place_id,nickname,content,date,situations,keywords,review_count,visit_count
1599062768,kis****,..,2025-04-10,저녁에 방문,,1791,1
1599062768,lioi20cnjv,맛있고 진짜 친절하시네요,2025-04-03,"저녁에 방문, 예약 없이 이용, 대기 시간 바로 입장, 나들이, 지인・동료",매장이 넓어요,1772,1
1599062768,놈일,1호점보다는 손님이 늦게 차는데도 금세 줄을 선다. 고기 맛이 좋다. 천변에 꽃 필 때 미어터질 듯.,2025-03-30,"저녁에 방문, 예약 없이 이용, 대기 시간 바로 입장, 데이트, 연인・배우자",음식이 맛있어요,785,1
1599062768,김지원지김먹방,가반항반 추천하고 서비스 조아용🫶,2025-03-28,"저녁에 방문, 예약 없이 이용, 대기 시간 바로 입장, 친목, 지인・동료",음식이 맛있어요,455,1
1599062768,SE0RI,고기가 너무너무 맛있었어요.. 가반항반먹고 목살시켜 먹었는데 요근래 먹은 고깃집중에 제일 좋았음. 잘먹었습니다.,2025-03-24,저녁에 방문,친절해요,230,1
1599062768,talymu,"이제 뭐 너무 자주와서 후기를 써야하나 싶기도 하지만오늘도 어김없이 다른 고깃집 가볼까? 하다가 결국 돌고 돌아 방목에 오니 후기까지 써야겠더라고요..🫶🏻진짜 가격대비 양, 맛, 질, 서비스 다 좋아서 다른 고깃집을 못 가겠어요...그리고 가끔 사장님(?)인지 오시면 음악 선곡이 진짜 넘 좋아서 대화않고 노래 흥얼거리면서 먹게됩니다.아, 우리 부부만 대화 않고 먹나 싶어 두리번거려보면 다들 대화없이 먹느라 바쁠정도로 진짜 맛있어요😭",2025-03-23,"저녁에 방문, 예약 없이 이용, 대기 시간 바로 입장, 데이트, 연인・배우자",음식이 맛있어요,40,1
1599062768,전국어디든찾아가는,"📍 성북구 한성대입구역 고기 맛집 '방목' 리뷰✅ 방문 지점: 방목 2호점 (1호점 대기가 많아 이동)✅ 주문 메뉴: 삼겹반 + 목살반 (600g, 39,000원)🍖 맛 & 품질고기 신선하고 두툼, 숯불향이 잘 배어있어 담백한 맛삼겹살은 비계와 살코기 비율이 적당, 목살은 부드럽고 촉촉🏠 매장 분위기 & 서비스노포 느낌이지만 2호점은 1호점보다 넓고 쾌적, 대기 적음직원들 친절, 추가 요청도 빠르게 응대🔥 총평✅ 고기 맛 최고, 가성비 만족, 2호점은 공간 넓고 편안📌 한성대입구역에서 제대로 된 숯불구이를 즐기려면 강추!",2025-02-27,"저녁에 방문, 대기 시간 10분 이내, 데이트, 연인・배우자",고기 질이 좋아요,17,1
1599062768,GRoOVejANg2,,2025-02-24,저녁에 방문,음식이 맛있어요,2449,8
1599062768,최재원9050,"사장님 이 리뷰 보고 계시면 알바생 혼내주십셔1. 응대일단 들어가자마자 직원이 아무도 없었습니다;;뭐지? 하고 들어가니까 알바생 2명이서 주방 쪽에서 놀고있더군요. 뭐 여기까진 그러려니 했는데, 2명이서 왔다고 하니까 귀찮은 티 팍팍 내네요… 솔직히 여기서부터 기분 나빴습니다2. 고기 굽기보통 한 판을 다 굽지 않는 것으로 알고 있습니다.남1 여1 데이트하러 갔는데, 한 번에 그걸 다 구우면 맛도 없어지고 어떻게 다 먹습니까 ?게다가 둘레 쪽은 불도 없는데 굳이 굳이 거기 위에 고기를 올리더군요;; 그냥 또 구우러 오기 귀찮아서 한 번에 다 올리는 게 딱 보였습니다.-방목의 메리트는 2가지라고 생각합니다- 친절함- 고기의 질고기의 질과 맛은 여전하지만 친절함은 최악이었네요",2025-02-03,"밤에 방문, 예약 없이 이용, 대기 시간 바로 입장, 데이트, 연인・배우자",음식이 맛있어요,40,1
1599062768,비히아,고기 구워주셔서 넘 맛있었어요bb,2025-01-24,"저녁에 방문, 예약 없이 이용, 대기 시간 바로 입장, 친목, 일상, 친구",음식이 맛있어요,1318,1
1599062768,GRoOVejANg2,둘이 먹기에 양이 많은편 ㅎㄷㄷㄷ 항상 맛있게 먹고 옵니다,2025-01-17,저녁에 방문,음식이 맛있어요,2449,7
1599062768,내입맛기록,"동네가 아니다 보니 오랜만에 다시 찾았는데, 여전히 맛있었습니다. 첫 방문했던 지인들도 모두 만족해서 더 기분이 좋았습니다. 된찌는 국물양이 조금만 더 많으면 좋겠다는 생각이 들었어요. 직원분들 모두 친절히 잘 응대해줘서 기분 좋게 먹고 왔습니다.",2024-12-10,"저녁에 방문, 예약 없이 이용, 대기 시간 바로 입장, 친목, 지인・동료",직접 잘 구워줘요,534,1
1599062768,슈니공주님,직원분들 때문에 다신 가기 싫어졌습니다. 12시까지 영업이길래 10시 반쯤 방문했습니다. 들어갈때부터 11시 라스트 오더라 말씀하시는 여직원분이 장사하기 너무 싫어보이더군요. 둘이서 간단히 먹을거라 상관없어서 알겠다고 하고 앉았는데 고기 구워주시는 남직원분은 엄청 크게 자른 고기라 속이 하나도 안익었는데 다익었다고 주셨고.. 초반에 시킨 공기밥은 나오지도 않아서 한참 후에야 주문 들어간거 맞냐 달라고 하니까 여직원분이 탁 내려놓고 가고;; 라스트오더 전에 추가로 주문한 껍데기 내려놓을때도 여직원분이 상에 있던 그릇들을 확 밀치면서 내려놓으셔서 제 바지로 쏟아지는건 아닌가 무서웠습니다. 어이없게도 기분 많이 불쾌한 상태에서 먹은 껍데기가 삼겹살보다 맛있었네요 1호점은 모르겠지만 2호점은 다신 안갈 생각입니다.,2024-11-26,"밤에 방문, 예약 없이 이용, 대기 시간 바로 입장, 데이트, 연인・배우자",잡내가 적어요,32,1
1599062768,묭네임드,김치말이국수도 서비스로 주시고 고기 너무 맛있습니다.,2024-11-25,"저녁에 방문, 예약 없이 이용, 대기 시간 바로 입장",음식이 맛있어요,513,1
1599062768,LORD17,종종 가는곳이지만 갈때마다 맛있게 먹고 기분좋게 나오는곳입니다 고기도 신선하고 반찬들도 구성이 좋아서 고기랑 곁들여먹기 넘좋습니다! 서비스로 주시는 음식도 정말 맛있었습니다!,2024-11-25,"저녁에 방문, 예약 없이 이용, 대기 시간 바로 입장, 친목, 친구",음식이 맛있어요,60,1
1599062768,10****,애들과 먹으러갓는데 고기가 부드러워요김치찌게도 맛잇고 김치국수는 서비스~~,2024-11-24,"저녁에 방문, 예약 없이 이용, 대기 시간 바로 입장, 회식, 아이",음식이 맛있어요,1042,1
1599062768,hoonl,고기질이너무좋아요서비스도많이주시고 배터지게먹었습니다👍,2024-11-19,저녁에 방문,음식이 맛있어요,1055,4
1599062768,리조리요,고기가 매우 두꺼워요 ㅎㅎㅎㅎㅎ 맛있게 잘 먹었습니다,2024-11-13,"저녁에 방문, 예약 없이 이용, 대기 시간 바로 입장, 일상, 친구",고기 질이 좋아요,264,1
1599062768,아이란29,맛있어서 순삭하느라 고기사진이 없네요최근 먹은 돼지고기중에 진짜 맛나요,2024-11-08,"저녁에 방문, 예약 없이 이용, 대기 시간 바로 입장, 친목, 친구",음식이 맛있어요,874,1
1599062768,yun4885,진 짜 쬰 나 마 싯 어,2024-11-02,"저녁에 방문, 예약 없이 이용, 대기 시간 바로 입장, 데이트, 친구",친절해요,16,1
1599062768,shinnala19,"... 그냥 열어분 가지마세요 ㅡㅡ저만 가게ㅡㅡ광주사람이고 삼친자인데, 친구가 제가 좋아할 것 같다고 해서 과연 전라도 토박이인 절 만족시킬 수 있겠나 싶어서 따라갔어요.우선 .. 저는 야장+소주 조합을 사랑하는 사람인데 사장님 가게 위치 선정 미치셨어요 ?다음 서울 올땐 오픈런해서 꼭 바깥자리 앉아서 바람 맞으면서 항정한입에 소주 목구멍에 털겁니다..그리고 고기. 그냥 .. 말 안할게요 드셔보세요. 웨이팅 있는거 ? 참고 드세요 왜 웨이팅 있는지 육즙 터지자마자 뇌가 끄덕이는 맛.. +김치찌개 는 소주 러버들한테 진심 추천합니다. 뚝배기라서 식지도 않고 계속 따뜻해.. 아 몰라 흥분해서 말이 길었는데 저 왜 광주 살죠 ...",2024-11-02,"저녁에 방문, 예약 없이 이용, 대기 시간 바로 입장, 여행, 지인・동료",직접 잘 구워줘요,42,1
1599062768,oo****,가브리살 항정살 반반 먹었어요. 고기도 맛있어요. 김치말이국수 서비스로 주셨어요,2024-10-25,"저녁에 방문, 예약 없이 이용, 대기 시간 바로 입장, 나들이, 부모님",음식이 맛있어요,9,1
1599062768,jwnya,목살이 담백 육즙 가득하니 제일 맛있는 것 같아요,2024-10-22,저녁에 방문,음식이 맛있어요,655,1
1599062768,sindy0410,👏,2024-10-12,저녁에 방문,음식이 맛있어요,277,1
1599062768,체리4810,대학생들한테는 가성비굿 .. 다시는 안갈거같아요ㅠㅠ 고기가 맛이 없어요,2024-10-11,"저녁에 방문, 예약 후 이용, 대기 시간 10분 이내",매장이 넓어요,919,1
1599062768,달미LEE,찌개까지 서비스 주셔서 친구랑 맛있게 잘 먹고 갑니다😎,2024-10-07,"저녁에 방문, 예약 없이 이용, 대기 시간 바로 입장, 친목, 친구",음식이 맛있어요,184,1
1599062768,bri****,"16시 오픈이라 시간 맞춰 갔더니 앞에 서너팀 정도 미리 와서 기다리고 계셨어요 그래도 매장에 자리가 많아서 바로 입장했습니다. 항정살과 방목살 정말 맛있구요 사이드 소스로 주시는 갈치속젓이 정말 맛나요🤤 된장찌개와 김치말이국수도 먹었는데 정말 맛있습니다! 직원분들께서 직접 구워주셔서 편하고, 또 친절하셔서 야외에서 고기 구워먹는 로망을 실현할 수 있는 최적의 고깃집이여요 나만 알고싶은 맛집이지만 또 식당이 잘되길 바라는 마음에... 리뷰 남겨요,,",2024-10-01,"저녁에 방문, 예약 없이 이용, 대기 시간 바로 입장, 데이트, 연인・배우자",음식이 맛있어요,30,1
1599062768,py****,너무 맛있어요! 푸파하고갑니다,2024-09-14,"저녁에 방문, 예약 후 이용, 대기 시간 10분 이내, 친목, 친구",단체모임 하기 좋아요,132,1
1599062768,푸심이,오랜만에 왔는데 역시 최고예요 고기가 더 맛있어 진 거 같아요 ㅎ 좀 일찍가서 웨이팅없이 먹을 수 있었어용👍🏻👍🏻,2024-09-08,"저녁에 방문, 예약 없이 이용, 대기 시간 바로 입장, 데이트, 일상, 연인・배우자",친절해요,846,2
1599062768,파르스르,항정살 가브리살 먹었는데 대존맛이았어요!!서비스로 김치말이국수도 주셨는데 이것도 너므 맛있어요,2024-08-17,"저녁에 방문, 예약 없이 이용, 대기 시간 바로 입장, 친목, 친구",음식이 맛있어요,144,1
1599062768,책먼지밥,고기가 늠 맛있어요!숯불은 태우는데 초반에 잘 구워주시고 된찌 김찌 김치말이국수 모두 너무 맛있었어요. 반찬구성도 아주 찰떡이었는데 여러번 리필해도 귀찮은 기색 없이 바로바로 가져다 주셔서 심신이 감사했습니다☺️👍🏼,2024-07-01,저녁에 방문,친절해요,161,1
1599062768,난 날 믿어,"분위기좋고, 합리적인 가격에 맛있는 식사할 수 있어서 좋았습니다 ^^ 번창하세요!",2024-06-29,"저녁에 방문, 예약 없이 이용, 대기 시간 바로 입장, 친목, 지인・동료",음식이 맛있어요,705,1
1599062768,먹박사잉,1호점에는 삼겹이랑 목살팔아요 2호점은 가브리살 항정살~~~ 처음에만 구워주십니당 친절하시도 가격도 저렴해요,2024-06-20,"저녁에 방문, 예약 없이 이용, 대기 시간 10분 이내, 데이트, 연인・배우자",음식이 맛있어요,917,1
1599062768,밍 소,삼겹살 먹었는데 진짜 맛있게 구워주시고 맛있는 밑반찬도 듬뿍 주세요! 서비스로 김치찌개도 주셨는데 진짜 양 엄청나고 맛있어요!!! 김치말이국수도 시원해서 입가심으로 먹기 좋고 아주 맛있고 직원분들 너무 친절하십니당!🩷,2024-06-15,"저녁에 방문, 예약 없이 이용, 대기 시간 바로 입장, 데이트, 연인・배우자",음식이 맛있어요,120,2
1599062768,lem****,완전친절 완전한맛 완전한 분위기,2024-06-03,"저녁에 방문, 예약 없이 이용, 대기 시간 바로 입장, 데이트, 연인・배우자",음식이 맛있어요,57,1
1599062768,jooleum,방목 제가 진짜 여기저기 자랑하면서 다닌 맛집인데 오늘도 어김없이 방문했어요! 사장님 항상 센스 만점에 스윗하시고 음식까지 맛있으면...방목이 제가 누울 곳인가봐요...여길 갈까말까 고민하고 있는 분이 제 글을 보신다면 무조건 가서 가반항반부터 시키고 시작하세요...여긴 찐맛집에 제 먹보인생을 건 Top3 식당입니다..!,2024-05-31,"저녁에 방문, 예약 없이 이용, 대기 시간 바로 입장, 친목, 친구",음식이 맛있어요,19,3
1599062768,케이크탐험가,"직접 맛있게 구워주셔서 넘 좋아요~! 가브리살, 항정살 모두 진짜 맛있네요~! 서비스도 잘 챙겨주시고, 직원분들 다들 넘 친절하셔서 기분도 좋아지는 맛집입니다!",2024-05-31,"저녁에 방문, 예약 없이 이용, 대기 시간 바로 입장, 데이트, 연인・배우자",친절해요,149,1
1599062768,hyejeoni,주기적으로 꼭 먹으러 오는데 먹을 때마다 행복하게 배 채우고 갑니다 ㅠㅠ 직원분들도 항상 파이팅 넘치시고 친절하셔서 기분 좋게 먹을 수 있어요..🩷 최고!!,2024-05-30,"밤에 방문, 예약 없이 이용, 대기 시간 바로 입장, 데이트, 연인・배우자",친절해요,25,1
1599062768,HJ4378,맛있어요~~두번째 방문인데 고기쫄깃쫄깃하고 내가 원하는 삼겹살이였어요. 친절하게 고기도 구워주시고 좋았습니다.,2024-05-20,"저녁에 방문, 예약 없이 이용, 대기 시간 바로 입장, 데이트, 연인・배우자",친절해요,51,1
1599062768,바이블 리,삼겹살 먹었는데요~고기 두툼하니  고소하구 맛있어요. 고기 직접 구워주셔서 편하더라구가성비 좋은 집같아요,2024-05-17,"저녁에 방문, 예약 없이 이용, 대기 시간 바로 입장, 일상, 친구",음식이 맛있어요,1051,1
1599062768,hi1****,맛있어요,2024-05-11,"저녁에 방문, 예약 없이 이용, 대기 시간 바로 입장, 일상, 지인・동료",음식이 맛있어요,1080,1
1599062768,클러치1,비계가 너무 많아요..서비스 많이 주셨지만 이건 아니네요. 다신 안올것같습니다.,2024-05-10,"저녁에 방문, 예약 후 이용, 대기 시간 10분 이내, 데이트, 연인・배우자",직접 잘 구워줘요,48,1
1599062768,돌도리33,음식이 맛있어요,2024-05-07,"저녁에 방문, 예약 없이 이용, 대기 시간 바로 입장, 친목, 지인・동료",음식이 맛있어요,641,3
1599062768,까칠한겸둥이,2호점ㄲㅏ지있는 부분이면ㅇㅓ느정도 맛은 보장된 부분인ㄱㅏ? 😋😋ㄹㅏ고생각하는 부분임?ㅇㅣ맞듯이??]⫬𐌅ヲ맛도 쫄깃쫄깃 하ㅁㅕ 🐖 괜찮았었고_ 🐷 지금보니 ㄱㅏ성비도 좋은곳ㅇㅣ였네? 👏 단_(원곡=김돈규&2024버전=노을버전🎶 🎵 )[첫_판만] 구우ㅓ주는 부분이였ㅈㅣ만추ㄱㅏ로 시킬ㄸㅐ 부탁ㅎㅐ서 한번ㄷ ㅓ구워준 부분은..감사했ㅈㅣ만 👏 👏 맛보기?식ㅇㅣ야 무ㅓ야 딱 한판&한번만 구위줘ㅅㅓ  아쉬운ㄱ ㅓ는 어쩔수ㄱㅏ없ㅈㅣ만🤨😔고기 잘굽ㄹㅓ_분들ㅇㅔ게는 🥩🥓어느정도>맛고 ㅏ 가성비 두 마ㄹㅣ 🐰 🐇 잡을수 있을만_한_곳 이ㄹㅏ 판단이 되는부분🤔🤫,2024-05-05,"저녁에 방문, 예약 없이 이용, 대기 시간 바로 입장, 지인・동료",음식이 맛있어요,2511,1
1599062768,Baegoppa,맛있고 진짜 친절하세용,2024-04-21,저녁에 방문,음식이 맛있어요,757,1
1599062768,SJ5870,"방목 첫방문🔥🔥들어가자마자 인사를 단체로 해주셔서 웃기면서 기분 좋았어요ㅎㅎ 직원분들 다 친절하셨습니당👍삼겹살이 구워지기 전에 잔치국수 시켜서 먼저 먹었는데 진짜징짜 존맛탱이에요!!!! 잔치국수 맛집ㅠㅠ🤤🤤 잔치국수로 배채우고 고기 먹기 시작했는데 숯불향 잔뜩 입혀져서 맛도뤼,,, 다만 조오금 질긴 부분이 많았어요ㅜㅜ 낙지젓갈, 와사비줄기 등등 반찬도 알차고 김치찌개를 서비스로 주셨어요!!🤩 날씨 좋을 땐 웨이팅이 너무 길어서 못올 거 같지만 비오는 날을 노려서 또 와야겠어욯ㅎㅎ",2024-04-20,"저녁에 방문, 예약 없이 이용, 대기 시간 30분 이내, 데이트, 연인・배우자",음식이 맛있어요,65,1
1599062768,Ummnmn,너무 친절하시고 특히 오징어젓갈? 너무 맛있고 특이했어요. 생일이라고 축하해주셔서 너무 감사했어요!! 고기도 질좋고 너무 맛있어요,2024-04-08,"저녁에 방문, 예약 없이 이용, 대기 시간 1시간 이상, 데이트, 기념일, 연인・배우자",음식이 맛있어요,73,1
1599062768,떵똥이,벚꽃 피크 때 방문해서 웨이팅은 무진장 길었지만 맛있었어요 고기도 직접 구워주시고 맛도 맛있어용 직원분들도 친절하시고 김치찌개 서비스로 주셨는데 감사합니다💞,2024-04-06,"저녁에 방문, 예약 후 이용, 대기 시간 2시간 이상, 데이트, 친구",음식이 맛있어요,71,1
1599062768,unice64,,2024-04-06,"저녁에 방문, 대기 시간 1시간 이상, 데이트, 일상, 연인・배우자",음식이 맛있어요,1003,1
1599062768,lss170104,항상 갑니다,2024-03-29,"저녁에 방문, 예약 없이 이용, 대기 시간 바로 입장, 친목, 지인・동료",음식이 맛있어요,84,1
1599062768,빅토리캡틴,최애 고깃집...사장님 친절하시고 서비스 최고!!!,2024-03-23,"저녁에 방문, 예약 없이 이용, 대기 시간 바로 입장, 친목, 친구",음식이 맛있어요,682,1
1599062768,ttongtty,지금까지 가본 고깃집중에 제일 맛있어요...36000원에 목살과 삼겹살이 600g인데 이 착한 가격에 맛까지 최고👍👍 정말 리뷰를 안남길수가 없네요고기도 직접 구워주시는데 엄청 두툼하고 육즙이 미쳣어요 김치말이 국수도 서비스로 나오는데 입가심 용으로 아주 좋습니다 혜화 갈때 무조건 들려야하는 고깃집 1등!!,2024-03-14,"저녁에 방문, 예약 없이 이용, 대기 시간 30분 이내, 데이트, 연인・배우자",음식이 맛있어요,28,1
1599062768,안뇨미,"방목 1호점은 전에 방문해본 적 있는데 2호점은 처음이었어요! 역시나 맛있더군요.. 고기질도 너무 좋고, 가격도 저렴해서 진짜 최고에여..👍🏻 고기도 직접 구워주시고, 너무 잘 구워주셔서 배불리 맛있게 잘 먹을 수 있었습니다 !! 😊",2024-03-13,"저녁에 방문, 예약 없이 이용, 대기 시간 10분 이내, 데이트, 연인・배우자",친절해요,9,1
1599062768,늘먹던걸로주세요,"삼겹살 600g 36,000원가성비 짱에 맛까지 있는 방목..육즙 좔좔 두툼해서 넘 행복한 맛이에요김치말이국수랑 먹으면 기절이니까 꼭 추가하기",2024-03-06,저녁에 방문,직접 잘 구워줘요,1084,1
1599062768,인생뭐별거있니,너무 맛있어요! 재방문의사 있습니담,2024-03-02,"저녁에 방문, 예약 없이 이용, 대기 시간 바로 입장, 친목, 친구",음식이 맛있어요,1283,1
1599062768,아리7519,항상 아이포함 가족끼리 방문하구 가반항반 먹는데국수나 껍데기등.서비스를 많이 주셔서 부족함없이 배터지게 먹고 나오는 고기집이에요. 주위에 이만한 고기집이없어요. 고기도 너무 맛있음!!!직접 구워주는것도 엄청 맛있구 직원님들 열정에 차서일하는게 너무 보기좋고 같이 즐거워요 ㅎㅎ젓가락 쨍그랑소리에 두리번 거리며 젓가락.들고 배회하시다니 넘 귀여우셔요 ㅋㅋ저희는 곧 일어날거라 모른척했습니다.항상 가서 부족하게 먹고 온적이 없는곳입니다.,2024-02-17,"저녁에 방문, 예약 없이 이용, 대기 시간 바로 입장, 가족모임, 연인・배우자, 아이",고기 질이 좋아요,23,1
1599062768,고맙습니다1988,"성북동 동네 주민으로써 자랑스럽게 이야기할 수 있습니다!!여기는 고기 찐 맛집입니다 👍👍항정살, 가브리살, 삼겹살, 목살 모든 고기를 다 먹어봤는데구워서 입속에 넣을때마다 감동이었습니다 💕그리고 서비스로 김치말이국수에 후식으로 껍데기까지 주시고이러면 또 방문할 수 밖에 없쟈냐 🤗한성대 넘버원 고기집 방목,다음에 무조건 또 올게욤 👋",2024-02-07,"저녁에 방문, 예약 없이 이용, 대기 시간 바로 입장, 데이트, 연인・배우자",음식이 맛있어요,44,1
1599062768,hello7519,,2024-01-26,"저녁에 방문, 예약 없이 이용, 대기 시간 바로 입장, 데이트, 친목, 연인・배우자, 친구, 지인・동료",음식이 맛있어요,1747,1
1599062768,Yuni53,"방목은 저의 최애 고깃집이에요 ㅠㅠ 잡내 안나고 진심 너무 맛있음, 항정반가브리반 최고입니다 👍🏻",2024-01-26,"저녁에 방문, 예약 없이 이용, 대기 시간 바로 입장, 친목, 친구",음식이 맛있어요,123,1
1599062768,찬물샤워8,맛도대박가격도대박접객도대박서비스도대박,2024-01-20,"저녁에 방문, 예약 없이 이용, 대기 시간 바로 입장, 데이트, 연인・배우자",음식이 맛있어요,8,1
1599062768,887819,저는 1호점보다 2호점이 메뉴가 맘에들어요반반먹고 가브리살만 추가했는데 껍데기도 서비스주시고해서 맥주도 먹고 밥도먹고 국수됴먹고 찌개도먹고너무맛있었어요또가고싶은데 5시20분에 들어갈땐 바로들어갔는데 6시반에 나오니까 사람 꽉차더라고요 꼭 일찍가세요,2024-01-16,"저녁에 방문, 예약 없이 이용, 대기 시간 바로 입장, 친목, 친구",음식이 맛있어요,39,1
1599062768,켠43,가격괜찮아요!!!!첫판 구워주는것도 너무 좋음,2024-01-15,"밤에 방문, 예약 없이 이용, 대기 시간 바로 입장, 친목, 친구",음식이 맛있어요,470,1
1599062768,silver9027,"김치마리 국수도 진짜 맛있고 고기도 처음에 한 번은 구워 근데 너무 맛있습니다. 그런데 깍둑썬 모양을 먹을려면 항정살, 가브리살 믹스?를 먹어야 한다고 하네요. 다음에 또 올거에요.",2024-01-01,"저녁에 방문, 예약 없이 이용, 대기 시간 바로 입장, 데이트, 연인・배우자",음식이 맛있어요,125,1
1599062768,cjeown,완전 맛있고 서비스도 너무 많이 주셔서 더욱 맛있게 잘 먹었습니다 최고예요!! 그리고 직원분들 다 친절하세요,2023-12-26,"저녁에 방문, 예약 없이 이용, 대기 시간 바로 입장, 친목, 친구",음식이 맛있어요,639,1
1599062768,hoonl,고기가정말 ~~~맛있어요 👍👍,2023-11-02,저녁에 방문,음식이 맛있어요,1055,3
1599062768,hoonl,삼겹살 입에서살살녹음 찐으로맛있음,2023-10-13,저녁에 방문,고기 질이 좋아요,1055,2
1599062768,HappySooo,존맛도리.....걍 서비스도 미친곳....물론 엄청먹었다..3인에 1.2kg먹은 맛집,2023-10-06,저녁에 방문,고기 질이 좋아요,153,1
1599062768,hoonl,가성비도좋구 서비스도좋아요 사람이많은 이유를알겠네요 ㅎㅎ,2023-09-19,저녁에 방문,음식이 맛있어요,1055,1
1599062768,dod****,굿,2023-09-17,저녁에 방문,,1244,1
1599062768,Minxx,삼선동 공방 원데이클래스 받고 우연히 찾아간 고깃집에서 인생고기집 찾았네요 직원분이 고기굽기 장인수준입니다 삼선동 가면 여기만갈듯 또 생각나네요,2023-09-09,저녁에 방문,친절해요,30,1
1599062768,라랄랴,"첫손님이라 서비스, 또 서비스, 또 서비스,,먹고나서 주변에 추천 엄청 했네요맛도 있고 저렴하고 친절까지..고기랑 잔치국수 주문했는데 사진엔 없지만 큰 콜라까지 주셔서너무 푸짐해 한라산을 세 병 먹었어요또 갈게요 번창하세요",2023-09-04,저녁에 방문,친절해요,501,1
1599062768,둡둡토끼,반반에 김치말이국수랑 밥 하나 시켜서 먹었어요! 김찌 서비스로 주셧는데 이것두 넘 맛나더라구오ㅠㅠ최고,2023-08-29,저녁에 방문,음식이 맛있어요,1078,2
1599062768,미니녕,반반먹었는데 둘이 먹기에 충분했어요숯도 좋고 고기도 좋아서 정말 맛있었어요서비스로 주신 김치말이국수가 기가막혀요김치찌개도 많이 맵지않고 고기먹고 나서 먹기에 좋아요또 가고싶어요,2023-08-23,저녁에 방문,음식이 맛있어요,2925,1
1599062768,힌둥검둥맘,"성북천 고기집들 많은데  요동네 친구가 여기가 맛있다그래서  방문.1호점 2호점 모두 넘 친절하세요!  특히 삼겹살이  맛있구 , 직접 맛있게 구워주세요 ~~~  맛있고 친절한 곳이라 늘 손님도 많지요~~  한번 가묜 재방문 꼭 하게되는 곳입니다",2023-08-21,저녁에 방문,음식이 맛있어요,167,1
