place_id,nickname,content,date,situations,keywords,review_count,visit_count
12987621,de****,굿,2024-08-05,점심에 방문,혼밥하기 좋아요,498,3
12987621,omy4rang,굿,2024-08-02,점심에 방문,음식이 맛있어요,2560,2
12987621,화양현화,죽 땡겨서 왔는데 사람 많아서 놀랐어요.. 완전 핫플~!존맛탱입니다~~~~,2024-07-31,"점심에 방문, 예약 없이 이용, 대기 시간 바로 입장, 일상, 혼자",음식이 맛있어요,228,1
12987621,가보고먹고마시고,약 먹으려면 아침을 거르지말아야해서 요즘 계속 죽 먹는 중인데 오늘은 연신내역점서 능이삼계죽 포장했어요. 미리 주문하니 금방 받을수 있어서 편리하고 사장님이 아주 친절하셨습니다~^^,2024-07-29,"저녁에 방문, 포장·배달 이용, 대기 시간 바로 입장, 일상, 연인・배우자",친절해요,1400,1
12987621,I YEON,굿,2024-07-29,아침에 방문,,950,1
12987621,배은정27,굿,2024-07-23,점심에 방문,혼밥하기 좋아요,2045,5
12987621,de****,굿,2024-07-23,점심에 방문,혼밥하기 좋아요,498,2
12987621,시월애1004,사장님이 친절하셔서 이 지점만 가요^^,2024-07-22,"점심에 방문, 예약 없이 이용, 대기 시간 바로 입장, 일상, 지인・동료",음식이 맛있어요,634,2
12987621,시월애1004,단골인증,2024-07-20,"점심에 방문, 예약 없이 이용, 대기 시간 바로 입장, 친목, 지인・동료",음식이 맛있어요,634,1
12987621,pigleet79,사장님이 친절하게 응대해주셔서 감사했어요~ 특송이 삼계죽도 아주 담백하고 맛있어요~,2024-07-11,"저녁에 방문, 예약 없이 이용, 대기 시간 바로 입장, 일상",음식이 맛있어요,331,1
12987621,Gardenscouple,건강한 맛이고 잘 먹게 됨 🥢,2024-07-11,"점심에 방문, 예약 없이 이용, 대기 시간 바로 입장, 가족모임, 친척・형제",재료가 신선해요,127,1
12987621,jin****,좋아요,2024-07-11,"아침에 방문, 예약 없이 이용, 대기 시간 바로 입장, 일상, 아이",음식이 맛있어요,1179,4
12987621,fre****,맛있게 잘 먹었습니다 ~,2024-07-06,"점심에 방문, 포장·배달 이용, 대기 시간 바로 입장, 일상, 아이",음식이 맛있어요,87,1
12987621,양배추dear맘,좋아요,2024-07-06,점심에 방문,음식이 맛있어요,4925,2
12987621,꿈꾸는자9151,어머니 수술후 죽을 자주 드시는데 전복죽도 맛있고 이번에 매생이굴죽 맛있네요,2024-06-17,"저녁에 방문, 포장·배달 이용, 대기 시간 바로 입장, 일상, 혼자",음식이 맛있어요,21,1
12987621,언제나 한량,죽 말고 비빔밥도 종류가 다양해서 좋네요. 부모님도 맛있게 드셨어요,2024-06-07,"점심에 방문, 예약 없이 이용, 대기 시간 바로 입장, 일상, 부모님",음식이 맛있어요,245,1
12987621,nap****,친절해요,2024-06-05,"저녁에 방문, 예약 없이 이용, 대기 시간 바로 입장, 일상, 부모님",친절해요,1242,16
12987621,동네이장44,맛있어요,2024-06-04,"점심에 방문, 예약 없이 이용, 대기 시간 바로 입장, 친목, 지인・동료",음식이 맛있어요,832,4
12987621,lit****,포장이라 주문해놓고 볼일 잠깐보고 가서 바로 찾았어요. 사장님께서 친절하십니다.,2024-06-01,"점심에 방문, 예약 없이 이용, 대기 시간 바로 입장, 친목, 지인・동료",음식이 맛있어요,999,3
12987621,NICOLE21,다른 지점보다 죽이 맛있어요,2024-05-29,"아침에 방문, 포장·배달 이용, 대기 시간 바로 입장, 가족모임, 부모님",건강한 맛이에요,593,2
12987621,갱찡,,2024-05-25,"점심에 방문, 예약 없이 이용, 대기 시간 바로 입장, 부모님",음식이 맛있어요,707,1
12987621,jun****,맛있어요,2024-05-23,"점심에 방문, 포장·배달 이용, 대기 시간 바로 입장, 일상, 혼자",음식이 맛있어요,2511,3
12987621,nap****,친절해요,2024-05-21,"저녁에 방문, 예약 없이 이용, 대기 시간 바로 입장, 친목, 부모님",음식이 맛있어요,1242,15
12987621,kjt415,맛있게잘먹고왔습니다,2024-05-21,"점심에 방문, 예약 없이 이용, 대기 시간 바로 입장",음식이 맛있어요,640,3
12987621,유장꾸,제가 간 본죽중에 가장 친절한 사장님이 계시는 곳강된장차돌비빔밥과 야채죽 먹었는데 맛도 훌륭합니다 !,2024-05-11,"점심에 방문, 예약 없이 이용, 대기 시간 바로 입장, 데이트, 일상, 연인・배우자",음식이 맛있어요,411,1
12987621,nap****,친절해요,2024-05-02,"저녁에 방문, 예약 없이 이용, 대기 시간 10분 이내, 일상, 혼자",친절해요,1242,14
12987621,영21,😄,2024-04-30,"점심에 방문, 예약 없이 이용, 대기 시간 바로 입장",매장이 청결해요,435,2
12987621,hao 3ariana o,굿,2024-04-25,점심에 방문,,1053,23
12987621,sua****,좋아요,2024-04-25,점심에 방문,,894,29
12987621,de****,굿,2024-04-24,아침에 방문,건강한 맛이에요,498,1
12987621,배은정27,굿,2024-04-24,아침에 방문,혼밥하기 좋아요,2045,4
12987621,nap****,친절해요,2024-04-20,"저녁에 방문, 예약 없이 이용, 대기 시간 30분 이내, 일상, 혼자",친절해요,1242,13
12987621,NICOLE21,든든하게 감사히 잘 먹었습니다,2024-04-19,"저녁에 방문, 예약 없이 이용, 대기 시간 바로 입장, 일상, 연인・배우자",반찬이 잘 나와요,593,1
12987621,hyunme0213,곤드레밥 맛있어요..친절해요,2024-04-17,"저녁에 방문, 예약 없이 이용, 대기 시간 바로 입장, 일상, 연인・배우자",음식이 맛있어요,2110,1
12987621,love코로,10분 전에 미리 전화주문하면 오래 안기다리고 바로 받을수 있어요 ㅎㅎ사장님도 너무 친절하십니바 번창하세요!,2024-04-15,"저녁에 방문, 포장·배달 이용",음식이 맛있어요,219,1
12987621,제인3671,위내시경을 하고 갔는데 먹기에 부담이 없고 좋습니다.,2024-04-12,"점심에 방문, 예약 없이 이용, 대기 시간 바로 입장, 일상, 혼자",음식이 맛있어요,849,2
12987621,단비끄,"사진보고 참깨계란새우죽 했는데 맛은 있는데 계란이 두군데 다 하나도 없어요,,,, 그리고 참깨에는 새우도 거의 없고요;;ㅠㅠ 아쉽네요",2024-04-11,"점심에 방문, 예약 없이 이용, 대기 시간 바로 입장",특별한 메뉴가 있어요,35,1
12987621,콩이엄마6335,음식이  맛있어요,2024-04-11,"아침에 방문, 예약 없이 이용, 대기 시간 바로 입장, 데이트, 연인・배우자",음식이 맛있어요,773,1
12987621,하늘연달25,몸이 안좋아서 예약주문..맛은 좋아요 가격이 비싸서 조금 부담스러워요ㅜㅜ사장님 친절하시고 포장도 꼼꼼히 해주셔서 좋아요!,2024-04-09,"점심에 방문, 예약 후 이용, 대기 시간 바로 입장, 일상, 혼자",음식이 맛있어요,35,1
12987621,nap****,친절해요,2024-04-08,"저녁에 방문, 예약 없이 이용, 대기 시간 10분 이내, 일상, 혼자",친절해요,1242,12
12987621,none1234,미리 포장하니까 바로 가져가고 좋아요 사장님이 친절하십니다!,2024-04-08,"점심에 방문, 포장·배달 이용, 대기 시간 바로 입장, 일상, 혼자",친절해요,10,1
12987621,쭌1150,본죽 자주 이용했는데 나눠주신다는 곳은 처음이네요~장사 잘되시라고 한개 더사고 맛있게 먹겠습니다.,2024-04-05,"저녁에 방문, 예약 없이 이용, 대기 시간 바로 입장, 일상, 혼자",친절해요,22,1
12987621,nap****,친절해요,2024-04-05,"저녁에 방문, 예약 없이 이용, 대기 시간 30분 이내, 일상, 혼자",친절해요,1242,11
12987621,유포리아74,친절하고 맛도 좋고 죽집중에서는 최고인듯요,2024-03-30,점심에 방문,음식이 맛있어요,207,6
12987621,아보카도인형,굿,2024-03-28,점심에 방문,음식이 맛있어요,750,1
12987621,nap****,친절해요,2024-03-27,"저녁에 방문, 예약 없이 이용, 대기 시간 30분 이내, 일상, 혼자",친절해요,1242,10
12987621,nap****,친절해요,2024-03-22,"저녁에 방문, 예약 없이 이용, 대기 시간 10분 이내, 일상, 부모님",친절해요,1242,9
12987621,별명3139,친절합니다.,2024-03-20,"저녁에 방문, 예약 없이 이용, 대기 시간 바로 입장, 일상, 혼자",음식이 맛있어요,160,1
12987621,kjt415,맛있게잘먹었습니다 집밥처럼든든하고좋네요,2024-03-19,"점심에 방문, 예약 없이 이용, 대기 시간 바로 입장",음식이 맛있어요,640,2
12987621,nap****,친절해요,2024-03-15,"저녁에 방문, 예약 없이 이용, 대기 시간 10분 이내, 일상, 혼자",친절해요,1242,8
12987621,boogiwoogii,달~달하니 단팥죽은 딱 제 취향. 🫠반찬은 뭐~ 본죽 기본 반찬이 그렇지요 뭐😓,2024-03-14,"저녁에 방문, 예약 없이 이용, 대기 시간 바로 입장, 가족모임, 부모님",음식이 맛있어요,1133,1
12987621,nap****,친절해요,2024-03-11,"저녁에 방문, 예약 없이 이용, 대기 시간 바로 입장, 일상, 혼자",친절해요,1242,7
12987621,그리미88why,단팥죽이랑 단호박죽 좋아해서 자주 먹는데새알심이 넘많네요.많아도 넘많음.새알심 건져내면 먹을게 없음팥죽이 더들어있음 좋겠어요,2024-03-07,"점심에 방문, 예약 없이 이용, 대기 시간 바로 입장, 일상, 혼자",,205,1
1635943491,수니8987,지나가다보면 늦게까지 문이 열려있고 고소한 참기름 냄새가 나서 궁금했었는데 오늘 드디어 방문!덮밥을 먹을 생각으로 들어갔는데생각보다 메뉴가 다양.기본육수가 있는데 이것부터 맛있음ㅋ육회쫄면 먹었는데 대박맛있음 ㅋ2인분이라 써있지만 맛있어서 혼자먹어도 될듯.다음에는 육회물회먹으러 가야지!,2025-03-08,"저녁에 방문, 예약 없이 이용, 대기 시간 바로 입장, 친목, 친구",음식이 맛있어요,111,1
1635943491,yes****,,2025-01-21,"점심에 방문, 예약 없이 이용, 대기 시간 바로 입장, 나들이, 친구",음식이 맛있어요,1259,2
1635943491,boo****,굿,2025-01-14,"점심에 방문, 예약 없이 이용, 대기 시간 바로 입장, 일상, 혼자",특별한 메뉴가 있어요,1315,1
1635943491,sontob33,너무 맛있어요 잘 먹었습니다~^^,2024-12-21,"점심에 방문, 포장·배달 이용, 대기 시간 바로 입장, 일상, 아이, 부모님",음식이 맛있어요,1191,1
1635943491,kir****,굿,2024-11-15,저녁에 방문,음식이 맛있어요,109,1
1635943491,레일라일라,친절한 느낌이 없어요.,2024-11-14,"점심에 방문, 포장·배달 이용, 대기 시간 바로 입장, 일상, 혼자",,86,4
1635943491,yoo****,맛있어요!,2024-10-29,"점심에 방문, 예약 없이 이용, 대기 시간 바로 입장, 일상, 연인・배우자",음식이 맛있어요,26,1
1635943491,정츄57,너무 맛있어요! 다음에 또오겠습니다!!! 굿굿!!,2024-10-28,"점심에 방문, 예약 없이 이용, 대기 시간 바로 입장, 데이트, 연인・배우자",음식이 맛있어요,5,1
1635943491,kha****,맛있고 사장님이 너무 착해요 위생상태 좋아요,2024-10-28,"점심에 방문, 예약 없이 이용, 대기 시간 바로 입장, 데이트, 연인・배우자",음식이 맛있어요,3,1
1635943491,오징어땅콩조아,너무 맛있고 가격도 착해서 만족했습니다 다음에도 올거 같네요 감사합니다,2024-10-28,"점심에 방문, 포장·배달 이용, 대기 시간 바로 입장, 일상, 친구",인테리어가 멋져요,5,1
1635943491,정현맘2921,특히 육회가 신선하고 맛있어요~ 육회초밥과 육회물회 맛있네요 매장도 깨끗하고 직원분들도 친절하세요 자주 오게 될 것 같네요^^,2024-10-27,"점심에 방문, 예약 없이 이용, 대기 시간 바로 입장, 회식, 아이",음식이 맛있어요,276,1
1635943491,squ****,아이와 먹을 수 있는 메뉴와 맛이 뛰어납니다,2024-10-27,"점심에 방문, 예약 없이 이용, 대기 시간 바로 입장, 친목, 아이",음식이 맛있어요,5,1
1635943491,sun****,집과 가까운곳에 생겨서 너무 맛있게 잘먹고 있어요 직원분들도 모두친절하셔서 올 때마다 기분좋습니다!,2024-10-27,"점심에 방문, 예약 없이 이용, 대기 시간 바로 입장, 일상, 아이",음식이 맛있어요,9,1
1635943491,시크즘마,시댁올때마다 먹는 육회쫄면~쫄면 마니아는 너무 좋아요육회쫄면음 맛나죵 새콤,2024-10-26,"점심에 방문, 예약 없이 이용, 대기 시간 바로 입장, 데이트, 연인・배우자",음식이 맛있어요,31,2
1635943491,cic****,사장님이 너무 친절하시고 음식이 너뮤 맛있어요!!!,2024-10-26,"점심에 방문, 포장·배달 이용, 대기 시간 바로 입장, 혼자",친절해요,6,1
1635943491,koo****,,2024-10-26,"점심에 방문, 예약 없이 이용, 대기 시간 바로 입장, 친목, 친구",음악이 좋아요,4,3
1635943491,도토리6383,육회도 언어도 신선하고 너무 맛있어요~~,2024-10-26,"점심에 방문, 예약 없이 이용, 대기 시간 바로 입장, 일상, 연인・배우자",음식이 맛있어요,9,1
1635943491,yej****,맛있어요!,2024-10-26,"점심에 방문, 예약 없이 이용, 대기 시간 바로 입장, 친목, 친구",인테리어가 멋져요,11,8
1635943491,다녀오겠습니다a,가상비도 좋고 맛있어요 !,2024-10-26,"점심에 방문, 예약 없이 이용, 대기 시간 바로 입장, 일상, 혼자",음식이 맛있어요,25,3
1635943491,HiEASY94,항상 늘 맛잇게 잘먹구 잇숩니당💜육회도 맛잇고~연어도 맛잇고~배달해서 먹어도 깔꿈해용👍🏻👍🏻👍🏻직접가서 먹어도 맛은 한결같네영🥰,2024-10-25,"저녁에 방문, 예약 없이 이용, 대기 시간 바로 입장",음식이 맛있어요,339,2
1635943491,라일락4799,두번째 방문이에요! 신선하고 맛있습니다 :),2024-10-25,"저녁에 방문, 예약 없이 이용, 대기 시간 바로 입장, 혼자",아늑해요,24,1
1635943491,Insun22,날치알 주먹밥 ! 언제먹어도 꿀떡 꿀떡  맛나게 잘~ 넘어가요,2024-10-25,"점심에 방문, 예약 없이 이용, 대기 시간 10분 이내, 친목, 친구",음식이 맛있어요,1,1
1635943491,펭귄70,음식이 맛있어요,2024-10-25,"점심에 방문, 예약 없이 이용, 대기 시간 바로 입장, 친목, 지인・동료",음식이 맛있어요,2,1
1635943491,rla****,연어 육회덮밥이 맛있어요~,2024-10-25,점심에 방문,음식이 맛있어요,1,1
1635943491,sxha,푸짐하구 맛있습니다!!,2024-10-25,"점심에 방문, 예약 없이 이용, 대기 시간 바로 입장, 친목, 지인・동료",음식이 맛있어요,5,2
1635943491,우드락96,집근처에 있어서 자주 이용하는데메뉴들도 맛있고 매장도 깔끔해요 ♡,2024-10-24,"저녁에 방문, 예약 없이 이용, 대기 시간 바로 입장, 데이트, 연인・배우자",음식이 맛있어요,39,1
1635943491,061****,"최근에 갱긴 육회바른연어! 두번째 방문인데 올 때 마다 맛있어요. 특히, 육회쫄면은 꼭 드시길~~",2024-10-24,"점심에 방문, 예약 없이 이용, 대기 시간 바로 입장, 데이트, 연인・배우자",음식이 맛있어요,2,1
1635943491,치즈루345,점심 먹으러 또 방문 했습니다.육회 비빔밥도 맛있고 육회 물회도 먹었는데 맛있어요~,2024-10-24,"점심에 방문, 예약 없이 이용, 대기 시간 바로 입장, 일상, 지인・동료",음식이 맛있어요,46,2
1635943491,모드리치88,또 먹으러 왔어요~ 이 동네 육회 맛집 👍👍,2024-10-23,"저녁에 방문, 예약 없이 이용, 대기 시간 바로 입장, 회식, 혼자",음식이 맛있어요,8,3
1635943491,김밥9933,항상 너무 잘먹고있는 육회바른연어! 제 최애인 연어와 스테이크 유부초밥을 친한형에게 사줬더니 엄청 좋아하네요 제가 더 뿌듯하게 ㅎㅎ매번 느끼지만 연어도 싱싱하고 초밥의 생명인 밥도 너무 맛있어서 기분좋게 잘먹었습니다 갈때마다 친절하게 반겨주시는 사장님과 사모님! 감사합니다 다음에 또 갈게요!!,2024-10-23,"점심에 방문, 예약 없이 이용, 대기 시간 바로 입장, 일상, 혼자",음식이 맛있어요,12,1
1635943491,조아라2957,"집아래 생겨서 매번 궁금했는데, 드뎌 와봤어요. 깔끔하고 음식도 빨리 나오고. 혼자 먹기에도 양이 적당해요. 너무 밥이 많거나 하면 육회비빔밥은 싫더라고요. 적당한 양에 밥이랑 야채가 있어서 한끼로 좋네용. ❤️ 다음엔 남편이랑 와서 다른거 시켜먹어볼게요 ~번창하세요 !! 😊😊",2024-10-23,"점심에 방문, 예약 없이 이용, 대기 시간 바로 입장, 일상, 혼자",음식이 맛있어요,4,1
1635943491,엘르니,불광동 맛집 육회비빔밥 맛있어요,2024-10-23,"점심에 방문, 예약 없이 이용, 대기 시간 바로 입장, 친목, 지인・동료",친절해요,40,1
1635943491,처음처럼216,너무 맛있어요,2024-10-22,"저녁에 방문, 예약 없이 이용, 대기 시간 바로 입장, 지인・동료",음식이 맛있어요,2,2
1635943491,dev****,항상 오는데 너무 맛있어요!다른 지점보다 여기가 더 맛있는거 같아요친절하시고 매장 분위기도 너무 좋아요!,2024-10-22,"점심에 방문, 예약 없이 이용, 대기 시간 바로 입장, 친목, 지인・동료",음식이 맛있어요,6,1
1635943491,pge****,,2024-10-22,"점심에 방문, 예약 없이 이용, 대기 시간 바로 입장, 친목, 친구",음식이 맛있어요,9,2
1635943491,니아초,"와이프랑 퇴근길에 만나 뭐먹을까 하다가초밥이 땡긴다하여 집가는길에 들렸습니다.가격도 저렴하고,맛도 너무 맛있고,사장님도 너무 친절하셨습니다.다음에도 또 방문할게요~~",2024-10-21,"저녁에 방문, 예약 없이 이용, 대기 시간 바로 입장, 데이트, 연인・배우자",음식이 맛있어요,4,1
1635943491,유재16,저번에 혼밥하러 왔는데 맛있어서 가족들이랑 왔습니다,2024-10-21,"저녁에 방문, 예약 없이 이용, 대기 시간 바로 입장, 친목, 연인・배우자, 부모님",음식이 맛있어요,27,2
1635943491,lsj****,,2024-10-21,"저녁에 방문, 예약 없이 이용, 대기 시간 바로 입장, 친목, 친구",음식이 맛있어요,10,9
1635943491,앙팡1146,처음 먹어보는데 맛나요!,2024-10-20,"저녁에 방문, 예약 없이 이용, 대기 시간 바로 입장, 친목, 친구",음식이 맛있어요,11,1
1635943491,건민맘31,친정 엄마와 함께한 저녁 식사. 구순을 앞둔 엄마 입맛에도 맞아서 이것저것 맛있게 먹었어요. 스테이크초밥은 너무 맛있어서 사진도 못찍고 먹었네요.  이제 외식하러  자주 올 것 같아요.^^,2024-10-20,"점심에 방문, 예약 없이 이용, 대기 시간 바로 입장, 일상, 부모님",음식이 맛있어요,4,1
1635943491,nhe****,맛있어서 두번째 방문입니디~동네에 맛있고 가성비 좋은 음식점이 생겨서 너 좋아요~~맛도 있고 가게도 청결하고 친절해서 자주 오게 될것 같네요~,2024-10-20,"점심에 방문, 예약 없이 이용, 대기 시간 바로 입장, 일상, 연인・배우자",음식이 맛있어요,10,1
1635943491,먹방요정 앤나,"✅ 메뉴 :🧸 모듬초밥 ₩14,900🧸 통오징어튀김 ₩10,900🧸 피치트리하이볼 ₩5,900✅ 서비스 :✔️ 키오스크✅ 총평 :지나가다가 우연히 발견했는데.. 기대이상으로너무맛있어서 깜짝놀랐어요..❤ 초밥도 다맛있고통어징어도 맛있고 하이볼도 맛있어요!!!사장님도 친절하시고 혼밥하기도 너무좋을 것같아추천해요❤",2024-10-20,점심에 방문,음식이 맛있어요,1266,1
1635943491,송예진32,맛있게 잘 먹구갑니다 :)이 동네에 맛집이 생겨서 좋아요~자주 올게요!,2024-10-20,"점심에 방문, 예약 없이 이용, 대기 시간 바로 입장, 친목, 친구",음식이 맛있어요,9,1
1635943491,동글동그,또 왔어요~ 거의 매주 오는듯한 느낌인데 직원분들도 매번 친절하시고 음식도 빨리 나와서 좋아요!,2024-10-20,"점심에 방문, 예약 없이 이용, 대기 시간 바로 입장, 일상, 혼자",메뉴 구성이 알차요,5,3
1635943491,kang80,가격대비 육회 양도 많고 넘 맛있습니다. 밖에서부터 고소한 향이너무좋아요,2024-10-19,"점심에 방문, 예약 없이 이용, 대기 시간 바로 입장, 데이트, 연인・배우자",음식이 맛있어요,30,1
1635943491,찾든지말든지,매장도 청결하고 육회 덮밥은 꼭 드세요!다음에 한번 더 올 의향이 있어요!!,2024-10-19,"점심에 방문, 예약 없이 이용, 대기 시간 바로 입장, 연인・배우자",음식이 맛있어요,55,1
1635943491,Hayan Oh,매장도깔끔하고 직원분도 친절하고 음식도 맛있어요. 다 신선해요!,2024-10-19,"점심에 방문, 예약 없이 이용, 대기 시간 바로 입장, 나들이, 친척・형제",음식이 맛있어요,4,1
1635943491,정은9564,자주와서 식사합나다,2024-10-19,"점심에 방문, 대기 시간 바로 입장, 친목, 연인・배우자",음식이 맛있어요,1,1
1635943491,alwjd481570,육회 좋아하는 부모님 모시고 왔는데 너무 맛있다며 좋아하시네요^^집근처에 있어 자주 방문할거 같아요^^,2024-10-18,"저녁에 방문, 예약 없이 이용, 대기 시간 바로 입장, 가족모임, 부모님",음식이 맛있어요,30,1
1635943491,정21,맛도 있고 매장도 깔끔해서 좋아요!! 메뉴도 다양하고 직원분들도 친절하셨어요🥰 포장으로 여러번 먹어봤는데 포장해서 먹어도 맛있어요🥹 친구랑 와도 괜찮을 것 같아룡😊💕,2024-10-18,"저녁에 방문, 예약 없이 이용, 대기 시간 바로 입장, 일상, 친구, 부모님",음식이 맛있어요,1,1
1635943491,솜맘16,맛있고 친절해요,2024-10-18,"점심에 방문, 예약 없이 이용, 대기 시간 바로 입장, 일상, 아이",음식이 맛있어요,22,2
1635943491,sma6205,음식이 맛있어요,2024-10-18,"점심에 방문, 예약 없이 이용, 대기 시간 바로 입장, 친목, 연인・배우자",음식이 맛있어요,365,7
1635943491,smd****,음식이  특별해요,2024-10-18,"점심에 방문, 예약 없이 이용, 대기 시간 바로 입장, 가족모임, 연인・배우자",음식이 맛있어요,2,2
1635943491,summer6066,배달만 시켜먹다가  처음와봤어요~ 맛있어요,2024-10-18,"점심에 방문, 예약 없이 이용, 대기 시간 바로 입장, 친목, 친구",친절해요,6,1
1635943491,허고은53,여기 정말 양도 많고 직원분들이 너무나 친절하세요..!!❤️육회도 넘나 맛있고 연어 때깔 굿!잘 먹고 갑니다🫶🏻,2024-10-18,"점심에 방문, 예약 없이 이용, 대기 시간 바로 입장, 친목, 친구",음식이 맛있어요,10,1
1635943491,Stella3850,사장님도 친절하고 음식이 맛있어요,2024-10-17,"점심에 방문, 예약 없이 이용, 대기 시간 바로 입장, 가족모임, 부모님",음식이 맛있어요,6,1
1635943491,yej****,음식이 너무 맛있어요,2024-10-17,"점심에 방문, 예약 없이 이용, 대기 시간 바로 입장, 친목, 친구",음식이 맛있어요,11,7
1635943491,따시기3,아이들이 정말좋아해요 너무맛있고 이런 가성비 맛집 좋아요~한달에 3번은 방문해요,2024-10-16,"저녁에 방문, 예약 없이 이용, 대기 시간 바로 입장, 일상, 가족모임, 아이",음식이 맛있어요,1,1
1635943491,ma****,맛있어요..,2024-10-16,"저녁에 방문, 예약 없이 이용, 대기 시간 바로 입장, 일상, 기타",음식이 맛있어요,4,1
1635943491,망두22,육회 연어 신선하고 맛있어요 ! 친절하셔서 더 좋아요,2024-10-15,"저녁에 방문, 예약 없이 이용, 대기 시간 바로 입장",음식이 맛있어요,6,2
1635943491,jdy6355,여자친구랑 데이트 하려고 두번째 방문 입니다! 맛도 맛있고 친절하셔서 다음에도 또 방문하겠습니다 ㅎㅎ 연어도 신선하고 육회도 정말 신선하고 간도 적당한 게 맛있습니다!,2024-10-15,"저녁에 방문, 예약 없이 이용, 대기 시간 바로 입장, 데이트, 연인・배우자",음식이 맛있어요,10,2
1635943491,yon****,,2024-10-15,"점심에 방문, 예약 없이 이용, 대기 시간 바로 입장, 데이트, 연인・배우자",음식이 맛있어요,1,1
1635943491,dms****,육회바른연어 좋아하는데 불광에 생겨서 너무좋아요 집에서 5분거리~ 식사메뉴도 좋고 한잔하기도 너무좋어요 !! 친절까지 맛집☺️😊,2024-10-15,"점심에 방문, 예약 없이 이용, 대기 시간 바로 입장, 데이트, 연인・배우자",음식이 맛있어요,34,1
1635943491,서동우577,육회먹은연어는 언제먹어도 맛있는거 같아요! 다음에 또 올게요 ㅎㅎ,2024-10-15,"점심에 방문, 예약 없이 이용, 대기 시간 바로 입장, 데이트, 부모님",인테리어가 멋져요,23,1
1635943491,ssu****,정말맛있었습니다 다음에도 또올게요,2024-10-15,"점심에 방문, 예약 없이 이용, 대기 시간 바로 입장, 친목, 연인・배우자",음식이 맛있어요,21,1
1635943491,유재16,점심에 혼밥으로 방문했는데 친절하고 메뉴도 빨리 나오고 다음에도 또 먹으러 와야겠습니다,2024-10-15,"점심에 방문, 예약 없이 이용, 대기 시간 바로 입장, 일상, 혼자",음식이 맛있어요,27,1
