place_id,nickname,content,date,situations,keywords,review_count,visit_count
19862040,aiskdieqmlaa,아기랑 처음간 고기집이었는데 숯불이 안전하고 직원분들은 친절하고 매장은 깔끔했어요아기도 엄청 잘먹는 야끼니꾸였어요 간이 세지 않아서 아기입맛에도 어른입맛에도 딱이었어요가족나들이의 마지막 저녁식사를 맛있는 고기로 행복하게 마무리 할수있게 해주셔서 감사합니다,2024-06-16,"저녁에 방문, 예약 없이 이용, 대기 시간 바로 입장, 나들이, 연인・배우자, 아이",음식이 맛있어요,20,1
19862040,체로키7,와인 가져가도 콜키지 받지 않아서 좋아요.친절하게 와인잔도 내어주시고고기먹다 더워하니까얼음물도 주시고넘 친절하게 반겨주셨어요.호주 친구랑 방문했는데대접받은것 같아서기분 좋았습니다.물론 돼지갈비도 맛있었어요.비빔냉면은 양이 너무 많아서남겨서 죄송했어요.서빙하시는 분들도 넘 친절해서또 가고 싶습니다.돈 받고 리뷰 안써요~제돈주고 사먹었어요^^,2024-06-09,"저녁에 방문, 예약 없이 이용, 대기 시간 바로 입장, 친목, 연인・배우자",음식이 맛있어요,972,5
19862040,gbk810,고기질이 좋고 매장도 깨끗하나 여직원이 좀 불친절 해서 아쉽네요,2024-06-07,"점심에 방문, 예약 없이 이용, 대기 시간 바로 입장, 일상, 친척・형제",음식이 맛있어요,1132,3
19862040,체로키7,기념일이라 가족과 예약후 방문했어요.새로 오픈한 호박식당은 처음 방문했는데자주 먹었던 소갈비가 메뉴에서 사라져서아쉬웠어요.호박세트랑돼지갈비 먹었는데 소고기보다 돼지갈비가 더 맛있었어요.아쉬운점은 달걀찜의 간이 넘 싱거워서 맛 없었어요.달걀찜 맛집이였는데 ㅜㅜ,2024-05-31,"점심에 방문, 예약 후 이용, 대기 시간 바로 입장, 기념일, 연인・배우자",음식이 맛있어요,972,4
19862040,롱롱삐,"산토리맥주2+1삼겹살+야키니쿠+짜파게티+옛날도시락 조합으로 3명이서 배부르게 1차했습니다.고기에 잡내가 없고 깔끔한 곁들임 찬, 개인적으로는 겉절이 느낌의 마늘향 강한 김치에 손이 많이 갔습니다😀역에서 가깝고, 인테리어 깨끗하고, 친절한 응대에 즐거운 저녁시간 보냈습니다🎼",2024-05-29,"저녁에 방문, 예약 없이 이용, 대기 시간 바로 입장, 친목, 친구, 지인・동료",음식이 맛있어요,552,1
19862040,너구리자갈치,호박식당은 고기도 맛있고 곁들이는 반찬들도 맛있어서 주기적으로 가는 고기 맛집입니다! 매장 리뉴얼 후 첫 방문해봤습니다. 매장은 깔끔해져서 좋았는데 정겨움이 사라진 느낌이랄까. 바쁘지 않았는데 매장에 직원들이 많았음에도 응대를 못받는 느낌이었습니다.돼지갈비는 여전히 맛있고 함께 나오는 계란찜 된장찌개에 배불리 잘 먹었습니다.,2024-05-25,"저녁에 방문, 예약 없이 이용, 대기 시간 바로 입장, 데이트, 연인・배우자",고기 질이 좋아요,122,1
19862040,Foreveryoung00,고기 양은 적었지만 맛있게 잘 먹었습니다다만 가게 분위기와는 사뭇 다른 음악이 나와서 놀랐어요 ㅎㅎ,2024-05-22,"점심에 방문, 예약 후 이용, 대기 시간 바로 입장, 친목, 친구",음식이 맛있어요,464,1
19862040,classic525,굿,2024-05-20,"점심에 방문, 예약 없이 이용, 대기 시간 바로 입장, 일상, 연인・배우자",음식이 맛있어요,658,2
19862040,oooooy,고기가 너무 질기고 잡내가 나요. 리모델링 후 초심 잃은듯.. 가격도 많이 올랐는데 아 진짜 돈 아깝네. 어쩐지 주말인데도 사람이 없드라..,2024-05-15,"저녁에 방문, 예약 없이 이용, 대기 시간 바로 입장, 데이트, 연인・배우자",,30,1
19862040,yujin33,고기가 정말 부드럽고 맛있어요강된장쌈밥도 정말 맛있었구요퇴근후에 예약없이가면 사람이많을 것 같아요,2024-05-14,"저녁에 방문, 예약 없이 이용, 대기 시간 바로 입장, 일상, 친구",음식이 맛있어요,626,1
19862040,김미화9182,음식이 맛있어요,2024-05-12,"저녁에 방문, 예약 없이 이용, 대기 시간 바로 입장, 일상, 친구",음식이 맛있어요,1972,2
19862040,달밤에춤,"맛난 고기, 쾌적한 실내에서 질좋은 숯불위에 구워먹는 소고기. 계란찜과 된장찌개 무한 리필에 찬들도 하나같이 다 맛있어요",2024-04-29,"저녁에 방문, 예약 후 이용, 대기 시간 바로 입장, 일상, 혼자",음식이 맛있어요,785,1
19862040,챙소블,와규전문점 호박식당 약수본점 다녀왔어요너무너무 맛있고 입에서 살살녹아요ㅠㅠ등심이랑 살치야끼니꾸랑 강된장쌈밥 먹었는데셋다 너무 맛있었고 조합 최고에요!!고기주문하면 된찌랑 계란찜 무한리필이라 짱 좋아요,2024-04-28,"저녁에 방문, 예약 없이 이용, 대기 시간 바로 입장, 친목, 친구",음식이 맛있어요,268,1
19862040,츄슐랭,잘먹었어요! 고기 음식 모두다 맛나요,2024-04-28,"점심에 방문, 예약 후 이용, 대기 시간 바로 입장, 데이트, 연인・배우자",매장이 넓어요,78,1
19862040,cam****,고기가 정말 맛있어요,2024-04-13,"저녁에 방문, 예약 없이 이용, 대기 시간 바로 입장, 친목, 친척・형제",음식이 맛있어요,385,1
19862040,허니클라우드,마싯습니다,2024-04-06,"점심에 방문, 예약 없이 이용, 대기 시간 바로 입장, 일상, 친구",음식이 맛있어요,258,1
19862040,감쟈감쟈2,감사합니당,2024-04-04,"밤에 방문, 예약 없이 이용, 대기 시간 바로 입장, 일상, 혼자",음식이 맛있어요,368,1
19862040,방글이8942,처음 왔어요.. 맛있게  잘 먹고 갑니다. 다음에 또 올께요!,2024-04-01,"점심에 방문, 예약 없이 이용, 대기 시간 바로 입장, 일상, 지인・동료",음식이 맛있어요,935,1
19862040,아침이슬1987,일 마치고 배고파 약수동 호박식당 생각나서 갔는데 예전자리 없어져서 당황함;; 포기하고 차 돌려서 가다가 위쪽으로 이전한 호박식당이 짠~~~보여서 다시 돌려 드뎌 입성^^2달전 이전하셨다고...메뉴가 좀 바뀌고 테블릿으로 주문하게 되어있었음.매장이 깔끔하고 늦은 저녁이라 (10시 조금넘어서 들어감)손님들이 부쩍되진 않아서 좋았다 고기질이 질기지않고 육즙이 나오면서 맛이좋았다~젓가락을 테이블에서 떨어트렸는데 소리를 들으셨는지 바로 새거로 셋팅해주셨다^^서비스로 계란찜 된장찌개 주시고 만족스럽게 잘 먹고 갑니당,2024-03-31,"밤에 방문, 예약 없이 이용, 대기 시간 바로 입장, 일상, 친구",음식이 맛있어요,205,1
19862040,들 사람,좋아요,2024-03-22,"점심에 방문, 예약 없이 이용, 대기 시간 바로 입장, 일상, 지인・동료",음식이 맛있어요,828,1
19862040,Yololo95,맛있어요,2024-03-17,"저녁에 방문, 예약 없이 이용, 대기 시간 바로 입장, 데이트",음식이 맛있어요,595,4
19862040,mjw727,고기 질이 좋아욛,2024-03-16,"점심에 방문, 예약 후 이용, 대기 시간 10분 이내, 친목, 친구",음식이 맛있어요,1554,1
19862040,둥이통이형이,호박식당은 2009년부터 영업한 제 기억 속 추억 가득한 맛집이에요. 회사가 장충동이었어서 여기 약수동쪽으로 회식하러 자주 왔는데 늘 사람이 북적이는 약수역 대표 맛집이라 자주는 못갔어요. 근데 이번에 리뉴얼 했다고 남편이 이야기 해 주어서 미리 예약했는데 글쎄 콜키지 프리라고.. 얏호 와인 한병 들고 와규 먹으러 다녀 왔어요. 와규 퀄도 좋은데금액은 돼지고기랑 얼마 차이 안나는 살치살 야끼니꾸 21000원 완전 혜자쥬. 그리고 제일 좋았던게계란찜이랑 된장찌개가 서비스에요. 모자르면 더 주신다는데 왜 이렇게 잘 해주시는건가용..?? ㅎ 3번 더 시켜서 드신 손님도 있데요.우리 부부는 1번씩 더 주문했는뎁처음보다 더 많이 주셨어요2층에 예쁜 매니저님 손 빠르고 친절하세요,2024-03-09,"저녁에 방문, 예약 후 이용, 대기 시간 바로 입장, 데이트, 연인・배우자",음식이 맛있어요,1085,1
19862040,좋은애비스마트월드,"⭐️⭐️⭐️⭐️⭐️가성비 좋은 고기집이어요. 매장 참 깔끔하고 쾌적해요. 음식들 신선하고 맛났어요.직원분들 진심다해 친절해요.한끼 맛나게 기분좋게 먹었어요 *^^*__________________[참고] 본인의 리뷰기준 : 1. 맛, 친절, 청결 세가지 중 한 가지라도 부족하다 느끼면 그냥 리뷰 안 올림. (왜냐하면 그날 그순간만 그랬을 수도 있으니까)2. 맛집 찾아 다니는걸 좋아하는 아재로서 조미료 범벅이거나 건강만 추구하는 맛은 그닥 안 좋아하는 입맛이 기준인 리뷰여요",2024-03-05,"저녁에 방문, 예약 없이 이용, 대기 시간 바로 입장, 친목, 지인・동료",음식이 맛있어요,997,1
19862040,taewoo426,맛있어요! 사이드 메뉴 다양한것도 좋아요,2024-03-03,"저녁에 방문, 예약 없이 이용, 대기 시간 바로 입장, 일상, 연인・배우자",음식이 맛있어요,595,1
19862040,cdi****,옆가게로 옮겼네요.삼겹살 맛있어용,2024-03-01,"저녁에 방문, 예약 없이 이용, 대기 시간 바로 입장, 회식",음식이 맛있어요,2043,5
19862040,Bob4798,분위기 아늑하고 직원분들 친절하셔서 좋았습니다무엇보다 돼지갈비 너무 맛있어서 깜짝 놀랬어요~~추천합니다!,2024-03-01,"저녁에 방문, 대기 시간 바로 입장, 가족모임, 아이",음식이 맛있어요,52,1
19862040,applemin1,추천 받은 맛집이라 가봤어요,2024-02-29,"저녁에 방문, 예약 없이 이용, 대기 시간 바로 입장, 데이트, 연인・배우자",음식이 맛있어요,371,1
19862040,우네띠네,고기가 두툼하니 아주 맛있고 서브 메뉴들도 아주 밋있었어요!!,2024-02-29,"저녁에 방문, 예약 없이 이용, 대기 시간 바로 입장, 가족모임, 연인・배우자",음식이 맛있어요,433,1
19862040,꼼지7945,회식으로 갔는데 맛있었어요!,2024-02-23,"저녁에 방문, 예약 후 이용, 대기 시간 30분 이내, 회식, 지인・동료",음식이 맛있어요,1228,2
19862040,쪼꼬미꼬미,삼결살은 두껍고 맛있게 잘 먹었는데 돼지갈비는 시키고 후회.. 불판이 너무 커서 여러종류의 사이드를 시키면 놔둘 공간이 없어서 굉장히 불편.. 직원분들이 특별히 불친절한건 아닌데 또 친절하지도 않음. 맥주 같은거 추가 주문하면 아무말없이 그것만 휙 주고 가버림. 고기 및 사이드 메뉴 등 음식의 맛은 갈비빼고 맛있어서 재방문은 하긴할건데 그때는 갈비는 안시킬듯,2024-02-22,"저녁에 방문, 예약 후 이용, 대기 시간 바로 입장, 친목, 친구",매장이 청결해요,34,1
19862040,스폰지밥24,굿,2024-02-19,점심에 방문,음식이 맛있어요,1941,1
19862040,용산드림,야끼니꾸 전문 호박식당 약수점 고기질이 아주 좋네요 :)살치 야끼니꾸 + 와규 등심 + 강된장 쌈밥 이렇게 주문했어요~ 참숯에 구운 고기 마블링이 아주 예술이네요. 육즙 촉촉하니 부드럽고 씹는 맛이 좋아요  :)강된장쌈밥도 맛있는 된장소스에 쌈밥 찍어먹으니 그냥 공기밥 먹는 것보다 더 맛있더라고요.고기 주문하면 서비스로 주시는 계란찜과 된장찌개도 야채도 많이 들어가있고 양이 아주 푸짐해요~반찬도 다양하게 나와서 가족식사/ 회식/ 데이트 모두 맛있게 먹을 수 있을듯해요 :)주말에 방문해서 맛있는 고기먹고 점심시간 지나서 갔더니 한적하게 식사할 수 있어서 좋았네요 ㅎ,2024-02-18,"점심에 방문, 예약 없이 이용, 대기 시간 바로 입장, 데이트, 일상, 연인・배우자",음식이 맛있어요,293,1
1874301580,희돌이네,항상 줄이 긴 순대국집입니다.거진 6개월만의 방문이네요^^먹어보고 알았습니다.그래! 이맛이지! 다른 순대국집과 다른 맛이 이멋이었어!! 러고 또 느끼고 갑니다.가끔와서 먹어봐야 알아요~ 이집이 왜 맛집인지요^^,2025-04-08,"점심에 방문, 예약 없이 이용, 대기 시간 바로 입장, 비즈니스, 기타",음식이 맛있어요,3152,8
1874301580,masa55,,2025-04-01,"저녁에 방문, 예약 없이 이용, 대기 시간 바로 입장",음식이 맛있어요,1932,3
1874301580,고구마구마구마,"약수맛집으로 유명한 약수순대국.. 4년 살면서 처음 가봤는데, 순대국 입문자에게도 부담없이 먹기 좋은 맛이예요 ! 일단 머릿고기가 엄청 많이 들어있는데 잡내없이 부드러워서 대만족.. 순대는 일반순대인데 큰 특징은 없지만 여긴 고기가 멱살 잡고 맛을 완성시키는 곳이라 노프라블람입니다..밥은 토렴해서 담아져나와서 다데기 풀고 바로 드시면 돼요! ☺️👍🏻",2025-03-29,"저녁에 방문, 예약 없이 이용, 대기 시간 바로 입장, 데이트, 연인・배우자",양이 많아요,44,1
1874301580,로라련쥬,가게이전하고 첫방문했어요. 마감이 다른곳보다빨라 직원분들눈치보면서먹느라불편했어요. 무김치가덜익은것빼면 맛은 큰변함없었습니다,2025-03-26,"저녁에 방문, 예약 없이 이용, 대기 시간 바로 입장, 일상, 부모님",,1092,1
1874301580,qkd****,21일 금요일 정확히 오후 5시8분쯤 웨이팅 앞에 두팀정도 기다린후 방문하였고약수에 순대국 맛집이라고 지인들 수소문을 통해 타지역에서 지인과 함께 한시간 걸려 찾아갔습니다순대국 두그릇과 소주 한병을 시켜보았고 음식은 빨리나오고 맛도 훌륭해서 좋았습니다 너무 맛있어서 소주 한병을 더 추가하고 다 마신후 음식이 남은 상태에서 가게를 방문한지 정확히 43분이 흘렀습니다저녁시간이고 맛집이어서 그런지 손님이 몰리기 시작하던 도중 사장님께서 음식을 다먹지도않았는데 손님들이 몰리는걸 보시고 저희에게 죄송하지만 손님이 몰려서 일어나주길 권하시더군요두명이서 43분만에 식사자리에서 일어나달라니솔직히 제 입장에선 어이가 없더군요 손님받아야되는건 알겠으나 처음이자 마지막 방문일거같네요더 못써서 여기까지 남깁니다.,2025-03-21,"저녁에 방문, 예약 없이 이용, 대기 시간 10분 이내, 데이트, 연인・배우자",음식이 맛있어요,6,1
1874301580,마루체리마루호두,"반찬은 깍두기고 순대국 주문하면 순대랑 머릿고기? 같이 나옵니다!! 국물 시원해서 너무 맛있었는데 양파나 고추가 없어서 다소 아쉬웠어요 ㅜㅠ 순대 초장이나 쌈장에 찍어 먹어도 맛있는데 그것도 없다고 하더라구용,, 그치만 진짜 국물은 시원해서 너무 맛있게 먹었습니다",2025-03-21,"점심에 방문, 예약 없이 이용, 대기 시간 바로 입장, 데이트, 연인・배우자",혼밥하기 좋아요,135,1
1874301580,Hailey6865,재방문 의사 없음여기는 맛집이 전혀 아니다. 아마도 원래는 맛있었겠지만 주방 직원분들이 기존 퀄리티 유지를 못하시는 듯프랜차이즈 순대국보다도 훨씸 맛이 없음..팔팔 끓이지도 않고 미지근한 상태로 서빙 받았던 것도 아쉬운 점.이런 수준의 음식으로 배 차는게 싫어서 그냥 남기고 깍두기로 배 채움 ㅠㅠ 깍두기는 새콤하고 맛있었다.테이블 지저분하고 1인 테이블이 많은 거 하나는 좋았으나 매우매우매우 비좁다.맛집이면 이정도 불편함 감수하는데 여기는..아님.,2025-03-18,"점심에 방문, 예약 없이 이용, 대기 시간 바로 입장, 일상, 혼자",혼밥하기 좋아요,46,1
1874301580,MRBIG,팔팔 끓지않고 나와서  좋았어요푸짐하고 고기가 너무커서 귀먹을때는 턱빠질뻔,2025-03-17,"점심에 방문, 예약 없이 이용, 대기 시간 바로 입장, 데이트, 연인・배우자",음식이 맛있어요,2050,1
1874301580,뱅기구름,"약수역 2번째 순대국집 방문입니다~평일  오후3시쯤 가니 웨이팅 없이 바로 먹을수 있었구요 혼밥석이 따로 있어서 이점은 좋았어요우선 순대국은 잡내가 없고,밥은 말아져서 토렴으로 나오고,다대기가 같이 올려져서 나옵니다 고기는 여러 부위로  상당히 많이 들어있었는데 어느 부위인지는 모르겠으나 질긴 부위가 있어서 먹는 도중에 한번 뱉었습니다.저처럼 식감에 예민하신 분들은 꺼리실수도 있겠네요 다 좋았는데 딱  한번 그 식감 때문에 더 가진 않을거 같아요ㅠ",2025-03-12,"점심에 방문, 예약 없이 이용, 대기 시간 바로 입장, 일상, 혼자",음식이 맛있어요,1074,1
1874301580,singi75,깔끔한 국물맛좋아요❤️순대와간 많이 들었어요,2025-03-06,"저녁에 방문, 예약 없이 이용, 대기 시간 바로 입장, 나들이, 친척・형제",음식이 맛있어요,282,1
1874301580,so****,좋아요,2025-03-05,점심에 방문,음식이 맛있어요,2741,2
1874301580,소끼리입니다,포장해서 끓여먹었는데 여전히 맛이 좋어요!양도 많고 시부모님도 좋아하셨어요,2025-03-01,"점심에 방문, 포장·배달 이용, 대기 시간 바로 입장, 나들이, 연인・배우자, 부모님",음식이 맛있어요,771,3
1874301580,맥플러리,맑은 국물에 푸짐한 건더기잡내 없고 깔끔하게 맛있네요!잘 먹었습니다👍,2025-03-01,"점심에 방문, 예약 없이 이용, 대기 시간 바로 입장, 일상, 혼자",고기 질이 좋아요,269,1
1874301580,이오마트,성시경 먹텐보고 방문했어요 점심시간이라 20분 내외로 대기가좀 있었구 보통이 양이 많았습니다 12000원 보통이 다른곳 특가격인데 양은 비슷한것 같아요! 주차는 편리했고 매장에서 할인권 30분 이후에는 본인부담이어서 3000원 냈어요 참고하세요 재방문의사 있어요,2025-02-27,"점심에 방문, 예약 없이 이용, 대기 시간 10분 이내, 친목, 나들이, 연인・배우자",음식이 맛있어요,40,1
1874301580,새우깡깡이,포장했는데 확장이전하셔서 훨씬 더 접근이 좋습니다 포장은 밥 없이 2인분부터인걸 몰랐어요 집에서 매장이랑 비슷한 맛 나게 끓이는 법 알려주심 양 많은편인데 세 번에 나눠서 먹었어요 굿굿,2025-02-26,"점심에 방문, 예약 없이 이용, 대기 시간 바로 입장, 나들이, 혼자",음식이 맛있어요,152,1
1874301580,공You,"굿먹을텐데 보고 왔는데 기대보다는 쪼금 약한 듯...서울에서 순대국밥 투어중인데 맛과 가성비로 봐서는 단가가 좀 있네요 고기가 좀 더 들어가서?서울 순대국 가격농민백암순대(선릉) 10,000현대순대국(영동시장) 10,000약수순대국 12,000맛은 농민백암순대가 👍 고기 부드러움은 현대순대국 👍",2025-02-24,"저녁에 방문, 예약 없이 이용, 대기 시간 바로 입장, 친목, 친구",음식이 맛있어요,2044,1
1874301580,pink popcorn,평범한 순대국 맛이에요 😝점심 때가면 사람 많아요..,2025-02-24,"점심에 방문, 예약 없이 이용, 대기 시간 10분 이내, 친목, 친구",혼밥하기 좋아요,1897,1
1874301580,난나답게,순대국 맛집 소문 듣고 가고싶어하다가 오늘에서야 먹어보네요평상시에 웨이팅도 많다고 들었는데 시간이 맞아 웨이팅 없이 잘먹고 왔어요내장고기도 많고 국물도 구수하니푸짐하게 잘 먹고 왔어요^^,2025-02-24,"점심에 방문, 예약 없이 이용, 대기 시간 바로 입장, 일상, 아이",음식이 맛있어요,129,1
1874301580,욱시티,먹다보면 언제다먹었지? 하게되는 마성의국밥순대는 의외로 평범하지만 머릿고기.내장은 부드럽고 풍성하다,2025-02-24,"점심에 방문, 예약 없이 이용, 대기 시간 바로 입장, 혼자",음식이 맛있어요,65,1
1874301580,꽉채워,이전하고 처음 왔네요. 포장이라 집에서 만킥😍😍😍,2025-02-19,"점심에 방문, 예약 없이 이용, 대기 시간 바로 입장, 데이트, 연인・배우자",음식이 맛있어요,1098,1
1874301580,소끼리입니다,토렴식이라 따뜻하고 맛있어요~~~ 안에 내용물도 많아요,2025-02-19,"점심에 방문, 예약 없이 이용, 대기 시간 바로 입장, 일상, 혼자",음식이 맛있어요,771,2
1874301580,chm****,굿,2025-02-18,"저녁에 방문, 예약 없이 이용, 대기 시간 바로 입장, 일상, 혼자",음식이 맛있어요,1450,3
1874301580,대장1210,맛은 괜찮은 편인데 다른 순댓국밥집 대비 가격대가 비싸다 ㅠ 가성비로는 아님 ㅠ,2025-01-31,점심에 방문,,411,1
1874301580,chm****,00,2025-01-27,"점심에 방문, 예약 없이 이용, 대기 시간 바로 입장, 나들이, 지인・동료",음식이 맛있어요,1450,2
1874301580,borntoready,약수 순대국 맛집!!!!! 재방문 100%,2025-01-27,"점심에 방문, 예약 없이 이용, 대기 시간 바로 입장, 일상, 혼자",음식이 맛있어요,809,1
1874301580,Lutisia,,2025-01-21,"점심에 방문, 예약 없이 이용, 대기 시간 30분 이내, 친목, 기타",음식이 맛있어요,150,1
1874301580,빨간안겨엉,옮기기 전부터 단골이었던 사람입니다. 맛이 완전히 변했습니다. 소중한 사람에게 추억의 맛을 공유하려고 데려갔다가 머쓱해질 정도로 최악의 맛이었습니다. 어쩌다 한 번 그랬겠거니 해서 두번 세번 방문해보고 그냥 맛이간 거구나 확신을 갖게 됐습니다. 예전 약수순대국을 기대하시는 분들 절대 가지마세요.,2025-01-18,"저녁에 방문, 예약 없이 이용, 대기 시간 바로 입장, 데이트, 연인・배우자",,24,1
1874301580,푸른사자93,기본에 충실한 순대국밥집,2025-01-18,"점심에 방문, 예약 없이 이용, 대기 시간 10분 이내, 데이트, 연인・배우자",음식이 맛있어요,252,3
1874301580,듀니뷰니,좋아요,2025-01-18,"점심에 방문, 예약 없이 이용, 대기 시간 바로 입장, 데이트, 연인・배우자",음식이 맛있어요,887,1
1874301580,깜찍똘아이,굿,2025-01-16,점심에 방문,음식이 맛있어요,1627,1
1874301580,해피해피9378,가격대비 특별하지 않습니다. 오히려 비싼편입니다. 밥을 국에 말아서 제공되어 황당했습니다. 물어보니 원래 그렇다고 하면서 아주 당당하게 말하고 안내판도 없고요. 당연히 다대기가 포함되어 맑은순대국이 아니고요. 음식제공된후 물어보니 미리 말하지 하였고 음식은 뜨겁지 않고 특별한 맛도 아니고요. 자리배정은 너무 좁았어요. 음식 서비스 맛 가격 모두 별로여서 다시는 안갈겁니다.,2025-01-16,"점심에 방문, 예약 없이 이용, 일상, 혼자",,117,1
1874301580,00ㅇ00,,2025-01-15,저녁에 방문,음식이 맛있어요,803,5
1874301580,꿀꿀ㅋ,잡냄새도 없고 맛있어요ㅎㅎ,2025-01-14,"저녁에 방문, 포장·배달 이용, 대기 시간 바로 입장, 데이트, 혼자",음식이 맛있어요,922,1
1874301580,찻집주인숲,가끔 와서 먹어요. 맛있어요. 잘 먹었습니다.,2025-01-13,"저녁에 방문, 예약 없이 이용, 대기 시간 바로 입장, 일상, 혼자",음식이 맛있어요,34,1
1874301580,안나0124,순대국 진짜맛있엇어요 웨이팅있었고 기대없이먹었는데 맛있었어요 다대기.국물더달라고하시면주세요 밥은말아져서나옵니다,2025-01-11,"저녁에 방문, 예약 없이 이용, 대기 시간 30분 이내, 데이트, 연인・배우자",음식이 맛있어요,119,1
1874301580,루디05,유명한 약수순대국.. 겨울이라 추운데도 줄 살짝..맛있죠 맛있는데.. 아주머니들이 친절하진 않아요..뭐 줄 서서 먹을 정도인가는 모르겠어요..재료소진으로 일찍 닫아서요..,2025-01-11,"저녁에 방문, 예약 없이 이용, 대기 시간 10분 이내, 친목, 친구, 지인・동료",음식이 맛있어요,830,1
1874301580,행복가득한일상을보내자,살고기랑 순대만 달라 했는데 이렇게 나왔어요. 고기 잡내 심하고... 순대는 그냥 마트에서도 파는 일반 순대인데... 왜 맛집이라고 하는지 모르겠어요... 고기는 씹다가 다 뱉었네요...ㅠㅠ 잡내가 이렇게 심한 고기는....,2025-01-11,"점심에 방문, 예약 없이 이용, 대기 시간 바로 입장, 일상, 혼자",,11,1
1874301580,des****,맛있는데 자리가 다닥다닥 넘 비좁아요,2025-01-09,저녁에 방문,음식이 맛있어요,1383,1
1874301580,캡틴짱콩,머릿고기와 순댓국 끝내줍니다. 다대기를 풀기 전에는 굉장히 맑고 개운하며 다대기 풀고 나서 들깨와 파 다진 고추와 함께 먹는 순댓국은 칼칼 하고 감칠맛이 좋아서. 정말 맛있습니다. 머릿고기도 다양한 부위를 적당히 잘 삶아서 맛이 참 좋습니다. 감사히 맛있게 잘 먹었습니다.,2025-01-09,"점심에 방문, 예약 없이 이용, 대기 시간 바로 입장, 일상, 지인・동료",음식이 맛있어요,1493,20
