place_id,nickname,content,date,situations,keywords,review_count,visit_count
1989474956,kakeed,"볶음면은 처음 먹어본건데 맛있어요!! 마라면이 안땡길 땐 볶음면 추천합니당,,👍",2023-12-18,점심에 방문,음식이 맛있어요,413,2
1989474956,봄날의햇사알짝,이 집 온면 최고에요가지덮밥도 맛있어요,2023-12-15,"점심에 방문, 예약 없이 이용, 대기 시간 바로 입장, 친목, 지인・동료",음식이 맛있어요,778,5
1989474956,철곡괭이,굿,2023-12-13,저녁에 방문,음식이 맛있어요,1931,5
1989474956,lune93,대기시간만 없으면 매주 가고 싶은곳,2023-11-30,"저녁에 방문, 예약 없이 이용, 대기 시간 30분 이내, 친목, 친구",음식이 맛있어요,191,3
1989474956,525233,진짜 다 너무 맛있었어요..양고기볶음밥 대존맛.. ㅠㅠㅠㅠㅠㅠㅠㅠ메뉴 다 먹어보고파요,2023-11-25,"점심에 방문, 예약 없이 이용, 대기 시간 10분 이내, 일상, 친구",음식이 맛있어요,471,1
1989474956,sun****,꿔바로우 궁금해서 먹으러 갔는데다른 매장과 확연히 달라요!!식초맛이 느껴지는 양념과국물 처럼 떠먹을수있을거같은 꿔바로우 양념이에요 ㅎㅎ 맛있었어요!! 고기 질도 좋아요👏🏻,2023-11-07,"점심에 방문, 예약 없이 이용, 대기 시간 바로 입장, 데이트, 연인・배우자",친절해요,107,1
1989474956,700****,좋아요,2023-11-03,점심에 방문,음식이 맛있어요,1078,2
1989474956,먹는건참잘해요,꿔바로우 소스 식초맛이 강해요!,2023-10-23,"점심에 방문, 예약 없이 이용, 대기 시간 바로 입장, 일상, 혼자",음식이 맛있어요,459,1
1989474956,로렌초이,말이 필요없네요. 꿔바로우 무슨 일이에요!! 이런 튀김 처음이에요. 식어도 딱딱해지지 않고 끝까지 부드러워요~ 지삼선도 난리난리 가지는 역시 튀김으로 먹어야 맛있어요!! 평일 점심때 가니 주변 대학교 학생들이 점심 먹으러 많이 오고 12시 넘으니 만석됐어요. 사장님 정말 친절하셔서 기분 좋게 식사했습니다. 조만간에 또 갈 것 같은 맛집이에요 :),2023-10-23,점심에 방문,음식이 맛있어요,184,1
1989474956,훈훈58,진짜 여기 꿔바로우 잘 해요 ..... 다른 중국음식들도 다 존맛탱구리 존맛도리에요ㅠㅠㅠ 외대 오시면 꼭 여기 방문해서 꿔바로우 맛집 업데이트 하세요!!!!!,2023-10-21,저녁에 방문,음식이 맛있어요,25,1
1989474956,블링블링블링10,꿔바로우맛집이라더니 온면도 맛있네요! 꿔바로우는 크기가 작아 잘라먹지 않아도 되어서 좋았고 매장이 좁아 오픈시간에 와도 웨이팅이 있습니다. 그래도 음식들이 다 맛있어서 좋았습니다. 온면도 면이 국물을 잘 머금어 맛있었습니다.,2023-10-21,점심에 방문,음식이 맛있어요,608,1
1989474956,쫄쫄이40,굿,2023-10-17,저녁에 방문,음식이 맛있어요,1113,1
1989474956,이주영334,,2023-10-07,점심에 방문,혼밥하기 좋아요,1472,1
1989474956,마니무짜요,촨커는 이문동의 심장 …,2023-10-06,저녁에 방문,음식이 맛있어요,197,1
1989474956,Ivresseason,경희대와 한국외대 사이에 있는 중식당. 꿔바로우가 맛있다고 해서 방문했다. 좌석은 6개 정도로 적은데 그래서 금방 웨이팅이 생긴다. 꿔바로우와 양꼬치(최소 2인분 주문)를 주문했다. 꿔바로우는 한 두입 크기 조각으로 나왔고 소스를 끼얹어주었다. 소스는 식초가 강하고 묽은 느낌에 적당한 단맛과 마늘맛이 있었다. 일반적인 달짝지근한 소스보다 덜 물려서 좋았고 바삭함도 오래 갔다. 양꼬치는 기본 양념이 강하게 되어 있다. 고기 하나하나 크기가 커서 좋았다. 다른 곳의 1.5배에서 2배는 되는 것 같다. 이 외에도 다양한 중식 메뉴가 있고 웨이팅이 힘들면 포장과 배달도 가능하다. 꿔바로우 맛으로 가장 인상깊은 곳이다.,2023-10-04,저녁에 방문,음식이 맛있어요,390,1
1989474956,보골보골드,온면이랑 토달볶 포장해서 먹었는데 시간이 지나도 따뜻하고 맛있었어요,2023-10-02,"저녁에 방문, 예약 없이 이용, 대기 시간 30분 이상, 데이트, 일상, 연인・배우자",음식이 맛있어요,32,1
1989474956,heechef,굿,2023-10-02,저녁에 방문,음식이 맛있어요,978,1
1989474956,마글론,맛있어요,2023-10-02,저녁에 방문,음식이 맛있어요,1812,1
1989474956,dks****,굿굿,2023-10-02,점심에 방문,특별한 메뉴가 있어요,1509,1
1989474956,맛있는건늘최고야,덮밥 류 퀄리티가 상당히 좋아요 소스 간이 딱 맞고 밥도 고슬고슬하더라고요 가지덮밥은 가지를 튀기듯이 지져서 내어 주시는 게 인상적이었어요 탑티어 급이라 불리는 꿔바로우는 생각보다 평범했지만 다시 방문해 다른 요리들을 먹어보고 싶을 만큼 음식 솜씨가 좋으신 것 같았어요,2023-10-02,점심에 방문,음식이 맛있어요,693,1
1989474956,ttnam,"저녁 늦게 갔더니 평일인데도 1시간반은 기다렸네요. 가게 테이블이 많지않아서 꽤 기다려야해요. 꿔바로우, 새우튀김, 토달덮밥 모두 맛있어요. 마감 시간 얼마 안남기고 들어가게되서 좀 급하게 먹느라 아쉬웠지만 또 가서 담번엔 양꼬치도 먹어보고싶어요!",2023-09-12,"저녁에 방문, 예약 없이 이용, 대기 시간 1시간 이상, 데이트, 일상, 연인・배우자",음식이 맛있어요,58,1
1989474956,중앵잉,"꿔바로우는 마라탕집 꿔바로우랑 완전 다른 느낌으로 맛있어요! 엄청난 꿔바로우 맛집이라기보다는 곁들임 메뉴들이 메인인 꿔바로우랑 조화롭게 잘 어울리는게 포인트인 것 같아요😋 그렇다고 꿔바로우가 그냥 그렇다는건 아니고, 이 메뉴 자체도 잡내 없이 깔끔하고 상큼하니 맛있어요! 혼밥하기 어려운게 흠이지만 2-3명이서 가면 배부르게 먹을 수 있을 것 같네요!",2023-09-12,점심에 방문,음식이 맛있어요,55,1
1989474956,kakeed,꿔바로우🍗 마라샹궈🥘 계란토마토덮밥 🍛촨커 국롤조합으로 먹었어요!,2023-09-08,저녁에 방문,음식이 맛있어요,413,1
37535322,넨깅,양도 많고 맛있어요! 완전 배불러..,2025-04-06,"점심에 방문, 예약 없이 이용, 대기 시간 바로 입장, 가족모임, 부모님",혼밥하기 좋아요,95,1
37535322,찬숙초이,마싯네욤,2025-04-04,저녁에 방문,음식이 맛있어요,336,1
37535322,라니223,굿,2025-04-02,"점심에 방문, 예약 없이 이용, 대기 시간 바로 입장, 일상, 아이",음식이 맛있어요,1552,4
37535322,매콤달콤냠냠,돈가스도 맛나고 사장님도 친절하십니다:),2025-03-31,점심에 방문,음식이 맛있어요,1661,1
37535322,바르뷔스,밥도 각 맞춘 모양으로 나오고 샐러드도 아주 동그랗게 나오고 오늘 맛도 뭔가 평소보다 조금 더 맛있는 느낌.. 마음 정하기까지 오래 걸렸지만 여기는 돈까스보다 함박이 조금 더 맛있다.,2025-03-22,점심에 방문,음식이 맛있어요,221,2
37535322,Samlee,여자친구가 자주 오는 단골집인데 이번에 처음 와봤어요 음식 맛이 훌륭한 건 기본이고 저희가 주문을 착각해서 금액이 오바돼서 결제되었는데도 흔쾌히 본인이 먹으면 된다고 재결제 해주셨어요 사장님도 너무 친절하시고 최곱니다 !!🫡👍👍 다음에 또 올게요 ~,2025-03-01,"저녁에 방문, 예약 없이 이용, 대기 시간 바로 입장, 데이트, 연인・배우자",매장이 청결해요,13,1
37535322,안녕센터,굿,2025-02-17,"점심에 방문, 대기 시간 바로 입장",,1460,12
37535322,바르뷔스,커다란 치즈 함박 좋아요,2025-02-16,점심에 방문,양이 많아요,221,1
37535322,우나와투나,완전 맛있어요,2025-02-15,"점심에 방문, 예약 없이 이용, 대기 시간 바로 입장, 일상, 혼자",음식이 맛있어요,505,5
37535322,하이바오아이바오,작은가게이고 안바쁜시간대에 갔는데도 불구하고 음식 가져가라는거는 썩 좋지않았어요 식판대에 쟁반 올려놓고 멀뚱멀뚱 (맛은 그냥 평범한 돈가스집),2025-02-09,"점심에 방문, 예약 없이 이용, 대기 시간 바로 입장, 나들이, 친구",,55,1
37535322,방학동피터,"돈까스를 좋아하는데 먹고싶다 싶으면 젤 먼저 생각나는 곳이에요~ 푸짐하고, 맛있어요~~ ^^ 강추요~~",2025-01-31,"점심에 방문, 예약 없이 이용, 대기 시간 바로 입장, 일상, 혼자",음식이 맛있어요,19,1
37535322,우나와투나,외대 돈까스 맛집..맛나요~~,2025-01-25,"점심에 방문, 예약 없이 이용, 대기 시간 바로 입장, 일상, 혼자",음식이 맛있어요,505,4
37535322,우나와투나,고구마치즈돈까스  맛있기는 한데너무 달아요.,2025-01-18,"점심에 방문, 예약 없이 이용, 대기 시간 바로 입장, 일상, 혼자",음식이 맛있어요,505,3
37535322,안녕센터,굿,2025-01-11,"점심에 방문, 예약 없이 이용, 대기 시간 바로 입장",가성비가 좋아요,1460,11
37535322,우나와투나,김치돈까스 맛있어요,2025-01-11,"밤에 방문, 예약 없이 이용, 대기 시간 바로 입장, 일상, 혼자",음식이 맛있어요,505,2
37535322,사랑소망엄마,양이 많아요,2025-01-07,"점심에 방문, 예약 없이 이용, 대기 시간 10분 이내, 일상, 혼자",음식이 맛있어요,2109,1
37535322,김경숙5058,좋아요,2025-01-01,저녁에 방문,음식이 맛있어요,727,2
37535322,쥬슐랭,오랜만에 39돈까스!가성비 좋아요!고구마치즈돈까스 추천입니다 :)다만 자리가 좁아 겨울에는 패딩 놓기에 번거로움이 좀 잇어요!,2024-12-29,"아침에 방문, 예약 없이 이용, 대기 시간 바로 입장, 데이트, 연인・배우자",음식이 맛있어요,768,1
37535322,bel****,굿,2024-12-25,"아침에 방문, 예약 없이 이용, 대기 시간 바로 입장, 친목, 친구",음식이 맛있어요,1468,1
37535322,하코냥,안심가스에 와사비 추가하니 더 맛있네요~~~크림카레돈가스는 매콤 1단계로 표시되어 있는데 그닥 맵지는 않으니 매운거 좋아하시는 분들은 참고하시면 좋을듯 합니다~~ 물론 맛있습니다ㅎㅎ,2024-12-15,"저녁에 방문, 예약 없이 이용, 대기 시간 바로 입장, 데이트, 연인・배우자",음식이 맛있어요,755,1
37535322,choiwwwlld,매번 포장해서 먹는곳입니다.역시 맛있습니다. 여기가 진리죠,2024-12-15,"점심에 방문, 예약 없이 이용, 대기 시간 바로 입장, 일상, 혼자",음식이 맛있어요,56,1
37535322,자산관리 CHO,오늘은 예쁜 딸과 저녁먹으러 39돈까스 매장에 들어왔어요.매콤돈까스와 치즈돈까스를 주문해서 먹었어요.모양도 예쁘게 나오네요.맛도 좋고 양도 푸짐하네요.젊은층의 학생들이 많이 와서 먹네요.#39돈가스 #외대맛집 #이문동맛집 #돈가스,2024-11-26,"저녁에 방문, 예약 없이 이용, 대기 시간 바로 입장, 일상, 연인・배우자",음식이 맛있어요,755,1
37535322,먕0,오 맛있아요‘,2024-11-23,"저녁에 방문, 예약 없이 이용",음식이 맛있어요,947,1
37535322,SOOlee,,2024-11-17,"아침에 방문, 예약 없이 이용, 대기 시간 바로 입장, 데이트, 연인・배우자",음식이 맛있어요,230,1
37535322,lee****,"등심가스  가성비, 맛 좋아서 자주 방문요.",2024-10-17,"점심에 방문, 포장·배달 이용, 대기 시간 바로 입장, 일상, 혼자",음식이 맛있어요,1055,4
37535322,응깅이,외대 돈까스 맛집입니다바삭하고 맛있어요,2024-10-14,"저녁에 방문, 예약 없이 이용, 대기 시간 바로 입장, 친목, 친구",음식이 맛있어요,211,1
37535322,맛있는거좋아하는쀼,"매운돈가스랑 안심까스 시켰는데 아침 일찍 열어서 늦은 아침 든든하게 먹기 딱 좋습니다. 일반적인 동네 돈가스집인데, 바로 구워주셔서 바삭함이 강점인 돈가스예요! 매운돈가스 소스 맛있어요 ㅋㅋ 혼밥 하기 엄청 좋고 가격대비 양이 많습니다. 지금 매운돈가스, 등심돈가스 1000원 할인중인듯요!",2024-10-05,"점심에 방문, 예약 없이 이용, 대기 시간 바로 입장, 일상, 연인・배우자",혼밥하기 좋아요,411,1
37535322,스테이림 서울에어비앤비,맛있는 돈가스 양이 많아요,2024-09-28,"저녁에 방문, 예약 없이 이용, 대기 시간 바로 입장, 여행, 혼자",음식이 맛있어요,70,1
37535322,평화자유사랑,고구마피자돈까스안심돈까스맛있어요❤️❤️❤️,2024-09-25,"아침에 방문, 예약 없이 이용, 대기 시간 바로 입장, 데이트, 연인・배우자",음식이 맛있어요,2456,2
37535322,김경숙5058,좋아요,2024-09-17,저녁에 방문,음식이 맛있어요,727,1
37535322,라니223,굿,2024-09-13,"점심에 방문, 예약 없이 이용, 대기 시간 바로 입장, 일상, 아이",음식이 맛있어요,1552,3
37535322,나나링1004,외대 근처 몇없는 돈가스 맛집이에요👍👍👍,2024-09-12,점심에 방문,음식이 맛있어요,290,1
37535322,라니223,굿,2024-09-01,"점심에 방문, 예약 없이 이용, 대기 시간 10분 이내, 일상, 아이",음식이 맛있어요,1552,2
37535322,월드베스트,조아요,2024-08-21,"아침에 방문, 예약 없이 이용, 대기 시간 바로 입장, 친목, 친구",음식이 맛있어요,683,6
37535322,ss****,굿,2024-08-20,"점심에 방문, 예약 없이 이용, 대기 시간 바로 입장, 일상, 혼자",음식이 맛있어요,562,2
37535322,0hp,맛은 좋은데 음식이 너무 늦게 나옴,2024-08-19,"점심에 방문, 예약 없이 이용, 대기 시간 바로 입장, 일상, 혼자",음식이 맛있어요,249,1
37535322,해피멍뭉이,후기 보고 갔는데 피자돈까스생각보다 그냥저냥세트추가로 냉모밀 시켰는데 면이 다 짧게 잘라져있는 거!!남은 찌꺼기 먹는 기분이라 별로였고맛도 소소 다시는 가고 싶지 않은 곳;;,2024-08-18,"점심에 방문, 예약 없이 이용, 대기 시간 바로 입장",,813,1
37535322,hello6425,가끔 돈까스만 사서 집에서 먹어욧,2024-08-15,"점심에 방문, 예약 없이 이용, 대기 시간 바로 입장",가성비가 좋아요,810,1
37535322,lee****,등심돈가스 세장ㆍ소스 저녁에 먹으려고 구입.아주 바삭해요.,2024-08-13,"점심에 방문, 포장·배달 이용, 대기 시간 바로 입장, 일상, 혼자",음식이 맛있어요,1055,3
37535322,쭈쭈49,평전 공연보러왔다가 들렀어요등심 먹었는데제가 좋아하는 서양식 돈까스네요다음에 올때도 들를게요,2024-08-11,"저녁에 방문, 예약 없이 이용, 대기 시간 바로 입장, 여행, 혼자",음식이 맛있어요,10,1
37535322,YG4379,맛있어요,2024-08-06,"저녁에 방문, 예약 없이 이용, 대기 시간 바로 입장, 친목, 친구",음식이 맛있어요,1096,1
37535322,꽃돼지4523,방문  인증을  합니다 ㅎ,2024-08-06,"저녁에 방문, 예약 없이 이용, 대기 시간 바로 입장, 일상, 지인・동료",양이 많아요,878,1
37535322,lIIllIllIl,치즈가 잔뜩 올라간 피자돈까스 맛있습니다,2024-08-02,"저녁에 방문, 예약 없이 이용, 대기 시간 바로 입장, 일상, 혼자",음식이 맛있어요,540,1
37535322,4조아4444,안심이랑 피자 냉모밀 냉우동시켰어요안심은 바삭하니 맛있네요고기 두께는 두껍지 않은 편이구부드러워요냉우동 좋네요,2024-07-25,"점심에 방문, 예약 없이 이용, 대기 시간 바로 입장, 데이트, 연인・배우자",양이 많아요,79,1
37535322,sim8881,굿,2024-07-12,밤에 방문,음식이 맛있어요,2205,1
37535322,ㅇㄱㅅㅇㅂㄷㄱ,맛없음 불친절하고 가성비도 별로라 다시는 안 갈듯,2024-07-09,"점심에 방문, 예약 없이 이용, 대기 시간 바로 입장, 데이트, 친구",,58,1
37535322,Ah80,,2024-07-03,"점심에 방문, 예약 없이 이용, 대기 시간 바로 입장, 혼자",음식이 맛있어요,2195,1
37535322,라니223,굿,2024-06-30,"저녁에 방문, 예약 없이 이용, 대기 시간 바로 입장, 일상, 아이",음식이 맛있어요,1552,1
37535322,우나와투나,,2024-06-30,"점심에 방문, 예약 없이 이용, 대기 시간 바로 입장, 일상, 혼자",음식이 맛있어요,505,1
37535322,전설의 샌드위치,배달로 시켜먹어도 맛있지만 역시 매장에 가서 먹는 게 훨씬 맛있습니다ㅎㅎ 김치랑 소스도 부족하면 더 받을 수 있어서 좋아요,2024-06-26,"점심에 방문, 예약 없이 이용, 대기 시간 바로 입장",음식이 맛있어요,188,1
37535322,나옹나옹36,좋아요,2024-06-16,저녁에 방문,음식이 맛있어요,2030,1
37535322,헬러어,안경쓴 할머니가 너무 불친절함 위생적이지 않음올때마다 느끼네요 사장님인가요?,2024-06-05,"점심에 방문, 예약 없이 이용, 대기 시간 30분 이상, 일상, 지인・동료",,5,1
37535322,노땡쓰,맛있어요,2024-05-12,"점심에 방문, 예약 없이 이용, 대기 시간 바로 입장, 일상, 연인・배우자",음식이 맛있어요,2024,3
37535322,juju20,밥이 너무 적어요…돈가스 맛은 괜찮아요,2024-04-25,"저녁에 방문, 예약 없이 이용, 대기 시간 바로 입장, 일상",음식이 맛있어요,27,1
37535322,군군군구우운,매콤치즈피자돈까스 넘 맛있어요 ~~최애,2024-04-11,"저녁에 방문, 예약 없이 이용, 대기 시간 바로 입장, 일상, 혼자",음식이 맛있어요,33,1
37535322,월드베스트,조아요,2024-04-09,"아침에 방문, 예약 없이 이용, 대기 시간 바로 입장, 친목, 친구",음식이 맛있어요,683,5
37535322,오찌77,간단히 먹기 좋음,2024-04-08,"저녁에 방문, 예약 없이 이용, 대기 시간 바로 입장, 일상, 혼자",음식이 맛있어요,1415,1
37535322,anjoo,정말 맛있습니다,2024-04-02,"점심에 방문, 예약 없이 이용, 대기 시간 바로 입장, 일상",음식이 맛있어요,1153,1
37535322,익명이에요옹,김치피자돈까스 양도 많고 매콤해서 맛있얶어요가게가 조금 작은편이라 기름 냄새가 아주 살짝! 나서 옷에 뱄지만 그래도 맛있고 배부르게 먹어서 좋았어요! 노래도 나와서 좋았어요~,2024-04-01,"저녁에 방문, 대기 시간 바로 입장, 친목",양이 많아요,241,1
37535322,폼쟈,치즈 돈까스 먹었어요. 양도 혜자스럽고 정말 너무 맛있었어요~🤤 이번만 해도 벌써 3번째 방문..!! 가볍게 돈까스 먹으러 가기 좋은 곳이예요. 또 갈 겁니다..!! 이날 저녁 저에겐 첫끼였는데 정말 최고의 식사... 바삭해서 다 먹었어요.. 😆,2024-03-22,"저녁에 방문, 예약 없이 이용, 대기 시간 10분 이내, 친목, 친구",음식이 맛있어요,31,1
37535322,SEAN41,,2024-03-19,"저녁에 방문, 예약 없이 이용, 대기 시간 바로 입장, 친목, 친구",음식이 맛있어요,504,1
37535322,티아모28,"경양식으로 서울 5대 안에 드는 맛임…매콤, 김치 소스도 맛나요.",2024-03-17,점심에 방문,음식이 맛있어요,7,1
37535322,내가먹는건영칼로리,크림카레 약간 매콤하고 맛있어요.하나 다 먹었더니 배 겁나 불러요!!!,2024-03-14,"밤에 방문, 예약 없이 이용, 대기 시간 바로 입장, 일상, 친구",음식이 맛있어요,515,2
37535322,뭉게뭉게25,포장할때 기름제거 좀 더 해주세요...,2024-03-08,"저녁에 방문, 예약 없이 이용, 대기 시간 바로 입장, 일상, 혼자",혼밥하기 좋아요,2565,3
37535322,77****,맛있네요~~매콤돈까스 맛있어요,2024-03-03,저녁에 방문,음식이 맛있어요,880,1
37535322,유자8158,맛있어요,2024-02-28,"점심에 방문, 예약 없이 이용, 대기 시간 바로 입장, 가족모임, 부모님",음식이 맛있어요,1198,1
37535322,Nightglow89,맛았었습니다,2024-02-02,저녁에 방문,음식이 맛있어요,370,1
37535322,메이4421,아이와 처음 갔는데 치즈돈가스와 피자돈가스 넘넘넘 맛있었어요♡♡ 원래 다른 집 가려다 없어져서 여기로 기대안하고 들어갔는데 진정한 맛집을 찾아서 좋구요 다음에 나머지 식구들과 함께 또 와서 먹으려구요,2024-01-29,"점심에 방문, 예약 없이 이용, 대기 시간 바로 입장, 나들이, 아이",음식이 맛있어요,688,1
37535322,Shaine,정말 맛있어요,2024-01-29,"점심에 방문, 예약 없이 이용, 대기 시간 바로 입장, 나들이, 아이",음식이 맛있어요,950,1
37535322,꼬뿌14,굿,2024-01-16,"저녁에 방문, 예약 없이 이용, 대기 시간 바로 입장, 데이트, 연인・배우자",음식이 맛있어요,31,1
37535322,딜라씨,굿,2024-01-16,"점심에 방문, 예약 없이 이용, 대기 시간 바로 입장, 데이트, 연인・배우자",음식이 맛있어요,36,1
37535322,둥글둥글6598,돈까스 맛있어요 ^^친절하고 좋아요 ~,2023-12-28,"점심에 방문, 예약 없이 이용, 대기 시간 바로 입장, 일상, 지인・동료",음식이 맛있어요,720,2
37535322,dys****,굿,2023-12-16,"밤에 방문, 예약 없이 이용, 대기 시간 바로 입장, 일상, 혼자",음식이 맛있어요,538,1
37535322,다비드초이스,굿,2023-12-11,"저녁에 방문, 포장·배달 이용, 대기 시간 바로 입장",음식이 맛있어요,896,4
37535322,부천사람,매콤 적당히 매콤해서 맛나요 밥도 더 주시고,2023-12-10,"점심에 방문, 예약 없이 이용",음식이 맛있어요,846,1
37535322,보노보노3953,튀김옷이 바삭해서 좋아요!!,2023-12-09,"점심에 방문, 예약 없이 이용, 대기 시간 바로 입장, 일상, 연인・배우자, 아이",음식이 맛있어요,328,1
37535322,김복길93,맛있어용,2023-12-02,"점심에 방문, 예약 없이 이용, 대기 시간 바로 입장, 친목, 친구",음식이 맛있어요,116,1
37535322,물냥비냥,등심 곱빼기입니다.양은 많은듯 하나 부담없이 다 먹을정도 입니다.메인메뉴는 피자가 들어간 메뉴입니다.,2023-11-20,점심에 방문,친절해요,453,1
37535322,오야스미나사이,굳,2023-11-15,"저녁에 방문, 예약 없이 이용, 대기 시간 바로 입장, 혼자",음식이 맛있어요,2590,4
37535322,msk****,굿,2023-11-14,점심에 방문,음식이 맛있어요,2399,1
37535322,노랑별반짝,혼밥하기도 좋고 음식 양도 많아요,2023-11-12,"점심에 방문, 예약 없이 이용, 대기 시간 30분 이내, 일상, 혼자",음식이 맛있어요,197,1
37535322,그린스,굿,2023-11-04,점심에 방문,혼밥하기 좋아요,1785,1
37535322,Leeview,크림카레돈까스 살짝 매콥하대서 시켰는데 하나도 안 매워서 조금 아쉬웠어요 😔 근데 음식 자체는 맛있었어요. 피자돈까스도 궁금해서 다음에 또 가려고요 🙈,2023-10-25,저녁에 방문,음식이 맛있어요,69,1
37535322,러블리크리스,,2023-10-25,점심에 방문,음식이 맛있어요,1484,1
37535322,둥글둥글6598,매콤함박 맛있어요 ^^,2023-10-25,점심에 방문,음식이 맛있어요,720,1
37535322,We럽,포장해서 먹었던~무난합니다~~,2023-10-24,저녁에 방문,,1038,1
37535322,lee****,돈가스 등심  저렴하고 바삭하고 맛나요,2023-10-18,점심에 방문,음식이 맛있어요,1055,2
37535322,지연 Mishhhie,양이 많고 맛있습미다. 기성비가 좋습미다.,2023-10-11,점심에 방문,음식이 맛있어요,121,1
37535322,민트초코36,가성비가 좋고 고구마피자돈가스 맛있고 양 푸짐해요! 돈가스 잘 안먹는데 여긴 자주 찾아오게 될 것 같아요,2023-10-10,저녁에 방문,음식이 맛있어요,3,1
37535322,꿈꾸는 My 하우스,"외국어대학교앞 39돈가스점등심돈가스 8,500원 * 2개 =17,000원김치돈가스 9,000원 * 1개 =  9,000원맛있게 잘먹었습니다.",2023-10-08,저녁에 방문,양이 많아요,1991,1
37535322,티라노7469,김치치즈돈가스가 맛있어요,2023-10-08,저녁에 방문,음식이 맛있어요,429,1
37535322,안녕센터,치즈는 별로네요~,2023-10-02,아침에 방문,,1460,10
37535322,hellohohoh,맛있어요,2023-09-23,"점심에 방문, 예약 없이 이용, 대기 시간 바로 입장, 나들이, 연인・배우자",음식이 맛있어요,1341,1
37535322,중앵잉,"양이 많다고 들었는데 진짜 양이 많습니다.. 내부는 생각보다 조금 좁지만 혼밥하기는 좋은 것 같아요! 피자돈까스 먹었는데, 제가 피자빵 같은 느낌을 생각하고 먹어서 그런지 생각보다 피자맛이 강하지 않아 오히려 좋았어요!!",2023-09-16,저녁에 방문,음식이 맛있어요,55,1
37535322,황뚠뚠,돈까스 맛있습니다~,2023-09-10,저녁에 방문,음식이 맛있어요,837,3
37535322,자몽자몽오렌지,포장으로 먹었었는데 잘 먹었읍니다 개추,2023-09-10,"점심에 방문, 예약 없이 이용, 대기 시간 바로 입장, 일상",음식이 맛있어요,1748,1
37535322,하늘곰71,양도 푸짐하고 무엇보다 맛있어요~!!사장님도 친절하시고요+_+,2023-09-02,저녁에 방문,음식이 맛있어요,453,1
37535322,덤38,양도많고 맛있어서 돈가스 먹고싶을땐 항상 찾습니다피자돈가스 추천!,2023-08-21,점심에 방문,친절해요,564,3
