place_id,nickname,content,date,situations,keywords,review_count,visit_count
35251613,민초2697,고르곤졸라 리코타 피자랑 엔초비 파스타 시켰어요. 고르곤졸라위에 리코타치즈랑 루꼴라가 잘 어울려져서 맛있어요. 엔로비 파스타 조금 짭짤거 한 거 같은데 중독적인 맛이예요.,2023-11-01,"저녁에 방문, 예약 후 이용, 대기 시간 바로 입장, 친목, 지인・동료",음식이 맛있어요,419,1
35251613,gna****,"음 솔직하게 평가할게요. 장점 단점 모두보세요. 맛있어요. 가격대비 양도 괜찮고 맛도 있고 좋아요. 근데 한가지 큰 문제는 사장님의 비즈니스 매너 음식을 판매하는 태도 고객을 대하는 태도 매장의 식사자리와 주방을 제대로 분리할 수 있는 인테리어 방법을 바꿔야 합니다.물론, 사람이 안바뀌는건 사실이지만 이 부분을 고치지 않으면 더 많은 고객을 확보하는건 불가능하다고 봅니다.",2023-10-30,저녁에 방문,음식이 맛있어요,30,1
35251613,바이올렛4949,리코타피자 너무 맛있고 재료를 정말 아낌없이 쓰시네요~ 루꼴라 좋아하는데 넘치도록 주셨어요~ 그리고  추천해주신 수제맥주도 진하고 맛있어요~ 너무 잘 어울려요.피자도우는 마치 떡 처럼 쫄깃쫄깃 했어요. 테라스 분위기도 좋았어요,2023-10-26,점심에 방문,음식이 맛있어요,85,1
35251613,슝슝7574,"화덕피자 맛집으로 8피스피자 최고에요 ,, 🍕피맥하기 너무 좋았고 베이컨스파게티도 상상이상으로 맛있었어요",2023-10-22,밤에 방문,음식이 맛있어요,162,1
35251613,wls****,화덕 피자라 뒤에사 보던 손님도 맛있겠다 소리를 지르네요 ㅎㅎ,2023-10-21,저녁에 방문,음식이 맛있어요,64,1
35251613,Glorious dayz,피맥하기 최고임!!!! 피자 진짜 죤마탱 ❤️,2023-10-17,점심에 방문,단체모임 하기 좋아요,424,1
35251613,우유380,화덕피자 짱맛..식어도 쫄깃하고 맛있음도우가 찐업체로부터 식사를 제공받아 작성한 리뷰입니다.,2023-10-15,점심에 방문,음식이 맛있어요,42,1
35251613,그린아가베,여기 피자 도우가 진짜 쫀득쫀득 맛있어요,2023-10-14,저녁에 방문,음식이 맛있어요,359,1
35251613,담뚜루,스파게티가 좀 짰지만 맛있었어요ㅋㅋ피자도 루꼴라 듬뿍에 맛있어요,2023-10-13,점심에 방문,음식이 맛있어요,783,1
35251613,sum****,넘... 넘 맛있어요 프로슈토 피자 먹었는데도우랑 재료들이랑 찰떡궁합이에요딱 잘 어우러진달까? 루꼴라도 신선하구느끼한피자가 아닌 과즙팡팡 산뜻한 피자에오클래식하지만 특별한..? 파스타도 꾸덕소스담뿍 아주 맛있게 잘 먹었습니다 🩷🧡❤️🩷🧡❤️,2023-10-10,저녁에 방문,음식이 맛있어요,90,1
35251613,dke****,음식 짱 빨리 나오고 맛있어요!!테라스 자리 최곱니다! 대신 주차공간 없으니 차 두고가세요ㅠㅠ 주말엔 공영주차장 자리도 없습니다,2023-10-08,저녁에 방문,음식이 맛있어요,166,1
35251613,cod****,이태원 해방촌 맛집.매장내 이국적인 분위기가 끝내줍니다.할라피뇨오일 스파게티 프로슈토 피자 맛집.정말 맛있고 특히 피자는 도우까지 쫀득하고 맛있었어요.맥주 먹으며 대화하기 좋은 이태원 맛집.너무 즐거웠고 재방문 할게요!,2023-10-02,아침에 방문,뷰가 좋아요,1109,1
35251613,춤밈섬,화덕피자라 금방나와서 좋았음. 하몽루꼴라 조합 좋아해서 다른곳에서도 먹고 좋은기억에 시켰는데 하몽이 좀 부족해 보였음. 절반먹고 포장해달라했는데 사장님표정이 무서웠음..가게가 넘어두워서 눈이 불편했음.,2023-08-12,저녁에 방문,음식이 맛있어요,88,1
35251613,dld****,조아요,2023-07-28,저녁에 방문,,586,1
35251613,해방촌댁,"빈티지한 인테리어도 너무 예쁘고, 사장님 손이 빠르셔서 주문한 음식이 빨리 나옵니다~스파게티를 먹은 딸아이가 ""따봉!""을 외쳤고, 피자를 맛본 후에는 ""내일도 오자!"" 하네요 ㅎㅎ맛있는데 건강까지 생각한 음식이라 더 좋았어요 : )폴딩도어라 개방감도 있고, 여러모로 힐링되는 시간이었습니다~~",2023-07-07,저녁에 방문,음식이 맛있어요,904,1
35251613,카롱카롱,맛있어요,2023-06-22,저녁에 방문,음식이 맛있어요,1361,9
35251613,skj5761,굿,2023-06-05,저녁에 방문,음식이 맛있어요,2004,1
35251613,안녕말고강녕,프로슈토 피자에용 일인운영하는 매장이고 바로 화덕에서 구워서 맛있어용 근데 조명이 너무 어두워서 잘 안보이지만 밤에가면 운치가 있어보이긴하네용 그래도 어둑한건 제 취향이 아닙니당 그래도 피자는 맛있어요 루꼴라 신선하고 위에올라간 고기도 맛있고 빵은 쫄깃하고 좋습니드,2023-05-29,저녁에 방문,음식이 맛있어요,42,1
35251613,소소2330,피자가 정말 맛있었어요!파스타는 독특하게 맛있었고요 ㅎㅎ,2023-05-29,저녁에 방문,아늑해요,149,1
35251613,yim86,,2023-05-20,저녁에 방문,음식이 맛있어요,327,1
35251613,김진선2583,맛도 인테리어도 완벽한곳🙌,2023-04-21,저녁에 방문,음식이 맛있어요,801,1
35251613,wht****,좋아요:),2023-04-01,저녁에 방문,음식이 맛있어요,211,1
35251613,CWK28,화덕피자라서 쫄깃하고 너무 맛있어요!미트피자 추천..!!파스타도 맛있지만 피자가 더 맛있었어요!,2023-02-17,저녁에 방문,인테리어가 멋져요,2,1
35251613,wld****,루꼴라 넘 맛납니다,2023-01-23,저녁에 방문,음식이 맛있어요,53,1
35251613,다따따다,굿,2023-01-05,저녁에 방문,,224,1
35251613,카롱카롱,자주 찾는 곳인데 도우도 얇고 맛있어요!,2022-11-06,저녁에 방문,음식이 맛있어요,1361,8
35251613,태나아두,맛있어영,2022-10-30,저녁에 방문,음식이 맛있어요,284,1
35251613,swi****,좋아요 좋아요 좋아요,2022-10-30,저녁에 방문,재료가 신선해요,732,1
35251613,yun****,테라스가 좋아여~👍,2022-10-22,저녁에 방문,인테리어가 멋져요,97,1
35251613,비카아라,간단히 한잔,2022-10-13,저녁에 방문,가성비가 좋아요,2301,1
35251613,카롱카롱,굿굿,2022-09-21,저녁에 방문,음식이 맛있어요,1361,7
35251613,나93,화덕피자라 담백하고 맛있어요1인 1피자 가능합니다…,2022-09-13,저녁에 방문,음식이 맛있어요,32,1
35251613,꿀떡쟁이,굿,2022-09-10,저녁에 방문,음식이 맛있어요,510,1
35251613,아은,굿,2022-09-10,저녁에 방문,음식이 맛있어요,135,1
35251613,최심심,"음 맛있게 먹긴 했지만, 막 엄청 특별하다거나 피자 맛집이라던지..큰 메리트는 없었어요 그냥 피맥하기에 쏘쏘..! 사장님과 직원이 조금 냉담한 분위기라 굳이 또 찾아갈 것 같지는 않아요..가게는 좁고 위생상태가 살짝 불안해요",2022-09-10,저녁에 방문,,213,1
35251613,angella92,매장은 다소 협소하나 화덕에서 구운 피자가 담백하니 맛있었습니다. 엔쵸비날치알 스파게티는 제 입맛에는 너무짰는데 피자와 함께먹으니 괜찮았어요 ㅎㅎ매장이 좀더 청결했으면 좋겠는 점이 아쉬웠습니다.,2022-08-14,저녁에 방문,음식이 맛있어요,137,1
35251613,쨈토끼,포모도로는맛있고 디아볼라는너무맛이없었어요사진보면아시겠지만 치즈를 엄청조금주세요....화장실에 포장용기있어요할라피뇨그릇이너무 지저분해요전체적으로 지저분해요 ㅠㅠ,2022-08-13,저녁에 방문,,715,1
35251613,hwanmyul,메뉴판에 사진이 없어서 들어가는 재료를 보고 복불복으로 시켜봤는데 맛있었어요 ! 타이거 맥주 진짜 꼭 드세요 세상 맛있어요 최고야,2022-08-13,점심에 방문,음식이 맛있어요,542,1
35251613,246356,굿,2022-08-12,저녁에 방문,화장실이 깨끗해요,793,1
35251613,카롱카롱,굿,2022-08-06,저녁에 방문,음식이 맛있어요,1361,6
35251613,dyoung84,1,2022-07-22,저녁에 방문,음식이 맛있어요,158,1
35251613,지구태양,굿,2022-07-22,저녁에 방문,음식이 맛있어요,1279,1
35251613,사람인78,1,2022-07-22,저녁에 방문,음식이 맛있어요,1105,1
35251613,min****,좋아요,2022-07-17,저녁에 방문,음식이 맛있어요,200,1
35251613,주연761,음식은 나쁘지않았지만 모든 음식이 나오기까지 30분이 걸렸습니다 ㅎ… 엄청 사람이 많던것도 아니고 저희 음식만 하면 되는 상황이었는데 주방에서 마스크안쓰고 통화하고 계시는 모습에 조금 마음이 불편했네요… 재방문은 안할것같습니다 ㅠ,2022-07-01,저녁에 방문,,28,1
35251613,cha****,굿,2022-06-18,저녁에 방문,음식이 맛있어요,1102,1
35251613,chi****,굿,2022-06-11,저녁에 방문,가성비가 좋아요,466,2
35251613,chi****,굿,2022-06-11,저녁에 방문,음식이 맛있어요,466,1
35251613,dur****,,2022-06-06,점심에 방문,음식이 맛있어요,175,1
1608568838,맛집만다니는완두콩,"남자친구 생일 맞이해 예약하고 갔는데! 뷰도 너무 좋고, 음식도 너무 맛있어서 좋은 추억 만들고 가용!!",2025-03-22,"저녁에 방문, 예약 후 이용, 대기 시간 바로 입장, 데이트, 연인・배우자",친절해요,519,1
1608568838,쏘쏘5120,친구 생일이라 좋은데서 축하해주고 싶어 방문했는데 바 자리 아니면 무조건 바틀 주문해야 하는데 가격이 창렬이라 다시 방문하진 않을 것 같아요~ 음식 맛은 그낭 저냥 ! 너무 비싸요!!!!! ㅠㅠ,2025-03-22,저녁에 방문,뷰가 좋아요,2785,1
1608568838,혤뀨,예약없이 방문시 테이블이 있어도 보틀을 안시키면 바 밖에 못앉아요 가격대비 음식 퀄리티도 굉장히 떨어지는 편 뭔가를 분주히 하시고 이쁘게하려고 하지만 맛도 양도 다 별로에요 뷰는 좋지만 좋은 뷰를 감상할수없어요 한번가보면 다시는 안갈거같아요,2025-02-27,"저녁에 방문, 예약 없이 이용, 대기 시간 바로 입장, 데이트, 연인・배우자",뷰가 좋아요,6,1
1608568838,lee****,작년에 와보고 너무 좋아서 또 예약을 하게 되었습니당 캐치테이블로 예약을 했는데 메모로 부탁드렸는데 부탁 잘 들어주셨어용 ㅠㅠ 매우 감사해요!직원분들이 센스가 넘치시고 친절하세요!!분위기도 너무 좋고 뷰 굿굿입니다! 음식도 맛있고요!!담에 또 올게요 직원분들 덕분에 좋은 사람들과 좋은 시간 보냈습니당🩷🩷,2025-01-30,"저녁에 방문, 예약 후 이용, 대기 시간 바로 입장, 기념일, 연인・배우자, 부모님",음식이 맛있어요,6,1
1608568838,티샷푸코,ㅎ,2025-01-05,점심에 방문,인테리어가 멋져요,480,1
1608568838,나니나니나니54,캐치테이블에서 티케팅 해서 간신히 갓엇어요 원하는 시간대에 대기 걸어놧는데도 어렵더라구요낮시간이라 나름의 운치도 잇고 보틀 주문이 의무가 아이라서 좋앗어요연말코스로 먹엇는데 뭔가 단백질의 향연이라 맛은 있엇지만 다양성에 조금 아쉬웟습니다 코스요리라 소고기나올때 쯤엔 거의 못먹엇네요ㅎ 앞으로 계속 다양한 코스요리 기대할게요음식 설명해주실때 목소리도 작고 음악은 커서 거의 이해를 못했습니다 그게 조금 아쉬웠어요 뷰는 좋았습니다 그리고 혹시 와인을 저렴하게 구매가능하신 분들은 콜키지 하세요..!,2024-12-25,"점심에 방문, 예약 후 이용, 대기 시간 바로 입장, 데이트, 연인・배우자",음식이 맛있어요,1692,1
1608568838,사용자01,분위기 정말 좋고 매장이 청결해요. 뷰는 진짜 너무 좋아요.음식 맛있구요 서빙하시는 직원분들 모두 친절합니다.윗층에서 공사하는 소리가 나서 대기하면서 걱정됐는데 시간 딱 되니 공사 멈추더라구요.,2024-12-25,"점심에 방문, 예약 후 이용, 대기 시간 바로 입장, 일상, 혼자",음식이 맛있어요,2239,1
1608568838,hah****,맛있음,2024-12-08,"저녁에 방문, 예약 후 이용, 대기 시간 바로 입장, 데이트, 친구",음식이 맛있어요,719,1
1608568838,10101010101010,와인 종류가 다양한 곳이라 평소 하이볼을 더 좋아해 고민하다 가봤는데 메뉴 하나하나 정말 맛있고 신선했던 것 같아요! 하이볼도 2가지 종류 둘다 맛있니다👍해방촌 가면 꼭 한번 들려보세요☺️,2024-11-24,저녁에 방문,음식이 맛있어요,815,1
1608568838,소영쇠런,남산타워 잘 보이는 뷰 맛집음식도 진짜 맛있어요. 특히 삼계 리조또 진짜 진짜 맛있어요. !!미리 예약하고 갔습니다,2024-11-10,"저녁에 방문, 예약 후 이용, 대기 시간 바로 입장, 여행, 연인・배우자, 아이",음식이 맛있어요,502,1
1608568838,별난i,드디어 가보다니!!! 예약없이 한자리가 딱 있어서 운좋게 먹었네요 ㅎㅎ 와인 설명도 잘해주시고 너무 맛있었어요 감태육회먹자마자 감탄에 연발~~ 꼭 드셔보세용!!,2024-11-02,"밤에 방문, 예약 없이 이용, 대기 시간 바로 입장, 데이트, 연인・배우자",매장이 청결해요,220,1
1608568838,하루하루햎삐,분위기 최고였고 야경 맛집이네요!!,2024-11-02,"저녁에 방문, 예약 없이 이용",음식이 맛있어요,1907,1
1608568838,Care bear,"분위기와 맛이 좋아 n번째 방문이지만, 언제나 서비스의 불편함에는 익숙해지지 않아요. 바에서 요리하시는 여자분께 테이블 여부 여쭈어봤는데, 다른 남자분께 손을 가리고 말하면서 ”그냥 예약되었다고 해“라 하고 남자분이 확인도 없이 그렇게 이야기하더라구요. 다 들리고 손님들도 다 알아요… 오너분께서 이 메세지 읽으시면 서비스 개선되면 좋겠습니다.",2024-10-29,저녁에 방문,음식이 맛있어요,813,1
1608568838,박쌀,안주들이 생각보다 비싸진 않고 맛있어서 같이 간 친구들이 다들 만족했어요 기념일에가기에 분위기가 좋아요,2024-10-19,"저녁에 방문, 예약 후 이용, 대기 시간 바로 입장, 기념일, 친구",음식이 맛있어요,233,1
1608568838,내가 내 돈 주고 가는 곳들,"서프라이즈 장소! 얼떨결에 찾은 숨겨진 보물 같은 레스토랑이었어요. 멋진 뷰, 아늑한 바이브, 친절한 직원분들, 맛있는 음식 그야말로 10점 만점에 100점!해방촌에 가게 된다면 꼭 한번 가봐야 하는 곳. 저는 무조건 담에 여기 또 올꺼에요!!",2024-10-17,"아침에 방문, 예약 후 이용, 대기 시간 바로 입장, 친목, 친구",음식이 맛있어요,31,1
1608568838,Seu27,이름처럼 경치가 참 훌륭하지만 무엇보다도 음식이 한식과 어우러져서 재미있고 맛있게 표현된 곳. 그래서 외국인친구한테 한식의 다양성에 대해서 소개할 때 종종 방문하고는 합니다. 멋있고 맛있는 곳이에요. 안주양이 조금만 더 늘었으면 하는 작은 바람도 있지만 여전히 갈 만한 이유가 충분한 곳입니다. 2층에 있어서 우연히 걸어가다가 보기는 쉽지 않은데 창문에 항상 외국 뮤직비디오 같은 게 나오고 있어서 그걸 보고 건물 왼쪽에 있는 계단으로 올라가면 찾기가 쉬운 것 같아요. 번창하시기 바랍니다.,2024-10-07,"밤에 방문, 예약 없이 이용, 대기 시간 바로 입장, 친목, 친구",음식이 맛있어요,48,1
1608568838,MinS8,와... 여긴 진짜..완! 벽 ! 이라는말은이너무 잘 어울려요음식이며 뷰 며 친절도며 완전너무 좋네요...!음식 하나하나 모두 감동이에요무조건 여긴 오케이에요 !!,2024-10-06,"저녁에 방문, 데이트, 연인・배우자",인테리어가 멋져요,1169,1
1608568838,율이이이이,예랑이 생일맞이로 갔는데남자직원분 너무 센스있으시고 와인 추천도 잘해주셨어여❤️기념일 너무 잘 즐기고 맛있게 먹고 갑니다감사합니다 친구들한테도 추천 많이할게용❤️,2024-09-21,"저녁에 방문, 예약 후 이용, 대기 시간 바로 입장, 데이트, 연인・배우자",인테리어가 멋져요,55,1
1608568838,HbDDD,"분위기깡패에 안주 기대없이갔는데, 메뉴 다맛있네요??재방문 각입니다. 주류 종류도 많은데, 제주오메기 음식페어링 좋네요~도수가 높지않아 부담없이 즐기기 가벼운 술입니다. 연인과 방문 추천드려요~^^ 좌석마다 조명덕에 서로에게 집중하기좋겠어요^^",2024-08-23,"저녁에 방문, 예약 후 이용, 대기 시간 바로 입장, 친목, 친구",음식이 맛있어요,970,1
1608568838,내돈내산컴온,직원이 너무 친절해요!!!👍👍👍심지어 식당 분위기와 음식까지너무너무 맛있어요~! 술도 다양해서 골라먹는 재미가 있어요☺️데이트로도 너무 좋아요🤍,2024-08-15,"저녁에 방문, 예약 없이 이용, 대기 시간 바로 입장, 일상, 연인・배우자, 친구",인테리어가 멋져요,156,1
1608568838,pueblo,뷰가 일단 미쳤구 분위기도 대박이에요!음식들도 맛있었습니다 -!,2024-07-25,"저녁에 방문, 예약 후 이용, 대기 시간 바로 입장, 친목, 나들이, 친구, 지인・동료",음식이 맛있어요,16,1
1608568838,Happyyyyyyyyyy,"해방촌 뷰맛집 차경에 방문했습니다! 광어세비체와 명란메밀면, 감태육회, 명란감태주먹밥, 올리브 주문했고 다 맛있었어요 ㅎㅎ 특히 명란메밀면이 들기름 향이 정말 고소해서 좋았고, 명란감태주먹밥에 올라간 명란소스가 부드러웠어요! 저녁때 가서 해질녘 뷰와 와인과 함께하는 좋은 식사시간이었습니다ㅎㅎ",2024-07-25,"저녁에 방문, 예약 후 이용, 대기 시간 바로 입장, 데이트, 연인・배우자",음식이 맛있어요,399,1
1608568838,hr77,가격대비 음식양 매우 창렬 가격은 레스토랑처럼 받아먹으면서 서비스는 김밥천국이랑 다를빠가없음 다신안감 절대 추천안함,2024-07-14,"점심에 방문, 예약 후 이용, 대기 시간 바로 입장, 데이트, 연인・배우자",,62,1
1608568838,마싰는게체고,"해방촌에 위치한 와인바에요!오향 칠전판 먹었는데 돼지고기,쌈피,파프리카,부추,우엉,토마토,오이 같이 먹으니까 진짜 조화롭게 맛있어요바 테이블에 앉아서 먹었는데 앞에 오픈 키친이라 요리 하는 것도 구경하고 노래도 잘 들려서 너무 좋았어요 주방도 깔끔하고 그만큼 안주도 다 맛있어요해방촌 처음 와봤는데 좋은 기억 가지고 가요 다음엔 농어구이 먹으러 또 오고 싶어요 🤍",2024-07-09,저녁에 방문,인테리어가 멋져요,208,1
1608568838,페페더두꺼비,맛있어서 양이 많았음에도 불구하고 이것저것 시켜서 먹어봤습니다 😊😊 생일이라고 말씀드렸더니 이렇게 예쁘게 해주셔서 정말 감사했습니다^^.,2024-07-08,"저녁에 방문, 예약 후 이용, 대기 시간 바로 입장, 친목, 친구",음식이 맛있어요,119,1
1608568838,햄스터님,뷰너무좋아요,2024-06-22,저녁에 방문,음식이 맛있어요,1205,1
1608568838,뚜북,전체적으로 간이 세지 않아 좋았어요 :)사장님도 엄청 친절하세용 감태육회에 육회가 쫀득! 하구요 광어세비체는 후식(?)으로 꼬옥 시키세욤..🩷,2024-06-12,"저녁에 방문, 예약 후 이용, 대기 시간 바로 입장, 데이트, 연인・배우자",친절해요,13,1
1608568838,hellosunday,맛나게 먹엇습니다,2024-06-09,"점심에 방문, 예약 없이 이용, 대기 시간 바로 입장, 일상, 친구",음식이 맛있어요,472,1
1608568838,오롱오롱,"예약하고 갔는데, 너무 만족스러운 방문이었습니다. 뷰도 끝내주지만, 직원분들 친절하시고, 음식도 맛있고, 와인도 종류별로 많아 음식과 맞는 와인 추천도 잘해주시구요! 비록 저 뷰 자리는 아니었지만  개방감있는 창문이라서 좋앗습니다. :) 재방문 의사 있습니다!! ㅎ",2024-06-01,"저녁에 방문, 예약 후 이용, 대기 시간 바로 입장, 친목, 친구",음식이 맛있어요,176,1
1608568838,일상을찾는자,해방촌 정취를 느낄수 있는 장소. 남산타워 뷰에 특색있네요,2024-05-28,"저녁에 방문, 예약 후 이용, 대기 시간 바로 입장, 비즈니스, 지인・동료",건강한 맛이에요,886,1
1608568838,호야135,"와이프와 저녁먹고 와인바가 가고싶어 찾아 예약없이 갔습니다. 다행이 자리가 나서 금방 앉을수가 있었네요. 일단 한쪽은 서울시내뷰, 한쪽는 남산타워가 보이는데, 이 뷰를 잘 살린 인테리어가 다했네요 :) 배가 불러 음식은 얼마 못먹었지만 굉장히 맛있었고, 물론 와인바답게 와인도 무척 많아 그날 먹고싶은것을 충분히 골라 즐길수 있었습니다! 조만간 또 방문할께요!",2024-05-26,"저녁에 방문, 예약 없이 이용, 대기 시간 10분 이내, 데이트, 일상, 연인・배우자",음식이 맛있어요,64,1
1608568838,맛도리대학총장,친구 생일이어서 예약 후 방문했어요. 특별한 날 너무너무 추천합니다 🖤,2024-05-25,"저녁에 방문, 예약 후 이용, 대기 시간 바로 입장",음식이 맛있어요,391,1
1608568838,이색적모래,good vibe! 센스있게 와인 쿨링해주고 예쁨. 무엇보다 저녁시간에가면 웨이팅해야하고 예약걸어놓는게 이득. 음식도 깔끔하게나오고 감태육회 진심추천👍🏻하우스와인 기본이 6만원이니만큼 주머니탈탈 털릴각오하고 가야함. 그래도 좋은날기념하기 나쁘지않음.,2024-05-14,"저녁에 방문, 예약 후 이용, 대기 시간 30분 이상, 데이트, 연인・배우자, 친구",기본 안주가 좋아요,97,1
1608568838,ysungho1,"소월로 차경, View맛집",2024-05-04,저녁에 방문,음식이 맛있어요,2366,1
1608568838,Carol6,해방촌 풍경과 맛있는 음식과 와인이 너무 좋아요👍,2024-04-28,"점심에 방문, 예약 후 이용, 대기 시간 바로 입장, 친목, 친구",음식이 맛있어요,203,1
1608568838,비트타는 왕꿈틀이,"차경은 진심 너무 맛있어요뷰도 너무 좋고, 안주 하나하나 너무 맛있어서 제주변에서도 많이오는 이태원 해방촌 술집이에요남산뷰 넘 멋지고 어두워지면 남산타워도 진짜 예쁩니다음식은 아 다 맛있는데.. 육회+감태, 광어묵은지세비체, 굴 등 다 넘 좋았고요. 술은 전통주, 와인 있으니 취향껏 드시면 될듯",2024-04-10,"저녁에 방문, 예약 후 이용, 대기 시간 바로 입장, 친목, 친구",인테리어가 멋져요,205,1
1608568838,tainshooy,맛있어요,2024-04-06,저녁에 방문,음식이 맛있어요,320,1
1608568838,신나는오둥이,"뷰가 좋다는 소문을 듣고 방문한 차경🏞️2주전에 예약을 하고 방문했는데 주말이라 그런지 아쉽게도 통창 바로 앞에 앉지는 못했지만, 통창을 통해 남산 아래를 바로 볼 수 있는 자리에 앉을 수 있어서 럭키✨분위기, 뷰, 그리고 와인 및 전통주 리스트는 굿👍🏻 음식, 서빙 타이밍, 친절도는 글쎄? 오픈 키친인데 다들 너무 바빠서 무언가를 요청하려고 누군가를 불러도 대답없는 메아리🥲 (저기요오...여기 사람 있어요오....)전반적으로 뷰가 너무 좋아서 와인 마시러 2차쯤 오기엔 딱 좋음!",2024-03-09,"저녁에 방문, 예약 후 이용, 대기 시간 바로 입장",뷰가 좋아요,747,1
1608568838,Yenj,와 뷰도 좋고 맛도 넘 좋아용 ㅠㅠㅠ,2024-03-03,"저녁에 방문, 예약 후 이용, 대기 시간 바로 입장, 데이트, 연인・배우자",음식이 맛있어요,712,1
1608568838,kkkkkkkkkkkz,용산구에서 최고로 맛좋은 뷰좋은곳이에요,2024-03-02,"점심에 방문, 대기 시간 30분 이내, 데이트, 친목, 나들이, 연인・배우자, 친구, 지인・동료",음식이 맛있어요,1678,1
1608568838,라둥2,"창문에서 바로 보이는 남산뷰가 그냥 안주에요..💚보고만 있어도 그냥 기분이 안정되고 좋아요심지어 비 오는 날이였는데더 운치있고 예뻤던 것 같아요!토마토 스튜에 면사리는 꼭 추가해서 드시구요명란마요 감태주먹밥,LA갈비도 맛있습니다!특별한 날 예쁘고 아늑하게 보내고 싶으시다면 꼭 가보세요!",2024-02-18,"저녁에 방문, 예약 후 이용, 대기 시간 바로 입장, 데이트, 기념일, 연인・배우자",오래 머무르기 좋아요,32,1
1608568838,부리부리2721,굿굿뷰 맛집....넘 친절하셔요,2024-02-13,저녁에 방문,음식이 맛있어요,1001,1
