place_id,nickname,content,date,situations,keywords,review_count,visit_count
1089404828,방혜영95,굳,2025-03-29,"저녁에 방문, 예약 없이 이용, 대기 시간 바로 입장, 친목, 친구",음식이 맛있어요,10,1
1089404828,jii53,안주 다 맛있습니다 오늘도 만취 ~~,2025-03-27,"밤에 방문, 예약 없이 이용, 대기 시간 바로 입장, 데이트, 연인・배우자",음식이 맛있어요,1,1
1089404828,명준호34,음식이 맛있고 양도 많이 나와요😁,2025-03-27,"저녁에 방문, 예약 없이 이용, 대기 시간 바로 입장, 친목, 친구",음식이 맛있어요,3,1
1089404828,nerds0,여기 두부김치 먹으려고 하루종일 굶고 왔습니당 🥵 자리도 넓고 안주도 맛있고 모임장소로 쨩♥️♥️♥️♥️♥️♥️♥️♥️♥️그리고 너무 맛있어요,2025-03-27,"아침에 방문, 예약 없이 이용, 대기 시간 바로 입장, 친목, 친구",인테리어가 멋져요,3,1
1089404828,pmh****,노원오면 항상 오는 술집 ㅎㅎ 넓은 공간에서 편안하게 술한잔 하기 넘 좋아요! 1차 2차 3차 다 제격!! 안주가 다양해서 좋아용 가성비 최고👍,2025-03-26,"저녁에 방문, 예약 없이 이용, 대기 시간 바로 입장, 친목, 친구",단체모임 하기 좋아요,40,1
1089404828,갱갱츄,너무 맛있어서 사진 찍지도 않고 다 먹어버렸습니다… 직원분들도 너무 친절하시고 음식도 맛있었습니다!! 회식이나 술 마실 곳 있으면 여기 적극 추천합니다아 노래 선곡도 너무 좋습니다… 🥹,2025-03-26,"저녁에 방문, 예약 없이 이용, 대기 시간 바로 입장, 친목, 친구",음식이 맛있어요,16,1
1089404828,일등성,안주 다양하고 맛있고 가격도 착해요~,2025-03-26,저녁에 방문,음식이 맛있어요,953,2
1089404828,서민,요리주점답게 메뉴도 다양하고 가성비까지 있어요! 특히 제육이랑 우삼겹순두부조림이 진짜 밥도둑이네요..!! 양념소스에 밥비비면 소주가 무한으로 들어갈듯요ㅎㅎ매장도 넓어서 단체모임하기 좋을거같아요 연령대가 낮은거같아요!,2025-03-25,"저녁에 방문, 예약 후 이용, 대기 시간 바로 입장, 데이트, 연인・배우자",친절해요,86,1
1089404828,웅웅63,노원에 오면 항상 오는 술집이에요안주도 다 가성비있는데 너무 맛있습니다 최고~!!,2025-03-25,"아침에 방문, 예약 없이 이용, 대기 시간 바로 입장, 친목, 친구, 지인・동료",음식이 맛있어요,11,1
1089404828,kim****,너무맛잇고 사장님도 친절하시고 다들 방문해보세요,2025-03-25,"아침에 방문, 예약 없이 이용, 대기 시간 바로 입장, 데이트, 연인・배우자",음식이 맛있어요,15,1
1089404828,얌얌욤,좋아용,2025-03-24,"아침에 방문, 예약 없이 이용, 대기 시간 바로 입장, 친목, 친구",인테리어가 멋져요,84,1
1089404828,doo****,,2025-03-23,"밤에 방문, 예약 없이 이용, 대기 시간 바로 입장, 친목, 비즈니스, 친구",대화하기 좋아요,3,1
1089404828,준석8498,분위기가 좋고 안주가 맛있어요!!!! 다음에 또 오겠습니다,2025-03-23,"밤에 방문, 예약 없이 이용, 대기 시간 바로 입장, 친목, 일상, 친구",음식이 맛있어요,35,2
1089404828,sun9412,음식들이 모두 너무 맛있고 술도 잘 마셨습니다! 친구 추천으로 오게 되었는데 정말 좋았습니다! 다음에 또 오고 싶습니다! 사장님도 친절하시고 좋았습니다!,2025-03-22,"아침에 방문, 예약 없이 이용, 대기 시간 바로 입장, 친목, 가족모임, 친구",음식이 맛있어요,1,1
1089404828,여닝5249,두번째 방문인데 친구들이랑 놀러왔는데 술먹기 너무 좋아요! 안주 맛있습니다! 다음에 또 올 의향 있습니다! 사장님이 친절하고 음식도 맛있습니다!,2025-03-22,"아침에 방문, 예약 없이 이용, 대기 시간 바로 입장, 가족모임, 친구",음식이 맛있어요,2,1
1089404828,boragongju,메뉴가 다양하고 안주가 다  맛있어요. 친절하고 가성비 좋은 곳입니다,2025-03-22,"아침에 방문, 예약 없이 이용, 대기 시간 바로 입장, 데이트, 연인・배우자",음식이 맛있어요,3,1
1089404828,jiq****,넘맛잇어용,2025-03-21,"저녁에 방문, 예약 없이 이용, 대기 시간 바로 입장, 친목, 친구",음식이 맛있어요,14,1
1089404828,suy****,굿,2025-03-21,"저녁에 방문, 예약 없이 이용, 대기 시간 바로 입장, 친목, 친구",음식이 맛있어요,8,2
1089404828,만두팔이,,2025-03-20,"저녁에 방문, 예약 없이 이용, 대기 시간 바로 입장, 친목, 친구",특별한 메뉴가 있어요,9,1
1089404828,lul****,,2025-03-20,"아침에 방문, 예약 없이 이용, 대기 시간 바로 입장, 친목, 친구",음식이 맛있어요,1,1
1089404828,임희연3025,여기 단골인데 술집은 여기 밖에 안 와요 직원들도 친절하고 간단히 먹기 너무 좋은 곳이에요!!,2025-03-19,"저녁에 방문, 예약 없이 이용, 대기 시간 바로 입장, 친목, 친구",가성비가 좋아요,5,1
1089404828,hyem912,메뉴도 많고 가성비 좋아요! 단체 모임하기도 좋을 것 같아요,2025-03-19,"저녁에 방문, 예약 없이 이용, 대기 시간 바로 입장, 친목, 친구",음식이 맛있어요,16,1
1089404828,노하경19,두부김치가 진짜 완전 맛있어용,2025-03-19,"저녁에 방문, 예약 없이 이용, 대기 시간 바로 입장, 친목, 친구",음식이 맛있어요,3,1
1089404828,hch****,너무너무 졸사 좋기를 보낼 수 있는 곳 입니다ㅇㅇ😍😍😍당추할게요~!~!~!~!~!,2025-03-19,"아침에 방문, 예약 없이 이용, 대기 시간 바로 입장, 친목, 친구",대화하기 좋아요,4,1
1089404828,여준영94,안주들이 완전 맛있어요! 빨간 메뉴들이 너무 내취향🥲 매장도 넓고 좋아요!,2025-03-19,"밤에 방문, 예약 없이 이용, 대기 시간 바로 입장, 친목, 친구",음식이 맛있어요,17,1
1089404828,잉정웅,진짜 너무 맛있어요 ㅎㅎ,2025-03-16,"저녁에 방문, 예약 없이 이용, 대기 시간 바로 입장, 친목, 친구",음식이 맛있어요,5,2
1089404828,rla****,"평소에 많이 왔었는데도 못 먹어본 안주가 많을 정도로 종류가 엄청 다양하고, 맛있었습니다 !",2025-03-15,"밤에 방문, 예약 없이 이용, 대기 시간 바로 입장, 친목, 지인・동료",음식이 맛있어요,4,1
1089404828,혜림6256,치즈 불닭이 진짜 맛있어요..딱 잘 끓인 라면. 위에 치즈 토치로 구우신 것 같은데 진짜 최고… 마싯습니다🥹👍🏻🤍,2025-03-15,"저녁에 방문, 예약 없이 이용, 대기 시간 바로 입장, 친목, 친구",음식이 맛있어요,18,1
1089404828,셈짱10,여긴 정말 제가 n번째 오는 술집!!! 음식도 저렴하고 맛있고 친구들이랑 대화하기도 좋고 의자도 소파형식이라 편하고 화장실도 내부에 있고 깨끗하고 담배는 안 피지만 흡연실도 내부에 있어서 그냥 밖에 나갈일도 없이 편하게 술 마시기 좋아요 노원와서 술 마시려면 고민 없이 대포집 🩷,2025-03-15,"저녁에 방문, 예약 없이 이용, 대기 시간 바로 입장, 친목, 친구",음식이 맛있어요,61,1
1089404828,jun****,너무너무 직원분들이 친절하세요!!,2025-03-15,"밤에 방문, 예약 없이 이용, 대기 시간 바로 입장, 친목, 친구",음식이 맛있어요,76,9
1089404828,kae****,분위기 좋고 음식이 맛있어요,2025-03-14,"저녁에 방문, 예약 없이 이용, 대기 시간 바로 입장, 데이트, 친목, 친구, 지인・동료",음식이 맛있어요,7,2
1089404828,yon****,쥐포구이 시켰는데 맛있어요,2025-03-13,"아침에 방문, 예약 없이 이용, 대기 시간 바로 입장, 친목, 친구",인테리어가 멋져요,3,1
1089404828,두쨩9,노원에서 늦게까지해서 넘 좋아요!!분위기도 딱 좋고 안주들도 다양해서 좋았어요~화장실도 깨끗하구 직원분들도 넘넘 친절하셨어요!다음에 또올게요~,2025-03-13,"밤에 방문, 예약 없이 이용, 대기 시간 바로 입장, 데이트, 친목, 연인・배우자, 친구",음악이 좋아요,21,1
1089404828,123****,너무 좋아요 맛도 있어요,2025-03-11,"저녁에 방문, 예약 없이 이용, 대기 시간 바로 입장, 데이트, 친목, 친구, 지인・동료",인테리어가 멋져요,13,2
1089404828,cog****,진짜 토스트 너무 맛있고 씨앗호떡도 너무 달달하고 맛있습니다 얘기 하기도 좋습니다!!!,2025-03-11,"밤에 방문, 예약 없이 이용, 대기 시간 바로 입장, 친목, 친구",음식이 맛있어요,1,1
1089404828,혜띰,맛있고 직원언니 넘 이뻐요..ㅎㅎ두부김치를 꼭 먹어야 됨싹싹김치됨,2025-03-09,"저녁에 방문, 예약 없이 이용, 대기 시간 바로 입장, 친목, 친구",친절해요,1,1
1089404828,jojole,마시써요,2025-03-08,"밤에 방문, 예약 없이 이용, 대기 시간 바로 입장, 데이트",기본 안주가 좋아요,14,1
1089404828,kwo****,,2025-03-08,"밤에 방문, 예약 없이 이용, 대기 시간 바로 입장, 친목, 친구",기본 안주가 좋아요,3,2
1089404828,쏭326,친구들끼리 술 마실 때 2차로 항상 오는 곳인데 두부김치가 진짜 맛있고 가상비 짱입니다 사진 찍을수도 잇고 포차 감성도 나고 꼭 오세요ㅜㅜㅜ,2025-03-08,"저녁에 방문, 예약 없이 이용, 대기 시간 바로 입장, 친목, 친구",음식이 맛있어요,14,1
1089404828,노승미니,직원이 친절하시고 음식 맛있어요~~,2025-03-08,"저녁에 방문, 예약 없이 이용, 대기 시간 바로 입장, 데이트, 연인・배우자",친절해요,16,1
1089404828,소멍이,좀 먹다가 찍어서 죄송해요ㅜㅜ 저 올때마다 묵사발 꼭 먹고요.. 근처 대학교 다녀서 학교 애들이 올때마다 묵사발은 꼭 시켜요!! 진짜 안주 너무 다 맛있고 직원분들도 너무 친절해요! 자주오고 있는데 저 자주 올 의미로 리뷰 적습니다 더더더욱 자주 오겠습니다❤️,2025-03-08,"저녁에 방문, 예약 없이 이용, 대기 시간 바로 입장, 친목, 친구",친절해요,28,1
1089404828,lub****,직원분들이 친절하시고 음식도 너무 맛있어요!!😍,2025-03-08,"저녁에 방문, 예약 없이 이용, 대기 시간 바로 입장, 친목, 친구",친절해요,13,1
1089404828,jan****,맛잇어요~~~,2025-03-08,"밤에 방문, 예약 없이 이용, 대기 시간 바로 입장, 친목, 연인・배우자, 친구",음식이 맛있어요,1,1
1089404828,송경훈6,분위기가 좋아요,2025-03-08,"밤에 방문, 예약 없이 이용, 대기 시간 바로 입장, 친목, 친구",음식이 맛있어요,28,1
1089404828,조성욱5110,사람들이 많은데 시끄럽지 않아서 얘기하기 편했어요 안주가 가격이 조금 나가서 부담스럽다고 느낄 수 있는데 양도 많고 엄청 맛있어요!!,2025-03-07,"아침에 방문, 예약 없이 이용, 대기 시간 바로 입장, 친목, 친구",음식이 맛있어요,8,3
1089404828,스크린마스터,친구들끼리 술 마시기 좋아요 분위기도 좋고 아늑해요!!,2025-03-05,"저녁에 방문, 예약 없이 이용, 대기 시간 바로 입장, 친목, 친구",음식이 맛있어요,14,2
1089404828,강민주8,너무 좋아요❤️❤️ 사랑? 스러운 대포.집,2025-03-02,"저녁에 방문, 예약 없이 이용, 대기 시간 바로 입장, 데이트, 친구",음악이 좋아요,9,1
1470461909,상큼133,맛있어요노원 맛집 강추,2025-04-09,"저녁에 방문, 대기 시간 바로 입장, 친목, 친구",음식이 맛있어요,14,1
1470461909,gog****,가격이 저렴하고 넘 맛있어요 특히 양념소갈비가 짱!,2025-04-08,"밤에 방문, 예약 없이 이용, 대기 시간 바로 입장, 데이트, 연인・배우자",매장이 청결해요,52,1
1470461909,아이스탑,신랑이랑 저녁메뉴 고민하다가 왔는데명성만큼 맛있네요!!꽃갈비 생 너무 맛나요😍청국장도 소주안주 굿소주3천원 최고!!! 술먹기 안성맞춤입니다👍👍👍,2025-04-08,"저녁에 방문, 예약 없이 이용, 대기 시간 바로 입장, 데이트, 연인・배우자",고기 질이 좋아요,39,1
1470461909,먹짱이뿌,여기는 서비스로 청국장이랑 콩나물국을 줘요. 근데 둘다 존맛. 불 상태도 좋고 후황도 상태 좋고 고기도 상태가 좋은 편이예요 !! 그리고 제일 중요한 소주가 3천뤈 !! 나이스 ! 청국장 무한리필이라 너무 좋고 맛도링,2025-04-08,"저녁에 방문, 예약 없이 이용, 대기 시간 바로 입장, 데이트, 연인・배우자",음식이 맛있어요,6,1
1470461909,개미부인,동네에 맛있는 고기집이 생겨서 너무 좋아요~ 가성비 좋고 주류 3천원이 무엇보다 맘에드네요,2025-04-08,"저녁에 방문, 예약 없이 이용, 대기 시간 바로 입장, 일상, 연인・배우자",음식이 맛있어요,148,1
1470461909,채원5780,일찍 와서 그런지 대기없이 이용할 수 있어서 좋았어요! 매장 내부 깨끗하고 직원분들도 친절하십니다!고기 맛있게 잘 먹었고 비빔공기밥도 맛있었습니다 추천!,2025-04-08,"점심에 방문, 예약 없이 이용, 대기 시간 바로 입장, 데이트, 가족모임, 부모님",음식이 맛있어요,14,1
1470461909,dae****,사장님 너무 친절하시고 음식도 신선하고 맛있어요👍,2025-04-08,"점심에 방문, 예약 없이 이용, 대기 시간 바로 입장, 친목, 일상, 친구",친절해요,2,1
1470461909,ps1****,양념소갈비살이랑 양념꽃갈비 먹었는데양념이 너무 맛있어요!!!자주올거같습니다,2025-04-07,"저녁에 방문, 예약 없이 이용, 대기 시간 바로 입장, 데이트, 연인・배우자",음식이 맛있어요,2,1
1470461909,gml****,너무너무 맛있어요! 콩나물국도 최고에옹,2025-04-07,"저녁에 방문, 예약 없이 이용, 대기 시간 바로 입장, 일상, 친구",음식이 맛있어요,25,1
1470461909,이경민616,보통 고기집오면 반찬 이것저것 세팅하면공간 부족해서 불편한데 여기는 넉넉하고앞접시가 특히 차려먹는 느낌나서 기분 좋네요직원분들도 친절하시고 고기도 너무 맛있어용❤️,2025-04-07,"저녁에 방문, 예약 없이 이용, 대기 시간 바로 입장, 데이트, 연인・배우자",친절해요,54,1
1470461909,kk****,잘먹었습니다 감사합니다!,2025-04-07,"저녁에 방문, 예약 없이 이용, 대기 시간 바로 입장, 데이트, 연인・배우자",음식이 맛있어요,5,1
1470461909,땡광87,지인소개로 오게 되었는데 사장님도 친절하고 구성이 너무 좋아요,2025-04-07,"저녁에 방문, 예약 없이 이용, 대기 시간 바로 입장, 일상, 부모님",음식이 맛있어요,12,1
1470461909,최정현448,직원들도 친절하고  주문시 바로 바로  빠릅니다~~ 음식도 맛있고   우선  청결하고 정갈하거 나와서 좋습니다^^,2025-04-07,"저녁에 방문, 예약 없이 이용, 대기 시간 바로 입장, 데이트, 연인・배우자",음식이 맛있어요,2,1
1470461909,ㅎㅎㅎㅎㅎㅎㅎ95,여긴언제나친절함고기도엄청맛잇어요그리고 청국장~~~짱이에욤,2025-04-07,"저녁에 방문, 예약 없이 이용, 대기 시간 바로 입장, 데이트, 연인・배우자",음식이 맛있어요,18,6
1470461909,lhj****,"고기도 고기대로 맛있고, 술쟁이로서 소주 얼음에 담아주는 친절함까지..너무좋습니다! 고기에서 냄새도안나고 맛있게 먹고갑니다~",2025-04-07,"저녁에 방문, 예약 없이 이용, 대기 시간 바로 입장, 친목, 친구, 지인・동료",음식이 맛있어요,8,1
1470461909,git****,항상 맛있게 먹는 동적깡통구이 오늘도 맛있게 잘 먹고 갑니다~!,2025-04-07,"저녁에 방문, 예약 없이 이용, 대기 시간 바로 입장, 회식, 지인・동료",친절해요,35,1
1470461909,김정규89,벌써 3번째 방문인데 너무 맛잇어요 ~~ 300번 방문할게요,2025-04-07,"저녁에 방문, 예약 없이 이용, 대기 시간 바로 입장, 친목, 지인・동료",음식이 맛있어요,2,1
1470461909,린짱1568,"돼갈만 먹다가 소먹으러 출동한날,고기 질은 육즙도 있고 맛이 괜찮았지만 젊은 여직원분 응대가 너무 미흡하고 별로였네요.청국장,김치국도 간이 적절하고 냉면도 나쁘지 않었습니다.하지만 고기양이 조금은 아쉬운듯요.",2025-04-06,"저녁에 방문, 예약 없이 이용, 대기 시간 바로 입장, 일상, 아이",고기 질이 좋아요,253,1
1470461909,1004 민양,고기 너뮤 맛있고 양도 많아요!! 이곳 알고나서 모임으로 자주오고 있어용,2025-04-06,"저녁에 방문, 예약 없이 이용, 대기 시간 바로 입장",음식이 맛있어요,10,1
1470461909,bookw,너무 맛있어요~  강추!!,2025-04-06,"저녁에 방문, 예약 없이 이용, 대기 시간 바로 입장, 데이트, 연인・배우자",음식이 맛있어요,1,1
1470461909,Chic Seung,굿입니다~~~자주이용하께용~~~💋,2025-04-06,"저녁에 방문, 예약 없이 이용, 대기 시간 10분 이내, 친목, 친구",음식이 맛있어요,590,1
1470461909,밍밍273,원래 본점에서먹고 맛있어서 한번씩가는데 동네에 생겨서 너무 좋아요!청국장도 너무맛있어요 올때마다 밥 한공기 비벼먹어요ㅎㅎ다음에 또올게요😆,2025-04-06,"저녁에 방문, 예약 없이 이용, 대기 시간 바로 입장, 데이트, 연인・배우자",음식이 맛있어요,25,1
1470461909,이이잉86,저번에 친구랑 먹으러왔는데 맛있어서 또 먹으러왔어요! 항상 친절하고 맛있어서 좋아요다음에 또 먹으러올게요오!,2025-04-06,"저녁에 방문, 예약 없이 이용, 대기 시간 바로 입장, 친목, 친구",음식이 맛있어요,14,1
1470461909,시지프스3332,우와아아아여기 대박임!양도 양이고 맛도 맛이고같이온 동생이 추천해서 와봤는데노원 갈비살은 여기가 다 이김 !!!!,2025-04-06,"저녁에 방문, 예약 없이 이용, 대기 시간 바로 입장, 데이트, 연인・배우자",음식이 맛있어요,2,1
1470461909,ssebbing79,노원직영점 생겨서 너무 좋네요본점이랑 맛 똑같고 친절하고 맛있어요!청국장서비스 최고!,2025-04-06,"저녁에 방문, 예약 없이 이용, 대기 시간 바로 입장, 데이트, 연인・배우자",음식이 맛있어요,12,1
1470461909,이하영1583,"직장 동료분이 추천해줘서 먹으러 왔어요~갈비살은 양념이 맛있고 꽃갈비는 생이 맛있다고 해서 반반메뉴로 시켰는데, 너무 맛있었어용맛있었어용꽃갈비가 생이라서 먼저 구웠는데 진짜 맛있고 눈 뜨이는 소고기 맛이었고, 양념소갈비는 약간 잘 느껴보지 못한 식감의 부드러운 고기입니다고기입니다 넘넘 맛있어요 추가로 꼬불살도 먹어봤는데 껍데기에 살이 붙어있는 느낌입니다여기도 또 와서 메뉴 다 먹어보고 싶은 곳~!잘 먹었습니다",2025-04-06,"저녁에 방문, 예약 없이 이용, 대기 시간 바로 입장, 데이트, 연인・배우자",음식이 맛있어요,21,1
1470461909,cutycuty9791,고기 좋고 양념갈비 무슨 맛?죽여주는 맛진짜 맛집!!!,2025-04-06,"점심에 방문, 예약 없이 이용, 대기 시간 바로 입장, 나들이, 연인・배우자",음식이 맛있어요,5,1
1470461909,cgy****,잘 먹었슴다,2025-04-05,"저녁에 방문, 예약 없이 이용, 대기 시간 10분 이내, 일상, 친구",음식이 맛있어요,20,1
1470461909,ehd****,너무 맛있어요!,2025-04-05,"저녁에 방문, 예약 없이 이용, 대기 시간 10분 이내, 가족모임, 부모님",음식이 맛있어요,7,1
1470461909,조민정8291,지난번엔 소갈비 먹고 맛잇어서 이번엔 삼겹 시켜봣는데 삼겹살도 맛잇네요!! 냉면도 맛잇고 가족끼리 외식하기 좋아요,2025-04-05,"저녁에 방문, 예약 없이 이용, 대기 시간 10분 이내, 일상, 부모님",음식이 맛있어요,27,2
1470461909,pak****,양념이 너뮤 맛있어요!,2025-04-05,"저녁에 방문, 예약 없이 이용, 대기 시간 바로 입장, 친목, 친구",음식이 맛있어요,4,1
1470461909,wls****,소갈비살 맛있어서 두번째 방문 입니다^^  직원분들 친절하시고 고기 진짜 맛있어요♡  비냉도 맛나네요  ㅋㅋ 또 올께요~♡♡♡,2025-04-05,"저녁에 방문, 예약 없이 이용, 대기 시간 바로 입장, 일상, 연인・배우자",음식이 맛있어요,10,2
1470461909,kor****,,2025-04-05,"저녁에 방문, 예약 없이 이용, 대기 시간 바로 입장, 데이트, 연인・배우자",음식이 맛있어요,1,1
1470461909,Byeongjo Kim,돼지갈비 엄청 맛있습니다. 사장님들도 친절하시고 친구들과 좋은 시간 보냈습니다 종종 방문하겠습니다,2025-04-05,"저녁에 방문, 예약 없이 이용, 대기 시간 바로 입장, 친목, 친구",음식이 맛있어요,27,1
1470461909,룰랄 룰랄,노원 소고기는 동적이죠!! 부모님도 아이도 다 만족하는 맛이에요>_< 직원분들 친절도랑 센스도 짱 👍🏼 아이랑 와도 눈치안보고 밥먹기 좋은곳이에요!!,2025-04-04,"밤에 방문, 예약 없이 이용, 대기 시간 바로 입장, 가족모임, 아이, 부모님",음식이 맛있어요,276,2
1470461909,로제타6,또 저번이랑 같이 비가 오는 밤거리에 육향에 이끌려 들어와버렸습니다. 비올때마다 생각날거같습니다 너무 맛있어요 번창하세요,2025-04-04,"밤에 방문, 예약 없이 이용, 대기 시간 바로 입장, 가족모임, 연인・배우자, 부모님",음식이 맛있어요,6,2
1470461909,윤둥이973,"고기가 맛있고, 친절해요",2025-04-04,"저녁에 방문, 예약 없이 이용, 대기 시간 바로 입장, 나들이, 부모님",친절해요,3,1
1470461909,룰룰루ㅜㄹㄹ,양도 많고 맛있어요❤️ 오랜만에 왔는데 다들 여전히 친절하시고 맛도 조아서 만족스러워요❤️❤️,2025-04-04,"저녁에 방문, 예약 없이 이용, 대기 시간 바로 입장, 데이트, 연인・배우자",친절해요,16,2
1470461909,jmj****,친구랑 처음 왔는데 진짜진짜 맛있고요직원분들 너무 친절해서 행복한 저녁식사 할  수 있었습니다!!,2025-04-04,"저녁에 방문, 예약 없이 이용, 대기 시간 10분 이내, 친목, 친구",음식이 맛있어요,12,1
1470461909,nog****,"꺄! 재방문입니다!!! 이번에는 돼갈돼갈! 돼지갈비를 고고싱!!!! 한가지 메뉴가 맛잇으면, 다른 메뉴도 맛있는 법!!! 역시 단짠단짠 돼갈 너무 맛잇어요! 다행히 웨이팅 피해서, 샤샥 앉아서 야무지게 먹었습니다!ㅋㅋ😉",2025-04-04,"저녁에 방문, 예약 없이 이용, 대기 시간 바로 입장",음식이 맛있어요,20,2
1470461909,kat****,또왔어요 두판~🥰,2025-04-04,"저녁에 방문, 예약 없이 이용, 대기 시간 30분 이내, 가족모임, 부모님",음식이 맛있어요,4,3
1470461909,노란산책,전체 구성 다 맛있어요,2025-04-04,저녁에 방문,음식이 맛있어요,551,1
1470461909,GURE,가성비좋고 넘 맛있어서 가족들과 다시갈거에요.,2025-04-04,"저녁에 방문, 예약 없이 이용, 대기 시간 10분 이내, 데이트, 연인・배우자",음식이 맛있어요,5,1
1470461909,god****,고기 질이 너무 좋고 육즙도 미쳤고 너무 맛있어요!! 또 방문할 겁니다 ㅎㅎ 다들 노원 오시면 소갈비 먹으러 꼭 오세요! 직원분들도 너무 친절합니다😊,2025-04-03,"밤에 방문, 예약 없이 이용, 대기 시간 바로 입장, 데이트, 연인・배우자",음식이 맛있어요,2,1
1470461909,samset,맛있는 고기♡친절한 종업원♡재방문 100%  입니다대박나세요♡,2025-04-03,"저녁에 방문, 예약 없이 이용, 대기 시간 바로 입장, 친목, 친구",음식이 맛있어요,4,1
1470461909,기자99,질좋은 고기와 숯불향이 끝내줍니다.맛있어요~~,2025-04-03,"저녁에 방문, 예약 없이 이용, 대기 시간 바로 입장, 가족모임, 부모님",음식이 맛있어요,15,1
1470461909,lov****,,2025-04-03,"저녁에 방문, 예약 없이 이용, 대기 시간 10분 이내, 데이트, 연인・배우자",음식이 맛있어요,7,1
1470461909,joj****,고기 너무 맛있습니다!^^ 갈비살 저렴한 가격에 배 부르게 먹었습니다!,2025-04-02,"밤에 방문, 예약 없이 이용, 대기 시간 10분 이내, 가족모임, 부모님",음식이 맛있어요,10,1
1470461909,uy****,맛있습니당-!,2025-04-02,"저녁에 방문, 예약 없이 이용, 대기 시간 바로 입장, 가족모임, 부모님",음식이 맛있어요,1,1
1470461909,mim199,양념이 완전 맛잇어요!! 밑반찬도 맛있고 청국장도 맛있습니당:),2025-04-02,"저녁에 방문, 예약 없이 이용, 대기 시간 바로 입장, 일상, 지인・동료",친절해요,20,1
1470461909,웽웽6780,지나갈때마다 매번 줄서있더라고요.너무 맛있고 육즙이 팡창 터져요~!! 고기가 부족하지 않은데 넘 맛있어서 혀씹을수있으니 조심히 드세요>_<마지막사진은 넘귀여운 울애기사진 한장 올려요ㅎ0ㅎ,2025-04-02,"저녁에 방문, 예약 없이 이용, 대기 시간 바로 입장, 데이트, 연인・배우자",음식이 맛있어요,1,1
