place_id,nickname,content,date,situations,keywords,review_count,visit_count
1609580558,san****,,2025-03-15,"저녁에 방문, 예약 없이 이용, 대기 시간 바로 입장, 가족모임, 아이",음식이 맛있어요,20,6
1609580558,no1****,불친절하고 셀프바에 야채는 채워져 있지도 않고 음식도 맛없어서 돈가스 반 이상 남겼어요. 음식 기다리는데 수저 채워 넣으면서 자리로 왔다갔다 신경쓰이고 여러가지로 다시 방문하고 싶지 않은 느낌을 받았습니다.,2025-03-15,"점심에 방문, 예약 없이 이용, 대기 시간 바로 입장, 일상, 부모님",,1,1
1609580558,기례지,집 앞에 있어서 너무 좋어요!항상 맛있습니다 ㅎㅎ,2025-03-15,"점심에 방문, 예약 없이 이용, 대기 시간 바로 입장, 일상, 부모님",친절해요,30,5
1609580558,Just Do It Now,맛있어요!,2025-03-15,"점심에 방문, 예약 없이 이용, 대기 시간 바로 입장, 일상, 혼자",음식이 맛있어요,21,3
1609580558,ans****,맛있게 잘 먹었어요 우리 동네 가성비 맛집 입니다,2025-03-15,"점심에 방문, 예약 없이 이용, 대기 시간 바로 입장, 지인・동료",음식이 맛있어요,42,12
1609580558,biisangoo78,오늘도 음식 재료는 신선하고 맛있습니다!,2025-03-14,"저녁에 방문, 예약 없이 이용, 대기 시간 바로 입장, 친목, 아이",음식이 맛있어요,13,5
1609580558,메이퀸1,맛있어서 또 왔습니다~~또 먹어도 맛있네요,2025-03-14,"저녁에 방문, 대기 시간 바로 입장, 데이트, 연인・배우자",음식이 맛있어요,27,2
1609580558,juh****,,2025-03-14,"저녁에 방문, 예약 없이 이용, 대기 시간 바로 입장, 일상, 연인・배우자",음식이 맛있어요,3,1
1609580558,훈이훈85,돈가스 너무 맛있어요벌써 3번째 방문입니다또올게요,2025-03-14,"점심에 방문, 예약 없이 이용, 대기 시간 바로 입장, 친목, 친구",음식이 맛있어요,26,4
1609580558,jes****,두번째 왔는데 너무 맛있고 친절하셔서 정말 맛있게 먹고 갑니다ㅜㅜ다음에 또 먹으러 오겠습니다ㅎㅎ,2025-03-14,"점심에 방문, 예약 없이 이용, 대기 시간 바로 입장, 일상, 혼자",음식이 맛있어요,18,2
1609580558,oop****,깔끔해서 너무좋아용음식도 마싯습니다,2025-03-13,"점심에 방문, 예약 없이 이용, 대기 시간 바로 입장, 일상, 혼자",음식이 맛있어요,20,7
1609580558,soccer s2,저번에 너무 맛있어서 또 왔어요 !,2025-03-12,"저녁에 방문, 예약 없이 이용, 대기 시간 바로 입장, 친목, 친구",음식이 맛있어요,569,1
1609580558,jan****,,2025-03-12,"저녁에 방문, 예약 없이 이용, 대기 시간 바로 입장, 친목, 아이",음식이 맛있어요,4,1
1609580558,또옹띵,치과올때마다 들르는 옥수역 백소정입니다.오늘도 정갈하게 잘 나오네요.,2025-03-12,"저녁에 방문, 예약 없이 이용, 대기 시간 바로 입장, 일상, 아이",음식이 맛있어요,8,2
1609580558,lhy291,"백소정 옥수역점 N번째 방문입니다 - ♥︎돈카츠와 우동, 마제소바가 땡기는 날에 방문하면 만족감을 느끼며 식사하실 수 있는 음식점이에요.옆동네 신금호에 살고 있지만 거리가 조금 있더라도 돈가스 먹고 싶은 날에 버스 타고 방문하는 곳이에요 :)점심시간 대에 일하시는 안경 쓰신 어머님이 너무 상냥하셔서 기분이 좋아지는 곳이에요. 어머님 계신 날에만 방문하고 싶을 정도입니다 - !!우동도 너무 뜨끈하고 카츠도 바삭해서 맛있어요 👍🏻",2025-03-12,"점심에 방문, 예약 없이 이용, 대기 시간 바로 입장, 일상, 혼자",매장이 넓어요,45,4
1609580558,현준맘43,맛있어요😄,2025-03-11,"점심에 방문, 예약 없이 이용, 대기 시간 바로 입장, 일상, 혼자",음식이 맛있어요,8,7
1609580558,김동환1276,혼밥하기 좋을거같고 메뉴도 상당히 많습니다.,2025-03-11,"점심에 방문, 예약 없이 이용, 대기 시간 바로 입장, 데이트, 연인・배우자",컨셉이 독특해요,24,1
1609580558,eodrmfdl61,제 점심짝꿍 음식점 이예요~!일주일에 최소 2번은 오는것 같네요,2025-03-11,"점심에 방문, 예약 없이 이용, 대기 시간 바로 입장, 일상, 연인・배우자",친절해요,40,10
1609580558,soy****,맛있어요:),2025-03-10,"점심에 방문, 예약 없이 이용, 대기 시간 바로 입장, 일상, 혼자",음식이 맛있어요,26,7
1609580558,lhy291,백소정 3번째 방문이에요 ♥︎전에 친구랑 치즈돈가스를 나눠먹은 게 생각이 나서 재방문했어요 !! 맛있었던 게 생각나서 버스 타고 왔어요 ㅎㅎ 저녁 시간대라 그런지 가족단위 손님이 많았어욤 특히 어린아이 손님이 많았어요,2025-03-09,"저녁에 방문, 예약 없이 이용, 대기 시간 바로 입장, 일상, 혼자",음식이 맛있어요,45,3
1609580558,박승열67,"아이가 좋아해서 종종 찾는 곳 입니다.음식이 깔끔하고 홀이 넓고 친절해서 좋아요.양배추, 밥 필요한 만큼 리필할 수 있어서 좋아요~",2025-03-08,"저녁에 방문, 예약 없이 이용, 대기 시간 바로 입장, 일상, 아이",음식이 맛있어요,10,1
1609580558,초디,,2025-03-08,"점심에 방문, 예약 없이 이용, 대기 시간 바로 입장, 일상, 연인・배우자, 아이",음식이 맛있어요,29,1
1609580558,재민몬,너무 맛있습니다 !!,2025-03-08,"점심에 방문, 예약 없이 이용, 대기 시간 바로 입장, 일상, 혼자",음식이 맛있어요,24,2
1609580558,passionist39,등심돈까스랑 마제소바 시켰습니다! 새우튀김은 영수증 리뷰 서비스로 주신거에요! 감사히 잘 먹겠습니다!,2025-03-08,"점심에 방문, 예약 없이 이용, 대기 시간 바로 입장, 데이트, 연인・배우자",음식이 맛있어요,12,1
1609580558,세키시74,양 많고 맛있음돈까스 바삭바삭,2025-03-08,"점심에 방문, 예약 없이 이용, 대기 시간 10분 이내, 친목, 친구",음식이 맛있어요,534,1
1609580558,구래뇨고,너무 맛있어서 자주 옵니다 항상 맛이 일정해요 !,2025-03-07,"저녁에 방문, 예약 없이 이용, 대기 시간 바로 입장, 나들이, 연인・배우자",인테리어가 멋져요,18,5
32085211,사랑해0917,요조아요,2025-02-19,점심에 방문,음식이 맛있어요,424,7
32085211,희망범띠,맛있어요,2025-02-08,"점심에 방문, 예약 없이 이용, 대기 시간 바로 입장, 일상, 연인・배우자, 친척・형제",음식이 맛있어요,1439,2
32085211,JYP8549,돌솥밥 맛있고 친절~~,2025-01-23,"점심에 방문, 예약 없이 이용, 대기 시간 바로 입장, 일상, 지인・동료",음식이 맛있어요,1647,1
32085211,한결같이기록하는한량,지난해에 다녀오고 음식이 맛있어서 이번에 딸 데리고 가서 먹었는데 여전히 맛있는 돌솥밥집. 찰밥돌솥도 맛있고 반찬도 맛있고 불고기전골도 맛있습니다. 다음에도 재방문할 듯요. 가족모임 장소로도 추천해요.,2025-01-02,"저녁에 방문, 예약 없이 이용, 대기 시간 바로 입장, 일상, 연인・배우자, 아이",매장이 넓어요,1617,2
32085211,희망범띠,좋아요,2024-12-15,"점심에 방문, 예약 없이 이용, 대기 시간 바로 입장, 일상, 연인・배우자",음식이 맛있어요,1439,1
32085211,사랑해0917,요조아요,2024-12-10,점심에 방문,음식이 맛있어요,424,6
32085211,장승훈,가게 앞에 차를 대면 사장님이 주차해주심 발렛비 1천원열몇가지 반찬이 나오는 곳음식들이 다 맛있고 특히 솥밥에 해서인지 밥이 정말 맛있음반찬들 판매도 해서 4천원짜리 진미채 한번 사와봤어요 매콤한게 맛있네요맛있는 게 먹고싶은데 딱 생각나는 메뉴가 없는날 가기 좋을듯,2024-12-08,"저녁에 방문, 예약 없이 이용, 대기 시간 바로 입장, 일상, 연인・배우자",음식이 맛있어요,106,1
32085211,Ms59,돌솥밥에 반찬들 맛있게 먹었어요,2024-11-26,"점심에 방문, 예약 없이 이용, 대기 시간 바로 입장, 나들이, 지인・동료",음식이 맛있어요,2659,1
32085211,ros****,음식 깔끔하고 맛있어요. 완전 집밥의 명소입니다. 잔치상 받은 기분이며 반찬마다 맛있었습니다.  또 가고 싶을것입니다^^,2024-11-25,"저녁에 방문, 예약 없이 이용, 대기 시간 바로 입장, 친목, 친구",음식이 맛있어요,884,5
32085211,주원9141,반찬도 다양하고  지난번엔  장모님정식 먹었는데  불고기도 즉석이라 맛있어요   솥밥이  정말  밥이 맛있어요  ^^,2024-11-14,"점심에 방문, 예약 없이 이용, 대기 시간 바로 입장, 일상, 아이",음식이 맛있어요,378,1
32085211,tnr****,밥이 정말 찰지고 너무 맛있었던곳^^,2024-11-11,"저녁에 방문, 예약 없이 이용, 대기 시간 바로 입장, 친목, 지인・동료",매장이 넓어요,668,1
32085211,dud****,좋아요,2024-10-29,"점심에 방문, 예약 없이 이용, 대기 시간 바로 입장, 나들이, 부모님",음식이 맛있어요,855,1
32085211,그거나죠,가끔 가는곳 가격은 좀 있지만 따뜻한 나물 한식 좋습니다그렇게 친절하지는 않은것 같아요,2024-10-16,"저녁에 방문, 예약 없이 이용, 대기 시간 바로 입장, 일상, 지인・동료",음식이 맛있어요,63,1
32085211,구수동천은정78,친절해요,2024-10-14,저녁에 방문,친절해요,329,11
32085211,사랑해0917,요조아요,2024-10-14,점심에 방문,음식이 맛있어요,424,5
32085211,고도리야,반찬이 자극적이지 않고 맛나요밥 양이 좀더 많으면 조켔어요밥도둑 반찬이 많습니다,2024-10-09,저녁에 방문,음식이 맛있어요,967,1
32085211,한결같이기록하는한량,가보자 가보자 하다 1년만에 갔는데 음식이 맛있습니다. 매장도 넓어서 단체모임하기 좋을 듯 싶고 발레주차도 해줍니다. 불고기정식 먹었는데 버섯불고기도 맛있고 각 반찬 모두 맛있는 집이라 재방문이 확실합니다. 주변 주민들이 많이 오는 맛집 같습니다.,2024-10-03,"저녁에 방문, 예약 없이 이용, 대기 시간 바로 입장, 데이트, 연인・배우자",음식이 맛있어요,1617,1
32085211,LALA LA,😅😅😅😅😅😅😅😅,2024-09-30,"점심에 방문, 예약 없이 이용, 대기 시간 바로 입장, 친목, 친구",향신료가 강하지 않아요,1055,1
32085211,사랑해0917,요조아요,2024-09-13,점심에 방문,음식이 맛있어요,424,4
32085211,나무서기,,2024-09-07,"점심에 방문, 예약 없이 이용, 대기 시간 바로 입장, 지인・동료",인테리어가 멋져요,144,1
32085211,kyc****,굿굿,2024-09-07,"점심에 방문, 예약 후 이용, 대기 시간 바로 입장, 친목",음식이 맛있어요,2479,2
32085211,젊은할머니,맛있어요,2024-09-07,점심에 방문,음식이 맛있어요,1370,1
32085211,ryu****,맛있어요,2024-09-06,"저녁에 방문, 예약 없이 이용, 대기 시간 바로 입장, 친목, 지인・동료",음식이 맛있어요,243,1
32085211,사랑해0917,요조아요,2024-09-04,점심에 방문,음식이 맛있어요,424,3
32085211,구수동천은정78,친절해요,2024-09-01,"점심에 방문, 예약 후 이용, 대기 시간 10분 이내, 지인・동료",친절해요,329,10
32085211,042****,맛있고 친절해요,2024-08-31,"점심에 방문, 대기 시간 바로 입장, 친목, 친구",음식이 맛있어요,305,2
32085211,사랑해0917,조아요,2024-08-27,점심에 방문,음식이 맛있어요,424,2
32085211,먹방에진심,한정식 먹고싶어서 갔는데 반찬도 잘나오고 가짓수도 많아서 다양하게 먹을 수 있어 좋았어요~엄마 모시고 갔는데 맛있다며 엄청 잘 드시더라고요👍🏻돌솥밥이 엄청 찰지고 맛있어요 밥에서 윤기가 굿..!반찬 간도 딱 맞고 가성비 너무 좋은 것 같아여~식당도 넓어서 모임하기에도 최고~~~🧡,2024-08-26,"점심에 방문, 예약 없이 이용, 대기 시간 바로 입장, 일상, 부모님",음식이 맛있어요,223,1
32085211,사랑해0917,조아요,2024-08-21,점심에 방문,음식이 맛있어요,424,1
32085211,호호하하6127,요즘 같이 무더운 날! 덥고 습해서 기운이 없을 때 든든하고 건강한 한끼로 최고였어요!! 평소 외식을 할 때 한식은 잘 안 먹는데 이 날은 정말 맛있게 먹고 왔어요!! 집에서 만들어 먹기 힘든 수많은 나물 반찬은 간도 적절하고 맛있습니다! 마지막으로 든든하게 돌솥밥까지 먹으니 너무 행복했어요!!!,2024-08-20,"저녁에 방문, 예약 후 이용, 대기 시간 바로 입장, 데이트, 연인・배우자",음식이 맛있어요,33,1
32085211,psh****,부모님이랑 아기랑 방문했는데 모두를 만족시킨 집이에요! 돌솥밥에 음식도 맛있어서 다들 맛있다고 그러더라고요~ 사장님도 친절하시고 추천합니다!,2024-08-18,"점심에 방문, 예약 없이 이용, 대기 시간 바로 입장, 일상, 부모님",아이와 가기 좋아요,45,1
32085211,유후패밀리,반찬이 자극적이지 않아 좋아요담백하고 맛있어요~,2024-08-12,"저녁에 방문, 예약 없이 이용, 대기 시간 바로 입장, 일상, 아이, 부모님",재료가 신선해요,158,1
32085211,구수동천은정78,친절해요,2024-08-12,"점심에 방문, 대기 시간 10분 이내, 친목, 친구",친절해요,329,9
32085211,글만두,한국인은 밥심 아닙니까. 옥수역 맛집으로 강추드립니다. 그냥 먹어도 맛있는 밥과 호불호 없이 맛깔스런 반찬까지 한끼 든든히 먹이 좋은 곳입니다. 추천이요!,2024-07-31,"저녁에 방문, 예약 없이 이용, 대기 시간 바로 입장, 친목, 친구",음식이 맛있어요,44,1
32085211,뭉치4448,버섯불고기 정식 시켯는데 양도 많도 한상 대접받는 기분들어 맛있게먹었습니다. 가게 엄청 넓어서 단체모임에도 좋아보여요. 다음에는 게장정식으로 먹어봐야겠습니다  반찬도 12가지나 나오고 먹을거 많아 좋았어요 전주본가 영양돌솥밥 옥수동맛집 추천합니다,2024-07-29,"저녁에 방문, 예약 없이 이용, 대기 시간 바로 입장, 친목, 지인・동료",음식이 맛있어요,97,1
32085211,dkdkdkek12,전라도 전주 돌솥밥의 정석! 돌게장까지 10첩반상 반찬들 모두 다 맛있고 부모님도 너무 만족해하셨습니다 다음번에 불고기정식먹으러 갈게요👍,2024-07-28,"점심에 방문, 예약 없이 이용, 대기 시간 바로 입장, 데이트, 가족모임, 부모님",매장이 넓어요,81,1
32085211,구수동천은정78,친절해요,2024-07-27,점심에 방문,친절해요,329,8
32085211,bae****,솥밥과 여러가지 반찬을 함께 먹을수 있는 한정식스타일이라 고루고루 맛볼수 있어 넘 좋아요^^ 신발벗고 들어가는매장 이라 바닥도 깨끗합니다,2024-07-24,"저녁에 방문, 예약 후 이용, 대기 시간 10분 이내, 일상, 친구",음식이 맛있어요,2772,1
32085211,구수동천은정78,친절해요,2024-07-24,점심에 방문,친절해요,329,7
32085211,yulllllll2,건강하고 맛난 한정식입니다 추천이요^^,2024-07-23,"저녁에 방문, 예약 후 이용, 대기 시간 바로 입장, 가족모임, 연인・배우자, 부모님",음식이 맛있어요,12,1
32085211,mehorey,찰솥밥정식 2인 먹고 왔습니다~반찬이 진짜 진짜 맛있어요!!3팩에 만원에 판다는데 이번주는 약속이 있어 패스하고담주에 반찬 사러 와야할것같아요.. 뭐 하나 안빠지고싹다 맛있습니다 진짜.. 담번엔 부모님 모시고오려구요*^^* 잘 먹고 갑니다~~,2024-07-19,"저녁에 방문, 예약 후 이용, 대기 시간 바로 입장, 일상, 연인・배우자",음식이 맛있어요,49,1
32085211,sunorita,건강한 옥수역 맛집으로 최고에요. 인근 주민들한테 유명한 이유가 있네요. 밥이 일단 찰솥밥이구요. 게장도 달아요!,2024-07-13,"점심에 방문, 예약 없이 이용, 대기 시간 바로 입장, 데이트, 연인・배우자",음식이 맛있어요,929,1
32085211,레몬필드,밑반찬이 하나 하나 다 너무 맛있어요. 엄마가 드시는 내내 맛있다고 계속 이야기하셨어요. 결국 반찬까지 사들고 나왔습니다. 가족모임은 계속 여기서 해야겠어요!!!! 어르신들 모임하시기도 너무 좋을것 같아요!,2024-07-11,"점심에 방문, 예약 후 이용, 대기 시간 바로 입장, 가족모임, 부모님",음식이 맛있어요,19,1
32085211,042****,최고입니다,2024-07-05,"점심에 방문, 예약 후 이용, 대기 시간 10분 이내, 나들이, 친구",음식이 맛있어요,305,1
32085211,기린리뷰,푸짐한 밥상 좀 보세요 밥도 고슬고슬하고 된장찌개 조미료 없이 완전 진한 맛입니다 여기는 무조건 와야해여,2024-07-01,"저녁에 방문, 예약 후 이용, 대기 시간 바로 입장, 데이트, 연인・배우자",음식이 맛있어요,456,1
32085211,희쭈,엄마가 좋아하셨구요! 다음 엄마 친구분들 모임장소는 여기로 바로 정하셨대요~~ ㅎㅎ 한정식 배부르게 잘 먹고 왔습니다 반찬 완전 푸짐함,2024-06-26,"저녁에 방문, 예약 없이 이용, 대기 시간 바로 입장, 일상, 부모님",단체모임 하기 좋아요,158,1
32085211,구수동천은정78,친절해요,2024-06-25,"저녁에 방문, 예약 후 이용, 대기 시간 10분 이내, 데이트, 연인・배우자",친절해요,329,6
32085211,구수동천은정78,친절해요,2024-06-24,"점심에 방문, 예약 없이 이용, 대기 시간 바로 입장, 나들이",친절해요,329,5
32085211,만두조아아,음식이 정갈하고 다 맛있어요!매장도 넓어서 어른들과의 식사로는여기가 제격입니다 다음번엔 버섯불고기 도전할께요,2024-06-22,"점심에 방문, 예약 없이 이용, 대기 시간 바로 입장, 일상, 부모님",친절해요,128,1
32085211,wo****,"옥수동 인근에 있는 맛집이라고 해서 찾아왔어요 찰솥밥 먹어봤는데 반찬이 하나같이 맛있었어요 그리고 밥도 질지 않고 쫄깃하고 맛있었고, 숭늉도 고소하고 맛있었습니다. 반찬이 맛있어서 밥이 모자랄까봐 걱정했네요. 다 먹었을 때엔 엄청 만족한 식사였고 반찬도 3팩에 만 원씩 팔고 계시길래 구매하고 나왔습니다 건강하고 맛있는 한식 찾으신다면 추천드려요!",2024-06-17,"점심에 방문, 예약 없이 이용, 대기 시간 바로 입장, 데이트, 일상, 연인・배우자",음식이 맛있어요,341,1
32085211,art4love,옥수동 노포버섯불고기 정식 추천찬 정갈하고 모두 맛있다,2024-06-16,"점심에 방문, 예약 후 이용, 대기 시간 바로 입장, 일상, 지인・동료",음식이 맛있어요,2205,1
32085211,구수동천은정78,친절해요,2024-06-14,"저녁에 방문, 예약 후 이용, 대기 시간 바로 입장, 나들이",친절해요,329,4
32085211,김들2,반찬이 많이 나오는데 하나하나 다 맛있어요ㅎㅎ기본정식을먹어도 충분하지만 돌게장이 맛있으니 장모님정식을 추천합니다혼자와서 불고기 정식드시는 분들도 꽤 있는걸 보아 혼자여도한상 푸짐하게 먹을 수 있는 곳 좋아요🥳 그리고 공깃밥도윤기없는 밥이 아니라 추가해도 잘먹었어요ㅎㅎ,2024-06-11,"저녁에 방문, 예약 후 이용, 대기 시간 바로 입장, 가족모임, 부모님",음식이 맛있어요,223,1
32085211,민트시은,보글보글 시골된장으로 끓인 된장찌개(된장국)와조물조물 담백하게 무쳐낸 나물반찬에김이 모락모락 나는 찰솥밥과갖은 재료들의 맛이 녹아든 소불고기까지맛깔스럽게 차려진 푸짐한 한상차림을 맛볼수 있는27년 전통 한정식 전문점 전주본가영양돌솥밥가지수 채우기 용 아닌하나하나 손이가는 아이들로 채워진 정갈한 기본찬에단짠 밸런스 좋은 양념옷을 입은 소고기에쫄깃한 식감이 일품인 새송이 · 느타리 · 팽이버섯을 비롯알배추 · 청경채 · 당면 · 떡국 등등다양한 재료구성에 보기만해도 든든해지는 버섯소불고기화룡점정 갓 지은 윤기 좌르륵 고슬고슬 찰솥밥까지너무너무 맛있게 잘 먹었습니다!!^^,2024-06-08,"점심에 방문, 예약 없이 이용, 대기 시간 바로 입장, 일상, 부모님",음식이 맛있어요,276,1
32085211,kkk9320,집밥처럼 정성 들어간 반찬들.,2024-06-06,"저녁에 방문, 예약 후 이용, 대기 시간 바로 입장, 나들이, 친구",음식이 맛있어요,510,1
32085211,구수동천은정78,친절해요,2024-06-02,점심에 방문,친절해요,329,3
32085211,kj4****,반찬이 간이 맞고  자연 맛 그대로ㆍ사장님이 음식에 대한 자부심도 대단하시지만  음식맛도 대단하네요ㆍ남여노소 누구에게도 자신있게 추천합니다ㆍ,2024-06-01,"점심에 방문, 예약 후 이용, 대기 시간 10분 이내, 나들이, 부모님",음식이 맛있어요,1012,1
32085211,메리리s,"와 진짜 데이트하다가 우연히 들렀는데 정말정말정말 깜작 놀랄만한 맛집을 발견했네요. 솥밥에 반찬이 10가지가 넘는 전부 사장님께서 손수 만드신 반찬에 집된장까지! 기대없이 방문했다가 단골이 되어버릴것 같우 맛집이었습니다!!특히, 나물반찬이 정말 맛있었어요 :) 남편이 대화도 제대로 안하고 음식에 집중하는거 보고 찐맛집인거 인증했습니다ㅎㅎ 옥수역 인근 최고의 한식집, 전주본가영양돌솥밥 추천합니다!!",2024-05-31,"저녁에 방문, 예약 없이 이용, 대기 시간 바로 입장, 데이트, 연인・배우자",음식이 맛있어요,141,1
32085211,syd****,굿.추천해요.,2024-05-31,"점심에 방문, 예약 없이 이용, 대기 시간 바로 입장, 데이트, 연인・배우자",음식이 맛있어요,21,1
32085211,unni280,"반찬 찐맛집인 곳 👏🏻👏🏻밥에 자부심 있으신 곳인데 이해가 되는 맛이다 맛있는 반찬 참 많았지만 굳이 5가지 고르자면 얼갈이 된장 무침, 열무 김치, 가지 나물, 회 무침, 된장국 🫶🏻🫶🏻 정말 맛있게 먹었다 집밥이 그리울 때 오면 야무지게 먹고갈 곳 ! 또 생각 날 것 같당 🥲🩶",2024-05-30,저녁에 방문,친절해요,101,1
32085211,아로미32조,"장모님 정식~돌솥밥에 ( 게장, 보쌈..)반찬들 맛있어요 ~",2024-05-27,"저녁에 방문, 예약 없이 이용, 대기 시간 바로 입장, 일상, 기타",음식이 맛있어요,1659,1
32085211,kimjihye73,좋아요,2024-05-26,점심에 방문,음식이 맛있어요,1729,1
32085211,냠냠냠냠냠얌얌얌,돌솥밥이 너무 맛있는 식당이었어요👍그리고 반찬들도 알차고 너무 자극적이지 않으면서도 맛있어서 먹고나서 속도 편해 집밥 먹은 기분이라 좋았어요❣️,2024-05-25,"저녁에 방문, 예약 없이 이용, 대기 시간 바로 입장, 데이트, 연인・배우자",음식이 맛있어요,414,1
32085211,박애은,옥수동 맛집이에요! 반찬이 다양하고 양도 많아 진짜 한 끼 잘 드실 수 있습니다. 간장게장도 많이 안 짭고 신선해요. 다른 반찬들도 다 맛있어서 냉장고 비우고 반찬 사러 가려구요. 근처 사시는 분은 반찬이라도 하나 구매해보세요! 간도 정말 딱 맞고 맛있습니다. 옥수동 한정식으로 강력추천드립니다!!,2024-05-23,"저녁에 방문, 예약 없이 이용, 대기 시간 바로 입장, 친목, 나들이, 연인・배우자, 친구",음식이 맛있어요,54,1
32085211,rinmin4,좋아요,2024-05-22,"점심에 방문, 예약 없이 이용, 대기 시간 바로 입장, 나들이, 친구",매장이 넓어요,450,1
32085211,지사똑예,"사장님 친절하심, 밥&반찬 다양하고 맛 좋음 = 끝났다여기 주방장님 음식 솜씨가 장난 아닙니다.어른 모셔가도 인정 받을만한 곳입니다.2만원대 한정식이 이 정도라면 또, 또또, 또또또 방문할 의사 100%입니다.무엇보다 사장님도 친절하셔서 기분 좋게 먹고 나왔네요 😋옥수동 진또배기 맛집이랍니다 ‘-’b",2024-05-18,"점심에 방문, 예약 후 이용, 대기 시간 바로 입장, 데이트, 연인・배우자",음식이 맛있어요,49,1
32085211,DIEN,옥수동 에서 유명한 곳이라고 해서 방문했는데 유명한 곳은 유명한 이유가 있네요. 반찬 실하게 잘 나오고 아주 건강한 맛이라. 한식 즐기고 싶을 때 가면 딱일 것 같아요.,2024-05-16,"저녁에 방문, 예약 후 이용, 대기 시간 바로 입장, 친목, 일상, 친구",양이 많아요,86,1
32085211,el****,특별한 날 건강한 음식입니다,2024-05-16,"점심에 방문, 예약 없이 이용, 대기 시간 바로 입장, 일상, 지인・동료",음식이 맛있어요,26,1
32085211,현이의먹방,와.한식맛집인정 !!가성비좋아요 만석이네요진짜 리필도 해주시고 너무좋았어요🩷🩷🩷🩷또갈게요,2024-05-11,"점심에 방문, 예약 없이 이용, 대기 시간 바로 입장, 데이트, 연인・배우자",음식이 맛있어요,1052,1
