place_id,nickname,content,date,situations,keywords,review_count,visit_count
1968521178,hhisy,,2025-03-13,"저녁에 방문, 예약 없이 이용, 대기 시간 바로 입장, 친목, 지인・동료",음식이 맛있어요,10,2
1968521178,KYH435,엇 부모님들과 함께 가족모임을 찾고있던중 주위에서 음식이 맛있고다양하다해서 예약후 방문했습니다.너무맛있어서 1주일에 2번올집이에요 회사원들은 단체회식하셔도 좋을거같아요 잘먹었습니다,2025-03-08,"저녁에 방문, 예약 후 이용, 대기 시간 10분 이내, 데이트, 친목, 나들이, 여행, 일상, 기념일, 회식, 가족모임, 비즈니스, 연인・배우자, 친구, 지인・동료, 부모님, 친척・형제",음식이 맛있어요,1,1
1968521178,mmm6066,"여기 장한평역 맛집!! 이였어요!!! 스파게티 먹었는데 넘 맛있어요!!페스카토레 빼쉐랑 토마토 볼로네제파스타 먹었는데! 해장용으로 국물맛 끝내주고! 볼로네제파스타는 고기가 씹혀 풍미가 굿이에여~장안라운지에 오시면 야끼니꾸(소고기), 사시미&스시, 탕, 파스타&무침튀김&피자, 다양한 주류(일본사케, 위스키, 와인, 스파클링와인, 하이볼, 생맥주, 병맥주, 소주, 고급소주), 커피(아메리카노) 이 모든 것을 동시에 맛볼 수 있어여!! 단체모임, 데이트 장소로도 좋으니 장한평역 근처오시면 ' 장안라운지' 꼭 들러보세요~ '장안라운지' 맛도리집입니닷!!! 강추!!",2025-03-07,"저녁에 방문, 예약 후 이용, 대기 시간 바로 입장, 친목, 친구",음식이 맛있어요,63,1
1968521178,sul****,너무 맛있어요:) 다음에 또 갈게요!,2025-03-06,"밤에 방문, 예약 후 이용, 대기 시간 바로 입장, 친목, 친척・형제",좌석이 편해요,10,1
1968521178,수퍼추,초밥과 사시미 메뉴가 생겼네요~모듬사시미는 회가 숙성이 잘되서 비린맛없이쫀득한 맛이 좋았어요! 특히 광어가 맛있었고초밥은 맛과 종류 무난한편...,2025-03-05,"저녁에 방문, 예약 없이 이용, 대기 시간 바로 입장, 친목, 친구",음식이 맛있어요,896,2
1968521178,찍소리,스시 모두 맛있어요~! 특히 제철묵은지는 회와 묵은지의 조합이 맛드러지네요~! 스시 너무 먹고싶어서 혼자라도 와서 먹었는데 분위기도 좋고 맛도좋아 또 올거에요! 퀄리티 좋고 회가 신선해요!,2025-03-05,"점심에 방문, 예약 없이 이용, 대기 시간 바로 입장, 일상, 혼자",화장실이 깨끗해요,20,1
1968521178,gag****,"트러플 향이 넘 좋고 맛있어요! 안주 및 식사 메뉴 종류도 다양하고 많아서 단체 모임으로 방문하면 메뉴고민 없이 진짜 좋을 거 같아요! 자리도 많고 요리도 맛있고 주종도 와인, 샴페인, 준마이 등등 다양해서 회식으로도 좋아보여용!!🙆‍♀️❤️ 오랜만에 친구 만나도 여기로 고르면 최고의 선택일 듯!",2025-03-04,"저녁에 방문, 예약 없이 이용, 대기 시간 바로 입장, 나들이, 혼자",인테리어가 멋져요,17,1
1968521178,jn****,집 가까이여서 방문하게 되었는데 양도 많고 맛있어요 !! 자주 방문 예정입니다 ㅎㅎ,2025-03-01,"저녁에 방문, 예약 후 이용, 대기 시간 바로 입장, 데이트, 나들이, 친구",음악이 좋아요,12,1
1968521178,Renderer,2.5점,2025-02-28,"저녁에 방문, 예약 후 이용, 대기 시간 바로 입장",,12,1
1968521178,KBWo,"맛있고 가성비 너무 좋았어요. 저는 개인적으로 육꼬밥이 정말 정말 맛있었는데, 가신다면요. 육꼬밥 꼭 시켜서 드셔보시길 추천해요.  모양도 예쁘고 맛도 정말 좋습니다. 양도 많아요!!",2025-02-28,"점심에 방문, 예약 후 이용, 대기 시간 바로 입장",음식이 맛있어요,1373,2
1968521178,KBWo,육꼬밥이랑 점심 특선으로 팔고있는 돈파스타랑 알리오올리오 먹었는대 하나하나하 다 너무 맛있었어요. 그리고 무엇보다 파스타에 돈까스까지 있는게 단돈 12000원이라 가성비 최고예요!!육회도 진짜 신선하고 비주얼도 너무 예뻐서 다음에 또먹으러 올것같어요~~ 남편이 강릉에서 먹었던 꼬막밥보다 더 맛있다고 하더라구요~,2025-02-27,"점심에 방문, 예약 후 이용, 대기 시간 바로 입장, 데이트, 연인・배우자",사진이 잘 나와요,1373,1
1968521178,wlgp6187,스시집에서 파스타 파는것도 넘 신기했는데 맛도 있어요!!! 👍👍,2025-02-15,"밤에 방문, 예약 없이 이용, 대기 시간 바로 입장, 친목, 친구",음식이 맛있어요,19,1
1968521178,CloNe,콜키지 프리라 술 한병을 가지고 가서 모듬 사시미와 빠떼를 먹었는데 정말 맛있었고 좋은 시간 보낼 수 있었습니다 추천드립니다!,2025-02-14,"밤에 방문, 예약 후 이용, 대기 시간 바로 입장, 데이트, 일상, 기념일, 연인・배우자",음식이 맛있어요,524,1
1968521178,com****,,2025-02-13,"점심에 방문, 예약 없이 이용, 대기 시간 바로 입장, 연인・배우자",재료가 신선해요,6,1
1968521178,춤추는끼민,"방어 숙성회는 처음 먹었는데, 그냥 방어회랑은 다르게 또 맛있었어요!!",2025-02-08,"저녁에 방문, 예약 후 이용, 대기 시간 바로 입장, 친목, 친구",음식이 맛있어요,47,1
1968521178,초코맛,"최악.. 이런데는 처음이예요 ㅡㅡ 가지마세요점심에 네이버예약 하고 갔는데 사장님인지 직원인지 하는분이 예약이 있는지도 잘모르고 주문하고 40분이 지나서야 음식이 나와서 음식이 코로 들어가는지 입으로 들어가는지도 모르게 급히 먹고 나왔습니다 ㅋㅋㅋㅋㅋ기다리는동안 3~4번을 언제 나오냐고 물었는데 주문이 밀려서 기다리라놓고 앞에서 태평하게 초밥만 정성스레 만드는 모습에 기가찼는데;;;음식이 늦는 이유가 주문이 급하게 몰려서라니요?? 그시각 저희 포함 4테이블밖에 없는데 점심시간에 4테이블 커버가 어려우면 평소엔 장사를 어떻게 하시는건가요?? 한테이블만 주문받으려고 장사하나요?? 그리고 미리 예약했던 피자도 안나오고 이럴거면 미리 메뉴 예약은 왜 하란건지?? 아줌마직원은 사과 한마디없고ㅋㅋ응대,서비스최악",2025-02-07,"점심에 방문, 예약 후 이용, 대기 시간 바로 입장",,546,1
1968521178,loveizark,"넘 맛있는 초밥에 우동, 튀김까지 한 번에 즐길 수 있는 세트메뉴가 있어서 잘 먹고 왔어요. 매장 분위기도 좋고 테이블 간격도 널널하니 답답하지 않아 마음에 드네요.다음엔 저녁에 하이볼 마시러 또 와야겠다 싶어요^^",2025-01-31,"저녁에 방문, 예약 없이 이용, 대기 시간 바로 입장, 데이트, 연인・배우자",음식이 맛있어요,645,1
1968521178,코코포니얌,초밥 먹으러 방문했어요~~~!초밥 완전 신선하고 주문하고 빨리나옵니당ㅎ.ㅎ 사장님도 친절하시구 좋아여😆재방문 의사 있습니당 굿👍🏻👍🏻👍🏻,2025-01-26,"점심에 방문, 예약 후 이용, 대기 시간 바로 입장, 데이트, 연인・배우자",음식이 맛있어요,157,1
1968521178,강타니탄이,지인과 방문했는데 매장 분위기가 너무 아늑하고 좋았습니다 음식 양이 많아요~~  또 방문하고싶어요 저녁에 가서 야끼니꾸 먹어보고싶습니다.,2025-01-23,"점심에 방문, 예약 후 이용, 대기 시간 바로 입장, 친목, 친구, 지인・동료",양이 많아요,19,1
1968521178,블루스카이3019,좋았습니다.근데 100 그램 쿠폰을 선택했었는데나오지 않았네요~~담에 가면 주시나요?~^^,2025-01-22,"저녁에 방문, 예약 후 이용, 대기 시간 바로 입장, 친목, 친구",음식이 맛있어요,20,1
1968521178,뀨60,장한평에 스시집이 생겼다고 해서 방문해보았습니다! 밥 양이나 간도 너무 적당하고 무엇보다 해산물이 엄청 신성했어요!! 새우튀김이랑 우동도 진짜 맛있구요😊😊 장한평 근처 사시는 분들은 꼭 방문해보세요!!,2025-01-22,"점심에 방문, 예약 후 이용, 대기 시간 바로 입장, 연인・배우자",음식이 맛있어요,18,1
1968521178,jjangan77,언니들과 분위기 좋고 맛좋고 하이볼보다 맛나게 일품소주세트 아주 좋았어요~~^^,2025-01-20,"저녁에 방문, 예약 후 이용, 대기 시간 바로 입장, 친목, 지인・동료",인테리어가 멋져요,8,1
1968521178,포뇨뇨2,스시랑 돈파스타둘다 먹었는데 너무 맛있어요 .. 점심으로 먹으러오는거 너무 추천드려용 사장님도 완전 친절하세요 ㅎㅎㅎ,2025-01-18,"점심에 방문, 예약 없이 이용, 대기 시간 바로 입장, 데이트, 연인・배우자",음식이 맛있어요,27,1
1968521178,쭈쭈바요,"런치시간에만 맛볼 수 있는 스시 세트 가성비가 최고인데요👍초밥 10pcs &새우튀김& 우동까지 구성해서12,000원 이라니!!😍불초밥까지 맛볼 수 있어서 정말 맛나게 먹었어요매장인테리어도 힙하고  파티션으로 나뉘어져 있어서모임하기도 넘 좋을꺼 같아요!사장님도 넘넘 친절하시고 장안동 맛집으로 인정합니다👍👍",2025-01-18,"점심에 방문, 예약 없이 이용, 대기 시간 바로 입장",음식이 맛있어요,253,2
1968521178,che****,장한평역에 위치한 가성비 좋은 초밥맛집!점심시간에 오시면 초밥+우동+튀김까지구성 좋고 저렴한 가격에 든든하게 식사 할수 있어요👍🏻❤️오랜만에 초밥 맛집을 찾은거 같아서너무 좋았어용 ㅎㅎ,2025-01-17,"점심에 방문, 예약 후 이용, 대기 시간 바로 입장, 데이트, 친구",음식이 맛있어요,63,1
1968521178,말랑자두85,장한평 주민인데 장한평역 2번 출구에서 엄청 가깝고 가성비 좋은 점심초밥 장라스시 10p 우동 새우튀김까지 포함이라 양도 푸짐하고  장라스시 장소가 편하고 이뻐서 잘 먹고 갑니다 :)  다음에 또 방문 예정입니다 !,2025-01-17,"점심에 방문, 예약 후 이용, 대기 시간 바로 입장, 혼자",음식이 맛있어요,1251,1
1968521178,누룽냐옹이,"가성비 좋은 점심특선 초밥 정말 만족스럽게 잘 먹었어요! 장라스시 10p에 우동, 새우튀김까지 알찬 구성이라 양도 푸짐하고 맛도 훌륭했어요. 다음에도 꼭 방문하고 싶어요!",2025-01-17,"점심에 방문, 예약 후 이용, 대기 시간 바로 입장, 데이트, 연인・배우자",음식이 맛있어요,145,1
1968521178,203050트리,입맛 까다로운 지인이 고른 곳! 대방어 굿! 닭대창볶음 굿! 꼬막반찬 나이스!,2025-01-12,"저녁에 방문, 예약 후 이용, 대기 시간 바로 입장",음식이 맛있어요,2207,1
1968521178,pur****,"올 때 마다 행복한곳 한 번 오시면 단골 될 맛집입니다. 사시미, 파스타, 탕류 거를 타선 없습니다. 소개팅, 데이트, 청첩장모임 등 최고의 선택이 될겁니다.",2025-01-09,"밤에 방문, 예약 없이 이용, 대기 시간 바로 입장, 데이트, 연인・배우자",친절해요,7,1
1968521178,아이유애나23,늘 믿고 먹어요!! 파스타 맛집 ㅎㅎ,2024-12-28,"저녁에 방문, 예약 없이 이용, 대기 시간 바로 입장, 친목, 친구",음식이 맛있어요,23,3
1968521178,wlals3160,"회랑 파스타, 피자 등등 시켰는데 너무 맛있어요~ 추천합니다",2024-12-28,"저녁에 방문, 예약 후 이용, 대기 시간 바로 입장, 가족모임, 부모님, 친척・형제",음식이 맛있어요,10,1
1968521178,lhj252410,완전 맛있게 잘 먹고왔어요~~~가격대비 알찬구성이라 담에 또가고싶어요,2024-11-24,"저녁에 방문, 예약 후 이용, 대기 시간 바로 입장, 친목, 기념일, 친구, 지인・동료, 아이",음식이 맛있어요,26,2
1968521178,쪼유9551,장한평에 텐동 맛집이 없어서 아쉬웠는데 친구가 데리고 와줬어요!!! 셋 다 텐동 먹었는데 바삭바삭하고 기름지지 않아서 순삭했습니다ㅋㅋ 우동이나 모일도 같이 나오는데 이 가격이면 진짜 가성비 최고인거 같아요! 김이랑 계란 튀김이 제 최애였어요ㅜㅜ 우리동네 텐동맛집 자주 방문할게요🥰😍 장사 오래해주세요 사장님!!,2024-11-23,"점심에 방문, 예약 없이 이용, 대기 시간 바로 입장, 친목, 친구",음식이 맛있어요,23,1
1968521178,rye****,가족들이랑 와서 텐동 먹었는데 양도 많고 너무 맛있게 잘 먹었습니다!또 방문하고 싶네요🤗,2024-11-22,"저녁에 방문, 예약 없이 이용, 대기 시간 바로 입장, 일상, 부모님, 친척・형제",음식이 맛있어요,4,1
1968521178,78chooser,오래간만에 지인들과 방문 했는데 일식쪽 메뉴가 많이 늘었네요.초밥 넘 맛있게 먹었어요. 파스타는 역시죠^^다음에는 방어회 먹으려 올게요♡,2024-11-22,"점심에 방문, 예약 없이 이용, 대기 시간 바로 입장, 친목, 지인・동료",음식이 맛있어요,17,2
1968521178,여경2,주말마다 근처에 올일이 있어서 근처 밥집 찾아보는데 초밥이랑 양식을 점심에도 하는 곳이라 해서와봤는데분위기도 이쁘고 음식이 깔끔하고 좋더라구요술집이라 안주메뉴가 있어서 회전율이 좋아서 그른지 싱싱하고 맛있습니다 로제파스타 초밥 다 맛있어요!!!,2024-11-21,"저녁에 방문, 예약 없이 이용, 대기 시간 바로 입장, 회식, 부모님",음식이 맛있어요,36,1
1968521178,죠지20,가까운 텐동전문점가시길.. 밥도 엄청적습니다 텐동먹다가 밥양적은건또처음,2024-11-19,점심에 방문,매장이 넓어요,660,3
1968521178,ryoheuni,,2024-11-17,"저녁에 방문, 예약 없이 이용, 대기 시간 바로 입장, 친목, 친구",음식이 맛있어요,878,2
1968521178,nir****,"여행와서 네이버평점 4.95여서 완전 맛집으로 알고 갔는데 실망 엄청 했네요. 평점 작업을 너무너무 많이 하셨네요. ㅜㅜ파스타는 밍밍한 맛, 우동도 별로, 겁나짠 모밀, 쉐프경력에 안 맞는 초밥 퀄리티, 마지막에 냉동 새우 튀김에 깜놀 했네요.  일식당에서 냉동새우튀김 나오는건 첨봅니다. 음식남기는걸 싫어해 다 먹긴 했지만...평점작업 적당히 하셔야 할듯요~~",2024-11-16,"저녁에 방문, 예약 없이 이용, 대기 시간 바로 입장, 여행, 연인・배우자",현지 맛에 가까워요,6,1
1968521178,배추자매,점심에 텐동 모밀세트랑 초밥우동 세트 먹었는데 너무 맛있었어요!! 텐동 튀김들도 신선하고 기름잡내없고 맛있게 잘먹었네요 초밥도 밥양 괜찮고 우동이랑 같이 먹으니까 배부르고 딱좋았어요 ㅎㅎ,2024-11-15,"저녁에 방문, 예약 후 이용, 대기 시간 바로 입장, 데이트, 연인・배우자",음식이 맛있어요,1016,1
1968521178,jij****,생일 기념해서 가족들이랑 왔는데 숨겨진 맛집 느낌이에요~ 코스요리 셋이서 먹었는데 충분히 배부르네요! 맛도 좋습니다:) 특히 육회.. 존맛,2024-11-05,"점심에 방문, 예약 없이 이용, 대기 시간 바로 입장, 기념일, 가족모임, 부모님",인테리어가 멋져요,12,1
1968521178,ann****,고르곤졸라피자도 맛있고트러플감자튀김도 맛나네요^^다른 메뉴도 먹어 고고 싶네요~~,2024-11-04,"저녁에 방문, 예약 후 이용, 대기 시간 바로 입장, 친목, 지인・동료",음식이 맛있어요,3,1
1968521178,으뜸이네먹거리,분위기도 좋고 음식도 너무 맛있었어요 짝꿍과 좋은 시간 보내고 왔습니다 특히 텐동 너무 맛있습니다,2024-11-03,"저녁에 방문, 예약 후 이용, 대기 시간 바로 입장, 데이트, 연인・배우자",아늑해요,30,1
1968521178,지섭짱,좋아요,2024-10-28,점심에 방문,음식이 맛있어요,2003,1
1968521178,jhmcyc,오늘 처음으로 가족들과 방문했는데회 두툼하고 맛있었어요떡볶이도 맛있네요~아주 잘먹었습니다!!,2024-10-27,"점심에 방문, 예약 후 이용, 대기 시간 바로 입장, 친목, 친척・형제",음식이 맛있어요,275,1
1968521178,야채타임은 맛있어,갑자기 갔으나 자리도 편하고 좋았어요!,2024-10-26,"저녁에 방문, 예약 없이 이용, 대기 시간 바로 입장, 친목, 친구",인테리어가 멋져요,701,1
1968521178,새벽내음타고,처음으로 방문한매장입니다횟집보단 술집같은분 위기이기에 좀 어둡네요일단 음식부터우동: 궁물이 미지근한게 ㅜ.ㅜ쌀국수 : 인스턴트 재료로 만든듯한               맛과 내용에 아쉽네요초밥 : 밥이 찰기가 없어서지 잡으면            밥알이 각개전투하네요집 근처 매장이라 왔는데 아쉬움이 많이 남는 매장입니다음식이 그래도 성의가 있게 나왔으면 좋았겠는데..,2024-10-22,"점심에 방문, 예약 없이 이용, 대기 시간 바로 입장, 일상, 연인・배우자",가성비가 좋아요,19,1
1968521178,나영이7109,,2024-10-22,"점심에 방문, 예약 없이 이용, 대기 시간 바로 입장, 비즈니스, 친구",음식이 맛있어요,682,1
1968521178,김도영웅,모츠나베 맛있어서 다먹었네요~,2024-10-21,"저녁에 방문, 예약 없이 이용, 대기 시간 바로 입장, 친목, 친구",음식이 맛있어요,32,1
1968521178,아이유애나23,파스타가 너무너무 맛있어요><,2024-10-19,"밤에 방문, 예약 없이 이용, 대기 시간 바로 입장, 친목, 친구",음식이 맛있어요,23,2
1968521178,민s7,여긴 항상 맛있고 아늑해서 좋아요 ㅎㅎ,2024-10-19,"저녁에 방문, 예약 없이 이용, 대기 시간 바로 입장, 데이트, 연인・배우자, 부모님",음식이 맛있어요,276,1
1968521178,apd****,육회랑 연어 너무 맛있고 또 올게여!!,2024-10-18,저녁에 방문,매장이 넓어요,31,1
1968521178,꿀탤이,메뉴알차고 금방나오고 맛있어요~,2024-10-16,"점심에 방문, 예약 없이 이용, 대기 시간 바로 입장, 친목, 지인・동료",음식이 맛있어요,169,1
1968521178,아이유애나23,너무너무 맛있어요! 양도 많아요>_<,2024-10-13,"점심에 방문, 예약 없이 이용, 대기 시간 바로 입장, 친목, 친구",음식이 맛있어요,23,1
1968521178,pho****,두번은 안갈듯,2024-10-11,"저녁에 방문, 예약 없이 이용, 대기 시간 바로 입장, 데이트, 연인・배우자",,10,1
1968521178,tnr****,지나가다 우연히 들렸는데 역대급 가성비 입니다 초밥 횟감 너무 신선하고 구성 너무 좋고 텐동도 바삭하면서 너무너무 맛있었어요 재방문 10000000% 입니다,2024-10-11,"저녁에 방문, 예약 후 이용, 대기 시간 바로 입장, 친목, 연인・배우자",음식이 맛있어요,135,1
1968521178,민승쨩쨩,장안동 맛집이라고 소문이 자자해서 처음 와봤는데 메뉴 구성도 너무 잘되어있고 맛있어요...!!!👍🏻👍🏻재방문 의사 1000000% !!!!!,2024-10-11,"점심에 방문, 예약 없이 이용, 대기 시간 바로 입장, 데이트, 연인・배우자",음식이 맛있어요,7,1
1968521178,아델레12,가성비 넘치는 메뉴들 가득한 곳!!점심 단돈 만원으로 이렇게 먹을 수 있는 곳이 있다니!장한평 맛집 인정이에요👍🏻,2024-10-09,"점심에 방문, 예약 후 이용, 대기 시간 바로 입장, 데이트, 연인・배우자",가성비가 좋아요,63,1
1968521178,rosemoose,혼자 가도 가성비 있게 먹을 수 있음. 텐동이랑 초밥 먹었는데 같이 나온 모밀은 면발의 전체 면적에 육수를 새겨 넣은 것 처럼 육수가 베어 났음. 맛이 따로 놀기 쉬운데 여기는 전혀 그렇지 않고 맛있었음.,2024-10-08,"저녁에 방문, 예약 후 이용, 대기 시간 바로 입장, 나들이, 기타",음식이 맛있어요,8,1
1968521178,느티나무7287,"사시미를 두껍게 썰어주셔서 바닷가에서 먹는 맛처럼  맛있게 먹었고요,크림가라아케에 크림, 가라아케가  부드럽고, 따뜻해서 정말 맛있었어요. 강추!!",2024-10-02,"저녁에 방문, 예약 후 이용, 대기 시간 바로 입장, 일상, 연인・배우자, 아이",음식이 맛있어요,200,1
1968521178,뀨영,여기 텐동 꼭 드세요! 텐동 바삭하니 짱맛도리!!모밀+텐동이 만원이아 가성비도 좋고 매장도 고급스러워요 ㅎㅎ 담엔 저녁때 술한잔 하러 방문하려구요,2024-10-01,"저녁에 방문, 예약 없이 이용, 대기 시간 바로 입장, 데이트, 연인・배우자",음식이 맛있어요,196,1
1968521178,달콤513,"점심메뉴인 텐동+쌀국수, 초밥+우동 세트에 새우크림파스타 먹규 왔습니다. 예약하고 방문해서 웨이팅없이 바로 입장가능했고 주차도 무료로 이용가능해서 아주 즐거운 데이트였어오 ㅎㅎ 텐동 진짜 맛있음!",2024-10-01,"저녁에 방문, 예약 후 이용, 대기 시간 바로 입장, 데이트, 연인・배우자",음식이 맛있어요,578,2
1968521178,dhw****,너무맛있어요 .사시미도 싱싱하고 튀김도 바삭하니 맛나고 .. 제주에서 왔는데 제주이상으로 회가맛있었어요 .모든 음식이 최고입니다. 기본음식부터 짱,2024-10-01,"점심에 방문, 예약 없이 이용, 대기 시간 바로 입장, 가족모임, 연인・배우자, 아이",음식이 맛있어요,10,1
1968521178,ctuwni,직장에서 같이 점심 먹으러 왔습니다! 음식도 다양하고 맛있어요!재방문 의사 있습니다,2024-10-01,"점심에 방문, 예약 후 이용, 대기 시간 바로 입장, 친목, 회식, 비즈니스, 지인・동료",인테리어가 멋져요,6,1
1968521178,par****,맛있습니다 다음에 또 올게요:),2024-09-30,"저녁에 방문, 예약 없이 이용, 대기 시간 바로 입장, 친목, 지인・동료",음식이 맛있어요,5,1
1968521178,긍정의달인,"음식도 퀄리티 너무 좋고, 식사하며 대화하기 좋은 곳이에요. 밤에는 더 무드가 좋은 곳이라 데이트코스로 강추 입니다 ^^",2024-09-30,"점심에 방문, 예약 후 이용, 대기 시간 바로 입장, 친목, 친구",음식이 맛있어요,574,1
1968521178,울슐랭,두 메뉴 다 적절하게 맛있었어요. 저녁 먹으면서 술 마시는 걸 좋아하는데 장안라운지가 딱!,2024-09-23,"저녁에 방문, 예약 없이 이용, 대기 시간 바로 입장, 데이트, 연인・배우자",음식이 맛있어요,366,2
1968521178,인왕산933,맛있어오,2024-09-22,"저녁에 방문, 예약 없이 이용, 대기 시간 바로 입장, 친목, 지인・동료",음식이 맛있어요,10,10
1968521178,rkd****,초밥이 신선하고 런치세트는 가성비도 좋아요!! 맛있고 신선하고 메뉴들도 다양해서 또 오려구여😍😍🥹,2024-09-22,"저녁에 방문, 예약 없이 이용, 대기 시간 바로 입장, 친목, 친구",룸이 잘 되어있어요,28,1
1968521178,v켈리v,"가게도 예쁘고 음식 맛있어요~ 메뉴가 많은데 음식 솜씨가 좋으시네요. 다 맛있었어요~~ 저희는 초밥 먹었지만 파스타, 비빔밥 드시는 분들도 계시네요~ 깔끔하고 맛있어요",2024-09-21,"점심에 방문, 예약 없이 이용, 대기 시간 바로 입장, 가족모임, 부모님",음식이 맛있어요,20,1
1968521178,rudolp26,장안하운지 깔끔하고 넘 좋아요!!! 맛있네용~~~~!!,2024-09-20,"저녁에 방문, 예약 없이 이용, 대기 시간 바로 입장, 데이트, 친목, 연인・배우자",음식이 맛있어요,22,1
1968521178,bts****,"맛있어요 , 다음에 한번 더 점심식사 먹어 보고싶네요.",2024-09-15,"저녁에 방문, 예약 후 이용, 대기 시간 바로 입장, 친구",음식이 맛있어요,104,1
1968521178,rlawlsg87,가성비 좋아요,2024-09-14,"점심에 방문, 예약 없이 이용, 대기 시간 바로 입장, 일상, 친구",음식이 맛있어요,790,2
1968521178,can****,,2024-09-11,"저녁에 방문, 예약 없이 이용, 대기 시간 바로 입장, 일상, 지인・동료",음식이 맛있어요,2,1
1968521178,탱이언니62,맛있어요,2024-09-11,"점심에 방문, 예약 없이 이용, 대기 시간 바로 입장, 데이트, 연인・배우자",음식이 맛있어요,1938,3
1968521178,revol1982,,2024-09-10,"점심에 방문, 예약 없이 이용, 대기 시간 바로 입장, 기념일, 친구",음식이 맛있어요,3,1
1968521178,인왕산933,맛있어요,2024-09-09,"점심에 방문, 예약 없이 이용, 대기 시간 바로 입장, 친목, 친구",음식이 맛있어요,10,9
1968521178,인왕산933,맛있어요,2024-09-08,"점심에 방문, 예약 없이 이용, 대기 시간 바로 입장, 일상",음식이 맛있어요,10,8
1968521178,최강남자49,"음식이 맛있고 주차도 편하고 직원분들도 아주 친절하세요^^ 데이트, 가족식사, 단체회식으로도 추천합니다",2024-09-07,"점심에 방문, 예약 없이 이용, 대기 시간 바로 입장, 데이트, 친목, 나들이, 일상, 기념일, 회식, 가족모임, 비즈니스, 연인・배우자, 친구, 지인・동료, 혼자, 아이, 부모님, 반려동물, 친척・형제, 기타",음식이 맛있어요,274,1
