place_id,nickname,content,date,situations,keywords,review_count,visit_count
1386326143,히밤찌,원래는 회를 더 좋아하는데 나이를 더 먹으면서 요즘엔 고기 먹자는 소리를 더 하는것 같다 ㅎㅎ 또 추억한점 ㅎㅎ 저번에 뽈항정 맛있게 먹고 이제는 삼겹에 뽈항정은 추가를 더해서 먹고있다 ㅎㅎ 볶음밥은 물론! ㅎㅎ 진짜 맛있게 잘 먹었습니다 ㅎㅎ 싹싹 아주 깨끗하게 다 먹었네 ㅎㅎ🐷🐷🐷,2024-12-23,"저녁에 방문, 예약 없이 이용, 대기 시간 바로 입장, 데이트, 친목, 일상, 연인・배우자, 지인・동료",음식이 맛있어요,388,11
1386326143,노력의결실,고기 잡내도 적고 입안에서 살살 녹습니다. 후추 가득 뿌려서 기름장에 콕 찍어먹으면 너무 맛있어요^^  배는 불러도 볶음밥도 필수입니다!,2024-12-22,"저녁에 방문, 예약 없이 이용, 대기 시간 바로 입장, 연인・배우자",음식이 맛있어요,191,1
1386326143,정은천사,구성도 좋고 너무 맛있어요!,2024-12-21,"저녁에 방문, 예약 없이 이용, 대기 시간 바로 입장, 데이트, 연인・배우자",음식이 맛있어요,29,1
1386326143,KimEmil,"새로 생겨서 왔는데, 무척 만족스러워요!맛있게 먹고 또 방문할게요 (:",2024-12-21,"저녁에 방문, 예약 없이 이용, 대기 시간 바로 입장, 가족모임, 부모님",음식이 맛있어요,67,1
1386326143,zz****,가성비 좋은 냉삼 맛집! 주류도 저렴해요. 매장도 깨끗하고 직원분도 친절해서 기분 좋게 먹고 옵니다~!,2024-12-21,"점심에 방문, 예약 후 이용, 대기 시간 바로 입장, 데이트, 연인・배우자",음식이 맛있어요,25,1
1386326143,babiduck,냉삼땡겨서 신랑퇴근하자마자 차두고 택시불러서 왓어요역시 냉삼은 추억으로 먹는거지요치즈계란찜 치즈넘치구 된장찌개 넘맛나요 볶음밥까지 먹구 가서 불금 푹자야지요ㅋ,2024-12-20,"저녁에 방문, 예약 없이 이용, 대기 시간 바로 입장, 데이트, 연인・배우자",음식이 맛있어요,2774,2
1386326143,나의바다구름,,2024-12-17,"점심에 방문, 예약 없이 이용, 대기 시간 바로 입장, 일상, 친구",음식이 맛있어요,9,1
1386326143,여릿소녀,"야식 먹으러 갔는데 양도 많고, 고기 질도 좋고 맛있어요!그리고 직원분들도 친절하시고 매장도 깔끔합니다!또 한 번 술 먹으러 올 것 같아요!!",2024-12-16,"저녁에 방문, 예약 없이 이용, 대기 시간 바로 입장, 데이트, 연인・배우자",음식이 맛있어요,58,1
1386326143,Chef Tony,,2024-12-16,"저녁에 방문, 예약 없이 이용, 대기 시간 바로 입장, 친목, 친척・형제",음식이 맛있어요,9,1
1386326143,알렉스핀치,친구 추천으로 왔는데 가성비 최고👍👍고기 퀄리티도 좋고 반찬들이 다 맛있어요 재방문의사 1000%,2024-12-15,"저녁에 방문, 예약 없이 이용, 대기 시간 바로 입장, 데이트, 친목, 연인・배우자, 친구, 지인・동료",음식이 맛있어요,12,1
1386326143,dlwjsjs,후추 뿌려먹는 냉삼 넘 좋아요♥︎ 고사리랑 미나리도 같이 먹는게 별미입니당 ! 잘 먹었습니다🫶🏻,2024-12-14,"저녁에 방문, 예약 후 이용, 대기 시간 바로 입장, 데이트, 연인・배우자",음식이 맛있어요,173,2
1386326143,히밤찌,일마치고 간만에 고기먹고싶어서 추억한점 왔다 ㅎㅎ 배가 완전고파서 공기밥에 옛날 삼겹 두개 주문! 고기가 나왔는데 앞전에 결혼 앞풀이한걸 사장님이 기억해주시고 소시지를 서비스로 주셨다!❤️ 삼겹살 열심히 쌈 싸먹다가 남친이 앞풀이때 뽈항정이 쫄깃하게 맛있었다고해서 뽈항정 추가 주문해서 살짝 노릇하게 익혀서 먹었는데 진짜 완전 쫄깃한게 맛돌이었고 서비스로 준 소시지는 추가 주문 메뉴인데 크기도 어마하게 큰데 일반소시지 맛이 아니라 수제 소시지(?)맛 암튼 맛있었다 ㅎㅎ 그리고 이번엔 고기랑 소시지까지 배용량 초과되도록 먹어서 볶음밥 대신 물 냉면주문했다 ㅎㅎ 사장님이 작은 그릇 주셔서 냉면 덜어서 식초 겨자 양껏 넣고 휘휘 저어서 쌈쌀때 냉면 살짝 얹으면 끝ㅎㅎ 진짜 또 맛있게 잘먹었습니다🥰🐷👍🏻❤️,2024-12-12,"저녁에 방문, 예약 없이 이용, 대기 시간 바로 입장, 데이트, 일상, 연인・배우자",음식이 맛있어요,388,10
1386326143,81chanel,좋아요,2024-12-11,"저녁에 방문, 예약 없이 이용, 대기 시간 바로 입장, 일상, 친구",음식이 맛있어요,571,1
1386326143,O o o O,남편이 정육점 해서 고기 외식은 거의 안하는데 여기는 종종 찾네요 ㅎㅎ 맛도 최고 … 소주값도 최고 … 🤭친절하신 사모님은 덤 🥹♥️영업시간 여쭤보려고 디엠 보냈었는데 기분 좋게 응대해주시는덕에 더 찾게 되네요 🙌🏻조만간 모임을 여기서 해볼까 합니다 ㅋㅋㅋㅋ저희 모임 한번 모이면 하루 매출 뚝딱일거에요적게 일하시고 돈 마니 버세용 💚❤️🎄,2024-12-06,"점심에 방문, 예약 없이 이용, 대기 시간 바로 입장, 데이트, 연인・배우자",매장이 청결해요,154,3
1386326143,라라라님,아이와 함께 고깃집 간거 오래간만인데 너무너무 만족한 식사했고 추억하나 만들고왔네요~ 친절하시고 2인셋트 시켜서 아이와 남편과 셋이서 배터지게 먹고왔어요. 냉면도 너무너무 맛있고 잘 먹고왔습니다. 또 방문할 의사 있습니다. 생맥주도 시원하게 한잔 했는데 너무 좋았어요~,2024-12-01,"저녁에 방문, 예약 없이 이용, 대기 시간 바로 입장, 일상, 아이",코스요리가 알차요,30,1
1386326143,did****,우리 가족이 좋아하는 외식장소에요~ 가성비 좋고 메뉴 구성도 좋아요~ 맛있구 셀프바라 편하게 가져다 먹을 수 있어요어지간한 삼겹살집보다 좋아요~~ 여기 추천합니다^^,2024-11-27,"저녁에 방문, 예약 없이 이용, 대기 시간 바로 입장, 가족모임, 연인・배우자",음식이 맛있어요,8,2
1386326143,jungssun,삼겹살에 관자 추가해서 먹었어요너무 맛있네요~ 아이들도 좋아해서 자주와야겠어요~,2024-11-27,"점심에 방문, 예약 없이 이용, 대기 시간 바로 입장, 가족모임, 연인・배우자",음식이 맛있어요,304,3
1386326143,thd****,양도 푸짐하고 넘 맛있습니당 ㅎㅎ매장 인테리어도 넘 깔끔하고 좋아용,2024-11-17,"점심에 방문, 예약 없이 이용, 대기 시간 바로 입장, 가족모임, 부모님",음식이 맛있어요,7,1
1386326143,whwslgus4,너무 맛있어서 다먹었어요,2024-11-14,"저녁에 방문, 예약 없이 이용, 대기 시간 바로 입장, 데이트",음식이 맛있어요,179,1
1386326143,이크이크26,언제먹어도 맛있는 추억한점~!!맛있고 서비스도좋아요 와보세요~!!!,2024-11-12,"저녁에 방문, 예약 없이 이용, 대기 시간 바로 입장, 친목, 연인・배우자",음식이 맛있어요,5,1
1386326143,051638,가성비 너무 좋고 맛도 넘 맛있어요!!! 직원분들 친절하시고 테라스석 있어서 분위기도 넘 좋아요 비오는 날 또 올게용 ><,2024-11-12,"저녁에 방문, 예약 후 이용, 대기 시간 바로 입장, 데이트, 연인・배우자",음식이 맛있어요,57,1
1386326143,킴딸기어뭉,옛날삼겹이랑 꽃목살 그리고 네겹이살 시켰는데 친구랑 첨 와봤는데 맛있고 소주값이 저렴해서완전 개이득 ㅋㅋㅋ또올게요!!!,2024-11-08,"저녁에 방문, 예약 없이 이용, 대기 시간 바로 입장, 친목, 친구",음식이 맛있어요,1058,1
1386326143,고추장 아찌,맛있고 가성비 좋아요👍👍,2024-11-08,"저녁에 방문, 예약 없이 이용, 대기 시간 바로 입장, 친목, 친구, 친척・형제",음식이 맛있어요,92,1
1386326143,SidohGH,사장님 친절하시고 냉삼도 맛있습니다:)번창하세요!🌈,2024-11-05,"저녁에 방문, 예약 없이 이용, 대기 시간 바로 입장, 친목, 친구",음식이 맛있어요,24,1
1386326143,김형선98,사장님 친절하시고 고기도 최고~!담에도 또 올께요,2024-11-05,"저녁에 방문, 예약 없이 이용, 대기 시간 바로 입장, 데이트, 연인・배우자",음식이 맛있어요,4,1
1386326143,tmffjqm,너무 맛나고 분위기가 너무 좋아요!!! 너무 잘먹었습니다,2024-11-05,"저녁에 방문, 대기 시간 바로 입장, 데이트, 연인・배우자",매장이 넓어요,4,1
1386326143,우리는좋아해,가성비가 정말 좋고 냉삼 퀄리티가 좋아서 맛있어요!,2024-11-03,"저녁에 방문, 예약 후 이용, 대기 시간 바로 입장, 데이트, 연인・배우자",친절해요,1750,1
1386326143,로운2맘,아이랑 두번째 방문인데 가격도 싸고 가성비 좋아서 만족했어요 옛날삼겹 3인분 세트 메뉴과 아이용 공기밥 하나 시켜서 먹으면 3식구 배 부르게 먹고 나올 수 있어요#리뷰노트#협찬,2024-11-02,"저녁에 방문, 예약 후 이용, 대기 시간 바로 입장, 친목, 일상, 가족모임, 연인・배우자, 아이",음식이 맛있어요,80,2
1386326143,O o o O,냠 냠,2024-11-02,점심에 방문,음식이 맛있어요,154,1
1386326143,히밤찌,일마치고 콧물 휘날리며 왔더니만 야장자리에 먹기전 셋팅끝나있어서 완전 흥분 ㅎㅎ 진짜 맛있어서 고기도 추가해먹고 볶음밥 계란 추가해서 샤샤샥 깨끗이 다 비웠다 ㅎㅎ 진짜 추억한점 짱 ㅎㅎ 제발 오래오래 장사해주세요❤️,2024-10-28,"저녁에 방문, 예약 없이 이용, 대기 시간 바로 입장, 데이트, 일상, 연인・배우자, 지인・동료",음식이 맛있어요,388,9
1386326143,아루4949,좋아요,2024-10-21,"점심에 방문, 예약 없이 이용, 대기 시간 10분 이내, 나들이, 지인・동료",특별한 메뉴가 있어요,872,2
1386326143,236848,고기가 맛있어요~ 사람도 많습니다~!! 직원분들도 친절하세요~!,2024-10-20,"저녁에 방문, 예약 없이 이용, 대기 시간 바로 입장, 데이트, 친목, 연인・배우자, 친구",음식이 맛있어요,31,1
1386326143,아루4949,좋아요,2024-10-18,"저녁에 방문, 예약 없이 이용, 대기 시간 10분 이내, 친목, 친구",고기 질이 좋아요,872,1
1386326143,쌍둥이별51,사가정의 가성비 좋은 냉삼집입니다! 요즘  서울 냉삼집도 1인분도 만원이 넘기는 곳이 많은데 여기는 가격도 저렴하고 냉삼 이외의 메뉴도 먹어볼 수 있어서 좋아요👍,2024-10-18,"저녁에 방문, 예약 후 이용, 대기 시간 바로 입장, 데이트, 연인・배우자",음식이 맛있어요,7,1
1386326143,jungssun,냉삼은 항상 여기서 먹고 있어요!구선이 알차고 너무 맛있어요~아이들이 좋아하네요!,2024-10-15,"저녁에 방문, 예약 없이 이용, 대기 시간 바로 입장, 일상, 가족모임, 연인・배우자",음식이 맛있어요,304,2
1386326143,발발이35,한상차림이 푸짐하다삼겹살에 안 올리면 아쉬운 미나리 고사리 김치 콩나물까지 모두 기본제공이라니 🫨🫨 된찌도 차돌된찌...!!행복한 한 쌈 한 쌈을 느낄 수 있는 곳,2024-10-14,"저녁에 방문, 예약 후 이용, 대기 시간 바로 입장, 친목, 친구",단체모임 하기 좋아요,109,1
1386326143,루피에오,너무 맛있게 잘 먹구 왔어요~~!!목살도 얇아서 바로바로 구워먹기 넘 좋아요⭐️🤍,2024-10-12,"저녁에 방문, 대기 시간 바로 입장, 일상, 친척・형제",음식이 맛있어요,99,1
1386326143,코코블럭,고기도 맛있고 분위기도 좋아요! 소주가2000원~,2024-10-10,저녁에 방문,음식이 맛있어요,817,1
1386326143,kkk12387,오늘 처음왔습니다 푸짐하고 맛있었어용~!!,2024-10-09,"저녁에 방문, 예약 없이 이용, 대기 시간 바로 입장, 데이트, 연인・배우자",음식이 맛있어요,9,1
1386326143,mis****,매번 올때마다 넘 만족해요😀 가성비 좋고 고기 맛도 굳굳 다 맛있지만 겹겹이삼겹이 젤 맛있어요😁,2024-10-05,"저녁에 방문, 예약 없이 이용, 대기 시간 바로 입장, 친목, 연인・배우자, 친구, 지인・동료",음식이 맛있어요,20,2
1386326143,경이지늬,오랜만에 생각나서 다시 재방문했는데 여전히 맛있었어요잘먹었습니다!,2024-10-05,"저녁에 방문, 예약 없이 이용, 대기 시간 바로 입장, 데이트, 연인・배우자",음식이 맛있어요,53,1
1386326143,히밤찌,점심으로 삼겹살 먹자하고 추억한점 왔다 ㅎㅎ 요근래 여기만 와서 다른 삼겹살 집 가보려고했는데 문 연 곳이 여기뿐 ㅎㅎ 잘 됐다 ㅎㅎ 기분탓인지 고기가 더 좋아보였고 양도 더 많아보였다 ㅎㅎ 반주로 한잔하다 멈출 수 없어 고기도 추가하고 볶음밥에 계란 추가해서 남은 고기 한 점이랑 야채 챱챱해서 호로록 ㅎㅎㅎㅎㅜㅠㅎㅎㅎㅎ🐷🐷🐷🥹👍🏻,2024-10-05,"점심에 방문, 예약 없이 이용, 대기 시간 바로 입장, 데이트, 일상, 연인・배우자, 지인・동료",음식이 맛있어요,388,8
1386326143,Yuki111111,추억의  냉삼  맛나요~~소주가 2000원 ㅎㅎ  굿~^^♡,2024-10-04,"점심에 방문, 예약 없이 이용, 대기 시간 바로 입장, 일상, 친구",음식이 맛있어요,1561,2
1386326143,kimhalyn,아이랑 오기 좋아요 가성비좋고 맛있어요,2024-10-04,"점심에 방문, 예약 없이 이용, 대기 시간 바로 입장, 일상, 연인・배우자, 아이",음식이 맛있어요,244,1
1386326143,성공한남자15,맛도 좋고 가성비도 좋고 너무 좋다는^^사장님 친누나같이 친절해요~^^,2024-10-03,"저녁에 방문, 예약 없이 이용, 대기 시간 바로 입장, 데이트, 연인・배우자",음식이 맛있어요,41,1
1386326143,Ellie Lee,직원분들 너무 친절하시구요분위기좋고 맛도 너무 좋아요^^,2024-10-03,"저녁에 방문, 예약 없이 이용, 대기 시간 바로 입장, 부모님",고기 질이 좋아요,215,1
1386326143,히밤찌,맛있는 고기 쌈싸먹으러 ~ 추억한점 왔다 ㅎㅎ 옛날삼겹살로 시작해서 뽈항정까지 먹고 볶음밥까지 ㅎㅎ 고기한점 남겨서 파채랑 야채랑 잘게 잘라서 챱챱~ 눌러서 야무지게먹었다 ㅎㅎ 역시 맛있음 ㅎㅎ 청양고추가 샤인머스캣 색이라 너무 매운건 아닌지 무서웠는데 맛있었다 ㅎㅎㅎㅎ 항상 잘 먹고 갑니다🥰🐷👍🏻❤️,2024-09-29,"저녁에 방문, 예약 없이 이용, 대기 시간 바로 입장, 데이트, 일상, 연인・배우자, 지인・동료",음식이 맛있어요,388,7
1386326143,yum5953,세트메뉴에 고기 추가해서 4인가족 맛나게 잘 먹었습니다♡,2024-09-21,"점심에 방문, 예약 없이 이용, 대기 시간 바로 입장, 가족모임, 연인・배우자, 아이",음식이 맛있어요,174,1
1386326143,이찌쪼아,전에 처음 방문하고 뻑간곳~ㅋ냉삼이 생각나면 이제는 이곳만 찾을꺼예여 ~ ㅎ고사리에 김치 콩나물 등등 넣고 삼겹살이랑 쌈 싸먹으면 진짜 ~~ 끝내줘여 된장찌개도 다른 고깃집에 비해 진하고~소주가격도 착하고사장님 직원분들 모두 너무 친절하셔서 더 기분좋은곳추억한점~ 쭈~~욱~~~ 번창하시길바래요,2024-09-20,"저녁에 방문, 예약 후 이용, 대기 시간 바로 입장, 연인・배우자, 친구",음식이 맛있어요,465,2
1386326143,cra****,항상 친절하시고 고기 맛도 좋아요~~~~,2024-09-19,"점심에 방문, 예약 없이 이용, 대기 시간 바로 입장, 친목, 친구",음식이 맛있어요,10,2
1386326143,제시카 89,사가정 맛집 추억한점에서 옛날삼겹살 먹고 왔는데 찐입니다!!!!😍😍오랜만에 냉삼이 땡겨 갔는데 진짜 추억의 맛을 느끼고왔어용ㅋㅋ가격도 착한데 특히 세트메뉴 구성이 알차용!!❤ 삼겹살3인분에 찌개에 계란찜에 볶음밥까지해서 3만원대라니!!! 가성비 짱짱맨 아니냐구용???ㅋㅋ맛도좋고 내용물 건더기도 푸짐하게 주셔서 배터지게 먹었어용!!ㅋㅋ잘먹는 성인들도 저세트메뉴면 알차게 먹을거 같아용ㅋ분명 배불렀는데 볶음밥 나오는순간 숟가락질을 또하게되는 마성의 볶음밥 맛..❤전 맵찔이인데 적당히 매콤해서 잘 들어가더라고용!!!♡ 볶음밥에 꼭깻잎잘라서 넣어드시는걸 추천합니다!!!김치는 덤이에용~♡소주 맥주 가격 착한게 쵝오..알콜러들 무조건입니다!!ㅋㅋ담에 또가야지~,2024-09-18,"저녁에 방문, 예약 후 이용, 대기 시간 바로 입장, 데이트, 연인・배우자",음식이 맛있어요,129,1
1386326143,위드휠N타이어,너무 맛있어요~~,2024-09-18,"저녁에 방문, 대기 시간 바로 입장, 친목, 친구, 지인・동료",음식이 맛있어요,5,1
1386326143,clk****,,2024-09-16,"저녁에 방문, 예약 없이 이용, 대기 시간 바로 입장, 친목, 친구",음식이 맛있어요,9,1
1386326143,하트1188,가성비짱!!! 맛있어용,2024-09-13,"저녁에 방문, 예약 없이 이용, 대기 시간 바로 입장, 데이트, 연인・배우자",음식이 맛있어요,35,1
1763150228,천상천하유아독종악녀48,맛있음,2025-04-07,"저녁에 방문, 예약 없이 이용, 대기 시간 바로 입장, 친목, 친구",음식이 맛있어요,866,3
1763150228,알뜰살뜰ㅎ,맛있어요♡,2025-04-07,점심에 방문,음식이 맛있어요,1777,3
1763150228,행복한상상님,"●가야밀면  ●육즙만두  ●양지탕가야밀면은 쫄긴한 면발에 쏘쏘한 양념의 맛입니다.육즙만두는 피자체가 퍼지는 피로 만두속과 약간 따로 놀며,육즙을  많이 느낄수 있진 않습니다.양지탕은 방송출연으로인해 궁금해서 시식해보았는데쉽게말하자면 갈비탕의 느낌이라고 생각하시면 될듯합니다.하지만 국물의 맛은 좀더 깊고 건더기의 고기도 풍부하여맛나게 먹었습니다.",2025-03-06,"점심에 방문, 예약 없이 이용, 대기 시간 바로 입장, 데이트, 연인・배우자",특별한 메뉴가 있어요,1189,2
1763150228,anna7289,굿,2025-03-04,"점심에 방문, 예약 없이 이용, 대기 시간 바로 입장, 일상, 아이",음식이 맛있어요,1299,2
1763150228,레나픽,동원시장 맛집이에요 ~~밀면 자극적이지않고 면발이 탱글탱글 시원해서 여름 뿐아니라 겨울인데도 맛있게 먹고왔어요 양지탕은 고기가득   간장 맛이 살짝나는 육수였고 뜨끈하게 밥말아먹으니 좋아요 애들과와도 좋아할듯 싶어요 친절하심니다,2025-02-02,"점심에 방문, 예약 없이 이용, 대기 시간 바로 입장, 나들이, 연인・배우자",음식이 맛있어요,246,1
1763150228,걷고걷고지치면타고,놀토 보고 존재를 알고 처음 가봄. 양지탕 고기 많고 맛있음.,2025-02-02,"점심에 방문, 예약 없이 이용, 대기 시간 바로 입장, 친목, 일상, 친구",친절해요,495,1
1763150228,무작,맛이 없는 건 아닌데 그렇다고 엄청 특별하진 않아요. 밀면은 북촌피냉면 느낌. 맵진 않아서 좋아요.,2025-01-27,"점심에 방문, 예약 없이 이용, 대기 시간 바로 입장, 일상, 혼자",혼밥하기 좋아요,1445,1
1763150228,잘살아보세40,,2025-01-26,점심에 방문,음식이 맛있어요,1132,1
1763150228,외향인 호소자,"밀면의 면발이 쫄깃탱탱해서 너무 맛있었고, 셀프로 가져다 먹는 온육수도 너무 맛있었어요~",2024-12-27,"점심에 방문, 예약 없이 이용, 대기 시간 바로 입장, 일상, 부모님",음식이 맛있어요,580,1
1763150228,무소유78,기본반찬은 부실하지만 양지탕 맛나요,2024-12-11,"점심에 방문, 예약 없이 이용, 대기 시간 바로 입장, 일상, 혼자",매장이 청결해요,922,2
1763150228,sep****,가격대비 여러모로 부족한 부분이느껴지는 포장이었음.,2024-12-10,"점심에 방문, 포장·배달 이용, 대기 시간 바로 입장",혼밥하기 좋아요,949,2
1763150228,누리17,맛있었어요,2024-12-04,"점심에 방문, 예약 없이 이용, 대기 시간 바로 입장, 일상, 부모님",음식이 맛있어요,440,1
1763150228,TOSHU,부산에서 먹던 그리운 그맛입니다 다 너무 맛있어서 싹싹 다 먹어치웠습니다 진짜 맛있고 친절하시네요^^,2024-11-30,"저녁에 방문, 예약 없이 이용, 대기 시간 바로 입장, 데이트, 연인・배우자",음식이 맛있어요,202,1
1763150228,천상천하유아독종악녀48,항상 맛있게 먹어요좀 빨리 끝나서 아쉬워요,2024-11-29,"저녁에 방문, 예약 없이 이용, 대기 시간 바로 입장, 일상, 친구",음식이 맛있어요,866,2
1763150228,찐먹빌런,여기 맛있어요,2024-11-21,"저녁에 방문, 예약 없이 이용, 대기 시간 바로 입장, 일상, 아이",음식이 맛있어요,679,1
1763150228,to_****,맑은국물 보다 빨간국물 선호하는 1인 입니다만전날 술 안마셧는데 땀 빠지는게 진짜 보약 한그릇먹는느낌 이내요맛있게 잘 먹었습니다.,2024-11-15,"점심에 방문, 예약 없이 이용, 대기 시간 바로 입장",음식이 맛있어요,84,1
1763150228,Mcknight02,"결제하고 보통 리뷰 잘 안남기는데 이건 남겨야겠다 싶어 리뷰 남깁니다. 퇴근하고 그냥 집에 가기 뭐해서 같은 직장 동료분께서 추천해주셨던 기억이 있어 방문하게 되었는데, 홀도 쾌적하고 다들 친절하게 응대해주시고 제일 중요한 음식 자체도 정말 부산에서 유명하다고 가서 먹었던 밀면이랑 느낌은 달랐지만 정말 맛있었습니다. 달랐던 이유는 먹을때 한약재 향이 나던데 거기서 나는 차이가 아닌가 싶습니다. 그리고 사장님께서 정말 음식 신경써서 만드시는게 먹으면서 잘 느껴져서 너무 행복한 한끼 잘 즐기다 갑니다. 의문이 가면 일단 가서 한번 드셔보세요 :) 홍보가 아닌 내돈내산 찐후기입니다. 많이 번창하시고 오래 계셔주셨으면 좋겠습니다!",2024-11-14,"저녁에 방문, 예약 없이 이용, 대기 시간 바로 입장, 일상, 혼자",음식이 맛있어요,1,1
1763150228,굿데이투다이,육수가 정말 맛있습니다다대기는 빼달라고 할걸 그랬어요면은 자가제면이라지만 맛있는지는 잘 모르겠어요약간 불었고 면끼리 달라붙어있었습니다다만 전체적 맛있었어요 재방문 의사는 있습니다,2024-11-11,"저녁에 방문, 예약 없이 이용, 대기 시간 바로 입장, 데이트, 연인・배우자",음식이 맛있어요,341,1
1763150228,까부리18,넘  맛있어요,2024-10-27,"점심에 방문, 예약 없이 이용, 대기 시간 바로 입장, 일상, 혼자",음식이 맛있어요,324,2
1763150228,바비다리29,,2024-10-19,"점심에 방문, 예약 없이 이용, 대기 시간 바로 입장, 친구",음식이 맛있어요,756,1
1763150228,lhy****,맛있어요,2024-10-17,"점심에 방문, 예약 없이 이용, 대기 시간 바로 입장, 데이트, 연인・배우자",음식이 맛있어요,694,1
1763150228,욘다욘다,씨엔블루 다녀갔대서 와봤습니다넘 친절하시고 넘 맛있어요 진짜!!!!!!! 생각나는 맛,2024-10-16,"점심에 방문, 대기 시간 바로 입장, 일상, 혼자",음식이 맛있어요,9,1
1763150228,사랑소망엄마,맛있어요  직원이 불친절하네요,2024-10-11,"점심에 방문, 예약 없이 이용, 대기 시간 10분 이내, 일상, 혼자",특별한 메뉴가 있어요,2109,1
1763150228,bym81,굿,2024-10-06,"점심에 방문, 예약 없이 이용, 대기 시간 바로 입장, 일상, 친척・형제",음식이 맛있어요,1179,1
1763150228,붕어알52,육수가 깔끔하고가야밀면 비빔반 물반 딱 촣아요,2024-10-02,"점심에 방문, 예약 없이 이용, 대기 시간 바로 입장, 일상, 혼자",음식이 맛있어요,1177,13
1763150228,똑똑새쩡이,이미 다먹고 생각난 영수증리뷰동원시장 안 밀면맛집:)맛있어요!!!자주가는집이예요!,2024-09-28,"점심에 방문, 예약 없이 이용, 대기 시간 바로 입장, 일상, 지인・동료",음식이 맛있어요,62,1
1763150228,마시멜로3389,며칠전에 부산에서 밀면 먹고  왔지만더운날 시원한 곳에서 시원한 밀면은 최고죠물같은비빔(가야밀면)  맛있어요온육수도 깔끔하니 맛있구요고기만두까지 먹으니 든든합니다,2024-09-17,"점심에 방문, 예약 없이 이용, 대기 시간 바로 입장, 가족모임, 친척・형제",음식이 맛있어요,372,1
1763150228,붕어알52,너무덥고 배고파 시원한 가야밀면 사리추가해 뚝딱...ㅋ,2024-09-03,"점심에 방문, 예약 없이 이용, 대기 시간 바로 입장, 일상, 혼자",음식이 맛있어요,1177,12
1763150228,hsg****,굿,2024-08-31,점심에 방문,친절해요,745,1
1763150228,딸기좋아72,맛있어요,2024-08-31,"점심에 방문, 예약 없이 이용, 대기 시간 바로 입장, 나들이, 연인・배우자",음식이 맛있어요,878,1
1763150228,로미9643,깔끔하고 맛있어요 ^^  친절하시구요 ~~ 또 갈께요,2024-08-24,"저녁에 방문, 예약 없이 이용, 대기 시간 바로 입장, 일상, 아이",음식이 맛있어요,715,2
