place_id,nickname,content,date,situations,keywords,review_count,visit_count
1356708948,mellow1120,"언제가도 항상 기대 이상으로 맛있게 먹고 나오는 곳이고, 둘이가서 3~4개 시켜도 더 먹고 싶은 곳이고, 누구에게 소개시켜줘도 다 칭찬만 듣고 알려줘서 고맙다는 얘기 듣는 곳입니다. 오랜만에 뵙는 여사장님이 계셔서 더 반갑고 좋았어요❤️ 사람많으면 그냥 지나가고 너무 바쁠 때도 못 갔다가 오늘 딱 갔는데.. 역시 최고예요ㅠ 그냥 저녁먹으러 간 건데 특별한 날이 된 것 같이 행복해졌어요. 사장님 흑백요리사2 나가시면 1등하실걸요 진짜 맛있어요 👍 넘넘 잘먹었습니다 😆",2024-11-07,"저녁에 방문, 예약 없이 이용, 대기 시간 바로 입장, 일상, 연인・배우자",음식이 맛있어요,34,4
1356708948,마루9175,근처에서 제일 맛있는곳이예요 정성스런 음식이 넘 맛있어요,2024-11-01,"점심에 방문, 예약 없이 이용, 대기 시간 바로 입장, 친목, 친구",음식이 맛있어요,199,1
1356708948,며느리,맛있습니다! 재방문의사있늠,2024-10-13,"저녁에 방문, 예약 후 이용, 대기 시간 바로 입장, 데이트, 연인・배우자",음식이 맛있어요,33,1
1356708948,오로취치,새우알리오 올리오 새우 실하고 맛있어요!트러플 버섯리조또 메뉴도 강추합니다.스테이크도 맛있어요!두번 드세요! 넘맛있어요!!!!!,2024-10-01,"점심에 방문, 예약 후 이용, 대기 시간 바로 입장, 친목, 연인・배우자",인테리어가 멋져요,16,1
1356708948,rkf****,엔초비 파스타 짭쪼름하니 계속 손이 가고 트러플 리조또는 고소해서 계속 들어가요! 알바생도 친절하고 매장 조용해서 좋아요~,2024-09-08,"점심에 방문, 예약 후 이용, 대기 시간 바로 입장, 친목, 친구",음식이 맛있어요,46,1
1356708948,플라2655,집앞에 있는 전현필식당 항상 가야지 생각하다가 이사온지 2년만에 남편이랑 먹으러 왔어요ㅎㅎ 트러플 버섯 크림 리조토 진짜 담백하니 풍미있게 맛있네요 다음에 다른 메뉴도 먹으러 와여겠어요!!,2024-07-21,"점심에 방문, 예약 없이 이용, 대기 시간 바로 입장, 데이트, 연인・배우자",음식이 맛있어요,20,1
1356708948,춤92,혼자 맛있는 음식 뭘 먹을까 고민하다가이곳에 왔습니다.스테이크를 시켰는데요소스가 많아서 여러가지 스테이크를 먹는 느낌이였어요.스테이크의 퀄리티는 역시 너무 좋았구요.숯불의 향까지 더해져서 너무 맛있었습니다.청량리주변 오시면 꼭 먹어보세요.고민하지마시고! 강추합니다!,2024-07-09,"점심에 방문, 예약 없이 이용, 대기 시간 바로 입장, 나들이, 혼자",음식이 맛있어요,3,3
1356708948,팝탈트,너무 맛있게 먹었어요! 사진에는 없는데 특히 스테이크랑 앤초비 파스타가 제일 마음에 듭니다! 라구도 홈메이드처럼 시판용 같지 않았고 신선했어요.,2024-06-30,"저녁에 방문, 예약 후 이용, 대기 시간 바로 입장, 데이트, 연인・배우자",음식이 맛있어요,19,1
1356708948,체리초코파이,면이 좀 많이 익은 느낌이었어요 진하기보단 좀 연한 라구소스맛그래도 분위기랑 맛자체는 괜찮네요,2024-06-22,"저녁에 방문, 예약 없이 이용, 대기 시간 바로 입장, 데이트, 연인・배우자",친절해요,57,1
1356708948,seh****,정말 맛있게 먹었습니다. 다음에 또 오고 싶어요!,2024-06-04,"저녁에 방문, 예약 후 이용, 대기 시간 10분 이내, 일상, 연인・배우자",음식이 맛있어요,10,1
1356708948,ke140443,트러플 크림버섯 리조또  역시 맛있다고 한 이유가 있네요~~^^너무 맛있게 먹었어요~~음식 나오는 속도가 텀이 좀있긴한대여유있게 대화나누실 분들은  좋을듯합니다~안심스테이크도  고기는 진짜 부드럽네요~~사이드가 없어서  그게좀 아쉬웠어요~~잘먹고왔어요~,2024-05-30,"점심에 방문, 예약 후 이용, 대기 시간 바로 입장, 친목, 친구",음식이 맛있어요,169,1
1356708948,갈색기린,"매장 크기가 작고 아담해서 소규모 모임하기 좋아요.(6인 테이블 1개, 4인 테이블 1개, 2인 테이블 1개)참나물 소고기 리조또  특색있고 맛났다는맛났다는식당 앞 도로가에 주차 가능하며, 쉐프님 친절하세요. 😀",2024-05-25,"점심에 방문, 예약 후 이용, 대기 시간 바로 입장, 데이트, 연인・배우자",재료가 신선해요,26,1
1356708948,jyr****,남자친구랑 조카들 데리고 언니가 예약해줘서 갔다왔어요 입 짧은 애들인데도 엄청 잘 먹고 이 전에도 여러번 왔었다고 조카가 말해주더라구요! 남자친구도 까다로운 입맛인데 맛있다고 했어요 :-) 다음에 전농동 갈 일 있으면 또 가볼려구요 잘먹었습니다 ㅎ-ㅎ,2024-03-27,"저녁에 방문, 예약 후 이용, 대기 시간 바로 입장, 가족모임, 연인・배우자, 아이",음식이 맛있어요,47,1
1356708948,키라8026,저희가족의 힐링플레이스 입니다 아이들을 잘 배려해서 챙겨주시고 음식은 모든메뉴가 특별하고 맛있습니다따뜻한 분위기에서 맛있는게 온가족 좋은시간 보냈습니다 감사해요,2024-03-23,"저녁에 방문, 예약 후 이용, 대기 시간 바로 입장, 가족모임, 연인・배우자, 아이",음식이 맛있어요,26,2
1356708948,바게뜨빵,음식 하나하나가 정갈하게 나와요~고기 맛 좋았습니다.,2024-02-25,"저녁에 방문, 예약 후 이용, 대기 시간 바로 입장, 친목, 지인・동료",아늑해요,129,1
1356708948,조를림,맛있게잘먹고왔어요 아늑하고 분위기좋습니다,2024-02-22,"저녁에 방문, 예약 후 이용, 대기 시간 바로 입장, 친목, 지인・동료",아늑해요,285,1
1356708948,유주블리,배고픈데 밥 해먹기 귀찮아서 먹으러 갔어요까르보나라  꾸덕하고 적당히 매워요 근데 양이 엄청 많아요ㅎㅎ가끔씩 생각나는 맛 또 먹으러 올게요 🩷❤️,2024-02-02,"점심에 방문, 예약 없이 이용, 대기 시간 바로 입장, 일상, 혼자",음식이 맛있어요,127,2
1356708948,춤92,"리뷰를 처음 작성할만큼, 음식이 너무 맛있었어요! 특히 스테이크의 맛이 최고였습니다! 미국에 살면서 많은 스테이크를 먹어봤지만, 이렇게 부드러운 스테이크는 처음이였어요. 미국 앵구스(앵거스) 스테이크는 비교도 안되는 맛이였습니다. 어떤 고기를 쓰는지 셰프님의 고기 고르는 안목이 탁월한것같아요.그리고 셰프님이 직접 만든 사이드디쉬와 각종 향신료는 고기의 품질과 곁들여져 환상적인 조화를 이룹니다.이곳에 가시면 꼭 스테이크를 드셔보세요! 저는 이제 한국에 올때마다 방문할것같아요! 음식을 맛있게 해준 셰프님과 리뷰를 읽는 모든분들 새해복많이 받으세요! 새해를 기분좋은 음식과 시작해서 올한해도 잘풀릴것같습니다.",2024-01-17,"점심에 방문, 예약 후 이용, 대기 시간 바로 입장, 데이트, 연인・배우자",음식이 맛있어요,3,1
1356708948,유주블리,안심스테이크랑 부가티니 먹었어요 :) 안심 고기굽기 딱 좋고 부가티니는 처음 먹어봤는데 약간 매콤하고  맛있어요 메뉴 예약 하고 갔더니 오래 기다리지 않았어요주차는 식사시간에 가게앞에 가능해서 주차도 편했어요 🙂🙂다음에 또 갈게요 잘 먹었습니다 🩷🩷,2024-01-17,"점심에 방문, 예약 후 이용, 대기 시간 바로 입장, 친목, 친구",음식이 맛있어요,127,1
1356708948,tak****,"오랜만에 멀리서 온 지인이 동네로와서 한끼 대접하려고 찾았습니다.  메인 파스타 메뉴는  가격대비 양이 많이 아쉽지만 재료가 신선하고 맛있어서 나쁘지 않았습니다. 다만 토마토샐러드?메뉴는 구성,재료,플레이트,맛에서 많이 아쉬웠습니다. 하지만 가장 아쉬운건 직원분들의 대처입니다. 홀 직원분이 기본적인 메뉴 숙지가 전혀안되었고, 제가 잘 몰라서요만 여섯번 들었습니다. 사장님께 여쭤보면 되는데 테이블옆에서 검색해볼게요...이러시는ㅜㅜ그걸 다 듣고있는 사장님은 아무런 대처도.. 직원분의 기본적인 메뉴 숙지는 사장님의 기본 교육이라는 생각에 많이 아쉽습니다. 재방문 의사는 없습니다.",2024-01-13,"점심에 방문, 예약 없이 이용, 대기 시간 바로 입장, 친목, 친구",재료가 신선해요,6,1
1356708948,숭이원,맛잇어요,2024-01-07,"점심에 방문, 예약 없이 이용, 대기 시간 바로 입장, 데이트, 연인・배우자",음식이 맛있어요,1530,1
1356708948,gimmong6,다 맛있어요~ 크리스마스때 오려고 11월 초에 예약하고 기다렸는데너무 맛있고 배도고파서 30분만에 다먹고 나왔습니다 ㅋㅋㅋㅋ메뉴 다 맛있습니다~,2023-12-25,"저녁에 방문, 예약 후 이용, 대기 시간 바로 입장, 데이트, 연인・배우자",음식이 맛있어요,908,2
1356708948,삼분의일짜리행복,미리 예약하고 크리스마스 이브에 와이프와 함께 식사했는데요. 안심스테이크 시어링은 아쉽지만 미디엄레어 굽기정도가 예술이었어요. 라따뚜이는 채소 본연의 맛이 느껴져 좋았으나 비주얼이 기대 이하였고요. 까르보나라 역시 정통로마식이 아니라 크림파스타여서 아쉬웠네요. 옆테이블에 아이 두명 데리고온 부부 덕분에 마치 우리 아이를 데리고 밥먹는듯한 간접체험도 잘했습니다^^ 동네에 작지만 알찬 레스토랑 있어서 좋아요~,2023-12-24,"저녁에 방문, 예약 후 이용, 대기 시간 바로 입장, 데이트, 연인・배우자",매장이 청결해요,343,2
1356708948,춤추는곰돌이,봉골레 맛있어요👍🏻👍🏻,2023-12-21,"점심에 방문, 예약 후 이용, 대기 시간 바로 입장, 친목, 친구",음식이 맛있어요,53,1
1356708948,kcoppens,깔끔하고 음식이 맛있어요.결혼기념일이라 조용히 소박하지만 고급진 분위기 윕니다.,2023-12-16,"저녁에 방문, 예약 후 이용, 대기 시간 바로 입장, 데이트, 연인・배우자",음식이 맛있어요,868,1
1356708948,하울9181,사진이 영 그렇네요.고기는 최고에요기념일에도 지인들과도 자주 가는곳입니다.입에서 살살 녹는맛 사장님 손이 금손이에요,2023-12-13,"저녁에 방문, 예약 후 이용, 대기 시간 바로 입장, 기념일, 아이",음식이 맛있어요,74,6
1356708948,냥072,특별한날에는 무조건 가는 동네 숨은 맛집 ..🤍유명한 쉐프님이 직접 조리해주셔서 더 특별하구맛있어용 !! 분위기도 아늑하고 따수워서 연말 모임있으신분들은 무조건 여기 추천입니당 !! 예약하고 가시면 수월하게 드실수있어요 :> 부모님도 만족해하셨답니당! 다음 기념일에도 방문할게요 ㅎㅎ,2023-11-22,"저녁에 방문, 예약 후 이용, 대기 시간 바로 입장, 기념일, 부모님",특별한 날 가기 좋아요,9,1
1356708948,Ms35,1인 쉐프님이라 미리 예약을 해야되는 곳 ! 큰 기대 없이 갔는데 정말 너무너무 맛있었어욤... 리조또가 은근 실패하기 쉬운데 인생리조또였고 나머지 메뉴들도 다 너무 맛있었어요>_<,2023-11-03,"점심에 방문, 예약 후 이용, 대기 시간 바로 입장, 데이트, 친목, 친구",음식이 맛있어요,7,1
1356708948,ye0****,조용하고 아늑해요크림리조또 맛있어요. 트러플이 강하진않아요.무난하네요,2023-10-17,저녁에 방문,매장이 청결해요,1948,1
1356708948,진히트,친절하고 맛도 좋습니다! 다만 1인 식당이라 시간이 좀 걸리니 여러명이 가는 모임보다는 2명 정도 소소하게 가서 식사하시는 것이 좋을 것 같다는 개인적 생각입니다.주변보다 가격대는 조금 있으나 후회없는 맛:),2023-09-24,"저녁에 방문, 예약 없이 이용, 대기 시간 10분 이내, 일상, 부모님",친절해요,540,1
1356708948,편하게하둥,스테이크랑 파스타 모두 너무 맛있었어요!,2023-09-03,점심에 방문,인테리어가 멋져요,70,1
1356708948,시선안경 경희대점,"매번 동네에서 약속이 있으면청량리 롯데백화점 내에서 해결했는데,전농동쪽에도 아기자기한 이쁜 가게들이 많아져서 식사하고 커피 마시러가는 동선도 좋아요👍🏻특히, 트러플버섯크림 리조또가 부드러운 크림풍미에 독특한 식감까지 모든 면에서 완벽했어요😊",2023-08-30,점심에 방문,인테리어가 멋져요,160,1
1356708948,dyc****,,2023-08-15,점심에 방문,음식이 맛있어요,1071,2
1356708948,키라8026,어디서도 맛 보기 힘든 전현필식당만의 시그니처메뉴들 입니다아이들도 맛있게 잘 먹어서 메뉴를 더 주문할 수 밖에 없었어요매장분위기도 좋고 아이들에게도  친절하게 잘 챙겨주셔서 감사했습니다 모든 메뉴가 남다르거 맛있지만 생모짜렐라 샐러드 볼로네제 잊을 수 없어요 ♡♡,2023-07-15,저녁에 방문,특별한 메뉴가 있어요,26,1
1356708948,gimmong6,진짜 너무너무너무너무 맛있어요,2023-07-08,점심에 방문,음식이 맛있어요,908,1
1356708948,eh****,친절해요. 맛있어요,2023-07-02,점심에 방문,친절해요,560,1
1356708948,peach7050,자주 갔었는데 이제야 리뷰를 올리네요! 이 근처 파스타집 중에 제일 맛있다고 자부할수 있어요 ㅎㅎ 특히 트러플 크림리조또는 진짜 꼭 시켜야해요!! 향도 향이지만 꼬들꼬들한 식감에 쫄깃한 버섯의 조합이 너무 좋아요👍 식당안은 자리가 협소해서 가기전에 예약하고 가는 것을 추천합니다.,2023-06-08,점심에 방문,친절해요,58,2
1356708948,막먹묵,"근처에 양식집을 찾아보다가 들어간 곳으로 트러플버섯크림 리조또, 볼로네제를 주문했다. 리조또는 트러플과 버섯향이 너무 좋았고 파스타는 타 볼로네제에 비해서 토마토가 덜 졸여진 느낌이었다. 재료들이 하나같이 신선했고 맛은 전혀 인위적이거나 무겁지 않아서 바닥까지 긁어먹었다는 점🤤",2023-06-06,점심에 방문,재료가 신선해요,31,1
1356708948,dyc****,,2023-06-03,점심에 방문,음식이 맛있어요,1071,1
1356708948,okdolking,"모짜렐라 치즈도 맛있고, 파스타도 다 자극적이지 않고 담백하게 맛있어요.특히 새우 알리오올리오의 새우가 진짜 맛나서 더 추가할 걸 후회했어요.주변에 간다면 또 재방문 하고프네요!가게는 아담하지만 깔끔해요! 주차에 약간 제약이 있지만 맛도 있고 분위기도 괜찮은 곳이라 추천👍",2023-05-27,점심에 방문,음식이 맛있어요,103,1
1356708948,야호야호야45,굿,2023-04-13,점심에 방문,특별한 날 가기 좋아요,297,1
1356708948,크크744,굿,2023-04-13,점심에 방문,단체모임 하기 좋아요,552,1
1356708948,peach7050,넘 맛있어서 사진도 안찍고 흡입했네요..갈때마다 너무 만족스러워요!!,2023-03-08,점심에 방문,친절해요,58,1
1356708948,today26,맛집이라고 소문나서 다녀왔어요. 1인 셰프라 다양하게 시켰을때 시간차가 나는 건 어쩔수없네요. 다음에는 같은 걸로 주문할게요.,2023-02-03,점심에 방문,음식이 맛있어요,152,1
1356708948,뽀로리당,굿,2023-01-21,점심에 방문,음식이 맛있어요,4438,1
1356708948,다중이,스테이크 맛보고 너무 맛있어서 거의 1인 1스테이크 했어요.  트러플리조또 짱맛이고요 볼로네제 면이 고소하고 맛나요,2023-01-15,밤에 방문,음식이 맛있어요,620,1
1356708948,복숭아피넛,음식 하나하나 정성이 느껴져서 대접 받는 느낌이였어요😽오랜만에 맛있는 파스타 먹고 힐링했어요 다 맛있었어요. 리조또는 먹어 본 리조또 중 체고였어요!! 파스타도 특색있어요 !!맛있어요 강추추사장님 넘 친절하세요단골 예약합니다😸,2023-01-05,점심에 방문,재료가 신선해요,15,1
1356708948,리봉이는행복해,"크리스마스에 예약하고 방문했어요ㅎㅎ남자친구가 스테이크를 잘 못먹는데여기선 입맛에 제일 잘 맞다고 아주 잘 먹었어요고기도 엄청 부드럽고 파스타도 정말 맛있어요 ,,💗 다음 기념일 때도 방문 하려구요 ! 잘 먹었습니다 😋",2022-12-25,저녁에 방문,친절해요,417,1
1356708948,scn0213984,마ㅅ있어용,2022-12-23,저녁에 방문,특별한 날 가기 좋아요,222,1
1356708948,Beatrice70,좋아요,2022-12-21,저녁에 방문,음식이 맛있어요,2387,2
1356708948,kal****,가족 생일이라 갔는데 너무 맛있어서 행복했네요,2022-11-19,점심에 방문,음식이 맛있어요,394,1
1356708948,Honestyj,트러플버섯크림리조또 특히 좋아해요.페코리니 부가티니도 치즈향이 너무 좋았어요,2022-11-08,저녁에 방문,특별한 메뉴가 있어요,25,1
1356708948,친절사원,조아요,2022-10-19,점심에 방문,가성비가 좋아요,2271,2
1356708948,야토리,"친구네 동네에 소박하게 자리한,  눈에 안띄는 이탈리안 레스토랑인데 국내 유명 호텔과 해외에서 일하셨다는 셰프님의 경력답게 근사한 파스타를 먹었네요. 이태리 출장이 잦았던 저와 이태리에서 20년 살고 온 친구에게는 완전 이태리에 데려다 놓은 맛이었어요. 신선한 재료를 아끼지 않은 페코리노 부가티니와 비린맛 혐오자인 저의 취향도 입맛을 다시게 만든 엔초비 스파게티는 조용히 주방을 지키고 계신 전현필 셰프님의 담백한 성격이 느껴졌다고나 할까... 뚜또 베네(완전 훌륭해)를 외치며 다 먹고는 식당을 나서기 전에 너무 좋았다고 인사 드리고 오길 잘했다는 생각. 조만간 또 가야겠다는 생각이 드네요^^",2022-10-07,저녁에 방문,특별한 메뉴가 있어요,732,1
1356708948,휘파람못부는토끼,"조개참나물파스타 진짜 맛있어요 강추합니다!!!!!봉골레파스타에 치즈랑 참나물을 넣은 느낌인데 조화로움........봉골레 안좋아한다고 생각해왔는데 이건 넘 맛있게 잘먹었어요! 같이 간 분들 모두 조개참나물파스타를 베스트로 뽑았어요. 조개 비린내 싹 잡고 뭘 한건지 아주 풍부한 맛이 느껴져서 넘 맛있ㅠㅠㅠㅠㅠㅠㅠㅠㅠㅠㅠ완전 취향저격,,,,,,💘",2022-09-30,점심에 방문,특별한 메뉴가 있어요,227,1
1356708948,클래식96,아무생각 없이 갔는데 맛있습니다. 단 음식 나오는 시간이 좀 걸립니다,2022-09-23,점심에 방문,음식이 맛있어요,331,1
1356708948,ssd****,음식이맛있었요,2022-09-23,점심에 방문,친절해요,134,1
1356708948,삼분의일짜리행복,동네에 이런 레스토랑이 생겨 좋아요. 엔초비 간이 딱 좋아 감동🤤,2022-09-21,점심에 방문,음식이 맛있어요,343,1
1356708948,나나우마미,음식맛있어요^^,2022-09-01,점심에 방문,음식이 맛있어요,236,1
1356708948,dododoo,맛있어요,2022-08-24,저녁에 방문,음식이 맛있어요,125,1
1356708948,친절사원,조아요,2022-08-14,저녁에 방문,음식이 맛있어요,2271,1
1356708948,Beatrice70,좋아요,2022-08-14,저녁에 방문,음식이 맛있어요,2387,1
1356708948,우쥬에,여러번 갔었는데 리뷰는 처음 남기나봐요 :) 맛있어요! 오늘 새로운 메뉴 2개 시도했는데 다 맛있어요 봉골레도 페코리노도 :) 둘이서 3개 먹으니 배가 터질 것 같아요 ㅎ ㅎ,2022-08-05,점심에 방문,음식이 맛있어요,27,1
1356708948,2su****,맛나요,2022-08-05,점심에 방문,음식이 맛있어요,365,1
1356708948,오렌지나무6171,"맛집맞아요~~~고급스럽고, 중후한 맛이 있어요^^",2022-08-02,저녁에 방문,음식이 맛있어요,2426,1
1356708948,ansrl23,아 음식이 정말 맛있어요 일반적인 양식이 아니라 잘 만든 양식을 먹었습니다,2022-07-31,점심에 방문,음식이 맛있어요,1244,1
1356708948,하울9181,우리동네 맛집이죠!맛있어요.예약이 다 찰수도 있어요.인기맛집이에요.미리 예약해도 좋을듯요.모임 가족식사 특별한 메뉴가 생각날때도좋은곳이에요.,2022-07-24,저녁에 방문,음식이 맛있어요,74,5
1356708948,jud****,"블로네제는 새콤한 맛이 좋았고,트러플버섯크림 리는 고소하니 맛났습니다.몇번갔다가 못먹어보고 오늘 예약해서 맛았게 잘 먹었어요~~^^",2022-07-10,저녁에 방문,음식이 맛있어요,95,1
1356708948,하울9181,그냥 아무날 아니어도 가서 식사하면 특별한 날이 된거 같아요.,2022-06-03,저녁에 방문,음식이 맛있어요,74,4
1356708948,gne11,예약은 필수~입니다!대접 받는 따뜻한 밥상을 대하는 느낌!음식 모드 깔끔하고 맛나요~^^친구들과 도란도란 이야기 나누고 싶은 곳입니다:),2022-05-25,저녁에 방문,음식이 맛있어요,1283,1
1356708948,Blue2l,음식이 맛있고 분위기가 좋아요,2022-05-25,저녁에 방문,음식이 맛있어요,627,2
1356708948,국공,맛있었습니다,2022-05-15,저녁에 방문,음식이 맛있어요,4443,1
1356708948,TheR,항상 사람들 많아서 궁금했던 찰나에 예약하고 갔습니다! 트러플 리조또 너무 맛있었어요:) 1인식당인지라 조리시간이 조금 걸려도 음식이 맛있으니 괜찮아요❣️,2022-05-15,점심에 방문,음식이 맛있어요,226,1
1356708948,반짝반짝빛나는2262,음식이 오래걸리긴 하지만 맛있었어요!! 근데 양이 좀 적어요ㅠㅠ,2022-05-10,점심에 방문,음식이 맛있어요,74,1
1356708948,chuchu8192,맛있었어요!,2022-05-08,점심에 방문,음식이 맛있어요,631,1
1356708948,Blue2l,맛있고 분위기도 좋아요:-),2022-05-03,저녁에 방문,음식이 맛있어요,627,1
1356708948,쓰유17,양은 많지 않아요하지만 동네에 이런 맛집이 있는게 참 좋다고 생각할 정도로 분위기와 음식 맛이 좋습니다추천합니다~~!,2022-04-24,저녁에 방문,매장이 청결해요,36,1
1356708948,져니693,엔초비파스타 중독이에요 잘먹었습니다 ㅎㅎ,2022-04-13,점심에 방문,인테리어가 멋져요,86,1
1356708948,쩡이8136,음식이한개씩 나오면 바로한것처럼 뜨거워야하는데  식어있고봉골레는 왜이렇게짠건지계산하고나오면서 돈아깝단생각이드네요재방문은 없을꺼같네요,2022-04-10,점심에 방문,,10,1
1356708948,지예희980223,좋아요,2022-03-22,저녁에 방문,특별한 메뉴가 있어요,1017,2
1356708948,sayee,"이근방 가기 좋은 분위기, 맛 다좋은 레스토랑:)",2022-03-19,저녁에 방문,인테리어가 멋져요,179,1
1356708948,시속120키로외발자전거,먹은 음식 모두 맛있었어요재료쓰신거나 맛에 비하여 가격이 합리적이라고 생각했습니다👍(스테이크 정말 부드럽고 촉촉했어요),2022-03-15,점심에 방문,재료가 신선해요,5,1
1356708948,bau****,"전현필 식당의 음식에는 감동이 있다,,,,",2022-03-08,점심에 방문,재료가 신선해요,25,1
1356708948,명예성남인,맛있어요!!,2022-02-27,점심에 방문,특별한 날 가기 좋아요,583,1
1356708948,먹낙이니까,재방문할거예요!,2022-02-12,점심에 방문,특별한 메뉴가 있어요,959,1
1356708948,jw56,음식 다 맛있어요!! 추천,2022-02-06,점심에 방문,인테리어가 멋져요,18,1
1356708948,미so천사,,2022-01-22,저녁에 방문,매장이 청결해요,47,1
1356708948,여유삶,맛있어요,2022-01-19,저녁에 방문,매장이 청결해요,208,1
1356708948,1t****,좋아요,2022-01-19,점심에 방문,음식이 맛있어요,850,1
1356708948,ros****,굿,2022-01-19,점심에 방문,특별한 날 가기 좋아요,845,1
1356708948,mugmilk,저번에 앤초비 파스타 먹으러 갔다고 너무 맛이 있어서 다시 방문했어요음식 나올때까지 시간이 걸리니까 예약해서 가는게 좋을 것 같아요리조또 엔초비 파스타 내 입맛에 맞아아서 너무 맛이 잇게 먹엇어요!!양이 더 조금 많았으면 좋겟네요~~,2022-01-09,점심에 방문,특별한 날 가기 좋아요,1261,2
1356708948,mugmilk,파스타 맛이 있어요!!,2022-01-06,점심에 방문,음식이 맛있어요,1261,1
