place_id,nickname,content,date,situations,keywords,review_count,visit_count
1423886812,정상통증,"요새같이 야외에서 먹기좋은 날, 데이뚜했어요~ 옥탑 뷰 좋고 술도 맛있고 서빙하시는분들도 친절하네요 아, 안주도 맛났어요",2024-05-21,"저녁에 방문, 예약 없이 이용, 대기 시간 바로 입장, 데이트, 연인・배우자",뷰가 좋아요,808,1
1423886812,뚜뚜띠98,루프탑 맘에 들어~,2024-05-19,"저녁에 방문, 예약 후 이용, 대기 시간 30분 이내, 데이트, 친구",뷰가 좋아요,619,1
1423886812,피아니시모안단테,"딱 뷰 하나만 보고 지나가다가 들어간 곳. 밖에서도 루프탑 홀이있는 게 보여서 워크인으로 방문했습니다. 일요일 오후 5시 10분 웨이팅 없이 착석했습니다.전화로 주문하는게 특이하긷 했고, 날도 좋은데 남산뷰라 더 좋았습니다. 파스타가 생각보다 맛있었어요.날 좋은 날 방문하기 좋은 곳이에요!",2024-05-12,"저녁에 방문, 예약 없이 이용, 대기 시간 바로 입장, 데이트, 연인・배우자",야외공간이 멋져요,186,1
1423886812,줄리공쥬,친구추천으로 와인마시러 왔어요~ 명란파스타랑 바질크림 파스타랑 에그인헬이랑 샐러드랑 모두 맛있네요👍👍👍와인마시기 좋은 분위기였어요💕💕 그리구 와인 저렴한 편이어서 왕창 마시기 좋아요좋아🥰🥰,2024-05-09,"저녁에 방문, 예약 없이 이용",음식이 맛있어요,441,1
1423886812,요오온,"루트탑에서 모든 메뉴 실패없이 완벽 세팅, 재방문하고픈 곳이에요!",2024-05-01,"저녁에 방문, 예약 없이 이용, 대기 시간 바로 입장, 친목, 친척・형제",음식이 맛있어요,1062,1
1423886812,비도그,점심 3인 예약 후 방문😊. 2층 창가서 먹었는데 따뜻한 봄바람 맞으며 와인 곁들여 즐거운 식사☺️. 분위기 아기자기 연인과 와도 좋겠음😚 (오늘은 지난해 등단한 시인분과 함께 왔음🥰)...페퍼로니피짜 살짝 매콤😜. 가장 좋았던 건 차돌토마토스튜 파스타🤩. 티오더기계 있는데 주문을 인터폰으로 하게 돼 있음😘..,2024-04-30,"점심에 방문, 예약 후 이용, 대기 시간 바로 입장, 친목, 친구",음식이 맛있어요,500,1
1423886812,제이m,"타이밍 좋게, 주말 오픈할때 딱 맞춰서 갔더니기다리지 않고 바로 자리 잡았어요 ㅎㅎ 치즈떡볶이랑  살라미 피자 먹었는데 맛있었어요! 특히 피자의 도우가 정말 맛있더라구요 ㅎㅎ  맥주와도 잘 어울리는 조합이었어요!",2024-04-28,"점심에 방문, 예약 없이 이용, 대기 시간 바로 입장, 나들이, 여행, 일상, 친구",음식이 맛있어요,281,1
1423886812,리 리 린,"평일 점심에 갔는데 만석은 아니었어요. 차돌갈릭오일파스타, 고사리크림파스타, 김치치즈리조또, 페퍼로니피자 먹었어요. 리조또가 매운 것 빼고는 다 맛있었어요. 가격도 크게 부담되지 않았어요. 테라스 자리가 너무 예뻐보였습니다.",2024-04-26,"점심에 방문, 예약 없이 이용, 대기 시간 바로 입장, 회식, 지인・동료",인테리어가 멋져요,501,1
1423886812,chi****,평일 런치메뉴로 파스타 먹었는데 분위도 좋고 가격도 저렴했어요차돌갈릭오일파스타: 차돌이 많지만 고기질이 좋지는 않음 하지만 마늘도 많고 깔끔하고 맛있음크림커리파스타: 특색있는 크림맛에 느끼하지 않고 너무 맛있음 통통한 새우와 브로콜리 버섯 마늘 등 내용물이 많아 골라먹을 수 있음,2024-04-26,"점심에 방문, 예약 없이 이용, 대기 시간 바로 입장, 친목, 일상, 친척・형제",음식이 맛있어요,178,1
1423886812,문북희,서울역에서 루프탑 감성으로 식사를 하고싶어서 찾아온 곳이였어요 :) 식사로도 좋고 식사 후 가볍게 맥주 마시러 오기도 좋은거 같아요 ! 쪽파피자는 소스가 너무 제스탈이라 맛있었고 곱창파스타도 칼칼하니 둘이 조합이 넘 좋았어요ㅎㅎㅎ음식이 맛있어서 또 생각나요,2024-04-23,"저녁에 방문, 예약 없이 이용, 대기 시간 바로 입장",음식이 맛있어요,537,1
1423886812,앤디짝꿍,음식이 모두 맛있네요,2024-04-13,"저녁에 방문, 예약 없이 이용, 대기 시간 바로 입장, 데이트, 아이",음식이 맛있어요,3456,1
1423886812,아기모빌,기대하지않고 방문하였는데 인테리어가 독특하고 분위기가 좋았습니다.또한 음식이 전체적으로 맛이 좋았으며 가성비가 괜찮았습니다.특히 유자닭껍질 프라이즈와 감바스를 추천드립니다.약간 어두운 분위기라 술도 곁들이기에 좋았습니다.날씨가 따뜻해져서 루프탑에서 맥주를 마시는 것도 추천드립니다.다만 루프탑의 경우 전화주문을 해야하기때문에 다소 불편할것으로 생각됩니다.,2024-04-07,저녁에 방문,인테리어가 멋져요,938,1
1423886812,사과닝,"명란알리오올리오, 바질크림시금치 파스타 둘 다 맛있었어요!창가도 루프탑도 서울로가 보여서 뷰도 좋고 사진도 잘나와요 :)",2024-04-07,"저녁에 방문, 예약 없이 이용, 대기 시간 바로 입장, 일상, 연인・배우자",음식이 맛있어요,168,2
1423886812,현짱아,"분위기가 아기자기하고 약간 외국할머니댁 느낌이라 너무 좋았어요. 직원분들도 친절하시고 음식들도 다 맛있는데, 리조또 무조건 드세요. 파스타랑 피자랑 김치치즈프라이즈도 드셔보세요. 아니 그냥 다 드셔보세요ㅠㅠ",2024-04-05,"저녁에 방문, 예약 없이 이용, 대기 시간 바로 입장, 친목, 친구",음식이 맛있어요,45,1
1423886812,이동은83,👍,2024-04-02,"저녁에 방문, 예약 없이 이용, 대기 시간 바로 입장, 데이트, 연인・배우자",음식이 맛있어요,1694,1
1423886812,사과닝,다양한 맥주 먹기에 좋은집! :)위치도 좋고 뷰도 좋아요 ㅎㅎ,2024-03-29,"밤에 방문, 예약 없이 이용, 대기 시간 바로 입장, 데이트, 일상, 연인・배우자",인테리어가 멋져요,168,1
1423886812,보라동자,맛좋로 분위기도 좋은 곳,2024-03-21,"점심에 방문, 예약 없이 이용, 대기 시간 바로 입장, 친목, 일상, 지인・동료",음식이 맛있어요,864,3
1423886812,사랑하나느낌둘,,2024-03-17,"점심에 방문, 예약 후 이용, 대기 시간 바로 입장, 친목, 친구",음식이 맛있어요,389,1
1423886812,verygoodd,진!!! 짜 맛잇어요조금 늦게가면 바로 웨이팅합니다인테리어도 너무 예쁘네요맛까지 있으니 최고에요,2024-03-16,"저녁에 방문, 예약 없이 이용, 대기 시간 바로 입장, 일상, 친구",음식이 맛있어요,595,1
1423886812,쇼바냥,서울역레스토랑 서울부띠끄 만리재길맛집❤️😀런치로 파스타와 피자 먹었어요 ><시그니처 메뉴 곱창 까르보나라 역시 추천!!퓨전 이탈리안 음식 루프탑에서 즐길 수 있어서 굳굳!,2024-03-12,"점심에 방문, 예약 없이 이용, 대기 시간 바로 입장, 데이트, 연인・배우자",음식이 맛있어요,3213,1
1423886812,얼음꽃87,좋아요,2024-03-09,저녁에 방문,,776,1
1423886812,뿌리잎새트리원,소곱창리조또와 까르보나라 넘 맛있어요❤️🙌🏼 강추드려요!! 웨이팅 있기에 오픈시간에 방문하는 걸 추천!,2024-03-09,"점심에 방문, 예약 없이 이용, 대기 시간 바로 입장, 일상, 친구",음식이 맛있어요,1411,1
1423886812,z55****,리조또랑 파스타먹었는데 맛은 물론이고 분위기도 좋고 단체모임하시는 분들도 많더라구요! 서울역 근처 데이트 장소로 딱이네요!!,2024-03-08,"저녁에 방문, 예약 없이 이용, 대기 시간 바로 입장, 데이트, 연인・배우자",음식이 맛있어요,1213,1
1423886812,faa****,보성쪽파피자 진짜맛있음,2024-03-04,저녁에 방문,음식이 맛있어요,898,1
1423886812,아게하로,"새우살톡톡터지는 보성쪽파피자와 소곱창토마토리조토 두가지 조합이 좋아요. 밥(리조토)이 맵기때문에 부드럽고 순한맛인 보성쪽파피자랑 같이먹음 보완해주는 느낌이 있고, 한식같기도하고 이국적인 느낌 둘다 나서 매력적이었습니다. #서울역레스토랑 #이색음식 추천!",2024-03-04,저녁에 방문,음식이 맛있어요,2092,1
1423886812,smile60,맛있고 뷰도 좋고 분위기도 좋아요 : ),2024-03-02,"저녁에 방문, 예약 없이 이용, 대기 시간 바로 입장, 데이트, 연인・배우자",음식이 맛있어요,1243,1
1423886812,네이버사람,"✔씨푸드 상하이 파스타해산물이 많이 들어간 짭잘하면서 매콤한 파스타에요 많이 맵지 않아 누구나 맛있게 드실 수 있을거 같아요안에 들어있는 해물도 질기거나 덜 익지 않았고 신선했어요면의 익힘정도는 너무 딱딱하지도 퍼지지도 않은 적정한 정도라 면만 먹어도 맛있어요✔부띠끄 치즈 떡볶이양식집 답게 치즈가 예술이고 정말 맛있어요치즈가 굳지 않았고 풍미가 충분히 느껴지면서 달고 맛있어요 안에 들어있는 떡, 어묵 등 다양한 재료들도 양념이 잘 베어있어 맛있었어요 👍",2024-03-01,"점심에 방문, 예약 없이 이용, 대기 시간 바로 입장, 나들이, 혼자",음식이 맛있어요,680,1
1423886812,탐험가bea,서울역에서 도보로 갈수 있음!!보성쪽파피자김치불고기치즈리조뜨 완전 추천해요!!너무 맛있어요!!데이트하기도 좋음,2024-03-01,"점심에 방문, 예약 없이 이용, 대기 시간 10분 이내, 데이트, 연인・배우자",음식이 맛있어요,152,1
1423886812,sod****,"서울역 근처에 양식 맛집을 소개받아서 방문했어요.루프탑에서 남산 야경을 즐길수 있는곳으로 유명하더라구요^^차돌갈릭오일파스타.페퍼로니 피자. 호가든 맥주로 런치메뉴를 주문했는데, 차돌박이의 고소한 향과 맛. 오일 소스가 너~무 맛있어요👏👏👏쭉쭉~늘어나는 모짜렐라 치즈.토마토.페페로니와 페페로치노 토핑의 조화가 완벽했어요~👍👍👍피자에 즐기는 시원~한 호가든 생맥주의 궁합..크~🔥🔥🔥",2024-02-28,"점심에 방문, 예약 후 이용, 대기 시간 바로 입장, 일상, 혼자",음식이 맛있어요,230,1
1423886812,메리다니,김치치즈리조또 제일 맛있어요!샐러드는 청상추가 많아서 조금 실망🙃 그래도 푸짐하게 잘 먹었어요. 갈 때마다 맛있는데 환기가 잘 안되서 다녀오면 온 몸에 냄새가..🥲ㅋㅋㅋㅋㅋ,2024-02-27,"점심에 방문, 예약 없이 이용, 대기 시간 바로 입장, 일상, 지인・동료",인테리어가 멋져요,85,2
1483304539,희망야,"예전 팔색삼겹살 때부터 단골이라서 신촌오면 항상 여기로 옵니다. 푸짐한 세트조합, 좋은 고기질, 다양한 밑반찬까지 빠지는게 없습니다. 이번엔 돈쟁반 먹었는데 다음에는 2인쟁반 먹으려구요!",2025-04-06,"점심에 방문, 예약 없이 이용, 대기 시간 바로 입장, 데이트, 연인・배우자",아늑해요,39,1
1483304539,박형진91,너어무 맛있었어요가성비도 좋고 고기 질도 좋고 사장님 친절하시고 안 갈 이유가 없습니다신촌 고깃집 강추🔥🔥🔥🔥,2025-04-06,"점심에 방문, 예약 없이 이용, 대기 시간 바로 입장, 친목, 친구",음식이 맛있어요,15,1
1483304539,ssj1999,밑반찬이 너무 잘 나와요 두 명이서 삼겹살 2인분 주문해서 잘 먹고 갑니다!! 두툼하니 맛나네요 단체손님분들 오시기 좋을 것 같아요~~,2025-04-05,"저녁에 방문, 예약 없이 이용, 대기 시간 바로 입장, 데이트, 연인・배우자",음식이 맛있어요,6,1
1483304539,jaehing2,맛있었어요!^_^,2025-03-30,"저녁에 방문, 나들이, 지인・동료",고기 질이 좋아요,7,1
1483304539,hon****,막창 껍데기 꼬들살 너무 맛있어요~!,2025-03-30,"저녁에 방문, 예약 없이 이용, 대기 시간 바로 입장, 데이트, 연인・배우자",친절해요,8,1
1483304539,하늘이7351,고기도 맛있고 밑반찬이특히 맛있었어요❤️후라이팬 볶음밥은 마무리로꼭 시켜주세요^^번창하세요💕,2025-03-30,"점심에 방문, 예약 없이 이용, 대기 시간 바로 입장, 데이트, 일상, 친목, 연인・배우자",음식이 맛있어요,355,1
1483304539,HAIBARA I,맛있게 먹느라 사진 많이 찍지도 못했네요 ㅠㅠ 직원분들 너무 친절하시고 음식 양도 많고 너무 맛있어요!! 👍👍👍,2025-03-29,"저녁에 방문, 예약 없이 이용, 대기 시간 바로 입장, 데이트, 연인・배우자",음식이 맛있어요,18,2
1483304539,매일을 위대하게,고기맛집이에요밋도 좋고  친절하시고재방문할 예정요~^^,2025-03-27,"저녁에 방문, 예약 없이 이용, 대기 시간 바로 입장, 친목, 지인・동료",음식이 맛있어요,4,1
1483304539,Hyun96,"가격대비 너무 맛있고, 양도 많았습니다!배가 너무 고파서 사진은 못찍었지만, 진짜 강추 할만한 곳입니다!신촌에서 삼겹살먹는다면 앞으로 여기 올게요!!!",2025-03-23,"저녁에 방문, 예약 없이 이용, 대기 시간 바로 입장, 일상, 친구",음식이 맛있어요,7,1
1483304539,dbe****,고기 가성비만 해도 좋은데 반찬까지 너무 잘나오니까 밥한끼 먹기 정말 좋아요,2025-03-21,"점심에 방문, 예약 없이 이용, 대기 시간 바로 입장, 데이트, 연인・배우자",음식이 맛있어요,12,1
1483304539,코코롱59,친구와 삼겹살이 먹고 싶어서 왔는데 반찬종류도 많고 고기도 맛있어요 다음에 또 올게요 ❤️,2025-03-20,"저녁에 방문, 예약 없이 이용, 대기 시간 바로 입장, 친목, 친구",음식이 맛있어요,104,1
1483304539,hye****,,2025-03-17,"저녁에 방문, 예약 없이 이용, 대기 시간 바로 입장, 데이트, 연인・배우자",음식이 맛있어요,21,1
1483304539,seo****,고기 완전 맛있고 밑반찬도 맛이써영 된장찌개도 맛있게 잘 먹었ㅇ어용~^^,2025-03-16,"저녁에 방문, 예약 없이 이용, 대기 시간 바로 입장, 친목, 연인・배우자",인테리어가 멋져요,1,1
1483304539,DOEU,돈쟁반 세트 먹었는데 목살을 먼저 먹어서 그런지 목살이 가장 맛있었습니다.,2025-03-16,"저녁에 방문, 예약 없이 이용, 대기 시간 바로 입장, 데이트, 연인・배우자",고기 질이 좋아요,10,1
1483304539,둥이통이형이,"쟁반집8292 첫방문은 아이들과 갔었는데너무 맛있게 잘 먹더라구요.그래저 두번째 방문은 남편과 함께 갔어요. 먹는 내내 남편이 고기도 맛있고 찌개도 맛있고 반찬도 맛있다꼬....ㅎㅎㅎ아주 그냥  극찬을 하더라구요. 금액도 엄청 저렴하거덩요~ 사장님 너무 멋지신 분 왜 멋지냐,,,가보면 알게 되실꺼에요.",2025-03-16,점심에 방문,음식이 맛있어요,1085,2
1483304539,mshyuk,음식 맛있고 점심 정식 구성과 가격이 좋아요!아주머님도 친절하세요ㅎㅎ,2025-03-16,"점심에 방문, 예약 없이 이용, 대기 시간 바로 입장, 데이트, 연인・배우자",음식이 맛있어요,82,1
1483304539,뚜뚜220,짱,2025-03-15,"저녁에 방문, 예약 없이 이용, 대기 시간 30분 이내, 데이트, 연인・배우자",음식이 맛있어요,42,1
1483304539,지수둥이,너무 맛있고 사장님이 친절하세요,2025-03-14,"점심에 방문, 예약 없이 이용, 대기 시간 바로 입장, 데이트, 연인・배우자",음식이 맛있어요,16,1
1483304539,행운아61,고기는 기본이고 밑반찬이 넘 맛있네요~사장님도 정말 친절하시고  리뷰 보구왔는데믿을만 합니다~~정말 배부르게 잘먹고 갑니다~,2025-03-13,"점심에 방문, 예약 없이 이용, 대기 시간 바로 입장, 일상, 연인・배우자",음식이 맛있어요,995,1
1483304539,3자매,신촌만 왔다하면 먹으러 오는 고기집! 올때마다 사장님이 너무 반갑게 인사해주시고 고기도 너무 맛있어요! 여기는 진짜 오래오래 갔음 좋겟어요!,2025-03-13,"점심에 방문, 예약 없이 이용, 대기 시간 바로 입장, 일상, 부모님",인테리어가 멋져요,16,4
1483304539,Julia4889,"사장님이 친절하시고, 고기도 맛있었어요.다만 집게랑 가위등 위생에 조금만 더 신경써주시면 좋겠어요.",2025-03-12,"저녁에 방문, 예약 없이 이용, 대기 시간 바로 입장, 일상",음식이 맛있어요,99,1
1483304539,꼬꼬냥17,오랜만에 맛있는 저녁 식사 였습니다~!!가족들 모두 만족했습니다.나중에 또 오고 싶어요👍,2025-03-09,"저녁에 방문, 예약 없이 이용, 대기 시간 바로 입장, 가족모임, 연인・배우자, 아이",친절해요,29,1
1483304539,랏소다연,매장이 넓고 직원분들 정말 친절하세요 !!!맛있게 잘 먹었습니다 ♡,2025-03-09,"점심에 방문, 예약 없이 이용, 대기 시간 바로 입장, 데이트, 친목, 연인・배우자, 친구",음식이 맛있어요,57,1
1483304539,cap****,맛있고 친절해요,2025-03-09,"점심에 방문, 예약 없이 이용, 대기 시간 바로 입장, 데이트, 연인・배우자",음식이 맛있어요,18,2
1483304539,개굴ㅋ,회사 동료들과 함께갔는데 양도많고 너무 맛있게 잘먹었습니다:),2025-03-08,"저녁에 방문, 예약 없이 이용, 대기 시간 바로 입장, 친목, 지인・동료",음식이 맛있어요,58,1
1483304539,수리수리마수링,,2025-03-01,"점심에 방문, 예약 없이 이용, 대기 시간 바로 입장, 데이트, 연인・배우자",음식이 맛있어요,2,1
1483304539,진솔한리뷰남,"단체모임이 많아요 ! 고기도 삼겹, 목살, 항정, 특수 부위 다양해서 좋아여!",2025-02-28,"저녁에 방문, 예약 없이 이용, 대기 시간 바로 입장, 데이트, 연인・배우자",양이 많아요,27,1
1483304539,Leeseung6,가성비 너무 좋고 사장님이 엄청 친절하세요~ 맛있게 먹었습니다!!,2025-02-28,"점심에 방문, 예약 없이 이용, 대기 시간 바로 입장, 가족모임, 부모님",음식이 맛있어요,1,1
1483304539,jin****,맛있게 잘 먹었습니다,2025-02-26,"점심에 방문, 예약 없이 이용, 대기 시간 바로 입장, 가족모임, 연인・배우자, 아이",음식이 맛있어요,22,1
1483304539,post64,반찬 종류가 많고 돈쟁반 주문하니 여러 부위가 나와 다양하게 먹을 수 있었습니다 잘 먹고 갑니다!ㅎㅎ,2025-02-24,"저녁에 방문, 예약 없이 이용, 대기 시간 10분 이내, 친목, 가족모임, 부모님, 친척・형제",음식이 맛있어요,6,1
1483304539,대한 만세56,"고기도 맛있고 구성도 다양해요,가족끼리 오기좋아요",2025-02-23,"저녁에 방문, 예약 없이 이용, 대기 시간 바로 입장, 친목, 부모님, 친척・형제",음식이 맛있어요,18,1
1483304539,써니158,가성비 좋고 푸짐합니다,2025-02-23,"점심에 방문, 예약 없이 이용, 대기 시간 바로 입장, 일상, 부모님",음식이 맛있어요,963,1
1483304539,노는게젤져아,삼겹살 먹고 싶어서 왔는데 반찬도 많고 냉삼이랑 삼겹살 시켜서 고기도 되게 맛있어서 잘 먹었어요! 냉면도 먹었는데 시원하고 맛있었습니다!,2025-02-20,"저녁에 방문, 예약 없이 이용, 대기 시간 바로 입장, 데이트, 연인・배우자",매장이 넓어요,1309,1
1483304539,믿음68,세팅 기다릴 필요도 없이 뙇 나오는 푸짐한 쟁반 🥰 반찬도 맛있고 고기도 잘 먹었습니다!!🤗 최고!!,2025-02-20,"저녁에 방문, 예약 없이 이용, 대기 시간 바로 입장, 데이트, 연인・배우자",음식이 맛있어요,68,1
1483304539,hanabiraaa,고기 양도 많고 정말 맛있었어요! 된장도 정말 맛있어요!! 사장님도 친절하셨어요:),2025-02-20,"점심에 방문, 예약 없이 이용, 대기 시간 바로 입장, 데이트, 연인・배우자",음식이 맛있어요,21,1
1483304539,정빈933,신촌 맛집이라고 해서 바로 달려왔는데 사장님이 너무 친절하셔서 기분좋게 먹고 가용 ! 다음에 또 오고 싶은 맛집이에요,2025-02-18,"저녁에 방문, 예약 없이 이용, 대기 시간 바로 입장, 데이트, 연인・배우자",음식이 맛있어요,2,1
1483304539,Jin hit,친철하시고 맛잇어용,2025-02-18,"점심에 방문, 예약 없이 이용, 대기 시간 바로 입장, 데이트, 일상, 친척・형제",음식이 맛있어요,2,1
1483304539,son****,완밥하고 갑니다...넘 맛잇어요❤❤❤😍😍😍❤😍❤😍❤😍❤😍❤😍😍😍😍😍 반찬 구성도 완전 알차고 오미자에이드도 완전..✌🏻😛😛👍🏻👍🏻👍🏻,2025-02-17,"저녁에 방문, 예약 없이 이용, 대기 시간 바로 입장, 데이트, 연인・배우자",음식이 맛있어요,12,2
1483304539,dprincess,신촌에 놀러왔다가 방운했어요. 사장님도 친절하시고 음식도 맛있어요~ 고기질도 좋아요~,2025-02-17,"저녁에 방문, 예약 없이 이용, 대기 시간 바로 입장, 가족모임, 아이",음식이 맛있어요,19,1
1483304539,에이스뉴욕치즈케이크,만족합니다~~~고기 맛 좋아요,2025-02-15,점심에 방문,음식이 맛있어요,1547,1
1483304539,ner****,맛있게 잘 먹었습니당~,2025-02-15,"점심에 방문, 예약 없이 이용, 대기 시간 바로 입장, 친목, 친구",음식이 맛있어요,15,1
1483304539,rady,너무 맛있게 잘 먹었습니다!!💪,2025-02-14,"저녁에 방문, 예약 없이 이용, 대기 시간 바로 입장, 데이트, 연인・배우자",음식이 맛있어요,26,1
1483304539,skk****,진짜 너무너무 맛있어요!!! 제 여자친구가 막창이 특히 넘모 맛있대여!!! 또 방문하려구요🥹,2025-02-11,"저녁에 방문, 예약 없이 이용, 대기 시간 바로 입장, 데이트, 연인・배우자",음식이 맛있어요,17,1
1483304539,하이하이58,검색 해서 와 본 곳이에요 고기 질도 좋고 양도 적당해요 더욱이 사장님 과 직원분들이 친절 하셔서 기분 좋게 이용 할 수 있었어요 반찬 리필도 이야기 않해도 바로 바로 해 주시고 서비스도 좋아요👍,2025-02-10,"저녁에 방문, 예약 없이 이용, 대기 시간 바로 입장, 데이트, 연인・배우자",음식이 맛있어요,11,1
1483304539,츄릅looo,마감때 왔는데도 친절하게 응해주시고 음식도 맛있었어요:),2025-02-10,"저녁에 방문, 예약 없이 이용, 대기 시간 바로 입장, 데이트, 일상, 연인・배우자",음식이 맛있어요,166,1
1483304539,cha****,맛있고 친절해욤 레몬에이드가 너무 맛있어요 인테리어가 좋아요 번창하세요,2025-02-10,"점심에 방문, 예약 없이 이용, 대기 시간 바로 입장, 데이트, 친구",친절해요,5,1
1483304539,Yano,"고기맛도 느끼기 전에 손님관리좀 해주셨으면 좋겠습니다. 저희 세번째 방문인데, 오분이상 밥을 먹을수 없을 정도로 취객 관리가 너~~~~~~무 안되요 정말로 미치겠습니다.",2025-02-09,"저녁에 방문, 예약 없이 이용, 대기 시간 바로 입장, 데이트, 연인・배우자",컨셉이 독특해요,9,1
1483304539,dpd****,,2025-02-07,"저녁에 방문, 예약 없이 이용, 대기 시간 바로 입장, 데이트, 연인・배우자",음식이 맛있어요,163,1
1483304539,메그레즈23,사장님이ㅇ친절하세요~ ^^,2025-02-06,"저녁에 방문, 예약 없이 이용, 대기 시간 바로 입장, 친목, 지인・동료",가성비가 좋아요,267,1
1483304539,lkj****,양도 푸짐하고 반찬도 다 맛있었어요. 오랫만에 아빠랑 기분좋은 데이트 했습니다 ^^,2025-02-06,"점심에 방문, 예약 없이 이용, 대기 시간 바로 입장, 가족모임, 부모님",음식이 맛있어요,2267,1
1483304539,jjj45,맛있게 잘 먹었어요^^,2025-02-04,"점심에 방문, 예약 없이 이용, 대기 시간 바로 입장, 친목, 연인・배우자",가성비가 좋아요,3,1
1483304539,멋쟁이이이이,고기질도 좋고 사장님이 너무 친절하셔서 맛있는 식사했습니다!👍서비스도 많이 챙겨주시고 다음에 올 가치가 있어요!,2025-02-02,"저녁에 방문, 예약 없이 이용, 대기 시간 바로 입장, 나들이, 부모님",인테리어가 멋져요,39,1
1483304539,시은90,맛있는고기 잘 먹었습니다~!!,2025-02-02,"저녁에 방문, 예약 없이 이용, 대기 시간 바로 입장, 데이트, 연인・배우자",음식이 맛있어요,73,1
1483304539,h01141,너무 맛있어서 허겁지겁 먹다가 사진을 안찍었네요… 서울 놀러와서 쟁반집 신촌에서만 두번째 방문이에요 가성비 좋아요❤️ 사장님도 친절하십니다,2025-02-02,"점심에 방문, 예약 없이 이용, 대기 시간 바로 입장, 여행, 친구",음식이 맛있어요,303,2
1483304539,하영96,우연히 방문하게 되었는데 너무 맛있고 친절했습니다👍👍👍,2025-02-01,"저녁에 방문, 예약 없이 이용, 대기 시간 바로 입장, 데이트, 연인・배우자",매장이 넓어요,16,1
