place_id,nickname,content,date,situations,keywords,review_count,visit_count
1237621083,앙녕앙녕64,맛있어요,2025-04-07,"저녁에 방문, 예약 없이 이용, 대기 시간 바로 입장, 데이트, 연인・배우자",음식이 맛있어요,6,1
1237621083,shyu18,너무맛있어용!!,2025-04-06,"저녁에 방문, 예약 없이 이용, 대기 시간 10분 이내, 데이트, 연인・배우자",음식이 맛있어요,18,2
1237621083,다렁2,"모소리 한 판, 제주 된장찌개 먹고 왔어요.가오리, 모소리, 구멍, 뽈항정 구성의 특수부위를 먹을 수 있어요. 특히 모소리랑 뽈항정이 맛있었어요. 식감이 꼬들쫀득해서 좋았어요ㅠㅠ 제주 된장찌개도 진짜 대맛도리... 고기랑 두부랑 감자 등등 재료가 실하게 많이 들어있는데 국물도 끝내줍니당.. 멜젓, 재래기, 양배추 피클 등 밑반찬도 잘 나와요. 일요일 저녁인데도 6시 쯤 되니까 금방 만석이 되더라구요! 만족스러운 고깃집이었습니다😆",2025-04-06,"저녁에 방문, 예약 후 이용, 대기 시간 바로 입장, 데이트, 연인・배우자",음식이 맛있어요,75,1
1237621083,야옹88,사당역 근처 모소리집 맛있게 먹었었는데 금호에도 있었네요~!! 응봉산 갔다가 밥먹으러 왔는데 딱 좋아요!,2025-04-05,"저녁에 방문, 예약 없이 이용, 대기 시간 바로 입장, 데이트, 연인・배우자",아늑해요,28,1
1237621083,쿠키9456,사장님 너무 친절하시고 맛있어요!! 자주와요~^^,2025-04-04,"저녁에 방문, 예약 없이 이용, 대기 시간 바로 입장, 가족모임, 친척・형제",음식이 맛있어요,9,1
1237621083,ㅎㅎㅎㅎ6144,양배추 재래기에 한번 놀라고된장찌개 맛에 두번 놀란 아주 놀라운 집!양배추재래기가 이집 킥인데 아주 꼬숩고 맛도리💖된장찌개 진짜 미친맛임!!담에 밥 한공기 된장찌개랑 먹어줘야겟음고기도 연하고 맛있었오용~~,2025-04-04,"저녁에 방문, 예약 없이 이용, 대기 시간 바로 입장, 친목, 친구",음식이 맛있어요,14,2
1237621083,par****,"질 좋고 맛있는 특수부위, 꾸덕한 멜젓, 친절한 서비스!잘먹고 갑니다제주된장찌개는 밥이별도 길래 살짝 의아했지만 왠지 알 거 같아요. 너~~~무 건더기가 많고 맛도 끝내줍니다.냄비잡고 긁어먹은 고깃집 찌개 처음이에요",2025-04-04,"저녁에 방문, 예약 후 이용, 대기 시간 바로 입장, 데이트, 연인・배우자",음식이 맛있어요,10,1
1237621083,이서우8477,고기가 신선하고 맛있어요!! 직원분들이 친절하셔서 더 기분좋게 다녀왔습니다~ 또 올게요👍👍,2025-04-03,"저녁에 방문, 예약 후 이용, 대기 시간 바로 입장, 친목, 친구",음식이 맛있어요,49,1
1237621083,독기59,n차 방문이지만 매번 올때마다 맛있고 사장님 직원분들 친절하셔서 좋아요!,2025-03-30,"저녁에 방문, 예약 없이 이용, 대기 시간 바로 입장, 데이트, 연인・배우자",음식이 맛있어요,8,2
1237621083,인선7448,생각날때마다 방문 하는 모소리! 특수부위 맛있어서 가끔 생각나요 ㅎㅎ좀 늦었으면 웨이팅 할뻔 했는데 운좋게 바로 들어왔어요!!,2025-03-30,"저녁에 방문, 예약 없이 이용, 대기 시간 바로 입장, 데이트, 연인・배우자",음식이 맛있어요,17,1
1237621083,son****,오랜만에 정말 제대로 돼지고기에 특수부위 를 즐긴 금호 모소리 가게에요. 가게가 작은데 사람들이 정말 가득하고 끊임없이 방문해 주는 금호동 맛집 이랍니다. 특수부위를 제대로 맛보고 싶다면 저는 적극 추천하는 가게입니다,2025-03-29,"저녁에 방문, 예약 후 이용, 대기 시간 바로 입장, 데이트, 연인・배우자",음식이 맛있어요,483,1
1237621083,jsy****,,2025-03-26,"저녁에 방문, 예약 없이 이용, 대기 시간 10분 이내, 회식, 지인・동료",음식이 맛있어요,3,1
1237621083,Jong ari,먹느라 바빠서 한 점 올리고 찍은사진 밖에 없지만 … 너무 맛있고 항상 친절하십니다. 대기 무서워서 서둘러 왔는데 운 좋게도 바로 들어갔어요!잘먹고 가요! 다음에 또 오겠습니다!,2025-03-26,"저녁에 방문, 예약 없이 이용, 대기 시간 바로 입장, 친목, 친구",음식이 맛있어요,21,1
1237621083,GRoOVejANg2,처음먹어보는 특수부위였는데 넘 맛있었어요 저희가 굽는것도 계속 봐주시면서 더 맛있게 먹는법도 알려주시고~ 거기다 친절하시기까지♡ 또 가고싶어요~ 저녁시간에 갔는데 늦었으면 자리 없을뻔~ 또 갈께요!!!,2025-03-24,저녁에 방문,음식이 맛있어요,2448,1
1237621083,az****,금호동 고깃집 중 최애 맛집이에용늘 변함없이 맛있어요!!!,2025-03-24,"저녁에 방문, 예약 없이 이용, 대기 시간 바로 입장, 데이트, 연인・배우자",음식이 맛있어요,2,2
1237621083,cdghp,너무맛있어요! 잘먹었습니다,2025-03-23,"저녁에 방문, 예약 없이 이용, 대기 시간 바로 입장, 데이트, 친목, 일상, 연인・배우자, 친구, 지인・동료, 혼자",음식이 맛있어요,36,1
1237621083,리치맨8898,너무 친절하고 맛있어요. 자주 오는 곳이에요^^,2025-03-22,"저녁에 방문, 예약 없이 이용, 대기 시간 30분 이내, 가족모임, 아이",음식이 맛있어요,13,5
1237621083,지구소년65,,2025-03-22,"저녁에 방문, 예약 없이 이용, 대기 시간 10분 이내, 친목, 친구",음식이 맛있어요,14,1
1237621083,제로5237,친절한 서비스와 맛있는 고기에 단골하기로 마음먹었습니다! ⭐️,2025-03-21,"저녁에 방문, 예약 없이 이용, 대기 시간 10분 이내, 데이트, 연인・배우자",단체모임 하기 좋아요,39,1
1237621083,Daisy957,,2025-03-21,"저녁에 방문, 예약 없이 이용, 대기 시간 바로 입장, 데이트, 연인・배우자",음식이 맛있어요,37,1
1237621083,탄수녀,오랜만에 방문했는데 여전히 인기도 좋고맛도 좋아요 !! 금호동 맛집 인정입니다.,2025-03-20,"저녁에 방문, 예약 후 이용, 대기 시간 바로 입장",음식이 맛있어요,12,1
1237621083,지은주20,최고로 맛있어요 금호역 고기 맛집! 오랜만에 왔는데도 맛이 여전하고 아주 맛있습니다,2025-03-17,"저녁에 방문, 예약 후 이용, 대기 시간 바로 입장, 데이트, 연인・배우자",음식이 맛있어요,7,1
1237621083,jan****,너무 맛있습니다 다음에 또올게요~!,2025-03-15,"저녁에 방문, 예약 없이 이용, 대기 시간 바로 입장, 데이트, 연인・배우자",음식이 맛있어요,13,1
1237621083,lim****,,2025-03-14,"저녁에 방문, 예약 없이 이용, 대기 시간 10분 이내, 가족모임, 부모님",음식이 맛있어요,8,1
1237621083,ck****,굳,2025-03-14,"저녁에 방문, 예약 없이 이용",고기 질이 좋아요,945,1
1237621083,소리8789,존맛 단골예약입니다요,2025-03-13,"저녁에 방문, 예약 후 이용, 대기 시간 바로 입장, 친목, 친구",음식이 맛있어요,6,2
1237621083,jiy****,수요일 저녁에 방문했는데 여자사장님(?)께서 너무너무  친절하셨습니다! 고기도 맛있고 밑반찬도 맛있었는데 그 분 덕분에 더 좋은 기억으로 저녁식사를 했어요 :),2025-03-12,"저녁에 방문, 예약 없이 이용, 대기 시간 바로 입장, 데이트, 연인・배우자",음식이 맛있어요,24,1
1237621083,댕셔이,특수부위는 처음 먹어보는데 너무 맛잇었어용!!! 추천추천,2025-03-10,"저녁에 방문, 예약 없이 이용, 대기 시간 바로 입장, 친목, 친구",음식이 맛있어요,21,1
1237621083,sun****,본 리뷰는 해당 업처로부터 일부상품을 제공 받고 성실하게 작성한 리뷰입니다.특별한 식감의 돼지고기를 먹고싶을 때가족끼리 방문하는 단골식당사진속 양배추무침은 다이어트부담을 싹 잊게 만들만큼 고기랑 찰떡궁합입니다..,2025-03-09,"저녁에 방문, 예약 없이 이용, 대기 시간 10분 이내, 일상, 연인・배우자",음식이 맛있어요,15,1
1237621083,영화같은삶4742,"기본으로 나오는 양배추샐러드가 진짜 별미이고,특수부위 뒷고기 퀄리티 너무 좋았어요~추천합니다 :)",2025-03-07,"저녁에 방문, 예약 없이 이용, 대기 시간 1시간 이상, 데이트, 연인・배우자",음식이 맛있어요,10,1
1237621083,ooj****,불금을 모소리에서! 동네에 다니다가 처음 와보는데 고기도 맛나고 친절하시고 정겨워 좋네요^^가족과 왔는데요~또 올게요~ 찜콩!!ㅎㅎ,2025-03-07,"저녁에 방문, 예약 후 이용, 대기 시간 바로 입장, 가족모임, 아이",음식이 맛있어요,1,1
1237621083,yourbora,매번 줄 서 있어서 오고싶었는데 드디어 왔어요!매장은 좀 좁은감이 있지만 5시에 왔더니 줄 안서고 바로 입장했어요-!고기 너무 맛있어요-!!,2025-03-07,"저녁에 방문, 예약 없이 이용, 대기 시간 바로 입장, 가족모임, 연인・배우자, 아이",음식이 맛있어요,127,1
1237621083,깡다구88,모소리 부위는 처음 맛보는데 맛있네요. 강추합니다. 돼지 한마리 잡으면 300그람만 나온다네요,2025-03-06,"저녁에 방문, 예약 없이 이용, 대기 시간 바로 입장, 친목, 친구",음식이 맛있어요,4690,1
1237621083,shyu18,첫 방문인데 너무 맛잇게 먹었습니다!,2025-03-02,"저녁에 방문, 예약 없이 이용, 대기 시간 바로 입장, 데이트, 연인・배우자",인테리어가 멋져요,18,1
1237621083,Sol4227,너무 맛있었던 금호모소리!살면서 처음 먹어보는 부위들이 가득했어요.모소리살 가오리살 뽈항정 구멍살 고기도 신선하고 잡내도 없더라구요.특히 뽈항정이 식감이 꼬독꼬독한게 제 원픽이었습니다.역시 맛집이라 그런지 웨이팅도 있었지만 대기공간에 히터 빵빵하게 틀어주셔서 따뜻하게 기다렸어요.다음엔 꼭 6시 전에 가서 웨이팅 없이 먹어야겠어요..!,2025-03-02,"저녁에 방문, 예약 없이 이용, 대기 시간 30분 이내, 친목, 친구",음식이 맛있어요,108,1
1237621083,손이록,,2025-03-02,"저녁에 방문, 예약 후 이용, 대기 시간 바로 입장, 친목, 친구",음식이 맛있어요,15,1
1237621083,lav****,친절하고 맛있어요  작은 제 배가 안타까울뿐,2025-03-02,"저녁에 방문, 예약 후 이용, 대기 시간 바로 입장, 친목, 친구",음식이 맛있어요,5,1
1237621083,44you3397,진짜진짜 맛있는집!!!추천왕추천,2025-03-01,"저녁에 방문, 예약 없이 이용, 대기 시간 바로 입장, 데이트, 연인・배우자",음식이 맛있어요,15,2
1237621083,반짝ㅇ,"돼지특수부위 쫄깃쫄깃하구 맛있어요!! 개인적으론 가오리살, 구멍살이 맛남 😋",2025-03-01,"저녁에 방문, 예약 없이 이용, 대기 시간 바로 입장, 데이트, 연인・배우자",음식이 맛있어요,19,1
1237621083,choichoi11,돼지고기 특수부위는 이제 금호모소리 입니다.모두 고기의 다른 맛을 느낄수 있어요.,2025-02-27,"저녁에 방문, 예약 후 이용, 대기 시간 바로 입장, 데이트, 연인・배우자",음식이 맛있어요,192,1
1237621083,김영신35,개인적으로는 가오리살 1등인데 모소리살도 맛있어요 👍🏻껍데기랑 짜글이밥 꼭 추가하세요 *^^*,2025-02-25,"저녁에 방문, 예약 없이 이용, 대기 시간 바로 입장, 친목",음식이 맛있어요,28,1
1237621083,하응가10,너무 맛있게 잘먹었습니다ㅎㅎ 껍데기도 손수 구워주셔서 맛있게 잘 먹었습니다🙌🏻 담에 또올게용ㅎ짜글이밥 JMT,2025-02-24,"저녁에 방문, 예약 없이 이용, 대기 시간 바로 입장, 데이트, 연인・배우자",음식이 맛있어요,39,1
1237621083,yk097141,맛있어요. 역시 기대만큼 훌륭해요,2025-02-24,"저녁에 방문, 예약 없이 이용, 대기 시간 30분 이내, 친목, 연인・배우자",음식이 맛있어요,8,1
1237621083,pda****,고기 신선하고 맛있구요 잡내도 없는거같아요사장님도 친절하십니다찌개도 맛있어요!!,2025-02-24,"저녁에 방문, 예약 없이 이용, 대기 시간 10분 이내, 데이트, 연인・배우자",음식이 맛있어요,11,1
1237621083,els****,진짜 진짜 맛있는 고기집이에요집이랑 멀어서 갈까 말까 고민했는데 다음에 또 가려고요,2025-02-22,"저녁에 방문, 예약 없이 이용, 대기 시간 30분 이내, 데이트, 연인・배우자",음식이 맛있어요,6,1
1237621083,muf****,오랜만에모소리왔는데 예약기능이 생겼어요!!!여전히 앙배추들은 넘나 맛있고모소리랑 가오리랑 가로막살 먹었는데 각자 특색있고 한점한점 음미하며 먹을수있어 좋았어요!!!조만간 또올게요~~~이제 짜글이밥먹으러 갑니당ㅋㅋ,2025-02-22,"저녁에 방문, 예약 후 이용, 대기 시간 바로 입장, 데이트, 연인・배우자",음식이 맛있어요,4,1
1237621083,무엇73,"평소 맛집 찾아다니는 걸 좋아하는데요, 금호 모소리 색다른 고기이기도 하고 방문했는데 분위기도 넘 좋고 맛있네요!!! 강력 추천!!!",2025-02-22,"저녁에 방문, 예약 없이 이용, 대기 시간 바로 입장, 데이트, 연인・배우자",인테리어가 멋져요,47,1
1237621083,하몽랑,기대 만큼 맛있는 고기집입니다!!!!!강추입니당!!!🫶🏻,2025-02-21,"저녁에 방문, 예약 없이 이용, 대기 시간 바로 입장, 데이트, 연인・배우자",음식이 맛있어요,18,1
1237621083,프히히힘,일단 고기가 아묻따 맛있어요금액걱정없이 배부르게 먹을 수 있고요짜글이도 한톨도 안남기고 다 먹었구요...유리창쪽에 앉아서 추웠는데 담요가 삭 준비되오있어서 안춥게 먹을 수 있었오요 그리고 고깃집 특유의 미끌거림이 어디에도 없어요 바닥도 테이블도 빤딱빤딱해서 기분좋게 즐길 수 있습니다 호호호 언제먹어도 맛있어요,2025-02-21,"저녁에 방문, 예약 후 이용, 대기 시간 바로 입장, 친목, 지인・동료",음식이 맛있어요,21,1
1237621083,az****,항상 맛있어요 ㅠㅠ 직원분들 다 친절하시고 금호동 유일한 맛집입니다!!,2025-02-20,"저녁에 방문, 예약 없이 이용, 대기 시간 바로 입장, 데이트, 연인・배우자",음식이 맛있어요,2,1
1237621083,맛지이이입,오늘 처음와본 모소리살!소문으로만 듣던 모소리살!기대만큼 고기가 정말 맛있었다직원분도 친절하시구 고기가 정말 식감두 좋구 살살녹았다다음에 또 오고싶은 고깃집이에요:),2025-02-20,"저녁에 방문, 예약 없이 이용, 대기 시간 바로 입장, 친목, 나들이, 친구",음식이 맛있어요,91,1
1237621083,솔직25,모소리 항상 너무 맛있어요! 벌써 또또또또또간집입니다!,2025-02-20,"저녁에 방문, 예약 없이 이용, 대기 시간 바로 입장, 일상, 친척・형제",음식이 맛있어요,48,1
1237621083,쥬루중,여기 가오리살 왤케 맛있나요? ;; 처음 먹어보는 특수부위인데 진짜 너무 맛있어서 계속 시켜먹었어요 ㅠㅠ 다른 것도 다 맛있는데 가오리살이 레전드예요 된찌도 존맛이고 안에 고기도 엄청 들어가있어요 담에 가서 가오리살 죽을 때까지 시켜먹을게요,2025-02-18,"저녁에 방문, 예약 없이 이용, 대기 시간 바로 입장, 친목, 친구",음식이 맛있어요,36,1
1237621083,옐니니12,"동네에 있어서 늘 가봐야지 하다가 드디어 가게된 모소리! 돼지고기 특수부위 전문점이라 다른곳에서는 쉽게 먹어볼 수 없는 부위까지 골고루 먹어볼 수 있어 좋았습니다 :) 모둠 한판을 주문했는데 구성 대비 가격도 너무 만족스럽고 무엇보다 모든 부위가 맛있어서 감탄하면서 먹었어요. 개인적으로는 모소리살이랑 구멍살이 젤 맛있었는데 다른 부위도 각자 매력이 있어서 다음에 와도 모둠으로 먹을 것 같아요!특히 같이 곁들임으로 나오는 양배추 재래기가 맛도리더라구요 ㅎㅎ 밑반찬도 최고였습니다,,마지막 짜글이밥까지 단짠단짠한게 야무지게 잘 먹었습니다 :) 다시 또 방문할께요!!!🙌🏻🙌🏻",2025-02-16,"저녁에 방문, 예약 후 이용, 대기 시간 바로 입장, 데이트, 연인・배우자",단체모임 하기 좋아요,37,1
1237621083,heejin96,"특수 부위를 전문적으로 취급하는 곳이라 기대가 컸는데, 기대 이상으로 만족하고 왔습니다 먹어본 부위는 가오리살, 모소리살, 구멍, 뽈항정살이었습니다. 각각의 특징이 확연히 달라 하나하나 비교하며 먹는 재미가 있더라구요직원분이 고기의 최적의 굽기 타이밍을 세심하게 챙겨주셔서 처음 먹어보는 부위도 실패 없이 즐길 수 있었습니다. 매장 내부는 고깃집 특유의 활기찬 분위기지만, 깔끔하게 관리가 잘 되어 있어 쾌적했어요.재방문의사 무조건 있습니다 ㅎㅎ",2025-02-16,"저녁에 방문, 예약 후 이용, 대기 시간 바로 입장, 데이트, 연인・배우자",음식이 맛있어요,26,1
1237621083,잔소리돼지,오랜만에 방문했는데 여전히 맛있었습니다❤️엄청 친절하세요🤍 다음에 또 올게요😊🫶,2025-02-15,저녁에 방문,양이 많아요,18,1
1237621083,flowerpig77,맛있어사 일부러 또 방문 했어요 고기 왕왕 맛있아요 잘먹거 갑니다앙 담에 또 먹으러 갈께용~♡♡♡,2025-02-15,"저녁에 방문, 예약 없이 이용, 대기 시간 바로 입장, 친목, 친구",음식이 맛있어요,18,1
1237621083,알몬드,"중학생 아들과 처음 와 본 고기집인데, 고기도 잡내없이 너무 맛있고, 반찬이 다양하진 않지만 딱 어울리는 반찬만 있어요! 처음 먹어보는 양배추 무침이 아주 신선하고 맛있어요! 사장님과 직원 모두  정말 아주 친절하십니다!다음에 또 오고 싶어 질것 같은 식당이네요^^",2025-02-15,"저녁에 방문, 예약 없이 이용, 대기 시간 10분 이내, 일상, 아이",음식이 맛있어요,24,1
1237621083,mym****,"삼겹살, 목살만 먹다가 특수부위 먹는 것만으로도 색달라서 의미있었어요 ! 부위별로 맛이 다 다르고 각각의 매력들이 있어요 개인적으로 가오리살과 뽈항정살이 제일 맛있었습니다 ☺️ 사장님도 너무 친절하셔서 기분 좋은 방문이었습니다",2025-02-14,"저녁에 방문, 예약 후 이용, 대기 시간 10분 이내, 데이트, 연인・배우자",친절해요,50,1
1237621083,졍졍17,너무 쾌적하고 맛있어요 고기 냄새 하나도 안나고 깔끔해요또 올게용,2025-02-12,"저녁에 방문, 예약 후 이용, 대기 시간 바로 입장, 친목, 지인・동료",인테리어가 멋져요,17,1
1237621083,달려라 혬찌,특수부위 좋아하는데 너무 맛있었어요!부위 모두 맛있어서 거를게 없더라구요한판 다 먹고 추가해서 먹었답니다💗나중에 또 방문할게요 :),2025-02-09,"저녁에 방문, 예약 후 이용, 대기 시간 바로 입장, 데이트, 부모님",음식이 맛있어요,99,1
1237621083,sam****,너무 맛잇어요!!!!✨💕✨💕✨💕,2025-02-07,"저녁에 방문, 예약 없이 이용, 대기 시간 바로 입장, 친목, 친구",음식이 맛있어요,52,1
1237621083,뀨루우,고기질이 좋고 맛있어요. 직원분들도 친절하세요~금호역 근처 맛집 찾으시면 강추드려요!!,2025-02-07,"저녁에 방문, 예약 없이 이용, 대기 시간 바로 입장, 데이트, 연인・배우자",음식이 맛있어요,77,1
1237621083,jin****,친절하고 맛있습니다. 강추강추!!,2025-02-07,"저녁에 방문, 예약 없이 이용, 대기 시간 바로 입장, 데이트, 연인・배우자",음식이 맛있어요,2,1
1237621083,juana94,근처 사는 지인 추천으로 왔는데 고기랑 반찬 다 너무 맛있어요! 직원분들도 친절하셔서 넘 만족스러운 식사였습니다💕,2025-02-07,"저녁에 방문, 예약 없이 이용, 대기 시간 바로 입장, 데이트, 친목, 연인・배우자, 친구",음식이 맛있어요,38,1
1237621083,민돌옥,모소리한판 먹었는데 종류별로 나와서 너무 좋아요!모소리살이 제일 맛있어요 … 쫀득하니 짱맛 ..멜젓이랑 먹어도 맛있고 소금와사비에만 먹어도 맛있어요 🤍 그리고 짜글이밥 존맛이니 드세요 ㅠㅠㅠ 리조또 먹는 기분이라 의외로 넘 잘 어울려요! 직원분도 넘 친절하셔서 기분 좋게 먹고 갑니당,2025-02-05,"저녁에 방문, 예약 후 이용, 대기 시간 바로 입장, 데이트, 연인・배우자",음식이 맛있어요,114,1
1237621083,mer****,힁 진짜 최고다 너무 맛있어요! 🥹🥹,2025-02-02,"저녁에 방문, 예약 후 이용, 대기 시간 바로 입장, 친목, 나들이, 친구",음식이 맛있어요,2,1
1237621083,박석원67,이용할때마다 항상 친절하시고 맛있게 잘 먹고 있습니다.,2025-02-02,"저녁에 방문, 예약 없이 이용, 대기 시간 10분 이내, 데이트, 연인・배우자",음식이 맛있어요,1,1
1237621083,독기59,매번 올때마다 너무 맛있어요!!다양한 부위를 즐길수있어 좋아요,2025-02-02,"저녁에 방문, 예약 없이 이용, 대기 시간 30분 이내, 데이트, 연인・배우자",음식이 맛있어요,8,1
1237621083,해피나방,모소리살이 꼬들꼬들하니 기막히게 맛있어요 콜키지프리여서 와인 한병들고 남편이랑 자주 오는 맛집입니다. 된찌랑 짜글이밥도 필수입니다 넘 맛나요!!,2025-02-01,"저녁에 방문, 예약 없이 이용, 대기 시간 바로 입장, 데이트, 연인・배우자",음식이 맛있어요,7,2
1237621083,조채윤90,"메뉴가 특이한데 잡내없이 맛있고, 사장님이 친절하세요!!",2025-02-01,"저녁에 방문, 예약 없이 이용, 대기 시간 바로 입장, 데이트, 연인・배우자",음식이 맛있어요,11,1
1237621083,tmfrl0964,예약하고 처음 왔는데 특수부위 다 맛있고 사장님이 너무 친절해요~~~ 다음에 또 올게요,2025-01-28,"저녁에 방문, 예약 후 이용, 대기 시간 바로 입장, 친목, 친구",음식이 맛있어요,54,1
1237621083,mk0****,가게가 협소하지만 맛있고 인기도 엄청 많아용 다들 와보세요!,2025-01-26,"저녁에 방문, 예약 없이 이용, 대기 시간 바로 입장, 가족모임, 부모님",음식이 맛있어요,8,1
1237621083,해쨍맑음72,와 시장에 이런 멋집이 있을줄이야....! 특수부위 완전 다 맛있어요!! 쫄깃하고 고소한게 이런 맛집 오랜만에 봐요. 진짜 강추입니다!,2025-01-25,"저녁에 방문, 예약 후 이용, 대기 시간 바로 입장, 데이트, 연인・배우자",음식이 맛있어요,51,1
1237621083,lo****,다른곳에서 먹기힘든 특수부위 너무 맛있고 직원분들 너무 친절하시고 좋아요된찌가 에이스에요 너무 맛있고 술이 쭉쭉 들어갑니다 굿굿,2025-01-25,"저녁에 방문, 예약 없이 이용, 대기 시간 바로 입장, 친목, 지인・동료",음식이 맛있어요,33,1
1237621083,강아지7426,동네맛집으로 유명한데 첨 와봤어요! 맛있네요 ㅎㅎ 자주 방문할께요! ㅎㅎ,2025-01-25,"저녁에 방문, 예약 없이 이용, 대기 시간 바로 입장, 일상, 연인・배우자",음식이 맛있어요,10,2
1237621083,jin****,고기 완전 맛읶습니다!!! 굳이에유,2025-01-24,"저녁에 방문, 예약 없이 이용, 대기 시간 바로 입장, 데이트, 연인・배우자",음식이 맛있어요,260,1
1237621083,구리구리구구,너무맛있어요 특히 모소리살!,2025-01-24,"저녁에 방문, 예약 없이 이용, 대기 시간 10분 이내, 친목, 친구",음식이 맛있어요,35,1
1237621083,marni947,두번째 방문〰️동네 맛집임!금호동에서 맛있는 돼지고기 먹고싶다?특수부위 먹고싶다? 모소리금호 추천〰️연탄에 구워먹는 냄새안나고 질 좋은 고기! 직원분들도 전부 친절한 가게ㅎㅎ,2025-01-24,"저녁에 방문, 예약 후 이용, 대기 시간 바로 입장",음식이 맛있어요,15,1
1237621083,해피님29,고기도 너무 맛있도 껍데기가 진짜…! 대박이에요,2025-01-22,"저녁에 방문, 예약 없이 이용, 대기 시간 바로 입장, 친목, 친구",음식이 맛있어요,5,1
1237621083,jby8209,테이블 넘 깨끗하고 고기도 맛있어요ㅎㅎ 사장님께서 엄청 친절하십니다!!! 금호동 살면서 가끔씩 오는 맛집이에요ㅎㅎㅎ,2025-01-21,"저녁에 방문, 예약 없이 이용, 대기 시간 바로 입장, 데이트, 연인・배우자",음식이 맛있어요,100,2
1237621083,밍동딩동,"우리동네 맛집 1등,,언제나 맛있어서 감동,,",2025-01-21,"저녁에 방문, 예약 후 이용, 대기 시간 바로 입장, 친목, 친구, 지인・동료",음식이 맛있어요,8,1
1237621083,mcmstjd,맛있어요,2025-01-18,"저녁에 방문, 예약 후 이용, 대기 시간 바로 입장, 데이트, 친구",음식이 맛있어요,3,1
