place_id,nickname,content,date,situations,keywords,review_count,visit_count
1451092437,jjjin61,"천호 암사에서 막국수 잘하는 집으로 유명하더라구요~더운날 시원한 음식이 땡겼는데 아주 제대로 먹고왔어요ㅎㅎ자극적인 맛이 아니라 건강한 재료의 맛이 느껴졌고, 계속 손이가는 맛이에요.막국수 면발도 그렇고 육수도 시원~하고 깔끔해서 간만에 제대로 된 막국수 먹었습니다.메밀 부추전도 국수랑 곁들여먹기 진짜 좋아요.다음에 퇴근하고 혼밥하러도 다시 가야겠어요.여름에 더운날 자꾸만 생각날 것 같아요ㅎㅎ",2024-06-16,"저녁에 방문, 예약 없이 이용, 대기 시간 바로 입장, 데이트, 연인・배우자",음식이 맛있어요,63,1
1451092437,ckck37,비오늘 주말 한우시래기국밥에 부추전에 막걸리~환상의 조합 ^^아이들과 함께 갔는데 너무 맛있게 잘 먹었어요ㅎㅎ,2024-06-15,"점심에 방문, 예약 없이 이용, 대기 시간 바로 입장, 일상, 아이",음식이 맛있어요,50,1
1451092437,멋쟁이6064,맛있어요,2024-06-07,"점심에 방문, 예약 없이 이용, 대기 시간 바로 입장, 일상, 혼자",음식이 맛있어요,1922,1
1451092437,lee****,"비빔막국수, 메밀부추전 맛있어요",2024-05-28,점심에 방문,음식이 맛있어요,2042,1
1451092437,초코송이쏭이,개인적으로 국밥보다는 메밀소바가 맛있었습니다!,2024-05-25,"저녁에 방문, 예약 없이 이용, 대기 시간 바로 입장, 데이트, 연인・배우자",컨셉이 독특해요,1388,1
1451092437,똑똑똑34,우리 동네  맛집중하나인데 시레기 한우 국밥.막국수만  맛있는줄 알았더니 부추메밀전  짱 망있어요!!,2024-05-24,"저녁에 방문, 예약 없이 이용, 대기 시간 바로 입장, 일상, 연인・배우자",음식이 맛있어요,731,7
1451092437,맛잘알교수,"친구가 소개해 줘서 방문한 곳인데 와 진짜 맛있었어요!들깨비빔막국수 꼭 시켜줘야 한다고 해서 시켰는데 진짜 고소하고 넘 마싯,,,, 청양고추도 썰어져나와서 매콤한 맛도 느낄 수 있고 진짜 맛있더라고요. 시래기국밥도 주문했는데 안에 시래기 한 가득과 전복도 들어있더라고요? 양도 진짜 많고 오직 우리동네막국수국밥에서만 맛 볼 수 있는 맛이라 재방문의사 100%입니다.",2024-05-23,"저녁에 방문, 예약 없이 이용, 대기 시간 바로 입장, 가족모임, 부모님",음식이 맛있어요,225,1
1451092437,jem****,맛있어요,2024-05-21,"점심에 방문, 예약 없이 이용, 대기 시간 바로 입장, 일상, 지인・동료",음식이 맛있어요,1941,1
1451092437,qnw****,암사역 초역세권 맛집이에용혼밥부터 반주까지 가능한 맛집입니다,2024-05-19,"점심에 방문, 예약 없이 이용, 대기 시간 바로 입장, 일상, 부모님",음식이 맛있어요,278,1
1451092437,반짝반짝빛나는맛나니,맛있어서 좋아요,2024-05-15,점심에 방문,음식이 맛있어요,1102,2
1451092437,반짝반짝빛나는맛나니,암사맛집 강추혼밥가능,2024-05-04,저녁에 방문,음식이 맛있어요,1102,1
1451092437,청담동 유상무,"우연히 지나다 들른 막국수집 입니다. 9천원짜리 국밥도 많이 드시네요. 김치부터 막국수와 국밥 모두 직접 만드는 맛집입니다. 자세한 리뷰는 네이버 블로그 청담동 유상무, 유상무의 하루하루에 리뷰 올렸습니다.",2024-04-30,"점심에 방문, 예약 없이 이용, 대기 시간 바로 입장, 일상, 친구",음식이 맛있어요,392,1
1451092437,tkd****,굿,2024-04-20,"점심에 방문, 예약 없이 이용, 대기 시간 바로 입장, 일상, 기타",음식이 맛있어요,607,4
1451092437,SK다회선인터넷직영점44,그냥 들어가서 먹었는데 시레기국밥에 소고기와  전복이 함께들어있네요. 한끼 든든하게 잘 먹었습니다.,2024-04-18,"밤에 방문, 예약 없이 이용, 대기 시간 바로 입장, 일상, 혼자",음식이 맛있어요,406,1
1451092437,견적안나와,"이제 동네에 알만한 사람들은 아는 맛집 고기도 많고 우거지도 많아서 한끼 식사로 든든 12,000원 !",2024-04-10,"저녁에 방문, 예약 없이 이용, 대기 시간 바로 입장, 일상, 연인・배우자",친절해요,268,4
1451092437,tkd****,굿,2024-04-06,"점심에 방문, 예약 없이 이용, 대기 시간 바로 입장",음식이 맛있어요,607,3
1451092437,섬김의본,괜찮아요.,2024-03-31,"점심에 방문, 예약 없이 이용, 대기 시간 바로 입장, 일상, 지인・동료",음식이 맛있어요,2254,2
1451092437,som****,좋아요,2024-03-26,"점심에 방문, 포장·배달 이용, 대기 시간 10분 이내",음식이 맛있어요,1637,5
1451092437,지토42,굿,2024-03-26,"점심에 방문, 예약 없이 이용, 대기 시간 바로 입장, 일상, 지인・동료",음식이 맛있어요,2820,7
1451092437,tkd****,굿,2024-03-23,"저녁에 방문, 예약 없이 이용, 대기 시간 바로 입장, 일상, 기타",음식이 맛있어요,607,2
1451092437,탱삼3,부추전이랑 만두 진짜 맛있어요같이 나오는 양념장이 포인트!!,2024-03-19,저녁에 방문,음식이 맛있어요,255,2
1451092437,지토42,굿,2024-03-19,"점심에 방문, 예약 없이 이용, 대기 시간 바로 입장, 일상, 친구",음식이 맛있어요,2820,6
1451092437,som****,굿,2024-03-19,"밤에 방문, 예약 후 이용, 대기 시간 10분 이내, 나들이",특별한 메뉴가 있어요,1637,4
1451092437,yhk****,좋아요,2024-03-17,"점심에 방문, 예약 없이 이용, 대기 시간 바로 입장, 가족모임, 부모님",,689,2
1451092437,tkd****,굿,2024-03-16,"점심에 방문, 예약 없이 이용, 대기 시간 바로 입장, 일상, 기타",음식이 맛있어요,607,1
1451092437,코코땡쓰,:),2024-03-11,"점심에 방문, 예약 없이 이용, 대기 시간 10분 이내, 일상, 연인・배우자",음식이 맛있어요,803,1
1451092437,6검사시너지8,양이 조금 줄어든것 같은 느낌맛 위생 좋음,2024-03-09,"저녁에 방문, 예약 없이 이용, 대기 시간 바로 입장, 일상, 혼자",,75,2
1451092437,yhk****,맛있고 좋아요,2024-03-06,"점심에 방문, 예약 없이 이용, 대기 시간 바로 입장, 일상, 부모님",음식이 맛있어요,689,1
1451092437,장난구렁이,비빔막국수 맛있어영,2024-02-24,"밤에 방문, 예약 없이 이용, 대기 시간 바로 입장, 친목, 친구",음식이 맛있어요,168,1
1451092437,som****,굿,2024-02-17,저녁에 방문,음식이 맛있어요,1637,3
1451092437,자몽에이드7586,혼밥 자리도 있고 무엇보다 맛있어요 든든하게 점심 잘 먹었습니다,2024-01-26,"점심에 방문, 예약 없이 이용, 대기 시간 바로 입장, 일상, 혼자",음식이 맛있어요,215,1
1451092437,섬김의본,좋아요.,2024-01-21,"점심에 방문, 예약 없이 이용, 대기 시간 바로 입장, 일상, 지인・동료",음식이 맛있어요,2254,1
1451092437,쵸코케잌,든든하게 한끼 먹을 수 있어서 좋았어요. 한우시래기국밥 추천합니다.,2024-01-20,"점심에 방문, 예약 없이 이용, 대기 시간 바로 입장, 친척・형제",음식이 맛있어요,115,1
1451092437,따봉9541,국밥맛집,2024-01-18,"저녁에 방문, 예약 없이 이용, 대기 시간 바로 입장, 데이트, 연인・배우자",음식이 맛있어요,571,1
1451092437,sokangnara,맛있어요,2024-01-18,점심에 방문,음식이 맛있어요,2283,8
1451092437,dre****,"가성비가 좋고 맛있어서 자주 방문하는 곳이에요.오늘도 역시나 대만족이었습니다.소머리국밥2, 굴전, 비빔막국수 강추합니다.",2024-01-13,"점심에 방문, 예약 후 이용, 대기 시간 바로 입장, 데이트, 연인・배우자",음식이 맛있어요,19,1
1451092437,jydnc,건강한 맛이에요 여러가지 메뉴인데도 맛이 제대로 납니다,2024-01-07,"저녁에 방문, 예약 없이 이용, 대기 시간 바로 입장, 일상, 연인・배우자",음식이 맛있어요,536,1
1451092437,sokangnara,맛있어요ㅎㅎ,2024-01-02,아침에 방문,양이 많아요,2283,7
1451092437,lun****,음식이 맛있어요.,2023-12-27,"저녁에 방문, 예약 없이 이용, 대기 시간 바로 입장, 일상, 친구",음식이 맛있어요,142,1
1451092437,charmingCho,숨은 맛집이넹,2023-12-26,"점심에 방문, 예약 없이 이용, 대기 시간 바로 입장, 일상, 혼자",음식이 맛있어요,1142,1
1451092437,기타맨40,들깨비빔막국수를 맛있게 먹어서 한우시래기국밥도 나름 기대했는데.. 8시 넘어서 마감이 가까워 그랬는지 원래 그런지 블로그 리뷰들에 비해 고기 크기도 정말 작고 얇고 그마저도 거의 없었어요.. 그래 한우라는데 기대한 내가 바보지 하고 시래기랑 전복으로 마음을 달래며 먹고 나왔는데.. 먹고 나온지 30분도 안됐는데 벌써 배고파요..제가 제일 싫어하는 상황이 바깥에서 음식 사먹고 바로 배고파져 다른걸 또 사먹거나 해야되는 건데.. 막국수가 좋았기에 아쉬움이 더 큽니다. 전복을 빼고 소고기 양을 늘려주시는게 차라리 메뉴 이름에 충실할 것 같습니다. 앞으로는 막국수만 먹으러 가야겠어요. 그래도 소머리국밥은 리뷰 보면 고기가 좀 큼직한듯 하니 처음 가시는 분들 참고하세요,2023-12-23,"저녁에 방문, 예약 없이 이용, 대기 시간 바로 입장",반찬이 잘 나와요,10,1
1451092437,did****,"한우시래기국밥, 비빔막국수 둘다담백하고 건강한맛양도 무지 많습니다!가게 인테리어도 밝고 따뜻한 느낌이고혼밥하러오시는 남성분들이 많은듯해서동네 찐맛집이구나 싶었어요",2023-12-10,"저녁에 방문, 예약 후 이용, 대기 시간 바로 입장, 데이트, 연인・배우자",음식이 맛있어요,24,1
1451092437,더지씨,국밥과 막국수 맛있습니당~~^^ 음식 나오는 시간은 조금 걸리는 편이에요~~,2023-12-08,저녁에 방문,음식이 맛있어요,608,1
1451092437,Swsw48,굿,2023-12-07,"점심에 방문, 예약 없이 이용, 대기 시간 10분 이내, 나들이, 지인・동료",음식이 맛있어요,879,1
1451092437,냥이4마리,안간사이 가격이 쫌 올랐네요주위에이런맛 내는 곳 없어서 자주가요,2023-12-05,"점심에 방문, 예약 없이 이용, 대기 시간 바로 입장, 일상, 친구",음식이 맛있어요,492,3
1451092437,6검사시너지8,국수 종류는 양에 비해서 비싸다고 생각함 국밥도 비싸긴한데 맛있음 돈이 많은 사람한테는 최고의 국밥집,2023-12-03,"점심에 방문, 예약 없이 이용, 대기 시간 바로 입장, 일상, 혼자",특별한 메뉴가 있어요,75,1
1451092437,sokangnara,굿,2023-12-03,점심에 방문,음식이 맛있어요,2283,6
1451092437,Dragon JK,굿,2023-11-30,"점심에 방문, 예약 없이 이용, 대기 시간 바로 입장, 친목, 친구",음식이 맛있어요,715,1
1451092437,솜사탕1236,good,2023-11-30,"밤에 방문, 예약 없이 이용, 대기 시간 바로 입장, 친목, 친구",음식이 맛있어요,694,1
1451092437,airen0200,쌀쌀한나씨에 딱이네여어제도가고 오늘도가고 맛도있고 질리지도안네ㅇㅕ ㅋㅋ맛있져요~^.^,2023-11-28,"점심에 방문, 예약 없이 이용, 대기 시간 바로 입장, 친목, 친구",음식이 맛있어요,2527,2
1451092437,airen0200,동네에 새로생겨서 가봤는데 어머!!이게 머선129 넘 맛있잖아요시레기소고기국밥..가격도 착하고 맛도있도 앞느로 단골될듯요...저장,2023-11-26,"점심에 방문, 예약 없이 이용, 대기 시간 바로 입장, 일상, 연인・배우자",음식이 맛있어요,2527,1
1451092437,김뿅뿅짱,암사동에 괜찮은 막국수집이 있었네요가격도 착한데 양도 많아요 😍면은 툭툭 끊길 것 같은 색깔이지만쫄깃쫄깃한 식감입니다. 제 기준 면이 조금 아쉬운데 참기름?넣은 새콤달콤 고소한 국물이 너무 맘에 들어서 재방문의사 10000%,2023-11-18,"저녁에 방문, 예약 없이 이용, 대기 시간 바로 입장, 일상, 혼자",음식이 맛있어요,687,1
1451092437,신난다신나50,음식 맛있고 든든해요,2023-11-17,"점심에 방문, 예약 없이 이용, 대기 시간 바로 입장, 친목, 친구",음식이 맛있어요,413,1
1451092437,똑똑똑34,여름동안 메밀 막국수 많이 먹었는데날씨가 쌀쌀해져  한우시래기국밥 먹었는데  역시 맛있어요!!!,2023-10-21,저녁에 방문,음식이 맛있어요,731,6
1451092437,jjo****,한우시래기국밥은 좀 느끼한 듯해서 깍두기랑 먹으니 시래기도 많고 괜찮아요. 깍두기가 맛있어서 밥이랑도 잘 먹었네요. 시래기 만두 좀처럼 볼 수 없는 것인데 담백하고 피도 쫄깃하고 훌륭했어요. 냉막국수 면도 도톰해서 씹는 맛이 아주 좋고 육수에 식초 넣고 먹으니 상큼한게 너무너무 맛있네요~ 친절하시고 아주 만족하고 갑니다.,2023-10-18,점심에 방문,음식이 맛있어요,1358,1
1451092437,kwy****,굿,2023-10-13,밤에 방문,매장이 넓어요,1051,3
1451092437,lriskelly,먹을만해요,2023-10-10,저녁에 방문,,779,2
1451092437,marubin,맛있다고해서 들러봤습니다~네이버가격하고 다르네요~더 올랐나봅니다그러나 시래기를 좋아해서 용서해(?)줍니다맛있어요,2023-10-10,저녁에 방문,음식이 맛있어요,1875,1
1451092437,kwy****,굿,2023-10-08,저녁에 방문,음식이 맛있어요,1051,2
1451092437,얌냠62,고기듬뿍 시래기듬뿍찬바람 불때 뜨끈한 국물 최고예요,2023-10-07,저녁에 방문,음식이 맛있어요,2509,2
13160969,jem****,맛있어요,2025-04-03,"저녁에 방문, 예약 없이 이용, 대기 시간 바로 입장, 일상, 지인・동료",음식이 맛있어요,1941,3
13160969,giltrip,매장에서 먹진 않았지만 포장해와서 먹어도 맛잇는 마법,2025-03-16,"점심에 방문, 예약 없이 이용, 대기 시간 바로 입장, 부모님",음식이 맛있어요,110,1
13160969,아름다운hee,맛있어요,2025-02-13,"저녁에 방문, 예약 없이 이용, 대기 시간 바로 입장, 일상, 지인・동료",음식이 맛있어요,1123,4
13160969,친절한 진이씨4,쫄깃한 아구찜을 정~말 좋아하는 1인입니다 암사에 거주하며 종로 등 멀리서만 찾아다녔더랬죠 암사역 근방 맛있는 저녁을 찾아 하이에나 처럼 걷던 중 마주친 아구타운! 손님으로 꽉 차있던 홀을 보고 도전했더니 역시나 맛이 끝내줍니다 중간 매운맛으로 도전했는데 맛이 강하지 않고 너무 좋았어요 볶음밥 건너뚸면 예의가 아닌지라 한판 뚝딱 해주고요~ 김치 곁들여주니 맛은 배가되었드랬죠 같이 나오는 찬 역시 흠잡을게 없고 다음엔 아구탕도 꼭 먹어보려구요 벌써부터 엔제 다시올지 생각하는 거 보면 참 맛집을 찾았구나 싶네요 추천 드립니다~사장님 너무 친절친절. 맛도 최고 더할게없네요  다음엔  아구 지리탕에 도전 해 보려합니당 👍👍👍👍❤👍️❤️❤️❤️❤️,2025-01-26,"저녁에 방문, 예약 없이 이용, 대기 시간 10분 이내, 데이트, 친목, 일상, 기념일, 회식, 가족모임, 비즈니스, 연인・배우자",음식이 맛있어요,21,1
13160969,채똥언니,여기를 왜 이제 알았을까요?홍보 1도 안하는 숨은 맛집 인듯요.예약 미리 하고 갔는데 주말 저녁시간 만석이었어요.미리 주문하고 간 덕에 음식도 바로 나왔는데 맛있게 잘 먹었어요재료도 싱싱하고 짜지않고 간이 잘 맞더라구요양도 많고 볶음밥도 굿굿 👍 해물찜 먹고 볶음밥 꼭 드세요!!!,2025-01-26,"저녁에 방문, 예약 후 이용, 대기 시간 바로 입장, 기념일, 아이, 부모님",음식이 맛있어요,190,1
13160969,용비연97,아구찜,2025-01-19,"저녁에 방문, 예약 없이 이용, 대기 시간 바로 입장, 일상, 부모님, 친척・형제",음식이 맛있어요,1502,2
13160969,아름다운hee,맛있어요,2024-12-18,"저녁에 방문, 예약 없이 이용, 대기 시간 바로 입장, 일상, 지인・동료",음식이 맛있어요,1123,3
13160969,cap****,굿,2024-12-09,저녁에 방문,가성비가 좋아요,518,3
13160969,cap****,굿,2024-11-23,저녁에 방문,음식이 맛있어요,518,2
13160969,cap****,굿,2024-10-25,"점심에 방문, 포장·배달 이용",음식이 맛있어요,518,1
13160969,all31,,2024-10-23,점심에 방문,음식이 맛있어요,1675,1
13160969,산수유5419,ㄱ,2024-10-16,저녁에 방문,,2293,1
13160969,gus****,맛있어요,2024-10-10,"저녁에 방문, 예약 없이 이용, 대기 시간 바로 입장, 나들이, 지인・동료",재료가 신선해요,79,1
13160969,han****,맛있고 합리적가격,2024-09-22,"점심에 방문, 예약 없이 이용, 대기 시간 바로 입장, 친목, 친구",특별한 메뉴가 있어요,1033,14
13160969,조모시기,굳,2024-09-20,"점심에 방문, 예약 없이 이용, 대기 시간 바로 입장, 나들이, 친구",음식이 맛있어요,434,2
13160969,gaa****,주인이 바뀌었나요?예전엔 맛이었는데 이번에 포장해서먹었는데 두번 다시 안가요.미원 맛이 너무 세고.고추가루 색도 색소 탓인지부자연스런 색이네요.맛 없었어요.,2024-09-19,"저녁에 방문, 포장·배달 이용",메뉴 구성이 알차요,11,1
13160969,꽃지언니짱,맛~~~ 굿👍양도~~~ 많아요살 쪽으로 주세요 이야기하면 껍데기 없는 살 쪽 주신다요^^,2024-09-15,저녁에 방문,음식이 맛있어요,898,2
13160969,ssu****,양도 많고 맛있어요~,2024-09-08,"저녁에 방문, 포장·배달 이용, 대기 시간 30분 이내, 나들이",음식이 맛있어요,196,3
13160969,jun****,좋아요,2024-09-07,"점심에 방문, 예약 없이 이용, 대기 시간 바로 입장",음식이 맛있어요,1326,1
13160969,토토슬,맵기도 적당하고 아구 식감도 좋아서쏘맥 석잔 마실 거 일곱잔 마셨네요 ^^,2024-09-05,"저녁에 방문, 예약 없이 이용, 대기 시간 바로 입장, 친목, 친구",음식이 맛있어요,470,1
13160969,임경훈16,"일단 거기서 일하시는 따님이 딱딱히 불친절합니다 저는 반려동물이 있어서 가기전에 데리고갔는지 물어보았고 된다기에 데리고갔는데 담부턴 딱딱하게 데리고오지 말라네요 솔직히 이럴거면 처음부터 안갔을거고 그 따님은 손님이 싫다해서 그런거라그러는데 제눈에는 거슬리니까 밖에 안보이네요 일단 거기 사장님, 따님 딱딱하구요 음식맛은 좋을지모르나 서비스는 안좋습니다. 특히 따님은 거기 일하면 안될거같네요(거기 직원이 주인인듯?) 개인적인 생각이고 다시 갈생각없습니다.",2024-08-31,"점심에 방문, 예약 후 이용, 대기 시간 30분 이내, 나들이, 반려동물",양이 많아요,5,1
13160969,복숭아 향기님,"💝 아구타운 암사점 💝아구탕 지리로 포장민물새우, 콩나물, 야채등 깔끔하고정갈한 맛👍👍👍 장금이가 울고 가겠어요. 🥘요리를 너무 잘하셔서요.반찬도 다~~ 맛나고 정성이 느껴져요.재방문하겠습니다  💯💯💯💯💯💝 아구타운 암사점 💝",2024-08-22,"점심에 방문, 포장·배달 이용, 대기 시간 바로 입장, 여행, 지인・동료",음식이 맛있어요,149,6
13160969,신승우76,해물찜 매운맛을 맵기로 지정해서 시켰는데 양도 많고 해물도 끝도없이 나와요 볶음밥까지 너무 완벽하고 소짜리인데도 둘이서 먹어도 양이 너무 많아서 남았어요 또 먹고 싶어서 앞으로 자주 갈것 같아요 번창하세여 !!,2024-08-14,"저녁에 방문, 예약 없이 이용, 대기 시간 바로 입장, 데이트, 친목, 연인・배우자, 친구",인테리어가 멋져요,26,1
13160969,예솔짱,해물찜 소 (매운맛) + 볶음밥 먹었습니당 .ᐟ.ᐟ.ᐟ 소 사이즈인데 양도 많고 매운맛도 불닭볶음면 정도의 맵기라서 좋았어요 🫡🫶  날이 많이 더워서 입맛이 없었는데 맛있게 매워서 찜 싹 다 먹고 볶음밥까지 마무리로 먹을만큼 맛있게 먹었어요...🤤밑반찬들도 여러가지 나와서 술안주로 먹어도 좋을 것 같아요 !! 다음에는 술이랑 함께 또 먹으로 갈거에요 !!암사역 맛집으로 강추✨합니당 ദ്ദി꒰⁎ ᵔᵒᵔ ⁎꒱ദ്ദി ❤︎,2024-08-14,"저녁에 방문, 예약 없이 이용, 대기 시간 바로 입장, 친목, 친구",음식이 맛있어요,19,1
13160969,가을하늘558,맛있어요,2024-08-05,"점심에 방문, 예약 없이 이용, 대기 시간 바로 입장, 일상, 연인・배우자",음식이 맛있어요,1226,10
13160969,아름다운hee,동태탕 국물이 끝네줘요~~^^,2024-07-24,"저녁에 방문, 예약 없이 이용, 대기 시간 바로 입장, 일상, 지인・동료",음식이 맛있어요,1123,2
13160969,아름다운hee,정말 맛있어요,2024-07-18,"저녁에 방문, 예약 없이 이용, 대기 시간 바로 입장, 일상, 지인・동료",음식이 맛있어요,1123,1
13160969,잇힝0408,해물도 다 신선하고 맛있어요😊,2024-07-15,"점심에 방문, 예약 없이 이용, 대기 시간 바로 입장, 가족모임, 연인・배우자, 아이, 부모님",음식이 맛있어요,1054,1
13160969,hyu****,양이푸짐합니다,2024-06-23,"저녁에 방문, 예약 없이 이용, 대기 시간 바로 입장, 일상",양이 많아요,840,1
13160969,myungsun69,굿이요,2024-06-13,"점심에 방문, 예약 없이 이용, 대기 시간 바로 입장, 데이트, 친목, 지인・동료",음식이 맛있어요,1781,9
13160969,lani124,^^,2024-06-01,점심에 방문,음식이 맛있어요,1431,1
13160969,han****,가성비 좋고 찬절한 서비스,2024-05-18,"점심에 방문, 예약 없이 이용, 대기 시간 바로 입장, 지인・동료",가성비가 좋아요,1033,13
13160969,thwjd1918,지인들과 건강한 음식 먹기 좋은 곳입니다,2024-03-30,"저녁에 방문, 예약 없이 이용, 대기 시간 바로 입장, 친목, 지인・동료",음식이 맛있어요,644,2
13160969,강동녹두장군천호대첩,"분명히 맛은 똑같이 좋은데 아구 조각이 너무 없네?소식좌로서 늘 남겨서 싸갔는데 이제는 콩나물만이 덩그러니 남아 있을 뿐,,, 심각한 물가 상승 문제에 파월형님이 떠오르네,,",2024-03-25,"저녁에 방문, 예약 없이 이용, 대기 시간 바로 입장, 지인・동료",음식이 맛있어요,445,3
13160969,ljs****,굿굿굿,2024-03-15,"저녁에 방문, 예약 후 이용, 대기 시간 바로 입장, 친목, 친구",음식이 맛있어요,1668,1
13160969,희야7233,.,2024-02-25,"저녁에 방문, 예약 없이 이용, 대기 시간 바로 입장, 친목, 친구",음식이 맛있어요,770,1
13160969,좋았던곳만만리뷰남겨요,맛있어요,2024-02-07,"저녁에 방문, 예약 없이 이용, 대기 시간 바로 입장, 데이트, 일상, 연인・배우자",음식이 맛있어요,89,1
13160969,꽃지언니짱,맛나요,2024-01-18,"저녁에 방문, 예약 없이 이용, 대기 시간 바로 입장, 친목, 지인・동료",음식이 맛있어요,898,1
13160969,건행사랑,맛집,2024-01-15,"저녁에 방문, 예약 없이 이용, 대기 시간 바로 입장",음식이 맛있어요,406,2
13160969,강동녹두장군천호대첩,아구찜 넘나 맛있는고오,2024-01-08,"저녁에 방문, 예약 없이 이용, 대기 시간 바로 입장, 지인・동료",음식이 맛있어요,445,2
13160969,eve****,언제 먹어도 맛있네요~👍,2024-01-06,저녁에 방문,음식이 맛있어요,1122,1
13160969,cha****,"일단 저렴하고,양 적당하고,맵기조절가능하고,싱싱합니다. 어른들 위주의 맛집 스멜입니다 젊은 사람 저희뿐이었어요 그만큼 맛집! 아구찜이지만,  칼국수 추가 부탁 들어주셔서 양념에 맛나게 비벼 먹고 아구찜 소주두병 맥주 54,000원 나왔습니다. 아구찜 좋네요.감사합니다.",2023-12-25,"저녁에 방문, 예약 없이 이용, 대기 시간 바로 입장, 데이트, 일상, 연인・배우자",음식이 맛있어요,24,1
13160969,yhk****,지인과 같이 갔는데 멋은 그렇네요 괜찮음,2023-12-01,"저녁에 방문, 예약 없이 이용, 대기 시간 바로 입장, 일상, 지인・동료",,689,2
13160969,jem****,맛있어요,2023-11-06,저녁에 방문,음식이 맛있어요,1941,2
13160969,쥬에리,알탕이 1만원이네요 가성비좋은거같아요 열심히 먹느라 사진이없네요,2023-11-04,점심에 방문,음식이 맛있어요,824,1
13160969,이리스3046,친절한 직원과 사장님 아귀찜도 맛있고 밑반찬도 맛있어요자주 가는  식당 이랍니다,2023-11-04,점심에 방문,음식이 맛있어요,384,2
13160969,강동녹두장군천호대첩,아구찜 또 이 정도로 맛있기 딱히 막 엄청 쉽고 그런거 아니잖아요? 늘 손님이 붐비는 것에는 합당한 이유가 있는 법.맵기 조절 가능하고 볶음밥 너무 맛있고. 오늘도 소맥 잘 먹고 갑니다. 맨날 싸가서 ㅈㅅ합니다. -소식좌 올림-,2023-10-11,저녁에 방문,음식이 맛있어요,445,1
