place_id,nickname,content,date,situations,keywords,review_count,visit_count
1066500146,0cold,친구들이랑 와서 술한잔 하기 좋아용👍👍,2025-01-01,"점심에 방문, 예약 없이 이용, 대기 시간 바로 입장, 친목, 친구",음식이 맛있어요,4,1
1066500146,nk****,맛있어요!!!!,2025-01-01,"점심에 방문, 예약 없이 이용, 대기 시간 바로 입장, 데이트, 연인・배우자",인테리어가 멋져요,3,1
1066500146,tae****,우선 매장분위기가 너무 좋고 음식도 바로 나와서 너무 맛있게 먹었어요!,2024-12-31,"저녁에 방문, 예약 없이 이용, 대기 시간 바로 입장, 일상, 친구",인테리어가 멋져요,6,1
1066500146,애피리안,너무 맛있어서 매번 또 방문 하는 집이에요. 연말 모임하기 딱 좋아요!,2024-12-31,"저녁에 방문, 예약 없이 이용, 대기 시간 바로 입장, 기념일, 부모님",인테리어가 멋져요,18,1
1066500146,jounmo,덜 맵게 해달라고 부탁드렸는데 진짜 딱 적당하게 매워서 맛있게 잘먹었습니다,2024-12-30,"저녁에 방문, 포장·배달 이용",음식이 맛있어요,45,2
1066500146,you****,분위기 좋고 직원분이 친절하세요! 치킨도 너무 맛있어요,2024-12-30,"저녁에 방문, 예약 없이 이용, 대기 시간 바로 입장, 친목, 친구",음식이 맛있어요,3,1
1066500146,kokokokoko45,집이랑 가까운 위치라 자주 와서 먹어요! 청결하고 늘 맛있습니다~,2024-12-27,"저녁에 방문, 예약 없이 이용, 대기 시간 바로 입장, 가족모임, 부모님",인테리어가 멋져요,16,1
1066500146,찐ㅋ30,분위기도 좋고 양도 많고 맛있어요,2024-12-27,"저녁에 방문, 예약 없이 이용, 대기 시간 바로 입장, 친목, 친구",인테리어가 멋져요,11,1
1066500146,스마일9968,닭다리살 부드럽고 양념도 넘 맛있어요~!~! 양도 많아여! 숯불치킨 맛집으로 추천합니당~~,2024-12-27,"저녁에 방문, 예약 없이 이용, 대기 시간 바로 입장, 일상, 부모님",인테리어가 멋져요,105,1
1066500146,어라지,자주 오는데 올때마다 친절하고 깔끔하고 맛나서 좋아요 ㅎㅎ,2024-12-27,"저녁에 방문, 예약 없이 이용, 대기 시간 바로 입장, 데이트, 연인・배우자",대화하기 좋아요,29,2
1066500146,다미다미루,감탄계 숯불치킨 넘맛있어용!! 주차도 편하고 씨드큐브점 깔끔하고 좋아 자주 방문합니다☺️,2024-12-25,"저녁에 방문, 예약 없이 이용, 대기 시간 바로 입장, 데이트, 연인・배우자",음식이 맛있어요,26,2
1066500146,hb79,가게 깔끔하고 맛잇어용 ㅎㅎ,2024-12-25,"저녁에 방문, 예약 없이 이용, 대기 시간 바로 입장, 데이트, 연인・배우자",음식이 맛있어요,94,2
1066500146,에라모르게따,너무 맛있어요 다음에 재방문의사 100프로!,2024-12-25,"저녁에 방문, 예약 없이 이용, 대기 시간 10분 이내, 데이트, 연인・배우자",음식이 맛있어요,39,1
1066500146,치즈달64,"크리스마스에 가족끼리 외식왔어요 양도 많고 깔끔해요 :) 맛도 좋아서 엄마도 좋아하셨어요 스태프도 친절하고 주차도 되서 마음편하게 다녀왔습니다  참, 하이볼도 맛있었어요!",2024-12-25,"저녁에 방문, 예약 없이 이용, 대기 시간 바로 입장, 친목, 부모님",음식이 맛있어요,71,1
1066500146,ska****,,2024-12-24,"저녁에 방문, 친목",음식이 맛있어요,58,2
1066500146,jounmo,신라면보다 맵고 밥이랑 잘 어울려요.,2024-12-23,"저녁에 방문, 포장·배달 이용, 대기 시간 30분 이내, 친목, 친구",음식이 맛있어요,45,1
1066500146,이민혁52,감탄계 생기고 맨날 치킨은 여기와서 먹어요분위기도 좋고 반반 너무 맛있어요!!🥳😊,2024-12-23,"저녁에 방문, 예약 없이 이용, 대기 시간 바로 입장, 친목, 부모님",인테리어가 멋져요,52,2
1066500146,IF70,맛있어보여서 들어왔는데 분위기도 넘 좋구 맛있어요!! 반반치킨 강추입니당👍😋 글고 치킨무 진짜마싯듬...,2024-12-22,"저녁에 방문, 예약 없이 이용, 대기 시간 바로 입장, 데이트, 연인・배우자",음식이 맛있어요,66,1
1066500146,suyoung52,맛있어요,2024-12-20,"저녁에 방문, 예약 없이 이용, 대기 시간 바로 입장, 친목, 친구",음식이 맛있어요,20,1
1066500146,리사마우이,매번 모임은 여기서해요너무맛있어요,2024-12-19,"저녁에 방문, 예약 없이 이용, 대기 시간 바로 입장, 친목, 친구",음식이 맛있어요,53,2
1066500146,ssooyy0,숯불치킨이 먹고 싶어 들렸어요!! 음식도 다양하고 친구들이랑 좋은 시간 보내고 갑니다~~👍,2024-12-19,"저녁에 방문, 예약 없이 이용, 대기 시간 바로 입장, 친목, 친구",음식이 맛있어요,107,1
1066500146,뭘봐껌바,바베큐가 이렇게 맛있을수 있는지 너무 맛나요,2024-12-19,"저녁에 방문, 예약 없이 이용, 대기 시간 바로 입장, 친목, 지인・동료",음식이 맛있어요,363,1
1066500146,메롱15,치킨 맛있엇습니다~ 웨이팅 없었고 내부 단체손님도 수용 가능할 정도의 내부 크기였습니다~,2024-12-18,"저녁에 방문, 예약 없이 이용, 대기 시간 바로 입장, 친목, 친구",인테리어가 멋져요,8,1
1066500146,기므겨므,힙하고 맛있고 다하네요!,2024-12-18,"저녁에 방문, 예약 없이 이용, 대기 시간 바로 입장, 데이트, 연인・배우자",친절해요,54,1
1066500146,Cheryl53,음식도 맛있고 사장님도 친절하시구 매장도 넓고 쾌적합니다 ! 덕분에 맛있는 식사였습니다 !!,2024-12-18,"점심에 방문, 예약 없이 이용, 대기 시간 바로 입장, 일상, 지인・동료",음식이 맛있어요,9,1
1066500146,나나4432,,2024-12-17,"저녁에 방문, 예약 없이 이용, 대기 시간 바로 입장, 나들이, 친구",음식이 맛있어요,1709,1
1066500146,자유의지13,오늘은 치밥으로 맛있게 먹었습니다. 매콤하니 맛있네요!! 감사합니다.,2024-12-16,"저녁에 방문, 포장·배달 이용, 대기 시간 10분 이내, 일상, 연인・배우자",음식이 맛있어요,5,1
1066500146,정경인96,매장이 매우 깨끗하고 음식이 매우 맛있습니다!,2024-12-16,"점심에 방문, 예약 없이 이용, 대기 시간 바로 입장, 가족모임, 부모님, 친척・형제",음식이 맛있어요,7,1
1066500146,mh****,매콤하니 맛납니당친목하기 너무죠아용~~!!,2024-12-14,"저녁에 방문, 예약 없이 이용, 대기 시간 바로 입장, 친목, 부모님",음식이 맛있어요,5,1
1066500146,Seoseomom,아이들이랑 주말저녁 맛있게 잘먹었네용감탄계 한판   초딩도 좋아해요 ^^,2024-12-14,"저녁에 방문, 예약 없이 이용, 대기 시간 10분 이내, 가족모임, 아이",음식이 맛있어요,19,1
1066500146,ann****,친절하고 맛있어용용❤️💕,2024-12-14,"점심에 방문, 예약 없이 이용, 대기 시간 바로 입장, 데이트, 나들이, 친구, 아이",음식이 맛있어요,16,1
1066500146,Nohyun,"음식도 너무 맛있고, 가성비도 좋네요! 한잔하기에도 딱 좋아요",2024-12-13,"저녁에 방문, 예약 없이 이용, 대기 시간 바로 입장, 데이트, 연인・배우자",음식이 맛있어요,60,1
1066500146,CLLIOUD,치밥으로 최곱니다~!,2024-12-11,"저녁에 방문, 예약 없이 이용, 대기 시간 바로 입장, 데이트, 연인・배우자",음식이 맛있어요,37,1
1066500146,펭귄86,너무 맛있어요 치킨은 감탄계!!,2024-12-11,"저녁에 방문, 예약 없이 이용, 대기 시간 바로 입장, 데이트, 연인・배우자",음식이 맛있어요,16,1
1066500146,보영19,친구랑 왔어요!! 담소 나누기 너무 좋은 분위기예요!치킨도 너무 맛있어요❤️❤️,2024-12-11,"저녁에 방문, 예약 없이 이용, 대기 시간 바로 입장, 친목, 친구",음식이 맛있어요,9,1
1066500146,imrriver,"아이들과 식사하기도 좋고, 술안주로도 좋아요!!♡♡",2024-12-11,"저녁에 방문, 예약 없이 이용, 대기 시간 바로 입장, 일상, 연인・배우자, 아이",음식이 맛있어요,9,1
1066500146,소보루부부,,2024-12-08,"저녁에 방문, 예약 없이 이용, 대기 시간 바로 입장, 친목, 친구",음식이 맛있어요,20,1
1066500146,강64,가족과 함께 왔는데 메뉴도 다양하고 아이도 함께 먹으르수있어서 좋았어요,2024-12-08,"저녁에 방문, 예약 없이 이용, 대기 시간 바로 입장, 친목, 연인・배우자",음식이 맛있어요,3,1
1066500146,wndmstjr87,맛있어요!! 직원 분도 너무 친절합니다!,2024-12-07,"저녁에 방문, 예약 없이 이용, 대기 시간 바로 입장, 데이트, 연인・배우자",음식이 맛있어요,4,1
1066500146,말의힘책의힘믿음의힘,포장이나 배달로만 시켜 먹다가 매장에서 직접 먹으니 더 맛있었어요. 치킨 뿐만 아니라 떡볶이나 골뱅이 같은 사이드 종류도 많아서 선택의 폭이 넓은 것도 좋았습니다.사장님도 친절하시고 매장도 깔끔해서 좋네요. 또 방문할게요^^,2024-12-06,"저녁에 방문, 예약 없이 이용, 대기 시간 바로 입장, 일상, 연인・배우자, 아이",음식이 맛있어요,98,2
1066500146,긍정적인 뽀로로,맛있고 친절하세요,2024-12-06,"점심에 방문, 예약 없이 이용, 대기 시간 바로 입장, 일상, 지인・동료",음식이 맛있어요,835,5
1066500146,bli****,맛있어요~ 덮밥류도 잘 되어있어서 간단히 밥 먹기 최고,2024-12-05,"저녁에 방문, 예약 없이 이용, 대기 시간 바로 입장, 데이트, 연인・배우자",음식이 맛있어요,73,5
1066500146,qq4871,맛있고 양도 많아요!,2024-12-03,"저녁에 방문, 예약 없이 이용, 대기 시간 바로 입장, 친목, 친구",음식이 맛있어요,13,1
1066500146,wit****,우연히 들렀는데 넘 맛있게 먹고 갑니다. 촉촉하고 부드러운 닭고기라 식사메뉴로도 괜찮아요. 👍,2024-12-03,"점심에 방문, 예약 없이 이용, 대기 시간 바로 입장, 데이트, 연인・배우자",음식이 맛있어요,82,1
1066500146,씨엠J,뼈없어서 먹기 너무 좋고음식 맛이 너무 깔끔해요 ^^.맵기도 단계별 조절되서 취향에 맞춰 먹을 수 있고 친절하세요 사이드도 다양해서 아이랑 오기도 좋아요,2024-12-02,"저녁에 방문, 예약 없이 이용, 대기 시간 바로 입장, 가족모임, 아이, 부모님",차분한 분위기에요,20,1
1066500146,b20****,맛있어요~짱~~~,2024-12-01,"저녁에 방문, 예약 없이 이용, 대기 시간 바로 입장, 가족모임, 연인・배우자",음식이 맛있어요,1,1
1066500146,EASTSKY,엄청 맛집이네요 새로 생긴 건물이라깨끗하고 음식도 더할나위 없이 맛나요다음에도 꼭 재방문하겠습니다,2024-12-01,"저녁에 방문, 예약 없이 이용, 대기 시간 바로 입장, 가족모임, 부모님",음식이 맛있어요,16,1
1066500146,오잉4613,오늘도 역시 맛있어서 순삭~담백하고 불맛도 나고 치킨은 요즘 ㅇㅣ것만 먹어요,2024-12-01,"저녁에 방문, 포장·배달 이용, 대기 시간 10분 이내",음식이 맛있어요,11,3
1066500146,19782,음식이 맛있어요 재방문 하겠습니다,2024-11-30,"저녁에 방문, 예약 없이 이용, 대기 시간 바로 입장, 데이트, 연인・배우자",음식이 맛있어요,363,1
1066500146,aprilfront,반반메뉴 구성이 좋아요아이들과 오기에도 적당해요,2024-11-29,"저녁에 방문, 예약 없이 이용, 대기 시간 바로 입장, 친목, 아이",대화하기 좋아요,15,1
1066500146,hhs691343,맛있어요~,2024-11-29,"저녁에 방문, 예약 없이 이용, 대기 시간 바로 입장, 일상, 친구",음식이 맛있어요,6,1
1066500146,myn****,진짜 너무 맛있어요! 우동사리 꼭 추가해서 드세요🤤이번에는 양념 반 데리야끼 반으로 시켰는데 후회없는 맛입니다. 꼭 드세요 진짜❤️,2024-11-29,"점심에 방문, 예약 없이 이용, 대기 시간 바로 입장, 친목, 회식, 친구",음악이 좋아요,17,2
1066500146,꾸아꾸,맛있어요!,2024-11-28,"저녁에 방문, 예약 없이 이용, 대기 시간 바로 입장, 데이트, 연인・배우자",음식이 맛있어요,31,1
1066500146,이우진9550,맛있어요!!!!! 분위기도 좋아용,2024-11-26,"저녁에 방문, 예약 없이 이용, 대기 시간 바로 입장, 친목, 지인・동료",음식이 맛있어요,21,1
1066500146,드랍쉽3251,숯불향 가득한 치킨은 처음이에요대파랑 조합도 좋아서 대파 추천드려요완전 친절하고 맛있어요!,2024-11-26,"저녁에 방문, 예약 없이 이용, 대기 시간 바로 입장, 데이트, 연인・배우자",음식이 맛있어요,24,1
1066500146,바람너머5,맛있어요,2024-11-25,저녁에 방문,음식이 맛있어요,3320,1
1066500146,101****,처음왔는데 만족합니다. 맛있게 잘 먹었습니다.재방의사 있습니다.,2024-11-23,"저녁에 방문, 예약 없이 이용, 대기 시간 바로 입장, 친목, 연인・배우자",음식이 맛있어요,15,1
1066500146,꽃길걷는 장쌤,직원분들이 모두 친절해요. 치킨도 부드럽고 맛있습니다,2024-11-23,"저녁에 방문, 예약 없이 이용, 대기 시간 바로 입장, 친목, 연인・배우자",음악이 좋아요,482,1
1066500146,dare73,매번 먹어도 맛있어요~,2024-11-22,저녁에 방문,음식이 맛있어요,1905,1
1066500146,tg****,"매번 시켜먹다가 매장와서 처음 먹어봤는데 너무 마싯구요 ㅠ_ㅠ,, 매장에서먹으니까 더더 맛있어요 매장도 엄청 깔끔하고 좋아요!!",2024-11-20,"저녁에 방문, 예약 없이 이용, 대기 시간 바로 입장, 데이트, 연인・배우자",음식이 맛있어요,4,1
1066500146,한지민2733,너무 맛있어요 단짠 킹왕짱 추천드려요,2024-11-20,"저녁에 방문, 예약 없이 이용, 대기 시간 바로 입장, 데이트, 연인・배우자",음식이 맛있어요,70,1
1066500146,코니3770,와 존맛탱 레전드,2024-11-19,"저녁에 방문, 예약 없이 이용, 대기 시간 바로 입장, 데이트, 연인・배우자",음식이 맛있어요,17,1
1066500146,뚜비뚜밥4066,밥은 그럭저럭인데알바인지 사장님인지 나이 좀 있는 여성분왜 이렇게 알바를 쥐잡듯이 잡나요? 손님도 있는데?새로운 알바 교육하시는거같은데 반말찍찍에듣고있는 손님도 기분이 별론데 본인은 얼마나ㅎㅎ,2024-11-19,"점심에 방문, 예약 없이 이용",,7,1
1066500146,배고파밥줘540,치킨이 엄청 빨리 나오고 불맛도 잘 나고 맛있어용~~,2024-11-18,"저녁에 방문, 예약 없이 이용, 대기 시간 바로 입장, 데이트, 연인・배우자",음식이 맛있어요,12,1
1066500146,inc****,맛있어요!!,2024-11-18,"저녁에 방문, 예약 없이 이용, 대기 시간 바로 입장, 데이트, 연인・배우자",음식이 맛있어요,49,1
1066500146,jwnya,불맛 제대로여서 정말 좋아요! 매장도 깔끔해서 또 오고 싶네요-!,2024-11-17,저녁에 방문,인테리어가 멋져요,655,1
1066500146,Lkkkkk,너무 맛있어요,2024-11-16,"저녁에 방문, 예약 없이 이용, 대기 시간 바로 입장, 친목, 친구",음식이 맛있어요,4,1
1066500146,Ellip,,2024-11-15,"저녁에 방문, 예약 없이 이용, 대기 시간 바로 입장, 데이트, 친구",특별한 메뉴가 있어요,121,1
1066500146,ejzkyz,너무맛있어요. 소금도 맛있고 양념도 맛있어서 항상 반반으로 먹습니다! 우동사리까지 추가해 먹으니 딱이에요! 재방문의사있어요!!,2024-11-13,"저녁에 방문, 예약 없이 이용, 대기 시간 바로 입장, 데이트, 일상, 친구",친절해요,41,2
1066500146,dnql6627,자주 오는 곳이에요!! 치킨 촉촉하고 숯불향 짱입니다!! 맛있아요~!!,2024-11-13,"저녁에 방문, 예약 없이 이용, 대기 시간 바로 입장, 친목, 친구",단체모임 하기 좋아요,76,1
1066500146,Jky96,맛있어요 양이 많아요 하이볼. 위에 곰돌이 얼음이 너무 귀여워요,2024-11-11,"저녁에 방문, 예약 없이 이용, 대기 시간 바로 입장, 일상, 부모님",음식이 맛있어요,3,1
1066500146,방긋웃는쿼카,창동  맛집이래서  왔는데요! 별기대안했는데맛있어요  진짜!! 살도  부드럽고  치즈가  매콤함을  좀  잡아줘요!  순한맛도  살짝  매콤해요!!굿굿,2024-11-11,"저녁에 방문, 예약 없이 이용, 대기 시간 바로 입장, 데이트, 일상, 연인・배우자",단체모임 하기 좋아요,65,1
1066500146,냥이83,항상 맛있게 잘 먹고  있어요맛있는 곳이 없어서 한동안 치킨 끊었다가요즘 최애집 중 하나입니다,2024-11-10,"저녁에 방문, 포장·배달 이용",음식이 맛있어요,15,5
17976421,엄기숙,친절해요,2025-04-03,"저녁에 방문, 예약 없이 이용, 대기 시간 10분 이내, 친목, 친구",음식이 맛있어요,433,1
17976421,YouHappy,"낮부터 신나게 먹었던 창동 삼겹살집이었어요. 점심이여서 점심 제육볶음 먹는 손님들 많았고, 저희는 삼겹살과 갈매기살을 먹었는데  고기질도 좋고 분위기도 오래된 맛집느낌이였습니다. 다음에도 돼지고기 생각나면 찾고 싶은 창동맛집이었어요!",2025-03-16,"점심에 방문, 예약 없이 이용, 대기 시간 바로 입장, 데이트, 연인・배우자",음식이 맛있어요,267,1
17976421,경희 순난13,생삼겹살 맛있어요,2025-03-15,"저녁에 방문, 예약 없이 이용, 대기 시간 바로 입장, 친목, 지인・동료",고기 질이 좋아요,333,5
17976421,hee****,,2025-02-28,점심에 방문,음식이 맛있어요,807,1
17976421,tjd****,주변에서 맛집이라는 이야기를 많이 들어서 기대하며오픈시간에 맞춰 방문했는데 고기에서 냄새가 좀 났습니다 당일 고기는 아닌것 같고 남아엤던것 같은데 보관이 잘 못된건지..덜 익혔나 싶어 바짝 구워먹어 봤으나 끝까지 나더군요..추가 주문 안한 몇 안되는 집이었습니다된장찌개는 맛있었습니다,2025-02-28,"점심에 방문, 예약 없이 이용, 대기 시간 바로 입장, 친목, 친구",반찬이 잘 나와요,25,1
17976421,앙응용,좋어요!!,2025-02-13,"저녁에 방문, 예약 없이 이용, 대기 시간 바로 입장",음식이 맛있어요,969,1
17976421,용강72,가끔 이용하는 곳점심시간 지나서 방문삼겹살 그런데로  괞찮으나미역국물  짜다.,2025-02-12,"점심에 방문, 예약 없이 이용, 대기 시간 바로 입장, 친목, 친구",친절해요,1159,4
17976421,abu****,맛있었어요. 웨이팅이 있는 데는 이유가 있네요.,2025-01-06,"저녁에 방문, 예약 없이 이용, 대기 시간 10분 이내, 일상, 연인・배우자",음식이 맛있어요,80,1
17976421,wot****,,2025-01-03,"저녁에 방문, 예약 없이 이용, 대기 시간 바로 입장, 친목, 연인・배우자, 친구, 아이",음식이 맛있어요,1233,2
17976421,tt****,,2024-12-31,점심에 방문,음식이 맛있어요,2110,2
17976421,인생승우,조아요~,2024-12-20,"저녁에 방문, 예약 없이 이용, 대기 시간 바로 입장, 친목, 친구",음식이 맛있어요,296,1
17976421,인빠송,삼겹살개춘^,2024-12-19,"저녁에 방문, 예약 없이 이용, 대기 시간 바로 입장, 데이트, 친구",음식이 맛있어요,2750,1
17976421,만만이 입니다,점심메뉴 제육볶음 먹음. 만족~~,2024-12-09,"점심에 방문, 예약 없이 이용, 대기 시간 바로 입장, 친목, 친구",음식이 맛있어요,4056,4
17976421,츼즤,제육은 맛있는데김치찌개단품은 깊은 맛 부족해요,2024-11-05,"점심에 방문, 예약 없이 이용, 대기 시간 바로 입장, 지인・동료",고기 질이 좋아요,66,1
17976421,kim****,친절,2024-10-30,"점심에 방문, 대기 시간 바로 입장, 친목",가성비가 좋아요,1595,1
17976421,이채원822,고기가맛있써요 쫄긴하고담백하니 고소하네요친절은써비스네요기분조은저녁시간이였써요,2024-10-23,"저녁에 방문, 예약 없이 이용, 대기 시간 바로 입장, 친목, 친구",음식이 맛있어요,324,1
17976421,빠꾸설기,고기가 맛있어요^^,2024-10-19,"저녁에 방문, 예약 없이 이용, 대기 시간 바로 입장, 친목, 친구",음식이 맛있어요,457,1
17976421,skylover7,굿,2024-10-15,저녁에 방문,고기 질이 좋아요,1091,2
17976421,soo****,무조건 밖에서 먹는거 추천,2024-10-08,"저녁에 방문, 예약 없이 이용, 대기 시간 바로 입장, 친목, 친구",고기 질이 좋아요,140,2
17976421,졍리리,창동역 고기맛집..!!점심메뉴인 제육도 맛있는데 이번에는 저녁에가서 삼겹살 먹었는뎅 마싯어용👍🏻,2024-10-08,"저녁에 방문, 예약 없이 이용, 대기 시간 바로 입장, 일상, 부모님",음식이 맛있어요,259,1
17976421,공주744,조아,2024-10-08,점심에 방문,음식이 맛있어요,2816,2
17976421,공주744,조아,2024-09-29,저녁에 방문,음식이 맛있어요,2816,1
17976421,행복한소망,도봉구 삼겹살 맛집,2024-08-15,"점심에 방문, 예약 없이 이용, 대기 시간 바로 입장, 일상, 가족모임, 부모님",음식이 맛있어요,702,1
17976421,Wonha,된장찌개가 정말 맛있어서 밥말아 먹었네요 ㅎㅎ그냥 밤에 출출해서 혼자 고기도 시켜먹었어요배부르게 잘먹었네요!,2024-08-11,"저녁에 방문, 예약 없이 이용, 대기 시간 바로 입장, 나들이, 혼자",고기 질이 좋아요,1715,2
17976421,김  개미,"창동에 고기 맛있는 집 흔치않다, 생삼겹이 굿 👍👍👍👍",2024-08-05,"저녁에 방문, 예약 없이 이용, 대기 시간 바로 입장, 데이트, 연인・배우자",매장이 넓어요,184,1
17976421,Miracle330,도봉구 창동역 1번출구 먹자골목30년 전통의 숨어있는 현지인 노포 삼겹살집 창동 토박이 친구가 추천하여 방문 사진에 보이듯 생삼겹살의 퀄리티가 상당히 좋은편이 집의 시그니처가 있으니 바로 묵은지(김치)단 어느 노포집과 마찬가지로 반찬구성이 단조롭고 된장찌개가 안나오고 추가로 시켜하는것은 단점삼겹살매니아라면 한번쯤은 방문하셔도 좋습니다 :),2024-08-05,"저녁에 방문, 예약 없이 이용, 대기 시간 바로 입장, 일상, 친구",음식이 맛있어요,314,1
17976421,leegs119,늘 생고기맛이 너무 좋아 삼겹 먹을때는 찾는곳이에요,2024-08-03,"저녁에 방문, 예약 없이 이용, 대기 시간 바로 입장, 일상, 연인・배우자",고기 질이 좋아요,429,2
17976421,godong01,음식이 맛있어요,2024-07-15,점심에 방문,음식이 맛있어요,835,5
17976421,sai****,굿,2024-07-12,저녁에 방문,음식이 맛있어요,1026,10
17976421,참이친구noh7969,맛이어요,2024-06-15,점심에 방문,음식이 맛있어요,913,9
17976421,순한맘,좋아요,2024-05-30,저녁에 방문,음식이 맛있어요,519,4
17976421,언 타,맛있어요,2024-05-30,저녁에 방문,음식이 맛있어요,575,4
17976421,헤헷4181,북청 오랜역사와 전통,2024-05-24,"저녁에 방문, 예약 없이 이용, 대기 시간 10분 이내, 나들이, 친구",음식이 맛있어요,342,3
17976421,pizzamasi,맛있어요,2024-05-24,"저녁에 방문, 예약 없이 이용, 대기 시간 10분 이내, 친목, 친구",고기 질이 좋아요,348,4
17976421,참이친구noh7969,맛있어요,2024-05-18,"점심에 방문, 대기 시간 바로 입장, 데이트",음식이 맛있어요,913,8
17976421,his****,굿,2024-05-16,"점심에 방문, 예약 없이 이용, 대기 시간 바로 입장, 일상, 지인・동료",음식이 맛있어요,1514,1
17976421,노루팡팡,"음식이 맛있어요. 상추를 많이 줘요. 고기 잡내가 없고, 질기거나 퍽퍽하지 않아요. 비계부분의 양이 적절해요. 오돌뼈도 씹히지 않아요.",2024-05-01,"저녁에 방문, 일상, 연인・배우자",음식이 맛있어요,1358,1
17976421,헤헷4181,김치맛집,2024-04-30,"저녁에 방문, 예약 없이 이용, 대기 시간 바로 입장, 친목, 친구",고기 질이 좋아요,342,2
17976421,pizzamasi,북청식당 김치맛집,2024-04-30,"저녁에 방문, 예약 없이 이용, 대기 시간 바로 입장, 데이트, 친구",음식이 맛있어요,348,3
17976421,왜내맘을흔드는건데,맛있어요,2024-04-29,"점심에 방문, 예약 없이 이용, 대기 시간 바로 입장, 일상, 지인・동료",음식이 맛있어요,615,1
17976421,leegs119,고기생각날때 가는곳이예요 고기질도 좋구 김치가 맛있어요,2024-04-19,"저녁에 방문, 예약 없이 이용, 대기 시간 바로 입장, 일상, 연인・배우자",음식이 맛있어요,429,1
17976421,다이닝15,맛있어요~,2024-04-19,"점심에 방문, 예약 없이 이용, 대기 시간 바로 입장, 일상, 혼자",음식이 맛있어요,598,1
17976421,지혜롭고싶습니다,굿,2024-04-18,저녁에 방문,음식이 맛있어요,1751,1
17976421,참이친구noh7969,맛나요,2024-04-06,"점심에 방문, 예약 없이 이용, 대기 시간 바로 입장",음식이 맛있어요,913,7
17976421,godong01,삼겹살이 맛있어요,2024-03-21,저녁에 방문,음식이 맛있어요,835,4
17976421,알로HA,생삼겹살이 너무 맛있어서   반찬도 맛있고 친절하세요,2024-03-20,"저녁에 방문, 예약 없이 이용, 대기 시간 바로 입장, 일상, 친구",음식이 맛있어요,1089,1
