place_id,nickname,content,date,situations,keywords,review_count,visit_count
1373442166,Clare8280,숨겨진 비밀장소같은 멋진 인테리어도 좋았지만 그보다 음식이 훨씬 더 맛있었습니다. 근래 기억하고 있는 브런치 집 중에서 단연 최고라고 말할 정도로 신선한 재료와 맛의 밸런스가 좋았고 사진에서 보기보다 양이 많은 편입니다. 추천합니다.,2024-01-19,"점심에 방문, 예약 후 이용, 대기 시간 바로 입장, 데이트, 연인・배우자",음식이 맛있어요,8,1
1373442166,nadangg,간판이 없어서 찾기 힘들지만 재미있어요. 주차가 안되는게 단점..버스정류장 바로 앞에 있어요! 매장 안에는 유니크한 분위기에 고급진 느낌! 메뉴는 다양하지 않은데 브런치로 먹기 딱 좋은 구성들이에요. 다들 2명이서 3개 시켜서 똑같이 시켜봤는데 양이 많았어요. 근데 다 먹게되요 맛있어서 ㅠㅠ 또 가고 싶어요,2024-01-18,"점심에 방문, 예약 없이 이용, 대기 시간 바로 입장, 데이트, 나들이, 연인・배우자",컨셉이 독특해요,77,1
1373442166,jhc****,재료 구성이 뻔하지 않아서 좋아요. 맛있어요!,2024-01-17,"점심에 방문, 예약 후 이용, 대기 시간 바로 입장, 데이트, 일상, 연인・배우자",음식이 맛있어요,10,1
1373442166,jjssyy,정신 없이 수다 떨고 먹다가 음식 사진을 못 찍었는데 너무 맛있었어요! ✨,2024-01-14,"점심에 방문, 예약 후 이용, 대기 시간 바로 입장, 친목, 친구",친절해요,189,1
1373442166,해롱90,,2023-12-29,점심에 방문,인테리어가 멋져요,1676,1
1373442166,히마와리S2,인테리어가 깔끔하고 음식이 맛있었어요~라자냐 추천해요!,2023-12-26,"점심에 방문, 예약 없이 이용, 대기 시간 바로 입장",특별한 메뉴가 있어요,197,1
1373442166,cj****,기념일에 예약하고 다녀왔어요 사장님들 너무 친절하셔서 기분이 좋았어요☺️ 와인 설명도 자세히 해주시고 주문한 메뉴들 진짜 존맛탱이었어요…여자친구가 이런 곳 데려와줘서 고맙다고 까지 했어요 무조건 재방문입니다ㅜㅜ,2023-12-24,저녁에 방문,인테리어가 멋져요,22,2
1373442166,꿈꾸는개척가,인테리어도 멋지고 음식도 맛있어서 좋아하는 공간입니다. 오랜만에 방문했는데 음식 여전히 맛나서 좋았어요! 특히 후무스 샐러드 맛있습니다,2023-12-22,"점심에 방문, 예약 후 이용, 대기 시간 바로 입장, 일상, 친구",음식이 맛있어요,267,1
1373442166,팔판댁,우선 저녁에 식사 예약 때는 와인이 필수입니다! 보통 9만원~12만원대 정도니까 참고해주세요!와인과 샴페인 종류가 많고 평소 먹던 와인이 쪽이 아니라 고민이 많았는데 바로 추천 해주셔서 덕분에 맛있게 잘 먹었습니다. 음식은 오래 걸리지 않았고 평일 저녁이라 자리도 널널했습니다:)다만 창가 쪽이라 조금 추웠고 먹다보니 음식이 식으면서 짠맛이 많이 느껴지더라구요:( 원래 식으면 짠맛이 더 잘 느껴저서 그런걸지도 모르겠군요! 가지 라자냐는 약간의 간 고기가 들어가면 더 맛있을거 같아요~!~!! 재방문 의사 있습니다! 덕분에 기념일에 맛있는 식사 먹고 즐거언 데이트 했습니다🫡,2023-12-19,"저녁에 방문, 예약 후 이용, 대기 시간 바로 입장, 데이트, 연인・배우자",음식이 맛있어요,35,1
1373442166,오7641,"와인추천도 너무 좋았고, 일행 중 임부가 있어서 와인을 못 마시는걸 슬퍼하자 예쁘고 맛있는 음료를 서비스로 주셔서 덕분에 즐거운 저녁이 되었습니다! 물론 음식 디쉬5개도 다 맛있었어요!",2023-12-09,"저녁에 방문, 예약 후 이용, 대기 시간 바로 입장, 친목, 친구",음식이 맛있어요,3,1
1373442166,하늘물고기87,친구 후무스 추천해줘서 갔는데 후무스도 맛있었지만 화이트라구가 찐맛도리네요ㅠ 리뷰 작성하는 지금도 또 먹고 싶음,2023-11-25,"점심에 방문, 예약 후 이용, 대기 시간 바로 입장, 친목, 친구",음식이 맛있어요,783,1
1373442166,ssangkome,간판도 없고 입구도 잘 못찾겠지만 들어가면 맛의 신세계를 느낄수 있는 곳이에요~ 디톡스쥬스도 넘 맛있고 음식이 정말 하나같이 감동적이게 맛있었어요! 플레이팅 예술인데 음식도 정말 빨리 나왔고 원래 밖에서 샐러드 잘 안시켜 먹는데 후무스볼은 유부가 씹히고 건강한 맛이 느껴져서 돈 아깝지 않게 다 긁어먹었네요^^ 디톡스쥬스도 넘 맛있어서 만약 와인을 안드실분은 꼭 같이 시켜 드셔봤음 좋겠어요!,2023-10-23,점심에 방문,음식이 맛있어요,95,1
1373442166,미엘32,좋아요,2023-10-10,점심에 방문,음식이 맛있어요,1563,1
1373442166,Salgoo,테라스 맛집 ♥,2023-10-09,점심에 방문,음식이 맛있어요,21,1
1373442166,yuuuuuuuj,맛있고 분위기 좋아요,2023-09-08,저녁에 방문,음식이 맛있어요,14,1
1373442166,Skk8899,"전날 예약해서 아쉽게도 정원쪽은 못앉고 홀에 앉았습니다.서빙해주시는 분들도 모두 친절하고, 그릇도 이쁘고, 음식 색감도 예쁘고 맛도있고🫶🫶담에는 더 일찍 예약해서 안쪽에 더 예쁜곳에서 또 식사하고 싶어요💘",2023-09-03,점심에 방문,음식이 맛있어요,312,1
1373442166,sday,인테리어뿐만 아니라 음식도 맛있어요예약 안하고 가면 대기가 길수도 있으니까캐치테이블 어플 깔아서 미리 예약하고 가세요!창가쪽에 앉으고 싶으시면 그건 따로 미리 전화해서말씀드려야해요~~양식 좋아하시면 내추럴하이 식당 추천 또 추천드립니다 🫶🏻,2023-08-06,점심에 방문,음식이 맛있어요,597,1
1373442166,둠스닥스,가볍게 내츄럴와인 한 잔 하기 좋음내부 인테리어가 시원시원하니 좋다,2023-07-29,점심에 방문,인테리어가 멋져요,607,1
1373442166,빈이9887,화이트 라구 파스타 추천,2023-07-23,점심에 방문,인테리어가 멋져요,670,1
1373442166,율이3333,드디어 가본 내추럴하이!! 분위기도 넘 좋고 음식도 맛있고 친절해서 반하고 왔어요🥹 다음에 또 방문예정!,2023-07-08,점심에 방문,인테리어가 멋져요,702,1
1373442166,술병난꼬부깅,🌟🌟🌟🌟🌟낮술하면서 브런치메뉴들 여러가지 시켰는데.세상에나 너모 맛있어서 접시까지 먹을뻔🤤🤤내츄럴와인 싫어하는데 추천해주신 샤도네도 너모 좋았구요. 친절하기까지. 단골예약 확쩡🫶🏻🫶🏻🫶🏻,2023-07-06,점심에 방문,음식이 맛있어요,1147,1
1373442166,loving81,가지 라자냐 & 알배추 구이 & 리코타 치즈와 구운 청포도 가지 라자냐 밀가루 없이 만들었는데도 너무 맛있었어요알배추 구이밀가루 없는 김치전 느낌 이것도 맛있었지만 약간 느끼해서 식사하실때보다 안주로 드실거면 괜찮은 메뉴리코타 치즈와 구운 청포도이 메뉴도 신선하고 맛있었어요 와인 안주로 최고일듯,2023-07-01,점심에 방문,인테리어가 멋져요,110,1
1373442166,박수수수옥수수,굳이 창가 좌석 아니여도 느낌 👍🏻,2023-06-25,점심에 방문,음식이 맛있어요,64,1
1373442166,nak****,꿀맛!!!,2023-06-18,점심에 방문,음식이 맛있어요,80,1
1373442166,godipooh,특정 좌석은 실내 공간임에도 야외 느낌이 들어 좋았고 시킨 메뉴 전부 맛있었습니다,2023-06-14,점심에 방문,특별한 메뉴가 있어요,348,1
1373442166,지쮸르,매장이 너무 깔끔하고 음식도 플레이팅 예쁜만큼 맛있었어요 후무스 샐러드 진짜 꼭 드세요,2023-06-11,점심에 방문,매장이 청결해요,28,1
1373442166,뉸누냔햐,분위기 너무 좋고.. 음식들도 진짜 아 너무 맛있고 ㅜㅠ 와인 못먹고온게 넘 아쉽...다음엔 꼭 와인까지 드링킹 하겠어요..,2023-05-26,점심에 방문,음식이 맛있어요,443,1
1373442166,블링블링7012,분위기가 좋아요,2023-05-18,저녁에 방문,매장이 넓어요,43,1
1373442166,바램이,"디톡스쥬스 재료없어서 못먹어서봐서 넘 아쉽지만 !! 넘 맛있었던 후무스볼이랑 여기서 젤루 좋아하는 알배추 구이 ,, 🥬💚",2023-04-30,점심에 방문,음식이 맛있어요,131,1
1373442166,로니쏭,사장님이 추천해 주신 와인으로 맛있게 마셨습니다내부 인테리어도 깔끔하고 음식도 너무 맛있습니다사장니이 와인 지식이 넒어서 추천도 너무 잘 받았어요!!다음에 또 가겠습니다,2023-04-16,저녁에 방문,인테리어가 멋져요,102,1
1373442166,udal5959,"화이트 라구와 가지 라자냐, 그리고 비프 타르타르 주문했어요! 모든음식 다 맛있었지만 전 가지 라자냐가 젤 맛났구요! 육회 좋아하신다면 비프타르타르도 맛있게 먹을수 있어요! 화이트라구도 소스 꾸덕하니 시킨 음식 모두 맛있었어요😊 저녁메뉴도 궁금해서 다음엔 와인과 함께 먹어보고 싶어요",2023-04-16,점심에 방문,친절해요,291,1
1373442166,YS0629,친구들이랑 일요일 브런치하러 방문! 시킨메뉴들 모두모두 맛잇엇어요 파스타는 조금 짯는데 나뿌지 않아요 가게인테리어도 아주 매력적이고 뒷쪽에 야외공간이 푸릇푸릇하게 비춰서 프라이빗하면서 싱그러운곳이엿어요!,2023-04-16,점심에 방문,친절해요,544,1
1373442166,머랭맘,"새로운 소스, 새로운 맛. 후무스보울에 유부가 들어있는게 독특하고 신기하네요! 예약하고 간거라 기다리지않아 편했구 재방문의사 있습니당!근데 의자가 너무 딱딱하고 불편해요..",2023-04-15,점심에 방문,재료가 신선해요,26,1
1373442166,쿠라성,너무 인테리어도 이쁘고 맛있고 좋아요 ㅎㅎ,2023-03-26,점심에 방문,특별한 날 가기 좋아요,740,1
1373442166,woneo,"두번째 방문, 오늘도 맛있게 잘 먹었습니다.",2023-03-19,점심에 방문,특별한 날 가기 좋아요,832,2
1373442166,반짝반짝31,후무스볼 너무 맛있다 우리 동네에도 생겼으면.. 라구파스타도 추천,2023-03-18,점심에 방문,인테리어가 멋져요,537,2
1373442166,서울일짱먹두팔,공간도 멋지고 친절하고 음식까지 맛있어요!친구 생일축하파티 겸 방문했는데 넘 만족스러웠어요.모든 메뉴가 맛있었던 내추럴하이❤️,2023-03-18,점심에 방문,인테리어가 멋져요,181,1
1373442166,샹들리유,#리코타치즈와 구운청포도 - 부드러운치즈와 불맛나는 청포도와 참깨맛나는 얇은 과자에 참기름의 묘한조합이 진짜 맛있어요!! #가지라쟈냐 - 짜지않은 건강한맛으로 아주 맛있어요#생양갈비구이 - 고수싫어하는데 고수향이 안나고 당근싫어하는데 당근향도 안나서 조화로운맛~#새우구이- 플레이팅부터 넘 예뻐요 촉촉하게 구어져서 더 먹고싶은맛~ 양이 적어요 ㅎ#샤워도우&이즈니버터 - 불향이 살짝 나면서 맛잇게 그을려진맛과 버터와 양파절임의 묘한 조합이 신선하고 맛잇어요~#내추럴하이 - 간판없는 힙한곳~인테리어가 깔끔하고 모던해요소품 하나하나 신경써서 제작한 디자인이 눈에 띄는곳~! 음식이 다 맛있어서 재방문하고싶어요~^^,2023-03-15,저녁에 방문,음식이 맛있어요,348,1
1373442166,플루플루,여자들이 너무 좋아할 디자인 + 맛 여자손님들만 있다는점이 신기 ㅋㅋ 맛있었오요 ㅎ,2023-03-11,점심에 방문,음식이 맛있어요,277,1
1373442166,카두리,후무스볼 가지라자냐는 브런치로 가볍게 먹기 좋고 라구파스타는 꾸덕하니 진해요!,2023-03-11,점심에 방문,음식이 맛있어요,675,1
1373442166,듄7180,너무 맛있어요! 근데 여기 입구에 있는 문에 손잡이가 없어서 문을 못찾아서 계속 앞에 서있었네요ㅠ 이건 개선이 되어야 할 것 같아요. 안에 인테리어나 분위기는 너무 이뻐요,2023-03-04,점심에 방문,재료가 신선해요,372,1
45449726,schoentag,너무너무 맛있어요… ❤️ 안주 종류도 넘 다양한데 하나같이 맛나고 술 종류도 다양하게 구비되어 있습니다,2025-04-03,"저녁에 방문, 예약 후 이용, 대기 시간 바로 입장, 친목, 친구",대화하기 좋아요,32,2
45449726,moon9126,,2025-03-14,"저녁에 방문, 예약 후 이용, 대기 시간 바로 입장, 친목, 친구",음식이 맛있어요,44,1
45449726,JSH1999,여자친구 생일을 맞아 예약 후 여자친구 퇴근에 맞춰 도착했어요예약석에 앉았고 테이블에 제이름이 써있는거 보고 세심하다 느꼈어요 음식들은 한식퓨전인데 정말 맛있었어요ㅎㅎ추천해주신 막걸리도 취향 저격이었고 다음에 또 생각나면 방문할 의향 있어요,2025-03-08,"저녁에 방문, 예약 후 이용, 대기 시간 바로 입장, 데이트, 연인・배우자",술이 다양해요,19,1
45449726,문상훈내성발톱먹고자란청북쥐,봉준호가극찬한맛집.,2025-03-01,"저녁에 방문, 예약 후 이용, 대기 시간 바로 입장, 친목, 연인・배우자, 지인・동료",음식이 맛있어요,444,1
45449726,주앵이얏,사진은 별로 없지만 떡갈비 김치 토마토 스튜는 무조건 시키세용 !!!!!! 완전 맛있어요 !!! 💓💓 소스가 계속 들어갑니당 .... 꼭 면이랑 추가해서 드세용 ㅠㅠㅠ전 면추가 못하고 나왔는데 너무 아수버용 .. 밥이랑 비벼먹어도 너무 맛있을 것 같아요 👍🏻👍🏻 아보카도 전도 굳굳 👍🏻👍🏻 건새우로 식감 대박이예용 ㅎ존맛텡입니당 💓💓,2025-02-25,"저녁에 방문, 예약 없이 이용, 대기 시간 바로 입장, 친목, 나들이, 여행, 일상, 친구, 지인・동료, 친척・형제",음식이 맛있어요,89,1
45449726,조소영4,시그니처 토마토 스튜 무조건 드세요❤️👍,2025-02-15,"저녁에 방문, 예약 없이 이용, 대기 시간 바로 입장, 데이트, 연인・배우자",음식이 맛있어요,20,1
45449726,rhddbswo,"감바스가 진짜 맛있고기본 빵 양이 엄청 많아서 놀랐어요,,4조각정도 될 줄 알고 빵추가 했는데넘 놀랐으여,,,",2025-02-14,"저녁에 방문, 예약 후 이용, 대기 시간 바로 입장, 친목, 친구",인테리어가 멋져요,50,1
45449726,푸딘나,일단 안주가 존맛이고요..술이 술술 들어감니다 분위기도 좋이요,2025-02-13,"저녁에 방문, 예약 후 이용, 대기 시간 바로 입장, 친목, 친구",매장이 청결해요,81,1
45449726,원이이잉11,"주류도 니즈에 맞게 친절하게 추천해주시고, 음식들도 전부 맛있었어요!~!~",2025-02-09,"저녁에 방문, 예약 후 이용, 대기 시간 바로 입장, 친목, 친구",인테리어가 멋져요,28,1
45449726,Uncolor,맛있고 메뉴구성이 진짜 너무 알차요들기름 막국수 꼭 드세요 🥺친절하셔서 기분 좋게 놀다 갑니다 감사합니다 -!,2025-02-07,"저녁에 방문, 예약 후 이용, 대기 시간 바로 입장, 데이트, 연인・배우자",친절해요,17,1
45449726,꿈하,"맛 분위기 서비스 모두 강추입니다 !!!저녁 겸 술한잔, 맛있고 예쁜 음식에 완전 기분 up!",2025-02-06,"저녁에 방문, 예약 후 이용, 대기 시간 바로 입장, 친목, 친구",인테리어가 멋져요,15,2
45449726,dtd****,들기름 막국수가 맛있고 큰 테이블이 있어서 다인원이 단체 모임하기 좋아요 너무 마싯게 잘 먹구 갑니다~~,2025-01-31,"저녁에 방문, 예약 없이 이용, 대기 시간 바로 입장, 데이트, 친구",대화하기 좋아요,5,1
45449726,테디정84,"정성 가득한 한식과 감각적인 음료의 조합으로 일상속 여유를 즐기라는 ‘술꼬마’의 모토처럼 뛰어난 맛과 멋이 펼쳐지는 곳이에요 :) 바삭바삭한 식감과 건새우,아보카도,부추 조화로운 맛이 어우러진 ‘부추건새우아보카도전’과 나루생막걸리의 페어링도 좋고 <나야,들기름> ‘들기름감바스’ 안의 탱글탱글한 새우와 아스파라거스,치즈떡 모두 들기름을 양껏 머금었기에 뫼르소 화이트와인과의 마리아쥬도 좋았네요! 배가 부른 상태에서 퀄리티 매우 좋은 한우육회와 김부각의 고소함이 입 안 한가득 퍼져서 정말 맛있다~! 라는 말이 연신 나왔어요🤗 구정 새해 선물을 맛있는 음식으로 내어주신 매우 친절한 술꼬마 사장님 다시 한번 감사드려요🙇🏻‍♂️ 또 찾아뵐게요~! 새해 복🧧많이 받으세요!",2025-01-30,"저녁에 방문, 예약 후 이용, 대기 시간 바로 입장, 친목, 나들이, 일상, 혼자",인테리어가 멋져요,254,5
45449726,dksdksjdlqwd,이태원 주민의 최최최최애맛집 술꼬마입니다. 술꾼들에게 안주는 완벽하고 맛은 뭐 기본입니다. 지인짜 맛있어요. 다 먹어봤는데 웬만하면 실패안합니다. 전통주들이랑 막걸리도 많아서 페어링하는 재미가 한가득이랍니다.,2025-01-28,"저녁에 방문, 예약 후 이용, 대기 시간 바로 입장, 친목, 친구",음식이 맛있어요,75,1
45449726,꿈하,퇴근 후 친구들이랑 한잔~ 음식 분위기 친절 다 만저 !,2025-01-23,"저녁에 방문, 예약 후 이용, 대기 시간 바로 입장, 친목, 친구",음식이 맛있어요,15,1
45449726,찐찐주,들기름 감바스 먹으러 갔는데 일반 감바스보다 덜 느끼하고 들기름 향이 많이 나서 독특하게 맛있었어요~~별관도 따로 있어서 매장이 넓은 편이라 웨이팅은 없었습니다양이 워낙 많아서 셋이 메뉴 두 개로 배부르게 잘 놀았습니다🔥,2025-01-19,"밤에 방문, 예약 없이 이용, 대기 시간 바로 입장",인테리어가 멋져요,58,1
45449726,AlexanderMcQ,메뉴들이 하나같이 독특하고 맛있었어요:)음식도 빨리나오고 직원분들이 너무 친절하셔서 즐거운 시간 보내고 왔습니다. 예약하고 들어올 때 제 이름이 테이블에 써 있는데 소소하지만 기분이 좋더라구요. 중간에 영양제도 챙겨주시는데 이런 서비스는 처음입니다. 감성이 있는곳 같아요👍🏻,2025-01-17,"저녁에 방문, 예약 후 이용, 대기 시간 바로 입장, 친목, 친구",친절해요,7,1
45449726,SPEC,골뱅이비빔면이 너무 새콤새콤하고 골뱅이가 듬뿍 들어기서 너무 맛있었어요~~작은메뉴중에 감자전 강추입니다! 피자인줄 알았어요 존👍👍 막걸리까지 맛있게 잘 먹고 갑니다,2025-01-11,"저녁에 방문, 예약 없이 이용, 대기 시간 바로 입장, 데이트, 연인・배우자",음식이 맛있어요,1153,1
45449726,bxm****,1월 밤 금요일에 7명이 갑자기 들이닥쳤을 때 당황하지 않는 프로페셔널함... 깔끔한 자리안내와 빠르게 나오는 음식 진짜 맛 미쳤어요; 여기 언니들 진짜 장난아님 센스가 센스가; 이런 직원이면 진짜 너무 기분좋게 마시고 나오죠 진짜생일이라고 하니까 틈틈이 생일축하한다고 해주시고ㅠㅠ 넘 감동 미친 술집(positive)이태원에서 여길 안 가면 어딜 가? 직원이 맛있고 음식이 친절해요^^,2025-01-11,"밤에 방문, 예약 후 이용, 대기 시간 바로 입장, 친목, 친구",친절해요,3,1
45449726,수콩60,안주가 너무 맛있어요! 그리고 분위기도 너무 좋습니다! :)),2024-12-31,"저녁에 방문, 예약 없이 이용, 대기 시간 10분 이내, 친목, 친구",음식이 맛있어요,5,1
45449726,가카시아,친구랑 이태원맛집 찾아갔다가 맛있어서 또 왔습니다 그때는 좀 취해서 리뷰 쓰는 거 까먹었는데 지금 한 번에 쓸게욥 ㅎ 자 일단 너~~무 맛있고 가성비 최고에요 요즈음 대한민국 물가에 오아시스가 여기입니다. 새우아보카도가 들어간 부추전도 맛있고 골뱅이 비빔면 면이 뭔가 특별해요 일반 소면이 아닌 거 같애요 뭔가 더 탱글한 느낌? 시간 좀 지나고서도 계속 먹었는데 탱글해서 아주 이뻤습니다 아 김치볶음밥도 실망시키지 않았고 대표 메뉴 김치찜도 사리면 넣어서 먹으세요 그리고 저 떡구이 3번 시켜먹습니다 걍 최고에요 그리고 여기는 주류 추천과 시음을 권장해주셔서 너무 좋았슴다 덕분에 여기서만 8병 마셔봤네요 술이 다양해서 너무 좋고 안주에 어울리게 추천해주셔서..직원분들도 너무 친절하시고..여튼 담에 또 뵈어용🫶🏻,2024-12-30,"저녁에 방문, 예약 없이 이용, 대기 시간 바로 입장, 일상, 친구",음식이 맛있어요,21,1
45449726,ㅎㅎㅎ87,너무 맛있게 먹고 가용!! 친절하시고 음식도 맛있어서 재방문의사 만땅입니다👏👏,2024-12-29,"저녁에 방문, 예약 후 이용, 대기 시간 바로 입장, 친목, 친구",음식이 맛있어요,19,1
45449726,최두팔00,친구들이랑 3차로 왔습니다 우선 할머니댁에있는 자개장이 있어서 익숙했고 머리올백으로 하신 얼굴작으고 예쁘신 사장님이 맛있고 안주가 예쁘세요🫶서비스로 주신 두가지의 막걸리는 너무 제스타일 이였고 친구들도 맛있게 먹었습니다저는 알코올 중독자 막걸리를 사랑하는 사람이고 여기는 이야기 하기도 좋고 연말 모임하기도 너무 좋습니다 단골이 이미 된것같고 이미 단골입니다❤️❤️ 다음에 친구들과 함께 방문하겠습니다 사랑합니다 더욱더 번창하세요🎉,2024-12-29,"밤에 방문, 예약 없이 이용, 대기 시간 바로 입장, 친목, 친구",친절해요,27,1
45449726,HyunJu62,직원분들이 너무 친절하세요👍🏻👍🏻,2024-12-24,"저녁에 방문, 예약 후 이용, 대기 시간 바로 입장, 친목, 친구",인테리어가 멋져요,14,1
45449726,소정하게,호랑이막걸리 꼭 드세오...+아보카도 새우전도 ㅈㅁㅌ 입니다,2024-12-16,"저녁에 방문, 예약 후 이용, 대기 시간 바로 입장, 친목, 친구",음식이 맛있어요,14,1
45449726,yj****,넘무 맛나요 강추합니다!👍👍👍,2024-12-13,"저녁에 방문, 예약 후 이용, 대기 시간 바로 입장, 친목, 친구",음식이 맛있어요,37,1
45449726,루삐따,이태원에서 핫한 술꼬마 방문했습니다~~ 안주시키면 취향 물어봐주시고 막걸리 추천해줍니다! 메인메뉴 떡갈비김치토마토스튜 먹어봤는데 딱 술안주였어요 파스타까지 면추가해서 먹으니까 안주 든든하게 술 마실 수 있어서 좋았습니다~~ 페퍼로니 감자전 단짠단짠 지대로 강추!!,2024-12-05,"저녁에 방문, 예약 후 이용, 대기 시간 바로 입장, 친목, 친구",음식이 맛있어요,218,1
45449726,사릉해유,"친구랑 이태원에서 일찍 만나 들른 술꼬마! 언덕위 골목안에 위치한 술꼬마! 단체석 매장과 일반매장이랑 두곳이라 첨엔 단체석매장에 문이 닫혀 놀랬다가 다시 안내받아 들어간 매장! 매일 신선한 육사시미가 들어온다길래 시켰는데 와우! 완전 신선하고 쫀득하면서 단백한 육사시미에 놀람! 기름장, 고추장소스, 내가 좋아하는 와사비에도 먹어봤는데 다 맛있음요! 이리 맛있어도 되나요? 추천받은 달콤하고 새콤한 호랑이막걸리! 이건 센술못마시는 나에겐 취향저격!넘 맛있다는! 술꼬마 오시면 요 육사시미 꼭 드셔보시길! 단체석 있는 매장도 바로 옆에 있어서 회식이나 단체모임에도 딱인곳! 이태원술꼬마 추천함돵!",2024-12-02,"점심에 방문, 예약 후 이용, 대기 시간 바로 입장, 친목, 친구",음식이 맛있어요,139,1
45449726,닉넴없없,이태원 올때마다 진짜 와보고 싶은데였는데.. 드디어!!!! 영접했습니다. 술 종류도 다양하고 특히 전통주가 많아서 좋았고 안주도 다 너무 기발해서 먹어보고 싶었는데 입은 두개라 아쉬웠어요..후🥲아 한가지 팁이라면..? 작년에 왔다가 사람 너무 많아서 못들어갔는데 옆 건물까지 확장하셔서 다인원 대관도 되겠더라구요. 연말모임 하기 좋아보였습니다!,2024-12-01,"저녁에 방문, 예약 후 이용, 대기 시간 바로 입장, 데이트, 연인・배우자",음식이 맛있어요,102,1
45449726,receiptdedecembre,.,2024-11-29,저녁에 방문,,183,1
45449726,blakkowwwl7,맛있어요,2024-11-29,"저녁에 방문, 예약 후 이용, 대기 시간 바로 입장, 친목, 친구",단체모임 하기 좋아요,858,1
45449726,joo****,"음식이 맛있고, 사장님친절하심👍맛잘알이 분명함!! 다만 홀 직원분이 너무 불친절해서 이용하는 중에 많이 불편했음. 너무 시끄러워서 대화불가🤬",2024-11-29,"저녁에 방문, 예약 없이 이용, 대기 시간 바로 입장, 데이트",음식이 맛있어요,164,1
45449726,다알리아55,술집인데 음식이 맛있어요~! ^^ 봉평메밀막걸리 처음 마셔봤는데 맛있네요~~,2024-11-29,"저녁에 방문, 예약 없이 이용, 대기 시간 바로 입장, 데이트, 연인・배우자",음식이 맛있어요,49,1
