place_id,nickname,content,date,situations,keywords,review_count,visit_count
1318432398,kdkdog,"예전에 갔던 좋은 기억에 재방문함.고기 종류도 많고 특히 껍데기가 맛있었던걸로 기억함.이번에 방문하고 느낀점은,매장은 넓으나, 주방과 홀을 사장님 한 분이 다 카버함.음식 나오는 속도 느리고, 상추파채는 손님이 직접 양념해서 먹어야 함.주말 저녁시간이라도 알바를 쓰지. 혼자하는 사장님 버거워보임. 음식맛은 나쁘지 않으나 가격이 비싼편.대부분 150g에 18000원 정도였음.암사동에서 이 돈 주고 먹을건 아니었음.재방문 의사는 없음",2024-06-16,"저녁에 방문, 예약 없이 이용, 대기 시간 바로 입장, 친목, 지인・동료",매장이 넓어요,22,1
1318432398,드록바34,오랜만에 먹으러왔어요 맛있어요,2024-06-01,"저녁에 방문, 예약 없이 이용, 대기 시간 바로 입장, 데이트, 연인・배우자",음식이 맛있어요,29,1
1318432398,보라7198,여기 오겹이랑 껍데기는 여기가 최고에요!!쫀뜩쫀득 ㅎㅎㅎㅎㅎ반찬도 정갈하게 너무 맛나요,2024-05-24,"저녁에 방문, 예약 없이 이용, 대기 시간 바로 입장, 일상, 연인・배우자, 아이",음식이 맛있어요,25,6
1318432398,보라7198,진짜 너무맛있어요ㅎㅎㅎ사장님 친절하시고 고기에 진심이신분입니다저희 가족도 고기에 진심인 가족이라 진짜 고기 땡기는 날이면무조건 인계동이네요!!오겹살 고기 너무 좋구 맛있습니다껍데기 다른곳보다 두툼하니 쫀득쫀득 !!,2024-05-13,"저녁에 방문, 예약 없이 이용, 대기 시간 바로 입장, 가족모임, 연인・배우자, 아이",음식이 맛있어요,25,5
1318432398,보라7198,오늘은 친정식구들 와서 다같이 다녀왔습니다 ㅎㅎ제주생갈비랑 오겹살 껍데기 모두 맛있다고허겁지겁ㅎㅎㅎㅎ진짜 고기 질이 달라요!정말 먹어도먹어도 질리지가 않아용!,2024-05-12,"저녁에 방문, 예약 후 이용, 대기 시간 바로 입장, 회식, 연인・배우자",음식이 맛있어요,25,4
1318432398,보라7198,또왔습니다..완전 최애 고기집!! 등극ㅋㅋㅋㅋㅋㅋㅋ고기만 맛있게먹느라리뷰이벤안쓴날도 있어서 그렇지 한 번 온 뒤로고기생각나면 무조건 요기네요!!사장님도 친절하시고 무엇보다 진짜 오겹살 쫀득쫀득 장난아니에요,2024-05-04,"저녁에 방문, 예약 없이 이용, 대기 시간 바로 입장, 가족모임, 연인・배우자, 아이",음식이 맛있어요,25,3
1318432398,kittygom,야장느낌으로 먹고싶어서 왔어요!!!사장님 친절하시구 항정껍데기 첨 먹어보는데 맛있어요 갈매기두 맛있네요^^,2024-05-03,"저녁에 방문, 예약 없이 이용, 대기 시간 바로 입장, 데이트, 연인・배우자",음식이 맛있어요,27,1
1318432398,보라7198,3일?4일에 재방문ㅎㅎㅎ체인점이지만 뭔가 더 쫀득하니 맛있는느낌정말 너무맛있어요😀🥰🥰,2024-04-23,"저녁에 방문, 예약 없이 이용, 대기 시간 바로 입장, 가족모임, 연인・배우자, 아이",음식이 맛있어요,25,2
1318432398,보라7198,아이랑 오기도 좋은곳이에요. 테이블 넓게 있어 좋고매장도 청결하네용^^고기는 딱 봐도 질이 좋아보이구사진은 밑반찬인데 하나같이 맛있어요메뉴구성 이랑 이벤트들도 알차게 해주시고 완전 단골 예약입니당!,2024-04-20,"저녁에 방문, 예약 후 이용, 대기 시간 바로 입장, 가족모임, 연인・배우자, 아이",음식이 맛있어요,25,1
1318432398,DDANI1,처음갔는데 너무너무 맛있어서 정신없이 먹었어요먹느라 사진이 된찌밖에 없어요ㅠㅠ 넘맛있어서 자주 가려고요~~!! 된장찌개도 예술~!!!!!!!!!!!,2024-04-15,"저녁에 방문, 예약 없이 이용, 대기 시간 바로 입장, 데이트, 연인・배우자",음식이 맛있어요,977,1
1318432398,sososik99,암사역 주변에 퀄리티 좋은 고기집 중 하나사장님 너무 친절하시고제주도 오겹살이라서 쫀득하고 살코기도 적당히있어서 정말 맛있게 먹을 수 있는 집!!껍데기 집 답게 솔직히 껍데기로는따라올 집이 없음!!,2024-04-11,"저녁에 방문, 예약 없이 이용, 대기 시간 바로 입장, 데이트, 나들이, 연인・배우자",음식이 맛있어요,85,1
1318432398,엠씨마,완전 맛있어요 껍데기가 쫄깃 고기도 신선하고엄청 위생도 깔끔하고 사장님도 친절하세요❤️❤️자주 올게요❤️,2024-03-19,저녁에 방문,음식이 맛있어요,361,1
1318432398,두더지3118,껍데기 맛있다는 소문듣고 찾아왔는데 역시 너뮤 맛있습니당 ㅎㅎㅎ 된장찌개까지 맛돌이 ㅋㅋㅋㅋㅋ사장님도 너무 친절하시고 다음에 또올게요!,2024-03-15,"저녁에 방문, 예약 후 이용, 대기 시간 바로 입장, 친목, 지인・동료",음식이 맛있어요,7,1
1318432398,밀키42,여기 지점이 껍데기가 제일 맛있어요반찬도 너무 맛있고 늦게까지 영업해서 좋아요 👍👍,2024-03-14,"저녁에 방문, 예약 없이 이용, 대기 시간 바로 입장, 회식, 지인・동료",음식이 맛있어요,26,1
1318432398,쥬디046,사장님이 너무 친절하게 대해 주셔서 들어올 때부터 넘 좋았어요! 🩷 다음에도 친구랑 꼭 같이 올 거예요~,2024-03-12,"저녁에 방문, 예약 후 이용, 대기 시간 바로 입장, 데이트, 친구",음식이 맛있어요,14,1
1318432398,림림이68,숙성고기라 너무 맛있고 파무침이랑 고기가 정말 잘 어울려요!!🩷,2024-03-11,"밤에 방문, 예약 없이 이용, 대기 시간 바로 입장, 데이트, 친목, 연인・배우자, 친구, 지인・동료",음식이 맛있어요,163,1
1318432398,라랄7424,껍데기 맛집,2024-03-01,"저녁에 방문, 예약 후 이용, 대기 시간 바로 입장, 친목, 친구",음식이 맛있어요,48,1
1318432398,엘리6824,고기가 연탄향으로 맛있어요.,2024-01-10,"저녁에 방문, 예약 후 이용, 대기 시간 바로 입장, 가족모임, 친척・형제",음식이 맛있어요,137,1
1318432398,맛집폭격기ㅎ,사장님 친절하시구!!!! 너무너무 맛잇어용 ㅎㅎ,2023-12-30,"저녁에 방문, 예약 후 이용, 대기 시간 바로 입장, 데이트, 연인・배우자",음식이 맛있어요,33,3
1318432398,ㅎㅋㅎ1,예약하고 가면 떡볶이 서비스인데 양도많고 맛있어요 그리고 사장님이 친절하시구 겨울이라 춥다고 김치콩나물국 서비스로 주시는데 갬동...ㅎ 껍데기 꼭드세여 완전 마싯어요 ㅎ 연탄불이라 좋아요,2023-12-24,"저녁에 방문, 예약 후 이용, 대기 시간 바로 입장, 가족모임, 아이",음식이 맛있어요,67,1
1318432398,lriskelly,4번째 방문이에요ㅎ 항정껍데기는 여전히 맛있고사장님도 정말 친절하세요~^^임산부인데도 너무 잘먹고왔어요!담에 또갈게요♡,2023-12-10,"저녁에 방문, 예약 없이 이용, 대기 시간 바로 입장, 데이트, 연인・배우자",음식이 맛있어요,779,3
1318432398,Daniel Haneul Park,,2023-12-02,"저녁에 방문, 예약 없이 이용, 대기 시간 바로 입장, 가족모임, 아이",음식이 맛있어요,1643,1
1318432398,데이빗밀스,와~ 껍데기🧡,2023-11-29,"저녁에 방문, 예약 없이 이용, 대기 시간 바로 입장, 데이트, 연인・배우자",음식이 맛있어요,1325,1
1318432398,111****,굿,2023-11-22,"저녁에 방문, 예약 없이 이용, 대기 시간 바로 입장, 친목, 친구",인테리어가 멋져요,552,1
1318432398,우람하다,가격은 꽤 되지만 맛은 확실히 있습니다. 가격이 있는 만큼 확실하게 직접 구워주면 좋겠습니다.,2023-11-14,저녁에 방문,매장이 청결해요,22,1
1318432398,집없는 사람,"매장도 깔끔하고, 고기 질도 좋아요. 특히 껍데기는 야들야들한 게 일품!",2023-11-07,저녁에 방문,친절해요,77,2
1318432398,jo****,굿,2023-10-04,저녁에 방문,친절해요,3654,1
1318432398,쑥이230,고고,2023-09-27,저녁에 방문,음식이 맛있어요,1076,1
1318432398,뽀글이엄마84,고기진짜맛있어요.껍데기도맛있고.직원분사장님친절하세요.볶음밥물냉면도별미👍동네맛집인정!,2023-09-05,저녁에 방문,음식이 맛있어요,454,1
1318432398,dhd****,고기도 다 너무 맛있고 특히 돼지껍데기 맛집 🥹🤍🤍🤍,2023-08-13,저녁에 방문,친절해요,17,1
1318432398,란6239,"세상에나 이렇게 맛있는 껍데기는 난생 처음이에요!!!다른 인계동껍데기랑도 차원이 다르고 고기들도 숙성이라 완전 다른 맛!!! 이벤트였던 떡볶이도 먹었는데, 치즈 없는게 더 맛있는것 같아요 ㅎㅎㅎ밑반찬들도 정말 맛있고 사장님도 친절해요❤️",2023-07-20,저녁에 방문,음식이 맛있어요,320,1
1318432398,joe****,너무 친절하신 사장님과 직원분들 덕분에 기분좋게 맛있게 먹었습니다~^^,2023-07-07,저녁에 방문,음식이 맛있어요,22,1
1318432398,wls****,사장님 친절하시고 고기맛도 좋습니다.같이 먹었던 김치볶음밥도 진짜 맛있네요.암사동에서 먹던 고깃집 중에서 손꼽히게 맛있습니다.,2023-06-07,저녁에 방문,음식이 맛있어요,26,1
1318432398,맛집짱,"반찬도 많이 나오고 껍데기도 맛있고, 사장님 정말 친절하세요.",2023-06-05,밤에 방문,가성비가 좋아요,1463,1
1318432398,피바람님,주문하고 음식 나오는데 좀 기다리긴 하지만 밑반찬도 맛있고 껍데기도 맛있어요!,2023-05-13,저녁에 방문,음식이 맛있어요,662,2
1318432398,이응7013,맛있어요!!!,2023-04-23,저녁에 방문,음식이 맛있어요,33,1
1318432398,용비연97,역시 언제가도 만족도 높은 맛,2023-04-12,저녁에 방문,고기 질이 좋아요,1502,2
1318432398,김윤v,맛있어용~ 친절해용~ 꼬기도 엄청 맛있게 잘 구워주셔서 감사했습니당👍🏻,2023-04-10,밤에 방문,인테리어가 멋져요,142,1
1318432398,유니부인30,굿,2023-04-02,밤에 방문,직접 잘 구워줘요,92,2
1318432398,트레비스81,역대급으로 맛있는 껍데기 잘 먹었습니다 :)다음에 또 올게요!!,2023-04-01,저녁에 방문,친절해요,67,1
1318432398,용비연97,숙성 짱너무너무 맛있어서 가족들과 한번 더 방문 예정입니다.,2023-03-30,저녁에 방문,음식이 맛있어요,1502,1
1318432398,찡S2,"고기도 맛있고, 직원분들도 친절하시고, 고기도 구워주셨어요. 기분좋고 맛있게 먹었네요! 다음에 또 갈께용!!",2023-03-25,저녁에 방문,특별한 메뉴가 있어요,1658,1
1318432398,코르세오,"구워주시니까 너무 좋아요~ 파절이 맛있어용!! 특별한 메뉴가 있던데, 다음에 먹어봐야겠어요~",2023-03-02,저녁에 방문,친절해요,653,1
1318432398,하츄핑은 여행중,"체인점인데 점바점 인가바여 암사점 너무 맛있음!🫢 친절하신 사장님이 하나하나 다 구워주시구, 편하게 잘 먹었어요! 가게도 청결하고, 암사역이랑 가까워서 교통도 편리하네요👍 쭉 번창하세요♥️",2023-02-19,저녁에 방문,가성비가 좋아요,395,1
1318432398,sta****,"맛은 당연하게 맛있고요. 사장님도 친절, 종업원들도 모두 친절하십니다. 동네맛집!",2023-02-19,저녁에 방문,친절해요,40,1
1318432398,일상9383,오겹살  쫄깃쫄깃 맛있어요~ 불족발은 매콤하고 껍데기 잘 구워주셔서 맛있게 먹었어요~~생갈비 식감이 부들부들 맛있네요~어른2 고등여1 총 3명이서 6인분 먹었네요~~,2023-02-12,저녁에 방문,인테리어가 멋져요,314,1
1318432398,으컁컁71,제주뭉팅고기 갈매기살 벌집껍데기 먹었습니다. 껍데기가 너무 땡기던 날이라 찾아갔습니다.우선 셋 중에서는 갈매기살이 젤 맛있었어요! 뭉팅고기 - 뻣뻣 (퍽퍽살 좋아하시는 분들 추천)껍데기 - 물컹? 했어요 .. 쫄깃한 껍데기라기보다는 서컹서컹한 비계 씹는 느낌 ㅠㅠ저희가 껍데기 성애자라 사진 비주얼보고 너무 기대하고 갔던 걸까요.. 두꺼워도 쫄깃탱탱한 껍데기를 기대했는데 ..껍데기 실패 ㅠ시골된장찌개 - 카레가루인지..여러 조미료가 합쳐져서 된장맛은 잘 안느껴지구 뭔가 텁텁요상한 찌개였습니당 ㅠ 그래도 찌개에 들어가는 재료들은 실했어요사장님은 친절하셨어요 반찬도 매운김치부터 해서 신경 쓰신 듯 보였습니당,2023-01-26,저녁에 방문,친절해요,203,1
1318432398,jer****,오늘 정말 제대로 된 껍데기를 먹었다 정말 너무 맛있고 서비스도좋고매장도 청결하다 사장님도 정말 친절해서 또 오고 싶은 곳 연초부터 행복한 저녁이였다,2023-01-25,저녁에 방문,매장이 청결해요,446,1
1318432398,mk1****,닭볶음탕을 먹었어요~ 추운 겨울 안주로 딱입니당! 국도 칼칼한게 매콤하고 안에 내용물이 제법 많이 들어있어서 배부르게 먹었어요~ 재방문의사 있습니다!,2023-01-25,저녁에 방문,매장이 청결해요,417,1
1318432398,우리집개까미,인계동껍데기 다른지역도 여러군데 가봤지만 다른곳에비해 고기가 더 신선하고 맛있는 느낌입니다 너무 얇지 않아서 서걱서걱 씹는느낌도 좋네요 사람이 많았지만 매장이 커서 회전률이 좋아보였습니다 사이드 메뉴도 많아서 다음에 가면 더 다양하게 먹어보고 싶습니다!,2023-01-25,저녁에 방문,친절해요,244,1
1318432398,탱귤7,"맛있어요! 그냥 맛있어요!! 껍데기 인생껍데기ㅠㅠㅠ 껍데기는 솔직히 예전부터 유명했는데 생각보다 삼겹살, 목살도 맛있어서 놀랐어요. 고기가 맛있어서 그냥.. 술 많이 먹어버린 곳. 매장이 넓어서 회식하러 오기 좋은 곳인 듯. 재방문 예정",2023-01-25,저녁에 방문,재료가 신선해요,191,1
1318432398,ADL,메뉴가 전이랑 좀 달라진거같아요분위기가 편안하고 껍데기가 부드러워요,2023-01-09,저녁에 방문,친절해요,858,1
1318432398,dkd****,엄청난 가성비 맛집! 너무 저렴하게 좋은 식사 할 수 있어요. 고기도 직원분들이 다 구워주셔서 엄청 편하구요. 껍데기도 얼굴에 튀길 위험 하나 없이 맛나게 먹고 나왔어요🥹,2023-01-09,저녁에 방문,양이 많아요,72,1
1318432398,허지원79,애들이 여기 껍데기를 너무 좋아해요~~ 원래 쳐다도 안보던 입맛 까다로운 애들인데 여기는 맨날 가자고 해요~ 아이들이 먹을 정도로 엄청 부드럽고 맛나요^^,2023-01-09,저녁에 방문,주차하기 편해요,50,1
1318432398,김신영33333,일단 매장이 엄청 깔끔하고 직원분들도 매우 친절하십니다. 고기랑 껍데기도 너무 맛있는데 된장찌개까지 일품이에요. 잡내 하나 없이 너무 맛있어서 과식하고 왔습니당ㅋㅋ,2023-01-09,저녁에 방문,가성비가 좋아요,57,1
1318432398,아지짱74,껍데기만 파는게 아니라 고기도 같이 팔아요. 전 껍데기도 맛있었는데 고기가 정말 맛있었어요. 특히 생갈비 적당히 달콤한게 또 먹고싶네요.,2023-01-09,저녁에 방문,주차하기 편해요,63,1
1318432398,없음84,일단 메뉴 종류가 엄청 많더라구요! 되게 쫄깃하고 잡내하나 없이 너무 부드러워요. 다음에 오면 못먹었던 메뉴도 먹어보려구요!! 가성비 최고 식당💐,2023-01-09,저녁에 방문,가성비가 좋아요,131,1
1318432398,조민진27,빠삭빠삭한게 최고존맛~ 삼겹살도 짱맛임스트레스 잘 풀리는 그런 맛 ㅎ,2023-01-06,저녁에 방문,친절해요,895,1
1318432398,뼝아리92,고기 맛잇엇어요~ 배터지게먹었네요 ㅎㅎ껍데기도시켰는데 쫀득하니 좋았어요 매장도 깨끗해요,2023-01-06,저녁에 방문,특별한 날 가기 좋아요,917,1
1318432398,가연9321,맛잇어요특히 껍데기전문점이다보니 쫀득 짭짤하니채고,2023-01-06,저녁에 방문,음식이 맛있어요,972,1
1318432398,진행290,사장님이직접 고기구워주시는데 맛나요 자부심 잇으시구 다양한 고기종류도많어용🥹,2023-01-06,저녁에 방문,친절해요,974,1
1318432398,ript812,껍데기 싸고맛잇어요~ 직원도 친절하구 사이드도 굿굿입니다 다른 고기도 시켜먹어봣는데 껍데기 못지않게 맛나요,2023-01-06,저녁에 방문,단체모임 하기 좋아요,797,1
1318432398,안주6487,예약하고가니 떡볶이 서비스로받앗어용 ㅎㅎ고기 사장님이 구워주시는데 편하게 잘 먹었어용,2022-12-30,저녁에 방문,화장실이 깨끗해요,422,1
1318432398,소휘쨔응,재료도 신선하니 맛잇고 껍데기 뿐만아니라 다른 고기도 왕창 먹었네요❤️❤️ 위생도 좋앗습니다,2022-12-30,저녁에 방문,화장실이 깨끗해요,1322,1
1318432398,Love1293,가게도 깨끗하고 손님우대잘해주세요~ㅎㅎ맛잇게 잘 먹었습니다 꺼억,2022-12-30,저녁에 방문,친절해요,758,1
1318432398,Gomi32,껍데기 존맛탱.. 쫄깃쫄깃 고소한게 중독성있어요 용범이네 왜유명한지 알거같네용!,2022-12-30,저녁에 방문,특별한 날 가기 좋아요,1083,1
1318432398,이응1433,껍데기가 쫀득쫀득한게 환상적이네용비빔국수랑도 찰떡이였어요!,2022-12-30,저녁에 방문,화장실이 깨끗해요,777,1
1318432398,oraeo1094,맛있게 먹고갑니다! 일반 고깃집들보다 깔끔하고 맛있어요ㅎㅎ 매장도 고깃집인데 매우 청결하고 사장님과 직원분들이 친절하셔서 좋네요! 껍데기도 두툼하고 먹기 좋게 나왔어요~,2022-12-28,저녁에 방문,재료가 신선해요,599,1
1318432398,개팔,오늘 먹으러왔는데 고기도 너무 맛있고!! 사장님들도 너무 친절하고 기분좋게 술한잔 하고갑니다! 다음에는 다른거를 먹어보려고요👍👍 또 와서 방문하고싶습니당,2022-12-28,저녁에 방문,양이 많아요,492,1
1318432398,als****,"고깃집 알아보다가 가봤는데, 만족이었습니다:) 일단 고기가 너무 맛있었습니다~ 불판도 개인적으로 고기굽기 너무 편했습니다! 밑반찬도 맛있었습니다~ 알바생분도 친절하셨어용! 담에 또 가겠습니다~",2022-12-28,저녁에 방문,양이 많아요,563,1
1318432398,qkr****,자주가는 단골 집인데 오늘도 너무너무 맛있게 잘 먹었습니다~~~~~ 매번 친절하게 응대해주셔서 감사합니다!! 담에 또 방문 예정!!!! 껍데기굿,2022-12-28,저녁에 방문,특별한 메뉴가 있어요,500,1
1318432398,ba_****,고기가 맛있어요!! 하이볼이랑도 너무 잘 어울리네요😍,2022-12-24,저녁에 방문,친절해요,261,1
1318432398,chk****,드라이에이징한 고기라 그런지 정말 뷰드럽고 맛있습니다ㅠㅠ 껍데기도 정말 쫀득하고!!!!직원분들도 친절한데 매장도 청결해서 더더욱 만족도가 높았습니다ㅎㅎㅎ 최고👍🏻👍🏻,2022-12-22,저녁에 방문,특별한 메뉴가 있어요,574,1
1318432398,hsj****,친구가 맛았다 해서 방문했는데 찐이네요~!!고기도 그렇고 껍데기 진짜 ㅠㅠㅠㅠ 너무 쫀득쫀득 완전 제스탈 .. 담에 또 올게요ㅎㅎ,2022-12-22,저녁에 방문,음식이 맛있어요,599,1
1318432398,키우위,매장이 청결하고 직원도 친절햇구요. 맛이야 말해모해 입니까 암사점 말고 다른 지점도 가보았고 암사점은 처음인데 역시나 만족입니다^^ 연말 모임으로 가성비 있게 잘 먹었습니다! 껍데기 뿐만이아니라 다른 고기도 신선하고 고기 맛이 좋아요,2022-12-22,저녁에 방문,음식이 맛있어요,72,1
1318432398,주연425,가족여행의 첫 출발! 용범이네 인계동 껍데기에 저녁먹으러갔어요 벌집껍데기랑 오겹살 먹었구 된장찌개도 추가했습니다! 예약시간대에 딱 마춰서 테이블 세팅 안내해주시고 빠르게 잘 먹고 갈수 있었어요. 같이간 가족들 모두다 너무나 맛있다고 만족하며 식사하고갔습니다. 감사해요👨‍👩‍👧‍👦👨‍👨‍👦,2022-12-22,저녁에 방문,음식이 맛있어요,72,1
1318432398,보로봉봉12,직원분들도 친절하고 매장도 청결하고~~ 젤 대박인건 고기와 껍데기맛이👍🏻 정말 최고입니다ㅎㅎ왜 사람들이 많은줄 알겠드라구요~!! 담에 또 오려구요~~,2022-12-22,저녁에 방문,음식이 맛있어요,564,1
1318432398,dja****,"추천으로 다녀왔는데 고기도, 껍데기도 맛있고 밑반찬도 너무 맛있어서 좋았어요! 식당도 깔끔하고 사장님도 너무 친절하셔서 단골 예약입니다 ㅎㅎ 벌집 껍데기보다 바삭하고 고소하게 잘 먹는 껍데기는 처음이였어요 ㅎㅎ",2022-12-19,저녁에 방문,음식이 맛있어요,21,1
1318432398,rhg****,친구들이랑 오랜만에 만나서 먹으러 왔는데 너무 만족스러웠어요! 고기도 드라이 에이징하고 숙성한거라고 하더라구요 그래서 그런지 엄청 부드럽고 맛있었어요! 껍데기도 쫄깃하게 맛있었어요! 다음에도 방문할게요,2022-12-19,저녁에 방문,재료가 신선해요,85,1
1318432398,daw****,양념안된 껍데기 처음 먹어봤는데 너무너무 맛있었어요!! 암사역에 고기랑 껍데기도 맛있는 곳 찾으신다면 여기 꼭 가야한다고 추천합니다!! 친절하게 대해주셔서 감사합니다,2022-12-19,저녁에 방문,재료가 신선해요,66,1
1318432398,류갱이,고기가 입에서 녹네요 정말 껍데기랑 제주고기 다 너무 맛있네요 고기가 질기지도 않고 신선한 고기라는게 느껴졌어요! 껍데기도 양념 안된거는 처음이였는데 맛있네요 정말 ㅎㅎ,2022-12-19,저녁에 방문,친절해요,84,1
1318432398,sew****,1차 2차 3차까지 여기서 뿌술수 있을만큼 메뉴도 다양하고 주류도 다양하더라구요 ㅋㅋㅋㅋ그리고 중요한건 다 맛남ㅋㅋㅋ1차 고기 조지고 2차로 꼬드득살에 껍데기 먹고 하이볼에 떡볶이까지! 추운데 여러군데 방문안하고 여기서 다 해결하고갑니다 완전 굿!,2022-12-19,저녁에 방문,친절해요,54,1
1318432398,생활박사,고기도 정말 정말 맛있는데 사장님 진짜 너무 친절하셔서 정말 기분 좋은 식사 했습니다 .네이버 예약으로 받은 떡볶이도 너무 맛나더라구요 고기 + 떡볶이 조합도 너무 좋았습니당 ㅎㅎㅎ,2022-12-19,저녁에 방문,재료가 신선해요,100,1
20360224,lee****,,2025-03-16,"점심에 방문, 예약 없이 이용, 대기 시간 바로 입장, 데이트, 친구",음식이 맛있어요,849,8
20360224,dore,허니순살이랑 오리지널 퐁듀치즈볼  먹었어요 매장도 따뜻하고 좋았습니다 교촌 오랜만에 먹었는데 너무 맛있었어요,2025-02-07,"저녁에 방문, 예약 없이 이용, 대기 시간 바로 입장, 데이트, 연인・배우자",음식이 맛있어요,654,1
20360224,ji****,.,2025-02-01,저녁에 방문,,2796,9
20360224,charmingCho,호,2025-01-16,"점심에 방문, 예약 후 이용, 대기 시간 바로 입장, 일상, 혼자",음식이 맛있어요,1142,1
20360224,에스영88,모임하기도 좋고~ 맛은 당연히 좋네요~^^,2024-12-30,"점심에 방문, 예약 없이 이용, 대기 시간 바로 입장, 친목, 아이",음식이 맛있어요,1010,1
20360224,all31,,2024-12-10,저녁에 방문,음식이 맛있어요,1675,15
20360224,다혜네 지하실 1번방,죠큐,2024-12-06,"점심에 방문, 예약 없이 이용, 대기 시간 바로 입장, 일상, 부모님",음식이 맛있어요,2201,1
20360224,일상9383,바삭하고 달달 짭쪼름 맛있게 먹었습니다.,2024-11-29,"저녁에 방문, 예약 없이 이용, 대기 시간 바로 입장, 데이트, 연인・배우자",음식이 맛있어요,314,1
20360224,barbie2431,양도 푸짐해서 네명이 실컷 먹었어요,2024-11-24,"점심에 방문, 예약 없이 이용, 대기 시간 바로 입장, 데이트, 연인・배우자",음식이 맛있어요,1049,1
20360224,DDANI1,콤보에 날개가 네개밖에 안나왓어요 신경좀 써주세요ㅛ,2024-10-18,"밤에 방문, 예약 후 이용, 대기 시간 30분 이내, 데이트, 연인・배우자",양이 많아요,977,5
20360224,이민정471,치킨 하나 두고 엄청 퍼마셨네ㅋㅋ화장실은 가게 나가서 우측 주차장 안쪽에 있음,2024-10-14,"저녁에 방문, 예약 없이 이용, 대기 시간 바로 입장, 친목, 지인・동료",음식이 맛있어요,212,1
20360224,즌즌42,맛있다,2024-10-13,"점심에 방문, 포장·배달 이용, 대기 시간 바로 입장, 일상, 연인・배우자",음식이 맛있어요,19,1
20360224,kjr4023,맛나요,2024-10-12,"점심에 방문, 예약 없이 이용, 대기 시간 바로 입장, 데이트, 친구",음식이 맛있어요,561,1
20360224,피터34,맛있어요,2024-09-07,저녁에 방문,음식이 맛있어요,101,1
20360224,몽블 랑 84,교ㅡ촌 오리지날 ㅡ짱!!,2024-09-03,"저녁에 방문, 포장·배달 이용",음식이 맛있어요,1073,3
20360224,dbsquddnsla,맛있어요!,2024-09-01,"점심에 방문, 예약 없이 이용, 대기 시간 바로 입장, 일상, 혼자",음식이 맛있어요,1559,1
