place_id,nickname,content,date,situations,keywords,review_count,visit_count
20854264,쭈물쭈물,얼큰두부전골/두부조림/두부부침전골은 슴슴한데 얼큰하고 조림은 밥도둑!부침은 말해뭐해 두부사랑은 여기서 먹기 딱좋음.짜지도 않고 전부다 밥도둑!뭔가 조미료 안쓴 느낌이고 두부전도 겉바속촉이 아니라 겉촉 속촉..!!!!!! 애기 다루듯이 살살 구운느낌 너무...맛있어서 밥 두그릇 뚝딱,2025-03-18,"점심에 방문, 예약 없이 이용, 대기 시간 바로 입장, 일상, 친구, 지인・동료",음식이 맛있어요,273,1
20854264,나의맛집일기,"인생 두부 맛집!! 매일 두부를 먹을 정도로 두부를 좋아하는데 여기는 찐이에요!! 국산콩으로 만든 두부가 입에서 사르르 녹아요 너무 부드럽고 고소해요 전골이랑 모두부 주문했는데 두개 다 진짜 맛있어요 대식가인데 양과 맛 모두 만족스러웠어요 반찬도 간이 세지 않고 슴슴해서 좋았고 두부전골은 애호박, 느타리버섯, 팽이버섯, 쑥갓, 새우젓, 두부 등이 들어가 있고 조미료 안 들어간 맑고 시원한 맛이에요 술도 안 마셨는데 해장하는 기분이에요 모두부도 제가 먹어본 두부 중에 제일 맛있어요 밥도 흑미밥이라 더 좋아요 사장님도 친절하시고 추천합니다 참고로 주말 기준 12시 20분이면 만석이에요",2025-03-16,"점심에 방문, 예약 없이 이용, 대기 시간 바로 입장, 데이트, 연인・배우자",음식이 맛있어요,111,1
20854264,sds205,그닥 맛없음,2025-03-04,"점심에 방문, 예약 없이 이용, 대기 시간 바로 입장",,25,1
20854264,사임당19,,2025-03-04,"점심에 방문, 예약 없이 이용, 대기 시간 바로 입장, 일상, 지인・동료",음식이 맛있어요,970,1
20854264,불량아줌마,두부가 맛있네요.식사만하다가 오늘은 두부김치에 두부추가~~맛있어요.두부가 입에서 녹아요.ㅎㅎ,2025-01-23,"저녁에 방문, 예약 없이 이용, 대기 시간 바로 입장, 친목, 지인・동료",음식이 맛있어요,1033,3
20854264,YJ9444,친구랑 둘이 동네밥집찾다가 찾아가봤습니다. 좀 가볍게먹고싶어서 갔어요. 시장쪽이라 기대별로안했는데 본식이랑 반찬도 깔끔하고 맛있어요.두부보쌈먹고싶었는데 보쌈이 안된다고하셔서 한참고민했네요.후기에 모두부랑 손두부가 너무 맛있어보이는데 둘다 사이드라 식사론 애매할가싶어 맑은순두부찌개랑 두부김치시켰네요.두부가 슴슴하니 깔끔하게 맛있었습니다. 볶은김치는 살짝 매콤해요.두부랑 먹어도맛있고 밥이랑먹어도 맛있어요.강릉까지 안가도 될거같아요ㅎㅎ 맛있게먹고너무배불러서 남기고온게 집가서 다시생각났어요 ㅠ 비지도 챙겨주셔서 비지찌개한번 해먹을까하네요. 양많아고민하니 친구랑 반 나눠주시고 사장님도 너무 친절하셨어요.재방문의사 친구랑 둘다있네요 다음엔 두부보쌈 성공하길 ㅎㅎ,2025-01-12,"저녁에 방문, 예약 없이 이용, 대기 시간 바로 입장, 일상, 친구",음식이 맛있어요,25,1
20854264,크래미크리스탈,"두부가 야들야들 입안에서 살살 녹아요. 친구부부들과 연말 모임을 사가정두부에서 했어요. 두부보쌈, 두부만두전골, 녹두전, 도토리무침까지 어쩜 다 이렇게 맛있을까요? 대낮부터 이 맛있는 음식들을 안주삼아 막걸리가 술술 넘어 가더라구요. 사장님 친절 하시고, 건강한 음식맛이 좋아서 자주 방문하게 되네요. 오늘도 감사히 잘 먹고 갑니다~",2024-12-30,"점심에 방문, 예약 후 이용, 대기 시간 바로 입장, 친목, 친구",음식이 맛있어요,811,1
20854264,leslie25,정말 손두부 찐맛집!!강릉에서도 손두부 많이 먹어봤는데요기 정말 찐으로 맛있었어요!두부가 맛있다고 느낀게 처음^^사장님도 친절하시고~다만 음식 나오는데 엄청 오래 걸려요 ㅎㅎ담에 또 갈게용,2024-12-22,"점심에 방문, 예약 없이 이용, 대기 시간 10분 이내, 친목, 친구",음식이 맛있어요,574,1
20854264,천상천하유아독종악녀48,전체적으로 간이 센 편국물은 새우젓으로 내고두부는 그동안 먹은 것중 최고,2024-12-15,"저녁에 방문, 예약 없이 이용, 대기 시간 바로 입장, 일상, 친구",음식이 맛있어요,866,1
20854264,ipa****,,2024-12-07,"점심에 방문, 예약 없이 이용, 대기 시간 바로 입장, 나들이, 연인・배우자",음식이 맛있어요,1078,1
20854264,푸른소금28,맛있었어요,2024-11-28,저녁에 방문,음식이 맛있어요,2213,6
20854264,이슬한잔,두부전골 22000두부김치 12000볶은 김치맛은 아숩지만  두부 맛남,2024-11-11,"점심에 방문, 예약 없이 이용, 대기 시간 바로 입장",음식이 맛있어요,616,1
20854264,lioi20cnjv,굿,2024-11-09,"저녁에 방문, 예약 없이 이용, 대기 시간 바로 입장, 나들이, 지인・동료",특별한 메뉴가 있어요,1772,1
20854264,긍정의 여자,굿,2024-09-30,"점심에 방문, 예약 없이 이용, 대기 시간 바로 입장, 데이트, 친구",음식이 맛있어요,1604,1
20854264,지금이중요해,"검색해서 찾아왔는데, 가성비 좋은 맛집이네요. 순두부찌개는 얼큰하고 순두부가 몽글몽글한게 고소하고 맛있어요.  사진에는 없지만 청국장도 주문했는데, 입짧은 엄마가 깨끗하게 다 드셨답니다.",2024-09-30,"점심에 방문, 예약 없이 이용, 대기 시간 바로 입장, 일상, 가족모임, 부모님",음식이 맛있어요,646,1
20854264,열화,굿,2024-09-21,저녁에 방문,재료가 신선해요,1107,1
20854264,ssh****,맛있네요,2024-09-21,저녁에 방문,음식이 맛있어요,2387,1
20854264,심보람60,두부가 너무 앗있고 사장님도 친절하세요산타고 내려와 자주 들리는 집인데 음식이 신선하고 두부가 너무 고소해요!고기도 바로바로 해주시는거 같아요넘 맛있어요!,2024-08-11,"점심에 방문, 예약 없이 이용, 대기 시간 바로 입장, 데이트, 연인・배우자",음식이 맛있어요,65,1
20854264,푸른소금28,맛있었어요,2024-08-08,저녁에 방문,음식이 맛있어요,2213,5
20854264,도리도리53,리뷰에 맛집이라해서 기대하고갔는데요.두부전골  맛없어요.반찬도 짜요.등산후 뒷풀이집으로  많이들 오시는듯요.,2024-08-04,"점심에 방문, 예약 없이 이용, 대기 시간 바로 입장, 가족모임, 연인・배우자",단체모임 하기 좋아요,22,1
20854264,대왕돼지,혼자 왕창 먹고 싶어서 포장해왔습니다.두부가 진짜 너무 맛있어요... 손두부는 확실히 시판 두부랑 비교가 안돼요ㅠㅠ 휴고기는 무난한 보쌈고기! 김치는 달달한 볶음김치라 청양고추 같이해서 먹으면 넘 맛있어요☺️만두전골이 너무 그리워서 조만간 친구들과 방문해서 종류별로 다 먹어야겠어요ㅋㅋㅋㅋ,2024-07-21,"점심에 방문, 포장·배달 이용, 대기 시간 바로 입장, 일상, 가족모임",음식이 맛있어요,101,2
20854264,대왕돼지,사장님 사랑합니다🫡집들이에 올리려고 포장해왔어요! 예전에 등산 하산 후 만두전골 먹고 뒤집어졌던 집인데 친구가 여기는 두부보쌈이 찐이라 하여 샀습니다.맛있어요ㅠㅠ 담백한 고기맛에 볶음김치?도 적당히 새콤하고 두부가 그냥 미쳤어요. 시판 두부랑은 비교가 안되는 풍미와 질감이에요.ㅠㅠ 아실분들은 아실 푸스스 부스러지면서 두부향이 팍 풍기는...🥹 집들이온 친구들 다 하나같이 두부가 진짜 맛있다고... 여러 음식 중 하나였는데 한입먹었는데 다른 사람들이 다 먹어서 다음에 소수로 가게가서 먹게요 ㅠ사진에 없지만 만두전골도 개미친맛입니다.  늦은 시간에 가면 품절이라 일찍 가는 게 좋고 제가 포장 전화한 12시~2시는 피크타임이라 포장 안된다고 하셨습니다! 3시부터 가능하니  참고하세요!,2024-07-06,"점심에 방문, 포장·배달 이용, 대기 시간 바로 입장, 일상, 혼자",음식이 맛있어요,101,1
20854264,불량아줌마,둘레길 걷고 서방과 식사하였네요.맛나요.~~,2024-06-30,"점심에 방문, 예약 없이 이용, 대기 시간 바로 입장, 일상, 연인・배우자",음식이 맛있어요,1033,2
20854264,불량아줌마,와우~~맛집 발견했어요.두부요리좋아하는데 딱이네요.~~맛있게 먹고 비지찌개하려고 한덩어리 서비스로 받아왔네요.~~두부요리생각나면 고고입니다.,2024-06-23,"점심에 방문, 예약 없이 이용, 대기 시간 바로 입장, 데이트, 연인・배우자",음식이 맛있어요,1033,1
20854264,푸른소금28,좋아요,2024-06-20,저녁에 방문,음식이 맛있어요,2213,4
20854264,써니매직,음식이 맛있어요,2024-06-11,"점심에 방문, 예약 없이 이용, 대기 시간 바로 입장, 일상, 지인・동료",음식이 맛있어요,759,1
20854264,강동녹두장군천호대첩,용문산 등산 느낌만 내고 땀이 식기도 전에 내려와서 바로 튀어갔습니다.두부보쌈 너무 맛있네요. 동동주도 쌀이 동동 떠있는게 달쌈콤하니 잘넘어가고 맛조합이 기똥차버렸어요.나중에 추가한 순두부도 역시 맛있어요.가는 길에 비지도 가져가라고 해주셔서 잘챙겨왔어요! 얼렸다가 비지찌개 해먹어야지 야무쥐게 먹어야G?,2024-06-09,"점심에 방문, 예약 없이 이용, 대기 시간 바로 입장, 데이트, 친구",음식이 맛있어요,446,1
20854264,레이나94,손으로 직접 만든 두부라 그런지 맛있어요,2024-06-04,"저녁에 방문, 예약 없이 이용, 대기 시간 바로 입장, 일상, 연인・배우자",음식이 맛있어요,544,1
20854264,새우는고양이,"오늘도 좋은 두부전골이었다. 두부부침도 호롤호롤하니 맛있음. 사장님도 친절. 사장님 부부 두분이 하시는 거라 음식은 늦게 나오는 편. 오늘은 주문 후 30분 정도 후에 첫번째 음식 나옴. 그래서 더 맛있는가 보다. 그리고 등산객 아줌마, 아저씨들아. 입구 옆에서 담배 좀 작작 피워라. 아무리 재떨이가 거기 있어도 창문으로 연기 다 들어오는데 그러고 싶냐. 배려심이 없어.",2024-04-27,"점심에 방문, 예약 없이 이용, 대기 시간 바로 입장, 일상, 연인・배우자",친절해요,1266,3
20854264,kis****,좋아요,2024-04-25,"점심에 방문, 예약 없이 이용",음식이 맛있어요,1266,4
20854264,ki****,좋아요,2024-04-25,"점심에 방문, 예약 없이 이용, 대기 시간 바로 입장, 친목, 친구",음식이 맛있어요,2071,6
20854264,노원나들이,두부전골에서 매운탕 맛이 나서 맛있었어요밥 한공기 뚝딱 하는 맛!!!,2024-04-23,"저녁에 방문, 예약 없이 이용, 대기 시간 바로 입장, 일상, 연인・배우자, 아이",음식이 맛있어요,197,1
20854264,자봉봉45,"두부가 너무 맛있어요 두부부침, 두부전골, 두부보쌈 즐겨먹어요 사장님도 친절하십니다",2024-04-19,"저녁에 방문, 예약 없이 이용, 대기 시간 바로 입장, 일상, 연인・배우자",음식이 맛있어요,576,1
20854264,ㅎㅅㅎ2378,"얼큰순두부, 도토리묵 좋아요~ 반찬은 좀 짠데 재활용 않고 반찬 버리시는 거 보고 신뢰감 상승",2024-04-18,저녁에 방문,음식이 맛있어요,382,1
20854264,미래소녀 포비,믿을 수 있는 가게예요.,2024-04-14,저녁에 방문,재료가 신선해요,1674,1
20854264,초이수비아,점심시간과 겹쳐 40분 정도 기다렸어요 손두부라 두부만 먹어도 너무 맛있구요자극적이지 않은 슴슴한 맛이라 더 좋았어요다음엔 전골 먹어보려구요 !!,2024-04-14,"점심에 방문, 예약 없이 이용, 대기 시간 30분 이내",음식이 맛있어요,115,1
20854264,새우는고양이,"사장님 친절하시고, 공깃밥 한 개 주문했는데 두 명 왔다고 반 공기씩 두 개로 나눠주시는 서윗함. 사소한 건데 감동했다. 추가 인심도 좋으심. 벽에 와이파이 암호 적혀있는 거 틀림. 바쁘셔서 물어보진 않음. 두부김치. 볶은 김치 넉넉히 주심. 나중에 남아서 밥반찬으로 먹음. 대낮부터 막걸리 땡기는 맛이다. 콩국수는 6월 말 경 부터 한다고 하심. 사장님 부부 두 분이서 하시기 때문에 웬만한 건 내가 움직여서 가져오는 게 좋음 (물, 반찬 추가 등). 허름한(?) 실내 창가에 앉아 시장골목 바라보며 먹으면 어디 시골 식당에 있는 기분.",2024-04-14,"점심에 방문, 예약 없이 이용, 대기 시간 바로 입장, 일상, 연인・배우자",친절해요,1266,2
20854264,새우는고양이,"두부전골엔 느타리/팽이버섯, 호박, 쑥갓 등 있고 민물새우 들어 있어 얼큰, 시원하고 알탕 비슷한 맛이 남. 맑은 두부전골은 없음. 공깃밥(흑미밥)은 따로 주문해야 함. 두부부침도 그렇고 두부가 부드럽고 고소함. 직접 만드시니 두부맛이 없을 수가 없다. 밑반찬 4종 다 맛있고 특히 김치가 묵은지 같은데 두부에 올려 먹으면 맛있음. 김치가 맛있어 두부김치도 당연히 맛있을 듯. 순두부도 기가막히다고 함. 사장님 친절하시고 추가 인심 좋으심. 계산대 앞에 콩비지가 일렬로 있으니 집에서 먹을 사람 가져가면 됨. 난 다른 곳에 들러야 해서 중간에 상할까봐 못 가져옴. 테이블은 4인 8개, 안쪽에 별실로 6인 테이블 하나.",2024-03-31,"점심에 방문, 예약 없이 이용, 대기 시간 바로 입장, 일상, 연인・배우자",친절해요,1266,1
20854264,HHhhHH,도토리묵은 첨 시켜봤는데 부드러워서 맛있어요!같이 간 친구들도 만족해 했어요.,2024-03-28,"저녁에 방문, 예약 없이 이용, 대기 시간 바로 입장",음식이 맛있어요,387,2
20854264,at****,굿,2024-03-26,"점심에 방문, 예약 없이 이용, 대기 시간 바로 입장",음식이 맛있어요,2133,1
20854264,푸른소금28,좋아요,2024-02-17,저녁에 방문,음식이 맛있어요,2213,3
20854264,EthanKang,두부보쌈 두부전골 청국장 종종 먹어요.가격 저렴하고 양도 많고 맛도 좋아요.,2024-02-02,저녁에 방문,음식이 맛있어요,493,2
20854264,셋뚱,모 두부 완전 고소고소~~모 두부 다 먹고서 한참을  멀둥멀둥 있었네요 ㅜㅜ전골이 30여분 만에 나왔네요 ㅜㅜ그래도 맛나게 먹고왔어요~,2024-01-27,점심에 방문,음식이 맛있어요,720,1
20854264,서울 삼촌,맛나게 잘 먹었네요 ^^,2024-01-18,"점심에 방문, 예약 없이 이용, 대기 시간 바로 입장, 회식, 지인・동료",음식이 맛있어요,235,1
20854264,jun****,좋아요,2023-12-21,"점심에 방문, 포장·배달 이용, 대기 시간 바로 입장, 일상",음식이 맛있어요,1326,2
20854264,jho****,두부가 맛있어요,2023-12-14,"점심에 방문, 예약 없이 이용, 대기 시간 바로 입장, 일상, 친구",,1477,1
20854264,jun****,좋아요,2023-12-09,"점심에 방문, 포장·배달 이용, 대기 시간 바로 입장, 일상, 혼자",음식이 맛있어요,1326,1
20854264,인간승리2,맛있어요,2023-11-10,저녁에 방문,음식이 맛있어요,607,1
20854264,갱팔,굿,2023-11-06,저녁에 방문,음식이 맛있어요,486,1
20854264,mj1****,가게는 그다지크지 않지만 맛은 좋아요,2023-10-22,저녁에 방문,음식이 맛있어요,2167,1
20854264,에뚜왈99,두부가 맛있어요. 식사로도 가성비 좋네요,2023-10-17,저녁에 방문,음식이 맛있어요,739,1
20854264,아멜리에뿔랑,ㆍ,2023-10-15,저녁에 방문,,1233,1
20854264,캡스20,보쌈 맛있게 먹고 갑니다,2023-10-15,점심에 방문,음식이 맛있어요,439,1
20854264,petty petty,모두부 찐입니다요,2023-09-16,저녁에 방문,음식이 맛있어요,759,1
20854264,우리는좋아해,"두부보쌈이라고 해서 두부랑 김치볶음만나오는 줄 알았지?!! 놉! 여긴 수육도 함께 🥹두부가 직접 만든 두부라 그런지너무 부드러워서 간장만 찍어도 최고 👍🏻세상 이런 두부를 이제야 먹어보다니,내가 여태 먹은 건 두부가 아니야..두부 하나, 김치과 수육, 청양고추 하나올려서 같이 한입에 먹길 대추천 !!",2023-09-12,저녁에 방문,친절해요,1750,1
20854264,qndldla,굿,2023-09-04,점심에 방문,음식이 맛있어요,1287,3
20854264,푸른소금28,좋아요,2023-08-28,저녁에 방문,음식이 맛있어요,2213,2
20854264,qndldla,굿,2023-08-24,점심에 방문,음식이 맛있어요,1287,2
20854264,중랑구로드뷰,,2023-08-18,저녁에 방문,음식이 맛있어요,383,1
20854264,늑골척추각,ㅁ구수함,2023-08-15,점심에 방문,재료가 신선해요,1278,1
20854264,쿠카이든,두부찌게가 매우 맛있습니다. 두부를 직접갈아주시는지 맛이 특별합니다,2023-07-31,점심에 방문,음식이 맛있어요,75,1
20854264,한선복,하얀수두부가 많이고소해요맛있어요,2023-07-31,점심에 방문,음식이 맛있어요,946,1
20854264,옹이5598,와진짜....너무맛있고 사장님들도 너무 친절하시고...ㅜㅠㅠㅠㅠㅠ지금도 인기많지만 더더 인기많아지세요!!!너무맛잇음 ㅠㅠ,2023-07-09,점심에 방문,친절해요,77,1
20854264,beloved9712,좋어요,2023-06-08,저녁에 방문,재료가 신선해요,969,1
20854264,holic5979,굿,2023-06-03,점심에 방문,재료가 신선해요,862,1
20854264,joo****,굿,2023-06-03,점심에 방문,재료가 신선해요,1322,1
20854264,HHhhHH,청국장 생각나면 가는집이예요.보쌈도 맛있지만 두부랑 김치가 짱짱!!,2023-05-27,점심에 방문,재료가 신선해요,387,1
20854264,arihori,굿굿,2023-05-21,점심에 방문,양이 많아요,1118,2
20854264,hyou650922,맛있어요,2023-05-11,아침에 방문,음식이 맛있어요,953,1
20854264,딩코사랑,좋아요,2023-05-06,점심에 방문,음식이 맛있어요,1069,1
20854264,푸른소금28,맛있게 먹었습니다,2023-05-05,점심에 방문,음식이 맛있어요,2213,1
20854264,느리게 걷기0,건강한 집밥 스타일 식당.두부요리 좋아좋아~서비스로 주신 비지도 넘 맛나요~감사합니다~^^*,2023-04-28,저녁에 방문,재료가 신선해요,2804,1
20854264,qndldla,굿,2023-04-10,점심에 방문,음식이 맛있어요,1287,1
20854264,poliwrath,,2023-04-02,저녁에 방문,가성비가 좋아요,521,1
20854264,pit****,"순두부와 두부김치 먹었습니다. 조금 시간이 걸리는 점 감안하셔야 하고 나쁘진 않았습니다. 다만, 거의 다 먹었는데 두부에서 철수세미가 나왔습니다. 죄송하다며 1,000원 깎아주셨네요..",2023-04-01,점심에 방문,,9,1
20854264,rhrpQkd,두부짱맛있어요,2023-03-19,저녁에 방문,음식이 맛있어요,1982,1
20854264,as2****,굿,2023-02-27,저녁에 방문,친절해요,1163,1
20854264,thesubi,맨날 먹고싶다!!,2023-02-19,저녁에 방문,친절해요,730,1
20854264,ra****,직접 만드신 두부 너무 고소해요^^ 비지찌게도 맛나구요,2023-02-12,점심에 방문,음식이 맛있어요,206,1
20854264,별하아아아,갈때마다 갬동이예요👏👏저만알고싶은 맛집ㅋㅋㅋㅋ짱맛잇어요,2023-02-04,점심에 방문,매장이 청결해요,1860,3
20854264,윤태맘62,음식은 평범해요.두부가 너무 얇아서 씹는맛을 모르겠어요.,2023-02-03,저녁에 방문,친절해요,2193,1
20854264,꽁꽁5929,두부가 엄청 부드럽고 맛있네요 청국장도 간간하지만 맛있게 먹었어요 다만 밑반찬은 좀 부실해요 약간 노포 느낌이라 반주하시는 어르신들이 많아 좀 시끄러웠어요,2023-01-28,점심에 방문,,726,1
20854264,빈96,굿,2023-01-19,저녁에 방문,친절해요,1019,5
20854264,83펭펭,겨울이라 뜨끈한게 먹고싶어서 찾아간 사가정 손두부 매장안에 자리가 너무 좁아요 4명이서 안내해주신 자리에 앉아서 두부만두전골 중 사이즈랑 두부조림 시켰는데 양도 진짜 많고 전골은 새우가 듬뿍 들어간 시원한 매운탕 같은 느낌의 전골이었고 부들부들한 두부가 맛있어요! 특히 두부조림이 자극적이지도 않고 너무 맛있었어요~ 나오는길에 사장님께서 비지도 챙겨주셨어요! 담에 두부 먹으러 또 올께요,2022-12-17,점심에 방문,양이 많아요,1206,1
20854264,오늘의나,노포 두부집 맛있어요 옛날느낌 가득해서 더 좋구요,2022-12-16,저녁에 방문,재료가 신선해요,162,1
20854264,20250918,굿,2022-12-12,점심에 방문,음식이 맛있어요,827,21
20854264,qwa****,두부전골 맛있구만,2022-12-11,저녁에 방문,음식이 맛있어요,418,1
20854264,20250918,굿,2022-11-29,점심에 방문,음식이 맛있어요,827,20
20854264,eb****,두부 연하고 진짜 맛있어요 또 가고 싶은 곳입니다,2022-11-27,저녁에 방문,음식이 맛있어요,128,1
20854264,kis****,좋아요~,2022-11-21,저녁에 방문,혼밥하기 좋아요,1266,3
20854264,ki****,좋아요,2022-11-21,저녁에 방문,양이 많아요,2071,5
20854264,20250918,굿,2022-11-10,점심에 방문,매장이 청결해요,827,19
20854264,인미현,진짜 찐 순두부..직접 만든거 맛있어요,2022-11-01,저녁에 방문,친절해요,1368,1
20854264,xxSSgg,금방 끓인 비지찌개 먹을만 했습니다. 밥이랑 반찬은 양이 아쉬워요.,2022-10-29,저녁에 방문,,1231,1
20854264,hye****,두부김치 맛있습니다두부가 고소하고 너무 맛있어요,2022-10-24,저녁에 방문,음식이 맛있어요,57,4
20854264,20250918,굿,2022-10-18,점심에 방문,가성비가 좋아요,827,18
20854264,자이언트곰,"두부전골 (중), 청국장2명이서 방문두부전골 국물이 아주시원하고 청국장도 구수한게 아주 맛있습니다맵찔이한테는 생각보다 매웠지만맛있어서 땀흘리면서 먹었네요같이간 지인이 두부 얼큰 고추장전골에는 고기가 들어가서 국물이 더 맛있다고 하던데다음에 방문시에 먹어봐야겠습니다",2022-10-16,저녁에 방문,친절해요,602,2
20854264,nuela,굿굿,2022-10-16,점심에 방문,친절해요,1130,1
1081594514,Omgha,너무 맛있아요 ㅠㅠㅠ,2025-04-09,"밤에 방문, 예약 없이 이용, 대기 시간 바로 입장, 데이트, 연인・배우자",음식이 맛있어요,23,1
1081594514,jjuuuu2,직원분이 친절하시고 음식도 맛있네요!재방문할겁니다 ㅎㅎ,2025-04-08,"저녁에 방문, 예약 없이 이용, 대기 시간 바로 입장, 친목, 친구",대화하기 좋아요,6,1
1081594514,달콤4122,세트구성 알차고 술종류도 다양해서 취향껏 ^^,2025-04-07,저녁에 방문,음식이 맛있어요,745,1
1081594514,iig****,데이트하러 사가정 왔는데 음식도 너무 맛있습니다!,2025-04-05,"저녁에 방문, 예약 없이 이용, 대기 시간 바로 입장, 데이트, 연인・배우자",단체모임 하기 좋아요,5,1
1081594514,축준위플몹,여기 되게 정갈하네요! 직원들이 친절하고 모임하기 좋아요!!!!!!!!!!!!!,2025-04-03,"저녁에 방문, 예약 없이 이용, 대기 시간 바로 입장, 데이트, 친목, 지인・동료",단체모임 하기 좋아요,17,1
1081594514,Tastikat,꼬치오뎅탕에 꽃게가 들어가있어서 더 맛있었던것 같아요. 국물이 시원해서 소주와 잘어울려요. 부추전은  얇으면서 바삭해서 막걸리와 잘 어울렸습니다. 하우스 막걸리는 탄산이 없는 맛이었습니다.,2025-04-03,"저녁에 방문, 예약 없이 이용, 대기 시간 바로 입장, 일상, 연인・배우자",음식이 맛있어요,16,1
1081594514,zxc****,항상 맛있게 먹고오는 곳입니다야외자리는 반려동물 동반 할 수 있어서 더 좋아요🫶🏽,2025-04-01,"저녁에 방문, 예약 없이 이용, 대기 시간 바로 입장, 일상, 연인・배우자, 반려동물",음식이 맛있어요,66,1
1081594514,윤떠닝,맛있어용,2025-03-31,"저녁에 방문, 예약 없이 이용, 대기 시간 바로 입장, 친목, 친구",음식이 맛있어요,24,1
1081594514,d06****,노래 선곡이 좋고 떠들때 시끄러움이 전혀 없었습니다. 직원 분들이 친절하고 안주도 맛있어서 다음에도 또 올거같습니다!,2025-03-29,"밤에 방문, 예약 없이 이용, 대기 시간 바로 입장, 친목, 친구",음식이 맛있어요,4,1
1081594514,회원,음식도 너무 맛있고 야구도 틀어주셔서 다같이 즐겁게 대화하면서 술마셨어요! 단체석도 있어서 모임하기 좋고 음악이 너무 시끄럽지 않고 적당해서 좋았습니다💕,2025-03-28,"밤에 방문, 예약 없이 이용, 대기 시간 바로 입장, 친목, 친구",음식이 맛있어요,1,1
1081594514,김현태1594,"야상 테이블 있어요 날씨 좋을때 정말 기분 좋게 먹었습니다 막걸리 600ml 둘이서 먹기 딱 좋았습니다고추튀김, 고기육수 둘다 맛있고 애플 하이볼도 최고에요데이트하기 좋고 아내랑 같이 왔습니다노래 분위기 좋고 친절하셔서 잘 먹고 갑니다 또올게요^-^",2025-03-26,"저녁에 방문, 예약 없이 이용, 대기 시간 바로 입장, 데이트, 연인・배우자",가성비가 좋아요,62,1
