place_id,nickname,content,date,situations,keywords,review_count,visit_count
1513470334,헬스정자,유명해서 처음 와봤는데 둘이 음식만 15만원어치 먹고 갑니다굴 맛있어요~!,2025-02-20,"저녁에 방문, 예약 없이 이용, 대기 시간 바로 입장, 친목, 친구",음식이 맛있어요,15,1
1513470334,dynamic180,ㄹㅇ 존맛 보스,2025-02-20,"저녁에 방문, 예약 없이 이용, 대기 시간 바로 입장, 데이트, 친구",음식이 맛있어요,3,1
1513470334,임효진46,인생 간장게장이고 모든 밑반찬이 맛있어서 싹싹 긁어먹고 왔어요 😆😁😄😄😀,2025-02-20,"저녁에 방문, 예약 없이 이용, 대기 시간 바로 입장, 친목, 친구",음식이 맛있어요,376,1
1513470334,모닝듀42,매번 맛있게 먹고 갑니다 ㅎㅎ,2025-02-19,"저녁에 방문, 예약 없이 이용, 대기 시간 바로 입장, 친목, 부모님",음식이 맛있어요,7,1
1513470334,ssagazy10,진짜 맛있어용!! 매번 올때마다 배터져서 가요!,2025-02-19,"저녁에 방문, 예약 없이 이용, 대기 시간 바로 입장, 친목, 친구",음식이 맛있어요,21,1
1513470334,won****,너무맛있어요~!,2025-02-19,"저녁에 방문, 예약 없이 이용, 대기 시간 바로 입장, 친목, 친구",음식이 맛있어요,18,1
1513470334,사잇소리,간장게장은 밥이 생명인데 밥이 안익어서 딱딱했고 미역국도 식어있었어요ㅠ 좌석도 불편하고 테이블도 불편하고..유명해서 엄청 기대하고 갔는데 실망이 너무 컸습니다ㅠ,2025-02-19,"저녁에 방문, 예약 없이 이용, 대기 시간 바로 입장, 데이트, 연인・배우자",음식이 빨리 나와요,24,1
1513470334,chs****,장지녕 간장게장 ... 여기가 제일 맛있어요 ㅠㅠ 다음에 또올게용 ^^근데 진짜 여기 게장이 짜지도 않고 간도 적당히 젤 맛있아요,2025-02-19,"저녁에 방문, 예약 없이 이용, 대기 시간 바로 입장, 친목, 친구",음식이 맛있어요,30,1
1513470334,achi0,간장게장 명품게장 섞어서 주문했어요짜지 않고 맛있어요양념게장도 매콤하니 맛있네요,2025-02-19,"점심에 방문, 예약 없이 이용, 대기 시간 바로 입장, 친목, 일상, 친구",음식이 맛있어요,59,1
1513470334,닉네임6595,아주맛나게잘먹었어요 게도싱싱하고 맛도있고김치도완전짱맛bbb,2025-02-19,"점심에 방문, 예약 없이 이용, 대기 시간 바로 입장, 나들이, 친구",음식이 맛있어요,26,1
1513470334,Yayyyyy,간장게장 먹고 싶을때마다 오는 곳ㅎㅎ 믿고 먹어요,2025-02-19,"점심에 방문, 예약 없이 이용, 대기 시간 10분 이내, 친목, 지인・동료",음식이 맛있어요,12,1
1513470334,yui****,맛있어용 또 올게용ㅇ 구성이 알차고간이 쎄지않라서 조아써요,2025-02-18,"점심에 방문, 예약 없이 이용, 대기 시간 바로 입장, 친목, 친구, 지인・동료",매장이 넓어요,14,1
1513470334,moo****,간장게장이 알이 꽈 차있고 맛나요그리고 밑반찬으로 나오는 굴누침신선하고 맛깔스럽고생선전과 미역국 숭늉 식혜 모두 맛나고 건강한 맛이에요다시 오고 싶은곳,2025-02-18,점심에 방문,음식이 맛있어요,2,1
1513470334,jiy****,너무 맛있어요 ! 게장 맛집 인정 !! 추천함니당,2025-02-17,"저녁에 방문, 예약 없이 이용, 대기 시간 바로 입장, 데이트, 친척・형제",음식이 맛있어요,13,1
1513470334,s4nha,맛있고 깨끗해용,2025-02-17,저녁에 방문,음식이 맛있어요,157,1
1513470334,유한솔39,맛있어요,2025-02-17,"점심에 방문, 예약 없이 이용, 대기 시간 바로 입장, 친목, 지인・동료",음식이 맛있어요,157,1
1513470334,데이지8177,간장게장 명품 2인 먹었는데 맛은 있지만... 게딱지가 너무 비렸어요 비리다기보다 이상한 맛이 나서 못 먹었어요 내장이 저렇게나 많은데 ㅠ 나오는 양념게장도 맛있고 굴김치도 맛있어요,2025-02-15,"점심에 방문, 예약 없이 이용, 대기 시간 바로 입장, 일상, 연인・배우자",음식이 맛있어요,22,1
1513470334,ykszzkk,일단 밑반찬들이 다 맛있었어요!! 숭늉이랑 미역국도 떠다 먹을수도있고 마지막에 후식으로 식혜까지 떠다먹으면 완벽합니다!!,2025-02-15,"점심에 방문, 예약 없이 이용, 대기 시간 바로 입장, 친목, 친구",음식이 맛있어요,14,1
1513470334,luc****,굴무침 먹고싶어서 왔는데 맛있었어요! 같이 방문한 친구가 게장을 못먹어서 게장은 포장하고 있는데 너무 기대됩니다!,2025-02-15,"점심에 방문, 예약 없이 이용, 대기 시간 바로 입장, 친목, 친구",음식이 맛있어요,44,1
1513470334,wlg****,쭈꾸미 시켰는데 맛있어요. 메인으로도 손색이 없습니다. 굴무침도 추가 했는데 굴이 좀 적었지만 양념이 너무 맛있네여.,2025-02-15,"점심에 방문, 예약 없이 이용, 대기 시간 바로 입장, 친목, 친구",재료가 신선해요,468,1
1513470334,가람별,"암꽃게, 숯게 각 한 마리씩 섞어 2인분 가능해서 주문했는데 넘 맛나다. 굴 들어간 겉절이가 맛나서 같이 나온 수육전하고 먹으면 맛 좋다. 게가 싱싱하고 참 맛났다.",2025-02-14,"점심에 방문, 예약 없이 이용, 대기 시간 바로 입장, 일상, 부모님",음식이 맛있어요,652,1
1513470334,yun****,암케랑 숫케 먹었는데 알도 많고 신선해요! 맛있게 잘먹고갑니다~ 밑반찬으로 나온 김치도 너무맛있어요,2025-02-14,"점심에 방문, 예약 없이 이용, 대기 시간 바로 입장, 데이트, 연인・배우자",음식이 맛있어요,34,1
1513470334,eun****,너무 맛있게 잘 먹었습니다!,2025-02-12,"저녁에 방문, 예약 없이 이용, 대기 시간 바로 입장, 데이트, 연인・배우자",음식이 맛있어요,42,1
1513470334,하트화분,순천향대학병원 갔다가 장지녕 간장게장 유명해서 가봤습니다 명품간장게장 짜지도 않고 맛있어요 알도 싱싱하구요 반찬도 하나하나 다 맛있었습니다병원갈때마다 가끔 방문해서 먹어야겠어요 ㅎ맛있는 한끼였습니다~,2025-02-11,"점심에 방문, 예약 없이 이용, 대기 시간 바로 입장, 혼자",음식이 맛있어요,109,1
1513470334,김형기6283,맛읺어요,2025-02-11,"점심에 방문, 예약 없이 이용, 대기 시간 바로 입장, 데이트, 연인・배우자",음식이 맛있어요,1261,1
1513470334,adk****,가족과 맛있는 게장 잘 먹었습니다 단골이예요 감사합니다,2025-02-08,"저녁에 방문, 예약 없이 이용, 대기 시간 10분 이내, 나들이, 연인・배우자",매장이 넓어요,30,1
1513470334,뽕찡찡,맛있어요!!!!!!!,2025-02-08,"저녁에 방문, 예약 없이 이용, 대기 시간 10분 이내, 친목, 친구",특별한 메뉴가 있어요,121,1
1513470334,마리오936,너무 맛있습니다. 그리고 주차장과 바로 이어져서 편해요.,2025-02-08,"저녁에 방문, 예약 없이 이용, 대기 시간 30분 이내, 데이트, 연인・배우자",음식이 맛있어요,1066,1
1513470334,qkrxoghks,너무너무 맛있고 깨끗해요!!비린맛이 전혀 없고 냉수육도 쫀득해요 ㅎㅎㅎ한남동 오시면 방문해보세요~~😊,2025-02-08,"저녁에 방문, 예약 후 이용, 대기 시간 10분 이내, 데이트, 친구",재료가 신선해요,15,1
1513470334,true0606,친구가 사줘서 점심 먹었는데 너무 맛있게 먹었어요,2025-02-08,"점심에 방문, 예약 없이 이용, 대기 시간 바로 입장, 데이트",음식이 맛있어요,859,1
1115969228,오 선물,.,2025-04-07,"점심에 방문, 예약 없이 이용",,891,1
1115969228,ysp****,오랜만에 방문했는데 너무 맛있게 먹었고 직원분들도 친절하세요~,2025-03-30,"저녁에 방문, 예약 없이 이용, 대기 시간 10분 이내, 데이트",음식이 맛있어요,6,4
1115969228,1mi****,웨이팅이 있었는데도 불구하고안내도 빠르고 음식도 맛있었습니다 !,2025-03-30,"저녁에 방문, 예약 없이 이용",음식이 맛있어요,4,1
1115969228,포카칩74,음식이 넘 맛있고 사장님이 친절해요 😊😊,2025-03-30,"점심에 방문, 예약 없이 이용, 대기 시간 30분 이내, 데이트, 연인・배우자",음식이 맛있어요,11,1
1115969228,yes****,5분정도? 웨이팅 하다가 들어갔어요면이랑 육수는 먹다가 추가해도 되어서 편했어요다만 응대가 너무 느려요 ㅠ.ㅠ,2025-03-26,"점심에 방문, 예약 없이 이용, 대기 시간 10분 이내, 친목, 친구",대화하기 좋아요,17,1
1115969228,키티야S2,엄청 가게가 작아요근데 위생 좀 제발 신경써주세요바쁜거 알아요 그렇지만 단가도 높아요그런만큼 위생에 쫌 신경써주세요그릇도 먼지 있는 그릇들이지만무엇보다 가위받았는데 엄청 덕지덕지 뭐가 붙어있는대로 나와서 말씀드리니 물로도 안 헹구고 행주같은거로 쓱싹닦아주시더라구여. 에휴 제가 그 가위를 사용안했어야했는데 그 가위 사용하고 지금 몸이 말이 아닙니다. 같이 온 지인분도 덕지덕지 붙은 가위보고 놀랫는데 그래도 잘 닦았겠지 했는데.. 아닌가 보네요. 그날 오후부터 일주일내내 약 먹고 수액맞고 영양제맞고 신경주사맞습니다.. 위생 좀 신경쓰세요… 정말 화납니다,2025-03-15,"점심에 방문, 예약 없이 이용, 대기 시간 30분 이상",,663,1
1115969228,지 그미,기본 제이타쿠동에 연어알+생연어+참치도로 추가한거(추가까지 4.1만원)와 토마토 연어국수(2만원)시켰습니다. 회두께도 굵었고 신선한 맛에 좋았습니다👍🏻아쉬운게 있다면 처음 시킬때 메뉴랑 사진이랑 매치가 되지않아 친구랑 토론하면서 네이버 메뉴랑 리뷰사진들 찾아보다가 여자직원분에게 인스타 사진 보여드리니 연어알연어동으로 안내해주셨어요. 아무리 생각해도 이상해서 다른 직원분에게 물어보니 제이타쿠동에 추가를 여러개 한거라고 하시더라구요.처음에 엄청 많이 우왕좌왕이였지만ㅜㅜ 덕분에 인스타에서 본거처럼 두툼한 연어살에 참치까지 먹었습니다. 바쁘신데도 친절히 대해주셔서 너무 감사해요!!!,2025-03-03,"저녁에 방문, 예약 없이 이용, 대기 시간 바로 입장, 일상, 친구",인테리어가 멋져요,38,1
1115969228,반잎풀,맛있게 잘 먹고 감미다 ♥,2025-03-02,"점심에 방문, 예약 없이 이용, 대기 시간 10분 이내, 데이트, 연인・배우자",친절해요,42,1
1115969228,hap****,메뉴 독특하고 맛있는데 카이센동 회가 너무 잘게 나와서 식감이 아쉬워요,2025-03-01,"점심에 방문, 예약 없이 이용, 대기 시간 바로 입장, 여행, 일상, 연인・배우자",특별한 메뉴가 있어요,858,1
1115969228,다크팽,연어토마토국수라는게 신기해서 좋았어요.은근 맛나요근데 다먹고 나니 느끼하네요ㅠㅠ게딱지는 밥하고 같이먹는게 맛날거같아요,2025-02-27,"점심에 방문, 예약 없이 이용, 대기 시간 바로 입장",친절해요,761,1
1115969228,112344,너무 맛있어요~!,2025-02-26,"점심에 방문, 예약 없이 이용, 대기 시간 바로 입장",친절해요,13,1
1115969228,Pplz,"공간이 협소했고, 양은 가격에 비해 적어요.맛이 있었지만 개인적으로 1/3 남은 시점에 육수 부어서 먹는 건 제 입에 맞지 않았어요!서빙해주시는 분이 친절해요",2025-02-24,"점심에 방문, 예약 없이 이용, 대기 시간 바로 입장, 일상, 지인・동료",음식이 맛있어요,843,1
1115969228,다이닝15,자리 예약 가능하지만 매직패스 개념이에요!예약하면 바로 들어가는 줄 았는데 도착 기준 1순위로 옮겨주시는거고 예약 시간보다 일찍 방문 했을 시 똑같이 대기! 예약시간에서 10분 늦으면 자동 취소예약 하실 분들 참고하세요!내부 작고 마주보는 테이블 아니라 3인 방문 시 조금 불편해요ㅋㅋ 대화 하기 불편한 구조!그치만 음식은 맛있습니다~,2025-02-23,"점심에 방문, 예약 후 이용, 대기 시간 30분 이내, 데이트, 연인・배우자",음식이 맛있어요,598,1
1115969228,1프렐류드,음식이 정갈해서 좋았습니다 직원분들도 아주아주 찬절허시더라구요. 자리가 너무너무 협소한게 아쉬웠습니다.   가격대비 양은 좀 적은 것 같아요.  소식좌들이 먹기에 좋을 것같아요.,2025-02-22,"점심에 방문, 예약 없이 이용, 대기 시간 바로 입장, 데이트, 연인・배우자",친절해요,25,1
1115969228,bgi****,인스타 핫플이라고 해서 왔는데 음식 너무 맛있었어용!! 연어국수 특이하고 좋았습니당,2025-02-19,"점심에 방문, 예약 없이 이용, 대기 시간 바로 입장, 데이트, 친구",인테리어가 멋져요,6,1
1115969228,doe****,가족끼리 방문했는데 너무 맛있게 먹었습니다!특히 토마토연어국수가 정말 맛있네요직원분들도 친절하서서 다음에 또 방문할게요:),2025-02-19,"점심에 방문, 예약 없이 이용, 대기 시간 바로 입장, 가족모임, 부모님",음식이 맛있어요,6,1
1115969228,김도연2869,"친구랑 성수 놀러왔다가 방문했습니다! 웨이팅 없이 바로 입장했고, 식사도 빨리 나와서 맛있게 잘 먹고 갔습니다 :)",2025-02-18,"저녁에 방문, 예약 없이 이용, 대기 시간 바로 입장, 친목, 친구",음식이 맛있어요,12,1
1115969228,1234456881,요약 : 매우 불친절하지만 음식이 괜찮다.다만 그것을 감당할만큼 맛있지는 않다.저희는 월요일 7시 30분경에 예약 후 방문했습니다.남자직원 한분 여자직원 한분 계셨습니다.1. 문이 잘 안닫혀서 동생이 문을 닫으려고하자 남자 직원분이 “아 그냥 제가 할게요”라고 말씀하셨습니다.2. 여자직원분은 기본적으로 반찬을 놓을때 굉장히 탕탕 거리면서 서빙하셨고 굉장히 화가 나보이셨습니다.3.내가 예민한가 하던 중에 반찬 코너 쪽에서 집게를 집어던지시는 것을 보고 제가 예민한 것이 아닌것을 깨달았습니다.4. 인스타 해시태그 리뷰에 참여하였지만 적혀있는 혜택은 제공되지 않았습니다 ㅎㅎ저녁식사로 간거였는데 괜히 기분만 안좋아지고왔네요. 외국인 고객이 많아서 그런지는 모르겠지만 굉장히 불편했던 경험이네요 👍,2025-02-17,"저녁에 방문, 예약 후 이용, 대기 시간 바로 입장, 나들이, 친척・형제",사진이 잘 나와요,33,1
1115969228,둠스닥스,신선한 해산물 덮밥으로 시작해서 뜨끈한 국밥으로 끝나는 곳. 넘 맛있고?새우튀김도 미챠씀 존맛탱,2025-02-06,"저녁에 방문, 예약 없이 이용, 대기 시간 10분 이내",음식이 맛있어요,607,2
1115969228,이맛이쥐,"🐭미쁘동 16,000 // 연어솝 16,000원🐁분위기도 좋고 매장도 깔끔해요🐁주방도 잘 보이고 깨끗한것 같아요🐀가게가 좁아서 다들 붙어서 먹는 느낌...🐀연어소바에 연어 5조각 있어서 좀 실망🐀소바 국물이 다 얼어 있음🐁면추가 2000원은 꼭하세요",2025-02-03,"점심에 방문, 예약 없이 이용, 대기 시간 바로 입장, 데이트, 연인・배우자",인테리어가 멋져요,391,1
1115969228,바닐라라떼덜달게66,우니미쁘동 맛있는데 양이 적어요~!,2025-01-17,"점심에 방문, 예약 없이 이용, 대기 시간 바로 입장, 일상, 지인・동료",특별한 메뉴가 있어요,574,1
1115969228,p_v****,맛있습니다!! 또 가고 싶어요 양이 적다고느낄 정도로 맛있어요,2025-01-03,"저녁에 방문, 예약 없이 이용, 대기 시간 바로 입장, 데이트, 연인・배우자",음식이 맛있어요,286,1
1115969228,DEUCE,여러가지 신선한 회가 얹어진 미쁘동!재료따라 고를 수 있는 것도 좋았고 무엇보다 맛있었어요👍,2024-12-28,"저녁에 방문, 예약 없이 이용, 대기 시간 바로 입장, 데이트, 연인・배우자",음식이 맛있어요,78,1
1115969228,양념S2,토마토연어국수랑 제이타쿠동 맛있어요👍연어국수랑 와사비 청귤소스(?)랑 잘 어울렸구요!제이타쿠동은 나중에 육수 넣어먹으니 또 색다른 느낌이라 맛있었어요~,2024-12-28,"점심에 방문, 예약 후 이용, 대기 시간 바로 입장, 데이트, 연인・배우자",음식이 맛있어요,496,2
1115969228,연우맘2768,"토마토 연어 국수,미쁘동 먹었어요.연어 국수는 메밀국수 추가 가능한데 전 연어만...채소들과 어우러져 비린맛 없이 깔끔한 맛,바삭 튀긴 새우튀김에 쯔유국물 적셔져서 그 또한 매력적인 맛, 미쁘동은 다져진 연어와 단새우 토핑 비펴 먹다가 따뜻한 장국에 말아서 또다른 따뜻함과 살짝 익은 연어의 맛조화가  매력의 맛대기는 루프탑에서 전기장판 깔려 따뜻한 테이블에서 기다림의 배려",2024-11-30,"점심에 방문, 예약 없이 이용, 대기 시간 30분 이내, 나들이, 연인・배우자, 아이",음식이 맛있어요,451,1
1115969228,하자하자4,굿,2024-11-24,"점심에 방문, 대기 시간 바로 입장",음식이 맛있어요,1790,1
1115969228,도나스4,"분위기도 깔끔하면서 세련된 미쁘동 서울숲, 금요일 저녁 사람들이 몰리기 전에 들렸더니 너무 좋았습니다.맛있는 메뉴들이 가득!! 신선하고 퀄리티 좋은 해산물에 감동, 생맥주와 소주, 가쿠빈과 페어링하기도 매력적이었습니다.제이타쿠동에 참치도로 꼭 추가해서 드세요, 입에서 살살 녹습니다!!대게딱지장과 토마토 연어국수는 또 얼마나 맛있는지, 고소한 대게딱지장! 상콤한 샐러드와 소스에 연어라니!! 혼자서도, 함께여도 좋은 맛집입니다. 데이트코스로도 참 좋네요!나올 때 이 감동을 그대로 느끼고 싶어서 밍키트도 포장해왔습니다. 이제 집에서도 한 번 더 먹어볼 수 있으니 추천합니다.^^",2024-11-22,"저녁에 방문, 예약 후 이용, 대기 시간 바로 입장, 데이트, 연인・배우자",음식이 맛있어요,337,1
1115969228,2345H,"주말 13:54 대기 시작 14:41 자리 앉고, 48분에미쁘동, 미쁘소바, 대게딱지장 나왔고 51분에 토마토 연어국수 나왔어요서울숲 간김에 철 지난 연어국수 먹으려고 간거라 생각한 맛이었을텐데도 느끼했어요연어 좋아한다면 환장할듯개인적 원탑은 대게딱지장 내장 최고야 꼬소해 짜릿해 밥추가 있으면 좋겠습니다어느정도 남았을 때 육수 부어먹는게 맛팁이던데 전 안부은게 훨더맛친절하세요",2024-11-22,"저녁에 방문, 예약 없이 이용, 대기 시간 30분 이상, 일상",특별한 메뉴가 있어요,178,1
1115969228,lim****,신선한 연어와 소바가 조화롭게 어우러진 깔끔하고 부담 없는 요리였어요!! 너무 맛있어요🥹,2024-11-22,"점심에 방문, 예약 없이 이용, 대기 시간 10분 이내, 친목, 나들이, 여행, 일상, 친구, 지인・동료, 혼자",음식이 맛있어요,243,1
1115969228,srisven,직원들 친절하구 맛있어요 밥추가무료라 배도 든든해요,2024-11-17,"저녁에 방문, 예약 없이 이용, 대기 시간 바로 입장, 친목, 친구",음식이 맛있어요,1050,1
1115969228,btt,굿굿,2024-10-27,"점심에 방문, 예약 없이 이용, 대기 시간 바로 입장, 데이트, 연인・배우자",음식이 맛있어요,230,1
1115969228,호두륜딘,세 번째 방문인데 여전히 맛있네욤 …. 🥹 화장실의 발전을 기대하며…🩷🩷,2024-10-26,"점심에 방문, 예약 없이 이용, 대기 시간 10분 이내, 데이트, 친구",음식이 맛있어요,409,1
1115969228,하늘바다13,,2024-10-26,"점심에 방문, 예약 후 이용, 대기 시간 바로 입장, 친목, 친구",음식이 맛있어요,220,1
1115969228,금붕어6979,,2024-10-21,"저녁에 방문, 예약 없이 이용, 대기 시간 바로 입장, 친목, 친구",건강한 맛이에요,840,1
1115969228,에쏘의 하루,언제 가도 또 먹고 싶은 미쁘동입니다 ㅎㅎ 날 추워지기전에 후딱 다녀왔어요! 회는 여전히 신선하고 퀄리티가 좋았어요😍 개인적으로 게장 맛있는데 많이들 드셨으면 좋겠습니닷❣️❣️,2024-10-21,"점심에 방문, 예약 후 이용, 대기 시간 바로 입장",음식이 맛있어요,1050,3
1115969228,두부알감자,미쁘동 토마토연어국수 말해뭐해~ 소바는 꼭 추가해서 같이 먹어줘야하는 거 국룰 산토리 가쿠빈 하이볼 달콤하니 호록호록 원샷 때렸다🤩 점심은 아직 날 더워가지고 안에서 먹었는데 담에 올땐 루프탑에서 먹어야지🔥,2024-10-16,"점심에 방문, 친목, 친구",음식이 맛있어요,592,3
1115969228,마으밍,츄천받아 방문한 곳인데 맛있게 잘 먹었어요!,2024-10-15,"저녁에 방문, 예약 없이 이용, 대기 시간 바로 입장, 데이트, 연인・배우자",음식이 맛있어요,468,1
1115969228,한낮의 만월,토마토연어소바 진짜 맛있어요!,2024-10-13,"점심에 방문, 예약 후 이용, 대기 시간 30분 이내, 일상, 아이",음식이 맛있어요,423,1
1115969228,wide86,연남점 가보고 서울숲점도 가봤는데 미쁘동 두그릇은 먹어야 배가 부를듯ㅋㅋㅋㅋㅋ맛은 있음... 2층이 차서 3층 안내 받았는데 쌩 야외라서 놀람....야외라고 안내 못 받음ㅇㅇ,2024-10-12,"점심에 방문, 예약 없이 이용, 대기 시간 30분 이내, 일상, 친구",음식이 맛있어요,695,1
1115969228,아드리비툼,ㅇㅇ,2024-10-05,"저녁에 방문, 예약 없이 이용, 대기 시간 바로 입장, 나들이, 혼자",친절해요,2485,1
1115969228,rkdmf11,ㅇ ㅇ,2024-10-05,"저녁에 방문, 예약 없이 이용, 대기 시간 바로 입장, 나들이, 혼자",친절해요,2280,1
1115969228,wosjz123,ㅇ ㅇ,2024-10-05,"저녁에 방문, 예약 없이 이용, 대기 시간 바로 입장, 나들이, 혼자",친절해요,2288,1
1115969228,민스브,ㅇ,2024-10-03,저녁에 방문,특별한 메뉴가 있어요,642,1
1115969228,깜food,"연남동을 미쁘동거리 마냥 웨이팅 세우던 미쁘동이 서울숲에도 있었네요?매일 아침 손질하는 신선한 해산물들을고시히카리 품종으로 지은 밥에 이쁘게 얹어나오는데우니, 딱새우, 도로등 다양한 토핑 소량씩 얹을 수 있어서 완전 인기에요 미쁘동하면 빠질수없는 새우튀김 2마리나 올라간 토마토가득 연어소바로 연어치기해주고연어러버라면 무조건 시켜야하는 큼지막하게 썰어나오는 사시미와참치,우니,연어알,연어,딱새우 등 기깔나는 9가지 재료로 만든 제이타쿠동까지! 성수동 데이트 예정이라면 여기 꼭 가세요!연인한테 칭찬받으실거에요",2024-10-03,"점심에 방문, 예약 없이 이용, 대기 시간 30분 이내, 데이트, 연인・배우자",음식이 맛있어요,278,1
1115969228,한끼도,서울숲 근처에 오면 꼭 들르는 맛집이에요..🫶 벌써 세 번인가 방문했는데 미쁘동 말고 또 다른 시그니처 메뉴인 토마토연어국수 시켜봤어요! 이것도 너무 맛있어서 감동이었어요ㅠㅠ 같이 온 친구도 너무 맛있었다고 하네요! 직원들도 늘 친절하시고 인테이러도 예뻐서 올 때마다 괜히 기분이 좋아지는 가게입니당ㅎㅎ 다음에 또 올게요!!,2024-09-19,"저녁에 방문, 예약 없이 이용, 대기 시간 바로 입장, 친구",음식이 맛있어요,152,1
1115969228,Old Spice 올스파,"성수 서울숲 맛집 미쁘동에 다녀왔습니다.분위기도 너무 좋았고, 무엇보다 음식들도 퀄리티가 아주 높기 때문에 데이트 코스로 굉장히 좋을것 같아요. 단 웨이팅은 어느정도 하셔야 할 것 같아요. 성수동 일식 찐맛집 인정합니다.",2024-09-13,"저녁에 방문, 예약 없이 이용, 대기 시간 바로 입장, 가족모임, 연인・배우자, 아이",음식이 맛있어요,127,1
1115969228,Marais1,"남편사무실이 있는 곳이라 전에 주말 나들니차 나왔다가 처음 갔던 곳인데 그때 맛있어서 자꾸 생각나더라고요.그래서 추석전 조기퇴근일에 한번 더 들렀습니다.비가 오는 으슬 으슬한 날씨애 오후 3시쯤이었는데도 매장안에 사람이 거의 찼고요(네, 점심시간에는 줄서야 먹을수 있는 곳이긴 합니다ㅎㅎ)이번에는 아이없이 둘이서 편하게 식사를 즐길수 있어 더 좋았네요:)저는 미쁘동, 남편은 연어소바에 하이볼 주문했고요.국밥까지 추가해서 먹었는데요. 이번에도 역시 깔끔하고 맛있었습니다.맛에서 좋은 식재료를 사용한게 느껴져서, 여기서 먹고나면 오늘 건강한 음식 맛있게 먹었구나 싶어서 뿌듯해요.모든 메뉴가 맛있긴 하지만, 전에 먹었던 토마토 연어국수가 더 특별한 맛이었습니다.다음에는 토마토 연어국수로 먹으려고요 :)",2024-09-13,"점심에 방문, 예약 없이 이용, 대기 시간 바로 입장, 데이트, 연인・배우자",친절해요,210,1
