place_id,nickname,content,date,situations,keywords,review_count,visit_count
1112420992,얀느,건강한 맛막국수는 좀 달아서 아쉬웠어오,2024-05-12,"저녁에 방문, 예약 후 이용, 대기 시간 30분 이내, 친목, 친구",음식이 맛있어요,716,1
1112420992,귤이옵니다,분명 들기름 막국수 세트만 시켜먹었는데..직원분들이 저희 하는 얘기를 들으셨는진 모르겠지만파김치를 시키니 바로 죽까지 서비스로 주는 좋은 가게..😍😍 너무너무 맛있게 잘먹고 잘 놀다 왔어요들기름 막국수.. 진짜 맛이 미쳤어오 너무너무 맛있어서 반해벌임.. 또 방문할게요 잘 먹었습니댜😚😚,2024-05-05,"저녁에 방문, 예약 후 이용, 대기 시간 바로 입장, 데이트, 연인・배우자",친절해요,15,1
1112420992,eewr,닭 진짜 맛있음 굿,2024-04-21,"저녁에 방문, 예약 없이 이용, 대기 시간 바로 입장, 친목, 친구",음식이 맛있어요,720,1
1112420992,뀨뀨꺄꺄끼끼꾜꾜,ㅎ지난번에는 영수증을 못받아서 리뷰를 못썻는데이번에는 굳이 달라고해서 씁니다 너무 맛있어서...전기구이 통닭중에 솔직히 젤 맛있고 한남보다더 맛있는거같아요 사장님이 조미료 알러지때매조미료 하나도 안쓰고 만드신거라는데...닭죽 진짜 미쳤구요 들기름막국수 간장도매일 끓이신다는데 솔직히레시피 훔치고싶어요진짜 ㅈㄴ 맛있네뇨ㅠㅠㅠ 들기름막국수는 찍지도 못하고 흡입했어요ㅠㅠㅠㅠ쨩쨩 맛있었습니다🫶🏻🫶🏻🫶🏻🫶🏻🫶🏻,2024-04-20,"저녁에 방문, 예약 후 이용, 대기 시간 바로 입장, 친목, 친구",인테리어가 멋져요,42,1
1112420992,음4736,맛있어요,2024-03-29,"저녁에 방문, 예약 없이 이용, 대기 시간 바로 입장, 데이트, 연인・배우자",음식이 맛있어요,59,1
1112420992,뷰앙,마늘한방통닭이랑 죽을 시켰는데 진짜 최고의 맛.. 건겅한 맛이에요 완전 보약느낌 양도 많아서 둘이서 가면 닭만 시켜도 충분할 것 같아요 대파김치는 무조건 필수입니다 최고에요😍👍✨,2024-03-15,"저녁에 방문, 예약 없이 이용, 대기 시간 바로 입장, 친구",음식이 맛있어요,23,1
1112420992,내마밈,확실히 맛잇는 통닭 맛집이에요! 추운날이었는데 닭죽도 감칠맛 가득하고 넘 맛있엇어요음식도 맛있고 몸이 따뜩해지는 기분저는 평일 오픙 시간에 갔는데 입장하자마자 대기가 있더라고요..넘 좋아서 다시 먹어보고싶지만 30분 이상 대기하면서 다시 가고싶지않아요동네 특성상 어쩔수없나봐요 ㅠㅠ,2024-03-11,"저녁에 방문, 예약 없이 이용, 대기 시간 바로 입장, 데이트, 연인・배우자",음식이 맛있어요,140,1
1112420992,야빵좀사와,토요일 오후 5시쯤 들어갔는데 저희 이후부터 웨이팅 시작했어요. 1시간 정도 걸린다니까 주말은 일찍 저녁 먹는 게 좋겠어요.한국인이라면 마늘통닭 시키셔야 해요. 달달한 마늘과 통통하고 부들부들한 통닭이 아주 기가 막혀요 🥰그리고 막국수도 시켰는데 제가 최근에 먹은 막국수 중에 제일 맛있었어요. 대파 김치는 생소한데 새콤하고 아삭하니 씹는 맛이 좋았습니다. 잘 먹었습니다~,2024-02-17,"저녁에 방문, 예약 없이 이용, 대기 시간 바로 입장",음식이 맛있어요,2157,1
1112420992,d5n****,마늘 간이 잘 되어있고 막국수도 새콤해서 닭요리와 조화가 이루어집니다,2024-02-14,"저녁에 방문, 예약 없이 이용, 대기 시간 바로 입장, 친목, 친구",,3,1
1112420992,류썸머냠냐미,설 연휴 전날 저녁에 방문해서 40분 정도 웨이팅한것 같아요! 음식은 빨리 나오고 맛도 좋고 세트라서 2명이서 먹기 좋았어요. 대파 김치 첨 먹어봤는데 닭죽이랑 엄청 잘 어울려요! 매장이 아늑해서 식사 시간대에는 웨이팅 필수일것 같아요.,2024-02-08,"저녁에 방문, 예약 없이 이용, 대기 시간 30분 이상, 데이트, 연인・배우자",아늑해요,586,1
1112420992,ABAB11,굿,2024-01-29,저녁에 방문,음식이 맛있어요,1301,1
1112420992,타샤6057,매장이 아늑하고 닭고기가 부드럽고 맛있어요 😋 사장님들도 친절하시고 잘생겼…🫣🤭 닭껍질이 jmt 🥵 하지만 양념은 좀 (많이) 매워여 (제 기준으로 🫣) 다음에 마늘통닭 먹으러 갑니다!🐔,2024-01-12,"저녁에 방문, 예약 없이 이용, 대기 시간 바로 입장, 친목, 친구",인테리어가 멋져요,31,1
1112420992,yw****,기다렸지만 맛있어요 웨이팅할만 합니다 마늘향이 많이 나긴 해요,2023-12-25,"저녁에 방문, 예약 없이 이용, 대기 시간 1시간 이상, 가족모임, 연인・배우자, 아이",음식이 맛있어요,535,1
1112420992,toruf0206,해방촌 대표 닭요리 중화 한방 통닭은 맥주 안주로 기가 막히네요또 올게요~~~!!,2023-12-24,"저녁에 방문, 예약 없이 이용, 대기 시간 바로 입장, 데이트, 연인・배우자",음식이 맛있어요,44,1
1112420992,호호호호1,한방마늘통닭닭죽,2023-11-12,저녁에 방문,특별한 메뉴가 있어요,1197,1
1112420992,별점테러,맛있어요,2023-11-09,저녁에 방문,음식이 맛있어요,472,1
1112420992,즐거운인생7841,항상 친절하셔서 좋아요,2023-10-31,"저녁에 방문, 예약 없이 이용, 대기 시간 바로 입장, 친목, 친구",아늑해요,73,1
1112420992,Yook0502,마늘을 잔뜩 주셔서 듬뿍올려 잘 먹었습니다🤤 들기름 막국수도 간도 잘 맞고 너무 맛나게 먹었어요 꼬옥 이 세트로 시키세요🫶🏻🫶🏻,2023-10-12,저녁에 방문,음식이 맛있어요,56,1
1112420992,oozyy,한국인의 마늘맛 .. 마늘통닭 넘 맛있게 먹고 왔어요ㅠㅠ 들기름막국수랑 조합도 최고! 사장님도 친절하셨어요👍👍 또 갈게용 !~~!,2023-10-02,저녁에 방문,인테리어가 멋져요,77,1
1112420992,부산이삼,맛있고 친절하고 다 좋은데 웨이팅이 너무심해서 다음에 다시 올 엄두가 안나요ㅠㅠ,2023-09-23,저녁에 방문,음식이 맛있어요,173,1
1112420992,하이루ㅎㅎ,그ㅅ,2023-08-01,저녁에 방문,가성비가 좋아요,1428,1
1112420992,anna flow,음식은 괜찮은데 구석 자리에 앉았더니 주문힐 때나 필요한 게 있을 때 사장님 부르기가 너무 어려워요,2023-07-27,저녁에 방문,음식이 맛있어요,888,1
1112420992,후암동 올리,건강히 맛을 챙기는 기분이예요! 마늘 양념은 따로 챙겨주셔서 바삭함을 살릴 수 있고 대파김치가 특히 잘 어울려 별미예요!! 꼭 마늘양념으로 시키세요. 이 소스가 다른집과의 차별화를 줍니다!! 이태원치킨맨 닭 좋아하는데 거기 안에 내용물 보다는 부족하지만 소스와 파김치 + 간간한 죽이 차별화된 점 같아요. 다음에 또 주문하려구요,2023-07-15,저녁에 방문,음식이 맛있어요,1312,1
1112420992,cyh****,다 맛있어요.,2023-07-08,점심에 방문,음식이 맛있어요,1245,1
1112420992,윤제로,마늘소스와 어우러진 전기구이통닭이라향도 좋고 맛있습니다.냄새만 맡아도 생맥주를 부르네요.양도 푸짐해서 든든하게 먹었습니다.,2023-07-01,점심에 방문,음식이 맛있어요,197,1
1112420992,달빛4595,직원분들 친절하세요! 약간 시크하시면서 매력있으세욬ㅋ지금까지 마늘한방이랑 오리지널한방 먹어봤을때둘다 맛있는데 좀더 뜨겁고 마늘향 +달큰한거 좋아하면 마늘한방이 더 추천드리고 오리지널은 확실히딱 기본기에 충실한 맛이에요! 들기름 막귝수만 연속으로 먹었는데 매운거 못드시는 분들은 꼭 드셔보세요 들기름향 엄청 나고 달큰해서 그런지젓가락 계속 들어가는 맛입니다 냉모밀같은 느낌도 나고같이 먹은 남자친구도 엄청 좋아했어요먹고나면 제대로 된 식사한 기분들어서항상 만족하면서 자리를 뜹니다!✨막국수 세트에 콜라+식혜 + 대파김치(중요)✨요런 조합으로 꼭 드셔보세요! 약간의 달큰한 국수맛을 대파가 계속 잡아줘서엄청 많이 먹게돼요🤭 다음에 또 갈게요!잘먹었숩니더!!!!!!!,2023-06-29,저녁에 방문,인테리어가 멋져요,57,1
1112420992,Martali,특별한 맛은 아니나 들기름국수가 맛있어요,2023-06-19,저녁에 방문,,86,1
1112420992,pzone,맛있네요. 닭,2023-06-13,저녁에 방문,음식이 맛있어요,703,1
1112420992,진쥬쓰,"이렇게 부드러운 치킨은 처음이에요 … 전기구이 통닭은데 그냥 살살 녹네요 …??? 가격도 정말 적당하고,, 대만족 치킨이었어요 ! 짱짱 ,,,,!!!",2023-06-11,저녁에 방문,음식이 맛있어요,1258,1
1112420992,Ps타치오,가성비가 좋아요평일 저녁이라 매장은 한산했어요,2023-06-01,저녁에 방문,친절해요,1229,1
1112420992,검은도우너,더워요ㅠ,2023-05-31,저녁에 방문,음식이 맛있어요,388,1
1112420992,Marvin71,#해방촌닭 #신흥시장 #후암동 #통닭,2023-05-22,저녁에 방문,특별한 메뉴가 있어요,1090,1
1112420992,luc****,통닭도 부드럽고 넘 맛있고 테이블이 적은편이라 오히려 시끄럽지않고 친구와이야기하며 편하게먹기좋았어요. 이런분위기넘나좋아서 담에 또가고픈장소임.세트로 시켰는데 양도 적당하이 흡족하게먹었음.,2023-05-11,저녁에 방문,친절해요,246,1
1112420992,EJLUKE,맛있게 잘 먹었습니다!,2023-04-26,저녁에 방문,친절해요,8,1
1112420992,칸토나32,.,2023-04-21,저녁에 방문,음식이 맛있어요,1493,1
1112420992,Gonewiththewind,사장님이 매우 친절하시고 닭도 엄청 부드러워서 참 맛있게 먹었습니다. 닭 안에 밥도 쫄깃하니 식감이 아주 좋았어요. 재방문의사 있습니다! 항상 번창하세요~,2023-04-16,저녁에 방문,음식이 맛있어요,11,1
1112420992,괌묵,친절하고 맛있습니다,2023-04-10,저녁에 방문,친절해요,10,1
1112420992,아베크제이,포장해서 먹어봤는데 넘 맛있어요,2023-04-02,저녁에 방문,친절해요,97,1
1112420992,버터라우겐,레알개맛도리네요.. 싹싹 긁어먹고 나옴,2023-03-30,저녁에 방문,음식이 맛있어요,55,1
1112420992,미미T,웨이팅 없이 먹었어요❣️,2023-03-17,저녁에 방문,친절해요,988,1
1112420992,qamarkr,맛있네용 @.@ 추천합니당,2023-03-04,저녁에 방문,매장이 청결해요,906,1
1112420992,꾸끼75,자주먹어요 귯,2023-02-22,저녁에 방문,음식이 맛있어요,723,1
32283786,cancantun,,2025-04-09,"저녁에 방문, 예약 없이 이용, 대기 시간 바로 입장, 나들이",음식이 맛있어요,67,2
32283786,zzz948,냠냠굿~,2025-03-30,"밤에 방문, 예약 없이 이용, 대기 시간 바로 입장, 데이트, 연인・배우자",특별한 메뉴가 있어요,965,1
32283786,1amgora,평소 모로코 음식을 좋아해서 방문해봤습니다 ! 향신료가 세게 느껴지지 않아 한국 사람들에게 인기가 좋을 것 같아요 ㅎㅎ 음악도 가게 분위기도 너무 좋으네요 :),2025-03-21,"저녁에 방문, 예약 없이 이용, 대기 시간 바로 입장, 일상, 혼자",음식이 맛있어요,3,1
32283786,해바라기9888,너무나도 맛있어요!!!! 진짜 대박쓰,2025-02-23,"점심에 방문, 예약 없이 이용, 대기 시간 바로 입장, 데이트, 연인・배우자",음식이 맛있어요,62,1
32283786,먹대리,"🥄모로칸 치킨, 스파이시 슈림프 포장모로코식 샌드위치를 먹어볼 수 있는 곳.모로코코카페 반대편에 위치해 있고 같은 분이 운영한다고 하네요. 주문은 키오스크로 해서 편했습니다.겉바 속촉의 바게트[모로칸 치킨] (토마토, 양파, 피클, 양상추, 고수) 카레 향의 향신료 풍미와 부드러운 닭고기의 조화. 약간의 산미. 가득 찬 치킨에서 오는 만족감. [스파이시 슈림프] 기본 재료는 위와 같음. 꽤 매콤한 하리사 소스와 탱글 한 새우의 육즙. 소스와 재료의 조합이 균형 있게 맛있는 느낌. *마쿠다 감자가 기본인 줄 알았는데 추가해야 했나 봐요. 뒤늦게 아쉬웠어요.    네이버 메뉴 최신화가 안 돼있네요.메뉴당 10,000 눌려서 못생기게 나왔는데 맛은 있었어요.맛있게 잘 먹었습니다👍",2025-02-13,"점심에 방문, 예약 없이 이용, 대기 시간 바로 입장, 일상",음식이 맛있어요,209,1
32283786,영장류제왕,생각보다 샌드위치가 너무 커서 다 먹으니 진짜 배불렀습니다!! 램칠리 먹었는데 양고기 향도 별로 안나고 고기도 푸짐하게 들어가 있어서 괜찮네요ㅎㅎ 그래도 저처럼 새로운 음식 도전하는걸 좋아하는 분이 아니라면 치킨샌드위치가 무난하게 더 낫습니다^^ 포테이토도 추가했는데 카레맛도 나는듯???!!! 이국적인 음식이라 이태원 놀러가는 분들에게 추천하고 싶음ㅎㅎ,2025-02-09,"점심에 방문, 예약 없이 이용, 대기 시간 바로 입장, 친목, 친구",음식이 맛있어요,892,1
32283786,쩝쩝왕비,모로코 음식점 맛집이라 추천받아서 먹었다가 너무 제 취향이라 _저번주에 왔다가 재료 소진됐다고 해서 다시 또 방문했습니다. 향신료 향이 강하지 않아서 무난하게 즐기기 좋더라구요. 저는 개인적으로 램칠리 샌드위치가 최애입니다!,2025-02-02,"저녁에 방문, 포장·배달 이용, 대기 시간 10분 이내",음식이 맛있어요,1519,1
32283786,올라혜진,해방촌에 위치해있고 운영하고 음식 만드시는분들이 외국분들이세요. 저는 양고기 샌드위치 먹는데 엄청 크고 양도 많아요! 약간 뚱뚱하고 재료 많이 넣은 반미 샌드위치 느낌. 맛있어서 종종가요. 매장도 모로코 느낌으로 인태리어가 꾸며져 있어요. 특이한 외국 음식 먹어보고 싶은 분들 추천! 맛은 도전적인 느낌은 아니에요,2025-01-01,"저녁에 방문, 예약 없이 이용, 대기 시간 바로 입장, 친목, 친구",음식이 맛있어요,249,1
32283786,트위저,맛있긴했는데 비싼편,2024-12-19,"저녁에 방문, 예약 없이 이용",음식이 맛있어요,105,1
32283786,마이크와 조숙희,"당근샐러드 : 포근하게 익은 당근에 파프리카 파우더, 양파와 피클, 잎채소가 잘 어울림!램 샌드위치 : 향신료가 적절히 들어가서 외국맛 먹고싶을때 너무 좋은 선택지",2024-11-01,"점심에 방문, 예약 없이 이용, 대기 시간 바로 입장, 여행, 일상, 혼자",음식이 맛있어요,2089,1
32283786,개민식,Wtf 개맛있음요 내돈내산임 새우 샌드위치 꼭 드세요.. 반미샌드위치처럼 번이 담백 바삭 고소하구 양도 많아요,2024-10-19,"점심에 방문, 대기 시간 바로 입장, 혼자",음식이 맛있어요,102,1
32283786,탱삼3,오랜만에 갔더니 샥슈카가 생겨서 먹어봤어요맛있긴 한데 그래도 카사블랑카는 샌드위치가 최고네요,2024-10-19,"점심에 방문, 예약 없이 이용, 대기 시간 바로 입장, 친목, 친구",혼밥하기 좋아요,255,2
32283786,블랙베리36,,2024-10-09,"점심에 방문, 예약 없이 이용, 대기 시간 10분 이내, 데이트, 연인・배우자",혼밥하기 좋아요,107,1
32283786,두둥두둥,5년째단골인데 너무 오랜만에 방문한탓에 보자마자 먹어버렸더니..사진 없어요ㅠㅠ정말 여긴 다 먹어봤지만 새우 들어간게 우리나라 사람한테는 제일 입맛에 맞지않나 싶어요ㅋㅋ정말 꼭 한번 먹어봐야할 샌드위치가 아닐까싶어요~맛은 설명할수없으니 가보심을 추천합니다ㅋㅋ,2024-10-04,"밤에 방문, 예약 없이 이용, 대기 시간 10분 이내, 나들이, 친척・형제",친절해요,267,1
32283786,맛집굴착기,할랄가이즈가 떠오르는 이국적인 맛의 샌드위치. 좀 더 따뜻하면 맛있었을 것 같다.,2024-09-29,저녁에 방문,특별한 메뉴가 있어요,187,1
32283786,오렌지자전거73,만원이라 좀 비싼듯~~나오는 시간이 좀 걸렸어요~맛은 괜찮았어요~,2024-09-27,"저녁에 방문, 예약 없이 이용, 대기 시간 바로 입장, 혼자",음식이 맛있어요,109,1
32283786,리베레6,"램 칠리 샌드위치(10,000원), 램샥슈카(13,000원)를 시켰습니다. 샌드위치는 육즙이 가득하고 매콤합니다. 샥슈카도 고소하고 맛있었어요.",2024-09-12,"점심에 방문, 예약 없이 이용, 대기 시간 바로 입장",음식이 맛있어요,491,1
32283786,lee****,해방촌에서 너무 좋아하는 맛집이에요!모로코식 샌드위치 넘 감칠맛 너요 ㅎㅎ양도 은근히 많아서 한개 다 먹음 배불러요!감자추가 필수입니다 ㅋㅋㅋㅋ,2024-09-01,"점심에 방문, 예약 없이 이용, 대기 시간 바로 입장, 친목, 친구",음식이 맛있어요,278,1
32283786,아룡임,치킨샌드위치 맛있었고 쉬림프 삭슈카는 조금 짰어요.이국적인 분위기 멋져요!,2024-08-03,"저녁에 방문, 예약 없이 이용, 대기 시간 바로 입장, 친목, 친구",음식이 맛있어요,65,1
32283786,Factmania,몇년전에 왔는데도 변함없이 맛있는 집입니다. 꼭한번 가보세요,2024-05-18,"저녁에 방문, 예약 없이 이용, 대기 시간 바로 입장, 데이트, 연인・배우자",음식이 맛있어요,850,1
32283786,tytrack,사장님이 외국인이라 소통이 좀 힘들지만..?맛은 좋앗어요,2024-05-01,"저녁에 방문, 예약 없이 이용, 대기 시간 바로 입장, 친목, 친구",음식이 맛있어요,164,1
32283786,두마리냥,"모르고 포테이토 추가 안했는데, 2000원 내고 꼭 추가해서 드세요. 맛이 확 다릅니다. 예전엔 기본에 포함이었어서 뭐지 하고 그냥 기본으로 시켰다가 후회했어요. 독특한 샌드위치 맛이고, 모로칸 치킨 샌드위치는 카레맛이랑 허브향 있어요. 책상이 조금 끈적여요.",2024-04-27,"점심에 방문, 예약 없이 이용, 대기 시간 바로 입장",음식이 맛있어요,262,1
32283786,kri****,"I am in shock. I love this place so much, but I realized today how unsanitary the workers are. I just saw them cleaning the tables, wiping the counters, punching the pos which has tons of bacteria, and STILL using the same gloves and hands to make other people’s sandwiches without wearing new gloves. This is not okay for customers. Please switch out your gloves every time you clean or use the pos",2024-04-10,"점심에 방문, 예약 없이 이용, 대기 시간 30분 이내, 데이트, 연인・배우자",음식이 맛있어요,23,1
32283786,mmj****,맛있어용,2024-04-07,"저녁에 방문, 예약 없이 이용, 대기 시간 바로 입장, 친목",친절해요,831,1
32283786,뇽용,샌드위치와 샥슈카 모두 맛있었습니다 향신료도 그리 강하지 않아요! 가격은 샌드위치치고 조금 비싸다 생각 ㅠ,2024-03-03,"점심에 방문, 예약 없이 이용, 대기 시간 바로 입장, 친목, 친구",음식이 맛있어요,502,1
32283786,뚜우듈,샌드위치 그냥 존맛탱이였어요.. 혼밥하기도 좋네용,2024-02-21,"점심에 방문, 예약 없이 이용, 대기 시간 바로 입장, 혼자",혼밥하기 좋아요,537,1
32283786,헤헤9639,샌드위치 맛있어요,2024-02-04,"점심에 방문, 예약 없이 이용, 대기 시간 바로 입장, 일상, 친구",음식이 맛있어요,478,1
32283786,Hope9376,맛있,2024-01-14,저녁에 방문,음식이 맛있어요,804,1
32283786,이토킴,굳,2024-01-02,"밤에 방문, 예약 없이 이용, 대기 시간 바로 입장, 데이트, 연인・배우자",음식이 맛있어요,1636,2
32283786,Enchanting,"무스타파 혼자서 작게 할때부터 좋아했는데,몇년만에가도 그대로인 맛에 감동♡금액도 이 정도면 요즘물가에 정말 양심적인거고~램은 맵찔에겐 살짝매울수있고,모든사람들의 원픽은 치킨이지만 여기 오믈렛이 hidden gem",2024-01-02,점심에 방문,음식이 맛있어요,1028,1
32283786,Alice8477,굳,2023-12-26,"점심에 방문, 예약 없이 이용, 대기 시간 바로 입장",,1497,1
32283786,여긴어디냐,해방촌 맛집. 소주도 팔면 딱좋을듯,2023-12-16,"점심에 방문, 예약 없이 이용, 대기 시간 바로 입장, 일상, 친구",친절해요,712,1
32283786,12121221,잘먹었습니다:) 다만 예전만큼의 감동이 없어서 아쉬웠어요 여전히 사람이 많습니다!,2023-12-03,저녁에 방문,음식이 맛있어요,484,1
32283786,Verath,1. 이태원에 걸맞는 가격대.2. 사장에게 물어보니 샌드위치가 아니라 샥슈카를 먼저 추천함 ㅋㅋ 3. 사장님은 영어가 더 편하신 듯4. 다음 번엔 샥슈카 먹으러 와야겠음5. 건너편 모로코코 카페랑 대표가 같음. 모로코 가게 흔치 않은데 무려 두 개나 운영하다니ㄷㄷ 여하간 모로코 음식 먹을 수 있어서 너무 좋았다,2023-11-22,"저녁에 방문, 예약 없이 이용, 대기 시간 바로 입장, 여행, 일상, 혼자",음식이 맛있어요,103,1
32283786,카카두러브,좋아요,2023-11-18,"점심에 방문, 예약 없이 이용, 대기 시간 바로 입장, 데이트, 연인・배우자",인테리어가 멋져요,921,3
32283786,choroc,너무 맛있어요 정말. 여행 다녀온 기분이에요역시 롱런하는덴 이유가 있네요,2023-10-25,점심에 방문,음식이 맛있어요,156,1
32283786,김수빈94,🍗모로칸 치킨🥪 닭꼬치같은 부드러운 닭다리 살이 잘려져 들어 있고 다른 집에선 맛볼 수 없는 이국적인 소스가 뿌려져 있었어요. 특이하게 피클이 가로가 아니라 세로로 길게 잘려 들어있는데 많이 짜지 않아 소스와 함께 먹기도 좋고 씹는 맛도 좋았어요. 특유의 소스와 특이한 재료들의 조합이 좋아서 자꾸 찾게 되는것 같아요. 처음이라 메뉴가 고민이라면 치킨을 추천드립니다!🥕베지테리언🥪 반미 같이 바삭한 바게트 빵에 안에 들어있는 튀김은 감자 해쉬볼같은 느낌이였습니다.  스리라차 마요같은 소스가 뿌려져 있는데 특유의 이국적인 향이 강하지만 맛있었어요! 은근히 매운맛이 강했습니다. 양념된 당근과 고수 등이 들어가 채식 메뉴지만 간간하기보단 다채로운 맛과 향이 나서 좋았어요.,2023-10-24,저녁에 방문,매장이 청결해요,168,1
32283786,미피미피키키,겉은 빵이 빠삭한데 안엔 엄청 부드러워요^^빵이 독특하게 맛있었어요예전에 수요미식회에 나왔다고 합니다 일찍 왔을땐 저희만 있었는데 나올때는사람이 많아서 빨리 일어났어요!!!!!,2023-10-24,저녁에 방문,음식이 맛있어요,606,1
32283786,히티틀러,"샌드위치 치고는 양도 많고, 빵이 바삭하고 좋다.다만 한국어나 영어로 의사소통이 좀 어렵고,  주차자리 찾기가 어렵다.",2023-10-14,저녁에 방문,음식이 맛있어요,1603,1
32283786,따이양,생소한 나라의 음식에 겁먹을 수 있지만 향신료에 아주 예민한 분이 아니라면 충분히 무난하게 먹을수 있는 곳! 종종가는 햄버거집 사장님이 추천해주셔서 잘 먹고 갑니다!😋가격에 비해서 양도 괜찮은것 같아요! 바게트가 질긴편도 아니라 굿! 고기에서 누린내도 없고 좋아용! 외국 음식을 자주 접한 분이라면 어디선가 한두번쯤 맛본 맛이에요! 식기는 셀프이니 당황하지 마세요~샥슈카?는 미트칠리느낌의 스튜에 빵 찍어먹는 느낌!? 무난하게 맛있어요!앞에 모로코음식점이랑 전체적인 메뉴 느낌이 비스무리한듯해요! 식재료도 공유하는듯!외국인손님들이 상당히 많고 동네 주민들도 애용하는 곳인듯!?,2023-10-07,점심에 방문,음식이 맛있어요,246,1
32283786,앤디317,모로칸 샌드위치 맛집 카사블랑카!치킨 샌드위치가 메인 입니다!,2023-09-24,저녁에 방문,음식이 맛있어요,260,1
32283786,도피인,특별한 샌드위치가 먹고 싶을 때 가면 좋을 듯한끼 식사로도 좋고 간식으로도 좋음새우 샌드위치는 이름에도 써 있듯 생각보다는 매울 수 있음4개.포장했는데..겉 포장에 샌드위치 이름을 표시해 주면 더 좋을 듯,2023-09-13,밤에 방문,음식이 맛있어요,16,1
32283786,하위발광43,알바 해주시는 외국인형님 살짝 삐리한감이 있긴했는데 그래도 친절하고 음식 항상 맛있고 갈때마다 만족함,2023-09-10,점심에 방문,음식이 맛있어요,5,1
32283786,준마니의 백세시대,"해방촌서 가장 개성 넘치고, 독특한 식당을 꼽으라면 카사블랑카 샌드위치 아닐까. 물론 맛도 좋고. 모로코 샌드위치라고 하면 향이 너무 강하지 않을까 생각하겠지만, 한국인 입맛에도 잘 맞는다. 첫 방문자라면 반드시 치킨 샌드위치를 먹어볼 것. 재방문자라면 샥슈카를 먹어보자. 블로그 리뷰: https://m.blog.naver.com/junmani87/223203054314",2023-09-06,저녁에 방문,음식이 맛있어요,24,1
32283786,앵겔지수1,굳,2023-07-29,"점심에 방문, 예약 없이 이용, 대기 시간 바로 입장, 데이트, 연인・배우자",음식이 맛있어요,1655,2
32283786,앵겔지수1,외쿡맛,2023-07-23,밤에 방문,음식이 맛있어요,1655,1
