place_id,nickname,content,date,situations,keywords,review_count,visit_count
19847411,jaylee101345,맛있어요,2025-04-04,"저녁에 방문, 예약 없이 이용, 대기 시간 바로 입장, 가족모임, 연인・배우자, 아이",음식이 맛있어요,1618,3
19847411,헤릭황4,용답동 맛집먹음직스러움두부 라면 추가필수,2025-03-07,"저녁에 방문, 예약 없이 이용, 대기 시간 바로 입장, 나들이, 일상, 가족모임, 지인・동료",건강한 맛이에요,46,1
19847411,유명한 셋째딸,좋아요,2025-02-27,저녁에 방문,음식이 맛있어요,2549,1
19847411,BACK68,양이 엄청 많고 맛있어요!!👍점심 때 갔는데도 웨이팅은 없었지만 사람도 많고 다음에도 방문하고 싶어요ㅎㅎ술안주로 딱!,2025-02-22,"점심에 방문, 예약 없이 이용, 대기 시간 바로 입장, 일상, 가족모임, 연인・배우자, 부모님, 친척・형제",음식이 맛있어요,536,1
19847411,Choi8D,오늘은 두루치기 대신 김치찌개가 먹고 싶어서 방문했어요! 맛집답게 이미 사람들로 꽉찼는데 다행히 웨이팅 없이 앉았다는!!! 그 뒤로 비로 웨이팅~ 예약도 가능하나 저희는 안하고 무작정 갔답니다 ㅎ 개운하니 시원한 김치찌개에요! 밥 한공기 뚝딱입니다👍🏻👍🏻🫶🏻,2025-02-13,"저녁에 방문, 예약 없이 이용, 대기 시간 바로 입장, 데이트, 연인・배우자",음식이 맛있어요,543,2
19847411,쑈리1,굿,2025-02-12,"저녁에 방문, 예약 없이 이용, 대기 시간 바로 입장, 친목, 친구",음식이 맛있어요,1675,3
19847411,보영714,정말 맛있어요 ㅠㅠ,2025-02-02,"저녁에 방문, 예약 없이 이용, 대기 시간 바로 입장, 데이트, 연인・배우자",매장이 넓어요,252,1
19847411,SerotoninSoo,눈 오는 날 먹었더니 더 입에 챡!! 붙는 맛♥️,2025-01-27,점심에 방문,음식이 맛있어요,485,1
19847411,한량처럼 살란다,용답동 맛집!5시에 갔는데 10분있다가 꽉참 ㅋㅋ술안주로 최고긴한데 저희는 저녁으로!라면사리 추가하면 같이 볶아나와요두루치기 너무 맛있음!가격은 조금 비싸나 비싼가치가 있어요나중에 볶음밥 하면 좋은데 저흰 공기밥 두개먹다남은걸로 볶아먹었어요 그래도 맛있음용답동 가시면 먹어보세요 굳굳!,2025-01-24,"저녁에 방문, 예약 없이 이용, 대기 시간 바로 입장, 데이트, 연인・배우자",음식이 맛있어요,779,1
19847411,안졸리나졸려88,솔직히 고기 양이 많지는 않지만 넘 맛있어서 3번째 방문했어요!,2025-01-12,"저녁에 방문, 예약 없이 이용, 대기 시간 바로 입장, 데이트, 연인・배우자",음식이 맛있어요,1814,1
19847411,미각잃은아재입맛,"두루치기 맛집. 몇해 전 깜놀했던 맛이 뇌리에 박혀있던..그 기억이 너무 강렬했나? 그때 만큼은 아니지만 충분히 맛있는 저녁이었다. 두부와 라면사리는 필수이며, 볶음밥이 마무리.",2025-01-02,"저녁에 방문, 예약 없이 이용, 대기 시간 바로 입장",음식이 맛있어요,46,1
19847411,jjong848,굿,2024-12-14,"저녁에 방문, 예약 없이 이용, 대기 시간 바로 입장, 일상, 친척・형제",음식이 맛있어요,3608,1
19847411,Cherrycoke,,2024-12-14,"저녁에 방문, 예약 없이 이용, 대기 시간 10분 이내, 일상, 연인・배우자, 혼자",음식이 맛있어요,2632,1
19847411,꼬부랑통,또 만났네 또 만났어 맛있어어 또 왔네요 이번에 진짜 광고 주인 봤네요. 맜있어요 오래오래하세요,2024-12-14,"점심에 방문, 예약 없이 이용, 대기 시간 바로 입장, 데이트, 나들이, 연인・배우자",음식이 맛있어요,42,2
19847411,쩡또또,굿,2024-12-12,"점심에 방문, 예약 없이 이용, 대기 시간 10분 이내, 데이트, 연인・배우자",음식이 맛있어요,715,2
19847411,도시사자,"두루치기3, 손두부사리1, 라면사리1사진상 양이 많은듯 보이나 딱히 그렇진 않고고기가 좀 질김..생각보다 맛은 보통",2024-12-06,"저녁에 방문, 예약 없이 이용, 대기 시간 30분 이상, 친목, 친구",음식이 빨리 나와요,677,1
19847411,앙싱당옹,코리아 웰컴푸드❤️,2024-12-03,"저녁에 방문, 예약 없이 이용, 대기 시간 바로 입장",매장이 넓어요,483,2
19847411,기여미0802,맛있,2024-12-02,"저녁에 방문, 예약 없이 이용, 대기 시간 바로 입장, 일상, 부모님",음식이 맛있어요,1515,7
19847411,꼬부랑통,맛은 있어요. 유명한 집이인가보네요. 연애인싸인 많아요. 아저씨가 엄청친절해요. 근데 홀 이모님은 많이 바빠서 정신없으시네요. 반찬은 맛있어요. 일행분 엄청좋아하셨어요. 다음엔 또와서 다른 메뉴 먹어보자고하네요. 가성비치고는 별로 아닌데 그냥 먹기에는 맛은 있어요. 다시 또 올것 같아요.,2024-11-18,"저녁에 방문, 예약 없이 이용, 대기 시간 바로 입장, 데이트, 연인・배우자",음식이 맛있어요,42,1
19847411,Forest45,김치 너무 맛있고 두부 사리 꼭 드세요,2024-11-10,"저녁에 방문, 예약 없이 이용, 대기 시간 바로 입장, 데이트, 연인・배우자",음식이 맛있어요,760,1
19847411,룡묭,외국 나가기 전 최고의 선택👍,2024-10-27,저녁에 방문,음식이 맛있어요,652,2
19847411,유겸댕,통돼지 두루치기에 볶음밥!,2024-10-26,"저녁에 방문, 예약 없이 이용, 대기 시간 30분 이내, 일상, 친척・형제",,1392,1
19847411,chariszz,통돼지 김치찌개인데 안에 고기가 너무 적은 거 아니예요?? 갈 때마다 고기가 손톱만하면 어떡해요 ㅠㅠ 맛있는데 고기가 너무 없거나 작음;,2024-10-20,저녁에 방문,음식이 맛있어요,1731,7
19847411,푸심이,오랜망에 왔네용 크 역시 중독적인 맛~ 라면사리 이보다 맛있는 조합은 없어용 ><,2024-10-17,"저녁에 방문, 예약 없이 이용, 대기 시간 바로 입장, 데이트, 일상, 연인・배우자",친절해요,846,2
19847411,getmerry,"양이 진짜 많아요. 특히 김치가 많아서 좋고, 반찬도 맛있어요. 두루치기는 두부와 공깃밥이 미포함이에요.",2024-10-17,"저녁에 방문, 예약 없이 이용, 대기 시간 바로 입장, 데이트, 연인・배우자",음식이 맛있어요,2299,1
19847411,barbie2431,김치찌개가 맛있고 온누리상품권 됩니다,2024-10-13,"점심에 방문, 예약 없이 이용, 대기 시간 바로 입장, 데이트, 연인・배우자",음식이 맛있어요,1048,1
19847411,노른자쏜다,맛있어요👍,2024-10-12,"저녁에 방문, 예약 없이 이용, 대기 시간 바로 입장, 친목, 친구",음식이 맛있어요,283,1
19847411,빙글빙글쩝쩝,뒤늦게 두부 추가를 했다두부가 킥이었다.. 답십리 맛집 인정합니다~~~,2024-10-10,저녁에 방문,음식이 맛있어요,160,1
19847411,kkhyakkhya,,2024-10-09,"점심에 방문, 예약 없이 이용, 대기 시간 바로 입장, 일상, 연인・배우자",음식이 맛있어요,554,2
19847411,장자기,맛있어요,2024-10-08,점심에 방문,음식이 맛있어요,1591,2
19847411,코리탑,처음 먹어봤는데 비쥬얼도  좋고  맛도 좋네요,2024-09-22,"점심에 방문, 예약 없이 이용, 대기 시간 바로 입장",음식이 맛있어요,1316,1
19847411,kilw,일단 좀 짜요…그리고 간이 쎈게 고기 잡내 감추려고 하신건지…잘 먹다가 씹었는데냄새가 엄청 나서 뱉었어요.그 전까지는 맛있었어요.,2024-09-14,"점심에 방문, 예약 없이 이용, 대기 시간 바로 입장, 친목, 친구",음식이 빨리 나와요,28,1
19847411,llj****,두루치기 3인분 김치찌개 2인분 시켜서 먹었어요 양도 많고 맛있었지만 저희가 주문을 하거나 부탁드리는 것에 대답이 하나도 없어 주문이 들어간건지 들으신건지조차 모르겠었고 점심시간대라 다른 손님들이 들어와서 시키는데 나이가 좀 있는 어머님 아버님 나이대에는 대답을 해주시더라구요. 그런 부분에서 기분이 별로였어요. 음식은 맛있고 양도 많았습니다. 친절하지않다는 리뷰는 보았었지만 주문이 들어간거에 대해 짧게나마 대답을 해주샸다면 좋을거같아요,2024-09-08,"점심에 방문, 예약 없이 이용, 대기 시간 바로 입장, 친목, 친구",음식이 맛있어요,13,1
19847411,깅도리,"남자친구가 엄청 가보고 싶다고 해서 따라갔어요둘 다 술은 안 먹고 두루치기랑 라면 사리로만 배를 채웠네요진짜 뻥 아니고 올해 먹어본 것 중에 손에 꼽습니다라면 사리를 추가하냐 마냐로 남자친구랑 티격태격하다가 한 개 추가해 봤는데 너무 맛있어서 먹다가 한 개 더 추가했어요조금 많이 드실 수 있으면 라면사리 두 개 추가하는 거 추천 드려요 ㅎㅎㅎㅎ 너무 배불러서 볶음밥은 먹진 못했지만, 다음에 또 가서 먹으면 좋겠 볶음밥으로 먹어봐야겠어요. 집이 송파인데 답십리까지 찾아가서 먹은게 후회 되지 않을 정도로 너무 맛있게 먹고 왔습니다 😃 벽에 보니까 연예인들도 자주 오는 거 같더라구요🙂 선선해질 때 한 번 더 갈게요😁😁",2024-09-07,"저녁에 방문, 연인・배우자",음식이 맛있어요,105,1
19847411,memovy,"sns에서 우연히 보고 너무 가고싶어서 저장했다가 간곳인데...하....진짜 여기 너무 맛있고 술이 죽죽 들어갑니다,,,가까웠으면 주에 3일이상 갔을정도로 강추입니다 라면 및 두부 사리는 그냥 필수입니다",2024-09-06,"저녁에 방문, 예약 없이 이용, 대기 시간 바로 입장, 친목, 친구",음식이 맛있어요,150,1
19847411,쩡또또,굿,2024-08-29,"점심에 방문, 예약 없이 이용, 대기 시간 바로 입장, 데이트, 연인・배우자",음식이 맛있어요,715,1
19847411,김초현86,믿고 먹는 맛집!!너무 맛있어요~!!,2024-08-28,"점심에 방문, 예약 후 이용, 대기 시간 바로 입장, 일상, 지인・동료",음식이 맛있어요,27,2
19847411,kyr108,맛있어요!,2024-08-28,"점심에 방문, 예약 후 이용, 대기 시간 바로 입장, 친목, 지인・동료",음식이 맛있어요,7,2
19847411,시절인연49,항상 맛있게 먹고 있어요-,2024-08-28,"점심에 방문, 예약 없이 이용, 대기 시간 바로 입장, 일상",음식이 맛있어요,1457,2
19847411,zxasxz,재료가 신선 하고  맛있습니다 재방 의사 완전 있습니다,2024-08-25,"저녁에 방문, 예약 없이 이용, 대기 시간 바로 입장, 나들이, 연인・배우자, 아이",음식이 맛있어요,158,1
19847411,pys2670,맛있어요,2024-08-22,"점심에 방문, 예약 없이 이용, 대기 시간 바로 입장, 일상, 연인・배우자",음식이 맛있어요,16,1
19847411,asmjinoh,맛있게 먹었습니다,2024-08-22,"점심에 방문, 예약 없이 이용, 대기 시간 바로 입장, 일상, 친구",음식이 맛있어요,4,1
19847411,김초현86,회사근처라 점심때오는데 항상 맛있고 양도 많아서 답십리 근처 최애 맛집으로 꼽습니다!!,2024-08-22,"점심에 방문, 예약 후 이용, 대기 시간 바로 입장, 일상, 지인・동료",음식이 맛있어요,27,1
19847411,뮨123,맛있어용,2024-08-21,"저녁에 방문, 예약 없이 이용, 대기 시간 바로 입장, 친목, 연인・배우자, 친구",음식이 맛있어요,1399,5
19847411,뮨123,맜있어요ㅎㅎㅎ,2024-08-12,"저녁에 방문, 예약 없이 이용, 대기 시간 바로 입장, 친목, 지인・동료",음식이 맛있어요,1399,4
19847411,s0s****,양이 푸짐하고 맛있어요 간이 최고입니다,2024-08-07,"점심에 방문, 예약 없이 이용, 대기 시간 바로 입장, 일상, 지인・동료",음식이 맛있어요,86,1
19847411,저희친하게지내요,퇴근하고 먹는 맛있는 저녁식사였습니다 👍,2024-08-06,"저녁에 방문, 예약 없이 이용, 대기 시간 바로 입장, 일상, 지인・동료",음식이 빨리 나와요,146,1
19847411,냠뮤,완전 맛있어요 양많아요,2024-08-01,"점심에 방문, 예약 없이 이용, 대기 시간 바로 입장, 친목",음식이 맛있어요,289,1
19847411,나운4984,김치찌개 후기가 많이 없고 대부분 두루치기 후기던데김치찌개도 너무 맛있어요!!,2024-08-01,"점심에 방문, 예약 없이 이용, 대기 시간 바로 입장, 가족모임, 부모님",음식이 맛있어요,2,1
19847411,도시남250,너무 맛있게 잘 먹었습니다. 용답동 맛집!!,2024-08-01,"점심에 방문, 예약 없이 이용, 대기 시간 바로 입장, 데이트, 일상, 연인・배우자",음식이 맛있어요,15,1
19847411,min****,,2024-07-29,저녁에 방문,음식이 맛있어요,243,1
19847411,이채원822,짜지않고개운하고조미료맛안나서맛있어요,2024-07-29,"저녁에 방문, 예약 없이 이용, 대기 시간 바로 입장, 나들이, 연인・배우자, 아이",음식이 맛있어요,324,1
19847411,mun****,맛잇어요,2024-07-25,"점심에 방문, 예약 없이 이용, 대기 시간 바로 입장, 데이트, 연인・배우자",음식이 맛있어요,18,1
19847411,minni1,배불러요,2024-07-16,"저녁에 방문, 예약 없이 이용, 대기 시간 바로 입장, 일상, 지인・동료",양이 많아요,854,1
19847411,이상혁456,아이가 좀 매워하긴 했지만 맛있어요.,2024-07-14,"저녁에 방문, 예약 없이 이용, 대기 시간 바로 입장, 일상, 아이",음식이 맛있어요,11165,3
19847411,환상라면,혼밥하기 좋아요,2024-07-08,"점심에 방문, 예약 없이 이용, 대기 시간 바로 입장, 일상, 혼자",친절해요,709,1
19847411,lmy10004,부대찌개는 좀 짰어요~~~,2024-06-30,점심에 방문,음식이 맛있어요,1315,4
19847411,연규연,"[서울 성동구 용답동]동네 두루치기 맛집☺️☺️두부와 라면사리는 꼭 추가해서 먹어야해요!!주문은 인원수대로 해야 하고, 밥은 따로 주문해야 합니당😉음식 간이 좀 쎈편인데, 그래서 라면사리가 더 맛있고 두부와 잘 어울리는 것 같아요! 고기 잡내도 안나고 김치도 왼전 맛있어요!그냥 완전 밥 반찬&술안주🥹🥹👍양이 많아 볶음밥 못먹은게 너무 아쉬워요🥹🅿️ 주차장은 근처 용답동 공영 주차장 이용하셔야 합니당",2024-06-27,"저녁에 방문, 예약 없이 이용, 대기 시간 바로 입장, 일상, 연인・배우자",음식이 맛있어요,50,1
19847411,sesun2,기본 양념이 맛있구 술땡기고~ 밥땡기고~ㅎ밑반찬도 나오고 깔끔하네요ㅎ배불러서 볶음밥을 못먹어서 아쉬웠어요ㅎ,2024-06-10,"저녁에 방문, 예약 없이 이용, 대기 시간 바로 입장, 데이트, 연인・배우자",음식이 맛있어요,410,1
19847411,끈즈,"오랜만에 와서 먹었어요~인당 주문해야 한다고 하셔서 4인으로 주문했습니다.라면사리랑 두부사리도 추가했어요!두부에 싸서 먹는거 진짜 맛있습니다.주변 공간이 오픈된 공간이라 다소 시끄러워요.조용한 공간을 바라긴 힘듭니다..조리는 거의 다 되어서 나오고, 약한 불로 데워서 먹습니다. 굳굳",2024-06-07,"저녁에 방문, 예약 없이 이용, 대기 시간 바로 입장, 친목, 친구",음식이 맛있어요,380,2
19847411,띰디현,오빠랑 손잡고 방문한 두루치기 맛집😘🥰두부사리 꼭꼭 추가해서 드세요 두부가 정말 보들보들 꽉찬 두부맛인데 시장두부집에서 파는 두부예요! 두루치기도 맛있고 맛집으로 인정해요~,2024-05-19,"저녁에 방문, 예약 없이 이용, 대기 시간 바로 입장, 친목, 친구",음식이 맛있어요,344,1
19847411,시간의 흐름그 곳은 어디일까,1인에14.000,2024-05-17,"점심에 방문, 예약 없이 이용, 대기 시간 바로 입장, 친목, 친구",,1802,4
19847411,Mmmmlwr,세번째 방문입니다! 진짜 줜맛탱이에요ㅠㅠ돼지고기와 김치 각종 채소의 조합...말해모해...🤤라면이랑 두부 꼭 추가해서 드세요!👏🤤👏,2024-04-27,"저녁에 방문, 예약 없이 이용, 대기 시간 바로 입장, 데이트, 연인・배우자",음식이 맛있어요,552,1
19847411,선잔디,맛도리,2024-04-01,저녁에 방문,음식이 맛있어요,1045,1
19847411,황뚠뚠,간이 좀 쎈편이에요~소주 안주로는 나쁘진 않아요~,2024-03-29,"저녁에 방문, 예약 없이 이용, 대기 시간 바로 입장, 일상, 친구",,837,2
19847411,BEANN,나쁘지 않았음인스타에 맛집이라길래 가봤는데손님은 없었음엄청 맛있는 맛은 아니고딱 두루치기 맛이었음,2024-03-24,점심에 방문,,424,1
19847411,Choi8D,동네 맛집 찾다가 우연히 발견했는데 사람들이 바글바글한 곳! 두루치기가 적당히 맵지않고 맛있어요!! 두부가 부들부들하니 좋아요 다음엔 또다른 메뉴인 김치찌개 맛을 보고싶은 집이에요!! 사람많은 이유를 알겠어여👍🏻😆,2024-03-23,"저녁에 방문, 예약 없이 이용, 대기 시간 30분 이내, 일상, 연인・배우자",음식이 맛있어요,543,1
19847411,김거산,통돼지두루치기 진짜 맛있게 먹었습니다.,2024-03-23,"저녁에 방문, 예약 없이 이용, 대기 시간 10분 이내, 데이트, 연인・배우자",음식이 맛있어요,337,1
19847411,아가자장2024,음식이 맛있어요 근데 저녁에 술한잔하면서 먹는것이 더 적당할듯요,2024-03-22,"점심에 방문, 예약 없이 이용, 대기 시간 바로 입장, 일상",양이 많아요,312,1
19847411,시간의 흐름그 곳은 어디일까,맛있어요,2024-03-11,점심에 방문,음식이 맛있어요,1802,3
19847411,차미슬처럼,자주 왔던 곳인데 오랜만에 찾아왔어요! 3인분 시켰는데 양도 많아서 놀랐어요 두부는 꼭 추가해서 드세요! 맛있습니다! 볶음밥은 밥과 김가루만 추가하는건데도맛 좋아요 술이 술술 들어갑니당🤣👐🏻,2024-03-09,"저녁에 방문, 예약 없이 이용, 대기 시간 바로 입장, 일상, 연인・배우자, 지인・동료",음식이 맛있어요,249,1
19847411,lls090136,,2024-03-02,"점심에 방문, 예약 없이 이용",음식이 맛있어요,891,1
19847411,네모사랑18,맛있게 잘먹었습니다.,2024-03-01,"점심에 방문, 예약 없이 이용, 대기 시간 바로 입장, 일상, 연인・배우자",음식이 맛있어요,409,1
19847411,솜19,귿,2024-02-27,"저녁에 방문, 예약 없이 이용, 대기 시간 바로 입장, 데이트",음식이 맛있어요,513,1
19847411,hi****,굿,2024-02-27,"저녁에 방문, 예약 없이 이용, 대기 시간 바로 입장, 데이트, 연인・배우자",음식이 맛있어요,128,1
19847411,미스터 자이언트,두명에서 방문 했습니다 두루치기 2인분+두부&라면 사리 추가+공기밥1+볶음밥 주문했습니다평소 맵찔이라 매울까봐 걱정했는데 적당히 매콤하고 불맛도 강하고 너무 맛있게 잘 먹었습니다.양이 거의 3~4인분 수준 결국 볶음밥 거의 먹지 못하고 배불러서 남겼습니다. 다음에도 또 방문 드릴께요 너무 맛있어요,2024-02-24,"저녁에 방문, 예약 없이 이용, 대기 시간 바로 입장, 데이트, 연인・배우자",음식이 맛있어요,15,1
19847411,영  파워 983,김치 찌게  먹었는데  그냥  평범하고  밑반찬을  조금 신경 써 주셨으면  합니다~~,2024-02-21,"점심에 방문, 예약 없이 이용, 대기 시간 바로 입장, 일상, 친구",매장이 청결해요,1151,1
19847411,시간의 흐름그 곳은 어디일까,맛있어 엄마사다드림,2024-02-19,점심에 방문,음식이 맛있어요,1802,2
19847411,BY8735,굿,2024-02-06,"점심에 방문, 예약 없이 이용, 대기 시간 바로 입장",음식이 맛있어요,2557,18
19847411,물빛85jy,김치와 섞어 먹는 삼겹살.. 간혹 이용하기 무난해요.,2024-02-03,"저녁에 방문, 예약 없이 이용, 대기 시간 10분 이내, 일상, 아이",음식이 맛있어요,3612,1
19847411,sce****,어릴때 먹어보고 오랜만에 갔더니 여전히 사람이 많다.음식은 맛있는데 서비스는 별루..사장님이랑 직원들도 그리 친절한거같지않고볶음밥은 진짜 시키지말아야겠다. 재료도 많이안넣어주는데 3천원인게 말도안되고 심지어 내가 직접 볶아먹으란다... 너무 별루!!이럴거면 공기밥 시켜서 내가 볶아먹었지,2024-01-31,"저녁에 방문, 예약 없이 이용, 대기 시간 바로 입장, 친목, 일상, 지인・동료",고기 질이 좋아요,82,1
19847411,wildrose45,자주감,2024-01-26,"저녁에 방문, 예약 없이 이용, 대기 시간 바로 입장, 친목, 친구",,2054,6
19847411,김경자14,맛있어요,2024-01-21,"저녁에 방문, 예약 없이 이용, 대기 시간 바로 입장, 친목, 친구",음식이 맛있어요,971,1
19847411,와츄,,2024-01-20,"점심에 방문, 예약 없이 이용, 대기 시간 바로 입장, 일상, 연인・배우자",양이 많아요,1518,1
19847411,로즈8314,맛있어요,2024-01-15,"저녁에 방문, 예약 없이 이용, 대기 시간 바로 입장, 친목, 지인・동료",음식이 맛있어요,1067,1
19847411,BY8735,좋아요,2024-01-11,"점심에 방문, 예약 없이 이용, 대기 시간 바로 입장",음식이 맛있어요,2557,17
19847411,392****,좋아요,2024-01-08,"점심에 방문, 예약 없이 이용, 대기 시간 바로 입장, 일상, 친구",음식이 맛있어요,2439,2
19847411,동이로,맛있어요. 고기양이 많기보다 김치양이 많아요! 손두부보다 라면이 진짜 맛나요 라면이 진짜 고소해요...! 라면사리 두번 추가 하세요,2023-12-31,"점심에 방문, 예약 없이 이용, 대기 시간 바로 입장, 데이트, 연인・배우자",음식이 맛있어요,945,1
19847411,기여미0802,맛있어요,2023-12-27,"저녁에 방문, 예약 없이 이용, 대기 시간 바로 입장, 데이트, 연인・배우자",단체모임 하기 좋아요,1515,5
19847411,junjin6713,"솔직히 가성비 최악인듯.맛있는지도 모르겄고,(왜 사람들이 많은지 노 이해)제육주문했는데.. 고기는 몇점 없고, 야채만 가득.나중에 볶음 밥 주문 했더니,공기밥, 김가루, 콩나물 주고 3,000원 받는건 정말 너무한듯. 심지어 직접 볶아야 함.두번은 안 갈것 같습니다.",2023-12-23,"저녁에 방문, 예약 없이 이용, 대기 시간 바로 입장, 친목, 친구",,897,1
19847411,tlaqk,좋아요,2023-12-21,"점심에 방문, 예약 없이 이용, 대기 시간 바로 입장, 일상, 친구",음식이 맛있어요,745,1
19847411,장안1동폭격기,사리 추가면 미리 말 좀 해주세요ㅠ 당연히 골라야 하는 건 줄 알았는데 계산할 때 추가 금액 나가네요.. ㅠ,2023-12-15,"점심에 방문, 예약 없이 이용, 대기 시간 바로 입장, 부모님",음식이 맛있어요,996,1
19847411,jhs****,맛있게 잘 먹었어요.흔히하는  두루치기 맛이 아닌 특별함이 있어요.,2023-12-09,"저녁에 방문, 예약 없이 이용, 대기 시간 바로 입장, 가족모임, 아이",음식이 맛있어요,674,1
19847411,새오23,주차: 공영주차장대기: 50여분금요일 저녁시간 5팀보내고 드디어 입성~! 손두부 사리 꼭 추가하세요 맛도리~0~ 양도 많고 고기질이 좋아서 잡내도 없이 맛있게 먹었습니다. 볶음밥시키면 콩나물이랑 김가루가 나와요. 잘게 잘라 직접 볶아먹는건데 진짜 별미👍🏻👍🏻👍🏻,2023-12-01,"저녁에 방문, 예약 없이 이용, 대기 시간 30분 이상, 친목, 친구",음식이 맛있어요,334,1
19847411,김길규빵야,"배고파서 아무데나 들어갔는데 숨은 맛집너낌,,조리된 후에 나와서 먹기 편했구 양도 완전 많아서 먹다 배터져서죽었다깼네욯",2023-11-25,"점심에 방문, 예약 없이 이용, 대기 시간 바로 입장, 친목, 지인・동료",음식이 맛있어요,161,1
19847411,두번째 아이디,공기밥 별도가 좀 아쉬움 맛은 있음,2023-11-23,"점심에 방문, 예약 없이 이용, 대기 시간 바로 입장, 친구",음식이 맛있어요,778,1
19847411,my4****,굿,2023-11-21,저녁에 방문,음식이 맛있어요,839,2
19847411,카롱3,푸짐하고 맛있어요! 여자셋이서 라면사리 두부사리 넣고 먹다가 배가 너무 불러서 밥은 못 볶은게 아쉽네요.근데 매장이 난방을 너무 쎄게 하셔서 좀 덥더라구요,2023-11-21,"저녁에 방문, 예약 없이 이용, 대기 시간 바로 입장, 친목, 친구",음식이 맛있어요,353,1
19847411,다빈맘81,음식이 깔끔하고 친절해요,2023-11-19,"저녁에 방문, 대기 시간 바로 입장, 데이트, 연인・배우자",음식이 맛있어요,347,1
19847411,푸심이,지지난주에 왔다가 넘 맛잇어서 2주만에 또왔습니다 라면사리가 진짜 미쳤어요 넘 맛있어용 고기도 오겹살이라 쫜득쫜득 식감미쳤고 양도 엄청나요!,2023-11-18,"저녁에 방문, 예약 없이 이용, 대기 시간 바로 입장, 데이트, 연인・배우자",친절해요,846,1
1797638043,chl****,옹심이가 진짜 너무 맛있어요 비빔막국수는 약간 싱거운 맛입니다 그냥 무조건 옹심이 시키세요 너무 맛있습니다!!,2025-04-06,"저녁에 방문, 예약 없이 이용, 대기 시간 바로 입장, 데이트, 연인・배우자",매장이 넓어요,994,1
