place_id,nickname,content,date,situations,keywords,review_count,visit_count
1464835021,minisooa0816,사장님도 친절하시고~^^치킨이 바삭바삭 맛있어요❤️❤️,2024-10-11,"저녁에 방문, 예약 없이 이용, 대기 시간 바로 입장, 데이트, 연인・배우자",인테리어가 멋져요,352,1
1464835021,hwangsae18,순살인데 퍽퍽하지 않고 맛있어요 :),2024-10-11,"저녁에 방문, 예약 없이 이용, 대기 시간 바로 입장, 데이트, 연인・배우자",재료가 신선해요,24,1
1464835021,산산산8,신선하고 너무 맛있어요. 양도 많네요. 닭강정 반반입니다~! 추천이요,2024-09-28,"점심에 방문, 예약 없이 이용, 대기 시간 바로 입장, 가족모임, 아이",음식이 맛있어요,23,1
1464835021,미친달,맛있어요 좋아요!!!,2024-09-25,"저녁에 방문, 예약 없이 이용, 대기 시간 바로 입장, 일상, 연인・배우자, 아이",음식이 맛있어요,26,1
1464835021,께라리요,치킨이맛나고 생맥주가 신선해요!튀김 파삭 닭은 촉초옥~ 넘 맛있어유!지나갈때마다 꼭 가보고 싶었는데기대이상이라 좋아요매장도 깔끔하고 사장님도 친절하십니다👍,2024-09-20,"저녁에 방문, 예약 없이 이용, 대기 시간 바로 입장, 데이트, 연인・배우자",음식이 맛있어요,12,1
1464835021,언제나SMILE,너무 맛있고 사장님도 친절하세요~~,2024-09-20,"저녁에 방문, 예약 없이 이용, 대기 시간 바로 입장, 친목, 지인・동료",음식이 맛있어요,110,2
1464835021,elly8874,집 가까워서 종종와서 먹는 치킨집인데너무 맛있어요~~,2024-09-18,"저녁에 방문, 예약 없이 이용, 대기 시간 바로 입장, 일상, 연인・배우자",음식이 맛있어요,7,1
1464835021,맛집도장꺠기,몇번째 오는지~~~ 자곡사거리오면 항상 고민없이 여기와요!!  Tv도 큰거있어서 야구나 축구보기 좋고 매장 엄청 시원하고 쾌적해서 치킨 먹으러오기 딱이에용,2024-09-11,"저녁에 방문, 예약 없이 이용, 대기 시간 바로 입장, 데이트, 연인・배우자",매장이 넓어요,55,1
1464835021,mki****,생맥 최곱니다~,2024-09-10,"밤에 방문, 예약 없이 이용, 대기 시간 바로 입장, 가족모임",친절해요,8,1
1464835021,switchonoff,생맥주 가격이 정말 착해요!!! ㅎㅎ요즘 생맥 3000원인 곳 별로 없는데ㅠㅠ그리고 사장님이 정말 친절하셔서 자주 방문하고 싶습니다!!저희는 가볍게 안주로 똥집튀김 주문했슴돠😆,2024-09-06,"저녁에 방문, 예약 없이 이용, 대기 시간 바로 입장, 데이트, 연인・배우자",친절해요,312,2
1464835021,hb7693,맛있어요 !,2024-09-06,"저녁에 방문, 예약 없이 이용, 대기 시간 바로 입장, 데이트, 연인・배우자",음식이 맛있어요,20,1
1464835021,죠타로우,맛있어요. 매장도 깨끗하고 무엇보다 직원분들도 친절해서 좋습니다.,2024-09-06,"저녁에 방문, 예약 없이 이용, 대기 시간 바로 입장, 데이트, 연인・배우자",음식이 맛있어요,13,2
1464835021,alone9697,맛있고 양 많아요!항상 잘 먹고 있어요 ^^,2024-09-04,"저녁에 방문, 예약 없이 이용, 대기 시간 바로 입장, 데이트, 연인・배우자",음식이 맛있어요,8,1
1464835021,NY8,가게도 깔끔하고 기본안주도 많아서 져아용^_^또 놀러올게욤,2024-08-31,"저녁에 방문, 예약 없이 이용, 대기 시간 바로 입장, 데이트, 연인・배우자",음식이 맛있어요,30,1
1464835021,himch146790,항상 맛있는 치킨을 먹을때 방문해요,2024-08-23,"저녁에 방문, 예약 없이 이용, 대기 시간 바로 입장, 가족모임, 아이",음식이 맛있어요,10,2
1464835021,세곡율현리뷰어,"다리, 윙&봉 메뉴가 있고 튀김옷이 얇아 좋아요. 👍",2024-08-22,"저녁에 방문, 예약 없이 이용, 대기 시간 바로 입장, 데이트, 연인・배우자",음식이 맛있어요,55,1
1464835021,오늘도최선을다하자,국내산 닭강정 맛집 인정 👍,2024-08-22,"저녁에 방문, 예약 없이 이용, 대기 시간 바로 입장, 친목, 연인・배우자",음식이 맛있어요,531,1
1464835021,죠타로우,자주 먹고 있는데 음식맛있고 매장도 깔끔하고 좋습니다.번창 하세요.,2024-08-22,"저녁에 방문, 예약 없이 이용, 대기 시간 바로 입장, 데이트, 연인・배우자",음식이 맛있어요,13,1
1464835021,kwo****,맥주가 시원하고 맛있어요!음식들도 맛있어서 맥주먹기 너무좋아요,2024-08-21,"저녁에 방문, 예약 없이 이용, 대기 시간 바로 입장, 친목, 친구",인테리어가 멋져요,37,2
1464835021,유변의솔직후기,"치킨이 신선하고 맛있습니다꽈리고추 튀김 1,500원에 추가할 수 있는데 이게 별미!! 생맥주는 단돈 3,000원👍🏻👍🏻사장님 엄청 친절하시고 매장도 쾌적해서 자주 오게 되는 맛집입니다",2024-08-16,"저녁에 방문, 예약 없이 이용, 대기 시간 바로 입장, 데이트, 연인・배우자",음식이 맛있어요,4,1
1464835021,나비의꿈2047,치킨을 자주먹진 않지만 오게되면 여기에 옵니다.홀에서 먹으면 너무너무 맛있습니다 ㅎㅎㅎㅎㅎ꼭오셔서 생맥주랑 드셔보시길 추천 드립니다!!,2024-08-13,"밤에 방문, 예약 없이 이용, 대기 시간 바로 입장, 데이트, 연인・배우자",음식이 맛있어요,15,2
1464835021,솜먹은사탕씨,사이드 치즈볼과 감튀 너무 맛있어요요거 먼저 먹다가 치킨 나오자 마자 먹느라 사진이 없네요ㅋㅋ반반치킨으로 다리윙날개로 시켯는데 먹기 편하고 애들도 잘 먹었습니다밥 하기 싫을때 애들랑 저녁으로도 좋고 야식으로도 부담없이 즐길수 있는 메뉴가 많아서 좋아요자주 방문 하겠습니당,2024-08-13,"저녁에 방문, 예약 없이 이용, 대기 시간 바로 입장, 가족모임, 연인・배우자, 아이",음식이 맛있어요,16,1
1464835021,mar****,치킨도 맛있고 매장도 깔끔해요!!,2024-08-13,"저녁에 방문, 예약 없이 이용, 대기 시간 바로 입장, 일상, 친구",매장이 넓어요,2,1
1464835021,언제나SMILE,닭이 정말 신선하고 맛있어요♡ 자곡동 최애 치킨집입니다~~,2024-08-13,"저녁에 방문, 예약 없이 이용, 대기 시간 바로 입장, 친목, 부모님",음식이 맛있어요,110,1
1464835021,tns****,음식이 맛있고 사장님이 친절하셔서 좋아요,2024-08-09,"저녁에 방문, 예약 없이 이용, 대기 시간 바로 입장, 데이트, 연인・배우자",재료가 신선해요,5,1
1464835021,조폭아줌마,치킨 맛있어요  잘먹을께요,2024-08-09,"저녁에 방문, 예약 없이 이용, 대기 시간 바로 입장, 일상",재료가 신선해요,1598,1
1464835021,오호호호호호호호홍,친절해요^^생맥이 3천원 너무좋아요 분위기도좋아요^^,2024-07-25,"저녁에 방문, 예약 없이 이용, 대기 시간 바로 입장, 친목, 친구",음식이 맛있어요,205,1
1464835021,카와이잇츠미,우와 진짜 깔끔하고 맛있고 양까지 많아요!!!!! 재방문의사 1000000%,2024-07-22,"저녁에 방문, 예약 없이 이용, 대기 시간 바로 입장, 친목, 친구",음식이 맛있어요,27,1
1464835021,ll****,양도많고 맛있고  맥주가 여기만큼 시원핸곳 없습니다 강추!!!,2024-07-16,"밤에 방문, 예약 없이 이용, 대기 시간 바로 입장, 일상, 친구",음식이 맛있어요,15,1
1464835021,생각하는빵집,"치맥하기 넘 좋은 동네맛집입니당🍗🍗양배추랑 새우깡도 맘껏 먹을 수 있고 소스도 넘 다양한,,,,사장님 센스쟁이셔용⭐️자주 올게용",2024-07-12,"밤에 방문, 예약 없이 이용, 대기 시간 바로 입장, 기념일, 회식, 가족모임, 부모님",매장이 청결해요,17,1
1464835021,nan****,치킨 맛나요 쏘쏘,2024-07-12,"저녁에 방문, 예약 후 이용, 대기 시간 30분 이내, 일상, 연인・배우자",음식이 맛있어요,938,1
1464835021,칭59,엄청 친절하시고 맛있게 잘먹었습니다~,2024-07-04,"저녁에 방문, 예약 없이 이용, 대기 시간 바로 입장, 데이트, 연인・배우자",음식이 맛있어요,22,1
1464835021,감자망고미,매장에서 먹으니까 따끈따끈 후라이드도 맛있구 닭강정도 명성대로 짱 맛있었습니다!!,2024-07-01,"저녁에 방문, 예약 없이 이용, 대기 시간 바로 입장, 일상, 연인・배우자",음식이 맛있어요,38,1
1464835021,kil****,맛있게 잘 먹었습니다,2024-07-01,"점심에 방문, 예약 없이 이용, 대기 시간 바로 입장, 일상, 연인・배우자",음식이 맛있어요,19,1
1464835021,푸푸5710,매장도 깔끔하고 치킨 너무 맛있어요 ㅎㅎ 사장님도 친절하시고 맛있게 먹었습니다~,2024-06-30,"저녁에 방문, 예약 없이 이용, 대기 시간 바로 입장, 데이트, 연인・배우자",음식이 맛있어요,28,1
1464835021,토토끼야,치킨도 맛있고 친절하고 좋아요^^ 매장도 깔끔해요~~,2024-06-29,"저녁에 방문, 예약 없이 이용, 대기 시간 바로 입장, 일상, 연인・배우자, 아이",친절해요,1375,1
1464835021,뼈장해국,맥시칸 너무맛있어요👍🏼👍🏼💂🏻,2024-06-28,"저녁에 방문, 예약 없이 이용, 대기 시간 바로 입장, 데이트, 연인・배우자",음식이 맛있어요,134,1
1464835021,Miyaa0,너무 맛있어서 허겁지겁 먹다가 이간 알려야해! 라는 생각이 들어 찍은사진입니다! 사장님 너무 친절하시구 맛있어요 단언컨데 치킨은 완벽한 맥주안주입니다!!! 잘먹었어용!!!,2024-06-25,"저녁에 방문, 예약 없이 이용, 대기 시간 바로 입장, 데이트, 연인・배우자",인테리어가 멋져요,271,1
1464835021,boo0429,저의 최애최애 맛집 ㅠㅠㅠ 너무너무 맛있어요! ㅠㅠㅠ 최고😍,2024-06-24,"저녁에 방문, 예약 없이 이용, 대기 시간 바로 입장, 데이트, 연인・배우자",음식이 맛있어요,57,7
1464835021,쌍가마고,사장님이 엄청 친절하셔서 음식 먹기 전부터 맘이 편하게 기분이 좋아지고 당연히 음식은 맛있고 가족 아이랑 오기에도 부담없고 좋습니다.,2024-06-22,"저녁에 방문, 예약 없이 이용, 대기 시간 바로 입장, 일상, 아이",음식이 맛있어요,3,1
1464835021,sje****,자곡동 치킨은 맥시칸!언제 먹어도 진짜 맛있어요!!😋사장님도 친절하시구 매장도 깨끗해서 올 때마다 기분이 좋아요👍🏻👍🏻,2024-06-21,"밤에 방문, 예약 없이 이용, 대기 시간 바로 입장, 데이트, 연인・배우자",음식이 맛있어요,21,1
1464835021,말랑귤222,너무 맛있어요! 양도 진짜 많고 샐러드도 맛있고 단골할겁니다!,2024-06-20,"밤에 방문, 예약 없이 이용, 대기 시간 바로 입장, 친목, 친구",친절해요,25,1
1464835021,boo0429,너무너무 맛있어요! 자곡동 최애 맛집😍,2024-06-17,"저녁에 방문, 예약 없이 이용, 대기 시간 바로 입장, 데이트, 연인・배우자",음식이 맛있어요,57,6
1464835021,himch146790,아주 좋아요. 추천합니다.,2024-06-16,"저녁에 방문, 예약 없이 이용, 대기 시간 바로 입장, 가족모임, 아이",음식이 맛있어요,10,1
1464835021,goo****,연속 이틀 방문입니다! 😍별로였다면 그럴 일 없겠죠..? 기본적으로 맥주도 치킨도 너무 맛있고...!  술 좋아하시는 분들 좋아하실만한 사이드 안주도 너무  충분하고 맛있어서 먹으면서 안먹어본 메뉴들이 궁금해서  다음 방문이 기대됩니다:),2024-06-16,"저녁에 방문, 예약 없이 이용, 대기 시간 바로 입장, 데이트, 연인・배우자",음식이 맛있어요,11,2
1464835021,goo****,"매장이나 화장실 너무 깨끗하고,사장님 친절하세요-메뉴 구성이나 가격도너무 좋아서 소비자 입장에서도 롱런 하셨으면 좋겠어요!내일 또 오려구요🙈",2024-06-15,"저녁에 방문, 예약 없이 이용, 대기 시간 바로 입장, 데이트, 연인・배우자",음식이 맛있어요,11,1
1464835021,god****,직원분들 굉장히 친절하고 치킨이 완전 맛있어요더욱 좋은건 청결함이 끝내줍니다자주 와서 먹는 집이에요굿입니다,2024-06-14,"저녁에 방문, 예약 없이 이용, 대기 시간 바로 입장, 데이트, 연인・배우자",음식이 맛있어요,6,1
1464835021,쇼몽언니20,자주오는단골집떡볶이도맛있어요,2024-06-12,"저녁에 방문, 예약 없이 이용, 대기 시간 바로 입장, 가족모임, 연인・배우자, 아이",음식이 맛있어요,28,5
1464835021,switchonoff,친구 집들이에 멕시카나 닭강정을 사서 갔어요:)중간맛으로 했는데도 저한테는 살짝 맵더라구용~둘이 하나 먹기 딱 좋았어요! (닭강정 반마리 기준),2024-06-11,"저녁에 방문, 예약 없이 이용, 대기 시간 30분 이내, 일상, 혼자",음식이 맛있어요,312,1
1464835021,boo0429,너무너무 맛있는 최애 치킨집!!! 강추해요🤩,2024-06-07,"저녁에 방문, 예약 없이 이용, 대기 시간 바로 입장, 데이트, 연인・배우자",음식이 맛있어요,57,5
1464835021,김수옥8,치킨과 똥칩 맛 굿가격도 합리적이고 맛집맛집맛집!!!,2024-06-05,"저녁에 방문, 예약 없이 이용, 대기 시간 바로 입장, 친목, 연인・배우자",음식이 맛있어요,19,1
1464835021,uiqns2,닭강정 중간맛 매콤하고 맛있어요 닭다리살이라 부드러워요!,2024-05-23,"저녁에 방문, 예약 없이 이용, 대기 시간 바로 입장",음식이 맛있어요,19,1
1464835021,이교준,,2024-05-23,"점심에 방문, 예약 없이 이용, 대기 시간 바로 입장, 친목, 친구, 지인・동료",음식이 맛있어요,6,1
1464835021,kan****,치킨도 너무 맛있고 맥주 3000원 소주 4000원이 너무 마음에 드네요!! 맛도 짱입니다!! 강추드려용!!,2024-05-19,"저녁에 방문, 예약 없이 이용, 대기 시간 바로 입장, 데이트, 연인・배우자",양이 많아요,45,1
1464835021,kwo****,너무 맛있게 잘먹었습니다!,2024-05-18,"저녁에 방문, 예약 없이 이용, 대기 시간 바로 입장, 친목, 나들이",음식이 맛있어요,37,1
1464835021,ora****,"평소에 자주 가는 맛집입니다:)100% 국내산 닭을 사용해서 그런지, 맛도 너무 있어요!!추천합니다 !!!",2024-05-03,"점심에 방문, 예약 없이 이용, 대기 시간 바로 입장, 친목, 지인・동료",음식이 맛있어요,3,1
1464835021,한밤의축제,바로 먹으니 맛있어요 미쳤네요 ㅋㅋㅋ,2024-04-30,"저녁에 방문, 예약 없이 이용, 대기 시간 바로 입장, 친목, 부모님",음식이 맛있어요,4,1
1464835021,boo0429,너무너무 맛있는 우리동네 맛집-!!! 최고에요👍,2024-04-28,"저녁에 방문, 예약 없이 이용, 대기 시간 바로 입장, 데이트, 연인・배우자",음식이 맛있어요,57,4
1464835021,yys****,여기 n번째 방문입니다^^ 자곡점에서 제일 맛있는 치킨하구 양배추까지 환상의 조합입니다 ㅎㅎ사장님도 너무너무 친절하십니다 자곡동살면 무적권 추천입니다!!,2024-04-27,"밤에 방문, 예약 없이 이용, 대기 시간 바로 입장, 데이트, 연인・배우자",음식이 맛있어요,8,1
1464835021,sus****,처음 왔는데 치킨 맛있어요 :) 양배추 샐러드도 리필해서 먹을 수 있어요!,2024-04-26,"저녁에 방문, 예약 없이 이용, 대기 시간 바로 입장, 데이트, 연인・배우자",음식이 맛있어요,70,1
1464835021,ult****,치킨도 맛있고 떡볶이도 맛있어요!!치킨을 순삭해버렸네용 ㅎㅎ,2024-04-23,"점심에 방문, 예약 없이 이용, 대기 시간 바로 입장, 데이트, 친목, 친구, 지인・동료",재료가 신선해요,2,1
1464835021,쇼몽언니20,낮에오니 더좋네요동네단골집^^~,2024-04-22,"점심에 방문, 예약 없이 이용, 대기 시간 바로 입장, 친목, 지인・동료",음식이 맛있어요,28,4
1464835021,도토리5989,드디어 인생닭강정 찾았어요!! 💕💕생맥도 진짜 저렴하고 맛있구 닭강정이 완전 대박이에요ㅜㅠ매콤달달해서 생맥이랑 너무 잘 어울려요!!닭강정은 매운맛으로 먹는게 제일 맛있는데 양배추샐러드 얹어서 먹으면 매운맛이 가라앉아서 맛있게 먹을 수 있어요~,2024-04-18,"저녁에 방문, 예약 없이 이용, 대기 시간 바로 입장, 일상, 연인・배우자",음식이 맛있어요,6,1
1464835021,pagect,아직 초등인 딸이랑 치킨먹으러 왔는데 순살바삭바삭 맛나네요~ 울 딸 맛집 추천해요^^,2024-04-12,"저녁에 방문, 예약 없이 이용, 대기 시간 바로 입장, 나들이, 아이",음식이 맛있어요,9,1
1464835021,인생은 축제,아이와 함께 방문 했는데 아이 간식까지 챙겨주시고 너무 친절하세요^^치킨 너무 맛있습니다:),2024-04-12,"저녁에 방문, 예약 없이 이용, 대기 시간 바로 입장, 가족모임, 아이",음식이 맛있어요,5,1
1464835021,boo0429,파닭 생맥 너무 좋아요!!!! 자곡동 치킨은 멕시칸이에요😍,2024-04-07,"저녁에 방문, 예약 없이 이용, 대기 시간 바로 입장, 데이트, 연인・배우자",음식이 맛있어요,57,3
1464835021,닉네임은뭔,치킨 양이 많고 맛있어요맥시칸 닭강정이 최고입니다,2024-04-02,"저녁에 방문, 예약 없이 이용, 대기 시간 바로 입장, 가족모임, 친척・형제",친절해요,22,1
1464835021,joi****,집앞이라 접근성도 좋구 매장 내부도 청결하고 치킨도 너무맛있네요 ㅎ 생맥주 너무맛있고 가격도 3000원이라 자주올것같아요!,2024-03-31,"저녁에 방문, 예약 없이 이용, 대기 시간 바로 입장, 데이트, 연인・배우자",음식이 맛있어요,19,1
1464835021,쇼몽언니20,친절하고 맛있어서 자주와요,2024-03-31,"저녁에 방문, 예약 없이 이용, 대기 시간 바로 입장, 가족모임, 연인・배우자, 아이",음식이 맛있어요,28,3
1464835021,boo0429,너무너무 맛있는 저의 최애집😍 파닭 드셔보세요! 최고입니다 ㅎㅎ,2024-03-27,"저녁에 방문, 예약 없이 이용, 대기 시간 바로 입장, 데이트, 연인・배우자",음식이 맛있어요,57,2
1464835021,TnnTnn,"생맥3000원 말이되나요?!매콤후라이드 겉바속촉 너무 맛있고, 꽈리고추 튀김이랑 엄청 잘어울려요👍",2024-03-25,"저녁에 방문, 예약 없이 이용, 대기 시간 바로 입장, 일상, 연인・배우자",음식이 맛있어요,38,1
1464835021,아무나하자6,맛있어요 다음에 재방문할게요,2024-03-24,"저녁에 방문, 예약 없이 이용, 대기 시간 바로 입장, 일상, 지인・동료",음식이 맛있어요,37,1
1464835021,쇼몽언니20,4번째방문♡,2024-03-24,"저녁에 방문, 예약 없이 이용, 대기 시간 바로 입장, 친목, 연인・배우자, 아이",음식이 맛있어요,28,2
1464835021,유갱17,오랜만 치맥~~^^여기 치킨뿐만 아니라 떡볶이도 완전 맛집~~아이들 생일잔치도 여기서 했는데 넘 좋았어서자꾸 오고싶네용 ㅎㅎㅎ,2024-03-17,"저녁에 방문, 예약 없이 이용, 대기 시간 바로 입장, 일상, 연인・배우자, 아이",친절해요,48,1
1464835021,gletglet,치킨 맛은 배달로 이미 맛은 인증되어 있었고 캘리 생맥주가 있다는 리뷰 보고 방문했는데 너무 맛있어여!! 사장님도 친절하시고 동네 치킨 맛집이 있어서 행복합니다~~^^,2024-03-15,"저녁에 방문, 예약 없이 이용, 대기 시간 바로 입장, 데이트, 연인・배우자",음식이 맛있어요,47,1
1134244869,요식업계암행어사,부대찌게 맛집입니다.3시마감이구요 가성비 굿 맛집입니다. 주차가 쫌 불편 근처 골목길에....,2025-01-02,"점심에 방문, 예약 없이 이용, 대기 시간 바로 입장, 친목, 친구",음식이 맛있어요,161,1
1134244869,matrix2713,굿,2024-12-03,"점심에 방문, 대기 시간 바로 입장, 일상, 지인・동료",음식이 맛있어요,894,14
1134244869,별남이,ㅇㅇ,2024-11-25,점심에 방문,음식이 맛있어요,2394,1
1134244869,matrix2713,굿,2024-10-21,"점심에 방문, 예약 없이 이용, 대기 시간 바로 입장, 데이트, 연인・배우자",음식이 맛있어요,894,13
1134244869,matrix2713,굿,2024-10-07,"점심에 방문, 예약 후 이용, 대기 시간 10분 이내, 나들이, 친구",음식이 맛있어요,894,12
1134244869,스마일14,,2024-09-19,"점심에 방문, 예약 없이 이용, 대기 시간 바로 입장, 일상, 친구",음식이 맛있어요,617,1
1134244869,matrix2713,굿,2024-09-02,"점심에 방문, 포장·배달 이용, 대기 시간 10분 이내, 데이트, 친구",음식이 맛있어요,894,10
1134244869,matrix2713,굿,2024-08-01,"점심에 방문, 포장·배달 이용, 대기 시간 10분 이내, 나들이, 친구",음식이 맛있어요,894,3
1134244869,youys112411,김치찌개두 맛있고 반찬도 정갈하게잘나와서 맛나게 먹고 왔어요,2024-07-18,"점심에 방문, 예약 없이 이용, 대기 시간 바로 입장, 일상, 혼자",음식이 맛있어요,328,14
1134244869,youys112411,쭈꾸미덮밥이 양도많고 맛은더좋아요^^,2024-07-12,"점심에 방문, 예약 없이 이용, 대기 시간 바로 입장, 일상, 혼자",음식이 맛있어요,328,13
1134244869,푸른하늘32,음식도 맛있고 친절하고 좋습니다,2024-06-27,"점심에 방문, 예약 없이 이용, 대기 시간 바로 입장, 일상, 지인・동료",음식이 맛있어요,196,2
1134244869,푸른하늘32,음식도 맛있고 친절하고 좋습니다,2024-06-20,"점심에 방문, 예약 없이 이용, 대기 시간 바로 입장, 일상, 지인・동료",음식이 맛있어요,196,1
1134244869,맨발,맛있어요,2024-05-30,"점심에 방문, 예약 없이 이용, 대기 시간 바로 입장, 친목, 지인・동료",음식이 맛있어요,267,2
1134244869,돌아방,,2024-05-07,"점심에 방문, 예약 없이 이용, 대기 시간 바로 입장, 일상, 혼자",음식이 맛있어요,159,11
1134244869,맨발,맛있어요,2024-05-03,"점심에 방문, 예약 없이 이용, 대기 시간 바로 입장, 친목, 지인・동료",음식이 맛있어요,267,1
1134244869,jan****,계란말이  맛나요^^,2024-04-22,"점심에 방문, 예약 없이 이용, 대기 시간 바로 입장, 일상, 지인・동료",음식이 맛있어요,93,2
1134244869,youys112411,,2024-04-02,"점심에 방문, 예약 없이 이용, 대기 시간 바로 입장, 일상, 혼자",음식이 맛있어요,328,9
1134244869,jan****,계란말이  맛나요^^,2024-03-14,"점심에 방문, 예약 없이 이용, 대기 시간 바로 입장, 비즈니스, 지인・동료",음식이 맛있어요,93,1
1134244869,jji****,쭈꾸미덥밮 맛있게 먹었어요~미역국도 맛있고~,2023-11-29,"점심에 방문, 예약 없이 이용, 대기 시간 바로 입장, 나들이, 일상, 연인・배우자",음식이 맛있어요,172,1
1134244869,sla****,쭈꾸미가 야들야들하고 불맛이나서 맛있었어요,2023-11-28,"점심에 방문, 예약 없이 이용, 대기 시간 바로 입장, 일상, 친구",친절해요,171,1
1134244869,당신을 응원합니당,굿,2023-09-23,점심에 방문,특별한 메뉴가 있어요,1086,1
1134244869,돌아방,쭈꾸미덮밥 양이 푸짐하고 맛있어요.,2023-09-21,점심에 방문,음식이 맛있어요,159,10
1134244869,천운28,좋아요,2023-06-01,점심에 방문,가성비가 좋아요,1409,1
1134244869,초롱초롱맘,좋아요,2023-04-23,아침에 방문,특별한 날 가기 좋아요,1628,1
1134244869,순돌6,맛나요,2023-04-23,아침에 방문,가성비가 좋아요,1833,1
1134244869,둥이둥이7513,맛있어요,2023-04-04,아침에 방문,친절해요,898,1
1134244869,jun****,오랜만에  먹어본 쭈꾸미 덮밥 너무 맛있어요,2023-03-25,점심에 방문,음식이 맛있어요,593,2
1134244869,jun****,부대찌개  넘 맛있어요,2023-03-24,점심에 방문,가성비가 좋아요,593,1
1134244869,han****,먹고나니 사진을 못찍음계란말이 따듯하니 맛있게 먹었어요,2023-03-13,점심에 방문,매장이 청결해요,638,5
1134244869,소확행317,굿,2023-03-08,아침에 방문,음식이 맛있어요,1020,1
1134244869,꾸울만두,"지인추천으로 가서 김치찌개먹었어요. 밥 다먹고 찌개남은거 아쉬워서 배부른데도 더 가져다먹었어요 직원분들도 다 친절하시고, 반찬도 다 맛있어요!!",2023-02-15,점심에 방문,가성비가 좋아요,43,1
1134244869,yougkr,좋아요,2023-02-02,점심에 방문,,451,2
1134244869,tj6466,,2022-12-14,점심에 방문,음식이 맛있어요,1889,1
1134244869,강민규5,좋아요,2022-11-09,아침에 방문,음식이 맛있어요,128,1
1134244869,꼬장아가,맛있어요,2022-11-07,점심에 방문,음식이 맛있어요,1286,13
1134244869,love,맛있어요♡,2022-11-03,점심에 방문,친절해요,73,1
1134244869,잠만봉이,좋아요,2022-11-01,점심에 방문,,174,2
1134244869,dnfl0618,친절하고 맛밌어요,2022-10-31,점심에 방문,혼밥하기 좋아요,460,2
1134244869,꼬장아가,굿,2022-10-31,점심에 방문,음식이 맛있어요,1286,11
1134244869,파란진실,맛있어요,2022-10-29,저녁에 방문,친절해요,33,1
1134244869,꼬장아가,좋아요,2022-10-26,점심에 방문,음식이 맛있어요,1286,10
