place_id,nickname,content,date,situations,keywords,review_count,visit_count
1739471650,윤뽀또,,2025-04-09,저녁에 방문,단체모임 하기 좋아요,814,1
1739471650,leo121,"최고의 맛집 짠돈, 서비스도 좋고 직원분들도 너무 친절해요! 맛은 당연히 보장됐습니다~ 또 올게요~",2025-04-07,"저녁에 방문, 예약 후 이용, 대기 시간 바로 입장, 데이트, 친목, 연인・배우자",인테리어가 멋져요,4,1
1739471650,나지혜쓰,고기잘먹고갑니다양이 아주 푸짐하네요히히히힣잘먹고갑니당,2025-04-06,"저녁에 방문, 예약 후 이용, 대기 시간 바로 입장, 일상, 혼자",인테리어가 멋져요,244,1
1739471650,yj1****,깔끔하고 마싯어용,2025-04-06,"저녁에 방문, 예약 후 이용, 대기 시간 바로 입장, 데이트, 연인・배우자",음식이 맛있어요,93,1
1739471650,정땡지,삼겹살 맛집이에용!!! 날씨도 선선해지니 야장하기 좋은 가게 입니당ㅎㅎ 노래도 좋고~~ 밑반찬도 좋고~~~ 친목 데이트에 아쥬 딱이에유 또 올게용,2025-04-06,"저녁에 방문, 예약 없이 이용, 대기 시간 바로 입장, 데이트, 연인・배우자",음식이 맛있어요,36,2
1739471650,ralcuu,"고기가 신선하고 정말 맛있어요!! 밑반찬도 푸짐하고, 파채랑 고기 정말 맛있습니다!! 매장도 넓고 쾌적해요!! 계란찜 추가 필수입니다!! 사장님, 직원분 엄청 친절하세요!!",2025-04-05,"저녁에 방문, 예약 없이 이용, 대기 시간 바로 입장, 친목, 친구",음식이 맛있어요,29,1
1739471650,skyholic72,젓갈숙성 고기라 그런지 너무너무 맛있어요!! 직원도 친절하시고 양념도 맛있고 밑반찬이랑 된장찌개까지 너무너무 완벽합니당~~ 남자친구랑 둘이 와서 소맥이랑 고기랑 너무 맛있게 먹고가요!! 노량진 오면 강추드립니당 ㅎㅎ,2025-04-05,"저녁에 방문, 예약 없이 이용, 대기 시간 바로 입장, 데이트, 연인・배우자",음식이 맛있어요,15,1
1739471650,뀨이니뀨,리뷰이벤트는 아니구요 진짜 자주 오는 곳이예요 ..!! 고기가 정말 신선하궁 ㅠㅠ 사장님도 친절하시구요 !!! 노량진 돼지고기는 여기예용 ㅎㅎ,2025-04-05,"저녁에 방문, 예약 없이 이용, 대기 시간 바로 입장, 일상, 연인・배우자",음식이 맛있어요,1299,3
1739471650,챔스가자맨유,양도 너무 많고 너무 맛있어요!!!! 또 올게요🥰🥰🥰,2025-04-05,"저녁에 방문, 예약 없이 이용, 대기 시간 바로 입장, 여행, 친구",음식이 맛있어요,4,1
1739471650,알옹40,오엠지 ㅠ. ㅠ 노량진의 보물 발견..! ㅎㅎㅎ진짜 고기도 두껍고 가성비도 좋은데!! 완전 맛있어요! 밑반찬도 완전 잘나와요💗 강추,2025-04-05,"저녁에 방문, 예약 없이 이용, 대기 시간 바로 입장, 데이트, 연인・배우자",음식이 맛있어요,30,1
1739471650,tls****,계란찜 무조건 시켜드세여 강추 드립니다!!!!!!넘넘 맛있어요 인기 있는 이유를 알 것 같아요 가성비 완전 미쳤고 야외에서 먹고싶었는데 너무 아쉬워요ㅠㅠ̑̈ 석류 칵테일 너무 맛있어요 여성 저격제대로 인 가게!!!,2025-04-04,"저녁에 방문, 예약 없이 이용, 대기 시간 10분 이내, 친목, 친구",야외공간이 멋져요,13,1
1739471650,하현정12,전에 왔을때 고기도 맛있고 친절하셔서 이번에 또 방문하게 되었습니다! 고기도 정말 맛있고 매장도 넓어서 아주 좋아요👍💗,2025-04-04,"저녁에 방문, 예약 없이 이용, 대기 시간 바로 입장, 나들이, 연인・배우자",음식이 맛있어요,8,1
1739471650,myi****,고기 질이 너무 좋고 맛있어요!!!다음에 또 와도 좋을 것 같아요 최고!!,2025-04-04,"저녁에 방문, 예약 없이 이용, 대기 시간 바로 입장, 데이트, 연인・배우자",인테리어가 멋져요,28,1
1739471650,강동30,,2025-04-04,"저녁에 방문, 예약 없이 이용, 대기 시간 바로 입장, 친목, 친구",음식이 맛있어요,12,1
1739471650,또랑트탐방,노량진에 이렇게 맛있는 삼겹살 집이 있는 줄 몰랐습니다. 소스도 너무 맛있고 야채도 너무 신선 한데 조합이 너무 환상적이에요. 무조건 가세요.,2025-04-03,"저녁에 방문, 예약 없이 이용, 대기 시간 바로 입장, 비즈니스, 지인・동료",음식이 맛있어요,5,1
1739471650,구구구579,정말 친절하시구 고기도 맛있어용~,2025-04-03,"저녁에 방문, 예약 없이 이용, 대기 시간 바로 입장, 데이트, 연인・배우자",음식이 맛있어요,27,1
1739471650,행복의인생,밥 맛있고 고기가 가성비 좋고 베부르게 먹었어용,2025-04-02,"저녁에 방문, 예약 없이 이용, 대기 시간 바로 입장, 친목, 친구",음식이 맛있어요,135,1
1739471650,메밀솝,오버안하고 자르는데 손이 아플정도로 두꺼운 삼겹살이에요..🥹진짜 너무 맛있고 짇원분들도 너무 착하십니다.. 재방문의사 🙆‍♀️🙆‍♀️🙆‍♀️🙆‍♀️🙆‍♀️ 번창하세요🤍,2025-03-31,"저녁에 방문, 예약 없이 이용, 대기 시간 바로 입장, 친목, 친구",음식이 맛있어요,7,1
1739471650,고호준89,n회차 방문이에요 친절하고 맛있어요 만족할겁니다,2025-03-31,"저녁에 방문, 예약 없이 이용, 대기 시간 바로 입장, 여행, 혼자",음식이 맛있어요,13,2
1739471650,윤주원11,고기가 엄청 부드럽고 맛있어요,2025-03-31,"아침에 방문, 예약 후 이용, 대기 시간 바로 입장, 친목, 친구",음식이 맛있어요,16,1
1739471650,딸기5667,몇 번째 방문인지 모를 정도로 엄청 많이 온 짠돈😘숯 불이라 그런지 육즙 빵빵하고 더 맛있는…노량진 고기집은 역쉬 짠돈😆😆,2025-03-30,"저녁에 방문, 예약 없이 이용, 대기 시간 바로 입장, 데이트, 연인・배우자",음식이 맛있어요,9,5
1739471650,200억의남자,일단 들어오는데 깨끗해서 좋았고고기맛이 좋아요 다음에 또올게요~,2025-03-30,"저녁에 방문, 예약 없이 이용, 대기 시간 바로 입장, 친목, 친구",인테리어가 멋져요,6,1
1739471650,cit****,,2025-03-29,"저녁에 방문, 친구",음식이 맛있어요,2,1
1739471650,땡글천사70,노량진 첫방문인데 음식 너무 맛있어요! 양도 많구 다음에 또와야징~~,2025-03-29,"저녁에 방문, 예약 없이 이용, 대기 시간 바로 입장, 친목, 친구",음식이 맛있어요,17,1
1739471650,은빛연어1,고기 맛있어요.짠돈 한판 다양하게 나와서 좋네요~♡♡,2025-03-29,"저녁에 방문, 예약 후 이용, 대기 시간 바로 입장, 친목, 친구",음식이 맛있어요,327,1
1739471650,hyojeong96,고기 떼깔이 장난아닙니당!!,2025-03-28,"저녁에 방문, 예약 없이 이용, 대기 시간 30분 이내, 친목, 친구",음식이 맛있어요,6,1
1739471650,하언스톤,"개인적으론 대패가 맛있으며 두번째 방문입니다.고기질, 가성비 모두 챙긴 노량진 맛집!",2025-03-28,"저녁에 방문, 예약 없이 이용, 대기 시간 10분 이내, 가족모임, 연인・배우자",음식이 맛있어요,15,1
1739471650,lhb204350,친구가 추천한 곳이라 왔는데 고기 진짜 맛있고 부드러워요~~!!그리고 반찬도 많이나오구 친구들이랑 모임하기 딱 좋은 거 같아요💚🩷,2025-03-27,"저녁에 방문, 예약 없이 이용, 대기 시간 바로 입장, 친목, 친구",고기 질이 좋아요,6,1
1739471650,슬기813,가격도 괜찮고 맛있어요!! 또 오려구요 :),2025-03-27,"저녁에 방문, 예약 없이 이용, 대기 시간 바로 입장, 친목, 친구",음식이 맛있어요,542,1
1739471650,JMH77,여긴 올 때마다 실패가 없습니다👍👍삼겹살이 진짜 맛있어요짠돈 한판 새로 나와서 먹어봤는데 이것저것 맛볼 수 있어서 좋았고 다 맛있었습니다 ㅎㅎ,2025-03-27,"저녁에 방문, 예약 없이 이용, 대기 시간 바로 입장, 친목, 친구",음식이 맛있어요,35,1
1739471650,정확한해설,얇은대패삼겹살은 금방 양념에 젖어듦으로생고기와 양념고기의 두가지맛을 한꺼번에 즐길수 있는 유쾌함을 준다,2025-03-25,"저녁에 방문, 예약 없이 이용, 대기 시간 바로 입장, 데이트, 연인・배우자",고기 질이 좋아요,43,1
1739471650,eti****,사장님도 친절하시구 고기 맛도 좋아요!! 다음에 또 방문할게요!:),2025-03-25,"저녁에 방문, 예약 없이 이용, 대기 시간 바로 입장, 친목, 친구",음식이 맛있어요,20,1
1739471650,AWHmma,고기가 정말 맛있습니다. 직원분들도 친절 하셔서 잘 먹었습니다.,2025-03-25,"저녁에 방문, 예약 후 이용, 대기 시간 바로 입장, 친목, 회식, 친구, 지인・동료",음식이 맛있어요,13,3
1739471650,김찬미1,직원이 친절하시고 푸짐하니 재료도 신선해요 ^^,2025-03-22,"저녁에 방문, 예약 후 이용, 대기 시간 바로 입장, 데이트, 연인・배우자",음식이 맛있어요,22,1
1739471650,jms6535,고기 양도 많고 질도 너무 좋아요!!,2025-03-22,"저녁에 방문, 예약 없이 이용, 대기 시간 바로 입장, 친목, 친구",음식이 맛있어요,18,1
1739471650,mdk****,음식이 맛있고 직원분들 친절하시네요,2025-03-22,"저녁에 방문, 예약 후 이용, 대기 시간 10분 이내, 가족모임, 연인・배우자",음식이 맛있어요,12,1
1739471650,sunny4879,아이가 맛있게 먹었어요~ 맛있습니다,2025-03-21,"저녁에 방문, 예약 없이 이용, 대기 시간 바로 입장, 여행, 아이",음식이 맛있어요,7,1
1739471650,kdk****,노량진 최애 고깃집 중 한곳 매장은 깔끔하고 테이블 사이 간격에 여유가 있어서 너무 시끄럽지 않게 대화하기에 좋은데요 직원들도 친절해서 편안한 분위기에서 식사 할 수 있어요. 무엇보다 고기가 맛있어서 기다림만 없다면 다음에도 방문할 것 같아요,2025-03-21,"저녁에 방문, 예약 없이 이용, 대기 시간 10분 이내, 친목, 친구",음식이 맛있어요,9,1
1739471650,학교폭파,삼겹살은 짠돈,2025-03-21,"저녁에 방문, 예약 없이 이용, 대기 시간 바로 입장, 친목, 친구",음식이 맛있어요,9,3
1739471650,별사탕1774,매번 올때마다 맛도 좋고 친절하셔서 계속 오게되요!!,2025-03-20,"저녁에 방문, 예약 후 이용, 대기 시간 바로 입장, 데이트, 연인・배우자",음식이 맛있어요,16,1
1739471650,콜프a,대패삼겹살도 목살도 잡내 하나도 안나고 너무 맛있어요!! 노량진 근처 고깃집 갈일있으면 여기올거같아요 너무 맛있게 먹고갑니다!,2025-03-20,"저녁에 방문, 예약 없이 이용, 대기 시간 바로 입장, 친목, 친구",음식이 맛있어요,2,1
1739471650,지나가리라26,"언제나 방문시 즐거운 짠돈입니다.좋은 사람들과 모임, 편한 분위기, 청결한 매장노량진의 축복. 짠돈 고기집인데 장소가 너무 깔끔하고, 고기가 맛 있으니 편하게 방문하여 즐겁게 먹고 갑니다.",2025-03-20,"저녁에 방문, 예약 후 이용, 대기 시간 바로 입장, 친목, 지인・동료",음식이 맛있어요,48,16
1739471650,ㄹㅎㄹ8572,고기 맛있고 쾌적해요! ♡︎,2025-03-18,"저녁에 방문, 예약 후 이용, 대기 시간 바로 입장, 친목, 친구",매장이 넓어요,20,1
1739471650,스론17,,2025-03-18,"저녁에 방문, 예약 후 이용, 대기 시간 바로 입장, 친목, 친구",인테리어가 멋져요,9,1
1739471650,hhr****,진짜 맛있어요 꼭 추천 2명 짠돈한판 완전 가성비 좋아요! 다음 노량진 데이트 무조건 짠돈!!,2025-03-17,"저녁에 방문, 예약 없이 이용, 대기 시간 바로 입장, 데이트, 연인・배우자",음식이 맛있어요,6,1
1739471650,qkd****,맛있습니다 ㅎㅎ,2025-03-17,"저녁에 방문, 예약 없이 이용, 대기 시간 바로 입장, 친목, 친구",음식이 맛있어요,18,2
1739471650,다람다람62,"예약하고왔는데 너무너무 맛있어요!!!소스로 나오는것도 맛있고, 가브리살이 특히 맛있네요!!! 노량진 최고맛집으로 인정!!!",2025-03-16,"저녁에 방문, 예약 후 이용, 대기 시간 바로 입장, 친목, 지인・동료",음식이 맛있어요,51,1
1739471650,yop****,고기 진짜 맛있고 밑반찬 미쳤어요거짓말안하고 20번은 왔는데 여전해...짠돈 나만알고싶은 맛집인데ㅠㅠ 이젠 사랑많이받아 예약필수♡,2025-03-16,"저녁에 방문, 예약 없이 이용, 대기 시간 바로 입장, 친목, 지인・동료",음식이 맛있어요,20,13
1739471650,gra****,여자직원분들이 정말 친절하시고 설명도 잘해주세요 그리고 고기도 두툼하면서  맛있고 특히 파절이가 맛있었습니다! 그리고 킥은 된장찌개에요 안에 내용물이 꽉찼어요 !!!,2025-03-16,"저녁에 방문, 예약 후 이용, 대기 시간 바로 입장, 데이트, 연인・배우자",가성비가 좋아요,16,1
1739471650,htl****,직원분들도 너무 친절하시고맛도 양도 너무 훌륭합니다++,2025-03-15,"저녁에 방문, 예약 없이 이용, 대기 시간 바로 입장, 친목, 친구",음식이 맛있어요,20,1
1739471650,zo****,깔끔하고 좋아요 맛있습니다~~~,2025-03-15,"저녁에 방문, 예약 없이 이용, 대기 시간 바로 입장, 일상, 연인・배우자",음식이 맛있어요,14,1
1739471650,sajoon,젓갈숙성 돼지구이..인테리어도 깨끗하고..정말 맛나고. 친철합니다.^^ 추천합니다 😎 👍,2025-03-15,"저녁에 방문, 예약 없이 이용, 대기 시간 바로 입장, 일상, 연인・배우자",음식이 맛있어요,30,1
1739471650,또또452,리뷰보고 왔는데 친절하고 맛도 넘좋아요,2025-03-14,"저녁에 방문, 예약 없이 이용, 대기 시간 바로 입장, 친목, 연인・배우자",음식이 맛있어요,12,1
1739471650,페이브2,삼겹살이 두툼하고 맛있네요 ^^,2025-03-14,"저녁에 방문, 예약 없이 이용, 대기 시간 바로 입장, 친목, 친구",음식이 맛있어요,1,1
1739471650,eon****,양많고 잡내없이 먹기 좋았어요직원분들 모두 친절하네요,2025-03-14,"저녁에 방문, 예약 없이 이용, 대기 시간 30분 이내, 가족모임, 연인・배우자",양이 많아요,16,1
1739471650,자파니,맛있습니다 너무,2025-03-13,"저녁에 방문, 예약 없이 이용, 대기 시간 바로 입장, 친목, 친구",음식이 맛있어요,2,1
1739471650,윤민아17,기본찬도 너무 잘 나오고 고기도 맛있어요!같이 나오는 파도 너무 달달하고 맛나네요특별 소스와도 조합 최고에용🙏,2025-03-10,"저녁에 방문, 예약 없이 이용, 대기 시간 바로 입장, 데이트, 연인・배우자",음식이 맛있어요,6,1
1739471650,고호준89,삼겹살이랑 대패 삼겹살 추천합니다. 진짜 맛있라요. 서울에서 이런 친절함 찾기어려운거같아요,2025-03-10,"저녁에 방문, 예약 없이 이용, 대기 시간 바로 입장, 일상, 혼자",음식이 맛있어요,13,1
1739471650,min****,고기 질도 좋고 분위기도 좋아요. 밑반찬도 정갈하게 잘나오네요.,2025-03-10,"저녁에 방문, 예약 없이 이용, 대기 시간 바로 입장, 친목, 친구",음식이 맛있어요,11,2
1739471650,딩이327,고기가 좋아요!,2025-03-10,"저녁에 방문, 예약 없이 이용, 대기 시간 바로 입장, 일상, 연인・배우자",음식이 맛있어요,55,1
1739471650,ald****,좋아요,2025-03-09,저녁에 방문,음식이 맛있어요,1076,1
1739471650,jun****,맛있어요!,2025-03-08,"저녁에 방문, 예약 없이 이용, 대기 시간 바로 입장, 일상, 친구",음식이 맛있어요,6,1
1739471650,dayoungii,"삼겹살, 목살 둘 다 맛있고 육즙 장난 아닙니다..🤤 김치말이국수랑 계란찜도 강추!! 직원 분들도 친절하시고, 저희는 운좋게 웨이팅 없이 들어왔는데 저녁 시간대에는 대기하시는 분들도 계시더라고요! 대기하고 먹을만큼 맛집입니다 ㅎㅎ 밑반찬 다 맛있고 저는 특히 계란 노른자 들어간 간장소스? 너무 맛있게 먹었어요🥹🩷 재방문 의사 200%",2025-03-08,"저녁에 방문, 예약 없이 이용, 대기 시간 바로 입장, 데이트, 연인・배우자",음식이 맛있어요,20,1
1739471650,son****,고기 질도 좋고 사이드메뉴도 다 맛있어요특히나 소스에 재워먹는 대패 목살 강력 추천이요,2025-03-08,"저녁에 방문, 예약 후 이용, 대기 시간 바로 입장, 데이트, 연인・배우자",음식이 맛있어요,2032,1
1739471650,ja****,대애박 어느 고기집에서도 꿀리지 않는 구성 같습니다,2025-03-08,"저녁에 방문, 예약 후 이용, 대기 시간 바로 입장, 데이트, 연인・배우자",음식이 맛있어요,328,1
1739471650,영주박주영91,여자친구랑 처음 왔는데 너무 맛있구 고기 질도 좋아요 자주올거예요ㅎㅎ,2025-03-07,"저녁에 방문, 예약 없이 이용, 대기 시간 바로 입장, 데이트, 연인・배우자",고기 질이 좋아요,42,1
1739471650,Jadoo언니,반찬구성 너무 알차구 양도 많고 맛있어요!!! ♥️♥️,2025-03-07,"저녁에 방문, 예약 없이 이용, 대기 시간 바로 입장, 친목, 연인・배우자",음식이 맛있어요,10,1
1739471650,묵찌83,늘 잘 먹고있는 단골집이에요! 요즘 묵사발도 나와서 더 존좋!,2025-03-07,"저녁에 방문, 예약 없이 이용, 대기 시간 바로 입장, 데이트, 연인・배우자",음식이 맛있어요,51,6
1739471650,wjd****,맛있쪄영,2025-03-07,"저녁에 방문, 예약 없이 이용, 대기 시간 바로 입장, 친목, 연인・배우자",음식이 맛있어요,12,1
1739471650,서비스와 맛,,2025-03-06,저녁에 방문,음식이 맛있어요,2060,1
1739471650,kyo****,가성비 갑 맛집이에요. 고기 질도 좋고 너무 맛있어요,2025-03-06,"저녁에 방문, 예약 후 이용, 대기 시간 바로 입장, 데이트, 연인・배우자",음식이 맛있어요,8,2
1739471650,jayeon33,너무너무 맛있어요! 다음에 또 올게요😝,2025-03-06,"저녁에 방문, 예약 없이 이용, 대기 시간 바로 입장, 친목, 지인・동료",음식이 맛있어요,20,1
1739471650,윤지연97,먹다가 급 찍었지만 맛있어용사람도 많고!,2025-03-05,"저녁에 방문, 예약 없이 이용, 대기 시간 바로 입장, 데이트, 연인・배우자",음식이 맛있어요,1175,1
1739471650,크롱13,맛있어서 고기 먹고싶을 때마다 친구들이랑 종종 와요 다음에도 또 올게요 💗,2025-03-05,"저녁에 방문, 예약 없이 이용, 대기 시간 바로 입장, 친목, 친구",음식이 맛있어요,14,1
1739471650,bruce879,"짠돈 한판 시켜서 먹었는데, 종류별로 먹을 수 있고 양도 많이 주셔서 배불리 먹었습니다. 그리고 고기가 젖갈에 숙성되어 있어서 다른 곳에서 먹던 고기보다 훨씬 더 맛있네요. 재방문 의사 1000%입니다.",2025-03-04,"저녁에 방문, 예약 후 이용, 대기 시간 바로 입장, 친목, 지인・동료",음식이 맛있어요,1173,1
1739471650,콩나물쑥쑥,전에도 단점이 없었는데 사장님께서 손님들을 위해 계속 연구해 더더 맛있어졌습니다! 리뉴얼이 되어서 묵사발도 추가되고 파절이는 더 맛있는 소스와 돌아왔네용!! 김치말이국수랑 고기랑 같이 싸먹으면 넘 맛있습니당 항상 친절하게 대해주시고 맛있는 음식을 먹으니 짠돈오면 항상 기분좋아지는것같습니당 감사합니당♥️,2025-03-04,"저녁에 방문, 예약 없이 이용, 대기 시간 바로 입장, 데이트, 연인・배우자",친절해요,67,7
1739471650,지나가리라26,"고기가 너무 맛있어서 흡입하느라, 찍질 못 했네요.그냥 이 곳은 걍 가세요! 주변 기름 튀고, 뻔한 고기 집 말고 바로 여기로요! 매장 깔끔. 사장님 깔끔.분위기 깔끔. 뭐 하나 빠지는 게 없습니다.그냥 노량진에서 고기가 먹고 싶다면  짠돈입니다.",2025-03-03,"저녁에 방문, 예약 후 이용, 대기 시간 바로 입장, 친목, 친구",음식이 맛있어요,48,15
1739471650,kang414a73,맛있어서 또 왔습니다 노래도 음식도 너무 좋아요,2025-03-02,"저녁에 방문, 예약 없이 이용, 대기 시간 바로 입장, 친목, 친구",음식이 맛있어요,10,2
1739471650,kor****,"⭐️⭐️⭐️⭐️⭐️들어갈 때부터 환대로 시작 했으며 나갈 때까지 응대를 너무 잘 해주셨습니다.마지막에 아이에게 젤리를 줘도 되냐고 부모에게 몰래 질문해주시는 경우가 잘 없는데, 너무 배려받는 기분이라 좋았습니다.삼겹살의 고기 부위도 괜찮았습니다. 맛 역시 좋았었습니다. 반찬으로 나온 콩나물 무침, 파무침, 쌈채소 모두 신선하고 좋았습니다.",2025-03-02,"저녁에 방문, 예약 없이 이용, 대기 시간 바로 입장, 나들이, 일상, 연인・배우자, 아이",음식이 맛있어요,13,1
1739471650,100****,고기가 잡내 하나 없고 너무 맛잇네여 노량진오면 다시 와야겠어요,2025-02-28,"저녁에 방문, 예약 후 이용, 대기 시간 바로 입장, 친목, 친구",음식이 맛있어요,4,1
1739471650,clone,"짠돈은 언제나 만족이에요ㅠㅠ 서울에서 고기 먹으려고 하면 180g에 17000원, 18000원 정도 하는데 여기는 그람수 대비 가격도 싸고 심지어 너무 맛있어요!!!!! 지금까지 5~6번 정도 온 것 같은데 처음 왔을 때 너무 맛있어서 주변 친구들에게 소개도 시켜줬어요 ㅎㅎ올 때마다 여자 사장님?이 매우 친절하시고 다른 알바생 분들도 친절하셔서 기분이 좋아요~~~ 다이어트 중이라 술은 못마셨지만 정말 맛있었습니다. 인생 고기집이에요🥺 숙성 고기라 그런지 약간 짠맛이 있어요. 대신 그래서 첫입에 먹을 때 너무 맛있어요! 하나 아쉬운 건 전에 왔을 때는 멜젓...?? 이 있었던 것 같은데 이제는 안 나오나 봐요.. 요건 조금 슬펐습니다ㅠㅠ근처 살았으면 정말 자주 왔을 것 같아요. 번창하세요!!😍",2025-02-28,"저녁에 방문, 예약 없이 이용, 대기 시간 바로 입장, 친목, 친구",음식이 맛있어요,10,3
1739471650,권송송,노량진에서 맛있는 돼지고기 먹으러 친구와 함께 다녀왔어요. 고기 질도 좋고 밑반찬들도 다양해서 고기랑 같이 먹기 좋았어요. 계란찜과 김치말이국수도 최고!! 가게 내부도 깔끔하고 직원분들도 친절하셨습니다ㅎㅎ,2025-02-25,"저녁에 방문, 예약 후 이용, 대기 시간 바로 입장, 친목, 친구",음식이 맛있어요,436,1
1739471650,8j****,"오랜만에 와도 역시,,, 최곱니다!!!🥺🥹😭👍🏻사장님 더 번창하세요!!🫶🏻",2025-02-22,"저녁에 방문, 예약 없이 이용, 대기 시간 30분 이상, 친목, 친구",음식이 맛있어요,12,3
1739471650,편재재,일하시는 분들도 친절하시고 너무 맛있었어요!,2025-02-22,"저녁에 방문, 예약 후 이용, 대기 시간 바로 입장, 데이트, 연인・배우자",음식이 맛있어요,5,1
1739471650,tjdud3873,노량진 고깃집 여기만 와요! 친절하시구 너무 맛있어요🥹🥹 된장찌개랑 계란찜 필수예요 ㅎㅎ,2025-02-20,"저녁에 방문, 예약 없이 이용, 대기 시간 바로 입장, 데이트, 연인・배우자",음식이 맛있어요,35,3
1739471650,로젤라96,반찬이 진짜 진짜 맛있고 고기도 진짜 맛있네요 ! 앞으로 항상 여기서 먹어야겠습니다,2025-02-14,"저녁에 방문, 예약 없이 이용, 대기 시간 바로 입장, 친목, 친구",음식이 맛있어요,8,1
1739471650,eli****,너무 맛있어요!!! 고기 질도 너무 좋아여😭,2025-02-14,"저녁에 방문, 예약 없이 이용, 대기 시간 바로 입장, 데이트, 연인・배우자",음식이 맛있어요,26,1
1739471650,naturesol,진짜 너무 맛있어요 젓갈향이 은은히 나는데 비린게 아니라 이 감칠맛이 진짜 미쳤어요.!!!!!!! 절대 광고 아니에요.고기가 너무 부드럽고 소스 안찍어도 간이 딱맞아요!그리고 쌈장이 좀 맛이 다르던데 너무 맛있어요. 일반 쌈장 맛인데 뭘 더 넣으신건지 더 맛있어요 사고싶어요. 파채도 너무 맛있고 데리야끼노른자도 맛있고ㅜㅜㅜ무조건 또 갈거에요,2025-02-10,"저녁에 방문, 예약 후 이용, 대기 시간 바로 입장, 데이트, 연인・배우자",음식이 맛있어요,66,1
1739471650,마크수빈,저번에 먹어보고 너무 맛있어서 또 왔어요 ..!! 짠돈은 삼겹살이 진쯔 너무 맛있어요 🤩🤩,2025-02-09,"저녁에 방문, 예약 후 이용, 대기 시간 바로 입장, 친목, 친구",친절해요,19,1
1739471650,정땡지,삼겹살 지이이이이인짜 맛있어요!!!술은 시원하게 먹는거 좋아하는데 사장님이 얼음도 아낌없이 주시고 밑반찬도 맛있는데 리필해도 양껏 주십니다 ㅎㅎㅎ기본적으로 고깃집은 고기가 맛있어야하는데 넘 맛있어서 자주 올거같아용!!소주도 냉동고에 보관해서 슬러쉬 만들어주시는데 기가 막힙니다~~왜 이제껏 안 왔는지...또 올게요 사장님 ㅎㅎ,2025-02-08,"저녁에 방문, 예약 후 이용, 대기 시간 바로 입장, 데이트, 연인・배우자",음식이 맛있어요,36,1
