place_id,nickname,content,date,situations,keywords,review_count,visit_count
1054348527,감사한울보,깔끔하고 매장 넓어요. 키오스크 꼭 주문해야해요. 예전엔 맛있었는데.. 동치미도 그렇고 낙지죽도 그렇고 좀 간이 세진 느낌이예요. 예전엔 선택 안해도 안짰는데… 이제는 주문할때 염도를 선택해야할듯합니다.,2024-03-14,"점심에 방문, 예약 없이 이용, 대기 시간 바로 입장, 일상, 혼자",매장이 넓어요,1145,1
1054348527,밤하늘90,굿,2024-03-12,점심에 방문,매장이 넓어요,413,1
1054348527,영혼의자유40,굿,2024-03-11,"점심에 방문, 예약 없이 이용, 대기 시간 바로 입장, 일상, 지인・동료",재료가 신선해요,1467,1
1054348527,쥬몬이의 여기저기,본죽 여러 군데에서 시켜 먹어봤는데 외대 앞 지점이 가장 맛있는 것 같아요이가 아파서 이틀 째 주문해서 먹고 있는데 안질려요 👍🏻,2024-03-09,"점심에 방문, 예약 후 이용, 대기 시간 바로 입장, 일상, 혼자",혼밥하기 좋아요,51,1
1054348527,nskgd,좋아요,2024-03-05,"저녁에 방문, 예약 없이 이용, 대기 시간 바로 입장, 가족모임, 친척・형제",음식이 맛있어요,2587,1
1054348527,맛있는먹방,맛나요,2024-02-25,"저녁에 방문, 포장·배달 이용, 대기 시간 바로 입장, 일상",음식이 맛있어요,1175,2
1054348527,사랑소망엄마,맛있어요,2024-02-24,"저녁에 방문, 예약 후 이용, 대기 시간 바로 입장, 일상, 혼자",음식이 맛있어요,2109,9
1054348527,안녕센터,굿,2024-02-02,점심에 방문,매장이 넓어요,1460,6
1054348527,Gigi83,약먹어야해서 주문하고 잘 픽업해갑니다~,2024-01-15,"점심에 방문, 포장·배달 이용, 대기 시간 30분 이내, 기념일, 혼자",건강한 맛이에요,184,1
1054348527,sun****,아이가 아파서 잘 먹엿어요,2024-01-14,"저녁에 방문, 포장·배달 이용, 대기 시간 바로 입장, 아이",친절해요,117,1
1054348527,xksdl164,너무 맛있어효,2024-01-08,"저녁에 방문, 예약 후 이용, 대기 시간 바로 입장, 일상, 혼자",친절해요,34,1
1054348527,월영화,좋아요,2024-01-04,"점심에 방문, 예약 없이 이용, 대기 시간 바로 입장, 일상, 혼자",음식이 맛있어요,3049,1
1054348527,unf****,,2023-12-27,"점심에 방문, 포장·배달 이용, 대기 시간 2시간 이상, 회식, 반려동물",음식이 맛있어요,3,1
1054348527,맛있는먹방,맛있어요,2023-12-25,"저녁에 방문, 예약 없이 이용, 대기 시간 바로 입장, 친목, 친구",음식이 맛있어요,1175,1
1054348527,lee****,단팥죽 구입했어요. 동지라 남푠이 먹고싶다고.,2023-12-22,"저녁에 방문, 포장·배달 이용, 대기 시간 30분 이내, 일상, 혼자",음식이 맛있어요,1055,1
1054348527,shi****,ㆍ,2023-12-12,점심에 방문,,2121,1
1054348527,우준맘1482,죽과  비빔밥 메뉴가 다양해요.  편하게  혼밥하기도 좋아요.,2023-12-10,"점심에 방문, 예약 없이 이용, 대기 시간 바로 입장, 일상, 부모님",가성비가 좋아요,187,1
1054348527,laargo,굿,2023-12-01,점심에 방문,음식이 맛있어요,1322,13
1054348527,공학돌이,너무 주문 많아서 엄청 기다림밖에선 사람 없어 보이지만배달 주문 계속 몰려있어서인스턴트 죽 만드는것처럼조리하는건 아닌지 걱정됨주방 직원 한명 더 필요한듯,2023-11-19,점심에 방문,,28,1
1054348527,laargo,조아요,2023-11-16,점심에 방문,음식이 맛있어요,1322,12
1054348527,ftiazz,"약간만 갈아달라고 했는데 완전 갈아주셨어요..ㅠ 완전 떡같고, 홍게살도 없어져있고.. 다른 날을 잘 해주셨는데ㅠ 아무리 점심이라 바쁘셔도 요청사항 좀 잘 확인해주세요ㅠ",2023-11-10,점심에 방문,매장이 넓어요,13,5
1054348527,Muuuuung,good,2023-11-07,"점심에 방문, 예약 없이 이용, 대기 시간 바로 입장, 회식, 친구",음식이 맛있어요,826,1
1054348527,꾸룩이1,굿,2023-11-07,"점심에 방문, 포장·배달 이용, 대기 시간 바로 입장, 일상, 혼자",혼밥하기 좋아요,1075,3
1054348527,laargo,굿,2023-11-06,점심에 방문,음식이 맛있어요,1322,11
1054348527,자까26,"포장해서 먹었는데, 오랜만에 본죽 먹으면서 아주 맛있어서 새삼 놀랐어요. 김치낙지죽은 첨인데 무척 놀랄 맛이었어요. 매장이 크고 쾌적해서 나중에 먹으러 가려고요.",2023-11-06,점심에 방문,매장이 넓어요,4,1
1054348527,닉네임383,죽도 맛있는데 제육볶음도 맛나네욤,2023-10-25,점심에 방문,양이 많아요,455,2
1054348527,laargo,굿,2023-10-24,점심에 방문,음식이 맛있어요,1322,10
1054348527,빈이림이맘,굿,2023-10-17,"저녁에 방문, 예약 없이 이용, 대기 시간 바로 입장, 일상, 혼자",매장이 넓어요,487,2
1054348527,러블리보아맘,한식전문가 매장신데도 죽도 잘만드시네요 맛있어요,2023-10-03,저녁에 방문,음식이 맛있어요,27,1
1054348527,sy****,속 편하게 먹을수 있어 좋아요,2023-10-03,점심에 방문,양이 많아요,539,2
1054348527,lmi****,사장님이 정말 친절하세요^^,2023-09-30,점심에 방문,음식이 맛있어요,438,1
1054348527,빈이림이맘,굿,2023-09-25,"저녁에 방문, 예약 없이 이용, 대기 시간 바로 입장, 일상, 혼자",매장이 넓어요,487,1
1054348527,몬들공줌,"19000원짜리 게살죽 진 주문했는데 작은 통 3개에 주는데 양이 너무 적어요. 큰통 하나로 받는게 나을 것 같더라구요.큰통 하나가 훨씬 많은 느낌이고, 통 3개로 받게 만든 건 꼼 수 같아요. ㅜㅜㅜ글구 죽은 건강때문에 먹는 건데 조미료 맛이 너무 나요. 그야말로 건강하게 만들었으면 좋겠어요.",2023-09-21,저녁에 방문,,242,1
1054348527,laargo,굿,2023-09-18,저녁에 방문,음식이 맛있어요,1322,9
1054348527,사랑소망엄마,특별한 메뉴가 많요,2023-09-15,점심에 방문,음식이 맛있어요,2109,8
1054348527,다비드초이스,굿,2023-09-09,아침에 방문,음식이 맛있어요,896,1
1054348527,sh****,-,2023-08-28,"저녁에 방문, 포장·배달 이용, 대기 시간 바로 입장, 가족모임, 아이",음식이 맛있어요,10,1
1054348527,laargo,굿,2023-08-24,저녁에 방문,음식이 맛있어요,1322,8
1054348527,sy****,친절하게 잘해주세요,2023-08-24,점심에 방문,친절해요,539,1
1054348527,Me3,맛있고 좋아요,2023-08-23,저녁에 방문,음식이 맛있어요,1743,1
1054348527,qqs****,본죽 없었음 몸아플때. ..어떻할까..약은 먹어야하고암것두 하기 싫을때..참고맙네요,2023-08-14,점심에 방문,음식이 맛있어요,807,3
1054348527,소금별9489,맛있는 죽!!!,2023-08-11,점심에 방문,음식이 맛있어요,1062,1
1054348527,글리머,건강검진을 위해 흰죽과 다른죽을 구매했는데 맛있네요,2023-08-09,점심에 방문,매장이 청결해요,696,4
1054348527,laargo,굿,2023-08-04,저녁에 방문,음식이 맛있어요,1322,7
1054348527,작은미소20,죽이 생각날때 가는곳낙지김치죽을 먹으러갔다가잦죽으로 바꿨더니 너무 갈아 풀이었네~ ㅠㅠ,2023-07-30,저녁에 방문,혼밥하기 좋아요,1065,2
1054348527,예나모롤,불닭콘치즈비빔밥이 신메뉴로 나와서 궁금해서 함 먹으러 왔어요! 양도 많고 맛있어요,2023-07-26,저녁에 방문,친절해요,27,1
1054348527,laargo,굿,2023-07-24,밤에 방문,음식이 맛있어요,1322,6
1054348527,냥퍼티,가격은 올랐는데 맛은 밍숭맹숭 싱겁운 느낌이였어요,2023-07-17,아침에 방문,매장이 청결해요,103,1
1054348527,Deanna24,친절하고 청결해요. 아플때마다 여기에서만 죽 사먹어요.,2023-07-16,"점심에 방문, 예약 후 이용",음식이 맛있어요,26,1
1054348527,boss7975,굿,2023-07-15,저녁에 방문,혼밥하기 좋아요,2841,5
1054348527,노랑별반짝,보양식으로 포장해왔어요,2023-06-30,아침에 방문,친절해요,197,1
1054348527,KMJ밍구,친절하고 쾌적해요. 맛도 굳.,2023-06-29,아침에 방문,친절해요,48,1
1054348527,laargo,굿,2023-06-15,점심에 방문,음식이 맛있어요,1322,5
1054348527,꼬부기남편,맛있어요,2023-06-12,밤에 방문,음식이 맛있어요,1327,1
1054348527,nlo****,,2023-06-11,점심에 방문,음식이 맛있어요,202,1
1342417361,kuromi,맛있어요,2025-03-28,점심에 방문,재료가 신선해요,834,15
1342417361,mellow,샐러드 파스타 넘 맛있어요. 채소가 가득해서 소화도 잘 됨😋,2025-03-21,"점심에 방문, 예약 없이 이용, 대기 시간 바로 입장, 일상, 혼자",음식이 맛있어요,229,3
1342417361,tae125,양이 진짜진짜 많고 든든한데 빵까지 나와요 😽 매장 분위기도 좋고 음식도 맛있어서 담에 또 방문하고 싶은 집! 담엔 베이글도 먹어보고 싶네요 🤤,2025-03-06,"점심에 방문, 예약 없이 이용, 대기 시간 바로 입장, 일상, 친구",음식이 맛있어요,41,1
1342417361,맛난거만유,"음 기존과 완전히 달라졌어요, 양도 적어지고 맛도 구상도 ㅠㅠ 양파랑 토마토가 들어갔는데 안 어울려요,,진짜 몬플 엄청 좋아했었는데",2025-03-05,"아침에 방문, 예약 없이 이용, 대기 시간 바로 입장, 혼자",혼밥하기 좋아요,7,1
1342417361,에펨졸업자,굿,2025-02-25,점심에 방문,음식이 맛있어요,2022,1
1342417361,kuromi,굿,2025-01-24,점심에 방문,재료가 신선해요,834,14
1342417361,sodlfmadms92,"4300원의 행복..일반그릭요거트도 신맛이 하나도 없이 고소해요! 너무 꾸덕하면 오히려 먹기 불편한데, 크림치즈 제형이라 좋았습니당 ㅎㅎ몬스터그래놀라도 의외로 달달함!",2025-01-21,"점심에 방문, 예약 없이 이용, 대기 시간 바로 입장, 일상, 혼자",재료가 신선해요,638,2
1342417361,eod****,좋아요,2025-01-20,"점심에 방문, 예약 없이 이용, 대기 시간 바로 입장, 데이트, 연인・배우자",음식이 맛있어요,1224,5
1342417361,sldkl,,2025-01-20,점심에 방문,음식이 맛있어요,1525,6
1342417361,sjkks,,2025-01-20,점심에 방문,음식이 맛있어요,1248,8
1342417361,eod****,좋아요,2025-01-15,"점심에 방문, 예약 없이 이용, 대기 시간 바로 입장, 데이트, 연인・배우자",재료가 신선해요,1224,4
1342417361,sldkl,,2025-01-15,점심에 방문,음식이 맛있어요,1525,5
1342417361,sjkks,,2025-01-15,점심에 방문,음식이 맛있어요,1248,7
1342417361,말랑커스타드푸딩,"블루베리그릭베이글에서 두유하드로 변경해서 먹었어요. 그릭요거트라 크림치즈보다 건강한 느낌이었고, 블루베리와 잼도 듬뿍 넣어주셨어요! 다만 베이글 옵션도 선택할 수 있으면 더 좋을 것 같아요~",2025-01-08,"점심에 방문, 예약 없이 이용, 대기 시간 바로 입장, 일상",혼밥하기 좋아요,141,1
1342417361,익명이에요옹,이벤트 귤토핑이어서 좋았어요,2025-01-06,점심에 방문,재료가 신선해요,241,5
1342417361,sodlfmadms92,이거.. 대혜자..애플시나몬 좋아한다면 무조건 추천!!!!,2024-12-20,"저녁에 방문, 예약 없이 이용, 대기 시간 바로 입장, 일상, 혼자",음식이 맛있어요,638,1
1342417361,eod****,좋아요,2024-12-18,"점심에 방문, 예약 없이 이용, 대기 시간 바로 입장, 나들이, 친구",음식이 맛있어요,1224,3
1342417361,sldkl,,2024-12-18,점심에 방문,음식이 맛있어요,1525,4
1342417361,sjkks,,2024-12-18,점심에 방문,음식이 맛있어요,1248,6
1342417361,지구쨘,맛있어요,2024-12-13,"저녁에 방문, 예약 없이 이용, 대기 시간 바로 입장, 친목, 친구",재료가 신선해요,183,1
1342417361,허난설헌3,회기 최애 샐러드/그릭요거트 맛집입니다🤍 바질 드레싱 정말 맛있어요!,2024-12-05,"점심에 방문, 예약 없이 이용, 대기 시간 바로 입장, 친목, 일상, 친구",매장이 넓어요,27,1
1342417361,kuromi,맛있어요,2024-11-29,저녁에 방문,음식이 맛있어요,834,13
1342417361,eod****,좋아요,2024-11-27,"저녁에 방문, 예약 없이 이용, 대기 시간 바로 입장, 데이트, 친구",음식이 맛있어요,1224,2
1342417361,sldkl,,2024-11-27,저녁에 방문,음식이 맛있어요,1525,3
1342417361,sjkks,,2024-11-27,저녁에 방문,음식이 맛있어요,1248,5
1342417361,kuromi,두유 요거트 최고,2024-11-21,점심에 방문,특별한 메뉴가 있어요,834,12
1342417361,el31,너무 좋아하는 곳이에요! 영업시간이 바뀌었거나 휴일일 때는 네이버지도에 꼭 공지해주시면 좋겠어요!!! 왔다가 닫혀있어서 슬프게 돌아갈 때가 몇 번 있었어요🥹요거트 솔드아웃 안 되도록 넉넉히 있었으면 하는 바람도 있습니다😋,2024-11-15,"점심에 방문, 예약 없이 이용, 대기 시간 바로 입장, 일상, 혼자",매장이 청결해요,46,1
1342417361,맛집찾아다니는맛도리,,2024-11-12,점심에 방문,음식이 맛있어요,179,1
1342417361,kuromi,맛있어요,2024-11-11,점심에 방문,특별한 메뉴가 있어요,834,11
1342417361,kuromi,좋아요,2024-11-07,점심에 방문,재료가 신선해요,834,10
1342417361,익명이에요옹,애플크럼블마일드도 맛있어요..♥,2024-11-06,"점심에 방문, 친목",음식이 맛있어요,241,4
1342417361,kuromi,양이 많이 준 거 같아서 슬프네요 ㅠㅠ,2024-10-31,점심에 방문,재료가 신선해요,834,9
1342417361,kuromi,맛있어요,2024-10-24,점심에 방문,음식이 맛있어요,834,8
1342417361,71749,"쓴 야채 없이 시저소스 치킨이랑 밥이랑 후레이크랑, 스파이시 크림 그레싱 추가해서 먹었어요 야채 싫어하고 소스맛으로 먹는 사람들 추천해요",2024-10-15,"점심에 방문, 예약 없이 이용, 대기 시간 바로 입장, 친목, 친구",음식이 맛있어요,634,1
1342417361,익명이에요옹,든든하고 좋아요,2024-10-02,점심에 방문,재료가 신선해요,241,3
1342417361,Ho도리,,2024-09-24,저녁에 방문,음식이 맛있어요,818,5
1342417361,eyc****,든든합니다,2024-09-23,"점심에 방문, 예약 없이 이용, 대기 시간 바로 입장, 일상, 혼자",음식이 맛있어요,1598,3
1342417361,mellow,데리야끼 치킨 포케 너무 맛있음 다음에도 또 사먹으려고요! 😊,2024-09-12,"점심에 방문, 예약 없이 이용, 대기 시간 바로 입장, 일상, 혼자",혼밥하기 좋아요,229,2
1342417361,익명이에요옹,먹고나면산적이되어있지만맛있어요,2024-09-09,점심에 방문,음식이 맛있어요,241,2
1342417361,프로피리,굿굿,2024-08-30,"점심에 방문, 포장·배달 이용, 대기 시간 바로 입장, 데이트, 친구",음식이 맛있어요,1808,1
1342417361,dodojh,굿굿,2024-08-30,"점심에 방문, 예약 없이 이용, 대기 시간 바로 입장, 데이트, 연인・배우자",음식이 맛있어요,1112,1
1342417361,바르뷔스,재료도 신선하고 맛있게 먹었습니다. 드레싱 양이 좀 부족해서 다음 주문시엔 드레싱 추가해야겠어요.,2024-08-12,저녁에 방문,음식이 맛있어요,221,1
1342417361,기대96,것,2024-07-30,"점심에 방문, 예약 없이 이용, 대기 시간 바로 입장, 친목, 친구",음식이 맛있어요,3208,1
1342417361,익명이에요옹,양 짱 많고 지금까지 먹은 샐러드중에 제일 신선했어요 ㅠㅠ ♥,2024-07-11,점심에 방문,음식이 맛있어요,241,1
1342417361,soo****,히트는 그릭요거트!! 하드 or  마일드 선택지가 있음! 그릭요거트 맛 있음!,2024-07-01,"점심에 방문, 예약 없이 이용, 대기 시간 바로 입장, 일상, 혼자",음식이 맛있어요,519,1
1342417361,쥬네,양상추 외에 다른 야채도 더 많이 다양하게 들어가면 더 좋을 것 같아요! 양이 정말 많아서 먹고 나서도 배가 정말 든든해요 ㅋㅋㅋㅋ 곁들여 나오는 호밀빵도 맛있구요 ㅎㅎ 두부단호박샐러드 추천합니다~,2024-06-12,"점심에 방문, 예약 없이 이용, 대기 시간 바로 입장",음식이 맛있어요,313,1
1342417361,돈벌자33,굿,2024-06-10,점심에 방문,가성비가 좋아요,1075,3
1342417361,215857,좋아요,2024-06-03,"점심에 방문, 예약 없이 이용, 대기 시간 바로 입장, 데이트, 연인・배우자",재료가 신선해요,871,3
1342417361,iiiyoullt,야채가 많고 바질파스타짱맛!!!,2024-06-01,"저녁에 방문, 예약 없이 이용, 대기 시간 바로 입장, 데이트, 연인・배우자",음식이 맛있어요,659,2
1342417361,잠꾸핑,,2024-05-30,"점심에 방문, 예약 없이 이용, 대기 시간 바로 입장",재료가 신선해요,825,6
1342417361,1909 써밋 서울,ㅇㅇ,2024-05-27,점심에 방문,,1449,3
1342417361,JM9485,양도 많고 맛있어요,2024-05-25,"점심에 방문, 대기 시간 10분 이내",음식이 맛있어요,333,4
1342417361,곰돌6223,오랜만에 간 학교앞 몬플~ 요거트볼 메뉴가 많아졌더라고요 그릭요거트 먹고 싶어서 갔다가 마일드 선택했는데 너무 마일드한 요거트라 놀랐습니다 ㅋ 요플레 제형이에요 참고하시길!,2024-05-20,"저녁에 방문, 포장·배달 이용, 대기 시간 바로 입장, 일상, 친구",음식이 맛있어요,133,1
1342417361,오롯15,주변에 샐러드파는곳이 잘 없는데몬스터가 있어서 종종 먹을수 있어 좋아요!,2024-05-18,"점심에 방문, 예약 없이 이용, 대기 시간 바로 입장, 친목, 친구",양이 많아요,583,1
1342417361,iiiyoullt,맛잇렁ㅎㅇ,2024-05-15,"저녁에 방문, 예약 없이 이용, 대기 시간 바로 입장, 데이트, 연인・배우자",음식이 맛있어요,659,1
1342417361,215857,좋아요,2024-05-13,"점심에 방문, 예약 없이 이용, 대기 시간 바로 입장, 데이트, 연인・배우자",음식이 맛있어요,871,2
1342417361,JM9485,토핑추가없이도 든든해요..!!,2024-05-10,"점심에 방문, 예약 없이 이용, 대기 시간 바로 입장",음식이 맛있어요,333,3
1342417361,잠꾸핑,,2024-05-08,"점심에 방문, 예약 없이 이용, 대기 시간 10분 이내",음식이 맛있어요,825,5
1342417361,nana7922,굿,2024-05-07,"저녁에 방문, 예약 없이 이용, 대기 시간 바로 입장, 일상, 혼자",,1160,1
1342417361,수영장놀이공원,짱몬플!!!!! 평생 안 사라졌으면,2024-04-29,"저녁에 방문, 예약 없이 이용, 대기 시간 바로 입장, 친목, 친구",음식이 맛있어요,44,2
1342417361,JM9485,든든해요,2024-04-29,"점심에 방문, 예약 없이 이용",재료가 신선해요,333,2
1342417361,무무6015,"샐러드, 요거트 맛집! 양도 많고 맛있어요!!",2024-04-26,"저녁에 방문, 예약 없이 이용, 대기 시간 바로 입장, 일상, 혼자",음식이 맛있어요,40,1
1342417361,JM9485,스페셜그릭 너무 맛있어요,2024-04-22,"점심에 방문, 예약 없이 이용, 대기 시간 바로 입장",특별한 메뉴가 있어요,333,1
1342417361,ru74,두부단호박샐러드+ 오리엔탈드레싱 닭가슴살 추가(+2000)/ 단호박에 중독🤪,2024-04-21,"점심에 방문, 예약 없이 이용, 대기 시간 바로 입장, 일상, 혼자",혼밥하기 좋아요,43,3
1342417361,ru74,연어 샐러드애 단호박 추가. 채소 구성이 더 다양했으면 좋겠다는 아쉬움이 있지만 먹고 가기 편해서 자주 이용해요.,2024-04-20,"점심에 방문, 예약 없이 이용, 대기 시간 바로 입장, 일상, 혼자",혼밥하기 좋아요,43,2
1342417361,수영장놀이공원,몬플은 진짜 사랑입니다,2024-04-11,"저녁에 방문, 예약 없이 이용, 대기 시간 바로 입장, 친목, 친척・형제",음식이 맛있어요,44,1
1342417361,kuromi,좋아요,2024-04-11,"점심에 방문, 예약 없이 이용, 대기 시간 바로 입장, 친목, 친구",재료가 신선해요,834,7
1342417361,배고픈 존재,샐러드만으로도 배 부르기가 가능한 곳.맛 있고 양 많아요. 직원들도 친절해요.,2024-04-11,"점심에 방문, 예약 없이 이용, 대기 시간 바로 입장, 혼자",음식이 맛있어요,35,1
1342417361,eyc****,바질파스타 양도 많고 바질향도 맛도 👍🏻👍🏻🥗,2024-04-09,"점심에 방문, 예약 없이 이용, 대기 시간 바로 입장, 일상, 혼자",음식이 맛있어요,1598,2
1342417361,떡보끼짱723,그릭요거트 샐러드 맛집! 혼밥하기 좋고 양 많아요,2024-04-01,"점심에 방문, 포장·배달 이용, 대기 시간 바로 입장, 일상, 혼자",혼밥하기 좋아요,88,1
1342417361,luculent62,락스 냄새  너무 심해요 3년째,2024-03-29,"점심에 방문, 예약 없이 이용, 대기 시간 바로 입장, 일상, 혼자",음식이 빨리 나와요,793,6
1342417361,kuromi,굿,2024-03-29,"점심에 방문, 예약 없이 이용, 대기 시간 바로 입장, 친목, 친구",재료가 신선해요,834,6
1342417361,kuromi,굿,2024-03-15,"점심에 방문, 예약 없이 이용, 대기 시간 바로 입장, 친목, 친구",재료가 신선해요,834,5
1342417361,chz****,자리많아서혼밥하기좋아용,2024-03-14,점심에 방문,혼밥하기 좋아요,93,1
1342417361,반창고95,좋아요,2024-03-14,점심에 방문,음식이 맛있어요,991,6
1342417361,kuromi,굿,2024-03-08,"점심에 방문, 예약 없이 이용, 대기 시간 바로 입장, 일상, 혼자",음식이 맛있어요,834,4
1342417361,kuromi,굿,2024-03-06,"점심에 방문, 예약 없이 이용, 대기 시간 바로 입장, 일상, 혼자",재료가 신선해요,834,3
1342417361,ru74,유일한 포케 메뉴. 데리아끼 치킨 포케. 먹으면서 이게 뭔지 싶을 정도로 아쉬운 구성이었어요. 차라리 샐러드에 밥 추가하는 걸 추천합니다.,2024-03-03,"저녁에 방문, 예약 없이 이용, 대기 시간 바로 입장, 일상, 혼자",,43,1
1342417361,qkfkrl1227,좋아요,2024-02-26,저녁에 방문,,2093,18
1342417361,lyn****,"제가 너무 좋아하는 곳인데, 기본중의 기본인 몬스터샐러드가 사라져서 힘빠졌네요. 기본을 다른 곳보다 맛있게 먹을 수 있어서 자주오던 단골인데. 다이어터 입장에선 단호박샐러드 있는거..좋지 않거든요. 선택할수가 없어서 슬프네요. 늘 몬스터플레이스에 계란추가해서 깔끔하고 당없이 클린하게 먹을수있어서 좋았는데. 맛은 당연히 있지만...단골로서 아쉬워요 ...바질샐러드파스타 생각날때 아니면 이젠 잘 안올거같네요 ㅎㅎ",2024-02-21,"점심에 방문, 예약 없이 이용, 대기 시간 바로 입장",음식이 맛있어요,53,1
1342417361,jhndn,갤러리에 몬플 샐러드 사진만 오백 장 잇는 사람... 샐러드 다른 곳에서 아무리 먹어 봐도 여기 이기는 곳 없슴 양도 많고 특히 그릭요거트 다른 곳보다 넘 싸고 맛있어요 플레이버 요거트는 묽은 곳이 많은데 여기는 엄청 꾸덕하고 맛도 주기적으로 새롭게 나와서 넘 좋습니다 매번 다른 맛 먹는 재미 ㅎㅎ 저번에는 여기 요거트가 너무 먹고 싶어서 사장님한테 급하게 마감 전에 말씀드렷는데 감사하게도 바로 만들어 주시고 저번에 누락된 토핑 말씀드렸더니 이번에 죄송하다고 두 배로 넣어 주셨어요 엄청나게 친절하심 흘흑 나 죽을 때까지 없어지면 안 됨 동네에 이런 곳이 있다는 게 나에겐 넘모 행운 체다치즈 없어진 건 진짜 아쉽지만 ㅜㅠㅠ 그래도 맛있어서 주기적으로 방문하는 곳입니다 사장님 진짜 적일많버... ♥,2024-02-18,"저녁에 방문, 포장·배달 이용, 대기 시간 바로 입장, 일상, 혼자",친절해요,15,1
1342417361,We럽,무난하고 건강하게 배불리  먹었습니딘아~~,2024-02-16,"저녁에 방문, 예약 없이 이용, 대기 시간 바로 입장, 일상, 혼자",재료가 신선해요,1038,1
1342417361,쥬슐랭,데리야끼치킨포케 양많고 맛있어요!연어샐러드도 맛도리!매장도넓고 친절하셔요 ㅎㅎ,2024-02-14,"저녁에 방문, 예약 없이 이용, 대기 시간 바로 입장, 데이트, 연인・배우자",음식이 맛있어요,768,1
1342417361,eyc****,신선하고 맛있네요.,2024-02-05,"점심에 방문, 예약 없이 이용, 대기 시간 바로 입장, 일상, 혼자",혼밥하기 좋아요,1598,1
1342417361,MY영민,점점 초심잃어가는 몬플 ..가성비 좋았던 곳이 가격은 오르고 양은 적어지고 기본매뉴들이 사라지는게 아쉬워요,2024-02-03,"저녁에 방문, 예약 없이 이용, 대기 시간 바로 입장, 혼자",음식이 맛있어요,30,1
1342417361,새미천재,그릭요거트 맛있어요,2024-01-30,"저녁에 방문, 포장·배달 이용, 대기 시간 바로 입장, 일상, 친구",특별한 메뉴가 있어요,2045,17
1342417361,jplus,외대 뷰 샐러드 집입니다. 리코타치즈 샐러드가 없어ㅠ아쉬웠지만 몬스터샐러드와 단호박샐러드 맛있어요.,2024-01-22,"점심에 방문, 예약 없이 이용, 대기 시간 바로 입장, 친목, 지인・동료",재료가 신선해요,566,1
1342417361,새미천재,그릭 굿,2024-01-13,"저녁에 방문, 포장·배달 이용, 대기 시간 바로 입장, 일상, 혼자",음식이 맛있어요,2045,16
1342417361,mim****,샐러드 먹으러 항상 요기만 와요요요요>< 추천합니다,2024-01-13,"점심에 방문, 예약 없이 이용, 대기 시간 바로 입장, 데이트, 연인・배우자",음식이 맛있어요,87,1
