place_id,nickname,content,date,situations,keywords,review_count,visit_count
1282258672,께께로,소개팅 맛집이지만!! 모임장소로도 좋습니다!!,2024-03-28,"저녁에 방문, 예약 후 이용, 대기 시간 바로 입장, 친목, 친구, 지인・동료",인테리어가 멋져요,621,1
1282258672,꽉이꽉이,,2024-03-28,"점심에 방문, 예약 없이 이용, 대기 시간 바로 입장, 일상, 친구",인테리어가 멋져요,474,1
971501438,골뱅이776,날씨좋을때 야외자리 좋아요,2025-04-04,점심에 방문,음식이 맛있어요,662,1
971501438,Huel,2명이 먹기 적당할지 걱정했는데 충분했습니다. 특히 브런치 먹으면서 마지막에 디저트로 마무리 할 수있어서 더 만족스러웠네요.,2025-04-02,"점심에 방문, 예약 없이 이용, 대기 시간 바로 입장, 친목, 친구",인테리어가 멋져요,16,1
971501438,yooooo6,,2025-03-26,"점심에 방문, 예약 없이 이용, 대기 시간 바로 입장, 친목, 친구",음식이 맛있어요,1305,1
971501438,계탄마리,건강하고 쾌적한 주말 브런치로 딱입니다👍🏻,2025-03-23,"점심에 방문, 예약 없이 이용, 대기 시간 바로 입장, 데이트, 연인・배우자",음식이 맛있어요,17,1
971501438,afp****,"팬케이크 맛있었습니다, 달고나 버터 처음 먹어봤는데 강추입니다~",2025-03-23,"점심에 방문, 예약 없이 이용, 대기 시간 30분 이상, 데이트, 연인・배우자",음식이 맛있어요,3,1
971501438,Aaackkks,맛있어요!,2025-03-23,"점심에 방문, 예약 없이 이용, 대기 시간 10분 이내",음식이 맛있어요,12,1
971501438,Khh,음식은 맛있었는데 서빙하시는 남성분 서비스 태도가 너무 불쾌했습니다 .. 서빙할때 슥 나타나서 실례합니다라는 말도없이 기분나쁜 표정으로 접시를 툭 두고나가는데 너무눈치보였습니다. 같은 테라스를 쓴 옆테이블분들도 물티슈 어디있냐고 물었는데 “옆쪽에”하면서 고개만 끄덕거려 그테이블분들도 황당해하셨습니다;; 음식은 맛있었는데 알바분 태도가 너무 불쾌하여 또가고싶은 마음은 안드네요..,2025-03-22,"점심에 방문, 예약 없이 이용, 대기 시간 바로 입장, 데이트, 연인・배우자",음식이 맛있어요,7,1
971501438,gk****,맛있어뇨!!!! 추천라쥬 이 아침 최고!!,2025-03-14,점심에 방문,양이 많아요,47,1
971501438,히키코모리,"일찍 약속이 있을 때,브런치하러 가기 너무 좋아요.음식도 하나같이 다 맛있어요.",2025-02-27,"점심에 방문, 예약 후 이용, 대기 시간 바로 입장, 친목, 친구, 지인・동료",친절해요,254,1
971501438,gli****,일요일 아침 일찍 왔는데 조용하게 맛있는 브런치 먹을 수 있어서 좋았습니다. 다음에 또 와서 다른 메뉴들도 먹어보고 싶어요.,2025-02-23,"점심에 방문, 예약 없이 이용, 대기 시간 바로 입장, 데이트, 연인・배우자",뷰가 좋아요,20,1
971501438,청춘별곡77,"3년전 아내와 결혼 하기 이전에 방문 했었는데너무 좋았던 기억이 있어서 아기와 다시 방문 했습니다.여전히 그때의 좋았던 매장 분위기, 맛있는 음식 최고 였습니다.",2025-02-16,"아침에 방문, 예약 없이 이용, 대기 시간 바로 입장, 가족모임, 연인・배우자, 아이",음식이 맛있어요,7,1
971501438,청이3816,분위기 너무 좋고 조용하고 맛있어요!!!,2025-02-01,"점심에 방문, 예약 없이 이용, 대기 시간 바로 입장, 데이트, 연인・배우자",아늑해요,30,1
971501438,달려라쿠99,맛있어요,2025-02-01,"아침에 방문, 예약 없이 이용, 대기 시간 바로 입장, 일상, 연인・배우자",뷰가 좋아요,27,1
971501438,Zily,맛있어용~,2025-01-31,"점심에 방문, 예약 없이 이용, 대기 시간 바로 입장, 데이트, 연인・배우자",재료가 신선해요,151,1
971501438,강아지풀19,엔쵸비파스타랑 프렌치토스트 먹었는데 둘다 넘 맛있어요. 프렌치토스트 담백한데 계속 끌리는맛.. 엔쵸비파스타도 다른데보다 훨 맛있어용 매장 뷰도 좋고 대만족!,2025-01-27,"점심에 방문, 예약 없이 이용, 대기 시간 바로 입장, 데이트, 연인・배우자",음식이 맛있어요,81,1
971501438,viv****,,2025-01-19,"아침에 방문, 대기 시간 바로 입장, 친목, 친구",음식이 맛있어요,3,1
971501438,au****,맛있고 좋아요! 다들 꼭 오세요,2025-01-17,"점심에 방문, 예약 없이 이용, 대기 시간 바로 입장, 친목, 지인・동료",음식이 맛있어요,16,1
971501438,영혼의자유40,굿,2024-12-31,"점심에 방문, 예약 없이 이용, 대기 시간 바로 입장, 데이트, 친목, 친구",재료가 신선해요,1467,1
971501438,여행이좋아요,3단 플레이트로 먹었는데 맛있었어요! 2인에서 먹기 양이 많긴 한데 세트가 저렴해서 다양하게 먹기 좋아요! 저는 크레페랑 스튜가 제일 인상적이었어요:)제 블로그에 자세하게 작성해뒀어요😃,2024-11-24,"점심에 방문, 예약 없이 이용, 대기 시간 30분 이내, 친목, 친구",재료가 신선해요,66,1
971501438,sooyoni,두번째 방문! 음식이 너무 다 맛있어요 특히 무화과 프렌치 토스트 굿!,2024-11-13,"점심에 방문, 예약 없이 이용, 대기 시간 바로 입장, 친목, 친구",뷰가 좋아요,29,2
971501438,대장이맘504,"여기 분위기 너무너무 좋고 다 맛있어요. 너무 너무 야채도 신선 하구요. 친구들이랑 또 올 거예요. 인테리어 너무 멋있어요. 여기 있는 메뉴 다 먹어 봤는데, 너무 너무 좋아요.",2024-11-13,"점심에 방문, 예약 없이 이용, 대기 시간 바로 입장, 친목, 지인・동료",음식이 맛있어요,10,1
971501438,Moment Catcher,날씨가 좋아 테라스에서 브런치 ^^,2024-11-09,점심에 방문,특별한 메뉴가 있어요,558,1
971501438,Jiwiii,,2024-11-06,"점심에 방문, 예약 없이 이용, 대기 시간 바로 입장, 친구",음식이 맛있어요,326,1
971501438,ran2813,조아요,2024-11-01,"점심에 방문, 예약 없이 이용, 대기 시간 바로 입장, 나들이, 연인・배우자",음식이 맛있어요,553,1
971501438,Over the Rainbow14,세트주문. 메뉴 하나하나 다 정성이 있어요. 많이 달지 않고 재료가 신선해요. 메뉴마다 향부터 식감까지 풍부해요.오랜만에 다이어트 하는 와이프에게 합격을 받았답니다.분위기 좋고 나들이 기분에 직원분도 친절하셔서 하루의 시작으로는 딱입니다.~^^,2024-11-01,"점심에 방문, 예약 없이 이용, 대기 시간 바로 입장, 데이트, 연인・배우자",음식이 맛있어요,28,1
971501438,aaa27,,2024-10-27,"점심에 방문, 예약 없이 이용, 대기 시간 바로 입장, 친목, 친구",음식이 맛있어요,82,1
971501438,둔스목도리,이쁘고맛있고공간이너뮤좋아요일찍여는것도엄청장점,2024-10-25,"점심에 방문, 예약 없이 이용, 대기 시간 바로 입장, 친목, 나들이, 친구",음식이 맛있어요,50,1
971501438,카르페디엠070,나무가 보여서 좋아요,2024-10-18,"점심에 방문, 예약 없이 이용, 대기 시간 바로 입장, 친목, 친구",음식이 맛있어요,480,1
971501438,강민정97,비포선라이즈 크레페 부드럽고 촉촉하고 맛있어요! 보늬밤 몽블랑 팬케이크도 달달하고 가을맛나고 넘 맛있었어요🍂🫠,2024-10-18,"점심에 방문, 예약 없이 이용, 대기 시간 바로 입장, 친목, 친구",음식이 맛있어요,19,1
971501438,겸손하게,,2024-10-12,"점심에 방문, 예약 없이 이용, 대기 시간 바로 입장, 데이트",음식이 맛있어요,21,1
971501438,juuy,테라스에서 브런치 먹을 수 있어서 너무 좋아요! 음식도 다 맛있고 빨리 나오고 다음에 또 방문할게요 🙂,2024-10-11,점심에 방문,음식이 맛있어요,8,1
971501438,겸소니,테라스가 있어서 시원한 날 방문했어요!! 음식들이 다 맛있고 사진 찍기 비주얼이 최고예요👍👍 추워지기 전에 한번 더 와야겠어요!! 모임하기 좋아요!!,2024-10-07,"점심에 방문, 예약 없이 이용, 대기 시간 바로 입장, 데이트, 연인・배우자",음식이 맛있어요,69,1
971501438,JJ5915,서울숲 올때마다 오는 곳이에요. 다른 매장보다 일찍 열어서 여유롭게 브런치하기 좋아요😊 토마토 스튜는 저희 가족 원픽ㅎㅎ,2024-10-06,"아침에 방문, 예약 없이 이용, 대기 시간 바로 입장, 나들이, 부모님",음식이 맛있어요,17,1
971501438,골방스튜디오,음식도 맛있고 테라스 분위기 죽여줘요👍,2024-10-04,"점심에 방문, 예약 없이 이용, 대기 시간 바로 입장, 친목, 친구",야외공간이 멋져요,103,1
971501438,jian7771,인기있는 메뉴로 시켰는데 성공적이에요~파스타는 마늘맛이 좀 강해요. 뇨끼는 살짝 매콤해서 더 맛있었어요. 저희 입맛엔 팬케이크가 제일 맛있었어요 :),2024-10-03,"점심에 방문, 예약 없이 이용, 대기 시간 바로 입장, 데이트, 일상, 연인・배우자, 아이",매장이 청결해요,6,1
971501438,doc****,"음식도 괜찮고, 테라스 자리가 있어서 분위기가 아주 좋아요",2024-10-03,"점심에 방문, 예약 없이 이용, 대기 시간 바로 입장, 일상, 연인・배우자",친절해요,2,1
971501438,eeeevvv,성수동에 일찍 여는 브런치집이 없는데 빙봉은 일찍열어서 좋아요!!서울숲뷰라 분위기도 좋고 메뉴도 다양해요ㅎㅎ,2024-10-01,"점심에 방문, 예약 없이 이용, 대기 시간 바로 입장, 데이트, 연인・배우자",메뉴 구성이 알차요,29,1
971501438,현찌86,야외공간이 예쁘고 음식이 넘 맛나요❣️,2024-09-30,"점심에 방문, 예약 없이 이용, 대기 시간 바로 입장, 친목, 친구",음식이 맛있어요,8,1
971501438,세잎네잎86,서울숲 뷰를 보며 버터팬케이크 브런치 먹는데 넘 힐링되네요~~ 테라스 자리 너무 추천입니당!!:),2024-09-30,"점심에 방문, 예약 없이 이용, 대기 시간 바로 입장, 나들이, 혼자",음식이 맛있어요,28,1
971501438,JJJ9280,서울숲뷰도 음식도 너무 좋아요♡,2024-09-25,"점심에 방문, 예약 없이 이용, 대기 시간 바로 입장, 친목, 친구",음식이 맛있어요,36,1
971501438,Icesoo,이름부터 귀여웠던 뇨끼뽀끼🧡 진짜 맛있었어요!! 떡볶이도 먹고 싶고 양식도 먹고 싶었는데 동시에 먹을 수 있는 메뉴가 있다니🫢 떡이랑 뇨끼만 있으면 탄수화물만 있어서 아쉬울 뻔했는데 소시지까지 있어서 먹기 너무 좋았어요! 달고나버터 팬케이크도 엄청 부드럽고 버터에 달고나가 조금씩 있어서 달달했어요💛 무엇보다 서울숲 뷰였고 선선해진 가을 날씨에 테라스에 앉아서 먹으니 너무 힐링이었습니다!!🌱,2024-09-23,"점심에 방문, 예약 없이 이용, 대기 시간 바로 입장, 친목, 나들이, 친구",뷰가 좋아요,110,1
971501438,jack8900,서울숲에서 가까운 브런치가게에요. 브런치 테이스팅 메뉴를 주문했는데 다양한 메뉴를 조금씩 맛볼 수 있어서 좋았어요. 특히 토마토 비프 수프가 독특하면서 맛있었고 다른 메뉴도 깔끔하고 맛도 좋았어요.,2024-09-22,"점심에 방문, 예약 없이 이용, 대기 시간 바로 입장, 데이트, 연인・배우자",음식이 맛있어요,194,1
971501438,고옴99,"테라스랑 실내 웨이팅을 따로 받는 점이 신기했어요.근데 다시 방문하고 싶을 정도로 음식이 특색 있고 맛있었어요!뇨끼뽀끼(19,000)는 로제떡볶이랑 뇨끼를 섞어 놓은 건데, 양이 엄청 많고 맛있었어요. 뇨끼는 으깬 감자의 질감이 좀 씹히는 쫄깃한 뇨끼였는데 떡볶이 소스랑 신기하게 잘 어울렸구요, 떡볶이도 쫄깃하니 맛있었습니다.바질페스토 쉬림프 파스타(21,000)가 엄청 맛있었어요. 소스가 약간 바질크림수프먹는 느낌? 의 꾸덕함... 지인한 크림맛에 적당한 바질향이 조화롭더군요. 면발은 좀 많이 익혀서 뚝뚝 끊기지만 그만큼 소스가 잘 배어 있었습니다. 간이 좀 센 편이니 참고! 웨이팅할 가치가 있네요. 추천!",2024-09-22,"점심에 방문, 예약 없이 이용, 대기 시간 10분 이내",음식이 맛있어요,329,1
971501438,minamlks,서울숲에서 아침 브런치를 느낌있게.잘 즐겻습니다,2024-09-22,"점심에 방문, 예약 없이 이용, 대기 시간 바로 입장, 데이트, 연인・배우자",음식이 맛있어요,9,1
971501438,은별대디,브런치먹으러 왔는데 맛있고 매장분위기도 좋아요~,2024-09-21,"점심에 방문, 예약 없이 이용, 대기 시간 바로 입장, 데이트, 연인・배우자, 아이",음식이 맛있어요,62,1
971501438,zz8888,동네에 사는데 브런치는 역시 빙봉이에용특히 프렌치토스트정식 추천해요!,2024-09-18,"점심에 방문, 예약 없이 이용, 대기 시간 바로 입장, 데이트, 연인・배우자",음식이 맛있어요,17,1
971501438,사과72,,2024-09-16,"점심에 방문, 예약 없이 이용, 대기 시간 바로 입장",매장이 청결해요,681,1
971501438,천둥6,멋진 풍경을 보며  가족과 여유롭게 즐기는 일요일 브런치🥰  메뉴 하나하나 다 맛있어요. 바질페스토 쉬림프 파스타에 들어가는 새우도 탱글탱글한 식감이 느껴지네요. 건강한 맛이에요,2024-09-08,"점심에 방문, 예약 없이 이용, 대기 시간 바로 입장, 일상, 아이",음식이 맛있어요,37,1
971501438,꼬양이27,뷰가 좋고 편안한 분위기에 메뉴가 빨리 나오고 맛있어요 !!,2024-08-23,"점심에 방문, 예약 없이 이용, 대기 시간 바로 입장, 데이트, 연인・배우자",음식이 맛있어요,13,1
971501438,letssue9,음식은 맛있는데 비싸요. 남자분한텐 양이작아서 한그릇 더 시켰어요. ㅠㅠ,2024-08-21,점심에 방문,친절해요,579,1
971501438,소리스힐튼,친구랑 왔는데 너무 맛있어요~뷰도너무이쁩니다:)날이 좀 시원했으면 야외에서 먹었을텐데 아쉬워요앤쵸비 파스타 맛있어용~💛,2024-08-16,"점심에 방문, 예약 없이 이용, 대기 시간 바로 입장, 일상, 친구",음식이 맛있어요,52,1
971501438,yoo****,,2024-08-16,"점심에 방문, 대기 시간 바로 입장, 친목, 연인・배우자",음식이 맛있어요,4,1
971501438,sooyoni,성수 온김에 브런치 즐기고 가요 복숭아 크림치즈 조합 너무좋아요,2024-08-14,"점심에 방문, 예약 없이 이용, 대기 시간 바로 입장, 데이트, 연인・배우자",음식이 맛있어요,29,1
971501438,꽃무늬지춘이,맛있어요,2024-08-14,점심에 방문,음식이 맛있어요,791,2
971501438,배로나,맛있어요,2024-08-10,"점심에 방문, 예약 없이 이용, 대기 시간 바로 입장, 친목, 친구",음식이 맛있어요,913,1
971501438,met****,,2024-08-09,"점심에 방문, 예약 없이 이용, 대기 시간 바로 입장, 일상, 친구",재료가 신선해요,2,1
971501438,졍59,네번째 방문하는 곳! 음식도 맛있고 예뻐요 :)서울숲 브런치집을 찾는다면 추천입니다!,2024-08-06,"아침에 방문, 예약 없이 이용, 대기 시간 바로 입장, 친목, 친구",차분한 분위기에요,12,2
971501438,가끔다는리뷰어,"멋진 분위기, 맛있고 특별한 메뉴재방문의사있어요! 커피는 아이스가 산미가 더 잘 느껴져서 좋았습니다:)",2024-07-20,"점심에 방문, 예약 없이 이용, 대기 시간 바로 입장, 일상, 부모님, 친척・형제",특별한 메뉴가 있어요,25,1
971501438,떰현,,2024-07-15,점심에 방문,음식이 맛있어요,1199,1
971501438,dik****,에그베네딕트 바질페스토 맛있어요 일요일 오전 11시30분에 왔는데 웨이팅 없이 바로 입징했어요,2024-07-14,"점심에 방문, 예약 없이 이용, 대기 시간 바로 입장, 친목, 친구",음식이 맛있어요,45,1
971501438,simz45,일찍 문여는 곳이라 너무 좋았고음식도 맛있고 인테리어도 너무 힐링되서 좋았어요아이를 위한 의자 식기도 준비 되어 있어서 아이와 오기 좋은 곳이예요,2024-07-13,"아침에 방문, 예약 없이 이용, 대기 시간 바로 입장, 일상, 연인・배우자, 아이",음식이 맛있어요,26,1
971501438,별명이52,양이 좀 아쉽지만 오일 파스타 맛있어요,2024-07-08,"점심에 방문, 예약 없이 이용, 대기 시간 바로 입장, 일상, 지인・동료",뷰가 좋아요,6,1
971501438,len****,음식이 너무 맛있고 분위기도 너무 좋았어요! 친구들이랑 만나서 오랜만에 좋은 시간 보내고 가네요~^^,2024-07-01,"점심에 방문, 예약 없이 이용, 대기 시간 바로 입장, 친목, 친구",음식이 맛있어요,28,1
971501438,good place,맛있어요~~,2024-06-27,"점심에 방문, 예약 없이 이용, 대기 시간 바로 입장, 친목, 지인・동료",음식이 맛있어요,340,1
971501438,맥주먹고,맛있고 분위기 좋네요,2024-06-22,"점심에 방문, 예약 없이 이용, 대기 시간 바로 입장, 나들이, 연인・배우자",음식이 맛있어요,48,1
971501438,hyeriiii87,친구들이랑 오랜만에 왔는데 너무 맛있고 참 더운데  쾌적해서 좋네요. 잘먹었습니다~~,2024-06-21,"점심에 방문, 예약 없이 이용, 대기 시간 바로 입장, 친목, 친구",음식이 맛있어요,74,1
971501438,kmh4270,지인들과 성수동 모임왔는데너무 뷰가 좋네요.테라스 더울줄 알았는데 시원하네요~~,2024-06-18,"점심에 방문, 예약 없이 이용, 대기 시간 바로 입장, 친목, 친구",건강한 맛이에요,72,1
971501438,y_s****,뷰가 너무 예쁘구요... 음식 다 너무 맛있구.. 재방문하고싶어요!,2024-06-10,"점심에 방문, 예약 없이 이용, 대기 시간 바로 입장, 친목, 일상, 친구",음식이 맛있어요,14,1
971501438,나뿌꾸,"사진찍기 예쁘긴한데 맛은,, 별로예요물병을 따로 제공해주지 않아 물을 계속 떠다 마셔야하고 피클같은 곁들임 없습니다음식은 금방 나오는 편이고 프렌치토스트 시럽 생크림 리필 안돼요맛보단 예뻐서 가는곳",2024-06-08,"점심에 방문, 예약 없이 이용, 대기 시간 30분 이내",,223,1
971501438,01****,비오는날  조용하게 브런치 먹었네요 숲뷰가 너무좋고 음식도 넘 맛있어요 바질쉬림프파스타  넘맛나요,2024-06-08,"점심에 방문, 예약 없이 이용, 대기 시간 바로 입장, 친목, 일상, 친구",음식이 맛있어요,6,1
971501438,coo****,음식이 맛있고 가게가 이뻐요,2024-06-06,"점심에 방문, 예약 후 이용, 대기 시간 30분 이내, 나들이, 연인・배우자",음식이 맛있어요,39,1
971501438,동그랑땡굴,아기 의자가 있어서 좋았어요. 음식 전부 다 맛있고 분위기도 좋았습니다!,2024-06-06,"점심에 방문, 예약 없이 이용, 대기 시간 30분 이내, 데이트, 연인・배우자, 아이",음식이 맛있어요,611,1
971501438,소피자인,5년전쯤이었나..친구랑 에그베네딕트를 정말 맛있게 먹었어서 그 추억에 다시 방문했으나 음식의 모습도 많이 바뀌도 맛도 제가 생각한 맛이 아니었네요. 유명해진 탓인지 깐깐한 규칙?도 아쉽구요. 두팀밖에 없는데 음식 나오기 전에 자리를 옮기려하니  앉아서 테이블 정했으면 옮기면 안된다는 캍같은  말에 다시 오고싶진 않더라구요. 사진은 예쁘게 나와요~ 야외테라스쪽은 아침에 조용하고 좋습니다. 실외기?소리 같은거 빼면요!,2024-06-06,"점심에 방문, 예약 없이 이용, 대기 시간 바로 입장, 친목, 친구",야외공간이 멋져요,48,1
971501438,에너지혜,크레페 프렌치토스트 조합 너무 맛잇어요~!,2024-06-02,"아침에 방문, 예약 없이 이용, 대기 시간 바로 입장, 친목, 친구",재료가 신선해요,155,1
971501438,옥이9025,음식도 빨리나오고 친절하셔서 다음에 친구와 또 오고 싶어요,2024-05-29,점심에 방문,야외공간이 멋져요,1838,1
971501438,찐성수 주민 내 돈 내산 추천 맛집,"예전에 경리단길에 가본 적이 있고, 서울숲은 두번째 방문.1인 1메뉴 필수.서울숲의 브런치 가게들의 맛은 평준화 되었다고 봅니다. 이곳은 테라스 자리에서의 식사와 아침 일찍 오픈하는 두 가지 옵션을 고려한다면 선택하기에 좋은 곳입니다.브런치 테이스팅 메뉴.비포 선라이즈 크레페, 메밀전병 위에 두툼한 베이컨이 올라갔어요. 잠봉 에그 베네딕트, 머핀위의 잠봉햄은 짜지 않고 부들부들하네요. 수란도 굿. 딸기&생크림 프렌치 토스트,  싱싱한 딸기와 달콤한 토스트라 당충전이 되네요.  토마토 미트볼 스튜, 향신료가 강한 묵직한 스튜입니다. 저희는 음료를 레몬진저티, 로즈레모네이드티로 바꾸었습니다.엔쵸비 오일 파스타.루꼴라, 엔쵸비, 페페론치노 등이 들어 있는데요,  간이 약간 짜게 느껴졌어요.",2024-05-24,"점심에 방문, 예약 없이 이용, 대기 시간 바로 입장, 일상, 기타",음식이 맛있어요,460,1
971501438,qufekfdlchlrh,,2024-05-18,"점심에 방문, 예약 없이 이용, 대기 시간 바로 입장, 데이트, 친구",뷰가 좋아요,11,1
971501438,lulu310603,,2024-05-15,"아침에 방문, 예약 없이 이용, 대기 시간 바로 입장, 친목",재료가 신선해요,7,1
971501438,pineal,,2024-05-15,"아침에 방문, 예약 없이 이용, 대기 시간 바로 입장, 친목, 친구",뷰가 좋아요,4,1
971501438,GOLDFISH56,날씨가 너무 좋은 요즘에 가기 딱 좋은 곳 입니다!!,2024-05-12,"점심에 방문, 예약 후 이용, 대기 시간 10분 이내, 친목, 친구",친절해요,17,1
971501438,1manbo,서울숲 테라스 브런치집 분위기 너무 좋아요 ㅎㅎ나중에 햇살 좋늘 때 또 가야겠네요,2024-05-11,"점심에 방문, 예약 없이 이용, 대기 시간 바로 입장, 데이트, 일상, 비즈니스, 연인・배우자, 아이, 기타",음식이 맛있어요,190,1
971501438,daehee98,음식도 신선하고 맛잇어요^^,2024-05-07,"점심에 방문, 예약 없이 이용, 대기 시간 바로 입장, 데이트, 연인・배우자",음식이 맛있어요,2,1
971501438,다음맛집리뷰,뷰가 너무 좋고 엔초비 파스타 완전 추천드려요,2024-05-04,"점심에 방문, 대기 시간 바로 입장, 데이트, 연인・배우자",음식이 맛있어요,669,1
971501438,soo****,음식이굿,2024-05-01,"점심에 방문, 예약 없이 이용, 대기 시간 바로 입장, 나들이, 아이",음식이 맛있어요,1188,1
971501438,유댕2010,브런치 하러 왔어요^^요즘 날씨에 테라스 너무 좋구요메뉴 3가지 시켰는데 다 맛있어요!!커피는 고소한 맛이네요~,2024-04-29,"점심에 방문, 예약 없이 이용, 대기 시간 바로 입장, 친목, 일상, 부모님, 친척・형제",음식이 맛있어요,28,1
971501438,sleepwalkerz,최애의 브런치 플레이스! 재료 너무 신선해서 맛있어요!,2024-04-28,"점심에 방문, 예약 후 이용, 대기 시간 30분 이내, 나들이, 친구",음식이 맛있어요,180,1
971501438,호이호이988,자주 방문했었는데나이드신분은 사장인가요그렇다면 다신 가지.않겠어요분위기와 친절함에 자주 갔었는데 더이상 주변에 추천도 못하겠네요,2024-04-28,"아침에 방문, 예약 없이 이용, 일상, 기타",,12,1
971501438,Ju1674,음식이 다 맛있고 뷰가 너무 좋아요 ♥,2024-04-27,"점심에 방문, 예약 후 이용, 대기 시간 30분 이내, 데이트, 연인・배우자",음식이 맛있어요,32,1
971501438,11881,굿,2024-04-27,점심에 방문,음식이 맛있어요,563,1
971501438,momemome,"❗️매장 분위기는 되게 좋은 것 같아요! 날씨도 좋아서 테라스에서 먹었는데 어두워서 음식사진이 잘 안나오는 것 빼고는 분위기는 괜찮았어요❗️뇨끼뽀끼,엔쵸비파스타,에그베네딕트 메뉴3가지  주문했어요전체적으로 가격대가 있고 양은 그저 그랬어요 좀 작다? 싶은정도❗️뇨끼뽀끼는 처음 보는메뉴였는데 떡볶이자체랑 뇨끼가 깔끔하게 맛있었어요 특별한맛은 없고 떡볶이에 뇨끼가 들어갔다,,정도❗️엔쵸비파스타는 엔쵸비는 잘 안느껴졌구요 그냥그랬어요❗️에그베네딕트의 잠봉햄은 좀 짠편이고 빵이랑 반숙이랑 잘어울렸어요!비쥬얼과 메뉴는 기대하게 만들었는데 가격에 비해 그저 그랬습니다ㅠ재방문의사는 없습니다!😫돈 많을 때 기분내기용으로 가기 좋을 것 같아요!",2024-04-27,"점심에 방문, 예약 없이 이용, 대기 시간 바로 입장, 친목, 나들이, 일상",야외공간이 멋져요,1001,1
971501438,청년K,테라스 분위기도 너무 좋고 커피도 맛있네요주말에 행복하게 잘 먹었습니다😁,2024-04-21,"점심에 방문, 예약 후 이용, 대기 시간 30분 이내, 일상, 기타",음식이 맛있어요,14,1
