place_id,nickname,content,date,situations,keywords,review_count,visit_count
1572861716,xkd****,친구들이랑 저번에 와보고 넘 맘에들어서이번엔 생일파티하러 예약 후 방문했어요!일단 안주가 특별한 메뉴가 많은데 맛까지 좋아서술이 술술 들어갑니당... 전통주 종류가 많아 골라먹는 재미도 있어요! 시음도 가능하니 먹어보고 고를수도 있어서 너무 좋아요 ㅎㅎ 전통주마다 주시는 잔도 다르고 술종류가 바뀔때마다 새잔을 주시는 센스까지....가게 인테리어도 너무 이쁘고 특히 화장실이 정말 깨끗합니다 ㅋㅋ 화장실에서 향기나요.사장님이 요리에 진심이신거 같아요 매일 기본안주도 바뀌더라구요? 메뉴연구도 계속 하시는거같아요 담에 또 갈꺼에요!! 대박나세요 🤎,2025-01-18,"저녁에 방문, 예약 후 이용, 대기 시간 바로 입장, 친목, 친구",친절해요,61,1
1572861716,찬잉33,"미아사거리에 이런 곳이 숨어있었다니…! 왜 이제야 안걸까요ㅠㅠ 우선 매장 인테리어랑 분위기가 너무 좋아서 데이트하기 넘 좋구요,, 대방어사시미는 입에서 그냥 녹아요ㅠㅠㅠ음식두 너무 맛있구 너무 친절하셔서 무조건 재방문할거같아요🥺🥺🤍",2025-01-18,"저녁에 방문, 예약 후 이용, 대기 시간 바로 입장, 데이트, 연인・배우자",음식이 맛있어요,37,1
1572861716,오른손은 거들뿐,부모님 생신이라 방문..음식도 맛있었고 서비스도 좋았어요..미역국도😍 주시고 석화도 신선하고 맛있었어요..연두부 아보카도 명란 요거 요거 술도둑..ㅎㅎ연세 많으신 부모님도 잘 드시니 맛집입니다..ㅎㅎ 👍,2025-01-18,"저녁에 방문, 예약 후 이용, 대기 시간 바로 입장",음식이 맛있어요,733,1
1572861716,4927263940482,"벌써 n번째 오는 오아.. 🤎오늘은 배가 불러서 새로운 메뉴를 도전해봤는데역시나 너무너무 맛있어요!오아 방어 맛있는거 세상사람들 다알아야하는데... 오늘은 배불러서 못시켜서 사진이 없네요ㅠㅠ맛있는 음식, 예쁜 분위기, 친절하신 사장님오늘도 오아 잘 즐기다 갑니다!",2025-01-18,"밤에 방문, 예약 없이 이용, 대기 시간 바로 입장, 데이트, 연인・배우자",음식이 맛있어요,346,4
1572861716,은하은,"인테리어가 깔끔하고 이뻣고 테이블이 엄청 특이하더라구여,은은한 조명덕분에 분위기 있고 나란히 앉을수있어 데이트하기 좋아보였어요안주가 양이 많지는 않아서 1차로가면 배고플거같아요2차로 방문해야할듯맛은 있었어요ㅎㅎ",2025-01-16,"저녁에 방문, 예약 후 이용, 대기 시간 바로 입장, 친목, 지인・동료",술이 다양해요,81,1
1572861716,젼8575,장점이 너무 많은 오아..🤍 음식도 맛있구 정말 이 조합에 대해 많이 고민하신게 보이는 음식들이라 너무 좋았어요! 진짜 다른 안주도 먹어보러 또 방문하고싶어요~~ 술도 진짜 다양하고 분위기도 좋고 데이트나 모임으로도 넘 추천합니다!! 미아사거리 맛집 리스트에 바로 메모해놨지용,2025-01-16,"저녁에 방문, 예약 후 이용, 대기 시간 바로 입장, 친목, 친구",친절해요,348,1
1572861716,찡찡이515,타코랑 들기름막국수 먹었는데 한식베이스라 부담없이 맛있게 먹었어요~~ 기본안주도 좋고 무엇보다 술이 다양하게 준비되어있어 골라먹는 재미가 있었어요!!  또 방문할께요😊,2025-01-14,"저녁에 방문, 예약 후 이용, 대기 시간 바로 입장, 친목, 지인・동료",음식이 맛있어요,20,1
1572861716,chchd7233,"최근에 먹은 방어중 최고,, 음식도 맛있구 서비스도 최고에요 다음에 친구들이랑 또 방문하겠습니다 사장님 번창하세요🫡",2025-01-12,"저녁에 방문, 예약 후 이용, 대기 시간 바로 입장, 데이트, 연인・배우자",대화하기 좋아요,17,1
1572861716,응11,"분위기 그냥 미쳐버렸구요, 올해 연말이나 크리스마스땐 무조건 예약 다 찰 곳이예요..음식 퀄리티 진짜 괜찮고 가성비 좋아요. 직원분도 너무 친절하시고 음식에 대해 간단히 설명해주시는데 진정성이 느껴지심인테리어도 진짜 아늑하고 고급진 느낌미아사거리 시끄러운 술집들 속에 숨어있는 보석같은 가게예요. 재방문 의사 1000퍼!",2025-01-12,"저녁에 방문, 예약 후 이용, 대기 시간 바로 입장, 데이트, 연인・배우자",음식이 맛있어요,955,1
1572861716,남민지33,미아사거리에 이렇게 분위기 좋은 곳이 생겨서 너무 기뻐요!! 주변 지인들 다 데리고 가고 싶어요😊😊 넘 맛있고 친절하셔요,2025-01-11,"밤에 방문, 예약 없이 이용, 대기 시간 바로 입장, 친목, 친구",친절해요,13,1
1572861716,gks****,동네에 분위기 좋은 술집이 있어서 왔어요. 분위기도 너무 좋고 서비스도 좋아요!,2025-01-11,"저녁에 방문, 예약 없이 이용, 대기 시간 바로 입장, 데이트, 연인・배우자",인테리어가 멋져요,3,1
1572861716,정윱43,"미아사거리에는 골목마다 예쁘고 맛집이 많은 것 같다.오아는 신선한 재료에 맛도 잘내는 집이고데이트나, 4인 이하 모임에 탁월한 선택이다.친절함과 맞춤 술 추천은 덤! 강추하고 재방문 의사 100퍼센트입니다!",2025-01-11,"저녁에 방문, 예약 후 이용, 대기 시간 바로 입장, 데이트, 연인・배우자",음식이 맛있어요,12,1
1572861716,더기더기99,두 번째 방문 역시 너무 좋았습니다. 모든 음식 재료가 아주 신선하고 맛있어요. !!,2025-01-10,"저녁에 방문, 예약 후 이용, 대기 시간 바로 입장, 친목, 친구",음식이 맛있어요,3,2
1572861716,bellebecky,"음식 맛있다는 소문 듣고 찾아갔어요! 분위기도 좋고, 친절하시고, 음식 하나하나 다 너무 맛있어요😊 예약하고 가니 웨이팅도 없어 좋네요. 종종 가도록 할께요!",2025-01-10,"저녁에 방문, 예약 후 이용, 대기 시간 바로 입장, 친목, 친구",인테리어가 멋져요,67,1
1572861716,glo****,"미아사거리 안주 찐맛집.... 몇군데 맛난곳들 있지만 여기가 최애로 등극했어요 ㅠㅜㅜ특히 맛났던 K타코 무조건 시켜야돼...일반 타코, 브리또랑은 또다른 맛!!! 진짜 먹어보고 탄성이 절로나오던,, 분위기랑 맛 다 만족했어요",2025-01-09,"저녁에 방문, 예약 후 이용, 대기 시간 바로 입장",음식이 맛있어요,99,1
1572861716,sm07602,문어바지락은두야소스 바게트너무맛있어서 계속손이갔어요 !!문어도 많이들어있고 질기지않고 야들야들해서맛있게먹었어요!! 동네에 분위기좋은술집 있어서 좋았어요 👍 👍,2025-01-08,"저녁에 방문, 예약 후 이용, 대기 시간 바로 입장, 데이트, 일상, 연인・배우자",특별한 메뉴가 있어요,580,1
1572861716,hyu****,분위기도 좋고 사장님께서 굉장히 친절하세요주문한 안주 두개 다 너무 맛있었어요 !! 전골은 재료들을 아낌없이 푸짐하게 넣어주셨어요 ! 진짜 짱👍다음에 또 방문할게요~!,2025-01-07,"저녁에 방문, 예약 후 이용, 대기 시간 바로 입장, 데이트, 연인・배우자",인테리어가 멋져요,536,1
1572861716,찐찐338,둘이 방어먹어본적없어서 찾다가 발견한곳인데요분위기 좋고! 음식 너무 맛있는데 직원분들도 너무 친절하셨어요음식하나하나 다 설명해주셔서 대접받는 기분ㅎㅎ방어도 맛났는데 두루치기...이거 찐맛나요약간 중식느낌도 살짝나고 두부도 맛나고분위기 좋게 잘먹었어요ㅎㅎ서비스...찐감덩이였어요ㅎㅎ,2025-01-04,"저녁에 방문, 예약 후 이용, 대기 시간 바로 입장, 데이트, 연인・배우자",음식이 맛있어요,47,1
1572861716,비버H,미아사는 지인추천으로 방문한 오아 음식도맛있고 잘먹고갑니다~~미아오시면 오마에서 한잔!!,2025-01-03,"저녁에 방문, 예약 없이 이용, 대기 시간 바로 입장, 친목, 친구, 지인・동료",음식이 맛있어요,17,1
1572861716,dlt****,음식 다 너무 맛있었어요 💖 다음에 또 방문 할게요!!,2025-01-03,"저녁에 방문, 예약 후 이용, 대기 시간 바로 입장, 데이트, 연인・배우자",음식이 맛있어요,13,1
1572861716,와ㅇ아앙,음식도 깔끔하니 맛있고 인테리어도 이쁘고엄마랑 데이트 하러 왔는데 전체적으로 너무 좋았어요대방어는 숙성돼서 더 맛있었고 같이 주신 묵은지가 진짜 맛있었어요,2024-12-31,"저녁에 방문, 예약 후 이용, 대기 시간 바로 입장, 데이트, 부모님",친절해요,34,1
1572861716,roc****,오아최고👍,2024-12-31,"저녁에 방문, 예약 후 이용, 대기 시간 바로 입장, 데이트, 연인・배우자",음식이 맛있어요,3,1
1572861716,횬로그,"한식 감성주점 오아사거리는 감성술집인데도 고퀄리티의 방어를 즐길수있어서 너무 좋았고, 전통주와의 궁합도 최고라서 강추드려요!",2024-12-29,"저녁에 방문, 예약 후 이용, 대기 시간 바로 입장, 데이트, 연인・배우자",음식이 맛있어요,165,1
1572861716,soo****,분위기도 멋지고 고급스러운 펍느낌이 좋아요 ㅎㅎ,2024-12-29,"저녁에 방문, 예약 후 이용, 대기 시간 바로 입장, 지인・동료",술이 다양해요,609,1
1572861716,토깽이밈,미아사거리 퓨전 한식 요리주점이라니!! 너무 이뻐용 ㅠ내부 인테리어 좌석도 동그란게 특이하고메뉴도 다양한데 비주얼이 다 좋아요👏🏻 제 원픽은 아스파라거스 허파볶음인데 쫄깃하면서 향이 정말 좋아요ㅜㅜ연두부 아보카도 명란도 별미예요 다음에 또 방문할래요,2024-12-28,"저녁에 방문, 예약 후 이용, 대기 시간 바로 입장, 일상, 가족모임, 친구, 친척・형제",음식이 맛있어요,98,1
1572861716,땅은미,지나가다가 보고 너무 예쁘고 깨끗해서 예약하고 왔는데 진짜 너무 너무 맛있어요 !!!!!! 모든 모임에 추천드립니다 !!!!! 들어와서 음식부터 서비스까지 맛있고 진짜 너무너무 친절하셔서 감동받고 돌아갑니다..! 꼭 행복하세요 오래오래 다니고 싶어요!!!,2024-12-28,"저녁에 방문, 예약 후 이용, 대기 시간 바로 입장, 친목, 지인・동료",음식이 맛있어요,28,1
1572861716,vus****,"미아사거리에 이렇게 분위기 좋은 술집이 생겼다니!!!! 예약하고 6시에 방문했는데 이미 만석이더라구여??? 벌써 소문났나봐여 ㅎㅎㅎ  근데 사람이 많은데엔 이유가 있었어요! 안주가 하나같이 퀄리티 미쳤고 개맛도리,,👍🏻👍🏻 간단히 먹으러 갔다가 술이랑 안주 왕창 먹고 갑니당 ㅎㅎㅎ 남자친구랑 오랜만에 분위기 좋은 곳에서 데이트 즐겼네여!!>< 조만간 또 방문하려구요!!! 직원분들도 다들 너무 친절하시고 기분 좋게 먹고 가요~~!",2024-12-28,"저녁에 방문, 예약 후 이용, 대기 시간 바로 입장, 데이트, 연인・배우자",친절해요,49,1
1572861716,긔긔15,"지금 방어철이라 그런지 양도 괜찮고, 신선했어요! 영수증 이벤트 히면 아이스크림도 주시니까 꼭 참여해보세요~!오픈 주방이라 안심했습니다😍😍",2024-12-28,"저녁에 방문, 예약 후 이용, 대기 시간 바로 입장, 친목, 친구",술이 다양해요,18,1
1572861716,이제이2jjj2j,분위기랑 맛까지 너무 만족스러운 곳이었어요! 분위기 있는 곳 찾을 때 또 갈 것 같아요. 손님 많으니까 예약 꼭 하세요💯💯,2024-12-28,"저녁에 방문, 예약 후 이용, 대기 시간 바로 입장, 데이트, 친목, 연인・배우자",음식이 맛있어요,1722,1
1572861716,do****,술먹으러 갔다가 식사하고 나왔어요..👍🏻 전골 양 엄청 푸짐하고 고기가 세상에 냄비 반이나 차지합니다..!!! 미나리 향도 그읏하니 맛있는 된장 전골이었어요거두절미하고 사이드메뉴 연두부아보카도명란 꼭 시키셔요💡 맛도 맛인데 너무 이쁨,2024-12-28,"저녁에 방문, 예약 후 이용, 대기 시간 바로 입장, 데이트, 연인・배우자",인테리어가 멋져요,419,1
1572861716,또심84,굿,2024-12-27,저녁에 방문,음식이 맛있어요,810,2
1572861716,sks****,"미아사거리역에 새로 오픈한 퓨전 한식 주점이라고 해소 방문해봤어요. 한식과 퓨전이 만나서 다른 곳에서는 맛 볼 수 없었던 메뉴들이라 좋았어요☺️🫶 술 종류도 다양해서 여러가지 술을 먹어 볼 수 있어요! 문어,바지락, 온두야소스,바게트 메뉴 꼭 드셔길 강추!! 고추장&토마토&감바스의 만남으로 한국인이 딱 좋아할 맛이에요!! 바게트 리필까지 했어요🫠 고급진 분위기에 맛있는 안주까지..💛 미아사거리에서 분위기 좋은 술집 찾으신다면 추천드려요👏👏",2024-12-27,"저녁에 방문, 예약 후 이용, 대기 시간 바로 입장, 데이트, 친목, 일상, 기념일, 연인・배우자, 친구, 지인・동료",특별한 날 가기 좋아요,30,1
37257007,소다미52,항상 맛있게 잘 먹어요!육회 연어 무한리필은 여기만한데가 없는것같아요!,2025-04-04,"저녁에 방문, 예약 없이 이용, 대기 시간 바로 입장, 가족모임, 아이, 부모님",음식이 맛있어요,3,1
37257007,황유준81,,2025-03-19,"저녁에 방문, 예약 없이 이용, 대기 시간 바로 입장, 친목, 연인・배우자",인테리어가 멋져요,7,1
37257007,sun****,,2025-03-19,"저녁에 방문, 예약 없이 이용, 대기 시간 바로 입장, 친목, 연인・배우자, 친구",음식이 맛있어요,3,1
37257007,hee9486,신선도 굿 맛있어요,2025-03-11,"저녁에 방문, 예약 없이 이용, 대기 시간 바로 입장",매장이 청결해요,1698,1
37257007,건강한토마토,육회맛있어요,2025-03-11,저녁에 방문,음식이 맛있어요,419,1
37257007,대마왕4425,맛있어요,2025-03-08,점심에 방문,음식이 맛있어요,3,1
37257007,윤태아범,육회 좋아해서 요즘 가끔 가는 곳!!,2025-02-21,"저녁에 방문, 예약 없이 이용, 대기 시간 바로 입장, 데이트, 연인・배우자",음식이 맛있어요,1276,2
37257007,살속의미남,맛있어요😋,2025-02-17,점심에 방문,,825,1
37257007,wl****,일주일에 한번씩은 꼭 오는것 같아요 육회가 넘 맛이 있어요,2025-02-15,"저녁에 방문, 예약 없이 이용, 대기 시간 바로 입장, 나들이, 친구",음식이 맛있어요,1053,12
37257007,포포챠코,무한리필땜에 오는데 항상 맛있네요,2025-02-15,"점심에 방문, 예약 없이 이용, 대기 시간 10분 이내, 데이트, 연인・배우자",음식이 맛있어요,473,5
37257007,wl****,연어회를 먹었는데 정말 맛이 있어요 안주꺼리가 다양하게 있고 가격도 저렴해요~,2025-02-01,"저녁에 방문, 예약 없이 이용, 대기 시간 바로 입장, 데이트, 연인・배우자",음식이 맛있어요,1053,11
37257007,칠백유정,사회초년생입니다. 가성비짱 배부르게 먹고가요 항상 감사합니다. 버틸힘이 생겨요! 다들 2025년 파이팅!!!,2025-01-31,"점심에 방문, 예약 없이 이용, 대기 시간 바로 입장, 비즈니스, 기타",음식이 맛있어요,6,2
37257007,칠백유정,사장님 직원분께서 오자마자 친절하시구 기분좋게 니작해서 기분좋게 나갑니당 점심 책임져주셔서 감사해용 많이 버세요♡,2025-01-26,"점심에 방문, 예약 없이 이용, 대기 시간 바로 입장, 비즈니스, 혼자",가성비가 좋아요,6,1
37257007,방랑식객 꾹이,조용해서 좋았습니다.,2025-01-21,"밤에 방문, 예약 없이 이용, 대기 시간 바로 입장, 친목, 지인・동료",대화하기 좋아요,151,1
37257007,후후후우웃,오~괜찮아요 대박,2025-01-06,저녁에 방문,음식이 맛있어요,1709,5
37257007,wl****,자주가는곳인데 언제나 먹어도 맛있는집  술안주도 다양하게 입맛대로 골라 먹을수 있어 좋아요,2024-12-28,"저녁에 방문, 예약 없이 이용, 대기 시간 바로 입장, 친목, 지인・동료",음식이 맛있어요,1053,10
37257007,오바람,사장님 친절하시고 맛있었어요,2024-12-18,"밤에 방문, 예약 없이 이용, 대기 시간 바로 입장, 친목, 지인・동료",음식이 맛있어요,11,1
37257007,음말라,좋아요,2024-12-08,밤에 방문,친절해요,882,2
37257007,무등산 호랑마,직접 포장해서 먹었는데 맛있어요,2024-12-05,"저녁에 방문, 예약 없이 이용, 대기 시간 바로 입장, 일상, 혼자",음식이 맛있어요,25,1
37257007,열정희희,육회 좋아해서 자주와요욱연어 다 너무 신선하고 맛있어요다음에 또 올께요~~,2024-11-23,"저녁에 방문, 예약 없이 이용, 대기 시간 바로 입장, 친목, 연인・배우자",친절해요,399,1
37257007,Sheh3vuue,좋아욤,2024-11-02,"저녁에 방문, 예약 없이 이용, 대기 시간 바로 입장",기본 안주가 좋아요,1165,9
37257007,kjm****,좋아욤,2024-11-02,"저녁에 방문, 예약 없이 이용, 대기 시간 바로 입장",음식이 맛있어요,1557,8
37257007,wl****,육회는 포장해서 집와서 딸이랑 같이 먹었어요 언제나 먹어도 맛이 그대로에요~,2024-11-02,"저녁에 방문, 예약 없이 이용, 대기 시간 바로 입장, 데이트, 연인・배우자",음식이 맛있어요,1053,9
37257007,우끼6494,무한리필 가격도 착하고 품질도 좋아서 너무 좋아여 연어 먹고싶을땐 항상 여기옵니다ㅎㅎ,2024-10-20,"밤에 방문, 예약 없이 이용, 대기 시간 바로 입장, 가족모임, 부모님",음식이 맛있어요,10,1
37257007,wl****,일주일에 한번씩 가는것 같아요 맛이 넘 좋으니까 계속 가게 되네요 땡겨요 맛이....,2024-10-19,"저녁에 방문, 예약 없이 이용, 대기 시간 바로 입장, 데이트, 연인・배우자",음식이 맛있어요,1053,8
37257007,지영6582,좋은사람들이랑 함께해서그런가  재미나고  신나고 맛나는 곳입니다,2024-10-17,"저녁에 방문, 예약 없이 이용, 대기 시간 바로 입장, 친목, 지인・동료",음식이 맛있어요,395,1
37257007,wl****,,2024-10-05,"저녁에 방문, 예약 없이 이용, 대기 시간 바로 입장, 데이트, 연인・배우자",음식이 맛있어요,1053,7
37257007,Yeona0,여기 너무 맛있어요!!! 담에 또 오려구요,2024-10-03,"저녁에 방문, 예약 없이 이용, 대기 시간 바로 입장, 친목, 친구",대화하기 좋아요,19,1
37257007,wa****,그 집에 오는 게 너무 좋아서 친구를 네다섯 번 데리고 왔다. 이번에는 정말 실망했다.. 연어 리필이 모두 40분이나 기다렸다!!!!! 첫 번째 리필은 20분 기다렸는데 중간에 두 판 나오는 게 빨랐고 마지막 리필도 20분이었다!!! 육회는 한 번 리필이 나오도 느리다. 마지막 연어 나왔을 때 마지막 판이라고 했는데 우리가 밥 먹을 시간이니까🙄🙄우리가 계속 먹는 것처럼 중간에 진짜 계속 기다렸는데 아예 아무것도 안 먹었다.아무리 배달이 바빠도 젓가락 놓고 40분 기다리게 하는 게 말이 됩니까? 우리가 말하지 않는 상황에서 리플이 천천히 나오는 것을 모르나요? 저는 가게가 합리적인 설명을 해주길 바랍니다.,2024-09-29,"저녁에 방문, 예약 없이 이용, 대기 시간 바로 입장, 일상, 연인・배우자",,6,1
37257007,윤태아범,적당히 달달한 맛있는 맛!!처음으로 육회 무한리필~,2024-09-27,"저녁에 방문, 예약 없이 이용, 대기 시간 바로 입장, 친목, 친구",음식이 맛있어요,1276,1
37257007,달큰별,배터지게 먹은 연어+육회 무한리필😋,2024-09-24,"저녁에 방문, 예약 없이 이용, 대기 시간 바로 입장, 일상, 친구",음식이 맛있어요,84,2
37257007,wl****,넘 맛이 있어 다먹고 사진컷 했어요,2024-09-21,"저녁에 방문, 예약 없이 이용, 대기 시간 바로 입장, 데이트, 연인・배우자",음식이 맛있어요,1053,6
37257007,하뽕이와 조이,맛있어요 벌써 3번째 방문인데육회 먹고싶을때마다 방문하게되요~,2024-09-18,"점심에 방문, 예약 없이 이용, 대기 시간 바로 입장, 데이트, 연인・배우자",음악이 좋아요,16,2
37257007,RiRi14,미아사거리 육회랑 연어 생각 날대마다 가는곳인데 이번이 친구들 데리고 주말 일찍 먹으러 갔는데 언제나 가도 정말 맛있네요 ㅎㅎ !! 맨날 밤에만 갔다가 이른시간에 가서 그런지 좋은자리 조용히 맛있게 먹었습니다 ㅎ 배달준비 하느라 바쁘신대도 정말 친절하시고 다른곳은 연어가 좀 그런곳이 많은데 여기는 무한리필로 먹어도 냄새도 안나고 정말 맛있어요!육회도 더할 나위없이 쭉쭉 계속 들어가고 흑임자 소스에 찍어먹으면 일품 입니다 ㅎ 너무 맛있어서 배터지게 먹고 갑니다!!다음에 또 지인들이랑 먹으러갈게요!,2024-08-25,"점심에 방문, 예약 없이 이용, 대기 시간 바로 입장, 친목, 친구",대화하기 좋아요,9,1
37257007,맛집에만리뷰써요,연어랑 육회세트 너무 맛있어요! 기본 찬으로 나오는 미역국도 너무 맛있습니다,2024-08-23,"밤에 방문, 예약 없이 이용, 대기 시간 바로 입장, 데이트, 연인・배우자",음식이 맛있어요,28,1
37257007,okj****,굿입니다,2024-08-19,저녁에 방문,음식이 맛있어요,694,11
37257007,wl****,육회 실컷 먹을려고 무한리필을 시켜서 먹었어요 그런데 그냥육회맛이랑 무한리필육회랑 맛이 좀 다르네요 양이 많지않은 사람은 그냥 육회 드세요 맛이 짱이랍니다~^^,2024-08-12,"저녁에 방문, 예약 없이 이용, 대기 시간 바로 입장, 데이트, 연인・배우자",음식이 맛있어요,1053,5
37257007,okj****,굿입니다,2024-08-02,점심에 방문,음식이 맛있어요,694,10
37257007,wl****,육회가 술안주 딱이에요 한번가서 드셔보세요  정말  맛있어요,2024-07-27,"저녁에 방문, 예약 없이 이용, 대기 시간 바로 입장, 데이트, 연인・배우자",음식이 맛있어요,1053,4
37257007,달큰별,연어 킬러라 찾은 육회왕자연어공주👍🏻연어 무한리필 배터지게 먹고 왔네유~~도톰도톰~배터지게 먹고 싶을 때 방문하긔👍🏻,2024-07-27,"저녁에 방문, 예약 없이 이용, 대기 시간 바로 입장, 일상, 아이",아늑해요,84,1
37257007,okj****,굿입니다,2024-07-25,저녁에 방문,음식이 맛있어요,694,9
37257007,웃는인연,2차로 간단하게 육회랑 한잔하기 좋았습니다. 그런데 배달민족맛집인듯. 계속 포장하느라 엄청 바뿌더라고요.,2024-07-17,"저녁에 방문, 예약 없이 이용, 대기 시간 바로 입장, 친목, 친구",음식이 맛있어요,348,1
37257007,nicole7523,맛있어요,2024-07-12,"저녁에 방문, 예약 없이 이용, 대기 시간 바로 입장, 친목, 친구",음식이 맛있어요,245,1
37257007,okj****,굿입니다,2024-07-04,저녁에 방문,음식이 맛있어요,694,8
37257007,조해피8,저번에 매장 방문이후 너무 맛있어서 포장하러또 방문했어요 가격도 착하고 맛도있어요,2024-06-27,"저녁에 방문, 포장·배달 이용, 대기 시간 바로 입장, 데이트, 연인・배우자",음식이 맛있어요,12,1
37257007,okj****,굿입니다,2024-06-21,저녁에 방문,음식이 맛있어요,694,7
37257007,pr****,육회가 젤 맛있네요~ 연어두 참치회는 별로였어요.. 연어 소스랑이 별로예요.. 한번 와야지 벼르다 왔는데 조금 실망이였어요.. 생각보다 별로였네요..,2024-06-17,"저녁에 방문, 예약 없이 이용, 대기 시간 바로 입장, 일상, 아이",가성비가 좋아요,543,1
37257007,Sheh3vuue,예전보다 가성비줄었지만 신선해요 ㅎㅎ,2024-06-16,"저녁에 방문, 예약 없이 이용, 대기 시간 바로 입장",음식이 맛있어요,1165,8
37257007,kjm****,연어가 싱싱하고 질이 좋아요,2024-06-16,"저녁에 방문, 예약 없이 이용, 대기 시간 바로 입장, 일상, 친구",음식이 맛있어요,1557,7
37257007,okj****,굿입니다,2024-06-14,저녁에 방문,음식이 맛있어요,694,6
37257007,수락산마녀,육회 전문점인데너무 상태가안좋아서술만 먹고 나왔네요날씨도 더운데 신경즘 쓰세요,2024-06-12,"밤에 방문, 예약 없이 이용, 대기 시간 바로 입장, 친구",,372,1
37257007,김진환64,안경쓴직원말투부터 싸가지가없었고 손님한테언행 정말듣기불편합니다 음식 무한리필시켯지만 양상추 오래놔두면생기는 갈색현상 진짜 먹기거북할정로 사진찍어두었습니다 소스로 가리면 안보일줄아시나요ㅋㅋ 무순 세척도안하시고 이물질가득 진심먹다가 여자친구도화나서 다먹지도않고 계산하고나왔습니다직원자체가 친절하지도않은곳은 다시 손님의대한 재교육이필요하겟네요,2024-06-12,"밤에 방문, 예약 없이 이용, 대기 시간 바로 입장, 데이트, 연인・배우자",,6,1
