place_id,nickname,content,date,situations,keywords,review_count,visit_count
1648903512,그만먹어제발,:),2025-04-08,점심에 방문,가성비가 좋아요,894,1
1648903512,송림향기,편해서 가끔 갑니다,2025-04-08,"점심에 방문, 예약 후 이용, 대기 시간 10분 이내, 친목, 친구",음식이 맛있어요,740,3
1648903512,안정현9138,빕*도 종종 가지만 가성비 측면에서는 훨씬 좋은 것 같습니다. 다양한 음식에 친절하고 빠르게 일처리 하시는 종업원분들에게도 좋은 점수 드리고 싶습니다.,2025-04-06,"점심에 방문, 예약 후 이용, 대기 시간 바로 입장, 가족모임, 아이",가성비가 좋아요,6,2
1648903512,미니928,주말 예약 후 이용하니 대기 시간없이 좋아요.,2025-04-05,"저녁에 방문, 예약 후 이용, 대기 시간 바로 입장, 가족모임, 연인・배우자, 아이",음식이 맛있어요,19,7
1648903512,8498,"어제 저녁7시에 갔는데 이미 손님들이 한번 휩쓸고가서인지음식이 많이 떨어졌음, 핫파트쪽은 바로 채워지는데김밥스시쪽은 늦게 채워짐. 한가지 안좋은건 핫쪽에 안경쓰신분 앞머리 다보이게 조리모자 쓰셨는데 계속 신경쓰이던데. 반면 샐러드쪽 안경쓰신 여자분은용모단정한게 보여서 좋았어요.",2025-04-04,"저녁에 방문, 예약 없이 이용, 대기 시간 바로 입장, 친구",가성비가 좋아요,122,1
1648903512,솔솔딸기맘,오픈런으로 맛있게 먹었습니다.,2025-04-04,"점심에 방문, 예약 없이 이용, 대기 시간 바로 입장, 친목, 친구",특별한 메뉴가 있어요,126,3
1648903512,DenyK,좋아요,2025-04-03,저녁에 방문,음식이 맛있어요,3069,1
1648903512,통장이텅장으로,방문일에 사람이 많지 않아 여유롭게 즐겼습니다,2025-04-03,"저녁에 방문, 예약 후 이용",매장이 넓어요,235,1
1648903512,hm07231,로봇같은 직원이 결제 해주셔서 혼자 맛있게 먹고나옴낮이라그런가 음식이 후딱 안채워짐,2025-04-01,"점심에 방문, 예약 없이 이용, 대기 시간 바로 입장, 일상, 혼자",음식이 맛있어요,584,1
1648903512,사악천사77,되게 오랜만에 애슐리ㅎㅎ역시 가끔 와야 맛있음ㅋㅋㅋ생일이라고 친구 만남!,2025-04-01,"점심에 방문, 예약 후 이용, 대기 시간 바로 입장, 기념일, 친구",,956,1
1648903512,더블더블101,종류도 다양하고 맛있긴 한데 할인 적용되는게 없어서 아쉽네요,2025-03-29,점심에 방문,음식이 맛있어요,2848,1
1648903512,포다무,,2025-03-28,"점심에 방문, 예약 없이 이용, 대기 시간 바로 입장",음식이 맛있어요,959,3
1648903512,ipa****,,2025-03-28,"점심에 방문, 예약 없이 이용, 대기 시간 바로 입장, 일상, 연인・배우자",음식이 맛있어요,1078,2
1648903512,흰곰타나토스,크고 좋아요크다보니 종류가 많고 좌석사이도 넓어서 프라이빗합니다직원분들도 매우 친절해요,2025-03-22,"점심에 방문, 예약 없이 이용, 대기 시간 바로 입장, 데이트, 연인・배우자",음식이 맛있어요,81,1
1648903512,아이69,,2025-03-21,"저녁에 방문, 예약 없이 이용, 대기 시간 30분 이내, 친목, 친구",양이 많아요,34,1
1648903512,wartos,음식이 괜찮네요 ㅋ,2025-03-21,"점심에 방문, 예약 없이 이용, 대기 시간 바로 입장, 데이트, 연인・배우자",음식이 맛있어요,1547,2
1648903512,sseal99,.,2025-03-21,점심에 방문,음식이 맛있어요,332,4
1648903512,항상감사77,"오랜만에 애슐리퀸즈에 방문했는데 테이블도 창가자리 너무 기분좋게 식사했어요. 즉석 우동,쌀국수,잔치국수도 스시옆에 위치해있고 샐러드,한식,중식,양식코너별 음식도 다양하고 맛있어요. 디저트와 음료코너가 더 맘에 들었지만~ 딸이랑 즐거운 시간 보내고 왔습니다",2025-03-19,"점심에 방문, 예약 없이 이용, 대기 시간 바로 입장, 기념일, 아이",매장이 넓어요,932,3
1648903512,삐죽아,폭립이랑 치킨 시그니처 좋아용 근데 딸기 시즌 마무리 돠어 아숩,2025-03-17,"저녁에 방문, 예약 후 이용, 대기 시간 바로 입장, 데이트, 연인・배우자",매장이 넓어요,358,1
1648903512,뮤직앤기타,매장도 철결하고음식이 맛있었습니다.다음에 또 방문하겠습니다~,2025-03-17,"점심에 방문, 예약 후 이용, 대기 시간 바로 입장, 친목, 지인・동료",음식이 맛있어요,89,1
1648903512,굴비보리,자주 옵니다~~~,2025-03-17,"점심에 방문, 예약 없이 이용, 대기 시간 바로 입장, 데이트, 연인・배우자",음식이 맛있어요,700,5
1648903512,1793hj,네이버로 예약하고 가니 안기다리고 좋았어요 애슐리 짱 존맛 🩷,2025-03-16,"저녁에 방문, 예약 후 이용, 대기 시간 바로 입장, 데이트, 연인・배우자",특별한 메뉴가 있어요,28,1
1648903512,희망으로 가득찬,맛있어요.,2025-03-16,"점심에 방문, 예약 없이 이용, 대기 시간 30분 이내, 친목, 연인・배우자, 아이",음식이 맛있어요,2704,4
1648903512,모모뮤,,2025-03-16,"점심에 방문, 예약 없이 이용, 대기 시간 바로 입장, 일상, 연인・배우자, 아이",음식이 맛있어요,599,9
1648903512,반페르시92,"음식도 먹을게 없고, 먹을 음식도 준비되지 않아서 50분만에 나와서 집에서 뭐시켜먹었습니다.가지마세요…",2025-03-15,"저녁에 방문, 예약 후 이용, 대기 시간 10분 이내, 가족모임, 연인・배우자, 부모님, 친척・형제",,15,2
1648903512,두두베베,,2025-03-15,"점심에 방문, 예약 없이 이용, 대기 시간 바로 입장, 데이트, 연인・배우자",음식이 맛있어요,2348,5
1648903512,you****,주차도 편하고 매장도 넓고 자극적이지 않고 맛있어요.,2025-03-15,"점심에 방문, 예약 후 이용, 대기 시간 바로 입장, 일상, 연인・배우자, 아이",친절해요,7,2
1648903512,nir****,마지막 타임 이라선지 제때 음식이 나오질않아 먹지못한 음식들이 많아 아쉬워요~~!,2025-03-14,"저녁에 방문, 예약 후 이용, 대기 시간 바로 입장, 기념일, 연인・배우자, 아이",,459,1
1648903512,roundfrog71,"아이들과 평일런치로 다녀왔어요. 초밥도 맛있고, 딸기축제 끝나기전에 다녀왔는데, 딸기는 그닥 달지 않더라고요. 맛있게 먹고 왔어요. 먹고 장보기 딱 좋았어요.",2025-03-14,"점심에 방문, 예약 없이 이용, 대기 시간 바로 입장, 일상, 혼자, 아이",음식이 맛있어요,660,2
1648903512,luc****,맛있게 잘먹었어요 웨이팅없이 들어갔네요,2025-03-14,"점심에 방문, 예약 없이 이용, 대기 시간 바로 입장, 친목, 친척・형제",음식이 맛있어요,285,2
1648903512,dbs****,굿,2025-03-12,점심에 방문,음식이 맛있어요,2129,4
1648903512,wjk****,,2025-03-12,"점심에 방문, 예약 없이 이용, 대기 시간 바로 입장, 일상, 아이",음식이 맛있어요,1642,2
1648903512,자몽식빵,가성비 먹기 좋아요. 평일이라 주말보다 저렴한 가격에 잘먹었어요!,2025-03-12,"점심에 방문, 예약 없이 이용, 대기 시간 바로 입장, 친목, 친구",가성비가 좋아요,438,1
1648903512,굴비보리,맛있게 잘 먹었어요~~~,2025-03-12,"점심에 방문, 예약 없이 이용, 대기 시간 바로 입장, 데이트, 연인・배우자",음식이 맛있어요,700,4
1648903512,쭈다,예약하고 가서 편안하고 맛있게 잘 먹었습니다!,2025-03-12,"점심에 방문, 예약 후 이용, 대기 시간 바로 입장, 일상, 기타",매장이 넓어요,1736,2
1648903512,새새개,애슐리 딸기 축제라서 다녀왔어요. 맛있게 즐기고 왔어요,2025-03-11,"점심에 방문, 예약 없이 이용, 대기 시간 30분 이내, 일상, 연인・배우자, 아이",음식이 맛있어요,1418,4
1648903512,뚱땡이92,,2025-03-08,저녁에 방문,음식이 맛있어요,3185,7
1648903512,신진1831,맛있게 먹었어요! 아침에 가도 사람 많더라고요 이거저거 먹을 수 있고 로봇이 치워주니 깔끔해요! 다음에 또 이용할게요,2025-03-08,"점심에 방문, 예약 후 이용, 대기 시간 10분 이내, 데이트, 연인・배우자",음식이 맛있어요,26,1
1648903512,Esto quod es,음식이 차가워요.,2025-03-07,"저녁에 방문, 예약 후 이용, 대기 시간 바로 입장, 가족모임, 부모님",친절해요,846,1
1648903512,하와이안셔츠95,,2025-03-07,"저녁에 방문, 예약 없이 이용, 대기 시간 바로 입장, 데이트, 연인・배우자",매장이 넓어요,81,1
1648903512,wartos,괜찮네요,2025-03-07,"점심에 방문, 예약 없이 이용, 대기 시간 바로 입장, 일상, 혼자",샐러드바가 잘 되어있어요,1547,1
1648903512,losakr,"가성비가 좋은 애슐리퀸즈, 오늘은 딸기가 있는 디저트류가 많네요. 간짜장이 맛있고 홍합도 괜찮고, 여기 음식 몇 종류를 먹지 못하는데 다 먹어보는 게 꿈이네요.",2025-03-07,"점심에 방문, 예약 없이 이용, 대기 시간 바로 입장, 친목",음식이 맛있어요,1114,2
1648903512,hrj****,,2025-03-07,"점심에 방문, 예약 후 이용, 대기 시간 바로 입장, 나들이, 아이",음식이 맛있어요,838,4
1648903512,아름다운 삶57,맛있게 잘 먹었습니다,2025-03-06,"점심에 방문, 예약 후 이용, 대기 시간 바로 입장, 친목, 친구, 지인・동료",음식이 맛있어요,1537,14
1648903512,고미당,맛있게 잘 먹었습니다,2025-03-05,"저녁에 방문, 예약 없이 이용, 대기 시간 바로 입장, 데이트, 연인・배우자",음식이 맛있어요,764,1
1648903512,mag****,케이크와 딸기 실컷 먹었어요.,2025-03-04,"점심에 방문, 예약 없이 이용, 대기 시간 바로 입장, 나들이, 아이",특별한 메뉴가 있어요,962,1
1648903512,bon****,월계점..왜이러케됬나요?ㅜ한달에2~3번은 오는데 오늘은 정말 최악이네요!위생상태며..(음료수컵 커피잔 스프..)등 전부 한두개정도가아닌 전부 찌꺼기에 지저분하고..심지어고춧가루 소승등 다묻어있고음식들도 바로바로 채워주지않고..사람들은기다리게하고 접시두없어서 또기다리고..주말!더활성화가되야하는데!너무 성의없고..그래요!다그랫다치고..위생좀!제발 신경좀썼음하네요..,2025-03-03,점심에 방문,,19,1
1648903512,Alloydesign,신학기 아이들 개학을 맞이하여 애슐리 월계점 방문하였습니다. 대기가 많을 것 같아서 미리 앱으로 대기예약하고 1시간 후 입장하였습니다. 딸기 특집이라 딸기 신나게 먹고 나왔습니다. 새학기 홧팅~,2025-03-03,"점심에 방문, 예약 후 이용, 대기 시간 10분 이내, 나들이, 아이",음식이 맛있어요,1340,9
1648903512,시내34,굿,2025-03-03,"점심에 방문, 예약 후 이용, 대기 시간 10분 이내, 가족모임, 부모님",음식이 맛있어요,1464,1
1648903512,어몽어미,바쁜시간대에 처음 와보는데컵이 씻은건가 싶을만큼 세척이 엉망이어서식욕이 뚝 떨어졌어요ㅜ사진 말고도 셋팅 되있는 컵 절반이상이 음식물이 묻어있었어요주말에는 설거지 인원을 더 충원하셔야 할것같아요,2025-03-03,"점심에 방문, 예약 없이 이용, 대기 시간 1시간 이상, 기념일",매장이 넓어요,217,2
1648903512,범블대디,오랜만에 방문한 애슐리 딸기도 맛있고 매니져가 음식 퀄리티도 많이 신경 쓰는 모습을 볼 수 있었어요^^,2025-03-01,"저녁에 방문, 대기 시간 10분 이내, 가족모임, 연인・배우자, 아이, 친척・형제",음식이 맛있어요,1864,21
1648903512,rpd****,"청결도 최악. 살면서 방문한 음식점 중에 이 정도인 곳이 있었을까.커피컵, 음료수컵 등 이물질이 너무 묻어 있어서 먹을 수 없었다. 비어있는 음식과 날파라는 덤 .전반적인 위생관리가 너무 부족하여 재방문 의사 절대 없음. 애슐리는 평생 안 갈 예정이다.친척동생을 데려갔는데 사주는 입장임에도 민망했다. 반성하시길.",2025-03-01,"저녁에 방문, 예약 없이 이용, 대기 시간 바로 입장, 친목, 연인・배우자",,5,1
1648903512,상콤발랄한라임,🍓시즌이어서 사람들이 많네요.,2025-03-01,"저녁에 방문, 예약 없이 이용, 대기 시간 바로 입장, 일상, 연인・배우자, 아이",아이와 가기 좋아요,526,8
1648903512,Janue,딸기축제 기간 좋아요,2025-03-01,"점심에 방문, 예약 후 이용, 대기 시간 바로 입장",재료가 신선해요,351,2
1648903512,장영님4,,2025-02-28,"저녁에 방문, 예약 후 이용, 대기 시간 바로 입장, 친목, 지인・동료",음식이 맛있어요,80,2
1648903512,28nuguri,맛있게 잘먹고 왔습니다,2025-02-28,"저녁에 방문, 예약 후 이용, 대기 시간 바로 입장, 친목, 연인・배우자",음식이 맛있어요,11,2
1648903512,Impeccable10,맛있어요.사람들 엄청 많네요.,2025-02-28,"점심에 방문, 예약 없이 이용, 대기 시간 1시간 이상, 가족모임, 부모님, 친척・형제",음식이 맛있어요,905,2
1648903512,피핀사랑,ㅇ,2025-02-28,점심에 방문,음식이 맛있어요,987,1
1648903512,스타일리스트0,사람이 많고    직원 별로없는데일당백 느낌바닥도 미끄럽고  사람많으니  정신없고,2025-02-28,"점심에 방문, 예약 후 이용, 대기 시간 바로 입장, 일상, 친구",재료가 신선해요,3,7
1648903512,젬마524,오랜만에 갔는데 알찬구성으로 식사 후식 까지 너무 잘 먹었어요,2025-02-27,"점심에 방문, 예약 후 이용, 대기 시간 10분 이내, 일상, 아이",음식이 맛있어요,82,1
1648903512,이정경9,,2025-02-26,"점심에 방문, 예약 후 이용, 대기 시간 바로 입장, 친목, 아이",음식이 맛있어요,383,3
1648903512,jos****,항상 좋은 시간 보내고ㅇ갑니다 감사합니다,2025-02-26,"점심에 방문, 예약 후 이용, 대기 시간 바로 입장, 일상, 혼자",가성비가 좋아요,37,37
1648903512,예지니아,직장 동료들이랑 회식했어요 평일 저녁에도 예약하시길 추천해요,2025-02-25,"저녁에 방문, 예약 후 이용, 대기 시간 바로 입장, 친목, 지인・동료",주차하기 편해요,56,1
1648903512,Harryjuni,"더 많은 정보는 네이버에 '해리주니'를 검색하세요~👉주말에는 인기가 많은 만큼 웨이팅이 발생할 수 있는데요, ​애슐리 앱을 통해 미리 대기 등록을 할 수 있어 기다리는 동안 다른 일을 하거나 편하게 대기할 수 있었어요.이번 방문의 하이라이트는 코앞에 펼쳐진 베리 스위트 러브 딸기 이벤트였어요이벤트 현장은 딸기를 테마로 꾸며져 있어, 들어서는 순간 상큼한 딸기의 향기와 화사한 장식이 저의 마음을 사로잡았어요.화이트 크림과 신선한 딸기가 부드럽게 어우러진 롤 케이크는 한 입 먹을 때마다 달콤함과 깔끔한 산미가 느껴져, 입안에서 행복한 여운이 오래도록 남았어요. 딸기 피스타치오 밀푀유는 피스타치오 크림과 달콤한 딸기의 조화가 일품이었어요. 3월16일까지니까 딸기 좋아하시면 추천해요",2025-02-22,"점심에 방문, 예약 후 이용, 대기 시간 바로 입장, 일상, 연인・배우자, 아이, 부모님",음식이 맛있어요,220,1
1648903512,으구호,"가본 애슐리중 위생, 정리 가장 최악이였습니다.리뷰를 처음으로 달아봅니다.음식 덮어진 뚜껑이며 음식 푸는 식기류며 근처에 음식 다흘러있는데 치우는 사람 아예 없네요 들어오고 나갈때까지 70분 정도 있었는데 디저트 식기에 붙은게 그대로 있고 집게에 늘러붙은 음식때매 케이크가 안퍼집니다사진에 케이크푸는 스푼이 여러케이크가 다 엉켜서퍼지지도 않는데 한시간 내내 덩어리가 붙어있네요",2025-02-21,"저녁에 방문, 예약 없이 이용, 대기 시간 30분 이상, 데이트, 연인・배우자",매장이 넓어요,20,1
1648903512,아이쿠나11,1시간 정도 배부르게 먹고 왔습니다. 메뉴가 다양해서 좋아요!,2025-02-21,"저녁에 방문, 예약 후 이용, 대기 시간 바로 입장, 데이트, 연인・배우자",음식이 맛있어요,49,2
1648903512,민땡스66,이마트 방문하면서 오랜만에  예약 명단올리고  식사해보기로했지요ㅋ 평일 인데도 사람 대기 많더라구요먼저 쇼핑좀 하다  1시간 정도 이후  입장 배고파서  엄청 열심히 먹었답니다굿~^^,2025-02-21,"점심에 방문, 예약 후 이용",가성비가 좋아요,985,1
1648903512,오호라100,,2025-02-20,점심에 방문,음식이 맛있어요,1792,3
1648903512,별표73,잘먹었어요. 딸기맛있어요.,2025-02-20,"점심에 방문, 예약 없이 이용, 대기 시간 30분 이내, 친목, 친구",음식이 맛있어요,1136,5
1648903512,쭈쭈바5,딸기축제라 급하게 다녀왔어요매장 입장하자마자 딸기로 직행딸기가 알은 좀 작았지만 달고 맛있었어요다른메뉴들은 거의 먹던것만 먹는 스퇄이라다들아실꺼에요 그맛~~,2025-02-20,"점심에 방문, 예약 후 이용, 대기 시간 10분 이내, 일상, 지인・동료",음식이 맛있어요,149,2
1648903512,kgwole,👍,2025-02-19,저녁에 방문,음식이 맛있어요,1814,1
1648903512,sejin5,🙂‍↔️,2025-02-19,"저녁에 방문, 예약 없이 이용, 대기 시간 바로 입장, 친목, 친척・형제",샐러드바가 잘 되어있어요,745,1
1648903512,캐슬란55,딸기상태가 엄청 좋진않았지만  ㅜ 다양하게 잘 먹고왔어요 메뉴 가짓수는 많은데 딱히 ㅜㅜ,2025-02-18,"저녁에 방문, 예약 후 이용, 대기 시간 바로 입장, 친목, 친구",음식이 맛있어요,175,2
1648903512,누룽지에요,,2025-02-18,저녁에 방문,음식이 맛있어요,1216,9
1648903512,you****,예약하고 조금 미리 도착했으나 바로 안내해주시고 음식도 자극적이지 않고 신선했어요.가족과 함께 했는데 즐겁고 맛있는 시간이었습니다.,2025-02-18,"점심에 방문, 예약 후 이용, 대기 시간 바로 입장, 일상, 가족모임, 연인・배우자, 아이",음식이 맛있어요,7,1
1648903512,먹뽀야미,"평일 런치인데 한시간 넘게 기다렸어요 사람 엄청 많습니다,,샐러드바 깔끔하고 음식 비면 직원분들이 빠르게채워주세요 ㅎㅎ딸기 진짜 달고 맛있었어요 🥹",2025-02-18,"점심에 방문, 예약 없이 이용, 대기 시간 1시간 이상, 가족모임, 부모님, 친척・형제",음식이 맛있어요,234,1
1648903512,gmongee,위치도 좋고 이용하기 편리해요~ 평일 런치에 갔는데 착한 가격에 다양한 음식을 맛볼 수 있어서 좋았어요. 특별히 딸기 디저트도 있고요~~ 애슐리퀸즈 이마트 월계점 좋아요!,2025-02-17,"점심에 방문, 연인・배우자, 아이",음식이 맛있어요,67,2
1648903512,박월천,신세계 상품권 가능해서... 1만원은 상품권으로 쓰고 9900원만 결제해서 먹고 있어요. 가성비 굿!,2025-02-17,"점심에 방문, 예약 후 이용, 대기 시간 바로 입장, 친목",양이 많아요,277,1
1648903512,장군대박맘,"월계점 애슐리는 예약이 필수같다;;; 30분넘게 기다린듯. 그나마 이마트에서 쇼핑하면서 시간을 보냄~~음식은 주말여서 너무만족^^  음식종류도 다양하고, 디저트도 맛나고, 매장도 넓어서 너무 좋다^^너무많이먹어서 집까지 걸어갔다는ㅎㅎ",2025-02-16,"저녁에 방문, 예약 없이 이용, 대기 시간 30분 이상",음식이 맛있어요,240,3
1648903512,모모뮤,딸기축제,2025-02-16,"점심에 방문, 예약 없이 이용, 대기 시간 바로 입장, 기념일, 연인・배우자, 아이, 부모님, 친척・형제",음식이 맛있어요,599,8
1648903512,modestar71,좀 별로  였어요,2025-02-15,"저녁에 방문, 예약 후 이용, 대기 시간 30분 이내, 친목, 아이, 기타",단체모임 하기 좋아요,34,2
1648903512,kim****,딸기기간인데 ㅋㅋ 딸기상태 처참했어요 ㅋㅋ,2025-02-15,"점심에 방문, 예약 없이 이용, 대기 시간 10분 이내, 데이트, 일상, 연인・배우자",음식이 맛있어요,850,2
1648903512,천사맘436,아들생일기념으로 오랜만에 방문했어요..미리예약해서 편하게 잘먹었습니다..딸기축제라 딸기디저트 맛있어요,2025-02-15,"점심에 방문, 예약 후 이용, 대기 시간 바로 입장, 기념일, 연인・배우자, 아이",음식이 맛있어요,23,2
1648903512,흐르는 물처럼74,좋아요.,2025-02-14,"점심에 방문, 예약 후 이용, 대기 시간 10분 이내, 가족모임, 부모님",가성비가 좋아요,310,1
1648903512,아름다운 삶57,맛있어요,2025-02-14,"점심에 방문, 예약 후 이용, 대기 시간 바로 입장, 일상, 아이",음식이 맛있어요,1537,13
1648903512,파이어스28,"딸기철이에요. 디저트 코너에 딸기 관련 디저트 많아요. 초밥도 맛있는 메뉴 많고 전체적으로 골고루 맛있게 잘 먹었습니다. 다 쓴 식기수거하는 로봇 호출하는거 아이들이 좋아해요. 인상적인건 타코야끼가 진한 맛이 좋았고, 홍합탕 시원해서 좋았고, 생선 스테이크도 좋았어요",2025-02-12,"저녁에 방문, 예약 없이 이용, 대기 시간 바로 입장, 친목, 연인・배우자, 아이, 부모님",음식이 맛있어요,774,1
1648903512,love jj16,"우리딸들  실컷 배불리먹고 왔다네요맛있고,종류도 다양하고  서울에선처음가는곳인데나름 만족했다합니다",2025-02-11,"점심에 방문, 예약 없이 이용, 대기 시간 바로 입장, 여행, 친구, 친척・형제",음식이 맛있어요,391,1
1648903512,맛있는음식 좋아요,"애슐리 자주 가는데, 오랜만에 방문한 월계점은 너무 별로 였어요. 11시 예약했는데, 예약 후 들어가는 줄로 30분 기다렸고, 남자직원 한분이 응대하는데 매우 불친절!! 그리고 딸기 축제 딸기가 리필이 안되어서 줄 엄청서있고, 와플기계도 2개만 열려 있어서 다들 줄서서 굽고..음식 리필도 빨리 안해주고.. 평일 낮이라 사람 많이 없을거라 생각해서 음식 조금만 준비한건지, 아이용 포크 숟가락 없어서 요청 4번 만에 겨우 받아서 먹었네요. 아무튼 월계점 별로 였어요 ㅠ 그냥 다니던 지점 가야겠어요.",2025-02-10,"점심에 방문, 예약 후 이용, 대기 시간 30분 이내, 일상, 아이",음식이 맛있어요,304,5
1648903512,Traveler51,딸기데이,2025-02-08,"점심에 방문, 예약 후 이용, 대기 시간 10분 이내, 가족모임, 연인・배우자",음식이 맛있어요,1244,3
1648903512,ddd4667,딸기도 작지만 달았고 디저트류가 좋았음,2025-02-07,"점심에 방문, 예약 후 이용, 대기 시간 10분 이내, 친목, 지인・동료",음식이 맛있어요,1412,15
1648903512,FOR DREAM,딸기가 있어서 그런지 평소보다 사람들이 더 많은 느낌이에요. 딸기는 싱싱하고 맛있었습니다,2025-02-07,"점심에 방문, 예약 후 이용, 대기 시간 바로 입장, 일상, 친구",음식이 맛있어요,2025,6
1648903512,스타일리스트0,가격대비나쁘지않아여 가격대비나쁘지않아여,2025-02-07,"점심에 방문, 예약 후 이용, 대기 시간 바로 입장, 일상, 친구",양이 많아요,3,6
1648903512,뚱델라,맛잇게 먹고 왓어요 ㅎ,2025-02-06,"점심에 방문, 예약 없이 이용, 대기 시간 바로 입장, 일상, 친구",음식이 맛있어요,989,2
1648903512,나루미니,음식이 빨리 안채워진다는 후기가 좀 있어서 고민했는데 가보니 음식도 빨리 채워지고 맛있고 좋았어요! 특히 딸기 시즌시작해서 딸기를 빨리 안채워주는거 아닐지 걱정했는데 딸기도 엄청 많이 금방 채워져서 잘 먹었습니다 ㅎㅎ직원분들도 친절하시고 음식도 맛있어서 좋았어요~평일 1시에 왔는데 1시간 10분정도 기다렸어요.. 어플로 예약하시는거 추천신세계상품권도 사용 가능합니다!,2025-02-06,"점심에 방문, 예약 없이 이용, 대기 시간 1시간 이상, 일상, 부모님, 친척・형제",친절해요,8,1
1648903512,tta****,아이 졸업으로 미리 예약한 후 이용하였습니다.음식 종류도 다양하고 매장이 넓어 붐비지않게 이용할 수 있었습니다.,2025-02-06,"점심에 방문, 예약 후 이용, 대기 시간 바로 입장, 기념일, 아이, 부모님",재료가 신선해요,12,1
1648903512,앞집토토로,오랫만에 갔었는데 맛 좋네요.,2025-02-05,저녁에 방문,음식이 맛있어요,1309,2
1648903512,ho****,단체모임하기 좋습니다.,2025-02-05,"점심에 방문, 예약 후 이용, 대기 시간 바로 입장, 가족모임, 부모님",단체모임 하기 좋아요,9,2
