place_id,nickname,content,date,situations,keywords,review_count,visit_count
1243886495,papyruse83,매번 가보고 싶다 생각만 했다가 채식하시는 어머님과 함께 방문 했어요! 고기 메뉴도 있어요 ㅎㅎ담에 조용히 혼자 또 가려듀요,2025-03-04,"점심에 방문, 예약 후 이용, 대기 시간 바로 입장, 기념일, 가족모임, 연인・배우자, 아이, 부모님",음식이 맛있어요,11,1
1243886495,줄리아24,세곡동. 브런치카페를. 찾다가. 발견한 곳~~^^딸이랑. 신랑이랑. 방문했는데ᆢㅋㅋ. 그 곳이 블루리본식당이라니~~샐러드도. 맛있고ᆢ스테이크도 맛있네요^^,2025-03-01,"점심에 방문, 예약 후 이용, 대기 시간 바로 입장, 데이트, 연인・배우자",음식이 맛있어요,18,1
1243886495,브렌,양은 적지만 신선하고 모든 음식이 맛있어요,2025-02-27,"저녁에 방문, 예약 없이 이용, 대기 시간 바로 입장, 친목, 친구",음식이 맛있어요,222,1
1243886495,섬김2,버섯샐러드 야채가 너무 신선하고 스파게티도 맛있네요. 마지막에 디저트로 아이스크림 마무리한 행복한 시간이었어요.,2025-02-27,"저녁에 방문, 예약 후 이용, 대기 시간 30분 이내, 친목, 친구",인테리어가 멋져요,14,1
1243886495,로이테드,,2025-02-27,"저녁에 방문, 예약 후 이용, 대기 시간 바로 입장, 친목, 친구",음식이 맛있어요,14,1
1243886495,jYe,"가족 생일로 아이와 부모님 모시고 갔어요. 분위기도 좋고 너무 친절하셔서 기분좋은 식사 하고 왔어요. 가까운 곳에 공영주차장도 비싸지 않고 자리도 많아서 이용하기 편했어요. 생일이라서 케이크 들고 갔는데 접시랑 포크까지 준비해주셔서 너무 감사했어요. 보통 생일이어도 초만 불수 있고 먹는건 안되는 곳이 많은데, 여기는 말씀 드리기도 전에 알아서 다 준비해주셔서 편안하고 즐거운 마음으로 축하할수 있었습니다. 너무 감사드려요. 다음에는 친한 친구들이랑 방문하려합니다.",2025-02-27,"저녁에 방문, 예약 후 이용, 대기 시간 바로 입장, 가족모임, 아이, 부모님",음식이 맛있어요,26,1
1243886495,찡이310,예약 시간에 맞춰 여유롭게 식사하였습니다재료 본연의 신선한 맛이 좋았고 분위기도 너무 조용하고 좋았습니다,2025-02-25,"점심에 방문, 예약 후 이용, 대기 시간 바로 입장, 친목, 친구",음식이 맛있어요,9,1
1243886495,hj****,분위기 너무 이쁘고 음식도 맛나네요 ^^직원분들  센스굿,2025-02-24,"저녁에 방문, 예약 없이 이용, 대기 시간 10분 이내, 데이트, 친구",재료가 신선해요,18,1
1243886495,sunshine113,"건강한 맛, 신선한 재료, 분위기 맛집입니다!!",2025-02-24,"저녁에 방문, 예약 후 이용, 대기 시간 바로 입장, 친목, 친구",인테리어가 멋져요,5,1
1243886495,Teuniverse,모임장소 알아보려고 2층에서 식사하고 1층 카페로 왔습니다. 2층 레스토랑은 서빙서비스도 좋고 분위기도 좋아요. 기존에 안먹어보던 음식도 도전을 해봤는데 제게는 갸우뚱했어요. 제가 주문한 음식들의 합이 부조화였던건지 소스때문인지 조금 혀에 강한 느낌이 남아서 찝찝했어요. 그래서 1층카페에서 아메리카노 마시긴 했지만...1층 카페는 예쁜데 큰 나무들이 너무 많아서 내부가 어수선한 느낌이 좀 있었어요. 하지만 친절하고 싱그러운 분위기 때문에 재방의사가 있습니다. 담엔 1층카페에서 브런치 해보려구요,2025-02-24,"점심에 방문, 예약 없이 이용, 대기 시간 바로 입장, 일상, 지인・동료",재료가 신선해요,45,1
1243886495,vio****,알리오올리오.버섯샐러드.비스큐새우소스링귀니른먹었는데 하나같이 너무너무 맛있고특히 2층 레스토랑남자매니져님이정말 편안하고 친절하셔서 기분좋은 식사를 하고갑니다~기념일때 꼭 다시 오겠습니다^^,2025-02-23,"저녁에 방문, 예약 없이 이용, 대기 시간 바로 입장, 데이트, 연인・배우자",음식이 맛있어요,18,1
1243886495,qhrkfma,"자연광이 자동 뽀샵 해주는 인생사진 건질 수 있는 곳 찾으신다면 여기 가세요!!2층의 깔끔담백한 건강한 식사도 너무 좋았고,1층의 커피와 디저트도 너무 맛있었어요👍🏻재방문 의사 200%",2025-02-20,"점심에 방문, 예약 후 이용, 대기 시간 바로 입장, 일상, 친구",인테리어가 멋져요,29,1
1243886495,주관솔직히,착즙포도주스 사진보고 시켰는데 미리만들어서 냉동해놓고 파시는지 색상이 달라서 별로였음. 요리 재료가 굉장히 신선해서 좋았고 식전주스도 인상적입니다.,2025-02-17,"점심에 방문, 예약 후 이용, 대기 시간 바로 입장",음식이 맛있어요,558,1
1243886495,빵긋쌤,2층에서 밥 먹고 1층 내려와서 카페 이용했어요~ 건강한 음식을 먹을 수 있는 곳이네요~! 주말에 시간보내기 좋아요~!^^,2025-02-16,"점심에 방문, 예약 없이 이용, 대기 시간 바로 입장, 데이트, 연인・배우자",인테리어가 멋져요,37,1
1243886495,hx0****,초코바게트가 아주 달콤해요 아이스크림과 아주 잘 어울리네요,2025-02-16,"점심에 방문, 예약 없이 이용, 대기 시간 바로 입장, 데이트, 연인・배우자",재료가 신선해요,1,1
1243886495,푸우67,조용하고 깔끔해요. 가족 모임으로 좋아요~,2025-02-16,"점심에 방문, 예약 없이 이용, 대기 시간 바로 입장, 나들이, 연인・배우자",음식이 맛있어요,30,1
1243886495,하루92485,"분위기 좋고 넓고 음식이 맛있는 강남 세곡동 맛집이에요! 발렌타인데이 겸 애인 퇴사 파티 위해 분위기 좋은 세곡동 맛집 찾다가 예약 후 방문 했는데 진짜 최고의 선택이었습니다! 포도잎밥, 바질 뽀모도, 딸기샐러드 주문했는데 진짜 셋다 완전 신선하고 맛있었고 식전에 주시는 음료랑 빵도 짱 맛있었어요! 무엇보다 분위기가 너무 좋고 사진이 잘 나와서 좋습니다 ㅎㅎ 데이트코스, 소개팅, 상견례, 식사 대접, 가족식사 모임, 돌잔치 등으로 딱 좋은 곳이에요!",2025-02-14,"저녁에 방문, 예약 후 이용, 대기 시간 바로 입장, 데이트, 연인・배우자",음식이 맛있어요,30,1
1243886495,bebecuty,분위기💕 음식퀄리티💕 모임장소로 완전 추천해요!지금은 딸기샐러드 시즌이래요 꼭드세요!!🍓🍓🍓,2025-02-08,"점심에 방문, 예약 후 이용, 대기 시간 바로 입장, 친목, 지인・동료",음식이 맛있어요,18,1
1243886495,이언15,"부모님 모시고 다녀왔는데 기대에 비해 많이 아쉬웠어요…문제는 저 라자냐였는데, 라자냐 딱 나와서 먹는데 위에만 따뜻하고 아래는 차갑 (미지근이 아니라 정말 차가웠어요)더라고요.마지막에 오븐을 이용해서 그런 경우가 있다고 다시 해다 주신다 하셨는데, 새 음식이 아니라 저희가 먹던 거를 다시 데워주기만 하셔서 거의 죽 같았어요. 나머지 음식들은 괜찮았는데 가격 대비 양은 적어요.라자냐에서 너무 실망했습니다… 오븐을 사용하는 것이 어떻게 아래가 차가울 수 있는 이유인지 모르겠고, 그럴 수 있다 하더라도 잘 조리된 음식을 먹으려고 맛집을 찾아오는건데… 이럴거면 집에서 밀키트를 먹을걸 그랬네요.리뷰 삭제하지 말아주세요.",2025-02-02,"점심에 방문, 예약 후 이용, 대기 시간 바로 입장, 일상, 부모님",특별한 메뉴가 있어요,86,1
1243886495,별빛무지개,분위기가 정말 예쁘고 음식도 맛있었습니다~~~자연을 닮은 분위기에 음식들도 풍미가 좋아서 즐겁게 식사했습니다~~,2025-01-30,"점심에 방문, 예약 후 이용, 대기 시간 바로 입장, 친목, 친구",음식이 맛있어요,3,1
1243886495,은둥86,정갈한 음식 맛있게 먹어요. 임산부라 혹시 파스타 조리 시에 요리술이나 와인들어가는지 여쭤봤는데 친절히 답해주셔서 감사했습니다.,2025-01-20,"점심에 방문, 예약 후 이용, 대기 시간 바로 입장, 친목, 친구",음식이 맛있어요,33,2
1243886495,응슷응64,"한적하고 넓고 맛있어요. 어란파스타 맛있구요, 아이스크림 디저트가 JMT입니다. 잘 먹고 갑니다! 부릉~",2024-12-31,"저녁에 방문, 예약 후 이용, 대기 시간 바로 입장, 데이트, 연인・배우자",비싼 만큼 가치있어요,26,1
1243886495,bs1394,가족 모임하러 왔어요.맛있고 분위기 좋네요재방문 계획있습니다.,2024-12-28,"점심에 방문, 예약 후 이용, 대기 시간 바로 입장, 나들이, 친구, 친척・형제",음식이 맛있어요,218,1
1243886495,Avantgarde bong,세곡동에서 분위기 좋고 인테리어도 이쁜 곳을 찾았네요음식도 맛있고 친절하셔서 자주 들를 예정입니다디저트로 커피 시켰는데 커피맛도 좋아서 일층 카페도 들러보려고요,2024-12-26,"저녁에 방문, 예약 후 이용, 대기 시간 바로 입장, 데이트, 일상, 기념일, 연인・배우자",인테리어가 멋져요,12,1
1243886495,얀나4,치킨파스타랑 비스큐 파스타가 생면이라 소스랑 너무 잘어울리고 맛있았어요~ 오픈 샌드위치도 다 맛있고 그릭요거트 까지 먹으니까 너무 좋았습니다! 제일 맛있었던 라자냐! 강추합니다!!,2024-12-26,"점심에 방문, 예약 후 이용, 대기 시간 바로 입장, 친목, 지인・동료",단체모임 하기 좋아요,205,2
1243886495,lsj****,음식 감칠맛나게 좋았구음식에 대하여 친절한 안내가 멋있어요,2024-12-23,"점심에 방문, 예약 후 이용, 대기 시간 바로 입장, 가족모임, 친척・형제",음식이 맛있어요,2,1
1243886495,rut****,"바이탈바이브(Vital Vibe) 리뷰: 싱싱한 재료의 매력최근 방문한 바이탈바이브는 건강하고 신선한 음식을 찾는 사람들에게 완벽한 선택이었습니다. 이곳의 가장 큰 매력은 단연 싱싱한 재료입니다. 첫 입부터 신선함이 느껴지는 샐러드와 과일 스무디는 어디에서도 쉽게 맛볼 수 없는 수준이었어요.특히 샐러드의 채소는 마치 갓 수확한 것처럼 아삭아삭하고 싱그러움이 가득했습니다. 드레싱 역시 재료 본연의 맛을 살려주는 깔끔한 맛이어서, 과하거나 부담스럽지 않았습니다. 스무디는 신선한 과일만을 사용해 설탕 없이도 충분히 달콤하고 자연스러운 맛을 느낄 수 있었습니다.또한, 메뉴 전반에 걸쳐 화학첨가물을 배제하고 재료 본연의 맛에 집중하려는 철학이 돋보였습니다. 한 끼를 건강하게 해결하고 싶을 때, 바이탈바이브",2024-12-22,"점심에 방문, 예약 후 이용, 대기 시간 바로 입장, 친목, 친구",재료가 신선해요,14,1
1243886495,qwe****,맜있어요.동생도 맛있다고 다음방문 무조건입니다.,2024-12-20,"점심에 방문, 대기 시간 바로 입장, 가족모임, 친척・형제",음식이 맛있어요,281,1
1243886495,urmygreen87,분위기도 좋고 맛도 좋아요!,2024-12-19,"점심에 방문, 예약 후 이용, 대기 시간 바로 입장, 데이트, 연인・배우자",음식이 맛있어요,6,1
1243886495,시간 부자68,좋은 재료와 신건한 애채로 만든 음식!,2024-12-17,"저녁에 방문, 예약 후 이용, 대기 시간 바로 입장, 데이트, 연인・배우자",음식이 맛있어요,22,1
1243886495,바닐라우유68,시그니처 메뉴들 추천합니다! 그리고 식전빵과 웰컴드링크로 주시는 포도주스가 정말 맛있어요💕 특별한 날에 오기 좋은 곳이에요!!,2024-12-16,"저녁에 방문, 예약 후 이용, 대기 시간 바로 입장, 친목, 친구",음식이 맛있어요,7,1
1243886495,정인기7,"식사가 참 맛있고 고급스럽습니다. 식사를 주시면서 재료 설명도 해주시고 정성스러움이 느껴집니다. 또,  세심하게 배려해주시네요. 특별한 날 모임 또는 연인과 함께하기 좋을 것 같습니다.",2024-12-14,"저녁에 방문, 예약 후 이용, 대기 시간 바로 입장, 데이트, 연인・배우자",특별한 메뉴가 있어요,13,1
1243886495,jus****,분위기도 좋고 음식도 신선하고 맛있었습니다~만족스러운식사였어요^^,2024-12-11,"점심에 방문, 예약 없이 이용, 대기 시간 바로 입장, 친목, 지인・동료",음식이 맛있어요,8,1
1243886495,부메랑45,사진은 못찍었지만 뭐하나 아쉽지않고 좋은 식당이었어요사장님 및 직원분들이 친철하셨던게 가장 기억에 남아요감사합니다,2024-12-06,"저녁에 방문, 예약 후 이용, 대기 시간 바로 입장, 데이트, 연인・배우자",매장이 넓어요,3,1
1243886495,노을보러가쟈,"2층에 들어가면 넓은 통창이 꼭 액자 그림같아서 눈에 확 들어와요! 가을부터 겨울까지 계절감이 느껴지는 풍경에 클래식음악과 함께 들으며 앉아있으면 힐링 됩니다☘️ 감각적인 가구들과 조명, 와인과 소품들까지 감성 가득이에요~ 파스타는 태어나서 먹은 파스타중 최고였어요! 알리오 올리오부터 가지홍합 파스타까지 깔끔하고 감칠맛 나면서 건강에도 좋은 음식이라 먹을수록 입과 눈이 행복해요💕 다음에는 부모님 모시고 다시 재방문하러 갈게요! 친절한 직원분들과 사장님, 그리고 맛있는 음식으로 입을 기쁘게 해주시는 셰프님 감사합니다! 재방문의사 말해뭐해 300%! 3층 대관하러 또 올게요!",2024-11-30,"저녁에 방문, 예약 없이 이용, 대기 시간 바로 입장",친절해요,774,1
1243886495,su****,인테리어도 예쁘고 모임하기 좋은 곳 같아요. 음식 설명을 비롯해 직원분들의 응대는 다소 아쉬웠지만 분위기 좋고 건강한 음식 잘 먹고 왔어요.,2024-11-29,"점심에 방문, 예약 후 이용, 대기 시간 바로 입장, 일상, 아이, 부모님",재료가 신선해요,376,1
1243886495,푸몽이,"수서에 블루리본 선정된 찐맛집에 비건식당이 있다하여 방문했습니다. 일단 인테리어가 너무 예뻐서 공간에 반했고, 신선하고 건강한 맛의 음식에 두번 반했습니다..고급져서 특별한 날에 꼭 가보시길 추천합니다 ♡",2024-11-27,"저녁에 방문, 예약 후 이용, 대기 시간 바로 입장, 데이트, 친구",특별한 날 가기 좋아요,11,1
1243886495,허니듀이,분위기가 너무 근사한 레스토랑이에요. 세곡동에 이런곳이 있었다니. 블루 리본을 받아서 그런지 파스타도 너무 맛있어요. 인테리어가 예뻐서 또 찾고 싶은 곳이에요,2024-11-26,"점심에 방문, 예약 후 이용, 대기 시간 바로 입장, 데이트, 부모님",음식이 맛있어요,524,1
1243886495,오리20,"분위기가 너무 예쁘고 서비스가 좋아서소개팅이나 데이트하기에 찰떡이예요~❣️아픈 분들을 포함해서 모두가 먹을 수 있도록신경써서 만든 요리라서음식에서 인위적인 맛, 조미료 전혀 느낄 수 없는데신기하게 맛있어요~~음식 나오는 접시까지 다 예뻐서 더 맛있어요!웰컴드링크 포도부터 저희가 아는 주스맛 아니고진한 포도맛인데 훌륭해요ㅎㅎ한끼 잘 대접받는다는 느낌 들어요",2024-11-25,"저녁에 방문, 예약 후 이용, 대기 시간 바로 입장",친절해요,97,1
1243886495,생각하는별,스레드보고 간 바이탈 바이브에요분위기도 너무 좋구 음식도 특색있어서 좋았어요무엇보다 다들 너무 친절하시더라구요.주차도 여우롭게했습니다!친구에게 칭찬받고 또오기로했습니다👍🏻,2024-11-25,"저녁에 방문, 예약 후 이용, 대기 시간 바로 입장, 친목, 친구",특별한 메뉴가 있어요,16,1
1243886495,먹으면행복한 행돼,모든 메뉴가 정말 신선하고 좋은 재료를 썼다는 게 느껴지더라구요. 특히 저 페코리노 치즈가 올라간 호박 메뉴는 꼭 드셔 보세요. 🥹 처음먹어보는 맛인데 정말 너무 맛있습니다. 비스큐 파스타도 맛있고 포도 밥도 식감이 되게 독특한 게 좋았어요. 그리고 모든 층 인테리어가 너무 예쁘고 식기류 하나하나 고급스럽고 멋졌어요. 여긴 대관해서 스몰웨딩 해도 좋겠다는 생각을!!,2024-11-24,"저녁에 방문, 예약 후 이용, 대기 시간 바로 입장, 데이트, 연인・배우자",음식이 맛있어요,54,1
1243886495,황유진1899,"요 근래 방문했던 양식집 중에서 맛, 분위기, 서비스 모두 다 좋았던 식당이었어요ㅎㅎㅎ 일단 기본적으로 음식들이 다 맛있어서 좋았습니다ㅎㅎ 하우스와인도 주문해서 먹었는데 음식과도 너무 잘 어울렸어요~~ 다음에 재방문의사 완전 있습니다ㅎㅎㅎ 집 근처에 이렇게 분위기 좋고 맛있는 양식집이 있어서 넘 좋아요~~!!💓💓",2024-11-24,"저녁에 방문, 예약 없이 이용, 대기 시간 바로 입장, 친목, 친구, 지인・동료",음식이 맛있어요,22,1
1243886495,아기팬더39,분위기 좋고 음식이나 인테리어 하나하나 너무 예뻐요! 티라미수는 새로나왔다고하여 먹었는데 딱딱해서 저는 별로였어요 나머지는 다 맛있었습니다,2024-11-24,"점심에 방문, 예약 후 이용, 대기 시간 바로 입장, 가족모임, 아이, 부모님",인테리어가 멋져요,34,1
1243886495,heh****,매장 깔끔하고 이뻐요창가쪽 뷰도 이뻐요,2024-11-24,"점심에 방문, 예약 없이 이용, 대기 시간 바로 입장, 친목, 친구",인테리어가 멋져요,21,1
1243886495,제이셋3,음식도 너무 맛있고 창밖 뷰도 너무 예뻐요. 어란 성게알 파스타 강추에요,2024-11-24,"점심에 방문, 예약 없이 이용, 대기 시간 바로 입장, 일상, 연인・배우자",음식이 맛있어요,7,1
1243886495,seo****,공간도 음악도 음식도 넘 좋네요다시 올 예정입니다 :),2024-11-23,"점심에 방문, 예약 없이 이용, 대기 시간 바로 입장, 데이트, 연인・배우자",음식이 맛있어요,91,1
1243886495,까망머리 앤,지난번 모임으로 방문하고 맛있어서 동생들과 주말 산책에 방문했어요. 주말 브런치로도 딱 좋네요.,2024-11-23,"점심에 방문, 예약 후 이용, 대기 시간 바로 입장, 일상, 반려동물, 친척・형제",음식이 맛있어요,25,1
1243886495,감자4716,인테리어도 예쁘고 음식도 맛있는데 직원분들이 정말정말 친절하셔서 재방문 안할 수가 없을 것 같아용! 1층은 애완동물도 같이 출입 가능해서 산책하다가 들러도 좋을 가게입니다☺️🩷🌸,2024-11-23,"점심에 방문, 예약 후 이용, 대기 시간 바로 입장, 나들이, 일상, 부모님, 반려동물",음식이 맛있어요,6,1
1243886495,ley****,건강하고 맛있는 레스토랑부모님 모시고 재방문하고 싶어요🤍,2024-11-19,"점심에 방문, 예약 후 이용, 대기 시간 바로 입장, 데이트, 친목",음식이 맛있어요,30,1
1243886495,joybyell,"너무 좋아하는 곳인데(올해 5번째 방문) 메뉴가 바뀌는건지 점심,저녁 메뉴가 다른건지엄마 모시고 갔는데 많이 바뀐듯한 느낌이더라구요.음식은 여전히 건강하고 맛있었는데양도 적어진듯하고 (제 느낌일수도)메뉴도 적어서 고를게 많이 없었어요.크림소스류 파스타도 없어진듯하고요.",2024-11-17,"저녁에 방문, 예약 후 이용, 대기 시간 바로 입장, 일상, 가족모임, 아이, 부모님",인테리어가 멋져요,143,5
1243886495,flp****,분위기도 좋고~친절하시고~~~,2024-11-17,"저녁에 방문, 예약 없이 이용, 대기 시간 바로 입장, 일상, 연인・배우자",인테리어가 멋져요,3,1
1243886495,나이스켈리,친구 추천으로 방문했는데 브런치 덕분에 눈도 입도 호강하는 시간이었습니다 너무 예뻐서 먹기 아까울 정도였고 예쁜만큼 너무 너무 맛있어요 커피도 고소하고 깔끔해서 다시 방문하고 싶어요 직원분도 친절하시고 음악도 분위기도 만족스럽습니다.,2024-11-17,"점심에 방문, 예약 없이 이용, 대기 시간 바로 입장, 친목, 친구",친절해요,28,1
1243886495,purple0913,매장도넘이쁘고음식도넘정갈하고예쁘게나오면서맛나네요~가까운동네에이런식당이있어서브런치먹으러두번째방문입니다..신선한재료로건강한맛의음식에매우만족하며먹었네요.또또방문할께요~,2024-11-16,"점심에 방문, 예약 후 이용, 대기 시간 바로 입장, 가족모임, 연인・배우자",음식이 맛있어요,29,1
1243886495,세븐나인,"아이와 함께 가족외식으로 방문했는데 건강하고 맛있는 음식, 와인 먹기 좋은 고급스러운 분위기, 직원의 친절함에 감동받고 갑니다^^ 특별한 날 꼭 와보시길 추천드려요!!",2024-11-14,"저녁에 방문, 예약 후 이용, 대기 시간 바로 입장, 데이트, 연인・배우자, 아이",인테리어가 멋져요,123,1
1243886495,율리아노7,"갬성있는 1층 브런치카페, 편안한 분위기에 2층 레스토랑, 건강한 파스타와 예쁘고 맛있는 샌드위치를 먹으며 즐거운 시간 보내고 왔습니다.^^",2024-11-14,"점심에 방문, 예약 후 이용, 대기 시간 바로 입장, 일상, 연인・배우자, 아이",인테리어가 멋져요,342,1
1243886495,키레이짱,지인들과 점심 식사 했는데  주문한 모든 음식이 다 맛있어요^^특히 오픈샌드위치의 3개의 각각 다른맛의 매력이 있어 브런치로 추천합니다^^,2024-11-14,"점심에 방문, 예약 후 이용, 대기 시간 바로 입장, 친목, 지인・동료",매장이 넓어요,7,1
1243886495,MOVIE짱,"런치 코스가 좋았는데, 없어져서 아쉬웠어요 ㅠㅠ 다시 만들어주세영!!!!! 파스타랑 리조또는 정말 맛있어요~!! 양은 좀 작아서 많이 아쉽!! 1층 브런치 메뉴 중에 오픈샌드위치 맛나네요! 양 좀 늘려주세용^^",2024-11-14,"점심에 방문, 예약 후 이용, 대기 시간 바로 입장, 친목, 지인・동료",인테리어가 멋져요,18,4
1243886495,너구링50,"감성적인 플레이팅에 맛까지 완벽했고, 분위기도 편안하고 따뜻해서 너무 좋았어요 정말 무해하고 따뜻한 레스토랑이었어요 아주 행복하게 식사했습니다 다음에 또 방문할게요~^^❤️",2024-11-11,"저녁에 방문, 예약 후 이용, 대기 시간 바로 입장, 데이트, 연인・배우자",음식이 맛있어요,500,1
1243886495,찐7185,매번 친구들 데리고 가는데 친구들이 찐으로 좋아해요 음식이너무맜있고 베이커리도 다른곳에서맛볼수없는맛이에요 실력좋은쉐프님들이 모여있는곳같아요 😊직원분들도 친절하세요,2024-11-11,"저녁에 방문, 예약 후 이용, 대기 시간 바로 입장, 데이트, 친구",음식이 맛있어요,7,2
1243886495,TKTORWH,"음식은 깔끔하고 건강한 맛 그 자체입니다. 음식 하나하나에 정성을 쏟은 흔적이 보이네요. 다만, 가격에 비해 양이 너무 적어요. 3명에서 5개의 메뉴를 시켜서 겨우 허기를 면할 정도입니다. 양을 조금만 늘려주시면 좋겠네요.가게 내부는 차분하고 넓어서 여유로운 분위기여서 좋았네요.",2024-11-10,"저녁에 방문, 예약 후 이용, 대기 시간 바로 입장, 기념일, 연인・배우자, 아이",인테리어가 멋져요,4,1
1243886495,포카리297,음식 정성스럽게 나오고 맛있고 신선해요. 친절하시고 매장도 깨끗합니다.  가족이랑 좋은 시간 보냈어요,2024-11-09,"점심에 방문, 예약 후 이용, 대기 시간 바로 입장, 가족모임, 연인・배우자",음식이 맛있어요,8,1
1243886495,mkr,"너무좋음. 맛있는데 속도편함인테리어도이쁨테이블 사이 칸막이가 아닌 화분이 있어 분위기도 살고 좋음인테리어 랑 음식을 맛보면 하나하나가 신경써서 만들어진 기분임직원분이신줄알았는데 사장님이셨던것도 놀랍고너무나 친절하셔서 놀라고메뉴판 뒤 문구를 보고 음식에서 이런맛이 나는 이유에 대해 이해가되어 좋았습니다.나만 알고싶은 맛집, 속이 편해서 더 좋은 곳기념일에 가도 되고 평범한 일상속에 가도 특별한 날이 되는거같아 기분이 좋아요사장님 오래오래 운영해주세요",2024-11-08,"저녁에 방문, 예약 후 이용, 대기 시간 바로 입장, 데이트, 연인・배우자",음식이 맛있어요,50,1
1243886495,Yoni19,"분위기, 서비스, 맛 모두 빠짐없이 만족했어요! 자주 가고 싶은 곳이에요",2024-11-08,"저녁에 방문, 예약 없이 이용, 대기 시간 바로 입장, 데이트, 연인・배우자",음식이 맛있어요,21,1
1243886495,서재마미,멋스러움 폭발 이탈리안 레스토랑이에요.친한 친구나 연인 그리고 소중한 사람과 여유로운 시간을 보내기 좋은 세곡동맛집이에요.음식 하나하나 맛은 물론 비주얼까지 예술 작품같아요.,2024-11-06,"점심에 방문, 예약 후 이용, 대기 시간 바로 입장, 친목, 친구",음식이 맛있어요,1143,1
