place_id,nickname,content,date,situations,keywords,review_count,visit_count
1229610281,산들바람3,맛있어요 ㅎㅎ 잘 먹는 둘이가서 콜라하나에 메뉴 세개 했더니 딱 10마넌 나왔어요 ㅎㅎ,2024-09-08,"점심에 방문, 예약 후 이용, 대기 시간 바로 입장, 데이트, 연인・배우자",음식이 맛있어요,34,1
1229610281,타이거r,맛있어요,2024-08-18,"저녁에 방문, 예약 후 이용, 대기 시간 바로 입장",음식이 맛있어요,1218,1
1229610281,yoo****,5년 가까이 다니는동안 맛도 직원분들의 친절함도 변하지 않는..보물같은 레스토랑~~~!,2024-08-18,"점심에 방문, 예약 후 이용, 대기 시간 바로 입장, 기념일, 지인・동료",음식이 맛있어요,21,1
1229610281,mmm****,한우카르파치오는 특색있고 맛있어요! 다만 리조또랑 파스타는.. 기대에 못미쳤던것 같습니다ㅠ 가격에비해 양이 매우 적은느낌이에요,2024-08-17,"점심에 방문, 예약 후 이용, 대기 시간 바로 입장, 데이트, 연인・배우자",친절해요,6,1
1229610281,리뷰진심,"카르파치오 꼭 드세요 꼭 ! 진짜 너어무 맛있습니다 🩷 바 자리에 앉았는데 오픈키친이라 바로 앞에서 만들어주시는걸 볼수있어서 눈도 즐거웠습니다 💕 직원분들 또한 너무 친절했어요 😇 지방에도 생겼으면 좋겠어요 ,, 덕분에 시골쥐 입호강 왔어요 -!-!",2024-08-17,"점심에 방문, 예약 후 이용, 대기 시간 바로 입장, 여행, 친구",음식이 맛있어요,507,1
1229610281,보광맘16,음식이 맛있고 친절하세요^^  매장이 넓지는 않고 주차는 발렛주차 해주십니다.,2024-08-15,"점심에 방문, 예약 후 이용, 대기 시간 바로 입장, 친목, 친구",음식이 맛있어요,673,1
1229610281,먹깨비원영,"두번째 방문인데, 항상 너무 친절하시고 오픈키친이라 보는재미랑 깔끔함까지 볼 수 있어서 좋고, 음식은 말할 것 없이 항상 좋습니다. 천일이라 방문했는데 다음에 또 방문할 맛집👍🏻",2024-08-03,"저녁에 방문, 예약 후 이용, 대기 시간 바로 입장, 데이트, 연인・배우자",차분한 분위기에요,89,1
1229610281,Looknpurple,언제나 친절하고 맛있는 곳!,2024-07-31,"점심에 방문, 예약 후 이용, 대기 시간 바로 입장, 친목, 친구",음식이 맛있어요,493,3
1229610281,효ON댕쓰,맛도 분위기도 괜찮아요,2024-07-24,"점심에 방문, 예약 후 이용, 대기 시간 바로 입장, 데이트, 연인・배우자",친절해요,714,1
1229610281,염탐소름,,2024-07-12,저녁에 방문,음식이 맛있어요,3412,1
1229610281,제이케이회계사,이름값을 하는 가성비도 있는 맛집. 자리는 많지 않고 6명은 구석 공간만 앉을 수 있지만 젊은 연인 데이트하기 좋겠다. 하나하나 괜찮고 양도 많지는 않아서 둘이 가도 세가지는 주문해보길,2024-07-07,"점심에 방문, 예약 후 이용, 대기 시간 바로 입장, 데이트, 연인・배우자",음식이 맛있어요,637,1
1229610281,아야8742,또 가고 싶은 곳존맛존맛!!!!!,2024-07-06,"저녁에 방문, 예약 후 이용, 대기 시간 30분 이내, 데이트, 연인・배우자",음식이 맛있어요,163,1
1229610281,큰까마귀64,,2024-07-03,"저녁에 방문, 예약 후 이용, 대기 시간 바로 입장, 친목",음식이 맛있어요,1147,4
1229610281,브롤리,"10명의 직원 중 한 명도 주문 누락을 알아차리지 못한 무능한 오스테리아 오르조.키친이 보이는 바테이블에 앉아 2개의 에피타이저와 3개의 파스타를 주문함.5:45, 5:58, 6:08, 6:31, 6:33 간격으로 메뉴가 나옴. 세번째 디쉬가 나온 후, 15분이 지났는데 키친에서 아무도 조리하고 있지 않았고 키친 & 서빙 직원 모두 우르르 모여 간식을 나눠 먹고 있었음. 뒤늦게 메뉴 누락을 알아 차리곤 두개의 메뉴를 급하게 준비 하는게 보임. 뒤늦게 서빙 후 아무런 사과조차 없었음.7시까지 식사를 마쳤어야 하는데, 6시33분에 마지막 디쉬를 내어주고는 6시48분쯤와서 7시 예약테이블이 있다고 결제를 부탁하러 옴. 굉장히 불쾌했고 결제하고 나갈 때까지 사과 한마디 없었음.",2024-07-02,"저녁에 방문, 예약 후 이용, 대기 시간 바로 입장, 데이트, 일상, 연인・배우자",,9,1
1229610281,Wannabe80,파스타 맛집생면 파스타부드러운 스테이크매력적이고 따뜻한 분위기다만 양은 매우 적다,2024-06-30,"점심에 방문, 예약 후 이용, 대기 시간 바로 입장, 데이트, 연인・배우자",음식이 맛있어요,182,1
1229610281,elly0826,맛있어요,2024-06-27,"점심에 방문, 예약 후 이용, 대기 시간 바로 입장, 친목, 친구",음식이 맛있어요,2474,1
1229610281,HA하루RU,너무 맛있어요:),2024-06-24,"저녁에 방문, 예약 후 이용, 대기 시간 바로 입장, 데이트, 연인・배우자",음식이 맛있어요,239,1
1229610281,ros****,오랜만에 또 갔는데 진짜 넘 맛있어요. 양이 좀 적은게 흠이지 맛은 정말 보장이에요.👍🏻,2024-06-23,"점심에 방문, 예약 후 이용, 대기 시간 바로 입장, 친목, 친구",음식이 맛있어요,238,1
1229610281,몽5642,"기대하고 왔는데 여기가 왜 유명 맛집인지 모르겠음..둘이서 메뉴 다섯개 시켰는데, 메뉴가 나올때마다 점점 더 맛이 없는 매직.. 기본적으로 양은 다 너무 적고맛도 그다지.. 뽈뽀는 너무 질기고 리조또는 3분 카레 수준..너무 실망적..테이블 사이 간격도 너무 좁아 분위기도 별로..업친데 덥친 격으로 집왔는데 배탈남 ㅜ어떻게 유명해진건진 모르겠지만 너무 실망스러워 재방문 의사 없음",2024-06-12,"저녁에 방문, 예약 후 이용, 대기 시간 바로 입장, 데이트, 연인・배우자",,97,1
1229610281,맛탐집방,맛있어요 분위기도 좋구 직원들이 친절하게 잘해주셔서 기분좋게 먹고 왔어요~~~,2024-06-12,"저녁에 방문, 예약 후 이용, 대기 시간 바로 입장, 데이트, 연인・배우자",음식이 맛있어요,14,1
1229610281,루삥뽕8186,"홀 서버 분 음식 설명하려면 하고 말려면 마세요 ,말끝 다 흐리고 돈 내고 밥먹는데 불편하네요 .음식 은 또 한손으로 툭 내려놓는건 뭐하자는거죠 ㅋㅋ",2024-06-09,"점심에 방문, 예약 후 이용, 대기 시간 바로 입장, 데이트, 연인・배우자",재료가 신선해요,31,1
1229610281,꼭구마,"구성 좋은 메뉴와 아늑한 분위기 덕분에 왜 데이트 명소로 불리는 식당인지 단번에 납득할 수 있었습니다. 음식의 맛도 우수했고, 직원분들의 세심한 배려가 편안한 식사를 이어갈 수 있게 도와줬습니다. 2인 식사 자리가 필요할 때 재방문하고 싶은 가게입니다.",2024-05-27,"저녁에 방문, 예약 후 이용, 대기 시간 바로 입장, 친목, 친구",친절해요,180,1
1229610281,루시드40,음식은 맛있으나 비싸고 양이 적음. 둘이 가서 메뉴 3개 이상 주문해야 적당한 양,2024-05-22,점심에 방문,음식이 맛있어요,408,1
1229610281,maraton,파스타는 맛남,2024-05-19,저녁에 방문,음식이 맛있어요,1355,2
1229610281,최라부,한우 카르파치오랑 우니 파스타가 정말 맛있어요,2024-05-19,"점심에 방문, 예약 후 이용, 대기 시간 바로 입장, 기념일, 가족모임, 부모님",음식이 맛있어요,913,1
1229610281,주야세상,존맛탱..💛,2024-05-07,"저녁에 방문, 예약 후 이용, 대기 시간 바로 입장, 데이트, 연인・배우자",음식이 맛있어요,597,1
1229610281,cu****,맛있,2024-05-02,"저녁에 방문, 예약 후 이용, 대기 시간 바로 입장, 데이트, 연인・배우자",음식이 맛있어요,2478,1
1229610281,이세상엔재밌고맛있는게너무많아,"간이 아주아주 쎘습니다.화이트라구는 물타서 먹으니 딱좋았어요ㅠ하지만 맛의 밸런스, 풍미, 매장의 분위기, 친절함다 너무 좋았습니다!",2024-04-29,점심에 방문,인테리어가 멋져요,200,1
1229610281,쩝쩝9292,제가 짜게 먹는편인데도 간이 좀 많이 쎈편입니다그점빼고는 직원분들도 친절하시고 맛있게 먹었어요!,2024-04-29,"점심에 방문, 예약 후 이용, 대기 시간 바로 입장, 데이트, 친목, 나들이, 연인・배우자, 친구, 지인・동료",인테리어가 멋져요,10,1
1229610281,영주5412,식기류도 멋스럽고 분위기도 좋습니다!대표메뉴 두가지를 먹어봤는데 화이트라구파스타는 생면이 맛있었지만 식사용으로는 짜서 와인이나 맥주와 함께 먹기 좋아여,2024-04-23,"점심에 방문, 예약 후 이용, 대기 시간 바로 입장, 친목, 친구",음식이 맛있어요,206,1
1229610281,아노자비토,,2024-04-19,"저녁에 방문, 예약 후 이용, 대기 시간 바로 입장, 데이트, 연인・배우자",음식이 맛있어요,406,1
1229610281,neeeeee,"모든 음식이 맛있었지만, 우니를 비싼데서만 먹어야 비리지 않는데, 한 번 도전해 본 오르조의 우니파스타는 정말 그 어디서 먹은것보다 맛있었어요!정말정말 좋은 추억이 되었던것 같아서 다음에도 그 다음에도 재재재방문의사가 가득합니다",2024-04-17,"저녁에 방문, 예약 후 이용, 대기 시간 바로 입장, 기념일, 연인・배우자",음식이 맛있어요,40,1
1229610281,jjimsta,음식은 맛있었습니다 주문받는 여직원이 불친절해서 기분이 좋지 않았습니다 함께 방문한 일행도 똑같이 기분을 느껴 아쉬웠네요 남직원분은 친절하고 좋았습니다,2024-04-14,"점심에 방문, 예약 후 이용, 대기 시간 바로 입장, 데이트, 연인・배우자, 친구",음식이 맛있어요,1461,1
1229610281,초코빵475,"바 자리에 앉아서 먹었고, 그래서인지 좀 덥긴 했습니다. 뽈뽀 나눠먹고 각자 파스타, 리조또 먹었는데 나눠먹을지도 미리 확인해주시더군요.(친구가 감기라 나눠먹지 않기로 함) 와인이 정말정말 땡겼지만 뒷 일정때문에 못 마신 게 아쉽네요. 시그니처라고 하신 리조또는 맛있었는데 혼자 다 먹기에는 조금은 물렸습니다. 고추기름때문에 중화풍 느낌도 들긴 했구요. 다음엔 여럿이 가서 나눠먹고 싶어요.",2024-04-11,"점심에 방문, 예약 후 이용, 대기 시간 바로 입장, 친구",음식이 맛있어요,751,1
1229610281,가앙83,맛있습니다.한우 카르파치오 특히 맛있었구요.화이트라구나 홍게리조또도 좋았어요,2024-04-07,점심에 방문,음식이 맛있어요,1514,1
1229610281,로도딕,캐치테이블로 예약하고 방문했습니다.재료가 굉장히 신선하고 뿌려진 소스가 굉장히 맛있었어요저희는 운전을 해야해서 술은 먹지 못 했지만 저희가 먹은 메뉴들이 대부분 오일리해서 술을 마시고싶더군요.양은 좀 적은 느낌입니다.우니 파스타의 우니 향이 많이 나지는 않습니다.,2024-03-17,"저녁에 방문, 예약 후 이용, 대기 시간 바로 입장, 데이트, 연인・배우자",친절해요,17,1
1229610281,고고밤주,맛도 서비스도 식당 분위기도 최고네요!! 너무 감사히 잘먹었습니다 ㅎㅎㅎ,2024-03-15,"점심에 방문, 예약 후 이용, 대기 시간 바로 입장, 데이트, 연인・배우자",음식이 맛있어요,302,1
1229610281,win****,파스타가 정말 맛있어요.,2024-03-15,"점심에 방문, 예약 후 이용, 대기 시간 10분 이내, 일상, 친구",음식이 맛있어요,902,1
1229610281,모먹살,기념일이라 예약해서 방문했습니다! 워낙 유명한 곳이라 기대하기도 했는데 전 메뉴 다 만족스럽게 잘 먹고 왔습니당  리조또는 후기처럼 생각보다 매워서 맵찔이분들은 속아프실수도 있을 것 같아요..? 서버분들도 다 친절하시구 좋은 시간 보냈어용 다음엔 디너타임 노려볼게요 ㅎㅎㅎ,2024-03-06,"점심에 방문, 예약 후 이용",음식이 맛있어요,573,1
1229610281,스누피오메가,"워낙 검증된 맛집이라 딱히 음식 칭찬할 필요가 있을까하는 고민 중에 정우성님도 잘 생겼다는 이야기는 아무리 들어도 질리지 않는다고 인터뷰 한 것이 떠올라 리뷰 남깁니다. 예약이 녹록치 않은 인기 맛집이지만, 한번쯤 도전해서 합리적인 가격에 맛있는 음식을 즐기기를 주변에 권고할 수 있는 훌륭한 식당입니다.",2024-03-03,"점심에 방문, 예약 후 이용, 대기 시간 바로 입장, 데이트, 연인・배우자",음식이 맛있어요,33,1
1229610281,529529,맛있어요,2024-03-03,"점심에 방문, 예약 후 이용",음식이 맛있어요,331,1
1229610281,바안짝,예약 후 이용했습니다~ 특이한메뉴들 잘 먹었어요~ 음식나온순서로 사진올렸어요~ 개인적으로는 한우카르파치오가 제일 맛있었어요! 파스타는 고기맛이 많이나고 짭쪼롬합니다~ 리조또는 살짝 매워요~,2024-03-01,"점심에 방문, 예약 후 이용, 대기 시간 바로 입장, 데이트, 친구",음식이 맛있어요,120,1
1229610281,Looknpurple,맛있고 서비스 좋아요.,2024-02-20,"점심에 방문, 예약 후 이용, 대기 시간 바로 입장, 친목, 친구",음식이 맛있어요,493,2
1229610281,자유로운하마,조명 너무 어두움. 자리 좁음. 가게가 작아서 시끌벅적하고 다 붙어있음. 파스타만 맛있고 다 그냥 그러저럭~ 항정살은 느끼한 거 좋아하는 나도 못 먹겠음. 너무 느끼함. 기름을 마시는 느낌. 스태프도 그렇게 친절하시거나 센스 있다라는 느낌은 없었던듯. 특히 여자분들. 제가 기대가 너무 높았던듯 합니다… ;,2024-02-08,"저녁에 방문, 예약 후 이용, 대기 시간 바로 입장, 친목, 기념일, 친구",,56,1
1229610281,무적피카츄,,2024-02-02,"점심에 방문, 예약 후 이용, 대기 시간 바로 입장",인테리어가 멋져요,551,1
1229610281,쩝쩝박사님께물어보세요,,2024-01-28,"저녁에 방문, 예약 후 이용, 대기 시간 바로 입장, 데이트, 기념일, 연인・배우자",음식이 맛있어요,422,1
1229610281,금빛할망구,한 5번째 왔나ㅎㅎㅎ 늘 와도 맛있네요!!,2024-01-26,"저녁에 방문, 예약 후 이용, 대기 시간 바로 입장, 데이트, 연인・배우자",음식이 맛있어요,328,2
1229610281,옌이93,👍,2024-01-21,"저녁에 방문, 예약 후 이용, 대기 시간 바로 입장, 데이트, 기념일, 연인・배우자",음식이 맛있어요,1017,1
1229610281,짐짐74,가서 아묻따 화이트라구에 트러플 추가해서 각 1그릇씩 드세욤... 대존맛,2024-01-20,"저녁에 방문, 예약 후 이용, 대기 시간 바로 입장, 데이트, 연인・배우자",음식이 맛있어요,94,2
1229610281,맛좋은유자,리조또는 처음 먹어봤는데 매콤하니 맛있더라구요!파스타는 역시나 맛있구요 물론 카르파치오도!!항상 갈때마다 맛이 변하지 않아서 오히려 더 맛있어지는 것 같아서 방문이 걱정되지 않네용!!!주문이 안 들어가서 좀 기다렸음에도 먹자마자 마음이 다 풀렸었답니당,2024-01-18,"저녁에 방문, 예약 후 이용, 대기 시간 바로 입장, 친목, 친구",특별한 날 가기 좋아요,960,2
1229610281,콩콩1,가격대가 좀 있는 편이지만 소중한 사람 대접하기 괜찮은 식당인것 같아요.메뉴 하나하나 맛이 다 좋았네요ㅎㅎ하우스 와인이 꽤나 맛있었고 화이트 라구파스타에 추가한 트러플 진짜 은은하게 맛있었어요!,2024-01-17,"저녁에 방문, 예약 후 이용, 대기 시간 바로 입장, 데이트, 기념일, 연인・배우자",친절해요,170,1
1229610281,진미유람단,정말 맛나고 좋아요 또 가고싶어요,2024-01-07,"저녁에 방문, 예약 후 이용, 대기 시간 10분 이내, 데이트, 연인・배우자",인테리어가 멋져요,622,1
1229610281,무디1,이전부터 와보고 싶었던 곳인데 너무 만족했습니다 다른 사람들 먹는 메뉴 다 먹었고 오늘의 와인 글라스로 먹었는데 너무너무 맛있어서병으로 시킬 걸 아쉬웠어요 양은 적어요. 둘이서 세개는 시켜야해요 분위기는 너무 좋고 연말 느낌? 밥먹다 눈오는데 낭만적이어서 더 좋았어요 가끔 특별한 날 데이트 장소로 추천해요,2024-01-06,"저녁에 방문, 예약 후 이용, 대기 시간 바로 입장, 데이트, 연인・배우자",음식이 맛있어요,191,1
1229610281,꾸일이,너무 맛있어요 메인 요리는 먹느라 사진 못 찍은 .. 진짜 맛있어요 !!! 금요일 저녁 예약하고 갔는데 만석이었어요 홀은 좁으나 직원분들이 곳곳에 계셔서  서비스적인 측면에선 만족스러웠습니다!!재방문 의사 있습니다 인기가 많은 이유가 있어요ㅠㅠ 사진 보니까 또 먹고싶네요....................... 💘양식이라 그런디 양은 적은 편이에요!!,2024-01-05,저녁에 방문,음식이 맛있어요,510,1
1229610281,Looknpurple,생면 파스타도 맛있고 모든 메뉴가 맛있어요.,2024-01-02,"점심에 방문, 예약 후 이용, 대기 시간 바로 입장, 친목, 지인・동료",음식이 맛있어요,493,1
1229610281,마음이예쁜건상콤하고달콤해,근사한 식사 잘먹었습니다,2023-12-30,"저녁에 방문, 예약 후 이용, 대기 시간 바로 입장, 친목, 기념일, 친구",음식이 맛있어요,771,1
1229610281,Roring,캐치테이블로 3일전쯤 남은자리 겟하고 방문했어요! 평일 낮이였는데도 이미 예약이 어렵더라구요 ㅎㅎ 한우 카르파치오가 궁금해서 방문했는데 듣던대로 정말 맛있었고 화이트 라구 파스타도 치즈맛이 진한게 맛있었어요! 생면도 얇고 식감도 좋았구요!! 다만 리조또는 많이 짜서 남겼어요 조금 덜 짜게 만들어도 좋을 것 같고 크랩은 거의 없긴하더라구요 ㅎㅎ 모두 친절하시고 빠르셔서 편하게 먹고 갑니다아!!,2023-12-28,"점심에 방문, 예약 후 이용, 대기 시간 바로 입장, 데이트, 연인・배우자",음식이 맛있어요,773,1
1229610281,토마토맘16,가지튀김 맛있어요.,2023-12-27,"점심에 방문, 예약 없이 이용",음식이 맛있어요,2412,1
1229610281,심플127,맛있어요,2023-12-27,"점심에 방문, 예약 후 이용, 대기 시간 바로 입장, 데이트, 연인・배우자",음식이 맛있어요,1421,1
1229610281,GRock,맛있고 친절해요. 가격은 비싸지만 그만큼 맛있고 아쉬운점은 양이 적어요,2023-12-19,"저녁에 방문, 예약 후 이용, 대기 시간 바로 입장, 데이트, 연인・배우자",음식이 맛있어요,55,1
1497299219,minstar0817,"라자냐랑 뽈뽀맘보, 뇨끼 프릿츠 이렇게 세 개 메뉴를 둘이서 먹었습니다. 샹그리아는 논알콜이었는데 너무 맛있었어요! 나머지 메뉴들도 지중해 온 느낌으로 맛있게 잘 먹었습니다. 평일에는 예약 안하셔도 괜찮을 것 같아요!",2025-04-10,"저녁에 방문, 예약 후 이용, 대기 시간 바로 입장, 가족모임, 친척・형제",음식이 맛있어요,9,1
1497299219,ROSSCHILD,깔끔하고 정갈하게 음식이 나옵니다편안한 분위기에 캐주얼한 식사 자리에 좋은거 같아요,2025-04-10,"저녁에 방문, 예약 후 이용, 대기 시간 바로 입장, 데이트, 연인・배우자",음식이 맛있어요,56,1
1497299219,밍덩v,분위기가 너무 좋고 맛도 맛있었어요 음식도 신선하고 라자냐 짱짱 여기오면 라자냐 꼭 시키세요,2025-04-10,"저녁에 방문, 예약 없이 이용, 대기 시간 바로 입장, 친목, 친구",음식이 맛있어요,147,1
1497299219,수요미식회,뽈뽀 먹고싶었는데 맛있게 잘먹었습니다 ^^,2025-04-10,"저녁에 방문, 예약 후 이용, 대기 시간 바로 입장, 친목, 지인・동료",특별한 메뉴가 있어요,26,1
1497299219,hs****,너무 맛잇고 외국온거 같아요ㅎㅎ,2025-04-10,"점심에 방문, 예약 후 이용, 대기 시간 바로 입장, 친목, 친구",인테리어가 멋져요,26,1
1497299219,자라44,와 진짜 맛있고 직원분들 완전 친절해요다음에 또 오려구요 이거 진심입니다그리고 매니저님께서 추천해주신 가게도 완전 만족 감사합니다 🔥,2025-04-09,"저녁에 방문, 예약 없이 이용, 대기 시간 바로 입장, 친목, 친구, 지인・동료",음식이 맛있어요,26,1
1497299219,jerry4233,데이트하기 최고입니다~!!,2025-04-09,"저녁에 방문, 예약 후 이용, 대기 시간 바로 입장, 데이트, 연인・배우자",음식이 맛있어요,32,1
1497299219,han****,음식이 맛있고 분위기가 좋아요~,2025-04-09,"저녁에 방문, 예약 없이 이용, 대기 시간 바로 입장, 데이트, 연인・배우자",음식이 맛있어요,44,1
1497299219,아이리95,가게도 이쁘고 음식이 넘 맛있어요!!! 라자냐도 맛있고 스테이크도 넘 맛있어요!! 직원분들도 친절하세요 다음에 또 방문할거예요,2025-04-09,"점심에 방문, 예약 후 이용, 대기 시간 바로 입장, 친목, 친구",음식이 맛있어요,14,1
1497299219,위니7316,음식이 맛있고 친절해요~♡,2025-04-09,"점심에 방문, 예약 없이 이용, 대기 시간 바로 입장, 데이트, 친목, 연인・배우자",음식이 맛있어요,5,1
1497299219,maroeyes50,"벚꽃구경하고 밥먹으러왔어요!! 맛은 당연히 맛있고 음악.인테리어,날씨 모두 완벽하네요^^",2025-04-09,"점심에 방문, 예약 후 이용, 대기 시간 바로 입장, 나들이, 부모님",음식이 맛있어요,11,1
1497299219,dbf****,가보고 싶던 곳이라 예약했는데 여자친구도 너무 좋아하고 덕분에 행복하게 식사했어요.. 너무 맛있고 특별한 메뉴도 다양해서 모든 메뉴 먹고싶어요 ㅠ,2025-04-08,"저녁에 방문, 예약 후 이용, 대기 시간 바로 입장, 데이트, 연인・배우자",음식이 맛있어요,23,1
1497299219,luc****,해방촌 하면 앞으로 여기 밖에 생각 안날듯 메뉴 하나하나가 너무 맛있고 친절하시고 메뉴 도장깨기 하러 와야겠어요,2025-04-08,"저녁에 방문, 예약 없이 이용, 대기 시간 30분 이내, 데이트, 연인・배우자",친절해요,16,1
1497299219,gya****,라자냐가 진짜 맛있습니당 !! 창문 열어주셔서 밖 뷰도 보이는데 감성 좋고 노래도 좋아요데이트 코스로 추천드립니다아,2025-04-08,"저녁에 방문, 예약 없이 이용, 대기 시간 바로 입장, 친목, 친구",인테리어가 멋져요,12,1
1497299219,HeliA61,진짜 너무너무너무너무너무 맛있어요!!!! 라자냐 위에 치브 부어주실 때 완전 군침이 쏴악!!! 음식 나올때마다 친절히 설명해주셔서 맛이 더 있었어요~~ 기회가 된다면 담에 또 오고 싶어요~,2025-04-08,"점심에 방문, 예약 후 이용, 대기 시간 바로 입장, 나들이, 친구",음식이 맛있어요,12,1
1497299219,qkr****,스테이크가 품절이여서 아쉽게 못 먹었지만 뽈뽀맘보 이거 진짜 맛있어요 ㅠㅠ 꼭드세요,2025-04-08,"점심에 방문, 예약 후 이용, 대기 시간 바로 입장, 데이트, 연인・배우자",음식이 맛있어요,2,1
1497299219,jie****,맛있게 잘 먹었습니다~,2025-04-08,"점심에 방문, 예약 후 이용, 대기 시간 30분 이내, 친목, 친구",음식이 맛있어요,33,1
1497299219,shd****,음식도 다 맛있고 애기도 뇨끼 잘 먹었어요ㅎㅎ,2025-04-08,"점심에 방문, 예약 후 이용, 대기 시간 바로 입장, 나들이, 연인・배우자, 아이",친절해요,12,1
1497299219,rhd****,예전부터 궁금해서 예약 후 방문 했는데 인테리어나 분위기가 너무 좋아서 음식 맛도 더 좋게 느껴졌어요! 뇨끼랑 리조또까지 같이 먹었는데 뇨끼가 특히나 맛있었어요😍,2025-04-08,"점심에 방문, 예약 후 이용, 대기 시간 바로 입장, 데이트, 연인・배우자",친절해요,70,1
1497299219,Haallong,친구랑 데이트하려고 예약했는데 아주 맛있게 잘 먹었습니다:),2025-04-08,"점심에 방문, 예약 후 이용, 대기 시간 바로 입장, 친목, 친구",음식이 맛있어요,16,1
1497299219,dewsini,맛집찾아보다가 미친비쥬얼❤️여긴 꼭와야해풍성한 치즈 하트뿅뿅입니다치즈 라자냐 당연맛있고 문어 카르파치오도 맛있어요스프릿츠도 맛있었어요 담에 또 올꺼예요,2025-04-08,"점심에 방문, 예약 없이 이용, 대기 시간 10분 이내, 친목, 친구",음식이 맛있어요,11,1
1497299219,최명기81,정말 맛있습니다 분위기도 갠찬구요 갠히 맛집이 아닌거같습니다 ㅎ 또 재방문 할거같아요~,2025-04-08,"점심에 방문, 대기 시간 30분 이내, 데이트, 연인・배우자",음식이 맛있어요,23,1
1497299219,ang****,뽈뽀 꼭 시키세용 ☺️ 스페인에서 먹엇던 맛의 80프로 이상 구현한 듯 합니당,2025-04-08,"점심에 방문, 예약 후 이용, 대기 시간 바로 입장, 데이트, 연인・배우자",음식이 맛있어요,49,1
