place_id,nickname,content,date,situations,keywords,review_count,visit_count
1253486915,포커45,딱 뚜껑 열었을 때 비주얼 너무 예뻐용 ㅎㅎ 중랑천 가려고 찾아보고 들렀는데 매장 넓고 쾌적합니당!!,2025-04-08,"저녁에 방문, 예약 없이 이용, 대기 시간 바로 입장, 데이트, 연인・배우자, 친구",매장이 넓어요,9,1
1253486915,woo****,조개찜 먹었는데 양도 푸짐하고 종류도 많아서 맛있게 먹었어요!!국물도 진하고 조개 다 건져먹고 먹는 소고기 샤브랑 칼국수가 최고예요!!👍👍,2025-04-08,"저녁에 방문, 예약 없이 이용, 대기 시간 바로 입장",음식이 맛있어요,87,1
1253486915,ksy****,결기라서 맛집 찾다가 발견했어요.맛있고친절하고 양도 무지 많아요. 모두모두 만족했습니다.,2025-04-07,"저녁에 방문, 예약 없이 이용, 대기 시간 바로 입장, 데이트, 연인・배우자",음식이 맛있어요,10,1
1253486915,rnr****,재료가 신선해서 너무 맛있어요. 저희 가족 최애 외식 장소입니다^^  아이들도 너무 잘 먹어요~사장님 포함 직원분들도 매우 친절합니다!!강추강추강추!!!,2025-04-07,"저녁에 방문, 예약 후 이용, 대기 시간 바로 입장, 가족모임, 아이",음식이 맛있어요,4,1
1253486915,aqua9775,맛있고 친절합니다,2025-04-07,"저녁에 방문, 예약 후 이용, 대기 시간 바로 입장, 가족모임, 부모님",음식이 빨리 나와요,1578,1
1253486915,이쁜송이20,사장님 너무 친절하시고 양도 많고 재료가 신선합니다자주 이용할거 같아요맛있게 잘 먹었습니다~~,2025-04-06,"밤에 방문, 예약 후 이용, 대기 시간 바로 입장, 가족모임, 아이, 부모님",음식이 맛있어요,13,1
1253486915,hae****,직원분도 친절하시고 너무맛있어요 ㅎㅎㅎㅎ면목점대박나세요!!!!!,2025-04-06,"저녁에 방문, 예약 후 이용, 대기 시간 바로 입장, 데이트, 친구",음식이 맛있어요,54,1
1253486915,ksy****,너무오랜만에  왔는데요  너무 맛있게  먹었어요여전히   변하지않은  맛입니다  최고에요  또 생각나면  또 와야죠   단골집으로  찍었어요,2025-04-06,"저녁에 방문, 예약 후 이용, 대기 시간 바로 입장, 데이트, 연인・배우자",음식이 맛있어요,8,1
1253486915,ㅇ354,왔다갔다하면서 사람들이 항상 많아 오고 싶었는데 드디어 와봤어용!! 역시 사람 많은 이유가 있어요!!! 조개들도 싱싱하고 양도 많아요!!,2025-04-05,"저녁에 방문, 예약 없이 이용, 대기 시간 바로 입장, 데이트, 연인・배우자",음식이 맛있어요,9,1
1253486915,송명준88,양도 많고 맛있게 먹었습니다😊,2025-04-05,"저녁에 방문, 예약 없이 이용, 대기 시간 바로 입장, 친목, 연인・배우자",음식이 맛있어요,5,1
1253486915,GB10,"둘이 와서 조개찜 소 ,활 쭈꾸미 샤브 시켯어요~",2025-04-04,"저녁에 방문, 예약 없이 이용, 대기 시간 바로 입장, 일상, 연인・배우자",음식이 맛있어요,1,1
1253486915,상큼이628,청결하고 직원분도 넘 친절했어요무엇보다 맛있어용! 또올께요~😊,2025-04-03,"밤에 방문, 예약 후 이용, 대기 시간 바로 입장, 친목, 지인・동료",음식이 맛있어요,43,1
1253486915,링링39,찌마기 역시 맛있어여 여러번 방문했어용!! ㅎㅎ,2025-04-03,"밤에 방문, 예약 후 이용, 대기 시간 바로 입장, 데이트, 연인・배우자",음식이 맛있어요,23,1
1253486915,헤이쥬드4,동네에 있는데 매번 지나치면서만 보다가 와봤어요! 푸짐하고 맛도 좋네요! 또 올게요~,2025-04-03,"저녁에 방문, 예약 없이 이용, 대기 시간 바로 입장, 데이트, 연인・배우자",재료가 신선해요,19,1
1253486915,gentleman89,ㅇ,2025-04-03,저녁에 방문,,1291,2
1253486915,초이수비아,지나가다가 한번 와보고싶었는데 왜 이제야 왔는지 ... 구성도 푸짐하고 해산물 메뉴도 있어서 조아요 너무 신선하고 맛있네요 😋,2025-04-03,"저녁에 방문, 예약 없이 이용, 대기 시간 바로 입장",음식이 맛있어요,115,1
1253486915,1700854,조개찜 생각날 때 믿고 오는 곳이에요!조개가 싱싱해서 석화는 여기서만 먹어요~~😊,2025-04-03,"저녁에 방문, 예약 후 이용, 대기 시간 바로 입장, 데이트, 연인・배우자",매장이 넓어요,45,4
1253486915,코코짱zzang,쭈꾸미철에 방문하니깐 살아 움직이는걸로 주셨어요! 매장도 엄청 넓고 친절하십니당,2025-04-03,"저녁에 방문, 예약 없이 이용, 대기 시간 바로 입장, 데이트, 친목, 일상, 연인・배우자, 친구, 지인・동료",매장이 청결해요,12,1
1253486915,스스스리우,찌마기 너무 맛있어요 조개찜 먹으러는 찌마기만 갈것같아요 !! 기대안한 해장라면도 엄청 맛있네요,2025-03-31,"저녁에 방문, 예약 후 이용, 대기 시간 바로 입장, 친목, 지인・동료",매장이 넓어요,24,1
1253486915,쿠크63,부모님 생신이라 모시고 왔는데 직원 분들도 친절하시고 너무 좋았어요! 덕분이 맛있고 즐겁게 먹고 갑니다 ♥️ 무조건 재방문 할 예정이에요! 잘 먹었습니다 ㅎㅎ !!!,2025-03-30,"밤에 방문, 예약 없이 이용, 대기 시간 바로 입장, 가족모임, 부모님",음식이 맛있어요,17,1
1253486915,몽롱2587,쌀쌀해서 들른  곳인데 가성비가 너무 좋고 맛있네요!! 직원분들도 친절하시고 강추!!,2025-03-30,"점심에 방문, 예약 후 이용, 대기 시간 바로 입장, 데이트, 연인・배우자",음식이 맛있어요,5,1
1253486915,전규영17,양도 많고 구성도 좋고 무엇보가 맛이있어서 좋네요다음에 또 오고싶은 맛이에요!,2025-03-29,"저녁에 방문, 예약 후 이용, 대기 시간 바로 입장, 가족모임, 기타",음식이 맛있어요,3,1
1253486915,jijiji66,조개찜 너무 좋아하는데 주변에 갈 만한 곳을 못찾아서 멀리다녔어요. 지인 추천으로 방문했는데 바닷가에서 먹는 만큼 신선하고 맛있고 양도 푸짐해요~ 진짜 배부르게 먹었습니다! 재방문의사 ok,2025-03-29,"저녁에 방문, 예약 후 이용, 대기 시간 바로 입장, 기념일, 부모님",음식이 맛있어요,31,1
1253486915,현갱870,"가족모임장소 찾다가 해산물 좋아하는 가족들이랑 와봤습니다! 해산물 러버들이라면 여기 꼭!! 오세요~~~가리비, 굴 등등 해산물이 싱싱하고 큼직큼직하니 먹을맛 났습니다😖 자리도 많고 매장도 넓은데 이른 저녁 벌써부터 사람이 꽉 찼습니다다음 모임도 여기로 오고싶네요 ㅎㅎㅎ",2025-03-29,"저녁에 방문, 예약 후 이용, 대기 시간 바로 입장, 기념일, 가족모임, 부모님, 친척・형제",재료가 신선해요,6,1
1253486915,핑주,낙지 맛있어용,2025-03-29,"밤에 방문, 예약 후 이용, 대기 시간 바로 입장, 데이트, 친구",양이 많아요,4,1
1253486915,kks****,데이트하러왔어요 ㅎㅎ맛있어요!,2025-03-28,"저녁에 방문, 예약 없이 이용, 대기 시간 바로 입장, 데이트, 연인・배우자",음식이 맛있어요,15,1
1253486915,협장군,너무너무 맛있게 잘 먹었습니다 소짜시켜도 엄청 배부르고 신선해요 또 방문할게요!!,2025-03-28,"저녁에 방문, 예약 없이 이용, 대기 시간 바로 입장, 데이트",매장이 넓어요,23,1
1253486915,쭈7726,아기 먹을 볶음밥도 있고 조개에 배추도 많이 들어 있어서 너무 좋았어요아기랑 자주 올거 같아요 잘먹었습니다^^,2025-03-28,"저녁에 방문, 예약 없이 이용, 대기 시간 바로 입장, 일상, 연인・배우자",음식이 맛있어요,31,1
1253486915,syj****,양도 푸짐하고 맛도 굿입니다. 다음에  또 방문 할것 같아요.,2025-03-27,"저녁에 방문, 예약 없이 이용, 대기 시간 바로 입장, 데이트, 연인・배우자",음식이 맛있어요,314,1
1253486915,낌띵이,,2025-03-27,"저녁에 방문, 예약 후 이용, 대기 시간 바로 입장, 데이트, 친구, 지인・동료",매장이 넓어요,34,1
1253486915,0nlyU,"매번 올때마다 신선한 가리비찜 + 석화찜만날 수 있어서 행복해요!지인들과 오다가 부모님 모시고 왔는데사장님 언제나 친절하시고,건강한 맛 보장되어있어서 뿌듯해요👍🏻찜기에 넣기전에 하나 하나 냄새 맡아보고넣으시는거 보고 감동 받았습니다🫶🏻신선보장!가리비러버인데 석화에 반해서석화 추가해서 먹었습니다.곧 또 봬요 사장님! 늘 적게 일하시고많이 많이 버시길 바랍니다🫶🏻",2025-03-26,"저녁에 방문, 예약 없이 이용, 대기 시간 바로 입장, 일상, 부모님",친절해요,253,3
1253486915,jos****,자리도 넓고 너무 맛있게 잘 먹었어요~~추천합니다!!ㅎㅎ,2025-03-25,"저녁에 방문, 예약 없이 이용, 대기 시간 바로 입장, 회식, 지인・동료",음식이 맛있어요,6,1
1253486915,충팔,면목동 맛집을 검색해서 처음 오게됬는데 양도 많고 맛있습니다,2025-03-23,"밤에 방문, 예약 없이 이용, 대기 시간 바로 입장, 친목, 친구",음식이 맛있어요,10,2
1253486915,digh0310,지나 다니면서 찌마기를 많이 보기만 했지 오늘 처음 방문했는데 양도 많고 너무 맛있어요!! 가성비 👍👍 다음에는 부모님 모시고 올게요~!!,2025-03-20,"저녁에 방문, 예약 없이 이용, 대기 시간 바로 입장, 데이트, 연인・배우자, 친구",음식이 맛있어요,2,1
1253486915,김씽이,맛있어요,2025-01-13,"저녁에 방문, 예약 없이 이용, 대기 시간 바로 입장, 데이트, 연인・배우자",음식이 맛있어요,1298,1
1253486915,Xxxxz,맛있고 양이많아요,2024-12-25,"저녁에 방문, 예약 없이 이용, 대기 시간 바로 입장",음식이 맛있어요,183,1
1253486915,도후44,나오자마자 허겁지겁 먹느라 사진을 못 찍었는데 해산물 안 좋아하는 친구도 엄청 잘 먹었네요 로컬 찐맛집 ㅇㅈ 체인점인 거 다 먹고 알았어요 개푸짐하네 ㄹㅇ;,2024-12-23,"저녁에 방문, 예약 없이 이용, 대기 시간 바로 입장, 친목, 친구",단체모임 하기 좋아요,5,4
1253486915,허뭉이키,1시간이상 기다렸는데 그럴만한 맛입니다🩵,2024-12-14,"저녁에 방문, 예약 없이 이용, 대기 시간 1시간 이상, 데이트, 연인・배우자",음식이 맛있어요,599,1
1253486915,스트림즈,1시간 넘게 기다렸지만..  넘 맛있게 먹고왔어요 ^^굴이 제철이라 최고였어요 ♡,2024-12-14,"저녁에 방문, 예약 없이 이용, 대기 시간 1시간 이상, 연인・배우자",음식이 맛있어요,499,1
1253486915,zzoung80,추운겨울철 딱이에요~~주말 낮 망년회^^맛있게 잘먹었어요~또올께요~~,2024-12-14,"점심에 방문, 예약 없이 이용, 대기 시간 바로 입장, 친목, 친구",음식이 맛있어요,93,1
1253486915,살벌한평가단,면목동 찌마기겨울 제철 음식 석화찜 🦪 너무 맛있게 먹었습니다양도 많고 질도 좋아서 그런지 손님들로 북적했어요 😢 정신없는 것 빼고는 만족했던 장소였습니다!,2024-11-29,"저녁에 방문, 예약 없이 이용, 대기 시간 바로 입장, 일상, 지인・동료",음식이 맛있어요,757,1
1253486915,Dksdkffuwba,굿~,2024-11-14,저녁에 방문,음식이 맛있어요,1381,1
1253486915,Togging,맛있어요,2024-11-12,"저녁에 방문, 예약 없이 이용, 대기 시간 바로 입장, 친목, 친구",매장이 넓어요,280,3
1253486915,tse****,우선 맛있고 양도 많고 직원들이 친절하고 마음이 따뜻해지는 분위기이에여. 전복버터구이 맛있어여.,2024-10-26,"저녁에 방문, 예약 없이 이용, 대기 시간 바로 입장, 데이트, 친구",음악이 좋아요,1,1
1253486915,tha****,양도 많고 너무 맛있어요직원들 너무 친절하고 좋았습니다자주 이용할게요!,2024-10-24,저녁에 방문,음식이 맛있어요,1,1
1253486915,찌까루,맛있어요!,2024-10-17,"저녁에 방문, 예약 없이 이용, 대기 시간 바로 입장, 친목, 친구, 지인・동료",음식이 맛있어요,281,1
1253486915,Hrrrr76,벌써 약 5번째 방문하는 맛집이에요 예전처럼 저렴하고 너무 맛있어요ㅜ 사장님도 너무 친절하시고 매장도 넓고 깨끗해요 다음주에 또 갈려구요,2024-10-13,"밤에 방문, 예약 없이 이용, 대기 시간 바로 입장, 친목, 친구",음식이 맛있어요,4,2
1253486915,cloud7541,신선하고 맛있습니당 ㅎㅎㅎ,2024-10-13,"저녁에 방문, 예약 없이 이용, 대기 시간 바로 입장, 친목, 친구",음식이 맛있어요,30,1
1253486915,키키키키10,3년만에 옛날생각이나서 오랜만에 방문했습니다.조개찜이 먹고싶어서 이곳저곳 알아보던중그래도 3년전에 맛있고 배부르게 먹었던 기억이 좋아서 방문했는데 가격이 우선 많이 올랐더라구요아무래도 3년동안 물가가 많이 오르니 어쩔순없지요~그러나 가격이 오른만큼 양은 그대로 일거라 생각했지만처음부터 양이 적네 생각했는데 역시나 다먹고났는데먹은게맞나? 할정도로 양이 적더라고요마무리로 칼국수도 주문했는데 아무맛도 안나고그냥 뜨거운물에 칼국수 넣어먹는맛이였습니다.그냥 김치에 뜨거운물칼국수 먹었네요.가장 맛있던건 어묵과 계란이였습니다.마지막계산후 직원의 마지막인사는 수고하세요.제가 여기서 일하는 직원도 아니고 근처에서 일하는 사람도 아닌데 수고하세요놀라웠습니다ㅋ다신안가요ㅋ,2024-10-04,"저녁에 방문, 예약 없이 이용, 대기 시간 바로 입장, 데이트, 연인・배우자",,54,1
1253486915,aga****,,2024-09-22,"저녁에 방문, 예약 없이 이용, 대기 시간 바로 입장, 데이트, 연인・배우자",음식이 맛있어요,316,2
1253486915,Togging,항상 너무 맛있게먹어요 ㅎㅎ 직원분들도 너무 친절하시고 양도많고 조개찜은 여기에요,2024-09-15,"저녁에 방문, 예약 없이 이용, 대기 시간 바로 입장, 친목, 친구",음식이 맛있어요,280,2
1253486915,dllEkfka,진짜 조개찜은 찌마기가 최고입니다👍🏻조개찜은 찌마기만 가욬ㅋㅋㅋㅋ자꾸 생각나요 너무 맛있어서 ㅋㅋㅋㅋ양도 많고 맛도 좋고 베스트베스트🥰사진은 없는데 계절메뉴로 생새우회 있는데 꼭 먹어보세요 새우도 크고 통통하니 아주 맛있습니다!몸통은 생새우회로 먹고 새우머리는 버터구이로 튀겨주시는데 완전 버터구이가 또 별미에요 너무 맛있어요💙,2024-09-15,"저녁에 방문, 예약 없이 이용, 대기 시간 바로 입장, 친목, 친구",친절해요,138,1
1253486915,광주여왕벌,전복 버터구이 맛있었어요 고기추가해서 먹었는데 양이 많아서 좋았어요,2024-09-05,저녁에 방문,음식이 맛있어요,1904,1
1253486915,aga****,,2024-06-19,"저녁에 방문, 예약 없이 이용, 대기 시간 바로 입장, 데이트, 연인・배우자",음식이 맛있어요,316,1
1253486915,thw****,.,2024-06-08,"저녁에 방문, 예약 없이 이용, 대기 시간 10분 이내, 일상, 지인・동료",특별한 메뉴가 있어요,1691,1
1253486915,csj1400,"맛있어요~ 어묵사리, 칼국수사리 추가하니 좋네용",2024-05-22,"밤에 방문, 예약 없이 이용, 대기 시간 바로 입장, 친목, 친구",친절해요,298,1
1253486915,슌129,넘 맛있었어요 친절하시고 즐거운 시간이었습니다,2024-04-26,"저녁에 방문, 예약 없이 이용, 대기 시간 바로 입장, 친목, 지인・동료",음식이 맛있어요,860,1
1253486915,박준희6970,친구들과 조개찜이 너무 먹고싶어서 예전부터 가고 싶었던 찌마기 면목점 갔는데 남자 3명이서 조개찜 중 시켜먹었는데 너무너무 맛있게 먹었습니다!!! 양도 적당해서 너무 좋았습니다 다 드시고 칼국수는 꼭 드세요!!😁😁,2024-04-19,"저녁에 방문, 예약 없이 이용, 대기 시간 바로 입장, 친목, 친구",음식이 맛있어요,4,1
1253486915,0nlyU,"가리비 먹으러 방문했어요!생물이라 크기가 일정하지 않을 수 있는데,미리 안내해주셔서 감사했습니다:)늘 아주아주 맛있는 가리비찜이에요❤️",2024-03-24,"저녁에 방문, 예약 없이 이용, 대기 시간 바로 입장, 친목, 지인・동료",친절해요,253,2
1253486915,kkl****,조개찜을 평소에 즐겨 먹지 않는데 정말 너무 맛있었어요 !!! 조개도 신선하고 직원분들이랑 사장님도 정말 친절하셔서 더 먹을 맛이 났습니다 ㅎㅎㅎ 재방문 의사 100 !!!! 다음에 꼭 또 방문할게요 ☺️☺️👍🏻,2024-02-08,"밤에 방문, 예약 없이 이용, 대기 시간 바로 입장, 친목, 친구",음식이 맛있어요,30,1
1253486915,gentleman89,ㅇ,2024-02-01,저녁에 방문,,1291,1
1253486915,kim****,다음에는 석화찜 말고 조개찜에 여러 사리 넣어 먹을거예요~,2024-01-13,"저녁에 방문, 예약 없이 이용, 대기 시간 바로 입장, 친목, 연인・배우자, 친구, 지인・동료",음식이 맛있어요,1091,1
1253486915,all****,신선하고 양 많고 직원분들 친절하고,2024-01-10,"저녁에 방문, 예약 없이 이용, 대기 시간 바로 입장, 일상, 연인・배우자",음식이 맛있어요,605,1
1253486915,찐먹빌런,굴찜 먹으러 다녀왔어요,2024-01-06,"저녁에 방문, 예약 없이 이용, 대기 시간 바로 입장, 일상, 친구",재료가 신선해요,679,1
1253486915,김맹추,다른 테이블이나 리뷰 보면 다 조개찜 먹던데 석화가 먹고싶어서 방문한거라 석화찜으로 픽했읍니다 석화찜은 국물없이나오더군요 암튼 굴이 엄청 크고 싱싱하고 걍 개오져요 미쳤음 개맛도리잼잼토스라 술 잘들어가더군요 치즈도 같이 주시는데 같이먹으면 더 맛있음ㅋㅋ 양도 많아서 3명까지는 소짜로 ㄱㄱ해도 될거같아요 둘이서 먹느라 많이 남겼는데 ㅜㅜ 아쉽뇌요,2024-01-05,"저녁에 방문, 예약 없이 이용, 대기 시간 바로 입장, 데이트, 일상, 연인・배우자",음식이 맛있어요,1640,1
1253486915,예디의 먹부림,조개 먹고 싶을 땐 늘 찌마기친구들이랑 조개먹고 옴 ㅎㅎ배 안아팠고 신선했음 ㅎ,2024-01-05,"저녁에 방문, 예약 없이 이용, 대기 시간 바로 입장, 친목, 친구",음식이 맛있어요,1069,1
1253486915,츄르기,날씨가 추워질즈음이면 생각나는 찌마기 매년 방문하고 있습니다. 가리비찜 최고에고 치즈사리랑 물만두사리는 꼭 추가하세요.제가 석화를 안먹는데 찌마기 석화는 먹습니다! 올해 또 방문할 거에요!!,2023-12-22,"저녁에 방문, 예약 없이 이용, 대기 시간 바로 입장, 친목, 친구, 지인・동료",비싼 만큼 가치있어요,280,2
1253486915,gbr****,생각나면 가끔 가는 곳 조개찜 먹으면서 어묵 등 사리 추가 하고 후식으로 칼국수 먹는데 밀가루 맛이 좀 나서 김치랑 국물 넣고 10분 넘게 끓여서 먹으면 괜찮아요.,2023-12-13,"저녁에 방문, 예약 없이 이용, 대기 시간 바로 입장, 가족모임, 연인・배우자, 아이",가성비가 좋아요,621,2
1253486915,tae****,양도 많고 너무 맛있었어요! 조개 좋아하시는 분들은 꼭 가보셨으면 좋겠어요 다음에도 또 올게요!,2023-11-26,"저녁에 방문, 예약 없이 이용, 대기 시간 바로 입장, 가족모임, 부모님",음식이 맛있어요,8,1
1253486915,코코블럭,찌마기 넘 맛남!! 가격이 많이 오른듯함유,2023-11-24,밤에 방문,음식이 맛있어요,817,9
1253486915,0nlyU,"가리비맛집이에요! 동료들이랑도,남자친구랑도 종종 방문합니다ㅎㅎㅎㅎ아주 술이 술술이에오💕해물라면도 전복친구도 매우 맛있습니다👍🏻",2023-11-17,"밤에 방문, 예약 없이 이용, 대기 시간 바로 입장, 데이트, 연인・배우자",음식이 맛있어요,253,1
1253486915,hae****,오늘 친구랑 방문했는데 너무 맛있고 양도 많아요!! 진짜 너무너무 맛있었어용 사람도 많은데 운좋게 대기 없이 들어갔어요! 진짜 맛있어용 조개구이 생각나면 오는거 추천합니당!!,2023-11-16,"저녁에 방문, 예약 없이 이용, 대기 시간 바로 입장, 친목, 친구",인테리어가 멋져요,26,1
1253486915,쭈물쭈물,담백함. 칼국수를 못 먹었는데 아쉬웠음.,2023-11-10,"저녁에 방문, 예약 없이 이용, 대기 시간 바로 입장, 일상, 친구",음식이 맛있어요,273,1
1253486915,hees2,맛나요,2023-11-09,저녁에 방문,음식이 맛있어요,622,5
1253486915,jgr****,맛있어요,2023-11-03,저녁에 방문,음식이 맛있어요,1472,1
1253486915,퍼킨스94,오래간만에 시어머니 모시고 갔어요조개찜. 새우구이 팔딱팔딱 .새우머리 따로 튀겨주셔서 맛있게 잘먹었어♡,2023-10-22,점심에 방문,친절해요,53,1
1253486915,mj1005,맛있었어욤 저녁에 간단히 먹기좋았습니다 :),2023-10-18,"저녁에 방문, 예약 없이 이용, 대기 시간 바로 입장, 일상, 연인・배우자",매장이 넓어요,78,1
1253486915,돼지의하루v,직원분들 친절하시고 조개찜 맛도좋아요 자주갈듯~,2023-10-08,밤에 방문,,367,1
1253486915,MEEE81,맛있어요!!,2023-10-01,저녁에 방문,음식이 맛있어요,943,1
1253486915,em3785,조개찜이 먹고싶어서 찾아갔는데 조개찜 생각보다 가격대가 좀 있고  여자셋이 중자 주문.칼국수사리넣어먹고 해장라면도 먹은 후 배부르게 나왔네요. 아쉬운점은 문이 활짝 열려있어서 모기가 너무 많았어요..ㅠ,2023-09-27,밤에 방문,매장이 넓어요,2740,1
1253486915,오영래,찌마기면목점다른 찌마기 지점도 가봤는데 제일 재료도신선하고너무 맛있고 친절하세요!! 해산물 좋아하시는분들은 꼭 와서드시는거 강추드립니당😚,2023-09-24,저녁에 방문,단체모임 하기 좋아요,9,1
1253486915,hees2,굿,2023-09-22,저녁에 방문,음식이 맛있어요,622,4
1253486915,kek****,좋아요,2023-09-09,저녁에 방문,음식이 맛있어요,1025,1
1253486915,kim****,다른찌마기보다 양이 푸짐한거 같아서잘먹었슴다애들이 겁나좋아 했어요무조건 최애 단골임다,2023-08-13,저녁에 방문,음식이 맛있어요,1,1
1253486915,doi00000,푸짐하고 너무 맛있어용 😁😁😁😁,2023-08-13,저녁에 방문,음식이 맛있어요,20,2
1253486915,dogyeoung,조개들이 완전 싱싱하고 맛나고 매장이 깔끔해요🫠🫠,2023-08-12,밤에 방문,친절해요,16,2
1253486915,코코블럭,조개찜은 찌마기쥬,2023-07-21,저녁에 방문,매장이 넓어요,817,8
1253486915,pui****,양도 많고 맛있어요ㅎㅎ,2023-06-16,저녁에 방문,매장이 넓어요,210,1
1253486915,조금나,조개찜 너무 맛있고 양도 많아요!!조개찜에 들어있는 치즈랑 같이먹으면 꿀맛이고국물도 너무 시원하더라구요 술마시면서 먹는데 술이깨요 ㅎㅎ 자주 먹으러 갈게요번창하세요~,2023-06-15,저녁에 방문,음식이 맛있어요,3,1
1253486915,qra****,면목역서 사가정역쪽으로 가다  한가위떡집 근처 위치~소자는 양이 저어서 3명이  먹기엔 아쉽고 2명정도가 딱일듯~,2023-06-09,저녁에 방문,친절해요,2721,1
1253486915,picassong,👍,2023-06-07,저녁에 방문,단체모임 하기 좋아요,350,1
1253486915,중랑구로드뷰,,2023-05-21,저녁에 방문,매장이 청결해요,383,3
1253486915,야옹이4263,조개찜 맛집 찌마기 매장 청결하고 조개찜 넘 맛있어요. 양이 많아 사리는 못먹었네요. 큰 조개 많아서 배불리먹었습니다. 다음에또 갈게요,2023-05-21,저녁에 방문,매장이 넓어요,258,1
1253486915,jmsson131,조개가 큼직막하니 신선하네요사장님도 친절하고 잘 먹고 갑니다~~,2023-05-19,점심에 방문,음식이 맛있어요,65,1
1253486915,쯔끄,드디어 우리동네에도 찌마기있다 ㅠ 하~~~ 저멀리 부천사는 친구만날때 무조건 찌마기갔는데 이제는 면목에서가면됩니다 개꿀 신라면사리 무조건드세염,2023-05-18,저녁에 방문,매장이 청결해요,57,1
1253486915,으네프레소,"조개찜 쫄깃쫄깃 넘 맛있어요!! 짱 푸짐!! 가리비 이렇게 많이 넣어주는곳 처음이에요~ 키조개랑 가리비 치즈에 찍어서 먹음 넘 맛있고 어묵, 만두, 계란 등등 사이드도 다양해서 좋았어요! 국물이 진짜 칼칼하니ㅎㅎㅎ 소주안주 지대로👍 칼국수도 필수에요! 넘 맛있게 먹었습니다~",2023-05-15,저녁에 방문,양이 많아요,1220,1
1253486915,소유8371,양도 푸짐하고 엄청 신선해요!!! 대왕가리비 너무 실하네요❤️❤️,2023-05-14,저녁에 방문,매장이 넓어요,359,1
1253486915,tjdal4373,굿,2023-05-14,저녁에 방문,음식이 맛있어요,965,3
1253486915,psy****,가리비양이 많았고 가리비 정말 맛있었어요 그 외에 처음먹어보는 조개들도 맛있고 고소했습니다 다먹고 사리를 넣어서 먹는데 사리 넣어서 먹었는데 강추에요👍 단골손님이 되고싶은 가게였습니당,2023-05-10,저녁에 방문,매장이 청결해요,1,1
