place_id,nickname,content,date,situations,keywords,review_count,visit_count
1622447769,미소래7,양념두 맛나고 알찬구성으로 잘먹었습니다,2024-11-24,"점심에 방문, 예약 후 이용, 대기 시간 바로 입장, 가족모임, 연인・배우자",고기 질이 좋아요,67,1
1622447769,살벌한평가단,상봉역 근처 고기 무한리필 청년 고기 장수🍖청마호크부터 양념갈비 돼지갈비 삼겹살 목살 고추장 삼겹살.다양한 고기 종류가 준비되어 있습니다. 고기 종류 모두 잡내 하나 없었고 질이 좋아 보였어요! 입에서 녹는맛이 예술!가성비가 너무 좋았고요. 특히 직원분들이 너무 친절했어요.마무리로 디저트 아이스크림과 탄산음료도 구비 되어 있어 만족한 식사를 했답니다☺️,2024-11-05,"저녁에 방문, 예약 없이 이용, 대기 시간 바로 입장, 일상, 지인・동료",음식이 맛있어요,751,1
1622447769,소류천령,가성비좋은 고기집입니다,2024-10-28,"저녁에 방문, 예약 없이 이용, 대기 시간 바로 입장, 친목, 친구",음식이 맛있어요,403,1
1622447769,킴킴킴S2,괜찮아요!두번째 방문,2024-08-23,"저녁에 방문, 예약 없이 이용, 대기 시간 바로 입장, 데이트, 친구",음식이 맛있어요,784,1
1622447769,죠초,주말점심으로 예약하고 갔는데 널널히먹었어요 ㅎㅎ배고파서 급히 먹는탓에 사진찍는걸 깜빡했는데고기 질이 정말 좋았고 두께도 두꺼워서 정말 좋앗어요!!예약하고 가서 서비스 된찌도 받앗는데 맛잇엇습니다 ㅎㅎ,2024-08-04,"점심에 방문, 예약 후 이용, 대기 시간 바로 입장, 친목, 친구",고기 질이 좋아요,5,1
1622447769,NN43,"19,900원으로 이렇게 다양한 고기를 먹을 수 있다니 👍 이미 유명한 줄은 알았지만 진짜 상봉 맛집이에요! 뼈구이, 삼겹살, 돼지갈비, 닭갈비, 간장삼겹살 등 고기 종류도 엄청 다양하고 제육볶음, 떡볶이 같은 음식들도 샐러드바에 준비되어 있어서 배부르게 먹을 수 있었습니당! 음료랑 아이스크림 그리고 커피까지 전부 무한,, 😋 요즘 물가도 오르는데ㅠ 가성비 맛집! 오래오래 장사해주셨으면 좋겠어요,, 넘 맛있게 먹었습니다 😊",2024-07-08,"저녁에 방문, 예약 없이 이용, 대기 시간 바로 입장, 일상, 지인・동료",음식이 맛있어요,11,1
1622447769,연보리1,"무한리필임에도 고기가 넘 훌륭해요ㅎㅎ 특히 갈비가 종류가 엄청 다양해요(양념갈비, 갈비삼겹, 갈비목살)다양한 종류의 고기를 가성비 넘치게 즐길수있어 좋고 사이드 가격도 합리적이에요! 숙성고기라그런지 잡내도 하나도 안나서 더 잘 먹었습니다👍👍",2024-07-04,"저녁에 방문, 예약 후 이용, 대기 시간 바로 입장, 데이트, 연인・배우자",음식이 맛있어요,108,1
1622447769,glo****,무한리필 이여서 너무 좋고 뼈구이까지 있어서 넘 맛 있었어요 ~ 고기가 다 신선하고 맛있어서  가족과 맛있게 먹고 갑니다 :),2024-06-28,"저녁에 방문, 예약 후 이용, 대기 시간 바로 입장, 가족모임, 연인・배우자, 아이",음식이 맛있어요,112,1
1622447769,강자68,가격 대비 고기 퀄리티 너무 좋아요! 고기 종류도 많고 샐러드바도 잘되어 있고요즘 기본 고기집 가면 1인분 16-18천원 하는데여기는 무한대로 맛난 고기 먹을 슈 있어서 좋네요사장님도 친절하시고요,2024-06-27,"저녁에 방문, 예약 없이 이용, 대기 시간 바로 입장, 일상, 연인・배우자",고기 질이 좋아요,1291,1
1622447769,나욤22,상봉역 고기집 찾다가 발견한 무한리필 고기집 👍🏻 사실 지나다니면서 여러본 보긴 했는데 가족외식 겸 첫 방문 해봣거든요!! 진짜 맛있습니다ㅋㅋㅋㅋ고기 종류도 다양하고 셀바가 잘 되어 잇어요!!,2024-06-27,"저녁에 방문, 예약 없이 이용, 대기 시간 바로 입장, 데이트, 연인・배우자",매장이 넓어요,571,1
1622447769,현이이,"가격이 오른거에 비해 종류도 너무 없고 부실하네요본점에서 맛있었던 기억이있어서 상봉점으로 방문해봤는데 샐러드바 종류도 너무 없고 별로네요 ㅜ그리고 직원분들이 바쁘지도 않은데 홀을 너무 안보시네요 불판도 다탈동안 안갈아주시고 접시도 한번안빼주시고,,고기 질은 나쁘지 않지만 여러 이유 때문에 재방문은 안할것같습니다",2024-06-09,"저녁에 방문, 예약 없이 이용, 대기 시간 바로 입장, 기념일, 부모님",,8,1
1622447769,Lydia92,처음 가본곳인데! 좋네요! 맛있어요!,2024-05-11,"저녁에 방문, 예약 없이 이용, 대기 시간 바로 입장, 데이트, 연인・배우자",음식이 맛있어요,521,1
1622447769,뇽굴히,맛있어요 !,2024-04-30,"저녁에 방문, 예약 없이 이용, 대기 시간 바로 입장, 데이트, 친목, 연인・배우자, 친구, 부모님",음식이 맛있어요,136,1
1622447769,yam****,무한리필.....,2024-04-07,"저녁에 방문, 예약 없이 이용, 대기 시간 바로 입장, 일상, 연인・배우자, 아이",양이 많아요,4559,1
1622447769,qra****,상봉역에 무한으로 고기 먹기 좋아요~테이블이 많치않아 바쁜 시간때는 대기가 있을수도 있답니다,2024-03-29,"저녁에 방문, 예약 없이 이용, 대기 시간 바로 입장, 친목, 지인・동료",특별한 메뉴가 있어요,2719,1
1622447769,동동4559,2층이라 창밖보면서 편하게 식사했어요직원분들 친절하시고 음식맛이 진짜 좋아요눈꽃삼겹살 진짜 맛있어요,2024-03-12,"점심에 방문, 예약 없이 이용, 대기 시간 바로 입장, 가족모임, 연인・배우자",음식이 맛있어요,9,1
1622447769,4768,"사장님, 직원분  너무 친절하셨고고기 퀄리티가 너무 좋았습니다.잘 먹었습니다👍",2024-03-11,"점심에 방문, 예약 후 이용, 대기 시간 바로 입장, 가족모임, 부모님, 친척・형제",음식이 맛있어요,590,1
1622447769,96522116,3.3데이라 식구들이랑 삼겹살 배부르게 먹고 왔어요. 전보다 대기가 없어서 기다리지않고 바로 들어감,2024-03-03,"저녁에 방문, 예약 없이 이용, 대기 시간 바로 입장, 가족모임, 부모님",가성비가 좋아요,56,1
1622447769,guswn5980,항상 맛있게 먹는 곳이에요~~,2024-02-19,"저녁에 방문, 예약 없이 이용, 대기 시간 바로 입장, 데이트, 일상, 연인・배우자",음식이 맛있어요,262,5
1622447769,변둘레,고기 질이 좋고 삼겹살과 목살이 맛있었어요! 설날 당일에 문열어서 간곳인데 맛도 나쁘지 않고 괜찮았습니다. 샐러드바는 조금 빈약한데 가성비 나쁘지 않은것 같습니다 ~~~~~~ㅎㅎ,2024-02-10,"저녁에 방문, 예약 없이 이용, 대기 시간 바로 입장, 일상, 부모님",음식이 맛있어요,1058,1
1622447769,Redmoon00,"친구들과 모임으로 예약 후 이용했습니다.고기 비쥬얼이 장난 아니네요~~ 무제한이래서 기대안했었는데, 아주 만족하며!! 맛있고 즐거운 시간보냈습니다!!서비스 된장찌개도 맛있었어요~~",2024-02-09,"점심에 방문, 예약 후 이용, 대기 시간 바로 입장, 친목, 친구",음식이 맛있어요,6,1
1622447769,봄이오면 28,잘 먹었습니다.,2024-01-21,"점심에 방문, 예약 없이 이용, 대기 시간 바로 입장, 가족모임, 아이",고기 질이 좋아요,1855,1
1622447769,dow****,짱 마싯어요,2024-01-20,점심에 방문,음식이 맛있어요,1233,1
1622447769,guswn5980,껍데기 넘 맛있고 삼겹살도 맛있어서 자주가는데 매운소스랑 멜젓이 킥이에요!,2024-01-05,"저녁에 방문, 예약 없이 이용, 대기 시간 바로 입장, 데이트, 연인・배우자",음식이 맛있어요,262,4
1622447769,니팅별이,예약하고 갔더니 된장찌개 써비스로 주셨어요. 고기도  부드럽고 퀄리티가 좋아요~  간만에 가족 외식 잘했습니다,2023-12-23,"점심에 방문, 예약 후 이용, 대기 시간 바로 입장, 가족모임, 아이",음식이 맛있어요,27,2
1622447769,김효경1,좋아요,2023-12-22,"저녁에 방문, 예약 후 이용, 대기 시간 바로 입장, 친목, 친구",음식이 맛있어요,1514,2
1622447769,guswn5980,여긴 껍데기도 맛있고 고기도 맛있고 멜젓소스도 좋아서 자주가요! 멜젓소스가 약간은 더 진했으면 좋겠어요~~~,2023-12-20,"저녁에 방문, 예약 없이 이용, 대기 시간 바로 입장, 일상, 지인・동료",음식이 맛있어요,262,3
1622447769,aa****,고기자체는 나쁘지않아요 갠추난편 다만 전체적인 위생은 신경을 많이 쓰셔야할꺼 같습니다... 깨끗한 그릇이 거의없다시피할정도...,2023-12-17,"저녁에 방문, 예약 없이 이용, 대기 시간 바로 입장",음식이 맛있어요,1778,1
1622447769,냐 냐 아,음식맛은 좋은데 위생상태 엉망임ㅠ,2023-12-17,저녁에 방문,,1609,1
1622447769,vic****,단체모임 좋아요,2023-12-02,"저녁에 방문, 예약 없이 이용, 대기 시간 바로 입장",음식이 맛있어요,3082,1
1622447769,정적이다,최근 리뉴얼 되서 그런지 더 괜찮아진거같네요맛있게 잘 먹고왔습니다!!,2023-11-24,"저녁에 방문, 예약 후 이용, 대기 시간 바로 입장, 회식, 지인・동료",음식이 맛있어요,312,1
1622447769,guswn5980,신랑이랑 맛있게 잘먹고왔습니당! 멜젓 짱!!,2023-11-21,"저녁에 방문, 예약 없이 이용, 대기 시간 바로 입장, 데이트, 연인・배우자",음식이 맛있어요,262,2
1622447769,SKYROCKET,가성비가 좋아요. 삼겨살빼고는 맛은 딱히에요.,2023-11-19,"저녁에 방문, 예약 없이 이용, 대기 시간 바로 입장, 데이트, 연인・배우자",양이 많아요,333,1
1622447769,Review집사,가성비 장난아니게 좋은 고기무한리필뷔페 입니당잡내1도 없고 반찬도 많구 부드럽고 육즙 팡팡이에여저렴한이유가 딱히 없을정도로 퀄리티 조아요👏🏻👏🏻👏🏻👏🏻👏🏻👏🏻👏🏻👏🏻👏🏻👏🏻👏🏻👏🏻👏🏻👏🏻👏🏻,2023-11-14,"저녁에 방문, 예약 없이 이용, 대기 시간 바로 입장, 일상, 친구",음식이 맛있어요,400,3
1622447769,Jhk78,리뉴얼되고 나서 정말 완벽해졌네요!또 방문하겠습니다~,2023-11-13,저녁에 방문,음식이 맛있어요,666,2
1622447769,대표이사7441,자주 이용하고있어요,2023-11-08,점심에 방문,,1073,5
1622447769,새미천재,좋아요,2023-11-07,저녁에 방문,고기 질이 좋아요,2045,3
1622447769,010bbb,굿,2023-11-07,저녁에 방문,음식이 맛있어요,1558,6
1622447769,보라공주0609,고기종류가 다양해서 골라먹는 재미가 있어요매장도 깔끔합니다~,2023-11-07,점심에 방문,음식이 맛있어요,1181,1
1622447769,Review집사,벌집삼겹살이 입에서 살살 녹습니다 상봉에서 가성비 있게 삼겹살 양념삼겹살 껍데기 먹고싶으면 이집으로 갑니다👍🏻👍🏻👍🏻 쵝오쵝오👍🏻👍🏻👍🏻상봉역 맛집 으로 인정 입니당💛💛💛💛💛💛💛💛💛💛💛💛💛💛💛💛💛💛,2023-10-31,점심에 방문,음식이 맛있어요,400,2
1622447769,대표이사7441,자주 이용하고있어요,2023-10-22,점심에 방문,,1073,4
1622447769,010bbb,굿,2023-10-21,저녁에 방문,음식이 맛있어요,1558,5
1622447769,Review집사,고기 무한리필 집 같지 않고 고급스러운 숯불 고기집 퀄리티 에요! 삼겹살은 입에서 살살 녹고 목살도 부드럽고 양념 삼겹살도 밥반찬 입니다👍🏻마시멜로우도 구워먹는 재미가 있고 껍데기도 정말 부드러워요상봉 맛집 답습니다 기존 무한리필 고기집들이랑 차이가 커요상봉 무한리필 숯불고기집은 이집으로 정착이요도시락통에 볶음밥도 해먹을수 있고 반찬들도 다 짱맛있어요💛💛💛💛💛👍🏻👍🏻👍🏻👍🏻👍🏻,2023-10-19,저녁에 방문,매장이 넓어요,400,1
1622447769,고기러버앤,청년장수 면목에 가보고 상봉도가봤는데 고기의질은 상봉이 훨씬좋고 구워먹기도 색다른게 있어서 상봉점이 훨씬 좋아요 면목은 그으름이 너무 많아서 겉만 타버리고 속은 안익고@.@ 상봉점도  24시인줄 알고 갔는데 아쉽게 나왔네요 면목지점은 24시간이던데~~셀프바 가지수도 면목이 훨씬 많고 넓어서 아쉽더라고요 고기랑 전체적인 음식은 면목역점보다 훨씬 맛있는거 같은데~24시간으로 해주세요~~♡그리고 상봉도 면목도 몸에 안좋다고들하는 일회용 불판이라 아쉬웠어요 아무튼  잘 먹었습니다,2023-10-18,저녁에 방문,음식이 맛있어요,13,1
1622447769,돌직구22,고기 퀄리티가 생각보다 좋았어요맛있게 잘 먹었어요,2023-10-16,점심에 방문,음식이 맛있어요,117,1
1622447769,ysd****,맛있어요,2023-10-15,저녁에 방문,고기 질이 좋아요,169,1
1622447769,OnewaY,무한리필 고깃집도 질이 좋을 수 있다능..맛있게 먹었습니다,2023-10-10,저녁에 방문,음식이 맛있어요,862,1
1622447769,새미천재,고기 맛있어요,2023-10-09,"저녁에 방문, 예약 없이 이용, 대기 시간 바로 입장, 가족모임, 아이",고기 질이 좋아요,2045,2
1622447769,대표이사7441,자주 이용하고있어요,2023-10-09,저녁에 방문,,1073,3
1622447769,010bbb,굿,2023-10-09,저녁에 방문,음식이 맛있어요,1558,4
1622447769,fld****,,2023-10-07,점심에 방문,음식이 맛있어요,1266,4
1622447769,대표이사7441,자주 이용하고있어요,2023-09-19,점심에 방문,,1073,2
1622447769,010bbb,굿,2023-09-19,점심에 방문,음식이 맛있어요,1558,3
1622447769,omem61,잘먹었습니다.,2023-09-14,저녁에 방문,가성비가 좋아요,549,1
1622447769,잔지바르,리뉴얼 되고 가봤습니다. 다른 곳보다 늦게까지 영업해서 밤에 가기 좋습니다.,2023-09-11,저녁에 방문,고기 질이 좋아요,139,1
1622447769,010bbb,굿,2023-09-09,저녁에 방문,음식이 맛있어요,1558,2
1622447769,포비8580,먹느라 사진은 못찍었네요 무한 셀프라 아이스크림도 있구마시멜로도 고기질도 괜찮았어요,2023-09-01,저녁에 방문,음식이 맛있어요,553,1
1622447769,성스러운 청솔새,잘 이용중입니다,2023-08-30,저녁에 방문,음식이 맛있어요,570,1
1622447769,대표이사7441,자주 이용하고있어요,2023-08-26,저녁에 방문,,1073,1
1622447769,010bbb,굿,2023-08-26,저녁에 방문,음식이 맛있어요,1558,1
1622447769,졔돌프,무한리필인데 고기질이 좋아요!고기 종류도 다양하고 샐러드바까지 있어서 다양하게 먹을 수 있어서 좋아요👏🏻👏🏻아이스크림 후식도 있으니 꼭 드세용😋,2023-08-25,저녁에 방문,음식이 맛있어요,1753,1
1622447769,guswn5980,맛있게 잘먹었습니다~~ 다만 테이블이 다닥다닥 붙고 밀폐된 느낌이라 주변이 너무 시끄러웠습니다ㅠ,2023-08-25,저녁에 방문,음식이 맛있어요,262,1
1622447769,psb****,일단 고기가 무한리필 치고 상태가 괜찮고 맛있어요. 숯불이라 더 맛있는 느낌이에요. 리뉴얼하고 매장도 깨끗해진거 같아요!! 근데 가장 좋았던 점은 키큰 여자 알바랑 안경쓰신 남자분이 너무 친절하셔서 기분까지 좋아졌네요~ 잘먹었습니다!!,2023-08-25,저녁에 방문,음식이 맛있어요,35,1
1622447769,굿좋아용,웨이팅 길어서 힘들었지만... 맛있네용,2023-08-23,저녁에 방문,음식이 맛있어요,1784,1
1622447769,HongMin,직원분들이 친절하십니다. 덕분에 식사 잘했습니다.,2023-08-18,저녁에 방문,특별한 날 가기 좋아요,13,1
1622447769,정승기73,여기 고기가 맛있어용. 매장도 깔끔하고 좋아용,2023-08-15,점심에 방문,고기 질이 좋아요,22,1
1622447769,김효경1,좋아요,2023-08-05,저녁에 방문,음식이 맛있어요,1514,1
1622447769,오늘은 어디로로로,"고기질이 좋고, 무한리필로 가져다 먹을 수 있어서 좋았어요돼지껍데기도 도톰하니 냄새도 없고 맛있었어요모든 고기가 고기 잡내없이 고소하고 맛있어요밥도 무한리필인데, 흑미밥이라 좋았어요",2023-07-02,점심에 방문,음식이 맛있어요,663,1
1622447769,새미천재,맛있어요,2023-07-01,저녁에 방문,친절해요,2045,1
1622447769,무한긍정9840,아이 생일이라 친구들과 함께 방문한 고깃집 친절하고  고기도 맛있게 배불리 먹고왔다고 하네요,2023-07-01,저녁에 방문,특별한 날 가기 좋아요,53,1
1622447769,시작하자52,"무한리필이라 푸짐하게먹을수 있었고, 직원분들이친절하셨어요",2023-06-26,점심에 방문,가성비가 좋아요,14,1
1622447769,2neang,무한리필집 퀄리티 생각하고 간건데 너무 대박 맛있었어요 가성비 좋아요...또 방문할거예요,2023-06-23,저녁에 방문,음식이 맛있어요,604,1
1622447769,chachamom22,맛있어요 배터짐,2023-06-22,점심에 방문,음식이 맛있어요,312,1
1622447769,blu****,무한리필 가본 중 이집이 최고,2023-06-16,저녁에 방문,고기 질이 좋아요,437,1
1622447769,뚜뚜루81년식,생각보다 더 저렴하게 고기 맛나게 먹었어요.,2023-06-13,저녁에 방문,음식이 맛있어요,866,1
1622447769,주채이,맛있어요.,2023-06-10,저녁에 방문,음식이 맛있어요,330,1
1622447769,스피카 지니,고기는 맛있게 잘 먹었어요밥먹으려고 된장찌개를 시켰는데 20분이 넘어도 안나와서 문의했더니 배달음식이 밀려서 그렇다네요배달만 하는곳도 아니고 홀도 있는곳인데 이해가 되질 않았네요결국 문의 2번 드려서 30분만에 된장찌개 받아서 먹었네요아무리 싸고 맛있는 곳이래도 이런 서비스 하는 곳은 재방문 안할듯 합니다,2023-06-10,저녁에 방문,,23,1
1622447769,200****,얼마전에 아이들이랑 가서 정신없이 아이들한테 준다고 얼마 먹지는못했는데 무한으로 고기 먹는것치고는 맛이있는것같습니다.근데 아이들이랑 가서보니 왔다갔다하는곳이 너무 좁은것같습니다 그래서 아이들한테는 좀 위험하네요,2023-06-10,점심에 방문,음식이 맛있어요,20,1
1622447769,069****,고기질이좋아요,2023-06-06,점심에 방문,음식이 맛있어요,536,1
1622447769,dkcktks24,굿,2023-06-04,저녁에 방문,고기 질이 좋아요,1287,1
1622447769,dkd****,좋아요,2023-05-31,저녁에 방문,,1236,2
1622447769,khh****,삼겹살 맛있어요,2023-05-31,저녁에 방문,친절해요,1351,4
1622447769,너만의플레이스,명륜진사갈비와 다르게 흡입구가 눈앞에 없어서 연기도 잘 빨아들이고 조용하고 대화하기도 좋앗어요 환기구 진짜 베스트그리고 그릇도 큼직하고 넘 편햇어요그리고 고기들이 신선하고 다 괜찮더라구요 덕분에 든든히 먹엇어요 ㅎㅎ 양파채잇으면 더 완벽하겟다는 생각만 남갸봅니다,2023-05-31,저녁에 방문,매장이 넓어요,103,1
1622447769,드래곤라자,고기 부페라 좋음 칼집 삼겹임,2023-05-23,저녁에 방문,음식이 맛있어요,666,1
1622447769,ryeon33,테이블에 붙혀져있는 고기먹는 순서대로 생고기로 시작해서 양념고기까지 구워 먹으면 돼요! ✔숙성눈꽃삼겹살-시즈닝스테이크목살-청마호크생갈비-청마호크양념갈비-화끈양념삼겹살-청년껍데기-청년닭갈비 무한리필이라고 고기의 질이 안좋을거라는 편견을 와장창 깨주는 맛이에요!!!! 너무 맛있어요!!!!!!!!고기육질이👍 잡내 전혀 없구요~ 퀄리티 좋구요👍전 갠적으로 숙성눈꽃삼겹살이 젤 맛있었어요🥩 더 좋은건 고깃집 다녀온거 티 안나게 연기가 화로 밑으로 끌려 나가더라구요😯🤭 이런 멋진곳이 있다니.....😭 📣 남녀노소 부담없이 즐길 수 있는 합리적인 가격📣 소중한 사람들과 한끼 즐겁게 즐길 수 있는 곳📣 누구도 흉내낼 수 없는 특별한 맛 청년고기장수 상봉점에서 무한으로 즐겨보세요~,2023-05-20,저녁에 방문,음식이 맛있어요,393,1
1622447769,먹부림부림,무한리필이면서 고기도 전부 신선하고 맛있음! 음료도 무제한! 반찬도 다양하고 팬이 그릴 옆에 있어서 냄새가 옷에 잘 안배어서 좋다,2023-05-20,점심에 방문,친절해요,347,1
1622447769,알미1777,별로요,2023-05-19,저녁에 방문,,401,2
1622447769,새벽1027,"돈마호크부터 삼겹살, 껍데기까지 총 7종을 무한리필로 먹을 수 있어서 아주 좋습니다. 숙성도 잘 되어서 고기가 엄청 맛있어요!",2023-05-11,저녁에 방문,매장이 넓어요,38,1
1622447769,rlawnsdh777,걍 맛이 없어요. 그 돈 주고 먹을바엔 그 돈 주고 쌈장에 밥 비벼 먹겠어요. 알바들도 불친절 하고 말투도 짜증나고 그냥 전체적으로 더러워요. 먹고 나니 들리는 소문은 맛이 없다고 하는데 그럴만 하네요. 셀프바에 있는 상추에는 이상한 드러운 하얀 가루들 묻어있고 위생도 안좋고 전체적으로 문제가 많네요. 고기 장사 쌈장 장사 하세요 쌈장이 제일 맛있어요,2023-05-11,점심에 방문,,1,1
1622447769,JH플레이스,고기가 맛있고 친절해요,2023-05-08,점심에 방문,단체모임 하기 좋아요,684,1
1622447769,마른하늘을 달려,무한리필 집은 기대 안하고 가는데여긴 기대하셔도 좋아요고기가 정말 신선하고 맛있어요직원분들도 친절 하시구여,2023-05-02,저녁에 방문,매장이 넓어요,1640,3
1622447769,알미1777,그냥 그래요,2023-04-30,저녁에 방문,,401,1
1622447769,랑자99,맛있어요,2023-04-30,저녁에 방문,친절해요,1328,1
1622447769,lin****,量很多，两个人给这一盆吃的撑撑的，很少有自助店家一上来就给这么多肉的，我们都没要第二盘，肉也很好吃，是碳火烤，有种烧烤的感觉，不错不错,2023-04-17,저녁에 방문,고기 질이 좋아요,4,1
1956449088,bos****,신선하고 맛있읍니다 추천해요~~,2025-04-08,"저녁에 방문, 예약 없이 이용, 대기 시간 바로 입장, 친목, 친구",음식이 맛있어요,22,1
1956449088,임성민6346,직원뷰니 친절하고 음식이 마싯어여😇❤️,2025-04-06,"저녁에 방문, 예약 없이 이용, 대기 시간 바로 입장, 데이트",친절해요,19,1
1956449088,hzz****,"일단 직원분들이 너무 친절합니다, 음식 설명하나하나 해주셨고 가게도 깨끗하고 좋아요~~",2025-04-05,"저녁에 방문, 예약 없이 이용, 대기 시간 바로 입장, 데이트",인테리어가 멋져요,6,1
1956449088,snk1204,음식도 너무 맛있고 분위기도 너무 좋아요 ㅎㅎ 다양한 메뉴가 많아서 자주 올거같아요~,2025-04-05,"저녁에 방문, 예약 없이 이용, 대기 시간 바로 입장, 데이트, 연인・배우자",음식이 맛있어요,142,1
1956449088,mmssski123,오랜만에 먹었는데 여전히 사시미 너무 맛있어요!!!넓은 자리에서 편하게 즐겼습니다!!,2025-04-05,"저녁에 방문, 예약 후 이용, 대기 시간 바로 입장, 친목, 친구",인테리어가 멋져요,28,2
1956449088,nopnop,숙성회 최고에요 벌써 몇번째인지 모르겠지만 항상 먹는 메뉴,2025-04-05,"밤에 방문, 예약 없이 이용, 대기 시간 바로 입장, 친목, 친구",음식이 맛있어요,36,3
1956449088,rrs****,너무너무 분위기도좋고 음식도 전부 맛있는담화 최고에요~,2025-04-04,"밤에 방문, 예약 없이 이용, 대기 시간 바로 입장, 데이트, 친목, 연인・배우자, 친구, 지인・동료",음식이 맛있어요,23,1
1956449088,까메오51,분위기도 좋고 가격대도 괜찮고 맛도 좋아서 추천합니다,2025-04-04,"저녁에 방문, 예약 없이 이용, 대기 시간 바로 입장, 데이트, 연인・배우자",음식이 맛있어요,7,1
1956449088,탱카탱카,여기는 재료가 너무 신선해서 맛이 없을 수가 없어요명란계란말이도 너무 맛있고 모둠 사시미도 너무 맛있어요9시이전에 오면 자리가 없는데 9시 이후에 오면 자리가 있네요2차로 추천드려요~~~~!~!~!~!~~ 강추!!!!!!!,2025-04-04,"저녁에 방문, 예약 없이 이용, 대기 시간 바로 입장, 친목, 지인・동료",음식이 맛있어요,34,1
1956449088,HONG7748,술이 땡길 때 마다 오는 곳숙성회 너무 맛있어요~!!,2025-04-04,"저녁에 방문, 예약 없이 이용, 대기 시간 바로 입장, 데이트, 연인・배우자",음식이 맛있어요,28,1
1956449088,영162,"분위기도 좋고 데이트, 소개팅 하기 딱 좋은 곳이에요 숙성회는 당연히 맛있고 라면도 의외의 발견이었어요 자주올게요 !!",2025-03-30,"저녁에 방문, 예약 없이 이용, 대기 시간 10분 이내, 데이트, 연인・배우자",인테리어가 멋져요,3,1
1956449088,하라코옹,술보다는 안주먹으러 오는 담화뭘 시켜도 다 맛있어요,2025-03-29,"저녁에 방문, 예약 없이 이용, 대기 시간 바로 입장, 데이트, 연인・배우자",인테리어가 멋져요,54,1
