place_id,nickname,content,date,situations,keywords,review_count,visit_count
37242230,네이버사람,✅밤에도 핫한 횟집저는 밤 11시에 가서 12시까지 있었는데 사람이 정말 많았어요. 이렇게 유명한 집을 이제야 알다니... 후회가 되더라구요. 얼마나 맛있으면 사람이 이렇게 많을까하고 기대가 되었어요.✅정말 맛있는 음식오징어사시미와 매운탕을 시켰는데 오징어사시미는 아주 얇게 썰어져 나왔어요. 두꺼운 식감을 원하신다면 오징어회를 주문하시면 돼요. 오징어사시미는 정말 회가 달고 맛있었어요. 저는 회의 고유한 맛을 느끼기 위한 초장을 찍지 않고 먹는데 정말 비린내 하나 없이 맛있었어요. 매운탕도 싱겁거나 짜지 않고 간이 잘 되어 있고 맛있었어요. ✅친절한 직원들손님이 정말 많은데도 직원들이 미소를 잃지 않고 친절하게 대해주세요.,2023-09-24,밤에 방문,화장실이 깨끗해요,680,1
37242230,인프재히,"처음 방문했는데, 음식도 너무 신선하고 양도 많아서 친구랑 둘이 엄청 배터지게 먹고 왔어요!! 광어회, 오징어회 세트 강추드려요,,! 술이 그냥 술술 들어갑니다 ㅎ 마지막에 매운탕도 꼭 드세용:) 미친맛😭 저희는 라면사리, 수제비사리 다 추가해서 먹었는데, 배불러도 계속 숟가락이 가서 끝까지 다먹고 나왔어요👍",2023-09-23,아침에 방문,음식이 맛있어요,290,1
37242230,수퍼추,오징어회가 맛난집~생선회 해산물모듬 세트가 푸짐하게 나와요기본 안주로 미역국과 고등어구이가 나와서회가 나오기까지 안주로 먹기 좋네요^^알바 언니 오빠야들이 얼굴에 표정이 없어서무서워요....ㅠ,2023-09-22,점심에 방문,음식이 맛있어요,896,4
37242230,황뚠뚠,싱싱하고 맛있습니다!!,2023-09-17,저녁에 방문,음식이 맛있어요,837,2
1106337586,아름 답다,공간 넓고 야채 신선하고 맛있어요가족모임이나 친구모임등등 모임 장소로적극 추천합니다,2025-04-06,"점심에 방문, 예약 없이 이용, 대기 시간 10분 이내, 가족모임, 부모님",음식이 맛있어요,30,1
1106337586,co654024,신선하고 맛있어요,2025-03-31,"저녁에 방문, 예약 없이 이용, 대기 시간 바로 입장, 친목, 부모님",음식이 맛있어요,1656,2
1106337586,기미수v,😃,2025-03-29,"저녁에 방문, 예약 없이 이용, 대기 시간 30분 이상, 가족모임, 부모님",음식이 맛있어요,2156,1
1106337586,관심무,월남쌈도 앗있고 번잡하지 않아서  좋습니다,2025-03-26,"저녁에 방문, 예약 없이 이용, 대기 시간 바로 입장, 친목",음식이 맛있어요,502,2
1106337586,자바미,야채랑 칼국수 먹고싶을때 가는곳 🍲다이어트 양심의가책 느끼지않고 먹고싶을때 오는곳 ..ㅋㅋㅋㅋㅋㅋㅋㅋㅋ🤣🤣,2025-03-19,"저녁에 방문, 대기 시간 30분 이내",재료가 신선해요,26,1
1106337586,mn7****,넓고 직원분 친절하고 깔끔하고 맛있어요~~,2025-03-16,"저녁에 방문, 예약 없이 이용, 대기 시간 30분 이내, 친목, 부모님",재료가 신선해요,264,1
1106337586,WEV,버섯 선택은 필수지,2025-03-02,"저녁에 방문, 예약 없이 이용, 대기 시간 바로 입장, 일상, 연인・배우자, 아이",음식이 맛있어요,792,1
1106337586,gimmong6,매장깔끔하고 재로 신선하고 좋아요~밥먹고 후식아이스크림도 너무 만족합니다~,2025-02-28,"저녁에 방문, 예약 없이 이용, 대기 시간 바로 입장, 일상, 연인・배우자",음식이 맛있어요,908,1
1106337586,you****,늘 이용하네요요즘처럼 야채값이 폭등할때샐러드며야채먹기 좋은거 같아요,2025-02-25,"점심에 방문, 연인・배우자, 친구, 지인・동료, 부모님",음식이 맛있어요,119,1
1106337586,suksuk822,,2025-02-21,"점심에 방문, 예약 없이 이용, 대기 시간 10분 이내, 친목, 지인・동료",친절해요,2618,3
1106337586,이것도사용중인닉네임이냐,"평일 점심시간인데도 대기가 많았어요~!30분이상 대기하고 들어간듯 해요육수 반반으로 선택 가능해서 좋았어요월남쌈과 샤브샤브같이 먹으니 너무 행복했어요😍아이스크림과 커피,차,주스는 따로 마련된 곳에서 먹을 수 있어요~!!",2025-02-11,"점심에 방문, 예약 없이 이용, 대기 시간 30분 이내, 일상, 지인・동료, 아이",음식이 맛있어요,210,1
1106337586,망한고구마,ㅠㅠ 가성비 체고에여 넘 맛있구우 !!!버섯을 사랑하는데 버섯 엄청 많니 먹고 갑니다요 ㅎㅎㅎ직원분들도 다 너무 친절하셔서 기분 좋게 먹었습니당 ><♥,2025-02-10,"점심에 방문, 예약 없이 이용, 대기 시간 바로 입장, 데이트, 연인・배우자",음식이 맛있어요,939,1
1106337586,서진마미80,좋아요,2025-02-04,저녁에 방문,친절해요,1022,2
1106337586,술수리술,재료 가져오는 셀프바 계속 정리하고 청소하셔서 청결함 고기맛도 좋고 식사 후에 무료카페 아이스크림도 굳,2025-01-26,"점심에 방문, 예약 없이 이용, 대기 시간 바로 입장, 일상, 부모님",음식이 맛있어요,193,1
1106337586,초록나무2980,,2025-01-20,점심에 방문,음식이 맛있어요,1800,19
1106337586,김성애30,친절해요,2025-01-13,"점심에 방문, 예약 없이 이용, 대기 시간 바로 입장, 일상, 지인・동료",음식이 맛있어요,1846,10
1106337586,eyu****,좋아요 친절해요,2025-01-11,"점심에 방문, 예약 없이 이용, 대기 시간 10분 이내, 친목, 지인・동료",음식이 맛있어요,1084,13
1106337586,먹을것에진심o,"가격이 조금 오르긴 했지만, 다양하고 건강하게 먹을 수 있어서 여러명이 갈 때 특히 좋아요",2025-01-10,"저녁에 방문, 예약 없이 이용, 대기 시간 바로 입장, 친목, 부모님",음식이 맛있어요,140,1
1106337586,예 남매,모임하기 좋아요,2025-01-08,"점심에 방문, 예약 없이 이용, 대기 시간 바로 입장, 친목, 지인・동료",음식이 맛있어요,89,2
1106337586,린지78,자주오는 소담촌! 어딜가도맛있고장안점은 식사후 디저트 아이스크림이 특히맛있어요ㅎㅎㅎ오늘도 든든히먹고 갑니당,2025-01-05,"저녁에 방문, 예약 없이 이용, 대기 시간 바로 입장, 데이트, 연인・배우자",매장이 넓어요,127,1
1106337586,비상6250,는곳이여요,2025-01-02,저녁에 방문,음식이 맛있어요,1706,2
1106337586,hun****,,2024-12-30,"점심에 방문, 예약 없이 이용, 대기 시간 바로 입장, 친목, 지인・동료",음식이 맛있어요,1847,1
1106337586,끈즈,"여자친구랑 식사하러 갔습니다.월남쌈도 있고, 다양한 재료들도 많아서 푸짐하게 먹었어요.샤브샤브 맛있게 먹고 마지막에 칼국수랑 죽 만들어 먹는건 국룰입니다.가성비 좋아서 좋아요!",2024-12-22,"저녁에 방문, 예약 없이 이용, 대기 시간 바로 입장, 가족모임, 연인・배우자",음식이 맛있어요,380,1
1106337586,비상6250,자주가는곳입니다,2024-12-20,저녁에 방문,음식이 맛있어요,1706,1
1106337586,fee****,맛잇어요특히 커피도 넘맛나요,2024-12-18,"점심에 방문, 예약 없이 이용, 대기 시간 바로 입장, 일상, 친구",음식이 맛있어요,1434,2
1106337586,알지잘알지,👍👍,2024-12-17,저녁에 방문,음식이 맛있어요,895,2
1106337586,sjs****,집근처에 있어서 오픈때부터 이용한 곳입니다.얼마전부터 매우 불편한 식사를 하고 오게되네요.나이드신 여자아주머니 직원분께 매운소스를추가 부탁했더니 자기 쉬는 시간이라면서한 번에 시키라고 화를 내시는데 매우 당황스러웠네요.Break time이냐고 물었더니 그건 아니고본인 쉬는 시간이라네요ㅠ도대체 누구한테 추가 주문을 해야되는건지ㅠ2주전에도 계산하는데 음식을 남겼는지 확인하겠다며퉁명스럽게 말하던 직원이라 더 불쾌했네요몇년동안 자주 찾던곳이라 매우 실망스럽네요.추가주문 안받고 직원쉬는 시간이면그 시간에 손님을 받으면 안되는거아닌가요?화내는 아주머니 덕분에 매우 불쾌한 시간을보내고 왔네요ㅠ,2024-12-12,"저녁에 방문, 예약 없이 이용, 대기 시간 바로 입장, 친목, 연인・배우자",,25,1
1106337586,똘이쌤,메인음식은 당연히 굿굿굿이구요!커피 아이스크림 맛있어요.! 잘 먹었습니다.^^,2024-12-11,점심에 방문,음식이 맛있어요,670,5
1106337586,조 백수형,행복한 점심식사입니다~~ㅎㅎ,2024-12-11,"점심에 방문, 예약 없이 이용, 대기 시간 바로 입장",음식이 맛있어요,1261,10
1106337586,관심무,붐비지않아 좋아요~,2024-12-09,저녁에 방문,음식이 맛있어요,502,1
1106337586,주상전하43,굿,2024-12-08,"저녁에 방문, 예약 없이 이용, 대기 시간 바로 입장, 친목, 지인・동료",음식이 맛있어요,2003,1
1106337586,JS171,간만에 야채 많이 먹었어요 맛있어요,2024-12-06,"점심에 방문, 예약 없이 이용, 대기 시간 바로 입장, 회식, 친척・형제",음식이 맛있어요,2169,3
1106337586,수퍼추,가성비 굿굿~~,2024-11-24,"저녁에 방문, 예약 없이 이용, 대기 시간 30분 이내, 친목, 친구",음식이 맛있어요,896,3
1106337586,mo****,맛있어요,2024-11-24,"점심에 방문, 예약 후 이용, 대기 시간 바로 입장, 가족모임, 부모님, 친척・형제",음식이 맛있어요,934,4
1106337586,ksw****,맛,2024-11-22,점심에 방문,음식이 맛있어요,1657,10
1106337586,딸기좋아72,,2024-11-21,"저녁에 방문, 예약 없이 이용, 대기 시간 바로 입장, 일상, 연인・배우자",음식이 맛있어요,878,12
1106337586,엠블라,와 야채 신선하고 월남쌈이랑 시원한 열무김치에 샤브샤브 다 최고입니다~^  ^,2024-11-17,"점심에 방문, 예약 없이 이용, 대기 시간 바로 입장, 친목, 나들이, 친구",음식이 맛있어요,265,1
1106337586,mimijela,따뜻한 육수에신선한 야채랑 고기 먹을 수 있어서 좋아요!다이어트 걱정없이 먹고나면 으스스한 컨디션도 회복되는 기분이에요.다른지점 보다 더 청결해서 좋았어요.주차는 두시간 지원됩니다 :),2024-11-15,"점심에 방문, 예약 없이 이용, 대기 시간 바로 입장, 데이트, 부모님",주차하기 편해요,463,1
1106337586,조 백수형,좋아요~<,2024-11-15,"점심에 방문, 예약 없이 이용, 대기 시간 바로 입장",음식이 맛있어요,1261,9
1106337586,joo****,좋아요,2024-11-15,"점심에 방문, 예약 없이 이용, 대기 시간 바로 입장, 가족모임",음식이 맛있어요,1322,2
1106337586,kmj****,맛있음,2024-11-11,"저녁에 방문, 예약 없이 이용, 대기 시간 바로 입장, 데이트, 연인・배우자",음식이 맛있어요,816,1
1106337586,애딩감딩,볶음밥까지  필수....! 탕은 무조건 두개.. 무한리필이니까 고무줄바지 필수!,2024-11-10,"저녁에 방문, 예약 없이 이용, 대기 시간 30분 이내, 친목, 친구",음식이 맛있어요,83,1
1106337586,yumi770808,가격저렴하고 재료 신선해요 가성비갑👍,2024-11-06,"점심에 방문, 예약 후 이용, 대기 시간 바로 입장, 친구",음식이 맛있어요,197,1
1106337586,wildrose45,신선한야채에 샤브샤브 궁물 맛남 굿,2024-11-02,"점심에 방문, 예약 없이 이용, 대기 시간 바로 입장, 일상, 가족모임, 부모님",음식이 맛있어요,2054,2
1106337586,파아란하늘1310,굿~,2024-11-01,"저녁에 방문, 예약 없이 이용, 대기 시간 바로 입장, 가족모임, 아이, 부모님",음식이 맛있어요,1253,5
1106337586,pyo****,음식이 맛나요,2024-10-31,"저녁에 방문, 예약 후 이용, 대기 시간 10분 이내, 친목, 친구",재료가 신선해요,1048,2
1106337586,sjj****,청결하고  까페. 좋아요,2024-10-25,"저녁에 방문, 예약 후 이용, 대기 시간 바로 입장, 친목, 지인・동료",음식이 맛있어요,172,2
1106337586,jho****,친절해요,2024-10-24,"점심에 방문, 예약 없이 이용, 대기 시간 바로 입장, 친목, 친구",음식이 맛있어요,1477,2
1106337586,호랑이와까치,좋아요 😀,2024-10-23,"점심에 방문, 예약 없이 이용, 대기 시간 바로 입장, 친목, 친구",음식이 맛있어요,497,1
1106337586,wpwntkaektn,양많으면 가성비 좋아요~,2024-10-21,"점심에 방문, 예약 없이 이용, 대기 시간 바로 입장, 일상, 부모님",가성비가 좋아요,1095,1
1106337586,타블렛62,아버님 생신이라 다들 모였는데 샤브 샤브 월남쌈 너무 좋아요. 소담촌 장안점 다들 만족합니다.,2024-10-19,"점심에 방문, 예약 없이 이용, 대기 시간 바로 입장, 친목, 연인・배우자, 지인・동료",음식이 맛있어요,589,1
1106337586,달파랑,좋아요,2024-10-11,점심에 방문,음식이 맛있어요,1487,1
1106337586,울잠팅이,굿 맛있어요 자주 가는곳이에요 6시전에 가서 기다리지않고 바로들어갔어요배부르게  잘먹고왔네요매장이 넓고 직원도 친절하고  음식재료도 신선하고 자주채워주고  다먹고  아이스크림에  매실차까지 먹을수있어요,2024-10-06,"저녁에 방문, 예약 없이 이용, 대기 시간 바로 입장, 일상, 연인・배우자, 아이",음식이 맛있어요,1147,5
1106337586,mo****,맛있어요,2024-10-06,"점심에 방문, 예약 없이 이용, 대기 시간 바로 입장, 가족모임, 친척・형제",음식이 맛있어요,934,3
1106337586,알지잘알지,👍👍,2024-10-05,저녁에 방문,매장이 넓어요,895,1
1106337586,딸기좋아72,,2024-10-01,"점심에 방문, 예약 없이 이용, 대기 시간 바로 입장, 일상, 연인・배우자, 아이",음식이 맛있어요,878,11
1106337586,fee****,음식도 맛잇엇는데 커피까지 무료라 너무 좋네요,2024-09-25,"점심에 방문, 예약 없이 이용, 대기 시간 바로 입장, 데이트, 친구",음식이 맛있어요,1434,1
1106337586,tvfxqz,매장도 크고 친절하세요 주차가 조금 아쉽지만 다음에도 갈 거 같아요,2024-09-17,"저녁에 방문, 예약 후 이용, 대기 시간 바로 입장, 가족모임",인테리어가 멋져요,777,1
1106337586,김성애30,친절해요,2024-09-16,"저녁에 방문, 예약 없이 이용, 대기 시간 바로 입장, 일상, 지인・동료",음식이 맛있어요,1846,9
1106337586,ksw****,맛있어요,2024-09-16,저녁에 방문,음식이 맛있어요,1657,9
1106337586,Udesign,전농동 최고의 맛집,2024-09-14,"저녁에 방문, 예약 후 이용, 대기 시간 바로 입장, 데이트, 기념일, 가족모임",음식이 맛있어요,397,1
1106337586,Jkhgfdb88,너무맛잇엇고 깔끔함 뷰도 이쁨,2024-09-12,"저녁에 방문, 예약 없이 이용, 대기 시간 바로 입장, 가족모임, 기타",인테리어가 멋져요,855,1
1106337586,꽁희온니,야채 생각날때  가요오늘도 많이 먹고 왔네요,2024-09-05,"점심에 방문, 예약 없이 이용, 대기 시간 바로 입장, 일상, 지인・동료",음식이 맛있어요,3071,3
1106337586,jho****,매장두 넓구 맛있어요,2024-09-05,"점심에 방문, 예약 없이 이용, 대기 시간 바로 입장, 친목, 친구",음식이 맛있어요,1477,1
1106337586,eyu****,대기가너무 많아요,2024-09-01,"저녁에 방문, 예약 없이 이용, 대기 시간 30분 이내, 나들이, 지인・동료",음식이 맛있어요,1084,12
1106337586,꽁희온니,야채가 신선하고 무한리필로 많이 먹을수 있어서 좋고 기분좋은 배불림 야채가 생각날때 또와서 먹어야겠다,2024-08-29,"점심에 방문, 예약 없이 이용, 대기 시간 바로 입장, 데이트, 지인・동료",재료가 신선해요,3071,2
1106337586,ksw****,친절,2024-08-29,점심에 방문,음식이 맛있어요,1657,8
1106337586,김성애30,친절해요,2024-08-29,"점심에 방문, 예약 없이 이용, 대기 시간 바로 입장, 지인・동료",음식이 맛있어요,1846,8
1106337586,구리빛청년,샤브샤브 말고도 월남쌈 그리고 아이스크림 커피등 다양학 먹기 좋아요,2024-08-27,"저녁에 방문, 예약 없이 이용, 대기 시간 바로 입장, 일상, 연인・배우자, 아이",친절해요,732,2
1106337586,ksw****,친절,2024-08-27,점심에 방문,음식이 맛있어요,1657,7
1106337586,김성애30,친절해요,2024-08-27,"점심에 방문, 예약 없이 이용, 대기 시간 바로 입장, 일상, 지인・동료",재료가 신선해요,1846,7
1106337586,정블리2785,맛있게 잘 먹었습니다,2024-08-20,"점심에 방문, 예약 없이 이용, 대기 시간 바로 입장, 친목, 지인・동료",음식이 맛있어요,1393,2
1106337586,hsg****,굿,2024-08-05,저녁에 방문,친절해요,745,10
1106337586,천지인9840,좋아요,2024-08-04,"저녁에 방문, 예약 없이 이용, 대기 시간 바로 입장, 친목, 친구",음식이 맛있어요,3124,1
1106337586,진주610,좋아요,2024-08-04,"저녁에 방문, 예약 없이 이용, 대기 시간 바로 입장, 친목, 친척・형제",음식이 맛있어요,3267,1
1106337586,꽃자리니,회식도 좋아요 ~,2024-08-02,"저녁에 방문, 예약 없이 이용, 대기 시간 바로 입장, 데이트",음식이 맛있어요,1244,3
1106337586,채히12,월남쌈에 아이들이 잘 먹어서 가족 모임에 만족스러웠어요아이들이 먹고 싶다고 해서 왔지만 어른들도 너무 맛있게 잘 먹었어요 ^^재료 신선하고 버섯 여러가지 종류에 보는 재미도 있고 멋는 재미까지 👍샐러드바도 구성 좋고 야채 신선 풍족해서 너무 마음에 드네요,2024-07-28,"저녁에 방문, 예약 없이 이용, 대기 시간 10분 이내, 가족모임, 부모님, 친척・형제",음식이 맛있어요,993,1
1106337586,wildrose45,굿,2024-07-27,"점심에 방문, 예약 없이 이용, 일상, 가족모임, 부모님",음식이 맛있어요,2054,1
1106337586,azx****,굿,2024-07-24,점심에 방문,음식이 맛있어요,2264,4
1106337586,은헌맘75,ㆍ,2024-07-22,"점심에 방문, 예약 없이 이용, 대기 시간 바로 입장, 친목, 친구",음식이 맛있어요,670,3
1106337586,hsg****,굿,2024-07-17,점심에 방문,친절해요,745,9
1106337586,정블리2785,직원들이랑 맛있게 먹었어요,2024-07-17,"점심에 방문, 예약 없이 이용, 대기 시간 바로 입장, 친목, 지인・동료",음식이 맛있어요,1393,1
1106337586,조 백수형,최고의 맛집이죠~~,2024-07-16,"점심에 방문, 예약 없이 이용, 대기 시간 바로 입장",음식이 맛있어요,1261,8
1106337586,꽃자리니,"단골집 입니다.시설,음식 깔끔하고 추천할만한 곳입니다.",2024-07-15,"저녁에 방문, 예약 없이 이용, 대기 시간 바로 입장, 데이트, 친구",음식이 맛있어요,1244,2
1106337586,유하굴,전농동에 있는 샤브샤브집!! 다 먹고 아이스크림까지 맛있게 먹었어요ㅎㅎ 고기는 무조건 목심입니다!,2024-07-09,"저녁에 방문, 예약 없이 이용, 대기 시간 바로 입장, 친목, 지인・동료",매장이 넓어요,471,2
1106337586,시냇물94,소담촌 좋아요,2024-07-07,"저녁에 방문, 예약 없이 이용, 대기 시간 바로 입장, 일상, 연인・배우자, 친구",음식이 맛있어요,1776,2
1106337586,파아란하늘1310,굿~,2024-07-06,"저녁에 방문, 예약 없이 이용, 대기 시간 바로 입장, 기념일, 연인・배우자, 아이",음식이 맛있어요,1253,4
1106337586,jae****,굿,2024-07-04,점심에 방문,가성비가 좋아요,1027,1
1106337586,수퍼추,런치메뉴 저렴하고 넘 좋아요~,2024-07-03,"점심에 방문, 대기 시간 바로 입장, 친목, 친구",음식이 맛있어요,896,2
1106337586,셋뚱,담백하게 맛난 샤브샤브~~,2024-06-30,저녁에 방문,음식이 맛있어요,720,7
1106337586,sjj****,가격대비 컬리디긴 좋아요,2024-06-28,"저녁에 방문, 예약 없이 이용, 대기 시간 바로 입장, 친목, 친구",음식이 맛있어요,172,1
1106337586,bla****,음식이 맛있어요,2024-06-28,"점심에 방문, 예약 없이 이용, 대기 시간 바로 입장, 일상, 친구",음식이 맛있어요,461,1
1106337586,yu0****,샤브샤브  맛집,2024-06-27,"저녁에 방문, 예약 없이 이용, 대기 시간 바로 입장, 친목, 지인・동료",음식이 맛있어요,393,1
1106337586,소소 데일리,오랜만에 샤브샤브맛나네요~,2024-06-23,저녁에 방문,특별한 메뉴가 있어요,2433,5
1106337586,hsg****,굿,2024-06-23,점심에 방문,재료가 신선해요,745,8
1106337586,꽁희온니,아이들과 맛있게 먹고 갑니다언제와서 먹어도 부담없고 속이 편안해서 좋아요무한리필이라 야채 원없이 많이 먹었네요,2024-06-22,"저녁에 방문, 예약 없이 이용, 대기 시간 바로 입장, 일상, 아이",음식이 맛있어요,3071,1
1106337586,소금리,맛있게 잘 먹었습니다!,2024-06-21,"점심에 방문, 예약 없이 이용, 대기 시간 바로 입장, 가족모임, 부모님, 친척・형제",음식이 맛있어요,1017,1
1106337586,Kimmy25,"가끔 부모님과 점심 먹으러 가다 예약없이 저녁에 가니 대기하고 들어가  7시 30분이 다되서야  식사가 시작되었어요. 근데  8시가 넘으니 직원들이 청소를 시작해서 몇시에 문닫냐고 했더니 9시가 샐러드바 마감이고 9시30분에 문을 닫는다고 하더군요. 밥먹는데 계속 정리를 하시고, 8시30분이 되니 대걸레를 가지고 청소를 하러 다니는데 아직 테이블에서 밥먹는 손님들도 있고..저희  테이블도 먹고있고.. 기기막히고 눈치가 보여 9시전에 나왔습니다. 저녁모임 하시려면 꼭 예약하고 가셔서 여유롭게 즐기다 오세요.",2024-06-15,"저녁에 방문, 예약 없이 이용, 대기 시간 30분 이내, 친목, 친척・형제",재료가 신선해요,10,1
1106337586,rev****,좋아요,2024-06-09,"저녁에 방문, 예약 없이 이용, 대기 시간 바로 입장, 기념일, 친척・형제",음식이 맛있어요,426,1
1106337586,똘이쌤,가족들과 맛있게 식사했습니다.^^,2024-06-07,점심에 방문,음식이 맛있어요,670,3
1028098486,김도영29,장한평 오랜만에 방문해서 왔습니다올때마다 매번 오는 맛집😋😋,2025-04-09,"저녁에 방문, 예약 없이 이용, 대기 시간 바로 입장, 일상, 혼자",혼밥하기 좋아요,15,6
1028098486,Joopiter,1인세트가 잘 구성되어 있고 매장 분위기가 조용해서 혼밥하기 좋아요 :) 차슈에서 불맛도 나고 간장 숙성 하셨다는 반숙계란도 맛있어요! 맛있는 한 끼 잘 먹고 갑니다~!,2025-04-09,"점심에 방문, 예약 없이 이용, 대기 시간 바로 입장, 일상, 혼자",혼밥하기 좋아요,33,1
1028098486,ys9****,남자친구가 이에케라멘 먹어보고싶다고 해서 따라 왔는데 너무 맛있네요..! 또 올게요 ㅎㅎ,2025-04-08,"저녁에 방문, 예약 없이 이용, 대기 시간 바로 입장, 데이트, 연인・배우자",음식이 맛있어요,35,1
1028098486,푸른하늘3806,아담하고 작은 가걔  혼자서  와도  부담없는  곳^^가격도 좋고 맛도  있어서  두번째 방문~방문 할때  마다 다른 메뉴 먹는 재미가 있다집 근처라  편하게 또 옵니다 ㅎ,2025-04-08,"저녁에 방문, 예약 없이 이용, 대기 시간 10분 이내, 일상, 기타",음식이 맛있어요,33,1
1028098486,니니니닌,한국에서는 라멘을 잘안먹는데 전혀 느끼하지않고  담백하니 맛있어요,2025-04-08,"점심에 방문, 예약 없이 이용, 대기 시간 바로 입장, 친목, 연인・배우자, 친구",음식이 맛있어요,530,1
1028098486,댕댕58,잘 먹고 갑니다~!!,2025-04-08,"점심에 방문, 예약 없이 이용, 대기 시간 바로 입장, 데이트, 연인・배우자",혼밥하기 좋아요,59,2
1028098486,유7027,남편이랑 산책하면서 항상 오고싶어서 눈여겨보던 곳..아기랑 산책 도중에 급 방문했는데 결국 아기가 깨버려서ㅜㅜ 남편은 제대로 못먹고 저만 제대로 먹은...ㅋ아가한테 미안하지만 엄마아빠는 너무 맛있구나ㅠㅠ♥︎빨리나와서 좋고 양도 많고 맛잇어요^^,2025-04-07,"점심에 방문, 예약 없이 이용, 대기 시간 바로 입장, 데이트, 연인・배우자",음식이 맛있어요,13,1
1028098486,sdfvxcv22,믿고오는 라멘트럭!!,2025-04-06,"점심에 방문, 예약 없이 이용, 대기 시간 바로 입장, 혼자",음식이 맛있어요,10,3
1028098486,쿠밍80,일요일도 영업해서 넘 조아용ㅎㅎ매일먹어도 안질리는 ><,2025-04-06,"점심에 방문, 예약 없이 이용, 대기 시간 30분 이내, 데이트, 연인・배우자",친절해요,55,19
1028098486,yeo****,맛있다는 후기가 많아서 찾아왔는데 국물도 진하고 맛있어요!!,2025-04-06,"점심에 방문, 예약 없이 이용, 대기 시간 바로 입장, 데이트, 연인・배우자",음식이 맛있어요,15,1
1028098486,Babi64,집앞에 있는 라멘집을 드디어 와봤어요!매장도 너무 청결하고 맛있어요!자주올거같아요,2025-04-06,"점심에 방문, 예약 없이 이용, 대기 시간 바로 입장, 친목, 연인・배우자",음식이 맛있어요,62,1
