place_id,nickname,content,date,situations,keywords,review_count,visit_count
1225845295,applelove90,아이가 파스타 먹고싶다고해서 방문했어요ㅎ따듯하니 맛있네요^^ 종종 와서 먹어야겠어요~가성비좋고 인테리어도 맘에들어요~~,2025-04-09,"저녁에 방문, 예약 없이 이용, 대기 시간 바로 입장, 일상, 아이",음식이 맛있어요,664,1
1225845295,서우2633,저번에 엄마랑 오고 좋았어서 또 왔어요!!가성비 너무 좋고 식전으로 주시는 마늘빵 존맛,2025-04-09,"저녁에 방문, 예약 후 이용, 대기 시간 바로 입장, 데이트, 연인・배우자",음식이 맛있어요,23,2
1225845295,Yuuuuu유,메뉴구성도 좋고 맛있어서 가성비 최고!잘먹었습니다:),2025-04-09,"저녁에 방문, 예약 없이 이용, 대기 시간 바로 입장, 데이트, 나들이, 연인・배우자",음식이 맛있어요,10,1
1225845295,jmj****,,2025-04-09,"점심에 방문, 예약 없이 이용, 대기 시간 바로 입장, 데이트, 연인・배우자",매장이 넓어요,53,1
1225845295,르네브,인테리어도 깔끔하고 음식이 전반적으로 맛있네요.노원에서 먹을 곳 마땅치 않았는데 추천합니다,2025-04-09,"점심에 방문, 예약 없이 이용, 대기 시간 바로 입장, 나들이, 아이",음식이 맛있어요,16,1
1225845295,소찌50,깔끔하고 점심시간에 혼밥하기 너무 좋아요 맛잇게 먹고 갑니다~,2025-04-09,"점심에 방문, 예약 없이 이용, 대기 시간 바로 입장, 혼자",인테리어가 멋져요,14,1
1225845295,지호9273,가격이 너무 괜찮고 맛도 정말 맛있어요 :),2025-04-09,"점심에 방문, 예약 없이 이용, 대기 시간 바로 입장, 데이트, 연인・배우자",대화하기 좋아요,4,1
1225845295,bbb****,노원 맛집이라 해서 왔는데ㅔ 정말 맛집이네여.. 이 가격에 이 분위기 이 맛이면 사장님 남는게 없을 것 같아유🥹🥹🥹 넘 조아서 담에 또오려구어~~!!,2025-04-08,"저녁에 방문, 예약 없이 이용, 대기 시간 바로 입장, 데이트, 연인・배우자",음식이 맛있어요,51,1
1225845295,방밍동,음식 종류가 많아서 너무 좋네요 나중에 다 먹으러 또 와야겠어요~><,2025-04-08,"저녁에 방문, 예약 없이 이용, 대기 시간 바로 입장, 친목, 친구",음식이 맛있어요,2,1
1225845295,핑뚱잉,가성비도 좋고 맛도 맛있고 진짜 노원 근처는 여기만 옵니다 한 4번 왔는데 40번 올 것 같아용!!,2025-04-08,"저녁에 방문, 예약 없이 이용, 대기 시간 바로 입장, 친목, 친구",대화하기 좋아요,14,1
1225845295,Dnsjd,네이버 예약후 다녀왔어요~~방문해서 고르곤졸라 피자/토마토 파스타/사이드메뉴 윙/스테이크 샐러드로 주문했어요음식도 따뜻하고 간도 괜찮구 샐러드도 싱싱해서 맛있게먹었습니다 ㅎㅎ가성비도 너무 좋은데 맛도 있어서 알차고 푸짐하게 저녁식사를 할 수 있었던것 같아요 ㅎㅎ웨이팅없이 바로 들어갔구 음식도 바로바로 나와서먹을 수 있었어요 ㅎㅎ 이점도 마음에 들었어요 ㅎㅎ다음번에 또 재방문하게된다면 다른메뉴로도 한번 먹어보고싶더라구요! 주변 지인들한테 추천하고 싶을만큼 좋은 가게였습니다!! 덕분에 좋은 저녁시간 보낼 수 있었어요~!,2025-04-08,"저녁에 방문, 예약 후 이용, 대기 시간 바로 입장, 가족모임, 부모님, 친척・형제",음식이 맛있어요,9,1
1225845295,bbosiraegi,맛잇어요 ㅋㅋ 담에 또와야지,2025-04-08,"점심에 방문, 예약 없이 이용, 대기 시간 바로 입장, 친목, 친구",음식이 맛있어요,294,1
1225845295,Ssesse,양도 많고 가성비 갑 양식집이에요 ㅠㅠ 직원분도 너무 친절하시고 만족합니당,2025-04-08,"점심에 방문, 예약 없이 이용, 대기 시간 바로 입장, 친목, 친구",음식이 맛있어요,8,1
1225845295,황다정,대기 없이 들어왔어요 ! 맛있고 추천합니다 :),2025-04-08,"점심에 방문, 예약 없이 이용, 대기 시간 바로 입장, 친목, 지인・동료",인테리어가 멋져요,15,2
1225845295,SongC91,직원분들도 너무 친절하시고 유아의자도 있어어 10개월 된 애기와 같이 와서 맛있게 먹고 갑니다~^^,2025-04-08,"점심에 방문, 예약 없이 이용, 대기 시간 바로 입장, 데이트, 연인・배우자",음식이 맛있어요,40,1
1225845295,muz****,처음 방문해봤는데 주차장도 잘 되어 있구 무엇보다 가격에비해 메뉴가 정말 알차서 좋았어요!! 로제 파스타 강추합니다!!,2025-04-07,"저녁에 방문, 예약 없이 이용, 대기 시간 바로 입장, 데이트, 친구",매장이 넓어요,5,1
1225845295,kim****,,2025-04-07,"저녁에 방문, 포장·배달 이용, 대기 시간 바로 입장, 일상, 연인・배우자",음식이 맛있어요,8,1
1225845295,우우우위76,인테리어가 잘되어있어서 분위기가 좋아용,2025-04-07,"저녁에 방문, 예약 없이 이용, 대기 시간 바로 입장, 데이트, 연인・배우자",인테리어가 멋져요,29,1
1225845295,bob****,맛있고 가성비 좋아서 여러번 오게 되네요,2025-04-07,"점심에 방문, 예약 없이 이용, 대기 시간 바로 입장, 친목, 친구",음식이 맛있어요,20,1
1225845295,fir****,"매장이 새로 생긴후부터 계속 오고싶었는데, 드디어 오게 됐어요-쪼금 늦은 시간인대도 손님도 많고, 연령대도 다양해서 걱정 1도 없이 들어왔어요-기다리는동안 배달도 엄청 많이 나가던데, 홀이 있는 가게는 배달도 믿음이가서 다음에는 배달도 도전해볼까봐요-스테이크도 있는 세트를 먹었는데 3만원대라니..진짜 가성비 최고인거 같아요-직원분들도 친절하고 매장도 깔끔해서 다시 올거같아요-",2025-04-06,"저녁에 방문, 예약 없이 이용, 대기 시간 바로 입장, 데이트, 연인・배우자",음식이 맛있어요,16,1
1225845295,Chrissorex,"메뉴가 너무 다양해서 고르는데 한참 걸렸네요! 고르곤졸라피자랑 투움바, 감바스 파스타 이렇게 먹었는데 너무 맛있고 가성비도 좋았습니다. 이런 가게가 있다는걸 이제라도 알아서 다행이네요 자주 올것같습니다!",2025-04-06,"저녁에 방문, 예약 없이 이용, 대기 시간 바로 입장, 데이트, 친목, 친구",음식이 맛있어요,6,1
1225845295,huuuui0,메뉴도 다양하고 정말 맛있어요,2025-04-06,"저녁에 방문, 예약 없이 이용, 대기 시간 바로 입장, 데이트, 나들이, 친구",음식이 맛있어요,24,1
1225845295,heo1106,정말 맛있고 가성비 식당이라서 강추합니다!!친구랑 정말 배부르게 먹었어요특히 파스타랑 마늘바게트는 최고였어요❤️,2025-04-06,"점심에 방문, 예약 없이 이용, 대기 시간 바로 입장, 친목, 친구",인테리어가 멋져요,17,1
1225845295,루루루루루룰룰루률,주차가능하고 가성비있어요 💛💛또올게용,2025-04-06,"점심에 방문, 예약 없이 이용, 대기 시간 바로 입장, 데이트, 연인・배우자",인테리어가 멋져요,23,1
1225845295,지애예요,아이들과 와서 다양한 메뉴를 시켜도 부담없고 맛있게 먹을수 있네요^^,2025-04-06,"점심에 방문, 예약 없이 이용, 대기 시간 바로 입장, 나들이, 아이",음식이 맛있어요,12,1
1225845295,재훈4498,날씨가 좋아 걷다가 파스타와 피자가 땡겨 방문하였는데 메뉴도 많고 시킨 음식도 맛있었습니다!!,2025-04-06,"점심에 방문, 예약 없이 이용, 대기 시간 바로 입장, 데이트, 연인・배우자",특별한 메뉴가 있어요,32,1
1225845295,점마니마니,매장 깔끔하고 음식도 맛있어요❤️🤍,2025-04-06,"점심에 방문, 예약 없이 이용, 대기 시간 바로 입장, 데이트, 연인・배우자",음식이 맛있어요,6,1
1225845295,물숭아,친구들 만나서 어디가지 하다가 아무렇게나 들어왔는데 생각지도 못하게 가격도 착하고 맛도 좋았어요 데이트하기도 좋은거같아요 가게도 깔끔!,2025-04-06,"점심에 방문, 예약 없이 이용, 대기 시간 바로 입장, 친목, 친구",음식이 맛있어요,63,1
1225845295,tyg****,마라로제 처음 먹어보는데 매콤하고 마라향나는게 넘 맛있어요 ㅎㅎ 가라아게도 바삭바삭 🥹 가게도 넘 이뻐서 남자친구랑 행벅하게 식사하고 갑니다 ㅎㅎ,2025-04-05,"저녁에 방문, 예약 없이 이용, 대기 시간 바로 입장, 데이트, 연인・배우자",음식이 맛있어요,45,1
1225845295,외식리뷰어,"직원분 친절하시고, 다양한 메뉴에 특히 마라크림파스타가 너무 맛있어요~!^^",2025-04-05,"저녁에 방문, 예약 없이 이용, 대기 시간 바로 입장, 가족모임, 아이",음식이 맛있어요,126,1
1225845295,까탈인,너무 맛나오!,2025-04-05,"저녁에 방문, 예약 없이 이용, 대기 시간 10분 이내, 데이트, 연인・배우자",양이 많아요,40,1
1225845295,Aloy,기본으로 제공되는 마늘빵도 맛있고 파스타도 가성비 좋고 맛있어요!  :),2025-04-05,"저녁에 방문, 예약 없이 이용, 대기 시간 바로 입장, 친목, 친구",친절해요,7,1
1225845295,Tennessee159,메뉴도 다양하고 가격도 저렴해서 너무 좋았어요!! 너무 맛있고 마늘빵 서비스도 주셔서 너무 감사했습니다🥺🥺 다음에 노원에 오면 또 방문할 것 같아요!! 주차도 편하고 정말 좋았습니다🥰,2025-04-05,"점심에 방문, 예약 없이 이용, 대기 시간 바로 입장, 가족모임, 부모님",음식이 맛있어요,2,1
1225845295,gieunzzang34,"가성비 좋고, 피자랑 파스타 둘다 너무 맛있어요!!가족들이랑 와도 좋고, 친구, 연인이랑 와도 좋을 것 같아요. 매장도 넓고, 쾌적합니다.재방문의사 100프로입니다.👍👍👍",2025-04-05,"점심에 방문, 예약 없이 이용, 대기 시간 바로 입장, 친목, 친구",친절해요,37,1
1225845295,gml****,매장도 깔끔하고 음식도 맛있습니다!,2025-04-05,"점심에 방문, 예약 후 이용, 대기 시간 바로 입장, 나들이, 친구, 아이",음식이 맛있어요,7,1
1225845295,바이올라73,음식이 맛있고 정말 친절하십니당~^^,2025-04-05,"점심에 방문, 예약 없이 이용, 대기 시간 10분 이내, 가족모임, 나들이, 부모님",친절해요,267,1
1225845295,검은머리앤17,,2025-04-05,"점심에 방문, 예약 후 이용, 대기 시간 바로 입장, 일상, 데이트, 아이",가성비가 좋아요,3,1
1225845295,모래9110,여자친구랑 찾아보다가 메누가 다양해서 와봤는데 맛도있고 서비스도 엄청 좋아요! 강추강추 다음에또올게요!!,2025-04-05,"점심에 방문, 예약 후 이용, 대기 시간 바로 입장, 데이트, 연인・배우자",음식이 맛있어요,23,1
1225845295,co****,집 근처 가성비 맛집으로 유명해요!가격이 일단 너무 저렴하고 맛도 좋아서종종 와서 먹는데 김치필라프가 진짜 맛있어요!!,2025-04-04,"저녁에 방문, 예약 없이 이용, 대기 시간 바로 입장, 데이트, 연인・배우자",음식이 맛있어요,5,1
1225845295,wjd****,,2025-04-04,"점심에 방문, 예약 없이 이용, 대기 시간 바로 입장, 데이트, 연인・배우자",음식이 맛있어요,2,1
1225845295,서주환2,서비스 마늘빵도 마싯고 주차공간이있는게 넘 좋은거 같습니다  음식 퀄도 나쁘지않아용,2025-04-04,"점심에 방문, 예약 없이 이용, 대기 시간 바로 입장, 데이트, 연인・배우자",음식이 맛있어요,28,1
1225845295,민혁39,음식이 빨리 나와요 ㅋㅋ맛있어요. 마늘빵도 맛있어요다음에 또 올게용~,2025-04-04,"점심에 방문, 예약 없이 이용, 대기 시간 바로 입장, 데이트, 연인・배우자",매장이 청결해요,10,1
1225845295,야호590,너무 맛있어요!! 요일별루 할인되는 메뉴도 있고 이것저것 이벤트도 많이해요! 식전 마늘빵이 너무 맛있어서 다음엔 마늘빵도 사이드로 주문해서 먹어야겠어요 💗 잘먹었습니다!,2025-04-04,"점심에 방문, 예약 후 이용, 대기 시간 바로 입장, 일상, 친구",음식이 맛있어요,23,1
1225845295,stenphanie,매장도 깔끔하고 식전 마늘빵도 맛있고 파스타 종류가 많아서 좋아요~!~!,2025-04-03,"저녁에 방문, 예약 없이 이용, 대기 시간 바로 입장, 데이트, 연인・배우자",음식이 맛있어요,777,1
1225845295,yerinfive,지나가다가 보여서 들어왔는데 가성비 좋고 매장도 매우 깔끔해요 번창하세요~~,2025-04-03,"저녁에 방문, 예약 없이 이용, 대기 시간 바로 입장, 데이트, 연인・배우자",음식이 맛있어요,11,1
1225845295,신바람난,식사권을 제공받고 방문했어요.가성비 좋은 파스타집이에요. 인테리어도 깔끔하고 넓어서 점심 약속 잡기 좋겠어요.가격대비 음식이 잘 나와서 부담없이 식사할수 있었어요.마라는 2단계쯤 되서 제법 얼얼해요.매운맛 좋아하는 사람 정신 못차릴듯ㅋㅋ,2025-04-03,"저녁에 방문, 예약 후 이용, 대기 시간 바로 입장, 데이트",음식이 맛있어요,676,1
1225845295,장연지연장,친절하시고 양도 많고 매장도 엄청 깔끔해요! 서비스로 주시는 마늘빵도 부들촉촉바삭 맛나요 ♥️♥️ 재방문 의사 100프로입니당 •͈˽•͈,2025-04-03,"점심에 방문, 예약 없이 이용, 대기 시간 바로 입장, 데이트, 연인・배우자",음식이 맛있어요,21,1
1225845295,풀루도,사장님 친절해서 기분이 좋아집니다. 음식도 맛있어요!,2025-04-03,"점심에 방문, 예약 없이 이용, 대기 시간 바로 입장, 비즈니스, 혼자",음식이 맛있어요,15,1
1225845295,mym****,너무 맛있어요ㅜㅜㅜ 마라맛 제대로임,2025-04-03,"점심에 방문, 예약 없이 이용, 대기 시간 바로 입장, 친목, 친구",음식이 맛있어요,6,1
1225845295,강철하수구,"""오늘 방문한 '파스타한끼 노원 본점'은 기대 이상이었어요! 시그니처 파스타와 고르곤피자는  풍미가 일품. 특히 로제파스타의 깊은 향이 인상적이었죠. 모던한 인테리어와 은은한 조명이 아늑한 분위기를 자아냈고, 직원분들의 세심한 응대와 추천 메뉴 설명이 정말 좋았습니다. 맛과 서비스 모두 완벽한 곳, 재방문 의사 100%!""",2025-04-03,"점심에 방문, 예약 없이 이용, 대기 시간 바로 입장, 데이트, 연인・배우자",음식이 맛있어요,35,1
1225845295,꽁치냥,가성비 좋고 맛있어서 파스타 생각나면 오는 곳이에요!식전 갈릭빵?도 진짜 맛있고 이번에 우삼겹불닭투움바 먹어봤는데 맵기도 딱 적당하고 너무 맛있어요 👍 사람도 항상 많은데 그만큼 맛집 인정 같아요💖직원분들도 항상 친절해서 좋습니다✨️,2025-04-03,"점심에 방문, 예약 없이 이용, 대기 시간 바로 입장, 일상, 혼자",음식이 맛있어요,195,1
1225845295,릴리7018,저는 많이 와봤는데 새로운 분들 모시고 왔어요.오호홋~~가성비가 좋다고 좋아했어요.다음에 또 오실 듯 해요.파스타도 리조또도 맛있었어요.,2025-04-03,"점심에 방문, 예약 없이 이용, 대기 시간 바로 입장, 친목, 친구",음식이 맛있어요,57,5
1225845295,bbi****,깔끔하게 음식이 나오네요~~~생각보다 양은 적은듯하네요~~,2025-04-03,"점심에 방문, 예약 없이 이용, 대기 시간 바로 입장, 일상, 아이",음식이 맛있어요,66,1
1225845295,태태야미야미,,2025-04-02,"저녁에 방문, 예약 후 이용, 대기 시간 바로 입장, 데이트, 연인・배우자",음식이 맛있어요,409,1
1225845295,연느60,가격이 저렴해 기대를 안했는데 맛도 훌륭하고 양도 푸짐해서 정말 가성비양식집으로 추천 드리고 싶은 곳이에요👍대부분 만원도 안 하는 메뉴들이라 부담이 없고 여러명이서 가서 다양하게 시켜나눠 먹기도 좋아요!ㅎㅎ,2025-04-02,"저녁에 방문, 예약 후 이용, 대기 시간 바로 입장, 데이트, 연인・배우자",음식이 맛있어요,453,1
1225845295,Jayja,샐러드 양도 많고 재료도 신선하고 맛있어요!!😃 마늘빵도 겉바속촉 맛있습니다! 파스타도 무난히 가성비 맛집입니다😃,2025-04-02,"저녁에 방문, 예약 없이 이용, 대기 시간 바로 입장, 일상, 친구",매장이 청결해요,3,1
1225845295,로카팡팡,깨끗하고 맛있어요,2025-04-02,"점심에 방문, 예약 없이 이용, 대기 시간 바로 입장, 친목, 부모님",음식이 맛있어요,8,1
1225845295,쑤7,리뷰서비스부터 파스타까지 완벽하네요 🫶🏻🫶🏻🫶🏻,2025-04-02,"점심에 방문, 예약 없이 이용, 대기 시간 바로 입장, 친목, 친구",음식이 맛있어요,28,2
1225845295,미용22,메뉴가 정말 많고 가격도 최고에요!! 가성비에 맛까지 최고인곳입니다,2025-04-01,"저녁에 방문, 예약 후 이용, 대기 시간 바로 입장, 친목, 친구",음식이 맛있어요,104,1
1225845295,jhhg500,,2025-04-01,"저녁에 방문, 예약 후 이용, 대기 시간 바로 입장, 가족모임, 아이",음식이 맛있어요,19,1
1225845295,보노보노3587,저번과 다른 메뉴로 먹어봤는데 가격도 저렴하고 맛있게 먹었어요. 매콤하니 매운거 좋아하시는분 추천합니다.,2025-04-01,"저녁에 방문, 예약 없이 이용, 대기 시간 바로 입장, 일상, 연인・배우자",음식이 맛있어요,316,1
1225845295,구불구불내인생,저번에 왔었는데 이번엔 친구들이랑 왔어요 투움바 맛있어요 !!!! 다음에 또 올게요 ㅎㅎ,2025-04-01,"저녁에 방문, 예약 없이 이용, 대기 시간 바로 입장, 친목, 친구",단체모임 하기 좋아요,18,1
1225845295,지9999999,엄마랑 같이 왔는데 너무 맛있게 잘 먹었어요!분위기도 넘 예쁘고 양도 많고 맛있네요다음에 또 생각날 것 같아요 ㅎㅎ,2025-04-01,"저녁에 방문, 예약 없이 이용, 대기 시간 바로 입장, 가족모임, 부모님",인테리어가 멋져요,392,1
1225845295,epsn49,맛있어요! 동네에 이런 곳 있어서 너무 좋아요:),2025-04-01,"저녁에 방문, 예약 후 이용, 대기 시간 바로 입장, 친목, 친구",음식이 맛있어요,11,1
1225845295,안3590,가격대비 맛도 좋고 양도 많아요 메뉴 다 격파하고싶네요,2025-04-01,"점심에 방문, 예약 없이 이용, 대기 시간 바로 입장, 친목, 친구",음식이 맛있어요,4,1
1225845295,Grabs,지나가다 들어갔는데직원분들 너무 친절하시고 음식도 맛있어요 좋네요,2025-04-01,"점심에 방문, 예약 없이 이용, 대기 시간 바로 입장, 나들이, 혼자",음식이 맛있어요,4,1
1225845295,tna****,맛있어요!!또 오고싶네요~~^^,2025-04-01,"점심에 방문, 예약 없이 이용, 대기 시간 바로 입장, 일상, 혼자",음식이 맛있어요,12,1
1225845295,shi****,양도 많고 완전 맛있어요하나도 안남기고 싹싹 다 먹었어요다음에 또 올게요🥰,2025-03-31,"저녁에 방문, 예약 없이 이용, 대기 시간 바로 입장, 데이트, 연인・배우자",음식이 맛있어요,65,1
1225845295,dai****,너무 맛있어용~!!!,2025-03-31,"저녁에 방문, 예약 없이 이용, 대기 시간 바로 입장, 친목, 부모님",음식이 맛있어요,17,1
1225845295,호이2882,기념일이라 파스타 피자 먹으러 왔는데음식이 아주 깔끔하고 맛있습니다다음에 또 올게용,2025-03-31,저녁에 방문,음식이 맛있어요,45,1
1225845295,쮸4119,직원분들도 친절하시고 음식도 맛있오요 😍,2025-03-31,"점심에 방문, 예약 없이 이용, 대기 시간 바로 입장, 혼자",친절해요,9,1
1225845295,izoa54,가격 맛모두 훌륭합니다,2025-03-31,"점심에 방문, 예약 후 이용, 대기 시간 바로 입장",음식이 맛있어요,1518,1
1225845295,이것이인생이다92,음식도모두맛있고 친절하게 응대해주시고 서비스도주셔서 즐거운시간보냈습니다^^,2025-03-31,"점심에 방문, 예약 후 이용, 대기 시간 바로 입장, 친목, 친구",음식이 맛있어요,25,1
1225845295,와우85,분위기가 넘 좋아요 데이트하기 딱 좋네요 ㅎ,2025-03-31,"점심에 방문, 예약 없이 이용, 대기 시간 바로 입장, 데이트, 연인・배우자",가성비가 좋아요,15,1
1225845295,bkjylee7729,피자랑 파스타랑 다 너무 맛있었어요분위기도 넘 좋았어용~~~~~편하게 부담없이 즐길수 있어서 좋아요!!,2025-03-30,"저녁에 방문, 예약 없이 이용, 대기 시간 바로 입장, 가족모임, 아이",아늑해요,12,1
1225845295,dae****,친구와 방문했어요가성비도 너무 좋고 맛도 있었습니다다음에도 방문할게요 감사합니다,2025-03-30,"저녁에 방문, 예약 없이 이용, 대기 시간 바로 입장, 데이트, 친구",음식이 맛있어요,15,1
1225845295,dlw****,오랜만에 양식이 먹고싶어 찾다보니 리뷰가 좋아 오게되었습니다!!음식도 너무 맛있고 직원분께서도 너무 친절하셔서 행복하게 먹고 갑니다 다음에 또 방문하겠습니다!!❤️❤️,2025-03-30,"저녁에 방문, 예약 없이 이용, 대기 시간 바로 입장, 데이트, 연인・배우자",음식이 맛있어요,18,1
1225845295,창동새댁,가성비 맛집입니다! 음식 나오자마자 흡입해서 사진이 없어요! 다음에 또 올꺼에요!,2025-03-30,"점심에 방문, 예약 없이 이용, 대기 시간 바로 입장, 가족모임, 아이, 부모님",음식이 맛있어요,9,1
1225845295,jini52,넘 맛있어요~!!!!,2025-03-30,"점심에 방문, 예약 없이 이용, 대기 시간 바로 입장, 데이트, 부모님",양이 많아요,2,1
1225845295,서우2633,"처음 와봤는데 식전빵으로 준 마늘빵 너무 맛있고 가격대와 양, 재료 다 너무 만족스러워요다음에 또 올게요❤️👍🏻",2025-03-30,"점심에 방문, 예약 없이 이용, 대기 시간 바로 입장, 나들이, 부모님",음식이 맛있어요,23,1
1225845295,lido,파스타 한끼 양도 많고 가격도 저렴하고 맛있습니다~~~ 집 주변이라 자주 올 것 같아요!!어머니가 파스타 좋아하셔서 자주 방문하겠습니다~,2025-03-30,"점심에 방문, 예약 후 이용, 대기 시간 바로 입장",음식이 맛있어요,53,1
1225845295,soy****,가격 대비 양도 많고 맛있어요!! 가성비 맛집입니다!!❣️👍,2025-03-30,"점심에 방문, 예약 없이 이용, 대기 시간 바로 입장, 데이트, 연인・배우자, 친구",매장이 넓어요,8,1
1225845295,쑤SU,항상 지나가다 보기만하고 올 시간이 없어서 못왔어요 ㅠㅠ 가성비 너무 좋고 너무 맛있어서 흡입했어요 ㅋㅋㅋㅋㅋ 그리고 주차가 돼서 진짜 최고.. 다음에 꼭 또 방문하겠습니다!!,2025-03-29,"저녁에 방문, 예약 없이 이용, 대기 시간 바로 입장, 데이트, 연인・배우자",음식이 맛있어요,32,1
1225845295,Jaok,"노원 최고의 파스타, 필라프 맛집입니다.강추합니다!",2025-03-29,"저녁에 방문, 예약 없이 이용, 대기 시간 바로 입장, 데이트, 연인・배우자",음식이 맛있어요,133,3
1225845295,sou****,가성비 좋아요~~분위기도 아기자기하고 맛도 괜찮아요^^,2025-03-29,"저녁에 방문, 예약 없이 이용, 대기 시간 바로 입장, 일상, 친구",음식이 맛있어요,175,1
1225845295,Beskar,음식이 맛있고 분위기도 좋아요,2025-03-29,"저녁에 방문, 예약 없이 이용, 대기 시간 10분 이내, 친목, 친구",음식이 맛있어요,12,1
1225845295,양갱033,가성비좋고 친절하고 좋아요^^,2025-03-29,"저녁에 방문, 예약 없이 이용, 대기 시간 바로 입장, 일상",음식이 맛있어요,52,1
1225845295,zja****,가성비 좋고 파스타 피자 완전 맛있어용~ 야무집니다!!,2025-03-29,"저녁에 방문, 예약 없이 이용, 대기 시간 바로 입장, 데이트, 연인・배우자",음식이 맛있어요,9,1
1225845295,cla****,"토마토파스타, 로제리조또, 버팔로봉 먹었는데요, 맛있네요~번창하세요",2025-03-29,"저녁에 방문, 예약 없이 이용, 대기 시간 바로 입장, 일상, 아이",음식이 맛있어요,21,1
1225845295,chaeniiiii2,메뉴가 하나하나 다 맛있고 가성비 짱👍🏻다음에 또 올게용🫶🏻✨,2025-03-29,"저녁에 방문, 예약 후 이용, 대기 시간 10분 이내, 데이트, 연인・배우자",인테리어가 멋져요,16,1
1225845295,렌고,주변에 이런 맛있는 파스타집이 있는지 이번에 처음 알게되었습니다! 식전에 나오는 마늘빵도 직잡 구우셔서 그런지 바삭하고 맛있습니다! 파스타는 두 말할 것 없고요!!자주 방문하겠습니다!,2025-03-29,"저녁에 방문, 예약 없이 이용, 대기 시간 바로 입장, 일상, 친구",음식이 맛있어요,3,1
1225845295,Happy빈,마시똥,2025-03-29,점심에 방문,,295,1
1225845295,HH4291,최강 맛집~~~~ 다 맛있구 가격도 착해서 배달로도 자주 먹어요😆👍🏻👍🏻👍🏻 파스타랑 스테이크 조합 최고❣️,2025-03-29,"점심에 방문, 예약 후 이용, 대기 시간 10분 이내, 데이트, 연인・배우자",음식이 맛있어요,574,2
