place_id,nickname,content,date,situations,keywords,review_count,visit_count
1076971373,현2650,세트 1번 시켰어요. 진짜 고기가 입에서 막 녹아요. ㅠㅠㅠㅠㅠㅠ 최우수덕분에 하루가 특별해졌어요 ㅠㅠㅠ 진짜 너무 맛있구 퀄리티 너무좋고 친절하시구 인테리어도 이뻐요 바깥 창문 뷰가..힐링되여 ㅠㅠ 잘먹었습니다 고기 진짜 짱 마싯어여,2023-07-27,저녁에 방문,음식이 맛있어요,72,1
1076971373,테드3633,국내에 흔치 않은 일본식 화로구이인 야끼니꾸를 즐길 수 있는 특별한 맛집 입니다. 눈꽃살은 입에서 살살 녹아내리는 고기로 한 입 베어 물면 감탄할 수 밖에 없습니다. 소갈비살은 특유의 감칠맛이 입안 가득히 퍼지며 그 풍미에 감탄할 수밖에 없습니다. 야채구이 꼬치도 함께 구워 먹으면 조화로운 맛을 즐길 수 있습니다.,2023-07-27,저녁에 방문,음식이 맛있어요,130,1
1076971373,꼬마병장,굿,2023-07-26,밤에 방문,음식이 맛있어요,1023,1
1076971373,잼민잉,세트메뉴라 둘이서 먹기 좋고 양 많아요 !!미니 화로 넘 귀엽네요 ^^고기 질도 좋아서 부드럽게 계속 들어가요 ~~,2023-07-26,저녁에 방문,친절해요,112,1
1076971373,러블리빠카,야끼니꾸 맛집 최우수!! 밑반찬도 맛있고 소고기 신선하니 맛있어요😉 매장 분위기도 좋아서 데이트장소로도 넘 좋네요!,2023-07-25,저녁에 방문,음식이 맛있어요,2167,1
1076971373,옙압,이 더위에도 미니화로로 굽는거라 전혀 덥지도 않고 내가 직접 구워먹는거라서 재밌고 색달라요 특히 파채에 노른자.. 신의 한수👍 계속 싸먹게 만드는 마력있는 친구👍 고기도 넘 맛있고 눈꽃살이랑 염통 미쳐써요🩷,2023-07-20,아침에 방문,음식이 맛있어요,904,1
1076971373,예지39,세트 구성에 가격도 너무좋고 무엇보나 고기퀄리티 맛이 최고에용👍🏻👍🏻분위기도 좋아서 데이트코스로도 딱❤️이가격에 이정도 퀄리티에 소고기라니 안갈수가 없습니당 너무 만족스러운 곳이였어요,2023-07-16,저녁에 방문,음식이 맛있어요,433,1
1076971373,bla****,고기가 녹아요 그냥 버터에요🥲먹고 감동.. 주먹밥도 간이 잘되어 있어서 고기랑 먹기 너무 좋았고 둘이서 딱 기분좋게 배부르게 먹을수있는 양이였어요. 세트 구성이 좋아서 둘이서 가면 세트 추천드려요!,2023-07-11,저녁에 방문,음식이 맛있어요,160,1
1076971373,구리곱창26,여기 진짜 맛있는데 이걸 어케 표현할 방법이 없네요!!!! ㅠㅠ 오랜만에 야키니쿠를 맛있게 먹고와서 행복했습니다 꽃갈비살이 야들야들 입에서 녹습니다. 팽이버섯 베이컨 말이도 참으로 맛나요 헤헤,2023-07-02,저녁에 방문,양이 많아요,68,1
1076971373,Bbben,볶음밥  꼭,2023-06-28,저녁에 방문,음식이 맛있어요,213,1
1076971373,수기래요19,맛있는데 너무 답답해요 둘이 먹어야 딱 좋아요,2023-06-28,저녁에 방문,음식이 맛있어요,147,1
1076971373,드림7552,남편이 좋아해서 자주 오게되는 곳이에요 !! 고기도부드럽고 주먹밥 구워먹으면 완전 별미에요 !! 성북천 걷다가 자연스럽게 최우수 방문하게 되는 한성대입구역맛집으로 완전 인정합니다 🐷🫶,2023-06-27,저녁에 방문,음식이 맛있어요,86,2
1076971373,웃쯔아101,일본에서도 못먹어본 야끼니꾸!최우수 #성북천맛집 인정입니다!고기의 질이 최우수맛 이더라구요.고급지게 구워 먹기 좋은곳 같아요!😎😜🤪🤩 또 먹으러 갈겁니다!추천 x 100👍👍👍,2023-06-25,저녁에 방문,음식이 맛있어요,202,1
1076971373,한별5245,오랜만에 기념일 맞이 데이트 했던 곳이예요!! 분위기도 좋고 음식도 다 맛있어요! 술 마시는 사람도 좋고 술 안마셔도 고기 자체가 너무 맛있어서 좋았답니다! 그리고 사장님 왕친절🩵,2023-06-22,저녁에 방문,음식이 맛있어요,194,1
1076971373,dlgpfus772,화로에 한점한점 구워먹는 재미가 있네요 양념소스에 담궜다가 구워먹어도 맛나요 밑반찬들도 다 고기와 잘어울리고 깔끔해요 꼬치도 종류가 다양하고 크림생맥주 시원하고 목넘김이 부드러워 좋네요,2023-06-18,저녁에 방문,음식이 맛있어요,679,1
1076971373,팬지90,"성북구청, 주말에 무료로 주차하고 슬렁 성북천 걸어 찾아간 야끼니꾸 화로구이집 최우수. 꼬맹이 미식가가 반한 눈꽃살이 너무 부드럽고 맛났어요. 벚꽃 피는 계절엔 꼭 와야할 그런 통창뷰. 맛과 멋을 다갖춘 그런 곳^^. 매콤한 우동과 갓지은 밥으로 만들어주신 날치알 주먹밥을 화로에 구워먹으니 그야말로 별미였답니다. 꼬치에 크림생맥까지도…",2023-06-18,저녁에 방문,인테리어가 멋져요,658,1
1076971373,난다요21,좋아요~,2023-06-16,밤에 방문,음식이 맛있어요,1875,2
1076971373,성북동쥬얼리9287,맛나요~,2023-06-11,저녁에 방문,특별한 메뉴가 있어요,1312,1
1076971373,yyyjee,검색해보고 방문했는데 너무 만족했어요! 둘이 먹기에 양도 적당하고 아주 맛있었습니다👍🏻 다음에 또 올게요!,2023-05-28,저녁에 방문,특별한 메뉴가 있어요,774,1
1076971373,랑콩월드,정말 너무너무 맛있어요 야끼니꾸 처음 먹어봤는데 눈꽃살 정말 입에서 녹더라구용❤️ 양도 많고 하나씩 구워먹는 재미가 쏠쏠했습니다 그리구 생맥주 찐 맛집이에요!!,2023-05-28,저녁에 방문,매장이 청결해요,147,1
1076971373,쀼뀨뀨6,일본 느낌 야끼니꾸 갬성이에요><주시는 소스에 담궜다가 양념고기처럼 먹으면 진짜 너무 맛잇음 ㅜㅜ 일본에서 먹은 야끼니꾸 맛이에요>< 고기도 너무 신선하고 세트로 먹으니 가성비도 좋아요🥰 그리고 야외감성 정말 미쳤어요 👀,2023-05-21,저녁에 방문,친절해요,125,1
1076971373,별명없는지나,한성대 분위기와 맛 둘다 만족스러웠던 최우수!!야끼니꾸 진짜 맛있게 먹고 왔습니다👍🏻눈꽃살 살살 녹아요ㅠㅠ 꼬치도 종류별로 다 만족스러웠고 밑반찬으로 나온 절임류와 파절이 중간중간 먹어주면 음식이 물릴틈이 없네요와인이랑 사케시켜서 같이 먹으니 금상첨화^^야외 테이블에서 즐길 수 있는 장점까지 있는 삼선교 야끼니꾸 찐맛집🌟 추천합니다💕,2023-05-21,저녁에 방문,음식이 맛있어요,65,1
1076971373,연상이짱이지,깔끔하고 쾌적한 장소에서 분위기있는 식사하고 왔습니다. 화로에서 고기를 구워먹으니 먹고 싶은 굽기로 원하는 만큼 먹을수 있었습니다.❤️ 최우수 넘 맛있어요 ;),2023-05-21,저녁에 방문,음식이 맛있어요,182,1
1076971373,cap****,야끼니꾸 전문점이 별로 없어서 찾아보다가 방문하게 되었습니다정말 맛있는 눈꽃살과 갈비살을 팔고 있었고 분위기도 너무 좋아서 데이트하기도 좋았습니다 ㅎㅎ,2023-05-09,저녁에 방문,인테리어가 멋져요,123,1
1076971373,chl****,고기 맛부터 분위기 뭐 하나 빠질거 없이 너무 좋았어요! 눈꽃살은 진짜 눈처럼 사르르 녹아내려요🥹 술 먹을 생각 없었는데 안먹을수가없더라고요! 야채꼬치도 맛고있고 기본찬으로 나온 음식들도 너~~~무 맛있어서 싹싹 비우고 왔어요! 사장님도 직원분도 엄청 친절하셔서 기분 좋게 먹고 왔네요🫶🏻 한성대 삼선교 맛집 최우수! 야끼니꾸 맛집 최우수! 이름값하는 곳이네요👍🏻,2023-05-04,저녁에 방문,친절해요,169,1
1076971373,쪼쪼의하루,눈꽃살은 부드러워서 입에서 살살 녹고 소갈비는 꼬들꼬들해서 식감이 좋았어요. 숯불에서 구우니 골고루 빨리 잘 굽혀서 너무 맛있게 잘 먹었어요.😆 담에 또 올게용😍,2023-04-27,저녁에 방문,음식이 맛있어요,80,1
1076971373,이정도는약과,흔치않은 일본식 야끼니꾸 식당이에요. 테이블 위에 화로를 올리고 눈꽃살 구워먹으니 대화 나누기도 좋고 고기가 입에서 살살 녹아내리네요. 고기는 그냥 먹어도 맛있지만 간장에 찍어서 먹어도 되고 와사비랑도 넘나 잘어울리고요.  파채에 계란 노른자 터트려서 잘 비벼주면 고기랑 맛있게 먹을 수 있고 명이나물이랑 피클도 다 맛있어요. 생크림 맥주도 신선하고 고소한 맛이예요.,2023-04-20,저녁에 방문,음식이 맛있어요,369,1
1076971373,hoonl,고기가살살녹아요 ~~~~사장님 너무친절하시구요,2023-04-19,저녁에 방문,친절해요,1055,1
1076971373,양블리잉,돼지고기파가 끝까지 다 먹은거면 말 다한거 아니예요?와.. 진짜 고기가 입에서 녹아요..테이블도 얼마 없어서 조용히 얘기하기두 너무 좋고화장실 핸드워시 냄새 좋아서 장바구니 담아뒀어요..화장실까지 갓벽..,2023-04-18,저녁에 방문,특별한 날 가기 좋아요,126,1
1076971373,Kim Kim,"소고기 육질 최고. 가격이 좀 있어서 1차보단 2-3차로 조금씩 고기 구워먹으며 즐기기 좋은 곳. 하우스 와인도 괜찮았구, 일본 야끼니꾸 집 느낌 낭낭. 의자도 편함!",2023-04-14,저녁에 방문,음식이 맛있어요,336,1
1076971373,inh****,성북천앞에 분위기좋고 고기맛있는 야끼니꾸집이에요°,2023-04-04,저녁에 방문,음식이 맛있어요,2680,1
1076971373,버진40,눈꽃살도 하이볼도 맛있네요 ㅎㅎ,2023-04-03,저녁에 방문,특별한 날 가기 좋아요,339,1
1076971373,혀허어후구0,겨울에 한번 오고 두번째방문이에요! 벚꽃뷰 너무 예뻐서 뷰만 보고도 맥주 원샷 가능인데 고기가 진짜 부드럽고 맛있어여ㅠㅠ 소고기 야키니꾸만 먹다가 꼬치도 먹었는데 아주 굿,2023-04-02,저녁에 방문,뷰가 좋아요,124,1
1005924447,Ta321,진짜 맛있고 분위기 너무너무 좋아요 라자냐 진짜 맛있으니까 꼭 드셔보시길..🫶🏻💗💗,2025-04-10,"저녁에 방문, 예약 후 이용, 대기 시간 바로 입장",아늑해요,254,1
1005924447,evedream,"음식 맛있고, 분위기 좋고,와인도 넘 좋았습니다.좋은 시간 보낼 수 있어서 감사합니다!",2025-04-09,"저녁에 방문, 예약 후 이용, 대기 시간 바로 입장, 친목, 친구",음식이 맛있어요,1,1
1005924447,달빛토깽이27,모든 음식이 너무 맛있었어요!!,2025-04-05,"점심에 방문, 예약 후 이용, 대기 시간 바로 입장, 친구",음식이 맛있어요,19,1
1005924447,희동이222,성신여대 브런치맛집!! 프렌치토스트 추천합니다ㅎㅎㅎ,2025-04-03,"점심에 방문, 예약 후 이용, 대기 시간 바로 입장, 가족모임, 친척・형제",친절해요,26,1
1005924447,백자메론,음식 사진도 찍었는데 폰이 꾸져서 안 올라가요 ㅠ살치살 스테이크가 참 맛있어용 직원분들도 완전 친절하시구 매장도 깨끗하고 화장실도 깨끗햐용매장은 좀 협소한 편이라 예약하셔두 원하는 자리에 앉지 못 할 수도 있울 고 같아요 ! 그래도 예약하고 가시는 거 추천드립니덩,2025-04-02,"저녁에 방문, 예약 후 이용, 대기 시간 바로 입장, 데이트, 연인・배우자",고기 질이 좋아요,91,1
1005924447,JJ3333,커플 디너코스 잘 먹고왔습니다친구들 모임하기도 좋고 낮에 브런치도 먹었는데애정히는 식당 생겼습니다꼭 와보세요 추천합니다 👍🏾,2025-04-02,"저녁에 방문, 예약 후 이용, 대기 시간 바로 입장, 데이트, 연인・배우자",음식이 맛있어요,135,1
1005924447,queque32,넘 맛있어요!!! 추천😭😭😭,2025-03-31,"저녁에 방문, 예약 후 이용, 대기 시간 10분 이내, 여행, 친구",음식이 맛있어요,2,1
1005924447,리뷰쓰려고가입함,음식도 너무 맛있고 사장님도 친절하세요. 분위기도 좋습니다!,2025-03-30,"저녁에 방문, 예약 후 이용, 대기 시간 바로 입장, 데이트, 연인・배우자",음식이 맛있어요,23,1
1005924447,sta****,양이 좀 적나 싶었는데 딱 맞아요! 리조또 바다향이..<3 분위기도 좋아서 데이트하기 좋을듯해요!,2025-03-30,"저녁에 방문, 예약 후 이용, 대기 시간 바로 입장, 친목, 친구",음식이 맛있어요,14,1
1005924447,띠미바리,부모님 결혼기념일에 특별한 식사였어요~ 잘먹었습니다!,2025-03-29,"저녁에 방문, 예약 후 이용, 대기 시간 바로 입장, 가족모임, 연인・배우자, 부모님",음식이 맛있어요,76,1
1005924447,양상추추,성북천 산책하다가 내사랑 호주를 떠올리게 하는 캥거루 간판을 보구 언젠가 와야지 했는데 드뎌 오늘 와보게됐어요  특별한 날 오면 뭔가 더 행복해질 것 같은 그런 아늑한 분위기라서 입장하자마자 설레기 시작 ㅎㅎㅎ   울집 근처에 이런 파인다이닝스런 레스토랑이 있었다니!!! QR코드로 메뉴판을 정독한 후 <감베리 크림 리가토니> <가니미소 오븐리조또> <하우스 샐러드>를 주문했어요 메뉴가 하나하나 나올때마다 감탄이♡ 아뉘 이 비줠 좀 보세요! 근데 이쁘기만한게 아니라 맛이 완전 헉!!! 완전 고메 파인 파스타랑 샐러드입니다 샐러드의 루꼴라랑 크림치즈 조합이 예술이었고 리가토니의 리메종크림소스가 감탄을 자아냈고 리조또의 게내장소스맛이 충격적으로 맛있었습니다 무조건 또 가야할 집으로 저장합니다 여긴!,2025-03-28,"저녁에 방문, 예약 후 이용, 대기 시간 바로 입장, 일상, 연인・배우자",음식이 맛있어요,2282,1
1005924447,callyme,매장 분위기도 너무 좋고 음식도 맛있었어요 🫶,2025-03-28,"저녁에 방문, 예약 후 이용, 대기 시간 바로 입장, 친목, 친구",메뉴 구성이 알차요,8,1
1005924447,최유빈19,파스타랑 리조또 모두 간 적당하고 느끼하지 않게 너무 맛있었어요! 해산물도 가득 담겨 있어서 좋았습니다 💓 인테리어도 예쁘고 건물 자체가 멋진 건축 공간이라 다음엔 테라스에서 먹으러 또 올 것 같아요 🍀,2025-03-27,"점심에 방문, 예약 후 이용, 대기 시간 바로 입장, 데이트, 친구",재료가 신선해요,14,1
1005924447,Malaika,분위기 무엇?❣️ 성신여대 데이트 맛집으로 가기 너무 좋아요. 분위기도 좋은데 음식이 진짜 진짜 맛있어요. 이번에는 디너 먹었는데 다음에는 브런치 먹으러 가보려구요👍🏻,2025-03-26,"저녁에 방문, 예약 후 이용, 대기 시간 바로 입장, 데이트, 연인・배우자",인테리어가 멋져요,16,1
1005924447,Ss2,런치 메뉴 보다는 디너 메뉴들이 훨씬 나았습니다! (아스파라거스 메뉴 시켰는데) 브런치 메뉴는 생각보다 너무 너무 부실 했고 양이 적어 먹을게 없는 느낌이엇어요... 사진조차 없네요ㅠㅠ 나왔을때 부모님께서는 그 접시가 그냥 사이드인가? 하셧습니다,2025-03-23,"점심에 방문, 예약 후 이용, 대기 시간 바로 입장, 나들이, 부모님",인테리어가 멋져요,62,1
1005924447,냥이아씨,남편과 수영끝나고 브런치를 하러 갔어요 둘다 에그베네딕트를 워낙 좋아해서 각1개씩 시키고 샐러드파스타를 시켰어요 근데 에그베네딕트가 빵이 좀더 촉촉했으면 하는 바람과 뭐가 많이 들어간것보다는 심플한 에그베네딕트가 더 좋은데 하는 아쉬움이 좀 있었어요 파스타셀러드는 너무 맛있었어요. 커피도 시켰는데 좀 연해서 밍밍했어요 그래서 샷추가를 부탁드렸는데 그냥 샷하나를 뽑아주셨어요 ㅎㅎ 담에 또 간다면 커피는 미리 샷추가를 해야할거 같아요,2025-03-23,"점심에 방문, 예약 후 이용, 대기 시간 바로 입장, 연인・배우자",음식이 맛있어요,29,1
1005924447,lifefoM,친절하고 맛있었어요 인원 수에 맞춰서 주문하시면 딱 적당해요,2025-03-22,"점심에 방문, 예약 후 이용, 대기 시간 바로 입장, 친목, 친구, 지인・동료",친절해요,107,1
1005924447,hyunnnn63,음식이 맛있고 팬지 에이드도 추천합니다. 분위기 좋은 식당이라 특별한 약속 있을 때 오면 좋을 것 같아요:) 친절하신 사장님까지ㅎㅎ 좋은 시간 보내고 갑니다!,2025-03-20,"점심에 방문, 예약 후 이용, 대기 시간 바로 입장, 친목, 일상, 친구",음식이 맛있어요,7,1
1005924447,iris0403,"기념일 차 연인과 예약 후 방문하였습니다전화로 안내주시던 분도 무척 친절하셨고, 실제 서비스를 해주시는 분들도 너무 따뜻해서 아직도 기억이 나네요매장 이용하는 내내 좋은 감정만 남기고 가네요추후 다른 날에도 방문할 의지 확실합니다번창하세요 🙂💛",2025-03-19,"점심에 방문, 예약 후 이용, 대기 시간 바로 입장, 데이트, 연인・배우자",인테리어가 멋져요,20,1
1005924447,리비828,"보문 근처에서 맛있는 브런치집 찾다가 소개 받아서 왔어요!🤭 내부가 따뜻한 우드톤이라 분위기가 편안했고, 창가 바 자리에서는 주방도 보여서 여유롭게 식사하기 좋았어요! 채광도 잘 들어와서 분위기 너무 예쁘더라고요💗 트러플 아보카도 부르스게타, 감베리 크림 리가토니 먹었는데 둘 다 만족스러웠어요✨트러플 아보카도 부르스게타는 루꼴라 샐러드랑 같이 나오는데 입맛에 완전 딱 맞았고, 감베리 크림 리가토니는 소스도 너무 맛있고 새우가 탱글한데 많이 들어있어서 넘 좋았어요!! 점심 시간에 갔더니 메인 홀은 꽉 차 있더라구요🥹 사람 많은 시간엔 미리 예약하고 가는 게 더 좋을 것 같아용!",2025-03-17,"점심에 방문, 예약 후 이용, 대기 시간 바로 입장, 일상, 친구",음식이 맛있어요,10,1
1005924447,wnmwmwn,"이국적인 느낌 뭉씬 풍기는 붉은 벽돌 건물에 위치한 양식집! 자주 가는 동네가 아닌지라 폭풍 검색 후 평 좋고 예쁜 곳으로 골랐늠(개인적으로 찾아봤응 땐 보문역 근처에 이보다 예쁜곳은 거의 없는듯..)출입문은 건뭉 우측! 사람이 꽉 차잇던지라 내부 자리는 약간 답답한 느낌이 있어 외부 테라스 잘에 앉으려햇더니 남자 직원분께서 춥지않겠냐 걱정해주시묘 괜찮다햇더니 담요도 챵겨주시고 추우면 언제든 다시 들어오라 안내해주셔서 식사 전부터 기분 나이스..☺️테라스 석은 기대한만큼 해가 잘 들지 않기도 하고, 그렇다고 엄청 예쁘게 꾸며져있거나 한 것도 아니고, 간혹 어디선가 넘어오는 담배냄새도 낫지만 그 모든게 아쉽지 않을 만큼 맛도 좋고 양도 많고 특히 친절함이 재방문 의사 1000으로 만들어준 곳. 잘먹고가요",2025-03-15,"점심에 방문, 예약 없이 이용, 대기 시간 바로 입장, 가족모임, 친척・형제",친절해요,942,1
1005924447,스트로베리A,음식이뻐요,2025-03-15,"점심에 방문, 예약 후 이용, 대기 시간 바로 입장",재료가 신선해요,49,1
1005924447,또치예요,"넷 다 너무 맛있었어요. 샐러드 빼고 나머지는 매콤한 맛이 있어서, 느끼할법한데도 잡아주네요. 가나미소 리조또는 게내장으로 했다고 들었는데, 거의 비린맛이 안 나서 놀랐어요. 분위기가 워낙 좋아서 기념일에 추천드려요",2025-03-14,"저녁에 방문, 예약 후 이용, 대기 시간 바로 입장, 기념일, 가족모임, 부모님",음식이 맛있어요,26,1
1005924447,glo****,비쥬얼 최고! 분위기도 너무 좋아요~동네에 이런 곳이 있다니 맛집 발견했네용데이트 하기에도 좋을 것 같아요 😍,2025-03-14,"저녁에 방문, 예약 후 이용, 대기 시간 바로 입장, 데이트, 친구",매장이 청결해요,4,1
1005924447,리온맘2,디너 메뉴를 먹어봤는데 역시 디너 메뉴도 독특하고 맛이 있어요. 👍😋👏근사한 플레이팅과 함께 퀄리티 있는 깊은 맛에.  행복한 식사를 잘했습니다. 🥰🥂🍷 다음에 와인도 먹으러오려고요. 번창하세요. 🎉,2025-03-14,"저녁에 방문, 예약 후 이용, 대기 시간 바로 입장, 데이트, 친목, 친구",음식이 맛있어요,1143,2
1005924447,소소한 바람,"성북천데이트 분위기에 조명까지!맛있는 음식과 사랑하는 사람, 기분좋은 성북구청맛집, 성북천맛집 루:)가니미소 오븐리조또와 클래식 라자냐먹었는데진짜 라자냐~  넘 맛있어요!!리조또 정석을 보여주는 메뉴!!진짜 입안가득 풍미가 느껴져요",2025-03-13,"저녁에 방문, 예약 후 이용, 대기 시간 바로 입장, 데이트, 연인・배우자",음식이 맛있어요,1309,1
1005924447,신책책,"친구랑 브런치 나들이 ㅎ.ㅎ세트로 주문해서 각자 음료 한 잔, 샐러드, 메인메뉴 2개에 디저트까지 나왔는데 양 충분해서 배불렀어요! 친구는 리가토니가 맛있었다 했는데 저는 에그 베네딕트가 맛있었어요!",2025-03-09,"점심에 방문, 예약 후 이용, 대기 시간 바로 입장",음식이 맛있어요,185,1
1005924447,안녕봉쥬루,분위기 너무좋고 브런치하기좋아요 커플끼리와서 기념일에 데이트하기좋은곳 반려견도 데리고올수있어서 같이와도 좋을것같아요맛도있고 아주 좋았어요!,2025-03-08,"점심에 방문, 예약 후 이용, 대기 시간 바로 입장, 데이트, 연인・배우자",인테리어가 멋져요,27,1
1005924447,뚫083,매장 분위기가 아늑하고 좋았습니다리가토니는 날치알의 향이 크림을 잡아줘서 좋았고 가나미소 리조또는 새우불향이 크림을 잡아줘서 좋았습니다크림 베이스 메뉴들 잘하는 거 같아요!담에 또 재방문할 듯성북천 걷다 들어오기도 좋은 듯합니다,2025-03-07,"밤에 방문, 예약 후 이용, 대기 시간 바로 입장, 친목, 친구",음식이 맛있어요,49,1
1005924447,윤423,분위기가 너무 좋은 곳이었다. 라자냐도 묵직하고 맛있다. 마늘도 엄청 들어가서 완전 한국인 입맛.데이트 분위기의 레스토랑이라 특별한날 방문하기 괜찮아 보인다,2025-03-06,"저녁에 방문, 예약 후 이용, 대기 시간 바로 입장",음식이 맛있어요,39,1
1005924447,모먹살,생일기념 방문했어요🥳 깔끔하게 맛있고 양은 많지않은편입니당 개인적으로 리조또가 원픽! 저녁은 또 다른 분위기일것같아서 저녁에 다시 한 번 와보고싶어요,2025-03-06,"점심에 방문, 예약 후 이용, 대기 시간 바로 입장",인테리어가 멋져요,573,1
1005924447,qud****,,2025-03-03,"점심에 방문, 예약 후 이용, 대기 시간 바로 입장, 데이트, 연인・배우자",음식이 맛있어요,14,1
1005924447,모니크6,"보문동 브런치 맛집이에요대표메뉴 감베리 크림 리가토니, 전복크림현미리조또 둘 다 맛있게 잘 먹었어요바 테이블에 앉았는데 주방이 바로 앞이라 조금 정신없었던 점 말곤 기분 좋은 식사했습니다직원분들도 친절하세요예약하고 방문하기를 추천합니다(아 레몬 아메리카노는 제 입맛에 안 맞았어요..)",2025-03-03,"점심에 방문, 예약 없이 이용, 대기 시간 30분 이내, 친목, 친구",인테리어가 멋져요,79,1
1005924447,Raineee,"새로생긴 성신여대 브런치 양식집인데 벽돌로 된 외관부터 분위기 있는 내부까지 너무 공간이 예뻤어요 ! 리조또랑 에그베네딕트랑 폴라로이드 대여, 미역국까지 ! 기념일을 정말 알차게 즐길 수 있는 곳이였어요 날씨가 따뜻해지면 야외공간도 즐기고 싶어요 !!  기념일 덕분에 알차게 잘 보내다가 갑니다 : )",2025-03-03,"점심에 방문, 예약 후 이용, 대기 시간 바로 입장, 데이트, 연인・배우자",인테리어가 멋져요,25,1
1005924447,som****,생일겸 분위기 좋은곳을 검색해보다가집근처 이런곳이 ....!!!!♥️분위기가 너무 좋으며 건물외관부터 내부까지 아늑하면서 너무 기분이 좋아요 🥰펫 프랜들리 매장이어서 강아지와 함께 점심에 방문했어요강아지 의자와 방석도 챙겨주셨구 음식도 너무 맛있었어요 👍🏻👍🏻생일때 방문하여 쥬키니 브레드 서비스로 주셨는데요거 디저트로 넘 좋았어요 ♥️저녁때 다시 방문하고싶어요 ! 소개팅이나 모임 생일때 방문하시면 너무 좋을거같아요 ♥️♥️,2025-03-02,"점심에 방문, 예약 후 이용, 대기 시간 바로 입장, 데이트, 연인・배우자",인테리어가 멋져요,66,1
1005924447,gar****,키워드 다섯개가 모자란 곳...✨분위기도 분위기인데 음식 하나하나 정말 맛있어서그릇 싹싹 긁어먹은 루브런치..🧡진짜 또 가고싶은 곳! 다음에는 저녁에 와서 와인이랑 즐기고싶어용 ..🍷❤️,2025-03-01,"점심에 방문, 예약 후 이용, 대기 시간 바로 입장",친절해요,269,1
