place_id,nickname,content,date,situations,keywords,review_count,visit_count
18780788,오프로드3,좋아요,2024-03-10,"점심에 방문, 예약 없이 이용, 대기 시간 바로 입장, 가족모임, 부모님, 친척・형제",음식이 맛있어요,1390,10
18780788,Ms59,낙지볶음 맛있게 먹었어요,2024-03-10,"점심에 방문, 예약 없이 이용, 대기 시간 바로 입장, 일상, 친구",음식이 맛있어요,2659,2
18780788,파리는안개에젖어,,2024-03-09,점심에 방문,양이 많아요,235,1
18780788,코코9323,계산할때만 친절하고 늘 정신없고 시장같음.입장 순서대로 음식이 나오지 않음ㅡㅡ반찬 가짓수 많아서 그거때문에 가요ㅠㅠ,2024-03-09,"점심에 방문, 예약 없이 이용, 대기 시간 30분 이내, 일상, 가족모임, 친구, 부모님",음식이 맛있어요,176,1
18780788,p1s1o10011,좋아요,2024-03-08,"점심에 방문, 예약 없이 이용, 대기 시간 10분 이내, 데이트",음식이 맛있어요,1709,4
18780788,mag****,반찬이 정말 정말 맛있었다크고 실한 꼬막도 상콤한 해파리봄동겉절이 갓김치 청경채나물에가지무침 뽀시래기인가 것두 나열하지 못한 반찬들도 넘 정성스럽게 느껴졌다반찬에 홀려 둘이서 세공기나 묵었다다시 가고픈 집이다,2024-03-06,"점심에 방문, 예약 없이 이용, 대기 시간 바로 입장, 친목, 친구",음식이 맛있어요,223,1
18780788,언제가는세계여행하고싶다,금호동에서 20년 넘게 해물찜 맛집으로 유명한 집~ 반찬 구성이 좋고 다 맛있어요 항상 손님이 많아서 오프런해요,2024-03-06,"점심에 방문, 예약 없이 이용, 대기 시간 바로 입장, 일상",음식이 맛있어요,915,1
18780788,min****,맛있고 반찬이 잘나와요,2024-03-03,"저녁에 방문, 예약 없이 이용, 대기 시간 바로 입장, 가족모임, 부모님",음식이 맛있어요,353,1
18780788,오프로드3,좋아요,2024-02-17,"저녁에 방문, 예약 없이 이용, 대기 시간 바로 입장, 가족모임, 부모님, 친척・형제",음식이 맛있어요,1390,9
18780788,내일또내일,굿~,2024-02-16,"점심에 방문, 예약 없이 이용, 대기 시간 바로 입장, 일상, 아이",음식이 맛있어요,2127,17
18780788,캐피탈51,맛집입니다,2024-02-16,"점심에 방문, 예약 없이 이용, 대기 시간 바로 입장, 친목, 친척・형제",음식이 맛있어요,270,1
18780788,맹고망고망고,맛있어요!,2024-02-02,"점심에 방문, 예약 없이 이용, 대기 시간 바로 입장, 일상, 회식, 가족모임, 친구, 부모님, 친척・형제",음식이 맛있어요,523,1
18780788,예삐맘맘,반찬이 많아서 좋아요~~,2024-02-01,"점심에 방문, 예약 없이 이용, 대기 시간 바로 입장, 친목, 친구",음식이 맛있어요,451,5
18780788,빛나는인생후후,반찬 많아요. 친절은 모르겠네요~,2024-01-27,"저녁에 방문, 예약 없이 이용, 대기 시간 30분 이내, 친목, 친구",음식이 맛있어요,1029,5
18780788,금모래36,좋아요,2024-01-27,"점심에 방문, 예약 없이 이용, 대기 시간 30분 이상, 친목, 친구",음식이 맛있어요,651,1
18780788,내일또내일,굿~,2024-01-25,"점심에 방문, 예약 없이 이용, 대기 시간 바로 입장, 친목, 친구",음식이 맛있어요,2127,16
18780788,xhswls,굿,2024-01-23,점심에 방문,음식이 맛있어요,1140,1
18780788,오프로드3,좋아요,2024-01-21,"점심에 방문, 예약 없이 이용, 대기 시간 바로 입장, 가족모임, 부모님",특별한 메뉴가 있어요,1390,8
18780788,hjyoon60,"동네 맛집, 집에서 구우면 냄새나는 생선구이 먹으러 간다.",2024-01-17,"점심에 방문, 예약 없이 이용, 대기 시간 바로 입장, 일상, 친구",음식이 맛있어요,319,1
18780788,ly****,친절하고 음식이 신선 했어요,2024-01-13,"저녁에 방문, 예약 없이 이용, 대기 시간 바로 입장, 나들이, 아이",음식이 맛있어요,1050,4
18780788,sil****,금호동 해물찜 넘 맛있어요항상 같은 맛있라서  넘 좋아요~,2023-12-31,점심에 방문,음식이 맛있어요,386,1
18780788,ha****,"신금호역 1번출구에서 가까운 해물명가는 소문난 맛집이예요. 11시반 오픈 시간에 맞춰 갔는데, 금새 좌석이 꽉 찰 정도로 인기있고 맛있어요.",2023-12-29,"점심에 방문, 예약 없이 이용, 대기 시간 바로 입장, 친목, 지인・동료",음식이 맛있어요,534,2
18780788,ji00young,맛있어요,2023-12-21,저녁에 방문,음식이 맛있어요,734,1
18780788,ksk****,좋아요,2023-12-19,"점심에 방문, 예약 없이 이용, 대기 시간 바로 입장, 친목, 친구",음식이 맛있어요,1399,4
18780788,오프로드3,좋아요,2023-12-10,"점심에 방문, 예약 없이 이용, 대기 시간 바로 입장, 가족모임, 부모님",음식이 맛있어요,1390,7
18780788,kimjihye73,좋아요,2023-12-08,점심에 방문,음식이 맛있어요,1729,1
18780788,제비꽃8061,낚지볶음과 알탕 먹었는데 맛있어요.반찬도 풍성하고깔끔해요.굿,2023-12-02,"점심에 방문, 예약 없이 이용, 대기 시간 바로 입장, 친목, 지인・동료",음식이 맛있어요,1553,1
18780788,오프로드3,좋아요,2023-11-26,점심에 방문,음식이 맛있어요,1390,6
18780788,Daily supper,"금호동 찐맛집 발견~~  왜 여길 이제야 갔냐며~~~해물찜 아구찜 모두 양도 푸짐하고 자극적이지 않고 깔끔 담백!!!! 연포탕 볶음밥도 완벽한데,끝없이 나오는 스끼다시도 대애박~~~  자꾸 생각날 맛집^^ 단골각!!!!!",2023-11-20,저녁에 방문,음식이 맛있어요,467,1
18780788,딸구맘721,늘 방문할때마다 만족해요. 맛있어요.,2023-11-19,"점심에 방문, 예약 없이 이용, 대기 시간 바로 입장, 가족모임, 부모님",음식이 맛있어요,583,5
18780788,오프로드3,좋아요,2023-11-11,"점심에 방문, 예약 없이 이용, 대기 시간 바로 입장, 가족모임, 부모님",음식이 맛있어요,1390,5
1660784189,국물빌런,하이볼에 진심인 곳한국에 100대 밖에 없는산토리에서 보내준 탄산 주입기가 있는곳맛있다.. ♥,2025-03-12,"밤에 방문, 예약 없이 이용, 대기 시간 바로 입장",음식이 맛있어요,1772,1
1660784189,행자심결67,"분위기 좋은 이자카야 *킨토라*아담하지만 인테리어가 독특하다.일본 고구마소주 *세키토바80ml*한잔을 10,000원에 즐길수 있다1차로는 다양한 안주가 있지만우리는 2차여서 가벼운안주에술에 집중했다 ^^아~~ 술에 분위기에 즐거운 담소천국이 따로없다 행복하다참고로 뮤지컬배우김동호 윤조 부부가 운영한다는데얼굴마담인지 하여튼 가게에앉아는 있었다.ㅋㅋ",2025-03-08,"저녁에 방문, 예약 없이 이용, 대기 시간 바로 입장, 친목, 지인・동료",음식이 맛있어요,194,1
1660784189,K한량,"킨토라는 늘 사랑이죠. 오픈한지도 이제는 꽤 된 거 같은데, 여전히 변함없이 청결하고 친절해서 초기 손님 중 1인으로 그저 감사합니다. 무엇을 선택해도 실패가 없는 안주 맛집.(+)생맥주 2잔이 계산이 되지 않은 걸 발견해서 말씀드렸더니, 1잔 값만 받으셨어요. 다음에 또 마시러 오겠습니다🍺",2025-03-05,"저녁에 방문, 예약 후 이용, 대기 시간 바로 입장, 데이트, 연인・배우자",음식이 맛있어요,302,5
1660784189,샤이한머스캣,힙하고 맛있고 좋고 다해요 여기.. ♡,2025-03-04,"저녁에 방문, 예약 후 이용, 대기 시간 바로 입장, 데이트, 연인・배우자",인테리어가 멋져요,93,1
1660784189,77d****,좋아요,2025-03-02,"저녁에 방문, 예약 없이 이용, 대기 시간 바로 입장, 일상, 지인・동료",음식이 맛있어요,1173,1
1660784189,namesms,킨토라 지나가다가 봤는데북적북적 사람들이 많고 늦은 시간까지 하는 몇 안되는 이자카야에요 둘이 가서 오붓하게 마셔도 좋고 여럿이 가서 다양한 일식 음식을 먹어도 좋아요발렌타인데이때 갔었는데 센스있게 초콜릿 챙겨주셨어요 안주 정갈하니 맛있어서 그런지혼술하시는 분도 많이오더라구오,2025-02-14,"저녁에 방문, 예약 없이 이용, 대기 시간 바로 입장, 데이트, 연인・배우자",음식이 맛있어요,108,1
1660784189,Interviewer 면접관,토머토파스탕유린교자마라크림새우유자사와,2025-02-03,"저녁에 방문, 예약 없이 이용, 대기 시간 바로 입장, 친목, 친구",음식이 맛있어요,208,2
1660784189,km****,동료들과 2차용으로 넘 좋았습니다.재방문 하겠습니다번창하세요,2025-01-11,밤에 방문,기본 안주가 좋아요,439,1
1660784189,예나0329,"금호동 이자카야 검색해서 금욜 7시 좀 안되서 갔는데 테이블은 다 예약이 있고 닷찌석만 남아서 앉았어요. 유린교자, 네기도로, 우니삼합 다 맛났고 새우머리는 생으로 반, 튀김 반해서 싹싹 먹었네요 ㅎㅎ 기린생맥도 넘 맛있고 산토리하이볼도 위스키맛 진해서 만족스러웠어요.남편이랑 기분 좋은 시간 보낼 수 있었고 친절해서 더 좋았어요. 담에 또 갈께요 :)",2024-12-06,"저녁에 방문, 예약 없이 이용, 대기 시간 바로 입장, 데이트, 연인・배우자",음식이 맛있어요,1897,1
1660784189,ryou6738,만족합니다,2024-11-22,저녁에 방문,음식이 맛있어요,2008,1
1660784189,SerotoninSoo,닷찌섯에서 대화 나누기 좋은 곳이었어요다음에 또 갈래요🩷,2024-11-21,밤에 방문,친절해요,486,2
1660784189,Interviewer 면접관,,2024-11-17,"저녁에 방문, 예약 없이 이용, 대기 시간 바로 입장, 친목, 친구",음식이 맛있어요,208,1
1660784189,SerotoninSoo,종종 올 것 같네용✨,2024-11-01,저녁에 방문,대화하기 좋아요,486,1
1660784189,K한량,"퇴근하고 가까운 사람과 한 잔 하며 이야기를 나누기 좋은, 금남시장의 보석 같은 공간. 고민을 하면 시킨 안주는 늘 성공적이다. 그저 이 느낌을 오래 간직하는 가게로 남아있어 주길🙏",2024-10-25,"저녁에 방문, 예약 후 이용, 대기 시간 바로 입장, 데이트, 친목, 연인・배우자",음식이 맛있어요,302,4
1660784189,xxalicexx,안주 너무 맛있고 친구들끼리 술마시기 좋은 킨토라 🩷🩷🩷🩷 하나같이 다 맛있당  😋😋😋😋😋,2024-10-20,밤에 방문,음식이 맛있어요,531,5
1660784189,페이스오프제이,오늘 첫 방문했어요~~~!!금호동에 이런 힙합 술집이 💜생맥주 너무 맛있고 안주들도 너무 맛있어요특히 저는 오늘 먹은 세가지중에 명란치즈감자 👍👍👍대창구이 메로구이 유자사와 조만간 또 가려구요~~~!!동네에 새벽4시까지 하는 술집이 생겨서 너무 좋아용!!잘먹었습니다 😳😳😳화장실도 술집전용 따로 있고~사장님 너무 친절하세요 🤭🤭🤭,2024-10-08,"밤에 방문, 예약 없이 이용, 대기 시간 바로 입장, 데이트, 연인・배우자",음식이 맛있어요,128,1
1660784189,Salt1234,분위기 좋고 맛있어요! 간단하게 한 잔 하기 좋아요~✨,2024-10-05,"밤에 방문, 예약 없이 이용, 대기 시간 바로 입장, 친목, 친구",음식이 맛있어요,10,1
1660784189,bor****,맛있습니다.양은 좀 적어요.  ㅠㅠㅠ 조금만 더 양이 많았으면 얼마나 좋을까 싶습니다. 특히 마낫또!!! 느므 맛있는데말이죠…. 분위기도 좋고 음식도 정갈하고 야물딱지게 플레이팅해져 나오네요담에 또 갈께요 만족입니다~~금남시장에 이렇게 멋진 이자카야가 생기다니!! 좋아요,2024-10-02,"밤에 방문, 예약 없이 이용, 대기 시간 바로 입장, 데이트, 연인・배우자",음식이 맛있어요,77,1
1660784189,신세계뉴라이프,"금남시장 5번길 초입에 있는 이자카야인데, 작지만 인테리어가 남다르고 빔 프로젝트로 보는 뮤비도 좋네요^^ 산토리카쿠하이볼과 야끼소바, 마구로마끼 주문했는데, 안주가 참 맛있어요. 하이볼도 산토리 양주가 듬뿍 들어가 깔끔하고 원하는 소다/토닉/진저에일을 고를 수 있어 좋네요. 금호동 핫플 인정합니다!",2024-09-30,"저녁에 방문, 예약 없이 이용, 대기 시간 바로 입장, 일상, 연인・배우자",음식이 맛있어요,91,1
1660784189,K한량,"금남시장 안에 들어온 나의, 그리고 우리의 안식처! 조그맣고, 알차다. 소소한 안주들 하나하나가 다 적당히 꽤 만족스럽다. 매번 갈때마다 고민을 하게 만드는 안주 메뉴가 있다는 것만으로도 충분히 흡족한 곳. 이곳도 시간이 지나면 변해가겠지만, 그래도 그 속도가 지나치게 빠르지 않았으면 좋겠다는 바람.",2024-09-27,"저녁에 방문, 예약 후 이용, 대기 시간 바로 입장, 일상, 연인・배우자",음식이 맛있어요,302,3
1660784189,K한량,"드디어 오늘로써 모든 안주를 다 먹어봤습니다! 일단 메인, 서브 안주 구분할 것 없이 다 기본 이상을 해서 실패할 확률이 아주 아주 낮습니다. 이후는 개인의 취향에 따라 다릅니다. 딱 먹기 적당한 양으로 나오는 안주들이 실제로 일본의 술집을 떠올리게 합니다. 생긴지 얼마 안 된 탓에 다행히 아직 사람이 미치도록 많지는 않아서, 운 좋으면 웨이팅 없이 착석 가능합니다. 기본적으로 친절하십니다😄",2024-09-15,"저녁에 방문, 예약 후 이용, 대기 시간 바로 입장, 데이트, 연인・배우자",음식이 맛있어요,302,2
1660784189,오성민53,분위기 맛 완벽한 조합 강추합니다!!!다음에 또올께요🫶🏻,2024-09-10,"저녁에 방문, 예약 없이 이용, 대기 시간 바로 입장, 데이트, 연인・배우자",음식이 맛있어요,30,1
1660784189,K한량,"새로 생겨서 연달아 두 번째 방문! 일단 근처에서는 비교할 곳이 없을 정도로 확실한 취향 저격! 합리적인 가격(한남, 성수에 비교해 저렴), 양이 많지 않게 나오면서(여러개 시키기에 좋음) 실패가 거의 없는 안주, 공간이 좀 좁아서 조만간 예약 없이는 방문하기 어려울 거 같아 벌써 아쉽지만.. 아무튼 조만간 몇번 더 방문해 남은 안주를 모두 다 섭취해 볼 예정🫢",2024-08-31,"저녁에 방문, 예약 후 이용, 대기 시간 바로 입장, 데이트, 연인・배우자",음식이 맛있어요,302,1
1660784189,티엔티엔씽푸,다른곳에 비해 음식양이 적어요그래도 다 맛있었어요특히 고등어초밥 진짜 최고에요 꼭 드셔보시길~,2024-08-29,"저녁에 방문, 예약 없이 이용, 대기 시간 바로 입장, 일상, 친구",음식이 맛있어요,384,1
1660784189,팬지90,"근사한 킨토라, 금남시장의 정겨운 골목으로 조금만 들어가다 보면 도저히 지나칠 수 없는 눈에 띔! 훈남들만 계신 이 이자카야는 이색적인 메뉴들로 일본을 고스란히 담아 연중무휴로 새벽 네시까지 문을 여는군요. 1949 금남시장을 제대로 힙하게 올라타신 금호랑이, 눈과 입이 모두 행복해지더록 가격대와 맛이 죄 맘에 들어오네요.",2024-08-29,"저녁에 방문, 예약 후 이용, 대기 시간 바로 입장, 데이트, 부모님",인테리어가 멋져요,658,1
1660784189,Alie22,명란감자전이 전이라는 느낌보다는 따뜻한 감자사라다 느낌이였어요. 제가 메뉴를 잘못고른건지.. 너무 실망해서 다시 가진 않을것 같아요,2024-08-27,"저녁에 방문, 예약 없이 이용, 대기 시간 바로 입장, 일상, 연인・배우자",,5,1
1660784189,민성준이이,"집 앞에 새로 오픈했다는 소식을 듣고 검색해봤는데 퀄리티가 너무 좋아서 참을 수가 없었어요,,🤤너무 맛있고 공간이 진짜 좋아서 이틀 연속 방문했어요..!늦은 퇴근길 새로운 안식처가 생긴 것 같아요오 ❤️‍🔥진짜 음식도 너무 좋고 쉐프님도 잘생기셨어요(?)그리고 시티팝 좋아하시는 분들 꼭 가세요,,, 천국입니다,,,극-락,,,🫶🏻",2024-08-22,"밤에 방문, 예약 없이 이용, 대기 시간 10분 이내, 데이트, 친목, 나들이, 일상, 기념일, 연인・배우자, 친구, 지인・동료, 혼자",음식이 맛있어요,5,2
1660784189,Wine2020,동네에 생겼다고 해서 남편이랑 왔는데 분위기 좋고 친절하고 가격도 좋아요,2024-08-20,"저녁에 방문, 예약 없이 이용, 대기 시간 바로 입장, 일상, 연인・배우자",음식이 맛있어요,9,1
1660784189,no****,,2024-08-19,"저녁에 방문, 예약 없이 이용, 대기 시간 10분 이내, 친목, 친구",음식이 맛있어요,14,1
1660784189,김두팔22,늦게 방문했는데 너무 좋은 가게 발견해서 좋았어요😆 단곹될거같아요. 자주오겠습니다!,2024-08-18,"밤에 방문, 예약 없이 이용, 대기 시간 바로 입장, 회식, 지인・동료",친절해요,6,1
1660784189,알앤비오,,2024-08-14,"저녁에 방문, 예약 없이 이용, 대기 시간 바로 입장, 친목, 친구",음식이 맛있어요,54,1
1660784189,covi,구뜨,2024-08-14,"저녁에 방문, 예약 없이 이용, 대기 시간 바로 입장, 일상, 혼자",음식이 맛있어요,1126,1
1660784189,봄이봄325,금남시장안에 있는 킨토라 !!!!새벽 심야에 영업하는 곳 찾아오면서 큰 기대는 하지않았는데 너무 맛있고 친절해요!!분위기 맛 음악 영업시간까지 최고입니다 !!가성비가 좋아 1차 2차 3차 까지 너무 완벽해요!자주 방문할꺼에요!,2024-08-13,"밤에 방문, 예약 없이 이용, 대기 시간 바로 입장, 데이트, 일상, 연인・배우자",음식이 맛있어요,29,1
1660784189,숑126,여기 분위기가 너무 좋아요ㅎㅎㅎ 저는 2차로 간단히 한잔하러 왔는데 식사로 먹을 메뉴들도 많아서 담엔 식사도 먹으러 와보고 싶어용! 술도 다양해서 고르는 재미가 있어요! 직원분들도 너무 친절하시고 기분 좋게 하루 마무리하고 갑니다:),2024-08-13,"밤에 방문, 예약 없이 이용, 대기 시간 바로 입장, 친목, 친구",음식이 맛있어요,7,1
1660784189,융2융2,"와 분위기도 좋고 금남시장 안에 이렇게 핫한 술집이 있는줄 몰랐어요!! 사장님도 진심 존잘,, 1차로도 좋고 새벽 4시까지해서 2차로도 좋아요!! 사장님이 자신있는 메뉴로 이소베마끼는 꼭 드셔야해요 왜냐? 너무 맛있거든요 입안가득 고등어가 전혀 비리지않고 맛있어요 먹어봐야 아니 꼭 드셔보세요ㅎㅎ 거기다 술종류도 다양하고 오뎅나베도 일본너낌으로 부들부들 맛있어요!! 닭껍질 튀김은 바삭하면서 그냥 먹어도 맛있고 마요 찍어먹어도 진심 너무 맛있쟈나🍀ଘ(੭*ˊᵕˋ)੭»ㅡ❥",2024-08-11,"저녁에 방문, 예약 후 이용, 대기 시간 바로 입장, 친목, 친척・형제",음식이 맛있어요,477,1
1660784189,auaug,금호동 근처에서 한잔 하려고 알아보다 발견한 보물같은 곳입니다! 일본에 온거같은 느낌의 인테리어와 그에 맞는 안주들이 너무너무 고급지고 맛있었습니다!메뉴 하나하나 정말 정성껏 준비하신 느낌이 많이 들어 너무 기분좋게 먹고 가는거같습니다!메로구이는 정말 강추드리는 메뉴입니다! 레몬즙 살짝과 따로 준비해주시는 간장에 찍어 먹으면 일식 전문점과 차이를 못느낄정도로 맛있습니다.너무 맛있게 먹었고 다음에 또 찾아가겠습니다!!,2024-08-11,"저녁에 방문, 예약 없이 이용, 대기 시간 바로 입장, 데이트, 연인・배우자",친절해요,36,1
1660784189,bh0,2차로 왔는데 대기 없이 들어왔어요 직원분듷이 친절하고 편의를 봐주서서 좋은 자리에 앉았어요오뎅탕이랑 시메사바 시켰는데 진짜 맛맀엇어요매장 깔끔 시원해서 좋았어요 굿~,2024-08-10,"저녁에 방문, 예약 없이 이용, 대기 시간 바로 입장, 데이트, 연인・배우자",음식이 맛있어요,13,1
1660784189,juz****,검색해서 기대없이 왔는데 음식이 너무 맛있고 퀄리티가 높아서 저와 친구들 모두 놀랐습니다! 직원분들도 무척 친절하세요! 기린맥주도 맛있고!!! 아무튼 음식 퀄리티가 보통이 아닙니다 진짜 맛나요!!!,2024-08-10,"밤에 방문, 예약 없이 이용, 대기 시간 바로 입장, 친목, 친구",인테리어가 멋져요,49,1
1660784189,hle****,음식이 정말 맛있고 분위기가 너무 좋아요!! 직원분들도 너무 친절하세요:) 또 올게용,2024-08-09,"저녁에 방문, 예약 없이 이용, 대기 시간 바로 입장, 나들이, 친구",음식이 맛있어요,6,1
1660784189,rla****,진짜 맛있었어요! 분위기도 너무 좋고 사장님도 진짜 잘생기심..ㅎㅎ 메뉴 모두 진짜 맛있고 술도 맛있어요! 하지만 주문이 밀렸는지.. 서빙이 조금 느려요 ㅠㅠ 2차로 오기 좋은 곳이에요!,2024-08-09,"저녁에 방문, 예약 후 이용, 대기 시간 바로 입장, 친목, 지인・동료",음식이 맛있어요,42,1
1660784189,맛집투어다해,집앞에 새로 생긴 곳에 왔어요!분위기도 음식도 친절함도 너무 좋네요 ㅎㅎㅎㅎㅎㅎ단골집 될 것 같습니다,2024-08-09,"밤에 방문, 예약 없이 이용, 대기 시간 바로 입장, 데이트, 연인・배우자",음식이 맛있어요,36,1
1660784189,커피총각,금호동에 거주한지 얼마안됐는데 늦게까지 하는 술집이 없어서 매번 아쉬웠던 찰나에 이자카야가 생겼다 해서 방문했습니다. 음식 너무 깔끔하고 맛있네요. 특히 이소베마끼 강추입니다. 친절하고 잘생긴 사장님들 감사합니다 또 방문할게요!,2024-08-08,"밤에 방문, 예약 후 이용, 대기 시간 10분 이내, 친목, 친구",음식이 맛있어요,94,1
1660784189,리네추럴,,2024-08-07,"밤에 방문, 예약 없이 이용, 대기 시간 바로 입장, 일상, 연인・배우자",음식이 맛있어요,1,1
1660784189,암시롱ㅎ,시장 한복판에서는 보기 힘든 이국적인 분위기 속에서 술마시기 좋아요! 포테토 사라다와 치킨 가라아게 둘다 짭잘해서 맥주안주로 딱입니다! 늦게까지 영업해서 2차나 3차로 오기에도 좋은 것 같습니다!,2024-08-04,"저녁에 방문, 예약 없이 이용, 대기 시간 바로 입장, 친목, 친구",친절해요,154,1
1660784189,ass****,사장님 친잘하고 안주 훌륭하고 술 종류도 많아요!,2024-08-04,"저녁에 방문, 예약 없이 이용, 대기 시간 바로 입장, 데이트, 연인・배우자",음식이 맛있어요,3,1
1660784189,휴일아,금남시장 핫플~* 안주 너무 맛나용 :) 사시미 싱싱하고 다른안주들도 맛났어용☺️☺️ 분위기도 넘좋!!,2024-08-03,"저녁에 방문, 예약 없이 이용, 대기 시간 바로 입장, 친목, 친구",음식이 맛있어요,13,1
1660784189,sdusl23,주문했던 음식도 다 맛있었고 직원분들도 엄청 친절하세요! 휴가철 놀러온것처럼 일본느낌 나고 좋습니다 ㅎㅎㅎ다음에 또 올게요,2024-08-03,"저녁에 방문, 예약 없이 이용, 대기 시간 바로 입장, 친목, 친구",음식이 맛있어요,14,1
1660784189,ioi슬기로운생활,"저녁을 우래옥에서 배터지도록 먹고, 소화제먹고 겨우 진정시킨 배인뎅..  위스키 딱한잔만 하자며ㅋㅋ 꼭와보고싶었던 곳이라며  친구손에 이끌려왔는데,이곳 분위기에, 사장님의 센스와 친절함에, 음식맛에 다양한 위스키에 취해서 자꾸 입에 뭘 넣게되네요. 소화제 한번 더먹어야겠어요 ..여기...🥹 아..♥︎ 너무 좋아요.  서울놀러오면 또올거에오 꼭이오.. 💖",2024-08-03,"밤에 방문, 예약 없이 이용, 대기 시간 바로 입장, 친목, 친구",음식이 맛있어요,82,1
1660784189,happydays2222,음식이 맛있었습니다 😊금남시장에 맛집 생겨서 넘 좋아요~,2024-08-02,"저녁에 방문, 예약 없이 이용, 대기 시간 바로 입장, 데이트, 연인・배우자",음식이 맛있어요,13,1
1660784189,이태원 단발여사73,"금호동 금남시장 내에 힙한 이자카야성동구 맛집 킨토라 남편과의 주말 데이트깔끔한 인테리어 일본 이자카야느낌 편안한 분위기직원분 친절하고 두툼한 사시미15pcs,  국물있는 토마토파스탕과 두퉁한 스테이크같은 메로구이를맛있게 먹으면서 생맥주와 콜라로 건배하며오붓한 데이트 즐겼어요.세프님 사시미 설명도 해주고맛이 어떠냐고 물어보는 센스. 데이트, 부부,모임으로즐기기 좋은 이자카야 만족합니다.",2024-07-28,"저녁에 방문, 예약 후 이용, 대기 시간 바로 입장, 데이트, 연인・배우자",음식이 맛있어요,960,1
1660784189,Sdcc78,옥수동 근처에 이런 바이브의 가게가 생겨서 좋아요. 음식들이 다 맛있어요. 양들은 조금 적으니 맛있게 먹다보면 훅 지갑이 비워집니다 ㅎㅎ 종종 놀러올게요:-),2024-07-28,"밤에 방문, 예약 없이 이용, 대기 시간 바로 입장, 데이트, 연인・배우자",음식이 맛있어요,11,1
