place_id,nickname,content,date,situations,keywords,review_count,visit_count
38219504,egoeswell,만족합니다 감사합니다,2024-10-29,"점심에 방문, 예약 후 이용, 대기 시간 바로 입장, 가족모임, 부모님",커피가 맛있어요,165,1
38219504,Kkkkkkvk,쇼핑하고 애들 데리고 가기 좋음👍👍커피가 맛있고 음.. 음식맛은 보통 감튀가 젤 나은듯하네여 ㅋㅋ,2024-10-27,"점심에 방문, 예약 후 이용, 대기 시간 바로 입장, 친목",건강한 맛이에요,16,1
38219504,스누피 앤 그로밋,"까르보나라 탈리아뗄레와 먹물리조또, 그리고 리코타치즈팬케익 먹었어요! 팬케이크가 진짜 ㄹㅇ 산더미라 너무 배불러서 한 쪽은 포장했어요ㅋㅋ 리조또랑 파스타도 둘 다 너무 맛있게 먹었습니다",2024-10-23,"저녁에 방문, 예약 없이 이용, 대기 시간 바로 입장, 친목, 친구",아늑해요,1139,2
38219504,소라고둥이,,2024-10-23,"저녁에 방문, 예약 후 이용, 대기 시간 바로 입장",인테리어가 멋져요,121,1
38219504,kam****,,2024-10-23,"저녁에 방문, 예약 후 이용, 대기 시간 바로 입장, 친목, 친구, 지인・동료",음식이 맛있어요,7,1
38219504,jane813,"오랜만에 친구들과의 모임을위해 강남신백 9F 자주테이블 예약하고 방문했어요비오는 평일아침시간인데도 거의 만석 인기레스토랑 인정!!지중해식 세트메뉴(씨푸드샐러드&감바스파스타) 와스파이시 타이 해산물 볶음밥 이렇게 오더했어요맛의 밸런스도 , 식재료들도 신선하고~ 맛있게먹었어요",2024-10-22,"점심에 방문, 예약 후 이용, 대기 시간 바로 입장, 친목, 친구",음식이 맛있어요,29,1
38219504,녹차아이스크림나뚜루,"맛도 가성비도 별로지만 청결도, 접객 깔끔합니다 테이블 간격이 넓어 그 이유로 재방문의사는 있습니다.",2024-10-20,"저녁에 방문, 예약 후 이용, 대기 시간 바로 입장, 친목, 지인・동료",재료가 신선해요,8,1
38219504,lomolitos,항상 맛있는 메뉴가 가득한 자주 테이블일요일 오전이라 예약하고 바로 입장! 강추,2024-10-20,"점심에 방문, 예약 후 이용, 대기 시간 바로 입장, 일상, 가족모임, 부모님",특별한 날 가기 좋아요,58,1
38219504,리노264,수비드함박스테이크를 추천드려요~^^,2024-10-19,"저녁에 방문, 예약 없이 이용, 대기 시간 바로 입장, 나들이, 혼자",음식이 맛있어요,375,4
38219504,yej****,테이블 간격이 넓고음식도 양이많고 맛있어요친구들과 모임하기 딱좋아요,2024-10-19,"저녁에 방문, 예약 후 이용, 대기 시간 바로 입장, 친목, 친구",음식이 맛있어요,42,1
38219504,궁그미Y,"🥞✨ 팬케이크 비주얼 갑! 🥞✨ 청첩장 모임 후기 💖인스타에서 보고 팬케이크 비주얼에 반해서 🤩 청첩장 모임 장소로 예약했는데, 대만족! 🥰사진처럼 🥞 팬케이크 진짜 컸어요! 😮 입에서 살살 녹는 맛에 감동! 😋스테이크도도 촉촉하고 부드러운 식감에 육즙향 가득! ☕음식도 빨리 나오고 신선해서 좋았어요! 👍가족들 모두 오랜만에 만나서 맛있게 즐거운 시간 보냈어요! 🥰다음 주 청첩장 모임도 여기서 예약했어요! 😉 그때도 잘 부탁드려요! 🙏#팬케이크맛집 #티라미수맛집 #청첩장모임 #추천 #분위기좋은곳 #음식맛있는곳 #신선한재료 #가족모임 #강력추천",2024-10-19,"점심에 방문, 예약 후 이용, 대기 시간 바로 입장, 친목, 친구",음식이 맛있어요,95,1
38219504,하재61,"분위기 좋고 음식, 식기 모두 너무 좋습니다.좋은 사람과 만남에 다시 방문 예정입니다.",2024-10-18,"점심에 방문, 예약 후 이용, 대기 시간 바로 입장, 친목, 지인・동료",특별한 메뉴가 있어요,5,1
38219504,Gabee,팬케이크 먹으러 왔어요! 볼때마다 진짜 비주얼도 최고고 너무 맛있어요 :),2024-10-14,"점심에 방문, 예약 후 이용, 대기 시간 바로 입장, 데이트, 친구",친절해요,38,1
38219504,spe****,"오징어튀김 샐러드 연하고 맛있었어요. 리뷰에서 양이 적다고 해서 걱정했는데 충분했어요. 여자 둘이서 오징어샐러드, 봉골레  시키고 남겼습니다.",2024-10-12,"점심에 방문, 예약 후 이용, 대기 시간 바로 입장, 친목, 지인・동료",음식이 맛있어요,8,1
38219504,여기가좋아유후,예약이 편리하고 이용하기 좋습니다. 음식도 깔끔하고 맛있어요!,2024-10-06,"저녁에 방문, 예약 후 이용, 대기 시간 바로 입장, 친목, 기념일, 연인・배우자, 아이, 부모님",매장이 청결해요,33,2
38219504,florarin,아이들이랑 가기 너무 좋은 자주테이블!,2024-10-04,"저녁에 방문, 예약 후 이용, 대기 시간 바로 입장, 일상, 친구, 아이",음식이 맛있어요,128,1
38219504,shelmo,청첩장 모임으로 진짜다같이 몇년만에 모였는데 맛있게 다 잘 먹었습니다!!!! 다음주에 또 여기서 청첩장 모임예약했는데 그때도 잘부탁드립니다!,2024-10-03,"점심에 방문, 예약 후 이용, 대기 시간 바로 입장, 회식, 지인・동료",단체모임 하기 좋아요,15,1
38510115,랴65,사장님이 직원분한테 대하는 태도가 기본적으로 짜증이 뭍어있고 화를 엄청 내셔서 먹는 내내 눈치가 보였습니다... 그치만 반찬도 음식도 너무너무 맛있어서 결국은 재방문 할것같지만요...,2025-04-06,"점심에 방문, 예약 없이 이용, 대기 시간 바로 입장, 데이트, 연인・배우자",음식이 맛있어요,3,1
38510115,유유동동주,10년가까이 생각날때 가끔씩 가서 아주 맛있게 먹는곳,2025-04-01,"아침에 방문, 예약 없이 이용, 대기 시간 10분 이내, 일상, 혼자",음식이 맛있어요,76,2
38510115,P군입니다,간만에 고등어 구이 냠냠~,2025-03-24,"저녁에 방문, 예약 없이 이용, 대기 시간 10분 이내, 일상, 연인・배우자",음식이 맛있어요,2064,17
38510115,엉쥬주,알탕은 처음먹어봤는데 칼칼하고 맛있어용은데 묵은지고등어가 더 맛있긴해용 고등어 삼치구이는 항상 존맛탱~~~,2025-03-21,"점심에 방문, 예약 없이 이용, 대기 시간 바로 입장",음식이 맛있어요,290,3
38510115,Emma1127,생선구이 먹고싶을 때 꼭 오고있어요 :-) 삼치+된찌 아니면 삼치+순두부찌개로 자주 먹어요^^ 삼치기 진짜 큽니다 👍🏻👍🏻👍🏻 찬도 맛있고 생선도 넘 맛있어요~ 요날따라 남자사장님이 기분이 안좋으셨는지 직원분께 소리를 많이 치시더라구요 🥹 원래 안그러는 곳인데 바빠서 예민하셨나봐요~ 맛있게 잘 먹고 왔습니다 💖,2025-03-19,"저녁에 방문, 예약 없이 이용, 대기 시간 10분 이내, 일상, 연인・배우자",음식이 맛있어요,173,2
38510115,바블의신나는세상,리스트업 해뒀던신논현 어랑생선밥상첫방문이었는데아주 만족한 한끼,2025-03-18,"저녁에 방문, 예약 없이 이용, 대기 시간 바로 입장, 데이트, 연인・배우자",음식이 맛있어요,2528,1
38510115,럭키꼬렛,고등어구이 하나도 안 비리고 너무 맛있어요 🤩😋👍묵은지고등어찜도 간 적당하니 맛있었고 반찬도 집 밥 처럼 깔끔하게 나와서 너무 좋아요 😆👍,2025-02-26,"점심에 방문, 예약 없이 이용, 대기 시간 10분 이내, 친목, 친구",음식이 맛있어요,226,1
38510115,엉쥬주,꿀맛~~,2025-02-26,"점심에 방문, 예약 없이 이용, 대기 시간 바로 입장",음식이 맛있어요,290,2
38510115,에스더알파걸,식사다운 식사를 하는 기분 맛있게 먹고 갑니다.,2025-02-25,"저녁에 방문, 예약 없이 이용, 대기 시간 바로 입장, 여행, 연인・배우자",음식이 맛있어요,809,1
38510115,춤추는가스레인지,첫 방문인데 너무 맛있게 잘먹었습니다!매장도 너무 깔끔해 보이고 콩나물 리필 요청 했는데 너무 친절하셨어요!음식도 너무 맛있었습니다 다음주에 또 가겠습니다 !,2025-02-25,"점심에 방문, 예약 없이 이용, 대기 시간 바로 입장, 데이트, 연인・배우자",음식이 맛있어요,243,1
38510115,메이폴57,오랫만에 고향 후배가 강동구 명일동에서 나를 찾아왔다. 생선구이가 먹고싶다길래 나의 단골집으로 갔다. 1인1식을 시키고 소주한병 시키고 지난 얘기를 하다보니 2시간이 넘었었다. 그리고 밖에서 담배한대 피고 왔더니 우리 테이블이 싹 치워졌다. 항의를 했더니 주인이 인상쓰며  하는 말 기가찬다. 꼴랑 이거 먹으면서 2시간을 넘겼다는것이다. 그것도 들어라고 말했다. 싸우고 싶었으나 오랫만에 찾아온 동생앞이라 일단참았다.내 단골이라 데려간 동생앞에 너무챙피했다. 가게는 바쁜시간을 지나 빈테이블이 많았는데 내돈주고 음식도 술도 덜먹었는데 싹치우고 주인 인상쓰며  말투가 기분더러웠다. 내일 팩트 체크를 위해 방문하겠다. 주인의 답을 들어보고 언론에 기사화를 하겠다. 후배앞에 쪽팔리고 기분더럽다.,2025-02-20,"저녁에 방문, 예약 없이 이용, 대기 시간 바로 입장, 친목, 지인・동료",커피가 맛있어요,4,1
38510115,맛슐랭 서울두유,생선구이 동태찌개 맛있어요,2025-02-20,"점심에 방문, 예약 없이 이용, 대기 시간 바로 입장, 일상, 지인・동료",음식이 맛있어요,763,1
38510115,실버듀88,가성비 좋은 생선구이 맛집입니다. 지난번 이어 재방문했어요. 일요일 저녁인데 손님들 꽤 많네요.고묵이 메뉴로 했는더 묵은지도 맛나요.,2025-02-16,"저녁에 방문, 예약 없이 이용, 대기 시간 바로 입장, 일상, 연인・배우자",음식이 맛있어요,795,2
38510115,Nikki24,일요일 오후 들렀어요. 오늘은 밥이랑 음식이 식어나와 평소먹던맛이랑 달라 아쉬웠어요.,2025-02-16,"점심에 방문, 예약 없이 이용, 대기 시간 바로 입장, 일상",음식이 맛있어요,328,3
38510115,보라앙마,갈때마다 만족스러운 식사를 하고오는 어랑💕이번엔 삼치구이랑 고등어조림 둘 다 맛볼 수 있는 삼묵이 주문했는데역시나 맛있게 잘먹고 왔답니다💜,2025-02-13,"점심에 방문, 예약 없이 이용, 대기 시간 바로 입장, 가족모임, 부모님",음식이 맛있어요,682,1
38510115,엉쥬주,너무 맛있었어요 >_< 평일 점심시간에 가니까 웨이팅 했으용,2025-02-13,"점심에 방문, 예약 없이 이용, 대기 시간 30분 이내",음식이 맛있어요,290,1
38510115,ileft,굿,2025-02-11,저녁에 방문,음식이 맛있어요,1304,2
38510115,만달라,생선구이 먹고싶어서 찾아 간 곳.가보니 동네 밥집. 단골들 참새방앗간 같은 곳.고등어구이 맛있었어요. 브레잌타임 없어서 좋아요.,2025-02-02,"점심에 방문, 예약 없이 이용, 대기 시간 바로 입장, 일상, 연인・배우자",음식이 맛있어요,85,1
38510115,min98680101,맛있어요,2025-01-27,점심에 방문,음식이 맛있어요,1456,2
38510115,cheezennang,여기 재방문만 여러번인데 이제야 리뷰를 쓰네용여기 고등어구이 진짜 맛있어요 꼭 드세요 끝!😄,2025-01-23,"점심에 방문, 예약 없이 이용, 대기 시간 바로 입장, 일상, 혼자",혼밥하기 좋아요,104,1
38510115,실버듀88,소문난 맛집인데 운좋게 웨이팅없이 입장했어요. 고동이세트로 고등어와 동태탕 좋은 가격으로 잘 먹고 왔습니다.,2025-01-05,"점심에 방문, 예약 없이 이용, 대기 시간 바로 입장, 일상, 연인・배우자",음식이 맛있어요,795,1
38510115,liv****,날이 추워서 뜨끈한게 먹고싶었는데 동태탕 너무 맛있게 먹었어요! 다음엔 생선구이도 먹으러 또 방문하고 싶습니다 :),2025-01-05,"점심에 방문, 예약 없이 이용, 대기 시간 바로 입장, 일상, 혼자",음식이 맛있어요,90,1
38510115,뀨라리오,간만에 방문한 생선집인데요 이번엔 삼된이!!삼치와 된장찌개를 시켰어요 ! 매번 반찬이 바뀌는곳이구요 오늘은 여수갓장아찌를 주셨는데 너~ 무 맛있는거에요! 양념도 딱이어서 밥도둑이었구요 삼치도 카레가 묻혀구웠는지 너무맛있는거에요!! 든든하게넘 잘먹었답니당 :),2024-12-29,"저녁에 방문, 예약 없이 이용, 대기 시간 바로 입장, 데이트, 연인・배우자",음식이 맛있어요,247,3
38510115,단무지101,"밥도둑 여깃어여,, 아주 껍질까지 고소하고 미쳤음",2024-12-26,"저녁에 방문, 예약 없이 이용, 대기 시간 바로 입장, 일상, 연인・배우자",음식이 맛있어요,789,4
38510115,니안나,맛잇어요!,2024-12-25,"저녁에 방문, 예약 없이 이용, 대기 시간 바로 입장, 데이트, 연인・배우자",음식이 맛있어요,772,4
38510115,P군입니다,고갈비구이 한끼 식사로 뚝딱!!,2024-12-04,"점심에 방문, 예약 없이 이용, 대기 시간 바로 입장, 일상, 혼자",음식이 맛있어요,2064,16
38510115,말하고걸어다니는맛집지도,"알탕, 참치김치찌개, 돼지불백, 고갈비구이 다양하게 시켜먹었는데, 다 맛있었어요!!!",2024-12-03,"점심에 방문, 예약 없이 이용, 대기 시간 바로 입장, 일상, 지인・동료",음식이 맛있어요,533,1
38510115,Polepole,고갈비구이(고등어)13000원이랑 삼치구이 15000원 주문했는데 생선이 진짜 크고 맛있어요!!! 생선 생각날 때는 무조건 여기로 올 생각입니다.넘 맛있고 친절해요!,2024-11-28,"저녁에 방문, 예약 없이 이용, 대기 시간 바로 입장, 일상",음식이 맛있어요,662,1
38510115,긍정의힘4557,정말 맛집이에요~,2024-11-19,"저녁에 방문, 예약 없이 이용, 대기 시간 바로 입장, 일상, 연인・배우자",음식이 맛있어요,3292,8
38510115,니안나,맛있어요!!! 재방문하는집,2024-11-10,"점심에 방문, 예약 없이 이용, 대기 시간 바로 입장, 데이트, 연인・배우자",음식이 맛있어요,772,3
38510115,hjlim001,좋아요,2024-11-07,"점심에 방문, 예약 없이 이용, 대기 시간 바로 입장, 친목, 지인・동료",음식이 맛있어요,646,1
38510115,우리의우주,"오랜만에 직장 동료들과 단골로 자주 방문했던 생선구이집을 다녀왔습니다. 동태탕 순두부찌개 고등어구이, 묵은지고등어조림, 돼지불백 역시 거를 타선 없이 저에게 입안을 행복하게 해줬습니다. 음식 양도 많고 맛도 있어서 가성비 좋은 음식점인 것 같아요.점심에는 줄 서서 먹는 맛집이라 저녁에 와서 맛있게 먹었습니다! 새로운 동료들도 데리고 왔는데 너무 맛있다고 하네요.😀",2024-10-31,"저녁에 방문, 예약 없이 이용, 대기 시간 바로 입장, 일상, 비즈니스, 지인・동료",음식이 맛있어요,2081,4
38510115,gomsu,생선구이 먹고싶어서 친구랑 점심먹으러 방문했습니다. 1시조금 지나갔더니 금방 입장했어요. 고등어 조림과 고등어 구이 먹었는데 맛있었어요. 집에서 생선구이 먹기 힘들쟎아요. 가격도 좋고 맛도 좋았어요,2024-10-31,"점심에 방문, 예약 없이 이용, 대기 시간 10분 이내, 친목, 친구",음식이 맛있어요,157,1
38510115,bih****,.,2024-10-30,"점심에 방문, 예약 없이 이용, 대기 시간 10분 이내, 일상, 지인・동료",양이 많아요,383,1
38510115,아보카도고구마,,2024-10-27,"점심에 방문, 예약 없이 이용, 대기 시간 바로 입장, 일상, 부모님, 친척・형제",음식이 맛있어요,147,1
38510115,바다여행57,좋아요,2024-10-15,"점심에 방문, 예약 없이 이용",음식이 맛있어요,2032,1
38510115,라아랄라랄,강남역에서 생선구이 먹을때 좋긴함.맛은 그냥 쏘쏘!재방문의사 없음,2024-10-10,"점심에 방문, 예약 없이 이용, 대기 시간 바로 입장",메뉴 구성이 알차요,165,1
38510115,단무지101,생선구이 먹고 싶을 때 제일 먼저 생각나는 어랑고등어ㅠㅠㅠㅠㅜ 찌개 다 존맛이예여🤎🤎,2024-10-09,"저녁에 방문, 예약 없이 이용, 대기 시간 바로 입장, 일상, 연인・배우자",음식이 맛있어요,789,3
38510115,비키만세,집에서 생선구이 먹기 쉽지 않은데 잘 먹고 왔어요^^,2024-10-09,"점심에 방문, 예약 없이 이용, 대기 시간 바로 입장, 일상, 친구",음식이 맛있어요,907,1
38510115,혜찐블라썸,🐟,2024-10-07,저녁에 방문,재료가 신선해요,3682,1
38510115,니안나,갈때마다 혼밥 하시는 분들도 많은듯해요. 맛있게 항상 잘 먹는 중입니다 메뉴 종류별로 먹어보는 중이에요.,2024-10-01,"점심에 방문, 예약 없이 이용, 대기 시간 바로 입장, 데이트, 연인・배우자",음식이 맛있어요,772,2
38510115,박군9912,반찬 포함하여 모든 음식이 다 달지 않은 것은 좋은데 너무 짜서 무슨 맛인지 모르겠음. 그리고 사장이 너무 큰 소리로 종업원들이랑 대화를 하여 손님으로서 무시당하는 기분이 들었음.,2024-09-25,"점심에 방문, 예약 없이 이용, 대기 시간 바로 입장, 일상, 혼자",컨셉이 독특해요,14,1
38510115,수염소년,강남에서 생선구이 먹고 싶을땐 여기로와요.고등어구이와 조림 2인 세트구성이 참 혜자로와요.두툼큼직하게 잘 구워진 고등어구이 한입뭉근하게 양념 잘베인 묵은지에 고등어살 싸서따끈한 쌀밥 야무지게 와앙 먹음 최고니까요.사장님도 친절하셔서 오늘도 기분좋게 잘 먹었어요 🥰,2024-09-22,"점심에 방문, 예약 없이 이용, 대기 시간 바로 입장, 데이트, 연인・배우자",음식이 맛있어요,977,1
38510115,니안나,이전부터 지나가다가 방문하고 싶어서 픽해놓고 이제서야 방문햇네요 집에서 생선 구워먹기 쉽지않은데 동네에 한식 생선구이 집이 있다니 맛도 있어요 반찬구성도 좋아요,2024-09-22,"점심에 방문, 예약 없이 이용, 대기 시간 바로 입장, 데이트, 연인・배우자",음식이 맛있어요,772,1
38510115,3ub,"신논현에서 이런 밥상을 맛볼 수 있다뇽!! 퇴근하고 7시 쯤 방문 했는데 마지막 자리를 겟겟 했습니다 ✨찬의 간도 적절하고 생선도 안쪽까지 이븐- 하게 익어서  퍽퍽하지 않았습니다,평상시에 백반을 먹어도 밥은 잘 안먹는데 정말 국물에 밥 샥샥 비벼서 먹었습니다!!! 사장님이 약간만 뒤돌아봐도 필여한거 있으시냐고 바로 확인해주시고 손도 몸도 빠르세요 슉슉! 👍🏻",2024-09-19,"저녁에 방문, 예약 없이 이용, 대기 시간 바로 입장",음식이 맛있어요,258,1
38510115,peeea,신논현 살다가 다른곳으로 이사가서 한동안 못먹었는데 신논현에 일있어서 왔다가 오랜만에 왔어요! 언제먹어도 참 맛있네요 ㅎㅎㅎ :),2024-09-10,"저녁에 방문, 예약 없이 이용, 대기 시간 바로 입장",음식이 맛있어요,366,2
38510115,져니니,또가야지,2024-09-08,"저녁에 방문, 예약 없이 이용, 대기 시간 바로 입장, 나들이, 혼자",음식이 맛있어요,565,1
38510115,뀨라리오,여긴 생선이 너무맛있어서 늘 먹으러오는곳이에요 삼치가 크고 푸짐해서 잘먹었구요 동태찌개도 개운맛에 너무 잘먹었어요👍👍직원들 교육에 사장님이 고생이 많아보이셔요😅,2024-09-08,"점심에 방문, 예약 없이 이용, 대기 시간 바로 입장, 데이트, 연인・배우자",음식이 맛있어요,247,2
38510115,우유먹고,"알고있는 생선구이 딱 그맛리뷰 잘 안쓰는데, 식사하다가 불편해서 남김홀 남자사장님 주방 여자사장님이 윗 연배의 종업원 아주머니들께 호통치고 반말하는것에 식사를 편히 못함.빨리 나가라는 압박도 받아서 불편.",2024-09-02,"점심에 방문, 예약 없이 이용, 대기 시간 10분 이내, 일상, 혼자",재료가 신선해요,11,1
38510115,인하인하,밥 세공기 먹고 나왔습니다 여자친구가 좋아하네요 다만 묵은지 찌개는 양이 좀 적어요,2024-09-01,"저녁에 방문, 예약 없이 이용, 대기 시간 바로 입장, 데이트, 연인・배우자",음식이 맛있어요,36,1
38510115,kjw****,음식은 너무너무 맛있었지만 남사장님이 계속 여사장님과 주방분들에게 너무 소리를 지르시더라구요.. 바쁘신 거 알겠지만 손님들 다 눈치보게 좋지 않은 소리를 계속 하시는데 밥 먹다 체할 뻔 해서 급히 나왔네요,2024-09-01,"점심에 방문, 예약 없이 이용, 대기 시간 10분 이내, 친목, 지인・동료",음식이 맛있어요,8,1
38510115,된다요된다21,음식도 맛있고 친절하시네요😊,2024-09-01,점심에 방문,음식이 맛있어요,1897,1
38510115,EUPHORIAAA,생선구이 먹고 싶으면 갑니다용,2024-08-28,점심에 방문,양이 많아요,1729,2
38510115,대기 만성,오늘 메뉴는 고순이에요^^고등어! 순두부!생선과 찌개 세트구성이 좋습니다생선 맛도 좋고요!번창하세요~,2024-08-22,"점심에 방문, 예약 없이 이용, 대기 시간 10분 이내, 일상, 지인・동료",음식이 맛있어요,324,1
38510115,한는,서울 여행기간 중 먹었던 식당중에 젤 맛있었어요동태탕은 콩나물 들어가서 시원한 맛삼치구이는 밥 한그릇 뚝딱할 맛이였어요사장님이 손님들한테는 친절하신데 직원분들이랑 다투셔서 나중엔 밥이 입으로 들어가는지 코로 들어가는지😅,2024-08-14,"점심에 방문, 예약 없이 이용, 대기 시간 바로 입장, 여행, 친구",음식이 맛있어요,70,1
38510115,ileft,굿,2024-07-31,저녁에 방문,음식이 맛있어요,1304,1
38510115,kiocy,진짜 너무 맛있네요..!생선은 너무 촉촉하고 굽기 정도도 딱 좋았어요.묵은지 조림도 살에 양념이 잘 배어 있어 너무 맛있었습니다.다음에 또 방문 예정입니다~!,2024-07-31,"점심에 방문, 예약 없이 이용, 대기 시간 바로 입장, 데이트, 일상, 연인・배우자",음식이 맛있어요,13,1
38510115,ozerangoz,고등어 알탕 맛있어용,2024-07-30,"점심에 방문, 예약 없이 이용, 대기 시간 10분 이내, 데이트, 연인・배우자",음식이 맛있어요,3445,2
38510115,레이첼530,혼밥하기 좋아요,2024-07-29,"저녁에 방문, 예약 없이 이용, 대기 시간 바로 입장, 친목, 혼자",음식이 맛있어요,353,1
38510115,난누구맛집은어디냐찾아보자꾸나,생선밥상 어랑 신논현.유명한밥집이죠. 반찬도 항상 정갈하고 맛있어요.생선구이는 기가막힙니다.낮밤 항상 웨이팅 길고.. 언제나 변함없는맛이예요.고순이 고등어+순두부세트 먹었네요.김치도 아삭하니 맛있고(항상 무슨김치든  김치가 맛있어요)밥도 바로해서 찰지고 맛있었네요.,2024-07-18,"저녁에 방문, 예약 없이 이용, 대기 시간 바로 입장, 친목, 친구",음식이 맛있어요,1100,2
38510115,자연0077,괜찮아요,2024-06-30,"점심에 방문, 예약 없이 이용, 대기 시간 바로 입장",음식이 맛있어요,260,1
38510115,오늘도 매우 맑음,"생선구이가 먹고 싶을땐 무조건 어랑 생선밥상!!고등어구이, 삼치구이가 너무 맛있고요~반찬도 정갈하게 잘 나와요!!우렁된장도 국물이 너무 맛있어요!!서초 NO.1 생선구이 맛집이에요~~",2024-06-20,"점심에 방문, 예약 없이 이용, 대기 시간 10분 이내, 일상, 지인・동료",음식이 맛있어요,465,1
38510115,순득,정말맛있어요 모든메뉴가 …밥또한 죽음입니다^^양이작은사람이라 어딜가나 밥을 남기는데 여기만오면 밥한그릇 뚝딱입니다!!!생선구이가 다 떨어져서 조림을 먹엇는데 ….캬 죽입니다~오늘은 집에 손님이 오셔서 쿠팡에 배달도되드라구요 주문각입니다 .!남자사장님 정말 친절하시고  매장에 애정이 가득하신거같아 따뜻하고 유쾨한식사 잘하고왓어요~리뷰 잘 안쓰는데 제가 영수증까지일부러 달래서 리뷰 올립니다 !!!꼭 구이나 조림 드셔보세요 ~절대절대 후회할일없으실꺼에욥!!,2024-06-17,"저녁에 방문, 예약 없이 이용, 대기 시간 바로 입장, 데이트, 연인・배우자",음식이 맛있어요,12,1
