place_id,nickname,content,date,situations,keywords,review_count,visit_count
1013556502,뽀글이는맹수,"근처에 김치찌개 집이 없어서 아쉬웠는데,맛있는 식당을 찾았네요😄👍음식도 괜찮고 직원분들이 다들 친절하셔서기분 좋은 점심 식사를 할수 있었습니다~👍👏재방문 의향 100000%!!!",2024-07-04,"점심에 방문, 예약 없이 이용, 대기 시간 바로 입장, 데이트, 친목, 여행, 일상, 회식, 가족모임, 비즈니스, 지인・동료, 혼자",음식이 맛있어요,20,1
1013556502,신수동리,김치찌개 맛집입니다~! ㅎㅎㅎㅎ계란말이랑 조합 좋고 직원분들 친절하십니다~!,2024-07-02,"점심에 방문, 예약 없이 이용, 대기 시간 바로 입장",음식이 맛있어요,717,1
1013556502,kkkk1923,반주 한다는 느낌으로 1잔 딱 하고 싶을 때 저녁이랑 같이 저녁 겸 겸사 겸사 먹기 좋은 곳이에요 ㅋㅋㅋㅋㅋ 회사 끝나고 너무 과한 자리는 불편하고 부담스러운데 이곳에 오면 편안하게 맛있게 먹을 수 있어요. 김치찜이 진짜 너무너무 맛있어서 집에 가면 자꾸자꾸 생각납니다.🥰 김치닭구이는 이번에 처음 먹어봤는데 핵존맛 이래서 사람들이 늘 많나봅니다😄😄😄😄😄😄😄😄,2024-07-02,"아침에 방문, 예약 없이 이용, 대기 시간 바로 입장, 데이트, 연인・배우자",음식이 맛있어요,54,1
1013556502,non****,아이들과 가면 항상 먹을 게 문제인데 여기는 주먹밥이랑 계란말이가 너무 너무너무 맛있어서 아이들 음식 걱정하지 않고 맛있게 먹을 수 있어요. 김치가 정말 맛있는데 진짜 김치만 따로 사고 싶은 지경이에요ㅋㅋㅋㅋㅋㅋㅋㅋㅋㅋㅋ,2024-07-02,"아침에 방문, 예약 없이 이용, 대기 시간 바로 입장, 데이트, 연인・배우자",음식이 맛있어요,114,1
1013556502,1029474,점심시간이 조금 여유로울 때는 꼭 이곳에 찾아와요. 김치구이 정식을 먹으면 한상 가득 집밥을 먹은 느낌 입니다ㅎㅎ달걀말이도 너무 맛있어서 밥을 자꾸 자꾸자꾸 먹게됩니다 ㅋ,2024-07-02,"아침에 방문, 예약 없이 이용, 대기 시간 바로 입장, 데이트, 연인・배우자",음식이 맛있어요,150,1
1013556502,kde****,세트시켰는데 너무 맛있네요비즈밸리 근처에 맛집이 많아져서 좋아요추천드립니다💯,2024-07-01,"점심에 방문, 예약 없이 이용, 대기 시간 바로 입장, 데이트, 연인・배우자, 아이",단체모임 하기 좋아요,278,1
1013556502,비타민8734,,2024-06-27,"저녁에 방문, 예약 없이 이용, 대기 시간 바로 입장, 일상, 연인・배우자",음식이 맛있어요,7,1
1013556502,man7108,,2024-06-27,"저녁에 방문, 예약 없이 이용, 대기 시간 바로 입장, 친목, 연인・배우자",음식이 맛있어요,9,1
1013556502,kimgw45,매장이 깔끔하고 맛있습니다. 또 방문하고싶네요 ㅎㅎ,2024-06-21,"점심에 방문, 예약 없이 이용, 대기 시간 바로 입장, 데이트, 연인・배우자",음식이 맛있어요,26,1
1013556502,혼밥이좋지,닭김치구이 맛있네요. 특히 김치가 제 스타일! 어제 오고 오늘 또 왔어요!ㅎㅎ근데 계란말이는 넘 짜요ㅜ.ㅜ,2024-06-21,"점심에 방문, 예약 없이 이용, 대기 시간 바로 입장, 일상, 지인・동료",음식이 맛있어요,328,1
1013556502,ses0678,재료소진때문에 네번째만에 성공이했습니다😂매장 너무깔끔하고 음식도 진짜맛있어요또 방문할예정입니다😁,2024-06-20,"저녁에 방문, 예약 없이 이용, 대기 시간 바로 입장, 데이트, 연인・배우자",음식이 맛있어요,8,1
1013556502,합55,음식이맛있어요,2024-06-20,"점심에 방문, 예약 없이 이용, 대기 시간 바로 입장, 친목, 지인・동료",음식이 맛있어요,9,1
1013556502,tls****,새로 생겨서 와봤는데너무 맛있네용 🤍,2024-06-18,"점심에 방문, 예약 없이 이용, 대기 시간 바로 입장, 일상, 친구",음식이 맛있어요,7,1
1013556502,yr53210,음식이  맛있고  깔끔하네요 집근처라  자주올것같아요,2024-06-14,"저녁에 방문, 대기 시간 바로 입장, 가족모임, 아이",인테리어가 멋져요,22,1
1013556502,수현345,세트메뉴 시켰는데 첨에 나온 계란말이부터 너무 맛있고 돈까스도 맛있고 메인 메뉴인 부대찌개도 너무 맛있어요! 석류하이볼도 시켰는데 너무 맛있었어용ㅎㅎ,2024-06-11,"저녁에 방문, 예약 없이 이용, 대기 시간 바로 입장, 가족모임, 부모님, 친척・형제",음식이 맛있어요,48,1
1013556502,바소바,가게도 쾌적하고 맛있습니다,2024-06-11,"저녁에 방문, 예약 없이 이용, 대기 시간 바로 입장, 회식, 비즈니스, 지인・동료",음식이 맛있어요,11,1
1013556502,휘토피아누,고덕비즈밸리에 이런 맛집이 생겼다니 ㅎㅎ 매장 너무 청결하고 시원하고 좋아요!! 다음에는 찌개 먹으려구요!,2024-06-10,"저녁에 방문, 예약 없이 이용, 대기 시간 바로 입장, 친목, 친구, 지인・동료",인테리어가 멋져요,25,1
1013556502,제이제이4679,맛이 좋아요! 밥도둑이에요!,2024-06-07,"점심에 방문, 예약 없이 이용, 대기 시간 10분 이내, 회식, 지인・동료",음식이 맛있어요,167,1
1013556502,앗싸붕,,2024-06-05,"저녁에 방문, 예약 없이 이용, 대기 시간 바로 입장, 데이트, 연인・배우자",음식이 맛있어요,463,2
1089215444,역지사지470,맛나요,2025-03-28,"점심에 방문, 포장·배달 이용, 대기 시간 바로 입장, 일상, 혼자",양이 많아요,864,3
1089215444,wit****,고덕그라시움 일반상가동 리틀매직영어에요 🥹뜨끈한 국물 먹고싶어서 왔는데 너무 맛있네요 !!,2025-02-24,"점심에 방문, 예약 없이 이용, 대기 시간 바로 입장",음식이 맛있어요,31,1
1089215444,플로라4364,국물도 진하고 양도 넉넉해요,2025-01-24,"점심에 방문, 예약 없이 이용, 대기 시간 바로 입장, 일상, 혼자",음식이 맛있어요,1847,5
1089215444,yhhyunn,순대국밥 맛있게 먹었습니다. 가족들끼리 가도 좋을 것 같아요,2025-01-06,"점심에 방문, 예약 없이 이용, 대기 시간 바로 입장, 일상, 친척・형제",음식이 맛있어요,136,1
1089215444,MK153,평범한 순대국이에요 고기잡내는 좀 나요,2024-12-28,"저녁에 방문, 예약 없이 이용, 대기 시간 바로 입장, 일상, 혼자",가성비가 좋아요,3573,1
1089215444,플로라4364,순대국물이 진하고 맛있어요,2024-12-03,"저녁에 방문, 예약 없이 이용, 대기 시간 바로 입장, 일상, 혼자",음식이 맛있어요,1847,4
1089215444,푸하하미라,,2024-11-07,"저녁에 방문, 예약 없이 이용",음식이 맛있어요,238,1
1089215444,katepeter,양많아요,2024-10-27,"점심에 방문, 예약 없이 이용, 대기 시간 바로 입장, 일상, 혼자",양이 많아요,710,1
1089215444,역지사지470,양많아요,2024-10-27,"점심에 방문, 예약 없이 이용, 대기 시간 바로 입장, 일상, 혼자",양이 많아요,864,2
1089215444,공주30,.,2024-10-25,점심에 방문,,1598,1
1089215444,kmj****,굿,2024-10-22,"점심에 방문, 포장·배달 이용, 대기 시간 바로 입장, 일상, 친구",음식이 맛있어요,1109,1
1089215444,롱런94,맛있어요,2024-09-28,"저녁에 방문, 예약 없이 이용, 대기 시간 바로 입장, 일상, 혼자",고기 질이 좋아요,593,1
1089215444,라푼젤40,순대국 여러군데서  먹어봤지만 가격도 착하고  맛도   있네요.  고기안좋아하는사람은  안들어간걸 택할수도  있어서   좋아요,2024-09-14,"밤에 방문, 예약 없이 이용, 대기 시간 바로 입장, 일상, 친척・형제",음식이 맛있어요,58,1
1089215444,플로라4364,순대도 신선하고 국물도 진하고 고소해요,2024-09-07,"저녁에 방문, 예약 없이 이용, 대기 시간 바로 입장, 일상, 혼자",음식이 맛있어요,1847,3
1089215444,플로라4364,순대도 맛있고 국물도 고소해요~,2024-08-29,"저녁에 방문, 예약 없이 이용, 대기 시간 바로 입장, 일상, 혼자",음식이 맛있어요,1847,2
1089215444,감사하기32,굳,2024-08-26,"밤에 방문, 예약 없이 이용, 대기 시간 바로 입장, 일상, 연인・배우자",음식이 맛있어요,594,1
1089215444,뀨09,근처 순대집중에 제일 나은듯 합니다,2024-08-23,"저녁에 방문, 포장·배달 이용, 대기 시간 바로 입장, 일상, 혼자",음식이 맛있어요,50,1
1089215444,0장족의발전0,매장넓고 깔끔합니다 건더기도 아주많이 들어있어요,2024-08-06,"저녁에 방문, 예약 없이 이용, 대기 시간 바로 입장, 데이트, 연인・배우자",음식이 맛있어요,708,2
1089215444,0장족의발전0,내부 깔끔하고 양도진짜 많습니다. 순대국은 국물 맛있어요~,2024-08-03,"점심에 방문, 대기 시간 바로 입장, 데이트, 연인・배우자",음식이 맛있어요,708,1
1089215444,플로라4364,순대국 양도 많고 국물이 엄청 고소하네요,2024-08-01,"저녁에 방문, 예약 없이 이용, 대기 시간 바로 입장, 일상, 혼자",음식이 맛있어요,1847,1
1089215444,e01234567,.,2024-07-15,점심에 방문,,2217,1
1089215444,알러빗알리뷰,순댓국 맛집이에요!지금까지 먹어본 순댓국 중 넘버 1 👍,2024-07-11,"점심에 방문, 예약 없이 이용, 대기 시간 10분 이내, 일상, 혼자",음식이 맛있어요,225,2
1089215444,글소리맛소리,가끔씩 저녁 메뉴 고민될 때 포장해서 먹어요.온 식구가 다 좋아해서 전원 만족 100%오늘은 좀 더 넉넉히 먹고 싶어 총 3인분 결재했어요~,2024-07-01,"저녁에 방문, 예약 없이 이용, 대기 시간 바로 입장, 일상, 혼자",음식이 맛있어요,331,7
1089215444,rightx2,무난무난 순대국 접근성 좋아서 자주가요,2024-06-29,"점심에 방문, 예약 없이 이용, 대기 시간 바로 입장, 일상, 친구",잡내가 적어요,30,1
1089215444,naveen,편육이 은근히 맛있네요,2024-06-29,"점심에 방문, 예약 없이 이용, 대기 시간 바로 입장, 일상, 연인・배우자, 아이",음식이 맛있어요,141,1
1089215444,gg파파29,굿,2024-06-11,저녁에 방문,음식이 맛있어요,1291,1
1089215444,알러빗알리뷰,"우리 가족이 좋아하는 순대실록! 순대만 순대국 ₩10,000 항정살 순태국 ₩15,000양념 다대기와 들깻가루 전부 넣고 순대와 항정살 넣고 같이 끓여요.마지막에 부추 넣고 담아내면 끝! 깍두기가 예전엔 덜 익은 깍두기라 좋았는데 요즘엔 익은 깍두기가 나오더라구요.",2024-04-26,"아침에 방문, 예약 없이 이용, 대기 시간 바로 입장, 일상, 혼자",음식이 맛있어요,225,1
1089215444,조초록,곱창 들어간 걸로 먹었는데 생각보다 되게 매워서 매운 거 못 드시는 분은 조심하셔야 할 듯. 맛은 냄새도 거의 안나고 맛있었어요. 반찬도 묵은 반찬 같은 느낌 없이 신선하고 맛있음.,2024-04-25,"점심에 방문, 예약 없이 이용, 대기 시간 바로 입장, 일상, 혼자",혼밥하기 좋아요,18,1
1089215444,짱구지70,굿,2024-04-15,밤에 방문,음식이 맛있어요,965,2
1089215444,soup0267,굿,2024-04-04,점심에 방문,친절해요,297,1
1089215444,글소리맛소리,엄마없을 때 알아서들 저녁 챙겨먹어라~이젠 어떻게 해먹는지 알지?가뿐하게 나는 외출준비만 하면 끝!어때유? 참 쉽쥬~~?,2024-03-20,"저녁에 방문, 예약 없이 이용, 대기 시간 바로 입장, 일상, 혼자",음식이 맛있어요,331,6
1089215444,챔이로다,"얼큰곱창 순댓국 + 시래기 순댓국점심으로 먹었어요!기본반찬 편하게 리필해서 먹을 수 있어서 좋았고, 든든하게 식사했습니다. 사장님도 친절하세요.",2024-03-13,"점심에 방문, 예약 없이 이용, 대기 시간 바로 입장, 일상, 부모님",매장이 넓어요,1271,1
1089215444,진주성42,맛있어요,2024-03-05,"점심에 방문, 예약 없이 이용, 대기 시간 바로 입장, 친목, 친구",음식이 맛있어요,6,1
1089215444,글소리맛소리,"완전 단골됨! 온 식구가 다 맛있게 먹으니 또 포장 구입! 언제나 맛있는 국밥 맛집!순대만순댓국 10,000(1인분)양도 충분해요.순대실록 상일동점입니다.",2024-02-24,"점심에 방문, 예약 없이 이용, 대기 시간 바로 입장, 일상, 혼자",음식이 맛있어요,331,5
1089215444,글소리맛소리,"전통순댓국 10,000 원, 항정수육 순댓국 15,000원.가족들이 다들 잘 먹으니 반찬거리 고민될때  2인분만 포장해서 먹으면 국이 맛있어서 한끼 맛있게 해결가능!동영상은 항정수육 순댓국이에요.",2024-02-18,"점심에 방문, 예약 없이 이용, 대기 시간 바로 입장, 일상, 혼자",음식이 맛있어요,331,4
1089215444,eunoia428,매장도 깨끗하고 맛도 좋고 너무 친절하세요,2024-02-15,"점심에 방문, 예약 없이 이용, 대기 시간 바로 입장, 친목, 지인・동료",음식이 맛있어요,6,1
1089215444,Alles gute,너무 맛있네요 순대볶음 맛있어요 추천추천,2024-02-15,"점심에 방문, 예약 없이 이용, 대기 시간 10분 이내, 친목, 친구",음식이 맛있어요,8,1
1089215444,moon7,깔끔하고 맛있어요 직원분들이 친절해서 좋아요 주차하기도 편하구요,2024-02-15,"점심에 방문, 예약 없이 이용, 대기 시간 바로 입장, 친목, 친구",음식이 맛있어요,6,1
1089215444,mar****,,2024-02-14,저녁에 방문,특별한 메뉴가 있어요,218,1
1089215444,짱구지70,굿,2024-02-12,저녁에 방문,음식이 맛있어요,965,1
1089215444,글소리맛소리,"수, 목, 일..  자꾸 생각나게 하는 국물과 순대!오늘은 항정살 순댓국도 사봤어요.고기가 부드럽고 질감도 좋아요.가격은 1인분 15,000원.아이들이 또 먹고 싶데서 1주일에 3번 먹는데도 질리지않고 맛있네요~^^",2024-02-04,"점심에 방문, 예약 없이 이용, 대기 시간 바로 입장, 일상, 혼자",음식이 맛있어요,331,3
1089215444,글소리맛소리,"지난 번, 이곳 들렀다가 너무 괜찮아서 식구들에게도 맛을 알리고 싶어 포장(비가열)해서 집에서 끓여 먹었어요.식구들 모두 너무 맛있다고 잘 먹어서 기분 좋았어요.믿고 먹을 수 있는 순대맛집이 생겨 너무 좋아요~",2024-02-01,"저녁에 방문, 예약 없이 이용, 대기 시간 바로 입장, 일상, 혼자",음식이 맛있어요,331,2
1089215444,글소리맛소리,"성시경이 반한 순대실록이라면! 믿을 수 있겠다싶어 후기도 안찾아보고 들어갔어요.국물맛도, 내장과 순대도 그냥 평범하지가 않아요. 제대로 만들었다는 자부심의 맛이었어요. 순대의 역사를 새로쓰겠다는 다짐이 들어있는 맛과 다양한 메뉴! 조선왕조실록 다음가는 순대실록! 여러분도 그 역사의 현장에 다녀오세요!! 순대 맛집 인정 👍",2024-01-31,"저녁에 방문, 예약 없이 이용, 대기 시간 바로 입장, 일상, 친구",음식이 맛있어요,331,1
1089215444,dada5357,저녁으로 아이셋과 함께 갔어요~~맛있고주차편하고(2시간넣어주심)맛도 좋았어요,2023-12-17,"점심에 방문, 예약 없이 이용, 대기 시간 바로 입장, 가족모임, 아이",음식이 맛있어요,74,1
1089215444,C1o7er,제 입맛엔 순대막이 좀 씁니다. 그치만 국물은 진짜 끝내줌,2023-12-01,저녁에 방문,친절해요,408,2
1089215444,jsp****,,2023-11-09,점심에 방문,매장이 청결해요,818,1
1089215444,역지사지470,美味しい,2023-11-04,점심에 방문,음식이 맛있어요,864,1
1089215444,her****,이름은 거창하지만 응대서비스라든지순대국 본연의 맛은 갸우뚱하네요,2023-11-01,저녁에 방문,매장이 넓어요,695,1
1089215444,Inner Peace22,순대랑 순대국 맛있어요,2023-10-27,저녁에 방문,음식이 맛있어요,301,1
1089215444,C1o7er,국물이 진짜 맛있습니다 크..,2023-10-20,저녁에 방문,매장이 넓어요,408,1
1089215444,nuk****,좋아요,2023-10-01,저녁에 방문,고기 질이 좋아요,883,1
1089215444,달림달림,만족합니다,2023-10-01,아침에 방문,고기 질이 좋아요,1618,2
1089215444,둘이라도,"시레기 / 삼겹수육 순대국 포장해서 먹었습니다. 밥, 다대기등 1인 1반찬 챙겨주셨고 맛도 괜찮아요",2023-09-25,저녁에 방문,음식이 맛있어요,1659,1
1089215444,스위밍이,동네에 순대국집 생겨서 좋아요,2023-09-25,저녁에 방문,음식이 맛있어요,202,1
1089215444,강력계 강반장,전에 칼국수 파시던 분인데 그맛 그 정성 그대로 순대도 역시나 맛있습니다.,2023-09-25,저녁에 방문,음식이 맛있어요,1217,1
1089215444,runner90,긋,2023-09-25,점심에 방문,혼밥하기 좋아요,371,1
1089215444,멋쟁이6064,맛있어요,2023-09-17,저녁에 방문,음식이 맛있어요,1922,1
1089215444,달림달림,만족합니다,2023-09-16,점심에 방문,음식이 맛있어요,1618,1
1089215444,오스카팔콘,음식 양이 진짜 많고 매장인테리어도 깔끔고 다음에 또 올래요,2023-09-14,점심에 방문,혼밥하기 좋아요,88,1
1089215444,odh****,"가성비,분위기,어느것 하나 빠질게 없는 최고 맛집입니다!너무 맛있어요!!",2023-09-13,점심에 방문,주차하기 편해요,83,1
1089215444,wlg****,메뉴들도 다양하게 많이 있어서 남녀노소 다 즐길 수 있는 곳 같음..!,2023-09-12,점심에 방문,가성비가 좋아요,112,1
1089215444,bqo****,누가와도 극찬할 수밖에 없는 맛이네요 ㅎㅎ 진짜 맛있어요 단골하려구요,2023-09-09,아침에 방문,친절해요,130,1
1089215444,hay****,인상적이었어요!! 비주얼도 맛도 넘 좋았습니다 객관적으로 맛집이에요,2023-09-08,점심에 방문,음식이 맛있어요,146,1
1089215444,ivy****,먹을만해요,2023-09-06,저녁에 방문,음식이 맛있어요,472,1
1089215444,hth****,"분위기도 너무 좋고 음식들 퀄리티며 비주얼, 맛이 완전 미쳤어요",2023-09-06,점심에 방문,음식이 맛있어요,138,1
1089215444,hal****,인기 많은 이유를 알겠습니당~~아주 흡입하다시피 먹고 왔네요~또 갈께옹~~,2023-09-05,점심에 방문,혼밥하기 좋아요,1,1
1089215444,2gc****,존맛탱 모든 메뉴뿌시기 도전,2023-09-04,점심에 방문,특별한 메뉴가 있어요,65,1
1089215444,삼백오,"편육정식과 얼큰곱창순대국 주문했습니다.국물맛은 전통순대국과 얼큰곱창순대국맛이 똑같습니다. 전혀 얼큰하지않았고 고기에 비계가 너무많고 곱창은 뻣뻣. 유일하게 나오는반찬이 깍두기인데 무가 무르고 매우 맛이 없어서 가격에 비해 상당히 아쉬운 식사였습니다. 테이블두개짜리 붙은곳 한쪽테이블에 앉았는데 밥공기2개 옆테이블에 던져놓고가는건 무슨경우인지.. 맛,서비스 전체적으로 불만족이라 다시는 방문하지 않을것같아요",2023-09-04,점심에 방문,,66,1
1089215444,d3n****,그저께 와서 먹고 너무 맛있어서 오늘 또 왔어요,2023-09-03,점심에 방문,매장이 청결해요,93,1
1089215444,cju****,푸짐하고 너무 맛있음!!음식이 대체로 다 맛있어서 또 오고싶어요 ~~,2023-09-02,점심에 방문,주차하기 편해요,125,1
1089215444,ioa****,함께간 지인과 나는 만족했다. 첫느낌은 좋다.또 와야겠다.,2023-08-31,점심에 방문,특별한 날 가기 좋아요,130,1
1089215444,ace****,정말 맛집맞아요♡최고였어요.,2023-08-31,점심에 방문,매장이 청결해요,113,1
1089215444,cha****,유명해서 가봤는데 맛있고 건강한 맛집이네요 :),2023-08-30,점심에 방문,특별한 메뉴가 있어요,154,1
1089215444,did****,메뉴들 모두 너무 만족 ㅠ,2023-08-30,점심에 방문,가성비가 좋아요,36,1
1089215444,은요일,정통 순댓국국물이 살짝 매콤하고 깔끔한 맛이 맛나네요.고기는 부드럽고 순대는 껍질이 살짝 질겼네요.깍두기가 맛있어서 좋았어요.주문은 테이블에 있는 테블릿으로하네요.,2023-08-28,점심에 방문,음식이 맛있어요,732,1
1089215444,fly****,딱 맛집이에요 오늘 특히 더 맛있었습니다,2023-08-28,점심에 방문,가성비가 좋아요,147,1
1089215444,amb****,깔끔하고  친구 데려와도 좋아할것 같습니다!,2023-08-27,점심에 방문,매장이 넓어요,17,1
1089215444,nst****,직원분들 친절하시고 좋았어요 맛있게 잘 먹고 갑니다 :),2023-08-27,점심에 방문,특별한 날 가기 좋아요,76,1
1089215444,ues****,맛있어요~~맛집입니다.,2023-08-27,점심에 방문,인테리어가 멋져요,15,1
1089215444,도로시4135,굿,2023-08-26,저녁에 방문,양이 많아요,1302,1
1089215444,udc****,푸짐하게 양껏 먹을 수 있어 좋아요~,2023-08-26,점심에 방문,인테리어가 멋져요,55,1
1089215444,김지원15,$,2023-08-25,저녁에 방문,음식이 맛있어요,95,1
1089215444,enr****,역시 소문대로 입니다 벼르다 간곳 이었는데 제대로된 요리 먹고 나왔습니다,2023-08-25,아침에 방문,가성비가 좋아요,177,1
1089215444,재인 Doyun,n,2023-08-24,저녁에 방문,,1208,1
1089215444,orm****,양도 많고 집밥 느낌이라 좋습니다!!,2023-08-24,아침에 방문,매장이 넓어요,137,2
1089215444,로지씨,"살코기 순댓국과 전통순댓국, 깍두기 모두 깔끔하게 맛있어요.양도 푸짐하고 자주 먹을것같아요. 다만 미리 전화해서 포장주문하고 싶은데 연락이 잘 안돼요. 결국 방문해서 한참 기다렸네요. 이부분은 차츰 좋아질거라 믿어요. 맛있어서 또 포장하러 갑니다.",2023-08-23,밤에 방문,음식이 맛있어요,1011,1
1089215444,cke****,하나도 안남기고 먹어버렸네용 .. 살찔까봐 그만 먹으려했는데 숟가락이 도저히 안놔졌어요 ㅋㅋㅋㅋ,2023-08-22,아침에 방문,직접 잘 구워줘요,118,1
1089215444,238248,청양순대국 정말 얼큰하고 맛있구요 순대는 제가 여지껏 순대국집에서 먹은 순대중에 제일 맛있었어요 많이 부드럽고 고소해요 맛있어요 그리고 청결하고 모든 음식 자체가 깔끔하고 담백해서 좋았어요,2023-08-20,점심에 방문,음식이 맛있어요,597,1
1089215444,ma****,꼭 가야하는 곳 넘 맛있어요!계속 맛있는 음식 계속 맛볼수있게해주세요~~,2023-08-20,아침에 방문,매장이 청결해요,65,1
1089215444,바다5840,"이틀연속 갔어요 하하..^^지나다 눈팅하고 살코기 순대국 먹었구요그담날은 맛있어서 지인과 또가서 순대국과 순대스테이크 주문했어요저는 기름진걸 좋아해서 담번엔 항정이나 삼겹순대국 먹을까해요~살코기순대국 고기가 사태살이라 저한테는 퍽퍽한 느낌..근데 제 지인은 비계 싫어해서 살코기순대국 엄청 좋아하더군요~깔끔하고 국물이 깊어요~ 순대스테이크는 돌판에 주는데 야채,고기,견과류 등이 다져져서 들어가있어 너무 맛있게 잘 먹었어요~반찬은 셀프인데 들깨가 들어간 된장?쌈장?이 맛있네요~ 상일동에 맛난 순대국집 생겨서 넘 좋아욤",2023-08-19,점심에 방문,음식이 맛있어요,323,1
1089215444,thr****,맛좋은곳이에요 맛집 추천합니다,2023-08-19,아침에 방문,가성비가 좋아요,10,1
1089215444,고구마친구다,입안으로 마구마구 들어갑니다 한입먹자마자 진실의미간발동! ㅋㅋㅋ,2023-08-18,점심에 방문,단체모임 하기 좋아요,52,1
1089215444,oky****,깔끔한맛에 완전 만족하고 갑니다. 친구도 여기 어떻게 찾얐냐고 극찬했어요!!,2023-08-17,점심에 방문,음식이 맛있어요,130,1
1089215444,b07****,너무 맛있게 잘먹었습니다 최고 모든가게 사장님이 다 여기사장님같았으면해요 ㅎ,2023-08-17,점심에 방문,직접 잘 구워줘요,10,1
1089215444,행복맘오잉,친절한데 비싸고 맛없음. 두 번 호기심에 갔다.. 안가게 됨. 예전 잘 가던 곳으로 회귀함,2023-08-16,저녁에 방문,친절해요,58,1
1089215444,쭈S2륀,순대가 아주 아주 맛나요!! 남 다름!!,2023-08-16,점심에 방문,음식이 맛있어요,100,1
1089215444,lob****,가격 맘에들고 퀄리티 맘에들고 이집 잘하네여~! 맛집으로 인정해요,2023-08-15,저녁에 방문,주차하기 편해요,173,1
1089215444,cro****,세심한 곳이에요 맛있게 즐겁게 먹고갑니다 나중에 혼밥도 가능할듯?,2023-08-15,저녁에 방문,매장이 넓어요,30,1
1089215444,니나노5720,대기가 겁나길어요.고기순대국 먹고팠는데 포장도 시간이 걸린대서 기본으로 샀어요.양은 많진않고 적당.왜 대기손님이 매일 많은건지 매장에서 먹어보고싶어요,2023-08-15,점심에 방문,음식이 맛있어요,829,1
1089215444,con****,여자친구랑 발견한곳인데 되게 맛있네요!! 깔끔하고 친절합니다,2023-08-14,저녁에 방문,주차하기 편해요,12,1
11887889,퓨마999,굿,2025-03-01,"점심에 방문, 예약 없이 이용, 대기 시간 바로 입장, 친목, 일상, 연인・배우자",음식이 맛있어요,482,22
