place_id,nickname,content,date,situations,keywords,review_count,visit_count
1930888437,wil****,맛있어용,2025-03-17,"밤에 방문, 예약 후 이용, 대기 시간 바로 입장, 데이트, 연인・배우자",음식이 맛있어요,13,1
1930888437,이나영96,맛있어용,2025-03-17,"밤에 방문, 예약 후 이용, 대기 시간 바로 입장, 데이트, 연인・배우자",음식이 맛있어요,7,1
1930888437,지롱82,고기 맛있고 부드러워요😋 냄새도 안나요!마파두부랑 먹었는데 마파두부도 맛있게 먹었어요ㅎㅎ,2025-03-16,"저녁에 방문, 예약 없이 이용, 대기 시간 바로 입장, 데이트, 연인・배우자",음식이 맛있어요,26,1
1930888437,ㅇㅇ라능1,갑자기 양꼬치가 땡겨서 찾아보다가 리뷰 좋은 곳에 왔습니다 맛있게 잘 먹고 갑니다! 양꼬치 잡내 없이 맛있게 먹었습니다! 다음에 또 오겠습니다! ㅎㅎ,2025-03-16,"저녁에 방문, 예약 없이 이용, 대기 시간 바로 입장, 친목, 친구",고기 질이 좋아요,243,1
1930888437,S화,양꼬치 먹으려고 서울숲 근처 찾아보는데 제일 많이 뜬곳이 양복점이라 와봤습니다. 양꼬치도 다른데보다 두껍고 쫄깃했고 양뚜밥도 맛있게 잘 먹었어요!,2025-03-16,"저녁에 방문, 예약 없이 이용, 대기 시간 바로 입장",음식이 맛있어요,502,1
1930888437,유현우974,양꼬치 고기가 큼직해서 좋았어요! 특히 다른 양꼬치집에는 없던 양푸밥이 맛있었어요 계란볶음밥도 있지만 양푸밥도 진짜 좋아요!,2025-03-16,"저녁에 방문, 예약 없이 이용, 대기 시간 바로 입장, 나들이, 연인・배우자",음식이 맛있어요,8,1
1930888437,cr****,우와 여기 진짜맛집이에요저 양꼬치 진짜 자주사먹거든요!!여기가 최고입니당 ㅋㅋ꿔바로우는 매콤한맛으로 시켰는데 진짜 특별하고 바삭했어요 또올께요~^^,2025-03-16,"저녁에 방문, 예약 없이 이용, 대기 시간 바로 입장, 친목, 일상, 연인・배우자, 아이",음식이 맛있어요,18,1
1930888437,김도현11,진짜 맛있어요. 양꼬치 통통해서 육즙팡팡 최고!블랙꿔바로우 존맛 강추!!,2025-03-16,"저녁에 방문, 예약 없이 이용, 대기 시간 바로 입장, 일상, 연인・배우자, 아이",친절해요,6,1
1930888437,jiw****,정신없이 먹어서 사진을 못 찍었는데 정말 맛있었습니다! 사장님도 엄청 친절하시고 음식도 빨리 나와서 좋아요,2025-03-16,"저녁에 방문, 예약 후 이용, 대기 시간 바로 입장, 데이트, 친구",음식이 맛있어요,1,1
1930888437,nor****,맛있어요!,2025-03-15,"밤에 방문, 예약 없이 이용, 대기 시간 바로 입장, 데이트, 연인・배우자",음식이 맛있어요,7,1
1930888437,qhdqld,양 많고 맛잇어요! 다음에도 오려구요~~~,2025-03-15,"밤에 방문, 예약 없이 이용, 대기 시간 바로 입장, 데이트, 연인・배우자",음식이 맛있어요,11,1
1930888437,dbs****,꼬치가 맛있어용,2025-03-15,"밤에 방문, 예약 후 이용, 대기 시간 바로 입장, 데이트, 일상, 연인・배우자, 친구",음식이 맛있어요,6,1
1232058547,박경아68,두번째방문우대갈비리조또 맛있네요알배추 셀러드는 어디에서도 맛보지 못했던 맛플레이팅이 너무 멋지도  생각했던맛이 아니여서 더 재밌고 맛있는또방문할께요 가격대는 좀 있어요 ^^,2025-04-07,"점심에 방문, 예약 후 이용, 대기 시간 바로 입장, 데이트, 친구",음식이 맛있어요,131,2
1232058547,withmerry,"차돌에 고사리... 들기름 조합으로 양식 외관에서 한식 맛의 버무림이 느껴지는 차돌고사리파스타, 크림치즈 한스쿱에 라구소스 올린 떡볶이, 김치볶음밥이 쏘옥 들어간 아란치니까지 맛없없 메뉴들💕비오는 주말에 미식으로 기분전환했어요~",2025-04-05,"점심에 방문, 예약 후 이용, 대기 시간 바로 입장",음식이 맛있어요,1497,1
1232058547,JOE58,"오랜만에 다시 방문한 ✨️심퍼티쿠시 성수점✨️>닭다리살 스테이크예전에도 먹었던 스테이크지만 닭다리살과 밑의 메쉬드 포테이토 조합이 정말 좋아요!>명란 크림 파스타(대—추천)뜨끈할때 먹으면 크림과 올라간 대파 튀김의 조합이 아주 좋아요 크림 파스타를 좋아하시는 어머니가 매우 만족스러워 하셨어요>비프 라구 떡볶이(시그니처)떡볶이 위에 올라간 라구와 크림치즈의 조합이 신기했어요 한번쯤 시켜먹어도 후회는 없는 맛이었습니다🫡>뇨끼 그라탕뇨끼를 외국식 감자 옹심이 정도로 생각하셨던 어머니가 가장 놀라면서 좋아하셨던 메뉴... 올라간 바삭 라이스 페이퍼와 크림, 버섯 등등 뇨끼와 아주 잘 어울렸어요!!!메뉴가 개편되어 갑오징어 카르파쵸가 없어진건 아쉽지만 여전히 좋았습니다🩷",2025-03-30,"점심에 방문, 예약 없이 이용, 대기 시간 바로 입장, 나들이, 일상, 부모님",음식이 맛있어요,253,2
1232058547,쟁님,"친척언니가 오랜만에 서울왔는데 여기 가보고싶다 얘기가나와서 예약하고 와봤어요ㅎㅎㅎ넷이서 양배추샐러드랑 명란크림파스타, 차돌고사리파스타, 우대갈비 리조또, 마늘빵 시켜서 먹었는데 양배추샐러드랑 우대갈비 리조또가 맛있더라구용!! 양배추 샐러드는 그래놀라랑 알배추와 소스와 치즈를 같이 먹으니까 너무 조화롭고 계속 끌리는 맛!!우대갈비 리조또도 새발나물이랑 갈비랑 밥이랑 같이 먹으니까 더 맛있었어요. 고사리 파스타는 제 입맛에는 안맞더라구요ㅎㅎ마늘빵에 명란크림소스 찍어먹으면 맛있음!자리도 넓고 뷰가 좋았어요!지하철 지나다니는게 보임!아기의자도 있고 넓은 프라이빗 좌석도 있어서 가족모임하기 좋을듯 합니다ㅎㅎ카카오친추하면 1000원쿠폰 줘요(인당가능!!못봐서 저희테이블은 한명만 받았네요ㅜㅜ아숩)",2025-03-29,"점심에 방문, 예약 후 이용, 대기 시간 바로 입장, 가족모임, 친척・형제",음식이 맛있어요,47,1
1232058547,dan****,여의도점방문해보고 너무맛잇어서 성수로 재방문했습니다👍👍,2025-03-29,"점심에 방문, 예약 후 이용, 대기 시간 바로 입장, 일상, 연인・배우자",음식이 맛있어요,13,1
1232058547,예팔이39,"음식도 맛있고, 매장 분위기도 너무 좋았어요. 좋은 시간 보내다 갑니다!But‼️예약금을 제외하고 계산해주면 좋을 것 같은데ㅠㅠ 굳이 예약금 따로 환불하고 음식도 제 값을 받으시니.. 환불이 됐나 안됐나 계속 확인하게 되고, 환불도 일주일 넘도록 안되니 괜히 기분이 😂...",2025-03-25,"저녁에 방문, 예약 후 이용, 대기 시간 바로 입장, 데이트, 연인・배우자",음식이 맛있어요,12,1
1232058547,Iiiioi,신식건물이고 인테리어멋져요음식도 특색있는메뉴들에 맛도있네요,2025-03-23,"점심에 방문, 예약 없이 이용, 대기 시간 바로 입장, 일상, 연인・배우자",음식이 맛있어요,559,1
1232058547,61s****,음식이  다맛있고   집들이를 여기서했는데 모두 좋아하네요  피자도 만들어 주셨으면 합니다,2025-03-19,"점심에 방문, 예약 후 이용, 대기 시간 바로 입장, 친목, 친구",음식이 맛있어요,2,1
1232058547,jingirok,"모든 음식이 맛있었어요 :)스테이크와 얼그레이하이볼의 조합도 좋았고고사리와 곁들여진 파스타, 대파와의 조합!모두 훌륭했어요 ㅎ",2025-03-18,"점심에 방문, 예약 없이 이용, 대기 시간 바로 입장, 여행, 친구",음식이 맛있어요,2105,1
1232058547,o3****,분위기도 너무 좋고 음식도 맛있었어요 친절하시구요! 통창이라 낮에도 이쁘긴한데 저녁에 훨씬 더 이쁠거 같아요 다음엔 저녁에 방문하려구요,2025-03-16,"점심에 방문, 예약 후 이용, 대기 시간 바로 입장, 친목, 친구",인테리어가 멋져요,16,1
1232058547,지원서,청첩장 모임하러 방문했습니다 ㅎㅎ 심퍼티쿠시만큼 좋은 청모장소가 없는 것 같아요! 메뉴 하나하나 다 맛있고 분위기도 좋아서 즐거운 식사시간 보냈습니다!샐러드도 맛있어서 다이어트하는 예신분들 청모하기도 좋은 것같아요~~~! ㅎㅎ,2025-03-15,"저녁에 방문, 예약 후 이용, 대기 시간 바로 입장, 친목, 지인・동료",인테리어가 멋져요,71,1
1232058547,웅이또잉,"😊 : 기념일 맞이 남자친구와 예약하고 방문. 금욜 저녁 기준 웨이팅 7팀 정도던데, 가능하면 웨이팅하고 가세요! 주차는 5층에 카 리프트 타고 올라가서 가능. 곱창파스타는 소곱창 굳기 전 따뜻할 때 먹어야 함. 곱도 많고 좋은데 무엇보다 당귀가 킥!! 당귀 조합이 향긋하고 리프레시도되고 넘 좋았음. 닭목살곤드레리조또도 파스타 못지않게 간이 딱 좋았음. 쌈장 마리네이드한건 처음 먹어보는데 특히 맛있고 고추 건조한 게 식감이 좋았음. 문의가 있으면 직원 분들 대응해주시는 게 좋았음. 저녁 때 지하철 왔다갔다 하는 뷰도 보기 좋았음. 🤔 : 소곱창은 식으면 약간 쌉사름한 맛이 나는게 종종 있음. 리조또 위에 레몬 폼은 특별히 별 맛 안 남.",2025-03-14,"저녁에 방문, 예약 후 이용, 대기 시간 바로 입장, 데이트, 기념일, 연인・배우자",인테리어가 멋져요,469,1
1232058547,먹동석,분위기도 좋고 음식도 맛있어요! 다양하게 시켜봤는데 파스타랑 스테이크 너무 맛있고 알배추 샐러드 강추합니다!,2025-03-14,"점심에 방문, 예약 후 이용, 대기 시간 바로 입장, 나들이, 지인・동료",음식이 맛있어요,311,1
1232058547,제리수,솔직히 음식 맛은 기대 이상…ㅎㅎ생각보다 더 맛있었어요주문한 음식들 다 성공적이였습니다!!,2025-03-13,"저녁에 방문, 예약 후 이용, 대기 시간 바로 입장, 친목, 친구",음식이 맛있어요,102,1
1232058547,박경아68,매장이 심플하고 음식도 간결해서 좋았다배추셀러드도 들기름소스로 특이하고 건강한맛이었고 고사리차돌파스타도 생각했던맛이 아닌게 너무 좋았다 양도 적당하고 플레이팅은 정말 칭찬하고싶다 재방문의사 아주 많음다음에는 밤에 한번 가보고싶다,2025-03-13,"점심에 방문, 예약 후 이용, 대기 시간 바로 입장, 데이트, 친구",음식이 맛있어요,131,1
1232058547,어슬렁집순이,예약시간보다 5분정도 늦게 왔는데 이해해주셔서 앉을수있었어요. 명란크림파스타는 대파채튀김의 바삭한 맛이랑 견과류의 고소한맛으로 크림소스가 느끼하지않아 맛있습니다! 닭목살 곤드레리조뜨는 닭고기와 꽈리고추랑 같이 먹어야 조화롭게 맛있더라구요 피치플라워에이드도 달달하니 좋았습니다👍,2025-03-11,"점심에 방문, 예약 후 이용, 대기 시간 바로 입장, 친목, 친구",음식이 맛있어요,244,1
1232058547,hho****,3월 7일 11시 30분 방문해습니다음식은 맛있게 먹었습니다근데 예약금 2만원 냈는데계산시 처리 안해주더군요3월 10일 입금 될 줄 알았는데 안들어 왔네요무슨 겨무인가요?내일 꼭 철해주세요,2025-03-07,"점심에 방문, 예약 후 이용, 대기 시간 바로 입장, 기념일, 친구",재료가 신선해요,16,1
1232058547,doya74,특별한날 특별한 맛있는 음식으로 좋아요,2025-03-05,"점심에 방문, 예약 후 이용, 대기 시간 바로 입장, 데이트, 연인・배우자",음식이 맛있어요,3,1
1232058547,js****,너무너무너무 맛있어요. 우대갈비 리조또랑 허브 샐러드 강추….,2025-03-03,"저녁에 방문, 예약 후 이용, 대기 시간 바로 입장",음식이 맛있어요,7,1
1232058547,고소망,음식도 넘 맛있고 분위기도 좋고 직원분들도 너무 친절하셨습니다 ~~,2025-03-03,"저녁에 방문, 예약 후 이용, 대기 시간 바로 입장, 기념일, 연인・배우자, 친척・형제",음식이 맛있어요,35,1
1232058547,KIWI515,"음식이 정말 맛있어요!옆에 지하철 지나다니는 그 풍경이 너무 예쁘더라고요재방문의사도 있습니다근데 대기 1번이고 사람은 계속 나오는데 안 들여보내주길래 여쭤보려고 들어갔는데앞에 직원이 통화중이시더라고요? 그래서 저기..이렇게 말걸었더니 얼굴을 찌푸리시면서 손짓으로 전화기를 가리키시더라구요....?적어도...다른 분한테 안내는 해주실 수 있지 않았을까 생각이 듭니다..음식+분위기는 정말 좋았는데 처음에 입장할 때 그 대응으로 기분이 많이 상했었어요+그리고나서 바로 입장 시켜줌! 가서 안 여쭤봤음 괜히 더 기다렸을뻔,,",2025-03-02,"저녁에 방문, 예약 없이 이용, 대기 시간 30분 이내, 친목, 친구",음식이 맛있어요,18,1
1232058547,한입공주와 두입왕비,분위기가 너무 좋고 독특한 메뉴가 많아요. 퓨전한식 느낌이라 더 좋았고 간도 적당하니 너무 맛있게 먹었어요!,2025-03-02,"저녁에 방문, 예약 없이 이용, 대기 시간 바로 입장, 나들이, 연인・배우자, 아이",음식이 맛있어요,146,1
1232058547,aajjibbu,맛있게 잘먹었습니다! 디저트와 커피 세트 가성비가 좋았어요!,2025-02-26,"저녁에 방문, 예약 후 이용, 대기 시간 바로 입장, 친목, 지인・동료",음식이 맛있어요,40,1
1232058547,핥,예약해서 좋은 자리 주셨고 노을두 보면서 맛있게 기분좋게 식사했습니다!층고도 높아서 좋았어요성수에서 주차지원🫶🏻,2025-02-23,"저녁에 방문, 예약 후 이용, 대기 시간 바로 입장",음식이 맛있어요,359,1
1232058547,Beer Lahai Roi,기념일에 예약하고 방문~ 예약이 그리 어렵진 않았고 알잘딱깔센으로 창가쪽으로 배치가 되어 전철뷰/사거리뷰를 즐기며 좋은 시간을 보냈습니다!음식이 증말 하나같이 다 맛있어서 아주 만족했네요ㅎㅎ 주차도 쏘쏘하고 괜찮았습니다~ 만족!,2025-02-20,"저녁에 방문, 예약 후 이용, 대기 시간 바로 입장, 데이트, 연인・배우자",친절해요,131,1
1232058547,boo****,음식 다 맛있고 분위기도 너무 좋았어요. 동료들과 식사 했는데 모두 소풍나온 기분이라며 좋아했어요.,2025-02-20,"점심에 방문, 예약 후 이용, 대기 시간 바로 입장, 친목, 지인・동료",음식이 맛있어요,26,1
1232058547,kec****,남자친구랑 저녁에 갔는데 정말 맛있었습니다 😋 나중에 성수 갈 일 있다면 재방문할 의향 있어요!,2025-02-10,"저녁에 방문, 예약 후 이용, 대기 시간 바로 입장, 데이트, 연인・배우자",음식이 맛있어요,5,1
1232058547,리치플랜트,"1. 인테리어, 분위기 뷰 굳2. 태블릿 메뉴판으로 주문 및 직원 호출 가능3. 음식 맛 굳. 명란크림파스타 굳굳    티라미수 굳굳4. 주차 편리 👍😃👅😀😍",2025-02-09,"점심에 방문, 예약 후 이용, 대기 시간 바로 입장, 기념일, 가족모임, 연인・배우자, 아이",음식이 맛있어요,1493,1
1232058547,혜욤이222,모임으로 갔는데 분위기 너무 좋고 음식도 진짜 맛있었어요! 기념일에도 가기 좋을것 같아요 ㅎㅎ,2025-02-07,"저녁에 방문, 예약 후 이용, 대기 시간 바로 입장, 친목, 친구",음식이 맛있어요,44,1
1232058547,크쿄키크,한식이랑 퓨전된 메뉴로 주로 먹었는데 너무 맛있게 먹었어요 데이트 하기 너무 좋고 직원분들도 굉장히 친절하세요. 다음에 또 방문하고 싶어요,2025-01-27,"저녁에 방문, 예약 후 이용, 대기 시간 바로 입장, 데이트, 연인・배우자",음식이 맛있어요,1126,1
1232058547,saytictoc,역시 맛납니당,2025-01-24,"저녁에 방문, 예약 후 이용, 대기 시간 바로 입장, 친목, 친구",음식이 맛있어요,232,1
1232058547,rea****,,2025-01-23,"저녁에 방문, 예약 후 이용, 대기 시간 바로 입장, 친목, 지인・동료",음식이 맛있어요,6,1
1232058547,dda****,음식이 특별하기도 하고 직원분들이 친절합니다또한 주변 공간도 넓어서 대화할 때 시끄러워서 얘기가 안들리거나 소음으로 고통받지 않고 옆에 전철이 위로 지나가서 특색도 있네요,2025-01-22,"저녁에 방문, 예약 후 이용, 대기 시간 바로 입장, 친목, 지인・동료",인테리어가 멋져요,80,1
1232058547,ken****,친절하고 맛있고 매우 만족스러웠습니다.,2025-01-20,"저녁에 방문, 예약 후 이용, 대기 시간 바로 입장, 데이트, 연인・배우자",음식이 맛있어요,177,1
1232058547,chl****,,2025-01-19,"저녁에 방문, 예약 후 이용, 대기 시간 바로 입장, 기념일, 가족모임, 부모님, 친척・형제",매장이 청결해요,1,1
1232058547,Qhtjsd,특별한 날 데이트하기 좋아요 :),2025-01-18,"저녁에 방문, 예약 후 이용, 대기 시간 바로 입장, 데이트, 연인・배우자",음식이 맛있어요,14,1
1232058547,하얀사과78,생일이라서 예약하고 갔는데 일단 기대이상이였습니다.음식도 맛있고 저는 우대갈비리조또가 너무맛있었습니다.알배추샐러드도 맛있고 차돌고사리파스타도다맛있네요 약간의 느낌함이 있었는데요 ^^매콤한거 좋아하시믄  추가해서 드시면 좋을듯합니다. 주변사람들 소개강추 입니다 ^^분위기도좋고 데이트장소도 너무좋아요사진도 잘 나와요 ^^,2025-01-16,"저녁에 방문, 예약 후 이용, 대기 시간 바로 입장, 데이트, 연인・배우자",음식이 맛있어요,705,1
1232058547,Talking To The Moon,"이 집은 유럽과 아시아의 맛을 잘 섞은 창의적인 메뉴가 매력적이에요! 🍝 이탈리안 파스타와 🥘 리조또, 진짜 맛있었어요. 샐러드도 새콤달콤해서 정말 신선한 느낌!여기서 먹으면서 서울 시내 전망을 감상할 수 있어요. 밤의 야경도 정말 멋져서, 데이트하기 딱 좋은 장소에요🌇. 정말 추천!",2025-01-15,"저녁에 방문, 예약 후 이용, 대기 시간 바로 입장, 데이트, 연인・배우자",음식이 맛있어요,67,1
1232058547,mym****,예약했는데 대기시간 없이 입장해서 좋았어요.음식구성이 독특해서 좋았어요.인테리어와 조명이 분위기 있어서 좋았어요.밤에 가서 그런지 창밖으로 보이는 전철풍경이 분위기가 좋았어요.,2025-01-12,"저녁에 방문, 예약 후 이용, 대기 시간 바로 입장, 데이트, 연인・배우자",인테리어가 멋져요,3,1
1232058547,굴도도리,"모든 메뉴가 맛있어 보여서 숙고하다 비프 라구 떡볶이, 차돌 고사리 파스타, 우대 갈비 리조또, 뇨끼 그라탕 주문했고 주문한 모든 음식이 맛있었습니다... 이번에 못 먹은 메뉴 먹으러 다시 방문할 생각이에요",2025-01-11,"점심에 방문, 예약 후 이용, 대기 시간 바로 입장, 가족모임, 친척・형제",음식이 맛있어요,13,1
1232058547,mjkanggg,맛있네요. 또 갈게요.,2025-01-06,"저녁에 방문, 예약 없이 이용, 대기 시간 바로 입장, 나들이, 지인・동료",음식이 맛있어요,212,1
1232058547,메이린65,분위기는 좋아요그런데 음식 양이 가격대비 너무 적고 외국에서 먹는 퓨전 한식 맛이 나서 몇 입 먹고 질리네요 ㅜ,2025-01-05,"저녁에 방문, 예약 후 이용, 대기 시간 바로 입장, 친목, 친구",단체모임 하기 좋아요,72,1
1232058547,yooooooon53,"생일 기념으로 예약하고 방문했는데생각했던 것 보다 너무 맛있고 청결하고 넘 좋았어요!!2차로 와인바는 다른 곳으로 가려다가 떡볶이 시켜서 여기서 1,2차를 다 먹었네용!!넘 좋아요",2025-01-02,"저녁에 방문, 예약 후 이용, 대기 시간 바로 입장, 친목, 기념일, 친구",음식이 맛있어요,36,1
1232058547,제이미7832,히터 넘 빵빵해서 더운 거 빼곤 최고!,2024-12-30,"저녁에 방문, 예약 후 이용, 대기 시간 바로 입장, 데이트, 연인・배우자",매장이 넓어요,37,1
1232058547,스왈로우테일,"전체적으로 음식 맛있고 좋았습니다 리조또는 은은한 버섯향과 좋은 퀄리티의 버섯 식감이 느껴졌어요 와규 스테이크는 굽기 좋았고 감자, 느타리버섯, 브로콜리 등 같이 나온 가니시들 조합도 좋았어요 차돌 고사리 파스타는 여전히 맛있는데 이전에 방문했을 때보다 고사리 양은 살짝 적게 들어간 것 같았어요 스텝분들 모두 친절하셔서 즐거운 식사하고 왔습니다",2024-12-29,"점심에 방문, 예약 후 이용, 대기 시간 바로 입장, 일상, 기념일, 연인・배우자, 아이",음식이 맛있어요,80,1
1232058547,세라6459,메뉴가 특별하긴 한데 맛은 쏘쏘였어요ㅎㅎ,2024-12-28,"저녁에 방문, 예약 후 이용, 대기 시간 바로 입장, 친목, 친구",특별한 메뉴가 있어요,459,1
1232058547,nannahey,심쿠는 고사리파스타가 찐임을.. 서울역점만 가다가 건대쪽 약속생겨서 갔는데역시나  맛도리~저녁엔 꼭 예약하고 가십셔~!,2024-12-28,"저녁에 방문, 예약 후 이용, 대기 시간 바로 입장",음식이 맛있어요,398,1
1232058547,lotslots,"차돌박이고사리, 청양마요 파스타 시켰는데 심퍼티쿠시는 역시 파스타 맛집인 것 같습니다!🍝 우대갈비는 맛있었으나 리조토 자체는 생각보다 평이하고 와규스테이크는 너무 레어여서 기대보단 쏘쏘였습니다,, 대신 스테이크 밑에 깔맅 버섯이랑 브로콜리 구이가 넘 맛있었습니다! 모짜렐라샐러드도 상큼하니 맛있었습니다🥗 세트보단 단품으로 주문하는게 더 가격이 괜찮고 합리적린 것 같아서 추천합니다",2024-12-27,"저녁에 방문, 예약 없이 이용, 대기 시간 1시간 이상",음식이 맛있어요,933,1
1232058547,chloe8928,"양이 너무 적어요,",2024-12-27,"점심에 방문, 예약 후 이용, 대기 시간 바로 입장, 친목, 친구",,66,1
1232058547,davin2969,새우가 들어간 오일파스타와 알배추 샐러드를 주문했어요. 새우에 배어있는 향이 너무 좋아서 행복했고 알배추가 머금고 있는 수분과 소스와 시나몬의 조화가 좋았습니다. 계속 생각나는 곳이에요. 직원분들도 친절하시고 화장실도 깨끗합니다.,2024-12-26,"점심에 방문, 예약 없이 이용, 대기 시간 바로 입장, 나들이, 친구",음식이 맛있어요,358,1
1232058547,god****,스테이크 먹었는데 굽기 물어보는거 없습니다. 물컹거리는 수준이었습니다. 핏기도 가득했습니다. 와규스테이크라고 했는데 기름이 굉장히 많았습니다. 다른 리뷰 사진과 비교해보니 우리가 먹은건 거의 지방이었군요. 크리스마스여서 바쁠까봐 말없이 먹고 지나왔지만 매우 불쾌합니다.,2024-12-25,"저녁에 방문, 예약 없이 이용, 대기 시간 바로 입장, 데이트",특별한 메뉴가 있어요,106,1
1232058547,pooha81,"세번째 방문입니다.맛집 천지 삐깔이인 성수동에서 세번째 재방문을 했다는 건 그만큼 제가 맛을 인정한다는 것입니다.전철 지나가는 뷰도 정말 갬성 넘치고,깔끔한 실내분위기와 예쁜 트리는 낭만을 더해줍니다.나오는 족족 다 맛있구요!!메인인 오리스테이크는 순식간에 먹어치워 사진을 못 찍었네요~~넘나 맛있었어요♡또 올게요!?^^",2024-12-25,"점심에 방문, 예약 후 이용, 대기 시간 바로 입장, 기념일, 아이",음식이 맛있어요,182,1
1232058547,야미얌이2,맛있었어요!,2024-12-24,"점심에 방문, 예약 후 이용, 대기 시간 바로 입장, 데이트, 연인・배우자",음식이 맛있어요,85,1
1232058547,야 이거 왜이렇게 맛있냐,"김치볶음밥 아란치니, 고추오일 명란크림파스타, 뇨끼 그라탕 먹었는데 셋 다 너무 맛있게 먹었습니다~ 아란치니는 바삭하고 토마토 소스랑 잘 어울렸고 파스타는 처음 먹어보는 맛있는데 느끼하지 않고 한식 같은 느낌도 있어서 색다르고 좋았어요! 뇨끼는 엄청 쫀득한데 라이스페이퍼 튀김이랑 같이 먹으면 바삭해서 식감이 좋아요! 직원분들도 친절하게 음식 설명 해주셔서 특별한 날이나 기념일에 예약하고 가면 좋을 거 같아요! 😋😋😋😋😋",2024-12-24,"점심에 방문, 예약 없이 이용, 대기 시간 바로 입장, 데이트, 친목, 나들이, 여행, 일상, 기념일, 연인・배우자, 친구, 지인・동료, 혼자, 친척・형제",인테리어가 멋져요,1123,1
