place_id,nickname,content,date,situations,keywords,review_count,visit_count
1395055395,이꿈27,마라샹궈 안짜고 맛있네용,2025-04-04,"점심에 방문, 예약 없이 이용, 대기 시간 바로 입장, 친목, 일상, 친구",음식이 맛있어요,366,1
1395055395,양배 츄,1.5단계로 먹었는데 맵기 적당하고 국물도 맛있었어요! 재료 다양하고 신선해요! 후식으로 아이스크림 먹을 수 있어요!💞,2025-04-03,"점심에 방문, 예약 없이 이용, 대기 시간 바로 입장",음식이 맛있어요,245,1
1395055395,찜콩,깔끔하고 너무 맛있어서 주기적으로 옵니다.,2025-03-14,"점심에 방문, 예약 없이 이용, 대기 시간 바로 입장, 일상, 혼자",음식이 맛있어요,62,1
1395055395,san****,맛있어요 마라탕 맛집이예요,2025-03-01,"점심에 방문, 예약 없이 이용, 대기 시간 바로 입장, 데이트, 연인・배우자",음식이 맛있어요,526,1
1395055395,dayk,"리뷰 보고 반신반의하면서 왔는데 여기 마라샹궈도 맛있고 매장도 깔끔한데 직원분이 친절하셔서 만족도 백프로에요!🥰 혼밥하러 왔는데 나중에 또 올 것 같네요!손님이 야채를 안 고를 때에는 앞에 비닐같은걸로 가림막 해놓으셔서 좋았고, 실곤약도 있어서 더 좋았습니당🤍",2025-02-21,"저녁에 방문, 예약 없이 이용, 대기 시간 바로 입장, 일상, 혼자",음식이 맛있어요,133,1
1395055395,아빠아버지,굿,2025-01-20,저녁에 방문,음식이 맛있어요,601,5
1395055395,당녀,이제는 우리 아이들이 직접가서 사오는 집 이네요~^^!초5학년 1.2단계 거뜬히 먹고 행복해하는 마라탕 최애집입니다~!,2025-01-12,"저녁에 방문, 포장·배달 이용, 대기 시간 30분 이내, 일상, 아이",음식이 맛있어요,1555,36
1395055395,쫑아37,양많고  맛있고   완전 깔끔하고  꿔바로우 소  양보고 완전  대박  맛도 너무 맛있어요 👍,2024-12-25,"점심에 방문, 예약 없이 이용, 대기 시간 바로 입장, 데이트, 아이",음식이 맛있어요,9,1
1395055395,현이9668,"마라삼궈 처음 도전했는데 너무 너무 맛있어요.매운걸 잘 먹지 못해서 단계를 1로  했는데 계속 손이 가네요, 사장님도 친절하시고 환경도 깨끗해서 강추입니다. 다음에는 1.5단계 도전하러 또 올게요~",2024-12-22,"점심에 방문, 예약 없이 이용, 대기 시간 바로 입장, 데이트, 친구",음식이 맛있어요,9,7
1395055395,오키동키키,마라샹궈 맛있어요!! 재료 관리가 신선하게 잘 되어 있어 감동했어요~ 볶음밥도 밥알 한알 한알 코팅되어 고슬고슬~ 사장님은 또 얼마나 친절하신지!🥰 조만간 마라탕 먹으러 가려구요😋👍🏻,2024-12-07,"아침에 방문, 예약 없이 이용, 대기 시간 바로 입장, 일상, 연인・배우자, 아이",음식이 맛있어요,1373,1
1395055395,kan****,여자친구랑 마라탕 먹으러 왔어요듬뿍 담았다고 생각했는데 생각보다 가격이 적게나와서 놀랐어요 가성비 마라탕 집입니다양도 많고 꿔바로우는 양이 엄청 많아요국물도 넘 맛있고 재료도 다양해서야무지게 먹고 왔습니다한성대주변 마라탕 맛집은 여기예요!,2024-12-03,"저녁에 방문, 예약 없이 이용, 대기 시간 바로 입장, 데이트, 연인・배우자",친절해요,7,1
1395055395,아오배부르다,고기추가 천원에 아이스크림까지 … 심지어 너무 맛있음 최고,2024-12-01,점심에 방문,음식이 맛있어요,950,1
1395055395,soo****,맛있는 마라탕 메뉴가 많아서 좋아요 ~한성대입구역 근처에 있어요 ^^,2024-11-24,"점심에 방문, 대기 시간 바로 입장, 지인・동료",음식이 맛있어요,609,1
1395055395,산다40,N번째 방문합니다 진짜 맛있는 마라탕집~~~!! 한성대 근처 마라탕집 중 여기가 최고에요!! 고기추가도 이벤트로 저렴하고 정말 맛있어요~~~~!!!!,2024-11-08,"저녁에 방문, 예약 없이 이용, 대기 시간 바로 입장, 데이트, 연인・배우자",음식이 맛있어요,44,1
1395055395,당녀,2틀만에 또 먹은 마라탕이네요~^^!저희 아이들 5학년 여기서 다키우는 것 같네요~너무 잘먹어서 뿌듯하고 맛있어서 행복하고~맛도 맛이지만~사장님 두분 모두 너무나 친절해서 가고 또 가고싶은 맛집입니다~아이들은 1.2단계 시켜드세요요청사항란에 쓰시면 됩니다^^! 최고 맛집👍👍👍,2024-11-08,"저녁에 방문, 포장·배달 이용, 대기 시간 30분 이내, 일상, 아이",음식이 맛있어요,1555,30
1395055395,당녀,너무 맛있어요~^^아이들과 함께 가서 먹기도 편안하고 사장님 두분 친절하셔서 더욱더 좋아요~😊,2024-10-30,"저녁에 방문, 예약 없이 이용, 대기 시간 바로 입장, 일상, 아이",음식이 맛있어요,1555,28
1395055395,oieuoa,개맛있음. 2.5단계먹고가면 밥 무한리필임.전 안먹긴햤는데 아이스크림도 있어요 꺅,2024-10-26,"저녁에 방문, 예약 없이 이용, 대기 시간 바로 입장, 혼자",혼밥하기 좋아요,19,1
1395055395,당녀,언제 먹어도 질리지 않은~아이들 뿐 아니라 부모님께서도 잘드세요~향신그다지 강하지 않은 1.2단계는 부담없이 드실수 있어요~^^,2024-10-25,"저녁에 방문, 포장·배달 이용, 대기 시간 30분 이내, 일상, 아이, 부모님",재료가 신선해요,1555,27
1395055395,sd****,굳굳,2024-10-24,"점심에 방문, 예약 없이 이용, 대기 시간 바로 입장, 데이트, 연인・배우자",음식이 맛있어요,2493,3
1395055395,kim****,"여기 진짜 맛집이에요 ㅠㅠ 고기 추가도 무려 1,000원밖에 안 하는,, 가성비 마라샹궈 맛집입니다👍👍",2024-10-09,"점심에 방문, 예약 없이 이용, 대기 시간 바로 입장, 데이트, 연인・배우자",음식이 맛있어요,270,1
1395055395,당녀,음식이 빨리 배달되고 맛도 좋고 너무 기분좋은 곳 입니다~^^,2024-10-04,"점심에 방문, 포장·배달 이용, 대기 시간 바로 입장, 일상, 아이",음식이 맛있어요,1555,26
1395055395,woo****,아이들이 먹기좋은 1.2단계 시켰어요친절하셔서 좋았어요.,2024-10-02,"저녁에 방문, 예약 없이 이용, 대기 시간 바로 입장, 일상, 아이",음식이 맛있어요,116,1
1395055395,xxxxxxzp,맛있어요~ 근데 같은 단계여도 랜덤이 있나봐요,2024-09-23,"점심에 방문, 예약 없이 이용, 대기 시간 바로 입장, 친목, 친구",음식이 맛있어요,44,1
1395055395,q요정,맛있어요,2024-09-23,점심에 방문,음식이 맛있어요,2074,1
1395055395,도레밍34,"직원 분이 엄청 친절하시고 꿔바로우 안 먹으면 진짜 후회합니다 중고등학교, 대학교까지 있어서 점심이나 저녁 타임 가면 웨이팅 있는데 웨이팅 시스템이 제대로 구축이 안 되어 있어서 아쉬움…",2024-09-20,"점심에 방문, 예약 없이 이용, 대기 시간 10분 이내, 친목, 친구",친절해요,73,1
1395055395,현이9668,추석다음날 바로 다복향 왔어요~집에서 술을 너무 많이 마셔서 매운맛 생각에 다복향 만한 음식이 없지요. 맛도 좋고 해장도 좋고 사장님도 친절하시고 계속 오게되네요~맛집으로 강추합니다.사장님 대박나세요💪💪💪👍👍👍🎉🎉🎉🥮🥮🥮💰💰💰,2024-09-18,"점심에 방문, 예약 없이 이용, 대기 시간 바로 입장, 친목, 친구",친절해요,9,6
1395055395,cai****,한성대 가면 들리는 마라탕 집입니다.추석 음식 느끼함을 이기는 맛입니다. 오랜만에 친구들이랑 들렸는데 맛은 여전히 맛있구 사장님 너무 친절합니다. 매장도 깨끗하고  .. 가끔 지저분한 집도 있는거 같은데 다복향은 위생에 믿음이 가는 집입니다. 자주자주 들리고 싶은 집이니 오래오래 운영해주세요^^,2024-09-18,"점심에 방문, 예약 없이 이용, 대기 시간 바로 입장, 일상, 친구",친절해요,5,2
1395055395,당녀,사장님 두분 너무나 친절하시고 맛도 좋고 쟤료들이 신선해서 아이들과 함께 먹기 좋아요~^^너무나 맛있는 마라탕 집입니다~^^!!,2024-09-12,"저녁에 방문, 예약 없이 이용, 대기 시간 바로 입장, 일상, 아이",음식이 맛있어요,1555,24
1395055395,ste****,동네맛집으로 1등인것같아요채소도 신선하고 매장도 깨끗하고 사장님도 친절해요,2024-09-05,"점심에 방문, 예약 없이 이용, 대기 시간 바로 입장, 일상, 연인・배우자",음식이 맛있어요,9,1
1395055395,ykj****,너무 너무 친절하시고 마라탕이 아주 맛있어요마라탕을 좋아해서 수십군데 먹어봤는데손에 꼽게 맛있네요국물이 진짜 맛있어요!!,2024-09-01,"저녁에 방문, 예약 없이 이용, 대기 시간 바로 입장, 친목, 연인・배우자, 친척・형제",뷰가 좋아요,8,1
1395055395,리루티,늘 친절하시고 맛있어요!조리도 빨라요!꿔바로우 맛있네요😆,2024-08-14,"점심에 방문, 예약 없이 이용, 대기 시간 바로 입장, 친목, 지인・동료",혼밥하기 좋아요,673,6
1395055395,꽁기꽁기33,재료가 신선하고 맛있습니다,2024-07-17,"점심에 방문, 예약 없이 이용, 대기 시간 바로 입장, 일상, 아이",음식이 맛있어요,93,2
1395055395,sd****,굳굳,2024-06-27,"점심에 방문, 예약 없이 이용, 대기 시간 바로 입장, 데이트, 연인・배우자",음식이 맛있어요,2493,2
1395055395,Moodshare,"사장님 친절하시고 마라탕,마라샹궈 모두 맛있어요 아이스크림도 하나 무료로 줘용🫠",2024-06-19,"점심에 방문, 예약 없이 이용, 대기 시간 바로 입장, 나들이, 친구",음식이 맛있어요,331,3
1395055395,꽁기꽁기33,가족과 함께 마라탕먹으러 왔어요! 꿔바로우도 맛있어용!,2024-06-08,"점심에 방문, 예약 없이 이용, 대기 시간 바로 입장, 친목, 연인・배우자",음식이 맛있어요,93,1
1395055395,o1234o,굿굿,2024-05-30,"점심에 방문, 예약 없이 이용, 대기 시간 바로 입장, 친목, 친구",음식이 맛있어요,791,2
1395055395,min****,저는 마라탕을 안좋아하는데 이 집으로 입문했어요ㅜㅜ 이사 가고 나서도 들르는 곳이랍니다! 무엇보다 사장님이 정말친절하세요~~,2024-04-24,"저녁에 방문, 예약 없이 이용, 대기 시간 바로 입장, 일상, 혼자",음식이 맛있어요,15,1
1395055395,o1234o,맛있어요,2024-04-23,"저녁에 방문, 예약 없이 이용, 대기 시간 바로 입장, 친목, 친구",음식이 맛있어요,791,1
1395055395,탄감자82,맛있어요친절해요,2024-04-20,"저녁에 방문, 예약 없이 이용, 대기 시간 바로 입장, 일상, 연인・배우자, 아이",음식이 맛있어요,22,1
1395055395,267****,오픈 준비중이였는데도 불구하고 친절하시고 넘  맛있게 기분좋게 잘 먹고왔어요~ 자주 먹을꺼같아요!,2024-04-19,"아침에 방문, 예약 없이 이용, 대기 시간 바로 입장, 일상, 연인・배우자, 아이",음식이 맛있어요,596,3
1395055395,당녀,미리 주문해놓고 포장해가기 좋아요~*^^*언제나 맛있고 친절하셔서 기분좋은 울동네 맛집!!아이들이 너무나 좋아해요~♡♡아이들 1.2단계도 있어요~~,2024-04-14,"저녁에 방문, 예약 후 이용, 대기 시간 30분 이내, 나들이, 일상, 아이",재료가 신선해요,1555,19
1395055395,도란도란674,맛있어요,2024-04-05,저녁에 방문,음식이 맛있어요,469,4
1395055395,해은57,아이가 좋아하는 맛집입니당^^,2024-04-05,저녁에 방문,음식이 맛있어요,456,4
1395055395,Zozo2910,,2024-04-01,"저녁에 방문, 예약 없이 이용, 대기 시간 바로 입장, 일상, 혼자",음식이 맛있어요,90,1
1395055395,iice,조아요오오!!!!💕,2024-03-27,"점심에 방문, 예약 없이 이용, 대기 시간 바로 입장, 데이트, 연인・배우자",친절해요,158,1
1395055395,쑤7880,"마라탕 매운맛으로 시켜먹었는데 넘 취향저격ㅠㅠㅠ매운 거 잘 먹는데 사장님께서 매우면 말씀해주시라고 하셔서 감동받았네요ㅠㅠ 게다가 고기추가가 천원,,! 다들 고기 추가해 드세요~! 같이 주문한 꿔바로우도 바삭 쫀득ㅠㅠ 덕분에 맛있게 잘 먹구 갑니다~",2024-03-24,점심에 방문,음식이 맛있어요,4,1
1395055395,연ㅎ흐,"다이어트 안할때 일주일에 화목 두번씩 먹으러 옴.. 일단 사장님 너무 친절하시고밥, 아이스쿠림 다 주시고…..여기 진짜 왜 안오는거지? 진짜 오면 절대 후회없음 절대로 진짜와 여기 진짜 나만 알고싶지만 유명해져야해",2024-03-15,점심에 방문,혼밥하기 좋아요,40,1
1395055395,반딧불이4622,4번 째 방문. 미니 꿰바로우. 마라탕.재료가 신선 하고 친절 하시고맛있어요. ~ ^^10시까지 영업해요.,2024-03-14,"저녁에 방문, 예약 없이 이용, 대기 시간 바로 입장, 일상, 친구",음식이 맛있어요,7,1
1395055395,lai301,마라탕 맛있어요ㅠㅠㅜ 뉴진면도 잘익어나왔고 국물이 적당하게 얼큰하고 그냥 맛있어요. 아이스크림도 1인당 무료로 하나씩 먹을수 있어요. 입가심으로 먹으면 아주그냥 완벽함.. 혼밥하기도 괜찮을거 같아요. 사장님도 친절하셔서 또 오고싶어요😝,2024-03-13,"점심에 방문, 예약 없이 이용, 대기 시간 바로 입장, 친목, 일상, 친구",친절해요,44,1
1395055395,ven****,혼밥하기도 나쁘지 않아요좋아요,2024-03-03,"점심에 방문, 예약 없이 이용, 대기 시간 바로 입장, 나들이, 부모님, 친척・형제",음식이 맛있어요,523,1
1395055395,리루티,늘 신선하고 늘 친절해요!!,2024-02-21,"점심에 방문, 예약 없이 이용, 대기 시간 바로 입장, 일상, 지인・동료",음식이 맛있어요,673,5
1395055395,jin****,맛있어요.,2024-02-14,"점심에 방문, 예약 없이 이용, 대기 시간 바로 입장, 친목, 일상, 아이",음식이 맛있어요,1092,1
1395055395,ksl****,맛있고 깨끗하고 넓고 친절하세요 💗 마지막에 아이스크림도 먹고 갈수 있어요 💗,2024-01-31,"저녁에 방문, 예약 없이 이용, 대기 시간 바로 입장, 일상, 혼자",음식이 맛있어요,6,1
1395055395,짱아817,집 근처라서 방문했는데 사장님이 친절하시고 재료가 신선해서 좋았습니다❤️,2024-01-30,"점심에 방문, 예약 없이 이용, 대기 시간 바로 입장, 일상, 혼자",재료가 신선해요,229,1
1395055395,당녀,양도 많고 너무나도 맛있는 맛집입니다~^^!쟤료들도 싱싱하고 먹을때마다 건강해지는 기분좋은 맛이예요~1단계는 하얀국물이라는데..저희 아이들은 약간 먹을  줄 알아  1.2단계 먹네요~^^!주문하실 때 말씀 하심 친절하신 여사장님께서 해주신답니다~친절 서비스 위생 청결 쟤료 모두 gooooooooood👍👍,2024-01-30,"점심에 방문, 예약 없이 이용, 대기 시간 바로 입장, 가족모임, 아이",음식이 맛있어요,1555,13
1395055395,블랙자몽,아이가 단골인데 방문할때마다 잘 챙겨주셔서 너무 좋아요 ~~ 동네에서 제일 맛있어요 ^^,2024-01-25,"저녁에 방문, 예약 없이 이용, 대기 시간 바로 입장, 가족모임, 아이",음식이 맛있어요,9,1
1395055395,당녀,양도 많고~ 맛도 좋고~ 쟤료가 싱싱해서 건강해지는 느낌입니다~^^! 저희는 이번주만 3일째..  마라탕!!ㅎㅎ 그만큼 아이들도 저도 너무 맛있게 먹는 마라탕집 입니다~~항상 느끼는거지만 친절+청결+맛 모두 gooooooood!!!!👍👍👍👍👍새콤달콤한 소스에 크리스피한 느낌의 넓적한 고기 꿔바로우도 반할만 합니다~~😍빠삭함과 육즙이 어우러져 어른 아이 모두 좋아할 맛입니다~^^,2024-01-18,"저녁에 방문, 예약 없이 이용, 대기 시간 바로 입장, 가족모임, 아이",음식이 맛있어요,1555,11
1395055395,당녀,"너무 푸짐하게 매번 감사히 잘먹는 우리동네 맛집 다복향!!👍여사장님,   남사장님~! 항상 웃음로 맞아주시고.. 친절하셔서~ 먹기 전 부터 햄볶아요~~^^♡우리 아이들이 저보다더 너무나 사랑하는 곳이네요~아이들에게 싱싱한 야채를 먹게 해주는 고마운 곳 입니다~!!^^맛도 건강도 챙겨주는 다복향!오래오래 함께 해주세요~~🙏🙏",2024-01-15,"저녁에 방문, 예약 없이 이용, 대기 시간 바로 입장, 일상, 친척・형제",음식이 맛있어요,1555,9
1395055395,사하라753,굿,2024-01-10,저녁에 방문,음식이 맛있어요,852,1
1395055395,노을 다락방54,"삼선동에 오랫동안 거주하면서 ‘한성대역에는 왜 마라탕집이 없을까!!’ 생각했었어요…! 성신여대나 대학로까지 나가야 마라탕을 먹을 수 있어서 항상 아쉬웠는데 집 근처에 마라탕집이 생겨서 정말 행복해요☺️ 다복향을 발견한 뒤로 언제 한 번 방문해야지 하다가 이제서야 가봤네요.. 알바 끝나고 마라탕이 진짜 먹고 싶어서 포장하려고 들렀는데 남자 사장님께서 정말 친절하게 대해주셨어요!!! 그리고 포장 기다리는 동안에 아이스크림도 주셔서 맛있게 먹었어요~ 집에 와서 마라탕을 먹어봤는데 양도 푸짐했고, 1.5단계로 하니까 딱 적당히 얼얼해서 좋았어요! 가격 대비 양이 많고 재료들이 싱싱하다는 점과 이벤트로 소고기가 3,000원->1,000원이라서 놀랐어요! 앞으로도 종종 들릴게요 사장님✨✨",2024-01-07,"점심에 방문, 포장·배달 이용, 대기 시간 바로 입장, 일상, 혼자",음식이 맛있어요,15,1
1395055395,리루티,좋아요 친절해요!!,2024-01-05,"점심에 방문, 예약 없이 이용, 대기 시간 바로 입장, 일상, 지인・동료",음식이 맛있어요,673,4
1395055395,0ㅇㅁㅇ0,진짜 맛있어요!!,2024-01-04,"점심에 방문, 예약 없이 이용, 대기 시간 바로 입장, 일상, 혼자",음식이 맛있어요,13,1
1395055395,당녀,"가서 직접 포장해왔어요~^^!배달 했을 때와 마찬가지로 포장 역시나 꼼꼼하게 잘해주시고~ 친절하시고..신선하고 맛도 좋고~!!!여사장님, 남자사장님 친절하시고..집에 오는 내내 행복을 들고 오는 줄~^^ 맛있는 마라탕 아이들과 기분좋게 먹어 0키로 칼로리 된것 같아요~^^감사합니다~",2024-01-03,"저녁에 방문, 예약 없이 이용, 대기 시간 바로 입장, 가족모임, 아이",음식이 맛있어요,1555,8
1395055395,kekekeee,너무 맛있게 먹었습니다,2023-12-30,"저녁에 방문, 예약 없이 이용, 대기 시간 바로 입장, 데이트, 연인・배우자",음식이 맛있어요,141,1
1395055395,폼푸00,학교 앞이라 자주가는 마라탕집!사장님도 친절하시고 고기 추가 천원이라는 좋은 금액이라 더 자주 찾게 됩니다,2023-12-28,"저녁에 방문, 예약 없이 이용, 대기 시간 바로 입장, 일상, 혼자",음식이 맛있어요,9,1
1395055395,쫑아2276,고기도 이벤트로 천원하고 배달도 같이 하시는거 같던데 주방도 깨끗하고 늦게 가서 포장 안되는줄 알았는데 포장도 해주신다고 하시고 친절하고 너무 맛있었어요👍🏻,2023-12-24,"밤에 방문, 포장·배달 이용, 대기 시간 바로 입장, 일상, 연인・배우자",음식이 맛있어요,19,1
1395055395,kyc****,마라탕,2023-12-15,점심에 방문,특별한 메뉴가 있어요,2581,2
1395055395,리루티,늘 친절하고 야채나 다른 재료들이 신선해요!,2023-12-14,"점심에 방문, 예약 없이 이용, 대기 시간 바로 입장, 일상, 지인・동료",친절해요,673,3
1395055395,현이9668,"면세점 갔다가 마라탕 먹고싶어 특별히 방문했어요, 예전에 갔었는데 사장님이 친절하고 또  너무 맛있어서 일부러 갔어요, 자주 생각나는 맛이에요~다음에도 또 올게요~",2023-12-12,"점심에 방문, 예약 없이 이용, 대기 시간 바로 입장, 일상, 혼자",친절해요,9,5
1395055395,jia****,마시써요👍👍,2023-12-12,점심에 방문,음식이 맛있어요,8,3
1395055395,당녀,말해뭐해요~^^ 너무 맛있어요~♡1.2단계는 아이들꺼! 2.5단계는 어른꺼!예전에 2단계먹었었는데.. 그것보다 얼큰하고 알싸한게 입안에 남는 것이좋으네요~ 땀샘 열림~^^;;친절한 여사장님 말씀으로는 3단계는 불닭볶은면 먹을 정도라고 하니~ 잘드시는 분들은 추천요~^^!ㅎ미니전은 매운 맛을 중화시켜주는 그런 튀김 맛이었어요^^이것 또한 좋으네요~ 크기는 성인 남자 손 크기만해요~간장에 찍어먹으니 맛있어요~👍,2023-12-03,"저녁에 방문, 예약 없이 이용, 대기 시간 바로 입장, 일상, 아이",음식이 맛있어요,1555,7
1395055395,당녀,쟤료가 엄청 신선하고 종류도 많아요~^^ 아이들과 먹을거라~ 항상 믿고 먹어요~♡조리도 너무 맛있게 나와요~ 진짜 친절한 여 사장님 집으로 저희 둥이들 보내야할듯해요~ㅎㅎ 마라탕 너무 좋아하네요~^^1.2단계 알아서 맞춰주시는.. 꼬치 종류도 골라 먹을 수 있게  많은데.. 특히 새우 크기가 큼직하니 맛나요~~^^!,2023-11-23,"저녁에 방문, 예약 없이 이용, 대기 시간 바로 입장, 가족모임, 아이",음식이 맛있어요,1555,5
1395055395,haribo91,친구 추천으로 방문했어요 땅콩소스 인상적입니다 ㅎㅎ,2023-11-20,"저녁에 방문, 예약 후 이용, 대기 시간 바로 입장, 친목, 친구",음식이 맛있어요,138,1
1395055395,ksl10,마라탕 맛있어용식후 아이스크림 있는 곳은 처음봣어요자주 올꺼 같습니다,2023-11-14,점심에 방문,음식이 맛있어요,86,1
1395055395,해은57,맛있어요,2023-11-13,저녁에 방문,음식이 맛있어요,456,2
1395055395,도란도란674,맛있어요,2023-11-13,저녁에 방문,특별한 메뉴가 있어요,469,2
1395055395,당녀,쟤료가 푸짐하고 너무 맛있어요~매운거 잘 못드시는 어른들 2단계 얼큰하고 좋음요~매장 깨끗!청결!친절! 모두 갖춘곳 입니다~ 울동네 마라탕집~중 최고~오!!!👍👍👍,2023-11-13,저녁에 방문,음식이 맛있어요,1555,4
1395055395,맛있는거조아함,재료담다가 떨어뜨려서 너무 죄송했는데 사장님께서 괜찮다고 해주셔서 정말 감사했습니다! 가성비도 너무 좋고 다른 곳은 12000원 나올곳인데 9000원 밖에 안나왔어요 이벤트 중이라 더 저렴한 것 같아요!!! 맛도 정말 맛있고 마늘맛이 났는데 그래서 저는 더 좋았습니다 한국인 맞춤인것 같아요 또 오겠습니다 잘먹었습니다!!,2023-11-10,점심에 방문,음식이 맛있어요,25,1
1395055395,현이9668,"오늘도 맛집투어 하고있어요마라샹궈에 전 하나 주문사장님이 매운 맛 못먹는걸 알고 매운맛 조정해줬어요,센스쟁이에요~다음주도 예약입니다.ㅋ ㅋ강추",2023-11-07,점심에 방문,음식이 맛있어요,9,4
1395055395,한토리22,마라와 땅콩소스맛이 달 어우러진 국물의 마라집입니다:)여기 얼얼한거 싫어하신 분들이 오시면 좋울 것 같아요 마유는 셀프코너에 따로 있어서 원하는 만큼 넣어 드실 수 있어요!후식으로 아이스크림도 서비스로 주는 착한 마라집👍👍,2023-11-05,"점심에 방문, 예약 없이 이용, 대기 시간 바로 입장, 데이트, 연인・배우자",음식이 맛있어요,16,1
1395055395,Kb1207,최고,2023-11-02,"점심에 방문, 대기 시간 바로 입장, 일상, 아이",음식이 맛있어요,1049,1
1395055395,jia****,역시 믿고 먹는 다복향  사진상에서는 맛없어보이지만 🤭실제로는 맛있어요  배달로만시켜먹다가 두번째로 매장에서먹엇는데 매장은여전히 깨끗하네요 오래오래 해주세요 사장님,2023-10-30,점심에 방문,음식이 맛있어요,8,2
1395055395,당녀,아이들과 함께 세번째로 간 다복향~! 울동네 이렇게 집처럼 편하게 맛있게 먹을수 있는 마라탕 집이 생겼다는건  진심 행운~^^아이들이 매주 가자고  할 정도로 맛도 있고 후식으로 아이스크림도 서비스로 주시니~ goooooooood!!!혼밥하기도 너무 좋아요~👍그리고 엄청 친절하심요~^^!,2023-10-28,저녁에 방문,음식이 맛있어요,1555,3
