place_id,nickname,content,date,situations,keywords,review_count,visit_count
1392377008,yangsida,고기맛있어요 구워주셔서편해요,2024-12-18,"저녁에 방문, 예약 후 이용, 대기 시간 바로 입장, 친목",음식이 맛있어요,577,1
1392377008,il****,강추입니다! 고기 정말 맛나요,2024-12-13,"저녁에 방문, 예약 후 이용, 대기 시간 바로 입장, 회식, 지인・동료",음식이 맛있어요,117,1
1392377008,다람잉26,예전에는 탕도 주셨던것 같은데 없어졌네용? (안간지 사실 좀 오래되서 ㅋㅋㅋㅋ)역시나 고기도 맛있고 사이드도 맛있었습니다 :),2024-12-12,"저녁에 방문, 예약 후 이용, 대기 시간 바로 입장, 친목, 친구",음식이 맛있어요,182,1
1392377008,bada777th55,고기 질 아주 좋았어요,2024-11-25,"저녁에 방문, 예약 없이 이용, 대기 시간 바로 입장, 친목, 친구",음식이 맛있어요,439,1
1392377008,트리플다이나믹,항상 깔끔하게 구워주시고 껍데기랑 된장술국 맛나게 잘 먹었어요~,2024-11-09,"점심에 방문, 예약 후 이용, 대기 시간 바로 입장, 일상, 연인・배우자, 아이",음식이 맛있어요,334,1
1392377008,123409876,굳,2024-10-18,"저녁에 방문, 예약 없이 이용, 대기 시간 바로 입장, 친목, 친구",,570,2
1392377008,sea****,,2024-10-05,"저녁에 방문, 예약 없이 이용, 대기 시간 바로 입장, 데이트, 연인・배우자",음식이 맛있어요,590,1
1392377008,미스터샨샤인,넘 맛있어용,2024-10-03,"점심에 방문, 예약 후 이용, 대기 시간 바로 입장, 친목, 친구",음식이 맛있어요,65,1
1392377008,gin****,최고의 고기집!!!,2024-10-02,"저녁에 방문, 예약 후 이용, 대기 시간 바로 입장, 회식, 지인・동료",단체모임 하기 좋아요,21,1
1392377008,고기도먹어본놈이먹는다,삼겹2인 된장술밥사장님이 직접 구워주시는데 편하고 맛있게 먹음된장술밥도 정말 맛남반찬들이 고기랑 잘 어울림!!!전반적으로 매우 만족또 올 예정,2024-09-22,"점심에 방문, 예약 없이 이용, 대기 시간 바로 입장, 데이트, 연인・배우자",음식이 맛있어요,80,1
1392377008,By_Chan,항상 갈때마다 맛있고 친절하신 곳 !! 주차도 편하고 올때마다 기분좋은 곳입니다!! 추천!!👍👍👍,2024-09-21,"저녁에 방문, 예약 없이 이용, 대기 시간 바로 입장, 일상",친절해요,60,1
1392377008,license,반찬이 맛있어요,2024-09-10,"저녁에 방문, 예약 없이 이용, 대기 시간 바로 입장",음식이 맛있어요,620,4
1392377008,신2812,항상 지나가다 사람들이 많아서 눈여겨봄. 맛있는 부산스타일 삼겹살집이에요~,2024-08-25,"저녁에 방문, 예약 없이 이용, 대기 시간 바로 입장, 일상, 연인・배우자, 아이",음식이 맛있어요,28,1
1392377008,우키키92,굿,2024-08-25,점심에 방문,친절해요,2713,3
1392377008,msso801,고기의 맛ㅇㅣ 좋았어요삼겹살 2인 목살1인직접 고기 알맞게 구워주니 고기 타는거 신경 안쓰고 이야기할 수 있어 좋앗음비빔냉면도 시켜먹어봤는데 고기가 배부려서다못 먹고 나옴ㅋㅋ전반적으로 좋았음밑반찬 파무침. 도토리냉국?등 구성 좋음,2024-08-22,저녁에 방문,음식이 맛있어요,324,1
1392377008,지훈맘27,부모님과 함께 예약후 방운했는데 고기도 맛있게 구워주셔서 잘 먹었습니다밑반찬도 깔끔하게 맛났어요.냉면 사진이 빠졌네요^^다음에 또 방문하겠습니다,2024-08-17,"점심에 방문, 예약 후 이용, 대기 시간 바로 입장, 가족모임, 연인・배우자, 아이, 부모님",음식이 맛있어요,101,1
1392377008,밍크 인플루언서,"💜 삼덕식당국내산 생삼겹살 구워주는 노원역 고기집.✅️ 직접 구워주셔서 편하게 먹을 수 있어요.✅️ 다양한 소스와 밑반찬이 있어서 편해요.✅️ 상추와 파채, 마늘 등은 셀프바에서 편하게 리필이 가능해요.✅️ 멜젓에 고기 찍먹하면 술이 꿀꺽 넘어가요.",2024-08-09,"저녁에 방문, 예약 없이 이용, 대기 시간 바로 입장, 비즈니스, 지인・동료",고기 질이 좋아요,4272,1
1392377008,달lee,언제나 믿먹 삼덕식당! 직접 구워주시고 무엇보다 고기 냉면 묵사발 김치 밑반찬 모두모두 맛있어요!!,2024-08-09,"점심에 방문, 예약 없이 이용, 대기 시간 바로 입장, 친목, 친구",직접 잘 구워줘요,2235,4
1392377008,dhtnals1001,진짜 맛있음 삼덕식당 최고❤️‍🔥,2024-08-01,"저녁에 방문, 예약 후 이용, 대기 시간 바로 입장",단체모임 하기 좋아요,2179,2
1392377008,로드맨19,굿,2024-07-30,"저녁에 방문, 예약 없이 이용, 대기 시간 바로 입장, 데이트, 연인・배우자",음식이 맛있어요,1585,1
1392377008,lim****,좋아요,2024-07-29,"저녁에 방문, 예약 없이 이용, 대기 시간 바로 입장, 가족모임, 친척・형제",매장이 넓어요,2502,1
1392377008,딸바보빵일,고기가 맛나요,2024-07-27,"저녁에 방문, 예약 없이 이용, 대기 시간 바로 입장, 일상, 연인・배우자",음식이 맛있어요,432,1
1392377008,Sunny skin,고기도 너무 맛나고 인원이 많아서 정신없었는데도 고기도 잘구워주시고 덕분에 즐거운 모임이 됏네요~사장님 정신없게 해드려 좀 죄송했어요😅여기 가끔 가던곳이라 모임장소로 잡았는데 예약때보다  인원이 좀 많이 늘어서 정신없었는데도 감사했네요~결제금액대비 서비스가 전혀 없는게 조금아쉽긴했지만 잘먹었습니다.번창하세요,2024-07-20,"저녁에 방문, 예약 후 이용, 대기 시간 바로 입장, 친목, 지인・동료",음식이 맛있어요,11,1
1392377008,올리브5172,가끔 가서 된장찌개 먹는데 맛있어요,2024-07-13,"점심에 방문, 예약 없이 이용, 대기 시간 바로 입장, 일상, 지인・동료",음식이 맛있어요,1067,7
1392377008,SUNs,음식도깔끔하고고기도맛있고~~좋아요~~~굿굿,2024-07-05,"점심에 방문, 예약 없이 이용, 대기 시간 바로 입장, 친목, 지인・동료",음식이 맛있어요,1231,12
1392377008,sms2595,맛잇어요,2024-06-26,저녁에 방문,음식이 맛있어요,1175,4
1392377008,spr****,여기고기맛있어요,2024-06-16,저녁에 방문,,1137,3
1392377008,친절맨65,굿,2024-06-14,점심에 방문,음식이 맛있어요,1073,1
1392377008,소소한빌런,구워주셔서 넘 편하고 맛있게 잘 먹었습니다.,2024-06-13,"점심에 방문, 예약 없이 이용, 대기 시간 바로 입장, 데이트, 연인・배우자",매장이 넓어요,460,1
1392377008,문어9253,좋아용,2024-06-04,"저녁에 방문, 예약 없이 이용, 대기 시간 바로 입장, 친목, 친구",음식이 맛있어요,478,1
1392377008,규디이,회식 장소로 들렸습니다!돼지고기는 직접 구워주시고 소고기는 직접 굽는 방식이에요!반찬 잘 나오고 특히 파채가 맛있었어요삼겹살이랑 소고기 둘다 퀄리티 괜찮았어요!다만 단체로가서 20만원치 넘게 먹었는데 작은 서비스 하나  없는건 조금 아쉬운 정도?ㅎㅎ그래도 맛있게 잘 먹었습니다!,2024-06-01,"저녁에 방문, 예약 후 이용, 대기 시간 바로 입장, 회식, 지인・동료",음식이 맛있어요,490,1
1392377008,발록84,맛있게 잘 먹었습니다,2024-05-30,점심에 방문,음식이 맛있어요,1871,6
1392377008,서현맘6876,좋아요!,2024-05-25,"저녁에 방문, 예약 없이 이용, 대기 시간 10분 이내, 데이트, 친구",음식이 맛있어요,1160,1
1392377008,도넛싫어,오가며 보니 항상 사람이 많길래 가봤어요. 맛있더라고요.,2024-05-10,"저녁에 방문, 예약 후 이용, 대기 시간 바로 입장, 일상, 연인・배우자",음식이 맛있어요,466,1
1392377008,뜌우비,간단한 저녁식사겸해서 방문하였습니다 영업시간10시까지인지 모르고 방문했는데 그냥 술없이 밥만먹으려고 방문햇던 거라서 괜찮을거 같아서 방문했습니다 고기를 구어주시는서비스는 너무 좋았습니다그렇지만 시간에 쫒기듯 기름 다튀게 구어주시고 사람이 계속 바뀌어가며 구어주시는데 시간이 별로없어서 빠르게 구어드렷다 하면서 눈치를 주는거 같더라구요 ...된장찌개도 호박도 안익어있고 ...그렇게 기분상한채로 식사를하고 있는 와중에 다른테이블을 치우고 테이블치운 그릇들을 가져가시면서 저희 테이블로와서는 라스트오더인데 더 시킬거 있냐고 물어보시는데 빨리 그냥 먹고나갈생각밖에 안들더라구요 20분만에 식사를하고 나왔네요....재방문 안할꺼같아요 기분좋게 밥먹으러갔다가 기분만 상하고 왔어요.,2024-05-01,"저녁에 방문, 예약 없이 이용, 대기 시간 바로 입장, 데이트, 일상, 연인・배우자",음식이 빨리 나와요,56,1
1392377008,여유있게멀리보자구,맛있어요. 고기질이 좋아요.,2024-04-29,"저녁에 방문, 예약 없이 이용, 대기 시간 바로 입장, 일상, 친구",음식이 맛있어요,1370,1
1392377008,운마,조아조아 삼덕식당,2024-04-27,"점심에 방문, 예약 없이 이용, 대기 시간 30분 이내, 데이트, 지인・동료",음식이 맛있어요,696,1
1392377008,ii****,고기  구워주는게 맘에들었고 맛은 말할것도 없이 맛있네요,2024-04-27,점심에 방문,음식이 맛있어요,973,1
1392377008,123409876,good,2024-04-26,"저녁에 방문, 예약 없이 이용, 대기 시간 바로 입장, 친목, 친구",음식이 맛있어요,570,1
1392377008,김수현3024,고기 많이 들어가있고 맛있어요,2024-04-25,점심에 방문,음식이 맛있어요,337,1
1392377008,san****,구워주시니까 편하게 잘 먹었습니다!,2024-04-18,"저녁에 방문, 예약 후 이용, 대기 시간 바로 입장, 친목, 지인・동료",매장이 넓어요,13,1
1392377008,흥짱25,좋아요.고기가 두꺼워서 굽기 힘들수 있는데 직원분들이 직접 구워 적당할때 먹어두 된다고 이야기도 해주셔서 먹기 편하고 좋았습니다.,2024-04-18,"점심에 방문, 예약 없이 이용, 대기 시간 바로 입장, 데이트, 연인・배우자",,3226,1
1392377008,아름다운 삶57,고기가 맛있어요,2024-04-17,"저녁에 방문, 예약 없이 이용, 대기 시간 바로 입장, 데이트, 연인・배우자",음식이 맛있어요,1537,1
1392377008,눈사람786,먹느라 정신 없어서 술사진밖에 없어요 존맛,2024-04-04,"저녁에 방문, 예약 후 이용, 대기 시간 바로 입장, 일상, 회식, 비즈니스, 지인・동료",음식이 맛있어요,80,1
1392377008,호이호이31,고기 잘옷굽는 일인 ㅠ직접구워주시니 너무좋습니다.고기질도 좋고 찬도 깔끔하게 잘나와요,2024-04-03,"저녁에 방문, 예약 없이 이용, 대기 시간 바로 입장, 회식, 지인・동료",음식이 맛있어요,524,1
1392377008,원숭짱,좋아요,2024-04-02,저녁에 방문,고기 질이 좋아요,3512,1
1392377008,달lee,삼겹살은 삼덕식당이죠! 말해뭐해....,2024-04-01,"점심에 방문, 예약 없이 이용, 대기 시간 바로 입장, 일상, 연인・배우자",단체모임 하기 좋아요,2235,3
1392377008,채원아빠90,삼겹살 추천이요.,2024-03-30,"저녁에 방문, 예약 후 이용, 대기 시간 바로 입장, 친목, 지인・동료",고기 질이 좋아요,441,1
1392377008,god****,ㅇ,2024-03-29,점심에 방문,,1155,1
1392377008,kissmant,직원분이직접구워줘서편하게먹을수있네오,2024-03-24,"저녁에 방문, 예약 없이 이용, 대기 시간 바로 입장, 일상, 친척・형제",반찬이 잘 나와요,529,1
1392377008,choco16,간만에 갔는데 꽃등심은 그냥 가격대비 무난했고삼겹살이 좀 퍽퍽하더라구요. .,2024-03-23,"저녁에 방문, 예약 없이 이용, 대기 시간 바로 입장, 일상, 연인・배우자, 친구",,1237,2
1392377008,1004uni1004,셀프바를 이용 못해서 아쉬웠어요. 저녁준비 재료를 해놔서 그런지 ? 갖다준다고 하는데 그게 더 불편했어요. 고기는 구워주시니 편합니다,2024-03-17,"점심에 방문, 예약 없이 이용, 대기 시간 바로 입장",,1472,1
1392377008,너가최고,고기도 맛있고 무엇보다 반찬이 잘 나와서 너무 만족스러워요!,2024-03-17,"점심에 방문, 예약 없이 이용, 대기 시간 바로 입장, 일상, 연인・배우자",음식이 맛있어요,924,1
1392377008,새치미65,,2024-03-09,"점심에 방문, 예약 후 이용",음식이 맛있어요,1358,1
1392377008,tea****,너무 맛있게 잘 먹었어요!! 다음에 또 갑니다!!,2024-03-03,점심에 방문,음식이 맛있어요,756,1
1392377008,dms****,고기 직접 구워주셔서 편했어요~고기 질도 엄청 좋아서 소금에만 찍어먹어도 맛있었습니다. 노원 갈 때 종종 들릴 것 같아요!,2024-02-25,"저녁에 방문, 예약 후 이용, 대기 시간 바로 입장, 친목, 지인・동료",매장이 넓어요,35,1
1392377008,산빛92,고기 구워줘서 좋고요.   품질이 좋네요.^^,2024-02-25,"점심에 방문, 예약 후 이용, 대기 시간 바로 입장, 친목, 지인・동료",음식이 맛있어요,51,1
1392377008,대박7386,고기 구워서 주는 삼덕식당 👍 👍 👍 👍 👍 친절한 식당,2024-02-23,"점심에 방문, 예약 후 이용, 대기 시간 바로 입장, 친목, 지인・동료",음식이 맛있어요,145,1
1392377008,dongnama68,맛이 좋아요. 친절하구,2024-02-20,"저녁에 방문, 예약 후 이용, 대기 시간 바로 입장, 일상, 친구",음식이 맛있어요,2011,1
1392377008,하늘만큼땅만큼77,좋아요,2024-02-15,"저녁에 방문, 대기 시간 바로 입장, 친목, 친구",음식이 맛있어요,2174,5
1392377008,세니5172,추천받아 갔는데 맛있었어요~ 삼겹살이랑 항정살 추천이요!,2024-02-15,"저녁에 방문, 예약 후 이용, 대기 시간 바로 입장, 친목, 친구, 지인・동료",음식이 맛있어요,118,1
1392377008,sun****,두번은 안가고싶은곳,2024-02-15,"점심에 방문, 대기 시간 바로 입장, 가족모임, 지인・동료",,1587,1
1392377008,miso7370,맛있어요,2024-02-12,"저녁에 방문, 대기 시간 30분 이내, 데이트, 부모님, 친척・형제",음식이 맛있어요,526,1
1392377008,mis****,굿,2024-02-12,"저녁에 방문, 예약 없이 이용, 대기 시간 10분 이내, 친목, 친척・형제",특별한 메뉴가 있어요,961,1
1392377008,WOO15,"고기도 두껍고 맛있었어요.개인적으론 삼겹살보다 목살이 더 맛있었어요. 한가지 아쉬운점은 밑반찬이 조금 부실한감이 있었어요. 콩나물, 미나리같은게 추가되었으면 하는 바램입니다.",2024-02-12,"점심에 방문, 예약 후 이용, 대기 시간 바로 입장, 가족모임",음식이 맛있어요,1430,1
1392377008,hypeace,고기를 직접 구워주셔서 편하게 먹고왔습니다. 직원분들도 너무 친절하세요.,2024-02-11,"점심에 방문, 예약 후 이용, 대기 시간 바로 입장, 데이트, 연인・배우자",친절해요,56,1
1392377008,kimfaction97,고기 질도 좋고 직접 구워주시니 일 없이 오로지 식사에 집중할수있는게 좋았습니다. 고기 맛집이라 다음에 또 오고싶은 곳이에요.,2024-02-04,"저녁에 방문, 예약 없이 이용, 대기 시간 바로 입장, 친목, 친구",음식이 맛있어요,690,1
1392377008,fok****,굿,2024-02-04,"점심에 방문, 예약 없이 이용, 대기 시간 바로 입장, 데이트, 연인・배우자",음식이 맛있어요,1168,1
1392377008,생선56,굿,2024-02-04,"점심에 방문, 예약 없이 이용, 대기 시간 바로 입장, 데이트, 연인・배우자",음식이 맛있어요,479,1
1392377008,my3920,매장이 넓고 고기 잘구워주셔서 좋았습니다삼겹살 맛있고 목살 엄청 부드러워요,2024-01-27,"점심에 방문, 예약 후 이용, 대기 시간 바로 입장",음식이 맛있어요,655,1
1392377008,올리브5172,반찬이 맛있어요,2024-01-13,"점심에 방문, 예약 없이 이용, 대기 시간 바로 입장, 일상, 친구",음식이 맛있어요,1067,6
1392377008,세실리86,모임이 있어사 미리 예약하고 갔는데 삼겹살도 토톰히고  직원이.맛나게 구워줘서 잘먹었습니다. 치즈계란찜도  치즈도 듬뿍이라 맛있네요. 담에.또 가겠습니다,2024-01-09,"저녁에 방문, 예약 후 이용, 대기 시간 바로 입장, 친목, 지인・동료",음식이 맛있어요,394,1
1392377008,hibabyeah,오랜만에 왔는데 고기 너무 맛있었습니다!! 👍🏻✨,2024-01-08,"저녁에 방문, 예약 없이 이용, 대기 시간 바로 입장, 데이트, 연인・배우자",음식이 맛있어요,1351,3
1392377008,Love you JH,올때마다 음식도 맛있고직원들이 참 친절하고 일을 너무 잘하는거 같애요~!젓가락 하나 떨어졌는데 저~기서 소리듣고바로 새 젓가락 가져다 주시는 센스👍고기도 맛잇게 구워주셔서 좋은데직원들까지 다 잘해주시니 늘 가면 기분이 좋아지는 고깃집입니다~ 또 방문할게요☺️,2024-01-07,"저녁에 방문, 예약 없이 이용, 대기 시간 바로 입장, 가족모임, 아이",음식이 맛있어요,425,1
1392377008,걷고또걷고,잘구워주셔서 고기 맛있게 먹었구요치~~~~즈가 듬뿍들어간 계란찜도 신나게 먹었구요눈이 날리는날  곁들임으로 주신 따뜻~~한 어묵국은 센스짱이었습니다,2024-01-06,"저녁에 방문, 예약 없이 이용, 대기 시간 바로 입장, 가족모임, 연인・배우자, 아이",음식이 맛있어요,81,1
1392377008,아이스큐브라떼,와~여기 찐 맛있어요~고기 직접 구워줘서 친구와 좋은 시간 보냈어요~~완전 👍👍👍된장국에 밥 말아 준 것도 맛나요~~꼭 드셔 보세요~~재방문 또 할꺼예요~🤗🤗🤗,2023-12-27,"점심에 방문, 예약 없이 이용, 대기 시간 바로 입장, 일상, 친구",매장이 넓어요,1853,1
1392377008,choisde,굿,2023-12-23,저녁에 방문,음식이 맛있어요,537,2
1392377008,식사는잡쉈나,덕분에 송년회 잘하고 맛있게 먹었습니다ㅎㅎ,2023-12-23,저녁에 방문,음식이 맛있어요,25,1
1392377008,남달라3620,춥디 추운날  방문해서 맛있게 먹고 왔어요~ 고기는 구워 주시니 무조건 맛있었구요 볶음밥은 철판에 바짝 볶은 느낌보다는 비빈느낌에 가까워서 아쉬웠어요~ 계란찜은 간이 약해서 아주 약간 느끼했어요~,2023-12-21,"점심에 방문, 예약 후 이용, 대기 시간 바로 입장, 일상, 아이",직접 잘 구워줘요,248,1
1392377008,삥핑삥2,맛잇어요,2023-12-16,"저녁에 방문, 예약 없이 이용, 대기 시간 바로 입장, 데이트, 연인・배우자",음식이 맛있어요,75,1
1392377008,hoy****,굿,2023-12-15,"저녁에 방문, 예약 후 이용",음식이 맛있어요,971,1
1392377008,stepday,"직접 구워주시고, 고기의 질이 너무 좋아서차비를 투자 햔 가치가 있다고 생각을 해요.역씨.. 삼덕식당 상계점 굿굿이에요~~",2023-12-10,"저녁에 방문, 예약 없이 이용, 대기 시간 바로 입장, 일상, 지인・동료",음식이 맛있어요,249,2
1392377008,동굴안구르미,요좋아요,2023-12-02,"저녁에 방문, 대기 시간 바로 입장, 친목, 친구",음식이 맛있어요,690,1
1392377008,김6052,반찬구성이 좋고 리필도 자유롭게 할 수 있어서 좋았습니다.   직접 구워주셔서 편햇습니다,2023-12-02,"저녁에 방문, 예약 후 이용, 대기 시간 바로 입장, 일상, 지인・동료",음식이 맛있어요,51,1
1392377008,모카3,돼지고기맛집종류별로 가격 착하게 먹는집,2023-12-01,"저녁에 방문, 예약 후 이용, 대기 시간 바로 입장, 친목, 지인・동료",음식이 맛있어요,307,2
1392377008,dbs****,굿,2023-11-28,점심에 방문,음식이 맛있어요,2129,1
1392377008,spr****,삼굡살맛남,2023-11-26,점심에 방문,,1137,2
1314429420,Ohnioes,감성적인 엑틴한 분위기가 있고 맛있는 안주와 함께최근에 나온 다래맛 새로 소주도 있어서 아주 좋아요!!!,2025-04-05,"밤에 방문, 예약 없이 이용, 대기 시간 바로 입장, 데이트, 연인・배우자",음식이 맛있어요,47,1
1314429420,곽단영,분위기도 좋고 맛있어요,2025-03-29,"저녁에 방문, 예약 없이 이용, 대기 시간 바로 입장, 데이트, 친구",매장이 청결해요,24,1
1314429420,신영훈59,미숫가루 소주 생각했던것보다 훨신 맛있어요!,2025-03-03,"저녁에 방문, 예약 없이 이용, 대기 시간 바로 입장, 데이트, 연인・배우자",음식이 맛있어요,15,1
1314429420,fbr****,미숫가루 소주가 맛있어요.! 다음에 또 오고 싶어요.ᐟ,2025-02-28,"저녁에 방문, 예약 없이 이용, 대기 시간 바로 입장, 친목, 친구",음식이 맛있어요,1,1
1314429420,여우야뭐하니59,인테리어가 예쁘고 분위기가 너무 좋아요!!맛있는 메뉴도 많아서 즐겁게 식사했습니다ㅎㅎ,2025-02-23,"밤에 방문, 예약 없이 이용, 대기 시간 바로 입장, 친목, 친구",음식이 맛있어요,12,1
1314429420,김유찬29,미숫가루 소주 강추!기본안주 맛있고 시끄럽지 않고 분위기가 좋아요,2025-02-22,"밤에 방문, 예약 없이 이용, 대기 시간 바로 입장, 친목, 친구",기본 안주가 좋아요,36,2
1314429420,찌니이이이잉312,ㅇ,2025-02-21,저녁에 방문,,2578,1
1314429420,99****,방문할때마다 항상 친절하게 대해주셔서 감사합니다오늘도 맛있게 잘 먹고가요👍🏻💗💗💗,2025-02-12,"밤에 방문, 예약 없이 이용, 대기 시간 바로 입장, 데이트, 친구",친절해요,48,1
1314429420,346****,맛있어요! 화장실이 깨끗하고 손 씻을 때 물이 차갑지 않아서 좋아요,2025-02-11,"저녁에 방문, 예약 없이 이용, 대기 시간 바로 입장, 친목, 친구",단체모임 하기 좋아요,25,1
1314429420,김밥4616,인테리어는 좋았고밀푀유나베는 맛있었고통삼겹마늘볶음은  중간석쇠두부김치는 꽝,2025-02-08,"저녁에 방문, 예약 후 이용, 대기 시간 바로 입장, 친목, 친척・형제",인테리어가 멋져요,27,1
1314429420,KKKang3,맛있고 분위기도 좋아요! 또 방문할게요~,2025-01-27,"저녁에 방문, 예약 후 이용, 대기 시간 바로 입장, 친목, 연인・배우자, 친구, 지인・동료",인테리어가 멋져요,15,1
1314429420,jiq****,넘맛잇어여,2025-01-05,"밤에 방문, 예약 없이 이용, 대기 시간 바로 입장, 친목, 친구",음식이 맛있어요,14,1
1314429420,지아8348,음식이 너무 맛있고 직원 분들이 너무 친절하세요!!! 재방문 의사 있어요!! !!😆😆,2025-01-01,"밤에 방문, 예약 없이 이용, 대기 시간 바로 입장, 친목, 친구",음식이 맛있어요,2,1
1314429420,jih****,분위기 좋고 공간도 넓어 단체로 이용하기 좋네요 음식도 모두 맛있습니다😋,2024-12-27,"저녁에 방문, 예약 후 이용, 대기 시간 바로 입장, 친목, 친구",인테리어가 멋져요,72,1
1314429420,수아1538,술 한 잔 하기 좋아요~,2024-12-19,"저녁에 방문, 예약 없이 이용, 대기 시간 바로 입장, 친목, 친구",음식이 맛있어요,2244,1
1314429420,96s****,모츠나베의 대창이 좀 아쉬웠어요,2024-12-16,"밤에 방문, 예약 없이 이용, 대기 시간 바로 입장, 친목, 친구",매장이 청결해요,189,1
1314429420,쑥떡197,"안주 맛있고, 매장 쾌적하고 화장실 이용하기 편리해요서비스 잘 주셔서 좋았어요!",2024-11-28,"저녁에 방문, 예약 후 이용, 대기 시간 바로 입장, 회식, 지인・동료",음식이 맛있어요,63,1
1314429420,샤샤샤0808,오랜만에 방문했는데 여전히 메뉴도 다양하고 알차요~! 좌석도 넓어서 단체로 오기 너무 좋아요ㅎㅎ된장찌개 시켰는데 양도 많아서 공기밥 시켜서 된장술밥 만들어서 먹었어요ㅎㅎㅎ 주류도 다양하니깐 꼭 방문해보시길 바래요!!,2024-11-22,"저녁에 방문, 예약 없이 이용, 대기 시간 바로 입장, 친목, 친구",음식이 맛있어요,14,1
1314429420,ralaral,친구들이랑 왔는데 조용하고 너무 좋아요🥹🥹,2024-11-02,"밤에 방문, 예약 없이 이용, 대기 시간 바로 입장, 친목, 친구",매장이 청결해요,43,1
1314429420,우악악,요기는진짜 최고에요 너무맛있고 양도 엄청많아요 회장님댁 짱!!!!!!!!!!!!!!!!!!! 맨날오고싶다,2024-11-01,"저녁에 방문, 예약 없이 이용, 대기 시간 바로 입장, 데이트, 연인・배우자",특별한 메뉴가 있어요,48,1
1314429420,햄2689,안주 종류도 많고 인테리어도 멋져요!!,2024-11-01,"저녁에 방문, 예약 없이 이용, 대기 시간 바로 입장, 친목, 친구",음식이 맛있어요,85,1
1314429420,가옹이에오,미숫가루 소주 완전 맛있어요! 소주 더 추가해서 먹었는데 완전 술술들어갈 정도로 맛나게 먹었습니다! 그리고 콘치즈랑 간계밥이랑 같이 먹으면 꿀 조합니다👍🏻👍🏻,2024-10-30,"저녁에 방문, 예약 후 이용, 대기 시간 바로 입장, 친목, 친구",인테리어가 멋져요,124,1
