place_id,nickname,content,date,situations,keywords,review_count,visit_count
31253249,the best latte,풍기샐러드.옥수피자.해산물스튜.아보카도명란리조트주문한 음식 다맛있었는데 옥수피자가 적당한 달달함이 특색있고 맛있다,2025-03-05,"점심에 방문, 예약 없이 이용, 대기 시간 바로 입장, 친목, 친척・형제",음식이 맛있어요,247,1
31253249,심심라이프,"친구따라 왔다가 단골되서 6년째 단골 !! 할머니랑 가족들이랑 와도 사장님이 항상 친절하게 해주시니까 자주자주와요 사장님~~갈때마다 대접받는 기분에 감사해요 !! 앞으로도 쭉맛난 음식 해주세용ㅋ 요즘 날도 추워서 그런지, 웨이팅할때 쓰라구 손난로제공해주시고 난로 피워주셔서 ㅎㅎㅎ 하나도 안추웠어요 너무 감사해요 👍💛💛",2025-02-12,"저녁에 방문, 예약 없이 이용, 대기 시간 10분 이내, 친목, 친구, 지인・동료",음식이 맛있어요,2,1
31253249,poo****,매장 브레이크타임 7분 남겨두고 포장 기다리는데 그 한겨울에 바깥에서 기다리라고 함. 갈때마다 세상 불친절해서 이유가 잇겟거니 햇는데 진짜 다신 안가려고 함.,2025-02-10,"저녁에 방문, 포장·배달 이용, 대기 시간 바로 입장, 친목, 지인・동료",,15,1
31253249,zhujing12,좋아요,2025-02-09,저녁에 방문,음식이 맛있어요,2478,7
31253249,소피007,JMT,2025-01-30,"저녁에 방문, 예약 없이 이용, 대기 시간 바로 입장, 친목, 친구",음식이 맛있어요,20,1
31253249,오지지,,2025-01-25,"저녁에 방문, 예약 없이 이용, 대기 시간 바로 입장, 데이트, 연인・배우자",음식이 맛있어요,1355,1
31253249,kan****,믿고 먹는 최애 화덕피자집요~깔조네 샐러드^^넘 좋아요,2025-01-25,"점심에 방문, 예약 없이 이용, 대기 시간 바로 입장, 일상, 친구",음식이 맛있어요,926,6
31253249,부천역곡탑정형외과,깔조네 최강맛집!,2025-01-05,점심에 방문,음식이 맛있어요,234,1
31253249,별두리,굿,2024-12-26,저녁에 방문,음식이 맛있어요,2250,1
31253249,danzzan언니,매장은 협소해요.,2024-12-21,점심에 방문,,1075,1
31253249,iv****,"한결같이 맛있는 집 ^^물가가 올라서 아쉽지만 ,그래도 맛있어요 ^^",2024-12-08,"밤에 방문, 예약 없이 이용, 대기 시간 바로 입장, 나들이, 친구",친절해요,715,3
31253249,ssoocarat,솔직히 맛도 없고 성의도 없어요… 메뉴 보고 부라타 피자에 프로슈토가 들어있다고 써있어서 맛있을것 같아 포장 주문으로 시켰는데.. 받아보니 이건 프로슈토도 아니고 햄인데다가 저렇게 작은 양을 조각조각 짤라서 주는 성의 없음.. 맛도 없고 돈이 아까워요.. 다시 찾아가서 프로슈토 들어있다고 했는데 왜 햄이 들어있냐고 했더니 프로슈토피자가 아니라는 말만 반복.. 누가 내가 시킨걸 모르나요? 재료가 들어있다고 했는데 안들어있는게 문제지.. 그럼 재료 바꼈다고 인터넷 메뉴라도 업데이트 시키던가 전화했을때 미리 말이라도 해주던가요.. 기분나빠서 다시는 안시켜 먹을듯.,2024-12-01,"저녁에 방문, 포장·배달 이용",,6,1
31253249,러블리54,여기 오면 옥수피자는 먹고 가요~~~!!🌽달콤해서 맛있어요~! 명란 파스타도 굿!피클 많이 줘서 좋아요!✨,2024-11-21,"저녁에 방문, 예약 없이 이용, 대기 시간 바로 입장, 일상, 친구",친절해요,146,1
31253249,우히힝2,피크시간대에 가면 웨이팅 필수인 곳샐러드까지 맛있어요,2024-11-10,"점심에 방문, 예약 없이 이용, 대기 시간 10분 이내, 데이트, 친구",음식이 맛있어요,644,1
31253249,가오나시38,가격은 조금 부담이 되지만 피자 정말 맛있아요,2024-11-08,"점심에 방문, 예약 없이 이용, 대기 시간 바로 입장, 데이트, 연인・배우자",음식이 맛있어요,1358,1
31253249,rpa****,굳,2024-10-31,"점심에 방문, 예약 없이 이용, 대기 시간 바로 입장, 친목, 친구",음식이 맛있어요,1319,3
31253249,자작나무48,분위기도 좋고 뭘 시켜도 진짜 맛있어요,2024-10-20,"저녁에 방문, 예약 후 이용, 대기 시간 10분 이내, 친목, 지인・동료",음식이 맛있어요,2622,1
31253249,피티에,ㅈㅇㅇ,2024-10-20,"점심에 방문, 예약 없이 이용, 대기 시간 10분 이내, 데이트, 연인・배우자",음식이 맛있어요,2781,1
31253249,너티야,또또또또간집 ! 옥수동 화덕피자는 이곳으로 🤤,2024-09-28,"저녁에 방문, 예약 없이 이용, 대기 시간 바로 입장, 데이트, 연인・배우자",음식이 맛있어요,78,1
31253249,백자74,파스타 리조또 맛있어요,2024-09-28,점심에 방문,음식이 맛있어요,796,6
31253249,twinklewith,옥수 피자 도우가 맛있어요!,2024-09-22,저녁에 방문,음식이 맛있어요,588,1
31253249,jazzmate,,2024-09-03,"점심에 방문, 예약 없이 이용, 대기 시간 바로 입장",친절해요,3115,1
31253249,현모양처89,굿,2024-08-27,점심에 방문,음식이 맛있어요,1539,2
31253249,iv****,너무 맛있게 잘 먹었습니다한결같이 맛있는 코너키친,2024-08-27,"점심에 방문, 예약 없이 이용, 대기 시간 바로 입장, 친목, 지인・동료",친절해요,715,2
31253249,Michelle19,옥수동 가격들이 아무리 상향 평준화되었더라고 좀 너무하네요 여기 생겼을때부터 다닌 주민인데 매번 느꼈지만 오늘은 좀 심해서 리뷰남깁니다.. 까르보나라 면이 아무리 두꺼운 면이라고 해도 그렇지 면이 6가닥 들어가는게 말이됩니까? 베이컨조각 몇개 넣고 전부 버섯밖에 없는데 2만5천원 파스타에 면 6가닥은 좀 너무하네요.. 사이좋게 3가닥씩 먹었어요..둘이 가서 피자 파스타 하나씩 시켰는데 40키로 소식좌 친구랑 갔는데도 버섯만 남기고 다먹었어요.. 다른 리뷰에도 써있었는데 식기 청결도도 좀 신경쓰셔야 하고요. 앞접시에 속눈썹이 붙어있었어요. 테이블도 그래요. 2인이라 2인 테이블 주실거면 다른 테이블도 2인은 2인테이블에만 앉히셔야지 저희만 2인테이블인건 또 왜그랬답니까? 오늘 무척 실망스러운 식사였네요,2024-08-21,"점심에 방문, 예약 없이 이용, 대기 시간 바로 입장, 일상, 친구",,5,1
31253249,hyo****,너무 맛있어요! 웨이팅이 있을때가 있지만 기다려서 먹을만한 맛이에요. 파스타보단 피자가 마싯어요,2024-08-10,"저녁에 방문, 예약 없이 이용, 대기 시간 30분 이내, 친목, 친구",음식이 맛있어요,104,1
31253249,조블리여사,연애 시절 부터옥송에서 데이트 할 때 다녔던 코너 키친 지금도 그 자리에서 장사를 하고 있어서 너무 기뻐요. 그리고 언제나 가도 맛있는 요리를 먹을 수 있어서 너무 감동적입니다 이제는 둘이 아닌 둥이들이랑 4시 갈 수 있어서 너무 더 감동인 것 같아요.,2024-08-04,"점심에 방문, 예약 없이 이용, 대기 시간 바로 입장, 나들이, 아이",친절해요,276,1
31253249,Anonymousy,예전에 되게 맛있게 먹었던 기억이 있어서 시켜봤는데 뭔가 많이 리뉴얼됐네요.. 마늘 고추에서 풋내나서 아쉬웠습니다,2024-08-04,"아침에 방문, 예약 없이 이용, 대기 시간 바로 입장",건강한 맛이에요,8,1
31253249,구yh,피자집인데 양식집 같은? 맛있고 색다르네요.,2024-08-02,"점심에 방문, 예약 없이 이용, 대기 시간 바로 입장, 일상, 아이",음식이 맛있어요,825,1
31253249,한결같이기록하는한량,옥수수피자 맛있네요,2024-07-25,"저녁에 방문, 예약 없이 이용, 대기 시간 10분 이내, 일상, 연인・배우자",음식이 맛있어요,1617,1
31253249,의문의 째째,친절하고 맛도 좋았어요 딱 하나 아쉬운건 스테이크가 기름부위가 너무 많아 몹시 물컹;;;,2024-07-22,"저녁에 방문, 예약 없이 이용, 대기 시간 바로 입장, 친목, 친구",친절해요,18,1
31253249,Coconell,굳이 강남에서 가끔 먹으러 가는 맛집메뉴 하나하나 다 맛있어요포장해보니 맛이 떨어져 매장에서 먹는 것을 추천해요 https://youtube.com/shorts/RFWNoekDNKc?si=oFhmyLcKv6PsUDYe,2024-07-18,"저녁에 방문, 예약 없이 이용, 대기 시간 바로 입장, 친목, 친구",음식이 맛있어요,170,1
31253249,신선선,존맛이네요처음 피자 한입 먹자마자 눈이 2배 커졌음.식기의 청결은 ㅎㅌㅊ였지만 또 방문할 예정,2024-07-13,"점심에 방문, 예약 없이 이용, 대기 시간 10분 이내, 데이트, 연인・배우자",음식이 맛있어요,446,1
31253249,쪼쪼히,추천받고 간 맛집인데 징짜 너무 맛있어요!해산물도 진짜 많고 토마토 소스며 음식 하나하나 맛있어서 놀랬음.....,2024-06-22,"점심에 방문, 대기 시간 30분 이내, 나들이, 부모님, 친척・형제",인테리어가 멋져요,291,1
31253249,제트지은,진짜 맛있게 잘먹었습니다!맛도 분위기도 짱이에요!,2024-06-09,점심에 방문,음식이 맛있어요,997,1
31253249,with me52,피자 맛있어요,2024-05-24,"저녁에 방문, 예약 없이 이용, 대기 시간 바로 입장, 일상",재료가 신선해요,1726,2
31253249,ryu****,가격은 조금 쎈편이지만 맛은 있어요,2024-05-23,"점심에 방문, 예약 없이 이용, 대기 시간 바로 입장, 친목, 친구",음식이 맛있어요,243,1
31253249,애정파,오랜만의 방문. 여전히 맛있으나 퉁명스러운 느낌의 서빙,2024-05-18,"점심에 방문, 대기 시간 10분 이내",음식이 맛있어요,1184,2
31253249,닛시43,"마약 옥수수 피자 진짜 맛있어요이번에 마르게리따도 처음 먹어 봤는데, 이것도 맛있네요다른 피자 먹을 때는 도우 부분을 남기게 되는데, 여기는 화덕으로 구워서 그런지 도우가 너무 맛있어요",2024-05-06,"점심에 방문, 예약 없이 이용, 대기 시간 30분 이내, 친목, 친구, 친척・형제",음식이 맛있어요,465,5
31253249,bberet,"다시 가고 싶은 맛집, 더코너키친 옥수동입니다.이베리코 스테이크 400g과 샐러드. 레드와인 한잔을 먹었습니다. 부드러운 육질에 익은 레몬드레싱이 담백하면서도 식감이 좋은 요리를 제공합니다. 불판의향과 레드와인 한잔이 최고의 조화였습니다",2024-05-02,"점심에 방문, 예약 없이 이용, 대기 시간 바로 입장, 일상, 혼자",음식이 맛있어요,117,1
31253249,its****,가격은 좀 있지만 맛나요👍🏻,2024-04-26,"저녁에 방문, 예약 없이 이용, 대기 시간 바로 입장, 일상, 부모님",음식이 맛있어요,549,3
31253249,zhujing12,좋아요,2024-04-24,"저녁에 방문, 예약 없이 이용, 대기 시간 바로 입장, 데이트, 친구",음식이 맛있어요,2478,6
31253249,현모양처89,동생 추천으로 온곳~ 맛있어요~수제 맥주도 한몫 합니다~,2024-04-22,점심에 방문,음식이 맛있어요,1539,1
31253249,iv****,한결같은 맛 너무 좋아요,2024-04-22,"점심에 방문, 예약 없이 이용, 대기 시간 바로 입장, 친목, 친구",음식이 맛있어요,715,1
31253249,휘게지기,,2024-04-18,"점심에 방문, 예약 후 이용, 대기 시간 바로 입장, 친목, 지인・동료",음식이 맛있어요,3945,1
31253249,DDUZI,공간은 협소하지만 맛은 일품!,2024-04-13,"점심에 방문, 예약 없이 이용, 대기 시간 1시간 이상",음식이 맛있어요,326,1
31253249,조를림,다맛있어요 ㅠㅠ 테라스같은 느낌의 바깥쪽 테이블 앉았는데 날씨만끽하기에 딱 ㅠㅠㅠㅠ 조용한 골목에있어서 더 좋은곳 맛있게잘먹었어요,2024-04-12,"저녁에 방문, 예약 없이 이용, 대기 시간 바로 입장, 친목, 친구",음식이 맛있어요,285,1
31253249,starryNiet,"갈 때마다 만족스러운 코너키친, 오늘도 너무 맛있게 먹고 왔습니다. 저희 어머니께서 짠 음식을 잘 못 드셔서 베이컨이 들어간 피자를 시킬 때 조금 걱정을 했는데 직원분께 이런 말씀을 드렸더니 바로 신경 써주셔서 어머님께서도 맛있게 피자를 드셨습니다. 계란이랑 피자가 너무나도 잘 어울리네요~ 라자냐도 바질향이 많이 나고 너무 맛있었습니다.",2024-04-08,"저녁에 방문, 예약 없이 이용, 대기 시간 바로 입장, 일상, 부모님, 친척・형제",음식이 맛있어요,24,1
31253249,옥수동 아가씨,맛있네요 레모네이드도 맛있고 가격만 아니면 자주 가겠어요,2024-04-04,"저녁에 방문, 예약 없이 이용, 대기 시간 바로 입장, 가족모임, 연인・배우자, 아이",음식이 맛있어요,129,1
31253249,Sincerelyjy,옥수동의 꽤나 오랜 맛집인 듯처음 가봤는데쉐프님의내공이 느껴진다비가 오는 궂은 날이었지만 만석‼️음식이 다 맛있고재료가 신선채소기 물기 없이 깔끔가성비 맛집 추가!!미리 예약했고 6명이라 안쪽 프라이빗한 자리라더 좋았던 것 같으니참고하세요~🙂,2024-03-25,"점심에 방문, 예약 후 이용, 대기 시간 바로 입장, 친목, 친구",음식이 맛있어요,272,1
31253249,맛없을시 비분강개,벌집 피자 맛있어용🍯,2024-03-23,"저녁에 방문, 예약 없이 이용, 대기 시간 10분 이내",음식이 맛있어요,341,1
31253249,Topreview,옥수동의 보물입니다 동네에서도 웨이팅이 있는 소문난 맛집이지만....핫플가면 오픈런에 재료소진으로 3시간만에 문닫는 홍보잘된 맛집들 무릎꿇을만 한 내공이엄청난 맛집임!샐러드가 이렇게 맛있을일이야 생각할정도로 맛있고파스타 피자는 진짜 굉장히 수준급임오픈하자마자 문전성시 이룰만한 이유있다!면 익힘이나 간이 완벽함까르보나라 그릇까지 먹을뻔❤️,2024-03-16,"점심에 방문, 예약 없이 이용, 대기 시간 바로 입장, 데이트, 연인・배우자",음식이 맛있어요,197,2
31253249,고도리야,라자냐 맛있어요 보드라운 감자와 새우 씹히는 식감이 좋습이다명란파스타 면도 일반면보다 도톰하고 맛있어요,2024-03-09,저녁에 방문,음식이 맛있어요,967,1
31253249,보락색귀요미,더코너치킨  파스타가25천,2024-03-09,"점심에 방문, 예약 없이 이용, 대기 시간 바로 입장, 데이트, 친구",음식이 맛있어요,1309,1
31253249,Jungbly Choi,프로슈트꼬또+스치나치샐러드+생맥❤️더할나위없이 완벽한 조합😋다른 음식들도 먹으러 재방문각 옥수동맛집!!👍🏻와인 하나들고 재방문예정!콜키지 이만원?삼만원?이라 하신듯..,2024-03-03,"점심에 방문, 예약 없이 이용, 대기 시간 바로 입장, 데이트, 연인・배우자",음식이 맛있어요,678,1
31253249,Topreview,동네 골목에 작은가게인데 검색없이 산책하다 화덕보고 맛집 포스가 느껴져서 워크인함테이블 8개 오픈키친 직원이 6명임메뉴가 진짜 너무너무너무 다양해서 결정장애왔으나 베스트 히트메뉴 표시가되있어서 주문하기 좋았음!주문하고 서빙속도도 빠르고 맘에 들었는데더 놀라운건 맛이었다.최애 이탈리안 레스토랑 1순위였던 인천 p호텔 라*칼라를 제치고 1위로 올라섰고 전통의 청담 파스타맛집들 미슐랭맛집들  무릎꿇고갈맛스파이시크림 포르치니는 매운거 좋아하는사람들은 정말 1인 팟타 하세요! 정말매력적이고 재료가 아낌없이들어감피자는 도우 고소 짭짤 세박자 다 완벽하고 처음에 가게좁은데 직원이 6명있어서 의아했는데 그만큼 수준급요리를 만들기위해서였다고 생각됨너무 감동을받아서 네이버 리뷰 처음400자씀,2024-03-02,"점심에 방문, 예약 없이 이용, 대기 시간 10분 이내, 데이트, 연인・배우자",음식이 맛있어요,197,1
31253249,쫑쫑할미,둘셋이가서ᆢ오붓하게 머리맞대고 음식나누기좋음ᆢ그이상여러명가는것은 장소좁고ㆍ테이블도적고ᆢ동네 핫한집이듯ᆢ예약안하면대기해야할정도로 인기있네요음식은이거저것 먹었는데 다 맛있었어요,2024-03-01,"점심에 방문, 예약 후 이용, 대기 시간 바로 입장, 친목, 친구",음식이 맛있어요,530,1
31253249,케니 갱밀,가성비 만족합니다.,2024-02-27,"점심에 방문, 예약 없이 이용, 대기 시간 바로 입장, 친목, 지인・동료",친절해요,2001,1
31253249,백자74,파스타와 리조또 모두 맛있어요,2024-02-26,저녁에 방문,음식이 맛있어요,796,4
31253249,있는그대로솔직히,언제나 맛있는 꽈트로 피자와 생맥주,2024-02-26,"저녁에 방문, 예약 없이 이용, 대기 시간 바로 입장, 일상, 혼자",음식이 맛있어요,41,2
31253249,kan****,늘 기대이상의 맛^^자주 가는 편입니다,2024-02-16,"저녁에 방문, 예약 없이 이용, 대기 시간 바로 입장, 일상, 연인・배우자",음식이 맛있어요,926,5
31253249,kiki123,맛있어요,2024-02-16,"점심에 방문, 예약 후 이용, 친목, 친구",음식이 맛있어요,470,1
31253249,skywater,새로운 메뉴 개발에 진심이신 더코너메뉴마다 늘 맛있어요~ 물잔에 물도 계속 살펴서 채워주시는 센스!,2024-02-13,"점심에 방문, 예약 없이 이용, 대기 시간 10분 이내, 일상, 친구",음식이 맛있어요,1020,1
31253249,kh****,"다양한 메뉴, 평일 낮 1시인데 3명중 두명왔는데도 안들여보내주는건 좀 그렇더라고요. 음식은 조금 맛나요",2024-02-07,"점심에 방문, 예약 후 이용, 대기 시간 10분 이내, 친목, 지인・동료",음식이 맛있어요,186,1
31253249,nani478,"아니……… 무슨 피자가 이러케 맛있어요…………. 아니 진짜 너무 맛있자나뇨 …. 전에 마르게리타를 감동하며 먹었었고 이번엔 특이한거 시켜봤는데 특이한거 안조아하는데도 넘 맛있네요 피자장인 인정입니다 피자만드시는분 어디서 오셨는지 너무 궁금 대체 도우도 완전 쫄깃하고 칭찬 아무리 해도 입이 마르지 않는 피자맛집,,",2024-01-28,"점심에 방문, 포장·배달 이용",음식이 빨리 나와요,559,1
31253249,크레센시아79,테이블이 몇개없어서단체로오는건 비추입니다.,2024-01-26,"저녁에 방문, 예약 없이 이용, 대기 시간 30분 이내, 친목, 지인・동료",음식이 맛있어요,1233,1
31253249,gusrud74,예전에 가다 오랫만에 갔는데 맛도 여전하네요 맛있는 피자와 파스타 좋아요,2024-01-09,"저녁에 방문, 예약 없이 이용, 대기 시간 바로 입장, 나들이, 연인・배우자, 아이",음식이 맛있어요,268,1
31253249,닛시43,언제 먹어도 맛있는 마약옥수수피자,2024-01-06,"점심에 방문, 예약 없이 이용, 대기 시간 바로 입장, 친목, 친구",음식이 맛있어요,465,4
31253249,ojo****,요리가 다 맛있어요 굿,2024-01-05,"저녁에 방문, 예약 없이 이용, 대기 시간 바로 입장, 친목, 친구",음식이 맛있어요,586,1
31253249,있는그대로솔직히,"둘이서 꽈뜨로 포르마지 피자, 스파이시크림 포르치니파스타 먹었는데 둘 다 맛있었다. 생맥주도 호가든처럼 향있고 맛났음!",2024-01-02,"저녁에 방문, 예약 없이 이용, 대기 시간 바로 입장, 데이트, 연인・배우자",음식이 맛있어요,41,1
31253249,qqqig57,직원분들 너무 친절하고 음식이 깔끔하고 빨리 나와요,2023-12-29,"점심에 방문, 예약 없이 이용, 대기 시간 10분 이내, 데이트, 친목, 친구",음식이 맛있어요,527,1
31253249,백자74,정말 맛있어요음식도 엄청 빨리나와요리조또랑 파스타 피자 모두 맛있어요,2023-12-26,"점심에 방문, 예약 없이 이용, 대기 시간 바로 입장, 가족모임, 부모님",음식이 맛있어요,796,3
31253249,그곳에 가봤음,리조또하고 파스타가 맛있어요,2023-12-23,"점심에 방문, 예약 없이 이용, 대기 시간 바로 입장, 일상, 아이",음식이 맛있어요,204,1
31253249,그날그꽃64,모든음식이 맛있어요 테이블간격이 좁아서 편하게대화하긴 좀 불편해요 홀직원분 친절하세요,2023-12-19,"점심에 방문, 예약 없이 이용, 대기 시간 바로 입장, 친목, 친구",음식이 맛있어요,710,1
31253249,차나삼에,친절하고 맛있습니다!,2023-12-07,점심에 방문,특별한 메뉴가 있어요,1779,1
31253249,strongcat,파스타보다는 피자가 더 맛있습니다. 평소 손님 많고 좋아하는 곳 중의 하나인데 8시30분 라스트 오더 9시 30분에 끝나는데 7시 30분부터 큰소리로 설겆이 바닥청소 하시는데 부엌 가까이 앉아있는 사람에게는 너무 시끄러웠어요.작은 매장이라 안그래도 사람들의 대화와 음악 소리도 큰데 이부분 고려해주셨으면 합니다.,2023-12-05,"저녁에 방문, 예약 없이 이용, 대기 시간 바로 입장, 친목, 친구",음식이 맛있어요,100,1
31253249,접슐랭,"https://jsuleng.tistory.com/https://m.blog.naver.com/matziprealhttps://hdla.it/gakihara간이 강하지만, 창의적인 맛을 느낄 수 있는 맛집.특히 먹물파스타는 원픽메뉴임.",2023-11-08,저녁에 방문,메뉴 구성이 알차요,68,1
31253249,찐맛집탐험대장,기대를 많이한 동네 맛집이었는데 생각보다는 별로였어요.마약옥수수 피자가 너무 달았어요.,2023-11-01,저녁에 방문,특별한 메뉴가 있어요,1312,1
31253249,백자74,화덕피자 너무 맛있어요,2023-10-09,점심에 방문,음식이 맛있어요,796,2
31253249,ckq****,친절해요,2023-09-23,점심에 방문,음식이 맛있어요,394,3
31253249,오드리1021,이 동네로 이사했어요맛집을 찾다가 친구 권유로 여기서아들하고 데이또했네요화덕에 구운 피자 식감이 엄청 만나네요파스타 역쉬 맛있어요맛에 반했어요 후훗,2023-09-04,점심에 방문,음식이 맛있어요,395,1
31253249,kjy825917,굿,2023-08-31,저녁에 방문,음식이 맛있어요,1056,1
31253249,taewoo426,1 매일 지나다니던 곳인데 리뷰가 좋은 편이라 방문2 피자 파스타 샐러드부터 감바스 등 메뉴 다양한 편에 가격도 무난3 주문이 밀린 건지 배달이 많은 건지 피자 나오고 음료는 감감무소식. 피자 끝날 때쯤에야 술 등장. 나올 때까지 세번 재촉4 입맛 다시다 옆테이블 다 먹어가길래 샐러드 안나오냐 물어보니 주문 안들어감5 피자는 맛있었는데 6 응대 등 너무 실망스러워서 재방문 할 일 없을듯,2023-08-26,저녁에 방문,,595,1
31253249,zhujing12,좋아요,2023-08-01,저녁에 방문,특별한 날 가기 좋아요,2478,5
31253249,july22nd,좋아요,2023-07-27,점심에 방문,음식이 맛있어요,648,1
31253249,밤둥언니,"맛있게 먹었어요 근데 비싸요 맥주가,,",2023-07-22,점심에 방문,음식이 맛있어요,1171,1
31253249,a100th,"주민 추천으로 간 곳인데 피자가 특히 너무 맛있었습니다.도우도 쫄깃하고, 멕시칸 느낌나면서 특이했어요.다른 메뉴들 먹으러 가보고 싶어요!",2023-06-10,저녁에 방문,음식이 맛있어요,1514,1
31253249,오스타네,작은 가게~ 음식 맛있고 음악으로 시끌시끌동네에 작은 가게들이 있는건 반갑다해산물 스튜는 내가 좋아하는 맛😍,2023-06-10,저녁에 방문,음식이 맛있어요,445,1
31253249,닛시43,마약옥수수피자 항상 빠짐없이 시켜요. 넘 맛있어요 진짜 추천메뉴입니다봉골레는 정말로 바지락 많이 들어가 있고 맛있었습니다.명란 아보카도 리조또는 생각보다 아보카도가 듬뿍 들어있었어요. 짭짤하고 참기름의 고소한 맛이 많이 나서 전 좋았는데 호불호 갈릴 거 같아요. 근데 아보카도는 약간 덜 익어 딱딱했어요ㅠㅠ,2023-06-10,저녁에 방문,음식이 맛있어요,465,3
31253249,별들의찬사15,옥수역근처에 있는 더 코너 키친.오늘의 추천메뉴 먹었는데 넘 맛있음.남편이 양이 작은듯하여포르치니파스타 주문하여먹었는데 난 괜찮았는데 남편입맛은 좀 그랬다함.고수 많이 주세요.좀 고수양이 작음.,2023-06-06,저녁에 방문,음식이 맛있어요,978,1
31253249,zhujing12,좋아요,2023-06-06,점심에 방문,음식이 맛있어요,2478,4
31253249,sue****,언제가도 맛있어요. 근데 메뉴판 그림 이미지 있었으면 좋겠네요,2023-06-03,저녁에 방문,음식이 맛있어요,610,1
31253249,맹이만세,왜 매일 자리가 없는지 음식을 먹어보고 알았음 흔히 맛보는 프렌차이즈 음식과 맛이 다름 굿~^^,2023-05-31,점심에 방문,음식이 맛있어요,1961,1
31253249,백자74,음식이 다 너무 맛있어요!특히 마약옥수수피자 제 입맛에 딱 맞아요!,2023-05-29,점심에 방문,음식이 맛있어요,796,1
31253249,오노요꼬,굿굿,2023-05-12,저녁에 방문,,567,9
1012333241,크리스탈1587,오랜만에 갔는데 맛있게 잘 먹었어요~~!,2025-04-05,"저녁에 방문, 예약 후 이용, 대기 시간 바로 입장",음식이 맛있어요,661,2
