place_id,nickname,content,date,situations,keywords,review_count,visit_count
38302062,나보다니들이놀란,곱창이 질기지 않고 녹는거 같아요 맛있어요,2025-01-30,"저녁에 방문, 예약 없이 이용, 대기 시간 바로 입장, 데이트, 연인・배우자",음식이 맛있어요,10,4
38302062,유뱅유,너무 맛있어요 양도 많아요!,2025-01-30,"저녁에 방문, 예약 없이 이용, 대기 시간 바로 입장, 일상",음식이 맛있어요,6,1
38302062,먕둥,몇일전에 왔을때 품절이어서 2인분밖에 못먹은게 아쉬워서 또 먹으러 왔어요!! 웨이팅 항상 있는데 그래도 30분안에는 들어오는것같아요 너무 맛있습니당👍🏻❤️,2025-01-26,"저녁에 방문, 예약 없이 이용, 대기 시간 30분 이내, 데이트, 연인・배우자",음식이 맛있어요,19,3
38302062,맛있는거다먹자,7년째 옵미다~~ 너무 맛있어요!!🤍,2025-01-24,"저녁에 방문, 대기 시간 바로 입장, 데이트, 연인・배우자",음식이 맛있어요,69,4
38302062,par****,"저 여기 10년째 다녀요!!어렸을때부터 다녔고, 삼겹곱창이 원픽입니다❤️사장님 번창하세요!!또 올게요 ㅎㅎ",2025-01-24,"저녁에 방문, 예약 후 이용, 대기 시간 30분 이내, 데이트, 연인・배우자",음식이 맛있어요,109,2
38302062,hj07130903,맛있게 잘먹었습니다,2025-01-24,"저녁에 방문, 예약 없이 이용, 대기 시간 바로 입장, 친목, 친구",음식이 맛있어요,994,1
38302062,jae123112,가격도 합리적이고 잘 먹었습니다,2025-01-24,"저녁에 방문, 예약 없이 이용, 대기 시간 바로 입장, 친목, 친구",음식이 맛있어요,12,1
38302062,아임튜브,점점 더 맛있어집니다! 역시 단골 맛집! 퇴근하고 먹기 너무 좋은 안주예용😌,2025-01-23,"저녁에 방문, 예약 없이 이용, 대기 시간 30분 이내, 데이트, 연인・배우자",음식이 맛있어요,1579,8
38302062,먕둥,여기 곱창 막창 정말 맛있어요!! 저 막창은 질겨서 잘 안먹었었는데 여기 막창 먹고 인식이 바뀌었습니다 막창이 이렇게 부드럽게 맛있을수 있나요…👍🏻👍🏻👍🏻,2025-01-22,"저녁에 방문, 예약 없이 이용, 대기 시간 30분 이내, 데이트, 연인・배우자",음식이 맛있어요,19,2
38302062,h_0****,너무너무 맛있어요 미아사거리에 이런곳이 있는줄 몰랐네요 ㅎㅎ,2025-01-22,"저녁에 방문, 예약 없이 이용, 대기 시간 바로 입장, 친목, 친구",음식이 맛있어요,17,1
38302062,히히헤83,맛있어요,2025-01-20,"저녁에 방문, 예약 없이 이용, 대기 시간 바로 입장, 일상, 부모님, 친척・형제",음식이 맛있어요,12,1
38302062,min****,항상 곱창은 여기로만 와요!! 먼곳에서 부모님 모시고 왔어요 역시 최고💕💕,2025-01-20,"저녁에 방문, 예약 없이 이용, 대기 시간 바로 입장, 친목, 부모님",음식이 맛있어요,22,3
38302062,min****,삼겹곱창이 너무 맛있어요 곱창 먹고싶을때마다 여기로 와요 !!,2025-01-20,"저녁에 방문, 예약 없이 이용, 대기 시간 바로 입장, 데이트, 연인・배우자",음식이 맛있어요,10,1
38302062,공원솔,진짜 진짜 맛있어요!!일년만에 먹는 동곱!!!,2025-01-17,"저녁에 방문, 예약 없이 이용, 대기 시간 바로 입장, 친목, 친구",인테리어가 멋져요,13,1
38302062,humanite,너무 맛있어요!!! ㅜ 세번째 인 거 같은데 진짜 올때마다 너무 맛있어서 행복해요…! ㅠ,2025-01-17,"저녁에 방문, 예약 후 이용, 대기 시간 30분 이내, 친목, 친구",양이 많아요,74,1
38302062,dad****,항상 배달로 먹다가 매장에서 처음 먹는데 너무 맛있었어요! 다음에 또 매장에서 먹고 싶은 맛이엿어요◡̈ 감사히 잘 먹엇습니다~,2025-01-17,"저녁에 방문, 예약 없이 이용, 대기 시간 바로 입장, 친목, 친구",음식이 맛있어요,53,1
38302062,능금17,늘 먹는 삼겹곱창으로 주문했어요잊을만하면 생각나는 미삼 동대문곱창~4개월만에 먹는데도 여전히 맛있네요 👏,2025-01-16,"저녁에 방문, 예약 없이 이용, 대기 시간 바로 입장, 데이트, 연인・배우자",음식이 맛있어요,27,2
38302062,나보다니들이놀란,삼겹곱창 맛있고 동치미도 맛있고  볶음밥도  맛있어요  잘먹었습니다   맛보면 또와요  강추,2025-01-16,"저녁에 방문, 예약 없이 이용, 대기 시간 바로 입장, 나들이, 연인・배우자",음식이 맛있어요,10,3
38302062,전소61,고등학생때부터 항상 친구랑 시간 될 때마다 여길 오는데 너무 맛있고 항상 만족감이 풀충전된 상태로 가요!🫶🏻곱창을 좋아하신다면 꼭 여기 추천드려요!삼겹살도 너무 맛있는데 곱창이랑 조합은 진짜..말이 필요없어요ㅠ.ㅠ제 인생 맛집이에요ㅠㅠ 꼭 오셔서 드셔보세요!,2025-01-13,"저녁에 방문, 예약 없이 이용, 대기 시간 바로 입장, 친목, 친구",양이 많아요,8,2
38302062,seo****,항상 잡내 없이 맛있어요!!😍,2025-01-09,"저녁에 방문, 예약 없이 이용, 대기 시간 바로 입장, 일상, 가족모임, 부모님",음식이 맛있어요,6,1
38302062,불곰3247,일산에서도 한달에 한번은 꼭 오는 쀄이버릿 맛쥡입니다..! 잘먹는 사람기준 2명이서 삼겹곱창3인분에 볶음밥이면 야무디게 먹을 수 있어요 체고!,2025-01-09,"저녁에 방문, 예약 없이 이용, 대기 시간 바로 입장, 데이트, 연인・배우자",음식이 맛있어요,27,3
38302062,xhooltow,양념이 너무 맛있고 잡내가 하나도 안나요!멀리서 찾아왔는데 그럴만 한 가치가 있네요 ~🩶,2025-01-09,"저녁에 방문, 예약 없이 이용, 대기 시간 30분 이내, 친목, 친구",음식이 맛있어요,25,1
38302062,The Super Rich,맛있게 잘 먹었습니다. 감사해요.,2025-01-08,"저녁에 방문, 예약 없이 이용, 대기 시간 30분 이내, 친목, 친구",가성비가 좋아요,21,1
38302062,rmi****,배달시켜먹다가 직접 먹으러 왔어요~~~ 맛있는 만큼 웨이팅도 있네요 ㅎㅎ 알배추도 주시고 맛있습니다~~,2025-01-08,"저녁에 방문, 예약 없이 이용, 대기 시간 10분 이내, 데이트, 연인・배우자",친절해요,45,1
1856550528,bsa****,테이블이너무협소해두번에나눠서시켜먹었어요좌석도협소해서가방하나놓을자리가없어요맛있는음식여유롭게먹고싶었는데음식은좋았는데불편함이음식맛을가린것같아요,2025-04-06,"점심에 방문, 예약 후 이용, 대기 시간 10분 이내, 친목, 연인・배우자",음식이 맛있어요,5,1
1856550528,미르미르미르르,가족 외식하기 딱 좋아요. 즐거운 시간이였음.,2025-04-06,"점심에 방문, 예약 후 이용, 대기 시간 바로 입장, 가족모임, 연인・배우자",음식이 맛있어요,28,1
1856550528,뱀장어백마리,오랜만에 방문했습니다. 근데 스테이크가 너무 짜고 스파이시 투움바 파스타 항상 먹던거였는데 이 날은 특히 너무 맵더라고요? 고추 갈린게 너무 많았습니다. 왠만큼 먹으니 파스타 소스에 고추 기름이.... 파스타 소스 추가해도 너무 적게 주셔서 매운게 중화되지 않았습니다..,2025-04-04,"저녁에 방문, 예약 없이 이용, 대기 시간 바로 입장, 데이트, 연인・배우자",친절해요,48,1
1856550528,슈슈슈슈2,토마호크 세트 맛있어용!,2025-04-01,"저녁에 방문, 예약 후 이용, 대기 시간 바로 입장",음식이 맛있어요,1049,3
1856550528,michin7,친절하고 맛잇어요,2025-03-30,"점심에 방문, 예약 없이 이용, 대기 시간 바로 입장, 회식, 연인・배우자, 아이",음식이 맛있어요,374,1
1856550528,디오닝67,아웃백은 투움바 파스타가 진리!!텐더 샐러드도 변함 없이 맛있습니다퀘사디아도 추천해요치킨들어간게 맛있습니다,2025-03-26,"저녁에 방문, 예약 없이 이용, 대기 시간 바로 입장, 일상, 연인・배우자",음식이 맛있어요,168,1
1856550528,lipsulman,친절해서 너무 좋았고 음식도 훌륭했습니다.,2025-03-25,"저녁에 방문, 예약 후 이용, 대기 시간 바로 입장, 가족모임, 아이, 연인・배우자",아이와 가기 좋아요,17,1
1856550528,dar****,오랜만에  생일기념으로 갔는데 음식도 맛있고 직원분들도 너무 친절해서 좋았습니다.,2025-03-25,"저녁에 방문, 예약 후 이용, 대기 시간 바로 입장, 연인・배우자",메뉴 구성이 알차요,1,1
1856550528,flapper360,투움바가 그리울때 한번씩 방문하는 아웃백 😊 백화점 내에 있어서 주차 편하고 식후에 둘러볼데 많은건 좋지만 매장 규모가 약간 작은편이라 웨이팅 수시로 발생 되는 점은 약간 아쉽네요~! 음식이야 항상 일관적인 맛 ㅎㅎ 서비스도 매우 뛰어나구욥 👍 만족만족,2025-03-23,"점심에 방문, 예약 후 이용, 대기 시간 바로 입장, 일상, 아이",친절해요,64,1
1856550528,맑음N,"금요일 저녁시간 예약하고 맛있게 먹었습니다.퀘사디아는 처음 주문했는데 맛있었어요.투움바파스타는 소스를 좀 많이 요청했는데….소스가 너무 없는듯…먹다보니 면에 붙은 소스가 말라 너무 꾸덕한 질감이 촉촉함보다 질척거려 별로였습니다….아웃백 음식들을 좋아해서 주문한 음식들 전체적으로 맛있게 먹었습니다. 남은음식도 포장 잘 해주시고 친절해요.저녁식사  만족스러웠습니다.기브미파이브  38,900원카카두그릴러퀘사디아  20,900원양송이스프 2  9,000원오렌지에이드  6,700원투움바파스타  25,900원멤버쉽쿠폰 & 카드할인으로 64,400원",2025-03-21,저녁에 방문,음식이 맛있어요,1783,9
1856550528,나야나야3,아이들과 오랫만에 아웃백부시맨 기본하나씩 먹어주고포터하우스 세트티본스테이크랑 파스타랑 부라타치즈샐러드랑베이비빅립도 먹고싶다고 추가배뚠뚠^^아이들과 즐거운시간,2025-03-18,"저녁에 방문, 예약 없이 이용, 대기 시간 바로 입장, 가족모임, 아이",음식이 맛있어요,341,1
1856550528,밝으미,다른곳보다 주방도 훤히 보이고 깔끔하여 미아점으로 자주갑니다지난번 아이와 방문시에는 마지막에 커피도 주셔서 이번 방문시에 요청하니...헐 저번에 잘못준거라 이번에 못준다네요살짝 기분 안좋더라구요,2025-03-16,"저녁에 방문, 예약 없이 이용, 대기 시간 바로 입장, 일상, 아이",음식이 맛있어요,638,3
1856550528,햄토리1583,서비스도 좋고 친절해요,2025-03-15,"점심에 방문, 예약 후 이용, 대기 시간 바로 입장",음식이 맛있어요,39,1
1856550528,아자6587,서버들도 친절하고 음식도 맛있었요,2025-03-09,"저녁에 방문, 예약 후 이용, 대기 시간 바로 입장, 친목, 친구",음식이 맛있어요,23,2
1856550528,푸카87,예약한 덕분에 바로 입장했구요. 주말 점심엔 대기자가엄청많네요. 투움바 맛은 예전만 못하지만빵과 스프는 여전히 굿굿ㅎㅎ,2025-03-03,"점심에 방문, 예약 후 이용, 대기 시간 바로 입장, 기념일, 부모님, 친척・형제",음식이 맛있어요,1725,3
1856550528,redrose098,양도많고 맛도좋고. 맛있게잘먹었습니다서비스응대하신분들도매우친절합니다,2025-03-03,"점심에 방문, 예약 후 이용, 대기 시간 바로 입장, 일상, 부모님, 친척・형제",음식이 맛있어요,406,2
1856550528,ㅎㅎㅎㅎ36,"랍스타 블랙라벨 패밀리세트 시켜서 먹었습니당.노원점보다 미아점이 맛은 더 맛있어용.다만 성인 네명이 앉기에는 자리는 넉넉하진않습니다.그래도 가족들이랑 즐거운시간 보내기 좋습니다.멤버쉽할인, 부메랑쿠폰, 상품권만 있다면 가성비 좋게 분위기낼 수 있어서 찾게되는 아웃백입니다♡",2025-02-27,"점심에 방문, 예약 후 이용, 대기 시간 바로 입장, 기념일, 가족모임, 부모님, 친척・형제",음식이 맛있어요,35,1
1856550528,msn****,아이 졸업식기념으로 저녁먹으러 고고씽~셋트메뉴 친절하게 설명주셔서 알차게 잘먹고 왔습니다~백화점내에 있어서 주차하기도 편하고결제시 카드할인도 상세하게 안내받았구요~,2025-02-25,"저녁에 방문, 예약 없이 이용, 대기 시간 바로 입장, 나들이, 아이",음식이 맛있어요,12,1
1856550528,angela60,굿조아요줏줏주조아요,2025-02-24,저녁에 방문,음식이 맛있어요,917,1
1856550528,사탕솜사탕,"에이드는 별로였고 음식은 맛있었어용 할인되는 거 많아서 잘 보고 가세요ㅠ 못 받고 와서 아쉬움,,,",2025-02-24,"점심에 방문, 예약 후 이용, 대기 시간 바로 입장",음식이 맛있어요,808,1
1856550528,윈터스46,"간만에 가족모두 아웃백다녀왔습니다. 5식구라서 이동이.쉽지않지만 그래도 좋은시간이었네요. 스테이크는 역시 맛나고 미디움레어가 저는 딱 좋아요. 식전 빵은 예전같지 않은 느낌 직원 모두 친절하고 좋은시간이었습니다. 40-50분 대기 했는데 런치 때문에 대기하는건데 시간이 지나 아쉬웠고, 우리보다.더기다린 팀들은 쫌 아쉬운듯 하네요.",2025-02-23,"점심에 방문, 예약 후 이용, 대기 시간 30분 이상, 가족모임, 연인・배우자, 아이",매장이 넓어요,433,2
1856550528,na와 나,,2025-02-23,"점심에 방문, 예약 없이 이용, 대기 시간 바로 입장, 데이트, 연인・배우자",친절해요,859,2
1856550528,클레어데인지,"런치 지나고 가서, 수프랑 음료값까지 조금 비싸긴하네용;; 이번 치킨텐더는 좀 막하셨는지.. 후추가너무 많이 들어가서 좀 짰네요;;",2025-02-22,"점심에 방문, 예약 없이 이용, 대기 시간 30분 이내, 일상, 아이",음식이 맛있어요,1877,14
1856550528,맑음N,"금요일저녁 예약하고 맛있게 먹었습니다.갈릭립아이 사이드로 나온 구운감자 꽤나 맛있었고 파스타도 맛있었어요.아웃백멤버쉽 부메랑쿠폰 1만원권과 통신사제휴할인중복이 가능해서 37,000원정도 할인받았습니다.기브미파이브  38,900갈릭립아이280g  49,900스파이시씨푸드알리오올리오  25,900오렌지에이드  6,700양송이스프 4,500아웃백부메랑쿠폰 + SK20%  ₩98,515",2025-02-21,저녁에 방문,음식이 맛있어요,1783,8
1856550528,김은영89,집에서 가깝고 친절해서 좋네요.일반 아웃백 매장보다 백화점내라서 그런지 밝아서 좋았어요.,2025-02-21,"저녁에 방문, 예약 후 이용, 대기 시간 바로 입장, 기념일, 기타",음식이 맛있어요,14,1
1856550528,00000071652,소중한 사람들과 특별한 날에 맛있게 먹고 왔어요^^,2025-02-20,"저녁에 방문, 예약 없이 이용, 대기 시간 바로 입장, 친목, 연인・배우자, 친구",음식이 맛있어요,357,1
1856550528,쿰수니가조아,생일이라 신랑이랑 특별하게 토마호크 세트 주문해서 먹었습니다~ 첨엔 양 별루인거같아 하나 더주문하려고 했는데 먹다보니 배터지는 줄 알았어요 ㅋㅋ 직원분들도 친절하고 기분좋은 데이트 가졌습니다~^^,2025-02-20,"저녁에 방문, 예약 후 이용, 대기 시간 바로 입장, 데이트, 연인・배우자",음식이 맛있어요,274,1
1856550528,꿈도리가조아,,2025-02-20,"저녁에 방문, 예약 후 이용, 대기 시간 바로 입장",인테리어가 멋져요,892,1
1856550528,pop****,음식이 뜨겁길 바라지는 않지만 실내가 추워서 그런지 음식이 금방 식어 맛이 없었습니다. 다음에 재방문 안할 것 같습니다.,2025-02-18,"점심에 방문, 예약 후 이용, 대기 시간 바로 입장, 기념일, 아이",매장이 넓어요,14,1
1856550528,좋은아이64,직원이 엄청 친절해요,2025-02-18,"점심에 방문, 예약 후 이용, 대기 시간 바로 입장, 기념일, 아이",주차하기 편해요,1644,4
1856550528,ARTee,맛있게 먹었어요~~~!,2025-02-17,"점심에 방문, 예약 없이 이용, 대기 시간 바로 입장, 친목, 친구",아늑해요,54,3
1856550528,Iso63,친절합니다,2025-02-17,"점심에 방문, 예약 후 이용, 대기 시간 바로 입장, 나들이, 부모님",비싼 만큼 가치있어요,55,1
1856550528,su****,실적유지를 위해 아웃백 자주 방문합니다 ㅎㅎ 맛있어서 신촌점을 늘 다니다가 ㅎ 불친절함에 질려서 미아점으로 갈아탔는데요 ㅎ 넘 친절하고 음식도 맛있습니다^^ 오늘 서버 에릭님도 친절하시더라구요. 감사히 잘먹었습니다.,2025-02-16,"점심에 방문, 예약 없이 이용, 대기 시간 바로 입장, 일상, 연인・배우자, 아이",음식이 맛있어요,239,2
1856550528,블링밍크,예약후 방문해 본스테이크 먹었습니다. 할인도 많고 맛도 좋아 만족했어요~ 서버가 친절했습니다~,2025-02-16,"점심에 방문, 예약 후 이용, 대기 시간 바로 입장, 연인・배우자, 아이",친절해요,30,1
1856550528,유마데,남편 생일에 동생 부부와 식사하러 갔습니다생일 축하 노래도 불러주시고 감사했어요아이가 있는 테이블이었는데세심하게 챙겨주셔서 감사했습니다 🩷,2025-02-15,"저녁에 방문, 예약 후 이용, 대기 시간 10분 이내, 가족모임, 친척・형제",음식이 맛있어요,103,1
1856550528,행복한 엄마79,스테이크가 맛있어요 파스타도 물론이구요,2025-02-12,"저녁에 방문, 예약 없이 이용, 대기 시간 바로 입장, 가족모임, 기타",음식이 맛있어요,1117,4
1856550528,마음으로그리는세상,3인이가서 4인분주문런치로 저렴하게 배부르게 먹고 왔습니다,2025-02-12,"점심에 방문, 예약 후 이용, 대기 시간 10분 이내, 일상, 연인・배우자, 아이",친절해요,1,1
1856550528,알쫑사랑그미,졸업식날이라 사람이 많아 좀 분주했고계산시 카운터 오류때문에 대기한거 말고는딱히 불편사항 없었어요,2025-02-12,"점심에 방문, 예약 후 이용, 대기 시간 바로 입장, 기념일, 연인・배우자, 아이",음식이 맛있어요,2,1
1856550528,밝으미,열흘만에 또 갔어요맛있어요지난번은 준비도 안해주셨는데 비닐장갑도 주셔서 편히 먹었어요 작은배려지만 참 감사했어요~마지막에 커피도 주셨어요지난번에 더 많이 먹었는데 안주셨는데...이번 경험이 더 즐거웠어요~~일관성있게 해주면 좋았을텐데요오늘 테이블담당 직원 최고요!!!,2025-02-10,"저녁에 방문, 예약 없이 이용, 대기 시간 바로 입장, 일상, 아이",음식이 맛있어요,638,2
1856550528,dbtmt,,2025-02-09,저녁에 방문,음식이 맛있어요,1204,15
1856550528,pearlholic,아웃백 아이랑 가기 좋아요!직원분이 처음이셨는지 두세번 오셔서 동일질문 귀여우셨어요 :) 처음엔 다 그렇죠~~,2025-02-09,"점심에 방문, 예약 후 이용, 대기 시간 바로 입장, 일상, 아이",매장이 청결해요,602,1
1856550528,macaron95,아이 졸업식 끝나고 기념으로 식사하러 다녀왔어요. 예약하고 가서 대기 시간없이 바로 입장할 수 있었구요. 서비스도 좋았고 항상 친절하게 응대해주시는 직원분들 덕에 기분 좋은 식사를 할 수 있었어요.,2025-02-07,"점심에 방문, 예약 후 이용, 대기 시간 바로 입장, 기념일, 연인・배우자, 아이",친절해요,17,2
1856550528,양67,맛있어요!!!!,2025-02-06,"점심에 방문, 예약 없이 이용, 대기 시간 30분 이내, 데이트, 부모님",음식이 맛있어요,395,1
1856550528,쫑아70,딸의 중학교 졸업을 축하하고 맛있는 음식을 먹기위해 네이버 예약후 대기없이 바로 입장하고 맛있는 스테이크와 파스타 샐러드 에이드를 먹고 왔어요~졸업시즌이라 손님이 많았지만 음식도 바로바로 나오고 즐거운 식사시간이였어요~^^,2025-02-06,"밤에 방문, 예약 후 이용, 대기 시간 바로 입장, 기념일, 연인・배우자, 아이",메뉴 구성이 알차요,332,1
1856550528,야옹5769,맛은 있지만 좀 비싸서 다음엔 생각 더 해보고 갈듯요.직원에게 머스타드 요청했는데 안 갖다줌. 배려심에 너무 기다리지는 말껄 그랬나봐요~전반적으로 가격에비해 서비스가 매우 부족한 면이 있어요.,2025-02-05,"점심에 방문, 예약 후 이용, 대기 시간 바로 입장, 기념일, 가족모임, 기타",음식이 맛있어요,37,1
1856550528,밝으미,다른 아웃백보다 음식이 맛있고 직원분들 모두 친절하시고..이해 안될때 시간 걸리는데도  할인관련 잘 설명해주셔서 감사했어요!,2025-02-01,"저녁에 방문, 예약 없이 이용, 대기 시간 바로 입장, 일상, 연인・배우자, 아이",음식이 맛있어요,638,1
1856550528,타마고1011,너무 맛있고 직원분들이 친절하세요,2025-02-01,"저녁에 방문, 예약 없이 이용, 대기 시간 바로 입장, 친목, 연인・배우자, 아이",음식이 맛있어요,576,2
1856550528,shnnyy,굿,2025-01-31,점심에 방문,음식이 맛있어요,2128,2
1856550528,reinadayo,설 연휴 마지막 날 아웃백 방문.제이슨(?) 서버님 친절하시고 음식도 다 맛있었어요근데 런치 메뉴가 먹을게 없네요 ㅠ 가격도 언제 이렇게 올랐는지 ㅠㅠ,2025-01-30,"점심에 방문, 예약 후 이용, 대기 시간 바로 입장, 가족모임, 부모님",음식이 맛있어요,2110,2
1856550528,cerisier,예약하고 가서 웨이팅 안 하고 바로 입장할 수 있었어요! 제이슨 서버님 너무 친절하게 잘 챙겨주셔서 식사 맛있게 하고 나올 수 있었어요👍🏻👍🏻,2025-01-30,"점심에 방문, 예약 후 이용, 대기 시간 바로 입장, 데이트, 연인・배우자",친절해요,16,1
1856550528,Emj,한때 일했던오빠의  생파티투움바를 좋아해서 올만 느끼 라인 별로인 아빠는 빼고~^^;언제나 만족,2025-01-28,"저녁에 방문, 예약 없이 이용, 대기 시간 바로 입장, 가족모임, 부모님",음식이 맛있어요,139,1
1856550528,별 행복,생일을 맞아 아웃백 예약후 이용하였습니다특별한 날 가기 좋아요음식도 맛있고 직원분들도 친절합니다,2025-01-28,"점심에 방문, 예약 후 이용, 대기 시간 바로 입장, 친목, 기념일, 아이, 친척・형제",특별한 메뉴가 있어요,24,1
1856550528,팅글링,너무 맛있고 친절한곳이어서 만족스럽습니다,2025-01-28,"점심에 방문, 예약 후 이용, 대기 시간 바로 입장, 친목, 아이",음식이 맛있어요,180,6
1856550528,puhaha141259,굿,2025-01-27,점심에 방문,음식이 맛있어요,1385,9
1856550528,크리미마미,가족들과 함께 점심하기 좋은 곳이에요.런치타임이 끝나면 조용해져서 좋습니다.,2025-01-27,"점심에 방문, 예약 없이 이용, 대기 시간 30분 이내, 가족모임, 연인・배우자, 아이, 부모님",친절해요,1574,1
1856550528,jud****,좋아요!^^생일쿠폰은 따로 없네요..ㅠㅠ,2025-01-25,"저녁에 방문, 예약 없이 이용, 대기 시간 바로 입장, 가족모임, 연인・배우자, 부모님, 친척・형제",메뉴 구성이 알차요,1187,1
1856550528,주리85,토마호크 790그램 가족들 4명이 배부르게 먹음,2025-01-25,"저녁에 방문, 예약 없이 이용, 대기 시간 바로 입장, 기념일, 친척・형제",양이 많아요,1727,1
1856550528,돌돌이사댱해,친구들이랑 맛있게 먹었어용ㅎㅎ,2025-01-21,"저녁에 방문, 예약 후 이용, 대기 시간 바로 입장, 친구",인테리어가 멋져요,22,1
1856550528,맑음N,"갈릭립아이스테이크 280g  49,900레몬치킨리조또  25,900골드코스트코코넛쉬림프  20,900양송이스프  4,500자몽에이드  6,700스테이크접시에 사이드로 주문한 구운마늘 매우 맛있어요.리조또는 맛있는데 크림소스가 너무 없이 나와서 먹다보니 밥이 매말라너무 꾸덕했어요.다음번엔 크림소스좀 넉넉하게 해주셨으면 좋겠어요.화요일 저녁시간 예약후 맛있게 먹었습니다.",2025-01-21,"저녁에 방문, 예약 후 이용, 대기 시간 바로 입장, 일상",음식이 맛있어요,1783,7
1856550528,민지35,맛있어요 😍😍😍,2025-01-17,"점심에 방문, 예약 후 이용, 대기 시간 바로 입장, 데이트, 연인・배우자",음식이 맛있어요,57,1
1856550528,힌둥검둥맘,예전에 한번 넘 불친절해서 분노의 후기 올린 적이 있는데^^:;; 최근 몇달 간은 직원분들 넘 친절하시구  스테이크도 너무 맛나구  매번 만족 했어요!  오늘은 가성비 런치세트 시켰는데 이 가격에 이 정도양과 맛이라니 너무 훌륭한 식사 시간이었어요 !!  직원분들 모두 넘 친절하시구 미아점 앗백 맛있어요옹,2025-01-16,"점심에 방문, 예약 없이 이용, 대기 시간 바로 입장, 데이트, 연인・배우자",음식이 맛있어요,167,3
1856550528,puhaha141259,Good,2025-01-14,점심에 방문,음식이 맛있어요,1385,8
1856550528,serishot,"친절한 서비스, 안내 모두 감사합니다.",2025-01-14,"점심에 방문, 예약 후 이용, 대기 시간 바로 입장",음식이 맛있어요,1150,9
