place_id,nickname,content,date,situations,keywords,review_count,visit_count
1670311545,kk9****,양도 많고 무엇보다 정말 맛이있습니다!!! 육전이 너무너무 맛있습니다,2025-03-08,"저녁에 방문, 예약 없이 이용, 대기 시간 바로 입장, 데이트, 연인・배우자",음식이 맛있어요,12,1
1670311545,minizinni,칼만두랑 비빔밥 시켰어요 양도 많고 깔끔하네요 다음에 또 이용힐게요^.^,2025-03-08,"점심에 방문, 예약 없이 이용, 대기 시간 바로 입장, 가족모임, 부모님",재료가 신선해요,5,1
1670311545,가온80,여기서만 먹을수있는 메뉴이고 손수 만든 면이라그런지 쫄깃하고 너무 맛있습니다.,2025-03-08,"점심에 방문, 예약 없이 이용, 대기 시간 바로 입장, 친목, 친구",음식이 맛있어요,11,2
1670311545,rms****,그냥 노량진 최고의 맛집입니다 다 맛잇고 밥이 야무집니다,2025-03-08,"점심에 방문, 예약 없이 이용, 대기 시간 바로 입장, 일상, 친구",음식이 맛있어요,7,1
1670311545,별명을쓰라고,,2025-03-07,"저녁에 방문, 예약 없이 이용, 대기 시간 바로 입장, 데이트, 연인・배우자",음식이 맛있어요,12,3
1670311545,cherish 123,,2025-03-07,저녁에 방문,혼밥하기 좋아요,1094,1
1670311545,송먕이,벌써 꽁칼 다섯 번째 방문입니다! 오늘 갈까 내일 갈까 언제 가지 하다가 계속 머리에 떠다녀서 왔어요~ 오늘은 배가 이른 시간부터 고파서 평소보다 살짝 일찍 12시 반쯤 방문했는데 자리는 여유로웠습니다! 사실 점심으로 샤브샤브 먹으면 구성이 알차고 맛있다 보니 배불러도 계속 먹다가 결국에 다 먹게 되더라구요 🫨 배가 많이 불러서 소화 충분히 시켜주려고 합니다! 칼국수 먹을 때 김치랑 같이 먹으면 더 맛있어요! 저는 꽁칼 첫 방문 때 육전 먹고 엄청 새롭고 신선하게 맛있어서 완전 놀랐었어요! 육전이 그냥 육전이 아니랍니다… 이건 드셔 보셔야 알 수 있는 감동의 맛이에요 ㅠ.ㅠ 아직 리뷰 이벤트 진행 중이니 다들 참여하셔서 육전 꼭 드셔보세요! 오늘도 직원 분 친절하게 응대해주셔서 감사했습니다! 또 올게요 💛,2025-03-07,"점심에 방문, 예약 없이 이용, 대기 시간 바로 입장, 일상, 혼자",친절해요,36,5
1670311545,콜드브루굿,기대 안하고 후기 보고 예약 방문했는데 골동면 깔끔하니 너무 맛있어요~~다음에 다른 메뉴도 먹고  싶네요^^,2025-03-06,"저녁에 방문, 예약 후 이용, 대기 시간 바로 입장, 친목, 친구",음식이 맛있어요,971,1
1670311545,ttltt23,혼밥 하기 좋은 곳입니다 노량진 들릴 때마다 자주 오는곳입니다 면발이 탱탱하고 얼큰 해서 맛있고 반찬도 맛있습니다!,2025-03-06,"저녁에 방문, 예약 없이 이용, 대기 시간 바로 입장, 혼자",음식이 맛있어요,27,5
1670311545,Eieiso,친절하시고 메뉴도 너무 맛있어오!!!자주 오고싶어요 ㅎㅎㅎ,2025-03-06,"점심에 방문, 예약 없이 이용, 대기 시간 바로 입장, 데이트, 친목, 나들이, 연인・배우자",양이 많아요,20,1
1670311545,영뚜르,지나다니면서 새로 오픈한 거 봤었는데 이제야 방문했어요~!밖에서 제면하는 모습을 볼 수 있어서 일단 신뢰가 갔었고 음식도 깔끔하고 신선했고 맛있었어요👍면만 먹기 아쉬울 수 있는데 보리밥도 같이 나와서 좋았어요~ 양도 꽤 많은 편이고 혼밥하기도 좋습니다!!,2025-03-05,"저녁에 방문, 대기 시간 바로 입장",음식이 맛있어요,87,1
1670311545,데일리너츠,날이쌀쌀해서 우시장 뚝배기 칼국수 시켰는데시켰는데 국물이 찐이에요거기에 숙주도 한웅큼 얹어나와서 진한국물이 칼칼하니 맛있습니다!!육전은 담에 오면 메인으로 시켜야겠어요 오늘 혼자온게 너무 아쉬울따름입니다 ..든든한 한끼 찾으시는분 꽁칼 강추합니다!,2025-03-05,"점심에 방문, 예약 없이 이용, 대기 시간 바로 입장, 일상, 혼자",음식이 맛있어요,29,1
1670311545,탕수육먹고시픔,한냄비뚝딱! 어제도 먹고 오늘도 또 먹으러 왔어요!! 꽁칼 최고!!,2025-03-04,"저녁에 방문, 예약 없이 이용, 대기 시간 바로 입장, 일상, 혼자",음식이 맛있어요,8,3
1670311545,민이얹으,칼만두 샤브샤브 넘 맛있습니다 허겁지겁 먹느라 도중에 사진을 찍었네요;ㅅ;만두 칼사리 죽까지 넘 푸짐한 한 상입니다 !,2025-03-04,"점심에 방문, 예약 없이 이용, 대기 시간 바로 입장, 일상, 지인・동료",음식이 맛있어요,419,2
1670311545,맛집탐험가994,"1년 만에 재방문 했습니다!!리뷰 이벤트로 육전과 함께 먹었습니다사장님,, 어디 계세요,,1년 전, 처음 생겼을 때 전 메뉴 섭렵하고자 주 5회 방문했던 저로서는 다소 아쉬운 요즘입니다…지난주엔 밀면 먹었는데 면이 좀 덜 익었다 할까요 뭔가 밀면도 그렇고 골동면도 그렇고 맛이 예전 같지 않아요 ㅠ.ㅠ 육전은 1년 전에 비해 훨씬 맛있게 먹었습니다!아 식후 식혜도 없어졌더라구요 ㅠㅠㅠㅠㅠ 대충 괜찮았습니다~~ 리뷰 쓰고 넘어갈 수도 있지만 애정 가득했던 가게였기에 솔직함 조금 담아 남깁니다! 조만간 또 방문할 예정인데 보다 만족스런 식사 기대하겠습니다-!",2025-03-03,"저녁에 방문, 예약 없이 이용, 대기 시간 바로 입장, 일상, 혼자",인테리어가 멋져요,37,1
1670311545,탕수육먹고시픔,맛있게 저녁 먹었습니당~~육전도 맛있어요,2025-03-03,"저녁에 방문, 예약 없이 이용, 대기 시간 바로 입장, 일상, 혼자",음식이 맛있어요,8,2
1670311545,테드96,뚝칼은 바람 많이 부는 오늘 같은 날 찰떡인 메뉴!비빔밥도 다른 곳이랑 다르게 보리밥을 써서 더 맛있었습니다!!,2025-03-03,"점심에 방문, 예약 없이 이용, 대기 시간 바로 입장, 데이트, 연인・배우자",음식이 맛있어요,9,3
31107834,hae****,가격이 이렇게 저렴한데 너무 맛있어서 자주 오는 단골집입니당 육회비빔밥 존맛👏👏👏,2025-04-09,"저녁에 방문, 예약 없이 이용, 대기 시간 바로 입장, 친목, 친구",음식이 맛있어요,2,2
31107834,hyu****,마시써요,2025-04-09,"저녁에 방문, 예약 없이 이용, 대기 시간 바로 입장, 데이트, 연인・배우자",재료가 신선해요,192,1
31107834,구구7211,육회초밥 맛있어서 자주와요~~😙,2025-04-09,"점심에 방문, 예약 없이 이용, 대기 시간 바로 입장, 혼자",음식이 맛있어요,10,2
31107834,dud****,조용ㅇ하고 양이 많아서 너무 좋습니다!,2025-04-08,"점심에 방문, 예약 없이 이용, 대기 시간 바로 입장, 일상, 혼자",음식이 맛있어요,7,1
31107834,이민성8858,근처에 부모님과 올만한 맛있고 깨끗한 식당입니다메뉴도 많고 친절하셔서 다음에도 또 오겠습니다~,2025-04-08,"점심에 방문, 예약 없이 이용, 대기 시간 10분 이내, 가족모임, 부모님",음식이 맛있어요,10,1
31107834,0복슝슝0,엄마랑 코스 메뉴로 먹었는데 맛있었어요~,2025-04-06,"저녁에 방문, 예약 없이 이용, 가족모임, 부모님",재료가 신선해요,23,1
31107834,lycoskim3,"할인도 되고, 친절하시고 음식도 맛있습니다~",2025-04-06,"저녁에 방문, 예약 없이 이용, 대기 시간 바로 입장, 데이트, 연인・배우자",음식이 맛있어요,20,1
31107834,츠유86,직원분들도 친절하고 맛있었어요,2025-04-06,"저녁에 방문, 예약 없이 이용, 대기 시간 바로 입장, 데이트, 연인・배우자",음식이 맛있어요,17,1
31107834,하키1056,다같이 올리고 싶었는데.. 맛있어서 나올 때마다 먹어치우느라 따로따로 올려요 ㅋㅋ정신 놓고 먹을 정도로 맛있습니다!!,2025-04-06,"저녁에 방문, 예약 없이 이용, 대기 시간 바로 입장, 데이트, 연인・배우자",음식이 맛있어요,23,1
31107834,게살비빔,신선하고 맛있어요 매운탕도 맛있었습니다 감사합니다!,2025-04-06,"점심에 방문, 예약 없이 이용, 대기 시간 바로 입장, 데이트, 연인・배우자",음식이 맛있어요,20,1
31107834,jiy****,가성비가 좋고 우동을 안시켜도 나와서 좋아요 남자 사장님이 친절하시고 이벤트가 많아서 좋았어요,2025-04-06,"점심에 방문, 대기 시간 바로 입장, 데이트, 연인・배우자",혼밥하기 좋아요,5,1
31107834,강림55,적은 가격으로 가성비 있게 즐기기 좋은 것 같아요!,2025-04-05,"점심에 방문, 예약 없이 이용, 대기 시간 바로 입장, 일상, 혼자",음식이 맛있어요,13,1
31107834,pc****,혼밥하기 좋고 가성비가 너무 좋아요.연어덮밥이랑 초밥도 너무 맛있어요!,2025-04-05,"점심에 방문, 예약 없이 이용, 대기 시간 바로 입장, 일상, 혼자",음식이 맛있어요,3,1
31107834,예에이예에이,"깔끔하고 맛있고, 조용히 혼자 먹기 좋아요 ㅎㅎ",2025-04-04,"점심에 방문, 예약 없이 이용, 대기 시간 바로 입장, 일상, 혼자",음식이 맛있어요,41,2
31107834,cj****,가성비 갑~~ 스시 준 정말 맛있습니다.,2025-04-04,"점심에 방문, 예약 후 이용, 대기 시간 10분 이내, 친목, 일상, 친구, 지인・동료",음식이 맛있어요,7,1
31107834,예에이예에이,오늘따라 초밥이 너무 먹고싶었는데 이렇게 맛있는 초밥집이 있어서 넘 좋아용!!!,2025-04-03,"저녁에 방문, 예약 없이 이용, 대기 시간 바로 입장, 일상, 혼자",음식이 맛있어요,41,1
31107834,인블74,너무너무 맛있어요 ㅠㅠ 런치 초밥 구성도 알차고 최고네요!,2025-04-03,"점심에 방문, 예약 없이 이용, 대기 시간 바로 입장, 친목",음식이 맛있어요,22,1
31107834,오늘차,"모둠초밥 구성이 다양해서 골라 먹는 재미가 있었어요. 생선초밥부터 육회, 유부초밥까지 한 판에 담겨 있어 취향 따라 즐기기 좋았고, 색감도 예뻐서 먹기 전에 눈부터 즐거웠어요. 초밥 크기도 적당해서 한입에 먹기 편했고, 전체적으로 균형 잡힌 구성이어서 만족스러웠어요!",2025-04-02,"저녁에 방문, 예약 없이 이용, 대기 시간 바로 입장, 일상, 친구",음식이 맛있어요,385,1
31107834,아우름동물병원,기대 이상으로 맛있어서 잘 먹었어요초밥도 모밀도 가라아게도 맛있네요번창하세요,2025-03-30,"저녁에 방문, 예약 없이 이용, 대기 시간 바로 입장, 데이트, 연인・배우자",친절해요,1,1
31107834,Seren77,노량진쪽에 있는 유일한 초밥집입니다! 맛있고 런치 가격이 합리적입니다!,2025-03-30,"점심에 방문, 예약 없이 이용, 대기 시간 바로 입장, 데이트, 연인・배우자",음식이 맛있어요,7,1
31107834,lde****,가성비 좋고 회가 신선해요,2025-03-30,"점심에 방문, 예약 없이 이용, 대기 시간 바로 입장, 친목, 친구",가성비가 좋아요,37,2
31107834,쿄쿄8747,초밥 구성이 좋고 가성비 있어요맛은 당연히 있습니다!,2025-03-29,"저녁에 방문, 예약 없이 이용, 대기 시간 바로 입장, 일상, 연인・배우자",인테리어가 멋져요,20,1
31107834,깨방정87,항상 좋습니다,2025-03-28,"저녁에 방문, 예약 없이 이용, 대기 시간 바로 입장, 나들이, 친구",재료가 신선해요,14,5
31107834,모구모구리,맛있어요.,2025-03-28,"점심에 방문, 예약 없이 이용, 대기 시간 바로 입장, 일상, 혼자",음식이 맛있어요,647,1
31107834,fcs****,친절한 스텝.혼밥하기 너무 편하고.육회비빔밥   가격은 너무 미안할 정도였어요 재료가 신선하다는 느낌.언제나 육회비빔밥 이 땡기면 여기 오자,2025-03-25,"저녁에 방문, 예약 없이 이용, 대기 시간 바로 입장, 일상, 혼자",음식이 맛있어요,3,1
31107834,메로멜론메롱구이,가성비도 좋고 맛있어서 정말 좋아요~,2025-03-23,"점심에 방문, 예약 없이 이용, 대기 시간 바로 입장, 일상, 부모님",재료가 신선해요,13,1
31107834,lde****,회가 신선하고 맛있어요,2025-03-23,"점심에 방문, 예약 없이 이용, 대기 시간 바로 입장, 나들이, 친구",가성비가 좋아요,37,1
31107834,똘똘2 누나,너무 맛있고 분위기가 좋아요 ㅎㅎ,2025-03-23,"점심에 방문, 예약 없이 이용, 대기 시간 바로 입장, 데이트, 친구",매장이 넓어요,296,1
31107834,진봉0,너무 맛있습니당~.~,2025-03-23,"점심에 방문, 예약 없이 이용, 대기 시간 바로 입장, 일상, 혼자",친절해요,31,1
31107834,als****,맛있어요!,2025-03-22,"저녁에 방문, 예약 없이 이용, 대기 시간 바로 입장, 데이트, 연인・배우자",음식이 맛있어요,81,1
31107834,초코초콜릿,아주괜찮아요 자주옵니다! 연어덮밥 맛있어요,2025-03-22,"점심에 방문, 예약 없이 이용, 대기 시간 바로 입장, 일상, 기타",음식이 맛있어요,980,4
31107834,Oneul81,노량진에서 누가 초밥 먹자 하면 꼭 데려가는 스시준입니다! 저도 친구 덕에 알게 되어 꾸준히 방문하고 있어요ㅎㅎ 친구들과 초밥 먹고싶을때 오는 곳 입니다 ㅎㅎ 초밥이 맛있고 양도 꽤 많은데도 가격이 합리적이라 초밥 먹고 싶을 때 찾게 돼요!,2025-03-22,"점심에 방문, 예약 없이 이용, 대기 시간 바로 입장, 일상, 친구",음식이 맛있어요,3,1
31107834,한번뿐인인생67,맛도좋고 서비스도 아주 최고입니다,2025-03-22,"점심에 방문, 예약 없이 이용, 대기 시간 10분 이내, 일상",음식이 맛있어요,21,1
31107834,seorin91,항상 맛있게 잘먹고있습니다!,2025-03-21,"저녁에 방문, 예약 없이 이용, 대기 시간 바로 입장, 친목, 친구",음식이 맛있어요,55,2
31107834,토익과외01087846151,노량진에서 젤 좋아하는 초밥집이예요,2025-03-20,"점심에 방문, 예약 없이 이용, 대기 시간 바로 입장, 일상, 혼자",음식이 맛있어요,34,1
31107834,김정아6035,좋아요,2025-03-17,저녁에 방문,음식이 맛있어요,2930,3
31107834,duh****,가격이랑 혼자서도 먹기 좋습니다,2025-03-17,"점심에 방문, 예약 없이 이용, 대기 시간 바로 입장, 일상, 혼자",가성비가 좋아요,31,1
31107834,초코초콜릿,맛있어요!가격도 괜찮고 늘 만족하고있습니다 맛나용,2025-03-16,"저녁에 방문, 예약 없이 이용, 대기 시간 바로 입장, 친목, 친구",음식이 맛있어요,980,3
31107834,깨방정87,언제나 좋습니다,2025-03-16,"저녁에 방문, 예약 없이 이용, 대기 시간 바로 입장, 데이트, 친구",음식이 맛있어요,14,4
31107834,gim****,,2025-03-16,"저녁에 방문, 예약 없이 이용, 대기 시간 바로 입장, 데이트, 연인・배우자",음식이 맛있어요,6,1
31107834,yj1****,깔끔하고 맛나용,2025-03-16,"저녁에 방문, 예약 없이 이용, 대기 시간 바로 입장, 일상, 혼자",음식이 맛있어요,93,14
31107834,rla****,잘 먹었습니다 ㅎㅎ,2025-03-16,"점심에 방문, 예약 없이 이용, 대기 시간 바로 입장, 일상, 연인・배우자",음식이 맛있어요,15,2
31107834,멋진남자1652,부모님 모시고 자주 방문합니다모든분들친절하시고요특히 사장님 ^^~맛있고 신선하고 재료가 좋아요번창하시길 기원합니다 사장님 수고하세요 ^^~~~,2025-03-15,"저녁에 방문, 예약 없이 이용, 대기 시간 바로 입장, 가족모임, 부모님",음식이 맛있어요,8,1
31107834,온앤온리닉네임,"미니우동, 런치, 모듬초밥다맛있어요!! 가성비 최고입니다!!",2025-03-15,"점심에 방문, 예약 없이 이용, 대기 시간 10분 이내, 데이트, 연인・배우자",친절해요,714,1
31107834,ing3099,👍👍👍👍👍👍👍👍🙂🙂🙂,2025-03-15,"점심에 방문, 포장·배달 이용, 대기 시간 10분 이내",혼밥하기 좋아요,4,1
31107834,파랑팔아75,양많고 맛있게먹었습니다~~,2025-03-14,"저녁에 방문, 예약 없이 이용, 대기 시간 바로 입장, 친목, 나들이, 친구",음식이 맛있어요,3,1
31107834,뇽01,노량진 가성비 맛집입니다!구성도 알차고 맛나요!밥양도 적당해서 여자분들이 드시면 좋을 세트에요!!,2025-03-14,"점심에 방문, 예약 없이 이용, 대기 시간 바로 입장, 친목, 친구",차분한 분위기에요,67,1
31107834,깨방정87,항상 좋습니다!!!,2025-03-13,"저녁에 방문, 예약 없이 이용, 대기 시간 바로 입장, 친목, 지인・동료",음식이 맛있어요,14,3
31107834,Bluv,"매장이 깔끔하고, 음식도 맛있어요!이곳에서 혼밥은 처음인데 혼밥하기도 좋은거 같아요👍👍👍👍",2025-03-12,"저녁에 방문, 예약 없이 이용, 대기 시간 바로 입장, 일상, 혼자",음식이 맛있어요,40,1
31107834,Leo MESSI 10,가성비도 너무 좋고 사장님도 완전 짱짱 친절하십니다!!자주 올게요,2025-03-10,"저녁에 방문, 예약 없이 이용, 대기 시간 바로 입장, 친목, 지인・동료",음식이 맛있어요,22,2
31107834,dlvvkfl88,가성비도 좋구 맛있는 초밥 잘먹겠습니다,2025-03-10,"저녁에 방문, 예약 없이 이용, 대기 시간 바로 입장, 데이트, 연인・배우자",음식이 맛있어요,17,1
31107834,콩컹이42,너무너무너무 맛있고 여기는 진짜 재방문무조건임 내 최애맛집👍🏻👍🏻,2025-03-10,"저녁에 방문, 예약 없이 이용, 대기 시간 바로 입장, 데이트, 친구",음식이 맛있어요,30,3
31107834,석68,레전드 노량진 초밥맛집!!벌써 3번째 방문째네요 점심마다 입맛없을때회사직원분들이랑 초밥 먹으러 자주오는데진짜 너무 맛있어요 사장님 ㅠㅠㅠ광어랑 구운연어 진짜 너무 맛있습니다또올게요!!,2025-03-10,"점심에 방문, 예약 없이 이용, 대기 시간 바로 입장, 데이트, 친구",음식이 맛있어요,57,3
31107834,REEEEE,저번에 방문하고 너무좋아서 재방문했어요 회식하기 너무좋습니다 맛있어요!,2025-03-09,"저녁에 방문, 예약 없이 이용, 대기 시간 바로 입장, 친목, 일상, 회식, 지인・동료",대화하기 좋아요,9,2
31107834,du****,맛있게 잘 먹구 갑니다! 가성비도 맛도 다 넘 좋고 친절하셔서 기분 좋게 밥 먹었어요😁,2025-03-09,"저녁에 방문, 예약 없이 이용, 대기 시간 바로 입장, 데이트, 연인・배우자",친절해요,8,1
31107834,police74795,맛있게 잘 먹고 갑니다~!!,2025-03-09,"점심에 방문, 예약 없이 이용, 대기 시간 바로 입장, 나들이, 친구, 혼자",음식이 맛있어요,27,1
31107834,재워닛,가성비 진짜 최곱니다 !! 양도 많고 가격도 저렴하고 벌써 몇번째 오는 건지 모르겠네요 ㅎㅎ 무엇보다 재료가 항상 싱싱해서 먹으면서 기분이 좋네요 감사합니다 ~,2025-03-08,"저녁에 방문, 예약 없이 이용, 대기 시간 바로 입장, 데이트, 친구",음식이 맛있어요,62,3
31107834,이나귱,"저번에 먹고 너무 맛있어서 또 방문했습니다키워드 5개 밖에 못고르는거 너무 아쉽네요,,,맛이면 맛 서비스면 서비스 머 하나 빠지는게 없는데 키워드가 5개뿐이라니….. 제 또간집 입니다..! 항상 일 끝나고 저녁에 방문 했는데 회사 근처였으면 점심 먹으러 자주 왔을거 같아요 제 친구가 예민한편이라 해산물에서 비린내 나면 못먹는데 여기는 너무 맛있다고 만족해하더라구요! 제가 우겨서 여기 온건데 만족해하는 모습을 보니 뿌듯하더라구요 ㅋㅋㅋㅋㅋ 앞으로 여기서 오래 장사해주세요 ㅜㅜㅜ ❤️❤️",2025-03-08,"저녁에 방문, 예약 없이 이용, 대기 시간 바로 입장, 친목, 친구",혼밥하기 좋아요,43,2
31107834,ryu****,음식이 너무맛있어요!!,2025-03-08,"저녁에 방문, 예약 없이 이용, 대기 시간 바로 입장, 일상, 지인・동료",음식이 맛있어요,8,3
31107834,daoni1013,우동도 같이 나오는 세트인데 우동은 일행 오면 주신다고 배려해주셔서 사진에는 못찍었어요..!!집앞에 매장있으면 맨날 오고싶을정도로 가성비있고 맛있어요ㅠㅠㅠ노량진 살고싶어요..,2025-03-08,"점심에 방문, 예약 없이 이용, 대기 시간 바로 입장, 데이트, 연인・배우자",음식이 맛있어요,39,1
31107834,rla****,저번에는 코스요리 이번엔 초밥! 잘 먹고 갑니다,2025-03-08,"점심에 방문, 예약 없이 이용, 대기 시간 바로 입장, 일상, 연인・배우자",음식이 맛있어요,15,1
31107834,경주8161,혼밥할려고 찾아보다가 런치초밥이 너무 저렴해서 한 번 가봤어요! 진짜 가성비 최고이고 제가 그렇게 많이 먹는편은 아니긴한데 10피스만 해도 너무 배불렀어요!진짜 가성비 최고.. 앞으로 근처가면 종종 갈 것 같아요!재방문 안 할 이유가 없어요.. 든든하게 잘 먹었습니다! 감사합니다ㅎㅎ,2025-03-08,"점심에 방문, 예약 없이 이용, 대기 시간 바로 입장, 일상, 혼자",친절해요,43,1
31107834,라니9,구성이 알차고 맛있어요!! 가격도 다른 곳과 비교해서 저럼합니다 ㅎㅎ 런치 세트도 추천 드립니다!,2025-03-07,"점심에 방문, 예약 없이 이용, 대기 시간 바로 입장, 데이트, 연인・배우자",음식이 맛있어요,26,2
31107834,밍무닝,회덮밥 7900원에 5%할인도 해주시고 우동이랑 양배추샐러드도 나와요ㅠㅠ 가성비 최고🩷,2025-03-07,"점심에 방문, 예약 없이 이용, 대기 시간 바로 입장, 친목, 친구",음식이 맛있어요,999,2
31107834,happyhoper,,2025-03-06,"점심에 방문, 예약 없이 이용, 대기 시간 바로 입장, 데이트, 연인・배우자",음식이 맛있어요,53,1
31107834,7ce****,불초밥 대박! 강추드립니다 ㅎㅎ 여러번왔는데 이번엔 리뷰써요,2025-03-05,"저녁에 방문, 예약 없이 이용, 대기 시간 바로 입장, 데이트, 연인・배우자",음식이 맛있어요,40,2
31107834,pmk****,벌써 3번째 방문! 혼밥하기 너무 좋아요 😍 스시 생각날때 간단하게 먹기 너무 좋구 무엇보다 구성도 알차서 계속 방문하게 되네요 💕,2025-03-05,"저녁에 방문, 예약 없이 이용, 대기 시간 바로 입장, 나들이, 혼자",음식이 맛있어요,86,3
31107834,용용슨,런치메뉴 가성비도 좋구 맛도 좋네여지나가다 보기만 하고 처음먹어보는데 자주 이용해야게숴용!!,2025-03-05,"점심에 방문, 예약 없이 이용, 대기 시간 바로 입장, 일상, 혼자",음식이 맛있어요,22,1
31107834,mckim84,갈때마다 장사가 잘되네요워낙 맛집이라오늘도 만족하는 식사였습니다.노량진에 이런 곳이 있다니항상 올때마다 행복합니다.잘먹었습니다.,2025-03-03,"저녁에 방문, 예약 없이 이용, 대기 시간 바로 입장, 일상, 혼자",음식이 맛있어요,134,11
31107834,이성호9,항상 맛잇게 잘 먹고 갑니다!!!재료가 신선해서 자주 오게 되는 거 같아요 ㅎㅎ,2025-03-01,"저녁에 방문, 예약 없이 이용, 대기 시간 바로 입장, 친목, 혼자",음식이 맛있어요,30,9
31107834,mylovekhk68,,2025-03-01,"점심에 방문, 예약 없이 이용, 대기 시간 바로 입장, 데이트, 연인・배우자",음식이 맛있어요,28,1
31107834,pig****,여자친구랑 와서 아주 맛있게 먹고 즐거운 시간 보내고 갑니다!!,2025-03-01,"점심에 방문, 예약 없이 이용, 대기 시간 바로 입장, 데이트, 연인・배우자",음식이 맛있어요,8,1
31107834,혜미니꾸,모둠초밥에서 방어초밥을 맛볼수있어서 좋있어요 런치메뉴라 가격도 합리적이고 양도 적절해서 배불리 잘먹었습니다!,2025-03-01,"점심에 방문, 예약 없이 이용, 대기 시간 바로 입장, 친목, 친구",음식이 맛있어요,12,1
31107834,으어으엉,처음와서 먹어봤는데 가성비 좋고 맛도 좋네요~올 수 있을때 자주 와야겠어용!,2025-02-28,"저녁에 방문, 예약 후 이용, 대기 시간 10분 이내, 데이트, 연인・배우자",음식이 맛있어요,7,1
31107834,밍9861,맛있어요~~! 우동이랑 샐러드도 같이 나와좋아요,2025-02-28,"저녁에 방문, 예약 없이 이용, 대기 시간 바로 입장, 데이트, 연인・배우자",음식이 맛있어요,112,1
31107834,이연우1,사장님도 친절하시고 너무 맛있게 잘 먹다가 갑니다 ㅎㅎ 다음에도 또 방문 할 것 같아요!!!,2025-02-27,"저녁에 방문, 예약 없이 이용, 대기 시간 바로 입장, 친목, 친구",음식이 맛있어요,10,1
31107834,현준02,맛있고 인테리어도 깔끔해서 좋아요,2025-02-27,"저녁에 방문, 예약 없이 이용, 대기 시간 바로 입장, 친목, 친구",음식이 맛있어요,13,1
31107834,민들레020,가성비 좋고 맛있어요♥︎,2025-02-27,"점심에 방문, 대기 시간 바로 입장, 친목, 친구",음식이 맛있어요,20,1
