place_id,nickname,content,date,situations,keywords,review_count,visit_count
1669322390,vil****,맛잇어요 잘온거같아여,2025-03-27,"저녁에 방문, 예약 없이 이용, 대기 시간 바로 입장, 친목, 친구, 지인・동료",음식이 맛있어요,16,1
1669322390,자룡이85,깨끗하고 친절하고 맛있어요!,2025-03-27,"저녁에 방문, 예약 없이 이용, 대기 시간 바로 입장, 가족모임, 아이",음식이 맛있어요,8,1
1669322390,lee****,,2025-03-27,"점심에 방문, 예약 없이 이용, 대기 시간 바로 입장, 친목, 지인・동료",음식이 맛있어요,18,1
1669322390,나이스79,맛있게 잘 먹었습니다,2025-03-26,"저녁에 방문, 예약 없이 이용, 대기 시간 10분 이내, 일상, 연인・배우자, 아이",음식이 맛있어요,30,3
1669322390,클쭈마쯔,역시 맛있어요 푸파 완료!! 말해뭐해,2025-03-26,"저녁에 방문, 예약 없이 이용, 대기 시간 바로 입장, 친목, 친구",음식이 맛있어요,17,1
1669322390,너구링50,"가격대비 양도 많았고, 고기 품질이 그냥봐도 너무너무 좋아보였답니다 고기 너무 맛있네용🥰",2025-03-25,"저녁에 방문, 예약 없이 이용, 대기 시간 바로 입장, 데이트, 연인・배우자",인테리어가 멋져요,501,1
1669322390,늘푸른돌,오늘 처음 방문했는데 메뉴 구성이 알차고 가성비 있네요.다음에 또 방문하고 싶네요!,2025-03-25,"저녁에 방문, 예약 없이 이용, 대기 시간 바로 입장, 일상, 지인・동료",음식이 맛있어요,26,1
1669322390,반짝반짝Twinkling,"반포 소고기반포갈비 한판 58,000원갈비살, 토시살,소갈비살을 모두 맛볼 수 있는 가성비 소고기집! 한판에는 된장찌개가 포함이라 더욱 좋은데~ 불위에 올려서 된장찌개 쫄여서 고기랑 같이 먹으면 더 맛있어요!",2025-03-24,"저녁에 방문, 예약 후 이용, 대기 시간 바로 입장, 일상, 연인・배우자",특별한 메뉴가 있어요,783,1
1669322390,메시무쉬,"한우한판세트 먹었는데, 정말 가성비 넘치고 너무 맛있었습니다. 감기로 진짜 맛밥이 없었는데, 단백질 많이 먹고 금세 훌훌 털어버린것같네요~  두분오셔서 이거랑 된장찌게랑 드시면 정말 딱 즐거운 식사같습니다.",2025-03-24,"저녁에 방문, 예약 후 이용, 대기 시간 바로 입장, 친목, 혼자",코스요리가 알차요,31,1
1669322390,벨벳72,고기 너무 때깔이 좋고 맛있어요!!!! 자주자주 오게 되네요!,2025-03-23,"저녁에 방문, 예약 없이 이용, 대기 시간 바로 입장, 데이트, 연인・배우자",음식이 맛있어요,90,2
1669322390,리즈3735,고기 질이 좋고 맛있어요 가성비 좋습니다 매장도 깨끗해요,2025-03-23,"점심에 방문, 예약 없이 이용, 대기 시간 바로 입장, 일상, 부모님",친절해요,18,1
1669322390,dee****,소갈비살 입에서 녹습니다ㅋㅋ양념도 맛있고 한판 강추합니다웨이팅해서 온 보람이 있네요 ㅋ,2025-03-22,"저녁에 방문, 예약 없이 이용, 대기 시간 10분 이내, 일상, 연인・배우자",음식이 맛있어요,7,1
1669322390,니콜이43,근처 백화점 왔다가 쇼핑하고 배고파서 왔는데 소고기맛집이네용😍 고기 질 좋고 맛있고 밑반찬들도 푸짐해요!,2025-03-22,"저녁에 방문, 예약 없이 이용, 대기 시간 바로 입장, 데이트, 연인・배우자",음식이 맛있어요,488,1
1669322390,빛보다빠름59,고기가 정말 맛있고 사장님과 직원분이 엄청 친절하세요.  분위기도 좋아서 술도 먹기 좋아요.,2025-03-22,"점심에 방문, 예약 없이 이용, 대기 시간 바로 입장, 가족모임, 연인・배우자, 부모님",음식이 맛있어요,4,1
1669322390,꿩3,,2025-03-21,"저녁에 방문, 예약 후 이용, 대기 시간 바로 입장, 친목, 지인・동료",음식이 맛있어요,10,1
1669322390,gua****,고기질 좋고 맛있어요 가성비  좋고  반찬도 맛있네요,2025-03-21,"저녁에 방문, 예약 없이 이용, 대기 시간 바로 입장, 친목, 친구",음식이 맛있어요,63,1
1669322390,난누구맛집은어디냐찾아보자꾸나,반포갈비 고속터미널숯불소갈비 전문점 반포갈비 한판 450그람에 토시살 150 갈비살 150 본갈비살 150  구성이고  58000원이예요.숙성고기라 부드럽고 육즙도 꽉차있어요.두판 먹었는데 맛있어서 그런지 부드럽고 술술 넘어가네요.가성비 최고의 맛집입니다.서비스로 나오는 된장찌개는 쏘쏘..그래도 가격대비 훌륭한맛집이예요.한번 더 가야겠어요.,2025-03-19,"저녁에 방문, 예약 후 이용, 대기 시간 바로 입장, 친목, 친구",음식이 맛있어요,1100,1
1669322390,령이9633,"고기너무 맛있어요, 부모님 모시고 방문했는데 너무 맘에 들어요,다음에는 친구랑 방문예정입니다~잘먹고 갑니다~",2025-03-18,"점심에 방문, 예약 후 이용, 대기 시간 바로 입장, 가족모임, 부모님",음식이 맛있어요,4,1
1669322390,아톰아빠98,맛 집 이에요.  지주 와야 할듯,2025-03-18,"점심에 방문, 예약 후 이용, 대기 시간 10분 이내, 친목, 친구",음식이 맛있어요,12,1
1669322390,byu****,,2025-03-16,"저녁에 방문, 예약 없이 이용, 대기 시간 바로 입장, 가족모임, 부모님",고기 질이 좋아요,4,1
1669322390,Kim Pro,이동갈비 먹고 너무 맛있어서 두번째 왔습니다.부드럽고 자극적이지 않아서 아이도 잘 먹네요!,2025-03-16,"점심에 방문, 예약 없이 이용, 대기 시간 바로 입장, 데이트, 연인・배우자",음식이 맛있어요,78,1
1669322390,태권브이76,와..  넘 맛있어요!!!! 먹느라 급히 찍었어요!!!,2025-03-16,"점심에 방문, 예약 후 이용, 대기 시간 바로 입장, 가족모임, 연인・배우자, 아이",음식이 맛있어요,30,1
1669322390,크리스피52,,2025-03-16,"점심에 방문, 예약 후 이용, 대기 시간 바로 입장, 나들이",음식이 맛있어요,20,1
1669322390,CVTK,,2025-03-15,"저녁에 방문, 예약 없이 이용, 대기 시간 바로 입장, 가족모임, 부모님",음식이 맛있어요,1348,1
1669322390,징징11,가족 기념일 회싯으로 방문했어요. 매장이 넓고 집이랑 가까워서 가족회식에 딱입니다. 잘먹었습니다. ^^,2025-03-15,"저녁에 방문, 예약 후 이용, 대기 시간 바로 입장, 기념일, 부모님",음식이 맛있어요,11,1
1669322390,꽃잎처,반포갈비 한판 먹었어요 소고기 된장찌개도 포함되어있어서 좋네요 찌개도 맛있고 고기도 맛있어요,2025-03-14,"저녁에 방문, 예약 없이 이용, 대기 시간 바로 입장, 데이트, 연인・배우자",음식이 맛있어요,22,1
1669322390,뽀숑네,고기가 맛있고 미나리 육회 엄지척!,2025-03-14,"점심에 방문, 예약 후 이용, 대기 시간 바로 입장, 일상, 지인・동료",고기 질이 좋아요,264,1
1669322390,lov****,고기가 맛있고 와사비 버섯이 잘 어울려요. 아이가 잘 먹었어요^^,2025-03-13,"저녁에 방문, 예약 없이 이용, 대기 시간 바로 입장, 가족모임, 아이",음식이 맛있어요,48,1
1669322390,조희수92,고기 신선하고 좋아요 ㅎㅎ단체로 회식하기 좋고 된장 맛잇어서 나오자마자 나눠먹엇네여 !직장이랑 가까워서 자주 올 것 같아요,2025-03-12,"저녁에 방문, 예약 없이 이용, 대기 시간 바로 입장, 친목, 지인・동료",매장이 청결해요,57,1
1669322390,소여니6513,,2025-03-11,"저녁에 방문, 대기 시간 10분 이내, 친목, 연인・배우자",음식이 맛있어요,4,1
1669322390,웰시토끼23,"무조건 고기한판에 육회추가,테라 한병에 세로2병 시켜야합니다이세상 소갈비맛이아니에요이제 단골될거에요여름이오기전에 또올게요🤓😎",2025-03-11,"저녁에 방문, 예약 없이 이용, 대기 시간 바로 입장, 일상, 친구",음식이 맛있어요,31,1
1669322390,dhk****,갈만한곳없어서 기대안하고 갔는데 가성비좋고 맛있게 먹었어요직원들 친절하고 평일에도 꽉찼네요소문난 맛집이였네요~자주가야겠어요~,2025-03-11,"저녁에 방문, 예약 후 이용, 대기 시간 바로 입장, 친목, 지인・동료",음식이 맛있어요,7,1
1669322390,sj308,"반포갈비 한판 추천합니다이 한판을 시키면 특토시살, 본갈비살, 소갈비살이렇게 세 부위를 한 번에 즐길 수 있어요. 부위마다 풍미가 다 달르고 씹는 맛도 달라서 다양하게즐기실 수 있습니다!^^",2025-03-11,점심에 방문,음식이 맛있어요,1243,1
1669322390,Fabiola,"헐.... 진짜 최근에 먹은 소고기 중에 제일 맛있었어요ㅠㅠㅠ....😍😍❤️🫶🔥🌟👍입에서 진짜 살살 녹아요!!!어떻게 이렇게 부드러운거에요....?!고터맛집 1등이라고 생각합니다 진짜...한판 가격도 합리적이고, 기본으로 나오는 찌개도 든든해서 너무 맛있게 먹었습니다🙇‍♀️🐽🥰❣️",2025-03-10,"저녁에 방문, 예약 후 이용, 친목, 친구",음식이 맛있어요,72,1
1669322390,ppo****,,2025-03-10,"저녁에 방문, 예약 없이 이용, 대기 시간 10분 이내, 친목, 부모님",음식이 맛있어요,6,1
1669322390,효HS,너무 맛있었어요👍🏻,2025-03-10,"저녁에 방문, 예약 없이 이용, 대기 시간 바로 입장, 친목, 친구",음식이 맛있어요,11,1
1669322390,무야호2378,매장 내부도 깔끔하고 고기 질이 너무 좋아요! 특제소스까지 있어서 더 맛있게 먹었습니다:),2025-03-10,"저녁에 방문, 예약 없이 이용, 대기 시간 바로 입장, 일상, 부모님",인테리어가 멋져요,60,1
1669322390,촌줌마,고속터미널 반포갈비 동생과 함께 맛있게 먹었어요 명인 숙성소고기라서 설살 녹네요 고기 꼬습네요,2025-03-10,"점심에 방문, 예약 후 이용, 대기 시간 바로 입장, 가족모임, 친척・형제",음식이 맛있어요,176,1
1669322390,HAJJO,"숯불에 구워먹는 소고기인데도 환풍기 세기가 세서 연기로 인한 불편함이 없었어요. 고기 육질도 너무 좋았고, 구웠을때 육즙, 육향도 풍부했습니다. 반포갈비 한판 주문하면 3가지 부위를 맛볼 수 있고, 된장찌개도 서비스로 나와서 가성비 좋게 식사할 수 있었어요👍",2025-03-09,"저녁에 방문, 예약 후 이용, 대기 시간 바로 입장, 데이트, 일상, 연인・배우자",음식이 맛있어요,1085,1
1669322390,drake,,2025-03-08,"저녁에 방문, 예약 없이 이용, 대기 시간 30분 이내, 데이트, 연인・배우자",음식이 맛있어요,75,1
1669322390,phi****,소고기 맛집 인정!!,2025-03-08,"점심에 방문, 예약 후 이용, 대기 시간 바로 입장",음식이 맛있어요,267,1
1669322390,굳모닝이에요,고기가 아즈 맛있어요. 된장찌개더 같이 나오는데 맛있어요,2025-03-08,"점심에 방문, 예약 후 이용, 대기 시간 바로 입장, 친목, 지인・동료",음식이 맛있어요,489,1
1669322390,lg2636,맛있어요,2025-03-06,"저녁에 방문, 예약 후 이용, 대기 시간 바로 입장, 친목, 지인・동료",음식이 맛있어요,6,1
1669322390,명장덕장,고속터미널 상가 지하에 이런 고깃집이 있는줄 몰랐네요 자주 오겠습니다 👌,2025-03-05,"저녁에 방문, 예약 없이 이용, 대기 시간 바로 입장, 회식, 지인・동료",음식이 맛있어요,21,1
1669322390,Aaaaa123,분위기도 좋고 맛있습니다 !,2025-03-05,"저녁에 방문, 예약 없이 이용, 대기 시간 바로 입장, 친목, 지인・동료",음식이 맛있어요,7,1
1669322390,오로라9967,음식 레전드에요 고기 너무 좋네요 부드럽고 너무 맛있어요 다양한 부위가 있어서 좋아요 그리고 서비스 너무 너무 너무 좋아요 직원 분들 친절하셔서 편하게 먹었습니다 또 방문 할게요 꼭 가 보세요,2025-03-04,"저녁에 방문, 예약 후 이용, 대기 시간 바로 입장, 친목, 친구",음식이 맛있어요,1178,1
1669322390,늦바람 첫인상,명장 숙성 기법으로 숙성된 육즙 가득한 갈비살은 참숯에 구워 풍미가 좋고 불향까지 느껴진다.개인적으로 특토시살이 가장 부드럽고 고소했다.소고기된장찌개는 냉이와 소고기 그리고 큼직하게 썰어 넣은 두부 한모가 넉넉히 들어있고 집된장처럼 아주 맛있었다. 반포갈비의 포천이동갈비는 자극적이지 않고 많이 달지 않아서 포천에 가서 먹었던 이동갈비나 보다 훨씬 맛있었다.,2025-03-03,"점심에 방문, 예약 후 이용, 대기 시간 바로 입장, 일상, 아이",음식이 맛있어요,492,1
1669322390,셔니85,콜키지프리 1병 소식에 방문해 봤는데 고기도 부드럽고 맛있어서 재방문예정!냉이된장찌개도 냉이향기 솔솔~,2025-03-02,"저녁에 방문, 예약 없이 이용, 대기 시간 바로 입장, 일상, 연인・배우자, 아이",가성비가 좋아요,45,1
1669322390,하리처럼70,존맛탱임ㅠㅠ 육회와 물냉 필수!! 진짜 개맛도리💗,2025-03-02,"저녁에 방문, 예약 후 이용, 대기 시간 바로 입장, 가족모임, 부모님",음식이 맛있어요,62,1
1669322390,맛있어서다이어터,반포갈비,2025-03-02,"점심에 방문, 예약 후 이용, 대기 시간 바로 입장, 일상, 혼자",음식이 맛있어요,2050,1
1669322390,다이아26,너무맛있어서 사진찍기도전에  다 먹어버렸네요 ..ㅋㅋㅋ,2025-03-01,"저녁에 방문, 예약 없이 이용, 대기 시간 10분 이내, 기념일, 아이, 부모님",음식이 맛있어요,5,1
1669322390,차승현3,별점을 숨겨놓은 이유가 있습니다이렇게 질기고 맛없는 소고기는 처음입니다구이용으로 판매하는 고기가 아닌것 같아요국거리용 고기같습니다일부러 비방하는게 아니라... 정말로 맛이 없습니다고기 질이 너무 떨어져요그리고 된장찌개는 간이 안맞고 감칠맛 0 입니다재방문은 커녕 첫방문도 말리고싶습니다...,2025-03-01,"저녁에 방문, 예약 없이 이용, 대기 시간 바로 입장, 데이트, 연인・배우자",,10,1
1669322390,로얄회원23,"마블링 꽃을 입고 나오는 모듬한판🌹특토시살, 본갈비살, 소갈비살 세계음식 명인의 숙성기법으로 더욱 스페셜함 가득숯불 불향 가득 구워 한입 먹으니 함박 미소가,,오리지널 이동갈비의 진면목의 맛을 느낄 수 있는 포천이동갈비에 맥주킹이죠, 스텔라와 함께하니힐링 치트키였네요🍻소고기와 향긋한 냉이까지 넣어서 할머니가 해주시던 느낌 그대로 재현한 소고기 된장찌개에몽글몽글 포슬포슬 계란찜 곁들여주고비빔과 물냉면의 조합에 미나리 카운터까지 삼위일체 #미나리비빔물냉면 갈비 한 점 얹어먹으니다시 한번 미소가득이었습니다❤",2025-03-01,"점심에 방문, 예약 후 이용, 대기 시간 바로 입장, 친목, 나들이, 친구, 지인・동료",음식이 맛있어요,148,2
1669322390,드렁큰곰돌,"엄청난 비주얼과 맛을 즐길 수 있게 해주는 소갈비를 즐길 수 있는 곳이라 추천드리고 싶고, 사이드 메뉴 하나 하나 맛이 좋아서 제대로 반했던거 같아요 :) 다채로운 메뉴들로 힐링하는 시간 가져보시기 바랍니다 🙏",2025-03-01,"점심에 방문, 예약 후 이용, 대기 시간 바로 입장, 친목, 친구",음식이 맛있어요,147,1
1669322390,행복을나누는큐피트,오후 1시림에도 자리가 꽉찼던 음식에 진심을 가지고 고객울 대하는 직원들과 사장님이 함께하는 반포갈비친구들이랑 오랜만에 모여 줄거운 시간을 가졌는데요. 살살 녹는 고기와 미나리와 메추리알 4개가 들어간 냉면!!! 양념장이며 국물이며 미텼어 ㅠ ㅠ 거기에 보글보글 찌개와 계란찜!!이게 왠걸? 라면에 도가니까??말해 뭐해요! 연휴에 가족과 함께 외식 어떠세요?,2025-03-01,"점심에 방문, 예약 후 이용, 대기 시간 30분 이내, 친목, 친구",음식이 맛있어요,12,1
1669322390,bea****,된찌가 맛나고 한판구성이 좋네요. 양문이랑 비슷한데 조금 양이 적습니다. 그릇에 고추가루 이회 발견한건 좀,2025-02-28,"저녁에 방문, 예약 없이 이용, 대기 시간 바로 입장, 친목, 친구",음식이 맛있어요,82,1
1669322390,맛있어서기절,친구랑 고터갔다가 우연히 들렀는데 고기가 넘 맛있어서 반했습니다! 지하였는데 환기도 잘되서 그런 지 손님도 많더라구용. 특히 양념 특토시살 강추입니당 🤟,2025-02-28,"저녁에 방문, 예약 후 이용, 대기 시간 바로 입장, 친목, 친구",음식이 맛있어요,214,1
1669322390,좋은사람행복한사람,"고속터미널역 맛집 반포갈비 가족 단위로 가도 좋고 회식으로도 좋았어요!! 고기 질이 좋고 미나리물비빔냉면 꼭 드세요 ~~ 향도 좋고 정말 맛있답니다!! 반찬들도 전부 맛있고, 고기도 맛있어서 세트에다가 이동갈비도 추가해서 먹었어요!! 완전 강력 추천합니다 ~~ 방문해보세요!!",2025-02-28,"저녁에 방문, 예약 후 이용, 대기 시간 바로 입장, 일상, 친구",음식이 맛있어요,29,1
1669322390,Action10,아이와 함께 재방문했어요~ㅎㅎ고기 넘 맛있어서 먹을때 조용~~하네요ㅋㅋ,2025-02-27,"저녁에 방문, 예약 없이 이용, 대기 시간 바로 입장, 데이트, 연인・배우자, 친구",음식이 맛있어요,57,2
1669322390,ghehe,고기가 아주 신선하고 맛있어요!파김치도 많이 주시고 정말 최고입니당양배추 김치라고 하나 이것도 별미에요소갈비 고터 근처에서 여기 완전 강추입니당,2025-02-27,"저녁에 방문, 예약 없이 이용, 대기 시간 바로 입장, 친목, 친구",음식이 맛있어요,19,1
1669322390,sol****,소고기된장술밥은 냉이향이 솔솔 나구요고기는특토시살 진짜 쵝오 ㅎㅎㅎ 그동안 먹어본 토시살중 최고입니다,2025-02-27,"점심에 방문, 예약 없이 이용, 대기 시간 바로 입장, 데이트, 친구",음식이 맛있어요,33,1
1669322390,lee****,고기질이 좋고 맛있습니다.,2025-02-26,"저녁에 방문, 예약 없이 이용, 대기 시간 바로 입장, 일상, 연인・배우자",음식이 맛있어요,26,1
1669322390,유정우린,,2025-02-26,"저녁에 방문, 예약 후 이용, 대기 시간 바로 입장, 친목, 친구",음식이 맛있어요,120,1
1669322390,테크네58,양문 갈비때부터 애용했는데 여전희 가성비좋고 분위기 좋은 거 같습니다,2025-02-26,"저녁에 방문, 예약 없이 이용, 대기 시간 바로 입장, 친목, 연인・배우자",음식이 맛있어요,4,1
1669322390,2degree,음식이 맛있고 소갈비인데도 가격이 합리적이에요!,2025-02-26,"저녁에 방문, 예약 없이 이용, 대기 시간 바로 입장, 친목, 친구",인테리어가 멋져요,31,1
1669322390,망고8549,회식 장소로 딱입니다!고기 질이 좋아요 ! ! 토시살 추천합니당배부르게 먹고 갑니다아,2025-02-25,"저녁에 방문, 예약 후 이용, 대기 시간 바로 입장, 회식, 지인・동료",고기 질이 좋아요,3,1
1669322390,보리오빠34,고기 질이 매우 좋으며 화력이 좋아 잘구워집니다. 된장찌개도 너무 맛있어요!!! 그릇도 플라스틱이 아니라 스테인리스 용기라 좋습니다,2025-02-25,"저녁에 방문, 예약 후 이용, 대기 시간 바로 입장, 친목, 지인・동료",음식이 맛있어요,13,1
1669322390,뷰스타 에크리,"여기 오시면 반포갈비 한판 주문해보세요. 두툼하게 썰어진 고기가 보기만 해도 식감 제대로 자극하죠? 갈비살과 특토시살, 본갈비살까지 모두 맛볼 수 있는 구성에 소고기된장찌개도 서비스로 주는데,냉이 듬뿍 넣고 두부 커다랗게 숭덩숭덩 썰어 강된장으로 끓여낸 된장찌개가 할머니가 끓여주는 맛집 된장찌개 수준! 세계고기숙성장인의 고기 맛은 말할 것도 없고요.이런 곳은 자주 갈수록 개이득입니다.고로 저는 담주에 또 갈거예요. 강남 한복판에 이런 가성비 맛집은 널리 알려야죠.",2025-02-25,"저녁에 방문, 예약 후 이용, 대기 시간 바로 입장, 일상, 연인・배우자",음식이 맛있어요,67,1
1669322390,Sunnykim91,고기질이 좋아요ㅎㅎ반찬들도 다맛있어요~ㅎㅎ직원분들이친절해요~,2025-02-25,"저녁에 방문, 예약 후 이용, 대기 시간 바로 입장, 친목, 친구",음식이 맛있어요,17,1
1669322390,벨벳72,고깃집은 고기가 질 좋고 맛있으면 다 된거죠!!!!! 갈비살 토시살 본갈비살 다 너무 맛있어요!!!!,2025-02-25,"저녁에 방문, 예약 없이 이용, 대기 시간 바로 입장, 데이트, 연인・배우자",음식이 맛있어요,90,1
1669322390,깐풍기,괜찮은 소고기를 저렴하게 먹을수 있어요.,2025-02-25,"점심에 방문, 예약 없이 이용, 대기 시간 바로 입장, 친목, 연인・배우자",음식이 맛있어요,70,1
1669322390,천만뷰,숯불 최고에요고기도 맛있고 된장찌개도 맛있어요가성비 맛집입니다,2025-02-25,"점심에 방문, 예약 없이 이용, 대기 시간 바로 입장, 일상, 부모님",음식이 맛있어요,16,1
1669322390,오레와시로히게다,"매장도 넓고 깨끗하고,고기질과 맛이 아주 맘에 들더라구요.구성과 가격도 합리적이고,된장찌개가 고기랑 세트라서 더욱 좋습니다.맛있어요! 강추합니다^^",2025-02-23,"저녁에 방문, 예약 후 이용, 대기 시간 바로 입장, 데이트, 연인・배우자",인테리어가 멋져요,30,1
1669322390,푸드스틸러,반포갈비 소고기 세트 퀄리티 좋고 맛있어요숙성 고기 명인이라고 여기저기 붙어있는데 ! 닉값한다는 생각이 들었어요🙂‍↕️ 미나리 비빔물냉면 꼭 시키삼요~ 미나리 신선하고 냉면도 맛있음 !,2025-02-23,"점심에 방문, 예약 후 이용, 대기 시간 바로 입장, 데이트, 연인・배우자",음식이 맛있어요,1296,1
1165918398,men****,먼가 맛이 좀 변한거같다 면도 그릇아래엔 다 끊겨있고 너무 좋아해서 포장해서 소주랑 먹던집인데 ㅠ,2025-04-08,저녁에 방문,음식이 맛있어요,84,1
1165918398,920****,회사근처라 점심시간에 동료들이랑 자주 찾는 곳이에요! 청양시오라멘 너무맛있어요!! 요즘 대기가 많아져서 점심시간에 일찍가야 그나마 빨리 들어갈 수 있어요 ㅠㅠ 저날은 김추가만 했는데 풀토핑추천드려요><,2025-04-06,"점심에 방문, 예약 없이 이용, 대기 시간 10분 이내, 일상, 친구, 지인・동료",매장이 청결해요,69,1
1165918398,보오미90,,2025-04-03,저녁에 방문,음식이 맛있어요,734,3
1165918398,포니포뇨,친절하고 청결하고 분위기가 깔끔하니 너무 만족해요 라멘도 맛있어요,2025-04-02,"저녁에 방문, 예약 없이 이용, 대기 시간 바로 입장, 일상",음식이 맛있어요,326,1
1165918398,한지316,"시오 라멘 먹었는데 자가제면이라 맛있네요, 오리 올려주는 거 좋았고 사실 양이나 가격대비 가성비가 좋진 않습니다. 하지만 맛있습니다",2025-04-02,"저녁에 방문, 예약 없이 이용, 대기 시간 바로 입장, 일상, 혼자",음식이 맛있어요,310,1
1165918398,shtmdxor95,,2025-03-22,저녁에 방문,음식이 맛있어요,2482,2
1165918398,미니미7272,츠케멘 처음 먹어보는데 신기(?)했어요,2025-03-12,"점심에 방문, 예약 없이 이용, 대기 시간 10분 이내, 일상, 친구",음식이 맛있어요,119,1
1165918398,ㅋㅋㅋ421,데이트로 와숩니다,2025-03-01,"저녁에 방문, 예약 없이 이용, 대기 시간 바로 입장, 데이트, 연인・배우자",음식이 맛있어요,44,1
1165918398,구구구구구꾸꾸구구,퇴근하고 지인들이랑 저녁 먹으러 방문했어요시오라멘 주문했고 국물 깔끔 담백하고면발 훌륭하네요라멘양은 성인 남자가 먹기에조금 부족하다고 생각해요 사이드랑 같이 먹었더니 딱 좋았습니다 잘 먹고 갑니다😊,2025-02-27,"저녁에 방문, 예약 없이 이용, 대기 시간 바로 입장, 일상, 지인・동료",혼밥하기 좋아요,1020,1
