place_id,nickname,content,date,situations,keywords,review_count,visit_count
1648684223,son****,파스타랑 통닭 너무맛있어용,2025-01-27,"저녁에 방문, 예약 없이 이용, 대기 시간 바로 입장, 친목, 친구",친절해요,26,1
1648684223,임긍정95,사장님 친절하시고 매장이 깨끗해서 좋아용 :)재방문하겠습니다~!,2025-01-25,"저녁에 방문, 예약 없이 이용, 대기 시간 10분 이내, 나들이, 연인・배우자, 지인・동료",음식이 맛있어요,28,1
1648684223,awf****,친구한테 여기 가보고 싶다고 말하니까 바로 알던 곳!!! 이미 유명해서 놀랬네요 ㅋㅋㅋ 이 쪽 동네선 유명해서 기대했는데 역쉬 🤤🤤 파스타에 치킨 조합 폼미폼미 ㅠ 사룽합니다,2025-01-24,"저녁에 방문, 예약 후 이용, 대기 시간 바로 입장",음식이 맛있어요,56,1
1648684223,yoo****,여러 통닭을 먹어봤지만 여기는 인생통닭집입니다 통닭도 맛있고 누룽지가 미쳤어요 포장해서 좀 식어서 먹어도 똑같이 맛있어요 강추 👍👍 가게 내부도 넓고 맥주 마시기 좋아요!,2025-01-23,"저녁에 방문, 예약 없이 이용, 대기 시간 바로 입장, 데이트, 연인・배우자",음식이 맛있어요,23,1
1648684223,noi****,누룽지 통닭에 파스타 먹어봤는데 의외로 환상 조합! 서로 잘 어우러져 색다른 느낌? 완전 맛있고 또 생각나는 맛이라 다음에 또 먹고 싶어요~~~~,2025-01-21,"저녁에 방문, 예약 후 이용, 대기 시간 바로 입장, 일상, 친구",음식이 맛있어요,57,1
1648684223,lalala2661,"봉화산 산책갔다가 배고픈데 어디가지? 검색하다 오게된곳! 입구부터 반겨주시고 강쥐 밥도 전자레인지에 데워주시고 예뻐해주시고, 콘치즈누룽지통닭에 해산물크림파스타 시켰는데 양도 푸짐하고 너무 예쁘고 눈도 입도 호강했어요♡ 행복하네요😝",2025-01-20,"저녁에 방문, 예약 없이 이용, 대기 시간 바로 입장, 친목, 친구",음식이 맛있어요,477,1
1648684223,현루하,파스타랑 전기구이 통닭의 만남신기하고 맛도 좋고 굿굿 !,2025-01-18,"저녁에 방문, 예약 없이 이용, 대기 시간 바로 입장, 데이트, 연인・배우자",음식이 맛있어요,10,1
1648684223,ogj****,메뉴가 진짜 많아서 깜짝 놀랐습니다.. 파스타랑 어묵탕 감탄하면서 먹었네요.. 양도 많고 가격도 좋고 그냥 술 안주로 제격입니다..!!!! 다음 주엔 친구랑 통닭 먹방 제대로 찍어보겠습니다!!,2025-01-17,"저녁에 방문, 예약 후 이용, 대기 시간 10분 이내, 친목, 지인・동료",음식이 맛있어요,44,1
1648684223,avv****,분위기 힙하면서도 유니크해서 좋아요그리고 우선 통닭 맛으로 승부 제대로 보실 줄 아는 진정한 맛입니다묘하게 건강해지면서 맛있게 먹는 느낌..? 양도 많고 구성 야무져요,2025-01-16,"저녁에 방문, 예약 후 이용, 대기 시간 10분 이내, 일상, 지인・동료",음식이 맛있어요,151,1
1648684223,lee****,"치맥하고 싶어서 장소 찾아보던 중 아무래도 아이 동반이라 지저분하거나 너무 술집 분위기면 꺼려지는데 여긴 깔끔해보여서 방문했어요~~ 기름때 없이 청결한 테이블 맘에 들고 화장실도 내부에,  깨끗해요!통닭은 진짜 퍽퍽살이 어딨지 싶을 만큼 촉촉하고 파스타는 전문점 급으로 녹진하니 너무 맛있네요!! 염지가 겉에 좀 쎄서 껍질벗겨 먹이면 7살 아이도 잘 먹어요ㅎㅎ 메뉴가 세련되고 맛있어서 모임으로도 딱입니다🤸🏻‍♀️",2025-01-13,"저녁에 방문, 예약 없이 이용, 대기 시간 바로 입장, 가족모임, 연인・배우자, 아이",음식이 맛있어요,25,1
1648684223,zug****,누룽지 투움바 크림 통닭 진짜 맛있어요..... 비주얼 짱입니다 ㅜㅜㅜㅜ 알차고 푸짐한 통닭에 이런 맛있는 소스는 또 처음 먹어보는 맛이네요 소중한 맛.. 제가 좋아하는 파스타까지 있어서 자주 와야겠습니다...,2025-01-11,"밤에 방문, 예약 후 이용, 대기 시간 바로 입장, 일상, 지인・동료",음식이 맛있어요,137,1
1648684223,zzv****,이미 지인들한테 추천 많이 받았던 곳 드디어 갔는데 확실히 실하고 맛있습니다 메뉴도 다양해서 좋아요~~,2025-01-11,"저녁에 방문, 예약 후 이용, 대기 시간 바로 입장, 친목, 친구",음식이 맛있어요,138,1
1648684223,고구마1910,메뉴도 진짜 많고 가게도 깔끔해용 ㅎㅎㅎㅎ 양 진짜 많구 통닭에 파스타라뇽 ㅠㅠ 파스타 가격도 좋은데 퀄도 장난아니예용 완전 배터지게 먹구온 ㅎㅎㅎ 사장님도 넘 친절하셔서 기분 좋게 먹구 갑니당>.<,2025-01-03,"저녁에 방문, 예약 후 이용, 대기 시간 바로 입장, 일상, 지인・동료",음식이 맛있어요,216,1
1648684223,tra****,와 진짜 신선한 조합인데 엄청 맛있고 구성 알차요!! 누룽지통닭이랑 파스타세트 존존존맛탱임니다.. ㅜㅜ 비주얼도 대박.. 지나가다 궁금해서 즉흥으로 간건데 생각도 못한 맛집이예요 다음에 또 남친이랑 갈고예요💖💖💖,2025-01-03,"저녁에 방문, 예약 후 이용, 대기 시간 바로 입장, 데이트, 연인・배우자",음식이 맛있어요,139,1
1648684223,bfl****,뼈만 남기고 다먹었네요 뿌듯 😎,2024-12-28,"저녁에 방문, 예약 후 이용, 대기 시간 바로 입장, 친목, 친구",음식이 맛있어요,150,1
1648684223,mzh****,매콤한 해장오일 파스타 소스에 닭고기 올려먹으면 꿀맛이네요!!!! 되게 이색음식 먹는거 같아요 자주 와야겠습니다!!,2024-12-27,"저녁에 방문, 예약 후 이용, 대기 시간 바로 입장, 데이트, 연인・배우자",음식이 맛있어요,159,1
1648684223,sus****,크리스마스 트리 있어서 분위기 너무 좋아요! 남자친구랑 분위기 맛집 찾기 대성공적입니당🥰🥰  스텔라생맥주 처음 마셔보는데 부드럽고 맛있네요 ㅎㅎ,2024-12-18,"저녁에 방문, 예약 후 이용, 대기 시간 바로 입장, 데이트, 연인・배우자",음식이 맛있어요,237,1
1648684223,라라바오,누룽지통닭은 변신은 무죄네요ㅠㅠ퓨전 스타일인데 진짜 넘 맛있고 파스타도 무슨 전문점급으로 맛있어요!절대 후회 안 할 곳이니 다들 두번 세번 가세요ㅠㅠ,2024-12-18,저녁에 방문,친절해요,804,1
1648684223,ddclub1258,음식이 맛있아요!,2024-12-14,"밤에 방문, 예약 없이 이용, 대기 시간 바로 입장, 데이트, 연인・배우자",음식이 맛있어요,795,1
1648684223,000****,맛있어보이는 전기통닭구이를 저렇게 직접해서 주세요전기통닭구이집인데 파스타도 맛있었어요!좋은 재료 사용해서 해주셔서 너무 좋고화장실도 예쁘게 가게 안쪽에 있어 좋았어용,2024-12-14,"저녁에 방문, 예약 없이 이용, 대기 시간 바로 입장, 일상, 친구",음식이 맛있어요,1895,1
1648684223,angelmild11,통닭에 파스타 조합 대박이예요... 친구랑 먹으면서 감탄 여러번 했습니다.... 남자친구한테 사진 보내주니 꼭 가야하는 곳이라고 기대중이네요 ㅎㅎㅎㅎ 다음 주에 또 방문하기로 했는데 벌써부터 배고파용 헤헤.. 😁😁,2024-12-14,"저녁에 방문, 예약 후 이용, 대기 시간 바로 입장, 친목, 친구",음식이 맛있어요,374,1
1648684223,뽀리둥,누룽지찜닭이 찐해서 맛있고요바삭고소한 누룽지맛이 별미에요파스타도 감칠맛 있어요크리스마스 인테리어도 예쁘고 분위기 훌륭했어요,2024-12-14,"점심에 방문, 예약 후 이용, 대기 시간 바로 입장, 일상, 연인・배우자",음식이 맛있어요,200,1
1648684223,slynn,동네에 있어서 자주 오는 곳인데 너무 맛있어요~ 양배추 샐러드도 추가로 꼭 주문해서 먹어보세요 너무 맛있습니당 메뉴도 다양해서 더 좋아요☺️🧡,2024-12-13,"저녁에 방문, 예약 없이 이용, 대기 시간 바로 입장, 데이트, 연인・배우자",매장이 청결해요,9,1
1648684223,google876,와 진짜 맛있고 뭔가 색다른 맛이네요 ㅠㅠㅠ 남자친구랑 여기 먹으려고 멀리서 찾아간건데 역시 그럴만합니다 .. 데이트장소로 제격이예용 맛 진짜 신세계..👍👍,2024-12-13,"저녁에 방문, 예약 후 이용, 대기 시간 바로 입장, 데이트, 연인・배우자",음식이 맛있어요,186,1
1648684223,mm****,신랑 생일이라 맛있는 맛집으로 고고!! 역시 리뷰 많은 칭찬들과 같았어요 ~분위기도 좋고 가격도 친절하고 오래기다리지않고 바로 음식이 나와서 허기진 나의 배한테 미안하지않았어요~ 전기구이는 닭살이 촉촉하게 뜯어지고 누룽지가 고소하면서 촉촉했네요 ㅎㅎ해장오일 파스타는 진짜 예술!! 옆테이블은 한그릇먹고 또시키심~!!ㅎㅎ 마지막으로 해산물크림파스타^^보이는대로 해산물이 많고 다는데보다 더고소하고 깊은맛이 났어요사장님이 아무래도 요리연구가? 인거 같습니다. 신메뉴도 있고!!요리채널 나가셔도 충분하고 추천 드립니다~~!! 강츄강츄!!!,2024-12-12,"저녁에 방문, 예약 없이 이용, 대기 시간 바로 입장, 데이트, 연인・배우자",음식이 맛있어요,658,5
1648684223,ac9385,누룽지가 겉바속쫀이에요 진짜 삼계탕이랑 누룽지랑 합쳐진 느낌이랄까요!?! 그리고 생각보다 파스타가 너무 맛있었어요 진짜 근처사시는 분들 무조건 오세요!!! 통닭과 파스타 다 맛있습니당 다음에 또 재방문할 예정이에요❣️,2024-12-10,"아침에 방문, 예약 후 이용, 대기 시간 바로 입장, 데이트, 연인・배우자",음식이 맛있어요,6,1
1648684223,먹잘알 여행가,닭고기가 정말로 부드럽고 쫄깃합니다!! 같이 나온 파스타도 생각보다 양이 있었고 맛났습니다. 삼계탕처럼 안에 누룽지가 있는데 정말 바싹하고 떡처럼 쫀득해요! 건강한 치킨 먹으러 오기 딱 좋은 곳입니다,2024-12-09,"저녁에 방문, 예약 없이 이용, 대기 시간 바로 입장, 데이트, 연인・배우자",매장이 청결해요,312,1
1648684223,워터보이708,가족과 함께 저녁에 식사겸 왔어요~^^맛있어요~^^,2024-12-06,"저녁에 방문, 예약 없이 이용, 대기 시간 바로 입장, 가족모임, 부모님",음식이 맛있어요,13,1
1648684223,꽂히면 그집만 간다,너무 좋아하는 맛집이라 지인들에게 마구마구 알리고싶은 식당이에요!!영수증 리뷰 안올리는날이 더 많은건 안비밀ㅋ단백하고 부드러운 누룽지통닭과 매콤깔끔한 해장오일파스타 조합 최고👍👍👍,2024-12-06,"저녁에 방문, 예약 후 이용, 대기 시간 바로 입장, 친목, 일상, 회식, 지인・동료",음식이 맛있어요,395,8
1648684223,장난구렁이,또 왔어여 !!!! 역시 누룽지 치즈 치킨 짱 맛있어요ㅎㅎㅎㅎㅎㅎ,2024-11-28,"저녁에 방문, 예약 없이 이용, 대기 시간 바로 입장, 친목, 친구",음식이 맛있어요,168,2
1648684223,tjs****,집근처에 새로생겨서 와봤어요!와 통닭도 맛있는데파스타미쳤음 !!!!자주 올게요😄,2024-11-28,"저녁에 방문, 예약 없이 이용, 대기 시간 바로 입장, 데이트, 연인・배우자",음식이 맛있어요,33,1
1648684223,YB부부,"탄단지 모두 챙길 수 있는! 매일매일 새로 시작하는 다이어트 중 맛있게 먹어도 전혀 죄책감 느껴지지 않는 건강하고 담백한 전기구이통닭 맛집입니다!- 전기구이통닭과 파스타라뇨? 의아하셨나요? 꿀조합은 누룽지통닭과 해산물크림파스타예요! 통닭의 기름기 쪽 빨아 먹어서 고소하고 담백한 누룽지에 중독성 있는 크림파스타 곁들여 먹으면 그 조합이 아주 훌륭합니다!- 치즈콘누룽지통닭 주문했구요, 모짜렐라 치즈가 퀄리티가 좋았습니다! 치즈 덕후들은 아마 그 차이를 바로 느낄 수 있지 않을까 싶어요!- 통닭 아주 담백합니다! 닭가슴살까지도 부드러워서 먹기 좋았어요!- 크림파스타가 대박이에요! 김풍 작가의 요리 같달까요? 고급스럽지 않지만 이상하게 맛있는 묘한 매력과 내공을 갖춘 파스타입니다!",2024-11-25,"저녁에 방문, 예약 없이 이용, 대기 시간 바로 입장, 데이트, 연인・배우자",음식이 맛있어요,220,1
1648684223,12a****,"젊은 사장님들의 트렌디한 느낌이 가득한 누룽지통닭, 파스타 전문 포차에요! 😛 중랑역맛집 술집은 많지만 여긴 동서양의 조합으로 즐길 수 있는 유일한 곳이라서 색다르게 느껴졌어요! 탄단지 완벽한 건강 통닭은 죄책감 없이 먹을 수 있고, 파스타는 가격대비 퀄리티가 그냥 미쳤는데용...? 매장 내부 넓고, 다른 안주들도 다양해서 모임하기도 좋을 것 같아요 🧡",2024-11-25,"저녁에 방문, 예약 없이 이용, 대기 시간 바로 입장, 데이트, 연인・배우자",음식이 맛있어요,462,1
1648684223,빈4024,생긴지 좀 됬는데매번 지나갈때마가 궁금했는데이제서야 와보네요인테리어도 뭔가 힙하고전기구이 좋아하는데 너무 맛있어용그리고 파스타가 진짜파스타 전문점 만큼 해요뒤지지 않습니다!!!ㅋㅋㅋㅋ👍👍👍,2024-11-22,"저녁에 방문, 예약 없이 이용, 대기 시간 바로 입장, 가족모임, 연인・배우자, 아이",음식이 맛있어요,20,1
1648684223,탐크루즈38,,2024-11-20,"저녁에 방문, 예약 없이 이용, 대기 시간 바로 입장, 데이트, 연인・배우자",음식이 맛있어요,10,1
1648684223,DDHYN,전기구이통닭을 콘치즈랑 같이 먹는다는 생각을 못해봤는데  먹어보니까 대박 맛있어요..파스타 소스에 콕 찍어먹어도 맛있더라구요!살이 야들야들 부드러워서 좋았고 누룽지가 씹는 맛을 올려줘서 좋았어요!,2024-11-19,"저녁에 방문, 예약 후 이용, 대기 시간 바로 입장, 친목, 친구",음식이 맛있어요,31,1
1648684223,tou****,누룽지통닭 넘 맛있어요ㅠㅠ통닭 크기도 꽤 커서 둘이 먹기에 양도 많더라구요처음에 콘치즈 먼저 먹다가 통닭을 뒤집어서 누룽지랑 같이 곁들이면 아주 굿굿 닭살도 엄청 부드러워서 굳이 집게를 이용하지 않아도 뼈가 쏙쏙 빠져요😋​​,2024-11-18,"아침에 방문, 예약 없이 이용, 대기 시간 바로 입장, 친목, 친척・형제",음식이 맛있어요,42,1
1648684223,예진8136,오고싶던곳~~^^ 기대이상 맛나요~~,2024-11-15,"저녁에 방문, 예약 없이 이용, 대기 시간 바로 입장, 데이트, 연인・배우자",음식이 맛있어요,17,1
1648684223,장난구렁이,저번에 왔다가 치즈콘닭누룽지 ?? 그거랑 매콤파스타 먹고 진짜 너무 맛있어사 또 왔어요 ㅎㅎㅎ오늘은 다른 메뉴로 시켰어요 역시나 ~~너무 맛있어영 냠냠 😍😋,2024-11-13,"저녁에 방문, 예약 없이 이용, 대기 시간 바로 입장, 친목, 지인・동료",음식이 맛있어요,168,1
1648684223,duhovy49,누룽지 청양크림통닭이 새로 나와서 먹어봤는데 역시나...bb크림이라 조금 느끼하지 않을까 싶었는데 전기구이라 기름이 쫙 빠져서 전혀 느끼하지 않고 고소한 크림이랑 너무 잘 어울려요. 퍽퍽한 가슴살 부위도 촉촉하게 잘 익어서 청양이 들어간 크림에 찍어먹으면 정말 계속 들어가요. 바삭바삭해서 맛있는 누룽지까지 같이 먹을 수 있어서 개이득. 강추합니다! 그리고 올 때마다 먹는 해장오일파스타는 그냥 무조건 시키는 메뉴에요. 매콤한 오일파스타 좋아하시는 분은 제발 꼭 드셔주세요. 다음번에 다른 신메뉴들 먹으러 또 방문예정^^,2024-11-12,"저녁에 방문, 예약 없이 이용, 대기 시간 바로 입장, 친목, 지인・동료",음식이 맛있어요,6,2
1648684223,mm****,신ㅁㅔ뉴!!  누룽지 로제크림통닭은. 스파게티소스에 달콤하면서도 로제 만의 맛있는 치즈 풍미속에 닭살이 부드럽게 조화를 이루며 맛이 끝내줬어요 ㅎㅎ 누룽지 청양크림통닭은 첫맛은 매콤한 청양고추맛이 느껴지고 뒷맛은 고소하면서 담백한 맛으로 마무리 하셨더라고요. 역시 사장님은 손님에게 감동의 맛을 선물해주셨습니다~~^^감사해요 ~!! 그리고 항상먹는 해장오일스파게티 이건 최고최고 불맛도나고 행복한 배부름 갖고 왔습니다^^ 강츄입니다~~~~!!!!,2024-11-12,"저녁에 방문, 예약 없이 이용, 대기 시간 바로 입장, 친목, 지인・동료",음식이 맛있어요,658,4
1648684223,바이올렛7132,통닭먹으러 갔다 너무 맛있어서 이것저것 다 시켜 먹었네요 ㅎ 음식이 다 깔끔하고 맛도리에요~~ 사장님도 친절하시고 새로운 맛집을 찾은거 같아서 너무 좋아요😄다음에 또 갈께요~~🫶🏻,2024-11-09,저녁에 방문,친절해요,2529,2
1648684223,Mars 2050,"고급진 치킨 요리를 맛있는 스파게티와 함께를 즐길 수 있는 곳이에요. 적절히 매콤히 누릉지양념통닭 강추해요. 전기구이로 기름기를 완전히 빼면서 식감은 촉촉해서 누릉지와 같이 먹으면 배도 응근히 부르고 건강한 음식인듯. 처음에 배고파서 봉골레 스파게티와 해장오일스파게티도 시켰는데, 은근히 치킨과 맛조합이 잘 되네요. 여기 사장님 넘 친절해서 편해요. 콜라와 맥주는 필수인듯.",2024-11-06,"저녁에 방문, 예약 후 이용, 대기 시간 바로 입장, 비즈니스, 지인・동료",음식이 맛있어요,100,1
1648684223,seong0506,오랜만에 추억의 전기통닭!안에 누룽지가 진짜 맛있어요!,2024-11-04,"저녁에 방문, 예약 없이 이용, 대기 시간 바로 입장, 데이트, 연인・배우자",음식이 맛있어요,70,1
1648684223,하하하3126,불금에 저녁 통닭 먹으며 뉴룽지 진짜 맛나네요. 파스타도 넘 맛나요. 적당히 매콤 하니 굿굿 양도 많아 저녁식사 하기 굿,2024-11-01,"저녁에 방문, 예약 없이 이용, 대기 시간 바로 입장, 친목, 친구",인테리어가 멋져요,41,1
1648684223,수지수지1,누룽지통닭은 2차가서 먹어야겠다라는 인식이 있었는데이태리전기구이통닭집은 워낙 양도 많고 맛도 좋아서 1차로 와서 먹어도 될 것 같아요,2024-11-01,"점심에 방문, 예약 후 이용, 대기 시간 바로 입장, 데이트, 연인・배우자",음식이 맛있어요,58,1
1648684223,상큼이9877,지금까지 먹은 전기구이통닭 중에서 제일 맛있었어요!!또 생각남~~~ 😉😉담백하고 간이 세지 않아서 남녀노소 호불호 없이 먹을 수 있을 것 같아요. 근처 지나갈때 포장할거에요 : ),2024-10-30,"저녁에 방문, 예약 없이 이용, 대기 시간 바로 입장, 일상, 가족모임, 연인・배우자, 아이",친절해요,391,1
1648684223,rbcchoi,남편이랑 간만의 외식^^ 중랑역 동부시장안에 이런 힙한 맛집이 있다니^^기름기없는 전기구이통닭에 홀딱 반했습니다. 맛있어요~~~재방문의사 완전 있구요. 사장님도 너어무 친절하셔서 좋았어요. 깔끔한거야 말해뭐해요.,2024-10-29,"저녁에 방문, 예약 후 이용, 대기 시간 바로 입장, 데이트, 연인・배우자",음식이 맛있어요,39,1
1648684223,Foodiie,통닭도 건강하고 담백하게 먹을 수 있고 맥주 안주로 딱이에요 ㅎㅎ파스타도 기대이상으로 너무 맛나요!! 맥주 소주잔도 넘 시원해서 뻔데기탕까지 호록하고 나와버림👍🏻,2024-10-28,"저녁에 방문, 예약 후 이용, 대기 시간 바로 입장, 데이트, 연인・배우자",대화하기 좋아요,32,1
1648684223,이힛9610,전기구이통닭이라 기름기가 빠져서 담백했어요. 콘치즈추가로 맛이 없을 수가 없죠!! 눌러붙어 있는 누룽지도 꽤 맛있답니다. 국물떡볶이 보통맛도 매콤한데 치킨이랑 함께 먹으니 깔끔한 조합이더라구요. 치킨무만 있는게 아니라 김치도 있는게 신기했어요!,2024-10-22,"점심에 방문, 예약 없이 이용, 대기 시간 바로 입장, 일상, 연인・배우자",음식이 맛있어요,67,1
1648684223,고동663,진짜 맛있고 사장님 완전 친절하셔요누룽지통닭 개개개 추천합니다껍질 바삭하고 속살 부드럽고 존맛탱;;; 👍,2024-10-19,"저녁에 방문, 예약 없이 이용, 대기 시간 바로 입장, 나들이, 혼자",음식이 맛있어요,42,1
1648684223,최지잉,누룽지치즈콘통닭 + 파스타 세트 주문했는데 너!무! 맛있어요 🥹 특히 찹쌀 누룽지가 두툼 + 바삭 퀄리티가 미쳤어요! 퍽퍽살도 퍽퍽하지 않고 또 파스타 소스에 찍어먹으면 무한으로 들어가요! 임신 중만 아니면 맥주에다가 (맥주도 저렴함) 먹었을텐데 ㅎㅎ 아기 낳고 또 와야겠어요!,2024-10-18,"저녁에 방문, 예약 후 이용, 대기 시간 바로 입장, 데이트, 연인・배우자",음식이 맛있어요,985,1
1648684223,bsa4977,"메뉴보고 너무 맛있어 보여서 방문하였습니다. 맛부터 비주얼, 건강까지 다 잡은 치킨구이 맛집입니다. 치킨뿐만아니라 파스타도 맛있어서 싹 다긁어먹고 왔습니다. 사장님과 직원분도 친절하시고 매장 분위기도 은은하고 깔끔한게 친구모임, 데이트, 회식으로 모두 좋을 것 같습니다.👍👍",2024-10-18,"저녁에 방문, 예약 후 이용, 대기 시간 바로 입장, 데이트, 친목, 나들이, 일상, 기념일, 가족모임, 연인・배우자, 친구, 지인・동료, 부모님",음식이 맛있어요,45,1
1648684223,대한해협,닭이 맛있는데 파스타가 진짜 너무맛있더라구요.,2024-10-11,"저녁에 방문, 예약 후 이용, 대기 시간 바로 입장, 데이트, 연인・배우자",음식이 맛있어요,228,1
1173243480,스마일강19,상봉동 삼겹살 목살 고기맛집고깃집 보은목살육즙 장난아님직접 구워주시니 좋아요소스의 조합 굿굿~~김치찌개 는 꼭 먹어 보세요,2025-03-18,"저녁에 방문, 예약 후 이용, 대기 시간 바로 입장, 나들이, 연인・배우자",음식이 맛있어요,210,1
1173243480,거북이6792,목살이 퍽퍽할줄알았는데 부드럽게 잘 구워주시고 친절하게 해주십니다 다음에 또 갈예정입니당~,2025-03-16,"저녁에 방문, 예약 없이 이용, 대기 시간 10분 이내, 친목, 친구, 지인・동료",음식이 맛있어요,3,2
1173243480,lee****,고기도 직접구워주셔서 너무 편하고 맛있었어요 다음에도 또 올생각이에요,2025-03-15,"저녁에 방문, 예약 없이 이용, 대기 시간 바로 입장, 데이트, 연인・배우자",음식이 맛있어요,1,1
1173243480,이광광,오랜만에 친구들이랑 밥먹으러왔는데여전히 맛있어요!,2025-03-14,"저녁에 방문, 예약 후 이용, 대기 시간 바로 입장, 친목, 일상, 친구, 지인・동료",음식이 맛있어요,20,3
1173243480,굿데이투다이,상봉 1티어 돼지고깃집,2025-03-12,저녁에 방문,음식이 맛있어요,341,1
1173243480,khk2866,삼겹살이 정말 맛있는 집입니다. 야채도 신선하고 추천합니다! 삼겹살 목살 다 최고였어요,2025-03-05,"저녁에 방문, 예약 없이 이용, 대기 시간 바로 입장, 친목, 친구",음식이 맛있어요,29,1
1173243480,mms****,목살미첫어요너무맛있자나!,2025-03-05,"저녁에 방문, 예약 없이 이용, 대기 시간 10분 이내, 데이트, 연인・배우자, 친구",음식이 맛있어요,2,1
1173243480,뇽뇽9658,다른집가려다가  갔는대  성공이네요  냉면이  진짜 맛있어요,2025-03-03,저녁에 방문,음식이 맛있어요,222,1
1173243480,김기섭9,너무너무 맛있어욯ㅎㅎㅎㅎㅎ,2025-02-26,"저녁에 방문, 예약 없이 이용, 대기 시간 바로 입장, 데이트, 연인・배우자",음식이 맛있어요,8,1
1173243480,rla****,너무 맛있고 직원분들이 고기고 다 구워주셔서 너무 좋아용 재방문 의사 100%입니당!!,2025-02-20,"저녁에 방문, 예약 없이 이용, 대기 시간 바로 입장, 데이트, 연인・배우자",음식이 맛있어요,7,1
1173243480,id4508,목살 장난아니에요ㅜㅜㅜ 최애 너무맛있어여 장난아님 담에 또갈게요 ㅎ 잘먹었슴다,2025-02-15,"저녁에 방문, 예약 없이 이용, 대기 시간 바로 입장, 데이트, 친구",매장이 넓어요,108,1
1173243480,봄봄옹,고기 퀄리티가 미쳤습니다!!같이 나오는 밑반찬들도 조화가 좋아서 먹는내내 너무 맛있어서 행복했어요~!!아이들 데리고 갔는데 고기도 직접 구워주셔서 편하게 먹을수 있었어요^^ 가격도 합리적이고 너무 맛있어서 단골 예약 입니다~!!,2025-02-14,"저녁에 방문, 예약 없이 이용, 대기 시간 바로 입장, 가족모임, 아이",음식이 맛있어요,16,1
