place_id,nickname,content,date,situations,keywords,review_count,visit_count
1603072773,ssan67,양도 많고 음식도 정갈하고 너무 맛있어요😊,2025-03-04,"저녁에 방문, 예약 없이 이용, 대기 시간 바로 입장, 데이트, 연인・배우자",매장이 청결해요,28,2
1603072773,whd****,음식 맛있고 조용하고 좋았습니다 다음에 또 올거에요 ㅎㅎ,2025-03-03,"저녁에 방문, 예약 없이 이용, 대기 시간 바로 입장, 데이트, 연인・배우자",음식이 맛있어요,12,1
1603072773,lynn54,맛있어요!! 카라이 기본 둘다 좋아요🤤,2025-03-03,"저녁에 방문, 예약 없이 이용, 대기 시간 바로 입장, 데이트, 연인・배우자",친절해요,32,1
1603072773,이지은2,검색해서 왔는데 분위기도 좋고 맛도 있어요 또 생각날꺼 같아요~~단골될께욤,2025-03-03,"점심에 방문, 예약 없이 이용, 대기 시간 바로 입장, 데이트, 연인・배우자",음식이 맛있어요,41,1
1603072773,준1086,맛있어요~,2025-03-03,"점심에 방문, 예약 없이 이용, 대기 시간 바로 입장, 일상, 혼자",음식이 맛있어요,38,1
1603072773,밍1951,고소하고 맛있어요~~ 사장님도 친절하시구 재방문의라 있습니당~!^^,2025-03-03,"점심에 방문, 예약 없이 이용, 대기 시간 바로 입장, 데이트, 연인・배우자",아늑해요,15,1
1603072773,cho****,머리끈까지 준비완료~~ 바쁘시지만 친절하시고 마제소바도 맛있어요~~,2025-03-02,"점심에 방문, 예약 없이 이용, 대기 시간 바로 입장, 나들이, 친구",혼밥하기 좋아요,21,1
1603072773,nini65,깔끔한 매장 분위기에 너무 맛있게 잘먹었어요🩷,2025-03-01,"점심에 방문, 예약 없이 이용, 대기 시간 바로 입장, 데이트, 연인・배우자",인테리어가 멋져요,18,1
1603072773,Zozo2910,매번 가게 앞만 지나가다가 궁금해서 와봤는데 맛있고 분위기도 괜찮아요bb 종종 올 거 같아요,2025-03-01,"점심에 방문, 예약 없이 이용, 대기 시간 바로 입장, 일상, 혼자",음식이 맛있어요,90,1
1603072773,HAFSNUPARK,짱 맛있어요:),2025-03-01,"점심에 방문, 예약 없이 이용, 대기 시간 바로 입장, 데이트, 연인・배우자",음식이 맛있어요,21,1
1603072773,굼23,정말 맛있어요! 아담하고 따뜻한 뷴위기로 너무 좋아요~~♥️♥️,2025-03-01,"점심에 방문, 예약 없이 이용, 대기 시간 바로 입장, 가족모임, 부모님",인테리어가 멋져요,33,1
1603072773,민트홀릭21,매장이 정말 청결하고 음식도 깔끔해요!,2025-03-01,"점심에 방문, 예약 없이 이용, 대기 시간 바로 입장, 데이트, 연인・배우자",음식이 맛있어요,11,1
1603072773,oth****,여기 돈코츠라멘 진짜 잘하네요ㅎㅎ국물이 진국입니다!혼밥하기에도 좋고 분위기도좋아서 자주와야겠어요😆,2025-03-01,"점심에 방문, 예약 없이 이용, 대기 시간 바로 입장, 데이트, 연인・배우자",음식이 맛있어요,182,1
1603072773,as****,저의 마제소바 최애집 입니다. 주말 전 퇴근길에 들렀네요. 늘 차분한 음악과 청결한 오픈키친이 저를 환영해줍니다. 덕준에 즐거운 주말의 시작입니다. 오늘도 맛있게 잘 먹었네요!!,2025-02-28,"저녁에 방문, 예약 없이 이용, 대기 시간 바로 입장, 데이트, 연인・배우자",혼밥하기 좋아요,11,6
1603072773,응9,"성신여대, 보문역 근처 소바 맛집을 찾으신다면 츠루츠루 강추합니다👍🏻제가 먹어본 소바 중에 간이 딱 맞고, 담백했어요ㅎㅎ한국인 입맛을 딱 저격하는 마제소바😋성신여대, 보문, 한성대 근처 소바맛집을 찾으신다면 꼭 방문해보세요!!바 테이블도 있어서 혼밥하기에도 적합해요 💓",2025-02-28,"점심에 방문, 예약 없이 이용, 대기 시간 바로 입장",음식이 맛있어요,121,1
1603072773,풀랄라,7번째방문했습니다 언제나맛있어요,2025-02-28,"점심에 방문, 예약 없이 이용, 대기 시간 바로 입장, 친목, 혼자",음식이 맛있어요,17,7
1177552668,요요렝,분위기가 아늑해용,2025-02-08,"점심에 방문, 예약 없이 이용, 대기 시간 바로 입장, 친목, 지인・동료",아늑해요,105,1
1177552668,리비유모온스터무난구기,맛나게 잘 먹었습니다.,2025-01-19,"점심에 방문, 예약 없이 이용, 대기 시간 바로 입장, 데이트, 연인・배우자",음식이 맛있어요,2948,1
1177552668,뇽뇽이84,오픈 토스트 너무 맛있어요❤️ 파스타 소스도 부드럽고 맛있어요~ 빵을 같이 주셔서 소스 찍어먹기 좋아요! 커피가 조금 신편이에요☺️,2025-01-18,"점심에 방문, 예약 없이 이용, 대기 시간 바로 입장, 데이트, 친목, 연인・배우자",음식이 맛있어요,48,1
1177552668,khl0620,,2025-01-09,"점심에 방문, 예약 없이 이용, 대기 시간 바로 입장, 일상, 지인・동료",인테리어가 멋져요,236,2
1177552668,selfbrand,good,2024-11-27,점심에 방문,단체모임 하기 좋아요,1928,1
1177552668,이수현35,ㅎㅎㅎ 여기 진짜 너무 힐링의맛 … 다 맛있지만 크림파스타랑 칠리새우토스트가 최애입니다 진짜 맛있어요 라떼도 고소하고 음료도 맛집인데 은근 먹다보면 양이 많아서 배터져요 또 가고싶네요…,2024-09-04,"저녁에 방문, 예약 후 이용, 대기 시간 바로 입장, 데이트, 연인・배우자",인테리어가 멋져요,28,5
1177552668,mi****,브런치메뉴 맛있어요. 커피도 맛있네요^^,2024-08-23,"점심에 방문, 예약 후 이용, 대기 시간 바로 입장, 친목, 지인・동료",음식이 맛있어요,206,1
1177552668,lsosvhe,양이 엄청 많았어요^^ 바질페스토 맛도 좋고 브런치도 다양해서 골라먹는 재미 솔~솔~ 동네 편한 브런치집예요.,2024-06-29,"점심에 방문, 예약 후 이용, 대기 시간 바로 입장, 데이트, 연인・배우자",음식이 맛있어요,62,1
1177552668,대통령15,프렌치 토스트는 무조건 파숲에서 포장해먹습니다! 달달구리 좋아하시는 분들은 꼭 생크림 추가해서 드셔보세요. 👍,2024-05-28,"점심에 방문, 포장·배달 이용, 대기 시간 10분 이내, 일상, 혼자",음식이 맛있어요,19,5
1177552668,kin****,혼자 왔는데 가게 문 닫으시려는 참에 왔는데 받아주셨어요. 치즈도 많이 들어가있고 재료 구성이 밋밋한 곳도 많은데 아주 만족스럽게 먹고 가요〜☺️,2024-05-19,"점심에 방문, 예약 없이 이용, 대기 시간 바로 입장, 나들이, 혼자",인테리어가 멋져요,85,1
1177552668,졔16,이미 너무 유명한 브런치 가게 파도의숲 이에요! 테이블이 많지 않아서 기다려야할까봐 ㅠ 오픈런 했어요 ㅋㅋㅋ 조금 일찍 갔는데도 들어가서 기다리게 해주시고 직원분들이 되게 친절하세요~ 음식도 너무 맛있어서 싹싹 다 먹었어요!!,2024-04-23,"점심에 방문, 예약 없이 이용, 대기 시간 바로 입장, 친목, 친구",음식이 맛있어요,50,1
1177552668,hailey820,맛있아요,2024-04-17,"저녁에 방문, 예약 없이 이용, 대기 시간 바로 입장, 일상, 친구",음식이 맛있어요,556,1
1177552668,kyc****,좋아요,2024-03-28,저녁에 방문,음식이 맛있어요,1326,1
1177552668,후마미90,맛있고 가격도 괜찮아요공간이 좁아서 좀 답답하긴 했어요,2024-03-23,"점심에 방문, 예약 없이 이용, 대기 시간 바로 입장, 가족모임, 연인・배우자, 아이",음식이 맛있어요,243,1
1177552668,구수동루피,,2024-02-06,"점심에 방문, 예약 없이 이용, 대기 시간 바로 입장, 데이트, 연인・배우자",대화하기 좋아요,662,1
1177552668,말랑92,집 근처고 맛있어서 자주 먹는 곳이에요 바로 픽업 하려고 예약하고 갔는데 이번엔 네이버로 주문해서 그런지 도착하니 알바분들이 알림을 못 봤다고 하셔서 좀 당황했어요 시간을 아끼려고 포장한 건데 도착해서 조리되길 기다렸던 게 아쉬웠어요 🥲 프렌치토스트 자주 먹는데 맛이 살짝 바뀐건지 전에는 빵이 엄청 촉촉하고 계란찜같은 느낌이었는데 이번에는 속안까지 촉촉한 느낌은 비교적 적은 편이었고 빵이 물에 덜 젖은 것 같은 느낌이었어요 소스?! 같은 것도 더 꿀같은 쫀득꾸덕한 텍스쳐로 바뀌었더라구요 둘 다 맛있긴 했지만 전이 더 제 취향에 더 맛있게 느껴졌어요 여기 진짜 좋아하는 가게인데 이번 구매는 조금 아쉬웠어요 ㅠ ㅠ,2024-01-15,"점심에 방문, 예약 후 이용, 대기 시간 10분 이내",음식이 맛있어요,10,1
1177552668,부먹찍먹처먹,"그냥 욕 나오게 맛있어요. 너무 맛있어서 자주 와서 전메뉴 도장 깨기 하고 싶을 정도. 오늘도 둘이서 메뉴 세 개 부숴버림.근데 사장님이 안 나오시는 날이라고 들었는데, 그래서 그런 건지, 주문이 밀려서 그런 건지 일하시는 분들이 너무 불친절했어요. 들어와서 인사까지 했는데 아는 척도 안 해 주시고, 제가 테이블까지 직접 들어가서 꽉 차 있는 거 확인하고 웨이팅 해야 하냐고 여쭤 보니까 그제서야 웨이팅 해야 한다고 아는 척해 주시고…. 한참 웨이팅 하다 들어왔는데, 주문도 되게 성의없게 받으셔서 당황함. 너무 맛있는데, 이렇게 불친절한 곳 처음입니다. 다음 방문도 고민할 정도의 불친절; 방문한 본인 친구 분들한테는 안 그러시던데…. 일하는 건 누구나 다 싫겠지만, 그래도 손님한테 티는 내지 말아 주세요;;",2024-01-15,"점심에 방문, 예약 없이 이용, 대기 시간 30분 이상, 일상, 친구",음식이 맛있어요,87,1
1177552668,류류요,"성북구청 근처에 위치한 브런치 맛집짧은면, 긴면이 선택 가능하고 전반적으로 면이 두꺼워서 더 맛있어요닭다리살 간장크림 파스타 15400뻔한맛이 아니고 크림이랑 굉장히 잘 어울리고 맛있어요 무언가 특색있음파도 브런치 16900방울토마토도 메뉴마다 마리네이드해서 얹어놨는데 맛있고 훈제연어, 올리브도 2종류 무튼 맛있음샐러트 파숲타 13000하몽을 굉장히 좋아하는데 같이 먹으니 맛있어요연어올리브토스트 9400보코치니 치즈가 올라가서 좋은데 훈제연어 맛으로 먹는거라.. 허니프렌치 토스트 6900계란찜 같고 미쳤어요 너무 맛있음우삼겹칠리오일파숲타 15400짭조름하고 오일 듬뿍에 요거트 소스 찍먹하니 좋았어요",2024-01-07,점심에 방문,매장이 청결해요,682,1
1177552668,민초단,프렌치 토스트 빵이 바뀌었나요? 배달로 종종 먹다가 포장은 처음인데 빵이 배달로 먹었던거에 비해 두께가 얇아요. 그래서 좀 아쉬웠습니다.,2023-11-20,"점심에 방문, 포장·배달 이용",음식이 맛있어요,67,1
1177552668,당녀,가격대비 나오지 않음~!미래태권도와 공푸 중간쯤 위치,2023-11-20,점심에 방문,아늑해요,1555,1
1177552668,sha****,"토스트가 따뜻한 칠리소스에 적셔 있어서 부드럽고 폭신폭신하니 맛있었어요♡♡ 그리고 통통한 새우, 버섯, 치즈, 구운 마늘이 함께 어우러져서 맛이 너무 조화로웠어요~ 다음에 또 먹으러 오고 싶어요!! 토스트 맛집으로 추천해용내부도 작고 아늑해서 소모임 가지기 좋아용",2023-11-10,점심에 방문,음식이 맛있어요,111,1
1177552668,shd****,굿,2023-10-11,점심에 방문,음식이 맛있어요,1628,1
1177552668,김지미80,가을을즐기는 무화과 샌드위치와커피한잔창업부터 지금까지엄청난 성장을 하고 있는 파도의 숲나도 카페 하고 싶다나도 한다,2023-09-27,점심에 방문,음식이 맛있어요,123,1
1177552668,지소닝,존맛탱 ♥️회사 근처라 가끔 점심먹으러 오는데 넘 맛있어요 😆특히 파스타를 숏으로 선택할 수 있어서 나눠먹기에도 넘나 좋습니당!! 커피맛은 쪼금 아쉬워용,2023-09-15,점심에 방문,인테리어가 멋져요,19,1
1177552668,wsy****,에이드는 시키지마세요ㅎㅎ음식 맛있고 음료보다는 커피가 나아요파도 브런치 맛잇어요 파스타도 굿 쟙,2023-09-12,점심에 방문,음식이 맛있어요,477,1
1177552668,keyseven,맛 가격 다 좋아요. 모임으로 굿!!!근데. 서비스하시는 여자분 왜이리 불친절한가요?짜증나네요,2023-09-10,점심에 방문,,3,1
1177552668,ksnaggo87,주문했던 브런치들과 파스타 모두 맛있고 커피도 맛있었어요! 어른들과 애들 모두 맛에 만족했어요. 동네에 이런 좋은 식당이 생겨서 좋아요.,2023-08-15,점심에 방문,친절해요,1245,1
1177552668,cha****,,2023-07-25,저녁에 방문,음식이 맛있어요,2746,1
1177552668,옹알이528,와...커피서 된장맛이나는곳은처음입니다아까워서 반을 억지로마셨는데 속이 부글부글합니다 토할거같아요,2023-06-28,저녁에 방문,,10,1
1177552668,yoy****,굿굿,2023-06-21,점심에 방문,음식이 맛있어요,47,1
1177552668,Clararara,주방 바닥이 너무 지저분했어서…,2023-06-14,"점심에 방문, 예약 없이 이용, 대기 시간 바로 입장, 일상, 친구",,240,1
1177552668,나일6458,친잘하고 맛있어요:),2023-05-24,점심에 방문,음식이 맛있어요,1478,4
1177552668,고독한 영수증1020,,2023-05-09,점심에 방문,특별한 메뉴가 있어요,103,1
1177552668,달리6333,굿굿굿 최고예요👍🏻👍🏻👍🏻,2023-05-04,저녁에 방문,특별한 메뉴가 있어요,857,10
1177552668,wlgml1982,신선하고 맛있어요~~,2023-04-29,점심에 방문,음식이 맛있어요,36,2
1177552668,Noname385,커피가 맛있어요.,2023-04-12,점심에 방문,음식이 맛있어요,522,2
1177552668,Noname385,음식이 맛있어요.,2023-04-10,점심에 방문,음식이 맛있어요,522,1
1177552668,나일6458,"드립커피 향이 풍부하고 가격이 괜찮은 곳입니다. 파스타 및 토스트는 재료가 풍부하게 들어가있어 좋아요.샐러드파스타는 살짝 달달하면서 상큼짭짤하고 가볍게 먹을 수 있는 느낌입니다. 루꼴라와 풀이 아삭하게 씹혀서 좋았고, 하몽도 함께 얹어져있어 조화로웠습니다. 콘과 치즈도 있어요😋질문했을 때 단답(""몰라요"")으로 돌아와 당황했는데, 옆의 직원분이 친절하게 답변해 주셨어요.",2023-03-31,점심에 방문,음식이 맛있어요,1478,3
1177552668,qwa****,여행중에 너무 맛있게먹고 1년간 그리워하다 두시간을 달려 다시 갔는데 가는내내 먹는내내 너무 행복했어요. 웨이팅 각오하고 갔는데 다행히도 한가해서 조용히 먹을 수 있었어요. 구성이나 맛자체가 취향저격이기도 하고 여행의 향수를 불러일으키는 식당이 되었네요. 종종 갈 수 있게 오래 영업해주셨으면 좋겠습니다...,2023-03-04,점심에 방문,재료가 신선해요,1,1
1177552668,han****,커피 맛이 좋아요.,2023-02-28,점심에 방문,특별한 메뉴가 있어요,101,1
1177552668,김지유리,동네에 있는 깔끔한 브런치 가게에요,2023-02-23,저녁에 방문,특별한 메뉴가 있어요,197,1
1177552668,현슨인데요,파숲 넘 맛있음,2023-02-16,점심에 방문,친절해요,109,2
1177552668,7tl39qns,예쁜접시와 살짝 달콤한 맛의 토스트기분좋은 브런치였어요,2023-02-16,점심에 방문,특별한 메뉴가 있어요,586,1
1177552668,혜화붙박이,저장해놓고 꼭 가봐야지 하고선 드디어 와봤어요! 기대한만큼 음식도 맛있었고 커피도 맛있었습니다.다음번엔 다른 메뉴들도 먹어보고싶어요~:),2023-02-06,점심에 방문,음식이 맛있어요,89,1
1177552668,밥집 탐방가,매장이 넓지는 않지만 깔끔하고 분위기 좋아요😊 푸딩 위에는 제철 잼이 올라가서 달았고 밀크티는 향이 독특해서 마음에 들었어요👍,2023-01-17,점심에 방문,음식이 맛있어요,1032,2
1177552668,tjw****,가끔 방문하는 곳입니다. 식사메뉴가 있어서 그런지 주방이 좀 정신없네요^^;,2022-12-30,점심에 방문,,31,1
1177552668,cunhee,너므맛있음 점점인기많아져서슬프다 ㅠ 번창하세용,2022-12-28,점심에 방문,양이 많아요,9,1
1177552668,밥집 탐방가,포장했는데 음식이 맛있고 커피도 산미 있고 맛있는 커피네요 만족스럽습니다!,2022-12-08,점심에 방문,음식이 맛있어요,1032,1
1177552668,Juliana3,집앞이라 한번씩 라떼 사마시는데 맛있어요 🥹,2022-11-24,점심에 방문,매장이 청결해요,38,1
1177552668,달리6333,맛 최고! 양도 생각보다 듬뿍이구요~일하면서 당 섭취 기분좋게 했어요. 커피 맛 고급스럽습니다^^,2022-11-12,저녁에 방문,특별한 메뉴가 있어요,857,7
1177552668,나일6458,꾸덕고소하고 살짝 매콤한 맛이 산뜻하게 잡아주네요. 새우가 많고.. 엄청 많고... 탱글한 양송이도 많이 들어있어요. 전체적으로 양이 많은 편입니다ㅎㅎ,2022-11-09,점심에 방문,재료가 신선해요,1478,2
1177552668,달리6333,굿굿😊,2022-11-07,점심에 방문,특별한 메뉴가 있어요,857,5
1177552668,잶잶이,짱맛 자주오는데 오랜마에 리뷰올려옇ㅎ,2022-11-01,저녁에 방문,음식이 맛있어요,341,2
1177552668,수현96,무화과 푸딩 진짜 제 인생 푸딩이에요❤프렌치토스트도 촉촉하고 달콤해서 맛있었는데서비스로 메론까지 올려주셔서 더 맛있게 먹었습니다 감사해요:),2022-10-27,점심에 방문,음식이 맛있어요,7,1
1177552668,달리6333,군,2022-10-12,점심에 방문,매장이 청결해요,857,3
1177552668,달리6333,굿,2022-09-30,점심에 방문,커피가 맛있어요,857,2
1177552668,구르믈5,배달시켜먹고 맛있어서 포장해서 먹었어요첨 먹을땐 특이하네? 괜찮네 였는데두번째 먹으니까 넘 맛있어서 울면서먹음파스타에 식빵도 올려주셔서 좋았어요,2022-09-27,점심에 방문,특별한 메뉴가 있어요,30,1
1177552668,LLLyj,파도가 컨셉이라 그런지 파랑파랑한 인테리어가 예뻐요💙브런치 먹기 딱 좋은 곳이에용,2022-09-23,저녁에 방문,친절해요,460,1
1177552668,sks****,매장이 아주 이쁘고 친철합니다,2022-09-23,저녁에 방문,매장이 청결해요,80,1
1177552668,나일6458,"혹시... 사장님 모토가'이것저것 많이! 맛있는건 더 많이!' 인가요?ㅎㅎ🌊파도 브런치: 연어 듬뿍에 계란 두개, 루꼴라랑 치즈도 있어서 좋았어요. 병아리콩도 고소하고요. 차가운 토마토가 특히 달달하니 맛있었네요. 브로콜리까지 맛나게 만들다니 넘 대단👍다만 빵이 습기를 조금 먹었는지 따뜻하지 않고 눅눅해서 약간 슬펐습니다. 요리 자체는 대만족:)☕️콜롬비아 게이샤: 화려하고 독특해요. 필터 잘 내려주셔서 향이 풍부합니다. 다음엔 숲블랜드 커피를 먹어보고 싶어요.",2022-09-21,점심에 방문,인테리어가 멋져요,1478,1
1177552668,달리6333,커피 맛 굿굿요👍,2022-09-19,저녁에 방문,커피가 맛있어요,857,1
1177552668,호로록4242,성북동 최고의 브런치 맛집🌱,2022-09-17,점심에 방문,친절해요,269,1
1177552668,jongock100447,맛있,2022-09-05,점심에 방문,특별한 메뉴가 있어요,483,1
1177552668,runeke,"항상 파숲타, 브런치, 토스트, 토마토스프 맛있게 먹고 있습니다. 토스트 먹으려고 들렀다가 음료까지 주문했는데 초코가 정말 진하네요. 달콤쌉쌀의 정석🍫🍫 리모델링하니까 더 좋아요🌊🌊",2022-08-31,저녁에 방문,디저트가 맛있어요,25,1
1177552668,줏대잡이43,숲브런치 너무 맛있고 자몽음료도 달지 않아 좋았어요,2022-06-14,점심에 방문,특별한 메뉴가 있어요,1533,2
1177552668,hap****,느리게 조리되는 점을 잘 알고 가면 좋을 것 같아요,2022-06-11,밤에 방문,인테리어가 멋져요,1704,1
1177552668,라빈72,맛있어요,2022-06-09,저녁에 방문,커피가 맛있어요,306,1
1177552668,렬이맘12,디카페인커피가 참 맛있어요 커피못마시는데 여기껀 첨으로 다마셨어요,2022-05-17,점심에 방문,커피가 맛있어요,145,1
1177552668,geedream,고급진맛에 사진도 예쁘게잘나오고강아지랑.같이 들어갈 수있어서 넘좋았어요~~,2022-05-10,점심에 방문,디저트가 맛있어요,122,1
1177552668,최수빈2686,,2022-04-26,점심에 방문,친절해요,1905,1
1177552668,대홍단감자60,좋아요!,2022-04-12,점심에 방문,커피가 맛있어요,493,1
1177552668,바콜브,음식 나오는게 늦긴 한데 맛있어용,2022-02-26,점심에 방문,친절해요,1308,1
1177552668,므스,맛있네용,2022-02-25,저녁에 방문,가성비가 좋아요,414,1
1177552668,eeeeeo,좋네요,2022-02-18,점심에 방문,인테리어가 멋져요,937,1
1177552668,리뷰합니댜,음식이늦게나와요,2022-02-11,점심에 방문,커피가 맛있어요,146,1
1177552668,ㅋㅋ6996,분위기도 좋고 커피도 아주 맛있습니다!!,2022-02-06,점심에 방문,매장이 청결해요,6,1
1177552668,가림33,"네이버로 주문하고 들렀어요푸딩, 파스타, 음료 전부 맛있었습니다직원분들도 친절하게 응대해주셨어요감사합니다",2021-12-03,점심에 방문,사진이 잘 나와요,205,1
1177552668,BENA39,음식도 맛있고 가게도 예쁘고 너무 좋았습니다,2021-11-03,점심에 방문,커피가 맛있어요,397,1
1177552668,밍밍4171,좋아요,2021-10-29,점심에 방문,대화하기 좋아요,667,1
1177552668,Sander,맛있어요!!👏👏👏👏👏,2021-10-04,점심에 방문,매장이 청결해요,208,1
1177552668,MINGDU,진짜 애정하는 곳. 포장해서 먹어도 맛있지만 역시 매장에서 바로 먹는게 진짜 맛있다..! 2인이상 메뉴 시켜서 토마토 절임 주셨는데 그것도 아주 맛있었음! 양이 많아서 배터질뻔..ㅎㅎ,2021-09-30,저녁에 방문,가성비가 좋아요,47,1
1177552668,나리나리74,파스타 양도 좋고 이것저것 많이 넣어주시고 맛있고 인테리어도 너무 아기자기 해서 행복한 브런치였어여💓,2021-09-08,밤에 방문,음료가 맛있어요,45,1
1177552668,tae****,포장해서먹었는데도 맛있네요,2021-08-31,점심에 방문,특별한 메뉴가 있어요,6,1
1177552668,문식49,"배달도 저희 주문 앞에 있는거 같은데 하나하나  정성 스럽게 만들어 주시는게 보였어요. 너무 친절하시고, 브런치도 맛나게 묵었습니다 재방문 의사 있어요오",2021-08-23,점심에 방문,커피가 맛있어요,11,1
1177552668,맛집헌터v,조용하고 음식은 맛있고ㅎㅎ 무화과토스트 뭐죠? 왤케맛있나요ㅠㅠ 빵순이 아닌데 빵순이로 만드는맛ㅋㅋㅋ 꼭 드세요 두번 드세요,2021-08-23,점심에 방문,커피가 맛있어요,34,1
1177552668,눈누4181,분위기도 좋고 음식도 맛있어요(๑´ސު｀๑) 점심엔 인근에 구청이 있어서 붐비니 예약하고 방문하면 좋을 거 같아요!,2021-07-02,점심에 방문,,6,1
1177552668,파랑톡톡,테이블이 몇 없어서 빨리가야하고음식이 늦게나와서 빨리 가야하는 맛집!,2021-06-09,저녁에 방문,,1165,1
1177552668,wlt****,또 갈게여~!!,2021-06-08,저녁에 방문,,1471,1
1177552668,tinytinygirl,"가격, 양, 맛 다 좋았으나 무성의한 태도에 별하나 뺌사장님은 괜찮았음",2021-05-13,점심에 방문,,52,1
1177552668,미치루,맛있어서 재방문!,2021-05-05,점심에 방문,,879,2
1177552668,팡팡1098,좋아요~~,2021-04-02,밤에 방문,,1673,1
1177552668,정상희104,아기자기,2021-03-26,밤에 방문,,1820,1
1177552668,미치루,너무 맛있어요,2021-03-21,점심에 방문,,879,1
1177552668,쪼이13,"커피 정말 맛있구요👍 브런치도 푸짐하고, 맛있어요👍 사장님도 친절하시구요👍 자주 갈 것 같아요^^",2021-03-09,저녁에 방문,,37,1
1177552668,안나봉,"아기자기한 분위기.갈릭새우파스타 양 푸짐하고, 새우 완젼 탱글!커피도 산미없는 거 넘 맛나요💫🎶💯",2020-10-26,밤에 방문,,37,2
1177552668,lilbi,1호단골집~!~!~! 맨날 먹어도 맛있어여~!~!~!,2020-10-20,저녁에 방문,,141,1
1177552668,Jane327,커스타드푸딩이랑 드립커피가 너무 맛있었어요 !!! 가게 분위기도 존예ㅠㅠ 또 가고싶어요,2020-10-20,점심에 방문,,156,1
1177552668,짚시여인,조아요~~~~~,2020-09-18,점심에 방문,,1143,1
1177552668,김덕배930,깔끔하고 밥도 괜찮고 콘센트도 있고 그렇다 가게가 작긴하고 그런데 귀여운 맛이잇다,2020-09-08,저녁에 방문,,634,1
1177552668,안나봉,"무화과 토스트 존맛탱!!! 무화과 큼직하게 올라가서, 입안에 가득 넣으면 과즙이 팡팡터지면 살살 녹아요!! 크림치즈랑 무화과가 이렇게 잘 어울릴줄이야..(ᵒ̤̑ ₀̑ ᵒ̤̑)wow!*✰꾸덕파스타도 양 많고, 루꼴라도 너무 좋고.완젼 여심 저격입니다!! 사장님도 친절하고, 깔끔한 차분한 장소입니당",2020-08-14,점심에 방문,,37,1
32093837,고민의탐험가,너무 맛있어요요 친절한 사장님 짱짱,2025-03-28,"저녁에 방문, 예약 없이 이용, 친목",음식이 맛있어요,2070,1
