place_id,nickname,content,date,situations,keywords,review_count,visit_count
1351594569,We럽,맛있었어요~~! 양도 푸짐하공 좋앟습니다~! 포장해서 먹었는데 굿,2023-12-03,"저녁에 방문, 예약 없이 이용, 대기 시간 바로 입장, 일상, 친구",가성비가 좋아요,1037,1
1351594569,여니47,해장국 돌솥밥 다 맛잇어요,2023-12-03,밤에 방문,가성비가 좋아요,324,1
1351594569,대박꾼,가격이 넝 좋아요 선지해장국 맛있어요,2023-12-02,"저녁에 방문, 예약 없이 이용, 대기 시간 바로 입장, 친목, 부모님",음식이 맛있어요,898,1
1351594569,iiiiioiiii,몇십년째 가끔 가지만 양이 점점 줄어들고 맛도 많이 변해서 아쉽네요,2023-12-02,"저녁에 방문, 예약 없이 이용, 대기 시간 바로 입장, 일상, 부모님",,620,1
1351594569,미니멀라이프4807,음식이 매우 빨리 나옵니다 자주에용 하는 식당 입니다 대박 나세요,2023-12-01,"점심에 방문, 예약 없이 이용, 대기 시간 바로 입장, 일상, 혼자",음식이 맛있어요,340,4
1351594569,엥나아,청년 아들의 추천으로 방문한 일심가성비 좋고 맛도 좋은 돌솥비빔밥집가끔 생각나면 들러봄직하다주문하고 수저 놓는데 따끈한 돌솥이 나온다만오천원짜리 집보다 푸근하네,2023-11-29,"저녁에 방문, 예약 없이 이용, 대기 시간 바로 입장, 친목, 연인・배우자",음식이 맛있어요,1044,1
1351594569,미니멀라이프4807,재방문 입니다,2023-11-24,점심에 방문,혼밥하기 좋아요,340,3
1351594569,미니멀라이프4807,맛있어요 감사합니다,2023-11-17,점심에 방문,가성비가 좋아요,340,2
1351594569,Impeccable10,가성비 좋아요.맛있어요.,2023-11-11,점심에 방문,음식이 맛있어요,905,1
1351594569,py****,굿굿,2023-11-09,점심에 방문,양이 많아요,897,18
1351594569,jeo****,양도 많고맛나요,2023-11-01,아침에 방문,음식이 맛있어요,1130,4
1351594569,cwmtswaf,오랜만에갔는데가격이올랐네요.근데밥밑에가물기가많이있었구요.쌀이그런건지밥이별로였어요담다만것처럼양도적구.깍두기는좋았어요.첨에들어가서.선지많이달랬더니.주시드라구요.근데.국물이부족해서국물을좀더달라하니.주방에서못마땅해하는소리가들리더라구요.물론주셨지만.될수있으면손님뒷얘기는안했으면좋겠습니다.들려요.밥먹는데.저원년단골인데.그건아니잖아요.,2023-10-23,저녁에 방문,음식이 빨리 나와요,26,1
1351594569,임인숙1793,친절해요,2023-10-18,점심에 방문,음식이 맛있어요,428,10
1351594569,밀리언맨48,나이스,2023-10-16,아침에 방문,음식이 맛있어요,662,8
1351594569,빙빙9636,좋아요,2023-10-03,아침에 방문,음식이 맛있어요,1484,1
1351594569,백현23,좋아요,2023-09-27,점심에 방문,음식이 맛있어요,1937,2
1351594569,bk0****,좋아요,2023-09-23,저녁에 방문,혼밥하기 좋아요,2660,171
1351594569,Oroi린,감사합니다 👍,2023-09-19,"밤에 방문, 예약 없이 이용, 대기 시간 바로 입장, 친목, 지인・동료",친절해요,1515,1
1351594569,이뿐이 아씨,좋아요,2023-09-18,점심에 방문,음식이 맛있어요,432,1
1351594569,bej****,굿,2023-09-17,점심에 방문,음식이 맛있어요,511,2
1737172492,와플3269,튀김 바삭바삭하고 너무 맛있러요~~! 커리도 매콤한 정도가 딱입니다^_^,2025-04-08,"저녁에 방문, 예약 없이 이용, 대기 시간 바로 입장, 친목, 친구",음식이 맛있어요,34,1
1737172492,lim****,혼밥하기 좋고 요즘 자주 오고 있어요. 그리고 튀김이 이렇게 바삭한건 처음 먹어봐서 엄청 맛있어요,2025-04-08,"점심에 방문, 예약 없이 이용, 대기 시간 바로 입장, 회식, 혼자",음식이 맛있어요,4,1
1737172492,리즈2489,너무맛있어요 최고맛집 ㅎㅎ,2025-04-06,"점심에 방문, 예약 없이 이용, 대기 시간 바로 입장, 데이트, 연인・배우자",음식이 맛있어요,12,2
1737172492,깐지깐지요,광운대 맛집 일심텐동 다녀왔어요~~튀김요리가 있는 매장인데 바닥도 깨끗하고무엇보다 음식이 넘 맛나요~~혼밥 죄석도 여러개 있어서 흔밥히기 넘 좋았어요~다음엔 가족이랑 와야겠어요~,2025-04-04,"점심에 방문, 예약 없이 이용, 대기 시간 바로 입장, 일상, 혼자",음식이 맛있어요,38,1
1737172492,duckduck1234,매장 넓고 쾌적해서 너무좋고 혼밥하기에 테이블배치도 너무 좋아요시켜먹기만 했는데 와서 먹어도 너무 좋은 것 같아요😋,2025-04-04,"점심에 방문, 예약 없이 이용, 대기 시간 바로 입장, 나들이, 친구",재료가 신선해요,10,1
1737172492,곽두팔2588,넘넘맛있어용! 근처에 자취하는데 또올게요 :),2025-04-04,"점심에 방문, 예약 없이 이용, 대기 시간 바로 입장, 데이트, 연인・배우자",음식이 맛있어요,23,1
1737172492,icl****,일끝나고 텐동 먹으러 왔어요 :) 매장 인테리어도 깨끗하고 혼밥 하기에도 좋을거 같아요!,2025-04-02,"저녁에 방문, 예약 없이 이용, 대기 시간 바로 입장, 친목, 지인・동료",음식이 맛있어요,16,1
1737172492,김성태26,맛있어요,2025-04-02,"점심에 방문, 예약 없이 이용, 대기 시간 바로 입장, 일상, 혼자",양이 많아요,32,1
1737172492,ant313,굉장히 먹음직스러워보이는 튀이이김~굿굿!,2025-03-31,"저녁에 방문, 예약 없이 이용, 대기 시간 바로 입장, 데이트, 연인・배우자",음식이 맛있어요,23,1
1737172492,블랄랄라71,처음와봤는데 튀김 따뜻하고 맛있어요! 냄새부터가 고소함 그 자체입니다,2025-03-31,"저녁에 방문, 예약 없이 이용, 대기 시간 바로 입장, 친목, 친구",음식이 맛있어요,51,1
1737172492,yskfamily,텐동이 먹고싶어서 근처에 찾아가서 먹었는데 깔끔하고 분위기도 좋고 맛도 있네요 잘먹었습니다^^,2025-03-30,"점심에 방문, 예약 없이 이용, 대기 시간 바로 입장, 일상, 혼자",음식이 맛있어요,9,1
1737172492,mn2,맛있어요,2025-03-28,"점심에 방문, 예약 없이 이용, 대기 시간 바로 입장, 친목, 친구",음식이 맛있어요,27,1
1737172492,야누스6179,혼밥용 바테이블이 있어서 혼밥하기 좋아요국산 생맥은 없고 300ml넘어보이는 기린 생맥을 5000원에 팝니다튀김이 아주 바삭합니다,2025-03-25,"점심에 방문, 예약 없이 이용, 대기 시간 바로 입장, 나들이, 혼자",음식이 맛있어요,309,1
1737172492,misty016,한끼 식사로 나쁘지 않아요~^^혼밥 좋아요,2025-03-24,"점심에 방문, 대기 시간 바로 입장, 일상, 혼자",양이 많아요,22,1
1737172492,ohs****,잘먹었어요~기름이 깨끗하고 맛있어요^^,2025-03-24,"점심에 방문, 예약 없이 이용, 대기 시간 바로 입장, 일상, 친구",음식이 맛있어요,22,2
1737172492,김성준8294,맛있어요,2025-03-18,"점심에 방문, 예약 없이 이용, 대기 시간 바로 입장, 친목, 친구",음식이 맛있어요,1,1
1737172492,rie****,매우 맛있게 잘먹었습니다,2025-03-18,"점심에 방문, 예약 없이 이용, 대기 시간 바로 입장, 친목, 친구",음식이 맛있어요,17,1
1737172492,빡지님,튀김류가 가격대에 비해 구성이 알차진 않네요.,2025-03-18,"점심에 방문, 예약 없이 이용, 대기 시간 바로 입장",친절해요,14,1
1737172492,치즈얌얌,홀도 깔끔하니 좋습니다. 다양한 메뉴가있어서 고르고 좋아요~여러명이가도 다양하게 먹를 수 있어서 좋고 양도 푸짐해서 좋습니다.ㅎㅎ친절하시고 혼밥하기도 너무 좋네요~~다음에 또 방문해야겟어요,2025-03-17,"점심에 방문, 예약 없이 이용, 대기 시간 10분 이내, 일상, 친구",음식이 맛있어요,11,1
1737172492,범도리39,너무 마싯어요 대학교 앞에 있어서 접근성도 편하고 밥도 많이 주시네요 ㅎㅎ 잘먹었습니다,2025-03-17,"점심에 방문, 예약 없이 이용, 대기 시간 바로 입장, 데이트, 연인・배우자",재료가 신선해요,52,1
1737172492,태영79,어제도 오고 또 왔는데 넘 맛잇어요!!!!💕💕,2025-03-14,"점심에 방문, 예약 없이 이용, 대기 시간 바로 입장, 데이트, 연인・배우자",특별한 메뉴가 있어요,19,1
1737172492,yun****,음식이 거의 바로 나와서 훨씬 바삭하게 먹을 수 있었어요!감사합니다,2025-03-14,"점심에 방문, 예약 없이 이용, 대기 시간 바로 입장, 일상, 혼자",음식이 맛있어요,1,1
1737172492,par****,,2025-03-13,"점심에 방문, 예약 없이 이용, 대기 시간 바로 입장, 일상, 혼자",음식이 맛있어요,3,1
1737172492,김민주7,튀김덮밥이 엄청 맛있어요!!특리 새우튀김이 바삭해서 좋아요 또 오고 싶을 정도로 너무 맛있어요,2025-03-12,"점심에 방문, 예약 없이 이용, 대기 시간 바로 입장, 친목, 친구",음식이 맛있어요,8,1
1737172492,이태양4493,음식 맛있습니다,2025-03-11,"점심에 방문, 예약 없이 이용, 대기 시간 바로 입장, 일상, 혼자",음식이 맛있어요,9,1
1737172492,rsg****,맛저 하러옴  두번째 방문임.,2025-03-06,"저녁에 방문, 예약 없이 이용, 대기 시간 바로 입장, 친목, 지인・동료",음식이 맛있어요,9,1
1737172492,hjh****,선배님들이랑 밥 먹기도 좋고 분위기가 좋아서 추천해요,2025-03-06,"점심에 방문, 예약 없이 이용, 대기 시간 바로 입장, 친목, 친구, 지인・동료",음식이 맛있어요,5,1
1737172492,kk2****,"너무 맛있습니다!!친구들과 공부하고 점심 먹으러 왔는데, 간만에 맛있는 음식 먹어서 눈물이 납니다🥹서비스 온천계란도 감사합니다~!!자주 올게요!",2025-03-06,"점심에 방문, 예약 없이 이용, 대기 시간 바로 입장, 친목, 친구",음식이 맛있어요,15,3
1737172492,힘차고즐겁게,가게 분위기가 좋고 혼밥하기도 좋은 것 같아요,2025-03-06,"점심에 방문, 예약 없이 이용, 대기 시간 바로 입장, 친목, 친구",음식이 맛있어요,14,1
1737172492,jed****,,2025-03-06,"점심에 방문, 예약 없이 이용, 대기 시간 바로 입장, 친목, 친구",음식이 맛있어요,9,1
1737172492,ali****,튀김도 많고 커서 좋아여. 진짜 맛있습미당,2025-03-05,"점심에 방문, 예약 없이 이용, 대기 시간 바로 입장, 친목, 친구",음식이 맛있어요,5,1
1737172492,line78,가게 분위기도 되게 일식집처럼 돼있었고 되게 좋았어요!!,2025-03-05,"점심에 방문, 예약 없이 이용, 대기 시간 바로 입장, 데이트, 연인・배우자",음식이 맛있어요,10,1
1737172492,엘렐린,음식이 맛있고 가게가 깔끔합니다,2025-03-05,"점심에 방문, 예약 없이 이용, 대기 시간 바로 입장, 일상, 기타",음식이 맛있어요,17,1
1737172492,gog****,맛있고 친절해요.,2025-03-04,"점심에 방문, 예약 없이 이용, 대기 시간 바로 입장, 친목, 친구",음식이 맛있어요,4,1
1737172492,파란하늘으노,너무맛있아요 ㅎㅎ일주일동안 3번왔어 ㅋㅋㅋ최고맛집^^,2025-03-04,"점심에 방문, 예약 없이 이용, 대기 시간 바로 입장, 데이트, 연인・배우자",음식이 맛있어요,27,2
1737172492,구피족보,맛이있습니다.,2025-03-03,"저녁에 방문, 예약 없이 이용, 대기 시간 바로 입장, 일상, 연인・배우자",음식이 맛있어요,281,1
1737172492,dls****,튀김이 바삭해요~ 음식이 깔끔해요~~^^,2025-03-03,"저녁에 방문, 예약 없이 이용, 대기 시간 바로 입장, 일상, 연인・배우자",음식이 맛있어요,9,1
1737172492,jun****,텐동 좋아하는 데 너무 맛있게 먹구 갑니다🙏🙏,2025-03-03,"점심에 방문, 예약 없이 이용, 대기 시간 바로 입장, 일상, 혼자",음식이 맛있어요,20,1
1737172492,유월1836,자리에서 충전할 수 있어서 좋네요. 맛도 있어요!,2025-03-02,"점심에 방문, 예약 없이 이용, 대기 시간 바로 입장, 일상, 혼자",음식이 맛있어요,794,1
1737172492,리즈2489,너무밋있어요 요즘 최애단골집😜😀,2025-03-02,"점심에 방문, 예약 없이 이용, 대기 시간 바로 입장, 데이트, 연인・배우자",음식이 맛있어요,12,1
1737172492,에스타275,텐동 먹으러 왔는데맛있고 친절하셔요잘 먹고 갑니다~!,2025-03-02,"점심에 방문, 예약 없이 이용, 대기 시간 바로 입장, 친목, 친구",음식이 맛있어요,52,1
1737172492,김나현10,텐동 맛있어요! 매장도 넓고 깨끗하네용❤️,2025-02-26,"저녁에 방문, 예약 없이 이용, 대기 시간 바로 입장, 데이트, 연인・배우자",매장이 넓어요,27,1
1737172492,na5471,맛있어서 자주 와요! ☺️ 튀김이 바삭해서 좋아요!,2025-02-26,"저녁에 방문, 예약 없이 이용, 대기 시간 바로 입장, 데이트, 연인・배우자",음식이 맛있어요,19,1
1737172492,파란하늘으노,아아도좋아하고 너무맛있어요 ㅎㅎ,2025-02-26,"저녁에 방문, 예약 없이 이용, 대기 시간 바로 입장, 데이트, 연인・배우자",음식이 맛있어요,27,1
1737172492,고리d,텐동 맛있어요!!!! 토리텐동 최고......👍,2025-02-23,"점심에 방문, 예약 없이 이용",음식이 맛있어요,52,1
1737172492,eun****,맛있어요 또 먹고싶어요 자주 올 것 같아요,2025-02-22,"점심에 방문, 예약 없이 이용, 대기 시간 바로 입장, 친목, 친구",음식이 맛있어요,22,1
1737172492,헨정,튀김이 너무 맛있어요!!,2025-02-22,"점심에 방문, 예약 없이 이용, 대기 시간 10분 이내, 친목, 친구",음식이 맛있어요,23,1
1737172492,nbn****,nice place to visit if you need some cripsy food in cold days ~~~~,2025-02-18,"저녁에 방문, 예약 없이 이용, 대기 시간 바로 입장, 친구",인테리어가 멋져요,79,1
1737172492,Ham53,"2번째 방문이에요! 남편이 텐동을 좋아해서 델꾸왔는데 너무 맛있대요 위에 튀김도 엄청 많이 올라가있고 바삭한게 진짜 맛있어요! 텐동말고 카레랑 우동 메뉴, 치즈돈까스도 있더라구요! 제가 한 요리보다 맛있는지 너무 맛있다네요",2025-02-16,"저녁에 방문, 예약 없이 이용, 대기 시간 바로 입장, 데이트, 연인・배우자",음식이 맛있어요,821,2
1737172492,용캐처,,2025-02-15,"저녁에 방문, 예약 없이 이용, 대기 시간 바로 입장, 나들이, 아이",음식이 맛있어요,46,1
1737172492,김민욱13,"텐동하고 카레가 너무 맛있었습니다, 겉자 속촉이에요! 우연히 들린 곳 인데 맛집 완전 인정입니다 다음에 기회가 온다면 또 들리도록 하겠습니다",2025-02-15,"저녁에 방문, 예약 없이 이용, 대기 시간 바로 입장, 데이트, 연인・배우자",음식이 맛있어요,2,1
1737172492,005375,맛도 좋고 매장도 넓고 깨끗해요! 추천합니다~,2025-02-15,저녁에 방문,음식이 맛있어요,25,1
1737172492,악50,광운대바로앞에 텐동집사장님이 엄청 친절하시고주문즉시 만들어주셔요매장도 깔끔하고 창문도커서 답답한느낌도 없고 좋아요어머니랑 왔는데 어머니도좋아하시네요,2025-02-15,"점심에 방문, 예약 없이 이용, 대기 시간 바로 입장, 일상, 부모님",음식이 맛있어요,81,1
1737172492,몽실이35,비쥬얼도 맛도 좋아요~~!!,2025-02-14,"점심에 방문, 예약 없이 이용, 대기 시간 바로 입장, 일상, 연인・배우자",음식이 맛있어요,50,1
1737172492,삐삐나에요,항상 맛있어용 텐동 먹고싶을땐 항상 여기로 옵니다!!!,2025-02-11,"점심에 방문, 예약 없이 이용, 대기 시간 바로 입장, 데이트, 연인・배우자",음식이 맛있어요,28,2
1737172492,하늘9523,직원분 너무 친절하시고 음식도 맛있어요 가까운 곳에 텐동집이 생겨서 넘 좋아요,2025-02-09,"저녁에 방문, 예약 없이 이용, 대기 시간 바로 입장, 데이트, 연인・배우자",음식이 맛있어요,17,2
1737172492,ths****,맛잇어서 자주옵니당,2025-02-09,"점심에 방문, 예약 없이 이용, 대기 시간 바로 입장, 친목, 친구",친절해요,3,1
1737172492,예은박,너무맛잇어서 자주오는 곳!,2025-02-09,"점심에 방문, 예약 없이 이용, 대기 시간 바로 입장, 친목, 친구",음식이 맛있어요,17,1
1737172492,로시67,동네라서 텐동 먹고싶을때 가끔와요! 정말 바삭하고 맛있게 잘튀김! 제 최애는 토리텐입니다 ㅎㅎ,2025-02-09,"점심에 방문, 예약 없이 이용, 대기 시간 바로 입장, 데이트",음식이 맛있어요,9,1
1737172492,마이스탈리,맛있게 잘 먹었습니다😃👍,2025-02-08,"저녁에 방문, 예약 없이 이용, 대기 시간 바로 입장, 일상, 혼자",음식이 맛있어요,1966,1
1737172492,Mia00,혼밥하기 좋아요 텐동먹고싶었는데 근처에 있어서 좋아요,2025-02-08,"점심에 방문, 예약 없이 이용, 대기 시간 바로 입장, 친목, 혼자",음식이 맛있어요,95,1
1737172492,Lonelynight79,동네에 깔끔하게 맛있는 맛집입니다~,2025-02-08,"점심에 방문, 예약 없이 이용, 대기 시간 바로 입장, 일상, 친척・형제",음식이 맛있어요,5,1
1737172492,요닝57,두번째 방문이예요! 직원분들이 친절하시구 메뉴구성이 많아서 좋아요!!!!!!🥰,2025-02-04,"점심에 방문, 예약 없이 이용, 대기 시간 바로 입장, 데이트, 일상, 연인・배우자",특별한 메뉴가 있어요,16,2
1737172492,zzo67,두번째 방문인데 맛있어요!!! 직원분도 친절하시고 혼밥하러 온사람들도 혼밥 자석이있어서 먹기 편하실거같아요!!제일 중요한거 음식도 맛있어요!!! 튀김 존맛,2025-01-31,"저녁에 방문, 예약 없이 이용, 대기 시간 바로 입장, 데이트, 일상, 연인・배우자, 친구, 지인・동료",음식이 맛있어요,24,1
1737172492,재형님4373,,2025-01-30,"저녁에 방문, 예약 없이 이용, 대기 시간 바로 입장, 데이트, 연인・배우자",음식이 맛있어요,89,1
1737172492,따꿍발망노랑왕자님,맛있고 분위기도 좋고 또 오고 싶은 곳이에요💖,2025-01-30,점심에 방문,음식이 맛있어요,667,1
1737172492,예이예빵,처음 와봤는데 깔끔하고 좋네요! 맛있게 먹었습니다~,2025-01-26,"점심에 방문, 예약 없이 이용, 대기 시간 바로 입장, 일상",음식이 맛있어요,38,1
1737172492,1oaug,집 앞에 텐동집이 생겼다고 해서 와봤는데 가성비도 좋고 외식하기 좋아요!! 직원분들도 친절하시고 맛있어서 또 오고 싶네요!!,2025-01-25,"저녁에 방문, 예약 없이 이용, 대기 시간 바로 입장, 일상, 부모님, 친척・형제",음식이 맛있어요,17,1
1737172492,오치,튀김이 넘넘 바삭바삭하고 식감이 미쳤어요치즈돈도 맛있는데 카레가 쬐끔 매워요(신라면 못먹는편)인테리어 아늑하고 혼밥하기 너무 좋게 되어있어요 굿,2025-01-25,"점심에 방문, 예약 없이 이용, 대기 시간 바로 입장, 데이트, 연인・배우자",혼밥하기 좋아요,13,1
1737172492,onlyhoya,늦은 저녁에 혼밥 했네요.,2025-01-23,"저녁에 방문, 예약 없이 이용, 대기 시간 바로 입장, 혼자",매장이 넓어요,10,1
1737172492,첼시이즈블루,깔끔하고 맛나요! 매장도 깨끗하고 넓어서 좋습니다. 혼밥하기 좋은 좌석도 있어요,2025-01-23,"저녁에 방문, 예약 없이 이용, 대기 시간 바로 입장, 일상, 친구, 지인・동료",매장이 넓어요,16,1
1737172492,seo****,그냥 맛있어용 믿어옵니당,2025-01-23,"점심에 방문, 예약 없이 이용, 대기 시간 바로 입장, 데이트, 연인・배우자",음식이 맛있어요,7,1
1737172492,ghd****,새로 생긴뒤로 꼭 한번 와보고싶었는데 와보길 잘한거 같아용 튀김도 바삭하고 간도 적당하고 맛있습니당 너무 친절하시고 다음에 또 오겠습니다!,2025-01-23,"점심에 방문, 예약 없이 이용, 대기 시간 바로 입장, 데이트, 연인・배우자",음식이 맛있어요,27,1
1737172492,kangsw421,맛잇어요 바삭바삭함,2025-01-21,"점심에 방문, 예약 없이 이용, 대기 시간 바로 입장, 친목, 친구",음식이 맛있어요,10,2
1737172492,Woojae02,매장이 청결하고 맛있어요!!,2025-01-21,"점심에 방문, 예약 없이 이용, 대기 시간 바로 입장, 친목, 비즈니스, 친구, 지인・동료",음식이 맛있어요,4,2
1737172492,gwa****,맛있게 먹었어요 bb,2025-01-21,"점심에 방문, 예약 없이 이용, 대기 시간 바로 입장, 일상, 지인・동료",음식이 맛있어요,1,1
1737172492,아이안6,맛있어요,2025-01-21,"점심에 방문, 예약 없이 이용, 대기 시간 바로 입장, 일상, 친구, 지인・동료",친절해요,4,2
1737172492,xot****,매장이 깔끔하고 넓어서 너무 맛있게 잘먹고갑니다!,2025-01-21,"점심에 방문, 예약 없이 이용, 대기 시간 바로 입장, 친목, 친구",음식이 맛있어요,21,2
1737172492,호호삐삐,광운대앞 일심텐동 2층 우선 아늑한 장소가 맘에 들고 음식이 빨리 나오고맛도 좋아요.특히 유자청 단무지가 신의 한수입니다.,2025-01-18,"점심에 방문, 예약 없이 이용, 대기 시간 바로 입장, 가족모임, 아이",음식이 맛있어요,8,1
1737172492,그림쟁이4,맛있어요,2025-01-17,"점심에 방문, 예약 없이 이용, 대기 시간 바로 입장, 일상, 아이",인테리어가 멋져요,953,1
1737172492,kye****,,2025-01-17,"점심에 방문, 예약 없이 이용, 대기 시간 바로 입장, 데이트, 연인・배우자",음식이 맛있어요,5,1
1737172492,김승재4093,너무너무 맛있습니다!! 돈육튀김 향이 진짜 너무 좋아요,2025-01-15,"점심에 방문, 예약 없이 이용, 대기 시간 바로 입장, 일상, 혼자",음식이 맛있어요,18,1
1737172492,main96,양 많고 맛있어요 추천,2025-01-14,"점심에 방문, 예약 없이 이용, 대기 시간 바로 입장, 일상, 혼자",음식이 맛있어요,43,1
1737172492,you****,온천계란추가해서 비벼먹음맛잇다고해서 그렇게먹어봣구요음식디게빨리나와서좋고튀김바삭하고맛잇어요다음엔 카레에튀김올라간거 먹어보려구요,2025-01-11,"점심에 방문, 예약 없이 이용, 대기 시간 바로 입장, 일상, 혼자",음식이 맛있어요,104,1
1737172492,ald****,근처 들를 일이 있어서 방문했는데 맛있고 직원분도 친절하셔서 좋았어요!,2025-01-08,"저녁에 방문, 예약 없이 이용, 대기 시간 바로 입장, 일상, 연인・배우자",음식이 맛있어요,9,1
1737172492,yoominho,고기도 맛있고 튀김의 기름진맛보다 담백해서 좋습니다!,2025-01-08,"저녁에 방문, 예약 없이 이용, 대기 시간 바로 입장, 일상, 혼자",음식이 맛있어요,11,1
1737172492,절세가45,식사하러 방문했습니다.토리텐동 시켰는데 맛있네요. 다른 튀김들도 신선하고 바싹합니다.,2025-01-06,"점심에 방문, 예약 없이 이용, 대기 시간 바로 입장, 일상, 혼자",음식이 맛있어요,4,1
1737172492,Holly25,블로그 리뷰보고 방문햇는데..오 사장님친절하고 음식도 빨리나와요.동네텐동집 있어서 좋으네요.음식도 맛있어요~^---^♡,2025-01-05,"저녁에 방문, 예약 없이 이용, 대기 시간 바로 입장, 데이트, 연인・배우자",음식이 맛있어요,16,1
1737172492,neo9riman,튀김이 너무 쫄깃하고 고소하고 맛있어요ㅠㅠㅠ,2025-01-04,"점심에 방문, 예약 없이 이용, 대기 시간 바로 입장, 데이트, 연인・배우자",음식이 맛있어요,6,1
1737172492,hos****,토리텐 정식이랑 이카텐동 시켰는데 나오는 속도도 빠르고 음식이 전반적으로 깨끗합니다다.밥위에 불닭소스 뿌려 먹으니 기름진맛이 덜해 맛있습니다. 제 취향 저격 ㅎㅎ광운대도서관 공부하러 왔다가 점심 먹기 좋아요,2025-01-04,"점심에 방문, 예약 없이 이용, 대기 시간 바로 입장, 데이트, 연인・배우자",음식이 맛있어요,19,1
1737172492,에반게리온22,음식도 맛있고 직원분도 친절해요분위기도 편안한 분위기도 음식도 깔끔합니다,2025-01-02,"점심에 방문, 예약 없이 이용, 대기 시간 바로 입장, 친목, 친구",인테리어가 멋져요,782,1
1737172492,god****,회사 근처라서 방문했는데 웨이팅 없이 들어와서 좋았고 편리하게 키오스크 결제로 메뉴 사진 보며 주문할 수 있어 편리했어요~ 맛도 괜찮아요!,2025-01-02,"점심에 방문, 예약 없이 이용, 대기 시간 바로 입장, 일상, 지인・동료",인테리어가 멋져요,10,1
1737172492,rjaekagkwk,너무 맛있고 인테리어가 진짜 좋아요 또 오겠습니다~,2025-01-01,"저녁에 방문, 예약 없이 이용, 대기 시간 바로 입장, 친목, 친구",재료가 신선해요,11,1
1737172492,코바나,따뜨한 햇살아래 식사하기 좋은 뷰 맛집입니다👍❤️,2024-12-31,"점심에 방문, 예약 없이 이용, 대기 시간 바로 입장, 데이트, 연인・배우자",음식이 맛있어요,6,1
