place_id,nickname,content,date,situations,keywords,review_count,visit_count
1882675011,만능이야,"지나가다 깨끗하고, 신선해보여 포장했는데 완전 맛집!!!  남편이 이런 참치는 동네서 팔 재료가 아니라고 ...ㅎ 저렴한 가격에 진짜 잘 먹었어요.",2021-07-06,저녁에 방문,,317,1
1882675011,건강한 삶 hy,오늘도 잘 먹었습니다.산삼주 최고였습니다.,2021-07-02,저녁에 방문,,1120,3
1882675011,냠냠7615,제가 먹어본 참치중에 젤 맛있어요 사장님도 엄청 친절하셔서 단골될 예정,2021-06-30,점심에 방문,,31,1
1882675011,fdfdfd,참치가 넘 신선하고 맛나요~단골이 될것 같습니다~♡,2021-06-30,점심에 방문,,1,1
1123697995,SSUNw,,2025-04-09,점심에 방문,음식이 맛있어요,995,1
1123697995,Won4367,오랜만에 맛있게 잘 먹었습니다👍,2025-04-06,"점심에 방문, 포장·배달 이용, 대기 시간 10분 이내, 일상",,4,3
1123697995,오리가방46,,2025-04-02,저녁에 방문,음식이 맛있어요,989,4
1123697995,liiiilliiiiliiiliiii,굿,2025-03-31,점심에 방문,음식이 맛있어요,912,1
1123697995,djkzlse,남자사장님~ 알바한테나 손님전화 받는 것 좀 친절하게 말하세요바쁜 거 알겠는데 ~해라 거리고 사납게 꽂는 말투 옆에서 기다리며 듣는데 불편하네요사장님이 친절히 대해줘야 옆에 알바도 안 바뀌고 계속 쭉 일하는거라 생각합니다동네에 좋아하는 브랜드 있어서 좋았습니다근데 그런 모습 불편해서 매출 올려주기 싫어서 안 가는 사람 꽤 있는 거 분명히 알아두셨으면 좋겠습니다,2025-03-16,"아침에 방문, 예약 없이 이용, 대기 시간 30분 이내",,8,1
1123697995,마루14,이삭하면 햄스페셜👍👍,2025-03-11,"점심에 방문, 예약 없이 이용, 대기 시간 바로 입장, 일상, 혼자",아늑해요,372,1
1123697995,구홍이,매장에서 먹고 갈 수 있는 테이블이 있어서 좋아요.,2025-02-17,점심에 방문,음식이 맛있어요,771,1
1123697995,마음이가는대로,음식도 빨리 나오고 좋아요,2025-02-14,"점심에 방문, 예약 없이 이용, 대기 시간 바로 입장, 데이트, 연인・배우자",음식이 맛있어요,965,1
1123697995,lymsun,굿,2025-02-13,"점심에 방문, 예약 없이 이용, 대기 시간 10분 이내, 일상, 아이",음식이 맛있어요,498,2
1123697995,zxc2977,좋아요,2025-02-13,점심에 방문,음식이 맛있어요,1484,46
1123697995,lymsun,굿,2025-02-09,"점심에 방문, 예약 없이 이용, 대기 시간 30분 이내, 일상, 아이",음식이 맛있어요,498,1
1123697995,핑크토마토24,맛있어요^^,2025-01-20,"점심에 방문, 포장·배달 이용, 대기 시간 바로 입장, 일상, 혼자",매장이 청결해요,6,3
1123697995,zxc2977,암사점 맛있어요,2025-01-16,점심에 방문,음식이 맛있어요,1484,45
1123697995,ji****,ㆍ,2025-01-09,저녁에 방문,,2796,5
1123697995,Good Lucky,아들 최애 메뉴♡딥치즈베이컨포테이토~~~~ 강추!딥치즈 소스가 듬뿍 들어있네요사장님 항상 친절하시고 토스트가 맛있어서 재방문했어요식사대용으로 충분히 배불러요@@다음엔 다른메뉴 먹어볼게용^^,2025-01-03,"점심에 방문, 포장·배달 이용, 대기 시간 10분 이내, 일상, 혼자",음식이 맛있어요,9,2
1123697995,천사1,매장이 너무 청결하네요토스트도 너무 맛있었어요,2025-01-03,"점심에 방문, 포장·배달 이용, 대기 시간 바로 입장, 일상, 혼자",음식이 맛있어요,931,2
1123697995,dore,알바생분들이 친절하셔서 좋았어요 음식도 생각보다 빨리나오고 재료도 많이 넣어주시는 것 같아요 맛있어요,2024-12-28,"점심에 방문, 예약 없이 이용, 대기 시간 바로 입장, 데이트, 연인・배우자",음식이 맛있어요,654,1
1123697995,ji****,ㆍ,2024-12-27,저녁에 방문,,2796,4
1123697995,si****,간단한 점심으로 먹기 좋아요!! 더구나 네이버 이벤트 중이라 더 좋아요^^,2024-12-21,"점심에 방문, 예약 없이 이용, 대기 시간 바로 입장, 일상, 친구",음식이 맛있어요,1056,3
1123697995,자근파동,이삭토스트 말이 필요 없습니다집근처엥 있어 좋아요,2024-12-21,"아침에 방문, 예약 없이 이용, 대기 시간 바로 입장, 일상, 혼자",음식이 맛있어요,18,1
1123697995,Good Lucky,사장님 친절하시고 토스트도 깔끔하고푸짐해서 엄청 맛있습니다^^딥치즈베이컨포테이토 강추!!,2024-12-20,"점심에 방문, 대기 시간 10분 이내, 일상, 혼자",음식이 맛있어요,9,1
1123697995,뮤즈224,라구는 역시 맛있어요 ~♡그런데 예쁘게 먹는건 포기하세요소스가 듬뿍 있어서 흘러나와서..예쁜건 포기하고 맛나게 드시길~ㅎㅎㅎ,2024-12-19,"점심에 방문, 예약 없이 이용, 대기 시간 바로 입장, 일상, 혼자",음식이 맛있어요,411,3
1123697995,zxc2977,좋아요,2024-12-05,점심에 방문,음식이 맛있어요,1484,44
1123697995,양파장,이삭 항상 맛있쥬 소스도 적당하고 토스트도 바삭함이 살아있는게 존맛탱 역시 이삭은 배달말고 픽업해서 바로먹어야하뮤 근데 전지점에서 키위주스메뉴가 아예 없어졌나바용 아쉽쓰ㅠ 주스가 손마니가긴함ㅎ,2024-11-19,"아침에 방문, 예약 없이 이용, 대기 시간 바로 입장",음식이 맛있어요,9,1
1123697995,Won4367,오늘도 맛있게 잘 먹었습니다~,2024-11-11,"점심에 방문, 예약 후 이용, 일상, 지인・동료",음식이 맛있어요,4,1
1123697995,아장아장펭귀니,넘 맛있어요 근데 항상 사람많아서 약간 대기 있어요ㅠ,2024-11-09,"점심에 방문, 예약 없이 이용, 대기 시간 바로 입장, 데이트",음식이 맛있어요,685,2
1123697995,용남56,굿ㅋㅋ,2024-11-08,저녁에 방문,음식이 맛있어요,640,3
1123697995,용남56,맛있어요 사진못찍어서ㅈㅅ,2024-11-06,저녁에 방문,음식이 맛있어요,640,2
1123697995,우리집뚱땡이,점심시간에 걸쳐가서 그런지- 주문이 많이 밀려있었어요-15분정도 걸린다고 주문후에 받았어요-주문하실거면 15~20분은 넉넉잡아 주문해야 할것같아요,2024-10-27,"점심에 방문, 포장·배달 이용, 대기 시간 30분 이내, 일상, 혼자",가성비가 좋아요,6,1
1123697995,sha****,베이컨베스트 맛있어용 ㅎㅎ 암사점은 항상 손님이 많아서 대기가 있는 편이에요!,2024-10-27,"아침에 방문, 예약 없이 이용, 대기 시간 바로 입장, 일상, 혼자",음식이 맛있어요,6,1
1123697995,hy53,미리 주문하고 픽업하니 좋았습니다!,2024-10-21,"저녁에 방문, 포장·배달 이용, 대기 시간 바로 입장, 혼자",혼밥하기 좋아요,15,1
1123697995,Hhhh91,맛있게 먹긴했는데 먹다보니 이런게 묻어있어서요 팬에 붙은건가..이거 먹어도 괜찮은건가요?,2024-10-19,"아침에 방문, 예약 없이 이용, 대기 시간 바로 입장",,27,2
1123697995,ji****,ㆍ,2024-10-11,저녁에 방문,,2796,3
1123697995,hye****,맛있게 잘먹엇어요,2024-09-24,점심에 방문,음식이 맛있어요,77,1
1123697995,kcjh34,요좋아요,2024-09-20,"아침에 방문, 예약 없이 이용, 대기 시간 바로 입장, 일상, 혼자",음식이 맛있어요,1986,1
1123697995,용남56,굿ㅋㅋ,2024-09-18,점심에 방문,음식이 맛있어요,640,1
1123697995,계란말이얍,굿,2024-09-12,저녁에 방문,혼밥하기 좋아요,1017,4
1123697995,아장아장펭귀니,친절하세요~,2024-09-11,"저녁에 방문, 예약 없이 이용, 대기 시간 30분 이내, 데이트",음식이 맛있어요,685,1
1123697995,배나공주,굿,2024-09-11,"저녁에 방문, 예약 없이 이용, 나들이",음식이 맛있어요,1156,2
1123697995,막둥이미르,굿,2024-09-11,"저녁에 방문, 포장·배달 이용, 대기 시간 10분 이내, 혼자",음식이 맛있어요,1528,4
1123697995,느티나무517,역시 이삭토스트 맛있네요 잘먹었습니다~,2024-09-09,"저녁에 방문, 포장·배달 이용, 대기 시간 30분 이내",음식이 맛있어요,3,2
1123697995,보물이13,,2024-09-02,"저녁에 방문, 예약 없이 이용, 대기 시간 바로 입장",가성비가 좋아요,2722,1
1123697995,배나공주,굿,2024-08-31,"점심에 방문, 예약 없이 이용, 대기 시간 바로 입장, 일상",음식이 맛있어요,1156,1
1123697995,오종현43,굳,2024-08-24,"아침에 방문, 예약 없이 이용, 대기 시간 바로 입장, 일상, 혼자",음식이 맛있어요,129,1
1123697995,잇50,햄스페셜 토스트 맛있어욘!,2024-08-10,"점심에 방문, 예약 없이 이용, 대기 시간 바로 입장, 일상, 혼자",음식이 맛있어요,810,1
1123697995,여여여여보슈,아침에 휘리릭 먹기 좋아요~픽업해서 집에서 우유랑 같이 맛있는 한 끼!,2024-08-03,"아침에 방문, 포장·배달 이용, 대기 시간 10분 이내, 일상, 연인・배우자",음식이 맛있어요,320,2
1123697995,코르세오,이삭 너무 맛있어요!!! 베이컨베스트 최애🫶🏻,2024-08-01,"점심에 방문, 예약 없이 이용, 대기 시간 바로 입장, 일상, 연인・배우자",음식이 맛있어요,653,6
1123697995,계란말이얍,굿,2024-07-29,점심에 방문,혼밥하기 좋아요,1017,3
1123697995,여여여여보슈,옛날에 학원 가기 전에 늘 먹었던 이삭토스트!여전히 넘 맛있다:),2024-07-25,"저녁에 방문, 예약 없이 이용, 대기 시간 바로 입장, 일상, 연인・배우자",음식이 맛있어요,320,1
1123697995,지용4724,좋아요,2024-07-23,"점심에 방문, 예약 없이 이용, 대기 시간 바로 입장, 데이트, 친구",음식이 맛있어요,2753,1
1123697995,bok****,굿,2024-07-16,점심에 방문,재료가 신선해요,1150,2
1123697995,막둥이미르,굿,2024-07-12,"점심에 방문, 포장·배달 이용, 대기 시간 10분 이내, 일상, 혼자",음식이 맛있어요,1528,3
1123697995,듑아,"들어갔을 때 학생 2명 테이블에서 먹고 있었고고 나머지 한 테이블에 사장님과 사장님어머님 2분이서 앉아 계셨는데 옆테이블 학생들한테 장난반 왜 이렇게 흘리면서 먹냐는 듯이 말씀하시더라고요. 그리고 학생들 나가니까 ""흘렸으면 치우라고 눈치줬는데 왜 못 알아먹냐고 저것들이"" 라고 하셨죠?왜 그 학생들이 치워야되죠? 사장님 할일 아닌가요? 이삭토스트 점내 식사는 셀프 청소인가요?뒤에서 손님들을 저런식으로  말하는구나 싶어서 아주 불쾌했어요. 가시는 분들 뒤에서 뭐라고 욕할지 모릅니다. 조심하세요.",2024-07-10,"저녁에 방문, 예약 없이 이용, 대기 시간 바로 입장, 일상, 혼자",,58,1
1123697995,이민정471,토스트맛집  햄스페셜 조아요,2024-07-07,"점심에 방문, 예약 없이 이용, 대기 시간 바로 입장, 일상, 연인・배우자",친절해요,212,2
1123697995,zxc2977,좋아요,2024-06-22,점심에 방문,음식이 맛있어요,1484,40
1123697995,ji****,ㆍ,2024-06-06,점심에 방문,,2796,2
1123697995,글리터리,"이삭 진짜진짜 좋아해요. 자주 먹구요!그런데 오늘 먹기가 좀 망설여진 이유가 있는데, 직원분들 마스크 좀 해주셨음 좋겠어요. 계속 대화하시면서 마스크도 안하시고 만드시는 게 좀 그렇더라구요.. 카운터보시는 분만 안쓰셨나했는데 토스트 만드시는 남자분도 안 쓰고 계속 말씀하시더라구요. 전에여기 직원분들 마스크 잘 쓰셨던 것 같은데 아예 안쓰시고 있어서 놀랐네요. 토스트처럼 노출된 환경에서 만드시는 음식은 마스크 착용해주시면 좋겠어요!",2024-05-28,"아침에 방문, 예약 없이 이용, 대기 시간 바로 입장, 일상, 기타",메뉴 구성이 알차요,66,6
1123697995,코르세오,이삭은 항상 맛있쥬,2024-05-27,"저녁에 방문, 예약 없이 이용, 대기 시간 바로 입장, 일상, 혼자",음식이 맛있어요,653,5
1123697995,zxc2977,좋아요,2024-05-16,점심에 방문,음식이 맛있어요,1484,39
1123697995,늘꽃길92,남자들이 참~~ 좋아합미다ㅋㅋㅋ,2024-05-15,"점심에 방문, 예약 없이 이용",음식이 맛있어요,458,3
1123697995,zxc2977,좋아요,2024-05-09,점심에 방문,음식이 맛있어요,1484,38
1123697995,jul****,ㅎㅎ,2024-05-04,"점심에 방문, 예약 없이 이용, 대기 시간 바로 입장, 일상, 혼자",음식이 맛있어요,439,2
1123697995,먹동석,프렌치 스크램블 너무 맛있어요!,2024-05-03,"저녁에 방문, 포장·배달 이용, 대기 시간 바로 입장, 일상, 친척・형제",음식이 맛있어요,311,1
1123697995,리티,이삭 좋아요,2024-05-02,"저녁에 방문, 예약 없이 이용, 대기 시간 바로 입장, 일상, 혼자",음식이 맛있어요,1509,1
1123697995,welldone11,굉장히 오픈주방인데 정리정돈청결을 잘 하시면 좋을것같...,2024-04-30,"저녁에 방문, 예약 없이 이용, 대기 시간 바로 입장, 일상",메뉴 구성이 알차요,1111,2
1123697995,초록뷰,종종 토스트 먹어요!,2024-04-24,아침에 방문,음식이 맛있어요,555,3
1123697995,사브리나 박79,맛있어요,2024-04-20,점심에 방문,음식이 맛있어요,951,1
1123697995,Som9463,좋아요~!,2024-04-19,"점심에 방문, 예약 없이 이용, 대기 시간 바로 입장, 일상, 혼자",혼밥하기 좋아요,416,1
1123697995,뭐야요,퇴근길에저녁으로먹으려구네이버예약주문하고방문했습니다도착하자마자바로받을수있었고스크램블에그처음먹어봤는데맛있었어요,2024-04-18,"저녁에 방문, 예약 후 이용, 대기 시간 바로 입장, 일상, 혼자, 반려동물",음식이 맛있어요,146,3
1123697995,1도모릅니다,미리 예약주문해놓고 픽업해서 가기 편해요 최애 메뉴는 베이컨 포테이토 피자세트에요,2024-04-15,"저녁에 방문, 예약 후 이용, 대기 시간 바로 입장",가성비가 좋아요,35,7
1123697995,sa****,맛있어용ㅎㅎ,2024-04-14,"저녁에 방문, 예약 없이 이용, 대기 시간 바로 입장, 일상",가성비가 좋아요,1615,1
1123697995,you****,굿,2024-04-07,"점심에 방문, 예약 없이 이용, 대기 시간 30분 이내, 일상, 혼자",음식이 맛있어요,1439,1
1123697995,Dalda Lemon,이삭토스트 암사점 맛있어요,2024-04-06,"점심에 방문, 예약 없이 이용, 대기 시간 바로 입장",음식이 맛있어요,1832,3
1123697995,jul****,ㅎㅎㅎ,2024-04-04,"저녁에 방문, 예약 없이 이용, 대기 시간 바로 입장, 일상, 혼자",음식이 맛있어요,439,1
1123697995,zxc2977,맛있어요~,2024-04-04,점심에 방문,음식이 맛있어요,1484,37
1123697995,luluerica,토스트 만드는 분이 만들면서 가래기침을 많이 해서좀 찜찜 ㅠ,2024-03-30,"점심에 방문, 예약 없이 이용, 대기 시간 바로 입장, 일상, 기타",음식이 맛있어요,189,1
1123697995,윤블리6654,역시 맛있어요:),2024-03-30,"점심에 방문, 포장·배달 이용, 대기 시간 10분 이내, 나들이, 아이",음식이 맛있어요,16,4
1123697995,늘꽃길92,맛있게 먹었습니당,2024-03-30,"점심에 방문, 예약 없이 이용",음식이 맛있어요,458,2
1123697995,이언니가는곳,손님도 많고 가끔 운동가는길에 사먹는데맛있고 직원분들 친절하세요,2024-03-26,"점심에 방문, 예약 없이 이용, 대기 시간 바로 입장, 혼자",음식이 맛있어요,462,1
1123697995,day****,음식도 맛있고 애들이 좋아해서 가끔씩 먹어요,2024-03-24,"점심에 방문, 예약 후 이용, 대기 시간 10분 이내, 가족모임, 아이",음식이 맛있어요,780,1
1123697995,Ssoy38,맛있고 간단하게 한끼 떼우기 딱 좋아요! 빨리받으려구 네이버 주문하고 방문했는데 네이버 주문보다 10분 후에 홀 주문하신분들 음식이 먼저 나오더라구요ㅎㅎ 다음에 바쁠 때는 그냥 가서 키오스크 주문해야겠어요,2024-03-24,"점심에 방문, 예약 후 이용, 대기 시간 30분 이내",혼밥하기 좋아요,26,2
1123697995,systemtrade,진짜 너무맛있다 대존맛탱안질린다..햄버거보다 맛있다,2024-03-23,"점심에 방문, 포장·배달 이용, 대기 시간 바로 입장, 나들이, 혼자",음식이 맛있어요,42,20
1123697995,앵히치,,2024-03-23,"점심에 방문, 포장·배달 이용, 대기 시간 10분 이내, 일상, 혼자",친절해요,45,2
1123697995,ksy****,주문하고 시간 맞춰 나가서 바로 픽업했어요.맛있게 잘 먹었어요.^^,2024-03-20,"점심에 방문, 예약 후 이용, 대기 시간 바로 입장, 일상, 부모님",음식이 맛있어요,5,3
1123697995,체리향기S,베이컨베스트 먹었는데 오늘은 평소와는 다르게 느끼했어요~~~ 지금 새벽 4:54분인데 속이 안좋네요~~~,2024-03-18,"저녁에 방문, 예약 없이 이용, 대기 시간 바로 입장, 일상, 혼자",음식이 빨리 나와요,1422,10
1123697995,여우야78,맛있어요,2024-03-18,"저녁에 방문, 예약 없이 이용, 대기 시간 30분 이내",음식이 맛있어요,1365,1
1123697995,nokyoon,친절하셨음 좋겠어요,2024-03-09,"점심에 방문, 예약 없이 이용, 대기 시간 30분 이내, 일상, 기타",음식이 맛있어요,597,1
1123697995,sokangnara,굿굿,2024-03-08,점심에 방문,음식이 맛있어요,2283,2
1123697995,빵여사45,행사쿠폰받아서저렴하게맛있게잘먹었어요,2024-03-07,"점심에 방문, 포장·배달 이용, 대기 시간 바로 입장, 친목, 친구",음식이 맛있어요,1072,1
1123697995,핫플방범대 신짱구,맛있고 친절해요,2024-03-06,"저녁에 방문, 예약 없이 이용, 대기 시간 10분 이내, 일상, 혼자",음식이 맛있어요,434,1
1123697995,캬캬캬6732,좋아요,2024-03-05,저녁에 방문,음식이 맛있어요,1125,3
1123697995,메리85,여자직원분이 정말 친절하세요 ㅠ ㅠ 감사합니다!맛있게 잘 먹었어요~!,2024-03-02,"점심에 방문, 예약 없이 이용, 대기 시간 바로 입장, 일상, 혼자",음식이 맛있어요,1212,1
1123697995,늘꽃길92,좋습니당 항상 깨끗하고 따뜻하게 포장해주십니당,2024-03-02,"점심에 방문, 포장·배달 이용, 대기 시간 바로 입장",음식이 맛있어요,458,1
1123697995,카무트,사장님 직원분들 항상 친절하시고 부지런하세요.어렷을적 어머니가 사주신  첫 이삭토스트가 생각나네요.영업시간이 제 출퇴근 시간이랑 같아.. 주중에는 못먹고 주말에만 항상 먹고있어요! 맛있어요!,2024-02-29,"점심에 방문, 포장·배달 이용, 대기 시간 10분 이내, 일상, 혼자",음식이 맛있어요,24,26
1123697995,율율12,.,2024-02-27,점심에 방문,,1666,1
1123697995,연쥬85,매장 빛이 밝고 좁은 편2인 정도 앉을 수 있는 테이블 두 개 있음손님 꽤 있는데 주문한 토스트 빨리 나옴,2024-02-23,"저녁에 방문, 예약 없이 이용, 대기 시간 바로 입장, 일상, 혼자",음식이 맛있어요,130,1
1123697995,소금빵 ㅎㅎㅎ,집 근처여서 매번 맛있게 잘 먹고 있습니다! 그런데 종업원 교육 좀 신경 써주시면 감사하겠습니다. 평일 저녁에 방문했는데 알바 한분은 계속 주문 밀려들어서 그런지 표정 완전 일그러진 상태로 욕설하며 조리하시더라구요. 기다리는 손닙 입장에서 굉장히 불쾌했습니다.  다른 한분은 머리카락이 너무 긴데 부스스하고 정리도 잘 안되어있어 위생에 좀더 신경썼으면 좋겠습니다. 한번은 손가락에 소스가 묻었는데 그걸 그대로 입으로 빨고 그대로 조리를 하는 모습을 보았는데 경악을 금치 못했습니다.,2024-02-23,"저녁에 방문, 포장·배달 이용, 대기 시간 10분 이내, 일상, 연인・배우자",음식이 맛있어요,16,1
1123697995,연 보라,토스트 가격 좋고 맛있어요,2024-02-20,"저녁에 방문, 포장·배달 이용",음식이 맛있어요,356,2
1123697995,체리향기S,베이컨베스트는 진리! 근데 요즘 가게가 환기가 잘 안되는거같아요~,2024-02-16,"저녁에 방문, 예약 없이 이용, 대기 시간 10분 이내, 일상, 혼자",음식이 맛있어요,1422,9
1123697995,aza j,암사동에도 이삭이와서 참 좋네여~^^첨엔 오전에 매장손님과 배달이 꽉차서인지 주문이 힘들더라구요..주말 오전 네이*에서 주문후 왠일로10분후 픽업! 문자도 주시고 친절하시더라구요^^맛은 예전이나 지금이나 어디에서나 같은맛 굿!!,2024-02-12,"점심에 방문, 포장·배달 이용, 대기 시간 바로 입장, 일상, 연인・배우자",음식이 맛있어요,16,1
1457022789,김정아97,든든하게 맛있게 잘먹었습니다,2025-04-09,"저녁에 방문, 포장·배달 이용, 대기 시간 바로 입장, 일상, 혼자",음식이 맛있어요,11,1
1457022789,99강민,족발은 정말 맛있고 부추전도 너무 맛있어요🐽🔥‼️‼️,2025-04-06,"저녁에 방문, 대기 시간 바로 입장, 데이트, 가족모임, 부모님",음식이 맛있어요,12,1
1457022789,엘리스1925,,2025-04-06,"저녁에 방문, 예약 없이 이용, 대기 시간 바로 입장, 친목, 부모님",음식이 맛있어요,6,1
1457022789,Junemonday,집 근처에 족발 먹고싶었는데 너무 맛있어요 ㅠㅠ불족이 정말 맛있고 기본으로 나오는 미역국 정말 맛있어요!!!!,2025-04-04,"저녁에 방문, 예약 없이 이용, 대기 시간 바로 입장, 데이트, 연인・배우자",매장이 넓어요,31,1
1457022789,지토42,굿,2025-04-04,"저녁에 방문, 포장·배달 이용, 대기 시간 30분 이상, 데이트, 연인・배우자",음식이 맛있어요,2820,2
1457022789,wh****,한번 먹어보고 너무 맛있었어서 자주 오는곳이에요올때마다 맛있고 너무 친절하십니다.가끔 늦게오면 족발이 없어서 돌아간적도 있었는데도항상 방문 시도하는 곳 입니다!,2025-04-03,"저녁에 방문, 예약 없이 이용, 대기 시간 바로 입장, 일상, 연인・배우자",음식이 맛있어요,13,2
1457022789,serendipityy,다른 말이 필요한가요? 소주 한병만 먹으러 갔다가 5개 뿌시고 왔습니다. 가세요 오늘 당장.,2025-03-31,"저녁에 방문, 예약 없이 이용, 대기 시간 바로 입장, 친목, 친구",음식이 맛있어요,9,1
1457022789,tlawnsqha,족발이 맛있는 건 물론. 어리굴젓 미역국 무김치 등 곁들임의 퀄리티가 너무 좋아서 자주 와요!!!💛,2025-03-30,저녁에 방문,음식이 맛있어요,21,2
1457022789,Pape74,너무 맛있게 먹느라고 사진을 못찍었습니다.다음번에는 많이 찍어서 올리겠습니다.매주 가는데 맛있고 청결하며 맛과 양가격 다방면으로 만족합니다.,2025-03-29,"점심에 방문, 예약 없이 이용, 대기 시간 바로 입장, 친목, 친구",음식이 맛있어요,6,2
1457022789,동현311,진짜 맛있고 양도 많고 직원분들도 친절하셔요!! 안갈 이유가 없네요 담에 또 먹을게용,2025-03-28,"저녁에 방문, 예약 없이 이용, 대기 시간 바로 입장, 데이트, 연인・배우자",음식이 맛있어요,38,1
1457022789,ffofofoo35,회사 이사온지 얼마 안되서 근처 맛집을 아직 못찾았는데 너무 맛있게 먹었습니다!,2025-03-27,"저녁에 방문, 예약 없이 이용, 대기 시간 바로 입장, 회식, 지인・동료",음식이 맛있어요,2,1
1457022789,jyw****,족발이 부드럽고 맛있습니다 막국수도 전문점 못지않게 맛있어서 너무 맛있게 잘 먹었습니다.,2025-03-27,"저녁에 방문, 포장·배달 이용",음식이 맛있어요,6,2
1457022789,정석원18,개꿀맛,2025-03-23,"밤에 방문, 예약 없이 이용, 대기 시간 바로 입장, 친목, 친구",음식이 맛있어요,8,1
1457022789,YJein11,처음 가본 곳인데 양도 많고 엄청 맛잇어서 배토지게 먹엇습니더~ 다음에 또 갈게요~!,2025-03-23,"저녁에 방문, 예약 없이 이용, 대기 시간 바로 입장, 가족모임, 친구",음식이 맛있어요,8,1
1457022789,gps****,족발 너무 맛있어요! 숯불 맛도 나고 맵기도 적당해서 엄청 잘 먹었습니다! 다음에도 또 올게요💛,2025-03-23,"저녁에 방문, 예약 없이 이용, 대기 시간 바로 입장, 가족모임, 친구",친절해요,7,1
1457022789,khc****,암사최고 족발집입니다~~!!직접 드셔보세요~~,2025-03-23,"저녁에 방문, 포장·배달 이용, 대기 시간 30분 이내, 친목, 아이",친절해요,30,25
1457022789,이슬9652,반반족발 강추합니당 막국수랑 어리굴젓도 맛있어용 가게 분위기도 좋아요,2025-03-22,"저녁에 방문, 예약 없이 이용, 대기 시간 바로 입장, 친목, 친구",음식이 맛있어요,41,10
1457022789,jha****,,2025-03-21,"저녁에 방문, 예약 없이 이용, 대기 시간 바로 입장, 친목, 친구",음식이 맛있어요,8,1
1457022789,서울사는후니,예전부터 가봐야지하다가 처음먹어보러간건데맛나게 먹고왔네요 ㅎㅎㅎ불족향도 좋고 막국수도 쫄깃하니 맛나용어리굴젓도 기본찬으로나오는데맛이훌륭합니다,2025-03-19,"저녁에 방문, 예약 없이 이용, 대기 시간 바로 입장, 데이트, 일상, 연인・배우자",음식이 맛있어요,41,1
