place_id,nickname,content,date,situations,keywords,review_count,visit_count
1134592891,모모6598,고기가 신선하고 맛있어요! 매장 분위기도 좋아요. 자주 오게 될 것 같아요^^,2025-03-28,"저녁에 방문, 예약 없이 이용, 대기 시간 바로 입장, 친목, 친구",매장이 넓어요,36,1
1134592891,듀17,"꼬들살, 삼겹살 먹었어요꼬들살 너무 부드럽고요!!! 삼겹살도 미쳤어요악관절 있어서 스플린트 끼는데 고기가 부드러워서 턱도 안 아팠어요 진짜 맛있습니다밥도 국그릇에 한가득 나와서 너무 좋았습니다",2025-03-28,"저녁에 방문, 예약 없이 이용, 대기 시간 바로 입장, 데이트, 연인・배우자",음식이 맛있어요,55,1
1134592891,으아6,맛있어요!,2025-03-28,"점심에 방문, 예약 없이 이용, 대기 시간 바로 입장, 데이트, 연인・배우자",특별한 메뉴가 있어요,54,1
1134592891,핑퐁핑퐁64,일본인 친구와 함께 간 맛집!!! 너무 맛있고 친절하고 다 합니다!!!! 최고예요👍👍👍,2025-03-27,"저녁에 방문, 예약 없이 이용, 대기 시간 바로 입장, 친목, 지인・동료",음식이 맛있어요,4,1
1134592891,sbe****,이렇게 맛잇는 고기는 처음 먹어봤어요!!,2025-03-27,"저녁에 방문, 예약 없이 이용, 대기 시간 바로 입장, 데이트, 친구",음식이 맛있어요,3,1
1134592891,김윤정067,맛집이라 찾아서 왔네요 고기가 야들야들하니 맛나네요,2025-03-27,"저녁에 방문, 예약 없이 이용, 대기 시간 바로 입장, 친목, 지인・동료",음식이 맛있어요,8,1
1134592891,돕이두밥,고기가 신선하고 넘 맛있어요~🩵,2025-03-26,"저녁에 방문, 예약 없이 이용, 대기 시간 바로 입장, 데이트, 연인・배우자",음식이 맛있어요,21,1
1134592891,jyj****,벌써 몇번째 방문인지 모르겠어요 주기적으로 와서 먹눈 맛집이에요진짜 맛도리라 둘이서 5인분 삽가능반찬까쥐 잘 나오고 직접 만드셔서 집밥 느낌 체고..♥항상 맛있게 잘 먹고 갑니다❣️,2025-03-26,"저녁에 방문, 예약 없이 이용, 대기 시간 바로 입장, 데이트, 연인・배우자",음식이 맛있어요,16,3
1134592891,ljw****,오랜만에 들렸는데 너무너무 맛있고 사장님 너무 재밌어요❤️,2025-03-26,"저녁에 방문, 예약 없이 이용, 대기 시간 바로 입장, 회식, 친구",아늑해요,13,1
1134592891,초록부부,전에 꼬들목살 먹었을때도 맛있었는데 냉삼도 맛있네요! 반찬도 너무 맛깔스럽게 나오고 특히 파김치 너무 맛있습니다>< 냉삼이 대패랑 그냥이랑 두가지 메뉴로 있는것도 좋아요!,2025-03-26,"저녁에 방문, 예약 없이 이용, 대기 시간 바로 입장, 데이트, 연인・배우자",음식이 맛있어요,23,1
1134592891,11111250,꼬들목살 맛있어서 다시 찾아왔어요! 맛있어요 사람 많네용,2025-03-25,"저녁에 방문, 예약 없이 이용, 대기 시간 30분 이내, 데이트, 연인・배우자",음식이 맛있어요,20,2
1134592891,아얍,저번에 소갈비살 맛있게 먹어서 꼬들살 먹으러 왔어요~~ 친절하시고 너무 맛있어요!,2025-03-25,"저녁에 방문, 예약 없이 이용, 대기 시간 10분 이내, 데이트, 연인・배우자",음식이 맛있어요,76,2
1134592891,whd****,고기 꼬들꼬들하고 너무 맛있어요!!! 쫄깃하면서 식감이 좋아요! 맛있게 먹고 갑니다^^,2025-03-24,"저녁에 방문, 예약 없이 이용, 대기 시간 바로 입장, 데이트, 연인・배우자",친절해요,16,1
1134592891,1_예하,고기는 당연 김치가 맛있어요! 직원분들도 너무 친절하심,2025-03-22,"저녁에 방문, 예약 없이 이용, 대기 시간 바로 입장, 데이트, 연인・배우자",음식이 맛있어요,2,1
1134592891,빈594,또 왔다네 또 육즙가득 꼬들꼬들한 목살 땡길 때 항상 옵니다. 생맥주 한 잔으로 시작해서 기름진 꼬둘목살 먹을때는 소주도 살쩍 적셔주고~ 우거지 된장찌개는 시원하고 구수한 게 요즘 다른 고깃집에서 나오는 쌈장 넣은 것 같은 가짜된장찌개랑 급이 달라요;;; 고기 먹다가 밥 한공기 시켜서 뚝딱 말아먹는 게 한국인의 밥상 저리가라입니다. 사장님들 이모님들 반찬 하나하나 간이 기가 막히고요 기본적으로 요리를 잘하시는거 한입먹어보면 모를수가 없어요 아이고 입아파 이럴시간에 고기 한점 더 먹지,2025-03-22,"저녁에 방문, 예약 없이 이용, 대기 시간 바로 입장, 데이트, 연인・배우자",음식이 맛있어요,2,2
1134592891,syk****,너무 친절하시고 고기도 맛있어요!!~,2025-03-22,"저녁에 방문, 예약 없이 이용, 대기 시간 바로 입장, 친목, 친구",음식이 맛있어요,3,1
1134592891,이준석1268,고기가 정말맛있네요 동료끼리와서 먹기 좋아요 하이볼도 달달하니 맛있네요,2025-03-22,"저녁에 방문, 예약 없이 이용, 대기 시간 10분 이내, 친목, 친구, 지인・동료",음식이 맛있어요,2,1
1134592891,lib****,고기질도 촣고 서비스도 굿굿이네요,2025-03-22,"저녁에 방문, 예약 없이 이용, 대기 시간 바로 입장, 일상, 아이",친절해요,6,1
1134592891,hol****,꼬들살 180g 17000원 가격도 혜자동네 고기 맛집 등록 완료,2025-03-22,"저녁에 방문, 예약 없이 이용, 대기 시간 바로 입장, 친목, 친척・형제",음식이 맛있어요,20,1
1134592891,나는부적,오랜만에 왔는데 역시나 맛있어요약수오는 친구들 데려오면 다 맛있다구 하는 곳!,2025-03-22,"저녁에 방문, 예약 없이 이용, 대기 시간 바로 입장, 친목, 친구",환기가 잘 돼요,30,1
1134592891,jssywltn0107,존맛 그자체꼬들목살 진짜로 맛있음꿈에 나와서 먹으러왔음파김치랑 김치랑 깻잎이랑 다 너무 맛있음이모님들도 너어어어어어무 친절하심 🥰👍🏻,2025-03-21,"저녁에 방문, 예약 없이 이용, 대기 시간 바로 입장, 데이트, 연인・배우자",음식이 맛있어요,30,1
1134592891,김민성64,맛있고 다음에 또 방문할 예정이에요~~,2025-03-21,"저녁에 방문, 예약 없이 이용, 대기 시간 바로 입장, 친목, 친구",고기 질이 좋아요,13,1
1134592891,일차훈계,사장님도 친절하시고 맛도 있어서 맛있게 먹고 갑니다 ! 매장도 넓어서 테이블도 많고 자주 애용할거 같아요 !,2025-03-21,"저녁에 방문, 예약 없이 이용, 대기 시간 바로 입장, 데이트, 연인・배우자",음식이 맛있어요,6,1
1134592891,숭현21,이름처럼 완전 꼬들꼬들한게 술이 꿀떡꿀떡 넘어가네요주기적으로 방문해야겠습니다!!,2025-03-21,"저녁에 방문, 예약 없이 이용, 대기 시간 바로 입장, 데이트, 연인・배우자",음식이 맛있어요,5,1
1134592891,fls****,약수역 저녁은 무조건 여깁니다~!!! 고소하고 꼬들꼬들한 목살이 정말 최고에요ㅠㅠㅠㅠㅠ 먹을 때마다 맛있어여ㅠㅠㅠㅠㅠㅠㅠㅠ 주전자 꼬들목살 사랑해요ㅠㅠㅠㅠㅠ❤️,2025-03-20,"저녁에 방문, 예약 없이 이용, 대기 시간 바로 입장, 친목, 지인・동료",음식이 맛있어요,8,1
1134592891,늘봄 마이웨이,고기가 맛있어요~반찬도 맛있네요~,2025-03-19,"저녁에 방문, 데이트, 연인・배우자",음식이 맛있어요,9,1
1134592891,짱지니짱짱,약수역 맛집입니다 꼬들살 최고!! 김치찌개도 정말 맛있어요 사장님도 너무 친절하시고 다른 메뉴 먹으러 또 방문하겠습니다😍,2025-03-19,"저녁에 방문, 예약 없이 이용, 대기 시간 바로 입장, 데이트, 연인・배우자",음식이 맛있어요,5,1
1134592891,프리스타일4953,주전자꼬들목살이란 메뉴가 넘 맛있어보여서 왔는데 꼬들하고 맛있었어용ㅎㅎ 밑반찬 구성도 넘 좋고 잘 나오고 친절하셨습니다 ㅎㅎㅎ,2025-03-18,"저녁에 방문, 예약 없이 이용, 대기 시간 바로 입장, 데이트, 연인・배우자",음식이 맛있어요,23,1
1134592891,오룡도사,꼬들목살 꼬들꼬들한게 너무 맛있네요우거지해장국 과 함께 먹으니 술안주로 최고네요 소문난 약수역 고기 맛집답게 이름값을 하네요,2025-03-18,"저녁에 방문, 예약 후 이용, 대기 시간 바로 입장, 데이트, 연인・배우자",음식이 맛있어요,1270,1
1134592891,김민정3657,길가다 이끌려 들어왓는데 맛도리ㅠㅠㅠ꼬들목살 식감 미쳣슴댜,2025-03-18,"저녁에 방문, 예약 없이 이용, 대기 시간 바로 입장, 친목, 친구",매장이 넓어요,4,1
1134592891,은또로니잉,꼬들목살 여기 시그니처인거같어요!! 넘 맛잇어용🩷 재방문 하고싶은 약수 찐맛집입니당!!,2025-03-18,"저녁에 방문, 예약 없이 이용, 대기 시간 바로 입장, 데이트, 연인・배우자",음식이 맛있어요,30,1
1134592891,211023,목살이 정말 꼬들해요 ㅎㅎ 맛있습니다,2025-03-18,"저녁에 방문, 예약 없이 이용, 대기 시간 바로 입장, 친목, 친구",음식이 맛있어요,177,1
1134592891,hy0****,꼬들목살 처음먹어보는데 너무 맛있어요 ㅠㅠ저녁장소로도 최고! 회식장소로도 최고예요!!여기 고기가 다른집에 비해 훨씬 꼬들하고 맛있습니다:),2025-03-18,"저녁에 방문, 예약 없이 이용, 대기 시간 바로 입장, 데이트, 연인・배우자",음식이 맛있어요,16,1
1134592891,슈비베토디,"목살이 꼬들하다고? 하고 한입 먹어봤는데 진짜 엄지척 ,,식감 맛 둘 다 좋고 목살이여도 퍽퍽하지 않아서 넘 맛있게 잘 먹고 왔습니다 （♡´∀`♡） 그리고 찬이 진짜 맛있어요 추천추천",2025-03-17,"저녁에 방문, 예약 없이 이용, 대기 시간 바로 입장, 친목, 지인・동료",매장이 넓어요,10,1
1134592891,bor****,"고기 맛집이라 종종 데이트오는데 둘이 삼겹2개, 꼬들목살에 계란말이 까지 야무지게 먹고가요~ 반찬도 깔끔하고 친절하셔서 자주와요~약수역 오시는분들 고기맛집으로 추천드려요🫶👍",2025-03-15,"저녁에 방문, 예약 없이 이용, 대기 시간 바로 입장, 데이트, 연인・배우자",음식이 맛있어요,24,1
1134592891,1444550,사진을 너무 못 찍었지만 너무 맛있어용 약수동 n년차 거주중인데 처음 와봤지만 음식도 괜찮고 사장님도 너무 센스넘치게 좋아여 ㅎㅎᩚ 추천합니당,2025-03-15,"저녁에 방문, 예약 없이 이용, 대기 시간 바로 입장, 데이트, 연인・배우자",친절해요,16,1
1134592891,bangbang45,모임하기에 너무 좋은 장소입니다! 사장님이 친절하시고 고기가 너무 맛있어요,2025-03-15,"저녁에 방문, 예약 없이 이용, 대기 시간 바로 입장, 나들이, 반려동물",매장이 넓어요,6,1
1134592891,Jardin98,꼬들목살 너무 맛있어요!! 해장국도 같이 먹을 수 있어 좋네요.,2025-03-15,"저녁에 방문, 예약 없이 이용, 대기 시간 바로 입장, 데이트, 연인・배우자",음식이 맛있어요,5,1
1134592891,wo9****,꼬들목살 맛있어요!약수쪽 사시는 분들은 고기먹고싶을때 오시면 좋을듯!!반찬도 맛있고 후식냉면있어서 좋아요ㅋㅋㅋ,2025-03-15,"점심에 방문, 예약 없이 이용, 대기 시간 바로 입장, 데이트, 연인・배우자",음식이 맛있어요,12,2
1134592891,이재피루,꼬들목살 정말 맛있어요!!다른 메뉴도 먹어 보고 싶은데 꼬들목살때문에 다른 메뉴를 못먹고 있어요ㅠㅠ항상 사장님 이모님들 너무 친절하십니다솔직히 유명해지지 않았으면..ㅎㅎ번창하세요,2025-03-14,"저녁에 방문, 예약 없이 이용, 대기 시간 바로 입장, 데이트, 연인・배우자, 지인・동료",음식이 맛있어요,22,2
1134592891,minoae77,고기가 꼬들해서 맛있어요! ㅎㅎ 같이나오는 반찬과 찌개도 맛있네요👍,2025-03-14,"저녁에 방문, 예약 없이 이용, 대기 시간 바로 입장, 데이트, 연인・배우자",음식이 맛있어요,28,1
1134592891,tou****,"약수역 근처 주전자 꼬들목살은 특수부위인 꼬들목살로 유명한 맛집!! 최고입니다! 고소하면서도 쫄깃한 식감이 정말 매력적!  부드러운 계란찜과 정갈한 밑반찬까지 완벽하게 어우러져, 고기 좋아하는 분들께 강력 추천합니다!다음주 친구 모임때 또 올거에요!!",2025-03-14,"저녁에 방문, 예약 없이 이용, 대기 시간 바로 입장, 친목, 친구",음식이 맛있어요,3,1
1134592891,라임향기18,친한 지인을 오랫만에 만나서 꼭 데려오고 싶어서 왔습니다 ❤️❤️ 데려온 사람들 누구나 만족했던 너무 맛난 집이에요!!! 언제든 오면 항상 반갑게 맞이해주시는 직원분들도 너무 좋아요 ☺️☺️☺️☺️☺️예전에 젓갈도 있었던거 같은데 오늘은 없네요 ㅠㅠ 시키지 않은 된장찌개가 나온건 조금 서운했어요 😢😢,2025-03-14,"저녁에 방문, 예약 없이 이용, 대기 시간 바로 입장, 친목, 지인・동료",친절해요,30,1
1134592891,홍아정,꼬들목살 꼬들꼬들 미텼어요!,2025-03-13,"저녁에 방문, 예약 없이 이용, 대기 시간 바로 입장, 친목, 친구",매장이 넓어요,11,1
1134592891,cal****,,2025-03-13,"저녁에 방문, 예약 없이 이용, 대기 시간 바로 입장, 친목, 지인・동료",음식이 맛있어요,5,1
1134592891,smj****,"질긴 고기 잘 못 먹는데, 여기 꼬들목살은 엄청 쫄깃하고 맛있어요!!! 고기 질도 좋고 엄청 친절하세요!",2025-03-13,"저녁에 방문, 예약 없이 이용, 대기 시간 바로 입장",음식이 맛있어요,6,1
1134592891,기무거누,사장님도 너무 친절하시고 고기랑 밑반찬도 너무 맛있어요 ㅠㅠ,2025-03-13,"저녁에 방문, 예약 없이 이용, 대기 시간 바로 입장, 친목, 친구",음식이 맛있어요,6,1
1134592891,링가딩가딩가링,동네맛집이라고해서 방문하게 되었는데꼬들목살 대존맛탱입니다ㅏㅏ😆우거지 된장찌개도 너무 맛있고사장님도 너무너무 재밌으시고 친절하셔요!!약수오면 또 먹으러 오겠습니다🤍,2025-03-12,"저녁에 방문, 예약 없이 이용, 대기 시간 바로 입장, 일상, 지인・동료",음식이 맛있어요,5,1
1134592891,약수동 리차드,꼬들목살도 너무 맛있고 일하시는 분들도 친절하고 되게 좋아요! 재방문의사 200%,2025-03-12,"저녁에 방문, 예약 없이 이용, 대기 시간 바로 입장, 친목, 지인・동료",음식이 맛있어요,15,1
1134592891,김시연84,약수역을 왔는데 여길 안오신다?! 인생의 낭비입니다..(?)일단 고기질이 너무 좋아서 맛있는건 기본이고푹 익은 파김치(근데 시지않아서 맛있어요)와 김치가 킥입니다사장님과 직원분들 친절하신건 말모말모...♡매장도 넓어서 회식도 좋고 데이트도 좋고 친구들끼리와도 좋고진짜 집근처에 이런 맛집이 있어서 다행이에요!,2025-03-12,"점심에 방문, 예약 없이 이용, 대기 시간 바로 입장, 데이트, 연인・배우자",음식이 맛있어요,28,1
1245523036,노래하는코코82,차돌된장 샤브샤브 국물 미쳤어요… 구수하고 진해서 밥 안 먹고 국물만 계속 떠먹었어요ㅋㅋ 진심 네모집 국물 맛집✨,2025-04-04,"점심에 방문, 예약 없이 이용, 대기 시간 바로 입장, 연인・배우자",음식이 맛있어요,404,1
1245523036,kwo****,취뽀기념으로 누나와 같이 방문했어요!! 직원분들이 너무 친절하시고 고기도 너무 맛있었어요!! 다음에 또 방문할게요~!!!^^,2025-04-03,"저녁에 방문, 예약 후 이용, 대기 시간 바로 입장, 기념일, 친척・형제",음식이 맛있어요,10,1
1245523036,나의라임오지는나무l,"트러플 한우차돌 버섯솥밥 향부터가 예술이에요. 트러플 향 확 올라오고, 고기랑 밥이랑 너무 잘 어울려서 감동💛",2025-04-02,"저녁에 방문, 예약 없이 이용, 대기 시간 바로 입장, 연인・배우자",음식이 맛있어요,273,1
1245523036,캔디팡팡10,숙성 안심이 이렇게 부드럽다고요? 미디움레어로 주문했는데 입에 넣자마자 사르르 녹아서 진짜 깜짝 놀랐어요🤤,2025-04-02,"저녁에 방문, 예약 없이 이용, 대기 시간 바로 입장, 연인・배우자",음식이 맛있어요,415,1
1245523036,호라잉ㅎㅎ,"등심 굽는 소리부터 설레요ㅋㅋ 고소한 향 퍼질 때부터 이미 맛있었고, 한 점 먹는 순간 눈이 번쩍 뜨였어요🥩",2025-03-30,"점심에 방문, 예약 없이 이용, 대기 시간 바로 입장, 지인・동료",음식이 맛있어요,114,1
1245523036,오잇스트릿,샤브샤브 고기가 질겨질 틈이 없어요. 얇고 부드러운데도 씹는 맛 살아있고 국물에 딱 어울려요. 완전 만족!,2025-03-29,"저녁에 방문, 예약 없이 이용, 대기 시간 바로 입장, 연인・배우자",음식이 맛있어요,253,1
1245523036,런닝보이80,우니한우 채끝솥밥은 말 그대로 고급 그 자체… 입에 넣으면 부드럽고 짭짤한 우니가 밥과 어우러져 녹아요🧡,2025-03-29,"저녁에 방문, 예약 없이 이용, 대기 시간 바로 입장, 연인・배우자",음식이 맛있어요,421,1
1245523036,디저트미슐랭,육회 비빔밥 처음 먹는 친구도 너무 맛있다며 흡입했어요ㅋㅋ 고기 신선도 자체가 다르니 당연한 결과죠~,2025-03-28,"점심에 방문, 예약 없이 이용, 대기 시간 바로 입장, 친구",음식이 맛있어요,366,1
1245523036,통키앙피구우,"솥밥은 처음엔 먹기 아까울 정도로 고급지게 나와요! 트러플 향 솔솔 올라오고, 차돌이랑 밥 조화도 최고예요",2025-03-26,"저녁에 방문, 예약 없이 이용, 대기 시간 바로 입장, 연인・배우자",음식이 맛있어요,239,1
1245523036,가을낙엽과단풍,"네모집은 메뉴 하나하나 다 정성스럽게 나온다니까요. 고기부터 반찬, 국물까지 그냥 놓칠 게 없어요👍",2025-03-26,"점심에 방문, 예약 없이 이용, 대기 시간 바로 입장, 지인・동료",음식이 맛있어요,407,1
1245523036,찬풍도장,밥이랑 고기랑 트러플 향이랑 이게 말이 되나요? 너무 고급지고 정갈한 맛이라 진짜 기분 좋아졌어요🤍,2025-03-23,"저녁에 방문, 예약 없이 이용, 대기 시간 바로 입장, 연인・배우자",고기 질이 좋아요,203,1
1245523036,지방0,굿,2025-03-21,점심에 방문,음식이 맛있어요,1236,1
1245523036,눕치린,점심 너무 맛나요!!!,2025-03-21,점심에 방문,음식이 맛있어요,1184,1
1245523036,le****,"잘 숙성된 고기의 질이 너무 좋고, 다양한 요리가 완벽합니다. 재방문 무조건 올거에요.",2025-03-19,"저녁에 방문, 예약 후 이용, 대기 시간 바로 입장, 친목, 친구, 지인・동료",음식이 맛있어요,1,1
1245523036,노매튜,너무 친절하게 설명 해주시고 고기 품질도 너무 좋아서 덕에 즐겁고 고급스러운 식사 하고 왔어요! 🥰,2025-03-19,저녁에 방문,친절해요,14,1
1245523036,뀨9042,내부분위기도 고급스럽고 고기 퀄리티도 좋은데 사이드까지 맛있어 데이트코스로 가기 좋아요. 내부에 개별 룸도 있어 소규모 모임으로 가도 좋을 것 같아요,2025-03-19,"저녁에 방문, 예약 후 이용, 대기 시간 바로 입장, 데이트, 연인・배우자",인테리어가 멋져요,52,1
1245523036,yej****,"와인은 한병콜키지 무료라서 와인들고 방문했어요안심 2인분 모듬야채메시포테이토된찌솥밥 이렇게 시켰고? 바 테이블은 세개 있었고 고기도 구워주시고 조용한 분위기라 소개팅이랑 썸타시는 분들? 양옆에 계셨어여먹기전부터 양옆에서 감탄해서막 역대급 된찌라니 그런얘기 들려서 넘 기대하면서 먹었고 고기는 그냥 정말 맛있는 소고기인데 같이 나온 곁가지 음식이 풍부해서 좋았고, 전 갠적으로 메시포테이토 찍어먹는거 넘 마싯 ㅜㅜㅜㅜ 남친은 그건 식감이 별로라고 안먹었지만 남친은 다 맛있는데 트러플솥밥이 역대급이라며트러플향에 달달한 맛까지 너무 좋았어요!",2025-03-08,"점심에 방문, 예약 후 이용, 대기 시간 바로 입장, 데이트, 연인・배우자",음식이 맛있어요,16,1
1245523036,써니0803,"안심이라 먹는순간 녹아요 부드럽고 육즙 촤르륵 넘 맛있어요. 같이 온 신랑도 고기집 좋고 숙성도 최고라고 좋아하더라고요. 반찬이랑 된장라면,솥밥까지 다 맛있어서 다음에는 부모님 모시고 가족끼이 방문하려고요!",2025-03-06,"저녁에 방문, 예약 후 이용, 대기 시간 바로 입장, 데이트, 연인・배우자",친절해요,27,1
1245523036,헤이링고,어쩜 하나부터 열까지 다 맛있는지먹는 내내 행복했어요~!솥밥은 기대 안했는데 와…. 고기먹으러 왔다가 솥밥 폭풍흡입!!고기랑 곁들일 것들이 많아서 즐겁게 식사했습니다!전부 조화로워요👍마지막 딸기샤베트 디저트까지 완벽한 식사였어요사랑하는 사람 다 데려오고 싶은 곳!,2025-03-01,"저녁에 방문, 예약 후 이용, 대기 시간 바로 입장, 친목, 친구",음식이 맛있어요,133,1
1245523036,오늘은 어디로로로,"고기 퀄리티 좋고, 그릴링 서비스도 해주셔서 맛있게 잘 먹고 갑니다기본 반찬, 장류도 잘 나오고 깔끔한 맛이 좋아요맛있게 잘먹고 갑니다",2025-02-28,저녁에 방문,음식이 맛있어요,663,1
1245523036,오월이555,"분위기랑 음악도 좋고 안심의 풍미랑 육즙이 정말 예술이예요! 직접 맛있게 구워주셔서 너무 편하게 즐겼고 입에서 살살 녹는 메쉬드 포테이토랑 같이 먹음 완적 스트레스 싹 날라가는 맛ㅎㅎ식사로 트러플 한우 차돌 버섯 솥밥도 고슬고슬 갓지은 밥에 트러플 풍미가 가득해서 너무 맛있었어요. 의미있는 날, 이벤트나 모임으로 오면 누구나 민족할만한 한남동 한우집!!",2025-02-28,"저녁에 방문, 예약 후 이용, 대기 시간 바로 입장, 친목, 친구",음식이 맛있어요,565,2
1245523036,김리릭,여기 전부터 넘 와보고 싶었던 곳이에요! 연예인분들도 많이 온다는 맛집이라 기대했는데 먹어보니 역시 왜 연예인들이 많이 찾아오는지 알 것 같은 맛! 고기가 진짜 이렇게 부드러울수가 있나? 싶을 정도로 진짜 맛있어요ㅠㅠ 고기도 고기인데 트러플 차돌 버섯 솥밥은 진짜 꼭 드세요!!! 이것만 따로 먹으러 오고 싶을정도로 넘 맛있었어여ㅠㅠㅠ 담에 기념일에 또 올꺼에여!!👍👍,2025-02-28,점심에 방문,친절해요,111,1
1245523036,린아블리,"남편이 좋아하는 한우 먹으러 방문했습니다! 네모집에서 돼지고기만 먹어봤었는데 한우도 맛있네요~~~ 등심이 아주 부드럽고, 야채모둠과 밑반찬으로 나오는 마, 샐러드도 신선함 가득해서 좋았습니다. 식사 메뉴로는 솥밥이랑 냉면 먹었는데 양 푸짐하고 재료가 실해서 만족스러운 식사 했네요! 데이트코스로도 좋은 한남동 맛집으로 추천합니다!!",2025-02-25,"저녁에 방문, 예약 후 이용, 대기 시간 바로 입장, 데이트, 연인・배우자",음식이 맛있어요,149,1
1245523036,dog****,고기도 맛있고 직접 구워주세요! 분위기도 좋고! 대화하면서 고기 먹기 좋아요!! ㅎㅎ사이드 메뉴도 맛있고! 소스 반찬도 다양해서 찍어 먹는 재미가 있어!,2025-02-24,"저녁에 방문, 예약 없이 이용, 대기 시간 바로 입장, 데이트, 연인・배우자",음식이 맛있어요,902,1
1245523036,리쯔린,"손님 많은 이유를 알겠네요! 고기 퀄리티가 일단 너무 좋고, 맛있음👍🏻 재방문 의사 무조건 있어요. 직원분 친절하시고 손도 빠르셔서 응대가 훌륭합니다. 고기도 제일 맛있게 구워주셔서 편하게 먹고 왔어요. 연예인들 많이 온다는데 그럴 것 같네요. 한남동 고기 잘하는 룸식당 찾으시는 분들께 추천드려용",2025-02-23,"저녁에 방문, 예약 후 이용, 대기 시간 바로 입장, 데이트, 연인・배우자",음식이 맛있어요,632,1
1245523036,럭키꼬렛,등심 정말정말 맛있어요🤩 야채모듬에 들어있는 버섯이랑 아스파라거스 다 신선하고 맛있었어요 😋  밑반찬도 다 맛있고 고기 직접 구워주셔서 편하게 먹을 수 있습니다~ 후식으로 비빔냉면 먹었는데 저한테는 간이 좀 쎘어요.,2025-02-23,"저녁에 방문, 예약 후 이용, 대기 시간 바로 입장, 데이트, 연인・배우자",직접 잘 구워줘요,226,1
1245523036,mongmong40,인생맛집 이에요💖일단 안심 무조건 드세요! 1티어 안심 이에요진짜 촉촉한 육즙이랑 부드러운 육질이 짱맛✨그리고 솥밥 된장라면 마무리 식사메뉴로 너무 잘 어울립니다 ㅎㅎ데이트하면서 분위기 좋고 넘 맛있게 먹었어요>_<재방문의사 100%,2025-02-23,"저녁에 방문, 예약 후 이용, 대기 시간 바로 입장, 데이트, 친목, 연인・배우자",음식이 맛있어요,1797,2
