place_id,nickname,content,date,situations,keywords,review_count,visit_count
566080414,도담이네,몇년째 가고있는데  항상 친절하시고 항상  고퀄리티의 음식을 준비해주셔서 만족하고있어요. 노량진의 횟집들이 대부분비슷하다지만 저는 여기가 제일 마음에 들어요 ^^,2025-02-08,"아침에 방문, 예약 후 이용, 대기 시간 바로 입장, 친목, 혼자",음식이 맛있어요,56,3
566080414,천사5037,노량진오면 무조건 여기만 갑니다 번창하세요!,2025-02-07,"저녁에 방문, 예약 후 이용, 대기 시간 바로 입장, 친목, 친구",음식이 맛있어요,25,4
566080414,푸른씨앗78,숙성회 전문으로 예상보다 더 만족스러웠습니다^^,2025-01-30,"점심에 방문, 포장·배달 이용, 대기 시간 10분 이내, 일상, 연인・배우자, 부모님",음식이 맛있어요,580,1
566080414,로젠블루원,특대방어와 연어(소) 예약 포장온누리상품권도 받음 👍,2025-01-26,"점심에 방문, 예약 후 이용, 대기 시간 바로 입장, 일상",음식이 맛있어요,2150,55
566080414,느룽이,급하게 예약 후 갔는데 사장님께서 너무 잘해주셨고 금요일 저녁이라 사람 많아서 초장집 다들 줄 서있는데 어떻게든 빨리 입장시켜주시려고 하셔서 오래 기다렸지만 하나도 짜증이 안나더라구요 사장님 마인드가👍🏻 더 잘되실거에요💛,2025-01-17,"저녁에 방문, 예약 후 이용, 대기 시간 10분 이내, 친목, 친구",음식이 맛있어요,38,1
566080414,신유진4,여기 회 진짜 맛있어요! 완전 대 존맛! 신선하고 숙성회며 소자 시켜도 정말 많이주시고 큰 활어회를 숙성시켜서 담백하고 쫀득하니 정말 대존맛이에요! 저 앞으로 회주문하면 이곳에서만 주문할것 같아요!!😍,2025-01-17,"점심에 방문, 예약 후 이용, 대기 시간 바로 입장",음식이 맛있어요,60,1
566080414,소금빵빵i,부위가 너무 좋아요!!특수부위모듬회로 주문하긴 했지만ㅎㅎ대방어배꼽살에 이어 연어배꼽 도미배꼽까지 주실 줄이야~~회가 도톰하고 진심 숙성해서 감칠맛이랑 찰져요!!!,2025-01-13,"점심에 방문, 예약 후 이용, 대기 시간 바로 입장, 친목, 친구",재료가 신선해요,114,2
566080414,우아와와옹,시간이 여유가 되시면 부위를 다 적어주신다고 하셨다 :) 두툼한 회가 가득한 포장한사발이다. 특히 실속이지만 가성비 넘치는 회부위들로 가득한 (뱃살이랑 고급부위들) 회 그리고 예약을 미리하면 픽업만 하면되니 너무 편리한 시스템이었다❤️노량진 수산시장의 노량진 횟집 푸른바다👍🏻,2025-01-12,"점심에 방문, 포장·배달 이용, 대기 시간 바로 입장, 친목, 일상, 혼자",재료가 신선해요,367,1
566080414,ia****,역시 겨울이라 ㅋㅋ 방어 모듬으로 주문했어요 소자임에도 양도 푸짐해서 원없이 먹었어요!!  두툼하게 잘라주셔서 온전히 느낄 수 있는것 같아요 무엇보다 여러 부위를 주셔서 방어의 다양한 식감을 느낄 수 있었네요!! 함께 주시는 묵은지도 맛있고 김 그리고 찌개끓이는 거까지 많이 줍니다!!! 잘 먹었습니다,2025-01-08,"점심에 방문, 예약 후 이용, 대기 시간 바로 입장, 데이트, 친목, 친구",주차하기 편해요,33,2
566080414,만두순돌콩,참돔 처음 먹어봤는데 너~~~무 맛있고 진짜 방어도 말할 것도 없이 기름지고 맛있습니다 ㅜ 회 두께보세요!!!🩷,2025-01-04,"저녁에 방문, 예약 후 이용, 대기 시간 바로 입장, 데이트, 연인・배우자",음식이 맛있어요,269,3
566080414,dancer21,예약시스템도 잘되어있고 무엇보다 맛이 좋아서 자주 이용하고 있습니다.,2025-01-04,"점심에 방문, 예약 후 이용, 대기 시간 바로 입장, 가족모임, 부모님",재료가 신선해요,249,6
566080414,왠만하면 안씀,잘 먹었지요..혹 주문시 초장과 무채 없이 포장 해달라면 가능 한가요.. 초장은 안먹고 무채는 쓰래기라서..일정 금액 이상 포장시 매운탕야채는 서비스로는...???,2024-12-28,"저녁에 방문, 예약 후 이용, 대기 시간 바로 입장",음식이 맛있어요,355,6
566080414,Yennnnnnnn,너무 맛있었어요!! 회는 바로 받을 수 있었고 도톰해서 너무 잘 먹었습니다. 식당식사로 미리 예약해둬서 바로 들어갔어요~~,2024-12-27,"저녁에 방문, 예약 후 이용, 대기 시간 바로 입장, 친목, 지인・동료",음식이 맛있어요,26,4
566080414,rkp****,좋아요,2024-12-25,"점심에 방문, 예약 후 이용, 대기 시간 10분 이내, 회식, 혼자",,1604,46
566080414,원투쓸이,"크리스마스날 회로 포식할겸 대방어 중짜와 모듬회 주문.아침 9시 포장이었는데 9시반쯤 준비되서,게도 찔겸 쫌 기다렸어요 (8시오픈).계~속 회뜨고 계시던데 포장이 엄청 많으셨나봅니다 :)기름기 좔좔! 반질반질 방어의 신선함은 최고에 부위도 골고루 담아주셨고 이거저거 챙겨주셔서 잘먹었습니다.친절하시기도하고 완전 짱추천 👍",2024-12-25,"점심에 방문, 예약 후 이용",친절해요,754,2
566080414,원투쓸이,"회 픽업하는김에게와 어패류도 함께 쪄서 가려고 주문.구매후 찌는 시간까지 50분 가까이 걸렸어요.포장 잘해주셔서 집까지 가는데 문제 없었구요,대게 수율 좋았어요 🦀소라랑 가리비 진짜 맛있고 파티때 인기 많았어요!ㅎㅎ 근데 갑각류/어패류쪽에 계신 여자 사장님은 말투가 뭐랄까;좋게말해 쿨시크인데, 누구에겐 불친절하단 느낌을 주시는 분 ㅠㅠ 뭔가 귀찮음의 바이브도 느껴지고 ㅋㅋㅋ찜시간이 많이 걸려서 주차권 요청했는데 인상 찌푸리신..",2024-12-24,"아침에 방문, 예약 없이 이용, 대기 시간 30분 이상",재료가 신선해요,754,1
566080414,Semm,결론부터 쓰자면 너무 맛있고 사장님 너무 친절하셔용!! 완전 강추합니다 (심지어 갓성비임..)원래 다른곳 갔었는데 새로운곳 서치중리뷰 좋은 푸른바다로 가보았습니다!네이버로 당일에 예약하고 픽업했는데도 큰 웨이팅 없이 이용하였고특수부위 6만 결제하였어요! 그리고 추천해주신 초장집까지 웨이팅 없이 바로 갔습니다(토요일 19:30정도였음)초장집 황금어장도 사장님도 친절하셨어요!,2024-12-21,"저녁에 방문, 예약 후 이용, 대기 시간 10분 이내, 데이트, 연인・배우자",음식이 맛있어요,187,1
566080414,알리75,"사진은 못찍었지만 특수모듬회 4인분 예약 후 픽업했습니다. 벌써 4번째 가족모임에 푸른바다에서 회를 테이크아웃해서 먹는데, 회가 신선하고 정말 맛있어요.이번에도 예상을 벗어나지 않더군요. 행복하고 즐거운 모임에 회가 큰 몫을 했죠.앞으로도 여기만 이용할 거에요.사장님, 번창하세요^^",2024-12-21,"점심에 방문, 예약 후 이용, 대기 시간 바로 입장",음식이 맛있어요,11,3
566080414,오징어땅콩쓰,실속2인세트였는데 횟감구성도 너무 좋았어요방어가 조금 부족하긴했지만 다음엔 특수부위2인 먹어봐야겠어요 맛있었습니다!!!,2024-12-15,"저녁에 방문, 예약 후 이용, 대기 시간 30분 이상, 친목, 친구",음식이 맛있어요,164,1
566080414,로젠블루원,특대방어와 참돔(소) 덕분에 즐거운 주말식사,2024-12-15,"점심에 방문, 포장·배달 이용, 대기 시간 바로 입장, 일상",재료가 신선해요,2150,52
566080414,만두순돌콩,대방어 ‘중’ 입니다! 노량진에서 먹는 회가 최고입니다!!🩷,2024-12-14,"저녁에 방문, 예약 후 이용, 대기 시간 바로 입장, 데이트, 연인・배우자",친절해요,269,2
566080414,vivien89,노량진 가면 푸른바다만 이용해요.  여기가 제일 신선하고 맛있었어요~^^역시 제철음식 방어회!,2024-12-14,"저녁에 방문, 예약 후 이용, 대기 시간 30분 이내, 일상, 연인・배우자",음식이 맛있어요,57,7
566080414,juj****,굿,2024-12-13,"저녁에 방문, 예약 후 이용, 대기 시간 바로 입장, 친목, 지인・동료",음식이 맛있어요,845,1
566080414,Peonylife,방어회 엄청 싱싱하고 맛있어요!회 잘 못드시는 분도 잘 드셔서 아주 만족합니다,2024-12-10,"저녁에 방문, 예약 후 이용, 대기 시간 바로 입장, 회식, 지인・동료",음식이 맛있어요,321,1
566080414,lea****,노량진 10년 산 주민입니다! 그동안엔 부모님 단골집에 회사러 다녔는데 더이상 그럴필요가 없게됐습니다..6만원에 숙성회 특수부위모듬회 먹을수있는 곳이자카야가면 이정도면 15만원은 넘게 깨지는데 완전 혜자로운 집입니다..더 알려져야해요!! 오래 파세요~~~~,2024-12-09,"점심에 방문, 예약 후 이용, 대기 시간 바로 입장, 일상, 부모님",음식이 맛있어요,60,1
566080414,aaa****,5명이 10만원짜리 먹고 딱 알맞길래 이번에는 넉넉하게 먹으려고 4명이 12만원짜리 시켰는데 양이 저번것하고 똑같은것같아요. 4이 먹어서 모잘랐어요.ㅜㅜ 구성도 많이 아쉽습니다.,2024-12-08,"점심에 방문, 예약 후 이용, 대기 시간 바로 입장, 친구",건강한 맛이에요,15,1
566080414,우항항냠냠,크 너무너무 맛있었습니다!!! 오랜만에 회다운 회를 먹은 느낌 ! 다음에도 푸른바다로 가자며 친구들과 약속 ㅋㅋㅋ>.< 사장님도 친절하시고 최고최고 👍🏻👍🏻,2024-12-07,"저녁에 방문, 예약 후 이용, 대기 시간 바로 입장, 친목, 친구",음식이 맛있어요,42,1
566080414,미니뿅554,특수부위맛미쳤어요! 너무맛잇다세상에행복해지는맛너무 신선해요맛딥인정,2024-12-03,"점심에 방문, 예약 후 이용, 대기 시간 바로 입장, 일상, 혼자",음식이 맛있어요,56,1
566080414,까비2073,믿고먹는 푸른바다입니다 너무맛있어요,2024-12-01,"아침에 방문, 예약 후 이용, 대기 시간 바로 입장, 친목, 연인・배우자",음식이 맛있어요,16,2
566080414,물개엉앙엉,실속 모둠회 2인 포장했습니다 회가 정말 싱싱하고 맛있었고 양도 두명에서 충분했습니다. 저는 회 자체를 별로 좋아하지 않는데도 불구하고 너무 맛있어서 놀랐습니다!!😊사장님 정말 친절하세요 ! 노량진 수산시장가게된다면 여기 추천할게요,2024-12-01,"아침에 방문, 포장·배달 이용, 대기 시간 바로 입장, 데이트, 여행, 기념일, 연인・배우자",음식이 맛있어요,10,1
566080414,jjong2ni,항상 맛있게 잘 먹고 있습니다!!,2024-11-28,"저녁에 방문, 예약 후 이용, 대기 시간 바로 입장, 친목, 지인・동료",음식이 맛있어요,52,7
566080414,로젠블루원,푸른바다스페셜 👍,2024-11-24,"점심에 방문, 포장·배달 이용, 대기 시간 바로 입장, 일상, 연인・배우자",음식이 맛있어요,2150,51
566080414,inh****,제철맞은 방어 정말 두툼하고 푸짐하게 챙겨주셨어요. 신선하고 역시 고소하고 맛있어요. 매운탕거리도 푸짐하게 싸주셔서 원없이 먹었습니다♡,2024-11-22,"점심에 방문, 예약 후 이용, 대기 시간 바로 입장, 일상, 연인・배우자",음식이 맛있어요,2680,1
566080414,심리학용어,요즘 방어철이잖아요? 방어가 먹고싶어서 푸른바다에서 방어 포장해왔어요! 직접 만드셨다는 묵은지+와사비+ 방어랑 같이 먹으면 정말 맛있어요!!! 맛있는 방어 드시고 싶으시면 푸른바다로 꼭 방문하세요!,2024-11-22,"점심에 방문, 예약 후 이용, 대기 시간 바로 입장, 일상, 혼자",친절해요,734,1
566080414,itnamu,"언제 이용해도 실망시키지 않는 노량진 맛집 입니다.이번에 연말 회식 장소로 다시 찾았는데, 일행분들도 모두 만족해서 괜히 저도 기분이 좋았네요.이제 대게나 킹크랩, 어패류 등 다양한 해산물도 함께 이용할 수 있어 여러 군데 안둘러보고  한번에 다 해결할 수 있어 좋았습니다.오랫동안 이용하다 보니 이젠 그냥 사장님께 인원수랑 먹고싶은거 이야기 하면알아서 셋팅해주시니 정말 좋아요 ㅎㅎ서비스도 잘 챙겨 주시고 식당 연결도 잘해주시니노량진 수산시장 어딜 가야 되나 고민이라면 강력 추천입니다!!",2024-11-21,"저녁에 방문, 예약 후 이용, 대기 시간 바로 입장, 회식, 지인・동료",음식이 맛있어요,400,2
566080414,cho****,만족합니다 잘먹었어요,2024-11-18,"점심에 방문, 예약 후 이용, 대기 시간 바로 입장, 친목, 친구",음식이 맛있어요,71,1
566080414,로젠블루원,특대방어와 참돔 左(중 size)  右(소 size),2024-11-17,"점심에 방문, 포장·배달 이용, 대기 시간 바로 입장, 일상, 연인・배우자",음식이 맛있어요,2150,50
566080414,꾸꾸9520,"특대방어 & 참돔회 먹었는데 너무 맛있었습니다 !회가 두툼한 게 매력적이었고, 방어는 김과 묵은지 필수인데 따로 챙겨주시니 너무 좋았어요.확실히 대방어 철이 시작된 게 느껴질 정도로 대방어의 기름기, 크기, 식감 등 장난 아니었고의외로 함께 구성된 참돔이 다른 곳보다 너무 맛있고 씹는 식감이 좋았어요❤️방어철 지나기 전에 꼭 방문해서 드세요 ㅠㅠ!",2024-11-17,"점심에 방문, 예약 후 이용, 대기 시간 10분 이내, 일상, 친구, 지인・동료",음식이 맛있어요,75,1
566080414,김연보라,노량진수산시장맛집 노량진대방어맛집 푸른바다! 회도 두툼하고 소 사이즈인데도 맛있는 부위 많이 주셨어요! 아주 잘 먹었습니다🙂,2024-11-17,"점심에 방문, 예약 후 이용, 대기 시간 바로 입장, 일상, 혼자",음식이 맛있어요,21,1
566080414,기스걸,좋아요,2024-11-17,"점심에 방문, 예약 없이 이용, 대기 시간 바로 입장, 일상, 지인・동료",음식이 맛있어요,2103,1
566080414,Ooooooj,회가 정말 두툼해서 한입가득 씹는 맛 최고!노량진수산시장은 처음인데 이렇게 퀄리티 좋은 회를 집에서도 즐길 수 있어서 만족스러워요!! 다음엔 다른 종류의 회도 도전해보고 싶네요! 😋,2024-11-10,"점심에 방문, 예약 후 이용, 대기 시간 바로 입장",음식이 맛있어요,10,1
566080414,지예74,방문해본 서울 모든 횟집중에 역대급 퀄리티에 가격에 양까지 미쳤습니다 !! 사장님도 정말 친절하시고 다음에도 또 회뜨러 가야겠어요🩷 멀리서 오셔도 그 시간 가치가 있습니다.,2024-11-04,"점심에 방문, 예약 후 이용, 대기 시간 바로 입장, 일상, 혼자",음식이 맛있어요,371,1
566080414,예니의미니룸,"노량진 수산시장 맛집은 푸른바다죠😊 다른곳과 달리 대형 활어 숙성 모듬회로 인분수에 맞게 부위별로 판매하구요! 방어, 숭어, 도미, 연어, 감성돔, 줄무늬전갱이, 광어까지💗 특수부위 모둠회 정말 추천합니다! 가격대비 양도 많고 신선해서 픽업으로 정말 잘 먹었어요~!! 사장님이 정말 친절하시구요ㅠㅠ 대형 활어를 쓰다보니 회가 두툼해서 맛이나 씹는 식감이 남달랐고 도미는 일식집처럼 마쯔가와를 해서 껍질과 함께먹을수 있었어요! 추가로 함께 주신 회전용 간장이랑 묵은지와 같이 먹는 것도 완전 꿀맛입니다😍 제가 부위랑 종류 궁금하다고 여쭤봤는데 꼼꼼하게 잘 알려주셔서 감사합니다👍",2024-11-01,"점심에 방문, 예약 후 이용, 대기 시간 바로 입장, 일상, 혼자",음식이 맛있어요,98,1
566080414,뀰의 흔적,"노량진횟집 이곳저곳 이용해봤지만 푸른바다가 가장 만족스러웠어요 회 중량도 넉넉하고, 두께도 원하는데로 맞춰주시고 서비스도 좋아요. 가격은 정찰제지만 기왕이면 서비스 좋은곳, 신선한횟감이 있는곳이 좋잖아요? 인기많은 횟집이라 활어들도 수급이 빨리되어 굉장히 신선합니다 :) 가장 추천하는곳이에요!",2024-10-30,"점심에 방문, 예약 후 이용, 대기 시간 바로 입장, 친목, 혼자",음식이 맛있어요,445,1
566080414,rkp****,굿,2024-10-19,"아침에 방문, 예약 후 이용, 대기 시간 10분 이내, 일상, 혼자",,1604,45
566080414,남자몽,벌써 4번째 방문! N번차 방문하는것 보면 확실히 믿고 계속 오는 곳이에요. 혹시 노량진 처음 가보시는 분들께 꼭 추천하는 곳인데요. 확실히 사장님이 회도 취향껏 잘썰어주시고 횟감도 신선해서 맛있어요! 이번에 활어숙성모둠회 먹었는데 가족들이 다 맛있다고 하네요. 다음에 방어시즌에 또 들릴게요!,2024-10-15,"저녁에 방문, 예약 없이 이용, 대기 시간 바로 입장, 가족모임, 부모님",음식이 맛있어요,799,4
566080414,rkp****,굿,2024-10-15,"점심에 방문, 예약 후 이용, 대기 시간 30분 이내, 일상, 혼자",,1604,44
566080414,산녀53,수십년 노량진뜨네기에서 정착한곳최고.,2024-10-13,"점심에 방문, 예약 후 이용, 대기 시간 바로 입장, 가족모임, 아이",음식이 맛있어요,11,1
566080414,sunny6248,가성비 너무 좋구 신선해서 만족해요!! 가격표가 매장에 다 나와있어서 막 무게재고 네고하고 그런거 안해듀 되서 너무좋아요 모듬도 잘되잇어서 만족회 한가지만 먹으면 물려서 잘 못먹는데 모듬으로 먹어서 좋앗어요!,2024-10-12,"점심에 방문, 예약 후 이용, 대기 시간 바로 입장, 데이트, 연인・배우자",음식이 맛있어요,319,1
566080414,my2****,제철 횟감 즉석에서 회떠주셔서 신선함 믿고 먹는 노량진수산시장맛집입니다! 가봐서 직접 눈으로 봤지만 전어도 이렇게나 큰 사이즈는 첨 봤어요 다양한 어종들 엄선해서 내놓으시는 듯 해요 두툼하게 썰린 회스타일도 취저고 굉장히 맛있었는데요 같이 챙겨주신 묵은지와 조합은 최고의 안주감! 챙겨주신 서더리도 매운탕 양념까지 들어있어서 쉽게 끓여서 한끼 먹었어요 재방문각입니다,2024-10-10,"점심에 방문, 예약 후 이용, 대기 시간 바로 입장, 일상, 혼자",음식이 맛있어요,162,1
566080414,꽁꽁이닷,"노량진수산시장 회에는 보통 와사비, 락교, 생강 전도 제공이지만 푸른바다에서는 묵은지랑 초밥양념, 매운탕거리랑 매운탕양념까지 챙겨주세요! 횟감도 너무 싱싱해서 찰지고 맛있어요 모듬회로 주문하면 푸짐하고 다양하게 즐길 수 있어요 가성비 대박이네요",2024-10-09,"저녁에 방문, 포장·배달 이용, 대기 시간 바로 입장, 일상, 혼자",음식이 맛있어요,880,1
566080414,로젠블루원,푸른바다스페셜(소)  보통두께,2024-10-06,"저녁에 방문, 포장·배달 이용, 대기 시간 바로 입장, 가족모임",음식이 맛있어요,2150,49
566080414,밥상37,둘이서 5만원 짜리 하나면 딱 좋아요~,2024-10-05,"저녁에 방문, 예약 없이 이용, 대기 시간 바로 입장, 일상, 연인・배우자",음식이 맛있어요,592,2
566080414,왠만하면 안씀,한달에 한번쯤 방문 하는것 같은데 만족하여 다른곳 보지도 않고 있네요,2024-10-01,"점심에 방문, 예약 후 이용, 대기 시간 바로 입장, 회식, 아이",음식이 맛있어요,355,4
566080414,욱뎅이부인,두번째 방문이여서 이번에는 예약하고 갔는데 빠르게 준비해주셔서 넘 맛있게 먹었어요!! ㅠㅠ 진짜 사장님도 넘 친절하시고 같이 간 친구도 넘 맛있대요 (넘 맛있게 잘먹어서 친구는 연어 포장해간거는 안비밀!! 짱맛!!!),2024-09-30,"저녁에 방문, 예약 후 이용, 대기 시간 바로 입장, 친목, 친구",음식이 맛있어요,191,1
566080414,pi****,굿,2024-09-27,점심에 방문,가성비가 좋아요,582,2
566080414,솜코리타,"‼️내돈내산 또간집 후기 입니다‼️솔직히 블로그 리뷰 넘쳐나는 노량진 횟집에서 제가 유일하게 뚫은 노량진 맛집 푸른바다🥹 가격에 비해 양이 넘나 대혜자이고, 진짜 겁나 신선해요!남자 사장님도 친절하셔서 일부로 여기 가려고 노량진까지 러닝하러 와요ㅋㅋㅋㅋ 진자 적게 일하고 많이 버세오 사장님💓",2024-09-21,저녁에 방문,음식이 맛있어요,228,3
566080414,Shul,구성이 정말 좋고회들이 하나같이 신서하고 맛있네요매운탕도 시원하고 얼큰해요사장님도 친절하셔서 다음에 또 와야겠어요 👍,2024-09-20,"저녁에 방문, 예약 후 이용, 대기 시간 바로 입장, 친목, 나들이, 일상, 회식, 혼자",음식이 맛있어요,77,1
566080414,야심찬돼지찌개,"특수모듬 소 (₩60,000) 구성 알차고 두껍게썰어서 맛있어요",2024-09-17,"저녁에 방문, 예약 없이 이용, 대기 시간 바로 입장, 데이트, 연인・배우자",음식이 맛있어요,177,3
566080414,시간여행73,가끔 회를 먹게 되는데 최고의 회입니다.두껍고 사장님의 마음을 담은듯 맛있게 먹었습니다.7명이 부족함없이  모두가 흡족하게 먹었습니다.매운탕  꺼리도  좋았어요.덕분에 좋은 음식 먹는 시간이었습니다.감사합니다.,2024-09-15,"점심에 방문, 포장·배달 이용, 대기 시간 10분 이내, 기념일, 친척・형제",음식이 맛있어요,4,1
566080414,동대문구10,양도 많고 굉장히 맛있습니다.,2024-09-14,"점심에 방문, 예약 후 이용, 대기 시간 바로 입장, 가족모임, 연인・배우자",음식이 맛있어요,26,4
566080414,Blue Dog,"기념일 등 특별한 날에 매번 포장 예약 드려요!항상 바쁘신 와중에도 너무 친절하시고 포장도 깔.끔.  빠지는 부분 없이 완벽해서 지인분들에게도 추천하는 곳이예요 👍👍 회도 신선하고 양, 구성 모두 만족스러워요!! 다음에는 사진 리뷰도 올려볼게요!😉",2024-09-14,"점심에 방문, 예약 후 이용, 대기 시간 바로 입장, 기념일, 연인・배우자",음식이 맛있어요,5,1
566080414,rkp****,좋아오ㅡ,2024-09-11,"저녁에 방문, 예약 후 이용, 대기 시간 10분 이내, 혼자",,1604,43
566080414,쀼숑쀼숑,노량진에서 가성비 좋은 곳을 찾았어요다른 곳과 달리 대형 활어 숙성 모듬회로 인분수에 맞게 부위별로 판매하고 있어더욱 맛있게 저렴하게 먹을 수 있는 곳모듬회에 참치라니진짜 구성이 너무 좋음,2024-09-10,저녁에 방문,음식이 맛있어요,1184,1
566080414,ableshs,"활어숙성모듬회 소 예약하고 바로 수령!회도 두툼하고 큼직한데 숙성회라 쫄깃해서 감동...*묵은지 광어초밥 좋아하는데 푸른바다에서 묵은지도 같이 주시고, 초밥양념도 주셔서 초밥으로도 먹을 수 있으니 일석이조!세꼬시도 너무 맛있었던 푸른바다 ~",2024-09-08,"점심에 방문, 예약 후 이용, 대기 시간 바로 입장, 데이트",음식이 맛있어요,111,1
566080414,na****,노량진 모듬회 포장은 처음인데 만족 대만족!,2024-09-08,"점심에 방문, 예약 후 이용, 대기 시간 바로 입장, 데이트, 연인・배우자",음식이 맛있어요,35,1
566080414,탐험가양반,예약 후 방문했는데 가서 좀 더 기다렸어요. 민어회 먹었는데 맛있었습니다.,2024-09-07,"저녁에 방문, 예약 후 이용, 대기 시간 30분 이내",재료가 신선해요,1053,1
566080414,rkp****,좋아요,2024-08-31,"아침에 방문, 예약 후 이용, 대기 시간 바로 입장, 나들이, 지인・동료",,1604,42
566080414,LookAtMe,네이버 예약으로 민어회 주문했습니다. 네이버 예약 이벤트로 20프로 할인 받아서 정말 싸고 맛있게 먹었습니다. 민어회 처음 먹어봤는데 사람들이 왜 먹는지 알 것 같네요 정말 크리미하고 맛있었습니다.,2024-08-28,"저녁에 방문, 예약 후 이용, 대기 시간 바로 입장, 친목, 나들이, 일상, 친구, 지인・동료",음식이 맛있어요,141,1
566080414,로젠블루원,민어고급모듬회(소)와 활새우,2024-08-18,"점심에 방문, 포장·배달 이용, 대기 시간 바로 입장, 가족모임, 연인・배우자",음식이 맛있어요,2150,48
566080414,keepgoing6,민어회모듬소자 포장했는데 맛있는 부위 골고루 넣어주셨고 포장도 엄청 꼼꼼하게 해주시고 부위도 다 세심하게 적어주셨어요 ㅎㅎ일단 너무 너무 친절하심!집에서 포장열어보니 대박...회엄청 싱싱하고 두툼했어요.부위별로 살살 녹는 회랑 쫀득한 회랑...제대로 호강했네요. 이날 좀 마음이 힘들었던 날인데 맛있는 푸른바다 모듬회먹고 기분전환 제대로 했어요 !!! 여름 제철 생선 민어회를 맛볼 수 있는 특별한 곳입니다. 다음에 또 맛있는 횟감 먹고싶으면 방문하려고요 !!!,2024-08-18,"점심에 방문, 예약 후 이용, 대기 시간 바로 입장, 기념일, 연인・배우자",음식이 맛있어요,132,1
