place_id,nickname,content,date,situations,keywords,review_count,visit_count
1340393421,재옹잉,"저는 술찐데요, 여기서 맥주 두병 먹었어요 그럼 말다한거.. 그리고 다른데는 다 꼬치끼워져있는 품목들 꼬치 거의없고 종류도 엄청 많아요 그리고 햄종류가 무려 5갠가 무조건 재방문 할거고 꿔바로우도 신냄새 팍팍나는게 개맛있어요 강추 어쩐지 사람이 많더라니...👍🏻",2024-10-13,"저녁에 방문, 대기 시간 바로 입장",친절해요,49,1
1340393421,용용제,"몇달전 카운터 담당분께 실망하고 리뷰에 담배와 응대  등에 대해 적었는데, 다행히 사장님이 보시고 답글도 달고 바로 개선해주신 부분이 눈에 띄어 다시 방문 했습니다! 근래에 카운터 담당자가 교체되었는데 기존 담당자보다 훨씬 친절하시고, 담배도 안 피우셔서 안심하는 마음으로 식사했어요.마라탕은 여전히 깔끔하고 맛있었습니다.!",2024-10-03,"저녁에 방문, 예약 없이 이용, 대기 시간 바로 입장, 일상, 부모님",음식이 맛있어요,22,2
1340393421,쿠키1761,,2024-09-25,아침에 방문,재료가 신선해요,1301,6
1340393421,울라울라요,"중딩 따님의 최애 식당.집에서 거리가 있긴한데, 그래도 먹고나서 소화 시킬겸 걸어서 와요.마라탕은 어딜가도 그맛인듯한데,꿔바로우는 진짜 푸짐하고 맛남.중국집에서 탕슉 먹을바엔 무조건, 이집 꿔바로우추천!",2024-09-15,"저녁에 방문, 예약 없이 이용, 대기 시간 바로 입장, 일상, 아이",음식이 맛있어요,158,1
1340393421,그니그니,"재료도 청결하게 잘 관리되어 있고, 직원분들도 친절하시고무엇보다 마라탕이 깔끔하니 정말 맛있어요!!!마라탕과 볶음밥 조합은 말해뭐해 💗💗꿔바로우는 겉은 바삭 쫀득하고 양도 푸짐해서 가성비 최고👍 식사로 먹기도 좋고  담에는 술한잔 하러 자주 찾을것같아요!!",2024-09-14,"저녁에 방문, 예약 없이 이용, 대기 시간 바로 입장, 데이트, 연인・배우자",음식이 맛있어요,111,1
1340393421,덩큰이,퇴근하고 여자친구와 방문했습니다. 각자 먹을만큼 먹고싶은 거 떠먹는게 너무 좋았어요. 적당히 매콤하고 너무 맛있게 먹고 왔어요. 직원분도 친절하시고 자주 방문하게 될 것 같아요~,2024-09-11,"아침에 방문, 예약 없이 이용, 대기 시간 바로 입장, 데이트, 연인・배우자",음식이 맛있어요,74,1
1340393421,우사미짱이야,매장도 엄청 깨끗하고 마라탕은 말해 뭐해요ㅠㅠ 너무 맛있어요.ᐟ.ᐟ.ᐟ.ᐟ 3단계 먹었는데 딱 맛있는 맵기였어요꿔바로우는 꼭 두번 세번 먹어줘야 하는 맛❤️,2024-08-29,"저녁에 방문, 예약 후 이용, 대기 시간 바로 입장, 친목, 친구",음식이 맛있어요,114,1
1340393421,잉챠라떼,여러 마라탕 집을 가봤는데 제가 가본 곳 중에서 제일 좋은 곳이었습니다. 직원분들도 친절하시고 재료들도 엄청 신선해요. 그리고 마라탕에 무슨 비결이 있는지 모르겠지만 국물 맛도 진짜 맛있습니다. 밥이랑 땅콩 소스가 셀프 바에 있는데 요즘 밥 주는데 흔하지도 않고 특히 땅콩 소스가 되게 맛있는 데다가 원하는 만큼 가져갈 수 있어서 좋아요. 점심시간에 종종 가는데요. 집 근처에 없어서 너무 아쉽습니다. 진짜 여기서 마라탕 한번 먹어보면 다른데서 못 먹어요. 접근성이 쉬운곳에 있으시거나 놀러왔는데 마라탕 먹을 곳 찾으신다면 꼭 이 집으로 가보세요. 마라탕의 기준이 달라집니다.,2024-08-27,"점심에 방문, 예약 없이 이용, 대기 시간 바로 입장, 일상, 혼자",음식이 맛있어요,113,1
1340393421,투워니쑤,마라탕 꿔바로우 먹을땐 신라방만 방문한답니다!! 직접 못갈땐 배달로다가 주문하구요~ 그만큼 풍성하고 맛난 리얼맛집이구요~~~ 또또또또간집입니다!!,2024-08-21,"저녁에 방문, 예약 없이 이용, 대기 시간 바로 입장, 아이",매장이 넓어요,141,2
1340393421,hglee4341,꿔바로우 넘 맛나용,2024-08-14,"저녁에 방문, 예약 없이 이용, 대기 시간 바로 입장, 일상, 부모님",음식이 맛있어요,1400,2
1340393421,ㅇ ㅏ이,타 가게보다 저렴했고 맛있었어요 ㅎ,2024-08-13,"저녁에 방문, 예약 없이 이용, 대기 시간 바로 입장, 데이트, 연인・배우자",재료가 신선해요,117,1
1340393421,유웅유,마라탕 먹은곳중에 여기가 1등입니다!🩷🩷! 재료도 청결하게 잘 관리되고있고 꿔바로우도 쏜득바삭하니 엄청 맛있었어요 ❤️❤️ㅎㅎ 남자친구 원래 마라탕 잘 안먹었는데 여기서 먹어보더니 너무 맛있다고 한그릇 다 먹었을정도👍💕 직원분들도 다 친절하셔서 먹는내내 기분이 좋았어요🩵🩵🩵🩵,2024-08-10,"점심에 방문, 예약 없이 이용, 데이트, 친목, 연인・배우자",음식이 맛있어요,205,1
1340393421,nightowl96,우리동네 마라탕 맛집입니다.,2024-08-09,"점심에 방문, 예약 없이 이용, 대기 시간 바로 입장, 일상, 혼자",음식이 맛있어요,385,3
1340393421,DaMu,점심에 갔더니 장안동 마라탕 맛집이라 그런지 사람이 많았어요! 1단계로 먹었는데 살짝 매콤한 사골국 먹는 기분ㅎㅎ 짜지 않고 또 너무 맵지 않아서 맛있었어요. 엄마랑 같이 갓는데 엄마도 만족~꿔바로우는 찹쌀피가 두툼한 편이었는데 딱딱하지 않고 바삭쫀득해서 마음에 들었습니다카운터 보시는 직원분이 외국인 같은데 살짝 미숙하지만 친절하게 잘 해주셔서 좋았습니다.,2024-08-09,"점심에 방문, 예약 없이 이용, 대기 시간 바로 입장, 데이트, 친목, 가족모임, 부모님",음식이 맛있어요,150,1
1340393421,후플푸프7,"매장도 넓고, 재료도 다양하고, 직원들이 굉장히 친절하고, 마라탕이 정말 매우 아주 맛있어서 신라방마라탕 장안동맛집 강추합니다!특히 직원님이 만들어준 특제땅콩소스가 예술이었습니다. 감사합니다!",2024-08-08,"점심에 방문, 예약 후 이용, 대기 시간 바로 입장, 일상, 친구",음식이 맛있어요,513,1
1340393421,윤수도윤맘,마라탕맛집입니다맛있게 먹었어요~^^,2024-07-30,"저녁에 방문, 예약 없이 이용, 대기 시간 바로 입장, 일상, 아이",음식이 맛있어요,923,9
1340393421,장안동외계인,먹느라 사진을 못찍었어요~^^사장님 바뀌신듯그래도 맛은 여전하게 굿~♡,2024-07-30,"점심에 방문, 예약 없이 이용, 대기 시간 바로 입장, 일상, 친구",음식이 맛있어요,1235,10
1340393421,윤수도윤맘,아들이오랜만에먹어서맛있대요꿔바로우랑맥주한잔했습니다,2024-07-11,"저녁에 방문, 포장·배달 이용, 대기 시간 바로 입장, 일상, 아이",음식이 맛있어요,923,8
1340393421,지아애미,아이들이 좋아해서 자주 와요 친철하고 맛도 좋아요 맵기도 단계별로있어 초딩에게도 딱입니다,2024-06-26,"저녁에 방문, 예약 없이 이용, 대기 시간 바로 입장, 일상, 아이",음식이 맛있어요,274,7
1340393421,이리스 도슨,신선하고 맛있어요 자주오는곳이에요!,2024-06-23,"밤에 방문, 예약 없이 이용, 대기 시간 바로 입장, 일상, 혼자",음식이 맛있어요,65,5
1340393421,Louiss,진ㅉ ㅏ짱~~💞💞,2024-06-14,"저녁에 방문, 예약 없이 이용, 대기 시간 바로 입장, 데이트, 연인・배우자",음식이 맛있어요,63,1
1340393421,umi****,.,2024-06-11,"점심에 방문, 예약 없이 이용, 대기 시간 바로 입장, 일상, 지인・동료",음식이 맛있어요,1027,1
1340393421,everstillnew13,일부러찾아와서먹는곳이예요!!!,2024-06-05,"저녁에 방문, 예약 없이 이용, 대기 시간 바로 입장, 일상, 아이",음식이 맛있어요,19,4
1340393421,lov****,.,2024-06-01,"밤에 방문, 예약 없이 이용, 대기 시간 바로 입장, 데이트, 연인・배우자",뷰가 좋아요,2413,1
1340393421,abc****,마라탕은 항상 신라방에서 먹는데 역시나 오늘도 정말 맛있습니다!! ㅎㅎ,2024-05-17,"저녁에 방문, 예약 없이 이용, 대기 시간 바로 입장, 일상, 연인・배우자",음식이 맛있어요,9,1
1340393421,윤징어다,점심시간에 가끔 가요 맛있어요,2024-05-14,"점심에 방문, 예약 없이 이용, 대기 시간 바로 입장, 일상, 지인・동료",음식이 맛있어요,208,1
1340393421,왕눈이1995,마라탕이 땡길 때 가면 좋습니다~~ 맛있어요!!!,2024-05-07,"저녁에 방문, 예약 없이 이용, 대기 시간 바로 입장, 데이트, 연인・배우자",음식이 맛있어요,1444,2
1340393421,콘센트보잉,저는 여기 처음 간곳 입니다..일단 맛은있었어요..다만 밑에 글쓰신분들과 같은 지적사항으로계산대 계시는 남자분..태도가 무뚝뚝한 성격이라 그런거일수있다고 넘어감...헌데 입구에서 담배피는 모습은 아... 진짜 아니것같네요. 애들과같이 밥먹고 계산하고 나갔는데 떡하니 피고계심...사장이면 이건아니지 않나요? 애들하고 저하고 눈마주쳤으면 끄는척이라도해야지..끝까지 피고계심..일단 맛보다 손님을 뭐같이 생각하시는듯..해서..여긴 다신 못갈듯합니다..그손으로 주방 들라날락한거 생각하믄...아.....,2024-05-05,"저녁에 방문, 예약 없이 이용, 대기 시간 바로 입장, 가족모임, 연인・배우자, 아이",음식이 맛있어요,35,1
1340393421,부르지마84,여기 찐 마라맛집입니다!!! 너무 맛있어요ㅎㅎ호불호 없이 누굴 데려가도 맛있다고하네요~언제가도 사람들로 붐비는 맛집이라 친구들 한명씩 다 데려가고싶어요ㅋㅋㅋ마라에 맥주 한병 하고 오기 좋은 식당입니다.,2024-04-24,"저녁에 방문, 예약 없이 이용, 대기 시간 바로 입장, 일상, 친구, 지인・동료",음식이 맛있어요,87,1
1340393421,goat8254,아이생일이라 친구들과 함께 이용하였어요사장님께서 할인도 해주시고 음료도 서비스로 주시고 너무 감사했습니다 마라탕도 맛있고 꿔바로우 맛집이였네요^^,2024-04-13,"점심에 방문, 예약 없이 이용, 대기 시간 바로 입장, 기념일, 친구, 아이",재료가 신선해요,15,1
1340393421,원1372,최고의 마라탕집..........☀️,2024-04-11,"저녁에 방문, 예약 없이 이용, 대기 시간 바로 입장, 데이트, 친구",음식이 맛있어요,43,1
1340393421,빼앰48,마라맛이 자극적이지도 않고 엄청 맛있어요!,2024-03-23,"점심에 방문, 예약 없이 이용, 대기 시간 바로 입장",음식이 맛있어요,504,1
1340393421,점박이스누피,,2024-03-21,"점심에 방문, 예약 없이 이용, 대기 시간 바로 입장, 일상, 지인・동료",음식이 맛있어요,1471,1
1340393421,장안동외계인,진짜 근처 마라탕집중 단연코 최고입니다~^^볶음밥도 맛있고 재료신선진짜 최고에요~~♡,2024-03-15,"저녁에 방문, 예약 없이 이용, 대기 시간 바로 입장, 일상, 친구",음식이 맛있어요,1235,9
1340393421,쿠키몬스터린,맛있아요 양이 많아요 사장님이 친절해요!,2024-03-12,"저녁에 방문, 예약 없이 이용, 대기 시간 바로 입장, 데이트, 연인・배우자",음식이 맛있어요,826,1
1340393421,lsm****,맛있어요!!!! 양도 많아용,2024-03-09,"저녁에 방문, 예약 없이 이용, 대기 시간 바로 입장, 데이트, 연인・배우자",음식이 맛있어요,36,1
1340393421,더럽15,맛도 얼큰하고 가게도 넓어서 좋아요,2024-03-09,"저녁에 방문, 예약 없이 이용, 대기 시간 바로 입장, 데이트, 연인・배우자",음식이 맛있어요,22,1
1340393421,빨강머리밍,맛있어서 찾아오는 집 입니다^^,2024-03-09,"저녁에 방문, 예약 없이 이용, 대기 시간 바로 입장",음식이 맛있어요,269,2
1340393421,kiyeri,2번째 매장 방문이에요 ㅎ여기 국물이 진짜 맛있구요 꿔바로우도 넘 맛있어서 아이들이 좋아해요^^또 방문하려구요 ㅎ,2024-03-09,"점심에 방문, 예약 없이 이용, 대기 시간 바로 입장, 가족모임, 아이",음식이 맛있어요,44,2
1340393421,젤코옹,마라탕이랑 꿔바로우 먹었는데 마싯어요!,2024-03-08,"저녁에 방문, 예약 없이 이용, 대기 시간 바로 입장, 친목, 친구",매장이 넓어요,26,1
1340393421,wooniworld,동네 단골 맛집이에요 기본에 충실하고 너무 깔끔하고 맛있어요마라탕 마라샹권 둘다 맛있어요,2024-03-06,"저녁에 방문, 예약 없이 이용, 대기 시간 바로 입장, 일상, 연인・배우자",음식이 맛있어요,6,1
1340393421,reumreumreum,마라탕 맛집 인정입니다..💛재료도 신선하고 간이 아주 딱이에요~!!토마토계란볶음이랑 꿔바로우 추천추천x100✨최애 마라탕집 🤭 여기 공기밥 무료라구요😱사장님 찐 맛집 오래 있어주셔야 해용잘먹었습니다~~~,2024-03-06,"점심에 방문, 예약 없이 이용, 대기 시간 바로 입장, 회식, 지인・동료",음식이 맛있어요,280,1
1340393421,대흉근,답십리 맛집,2024-03-05,"점심에 방문, 예약 없이 이용, 대기 시간 바로 입장, 일상, 부모님",친절해요,31,1
1340393421,슈퍼우먼1738,이틀 사이 두번이나 갔네요.국물이 진해요,2024-03-03,"점심에 방문, 예약 없이 이용, 대기 시간 바로 입장, 가족모임, 친척・형제",음식이 맛있어요,85,1
1340393421,00040,꿔바로우 양 엄청 많아요!! 바삭바삭하고 고기도 많이 들어있습니다!둘이 멋모르고 중짜 시켰다가 너무 많이나와서 다 못먹었어요ㅠㅠ마라탕 말뭐 매장 너무 청결하고 재료도 신선해서 좋았습니다.,2024-03-02,"점심에 방문, 예약 없이 이용, 대기 시간 바로 입장, 데이트, 연인・배우자",음식이 맛있어요,85,1
1340393421,이니나닝,"일단 매장이 너무 청결하고 넓어서 좋아요!마라탕도 크게 느끼하지 않고, 꿔바로우는 바삭 촉촉하고 마라탕에 넣을 재료 종류도 많아서, 다양하게 먹을 수 있어요!완전 인생 마라탕집이에요!",2024-03-02,"점심에 방문, 예약 없이 이용, 대기 시간 바로 입장",음식이 맛있어요,380,1
1340393421,yoo****,애정하는 마라탕집!🫶🩷,2024-02-29,"저녁에 방문, 예약 없이 이용, 대기 시간 바로 입장, 친목, 친구",음식이 맛있어요,10,3
1340393421,별이on,마라탕과 마라상궈는 맵고 짠 음식이라는 생각이 있는데신라방마라탕은 간이 띡 적당했어요신라면 보다 안매운 단계로 했어요마라샹궈도 맵기 조절이 가능해서 좋아요혼자 가도 친구랑 가도 멋은 곳이에요,2024-02-29,"저녁에 방문, 대기 시간 바로 입장, 데이트, 친목, 나들이, 일상, 친구, 부모님",음식이 맛있어요,422,1
1340393421,pearl20y,신라방은 처음 와보는데 너무 맛있어서 만족스러워요! 재료도 추가금액 없이(고기 제외) 담을 수 있어서 좋고 다양해서 제맘대로 잘 골라 먹었어요 국물도 진하니 맛있고 야채가 싱싱해요! 글구 여기... 꿔바로우가 찐이에요 존맛탱 잘 먹다 갑니다🫶🫶,2024-02-25,"저녁에 방문, 예약 없이 이용, 대기 시간 바로 입장, 일상, 친구",음식이 맛있어요,68,1
1340393421,물꼬기3095,재료도 신선하고 국물도 맛있어요~,2024-02-22,"점심에 방문, 예약 없이 이용, 대기 시간 바로 입장, 친목, 아이",음식이 맛있어요,19,1
1340393421,수연 아빠,자주와요. 난 여기가 제일 맛있음,2024-02-21,"점심에 방문, 예약 없이 이용, 대기 시간 바로 입장, 일상, 아이",음식이 맛있어요,1747,7
1340393421,위햅삐,배고프고 맛있어서 먹다가 사진을 찍었네요😆두번째 마라탕인데 제대로 입문한거같아요😊,2024-02-18,"점심에 방문, 예약 없이 이용, 대기 시간 바로 입장, 가족모임, 부모님",음식이 맛있어요,194,1
1340393421,Diclofenac,,2024-02-18,점심에 방문,음식이 맛있어요,1273,8
1340393421,MIngsu,너무 맜있어요!! 다음에 또 오고 싶어요,2024-02-17,"저녁에 방문, 예약 없이 이용, 대기 시간 바로 입장, 일상, 부모님",음식이 맛있어요,83,1
1340393421,립툰,동네 맛집이라 종종 이용하는곳인데요재료도 좋고 무엇보다 맛있어요근데 사장님이 불친절 하셔서 불편하단 생각이좀 들었어요,2024-02-17,"점심에 방문, 예약 후 이용, 대기 시간 바로 입장, 데이트, 연인・배우자",음식이 맛있어요,27,1
1340393421,뚱이52,울동네 마라탕 맛집 입니다 :),2024-02-15,"저녁에 방문, 예약 없이 이용, 대기 시간 바로 입장, 일상, 부모님, 친척・형제",음식이 맛있어요,21,2
1340393421,마리맘33,땀좀 흘릴정도 맛으로 주문채소 신선하고 얼큰하니 잘 먹었습니다꿔바로는 바삭 촉촉  짱입니다,2024-02-15,"아침에 방문, 포장·배달 이용, 일상, 가족모임, 아이",음식이 맛있어요,86,1
1340393421,차수안,존맛임 저 마라탕 맨날 여기와요 꿔바로우 꼭 먹어야함 미침 꿔바로우 최고...,2024-02-14,저녁에 방문,음식이 맛있어요,11,1
1340393421,뭔들33,친절하신 설명 덕분에 맛있게 먹고 갑니다.후식커피도 스타벅스 원두라 따로 커피숍 안가고 좋네요,2024-02-11,"저녁에 방문, 예약 없이 이용, 대기 시간 바로 입장, 가족모임",음식이 맛있어요,475,1
1340393421,Diclofenac,,2024-02-11,"저녁에 방문, 예약 후 이용, 대기 시간 바로 입장, 일상, 연인・배우자",음식이 맛있어요,1273,7
1340393421,kiyeri,초딩 딸내미가 명절연휴에 마라탕 노래를 불러서 검색해보고 방문했는데 국물이 끝내주네요 ㅎ맛있게 잘 먹었습니다^^,2024-02-11,"점심에 방문, 예약 없이 이용, 대기 시간 바로 입장, 친목, 가족모임, 연인・배우자, 아이",음식이 맛있어요,44,1
1340393421,tjd****,너무맛있어용! 친절하구 감사합니다,2024-02-08,"점심에 방문, 예약 없이 이용, 대기 시간 바로 입장, 친목, 일상, 회식, 친구",인테리어가 멋져요,33,1
1340393421,지아애미,신라방 맛있어서 자주 옵니다~^^가족들 모두 좋아해요,2024-02-07,"저녁에 방문, 예약 없이 이용, 대기 시간 바로 입장, 친목, 일상, 친구, 아이",음식이 맛있어요,274,5
1340393421,수연 아빠,"내꺼 아들, 딸 각 1개씩맛나요",2024-02-03,"점심에 방문, 대기 시간 바로 입장, 가족모임, 아이",음식이 맛있어요,1747,6
1340393421,오리꽥17,넘 맛있어요,2024-02-03,"점심에 방문, 예약 없이 이용",음식이 맛있어요,213,1
1340393421,세포박사,맛있어요~항상 동대문에 오면 먹는 집마라탕  짱,2024-02-03,"아침에 방문, 예약 없이 이용, 대기 시간 바로 입장, 일상, 지인・동료",음식이 맛있어요,21,6
1340393421,나뭇잎11,"마라탕이 엄청 맛있네요!! 꿔바로우는 바삭바삭하고 마라탕이랑 너무 잘 어울립니다! 둘이서 마라탕이랑 꿔바로우 소 먹으니 완전 배불러요~! 밥도 무료제공이라서 두그릇이나 먹었네요 😂 육수가 부족하면 육수도 리필이 되고, 맵거나 짜면 다시 해준다고 하니 서비스도 좋아요!",2024-02-01,"저녁에 방문, 예약 후 이용, 대기 시간 바로 입장, 일상, 연인・배우자",음식이 맛있어요,26,1
1340393421,s_****,그 어느 때 보다 많은 양을 담았다고 생각했는데 가격이 너무 적게 나와서 의심했어요ㅋㅋㅋ 진짜 제가 먹어본샹궈중에 가장 가격도 착하고 맛도 있네요 2단계가 신라면보다 매운 맛이라고 하는데 그렇게 엄청 많이 매운 것 같진 않아서 다음에 와서는 3단계를 먹어 보려고 합니다! 마라를 딱히 자주 찾지 않는 남자친구도 맛있다고 재방문 하자고 하네요ㅋㅋㅋ담에 꼭 또 올게요!,2024-01-31,"저녁에 방문, 예약 후 이용, 대기 시간 바로 입장, 데이트, 연인・배우자",친절해요,148,1
1340393421,yoo****,애정하는 마라탕집💕맛있음,2024-01-30,"저녁에 방문, 예약 없이 이용, 대기 시간 바로 입장, 친목, 친구",매장이 넓어요,10,2
1340393421,k970419,일주일에 한번은 와야함니다 .. 너무 맛있음 ㅠ,2024-01-30,"점심에 방문, 예약 없이 이용, 대기 시간 바로 입장, 데이트, 연인・배우자",매장이 넓어요,57,2
1340393421,윤콩쓰,오랜만에 먹은 마라탕입니다 2단계 맵기로 했는데 정말 맛있어요 무엇보다 국물이 진짜 깔끔합니다 너무맛있고 가게도 깨끗하고 깔끔합니다 오랜만에 마라탕 진짜 맛있었어요 꿔바로우까지 달달하고 찹살이라 더 맛있었습니다 재방문 의사 완전있어요,2024-01-28,"점심에 방문, 예약 후 이용, 대기 시간 바로 입장, 데이트, 연인・배우자",음식이 맛있어요,24,1
1340393421,라이이,양이 많아요 맛있어요 굿,2024-01-27,"저녁에 방문, 예약 없이 이용, 대기 시간 바로 입장",음식이 맛있어요,2235,1
1340393421,쭈니러브76,마라탕도 맛있었는데 마라샹궈도 넘 맛있네요~,2024-01-25,"저녁에 방문, 포장·배달 이용, 대기 시간 바로 입장, 일상",음식이 맛있어요,324,2
1340393421,보자기맵시 윤댕,매장도 음식도 정말 깔끔하고 맛있네요잘 먹고갑니다 :),2024-01-25,"저녁에 방문, 예약 없이 이용, 대기 시간 바로 입장, 일상, 아이",매장이 넓어요,30,1
1340393421,yoo****,진짜 오랜만에 와서 너무 맛있게 먹어요ㅜ!🫶🫶,2024-01-24,"저녁에 방문, 예약 없이 이용, 대기 시간 바로 입장, 친목, 친구",매장이 넓어요,10,1
1340393421,히읗리을,재료도 많고 맛도 좋았던 곳이에요!신라방은 처음 이용했는데 평일인데도바로 만석이 될 만큼 이미 유명한 곳이었어요너무 맛있게 먹어서 다음에 또 가려구요 ෆ,2024-01-24,"저녁에 방문, 예약 후 이용, 대기 시간 바로 입장, 데이트, 연인・배우자",음식이 맛있어요,39,1
1340393421,오구어구,이 동네 살면서 처음 와봤는데 재료 신선한 거 같아요 특히 야채!,2024-01-21,"점심에 방문, 예약 없이 이용, 대기 시간 바로 입장, 데이트, 연인・배우자",재료가 신선해요,34,1
1340393421,sy0****,너무 맛있고 가게가 엄청 청결해요!밥도 무제한이고 육수가 찐합니당,2024-01-20,"점심에 방문, 예약 없이 이용, 대기 시간 바로 입장, 데이트, 연인・배우자",음식이 맛있어요,2,1
1340393421,ron****,맛있어요. 잘 먹었습니다.,2024-01-20,"아침에 방문, 예약 후 이용, 대기 시간 바로 입장, 가족모임, 아이",음식이 맛있어요,27,1
1340393421,JJO31,엄마도 저도 워낙 마라탕을 좋아해서 점심시간에 종종 신라방마라탕 으로 먹으러 왔어요~ 마라맛도 단계별로 선택이 가능해서 저같은 맵찔이한테는 아주 좋아요 ! 늘 1단계로 엄마는 2단계로 드시는데~ 취향껏 먹을 수 있다는점이 너무 좋아서 자주 애용합니다~!,2024-01-19,"밤에 방문, 예약 없이 이용, 대기 시간 바로 입장",음식이 맛있어요,319,1
1340393421,lpj****,국물이 시원해요,2024-01-18,"점심에 방문, 예약 없이 이용, 대기 시간 바로 입장, 회식, 지인・동료",인테리어가 멋져요,28,1
1340393421,서울c준영맘,마라탕 최애인데 찐 맛집입니다~~직원분들도 친절하셔서 단골킵합니다~^,2024-01-18,"점심에 방문, 예약 없이 이용, 대기 시간 바로 입장, 친목, 지인・동료",음식이 맛있어요,3,1
1340393421,쭈니1201,아이 방학해서 버스타고 찾아온 신라방 마라탕~~마라탕 먹으러 가자니까 사춘기아들도 따라나서네요~^^점심시간이라 사람도 진짜많더라구요~^^너무너무 맛나게 잘먹고 아들이랑 데이트도 잘했습니다~^^담주에 아들친구들이랑 또 올께요~~^^,2024-01-18,"점심에 방문, 예약 없이 이용, 대기 시간 바로 입장, 데이트, 아이",음식이 맛있어요,38,2
33834364,임황규,요맛나요,2025-04-08,"점심에 방문, 예약 없이 이용, 대기 시간 바로 입장, 데이트, 연인・배우자",음식이 맛있어요,2179,3
33834364,당애,고규마후라이맛있엉요,2025-04-06,저녁에 방문,음식이 맛있어요,840,3
33834364,Blood77,고구마 후라이 맛있어요,2025-04-06,"저녁에 방문, 예약 없이 이용, 대기 시간 바로 입장, 데이트, 연인・배우자",가성비가 좋아요,550,4
33834364,김니32,고구마 맛있어요,2025-04-06,"점심에 방문, 예약 없이 이용, 대기 시간 바로 입장, 데이트, 연인・배우자",혼밥하기 좋아요,342,1
33834364,디디젤로,고구마후라이 맛있어요 ㅋㅋ,2025-04-01,점심에 방문,음식이 맛있어요,1843,2
33834364,하랑55,친절한 고객응대가 좋았어요,2025-03-25,"저녁에 방문, 예약 없이 이용, 대기 시간 바로 입장, 일상, 아이",혼밥하기 좋아요,884,1
33834364,flower39,굿,2025-03-22,저녁에 방문,음식이 맛있어요,2024,1
