place_id,nickname,content,date,situations,keywords,review_count,visit_count
1189698732,아뚜율,인테리어가 너무 멋지고가격이 너무너무 착해요♥️♥️,2023-05-23,저녁에 방문,인테리어가 멋져요,388,1
1189698732,핑크와와,외대앞술집 중에 분위기 맛집이라고해서 가봤는데 칵테일 종류가 엄청 많아요직원분도 정말친절하셔서 칵테일추천 잘해주시구요~! 편안한 분위기라 넘좋았어요!,2023-05-22,밤에 방문,친절해요,256,1
1189698732,acua,"오랜만에 방문했는데 재밌는 사진 기계가 생겼네요ㅎㅎ 칵테일 자체가 인상적이진 읺았는데, 분위기나 가성비가 좋아서 여러번 재방문 했어요",2023-05-20,저녁에 방문,술이 다양해요,242,1
1189698732,도도써니,굿,2023-05-17,저녁에 방문,혼술하기 좋아요,1074,1
1189698732,합격82,굿굿,2023-05-15,점심에 방문,음식이 맛있어요,256,2
1189698732,하늘지기님,굿,2023-05-12,아침에 방문,인테리어가 멋져요,997,1
1189698732,쀼숑쀼숑,2차로 즐기기 좋았던 이문바직원과 사장님도 친절하시고 저렴해서 좋았어요,2023-05-11,아침에 방문,매장이 청결해요,1184,1
1189698732,난주공,좋아요,2023-05-08,저녁에 방문,특별한 메뉴가 있어요,2980,1
1189698732,kn****,매장도 이쁘고 음식도 술도 너무 맛있는 곳!,2023-05-08,저녁에 방문,술이 다양해요,36,1
1189698732,꺅8930,굿굿,2023-05-03,점심에 방문,음악이 좋아요,200,1
1189698732,sug****,굿,2023-05-02,점심에 방문,매장이 청결해요,1048,1
1189698732,Jkj75,굿,2023-05-02,점심에 방문,친절해요,1133,1
1189698732,맛다시맛다시다,"조용하고 이쁜 바에용!경희대•외대 근처인데, 시험기간이라 학생들이 없어서 더 조용했나봐요, 럭키! 😆기본안주로 프레즐 한접시가 나옵니다ㅎㅎ인테리어도 이쁘고, 사장님께서 정말 친절하셨어요!",2023-04-24,저녁에 방문,기본 안주가 좋아요,501,1
1189698732,합격82,굿,2023-04-23,아침에 방문,음식이 맛있어요,256,1
1189698732,커넥션컴퍼니,인케이다가 졸아요,2023-04-17,점심에 방문,인테리어가 멋져요,750,1
1189698732,w0u0n,시그니쳐 칵테일 맛있네요... 기본으로 나오는 프레첼 너무 중독성 있습니다....,2023-04-13,밤에 방문,기본 안주가 좋아요,19,1
1189698732,hey****,좋아요,2023-04-07,점심에 방문,친절해요,1001,1
1189698732,지니ma,굿,2023-03-31,점심에 방문,대화하기 좋아요,532,1
1189698732,ps초록,맛있어요,2023-03-22,점심에 방문,친절해요,999,1
1189698732,Rok5,👍,2023-02-27,점심에 방문,음식이 맛있어요,825,1
1189698732,tifani62575,"어제 저녁 먹고 남자친구랑 들렀는데 집 근처에 이런 바가 있다는걸 이제 안게 너무 아쉬울 정도로 너무 좋았어요 ! 처음에 시킨 칵테일을 제 실수로 엎었는데 바로 안다치셨냐고 물어봐주시고 다시 만들어주시는 걸 보고 제가 너무 죄송하고 감사했어요 .. 기본 안주인 프레첼도 리필했었는데 저랑 남자친구랑 둘 중 뭐먹을지 고민하니까 둘다 주신 천사 사장님 ,, 정말 너무 친절하시고 가게 안에 사진 찍는 기계?도 있어서 인증샷처럼 추억을 남길 수 있어서 너무 좋았어요 ,, 💓 주변에 소문 많이 낼게요 번창하세요 !! :)",2023-02-19,저녁에 방문,가성비가 좋아요,20,1
1189698732,겸둥인,굿,2023-02-10,밤에 방문,대화하기 좋아요,701,1
1189698732,서영이70,"노란색 표지판을 보고 지하로 들어가면 분위기 좋은 바가….😊🤍 처음 가봤는데 칵테일 가격도 너무 좋고, 너무 맛있었어요!! 달달한 술을 좋아하지 않아서 사장님추천을 받아서 판도라랑 모스코뮬??을 먹어봤는데 취향저격이었습니다…😇🔫🔫🔫위스키가격도 싸서 안먹어보신분들 한번 도전해보는것도 좋을 것 가타용!!🤍",2023-02-08,저녁에 방문,술이 다양해요,8,1
1189698732,쓰이협지,"직원들이 친절하고 훈훈해요, 노래도 잘 틀고 재미있게 놀다갑니다🥹🥹",2023-02-08,저녁에 방문,혼술하기 좋아요,4,1
1189698732,김깔끔,굿,2023-02-03,점심에 방문,음식이 맛있어요,1162,1
1189698732,코코6419,굿,2023-01-29,점심에 방문,친절해요,192,1
1708823858,바르뷔스,"ㅠㅠ 먹을 때마다 든든하고 맛났던 버거운버거 오늘은 무슨 일인가요...맘터보다 컸던 치킨버거가 편의점버거보다 작아졌어요ㅠ방에서 뒹굴다가 머릿속에 ""버거운버거 치킨버거!"" 계시가 내려서 씻고 옷 갈아입고 나가서 기대 가득한 마음으로 통통한 버거를 후다닥 포장해왔는데 도착해서 포장 열어보니 양상추만 거대한 공갈버거가ㅠ  빵보다 너비도 작고 두께도 1cm정도로 얇고 질겨긴 치킨패티... 편의점 호빵마냥 내용물 없이 맨빵만 여러입 먹어야 치킨에 도달할 수 있는 그런 버거... 혼자 거대한 양상추가 떨어지고 나니 편의점 버거에도 못 미치는 비주얼... 아무리 치킨 패티마다 차이가 있다 해도 오늘은 정말 제가 알던 버거운버거 치킨패티의 1/3에도 못 미치는 그런 아쉬움과 실망이 가득한  버거였습니다. 다시 커지길ㅠ",2025-04-06,저녁에 방문,혼밥하기 좋아요,221,5
1708823858,hye****,너무 맛잇어요 학교 근처 최고의 버거집.. 맛있게 잘먹었습니다 ❤️,2025-04-02,"점심에 방문, 포장·배달 이용, 대기 시간 바로 입장, 친목, 친구, 지인・동료",인테리어가 멋져요,1,1
1708823858,gooooo98,입벌려 먹기 버거울 정도로 맛있는 경희 최고의 버거 최고!!!!!!!!!!,2025-04-02,"점심에 방문, 예약 없이 이용, 대기 시간 바로 입장, 친목, 친구, 친척・형제",음식이 맛있어요,8,1
1708823858,kuromi,굿,2025-03-27,저녁에 방문,재료가 신선해요,834,3
1708823858,미니언6686,양 많고 맛있어요,2025-03-25,"저녁에 방문, 예약 없이 이용, 대기 시간 바로 입장, 일상, 혼자",음식이 맛있어요,819,1
1708823858,ale****,여기는 진짜 goat입니다.! 사장님도 친절하십니다 ㅎㅎ,2025-03-21,"점심에 방문, 예약 없이 이용, 대기 시간 바로 입장, 데이트, 연인・배우자",혼밥하기 좋아요,9,1
1708823858,송리더님,완전 크고 배불어요 수제버거 느낌이에요 가격대비 아주 훌륭하다고 생각합니다 사장님이 버거에 진심을 담아주시네요 잘 먹었습니다,2025-02-27,"점심에 방문, 예약 없이 이용, 대기 시간 바로 입장, 데이트, 연인・배우자",음식이 맛있어요,83,1
1708823858,sar120,너무 맛있어서 또오려구요 이렇게 가성비 가심비 다챙긴 버거집 처음 봤어요!!! 단골 예정입니다아 ㅎㅎ,2025-02-27,"점심에 방문, 예약 후 이용, 대기 시간 바로 입장, 데이트, 연인・배우자",음식이 맛있어요,104,1
1708823858,Gomawo,"따뜻하고 바삭한 치킨이 가득 들어있는 치킨버거 넘 맛있네요. 사장님도 친절하시고 , 인심도 좋으셔서 배부르게 먹고 가요. 매장도 깔끔해서 담에는 친구들과 먹고 가야겠어요 식사대용으로 매장에서 먹고 가는데 든든하니 넘 좋네요^^",2025-02-26,"점심에 방문, 예약 없이 이용, 대기 시간 바로 입장, 일상, 혼자",음식이 맛있어요,35,1
1708823858,유환승,계절학기 시험 기간에도 먹기 정말 좋습니다 ㅎㅎ직원분들도 너무 친절하십니다 🥹👍,2025-01-02,"점심에 방문, 예약 없이 이용, 대기 시간 바로 입장, 친목, 친구",음식이 맛있어요,18,7
1708823858,인간믹서기,치킨 말고 불고기도 맛있네요.,2024-12-30,점심에 방문,음식이 맛있어요,1312,7
1708823858,미슬랭,햄버거은 롯데리아 같고..감자튀김은 맘스터치 같음.콜라는 펩시음악은 00 년대 히트송(애들은 가라)햄버거 나눠먹으려고 하니 반으로 갈라주심 ㅎㅎ친절하시네요. 잘먹고 갑니닿,2024-12-28,점심에 방문,특별한 메뉴가 있어요,1610,1
1708823858,렉쳐,공연 보고 방문. 가성비 좋게 잘 먹었습니다,2024-12-22,"저녁에 방문, 예약 없이 이용, 대기 시간 바로 입장, 데이트, 연인・배우자",양이 많아요,497,1
1708823858,red****,양도 푸짐하고 맛있네요,2024-12-12,"저녁에 방문, 예약 없이 이용, 대기 시간 바로 입장, 데이트, 연인・배우자",음식이 맛있어요,1101,1
1708823858,초록콧물훌쩍,너무 맛있게 잘 먹었습니다. 진짜 한입에 먹기 버겁게 크고 양이 많네요. 잘 먹었습니다~,2024-12-08,"저녁에 방문, 예약 없이 이용, 대기 시간 30분 이내, 데이트, 친목, 연인・배우자, 친구, 지인・동료",양이 많아요,7,1
1708823858,바르뷔스,맛있어요~~ 제가 사진 찍으면 맛 없어 보이게 찍혀서 사진은 안 올릴게요.,2024-11-23,저녁에 방문,음식이 맛있어요,221,4
1708823858,인간믹서기,신속히 음식이 나와서 좋습니다.,2024-11-20,점심에 방문,음식이 맛있어요,1312,6
1708823858,seo****,경희대 햄부기 맛집!!!,2024-11-07,"점심에 방문, 예약 없이 이용, 대기 시간 바로 입장, 친목, 친구",음식이 맛있어요,34,1
1708823858,고팀장입니다,가성비 갑 햄버거프랜차이들보다 양많고 맛있어요매장도 넓어서 혼자 점심하면서 일보기도 좋아요,2024-11-01,"점심에 방문, 예약 없이 이용, 대기 시간 바로 입장, 일상, 혼자",음식이 맛있어요,470,1
1708823858,맘모스롤,"경희개 햄버거 맛집, 가성비 정말 좋아요! 특히 시그니처 버거에는 육해공이 다 들어있고 불닭치즈카츠도 너무 맛있어요. 가성비 진짜 최고",2024-10-30,"저녁에 방문, 예약 없이 이용, 대기 시간 바로 입장, 친구",양이 많아요,124,1
1708823858,권오명1966,조,2024-10-26,점심에 방문,재료가 신선해요,1227,1
1708823858,닉네임4016,양 많고 혜자스럽습니다!,2024-10-20,점심에 방문,음식이 맛있어요,11,1
1708823858,진실103709,우리 아이들의 천국예요. 한입버거가 우리 아이들의 최애입니다^^ 감사해요 좋은 버거집 있어서 좋아요,2024-10-05,"저녁에 방문, 예약 없이 이용, 대기 시간 바로 입장, 가족모임, 아이",음식이 맛있어요,7,1
1708823858,인간믹서기,가성비 좋은 버거집으로 추천합니다!#버거운버거,2024-09-24,점심에 방문,음식이 맛있어요,1312,5
1708823858,달달달 달다구리,고기패티가 두툼하고 촉촉해요. 패티말고도 야채가 많이 들어있어서 너무좋고 달달한 소스도 참 맛있네요  생긱보다 메뉴가 많아요 다음에는 치킨하고  베이크하고 샐러드도 곁들여 먹고싶네요 .   이제야 알았다니. 재방문의사 200퍼센트예요,2024-09-22,"점심에 방문, 예약 없이 이용, 대기 시간 바로 입장, 가족모임, 친척・형제",음식이 맛있어요,129,1
1708823858,지영973,맛있어요!! 친절하십니다,2024-08-30,"점심에 방문, 예약 없이 이용, 대기 시간 바로 입장, 데이트, 친구",음식이 맛있어요,15,1
1708823858,남상운43,감튀랑 치킨 항상 바로바로 튀겨서 맛있어용,2024-08-28,"점심에 방문, 예약 없이 이용, 대기 시간 바로 입장, 일상, 혼자",음식이 맛있어요,13,1
1708823858,바르뷔스,치킨버거 굿,2024-08-23,점심에 방문,음식이 맛있어요,221,3
1708823858,바르뷔스,치킨버거와 감자튀김 맛있습니다^^그런데 사이드메뉴 샐러드 추가 주문하니 뜨끈한 햄버거에 눌려서 샐러드도 뜨끈뜨끈ㅋㅋ따뜻한 메뉴끼리만 시켜야겠어요. >> (수정) 이후에 다시 주문하니 샐러드 뜨끈해지지 않도록 따로 포장해 주셨어요. 사이드로 샐러드 같이 시켜도 안전합니다~~ㅋㅋ,2024-08-17,점심에 방문,양이 많아요,221,2
1708823858,안기영84,단골입니다ㅎㅎ 맛있게 잘 먹었습니다:),2024-08-13,"저녁에 방문, 예약 없이 이용, 대기 시간 바로 입장, 데이트, 친목, 나들이, 여행, 일상, 연인・배우자",음식이 맛있어요,11,1
1708823858,bom717,경희대 온김에 먹으러 왔는데 햄버거랑 감자튀기 다 너무너무 맛있어요🍔또 먹으러 올게요#버거운버거,2024-08-10,"저녁에 방문, 예약 없이 이용, 대기 시간 바로 입장, 데이트, 연인・배우자",음식이 맛있어요,134,1
1708823858,s2d****,경희대 온김에 우연히 들리게 되었는데 수제버거라 뜨끈뜨끈하고 너무 맛있어요🍔사장님도 친절하셔서 더 기분이 좋았습니다 또 먹으러 올게요#버거운버거,2024-08-10,"저녁에 방문, 예약 없이 이용, 대기 시간 바로 입장, 데이트, 연인・배우자",음식이 맛있어요,22,1
1708823858,유환승,동기들이랑 맛있게 먹고 갑니다😝,2024-08-07,"저녁에 방문, 예약 없이 이용, 대기 시간 바로 입장, 친목, 친구",음식이 맛있어요,18,4
1708823858,김똥5387,맛잇는데 조리가 오래걸려서 아쉬우ㅏ용 하지만 맛잇어서 맨날 가용,2024-08-05,"저녁에 방문, 예약 없이 이용, 대기 시간 30분 이내, 나들이, 혼자",음식이 맛있어요,131,3
1708823858,바르뷔스,햄버거 크고 맛있어요!! 핫치킨버거 치킨 통통하고 맛났는데 다른 메뉴 시킨 분들도 다 맛있다 하시네요ㅎㅎ,2024-07-25,점심에 방문,음식이 맛있어요,221,1
1708823858,몰라5390,경희대 햄버거 맛집 찾았습니다후문에 있어서 갈 일 있다가 들렀는데 진짜 맛있어요. 첫 번째로 가성비 최고 좋아요. 햄버거 하나 먹고 배차는 거 쉽지 않은데 반쪽 먹고 배 불렀어요감자튀김도 맛있고 치킨 너겟도 맛있어서 다음에는 치킨이랑 다른 메뉴도 먹어보려고요혼밥 하는 분들도 많고 중국 유학생분도 많았어요. 역시 맛있으면 다들 먹으러 오는 것 같아요다음에 배달로 먹어봐야겠어요,2024-07-18,"점심에 방문, 예약 없이 이용, 대기 시간 바로 입장, 데이트, 연인・배우자",음식이 맛있어요,397,1
1708823858,K고양의 여행기,저는 서울에 살고있지 않아서 처음보는 버거가게 이었습니다 키오스크에서 불새버거 제가 좋아하는 와사마요가 들어간 세트로 골랐는데간단하고 편하게 한 끼를 맛나게 해결할 수 있었네요😉😁,2024-07-12,"저녁에 방문, 예약 없이 이용, 대기 시간 바로 입장, 친목, 지인・동료",음식이 맛있어요,199,1
1708823858,lto****,이건 꼭 학교 근처에 있어야해요.양도 많고 맛있고  ~햄버거 하나다 못먹은건 처음입니다.음료도 무한 리필.가성비 좋고 친절하고 예쁜직원분 기존 햄버거집보다  좋을꺼같아요!!배달해먹기도  너무 좋고  운동하시는분들도 추천드려요~,2024-07-06,"저녁에 방문, 예약 없이 이용, 대기 시간 바로 입장, 가족모임, 아이",음식이 맛있어요,29,1
1708823858,kuromi,맛있어요,2024-07-05,"점심에 방문, 예약 없이 이용, 대기 시간 바로 입장, 친목, 친구",음식이 맛있어요,834,2
1708823858,김똥5387,저렴하고 퀄리티는 좋아요:),2024-07-03,"저녁에 방문, 예약 없이 이용, 대기 시간 30분 이내, 나들이, 혼자",음식이 맛있어요,131,2
1708823858,안습가이,양이 많고 맛있어요. 가성비 좋아요!,2024-07-02,"점심에 방문, 예약 없이 이용, 대기 시간 바로 입장, 일상, 지인・동료",음식이 맛있어요,5,1
1708823858,댄니나,모든 부분 너무 만족해요!!! 강력 추천합니다,2024-06-22,점심에 방문,음식이 맛있어요,705,1
1708823858,유환승,시험기간에 혼밥 든든히 하기 좋습니다😋🥹,2024-06-17,"저녁에 방문, 예약 없이 이용, 대기 시간 바로 입장, 일상, 혼자",혼밥하기 좋아요,18,3
1708823858,her****,처음으로 버거운버거 시그니처 메뉴를 먹어봤는데 재료도 신선하고 너무 맛있어요!,2024-06-14,"점심에 방문, 예약 없이 이용, 대기 시간 바로 입장, 나들이, 혼자",음식이 맛있어요,10,2
1708823858,tor****,맛있어요!!,2024-06-12,"저녁에 방문, 예약 없이 이용, 대기 시간 바로 입장, 데이트, 연인・배우자",음식이 맛있어요,11,1
1708823858,해피스트42,진짜 여기 맛있고 사장님 부부가 최최고!!!!강추합니다.♡,2024-06-03,"저녁에 방문, 예약 없이 이용, 대기 시간 바로 입장, 가족모임, 아이",음식이 맛있어요,24,1
1708823858,ins****,매주 찾아오는 곳입니다. 너무 맛있게 먹고 있어요~,2024-06-03,점심에 방문,음식이 맛있어요,5,4
1708823858,랍73,햄버거 맛있고 양도 많고 가격도 합리적이에요사장님도 친절해요,2024-05-31,"저녁에 방문, 예약 없이 이용, 대기 시간 바로 입장, 일상, 혼자",음식이 맛있어요,42,1
1708823858,ypi****,친절하게 대응해주셔서 너무 좋았어요!  매장도 넓고 쾌적하네요!!,2024-05-29,"점심에 방문, 예약 없이 이용, 대기 시간 바로 입장, 데이트, 친구",음식이 맛있어요,5,1
1708823858,her****,양도 많고 패티가 너무 신선해요!! 심지어 감자튀김도 맛있어용,2024-05-28,"저녁에 방문, 예약 없이 이용, 대기 시간 바로 입장, 친목, 친구",인테리어가 멋져요,10,1
1708823858,유건희89,매장도 쾌적하고 메뉴 종류가 많아서 좋아요,2024-05-28,"저녁에 방문, 예약 없이 이용, 대기 시간 바로 입장, 친목",인테리어가 멋져요,5,3
1708823858,ins****,완전 맛있게 잘 먹었습니다!! 항상 즐겨 찾는 곳이에요~,2024-05-27,"점심에 방문, 예약 없이 이용, 대기 시간 바로 입장, 일상",매장이 넓어요,5,3
1708823858,리락꾸야,처음 방문했는데 친절하시고 너무 맛있어요특히 감자튀김 너무 좋아하는 감자튀김이라 아이도 잘먹고 다음에 또 먹으러오려구요!!>.<,2024-05-26,"점심에 방문, 예약 없이 이용, 대기 시간 바로 입장, 일상, 아이",인테리어가 멋져요,72,1
1708823858,dhtnqls90,맛있습니당 ㅎㅎ다음에또올게용,2024-05-25,"점심에 방문, 예약 없이 이용, 대기 시간 바로 입장, 데이트, 친구",음식이 맛있어요,10,1
1708823858,인간믹서기,버거가 juicy하고 가격도 적당합니다.,2024-05-21,점심에 방문,음식이 맛있어요,1312,4
1708823858,Sh8024,확실히 한입에 먹기 버거운버거에요 ㅋㅋ,2024-05-11,"점심에 방문, 예약 없이 이용, 대기 시간 바로 입장, 친목, 친구",음식이 맛있어요,61,1
1708823858,김태강7,가성비도 좋고 안에 들어간 재료들이 신선해서 좋았어요. 강추합니다!,2024-05-09,"점심에 방문, 예약 없이 이용, 대기 시간 바로 입장, 일상, 혼자",음식이 맛있어요,2,1
1708823858,고메6,진짜 양 너무 많아서 감튀 다 못먹을 정도였습니다..ㅎㅎ 저는 불새버거 먹었는데 와사비맛 톡톡히 나서 너무 맛있었어요!! 감튀는 짭쪼름한 편이라 케찹 필요없는 맛이었어요 ㅎㅎ 추천함미다!!,2024-05-09,"점심에 방문, 예약 없이 이용, 대기 시간 바로 입장, 친목, 일상, 친구, 지인・동료",음식이 맛있어요,11,1
1708823858,fir****,맛있었습니다,2024-05-01,"점심에 방문, 예약 없이 이용, 대기 시간 바로 입장, 나들이, 혼자",음식이 맛있어요,29,1
1708823858,thd****,너무 맛있어요ㅠㅠ,2024-04-28,"점심에 방문, 예약 없이 이용, 대기 시간 바로 입장, 일상, 혼자",음식이 맛있어요,54,1
1708823858,유환승,간판메뉴인 치킨버거뿐만 아니라 불고기버거도 맛있어요,2024-04-22,"저녁에 방문, 예약 없이 이용, 대기 시간 바로 입장, 일상, 혼자",매장이 넓어요,18,2
1708823858,유건희89,"매장이 깨끗하고, 메뉴 종류가 다양해서 좋았어요 다음에 또 오고싶어요",2024-04-22,"점심에 방문, 예약 없이 이용, 대기 시간 바로 입장, 친목, 친구",음식이 맛있어요,5,2
1708823858,Mudryk,정말 맛있어요~😋😋😋,2024-04-12,"저녁에 방문, 예약 없이 이용, 대기 시간 바로 입장, 친목, 친구",음식이 맛있어요,4,1
1708823858,유건희89,매장이 깨끗하고 메뉴가 다양해서 좋았어요~,2024-04-12,"저녁에 방문, 예약 없이 이용, 대기 시간 바로 입장, 일상, 친구",음식이 맛있어요,5,1
1708823858,이승연46,너무 맛있어요!!! 다름 프랜차이즈보다 여기가 젤 나아요오,2024-04-12,"저녁에 방문, 예약 없이 이용, 대기 시간 10분 이내, 데이트, 연인・배우자",음식이 맛있어요,18,1
1708823858,Yun1014,양도 상당하고 정말 버거운 버거에요! 회기의 진정한 버거 맛집! 사장님도 너무 친절하시고 꼭 가보세요!,2024-03-31,"점심에 방문, 예약 없이 이용, 대기 시간 바로 입장, 데이트, 연인・배우자, 친구",음식이 맛있어요,576,2
1708823858,인간믹서기,가성비 갑 버거집,2024-03-26,점심에 방문,음식이 맛있어요,1312,3
1708823858,김화랑12,주 5회 햄버거 먹는 사람이 강력 추천합니다!진짜 이만한곳 없습니다...,2024-03-20,"저녁에 방문, 예약 없이 이용, 대기 시간 바로 입장, 일상, 혼자",음식이 맛있어요,3,1
1708823858,쿠쿠다스4322,버거운 버거! 처음인데 너무 맛있어요!,2024-03-20,"점심에 방문, 예약 없이 이용, 대기 시간 바로 입장, 친구",매장이 청결해요,11,1
1708823858,Esther3215,매장이청결하고 좌석이 편해서 좋아요,2024-03-20,"점심에 방문, 예약 없이 이용, 대기 시간 바로 입장, 일상, 친구",가성비가 좋아요,9,1
1708823858,김보15,좋아요,2024-03-17,"점심에 방문, 예약 없이 이용, 대기 시간 바로 입장, 데이트, 연인・배우자",음식이 맛있어요,1693,1
1708823858,1whtjddbs,너무 맛있고 가성비도 좋아요 경희대 근처에서 버거 먹을거면 여기로!!,2024-03-12,"점심에 방문, 예약 없이 이용, 대기 시간 바로 입장, 친목, 일상, 친구",음식이 맛있어요,5,1
1708823858,DIOvolo,"야채도 푸짐하고, 뭣보다 엄청 빠르게 나옵니다맘스터치가 몇 년 전부터 계속 바뀌면서 가성비가 떨어지는 느낌이었는데 완벽한 대체재를 찾은거같아요!",2024-03-06,"점심에 방문, 예약 없이 이용, 대기 시간 바로 입장, 혼자",음식이 맛있어요,1,1
1708823858,iml****,학교랑 가깝고 맛있어요.👍🏻😄메뉴도 다양해요,2024-03-06,"점심에 방문, 예약 없이 이용, 대기 시간 바로 입장, 친목, 친구",음식이 맛있어요,15,1
1708823858,뭇,매번가는곳 매번맛있다!,2024-03-01,"점심에 방문, 예약 없이 이용, 대기 시간 바로 입장, 일상, 혼자",음식이 맛있어요,105,1
1708823858,BellaJin,입학식마치고 맛집찾다가 🤩 가족들과 가성비 좋은 회식👍🏻 맛있어요. 레드감자🔥👍🏻 양이 많아요🌸,2024-02-29,"저녁에 방문, 예약 없이 이용, 대기 시간 바로 입장, 친목, 친척・형제",친절해요,434,1
1708823858,김똥5387,치킨패티가 너무 맛잇어요 치킨버거땡길때 가용:),2024-02-27,"저녁에 방문, 예약 없이 이용, 대기 시간 30분 이내, 기념일, 혼자",음식이 맛있어요,131,1
1708823858,ini0630,굿,2024-02-21,"점심에 방문, 예약 없이 이용, 대기 시간 바로 입장, 데이트, 연인・배우자",음식이 맛있어요,804,6
1708823858,도원짱,감사합니다,2024-02-09,"저녁에 방문, 예약 없이 이용, 대기 시간 바로 입장, 일상, 친구",음식이 맛있어요,2268,1
1708823858,ini0630,굿,2024-02-05,"점심에 방문, 예약 없이 이용, 대기 시간 바로 입장, 데이트, 연인・배우자",음식이 맛있어요,804,5
1708823858,ini0630,굿,2024-01-18,"점심에 방문, 예약 없이 이용, 대기 시간 바로 입장, 데이트, 연인・배우자",음식이 맛있어요,804,4
1708823858,통장,먹다 너무 놀라서 찍어요 새우알이 많고 톡톡터지고 두꺼우면서 부드러운 치킨패티 담백한 고기패티 ..미쳤습니다..먹고 맛있어서 포장으로 또 주문했어요 한입버거운 시그니처버거 하나먹으러 방문해도 이상하지않은 매장입니다 진짜ㅜ소스도 하나도 안느끼하고 진짜 존맛탱.....,2024-01-06,"점심에 방문, 예약 없이 이용, 대기 시간 바로 입장, 친목, 친구",음식이 맛있어요,40,1
1708823858,은지573,폭설이 내린 2023년 마지막 토요일인 12월 30일경희대평화의전당 콘서트 보러왔다가 들렀어요햄버거 너무 맛나요... 양상추가 신선해서 아삭하고...치즈감자도 맛나고 후라이드 통다리도 맛나네요..걍 다 맛나요 ㅎㅎ왜 우리집 근처에는 이런곳이 없을까요??이사오고 싶네요 ㅎㅎ,2023-12-30,"점심에 방문, 예약 없이 이용, 대기 시간 바로 입장, 일상, 아이",음식이 맛있어요,47,1
1708823858,긍정의달인,와 여기 치킨 진짜 맛있어요 ㅎㅎ햄버거랑 조합이 최고였어요!데이트코스로 너무 좋았습니다 또 방문할께요:),2023-12-29,"저녁에 방문, 예약 없이 이용, 대기 시간 바로 입장, 데이트, 연인・배우자",음식이 맛있어요,574,1
