place_id,nickname,content,date,situations,keywords,review_count,visit_count
1174905682,her****,"혼자 가도 부담 없이 든든한 한끼를 즐길 수 있는 곳이에요! 따뜻하고 담백한 국물에 넉넉한 국수, 그리고 단백질을 책임져 줄 불고기까지! 든든한 한끼로 완전 추천이에요!!",2025-01-03,"저녁에 방문, 예약 없이 이용, 대기 시간 바로 입장, 친목, 혼자",음식이 맛있어요,32,4
1174905682,까꿍9794,집 근처라 퇴근하고 방문하는 편인데요.가성비도 좋고 제가 좋아하는 교자와 메밀전병이 같이 팔아서 좋아합니다.음식도 맛있고 굉장히 친절하세요.음식도 깔끔하고 최고에요!번창했으면 좋겠어요!,2025-01-02,"저녁에 방문, 예약 없이 이용, 대기 시간 바로 입장, 데이트, 연인・배우자",음식이 맛있어요,14,2
1174905682,se086,"오랜만에 국수가 땡겨서 방문했어요! 매장이 깔끔해서 편안하게 먹기 좋아요~ 혼밥하기 좋아요! 통통국수, 비빔국수, 직화불고기덮밥 먹었는데 비빔국수 최애~! 새콤달콤 너무 맛있어요!! 또 먹으러 올게요~",2024-12-30,"저녁에 방문, 예약 후 이용, 대기 시간 바로 입장, 일상, 부모님",매장이 청결해요,143,1
1174905682,월애55,동네에 생긴 통통국수  가게이믈만킴 국수가 통통하고 깔끔하니 맛있네. 자주 찾아 올 것 같습니다,2024-12-28,"점심에 방문, 예약 없이 이용, 대기 시간 바로 입장, 일상, 아이",음식이 맛있어요,12,1
1174905682,아이니10,저의 인생국수집이에요 너무~~맛있구요 직화불고기도 그 일반적인 얇은고기 아니에요. 두툼하고 불맛 최고임 비빔국수 넘 맛있고 얼큰통통국수도 넘 맛있 ㅠㅠㅠ 미아사거리 맛집이에요 강추,2024-12-28,"점심에 방문, 예약 후 이용, 대기 시간 바로 입장, 데이트, 연인・배우자",음식이 맛있어요,303,1
1174905682,her****,국수 정말 좋아하는데요. 국물이 좋은 재료를 써서 그런지 맛이 깔끔하고 깊어요! 좋아하는 국수를 든든하게 먹을 수 있어서 자주 찾는 곳이에요! 불고기도 미니 화로에 올려주셔서 식지 않고 끝까지 따뜻하게 맛있게 먹을 수 있어요!,2024-12-27,"저녁에 방문, 예약 없이 이용, 대기 시간 10분 이내, 친목, 일상, 혼자",매장이 넓어요,32,3
1174905682,치토뿅,"덮밥이랑 비빔국수,교자만두,고기추가 이렇게 둘이서 진짜 푸짐하게 먹습니다:)가성비도 이런 가성비가 없어요고기양 엄청 많은데 가격보고 놀랄 수 밖에 없고 비빔국수 면발 정말 통통,탱탱해요ㅎㅎ반숙란 한입 베어물면 완벽테이크아웃해서 먹는거였는데 교자만두 정만 바삭바삭 합니다:)매장 이용시에는 요구루트도 먹을 수 있는 것 같아요매장도 정말 깨끗하고 의자도 크고 자리가 넓어 다음번엔 매장이용하고 요구르트도 챙겨먹는걸롴ㅋㄲㅋ",2024-12-27,"점심에 방문, 예약 없이 이용, 대기 시간 바로 입장, 일상, 친구",음식이 맛있어요,57,1
1174905682,aro****,국수랑 불고기를 같이 주는 맛집이 있다고 해서 점심먹으러 다녀왔습니다!! 오오 생면이라 면 자체가 너무 맛있는데요!!! 고기도 맛있고 통통국수 따뜻한 국수 진짜 맛있어요!!!! 강추강추,2024-12-24,"저녁에 방문, 예약 없이 이용, 대기 시간 바로 입장, 친목, 연인・배우자, 아이",친절해요,207,1
1174905682,jan****,가족과 함께 식당 왔어요.음식이 맛있고 깔끔합니다.재방문의사 있습니다^^,2024-12-24,"점심에 방문, 예약 없이 이용, 대기 시간 바로 입장, 친목, 연인・배우자",음식이 맛있어요,22,1
1174905682,피식26,고기랑 같이 주니까 가성비 좋아요 면이 맛나요 고기도 맛나요,2024-12-23,"저녁에 방문, 예약 없이 이용, 대기 시간 바로 입장, 데이트, 연인・배우자",음식이 맛있어요,23,1
1174905682,친형,근처 헬스장에서 운동하고 나면 마땅히 식사할만한 곳이 없었는데 역근처에 깔끔하고 구성 좋은 맛집 찾았네요.불맛가미되어 고기가 더 맛나고 국수도 아주 찰지고 맛있어요.종종 또 먹으러가렵니다 :),2024-12-23,"점심에 방문, 예약 없이 이용, 대기 시간 바로 입장",음식이 맛있어요,1195,1
1174905682,제이2937,조리경력 25년 오너쉐프의 손맛 👍🏻 국물도 진하고 면발도 통통 쫄깃해서 너무 맛있게 먹었어요! 불고기까지 제공되어서 같이 먹으니 든든하게 잘 먹었쑴니당♥️너무 맛나요:),2024-12-21,"점심에 방문, 예약 후 이용, 대기 시간 바로 입장, 나들이, 연인・배우자",음식이 맛있어요,136,1
1174905682,SARAH20,"강북 고기국수 맛집 아니, 서울 최고 국수 맛집으로 곧 소문날 것 같음 ㅠㅠ 정말 기본이고 간단한데 맛있고 계속 생각나는 맛이에요.(실제로 계속 생각나고 있습니다) 단골할게요~ 잘먹었습니다! 강남 논현쪽에도 분점 내주세요ㅠㅠㅠ",2024-12-21,"점심에 방문, 예약 없이 이용, 대기 시간 바로 입장, 데이트, 연인・배우자",음식이 맛있어요,12,1
1174905682,토요일63,국수랑 같이 먹는 맛난 고기! 직화로 구운  고기에서 불향이 풍풍나네요. 국수 면발도 아주 좋아요. 또 먹고 싶어요. 굿~~ 재방문 의사 100%입니다.,2024-12-19,"점심에 방문, 예약 없이 이용, 대기 시간 바로 입장, 가족모임, 연인・배우자",음식이 맛있어요,118,1
1174905682,s_****,국수랑 고기 구성이 좋아요 깨끗하고 맛있네요!,2024-12-19,"점심에 방문, 예약 없이 이용, 대기 시간 바로 입장, 일상, 연인・배우자",혼밥하기 좋아요,10,1
1174905682,슈가라일락,역시 25년 요리 경력자 사장님 음식솜씨는 말이 필요없네요.  국수먹고 이렇게 감탄하게 될줄이야~^^ 진한 육수도 끝내주고 감칠맛 나는 양념장의 비빔국수는 물론 불향 가득나는 촉촉한 불고기까지. 국수 먹고 맛있게 배부르고 싶으신 분들~얼른 가보세요. 가성비까지 좋은 강북맛집이에요,2024-12-19,"점심에 방문, 예약 후 이용, 대기 시간 바로 입장, 일상, 아이",음식이 맛있어요,927,1
1174905682,몽클린 에어컨분해세척,간단하게 국수먹고싶어서 검색하다 우연히 방문한곳.반숙계란 엄청맛있고 양도 많음!!함께나오는 불고기도 식지않게 먹을수있고 가성비 굿!!우연히 검색하고왔지만 이제 단골로 자주올듯!,2024-12-18,"저녁에 방문, 예약 후 이용, 대기 시간 바로 입장, 데이트, 연인・배우자",친절해요,13,1
1174905682,joo****,면을 너무 좋아하는 면순이라서 국수 먹으러 왔는데 불고기까지 함께 먹을 수 있어서 좋았어요👍🏻비빔국수의 새콤하면서도 고소함이 느껴져서 불고기랑 잘 어울렸어요 ! 생면이라서 면의 식감이 쫄깃쫄깃해서 너무 맛있더라구요 😊 사이드 메뉴로 교자까지 주문해서 정말 푸짐하고 배 터지게 먹었어요 !사장님도 친절하시구 매장도 깔끔해서 맛있게 식사하구 갑니다 🫶🏻,2024-12-18,"점심에 방문, 예약 없이 이용, 대기 시간 바로 입장, 일상, 친구",친절해요,397,1
1174905682,백광41,포장해와서 먹었는대 맛있어요친절 합니다,2024-12-17,"저녁에 방문, 포장·배달 이용, 대기 시간 10분 이내, 일상, 혼자",음식이 맛있어요,1241,1
592637304,pur****,직원이 친절해요,2025-02-19,저녁에 방문,음식이 맛있어요,1181,8
592637304,pur****,직원이 친절해요,2025-01-23,저녁에 방문,음식이 맛있어요,1181,7
592637304,Ofndnf,진짜 고기가 신선하고 맛있어요… 특히 냉면까지 마무리하면 완벽한 한 끼 해결~ 물냉면이 탱글하고 베이스도 시원해서 사계절내내 잘 먹고 있어요!!,2025-01-13,"저녁에 방문, 예약 없이 이용, 대기 시간 바로 입장, 일상, 연인・배우자",음식이 맛있어요,69,1
592637304,찌햐끄,무한리필인데 고기질 좋습니다.친절하셔서 자주가요,2025-01-02,"저녁에 방문, 예약 없이 이용, 대기 시간 바로 입장, 데이트, 연인・배우자",고기 질이 좋아요,579,1
592637304,pin****,맛있어요 좋아요,2024-12-28,"점심에 방문, 예약 없이 이용, 대기 시간 바로 입장, 일상, 지인・동료",양이 많아요,628,1
592637304,없음308,"성인 2인 35,800 (인당 17,900)된장찌개 3,000총 38,800삼겹살, 쫄깃살?(항정살 등등), 대패삼겹, 갈비, 돼지껍데기 등이 있는데요맛있게 잘먹었습니다화력도 쎄고 좋습니다",2024-12-12,"저녁에 방문, 예약 없이 이용, 대기 시간 바로 입장, 일상, 지인・동료",양이 많아요,171,1
592637304,거짓말은하지않습니다,좋아요 고기도 여러가지고 남자 알바생 분도 재치있고 재밌어요ㅋㅋ,2024-11-29,"저녁에 방문, 예약 없이 이용, 대기 시간 바로 입장, 일상, 친구",음식이 맛있어요,327,1
592637304,pur****,직원이 친절해요,2024-11-17,저녁에 방문,음식이 맛있어요,1181,6
592637304,빵빵ㅇ이,👍👍👍👍👍👍,2024-11-12,"저녁에 방문, 예약 없이 이용, 대기 시간 바로 입장, 데이트, 일상, 연인・배우자",음식이 맛있어요,406,1
592637304,고미당,너무 맛있게 잘 먹었습니다,2024-11-06,"저녁에 방문, 예약 없이 이용, 대기 시간 바로 입장, 데이트, 연인・배우자",음식이 맛있어요,764,4
592637304,귀욤종90,무한리필이지만 고기퀄리티가 너무좋아요,2024-11-06,"저녁에 방문, 예약 없이 이용, 대기 시간 바로 입장, 데이트, 친목, 연인・배우자, 친구",음식이 맛있어요,18,1
592637304,가가자매맘,사장님 넘친절하시고ㅡ파절임 너무맛나요ㅎㅎ양념직접하시는데 ㅠㅠ최고! 고기도 맛나고~~최고에요♡,2024-10-29,"저녁에 방문, 예약 없이 이용, 대기 시간 바로 입장, 가족모임, 연인・배우자",음식이 맛있어요,755,1
592637304,pur****,직원이 친절해요,2024-10-06,저녁에 방문,음식이 맛있어요,1181,5
592637304,jjinjjin70,지난번에 한번가보고 계속 생각나서 또 방문했어요~~ 다른 프차무한리필 고깃집보다 훨~~~씬 고기질도 좋고 맛있어요~~ 배터지게 너무 잘먹었어요ㅎㅎ 사장님도 너~무 친절 하시구 맛있구~~단골예약이요~~!!ㅎㅎ완젼 강추입니당~^^!!!,2024-10-01,"저녁에 방문, 예약 없이 이용, 대기 시간 바로 입장, 데이트, 연인・배우자",음식이 맛있어요,29,1
592637304,yell6471,아는 지인한테 소개 받아서 처음왔는데 웨이팅이 있는맛집이라고 들어서 걱정했는데 웨이팅 없이 입장해서 너무 좋았어요 특히 지인에게 너무 고마울정도로 맛있네요! 수유 골목에 숨겨진 맛집이에요 ㅠㅠ 둘이 먹다가 하나 죽어도 모르겠어요!! 매장도 레트로 느낌이 있어서 쾌적하고 고기는 얼마나 품질이 좋은지 너무너무 맛있는데 무한리필이라니! 왕창 먹었습니다 !! 사장님도 직원분들도 너무 친절하셔서 입은 맛있게 눈은 행복하게 먹었습니다!! 단골 될것같아요 ~ 반찬도 원하는 만큼 제가 가져갈수있어서 알차게 남김없이 먹었습니다 번창하세요 다음에 또 갈게요!!☺️,2024-09-24,"저녁에 방문, 예약 없이 이용, 대기 시간 바로 입장, 나들이, 일상, 친구, 지인・동료",음식이 맛있어요,4,1
592637304,내돈주고 사먹는 래키,역대급 이에요 장사마인드 최고네요 ~!오후8시45분 입장해서  계산하니 오후9시11분에 나왔어요. 목살갈비 먹으러갔는데 안채워주길래 물어보니 없다고하네요. 없으면 그만인건가요????사과한마디 없네요 ~~~~~~~가실분들은 참고하세요.,2024-09-08,"저녁에 방문, 예약 없이 이용, 대기 시간 바로 입장, 친목, 친구",컨셉이 독특해요,442,1
592637304,Diana1757,"⭐️⭐️⭐️⭐️➕ 가성비 굿 눈치 안 보고 편히 돼지, 닭고기 왕창 즐기고 싶으시다면 무조건 가십쇼!",2024-09-08,점심에 방문,음식이 맛있어요,934,1
592637304,김나형33,고기다양하고 맛나요,2024-07-31,"저녁에 방문, 예약 없이 이용, 대기 시간 바로 입장, 데이트, 친구",음식이 맛있어요,727,13
592637304,으메잉,"친절하시고, 가성비 있어요.샐러드바 깔끔하고, 딱 먹을만한 고기종류는 다 있어서 실속있어요! 편안한 분위기 입니다.",2024-07-28,"저녁에 방문, 예약 없이 이용, 대기 시간 바로 입장, 일상, 부모님",친절해요,1475,1
592637304,허어준,아쉽게도 사진을 못 찍었지만 정말 오랜만에 만족한 고기집입니다. 고기 질도 좋았고 처음 먹었던 쫄깃살도 상당한 별미입니다. 다른 고기집과 다르게 와사비도 셀프바에서 먹을 수 있어서 색다르다고 느꼈습니다. 식후에 냉면도 시켰는데 시원하고 맛있었습니다. 무엇보다 무더운 날씨를 가볍게 날릴 수 있는 얼음물이 있다는 점이 제일 좋았습니다. 식사 중 주차 문제가 생길뻔했는데 친절하신 사장님께서 잘 해결해주셔서 다행이었습니다^^ 다음에도 또 갈게요~,2024-06-29,"저녁에 방문, 대기 시간 바로 입장, 친목, 친구",음식이 맛있어요,5,1
592637304,절망뒤의 굶주린 열정,고기부페에서 바질 파스토라니!고기에 진심인 사장님 응원합니다!,2024-06-28,"저녁에 방문, 예약 없이 이용, 대기 시간 바로 입장, 데이트, 연인・배우자",음식이 맛있어요,1277,1
592637304,밍공주s2,"진짜.. 꽁꽁 숨겨두고 싶었던 나의 맛집..젤 많이 갔던 날이 일주일에 세번이나 갔던 집..오빠랑 저의 최애 고깃집이예요,,큰두레를 알게 된 후로 동네 고깃집을 안가요,,싸장님들도 넘 친절하시구고기도 넘 맛있구최고입니당❤️❤️❤️",2024-06-17,"저녁에 방문, 예약 없이 이용, 대기 시간 바로 입장, 데이트, 연인・배우자",친절해요,16,1
592637304,뭐하고있니35,가성비 최고 고기맛 최고 친절하신 직원분들 최고냉면도 찌개도 맛있고 고기많이 먹어도 절대로 눈치안주시고 자상하신 직원분들 감사합니다.,2024-06-02,"저녁에 방문, 예약 없이 이용, 대기 시간 바로 입장, 데이트, 연인・배우자",음식이 맛있어요,517,2
592637304,규디이,무한리필고깃집인데 퀄리티가 대박입니다특히 삼겹살이랑 대패 너무 맛있게 먹었어요셀프바도 깔끔하게 관리되고있었고파채가 진짜 존맛입니다 ㅎㅎ찌개도 시켰는데 건더기 많고 퀄리티 넘 좋았어요!!!수유에 무한리필 고깃집은 큰두레로♡,2024-05-29,"저녁에 방문, 예약 없이 이용, 일상, 연인・배우자",음식이 맛있어요,490,2
592637304,pur****,직원이 친절해요,2024-05-23,저녁에 방문,음식이 맛있어요,1181,4
592637304,RIO43,👍,2024-05-17,"저녁에 방문, 예약 없이 이용, 대기 시간 바로 입장, 데이트, 연인・배우자",음식이 맛있어요,848,2
592637304,고미당,맛있게 잘 먹었습니다,2024-04-10,"저녁에 방문, 예약 없이 이용, 대기 시간 바로 입장, 데이트, 연인・배우자",음식이 맛있어요,764,3
592637304,냠냠쩝쩝뿡,마싯고 친절해서조어요,2024-04-06,"저녁에 방문, 예약 없이 이용, 대기 시간 바로 입장",고기 질이 좋아요,600,1
592637304,Xmas100,가성비가 일단 너무 좋았구요 사장님이 진짜 친절하셨어요 원래 무한리필을 일년에 몇번 안가서 아무데나 쳐서 오고 다시 가는 스타일은 아닌데 여기는 먹으면서도 같이온 언니랑 다시 오자고 할정도였어요 !!,2024-04-05,"저녁에 방문, 예약 없이 이용, 대기 시간 바로 입장, 일상, 친구",음식이 맛있어요,12,1
592637304,김나형33,고기 양념닭갈비. 맛나요,2024-03-26,"저녁에 방문, 예약 없이 이용, 대기 시간 바로 입장, 친목, 친구",음식이 맛있어요,727,12
592637304,모든 내돈내산,음...  개인적으로두번은 안갈듯,2024-03-10,"저녁에 방문, 예약 없이 이용, 대기 시간 바로 입장, 나들이, 연인・배우자, 아이",양이 많아요,201,1
592637304,sos****,맛있어요,2024-03-09,"저녁에 방문, 예약 없이 이용, 대기 시간 바로 입장, 일상, 연인・배우자",음식이 맛있어요,1033,1
592637304,hej****,꼬들살맛있어요,2024-03-09,"저녁에 방문, 예약 없이 이용, 대기 시간 바로 입장, 일상, 연인・배우자",음식이 맛있어요,701,1
592637304,핸즈스토리,엄마랑 맛있게 먹고 왔어요~무한리필이라 그런지 마냥 들어가네요!,2024-02-24,"점심에 방문, 예약 없이 이용, 대기 시간 바로 입장",음식이 맛있어요,1531,1
592637304,백백곤주,친절하시고 맛나옹!!,2024-02-19,점심에 방문,고기 질이 좋아요,676,1
592637304,pur****,직원이 친절해요,2024-02-18,저녁에 방문,음식이 맛있어요,1181,3
592637304,뭐하고있니35,진짜 여기는 강북구 아니 서울특별시 찐맛집 고기부페입니다. 인근 고기부페집과는 고기질이 차원이 다르고 밑반찬도 맛있고 특히 사장님과 직원분들 모두 너무너무너무 친절하셔서 자주자주 오게됩니다. 다른분들도 와보시면 대만족하실겁니다^^ 오늘도 잘 먹고갑니다,2024-02-17,"저녁에 방문, 예약 없이 이용, 대기 시간 바로 입장, 친목, 연인・배우자, 친구",음식이 맛있어요,517,1
592637304,꺄륵짱예쁘다,엉,2024-02-10,"저녁에 방문, 예약 없이 이용, 대기 시간 바로 입장, 데이트, 연인・배우자",고기 질이 좋아요,1380,1
592637304,eh****,굿,2024-02-04,"저녁에 방문, 예약 없이 이용, 대기 시간 바로 입장, 일상, 아이",고기 질이 좋아요,856,5
592637304,상와니2,무한리필점인데 숯불에 구워먹는다는게 너무 좋았어요 고기도 정말 👍 👍 👍 가격도착하구 대만족입니다 친구랑 둘이서 야무지게 먹고나왔습니다 단골될듯 ❤️,2024-01-31,저녁에 방문,음식이 맛있어요,19,1
592637304,초루맘,수유동 들릴일이 생겨서 밥집 찾아보다후기가 좋아 들렸는데 너무 맛나네요!양념은 너무 달지 않고 적당해요!고기 종류도 다양해서 질리지 않게다양하게 먹을 수 있더라구요?그리고 파채 진짜 너무 맛나요!다른 무한리필집은 파채보면직접 양념을 버무려야하기도하고아님 되어있다해도 고추가루랑 식초 베이스라 풋내나거든요근데 여기는 상큼하고 참기름도섞였는지 맛있더라구요파채 별로 안 좋아하는데도맛있게 두번이나 더 갖다 먹었네요그리고 주차장 없는게 문제였지만사장님께서 주차 친절하게 알려주시고식당내부에서도 다들 친절하시고무엇보다 인상이 참 밝으십니다이 가격에 질 좋은 무한리필이라니멀리서 왔는데 맛있게 잘 먹고 갑니다다음에 또 올 일 생기면 무조건 재방문의사 999999% 입니다!!번창하세용😆,2024-01-27,"점심에 방문, 예약 없이 이용, 대기 시간 바로 입장, 데이트, 일상, 연인・배우자",친절해요,22,1
592637304,다이닝15,가성비가 좋은 곳이에요~잘 먹었습니다!,2024-01-24,"저녁에 방문, 예약 없이 이용, 대기 시간 바로 입장, 일상, 연인・배우자",가성비가 좋아요,598,1
592637304,sak****,무한리필인데 숯불에 구워먹을 수 있다는게 놀랍고 고기질도 좋고 국내산고기도 있어서 맘껏 먹고왔어요 무한리필가격치고 저렴한데 고기질도 좋으니 1석2조에요!!,2024-01-15,"점심에 방문, 대기 시간 바로 입장, 친목, 친척・형제",매장이 넓어요,76,1
592637304,u forset,무한리필이여서 가성비로 정말 맛있게 먹었습니다~고기도 다 신선하고 다른 반찬들도 맛있었어요! 특히 양념갈비 최고였습니다!!! 그리고 사장님 사모님 두분다 너무 너무 친절하셔서 더 맛있게 먹고 갔습니다~ 매장도 청결합니다재방문 의사 100프로 입니다!!! 번창하세요☺️,2024-01-11,"저녁에 방문, 예약 없이 이용, 대기 시간 바로 입장, 데이트, 연인・배우자",친절해요,53,1
592637304,enj****,나의 인생맛집♡매일 힘든하루.. 스트레스.. 여기서 고기먹으면서 풀고있어요ㅋㅋ강북에서 소문난 이유는 분명히 있다니깐요~~고기종류가 10가지나 되는데 가격은 만원중반대.. 무한리필..사장님 가격말이안돼요~~~ㅋㅋ,2024-01-07,"저녁에 방문, 예약 없이 이용, 대기 시간 바로 입장, 친목, 나들이, 일상, 친구, 지인・동료",가성비가 좋아요,39,3
592637304,ys_****,큰두레는 뭐 말이 필요한가요 ㅋ ㅋ여기보다 가성비 좋은집은 본적이 없습니당이가격에 이정도면 전국 가성비 맛집입니다 진짜 큰두레는 최고에요~~~~~~~~~~~~,2024-01-07,"저녁에 방문, 예약 없이 이용, 대기 시간 바로 입장, 일상, 친구",음식이 맛있어요,52,8
592637304,lee****,수유맛집 일뜽!!가격미쳤..ㅎ 생생정보에 나온 맛집중에 큰두레가 최고인 듯♡고기 넘 맛있고 친절하시고 ..ㅠ 여기 증말 너무 조아욧 😀,2024-01-06,"저녁에 방문, 예약 없이 이용, 대기 시간 바로 입장, 친목, 일상, 회식, 친구, 지인・동료, 기타",음식이 맛있어요,37,2
592637304,키위짱,고기상태 좋고 가격도 착하고 맛있게 잘 먹엇어요,2024-01-06,"점심에 방문, 예약 없이 이용, 대기 시간 바로 입장, 데이트, 연인・배우자",음식이 맛있어요,659,1
592637304,수정29,잘먹고왔어요.,2023-12-19,"저녁에 방문, 예약 없이 이용, 대기 시간 바로 입장, 데이트, 연인・배우자",고기 질이 좋아요,378,1
592637304,whw****,타 무한리필도 가봤고 했지만 여긴 고기잡내를 떠나서잡내는 당연히 안나고 고기질로 승부를 보네요 와사비 양꼬치시즈닝으로 잘 물리지도 않게신경써주셔서 너무 좋았습니다 사이드 반찬도 배채우는게 아니고 고기로만 승부를 보시는거 같아 이게 바로 고기집 아닌가 생각이 듭니다 너무 잘 먹었습니당,2023-12-06,"점심에 방문, 예약 없이 이용, 대기 시간 바로 입장, 친목, 연인・배우자, 친구",아늑해요,22,3
592637304,지나지롱,항상 맛있고 친절해요!! 추천!!!,2023-12-04,"저녁에 방문, 예약 없이 이용, 대기 시간 바로 입장, 데이트, 친목, 나들이, 일상, 연인・배우자, 친구, 지인・동료",음식이 맛있어요,257,2
592637304,pur****,잘먹어써요~~,2023-12-04,저녁에 방문,음식이 맛있어요,1181,2
592637304,sunsun5733,,2023-12-02,"저녁에 방문, 예약 없이 이용, 대기 시간 바로 입장, 친목, 친구",음식이 맛있어요,1015,1
592637304,김나혁67,무한리필집은 고기가 싼마이 고기를 많이 써서 자주 이용하진 않아요 하지만 티비를 보다 정말 맛있어 보여서 가족들과 이동 했어요 ! 처음에는 불냉면도 먹고 이것도 먹고 저것도 먹어야지 했는데 ..무한리필에 음료수만 먹어도 배가 불러서 ㅎㅎ 무한리필에 음료수만 먹었네욥 ! 내돈내산하면서 가장 만족하면서 먹은 무한리필집 중 하나 입니다.,2023-11-26,"저녁에 방문, 예약 없이 이용, 대기 시간 바로 입장, 데이트, 친목, 나들이, 연인・배우자, 친구, 아이",음식이 맛있어요,152,1
592637304,eve****,고기질이 좋아요 양념도 속까지 잘 베어서 맜있게 먹었어요 침숯이라 다 좋은것 같네여ㅎㅎ 기본 반찬들도 갈비랑 궁합이 좋았어요 또 갈게요~,2023-11-26,"저녁에 방문, 예약 없이 이용, 대기 시간 바로 입장, 데이트, 연인・배우자",음식이 맛있어요,10,1
592637304,개리디터,갈비맛이 달짝하고 부드러워요 가성비는 물론이고 아주 만족스럽네요 위장만 버텨준다면 매일 저녁으로 오고싶어요 고기 퀄리티도 좋고 양념이 잘 벤거 같아요~,2023-11-26,"저녁에 방문, 예약 없이 이용, 대기 시간 바로 입장, 친목, 친구",음식이 맛있어요,451,1
592637304,고미당,너무 맛있고 좋아요 항상 배불리 먹고 갑니다,2023-11-25,"저녁에 방문, 예약 없이 이용, 대기 시간 바로 입장, 데이트, 일상, 연인・배우자",음식이 맛있어요,764,2
592637304,지나지롱,"맛, 질, 친절 모두 갓벽✨✨",2023-11-21,"저녁에 방문, 예약 없이 이용, 대기 시간 바로 입장, 데이트, 친목, 일상, 기념일, 가족모임, 연인・배우자, 친구, 지인・동료",음식이 맛있어요,257,1
592637304,99jaoutsider,대패삼겹 굿,2023-11-10,"저녁에 방문, 예약 없이 이용, 대기 시간 바로 입장, 가족모임, 부모님",양이 많아요,1669,2
592637304,kyungseop79,굿,2023-11-10,"저녁에 방문, 예약 없이 이용, 대기 시간 바로 입장",,938,2
592637304,pur****,맞나게 먹어써요~~,2023-10-23,저녁에 방문,음식이 맛있어요,1181,1
