place_id,nickname,content,date,situations,keywords,review_count,visit_count
1345182284,soo****,생선잘먹고 왓네요~~  맛있어요 추천합니다^^,2024-09-07,"점심에 방문, 예약 없이 이용, 대기 시간 10분 이내, 친목, 지인・동료",음식이 맛있어요,1144,1
11848895,kong5791,가족이랑 식사하러 예약 후 방문했어요!서버님들이 다 너무 친절하셔서 즐거운 식사자리가 될 수 있었어요:)저희 담당서버님 성함 좀 보려고 몇 번 기웃했는데 어두워서 잘 안보여서 남기지 못했네요ㅠㅠ2층에 여자 서버분이셨는데 정말 친절하셨습니다 근사한 서비스 감사합니다!,2025-04-06,"점심에 방문, 예약 후 이용, 대기 시간 바로 입장, 일상, 연인・배우자, 아이, 친척・형제",친절해요,118,2
11848895,마마95,예약하고 가서 기다리지 않고 먹을 수 있어서 좋았어요~저번보다 주말인데도 음식 나오는 속도도 좋았고 무엇보다 일하시는분들이 친절하셔서 항상 기분 좋게 외식하는 곳이 되었네요~,2025-04-06,"점심에 방문, 예약 후 이용, 대기 시간 바로 입장, 가족모임, 연인・배우자",단체모임 하기 좋아요,56,4
11848895,히슬그르링,가족들이랑 저녁 넘 맛있게 먹었어요~,2025-04-04,"저녁에 방문, 예약 후 이용, 대기 시간 바로 입장, 일상, 기념일, 가족모임, 부모님, 친척・형제",음식이 맛있어요,1247,3
11848895,yjae94,오랜만에 맛있게 잘먹었습니다👍,2025-03-31,"저녁에 방문, 예약 없이 이용, 대기 시간 바로 입장, 일상, 부모님",음식이 맛있어요,234,2
11848895,yaklober1122,런치메뉴 가끔 생각나 가는데 현대카드 M포인트까지 사용해서 결제되니 좋아요. 직원들 친절하고 2층까지 넓어서 좋네요.,2025-03-29,"점심에 방문, 예약 후 이용, 대기 시간 바로 입장, 일상, 연인・배우자",음식이 맛있어요,64,3
11848895,kyung9988,"스테이크랑 파스타 신메뉴로 먹어봤어요스테이크는 할라피뇨가 있어서 덜 느끼해서 좋았고, 파스타는 기본 투움바가 저는 더 맛있는 것 같아요!예약 후 빠르게 입장했고, 직원분들 모두 친절히 응대해 주셨습니다!",2025-03-27,"점심에 방문, 예약 후 이용, 대기 시간 바로 입장, 가족모임, 부모님",음식이 빨리 나와요,25,11
11848895,글쓰90,"베이비백립과 투움바 파스타(부라타 치즈 버전)을 주문했습니다. 음식 나오는데는 시간이 꽤 걸렸습니다. 베이비백립에 감자튀김 사이드로 했는데, 감자튀김은 눅눅했고 베이비백립도 따뜻하긴 했으나 아주 따뜻한 느낌은 아니였습니다.자리배치는 주방쪽에 출입문 옆쪽이었는데 사람들이 자주 들락날락하다보니 서늘했고 음식도 빠르게 식은 느낌입니다. 매장환경 상 어쩔 수 없다면 음식을 중도에 데워주는 걸 물어봐주거나 음식을 더 따뜻하게 서빙하시거나 해야할 거 같습니다. 그릇이 따뜻하게 나오는 건 알고있으나 그걸론 역부족이었습니다. 파스타는 양이 좀 줄어든거 같았고요. 100%중 60-70% 수준의 만족도였습니다. 서버분들은 매우 친절하셨습니다.",2025-03-23,"저녁에 방문, 예약 없이 이용, 대기 시간 바로 입장, 일상, 친척・형제",매장이 넓어요,47,2
11848895,Mars 2050,"7프리미어에디션, 갈릭립아이,오지치즈후라이즈, 치킨텐더샐러드. 모두 최애 메뉴로. 즐거운 모임~~강추.",2025-03-23,"저녁에 방문, 예약 후 이용, 대기 시간 10분 이내, 친목, 친척・형제",음식이 맛있어요,100,1
11848895,딩키75,토마호크 굽기도 적당하고 맛있어요.👍 스파이시투움바도 매콤해서 끝까지 먹을수 있어요..넘 맛있게 배부르게 잘 먹었습니다^^,2025-03-23,"점심에 방문, 예약 후 이용, 대기 시간 바로 입장, 친목, 친구",음식이 맛있어요,474,2
11848895,채영맘8,맛있어요,2025-03-23,"점심에 방문, 예약 후 이용, 대기 시간 바로 입장, 친목, 지인・동료",음식이 맛있어요,27,1
11848895,뀨르귤,오랜만에 방문했는데 여전히 맛있습니당:)직원분들도 친절하세요💓,2025-03-23,"점심에 방문, 예약 후 이용, 대기 시간 바로 입장, 기념일, 부모님",음식이 맛있어요,158,3
11848895,마마95,주말이라 사람이 많아서 음식이 좀 늦게 나오긴 했지만 유모차 자리도 마련해주시고 친절하고 가족모임하기 좋아요~ 그런데 주말에는 직원이 더 있어야 될 거 같긴해요~,2025-03-22,"점심에 방문, 예약 후 이용, 대기 시간 10분 이내, 일상, 기타",단체모임 하기 좋아요,56,3
11848895,LO315,좋아요,2025-03-21,저녁에 방문,친절해요,964,1
11848895,MIMI3843,"스테이크가 먹고싶었는데 마침 신세계 상품권이 있어 방문했습니다새우살이 맛있어서 토마호크로 예약했습니다최저가 760g이라서 미리 중량선택 했고미디움레어로 하면 처음엔 핏물이 나온다 싶다가도 뜨거운 접시에 금방 다 웰던 됩니다다만 오늘은 담당 서버를 잘못 만난것 같아요스테이크 소스, 피클을 요청했으나 같이 요청한 옆 테이블만 갖다주고 저희는 잊었더라구요그래서 지나가는 다른 직원에게 부탁해서 바로 받아볼 수 있었습니다아웃백은 필요한 게 있을때마다 지나가는 직원에게 도움의 눈빛을 보내야 하는 부분이 참 불편해요다 먹고 후식 요청하고 싶은데 지나가는 직원에게 손 들고 저기요 불렀더니 그냥 쌩 지나가고..아웃백도 벨이나 키오스크가 있었음 좋겠네요잘 먹었습니다",2025-03-21,"저녁에 방문, 예약 후 이용, 대기 시간 10분 이내, 일상, 부모님",매장이 넓어요,116,2
11848895,메리미민,예전 런치메뉴가 재개되서 너무나 만족스러운 점심 이였습니다치킨텐더 찹스테이크 👍🫶생일이라 기념사진두 찍어주심,2025-03-21,"점심에 방문, 예약 후 이용, 대기 시간 바로 입장, 친목, 지인・동료",음식이 맛있어요,117,2
11848895,Linas,메뉴가 다양해서 좋아요,2025-03-20,"저녁에 방문, 예약 후 이용, 대기 시간 바로 입장, 친목, 지인・동료",음식이 맛있어요,1726,7
11848895,bkywwm,,2025-03-20,"점심에 방문, 예약 없이 이용, 대기 시간 바로 입장",음식이 맛있어요,927,2
11848895,슈슈6713,너무 행복한 시간이었고 맛있는 식사를 하였습니다. 감사합니다^^,2025-03-16,"점심에 방문, 예약 후 이용, 대기 시간 바로 입장, 기념일, 연인・배우자",음식이 맛있어요,36,3
11848895,리아8970,아웃백은 역시 스테이크가 맛있어요각자 고기만 실컷 먹고 왔네요맛있고 친절했어요부시맨빵도 부드럽고 좋네요,2025-03-15,"저녁에 방문, 예약 후 이용, 대기 시간 바로 입장, 친목, 연인・배우자",음식이 맛있어요,702,2
11848895,희망18,음식도 맛있고 분위기가 차분하고 좋아요특히 남자 직원분이 너무 친절하게 응대해주셔서 더 좋았던것같아요,2025-03-15,"점심에 방문, 예약 후 이용, 대기 시간 바로 입장, 가족모임, 연인・배우자",음식이 맛있어요,37,1
11848895,coal,ㄱㅅ,2025-03-14,"점심에 방문, 예약 없이 이용, 대기 시간 바로 입장, 데이트, 연인・배우자",음식이 맛있어요,1817,2
11848895,캔디걸78,,2025-03-13,"저녁에 방문, 예약 후 이용",음식이 맛있어요,1558,2
11848895,sjson04,친절해요,2025-03-11,"저녁에 방문, 예약 없이 이용, 대기 시간 10분 이내, 나들이, 연인・배우자",음식이 맛있어요,905,2
11848895,min0808,담당 서버분이 친절하게 챙겨주셔서 편하게 잘 먹고 왔어요! 투움바파스타 그리고 짐붐바스테이크 런치로 가니 수프랑 에이드도 나와서 좋네요 ㅎㅎㅎ,2025-03-11,"점심에 방문, 예약 없이 이용, 대기 시간 바로 입장, 부모님",음식이 맛있어요,1534,1
11848895,elle5793,친절하고 맛있오요~~,2025-03-09,"저녁에 방문, 예약 후 이용, 대기 시간 바로 입장, 데이트, 연인・배우자",음식이 맛있어요,270,1
11848895,dkm2000,"오랜만에 모임이라 맛있는 음식과 함께 즐거운 시간 되었어요. 음료 리필도 물어봐주시고, 친절해서 좋았어요.",2025-03-09,"점심에 방문, 예약 후 이용, 대기 시간 바로 입장, 친목, 지인・동료",음식이 맛있어요,17,1
11848895,해피미일,모임하러 방문했는데 좋았어요!예약도 가능하고 배터지게 먹고왔네여!직원분들도 친정하세요💓🙆🏻‍♀️다음에 또 방문 할게여 ㅎㅎㅎ,2025-03-09,"점심에 방문, 예약 후 이용, 대기 시간 바로 입장, 친목",매장이 넓어요,134,1
11848895,맛포동,이 날 정신없어서 사진을 못찍었지만리뷰를 꼭 남기고 싶어서 남깁니다.기념일 날 부모님 모시고 방문했어요.간만의 아웃백이라 메뉴 고르는데 정말 많이 헤맸는데담당 서버님이 정말 잘 추천해주셔서너무 좋은 식사자리를 하고 왔습니다.닉네임을 봤어야 했는데 정확친 않지만장미?였던 것 같아요.매장 매니져님 보신다면 꼭 이 직원 칭찬해주셨으면 좋겠어요.다른 직원분들도 너무 친절하셨고재방문 의사 200%입니다.,2025-03-08,"점심에 방문, 예약 후 이용, 대기 시간 바로 입장, 기념일, 부모님",음식이 맛있어요,256,1
11848895,apa****,"아웃백런치세트 맛있고, 가성비 좋아요!",2025-03-05,"점심에 방문, 포장·배달 이용, 대기 시간 바로 입장, 일상, 혼자",음식이 맛있어요,1438,8
11848895,asu****,맛있어요,2025-03-03,"점심에 방문, 예약 없이 이용, 대기 시간 바로 입장, 일상, 연인・배우자",음식이 맛있어요,2806,17
11848895,strolling snail,먹은걸 다 찍었어야는데 사진이 요거밖에 없네요~~언제가도 맛있고 즐겁게 먹고 오는곳입니다.직원분들의 친절함은 두말알것없구요~애기들이 빵을 좋아해서 요리 나어기전에 빵을 엄청 먹었어요~~집에 오는길에도 넉넉히 빵을 포장해주셨어요~유치원 조카들이 있어 중간중간 계속 물티슈며 물이며 주문했는데 역시 친절한 아웃백 직원분들~~감사한 마음으로 맛나게 먹고 왔어요~,2025-03-03,"점심에 방문, 예약 후 이용, 대기 시간 바로 입장, 가족모임, 연인・배우자, 아이, 친척・형제",음식이 맛있어요,82,1
11848895,드르릉50,예약하고 이용할수있어서 좋아요~ 주차장 있고 직원분들이 정말 친절하십니다 ㅎㅎ,2025-03-02,"점심에 방문, 예약 후 이용, 대기 시간 바로 입장, 가족모임, 부모님, 친척・형제",음식이 맛있어요,87,4
11848895,BBO54,아침에 급 아웃백이 땡겨서 오픈 시간 맞춰 갔어요.갈 때마다 항상 친절하셔서 기분 좋게 잘 먹고 왔어요.,2025-03-02,"점심에 방문, 예약 없이 이용, 대기 시간 바로 입장, 일상, 부모님",음식이 맛있어요,798,7
11848895,x쩡이x,아웃백 정말 좋아하고! 아웃백 정말 많이가봤는데요!이렇게 맛있고 친절한 지점은 노원점이 처음인 것 같아요🫢식사 내내 넘 만족스러워서 리뷰 남기는것도 처음이에요..🩷성함은 기억이 잘 안나지만 정ㅈㅇ 직원님 넘 친절하시더라구요..! 덕분에 음식들도 맛있는데 친절하시기까지 해서 맛도리가 더 맛도리가 되었어요 🐶맛도리!!!!메뉴들 간도 딱 맞구 젤 기억에 남는 아웃백일것같아요ㅎㅎ앞으로도 간다면 노원점으로만 방문하고싶을정도에요 🫶🏻넘 맛있게 행복 가득하게 잘먹었습니다!,2025-03-01,"저녁에 방문, 예약 후 이용, 대기 시간 바로 입장, 가족모임, 친척・형제",단체모임 하기 좋아요,46,1
11848895,아자타파하,음식 맛있었어요다만 지나친 특정 스테이크 영업은 지양했으면 좋겠습니다,2025-03-01,"저녁에 방문, 예약 후 이용, 대기 시간 바로 입장, 가족모임, 부모님",음식이 맛있어요,72,3
11848895,nam****,"서비스, 맛 모두 괜찮아요",2025-03-01,"점심에 방문, 예약 후 이용, 대기 시간 바로 입장, 가족모임, 아이",음식이 맛있어요,13,1
11848895,뒹글곰67,가끔 방문하는 곳입니다. 커피까지 한 번에 해결 가능해서친구들과 방문할때 강추드립니다.,2025-02-27,"점심에 방문, 예약 후 이용, 대기 시간 바로 입장, 친목, 친구",음식이 맛있어요,61,1
11848895,대기업회장엄마,🍓대기업회장엄마🍓우리 큰아들 좋아하는 ⭕️아웃백 노원점⭕️투움바파스타랑🍝 짐붐바스테이크🥩짐붐바스테이크는 굽기 조절이 안되는 메뉴인데이날은 더 구워진거 같아요.그래도 투움바파스타를 워낙 좋아해서 맛있게 먹더라고요 우리아들❤,2025-02-27,"점심에 방문, 예약 후 이용, 대기 시간 바로 입장",음식이 맛있어요,1836,8
11848895,아카이모모,남자매니저분인지 넘넘 친절하셔서 편하게 식사했어용^^,2025-02-26,"점심에 방문, 예약 없이 이용, 대기 시간 바로 입장, 나들이, 친척・형제",음식이 맛있어요,1724,1
11848895,bkywwm,,2025-02-26,"점심에 방문, 예약 없이 이용, 대기 시간 바로 입장",음식이 맛있어요,927,1
11848895,부뚜막야옹,"스테이크와 파스타 등 메뉴 알차게 먹었는데 첨에 주문할때 벨도 없고 주문하기 위해 한참을 두리번거려야 했네요~;;리뷰가 좋아 찾아서 갔던 곳인데 자리도 비좁고 재방문은 없을 듯 합니다. 다만, 매니저급 친절한 직원분 한분으로 마지막 이미지는 좋게 남은 듯요~^^",2025-02-26,"점심에 방문, 예약 없이 이용, 대기 시간 바로 입장, 기념일, 아이, 부모님",메뉴 구성이 알차요,369,1
11848895,oxt****,퀸즈랜드립아이. 레어. 헤헤스파이시 투움바. 🌶 🌶 🌶 레몬치킨 리조또.  👶 초코렛썬더프롬다운.  ☺️ 휘핑을 아이스크림으로 변경. 눈이 번쩍,2025-02-23,"점심에 방문, 예약 없이 이용, 대기 시간 바로 입장, 일상, 연인・배우자, 아이, 부모님",음식이 맛있어요,1469,13
11848895,davekim,굿,2025-02-21,"저녁에 방문, 예약 없이 이용, 대기 시간 바로 입장, 데이트, 연인・배우자",음식이 맛있어요,947,2
11848895,저무는꽃등심,비싸요ㅠㅠㅠㅠㅠ 많이ㅠㅠㅠㅠㅠ 자주 먹기에는 왕부담ㅠㅠㅠㅠㅠ,2025-02-21,"점심에 방문, 예약 후 이용, 대기 시간 바로 입장, 가족모임, 연인・배우자",친절해요,263,1
11848895,take5,아웃백 런치 사랑합니다 ㅋㅋㅋㅋ양은 예전보단 줄어든것 같지만여전히 맛잇어요,2025-02-21,"점심에 방문, 예약 후 이용, 대기 시간 바로 입장, 친목, 지인・동료",음식이 맛있어요,378,1
11848895,joy****,예전보다 가격은 많이 올랐지만 서비스 및 고객 응대가 좋아서 괜찮았습니다,2025-02-20,"저녁에 방문, 예약 없이 이용, 대기 시간 10분 이내, 가족모임, 연인・배우자",음식이 맛있어요,70,1
11848895,heu****,,2025-02-20,"점심에 방문, 예약 후 이용, 대기 시간 바로 입장, 가족모임, 아이, 부모님, 친척・형제",음식이 맛있어요,1535,1
11848895,유니콩98,"중학교때부터 노원역 패밀리레스토랑으로 저희 가족도 몇번 방문해서 사진도 찍고 추억이 있는 아웃백 노원점! 가족 행사가 있어서 예약 후 오랜만에 방문했어요. 매니저분, 서버분들 친절하셨고, 스테이크도 적당하게 요청한 굽기에 잘 맞춰나와 역시 스테이크하우스였습니다. 특히 가족 사진 찍어주시고 인화해주셔서 감사합니다. 음식도 음식이지만 이런 서비스 좋아요. 통신사 할인도 쏠쏠하네요. 가끔씩 모임 장소로 가려고합니다~",2025-02-16,"저녁에 방문, 예약 후 이용, 대기 시간 바로 입장",음식이 맛있어요,218,1
11848895,영영2951,입장할때 사람이 워낙 많아서 정신이 없었는데 담당서버님이 친절하셔서 그래도 편하게 먹고왔습니다:),2025-02-15,"점심에 방문, 예약 후 이용, 대기 시간 10분 이내, 데이트, 연인・배우자",메뉴 구성이 알차요,117,1
11848895,pooh7998,"토아호크, 710g 2명이 배터지도록 먹었습니다. 서버들도 친절해요..",2025-02-14,"저녁에 방문, 예약 후 이용, 대기 시간 바로 입장, 데이트, 친구",친절해요,19,1
11848895,제주 스텔스,군대간 아들이 휴가나와서 간곳오래간만에 아웃백에서 맛나게 먹었어요역시 부쉬맨브레드 최고친절하시고 설명을 잘 해주셨어요,2025-02-12,"저녁에 방문, 예약 없이 이용, 대기 시간 10분 이내, 일상, 연인・배우자, 아이",음식이 맛있어요,620,1
11848895,리사78,자리도 좁고 가격은 비싼싸네요!,2025-02-12,"점심에 방문, 예약 없이 이용, 대기 시간 30분 이내",,461,1
11848895,antu4610,아이 졸업이라서 갔는데 어른들 먹기엔 좀 그렇네요,2025-02-12,"점심에 방문, 예약 없이 이용, 대기 시간 30분 이내, 가족모임",,275,1
11848895,레몽레몬,오랜만에 아웃백 가서 맛있게 먹었습니다~,2025-02-11,"저녁에 방문, 예약 후 이용, 대기 시간 바로 입장, 친목, 일상, 가족모임, 부모님",음식이 맛있어요,431,1
11848895,풍류길손,"가족들과 함께 🍖아웃백 스테이크 하우스 노원점🍖오랜만에 방문한 아웃백, 역시 명성에 걸맞는 서비스와 퀄리티 높은 메뉴가 가족 모두에게 행복한 시간을 선사합니다. 😀성인 가족 4명이 포만감을 충분히 느낄 수 있는 푸짐한 양과 모든 음식이 남다른 맛을 품고 있어 만족스러운 식사가 됩니다. 👍자주 방문할 수 있는 곳은 아니지만 꼭 다시 방문하고 싶은 멋진 아웃백입니다. ❤️🧡💛💚💙",2025-02-11,"저녁에 방문, 예약 없이 이용, 대기 시간 바로 입장, 일상, 연인・배우자, 아이",음식이 맛있어요,309,1
11848895,마초7350,부모님이 아웃백 드시고 싶다해서 환갑기념 저녁식사했어요! 넘 맛있다고 하셨어요😊 그리고 영수증에 서버분이 bibi 라고 적혀있는데 엄청 친절하셨거든요...?! 이분 맞으실까요!! 진짜 센스있게 주문 받아주시고 짱짱❤️ 다른 남자 서버분도 친절하셨어요 2층 이용했습니다!,2025-02-08,"저녁에 방문, 예약 후 이용, 대기 시간 바로 입장, 기념일, 부모님",음식이 맛있어요,378,1
11848895,오디로든가보자,[아웃백 노원점]🪄랍스타커플세트/스파이시 투움바/씨푸드아라비아따⭐️친구 생일파티는 역시 아웃백스테이크는 좋은 굽기로 질기지 않고 너무 맛있어요🥩파스타는 소스 맛에 더 후루룩 먹었어요🍝🍅해산물들이 전체적으로 통통했고역시 부시맨 브레드는 퐁신하고 따끈해서 스프레드 듬뿍 얹어 먹어서 더더더 짱맛이었어요😋,2025-02-07,"저녁에 방문, 예약 후 이용, 대기 시간 바로 입장, 기념일, 친구",인테리어가 멋져요,124,1
11848895,hap****,아이가 스테이크 좋아해서 자주가요음식이맛있어요,2025-02-07,"점심에 방문, 예약 후 이용, 대기 시간 바로 입장, 친목, 아이",음식이 맛있어요,974,5
11848895,임팩트만,런치세트로 갈릭립아이와 투움바파스타 주문해서 먹었습니다 ~~ 생일이라 방문하였는데 만족합니다 !,2025-02-06,점심에 방문,음식이 맛있어요,888,5
11848895,binsa100122,지하철근처라 아주편리합니다,2025-02-04,"점심에 방문, 예약 후 이용, 대기 시간 바로 입장, 친목, 지인・동료",가성비가 좋아요,291,1
11848895,민트향01,직원분들이 친절하시고 혼자 방문해도 부담없이 먹을수 있어서 좋아요 고기굽기 체크나 부족한거 있는지 체크 잘해주셔서 편안하게 식사할수있어서 좋습니다 다만 달링포인트스테끼는 420g이라 혼자 먹기엔 대식가가 아니고서야 무리네요ㅠㅋㅋㅋㅋㅋㅋ 음식맛있고 편안하게 식사할수있어서 재방문 예정이요,2025-02-02,"저녁에 방문, 예약 없이 이용, 대기 시간 바로 입장, 일상, 혼자",음식이 맛있어요,343,3
11848895,Fhdla,좋아요,2025-02-01,저녁에 방문,인테리어가 멋져요,947,1
11848895,yaklober1122,런치 이용하기 너무 좋네요 네이버에서 미리 예약 후 바로 입장했어요.  파스타 매운맛에 얇은면 바꾸니  너무 맛있고 고기도 사이드인 고구마도 너무 맛있어요.  둘이 먹기 배 불러요. 직원분들 친절하고 분위기 아늑하니 가족하고 밥먹기 좋아요.,2025-01-31,"점심에 방문, 예약 후 이용, 대기 시간 바로 입장, 일상, 아이",음식이 맛있어요,64,2
11848895,vc****,항상 맛있고 가성비 좋습니다. 아웃백 예약도 편하고 좋네요. 추천,2025-01-30,"점심에 방문, 예약 후 이용, 대기 시간 바로 입장, 친목, 아이, 부모님, 친척・형제",음식이 맛있어요,23,3
11848895,은8469,영화보러 왔다가 근처에 있는 아웃백 갔는데 직원분들이 다 친절하셔서 더 좋았어요! 재방문 의사 있습니다ㅎㅎ,2025-01-28,"점심에 방문, 예약 없이 이용, 대기 시간 10분 이내, 여행, 친척・형제",친절해요,15,1
11848895,ju0622,,2025-01-27,"점심에 방문, 예약 후 이용, 대기 시간 바로 입장, 데이트, 친목, 기념일, 연인・배우자, 지인・동료",음식이 맛있어요,1253,9
11848895,아침인사8263,"매우 오랜만에 빵 먹으러 들렀습니다.예산이 초과되어 6명(아이2) 먹는데 50정도 나왔지만,와인도 괜찮았고 고기도 맛있게 배부르게 먹었네요.다음에늠 점심 세트로 가야겠네요 ㅎㅎ",2025-01-25,"저녁에 방문, 예약 후 이용, 대기 시간 10분 이내, 가족모임, 연인・배우자, 아이, 부모님",음식이 맛있어요,14,1
11848895,찬무지,"특별한 날이면 방문하는 아웃백..!제가 토마호크를 너무 좋아해서 여유가 있으면 와서 즐기게 되는 것 같습니다.7 프리미어로 주문 했는데, 솔직히 킹프라운의 메리트는 크게 없는 것 같고요 ㅎㅎ..머리까지 꽉찬 살이 좋긴 한데 생각보다 빠르게 식어서 맛이 아쉬웠습니다.차라리 일반 토마호크 세트에 다른 스테이크를 추가 주문하는 게 더 좋겠더라고요!그래도 6인 예약으로 2층 이용하니 훨씬 널찍하고 조용해서 좋았습니다~~",2025-01-25,"저녁에 방문, 예약 후 이용, 대기 시간 바로 입장, 기념일, 부모님, 친척・형제",음식이 맛있어요,44,1
11848895,엔젤5352,,2025-01-25,"점심에 방문, 예약 후 이용, 대기 시간 바로 입장, 가족모임",음식이 맛있어요,2953,4
11848895,duf****,"베이비백립, 스파이시투움바파스타, 치킨텐더샐러드 모두 다 너무 맛있어요😉🤎🤎아웃백 너무 좋아해요~~~",2025-01-25,"점심에 방문, 예약 후 이용, 대기 시간 바로 입장, 가족모임, 부모님, 친척・형제",차분한 분위기에요,279,2
11848895,안젤라헨,아웃백 정말 오랜만에 가봤어요혹시나 해서 하루전날 예약하고 평일 런치 이용했습니다. 런치세트~  오호  스프부터 커피까지^^아웃백 가입해서 신규회원 웰컴치킨텐더 쿠폰사용했어요둘이서 ㅋㅋ 양이 무지 많아요~~음료도 탄산으로 한번 더 리필가능하고 커피는 테이크아웃 했답니다역시나 친절하시공~~다음에도 런치세트로 먹으러 와야겠어요~~,2025-01-24,"점심에 방문, 예약 후 이용, 대기 시간 바로 입장, 친목, 친구",음식이 맛있어요,194,1
11848895,seinsen,너무 맛있어요! 🤤,2025-01-23,"저녁에 방문, 예약 후 이용, 대기 시간 바로 입장, 가족모임, 부모님",친절해요,14,1
11848895,BBO54,오늘은 코코넛쉬림프 먹고싶어서 갔어요평일 런치임에도 불구하고 대기가 있어서 예약하고 가는걸 추천합니다 ^^,2025-01-23,"점심에 방문, 예약 후 이용, 대기 시간 바로 입장, 일상, 아이, 부모님",음식이 맛있어요,798,6
11848895,체리쉬4569,역시 아웃백은 투움바가 짱이네요!! 소스 더 달라고 말씀드리면 더 주셔서 넘 좋았어요!! 다음에 또 가고 싶네요ㅎㅎㅎ,2025-01-22,"점심에 방문, 예약 후 이용, 대기 시간 바로 입장, 일상, 친척・형제",친절해요,146,1
11848895,둠칫37,아이와 부모님 모시고 갔는데 저희테이블 담당해주신 직원분 너무 친절하셨어요! 덕분에 기분좋게 잘먹고 왔습니다^^,2025-01-20,"저녁에 방문, 예약 후 이용, 대기 시간 바로 입장, 가족모임, 아이, 부모님",음식이 맛있어요,38,1
