place_id,nickname,content,date,situations,keywords,review_count,visit_count
1675790428,밍지 에오,"분위기부터 시작해서 내부 인테리어, 음식 맛 비주얼 다 대박인 곳입니다…!❤️기념일에 무조건 갈 것 같아용강추합니다!!!!!",2025-01-24,"점심에 방문, 예약 후 이용, 대기 시간 바로 입장, 데이트, 연인・배우자",인테리어가 멋져요,97,1
1675790428,Seonni,"분위기가 너무너무 좋은 한강진 맛집 라인드 한남!!여기 공간이 고급스럽고 깔끔해서 데이트 하거나 소개팅하기에 딱 일 것 같아요ㅎㅎ식전빵이 따뜻하고 바삭해서 메인 파스타가 정말 기대되었는데, 대박...!잣을 곁들인 관자 오일 파스타는 루꼴라의 상큼함과 잣의 향이 올라와 감칠맛이 너무 좋았고 해산물 토마토 스튜&숏파스타는 파스타 면의 씹는 맛이 매력적이었고해산물의 신선함이 가득 느껴졌어요~두 파스타 모두 해산물이 아낌없이 들어가 새우살, 관자살, 조개살이 입안 가득 향을 품으며 탱글하게 터졌어요><면과 해산물의 밸런스가 👍🏻데이트/기념일/소개팅 장소로 추천드려요💕",2025-01-23,"저녁에 방문, 예약 후 이용, 대기 시간 바로 입장, 친목, 친구",음식이 맛있어요,51,1
1675790428,젊은남자tm,유럽풍 인테리어가 근사함음식이 다소 가격이 있으나 맛있고 정결함해산물 칸넬노니소꼬리찜 리조또 맛있어요,2025-01-21,"저녁에 방문, 예약 후 이용, 대기 시간 바로 입장, 친목, 지인・동료",음식이 맛있어요,61,1
1675790428,풀한포기,"너무 맛있어요~한남동 맛집 소개할때 꼭 추가하는 곳이에요^^깐넬로니도 맛있고,리조또류도 맛있어요!무도 수제 총각무 피클이라 맛있어요~",2025-01-20,"점심에 방문, 예약 후 이용, 대기 시간 바로 입장, 친목, 지인・동료",매장이 청결해요,14,1
1675790428,별명은별명이지,매장 사진하고 분위기가 많이 달라서 당황하긴했는데.. ㅋㅋㅋ 한남동 레스토랑 느낌은 아니고 가성비있는 20대 커플용 식당 느낌. 다행히 음식이 맛있어서 커버됬어요👏,2025-01-19,"저녁에 방문, 예약 후 이용, 대기 시간 바로 입장, 가족모임, 부모님",음식이 맛있어요,9,1
1675790428,S bin,"저번에 다녀오고 너무 만족하며 재방문한곳에요 맛 , 분위기 , 친절함 모두 두루 갖춘 곳입니다 다 맛있지만 뇨끼는 정말 강추해요 ... 🫶🏻💗",2025-01-19,"점심에 방문, 예약 후 이용, 대기 시간 바로 입장, 데이트, 연인・배우자",친절해요,7,2
1675790428,싸우디71,정말 맛있었어요 특히 우니파스타,2025-01-18,"저녁에 방문, 예약 없이 이용, 대기 시간 바로 입장, 데이트, 연인・배우자",음식이 맛있어요,13,1
1675790428,ana****,맛있고멋진 인테리어에요,2025-01-16,"저녁에 방문, 예약 후 이용, 대기 시간 바로 입장, 데이트, 연인・배우자",음식이 맛있어요,18,1
1675790428,박하스63,문어구이는 메쉬드포테이토와 함께 나오는데요. 질기지 않고 딱! 맛나게 구워졌어요.새우샤프란리조또에는 진짜 새우가 듬뿍 들어있고요. 음식들이 하나같이 진짜 리얼리로 맛나요! 한남동 맛집추천해요,2025-01-16,점심에 방문,음식이 맛있어요,1563,2
1675790428,NO22엘빠,생일에 와이프랑 맛있고 좋은시간을 보냈습니다.좋은날과 함께해서 즐거웠습니다.,2025-01-12,"저녁에 방문, 예약 후 이용, 대기 시간 바로 입장, 기념일, 연인・배우자",음식이 맛있어요,21,1
1675790428,yu****,분위기도 맛도 최고!,2025-01-12,"점심에 방문, 예약 후 이용, 대기 시간 바로 입장, 데이트, 연인・배우자",음식이 맛있어요,54,1
1675790428,hanah57,재료가 신선하고 맛있었어요!새우리조또 강추합니다~,2025-01-11,"점심에 방문, 예약 후 이용, 대기 시간 바로 입장, 가족모임, 부모님, 친척・형제",아늑해요,17,1
1675790428,박블리25,"분위기도 좋고 너무 맛있어요!!랍스터 로제 파스타,트러플 감자뇨끼,새끼 한치 먹었는데 다 만족! 다음에 또 먹으러 오겠습니다🙏🏻🩷",2025-01-11,"점심에 방문, 예약 후 이용, 대기 시간 바로 입장, 데이트, 연인・배우자",음식이 맛있어요,27,1
1675790428,son****,음식 맛있었습니다 :),2025-01-08,"점심에 방문, 예약 후 이용, 대기 시간 바로 입장, 기념일, 친구",친절해요,29,1
1675790428,HYEONG TAE,"여기 트러플 감자뇨끼(3만5천),행궁동 하우스 플랜비 뇨끼보다 한 수 위에요~ 예약없이 찾아와서 먹고 가는데, 스프도 부드럽고, 뇨끼가 꼭 휴게소 알감자를 부드럽게 해준 것처럼 맛이 너무 행복했어요🥰~디저트 티라미수는(1만4천) 모든 세상 근심 걱정을 잊게하는 치유의 맛입니다! 텁텁하지 않고, 부드러운 생크림과 같이 티키타카치는 콜라보의 맛! 내일 월요일을 즐겁게 보낼 수 있을 듯해요고맙습니다요~직원분들의 친절 응대🫡(매니저님 감사용)",2025-01-05,"저녁에 방문, 예약 없이 이용, 대기 시간 바로 입장, 나들이, 혼자",음식이 맛있어요,569,2
1675790428,백열심,리뷰가 대부분 광고성으로 보여서 분위기만 좋고 음식은 별로면 어쩌나 걱정했는데 맛있었어요! 가격대가 조금 있지만 좋은 사람하고 좋은 시간 보내기 좋은 공간이라고 생각해요ㅎㅎㅎ,2025-01-04,"저녁에 방문, 예약 후 이용, 대기 시간 바로 입장, 데이트, 친목, 친구",음식이 맛있어요,115,1
1675790428,me5115,맛있게 먹었어요!잘 먹고 갑니다:)기념일에 꼭 오세요!,2025-01-04,"저녁에 방문, 예약 후 이용, 대기 시간 바로 입장, 데이트, 친목, 나들이, 연인・배우자",음식이 맛있어요,42,1
1675790428,유키냥이집사16,"음,, 분위기만 보고 간다면 오케이 음식맛은 이 가격에는 아주 많이 아쉽네요시저샐러드, 관자 오일 파스타는 비추어니언스프는 맛있었어요가격과 분위기에 비해 직원분들의 서비스가 많이 아쉬웠습니다. 서비스를 받는 느낌이 없었어요 ㅎㅎ그래서 빠르게 있다 나왔네요.어차피 이용시간도 2시간 안쪽이고 추가 오더 및 주방 마감을 안내해주시는분이 저희말을 듣지도 않고 본인 할 이야기만 툭하고 가버리는 그 애티튜드가 인상깊었습니다 눈을 돌려가며 기분 언짢은 표정을 지으셨는데 당최 이유는 모르겠어요^^캐치테이블 및 리뷰는 모두 디저트를 주면 쓰는 리뷰라 찐리뷰 걸러 보고 가시는거 추천임당",2025-01-04,"점심에 방문, 예약 후 이용, 대기 시간 바로 입장, 친목, 친구",,46,1
1675790428,밤바라밤밤밤,하… 인테리어에 낚였던곳이네요리뷰를 뒤늦게 쓰는데 이유는 제가 다음에 실수로 또 갈까봐 제가 읽으려고 씁니다뇨끼 안파시는걸 추천드립니다스테이크 종류가 하나에요 직원들 응대 별로에요,2025-01-03,"저녁에 방문, 예약 없이 이용, 대기 시간 바로 입장, 친목, 친구",인테리어가 멋져요,24,1
1675790428,Alex7777,너무 맛있는데 양까지 많아서 배부르게 먹었고음식이나 내부 무드 퀄리티보다 저렴하게 먹어서 좋았어요 ~,2025-01-03,"저녁에 방문, 예약 후 이용, 대기 시간 바로 입장, 나들이, 친구",인테리어가 멋져요,7,1
1675790428,요리보고72,직장 동료와 왔는데 음식이 다 맛있고 공간도 너무 예뻐요~~,2024-12-30,"저녁에 방문, 예약 후 이용, 대기 시간 바로 입장, 친목, 지인・동료",인테리어가 멋져요,203,1
1675790428,첼리스트94,너무나 좋은 연말모임이었습니다 ^^항상 맛도좋고 ...음식이 조금 빨리 나왔으면 더좋았겠는데 ~연말이라 바쁜거 같았어요! 또 방문할께요!,2024-12-28,"저녁에 방문, 예약 후 이용, 대기 시간 바로 입장, 친목, 친구",인테리어가 멋져요,97,1
1675790428,플랑뮤,연말 지인분들과 예약하고 왔는데 분위기랑 너무 좋아요 음식이랑 나무 맛있어요,2024-12-27,"저녁에 방문, 예약 후 이용, 대기 시간 바로 입장, 친목, 친구",음식이 맛있어요,130,1
1675790428,jun****,넘 맛있고 분위기도 좋아요!!부모님 모시고 식사하기에 굳입니당,2024-12-26,"저녁에 방문, 예약 후 이용, 대기 시간 바로 입장, 가족모임, 부모님",음식이 맛있어요,6,1
1675790428,yoomss,크리스마스 이브 디너 코스 예약해서 갔어요. 인당 18만원이었는데 허술한 코스구성부터 요리가.. 양도 적고 맛도...;;; 저녁 식사 내내 기분이 안좋더군요. 스테이크도 저와 상대방의 스테이크 굽기를 반대로 해주셨더라구요. 주변 테이블 둘러봤는데 다른 분들도 표정들이 별로. 라인드한남 평소 메뉴와 다른 크리스마스 스페셜메뉴로 구성하셨을텐데 대체.. 무슨일?인지 궁금합니다. 이런 리뷰 진짜 안남기는데 기대  이하였습니다. (영수증은 예약금20만원 선지급후 나머지 카드결제 내역입니다)재방문 의사 없습니다.,2024-12-24,"저녁에 방문, 예약 후 이용, 대기 시간 바로 입장, 데이트, 연인・배우자",인테리어가 멋져요,24,1
1675790428,bam****,,2024-12-24,"저녁에 방문, 예약 후 이용",음식이 맛있어요,639,1
1675790428,뇽뇽3132,"화이트라구파스타, 관자오일파스타, 아보카드 샐러드 먹었는데 세개다 너무 맛있었어요~! 매장 안에 트리도 있어서 분위기도 너무 좋고 층고가 높아서 답답하지 않았습니다. 직원분들도 친절하셔요~",2024-12-23,"저녁에 방문, 예약 후 이용, 대기 시간 바로 입장, 데이트, 연인・배우자",음식이 맛있어요,21,1
1675790428,uujoung,우니 파스타가 진짜 맛있어요 ㅎㅎ강추강추~~!,2024-12-23,"점심에 방문, 예약 후 이용, 대기 시간 바로 입장, 데이트, 연인・배우자",인테리어가 멋져요,16,1
1675790428,김수연88,"여기 뇨끼랑 파스타 다 너무 맛있었어요!! 식전빵도 맛있고 분위기도 연말분위기 낭낭한게, 연말맞이 데이트나 모임 가지시는 분들께 딱이에요!! 덕분에 좋은 시간 보내구 갑니당🤍",2024-12-22,"저녁에 방문, 예약 후 이용, 대기 시간 바로 입장, 데이트, 친목, 친구",인테리어가 멋져요,18,1
1675790428,srhspark,"연말 데이트로 방문하였습니다. 우니파스타와 농어 부야베스 주문했고 두 메뉴 다 만족스러웠습니다. 우니파스타는 우니랑 곁들여서 먹으니 바다향이 은은하게 나서 맛있었고, 농어 부야베스는 껍질은 바삭하고 살은 촉촉하면서 국물은 계속 퍼먹고 싶을 정도로 너무 맛있었어요🥹 인테리어도 클래식한 느낌으로 꾸며져있어서 연말 분위기 나고 좋았습니다~",2024-12-22,"점심에 방문, 예약 후 이용, 대기 시간 바로 입장, 데이트, 연인・배우자",음식이 맛있어요,3,1
1675790428,화신83,생일 기념으로 분위기 좋은 곳 찾고있다가 라인드 한남 발견해서 예약해서 왔어요~평소에도 뇨끼 좋아하는데 여기 뇨끼가 이때까지 먹었던 뇨끼중에 가장 맛있네요👍👍,2024-12-22,"점심에 방문, 예약 후 이용, 대기 시간 바로 입장, 데이트, 연인・배우자",음식이 맛있어요,6,1
1675790428,연두부농,"연말 기념으로 친구랑 예약후 다녀 왔는데 실내 분위기가 너무 예뻐서 귀가하기 아쉬웠어요🥹 화장실도 깨끗하고 직원분들도 친절하시고,, 인테리어가 유럽풍 고급 저택 느낌이라 그런지 첫방문 너무 만족 스러웠습니다 ㅎㅎ 사람이 많으면 시끄러운 곳도 많은데 조용히 여유롭게 즐길 수 있어서 더 좋았구요 킹프라운 로제 파스타랑 한치튀김 먹었는데 양도 만족 했고 맛도 자극적이지 않고 담백해서 싹싹 긁어 먹었어요 너무 예쁜 장소에서 친구랑 좋은시간 보내서 행복했구요 제 생일날 또 방문 하러 오겠습니당 ㅎㅎ 🫠🖤🍷🍝 🫶🏻",2024-12-21,"저녁에 방문, 예약 후 이용, 대기 시간 바로 입장, 친목, 일상, 친구",메뉴 구성이 알차요,23,1
1675790428,최현영56,분위기도좋구 너므 친절해요 !,2024-12-21,"저녁에 방문, 예약 후 이용, 대기 시간 바로 입장, 친목, 친구",인테리어가 멋져요,46,1
1675790428,gin****,친구들이랑 연말모임하려고 왔어요🙂분위기도 좋고 음식도 맛있어요! 예약하고 오길잘한거같아요 ㅎㅎ특히 스테이크가 정말 맛있어요!!🙂데이트부터 모임까지 추천드립니다!!,2024-12-20,"저녁에 방문, 예약 후 이용, 대기 시간 바로 입장, 친목, 친구",음식이 맛있어요,84,1
1675790428,스윗뇽,,2024-12-20,"저녁에 방문, 예약 후 이용, 대기 시간 바로 입장, 친목, 친구",음식이 맛있어요,6,1
1675790428,송주연76,친구생일 맞아 같이 왔는데 음식도 모두 맛있고 직원들 모두 친절하고 분위기도 너무 좋고 다음에 또 올거같아요,2024-12-20,"저녁에 방문, 예약 후 이용, 대기 시간 바로 입장, 친목, 친구",인테리어가 멋져요,7,2
1675790428,kgw****,데이트겸 점심먹으러왔는데 맛있게 잘먹고가용,2024-12-20,"점심에 방문, 예약 후 이용, 대기 시간 바로 입장, 데이트, 연인・배우자",음식이 맛있어요,12,1
1675790428,Pplz,파스타가 너무 맛있고 인테리어도 멋져요!!직원부들도 친절하셔서 너무 기분 좋게 식사했습니다재방문 의사 있어요🤭😸,2024-12-19,"점심에 방문, 예약 없이 이용, 대기 시간 바로 입장, 일상, 지인・동료",인테리어가 멋져요,843,1
1675790428,또토리331,"매장 옮기기 전에 자주 갔었는데요, 그 때 기억이 좋아서 오랜만에 근처 온 김에 들렀다가 예전의 기억이 싹 사그러드네요. 음식은 여전히 참 맛나거든요, 근데 스테이크 40분 기다렸어요. 직원분을 2번이나 불러 음식 언제 나오냐 묻는게 재촉하는 사람 만드는 거 같아 너무 짜증나더라구요. 만석인건 손님은 모르잖아요. 만석이라 사람이 많았으면 미리 음식 나오는데 지연될 수 있다 고지를 해주든, 어느 다른 곳처럼 애초에 다른 메뉴도 얼추 시간 맞춰 늦게 내어줄지 묻든 하는 안내 멘트가 필요해보이네요.",2024-12-18,"저녁에 방문, 예약 후 이용, 대기 시간 바로 입장, 데이트, 연인・배우자",음식이 맛있어요,18,1
1675790428,wifjejg,기념일로 온 곳인데!! 진짜 맛있어요 ㅠㅠ 특히 뇨끼💗 완전 제스타일!! 다들 한남동 오면 여기 꼭 오세요~,2024-12-18,"점심에 방문, 예약 후 이용, 대기 시간 바로 입장, 데이트, 기념일, 연인・배우자, 친구",인테리어가 멋져요,12,1
34658718,princess84,"모임하기 좋은 장소이고, 음식도 맛있고 주차도 편합니다.",2025-04-01,"점심에 방문, 예약 후 이용, 대기 시간 바로 입장, 친목, 지인・동료",음식이 맛있어요,25,2
34658718,사장님67,베라 한남점 여긴 최애 식당. 이탈리아에서 지정한 이태리 식당. 지킬앤하이드 스페셜 메뉴 맛났어요. 좌석 널직하고 화장실이 예술이에요. 가격 만큼의 가치를 하는 식당.,2025-03-26,"저녁에 방문, 예약 후 이용, 대기 시간 바로 입장, 친목, 지인・동료",음식이 맛있어요,19,1
34658718,봄양45,저녁에 모임하기 좋아요 음식도 맛있구 편합니다. 디져트는 거기서 먹어도 되고 패션5 디져트 사다 먹어도 되요. 여러모로 편한곳!,2025-03-24,"저녁에 방문, 예약 후 이용, 대기 시간 바로 입장, 친목, 친구",음식이 맛있어요,38,1
34658718,kda****,발렛비가 비싸지만분위기ㆍ맛 모두 만족함,2025-03-24,"점심에 방문, 예약 후 이용, 대기 시간 바로 입장, 지인・동료",음식이 맛있어요,100,6
34658718,tho****,화덕피자 먹고 싶어서 여자친구랑 같이 방문했는데 분위기는 너무 좋아서 둘다 놀랐어요. 그리고 먼저 더 좋은 자리로 바꿔주셔서 너무 감사합니다. 피자는 너무너무 맛있고 파스타는 상상 이상의 맛이에요. 인테리어도 굉장히 멋있고 예쁜 사진 많이 남겼어요.다음에 방문할 때 와인도 같이 시켜서 즐기겠습니다.,2025-03-22,"점심에 방문, 예약 후 이용, 대기 시간 바로 입장, 데이트, 연인・배우자",인테리어가 멋져요,10,1
34658718,odr****,"지인들과 모임으로 자주 가는데,주차비가 넘 비싸요 ㅠㅠspc로얄등급인데 그전에는 발렛비 무료,주차비도 무료였는데이제는 1시간만 무료여서 그전보다는덜 가고 백화점 식당으로 가게 되네요...",2025-03-18,"점심에 방문, 예약 후 이용, 대기 시간 바로 입장, 친목, 친구",음식이 맛있어요,149,11
34658718,Jazzz,한남동 놀러가서 예약하고 갔어요 사실 가격에 비해 그렇게 특별한진 모르겠어요..! 그냥 무난한 맛..! 분위기는 예쁘고 직원분들 친절하셔서 좋았습니다~,2025-03-16,"점심에 방문, 예약 후 이용, 대기 시간 바로 입장, 데이트, 연인・배우자",매장이 넓어요,25,1
34658718,ehk20000,친절한 배려 감사했습니다 예약때 요청했던 여유로운 좌석으로준비해 주셔서 진심 감사하고 전복 리조또특별히 맛있었어요,2025-03-14,"점심에 방문, 예약 후 이용, 대기 시간 바로 입장, 친목, 지인・동료",음식이 맛있어요,1,2
34658718,Zero32,뮤지컬 보러갔다가 뮤지컬 특별메뉴가 있어서 방문!! 맛있고 디저트도 취향에 맞추어 주셔서 좋았습니다,2025-03-09,"저녁에 방문, 예약 후 이용, 대기 시간 바로 입장, 가족모임, 아이",특별한 메뉴가 있어요,376,1
34658718,kda****,맛있는 음식으로 좋은시간함,2025-02-28,"점심에 방문, 예약 후 이용, 대기 시간 바로 입장",음식이 맛있어요,100,5
34658718,샬랄라라라89,,2025-02-26,"점심에 방문, 예약 후 이용, 대기 시간 2시간 이상, 친목, 친구, 지인・동료",음식이 맛있어요,23,1
34658718,시크릿드림,시저샐러드랑 한치 채소튀김 너무 맛있어요! 시저샐러드 진짜 신선하고 최고! 한치 채소튀김도 바삭바삭하고 넘 맛나용. 인테리어도 너무 멋지고 조용히 식사하며 얘기하기 좋아요.,2025-02-20,"저녁에 방문, 예약 후 이용, 대기 시간 바로 입장, 일상, 친척・형제",음식이 맛있어요,231,3
34658718,Jimena,회식으로 갔는데 두루두루 맛있었지만 그 중 가지그라탕(?)을 매우 맛있게 먹었습니다!,2025-02-19,"저녁에 방문, 예약 후 이용, 대기 시간 바로 입장, 회식, 지인・동료",매장이 청결해요,60,1
34658718,ang****,스테이크도 파스타도 다 맛있네요~담에 또 가고 싶어요,2025-02-18,"저녁에 방문, 예약 후 이용, 대기 시간 바로 입장, 데이트, 아이",음식이 맛있어요,4,1
34658718,mio****,샐러드가 언제부턴가 양이 많이 줄어서 아쉬워요,2025-02-02,"저녁에 방문, 예약 후 이용, 대기 시간 바로 입장, 부모님",음식이 맛있어요,3,3
34658718,전호독,굿,2025-02-02,"점심에 방문, 예약 없이 이용, 대기 시간 바로 입장, 데이트, 연인・배우자",음식이 맛있어요,1469,1
34658718,나야쩡이,친구랑 뮤지컬보러 가기전 식사를 했는데 음식도 맛있고 분위기도 좋아요 특히 화덕피자 건강하게 맛있었어요 양이 많아서 조금 남기고 왔는데 집에 귀가하며 아깝다는 생각이 나더라고요. 다음에 근처에 간다면 또 방문해서 다른 메뉴도 먹어봐야겠어요,2025-02-01,"점심에 방문, 예약 후 이용, 대기 시간 바로 입장, 친목, 친구",음식이 맛있어요,15,1
34658718,잠좀자자27,오래전부터 가족 모두 즐겨찾는 곳이에요버섯피자는 최소 30번은 먹었을거에요 코로나때는 배달 여러번 해서 먹었었네요 직접 가서 먹는게 제일 맛있지만요!피자도 파스타도 어떤 메뉴든 맛있고 쿠폰 이용하면 그렇게 비싼 느낌도 없어 종종 방문하고 있어요 가족끼리 가기에도 좋고 모임으로 가기에도 좋아요,2025-01-25,"저녁에 방문, 예약 후 이용, 대기 시간 바로 입장, 나들이, 아이, 부모님",음식이 맛있어요,17,2
34658718,아이샘,인테리어가 너무 근사하고 음식도 정갈하며 맛있었어요,2025-01-22,"점심에 방문, 예약 후 이용, 대기 시간 바로 입장, 친목, 친구",음식이 맛있어요,601,1
34658718,군계일학15,,2025-01-17,"저녁에 방문, 예약 후 이용, 대기 시간 바로 입장, 데이트, 연인・배우자",음식이 맛있어요,10,1
34658718,Brian69,식사도 맛있었고 분위기도 좋았어요! 친절한 직원분들께도 감사드립니다.,2025-01-15,"저녁에 방문, 예약 후 이용, 대기 시간 바로 입장, 데이트, 연인・배우자",음식이 맛있어요,22,2
34658718,CiderRich,"지킬앤하이드 뮤지컬 보기 전에 가까운 곳 갈만한 곳 찾다가걸어서 5분 거리라 방문했는데 매장도 넓고, 맛도 좋아서 만족했네요~~매장이 넓어서 시끌벅적 하지도 않아서 분위기도 추천!",2025-01-12,"저녁에 방문, 예약 후 이용, 대기 시간 바로 입장, 데이트, 연인・배우자",음식이 맛있어요,8,1
34658718,쇼미더머니니,샐러드가 건강하고 맛잇어요. 가장맛잇던건 파스타!! 명란이랑 크림이랑 너무 잘어울려요. 디저트도 가성비좋습니다. 이정도 퀄에 이가격이면 혜자네요,2025-01-12,"점심에 방문, 예약 후 이용, 대기 시간 바로 입장, 데이트, 연인・배우자",인테리어가 멋져요,23,1
34658718,해피데이wm,"역시 화덕에서 구워서 피자 넘 맛있어요가지그라탕, 로제 파스타도 다 넘 맛있네요분위기도 편안하고 서비스도 만족입니다",2025-01-03,"저녁에 방문, 예약 후 이용, 대기 시간 바로 입장, 친목, 친구",음식이 맛있어요,928,1
34658718,John Galliano,새로나온 뇨끼 너무 맛있는데 양이 ㅠㅠ,2024-12-29,점심에 방문,음식이 맛있어요,1359,16
34658718,벗사랑54,"우리나라 최고의 음식점, 베이커리 카페가  맞군요. 너무 맛있고 멋진 경험이였고 가족모두 대만족 하였습니다.",2024-12-28,"점심에 방문, 예약 후 이용, 대기 시간 바로 입장, 가족모임, 친척・형제",음식이 맛있어요,10,1
34658718,JackFrost,여자친구와 함께 와서 식사했었습니다.모든것이 훌륭했습니다.,2024-12-25,"저녁에 방문, 예약 후 이용, 대기 시간 바로 입장, 데이트, 연인・배우자",인테리어가 멋져요,10,2
34658718,SunnyDay15,"크리스마스 이브 저녁 식사하러 가서 크리스마스 패밀리 세트 주문. 샐러드, 깔라마리, 피자, 파스타/리조토 2가지, 와규 스테이크, 케이크까지 5명이서 부족하지 않게 잘 먹었어요. 커피는 불포함이라 조금 아쉬웠어요 와인 한 병 주문하면 2병까지 콜키지 무료.",2024-12-24,"저녁에 방문, 예약 후 이용, 대기 시간 바로 입장, 기념일, 연인・배우자, 아이, 부모님",음식이 맛있어요,1220,1
34658718,쿠키4285,맛있기는 한데 그렇다고 엄청 뛰어난 맛은 아니고 평범합니다. 가격이 비싼 편인데 장소의 위치랑 분위기 등을 고려하면 뭐..다만 식전빵이 씹기 힘들정도로 질겼습니다. 쫄깃을 넘어선 질김이라 차라리 기본 바게트에 발사믹을 주는게 좋았겠다 싶을 정도였어요. 모임하기에 추천합니다만 일부러 찾아가지는 않을 것 같네요.,2024-12-23,"점심에 방문, 예약 후 이용, 대기 시간 바로 입장, 비즈니스, 지인・동료",재료가 신선해요,230,1
34658718,아이스마이,,2024-12-21,"저녁에 방문, 예약 후 이용, 대기 시간 바로 입장, 친목, 친구",음식이 맛있어요,3,1
34658718,슈가스프레드,"맛있는데, 솔직히 좀 비싸긴 해요~",2024-12-19,"저녁에 방문, 예약 후 이용, 대기 시간 바로 입장, 친목, 지인・동료",음식이 맛있어요,554,1
34658718,ohs****,,2024-12-19,"저녁에 방문, 친목, 지인・동료",음식이 맛있어요,68,2
34658718,072072,"음식은 그냥 저냥입니다. 분위기는 편안하고 괜찮습니다. 친절해요. 식당을 다시 찾게 하는 것, 그리고 영속하게 하는건 역시 맛인것 같습니다. 맛을 전반적으로 개선할 필요가 있고, 식전 빵은 피자 도우 구워서 올리고당 뿌리는 것 같은데.. 엄청 질기고, 처음부터 기분이 안좋아요. 구운 치아바타와 올리브 소스 같이 제대로 나오는게 아니라면 차라리 안주는게 나을 것 같습니다.",2024-12-18,"점심에 방문, 예약 후 이용, 대기 시간 바로 입장, 친목, 지인・동료",인테리어가 멋져요,8,1
