place_id,nickname,content,date,situations,keywords,review_count,visit_count
1207670608,곤드레63,"금호 자체에 사는게 아니지만, 이 맛이 생각나서 항상 또 찾아오게됩니다 ..🧡 맛은 보장되어 있고, 양도 많아요😋 사장님께서 너무 친절하시고 매장 분위기도 따스해서 오면 항상 기분좋게 배불리 한끼 먹고가요 ㅎㅎ 그리고 누누이 말하지만 매장이 정말 청결하답니다 ,, 사장님께서 항상 관리 열심히 하시는게 느껴져요!! 매장 안에서 흘러나오는 노래도 옛날 팝, 따뜻한 감성의 곡들로 사장님께서 선곡해두셔서 금호점에서만 느낄 수 있는 이 분위기가 정말 좋아요ㅠㅠ 오늘은 연말이라 그런지 더더욱 크리스마스 맞이하는 기분의 노래들을 들을 수 있어서 기분 좋았네요 ㅎㅎ 항상 감사합니다 사장님~~ 맛난 저녁 먹고갑니다<3 조만간 또 올게요 좋은 연말되세요❣️ ( + 그리고 꿀팁드리자면, 계란말이에는 꼭! 치즈추가 하세요 🧀🥚)",2024-12-01,"저녁에 방문, 예약 없이 이용, 대기 시간 바로 입장, 데이트, 연인・배우자",친절해요,17,2
1207670608,뿌뿌피피카카,김치찌개 고기도 신선하고 늘 맛있어요❤️👍🏻,2024-11-27,"점심에 방문, 예약 없이 이용, 대기 시간 바로 입장, 데이트, 연인・배우자",음식이 맛있어요,13,1
1207670608,sy_****,언제먹어도 맛있는 백채김치찌개👍🏻두꺼운 고기에 맛있는 김치로 맛이없을수없어요..><♥️,2024-11-10,"점심에 방문, 예약 없이 이용, 대기 시간 바로 입장, 친목, 친구",음식이 맛있어요,63,1
1207670608,안경잡이86,사장님 너무 친절하시고 음식도 맛있습니다!인수 맞춰서 세트 시켜드세요!ㅎㅎ,2024-11-09,"점심에 방문, 예약 없이 이용, 대기 시간 바로 입장, 친목, 친구",음식이 맛있어요,13,1
1207670608,hap****,"음식이 맛있고, 사장님께서 정말 친절하세요^^매장도 깔끔하고 가성비갑입니다^^ 맛있게 잘 먹었습니다~~",2024-11-08,"점심에 방문, 예약 없이 이용, 대기 시간 바로 입장, 일상, 친구",음식이 맛있어요,2,1
1207670608,혠76,저번에 먹고 너무 맛있어서 또 왔어요!! 김치찌개는 역시 여기에요 추천 왕추천!!,2024-11-02,"저녁에 방문, 예약 없이 이용, 대기 시간 바로 입장, 데이트, 연인・배우자",대화하기 좋아요,44,2
1207670608,안 중식,너무 맛있어어요^,2024-11-02,"점심에 방문, 예약 없이 이용, 대기 시간 바로 입장, 데이트, 연인・배우자",음식이 맛있어요,2,1
1207670608,라링68,메뉴구성도 좋고김치찌개 너무 맛있어요돼지고기도 많이들었고 라면사리랑 계란말이까지!또올게요! 잘먹었습니다😋,2024-10-29,"점심에 방문, 예약 없이 이용, 대기 시간 바로 입장, 데이트, 연인・배우자",음식이 맛있어요,11,1
1207670608,으니짱79,3인세트로 주문했어요먼저 계란말이 두툼하니 부드럽고 맛있어요김치찌개는 3인분인데 양이 엄청 많네요 ㅎ라면사리까지 넣어서 맛있고  배부르게 잘먹었습니다 ^^,2024-10-26,"점심에 방문, 예약 없이 이용, 대기 시간 바로 입장, 일상, 아이, 부모님",음식이 맛있어요,157,1
1207670608,양보리,2인세트 둘이서 맛있게 배불리 먹었습니다😋😋,2024-10-22,"저녁에 방문, 예약 없이 이용, 대기 시간 바로 입장, 데이트, 연인・배우자",음식이 맛있어요,58,1
1207670608,김선우짱,사촌누나집에 놀러와서 맛집 찾아서 왔는데 고기 양도많고 김치도 맛있네요^^ 특히 사장님이 친절하셔서 기분이 넘 좋은 하루네요^^ 사장님 감사합니다~,2024-10-20,"저녁에 방문, 예약 없이 이용, 대기 시간 바로 입장, 일상, 아이, 친척・형제",음식이 맛있어요,3,1
1207670608,트리플링,"고기 잡내 1도 없고친절하시고제일 큰 장점은 김치찌개를 먹고 난 뒤에 보통 물, 아이스크림, 음료가 먹고싶어지는데 여기는 그렇지 않고 입에 짠느낌이 없고  깔끔! 개운합니다. 괜히 단골들이 생기는게 아니고 한번만 오는 사람이 없는듯 합니다. 타 지점 가봤는데 맛이 아예 다릅니다. 한 끝 차이 이런거 아니고 열 끝 차이 정도 납니다. 독립적인 김치찌개 맛집으로 보시면 됩니다. 매일 정해 놓은 수량만 판매 하시기 때문에 재료가 신서하고 그만큼 맛있습니다! 벌써 또 가고싶네요",2024-10-18,"저녁에 방문, 예약 없이 이용, 대기 시간 바로 입장, 데이트, 연인・배우자",음식이 맛있어요,25,1
1207670608,yololeitdi,친절하시고 맛있습니다~~!,2024-10-16,"점심에 방문, 예약 없이 이용, 대기 시간 바로 입장, 친목, 연인・배우자",아늑해요,25,1
1207670608,뷰린이당,"처음 방문했는데, 너무너무 맛있고, 고기가 너무 맛있습니다! 사장님도 친절하십니당 ㅎㅎㅎ 맛있게 잘 먹고 가겠습니당ㅎㅎ",2024-10-11,"저녁에 방문, 예약 없이 이용, 대기 시간 바로 입장, 데이트, 연인・배우자",음식이 맛있어요,12,1
1207670608,강해원436,김치찌개는 역시 백채김치찌개! 맛있어요~!! 다음에도 먹으러 올게요~,2024-10-11,"점심에 방문, 예약 없이 이용, 대기 시간 바로 입장, 일상, 친척・형제",음식이 맛있어요,4,1
1207670608,혠76,양도 많고 너무 맛있었어요 다음에 또 올게요!!,2024-10-09,"저녁에 방문, 예약 없이 이용, 대기 시간 바로 입장, 데이트, 연인・배우자",아늑해요,44,1
1207670608,좌수,너무 맛있네요 ~! 추천드립니다 ㅎㅎ,2024-10-05,"점심에 방문, 예약 없이 이용, 대기 시간 바로 입장, 데이트, 연인・배우자",음식이 맛있어요,37,1
1207670608,ny****,,2024-09-22,"점심에 방문, 예약 없이 이용, 대기 시간 바로 입장, 데이트, 연인・배우자",음식이 맛있어요,35,1
1207670608,갓도동,맛있게 잘 먹었습니다.서비스도 주셔서 배부르게 먹었습니다^^또 이용할께요~~,2024-09-17,"저녁에 방문, 예약 없이 이용, 대기 시간 10분 이내, 가족모임, 아이",음식이 맛있어요,2,1
1207670608,용현용,역시는 역시죠 김치찌개는 여기만 옵니다,2024-09-17,"점심에 방문, 예약 없이 이용, 대기 시간 바로 입장, 친목, 친구",음식이 맛있어요,28,1
1207670608,air****,"사장님 친절가게 깔끔깨끗하게 유지,명품계란말이고기잡내전혀없고 찌개의 정석제대로 밥먹은느낌또올거임 일본에서도 김치찌개 관광 와서 먹고 있음김치찌개로 국위선양 까지세계에 내어 놓아도 손색없을 만한 맛이긴 하지사장님. 음식에 대한 프라이드가 강함재료 신선함유지를 위해 애쓰는것이 맛으로 증명먹는데 바쁘서 사진은 못찍음",2024-09-16,"점심에 방문, 예약 없이 이용, 대기 시간 바로 입장, 친목, 부모님",음식이 맛있어요,20,1
1207670608,곤드레63,"백채는 “금호역점”이 정말 최고입니다..❤️ 원래는 저 김치찌개 밖에서 찾아먹지 않았는데.. 요기 김치찌개 먹고나서는 집에서만 해먹는 음식이라는 틀을 깨고 이곳이 또 생각나서 사먹게 만드는 맛이에요ㅠㅠ 일단, 찌개 자체도 엄청 맛있는데 그안에 고기가 듬뿍 들어가있어서 한입 먹을때마다 만족감이 장난 아니구요! 그리고 사장님께서 정말 좋은 퀄리티의 고기를 선별해서 재료로 사용하시는게 느껴집니다ㅎㅎ 그리고 계란말이에는 치즈추가해서 먹는데 항상 몽글몽글 예쁘고 풍성하게 만들어주시고 거기에 모짜렐라가 가득이라 진짜 맛있어요ㅠㅠ 사장님께서 매장관리도 항상 깔끔하게 하시고, 밥먹을때 들리는 노래 선곡들이 정겹고 따뜻한 감성이라 좋아서 남자친구랑 항상 그 분위기+맛 즐기러가는데 항상 친절하게 맞이해주셔서 감사합니다❤️",2024-09-07,"저녁에 방문, 예약 없이 이용, 대기 시간 바로 입장, 데이트, 연인・배우자",친절해요,17,1
1207670608,yj5042,음식 진짜 맛있고 사장님 엄청 친절하시고 매장이 엄청 청결합니다. 그리고 흘러나오는 올드팢이 너무 좋아요!!,2024-09-04,"저녁에 방문, 예약 없이 이용, 대기 시간 바로 입장, 일상, 친구",음식이 맛있어요,3,1
1207670608,koreabetty,"국내산고기에, 맛도 좋고, 매장도청결하고 사장님 친절하시고. 좋았습니다~",2024-09-04,"점심에 방문, 예약 없이 이용, 대기 시간 바로 입장, 일상, 지인・동료",음식이 맛있어요,200,1
1207670608,가을꾸,친구랑 방문했어요~ 김치찌개 좋아하는데 인생김치 찌개집 되버렸어요~~❤️❤️같이간 친구도 너무 맛있다구 하구ㅜㅜ 사장님두 너무 친절하세요😆 맛있게 잘먹었습니당😉,2024-09-02,"점심에 방문, 예약 없이 이용, 대기 시간 바로 입장, 일상, 친구",음식이 맛있어요,490,1
1207670608,yus****,사장님 친절하시고 맛도좋구요  청결해요 매 짐심시간에 맛있게 먹고있습니다,2024-09-02,"점심에 방문, 예약 없이 이용, 대기 시간 바로 입장, 일상, 지인・동료",음식이 맛있어요,2,1
1207670608,MyLovely디오,직장근처에 있는 음식점인데 점심시간에 자주 애용을 하는곳이에요~ 사장님께서 엄청 친절하시고 맛있는 음식을 늘 제공해주셔서 얼마나 감사한지 몰라요ㅎㅎ 자주자주 애용할곳입니다. 음식맛도 아주아주 최고에요👍👍강력추천 음식점 백채!!  사랑합니다.🩷,2024-09-02,"점심에 방문, 예약 없이 이용, 대기 시간 10분 이내, 일상, 지인・동료",음식이 맛있어요,36,1
1207670608,스카이라인89,"음식은 맛있었다. 그러나 남자 사장님의 응대방식이 반드시 개선되야할 것 같다. “메뉴에 써있지 않냐”, “난 또 무슨얘기하는거라고”, “그런건 손님이 처음이다”옵션을 선택하는 메뉴에 관하여 문의하는중 들은 답변이다.스포츠에서도 달성하기 어렵다는 그랜드슬램을, 하루만에 해내셨다.",2024-09-01,"점심에 방문, 예약 없이 이용, 대기 시간 바로 입장, 나들이, 혼자",,5,1
1207670608,고구마킬러,"김치찌개 자체는 맛있는데 사장님이 무서운 분 같아요. 반찬이 두가지밖에 안 나오는데 단무지 달라고 했고, 리뷰쓰려고 영수증 달라고 했더니 약간 어이없어 하는 눈빛을 보이시네요.",2024-06-21,"점심에 방문, 예약 없이 이용, 대기 시간 바로 입장, 비즈니스, 지인・동료",음식이 맛있어요,801,1
1207670608,kimjihye73,좋아요,2024-06-19,점심에 방문,음식이 맛있어요,1729,1
1207670608,한국인8488,"15시이후 비가 온데요. 하늘이 잔뜩 흐려져 있네요. 12:02 식당 도착, 1인분을 시키다. 11분 후 주문품이 나오다. 특색은 찾지 못하다. 수고하세요'라고 인사하고 식당을 나서다. 별다른 답례는 느끼지 못하고...",2024-05-26,"점심에 방문, 예약 없이 이용, 대기 시간 바로 입장, 일상, 혼자",혼밥하기 좋아요,566,1
1207670608,백두에서한라한라에서백두로,좋아요,2024-04-27,"점심에 방문, 예약 없이 이용",음식이 맛있어요,931,1
1207670608,Shine K,맛있어서 과식했어요,2024-03-03,"점심에 방문, 예약 없이 이용, 대기 시간 바로 입장, 친목, 친구",음식이 맛있어요,873,1
1207670608,5001,맛있게 잘 먹었습니다,2024-03-02,"점심에 방문, 예약 없이 이용, 대기 시간 바로 입장, 친목",음식이 맛있어요,676,1
1207670608,vito0529,맛나네요,2024-02-21,"저녁에 방문, 예약 후 이용, 대기 시간 바로 입장, 친목, 일상, 친구",음식이 맛있어요,52,1
1207670608,와르샤,사장님 친절해요,2023-11-14,"점심에 방문, 포장·배달 이용, 대기 시간 바로 입장, 일상, 혼자",친절해요,1704,3
1207670608,더지씨,항상 맛있게 잘먹고 있습니다^^ 2인세트에 햄구이도 생겨서 좋아요~~~^^,2023-10-07,저녁에 방문,음식이 맛있어요,608,1
1207670608,매봉산날다람쥐,와 진짜 오랜만에 맛있게 배터지게 먹었네요. 다이어트 실패!ㅋㅋ김치찌개 고기 엄청 큼직하고 좋은걸로 직접 숭덩숭덩 썰어주시고 반찬도 맛있고 밥은 흑미밥!! 사장님 친절하시고 매장 너무너무 깨끗해요.,2023-09-12,밤에 방문,친절해요,133,1
1207670608,와르샤,굿,2023-06-21,점심에 방문,음식이 맛있어요,1704,2
1207670608,baseball44,김치찌개와 계란말이ㆍ,2023-05-17,저녁에 방문,특별한 메뉴가 있어요,392,1
1207670608,와르샤,굿,2023-04-11,저녁에 방문,친절해요,1704,1
1207670608,북극곰2172,맛있고 양도 푸짐하고 사장님 친절하시고 매장도 청결해요! 별다섯개 쾅쾅!,2023-03-22,저녁에 방문,혼밥하기 좋아요,4,1
1207670608,hhe****,굿,2023-02-22,저녁에 방문,친절해요,1163,1
1207670608,bk812,대박김치찌개,2023-01-07,점심에 방문,친절해요,371,1
1207670608,예쁜스마일,역시 최고예요! 세시부턴 브레이크타임이라 두시반부터 걸어두시더라구요~ 시간 잘맞춰와야해요 ㅎ맛있습니다,2022-11-12,점심에 방문,친절해요,760,1
1207670608,jaeng96,맛있는 김피찌개,2022-11-01,점심에 방문,음식이 맛있어요,1169,1
1207670608,금호동고양이,아이고..인터넷에서 진상썰 보면서 웃기만 했는데 그 진상이 나 일줄이야..매장에서 먹었을때(..오 ...오래되긴 했네요;;) 김가루에 슥슥 비벼 먹었던 기억이 있어서 요청사항에 적은건데..김가루가 없으면 안주셔도 되는데 이걸 어떻게 구해서 주셨네요;;; 이런 진상 짜증나실텐데 이쁘게 손편지까지;; 진상짓 너무너무 죄송합니다.음식이야 말해 뭐하겠어요. 실제로 매장가면 어머니보다 더 깨끗하게 테이블이며 관리하시고 항상 부족한거 없는지 봐주시고 그래서 배달도 걱정없이 믿고 주문합니다. 요즘엔 친구들끼리 만나도 밥대신 술!! 이라 매장에 간지 오래되긴 했지만 지나가며 항상 응원하고 군침흘리고 갑니다.오늘도 잘 준비해주신 귀한음식 맛있게 잘 먹겠습니다. 감사합니다,2022-10-12,저녁에 방문,특별한 메뉴가 있어요,15,1
1207670608,고기파는스님,도곡동에서 거리가 있지만 자주가는 맛집입니다~ 사장님 어찌나 친절하신지^^ 가끔 지나는길에 포장도 해오는데 단골이라고 식혜도 챙겨주십니다~ 김치에 포스트잇으로 숙성 날짜까지 적어놓고 꼼꼼하게 관리하시는 만큼 국물맛이 시원하고 깔끔합니다 지금껏 먹어본 김찌지개중 단연 최고입니다 계란말이도 완전 꿀맛이고요 특이한것은 테이블마다 타이어를 부착해놓고 끓이는 시간을 정확히 알려주는것이 맛을 지키려는 노력으로 보였습니다 지난번에는 7시에 갔는데 당일 재료 소진으로 영업종료ㅠㅠ 지금껏 두번 겪었습니다;; 퀵 배달 기사분들께 참 친절하게 대하시는걸 봤습니다 일일이 인사하고 좋은 말씀도 해주시구요 사장님 성품 자체가 선비성품인듯^^경상도 사람들은 무뚝뚝하다고 하는데 사장님을 보면 빈말인듯 합니다ㅋ사장님 부자되세요~,2022-10-04,밤에 방문,친절해요,37,1
1207670608,모아이81,김치찌개 포장으로 집에서 먹는데 플라스틱이 나왔네요. 맛은 좋았는데 플라스틱 넣고 팔팔 끓인게 신경 쓰이네요....ㅜㅜ,2022-09-30,저녁에 방문,음식이 맛있어요,12,1
1207670608,wjd****,킹성비 김치찌개 집임니다 번창하세요🤠,2022-09-17,점심에 방문,가성비가 좋아요,1191,1
1207670608,바라보다96,,2022-08-22,저녁에 방문,음식이 맛있어요,318,1
1207670608,Jellyco,계란말이에서 계란 껍질이 나왔어요. 김치찌개는  맛있고요. 아마도 또 배달 할 듯,2022-08-21,저녁에 방문,,130,1
1207670608,sjkim2286,굿,2022-06-08,저녁에 방문,음식이 맛있어요,682,4
1207670608,대주주14,사장님 너무 친절하세요 맛도 있구요,2022-06-01,점심에 방문,음식이 맛있어요,112,1
1207670608,신이제트,치즈계란말이 추천이요,2022-05-16,점심에 방문,음식이 맛있어요,28,1
1207670608,ddable,인위적으로 신맛을 낸게 아닌 김치찌개여서 좋았어요! 계란말이도 맛있었구요~사장님께서 테이블 정리하시는 모습에서 청결함을 느낄 수 있었네요~ 매장은 작지만 깨끗하게 관리하고 있어 믿을 수 있는 식당인 것 같아요!재방문의사 100%있어요,2022-05-14,저녁에 방문,음식이 맛있어요,221,1
1207670608,연s1720,맛나요 맛나,2022-05-13,점심에 방문,음식이 맛있어요,1255,1
1207670608,ssong158,맛있어요,2022-04-26,저녁에 방문,음식이 맛있어요,1044,1
1207670608,aa1bb2,진짜 맛있어요!지난주에도 먹었는데 또 생각나는맛이에요.또 먹고싶네용!,2022-03-25,저녁에 방문,친절해요,1749,7
1207670608,아하6893,ᆢ,2022-03-12,저녁에 방문,가성비가 좋아요,1039,3
1207670608,sjkim2286,굿,2022-03-06,저녁에 방문,친절해요,682,3
1997664345,스마일 나양,언제나 부대찌개는 이 곳에서만!집에서도 여행 갈 때도 강추!강추 합니다~,2025-04-05,"저녁에 방문, 포장·배달 이용, 대기 시간 바로 입장, 일상, 아이",음식이 맛있어요,13,1
1997664345,eas****,동네에서 가장 좋아하는 부찌에요! 비조리 포장해서 집에서 끓여먹었는데 매장에서 먹는거랑 똑같이 맛있네요,2025-03-01,"저녁에 방문, 포장·배달 이용, 대기 시간 10분 이내, 일상, 친구",음식이 맛있어요,27,1
1997664345,kim****,오늘도 맛있게 먹었습니다.,2025-03-01,"점심에 방문, 포장·배달 이용, 대기 시간 바로 입장, 일상, 연인・배우자",음식이 맛있어요,4,3
1997664345,Shinjee85,맵기조절이 안되서 오뎅 추가했는데 넘 맛있어요!! 동네 맛집이 별루 없는데 여긴 가성비맛집이예요 포장하면 할인도 해줘용,2025-02-17,"저녁에 방문, 포장·배달 이용, 대기 시간 바로 입장, 일상, 반려동물",친절해요,19,1
1997664345,안녕3999,포장으로 이용했어요잘먹겠습니다,2025-02-07,"저녁에 방문, 포장·배달 이용, 대기 시간 바로 입장",음식이 맛있어요,1,1
1997664345,끌로에86,반찬검정콩안에  그릇깨진 조각 같은게 들어있어요ㅠ,2025-02-07,"점심에 방문, 포장·배달 이용, 대기 시간 바로 입장, 일상, 연인・배우자",음식이 맛있어요,11,1
1997664345,풋사과89,오랜만에 먹은 부대찌개! 추운 날씨에 어울리는 칼칼한 맛에 오늘 점심은 성공이였어요! 다음번엔 매장에서 라면볶음을 꼭 먹을 생각입니다 늘 친절하게 대해 주셔서 감사합니다 :),2025-02-06,"점심에 방문, 포장·배달 이용, 대기 시간 바로 입장, 친목, 지인・동료",음식이 맛있어요,48,1
1997664345,금호동찹쌀떡,맛있어요. 가족들과 먹었는데 자극적이지 않고 좋아요,2025-02-02,"점심에 방문, 포장·배달 이용, 대기 시간 바로 입장, 친목, 연인・배우자",음식이 맛있어요,7,1
1997664345,님1292,언제 먹어도 맛있어요다른 부대찌개랑 견주어도 절대 뒤지지않아여 너무너무 맛있어요😊 늘 감사합니다,2025-01-30,"저녁에 방문, 포장·배달 이용, 대기 시간 바로 입장, 일상, 혼자",음식이 맛있어요,34,3
1997664345,seu****,포장주문 안내를 친절히 해주셨어요! 맛도 깊고 좋았습니다 또 먹고 싶을 것 같아요 😋,2025-01-26,"점심에 방문, 포장·배달 이용, 대기 시간 바로 입장, 일상, 연인・배우자",친절해요,8,1
1997664345,tls****,진짜 진심으로 저 회사 상사들이 부대찌개를 너무 좋아해서 정말 일주일에 2번 이상은 부찌 맛잇다는 곳으로 골라서 먹으러 다니는데 그래도 집에 와서 시켜먹는 맛입니다 진짜.. 어제도 회사에서 부찌 먹고 왔는데 서박사 먹고 나면 왜 서박사는 우리 회사 근처에 없을까 라는 생각을 하며 먹었습니다! 부대찌개 먹으면 라면사리를 위주로 먹는데 여기는 면사리 없이 먹어도 맛있어요! 집에서 스팸은 제가 직접 넣어서 먹은거에요! 오해는 절대 노노 맛있는거 더 맛잇게 먹으려고 넣은거에요! 리뷰 안쓰는데 젠장 너무 길게 썻네요. 암튼 그런 맛입니다. 감사합니다 사장님!,2025-01-25,"저녁에 방문, 포장·배달 이용, 대기 시간 10분 이내, 일상, 연인・배우자",음식이 맛있어요,7,1
1997664345,jshbombing7,아이가 젤 잘먹는 집입니다.,2025-01-25,"점심에 방문, 포장·배달 이용, 대기 시간 바로 입장, 일상, 아이",음식이 맛있어요,364,3
1997664345,UC37,양 마너이 주십니다 따로 두부도 구매 해서 넣으니 배 빵빵,2025-01-19,"저녁에 방문, 포장·배달 이용, 대기 시간 바로 입장, 친목, 연인・배우자",가성비가 좋아요,6,1
1997664345,gog****,방문해서만 먹어보다 포장 처음 해봤는데 너무 맛있어요. 앞으로 포장도 자주 이용할께요~두부는 집에서 추가한겁니다 ㅎㅎ,2025-01-08,"저녁에 방문, 포장·배달 이용",음식이 맛있어요,30,1
1997664345,아라4055,양이많고 사리가 넉넉해요 소시지 햄등등,2025-01-05,"저녁에 방문, 포장·배달 이용, 대기 시간 바로 입장, 일상, 혼자",친절해요,36,1
1997664345,곰이래요99,부대찌개는 항상 서박사에서 먹는데역시나 오늘도 실망시키지 않는 맛 이었네요손님 대접용으로 함께 먹었는데 좋았습니다 :),2025-01-04,"저녁에 방문, 포장·배달 이용, 대기 시간 바로 입장, 가족모임, 연인・배우자, 아이",음식이 맛있어요,16,1
1997664345,chiang79,너무 맛있습니다. 최고 👍,2024-12-14,"저녁에 방문, 포장·배달 이용, 대기 시간 바로 입장, 일상, 연인・배우자",음식이 맛있어요,2,2
1997664345,워붕이,처음 먹어봤는데 정말 맛있네요!,2024-11-21,"저녁에 방문, 포장·배달 이용, 대기 시간 10분 이내, 가족모임, 부모님",음식이 맛있어요,2,1
1997664345,diary21,양도 푸짐하니 많고 국물이 진해서 좋아요! 다음에 또 방문할 의향 있어요,2024-11-15,"저녁에 방문, 포장·배달 이용, 대기 시간 30분 이내",음식이 맛있어요,2,1
1997664345,춤추는 바람46,양이 넉넉하고 양념이 맛있어요. 아이와 같이 먹으려고 다데기를 조금 빼고 끓였더니 많이 안 매워서 좋았고요. 서비스로 소세지를 추가로 주셨어요. 기본으로 나오는 소세지 양도 많아서 푸짐하게 먹었습니다.,2024-10-30,"저녁에 방문, 포장·배달 이용, 대기 시간 바로 입장, 일상, 아이",음식이 맛있어요,2,1
1997664345,kim****,서박사 부대찌개가 금호동에서 제일 맛있어요.,2024-10-28,"저녁에 방문, 포장·배달 이용",음식이 맛있어요,4,1
1997664345,님1292,언제먹어도 너무 맛있어요 늘 밥 두공기는 기본입니다♥️🧡,2024-10-19,"저녁에 방문, 포장·배달 이용, 대기 시간 10분 이내, 일상, 연인・배우자, 친구",음식이 맛있어요,34,2
1997664345,jshbombing7,항상 친절하시고 맛이 깔끔하게 맛납니다.,2024-10-09,"점심에 방문, 포장·배달 이용, 대기 시간 10분 이내, 일상, 연인・배우자, 아이",음식이 맛있어요,364,2
1997664345,다방,쌀쌀해진 날씨에 서박사부대찌개 강추!! 또 방문할것 같아요!,2024-10-04,"저녁에 방문, 포장·배달 이용, 대기 시간 10분 이내, 일상, 연인・배우자",음식이 맛있어요,14,1
1997664345,님1292,너무 맛있어요 밥 3그릇 이상 먹게 되네요,2024-09-23,"점심에 방문, 포장·배달 이용, 대기 시간 바로 입장, 일상, 혼자",친절해요,34,1
1997664345,바다맛카라멜,날씨가 쌀쌀해지면 생각나는 부대찌개.국물이 깔끔하고 햄이랑 같이 떠먹으면 너무 행복해요.맛이 강하지 않아서 정말 자주 오고 싶은 곳이에요:)첨에 치즈 올려서 나오는데 사장님께서 바로 섞어 주시거든요. 사진은 그전에 후딱 찍어야해요. ㅎㅎㅎ너무 잘생긴 사장님! 앞으로도 계속 맛있는 부대찌개 부탁 드려요! 오늘도 넘 맛있게 먹고 가요~ 🥹❤️,2024-09-23,"점심에 방문, 예약 없이 이용, 대기 시간 바로 입장, 일상, 연인・배우자",음식이 맛있어요,11,1
1997664345,양갱968,우리동네 부찌 맛집!! 재료도 신선하고 국물도 깔끔해서 자주 즐겨먹어요❤️❤️,2024-08-05,"저녁에 방문, 포장·배달 이용, 대기 시간 바로 입장",음식이 맛있어요,67,1
1997664345,칼니스92,오랜만에 먹는거라 기대됩니다~,2024-07-29,"저녁에 방문, 포장·배달 이용, 대기 시간 10분 이내, 일상, 기타",음식이 맛있어요,4,1
