place_id,nickname,content,date,situations,keywords,review_count,visit_count
1400319684,골목2끔이,짬뽕맛이깔끔해서맘에들어요제가접대하느라오늘은왕십리에서먹던어항동고를!!오래걸렸어요 ㅠㅋ허나정말모두맛있게먹었어요,2023-12-28,"점심에 방문, 예약 없이 이용, 대기 시간 10분 이내, 친목, 지인・동료",음식이 맛있어요,946,1
1400319684,윤조아빠,1인 26000원 량코스 2인 52000원음식 양 창렬함오픈후 두번째 손님이었는데 음식 인당탕수육3조각 나오고15분후 인당칠리새우2개씩 15분후 또 음식 나오고 무슨 양도 적고  시간이 이래 많이걸리는지음식맛도 걍 쏘쏘웬만하면 리뷰 안하는데 다신 안감 절대 코스 시키지마셈돈아까움 다신안감,2023-12-28,"점심에 방문, 대기 시간 바로 입장, 데이트, 연인・배우자",,8,1
1400319684,JJ9505,만두가 진짜 맛있었어요!,2023-12-25,"점심에 방문, 예약 없이 이용, 대기 시간 바로 입장, 데이트, 연인・배우자",인테리어가 멋져요,678,1
1400319684,Sky71,도봉구에 하림각 출신 30년 경력 셰프가 있다고 하는 한스친친 창동점입니다.도봉구 짬뽕 맛집답게 짬뽕 종류만 7가지예요 대박임 ㅋㅋ!식사메뉴 제가 올려둡니다 참고하세용ㅎ식사메뉴 진짜 다양해서 고르는데 좀 힘들었어요 XO게살볶음밥 이거 게살 진짜 겁나 많이 들었는데 밥 속에 더 많이 들어서 놀랐고요 차돌짬뽕역시 처음에 차돌이 안보이네~ 했는데 안에 엄청 많더라구요 재료를 아낌없이 팍팍 주시는 점이 너무 맘에 듭니다. 짬뽕밥 국물 죽여요 해장으로로 딱입니다 ㅎ 진짜 맛있어요,2023-12-17,"점심에 방문, 예약 없이 이용, 대기 시간 바로 입장, 가족모임, 부모님",음식이 맛있어요,248,1
1400319684,aro****,진짜 맛있는 중국집이예요!! 특히 수제만두 정말 맛있어요!!!! 짬뽕밥 해물도 마니 들어있고 대체적으로 존맛인 중국집이예요!!,2023-12-16,"점심에 방문, 예약 후 이용, 대기 시간 바로 입장, 가족모임, 아이",음식이 맛있어요,207,1
1400319684,방학동40년거주자,good,2023-12-12,"저녁에 방문, 예약 후 이용, 대기 시간 바로 입장, 회식, 지인・동료",매장이 넓어요,484,1
1400319684,광적인삶,귿귿귿귿,2023-12-12,"저녁에 방문, 예약 없이 이용, 대기 시간 바로 입장, 가족모임, 부모님",음식이 맛있어요,2569,10
1400319684,y2****,팔보 쟁반 짜장면은 살짝 매콤 하고 해물도 많이 있어서 좋았어요 찹쌀 탕수육 바삭해요  너무 맛있게 먹었어요,2023-12-10,"점심에 방문, 예약 없이 이용, 대기 시간 바로 입장, 일상, 부모님",음식이 맛있어요,1083,4
1400319684,하마링링,매장이 굉장히 넓어서 모임 하시는분들이 많더라구요👍음식들은 양 푸짐한편이였어요!배터지게 잘 먹었습니다💜,2023-12-06,"저녁에 방문, 예약 후 이용, 대기 시간 바로 입장, 가족모임, 연인・배우자",음식이 맛있어요,128,1
1400319684,수원여자 용인남자,탕수육 맛있어요,2023-12-01,점심에 방문,음식이 맛있어요,664,1
1400319684,괭78,메뉴가 자극적이지 않고 맛있어요 ! 남녀노소 어른아이 구분없이 좋아할 것 같은 맛이에요! 다음에 또 방문 예정입니다 많이 파세요👏🏻,2023-11-29,"점심에 방문, 예약 없이 이용, 대기 시간 바로 입장, 친목, 친구",음식이 맛있어요,495,1
1400319684,바람너머5,평가 없음,2023-11-28,저녁에 방문,,3320,4
1400319684,LeeJay,예약후 방문하였고 룸으로 안내 받음.요리가 맛있고 빨리 나옴.,2023-11-25,"저녁에 방문, 예약 후 이용, 대기 시간 바로 입장, 가족모임, 부모님",음식이 맛있어요,268,2
1400319684,쥬리56,좋아요,2023-11-25,"저녁에 방문, 예약 후 이용, 대기 시간 바로 입장, 가족모임, 부모님",음식이 맛있어요,1061,4
1400319684,ang****,짜장조와~~~^^,2023-11-14,"저녁에 방문, 예약 없이 이용, 대기 시간 바로 입장, 가족모임, 아이",음식이 맛있어요,458,8
1400319684,j4nu4ry,맛있고 좋아요,2023-11-12,점심에 방문,음식이 맛있어요,221,1
1400319684,샐라39,창동 맛집 한스친친매장 넓고 룸도 많아요지하철과도 가깝고 주차장도 있어요탕수육 짜장면 XO볶음밥 다 맛있었어요~,2023-11-04,저녁에 방문,매장이 넓어요,184,1
1400319684,광적인삶,귿귿귿귿,2023-10-31,"저녁에 방문, 예약 없이 이용, 대기 시간 바로 입장, 가족모임, 부모님",음식이 맛있어요,2569,8
1400319684,구르리야,맛있게 잘 먹었어요~~~다음에 또 갈게요!,2023-10-24,점심에 방문,음식이 맛있어요,262,1
1400319684,메트로40,👍 👍 👍 👍 👍,2023-10-22,점심에 방문,음식이 맛있어요,100,1
1400319684,화도주민,굿,2023-10-22,점심에 방문,재료가 신선해요,2683,1
1400319684,방울토마토쨉쨉14,대가족모임   코스요리  강추!,2023-10-14,저녁에 방문,음식이 맛있어요,235,1
1400319684,k2o****,평일 점심때만 먹을수있는 행복세트 먹고왔네요.역시 맛있어요. 강추 합니다 ^^,2023-10-11,점심에 방문,특별한 날 가기 좋아요,663,3
403988944,수원이67,굿,2025-03-26,"저녁에 방문, 예약 없이 이용, 대기 시간 바로 입장, 일상, 지인・동료",음식이 맛있어요,1269,1
403988944,상계동먹린이,음식이 신선하고 깔끔해요디저트도 좋고 서비스로 돈까스도 주셨는데 그건 안찍엌ㅅ네요얼큰차돌은 진짜 매우니까 저같은 맵찔인 그냥 차돌도 좋을거같아요또방문할겁니다,2025-03-25,"점심에 방문, 예약 없이 이용, 대기 시간 바로 입장, 데이트, 연인・배우자",친절해요,96,1
403988944,Vivaan,모든걸 경험해보고 싶어서 세트로 먹었어요샐러드와 사시미가 신선해요살치살도 부드러운게 좋았어요튀김은 겉바속촉으로 소스 찍어먹으니 맛있네요오뎅탕은 매콤하고 칼칼하니 괜찮았어요오징어 튀김이 궁금해서 추가로 주문했어요바삭하니 맛있네요전반적으로 신선하고 좋았어요음식에 살짝 문제가 있었지만 서빙하시는 여직원분이대처를 너무 잘해주셔서 기분좋게 마무리 했습니다독특한 자리구성이 이색적이에요추천합니다,2025-03-22,"저녁에 방문, 예약 없이 이용, 대기 시간 바로 입장, 데이트, 연인・배우자",재료가 신선해요,202,1
403988944,진심맛집,Yummy,2025-03-20,"점심에 방문, 예약 없이 이용, 대기 시간 바로 입장, 회식, 지인・동료",음식이 맛있어요,320,1
403988944,jor****,"혼밥하기 좋고, 맛있습니다.",2025-03-13,"점심에 방문, 예약 없이 이용, 대기 시간 바로 입장, 친목, 친구",음식이 맛있어요,77,1
403988944,만두21,소고기 덮밥 든든합니다,2025-03-08,"저녁에 방문, 예약 없이 이용, 대기 시간 바로 입장",음식이 맛있어요,358,4
403988944,달lee,오늘은 소고기숙주덮밥이랑 얼큰차돌우동 픽!!! 오늘고 맛있게 너무너무 잘 먹었습니다🤩,2025-03-06,"점심에 방문, 예약 없이 이용, 대기 시간 바로 입장, 친목, 친구",음식이 빨리 나와요,2235,6
403988944,드림샘4,만족했습니다,2025-02-25,"저녁에 방문, 대기 시간 바로 입장",특별한 메뉴가 있어요,46,20
403988944,달lee,돈까스카레 맛있는데 오늘은 함박카레 시켰어요. 함박카레도 맛있네요! 사실 연어덮밥 숙주덮밥 일식라멘 여기 다 맛있어요.ㅋ,2025-02-19,"점심에 방문, 예약 없이 이용, 대기 시간 바로 입장, 친목, 일상, 지인・동료",음식이 빨리 나와요,2235,5
403988944,leegs119,점심먹으러 오랜만에  들렀어요 함박카레랑  차돌우동 맛있게 먹고 왔어요,2025-02-07,"점심에 방문, 예약 없이 이용, 대기 시간 바로 입장, 일상, 연인・배우자",음식이 맛있어요,429,2
403988944,호호아줌96,,2025-01-16,점심에 방문,음식이 맛있어요,279,1
403988944,복마님,음식에 정성을 다하는곳이네요,2025-01-07,"점심에 방문, 예약 후 이용, 대기 시간 바로 입장, 친목, 지인・동료",음식이 맛있어요,189,1
403988944,쩡이261,음식도 맛있고 친절해요...,2024-12-28,"저녁에 방문, 예약 없이 이용, 대기 시간 바로 입장, 친척・형제",음식이 맛있어요,994,1
403988944,arc****,"너무 맛있릅니다,,, 단체 모임하면 정말 좋을 거 같아여",2024-12-21,"저녁에 방문, 예약 후 이용, 대기 시간 바로 입장, 데이트, 연인・배우자",단체모임 하기 좋아요,160,1
403988944,없음308,"연어사시미 덮밥 17,000구성은 밑반찬으로 오이샐러드, 야채샐러드, 단무지, 우동(소)가 같이 나오며 이 때는 서비스로 다른 식사메뉴에 나오는 돈까스 샐러드를 서비스로 주셨습니다디저트로는 바나나 + 미음 샤베트 위에 엄청 달달하고 바삭한 호두가 올려져 있는데 이 호두가 샤베트와 엄청 잘어울립니다연어사시미 덮밥은 밥위에 연어사시미가 덮여져 있어 숟가락으로 사시미를 끊어내면서 동시에 밥술을 뜨면 됩니다드셔보시고 간이 안맞으면 간장을 1,2방울 첨가합니다이 메뉴는 사이드메뉴랑 잘 어울려요각각 따로먹으면 맛있다는 느낌 못느끼는데 덮밥이 슴슴한 느낌이 있는데 사이드메뉴들이 그걸 잡아주고 오이가 상큼함을 더해줘서 조합이 좋아요디저트도 차가운 식감과 엄청 단맛이 합쳐지니 중화되서 더 맛있어지네요",2024-12-14,"저녁에 방문, 예약 없이 이용, 대기 시간 바로 입장, 일상, 혼자",음식이 맛있어요,171,1
403988944,루시9530,진짜 찐 맛집이에요!!! 하이볼이랑 생맥주와 즐기는 맛난 안주들!고등어봉초밥 첨 먹어보는데 아주아주 부드럽고 넘 담백하고 맛있어서 최고랍니다👍🏻😍🥰마제소바랑 가지탕수도 추천! 특히 가지탕수 꼭 드셔야 해요!!!! 식감이 진짜 취향저격이랍니다!~~ 사장님도 친절하시고 서비스도 잘 주세요😆👍🏻 조만간 또 먹으러 가려구요!!!💗💗,2024-12-13,"저녁에 방문, 예약 없이 이용, 대기 시간 바로 입장, 친목, 지인・동료",친절해요,426,1
403988944,godong01,돈까스 포장 가끔하는데 애들도 좋아하고 맛있어요,2024-11-21,점심에 방문,음식이 맛있어요,835,9
403988944,carna,"창동역 원탑 맛집!!이곳에 모든 음식이 정갈하면서 맛깔납니다!! 평일 런치에 함박카레 한정판으로 판매되는데, 창동에서 3년간 일하면서 이거먹겠다고 오픈런 했던 날이 셀수없이 많아요!!!직원분들 친절하시고 초밥이나 돈까스, 샐러드, 요리류 전부 맛나요!! 부모님들도 좋아하시는 음식점이에요! 강추합니다!!",2024-11-09,"점심에 방문, 예약 없이 이용, 대기 시간 바로 입장, 가족모임, 연인・배우자, 부모님",대화하기 좋아요,68,1
403988944,khy****,꽃게라멘과 스시 맛있어오,2024-11-02,"점심에 방문, 예약 없이 이용, 대기 시간 바로 입장, 가족모임, 아이",음식이 맛있어요,315,2
403988944,해바라기9399,맛두 완전 훌륭하고 멋진 사장님이 계신 곳이에요. 모든 메뉴들에 정성이 느껴졌어요. 또 가고싶은 맛집이에요.,2024-10-31,"점심에 방문, 예약 후 이용, 대기 시간 바로 입장",음식이 맛있어요,844,1
403988944,HJ5339,항상 친절하시고 음식이 맛있어요,2024-10-30,"점심에 방문, 예약 없이 이용, 대기 시간 바로 입장, 일상, 혼자",음식이 맛있어요,352,1
403988944,기능이,음식은 원래 너무 맛있고중간에 이모님이.너무 친절하셔서 진짜 배로 맛있게 먹었습니다 잘 먹었습니다!!!,2024-10-22,"저녁에 방문, 예약 없이 이용, 대기 시간 바로 입장, 친목, 친구, 지인・동료",음식이 맛있어요,28,1
403988944,gnu0y0es,시키지 않았어도 계속 서비스로 내어주는 곳..사장님도 직원분들도 다 너무 친절하시고 좋았어요맛도 있는데 메뉴 개발을 계속 하시는 듯한 메뉴들너무 보석같은 곳이라고 생각되었습니다디저트마저 주시고 게다가 맛있다니 ...!!심지어 용기내챌린지까지 하는 정말 좋은 곳이라는 생각이 들었습니다 다양한 메뉴 다 먹어 보고싶어요,2024-10-09,"점심에 방문, 예약 없이 이용, 대기 시간 바로 입장, 데이트, 연인・배우자",친절해요,146,1
403988944,tig****,주말에 식사하러 방문했어요음식이 맛있어요,2024-09-28,"점심에 방문, 예약 없이 이용, 대기 시간 바로 입장, 일상, 아이",음식이 맛있어요,1218,1
403988944,leegs119,음식이 다양하고 맛있어요,2024-09-06,"점심에 방문, 예약 없이 이용, 대기 시간 바로 입장, 나들이, 친구",음식이 맛있어요,429,1
403988944,godong01,음식이 맛있어요 창동 맛집,2024-08-30,저녁에 방문,음식이 맛있어요,835,8
403988944,신태용93,오호 맛잇어요. ㄱㄱㄱㄱ. 그냥 ㄱㄱㄱㄱ 스스로 판단해욧♡,2024-08-16,"저녁에 방문, 예약 없이 이용, 대기 시간 바로 입장, 데이트, 연인・배우자",음식이 맛있어요,13,1
403988944,긍정적인 뽀로로,맛있어요,2024-08-02,"점심에 방문, 예약 없이 이용, 대기 시간 바로 입장, 일상, 지인・동료",음식이 맛있어요,835,1
403988944,BanHag,"너무너무 친절하시고, 창동에 이렇게 다양하고 신선한 음식을 퀄리티 있게 하시는 곳이 있다는게 놀라웠습니다. 다음에 또 갈게요!",2024-07-30,"저녁에 방문, 예약 없이 이용, 대기 시간 바로 입장, 일상, 연인・배우자",음식이 맛있어요,93,1
403988944,gio****,굳,2024-07-23,점심에 방문,음식이 맛있어요,2905,3
403988944,wlt****,맛있게 먹었습니다 서비스로 주시는 음식도 다 훌륭하고 후식으로 먹은 아이스호두도 맛있어서 입가심하기 좋았어요,2024-07-23,"점심에 방문, 예약 없이 이용, 대기 시간 바로 입장, 친목, 친구",음식이 맛있어요,17,1
403988944,Ghost9861,맛있어요~,2024-07-18,"점심에 방문, 예약 없이 이용, 대기 시간 바로 입장, 일상, 혼자",혼밥하기 좋아요,218,13
403988944,kgwole,,2024-07-13,저녁에 방문,음식이 맛있어요,1826,1
403988944,주전자4042,맛있어요,2024-07-04,"저녁에 방문, 예약 없이 이용, 대기 시간 바로 입장, 일상, 친구",음식이 맛있어요,2252,1
403988944,OneZeroNine,"동네에 이런 곳이 있었다니!메뉴 하나하나가 다 너무 맛있었음 굿굿!!이것저것 시켜먹고 둘이서 20만원정도 나왔는대가격이 저렴한편은 아니지만 , 그만큼 맛이 있음창동에 이런 이자카야가 있는줄 몰랐음그리고 , 신기하게 매장이 여러개로 쪼개져있음상가 건물 여러곳을 나뉘어서 매장으로 꾸며놓셨음일장일단이 있을듯~디저트로 나왔던 아이스호두? 까지도 맛이 좋았다조만간 또 갈듯!",2024-07-04,"저녁에 방문, 예약 없이 이용, 대기 시간 바로 입장",음식이 맛있어요,545,1
403988944,rla****,완벽한 식사였아요 :)다음에 또 맛보러 올게용사장님 친절하시고 서비스도 많이 주시고 너무 감사했아요:),2024-07-04,"저녁에 방문, 예약 없이 이용, 대기 시간 바로 입장, 데이트, 연인・배우자",음식이 맛있어요,1271,1
403988944,godong01,음식이 맛있어요,2024-06-25,점심에 방문,음식이 맛있어요,835,6
403988944,SS777,,2024-06-18,"저녁에 방문, 예약 없이 이용, 대기 시간 바로 입장, 일상, 지인・동료",음식이 맛있어요,3235,1
403988944,Ghost9861,동네 맛집이라 계속 이용중이에요,2024-06-18,"점심에 방문, 예약 없이 이용, 대기 시간 바로 입장, 일상, 혼자",특별한 메뉴가 있어요,218,12
403988944,날마다 새롭게4,굿,2024-06-15,저녁에 방문,음식이 맛있어요,1109,4
403988944,lookgood7,맛잇어요,2024-06-08,"저녁에 방문, 예약 없이 이용, 대기 시간 바로 입장, 친목, 친구",음식이 맛있어요,487,2
403988944,godong01,음식이 맛있어요,2024-06-07,점심에 방문,음식이 맛있어요,835,5
403988944,도도1456,맛있어요,2024-05-29,"저녁에 방문, 예약 없이 이용, 대기 시간 바로 입장, 친목, 친구",음식이 맛있어요,982,1
403988944,gio****,굳,2024-05-28,점심에 방문,음식이 맛있어요,2905,2
403988944,godong01,음식이 맛있어요,2024-05-28,점심에 방문,음식이 맛있어요,835,4
403988944,샤랄라000,맛있게 먹었습니다.,2024-05-21,점심에 방문,음식이 맛있어요,535,1
403988944,akdjebdi,리뷰를 안쓸 수 없어요! ㅋㅋ 늦은 점심 먹으러 1시 넘어서 방문했어요~ 카레돈까스와 차돌우동 시켰는데 넘넘 맛있네요!!직원분들도 친절하셔요. 돈까스 튀김옷도 바삭바삭하고 고기도 두툼합니다. 서비스로 주신 우동샐러드랑 후식도 정말 맛있게 잘 먹었습니다.다음에는 다른 메뉴 먹어보고 싶네요!,2024-05-16,점심에 방문,,789,1
403988944,godong01,음식이 맛있어요,2024-05-16,점심에 방문,음식이 맛있어요,835,3
403988944,윤이87,서비스도 좋고 친절하시고 무엇보다̆̎ 음식이 너무 맛있어요ㅠㅠ 먹으면서 계속 감동.. 동네에 이런 맛집있는지 몰랐는데 앞으로 술먹으러나 식사로나 종종 오려고요~,2024-05-15,"저녁에 방문, 예약 없이 이용, 대기 시간 바로 입장, 데이트, 일상, 연인・배우자",음식이 맛있어요,6,1
403988944,gio****,굳,2024-05-14,점심에 방문,음식이 맛있어요,2905,1
403988944,UJ323,오랜만에 갔더니 새로운 메뉴들이 생겼네요! 어버이날이라 그랬겠지만 다들 너무 정신없이 바쁘셔서 음식도 늦게 나오고 요청사항도 깜박하셨는지 뒤늦게 대응해주셔서 아쉬웠어요ㅠ 마구로 타르타르는 가격은 비싼데 맛있고 고등어봉초밥 고등어 비리지 않고 추천👍🏻 돈까스가 생각보다 양도 많고 맛있어요!,2024-05-08,"저녁에 방문, 예약 없이 이용, 대기 시간 바로 입장, 일상, 부모님",음식이 맛있어요,245,2
403988944,Chulpchulpchu,A 코스로 즐겼어요. 사장님 직원분들 다들 친절하시고 바쁘신데도 잘 챙겨주셨어요. 가격이 올랐지만 물가상승률로 그러려니 합니다. ^^,2024-05-08,"저녁에 방문, 예약 없이 이용, 대기 시간 바로 입장, 일상, 연인・배우자",친절해요,740,3
403988944,날마다 새롭게4,굿,2024-05-08,저녁에 방문,음식이 맛있어요,1109,3
403988944,Jim0309,너무 맛있었어요 ! 2번째 방문!!!!!!!사장님 자주갈게여~~~~‘,2024-05-03,"저녁에 방문, 예약 없이 이용, 대기 시간 바로 입장, 가족모임, 부모님, 친척・형제",음식이 맛있어요,46,1
403988944,신은숙42,"늘 가면 꼭 먹는 메뉴, 나가서키 나베.오늘은 좋아하는 언니랑 함께 먹었어요.",2024-05-03,"저녁에 방문, 예약 없이 이용, 대기 시간 바로 입장, 일상, 친구",재료가 신선해요,1269,2
403988944,블루버드46,친절해요,2024-04-24,점심에 방문,음식이 맛있어요,325,1
403988944,elena0423,결혼기념일날 집근처 쉐프마인드에서 오마카세로 분위기 잡았네요.,2024-04-23,"저녁에 방문, 예약 후 이용, 대기 시간 바로 입장, 데이트, 연인・배우자",음식이 맛있어요,684,14
403988944,godong01,음식이 맛있어요,2024-04-23,점심에 방문,음식이 맛있어요,835,2
403988944,대부호90,돈까스맛있어요초밥도 맛있어요^^,2024-04-04,점심에 방문,음식이 맛있어요,1074,1
403988944,pa****,굳,2024-03-26,점심에 방문,음식이 맛있어요,864,1
403988944,바니3753,맛있어요굿,2024-03-21,"저녁에 방문, 예약 없이 이용, 대기 시간 바로 입장, 친목, 친구",음식이 맛있어요,1549,1
403988944,AAA65,서비스가 엄청 많고 맛도 좋네용,2024-03-13,"점심에 방문, 예약 없이 이용, 대기 시간 바로 입장, 데이트, 연인・배우자",음식이 맛있어요,1943,1
403988944,날마다 새롭게4,맛있어요,2024-03-12,저녁에 방문,음식이 맛있어요,1109,2
403988944,elena0423,제일 좋아하는 숙주덮밥에 까치복지리 추가!해야될듯. 시원한 국물이 좋네요,2024-03-08,"점심에 방문, 예약 없이 이용, 대기 시간 10분 이내, 회식, 친구",음식이 맛있어요,684,13
403988944,BerryYou,지인들과 한 잔 하기 좋은 예쁘고 맛있는 이자카야입니다:) 제 최애 메뉴는 우동샐러드!! 직접 만드신다는 참깨 드레싱이 넘 잘 어우러지고 야채가 많아서 진짜 좋아요! 가지탕수는 처음 시켜봤는데 요것도 맛있었습니당:),2024-03-07,"저녁에 방문, 예약 없이 이용, 대기 시간 바로 입장, 친목, 친구, 지인・동료",음식이 맛있어요,76,1
403988944,어머나8770,맛있는 맥주와 술안주로 즐거운 모임 가졌네요서비스도 항상 주시고..굿굿~~,2024-03-07,"저녁에 방문, 예약 없이 이용, 대기 시간 바로 입장, 친목, 친구",음식이 맛있어요,680,2
403988944,Ghost9861,자주 가서 먹는데 서비스 나와서 좋아요,2024-03-07,"점심에 방문, 예약 없이 이용, 대기 시간 바로 입장, 일상, 혼자",음식이 맛있어요,218,11
403988944,모든지 맛잇게,음식 너무 맛있고 친절해요 !! 돈까스도 맛있고 우동샐러드도 소스 직접 만드셨다는 말 듣고 너무놀랐어요 ㅎㅎ 마지막에 디저트까지ㅠㅠ 너무 맛있어서 흡입했어요 ㅋㅋㅋㅋ 또 올게요!!,2024-03-01,저녁에 방문,음식이 맛있어요,393,1
403988944,신은숙42,갈 때마다 똑 같이 맛있는 음식! 고맙고 감사한 일이죠!,2024-02-22,"저녁에 방문, 예약 없이 이용, 대기 시간 바로 입장, 친목, 지인・동료",음식이 맛있어요,1269,1
403988944,Ghost9861,자주 이용중이에요,2024-02-21,"점심에 방문, 예약 없이 이용, 대기 시간 바로 입장, 친목, 친구, 혼자",음식이 맛있어요,218,10
403988944,Ghost9861,굿굿,2024-02-18,"저녁에 방문, 예약 없이 이용, 대기 시간 바로 입장, 일상, 친구",음식이 맛있어요,218,9
403988944,jec****,포장으로는 처음인 간장새우덮밥 너무 맛있습니다챙겨주시는 서비스도 잘먹을께요!,2024-02-15,"저녁에 방문, 포장·배달 이용, 대기 시간 10분 이내, 일상, 혼자",음식이 맛있어요,24,4
403988944,미식한고독가3,해장할곳 찾다가 발견했는뎅 존맛도리 연어구이랑 타코야끼도 서비스로주시구 디저트도주셨어여~~담엔 술마시러 가보고싶어요,2024-02-15,"점심에 방문, 예약 없이 이용, 대기 시간 바로 입장, 일상, 혼자",음식이 맛있어요,156,1
403988944,카메라맨,주문하는게 어려워요 ㅠㅠ,2024-02-14,"저녁에 방문, 예약 없이 이용, 대기 시간 바로 입장, 친목, 지인・동료",,210,1
403988944,jiyoung2ek,바빠도 친절하시고 메뉴가 정말 다양해요 디저트도 맛있어요,2024-02-02,"점심에 방문, 예약 없이 이용, 대기 시간 바로 입장, 비즈니스",음식이 맛있어요,256,1
403988944,언제나웃자아,굿,2024-02-01,점심에 방문,음식이 맛있어요,895,1
403988944,Miracle330,"창동역 번화가가 아닌조금은 생소한? 동아아파트 상가내에 위치한이자카야 & 일식당점심은 식사 위주저녁은 이자카야 형식의 밥집 겸 술집창동 토박이 친구의 강력추천2차로 방문모듬회 및 굴튀김 주문광어,연어,황새치,참치갑오징어,고등어,전복 세팅비록 활 모듬회는 아니지만숙성 모듬회로써 구성이 좋은 편굴튀김에 타르타르 소스를 찍어 먹어보니이 집 튀김을 잘하는 집이구나 알게 되더군요상호명처럼 음식맛 좋구 반찬들도 정갈하며계속되는 서비스에충성고객=단골고객들이 많은 편가게 이미지는 첫 방문과 나갈때의이미지가 상당히 중요한데...여사장님 친절히 밝게 웃으시며 응대해주시고나갈때도 큰 목소리로 다음에 또 오시라는데 아니 갈 수 없겠습니다 :)도봉구 No.1 이자카야 & 일식당",2024-01-27,"저녁에 방문, 예약 후 이용, 대기 시간 바로 입장, 친목, 지인・동료",음식이 맛있어요,314,1
403988944,앙응용,최고예요🤩🤩,2024-01-27,"저녁에 방문, 예약 없이 이용, 대기 시간 바로 입장, 일상, 친구",아늑해요,969,2
403988944,또잉152,"스페셜 초밥,살치살 스테이크 덮밥,갑오징어 튀김 시켜 먹었는데 초밥마다 다 너무 맛있고 살치살도 너무 부드러웠어요! 서비스로 주신 복어 껍질무침도 진짜 맛있고 타코야끼, 특히 아이스 호두!! 호두 별로 안좋아 하는데 이건 정말 맛있더라구요 ㅜㅠㅠ 여기 가시먄 아이스 호두는 꼭 드세요 우유푸딩도 직접 만드신거 같던데 여기 그냥 다ㅏㅏㅏ 맛있습니다 👍👍",2024-01-23,"저녁에 방문, 예약 없이 이용, 대기 시간 바로 입장, 가족모임, 부모님",친절해요,26,1
