place_id,nickname,content,date,situations,keywords,review_count,visit_count
38011060,chang222,좋아요,2023-11-03,저녁에 방문,음식이 맛있어요,1056,1
38011060,까불이3983,술꾼들의 성지입니다~ 양이 많은 편아니라 여러개 시켜먹기 좋아요,2023-11-01,점심에 방문,음식이 맛있어요,277,1
38011060,술기로운어흥,올만에 닭발과 갈비먹고싶어서~~둘이서 닭발에 갈비에 코다리에~~라면에~~막걸리도 2병까지 배부르게 잘먹고왔습니다최고최고,2023-10-30,저녁에 방문,음식이 맛있어요,2030,4
38011060,미래를바,맛있어요~,2023-10-26,"저녁에 방문, 예약 없이 이용, 대기 시간 바로 입장, 친목, 친구, 지인・동료",음식이 맛있어요,2144,4
38011060,다조리8,N 번째 방문하는 남원닭발여긴 돼지갈비 라면 맛집입니다진짜 너무 맛있어서 100번 정도 방문할 예정입니다,2023-10-24,저녁에 방문,음식이 맛있어요,580,1
38011060,양양이쥬,첫방문! 남자친구가 맛있데요,2023-10-22,"아침에 방문, 예약 없이 이용, 대기 시간 바로 입장",,2085,1
38011060,굴더,재구네 먹으러 왔다가 맨날 꽉 차서 이집으로 오게돼요,2023-10-20,저녁에 방문,음식이 맛있어요,251,2
38011060,aey****,갈비도 닭발도 모두 맛있어요소주 한잔하기 딱 좋은 곳으로 추천입니다:),2023-10-20,저녁에 방문,음식이 맛있어요,703,1
38011060,qoeoghks0123,굳,2023-10-15,저녁에 방문,음식이 맛있어요,229,1
38011060,mis****,ㅋ,2023-10-13,아침에 방문,음식이 맛있어요,149,1
38011060,Swsw48,맛있어여,2023-10-03,저녁에 방문,음식이 맛있어요,879,1
38011060,lil****,닭발이랑 라면에 술 마시기 좋아요!,2023-09-24,저녁에 방문,가성비가 좋아요,849,2
38011060,찌니793,소주 한잔 먹기 좋은 맛집!친절하시고 음식 맛있고 가격 착해요! 닭발이랑 고기 양념이 아주 맛있어요. 늘 푸짐하게 시켜서 포장해오는데 집에와서 먹어도 맛나요!,2023-09-24,"저녁에 방문, 예약 없이 이용, 대기 시간 바로 입장, 친목, 연인・배우자, 친구",음식이 맛있어요,394,1
38011060,nevermind81,굿,2023-09-23,저녁에 방문,단체모임 하기 좋아요,3077,2
38011060,단무지101,노포갬성✨,2023-09-22,밤에 방문,아늑해요,788,1
38011060,이슬한잔,갈비 15000닭발 15000라면 4000  간이 쎄고 라면  맛남  금욜저녁 11시쯤  웨이팅 2팀,2023-09-16,밤에 방문,특별한 메뉴가 있어요,616,1
38011060,블루엣59,맛있어요,2023-09-14,"저녁에 방문, 예약 없이 이용, 대기 시간 10분 이내, 일상, 혼자",잡내가 적어요,799,1
38011060,뀨5796,"닭발 맛집다운 구성이 아주 좋았습니다 :) 기본으로 나오는 미역국도 훌륭해요! 매장이 넓진 않지만 1, 2호점이 바로 앞에 있으니 수용은 잘 되는 듯 해요!",2023-09-13,"저녁에 방문, 예약 없이 이용, 대기 시간 바로 입장, 친목, 친구",음식이 맛있어요,56,1
38011060,뽀로로꼬꼬밍,"믿고 먹는 동네맛집이에요ㅎ돼갈,계란말이필수!",2023-09-10,밤에 방문,음식이 맛있어요,37,1
38011060,마루코5,닭발좋아하시는분들이라면 한번 가보시길 바랍니다,2023-09-06,밤에 방문,,287,1
38011060,소금인형3261,"오늘은 닭발, 후기 좋던 돼지갈비까지~~ 둘다 맛이 끝판왕!!!등산후 집가는길 어제 그 맛을 잊지 못해 또 방문~~주중에 또 들러야겠어요^^*",2023-08-27,저녁에 방문,음식이 맛있어요,91,2
38011060,소금인형3261,맛집 검색해서 찾아갔는데 맛집 맞네요.ㅎㅎ 단골각 입니다~~,2023-08-26,점심에 방문,친절해요,91,1
38011060,지슈공쥬님,ㅇ,2023-08-19,저녁에 방문,음식이 맛있어요,424,1
38011060,개미누나,진짜 넘 마싯다.. 가성비 최강이야...또 먹고싶다..,2023-08-15,"저녁에 방문, 포장·배달 이용, 일상, 연인・배우자",음식이 맛있어요,659,15
38011060,솜잉95,친구 따라 갔는데 여기 진짜 너무 맛있네요...돼지갈비랑 닭발 조합 누구 아이디어인지 최고예요 살짝 매울 때쯤 달달한 고기 한 점...먹다가 계란찜이랑 라면도 추가해 먹었는데왜 계란찜이랑 라면도 맛있죠?자주 갈게요 번창하세요(싹 다 긁어먹음),2023-08-03,저녁에 방문,매장이 넓어요,433,1
38011060,개미누나,복날이니까 삼계탕에 똥집 마넌치사서 한잔 따악!!!~~~,2023-07-23,저녁에 방문,음식이 맛있어요,659,14
38011060,맛집디오닝,닭발먹고싶어서 검색해서 먹으러왔는데 너무맛있어요~~ 라면도 꼭 먹어야한다고해서 먹었네요! 핳 또 가고싶어요,2023-07-21,저녁에 방문,친절해요,2037,1
38011060,sh5123,굿,2023-07-16,밤에 방문,음식이 맛있어요,387,1
38011060,올리비아1137,,2023-07-16,저녁에 방문,가성비가 좋아요,967,3
38011060,JiNijini,매장도 넓은데 닭발 맛집이라 웨이팅 계속 있네요 ㅎㅎ넘 궁금해서 기다리다 들어와봤는데 맛있었어요^^,2023-07-16,밤에 방문,단체모임 하기 좋아요,616,1
38011060,영영용용2121,매워서 주먹밥이랑 계란찜이랑 먹으니깐 딱 좋았어오!!,2023-07-15,밤에 방문,혼밥하기 좋아요,2504,1
38011060,꼴통지원이,변함없는집큰이모도 음식맛도추억의맛집 ♡,2023-07-15,아침에 방문,직접 잘 구워줘요,434,1
38011060,SY252,돼지갈비는 연탄불에 구워서인지 육포 같아요 적당히 달고 살도 두툼해요,2023-07-14,밤에 방문,음식이 맛있어요,196,1
38011060,tgeumsungyu,.,2023-07-12,저녁에 방문,,404,1
38011060,요런곳,술을 부르는 참새 방앗간ㅋㅋ좋아요🧡,2023-07-10,아침에 방문,특별한 메뉴가 있어요,1649,1
38011060,someday3616,불향이 확 올라오네요 맛있어요가격대비 양이 조금 아쉽긴했어요~,2023-07-09,저녁에 방문,직접 잘 구워줘요,1220,1
38011060,요정카부,통닭발구이 진짜 맵고 맛있어요~돼지갈비는 단짠단짠 그 자체 입니다!그리고 라면은 꼭꼭!!!! 꼭드세용🥺,2023-07-09,점심에 방문,친절해요,478,2
38011060,JWKH joyful,안매워요. 미역국과 잘 어울려요. 주먹밥에는 단무지가 많고 날치알 맛은 별로 안나요.달걀찜 7000원 넘 비싸서 안시켰어요. 일하시는 분(아주마니) 무뚝뚝~ 좀 미소지어주세요. 웃으면 모두 기분 좋잖아요?^^복도 온대요~~,2023-07-08,점심에 방문,특별한 메뉴가 있어요,1186,1
38011060,바보3854,맛있고 분위기가 좋아용,2023-07-07,저녁에 방문,음식이 맛있어요,84,1
38011060,유쉥,엄마카드로 사먹어서 영수증 뒤늦게 발견! 부랴부랴 한달지나쓰는 리뷰닭발 쫀득쫀득 갈비 달달구리라면 칼칼리뷰쓰는 지금 또 침이 싹 고인다술 없이 먹었는데도 맛있었다🔅,2023-07-07,점심에 방문,직접 잘 구워줘요,186,1
38011060,Nepturus,떡뽁이 양념 잔뜩 묻힌 닭발 .  돼지갈비는  단짠 단짠 ..,2023-07-01,저녁에 방문,가성비가 좋아요,39,1
38011060,주기록,"맵싹한 무뼈닭발에 계란찜 주문하니 둘이서 소주2병, 막걸리 2병 뿌쉈습니당~ 사장님 친절하시구 안주 맛있어요!!!",2023-07-01,저녁에 방문,음식이 맛있어요,195,1
38011060,dld****,무난,2023-06-30,저녁에 방문,,586,2
38011060,의정부쩡시리,십년만에 찿아갔지만 10년전 그대로 맛을 유지하고 닭발과 갈비의 연탄불불맛이 예술입니다~~^^시간되시면 꼭 한번 가봐야할 맛집입니다,2023-06-28,저녁에 방문,음식이 맛있어요,58,1
38011060,요정카부,뼈있는 닭발 넘 맛있음!!!맵기 조절이 안된다고 하셔서 아쉬웠지만 주먹밥이랑 같이 잘 먹었슴돼지갈비도 좀 달달하긴 하지만 밥이랑 같이 먹으면 맛있어용그리고 라면은 무조건 주문하세오ㅜㅅㅜ술 마시먄서 해장하는 기분 !!라면도 꽤 매워용!!바쁜데도 친절하셔서 좋아써욘,2023-06-24,"밤에 방문, 예약 없이 이용, 대기 시간 바로 입장, 데이트, 연인・배우자",친절해요,478,1
38011060,개미누나,오늘은 볶음밥에 똥집 ㅋ.ㅋ.ㅋ.ㅋ.ㅋ.ㅋ똥집더 마싯다구여 마니 먹어달라구여!~~~~,2023-06-23,저녁에 방문,음식이 맛있어요,659,13
38011060,wpen3000,좋아요,2023-06-15,저녁에 방문,음식이 맛있어요,276,2
38011060,요디제이뽕디스뽜리,역시 닭발이 맛있어요,2023-06-12,저녁에 방문,음식이 맛있어요,356,5
879873274,컨컨,기본반찬이 맛있고 냉삼 진짜 맛도링ㅎㅎ,2025-04-04,"저녁에 방문, 예약 없이 이용, 대기 시간 바로 입장, 친목, 친구",음식이 맛있어요,10,1
879873274,보헤미안610498,얼마전에 다른곳에서 자리를 옮기셔서 처음 와봤는데 이전보다 뷰도 좋고 더 분위기도 좋았던 것 같습니다맛은 여전히 맛있어요 !,2025-04-01,"저녁에 방문, 예약 없이 이용, 대기 시간 바로 입장, 회식, 지인・동료",음식이 맛있어요,6,1
879873274,박지현6971,맛있어요,2025-03-31,"저녁에 방문, 예약 없이 이용, 대기 시간 바로 입장, 데이트, 연인・배우자",음식이 맛있어요,534,1
879873274,pjhcomeback,너무 맛있어요 .이제부터 냉삼은 청춘상회입니다. 반찬이며 고기며 짱입니다 ㅋ 꼬들살꼭드세요,2025-03-28,"저녁에 방문, 예약 없이 이용, 대기 시간 바로 입장, 데이트, 연인・배우자",음식이 맛있어요,39,1
879873274,모노인사이드44,기본으로 나오는 김치찌개가 맛있고고기도 맛있게 잘먹었어요!,2025-03-27,"저녁에 방문, 예약 없이 이용, 대기 시간 바로 입장, 일상, 기타",음식이 맛있어요,37,1
879873274,qpa****,사장님도 친절하시고 고기도 맛있었어요!사이드가 다양하고 김치찌개도 너무 맛있어요 ㅎㅎ비빔면 서비스 감사합니다!!😊,2025-03-25,"저녁에 방문, 대기 시간 바로 입장, 친목, 일상, 친구",음식이 맛있어요,4,1
879873274,평평47,"매장도 깨끗하고, 사장님 너무 친절하시고, 기본찬 너무 좋고.. 너무 좋아요!!!!",2025-03-21,"저녁에 방문, 예약 없이 이용, 대기 시간 바로 입장, 일상, 친구",가성비가 좋아요,35,1
879873274,치치8350,사장님이 친절하시고 음식이 너무 맛있어요!!,2025-03-21,"저녁에 방문, 예약 없이 이용, 대기 시간 바로 입장, 친목, 친구",음식이 맛있어요,16,1
879873274,쓰리봉0103,9시넘어서 가니 한가롭게 이용 가능했어요 ☺️이사하기 전부터 종종 가던곳이었는데 2층 이사가고는 처음 왔네요 ㅎㅎ 고기는 전보다 더 맛있어진 느낌 ㅎㅎ 맛있게 잘 먹구 왔어요 ㅎ,2025-03-19,"밤에 방문, 예약 없이 이용, 대기 시간 바로 입장, 데이트, 연인・배우자",음식이 맛있어요,29,1
879873274,oth****,새볔에 냉삼땡겨서 먹었는데맛났어요식당바닥이 마니미끌거리던데 그것만 참고해주심 굿^^,2025-03-18,"아침에 방문, 예약 없이 이용, 대기 시간 바로 입장, 친목, 친구",음식이 맛있어요,31,1
879873274,빼빼로7482,고기도 너무 맛있고 사장님도 너무 친절하셔용 ㅜㅜㅜ매장 너무 깨끗하구 또올게용 사쟝님💗❕‼️,2025-03-16,"밤에 방문, 예약 없이 이용, 대기 시간 바로 입장, 친목, 지인・동료",친절해요,30,1
879873274,식이90,너무 맛있게 먹고 가고 또 놀러오고 싶어요!,2025-03-13,"밤에 방문, 예약 없이 이용, 대기 시간 바로 입장, 데이트, 연인・배우자",음식이 맛있어요,15,1
879873274,탕큰,고기도 밑반찬도 비빔면도 최고최고❣️❣️넘 잘먹었습니당,2025-03-12,"밤에 방문, 예약 없이 이용, 대기 시간 바로 입장, 데이트, 연인・배우자",음식이 맛있어요,11,1
879873274,애기덕후,냉삼이 먹고싶어서 찾아왔습니다~! 냉삼도 맛있고 꼬들살도 시켜먹어봤는데 정말 꼬들꼬들 맛있었어요!! 미나리도 맛있고 다른 반찬들도 다 맛있습니다!! 괜히 청춘상회가 아니네요 추억의 노래들이 나와요🥰노래 선정도 아주 굿👍🏻👍🏻또 올게요~!💞💞,2025-03-09,"밤에 방문, 예약 없이 이용, 대기 시간 바로 입장",매장이 넓어요,155,1
879873274,서성거리다,냉삼 먹고 싶어서 그냥 들어왔는데 가게 인테리어도 레트로에 분위기 좋았고 밑반찬도 푸짐하고 고기도 너무 맛있었습니다!! 그리고 라면 진짜 레전드로 맛있어요 꼭 드셔보세요,2025-03-07,"저녁에 방문, 예약 없이 이용, 대기 시간 바로 입장, 데이트, 연인・배우자",인테리어가 멋져요,3,1
879873274,펭수도라펭도라,"존맛탱 고기, 존맛탱 반찬+++++!!!!! 신당동에 이런곳이..사장님 센스도 쩔어요.. 그리고 고기 너무 맛있어요..❣️❣️❣️ 담에 또 올게요 신당동 존맛탱집입니다💖",2025-03-03,"저녁에 방문, 예약 없이 이용, 대기 시간 바로 입장, 친목, 회식, 지인・동료",음식이 맛있어요,24,1
879873274,난 기밍이야,첫방문인데 너무너무 만족스럽네요 !! 기본 반찬들도 넉넉하구 다양하게 나오고 너무 맛있어용 😗😗 냉삼 또 먹고싶을때 한번 더 방문하고 싶어요 !!,2025-02-25,"아침에 방문, 예약 없이 이용, 대기 시간 바로 입장, 일상, 부모님",음식이 맛있어요,5,1
879873274,서울T현케이,와이프가  꼭 가자고해서 따라왔는데 너무 맛있습니다 사장님도 너무 친절하고 고기맛도좋고 노래선곡센스 최고입니다 냉삼은 말모말모 다맛잇어요 😀,2025-02-20,"저녁에 방문, 예약 없이 이용, 대기 시간 바로 입장, 가족모임, 연인・배우자",음식이 맛있어요,9,1
879873274,여행가고싶당36,진짜 너무 맛있어요 ㅠㅠㅠ 꼭 방문하세요,2025-02-19,"저녁에 방문, 예약 없이 이용, 대기 시간 바로 입장, 친목, 친구",음식이 맛있어요,47,1
879873274,Stanleyyy,,2025-02-16,"저녁에 방문, 예약 없이 이용, 대기 시간 바로 입장, 친목, 친구",음식이 맛있어요,377,1
879873274,dla****,자리 옮긴 위치가 훨씬 접근성이 좋은거 같아요! 반찬이나 고기도 이전과 똑같이 맛나요!!! 특히 꼬소한 볶음밥과 여기 밑반찬이 킥입니다,2025-02-15,"저녁에 방문, 예약 없이 이용, 대기 시간 바로 입장, 데이트, 연인・배우자",음식이 맛있어요,9,1
879873274,polo3636,너무 맛있어용~~^^,2025-02-13,"밤에 방문, 예약 없이 이용, 대기 시간 바로 입장, 친목, 친구",음식이 맛있어요,132,1
879873274,기적의세대,,2025-02-12,"아침에 방문, 예약 없이 이용, 대기 시간 바로 입장, 친목, 친구, 친척・형제",음식이 맛있어요,4,1
879873274,Jk311,떡볶이 타운으로 옮기기 전부터 몇번 갔었는데 신당 고기집 중에 제일 맛있어요 고기도 맛있고 밑반찬으로 나오는 김치찌개도 맛있어요,2025-02-11,"저녁에 방문, 예약 없이 이용, 대기 시간 바로 입장, 데이트, 일상, 연인・배우자",음식이 맛있어요,6,1
879873274,미카언니,동네에서 대패삼겹살 찾다가 정착했어요!!장소도 넓고 쾌적하고 고기도 맛있어요 반찬도 감동스럽네요😍👍직원분들도 친절하세영 다른 분들도 노래 좋고 분위기 좋다고 리뷰 쓰셨던데 동감입니당😉,2025-02-11,"저녁에 방문, 예약 없이 이용, 대기 시간 바로 입장, 일상, 연인・배우자",음식이 맛있어요,1039,1
879873274,정말괜찮은곳 or 너무별로인곳만,처음왔는데 고기도 맛있고 밑반찬 구성도 엄청나네요! 단골 예정입니다ㅎ.ㅎ,2025-02-11,"밤에 방문, 예약 없이 이용, 대기 시간 바로 입장, 데이트, 연인・배우자",음식이 맛있어요,29,1
879873274,병호형38,고기도 야들야들 맛있고 반찬도 맛있어요~서비스 김치찌게도 정~말 맛있어요~사장님도 친절 하시고 새벽에도 영업해서 정말 좋아요~~,2025-02-10,"아침에 방문, 예약 없이 이용, 대기 시간 바로 입장, 일상, 연인・배우자",음식이 맛있어요,52,1
879873274,kkp****,,2025-02-09,"저녁에 방문, 예약 없이 이용, 대기 시간 바로 입장, 친목, 연인・배우자, 친구",음식이 맛있어요,9,1
879873274,p2starag,올랜만에 냉삼먹엇는데 너무맛잇구 쫄깃해요~오늘저녁초이스 굿이요,2025-02-09,"저녁에 방문, 예약 없이 이용, 대기 시간 바로 입장, 친목, 친구",단체모임 하기 좋아요,4,1
879873274,ji****,냉삼땡길때마다 오는곳이예요~이사하시고 첨왔는데 2층뷰도 좋으네요! 구성이 실해서 자주찾는곳이예요~~항상 뒤끝이 깔끔한곳이예요~~~변함없는맛에 또 맛있게먹구 갑니다~~^^ 수고하세요~!!!!^^번창하세요!!!!!,2025-02-08,"밤에 방문, 예약 없이 이용, 대기 시간 바로 입장, 일상, 연인・배우자",음식이 맛있어요,10,1
879873274,부동산알려주는언니,냉삼 먹고 싶었는데 맛있게 먹고 갑니다 😉,2025-02-07,"저녁에 방문, 예약 없이 이용, 대기 시간 바로 입장, 데이트, 연인・배우자",음식이 맛있어요,18,1
879873274,kwo****,냉삼이 양도 많고 밑반찬이 엄청많아용! 집반찬처럼 나와서 조아써용,2025-02-07,"아침에 방문, 예약 없이 이용, 대기 시간 바로 입장, 데이트",음식이 맛있어요,14,1
879873274,VchV,내부가 깔끔하고 고기질이 아주 좋습니다:),2025-02-07,"밤에 방문, 예약 없이 이용, 대기 시간 바로 입장, 친목, 친구",고기 질이 좋아요,54,1
879873274,llllllllll27,,2025-01-27,"저녁에 방문, 예약 없이 이용, 대기 시간 바로 입장, 일상, 친구",음식이 맛있어요,22,1
879873274,캐롤라인1159,고기가 완전 실하고 반찬도 맛있고 레트로 쵝오가게도 완전 친절하고 깨끗해요왕따봉~~~,2025-01-27,"저녁에 방문, 예약 없이 이용, 대기 시간 바로 입장, 친목, 친구",음식이 맛있어요,93,1
879873274,jen****,"연휴 마지막엔 냉삼에 소주죠최고 맛있습니다 ,,",2025-01-27,"밤에 방문, 예약 없이 이용, 대기 시간 바로 입장, 데이트, 연인・배우자",음식이 맛있어요,7,1
879873274,jin****,운동후 친구들과 함께 먹으러왔는데 냉삼미쳤습니다.신당동에서 제일 맛있는 냉삼집 추천!반찬도 다양하고 서비스 찌개까지 떡볶이 먹으러왓디가 홀려서 들어갓는데 맛도 미쳣고 사장님도 엄청 친절하세요..!,2025-01-24,"저녁에 방문, 예약 없이 이용, 대기 시간 바로 입장, 친목, 친구",뷰가 좋아요,13,1
879873274,hy****,"지금 이 자리로 이사오기시 전부터 이용햇어요~ 다섯번정도 온것 같습니다 여기는 맛도 잇고 가성비도 진짜 좋아요~~ 사장님도 친절하시고, 냉삼먹기 완젼 딱 좋습니다 굿굿 오래오래 장사하세영",2025-01-23,"밤에 방문, 예약 없이 이용, 대기 시간 바로 입장, 데이트, 연인・배우자",친절해요,41,1
879873274,로마인32,가성비 좋고 도시락통에 나오는 반찬이 맛있고 좋아요,2025-01-21,"저녁에 방문, 예약 없이 이용, 대기 시간 바로 입장, 가족모임, 아이",음식이 맛있어요,4,1
879873274,qka****,저는 맛있으면 웁니다..༼༎ຶ۝༎ຶ༽우워어어어어엌!!!!!!!༼༎ຶ۝༎ຶ༽우워어어어어엌!!!!!!!༼༎ຶ۝༎ຶ༽우워어어어어엌!!!!!!!༼༎ຶ۝༎ຶ༽우워어어어어엌!!!!!!!༼༎ຶ۝༎ຶ༽우워어어어어엌!!!!!!!༼༎ຶ۝༎ຶ༽우워어어어어엌!!!!!!!༼༎ຶ۝༎ຶ༽우워어어어어엌!!!!!!!,2025-01-20,"아침에 방문, 예약 없이 이용, 대기 시간 바로 입장, 데이트, 연인・배우자",음식이 맛있어요,7,1
879873274,추루츄,굿,2025-01-18,"아침에 방문, 대기 시간 바로 입장, 친목",음식이 맛있어요,916,4
879873274,16번째쩝쩝박사,"우정 닭발 먹으려고 왔다가 대기있어서 걸어두고, 간단하게 삼겹살 먹고 가야지~ 했는데, 아주 제대로 식사를 했네요! 고기 질이 일단 좋고요! 다른 야채들도 신선해요!! 쌈야채가 달아여 달아",2025-01-17,"저녁에 방문, 예약 없이 이용, 대기 시간 바로 입장, 친목, 친구",음식이 맛있어요,108,1
879873274,jsy****,신당동 주민 1등 맛집 등극🤪평소 지나가다가 청춘상회 보고 남푠이랑 다음에 한번 가보자~하고 오늘 드디어 방문 했어요! 떡볶이 타운안에 있어서 위치도 너무 좋구요!! 무엇보다 꼬들살이 미쳤어요…처음 먹어보는 고기맛이예요 고기러버 우리 부부는 푹 빠질거 같아요 아침 8시 까지 영업이라니 술쟁이 우리 부부는 ..딱 찜콩했어요!!ㅎㅎㅎ 반찬도 괜찮고 무엇보다 사장님 서비스가 너무 좋아요!!! 강추입니다🫶,2025-01-17,"아침에 방문, 예약 없이 이용, 대기 시간 바로 입장, 데이트, 연인・배우자",음식이 맛있어요,5,1
879873274,앨리스8094,"꼬들살 진짜 너무너무 맛있어요!!! 완전 강추최근에 간 냉삼집 중에 제일 맛있어요:)기본으로 김치찌개랑 여러가지 반찬 나와서 좋네요한라산, 클라우드, 칭다오 등 소주/맥주 종류도 다양해서 취향대로 마실 수 있어요ㅎㅎㅎ오랜만에 맘에드는 혜자 고기집 발견해서 넘 좋습니다",2025-01-16,"저녁에 방문, 예약 없이 이용, 대기 시간 바로 입장, 나들이, 친구",뷰가 좋아요,53,1
879873274,Skrkdgo,알배추가 너무 맛있어서 지인이 자꾸 훔쳐먹으려합니다.존맛탱 맛집,2025-01-16,"밤에 방문, 예약 없이 이용, 대기 시간 바로 입장, 친목, 친구, 지인・동료",음식이 맛있어요,20,1
879873274,황예진0,냉삼겹이지만 잡내가 없고 깔끔해요 야채들도 신선함니다 ! 은박지 자주 갈아주셔서 깨끗하게 먹을 수 있었어요 !!,2025-01-15,"밤에 방문, 예약 없이 이용, 대기 시간 바로 입장, 친목, 회식, 지인・동료",단체모임 하기 좋아요,6,1
879873274,supak79,너무 맛있어서 사진이 없어요.이전에 큰길에 있을 때부터 단골인데역시는 역시입니다.근무하시는 분들 너무 친절하시고 매장도 깨끗해요.고기먹고 볶음밥  비빔면은 후회없는 선택이였습니다.,2025-01-14,"저녁에 방문, 예약 없이 이용, 대기 시간 바로 입장, 친목, 지인・동료",음식이 맛있어요,32,1
879873274,hbhbhbhbhbhbhb,이전 하기 전에도 몇 번 왔었는데 반찬도 다양하고 고기도 맛있어요!!,2025-01-12,"저녁에 방문, 예약 없이 이용, 대기 시간 바로 입장, 일상, 친척・형제",친절해요,5,1
879873274,446281,사장님 너무 친절하시고 고기 맛있어요!!반찬도 잘 나와서 맛있게 먹었습니다 !,2025-01-12,"밤에 방문, 예약 없이 이용, 대기 시간 바로 입장, 친목, 지인・동료",음식이 맛있어요,3,1
879873274,woo****,마싯어요! 또 오고싶어요 사장님도 칰절하세요 ㅠ,2025-01-11,"저녁에 방문, 예약 없이 이용, 대기 시간 바로 입장, 데이트, 연인・배우자",양이 많아요,30,1
879873274,eu****,예전부터 알고맀었지만 !¡ 지인들 덕분에 처음와보는데 너무 좋아요 음악 선택부터 냉삼은 말해못해 👍🏻👍🏻사장님도 쿨하시고 털털 그자체 너무 잘먹고해서 술도 꿀떡꿀떡 넘어가네요 🧡❤️동네근처라 재방문 그자체 👍🏻,2025-01-11,"저녁에 방문, 예약 없이 이용, 대기 시간 바로 입장, 친목, 친구",음식이 맛있어요,20,1
879873274,크랭커호소인,앙 맛도리~ 아주 맛나용💚,2025-01-09,"아침에 방문, 예약 없이 이용, 대기 시간 바로 입장, 친목, 회식, 지인・동료",음식이 맛있어요,41,1
879873274,ya****,냉삼이 너무 맛있고 서비스 도 친절하시고 및반찬이 너무 잘나와여 꼭 다사올게요,2025-01-08,"아침에 방문, 예약 후 이용, 대기 시간 바로 입장, 친목, 친구",음식이 맛있어요,5,1
879873274,Ppol,새벽에 냉삼먹을수 있는 유일한 곳사장님도 친절하고 이번에 위치를 이전했는데 더 쾌적해진거같아요~! 고기는 역시나 맛있어용 짱짱,2025-01-08,"아침에 방문, 예약 없이 이용, 대기 시간 바로 입장, 친목, 지인・동료",음식이 맛있어요,3,1
879873274,따이릉,너무 맛나고 양도 많고 반찬 10사기~~!,2025-01-08,"밤에 방문, 예약 없이 이용, 대기 시간 10분 이내, 나들이, 친구",음식이 맛있어요,33,1
879873274,gge****,사장님 너무 친절하시고 일단 고기가 너무 맛있어요~~데이트는 신당 청춘상회 강추!!!,2025-01-07,"저녁에 방문, 예약 없이 이용, 대기 시간 바로 입장, 데이트, 연인・배우자",음식이 맛있어요,3,1
