place_id,nickname,content,date,situations,keywords,review_count,visit_count
1422592463,Kkae,고터에 먹을곳이 진짜 마땅하지 않은데 그중엔 좋은 것 같아요. 인테리어도 그렇고 자리배치라든가 음악이라든가 컨셉이 뭔가 브런치 느낌은 아니긴 한데 그래도 맛있고 가볍게 먹기 좋아요. 고터 갈때마다 갑니다!!갈때마다 사람이 많아져서 그런지 점점 시끄러워지고 있는데 음악을 좀 더 잔잔하게 틀면 사람들도 조용하게 말하지 않을까 싶어요....,2025-01-18,"점심에 방문, 예약 없이 이용, 대기 시간 바로 입장, 친목, 친구",음식이 맛있어요,10,1
1422592463,kim4786,브런치 메뉴가 다양해요,2024-12-29,"점심에 방문, 예약 없이 이용, 대기 시간 바로 입장, 친목",음식이 맛있어요,514,1
1422592463,상냥모드,3시까지 브런치주문시 커피2잔 + 브런치1개 20900원입니다. 양은 많지않아요~여러브런치집을 다녔지만 서울이라 양이 적은감이 있음. 커피는 시키지마세요. 보리차느낌이 ~5천원입니다.재방문의사없음.,2024-12-25,"점심에 방문, 예약 없이 이용, 대기 시간 바로 입장, 데이트, 연인・배우자",음식이 빨리 나와요,1318,1
1422592463,핑크유진맘99,"브런치플레이트,마르게리타피자,까르보나라파스타 먹었어요~친구가 여기 인기많은데 갔다고 가보자고해서 10:30쯤 갔는데 오픈일찍하나봐요.바로 들어갔어요.생각보다 캐주얼레스토랑 편안한 느낌이었어요.음식 다 맛있었어요.가성비도 좋고요.파미스테이션쪽 식당만 가다가 경부선버스 1번쪽 식당은 처음가봤어요.스타벅스 바로 옆이에요.다들 힘들게 찾아왔네요.이쪽은 파미스테이션쪽 식당보다 사람들이 덜 붐볐어요.여유로운 시간때에 와서 대화많이 나누고 잘있다가 갑니다.",2024-12-22,"점심에 방문, 예약 없이 이용, 대기 시간 바로 입장, 친목, 친구",대화하기 좋아요,515,1
1422592463,JiW,😔😫,2024-12-15,점심에 방문,매장이 넓어요,511,1
1422592463,내일은 행복,맛있게 잘 먹었어요~특히 봉골레~~,2024-12-14,"저녁에 방문, 예약 없이 이용, 대기 시간 바로 입장, 일상, 친구",음식이 맛있어요,2155,1
1422592463,Elephant,신선해서 좋아요!,2024-12-14,"점심에 방문, 예약 없이 이용, 대기 시간 10분 이내, 친목, 친구",음식이 맛있어요,2296,1
1422592463,반짝반짝설레이는,오전 9시부타 오픈해요. 고속터미널 내에서 아침 일찍 방문하기 좋아요.브런치 메뉴 있어요. 대화 나누기 좋아요. 주말에는 사람 많습니다.,2024-12-14,"점심에 방문, 예약 없이 이용, 대기 시간 바로 입장, 데이트, 친구",음식이 맛있어요,3872,2
1422592463,Lovely DD,맛있게 잘 먹고 갑니다~~피자랑. 파스타 맛나네요!!,2024-12-10,"저녁에 방문, 예약 없이 이용, 대기 시간 바로 입장, 일상, 부모님",음식이 맛있어요,1672,1
1422592463,애기씨55,너무 시끄라워서 소리질러가며 얘기해야해요음식이 조금 나오는데  맛이 없어서 남겻어요피자도우는 어떻게구워는지 딱딱하고 질겨요  이게화덕피자 맛는지...스파게띠안에 고기는 햄같아요 오래된느낌 ㅠㅠ가격은 잇는데 푸드코트 느낌입니다,2024-12-08,"점심에 방문, 예약 없이 이용, 대기 시간 바로 입장, 친목, 친구",,67,1
1422592463,Rachel8,조용하고 가성비 좋아요,2024-12-08,점심에 방문,음식이 맛있어요,336,1
1422592463,데이롱,라구파스타 먹었는데 위에 떡갈비같은게 맛있었어요!!!파스타는 사실 평범했는데 피자맛집이라 하니 다음엔 피자를 먹어보겠습니다🤔,2024-12-07,"점심에 방문, 예약 없이 이용, 대기 시간 바로 입장, 친목, 친구",건강한 맛이에요,43,1
1422592463,이끌리어82,,2024-11-28,"저녁에 방문, 예약 없이 이용, 대기 시간 바로 입장, 친목, 친구",음식이 맛있어요,1201,1
1422592463,나나아a,고속터미널맛집❤️ 브런치하기 좋은 메뉴 많아서 종종 가요 외식하면 조미료 듬뿍에 자극적인 음식 많은데 시그니처랩은 건강하게 맛있는 브런치 할 수 있어서 좋더라구요 미국산 부채살 스테이크샐러드는 제 최애입니다 고기 진짜 부드럽고 특히 감자가 미쳤어요❤️ 레시피를 훔치고 싶을정도로 바삭하고 맛있습니다👍👍👍 이러다 알바 할지경크리스마스 분위기로 꾸며져 있어 매장 예뻐서 좋았어요 믿고 가는 고터맛집입니다!!,2024-11-27,"아침에 방문, 예약 없이 이용, 대기 시간 바로 입장, 일상, 혼자",음식이 맛있어요,122,1
1422592463,주변탐방하는 틴트,새로나온 뇨끼를 먹었는데 꾸덕하니 맛있더라구요ㅋㅋ자몽에이드도 진짜 괜찮았어요그리고버섯샐러드와 아메리카노 세트를 시켰었는데ㅋㅋㅋ샐러드양이생각보다적어서 깜짝놀랬어요.ㅋㅋ거기에비에 버섯과 드레싱의조화가 좋았답니다..조금많이 비쌌지만 자리세가있으니 ㅋㄱ그래도맛있게먹고갑니다.,2024-11-24,"아침에 방문, 예약 없이 이용, 대기 시간 바로 입장, 일상, 부모님",음식이 맛있어요,620,1
1422592463,하엘25,,2024-11-20,"점심에 방문, 예약 없이 이용, 대기 시간 바로 입장, 친목",음식이 맛있어요,914,1
1422592463,타오바오79,시그니처 리조또가 맛났어요,2024-11-20,"점심에 방문, 예약 없이 이용, 대기 시간 바로 입장, 일상, 연인・배우자",음식이 맛있어요,28,1
1422592463,드론쿵타이거,근처 볼일보러왓다가 들름너무 잘 먹었네요 피자도 새로 생긴거같은데 담에꼭 먹어부야겠어요 이거 빨강밥 아주 맛있네요 보리밥 느낌도나고 아주맛남까르보나라도 일품입니다 개꿀띠,2024-11-16,"점심에 방문, 예약 없이 이용, 대기 시간 바로 입장, 데이트, 연인・배우자",음식이 맛있어요,18,2
1422592463,0812lyj,전반적으로 맛있어요. 빵만 빼구~ 감자가 예술이네요.,2024-11-03,"점심에 방문, 예약 없이 이용, 대기 시간 바로 입장, 데이트, 연인・배우자",음식이 맛있어요,1586,1
1422592463,안주탐험가,피자 사이즈가 작네요- 너무 시끄럽긴 했는데 맛은 있어요. 치킨 샐러드에 치킨이 생각했던 치킨이 아니었어요. 훈제였던 것 같은데 삶은거나 튀긴게 나을 듯요,2024-10-20,"점심에 방문, 예약 없이 이용, 대기 시간 바로 입장, 친목, 친구",음식이 맛있어요,1153,1
1422592463,No1하양이,아침일찍도착해도 부담없이 가서 먹기좋은곳입니다 음식도 맛있고 좋아요!,2024-10-20,"점심에 방문, 예약 없이 이용, 대기 시간 바로 입장, 데이트, 연인・배우자",음식이 맛있어요,511,1
1422592463,김병준89,고속터미널 영동선 안에 위치한 맛집 시그니처랩 반포점! 신선한 부라타샐러드와 꾸덕한 까르보나라의 조합이 아주 만족스러운 식사였습니다!^^,2024-10-16,"저녁에 방문, 예약 후 이용, 대기 시간 바로 입장, 친목, 친구",음식이 맛있어요,102,1
1422592463,블루문6251,굿,2024-10-14,"점심에 방문, 예약 없이 이용, 대기 시간 바로 입장, 친목, 친구",음식이 맛있어요,1274,1
1422592463,who am I,일찍 문을 연다는것만좋네요. 브런치메뉴중 아보카도메뉴먹었는데 좀 부실합니다.,2024-10-03,"아침에 방문, 예약 없이 이용, 대기 시간 10분 이내, 친목, 친구",건강한 맛이에요,1232,1
1422592463,현명한지햇님,진짜 가성비도 좋고 음식이 빨리 나와서 좋았구요음식도 맛있었어요 🩷,2024-10-01,"점심에 방문, 예약 없이 이용, 대기 시간 바로 입장, 나들이, 친구",음식이 맛있어요,251,1
1422592463,먹보네,"이른아침에 문연 브런치가게가 이곳 밖에 없길래 리뷰 안 좋은데 다녀갔습니다. 개인적으로 37.5가 더 나아보이고 음식먹으면서 카운터에 가 주문, 반납하고 식기, 티슈까지 고객이 다 챙겨야합니다. 체인점이라 다른 매장은 어떨지 모르겠지만 굳이 안가고싶어요.맛은 평범, 양 적고, 가격은 다른 브런치 매장들과 비슷하니 후기도 안좋을겁니다. 사람이 많은 날도 있는것같은데 웨이팅도 위치특성때문에 있는것같아요. 사람없을때 조용히 커피마시기 좋다는 말에는 동의해요. 조용합니다. 직원분들은 친절하신데 시스템이 불친절합니다.",2024-09-28,"아침에 방문, 예약 없이 이용, 대기 시간 바로 입장, 가족모임, 아이",,26,1
1422592463,수연332,양이 많진않지만 맛있어요. 알리오올리오 추천!,2024-09-26,"저녁에 방문, 예약 없이 이용, 대기 시간 바로 입장, 친목, 친구",음식이 맛있어요,689,1
1422592463,비 오는 맑은 날,공간도 예쁘고 간단히 식사하기 좋은 공간이에요.리조또가 젤 맛있었고 피자도 바질 소스 올라가 있어서 특별한 피자였습니다!마침 맥주도 할인중이라 시원하게 마셨습니다!,2024-09-23,"점심에 방문, 예약 후 이용, 대기 시간 바로 입장",음식이 맛있어요,1633,1
1422592463,설탕 소금,맛있어요!,2024-09-14,아침에 방문,음식이 맛있어요,523,4
1422592463,민샤민샤87,리조토가 맛있어요,2024-09-12,"아침에 방문, 예약 없이 이용, 대기 시간 바로 입장, 친목, 친구",음식이 맛있어요,785,2
1422592463,Sandra Kao,맛있게 먹었어요!,2024-09-09,"점심에 방문, 예약 없이 이용, 대기 시간 바로 입장, 나들이, 친구",대화하기 좋아요,174,1
1422592463,ans****,굿,2024-09-05,점심에 방문,,1472,1
1422592463,WOOKS,"친절하십니다.맛있습니다.샹그리아 강추합니다!!!양 든든합니다.식사도, 음료도 하기 좋은곳입니다.",2024-09-03,"저녁에 방문, 예약 없이 이용, 대기 시간 바로 입장, 나들이, 일상, 지인・동료",음식이 맛있어요,253,1
1422592463,GomS,매장 깔끔하고 직원분들 엄청 친절하십니다.담소나누며 식사하기 좋습니다.음식 양 넉넉하고 맛있습니다.음식없이 음료 주문하고 들러가기도 편합니다.,2024-09-03,"저녁에 방문, 예약 없이 이용, 대기 시간 바로 입장, 친목, 지인・동료",음식이 맛있어요,103,1
1422592463,Heidi39,맛있고 매장이 넓어요,2024-08-31,"저녁에 방문, 예약 없이 이용, 대기 시간 바로 입장, 친목, 지인・동료",음식이 맛있어요,728,1
1422592463,nadohe67,"식사를 한식으로 한지라 커피만 마시려고 들어갔슴다고터 특서상 여기저기 다 시끄러운데 식사타임이 끝난뒤 커피 마시는 사람은 많지 않아 지방가는 친구와 조용히 얘기 하기 좋았어요~~사실 두번째 방문,두번다 커피만담에는 피자와 파스타를 먹어 봐야겠어요",2024-08-28,"점심에 방문, 예약 없이 이용, 대기 시간 바로 입장, 일상, 친구",친절해요,670,1
1422592463,정말쟁이,굿굿,2024-08-24,점심에 방문,음식이 맛있어요,463,1
1422592463,샬롬 SHALOM,여러 지역에서 모여서 만나기 좋아요,2024-08-19,"점심에 방문, 예약 없이 이용, 대기 시간 바로 입장, 나들이, 친구",음식이 맛있어요,1594,1
1422592463,bok****,피자에 치즈가 쫄깃쫄깃 맛있어요,2024-08-16,"점심에 방문, 예약 없이 이용, 대기 시간 바로 입장, 데이트, 연인・배우자",음식이 맛있어요,2175,1
1422592463,룰루삐삐,메뉴가 싹 바뀌었네요.기존에 있던 스테이크 샐러드 피자가 없어진게 아쉬워요,2024-08-14,점심에 방문,친절해요,764,2
1422592463,오호호29,고속터미널치고는 조용한 느낌이어서 북적이지 않게 식사하기에는 좋은것 같아요. 그런데 음식이 아쉬웠어요.. 샐러드의 치킨이 딱 보기에도 살짝 오래되어보였는데 냄새도 좀 나고... 한입씩먹고 못먹었어요.. ㅠㅠ,2024-08-12,"점심에 방문, 예약 없이 이용, 대기 시간 바로 입장, 친목, 친구",,457,1
1422592463,이스트88,브런치 식당 일찍부터 여는 곳,2024-08-11,"점심에 방문, 예약 없이 이용, 대기 시간 바로 입장, 데이트, 연인・배우자",가성비가 좋아요,418,1
1422592463,보그복,모임하기에 좋은 장소 입니다~~,2024-08-10,점심에 방문,음식이 맛있어요,337,1
1422592463,코코아빙수와 눈꽃빙수,"메뉴가 좀 리뉴얼되었네요!!! 덮밥 종류가 없어졌네요!일부는 그대로 있고, 리조또가 생겼어요!!! 너무 좋네요!!!여기서 만들어주시는 과일주스가 참 좋았는데 없어져서 아쉽네요...ㅠㅠ그리고 이전에는 직원분이 불친절하다는 느낌을 받았는데직원분도 바뀌셨네요낭낭한 목소리로 상냥하게 말씀해주시네요 모든 손님한테..!인테리어가 이뻐서 좋지만 친절하셔서 더 좋은 거 같아요아쉬운건 셀프 서빙...ㅠㅠ그래도 잘 먹고 갑니다~!~!아, 리조또 맛있어요!!!! 먹다가 심심하면 셀프바에 있는 케찹 뿌려먹어도 좋을거 같아요!!재료가 다 신선!",2024-08-08,저녁에 방문,친절해요,855,4
1422592463,안녕하세요9667,"매콤김치필라프 맛있어요!파스타는 면이 덜 익은 느낌이었고, 사람이 많으니 조금 시끄러웠지만 가성비있게 먹었습니다!",2024-08-08,"점심에 방문, 예약 없이 이용, 대기 시간 바로 입장, 일상, 부모님",가성비가 좋아요,907,1
1422592463,블라초,"고터 경부영동선에서 혼밥 잘 할 줄 모르는 여자들이 특히 혼밥하기 편한 카페 겸 캐주얼 레스토랑. 샐러드, 피자와 파스타 등의 간단한 이탈리안 메뉴들이 여러 가지 있다. 레몬에이드 달달하면서 시큼하고 진한 스타일. 네이버에 ‘블라초블로그’ 검색",2024-07-30,"저녁에 방문, 예약 없이 이용, 대기 시간 바로 입장, 나들이, 일상, 부모님",음식이 맛있어요,1178,1
1422592463,씨뉴,"일요일 13시 30분 쯤에 들어가서 대기 없이 이용했어요!! 다들 맛있다고 하셨던 마르게리따 피자를 시켜보았습니다✨️쭈우욱 늘어나는 치즈 보이시나요?? 쫀득짭짤한 모짜렐라 치즈가 듬뿍 들어가 너무 맛있어요!! 위에 도르륵 뿌려진 바질페스토는 향긋하고, 구운 토마토는 따끈상큼해서 입맛을 싸악 잡아주네요💖 피자의 끄트머리 테두리까지, 화덕에서 구운 피자라 그런지 정말 고소하고 바삭해요!! 겉에 노릇노릇하데 구워진 부분이 아주 맛있었어요😋 하나도 남기지 않고 다 먹었습니다!! 수제로 만드신 것 같은 피클과 무는 아삭하고 새콤해서 피자에 새로움을 더해준다는 느낌!! 오늘도 맛있게, 잘먹었습니다!!",2024-07-28,"점심에 방문, 예약 없이 이용, 대기 시간 바로 입장, 나들이, 혼자",음식이 맛있어요,69,1
1422592463,hip****,가격도 착하고 맛도 있어요! 좋습니다! 좋아요!,2024-07-28,점심에 방문,음식이 맛있어요,2249,1
1422592463,류블리16,음식이 진짜 맛있어요!! 🥺🥺 피자도 두툼하고~~ 볼로네제 파스타가 짱맛있어유! 오픈 샌드위치도 넘 맛있어가지규 흡입하고 왔어용 🫧🫧🤍 터미널에서 기다릴때나 고터 방문할 때 강추합니닷!!,2024-07-26,"점심에 방문, 예약 없이 이용, 대기 시간 바로 입장, 친목, 부모님, 친척・형제",음식이 맛있어요,62,1
1422592463,빵미나링,고터오면 브런치집으로 종종 오게됩니다.가격대가 좀 있긴한데 전반적으로 메뉴들이 다  맛있어요.버섯 샐러드는 제 최애입니다. 양이 좀 더 많았으면 하는 바램이 있네요.,2024-07-24,"점심에 방문, 예약 없이 이용, 대기 시간 바로 입장, 데이트, 연인・배우자",음식이 맛있어요,487,1
1422592463,우리들의 우기,,2024-07-17,"저녁에 방문, 예약 없이 이용, 대기 시간 바로 입장, 친목, 친척・형제",음식이 맛있어요,240,4
1422592463,바른소리83,굿,2024-07-16,저녁에 방문,음식이 맛있어요,1257,1
1422592463,hea****,오픈시간이 빨라서 좋네요,2024-07-16,아침에 방문,음식이 맛있어요,1467,2
1422592463,biniping,월요일 18시에 가서 그런가 웨이팅없이 입장김볶이랑 차슈덮밥 둘다 굿#김치볶음밥 달다는 리뷰봤는대 달다는 느낌 크게 못느낌피자 파스타들도 ㅅㅌㅊ내 입맛엔 까보>봉골레>알리오올리오 순으로 맛있는듯스테이크 샐러드 알감자랑 마늘도 바삭하니 맛있음카운터 가서 주문 및 결재#음식 받는거 셀프#반납도 셀프,2024-07-15,"저녁에 방문, 예약 없이 이용, 대기 시간 바로 입장",음식이 맛있어요,816,1
1422592463,hea****,굿,2024-07-15,아침에 방문,음식이 맛있어요,1467,1
1422592463,루룰루룰루,완전 비추 .. 별로..,2024-07-13,"저녁에 방문, 예약 없이 이용, 대기 시간 바로 입장, 데이트, 연인・배우자",,1086,1
1422592463,tomatoys,아침일찍 여는 브런치카페라 너무 좋아요성모병원들렸다 아이와 들렸는데 맛도 있고 음식도 빨리나오고 친절해서 좋았습니다,2024-07-10,"아침에 방문, 예약 없이 이용, 대기 시간 바로 입장, 일상, 아이",친절해요,397,1
1422592463,어90,터미널 안 식당이라 사람 많아요 시끌시끌해서 같이 떠들기 좋아요,2024-07-07,"점심에 방문, 예약 없이 이용, 대기 시간 바로 입장, 친목, 지인・동료",음식이 맛있어요,439,1
1422592463,최고0428,"루꼴라 피자 19500원💸, 브런치 플레이트 17000원💸  콜라 3000원💸 무난하게 먹을만한 맛이에용😋 루꼴라는 제가 아는 루꼴라보다 향이 적더라구여.  피자 사이즈가 s라 두 분이서 충분히 먹을 수 있어요. 제가 도둑 관상인지 🥸 얼굴 보더니 핫소스는  뚜껑 빼고 주시더라구요.. 당황..  도둑 취급 당해서 기분이 안좋았어요.. 안 가져가는데;; 미니 사이즈라서 분실이 많아서 그런것같은데 손님 도둑취급하는 것보단 핫소스 큰 사이즈나 일회용을 두는게 좋아보여요.",2024-07-06,저녁에 방문,인테리어가 멋져요,377,1
1422592463,hot****,고터 브런치 맛집이에요토요일 10시20분쯤 왔는데 매장에 절반정도 손님이 차있고 나갈때보니 4팀정도 웨이팅이 있더라구요핫플이라 주말에는 좀 서둘러가는게 좋을것같아요재료도 너무 신선해서 맛있고 매장도 넓고 쾌적해서 자주 올거같아요직원분들도 친절하세요~,2024-07-06,"아침에 방문, 예약 없이 이용, 대기 시간 바로 입장, 데이트, 연인・배우자",음식이 맛있어요,20,1
1422592463,윤나맘,맛있어용,2024-07-04,"점심에 방문, 예약 없이 이용, 대기 시간 10분 이내, 친목, 친구",음식이 맛있어요,1239,1
1422592463,sub****,엄마랑 브런치 먹고왔어요~ 오전에 먹기 좋앗습니다ㅎㅎ,2024-06-24,"점심에 방문, 예약 없이 이용, 대기 시간 바로 입장, 일상, 부모님",음식이 맛있어요,103,1
1422592463,dy****,별로에요음식이 너무맛이없어요짜고 재료가 신선하지 않습니다,2024-06-22,"점심에 방문, 예약 없이 이용, 대기 시간 바로 입장, 데이트, 연인・배우자",,7,1
1422592463,유떠기,부모님과 함께 들렀습니다. 직원분들 친절하세요~^^그런데 음악소리가 너무큰것 같아요ㅠㅠ,2024-06-19,"점심에 방문, 예약 없이 이용, 대기 시간 바로 입장, 나들이, 부모님",음식이 맛있어요,244,1
1422592463,rulla32,,2024-06-17,아침에 방문,재료가 신선해요,1140,1
1422592463,쩝쩝박사 냠냠후기,"피자는 너무 맛있는데 차슈덮밥은 너무 아쉬워요ㅠ밥은 동남아 쌀밥같고 차슈가 맛없어요 ,,, ㅜ피자는 치즈 듬뿍이라, 도우가 바삭해서 맛있습니다!+ 선결제 시스템이고 퇴식구에 반납하고 가야해요거의 셀프 시스템입니다",2024-06-16,"저녁에 방문, 예약 없이 이용, 대기 시간 바로 입장",친절해요,292,1
1422592463,나나0102,음식은 맛있긴한데 공간이 작아서 그런지 엄청 시끄러워요밥 먹으면서도 귀가 아픈느낌 ㅜㅜ,2024-06-16,"점심에 방문, 예약 없이 이용, 대기 시간 바로 입장",음식이 맛있어요,618,1
1422592463,바른전달자,"트러플베이컨 피자 건강하고 신선한 맛.장소는 넓지 않은데 회전율 좋고, 피클이 직접만드는것 같더라구요 3번 리필해서 먹었어요. 라떼는 우유에서 특유의 냄새가 있어요. 서럽넣어먹으니 괜찮기는 했어요.",2024-06-15,"아침에 방문, 예약 없이 이용, 대기 시간 바로 입장, 일상, 친구",재료가 신선해요,923,1
1422592463,꾸꾸안이,,2024-06-13,"저녁에 방문, 친구",양이 많아요,3593,1
1422592463,아이란29,아점 먹기 좋아요,2024-06-11,"점심에 방문, 예약 없이 이용, 대기 시간 바로 입장, 친목, 친구",음식이 맛있어요,874,1
1422592463,스이 NP,"다른 브런치 매장들보다 훨씬 일찍 열어서 그 점이 최대 강점이 아닌가 합니다. 세트 메뉴의 가성비가 좋습니다. 브런치 플레이트와 루꼴라 피자 먹었는데, 재료도 좋고 맛도 괜찮은 편이어서 다음에 아침 일찍 오게되면 다시 방문하려고 합니다.",2024-06-08,"점심에 방문, 예약 없이 이용, 대기 시간 바로 입장, 친목, 친구",재료가 신선해요,29,1
1422592463,꼬부기맘21,브런치 먹기 좋아요 커피랑 세트메뉴가 있어 좋았어요다른건 다 맛있었는데 호밀빵만 별로였어요 ~잘먹고 왔어요~,2024-06-05,"아침에 방문, 예약 없이 이용, 대기 시간 바로 입장, 일상, 친척・형제",가성비가 좋아요,436,1
1422592463,뭘 이런걸다 ㅋ,고터가는길에 들렀어요. 두번째방문인데 오늘은  간이 좀 쎈거같았어요. 그래도 뭐.. 친구랑 밥먹기좋음 ~,2024-06-02,"점심에 방문, 예약 없이 이용, 대기 시간 바로 입장, 친목, 친구",음식이 맛있어요,10,1
1422592463,onion16,맛있는데 좀 짜요,2024-05-31,저녁에 방문,,1220,1
1422592463,용주24,런치 세트로 먹었는데 저렴하게 맛있어요커피도 맛있어요,2024-05-28,"점심에 방문, 예약 없이 이용, 대기 시간 바로 입장, 친목, 친구",음식이 맛있어요,452,1
1422592463,선652,이야기를 하기에는 조금 시끄러운 감이 있습니다. 음식은 맛있었어요,2024-05-26,"점심에 방문, 예약 없이 이용, 대기 시간 바로 입장, 친목, 일상, 친구",음식이 맛있어요,56,1
1422592463,uj****,맛잇고 ㅎㅎ 친절하심그러나 넘 시끄럽다ㅜㅜ,2024-05-26,"점심에 방문, 예약 없이 이용, 대기 시간 바로 입장, 친목, 친구",음식이 맛있어요,395,1
37086581,luxury23,분위기조코 맛조코 특히 전 전가복을 원래도 제일좋아하기도하지만 모던눌랑 전기복 추천합니다.전복도 많고 양도푸짐하고 만족이에요!!!!글고 제일마지막 주문한 후식도 꼭 드시고 나오세요.푸딩안좋아하는데 어쩜 이리맛좋았던지. 푸딩안좋아하셔도 꼭 드시고오세요.담에 또 갈께요!!!,2025-04-07,"저녁에 방문, 예약 후 이용, 대기 시간 바로 입장, 친목, 지인・동료",음식이 맛있어요,177,1
37086581,red****,"블루리본 받은곳이라고 해서 약간의 기대?하며 갔는데 코스요리 흐름 너무 끓기고, 음식 맛도 동네중국집정도의 맛, 음식 퀄리티도 떨어져요! 의자쇼파는 낡고 다시는 방문하고싶지 않네요! 기념일로 갔는데 옆에 텍사스갈걸 후회되네요",2025-04-04,"점심에 방문, 예약 후 이용, 대기 시간 바로 입장, 기념일, 연인・배우자, 아이",,21,1
37086581,mrs****,분위기 좋고 친절하고 음식도 맛있어요,2025-03-29,"점심에 방문, 예약 후 이용, 대기 시간 바로 입장, 친목, 지인・동료",음식이 맛있어요,7,1
37086581,Elisha03,"오늘 엄마와 제가 사랑하는 선생님 모시고 갔어요!!어머니돈어머니산.입니다ㅎㅎ(예약만 제가 했어용)안에 내부 인테리어도 예쁘고 층고가 탁트여있어서 좋았어요👍 안내도 너무 친절하셨어요!! 음식도 추천대로 시그니처로 상하이롤 플래터, 민트 라임 슈림프,동파육, 비빔탄탄면 그리고 볶음면시켜 먹었는데 완전 맛있었어요!! 제 원픽은 ""비빔탄탄면"", 엄마와 선생님 원픽은 마지막 사진에 나오는 볶음밥인데 메뉴이름이 생각이 안나네요ㅠ전부 단품으로 시켜 먹었는데 네이버메뉴판에서 이름을 못찾았어요..😂암튼 완전 추천합니다:))시간이 있었다면 조금 더 여유롭게 먹고 나올텐데 뒤에 일정이 있어서 12시 예약하고 가서 1시반쯤 나왔어용🥹다들 가족모임이나 깔끔하게 대접할 일 있을 때 방문해보세요~~!!",2025-03-28,"점심에 방문, 예약 후 이용, 대기 시간 바로 입장, 일상, 기타",친절해요,37,1
