place_id,nickname,content,date,situations,keywords,review_count,visit_count
1680628587,hyhh24,소고기와 돼지고기를 동시에 맛볼수있는게 큰 메리트인거 같아요 특히 소고기는 입에서 사르르 녹아 순삭했습니다 ㅎㅎ 후식으론 비냉 시켜서 삼겹살과 먹었는데 맛없을수없는 조합이었어요! 가족외식으로 재방문하고 싶은 곳입니다.*체험권을 제공받아 작성한 리뷰입니다*,2024-10-27,"저녁에 방문, 예약 후 이용, 대기 시간 바로 입장, 일상, 연인・배우자",음식이 맛있어요,7,1
1680628587,Lotus09,고기도 맛있었고 사장님 너무 친절하시고! 가게도 깨끗해서 재방문의사 뿜뿜하는 고기맛집이에요! ㅠㅠ,2024-10-24,"저녁에 방문, 예약 없이 이용, 대기 시간 바로 입장, 데이트, 연인・배우자",음식이 맛있어요,331,1
1680628587,emm****,밑반찬이랑 신선한 야채부터 정갈하게 나와서 기대했는데 고기도 맛있어요. 삼겹살이 보통 길죽한 삼겹이 아니고 동그랗데 생겨서 신기했는데 얇게 나와서 차돌박이 느낌으로 바로바로 구워 먹을수 있어서 좋았어요. 이베리코 갈비살도 쫄깃하고 맛있네요. 손님이 많은 이유가 있는 찐맛집! 3인분 시키면 김치찌개도 서비스로 주셔서 진짜 푸짐하게 먹었어요~ 찐솔밭공원역 맛집!!,2024-10-21,"저녁에 방문, 예약 없이 이용, 대기 시간 바로 입장, 친목, 친구",음식이 맛있어요,90,1
1680628587,하하오오히히,고기의 질과 맛이 아주 만족스럽습니다.생갈비살의 별미를 느껴보실분들은랑원담 꼭 방문해보세요.단골될것같습니다!!^^,2024-10-19,"저녁에 방문, 예약 없이 이용, 대기 시간 바로 입장, 친목, 연인・배우자",음식이 맛있어요,5,1
1680628587,아자이립,맨날 10시에 와서 11시에 나가는게 죄송하네요💦진짜 너무너무 맛있어서 여자친구랑 자려고 누우면 생각나서 벌떡 오고 있어요💦💦,2024-10-18,"아침에 방문, 예약 없이 이용, 대기 시간 바로 입장, 연인・배우자",음식이 맛있어요,13,1
1680628587,성유경17,소문자자한 랑원담역시가 역시입니다너무 친절하고 맛있어요,2024-10-12,"저녁에 방문, 예약 없이 이용, 대기 시간 바로 입장, 일상, 부모님, 기타",음식이 맛있어요,30,1
1680628587,장신은현장,처음 방문 했구요 블로그 보고 방문을 해봤는데 생각보다 더 만족 했구요 소갈비살 이거 정말 맛있어요 한번 드셔보세요들,2024-10-11,"저녁에 방문, 예약 없이 이용, 대기 시간 바로 입장, 데이트, 연인・배우자",음식이 맛있어요,42,1
1680628587,dongbang226,분위기좋고 맛있어요~,2024-10-11,"저녁에 방문, 예약 없이 이용, 대기 시간 바로 입장, 일상, 연인・배우자",음식이 맛있어요,1061,2
1680628587,dj4911,육회가 특히 맛있어요고기질도 좋고 가성비 좋아요자주올께요,2024-10-11,"저녁에 방문, 예약 없이 이용, 대기 시간 바로 입장, 가족모임, 연인・배우자, 아이",음식이 맛있어요,5,1
1680628587,Kenil,"쌍문동 고기집 완죤 추천해요!!날씨가 많이 추워서 뭐먹지 하다가 들어갔는데 소기기 진짜루 맛있었어요!!깔끔하고 이쁜 인테리어 외관이라 마음에 들었고, 직원분들도 너무 친절하시고 메뉴 추천도 잘해주셔서 너무 좋았어여!진짜루 잘먹었습니당 쌍문동 고기집 추천해요~",2024-10-09,"저녁에 방문, 예약 없이 이용, 대기 시간 바로 입장, 데이트, 연인・배우자",음식이 맛있어요,124,1
1680628587,nm9192,갈비살 너어어어어무 맛있어용 ㅋㅋ육즙 좔좔에 부드럽고 잡내1도 없어요 !! 같이간 남자친구도 맛있다고 해서 재방문 예정입니당 !갈비살 드실분 요기 꼭 가세여 진짜 강추임👍🏻🩷,2024-10-09,"아침에 방문, 예약 없이 이용, 대기 시간 바로 입장, 데이트, 연인・배우자",단체모임 하기 좋아요,35,1
1680628587,책 과음악사랑,식당도 깔끔하고 사장님과 직원분이 넘 친절해요. 음식도 맛있고 고기질도 너무 좋습니다.육회도 좋았구.비빔냉면도 넘 맛있었어요.,2024-10-09,"아침에 방문, 예약 후 이용, 대기 시간 바로 입장, 친목, 부모님",음식이 맛있어요,112,1
1680628587,제이젱이야,"친구랑 불금에 고기 먹고 싶어서 방문했는데 넘 맛있고 배부르게 먹어서 방문하길 잘했다고 생각했어요!! 👍🏻 꽃갈비살 추천해주셔서 먹었는데 고기 질이 좋고, 부드러워서 입에서 살살 녹았습니당ㅎㅎ 🤤 추가로 주문한 이베리코와 냉면도 넘 맛있었어요! 매장이 다른 고깃집과 다르게 전체적으로 깨끗하고 쾌적해서 좋았고, 직원분들 서비스도 좋으셔서 즐거운 식사 시간이 됐던 거 같아요!! 😊",2024-10-04,"아침에 방문, 예약 후 이용, 대기 시간 바로 입장, 일상, 친구",매장이 넓어요,103,1
1680628587,cha****,저녁메뉴 고민중에 소고기는 먹고싶고 가던데말고 새로운데 가고싶어서 폭풍검색해서 찾은곳!!일단집가까운데있어서 죵고 가게가 깨끗해서 좋았다!! 첫인상은 반찬나오는 식기가 예쁘고 고기상태가 좋아보였고 무슨 부위인지 나와있어서 좋았다~고기는 말해뭐해 너무 맛있었다!!!된찌도 고기팍팍팍!!두부팍팍팍!!! 계란찜도 색깔도맛도 이뻤다!!무조건한번은 더올듯하다!!!쏘주도4000원이다ㅋㅋㅋ무조건 한번은 더 올듯하다!!! 쏘주도,2024-09-30,"저녁에 방문, 예약 없이 이용, 대기 시간 바로 입장, 데이트, 연인・배우자",재료가 신선해요,9,1
1680628587,읍미다,고기 질도 너무 좋은데다가 이쁘게 나와서 사진찍기 좋고 !!!!! 매장도 너무 깔끔하고 사이드 및 밑빈찬도 다 맛있구 사장님도 친절하시고 🥺 처음 와봤는데 여러모로 완전 만족스러운 식사였어요 ㅎㅎ 동네에 괜찮은 고깃집 추천하고 다닐게요♥️ +++된장찌개개가 진짜 개존맛탱...... ㅠㅠㅠㅠㅠㅠ,2024-09-29,"저녁에 방문, 예약 없이 이용, 대기 시간 바로 입장, 데이트",음식이 맛있어요,495,1
1680628587,juyunsu35,음식정말맛있어요 매장도 깨끗하고 사장님도 친절하세요!,2024-09-28,"점심에 방문, 예약 없이 이용, 대기 시간 바로 입장, 친목, 친구",음식이 맛있어요,5,1
1680628587,잡동71,솔밭공원 고기 맛집이에요사장님 친절하시고 고기 퀄리티 정말 좋아요매장도 깨끗~ 반찬도 정갈해요추천합니다 ~~~,2024-09-28,"밤에 방문, 예약 없이 이용, 대기 시간 바로 입장, 데이트, 연인・배우자",음식이 맛있어요,4,1
1680628587,해우리35,육회도 맛있고 고기도 질이 좋습니다,2024-09-20,"저녁에 방문, 예약 없이 이용, 대기 시간 바로 입장, 가족모임, 부모님",음식이 맛있어요,6,1
1680628587,smk****,기대없이 왔는데 너무너무 친절하시고고기 맛이 너무 맛있어서 깜짝 놀랐어요.온 가족이 행복하게 먹고 갑니다^^,2024-09-15,"저녁에 방문, 예약 없이 이용, 대기 시간 바로 입장, 가족모임, 연인・배우자, 아이, 부모님",음식이 맛있어요,9,1
1680628587,최망고7,새로생긴데라 그런지 아주깔끔하고 잘나오네요.고기도좋아요 잘먹엇어요,2024-09-13,"아침에 방문, 예약 없이 이용, 대기 시간 바로 입장, 친목, 친구",음식이 맛있어요,1,1
1680628587,izoa54,여기 진짜 괜찮아요고급스러운 맛에가격은 혜자사장님도 친절하시고아주 센스있는 맛집입니다,2024-09-11,저녁에 방문,음식이 맛있어요,1519,1
1680628587,라파엘공주,오랜만에 와이프랑 맛나게 먹고 왔어요고기가 아주 신선하고 반찬도 너우깔끔하게 멋스럽게 이쁘고 맛나게 먹고 왔어요이곳 강추합니다 ♡!!!!!직원분들 아주 친절하시구 번창하세요,2024-09-11,"저녁에 방문, 예약 없이 이용, 대기 시간 바로 입장, 데이트, 연인・배우자",음식이 맛있어요,627,1
1680628587,비오리짝꿍,"고소한 기름기가 입안에 가득이라 맛있는 이베리코 갈비살! 육즙과 육향이 풍부해 세계4대진미 제대로 즐길수 있었던 쌍문동 고기집, 랑원담이였는데요, 대구 직송해온 한우 암소 육회는 쫄깃하면서 탱글탱글해서 술안주로 참! 좋았어요.",2024-09-09,"저녁에 방문, 예약 후 이용, 대기 시간 바로 입장, 일상, 연인・배우자",음식이 맛있어요,405,1
1680628587,Nix102,처음 생겼을 때에도 와보고 우리동네에 맛집이 생겨서 좋았는데요. 얼마 전 수유에서 유명 소고기집에서 먹었는데 그곳보다도 훨씬 맛있습니다 : ) 고기 질이 진짜 넘 좋아요~!,2024-09-04,"저녁에 방문, 예약 없이 이용, 대기 시간 바로 입장, 데이트, 연인・배우자",친절해요,44,1
1680628587,jim****,고기도 맛있었고 사장님도 친절하셨어요!냉면이랑 된장찌개도 맛있었어요다음에 또 오고싶어요ㅎㅎ,2024-09-02,"저녁에 방문, 예약 없이 이용, 대기 시간 바로 입장, 기념일, 아이, 부모님",음식이 맛있어요,4,1
1680628587,카페모카14,반찬도 깔끔하고 고기도 맛있고 사장님도 친절하세요.다음에 또 방문할께요~,2024-09-02,"저녁에 방문, 예약 없이 이용, 대기 시간 바로 입장, 친목, 친구",음식이 맛있어요,25,1
1680628587,우타니80,고기는 물론 반찬까지 깔끔하고 전부 맛있네요~모임하실분들 강추합니다^^,2024-09-02,"저녁에 방문, 예약 없이 이용, 대기 시간 바로 입장, 친목, 친구",음식이 맛있어요,19,1
1680628587,양자리,굳굳,2024-08-31,"점심에 방문, 예약 없이 이용, 대기 시간 바로 입장, 친목, 연인・배우자",음식이 맛있어요,291,1
1680628587,yooo89,고기가 신선한게 느껴지네요 살살 녹아요~~잘먹었습니당,2024-08-30,"저녁에 방문, 예약 없이 이용, 대기 시간 바로 입장, 데이트, 연인・배우자",음식이 맛있어요,21,1
1680628587,에펠97,친절하고 음식도 맛있어요,2024-08-28,"저녁에 방문, 예약 없이 이용, 대기 시간 바로 입장, 일상, 연인・배우자",음식이 맛있어요,1444,4
1680628587,seo****,맛있고 사장님이 친절해요☺☺,2024-08-26,"저녁에 방문, 예약 후 이용, 대기 시간 바로 입장, 친목, 지인・동료",매장이 넓어요,22,1
1680628587,람가67,부모님과 함께 방문했는데 고기 질도 좋고 계란찜이 특히 너무 맛있어요! 직원분들도 너무 친절하셔서 기분 좋게 식사할 수 있었어요. 부모님이 자주 오자고 하셨습니다 ㅎㅎ 잘 먹고 가요!,2024-08-26,"점심에 방문, 예약 없이 이용, 대기 시간 바로 입장, 일상, 회식, 부모님",음식이 맛있어요,6,1
1680628587,1 O O 4,고기가 신선하고 맛있어요💙 동네 맛집이에요!!!,2024-08-25,"점심에 방문, 예약 없이 이용, 대기 시간 바로 입장, 일상, 연인・배우자",음식이 맛있어요,517,4
1680628587,뚜잉또잉195,엄마랑 아빠랑 같이 왔는데 고기질도 좋고 맛있어요.고기집 더우면 먹다가 지치는데 매장도 시원하고 서비스도 좋아요,2024-08-23,"저녁에 방문, 예약 없이 이용, 대기 시간 바로 입장, 가족모임, 부모님",음식이 맛있어요,10,1
1680628587,yoo****,두 번째 방문인데 직원 분들도 너무 친절하시고 맛있어요 :) 적극 추천합니다아!,2024-08-23,"저녁에 방문, 예약 없이 이용, 대기 시간 바로 입장, 데이트, 연인・배우자, 아이, 친척・형제",매장이 넓어요,21,1
1680628587,땡멍맘,부모님 모시고왔는데 너무 좋아하십니다 그리고 너무맛있어용 !!,2024-08-18,"저녁에 방문, 예약 없이 이용, 대기 시간 바로 입장, 가족모임, 부모님",음식이 맛있어요,80,2
1680628587,sio****,아주 맛있습니다 고기퀄리티가 아주좋네요,2024-08-18,"저녁에 방문, 예약 없이 이용, 대기 시간 바로 입장, 가족모임, 부모님",음식이 맛있어요,3,1
1680628587,Nessa,정갈하게 나오고 셋팅도 예쁘고 진짜맛있어요!사장님도 너무 친절하세요^^!!집앞인데 자주 올 것 같아요!,2024-08-17,"저녁에 방문, 예약 없이 이용, 대기 시간 바로 입장, 친목, 기념일, 가족모임, 부모님, 친척・형제",인테리어가 멋져요,183,1
31316156,kka****,매장도 넓고 혼밥하기 좋아요,2025-04-02,"저녁에 방문, 예약 없이 이용, 대기 시간 바로 입장, 데이트, 연인・배우자",음식이 맛있어요,1187,9
31316156,꾸미60kr,가끔 생각나던 곳이라 오랫만에 외출후 돌아오는길에 저녁을 먹으러 왔는데웨이팅 하지않고 바로 들어가 앉았다나가사끼 짬봉국물은 역시 션하니 맛 있다그런데 해산물 내용도 없고 양배추만 많다오늘의초밥 도 왠지 신선한지 잘 모르겠고비린것도 있어 먹다 버렸다내 입맛이 변한건가? 왠지 예전처럼 맛깔스럽지도 않은듯 했다,2025-03-15,"저녁에 방문, 예약 없이 이용, 대기 시간 바로 입장, 일상",친절해요,971,4
31316156,Los23,회가 신선하고 메뉴구성이 좋습니다🍣스시맛집입니다👍,2025-03-06,"점심에 방문, 예약 없이 이용, 대기 시간 바로 입장, 데이트, 나들이, 일상, 연인・배우자",음식이 맛있어요,56,1
31316156,r00****,직원분들 다 친절하시고 연어롤 진짜 맛있습니다!,2025-03-02,"저녁에 방문, 예약 없이 이용, 대기 시간 바로 입장, 데이트, 연인・배우자",음식이 맛있어요,54,1
31316156,칼라Jung,장사잘되는집에서  회가 비린내가 나면...질 문제인데...원가비싼 회는 다빠졌네요..진짜  이사오시기  전에는 식사하고  감동하고갔는데..안타깝네요.,2025-03-02,"점심에 방문, 예약 없이 이용, 대기 시간 바로 입장, 데이트, 연인・배우자",친절해요,751,1
31316156,pinklemontree,"매장에서만 먹다가 처음으로 포장해봤는데 깔끔하게 포장 해주시고, 시간도 맞춰서 준비해주셔서 좋았습니다. 맛은 말할 것도 없이 맛있습니다.",2025-02-25,"저녁에 방문, 예약 없이 이용, 대기 시간 바로 입장, 일상, 혼자",친절해요,221,2
31316156,버숙,,2025-02-19,"아침에 방문, 예약 없이 이용, 대기 시간 바로 입장, 일상, 혼자",음식이 맛있어요,424,1
31316156,정윤숙30,좋아요,2025-02-17,점심에 방문,음식이 맛있어요,1278,5
31316156,안태원,좋아요,2025-02-17,점심에 방문,음식이 맛있어요,1175,5
31316156,일이1984,캘리포니아롤 포장해서 잘먹었어요,2025-02-15,"저녁에 방문, 포장·배달 이용, 대기 시간 10분 이내, 일상, 친척・형제",음식이 맛있어요,1065,10
31316156,몽실언ㄴl,포장해와서 먹었어요~캘리포니아롤은 첨 먹어봤는데 맛있네요😊😊맛있는 식사했습니다~ 감사해요,2025-02-15,"저녁에 방문, 포장·배달 이용, 대기 시간 바로 입장, 일상, 혼자",음식이 맛있어요,153,1
31316156,k21****,초밥 보들보들 맛있고요.나가사키 짬뽕도 맛나요!!!불맛도 나고~~ 매장이넓어서 혼밥하기 좋아요,2025-02-13,"점심에 방문, 예약 없이 이용, 대기 시간 바로 입장, 일상, 지인・동료",음식이 맛있어요,85,1
31316156,YouHappy,"집근처에 있는 스시맛집! 사이코우스시 정식코스 리뷰가 거의 없어서 궁금했었는데요. 2인이상 주문가능한 저녁정식으로 주문해보았고, 주문하자마자 순식간에 한상 세팅되는게 성격 급한사람에게는 만족스러울듯 하구요. 스시, 사시미, 짬뽕 모두 평균이상 맛있었던 사이코우스시였습니다.",2025-02-02,"저녁에 방문, 예약 없이 이용, 대기 시간 바로 입장, 데이트, 연인・배우자",음식이 맛있어요,267,1
31316156,MINOSLOVE,나가사끼짬뽕  역시... 👍,2025-01-24,"아침에 방문, 예약 없이 이용, 대기 시간 바로 입장, 일상, 아이",음식이 맛있어요,1412,3
31316156,새콤레몬60,굿,2025-01-16,점심에 방문,음식이 맛있어요,925,9
31316156,별빛스카이,롤 맛집롤먹고싶을때는 언제나 이곳으로와요,2025-01-09,"점심에 방문, 예약 없이 이용, 대기 시간 바로 입장, 일상, 연인・배우자",음식이 맛있어요,400,3
31316156,규라라,,2025-01-02,"점심에 방문, 예약 없이 이용, 대기 시간 바로 입장, 친목, 지인・동료",친절해요,1652,4
31316156,타키마흐,새해 첫 외식은 사이코우!,2025-01-01,"저녁에 방문, 예약 없이 이용, 대기 시간 바로 입장, 데이트, 연인・배우자",음식이 맛있어요,128,2
31316156,OOYOON,맛있어요👍🏻,2024-12-21,저녁에 방문,음식이 맛있어요,548,2
31316156,난나얌얌,맛있고 좋아요,2024-12-21,점심에 방문,음식이 맛있어요,1961,3
31316156,녹차향기86,맛있어요,2024-12-19,"점심에 방문, 예약 없이 이용, 대기 시간 바로 입장, 가족모임, 부모님",음식이 맛있어요,1662,2
31316156,네Ql버,,2024-12-17,저녁에 방문,음식이 맛있어요,765,7
31316156,daiye,이 지역에서는 사장 퀄리티 있고 맛있는 초밥집입니다,2024-12-15,"저녁에 방문, 예약 없이 이용, 대기 시간 바로 입장, 일상, 혼자",음식이 맛있어요,595,1
31316156,심슨7885,맛있어요,2024-12-14,점심에 방문,음식이 맛있어요,1609,1
31316156,Pk81,요즘 방어 좋은데..  방어초밥 회는 넙적한데 그냥그래요 탄탄함이 적고 맛도그렇고 연어머리조림 맛있어요밥없이는 짜요,2024-12-14,"밤에 방문, 예약 없이 이용, 대기 시간 바로 입장, 데이트, 연인・배우자",음식이 맛있어요,1288,9
31316156,thedr,신선하고 괜찮았어요,2024-12-13,"저녁에 방문, 예약 없이 이용, 대기 시간 바로 입장, 데이트, 연인・배우자",친절해요,541,1
31316156,모모828,방어 괜찮음,2024-12-13,"저녁에 방문, 예약 없이 이용, 대기 시간 바로 입장, 데이트, 연인・배우자",특별한 메뉴가 있어요,222,1
31316156,기쁨270,,2024-12-01,저녁에 방문,음식이 맛있어요,915,6
31316156,참제비,"나가사키 짬뽕이랑 초밥, 사진엔 없지만 캘리포니아롤도 정말 정말 맛있어요!!",2024-11-25,"저녁에 방문, 예약 없이 이용, 대기 시간 바로 입장",음식이 맛있어요,949,1
31316156,mii****,감사합니다,2024-11-21,저녁에 방문,음식이 맛있어요,672,5
31316156,iiooiiooii,"테이블에서 주문,결제가능해서 좋아요.",2024-11-20,"점심에 방문, 예약 없이 이용, 대기 시간 바로 입장, 데이트, 연인・배우자",음식이 맛있어요,592,2
31316156,기쁨270,,2024-11-16,저녁에 방문,음식이 맛있어요,915,5
31316156,미루나무아래,음식이  맛있어요~자주 방문할거 같아요.,2024-11-05,"저녁에 방문, 예약 없이 이용, 대기 시간 바로 입장, 일상, 혼자",음식이 맛있어요,15,3
31316156,타키마흐,너무 맛있어서 울면서 먹었어요..회덮밥 짱짱맛,2024-10-30,"저녁에 방문, 예약 없이 이용, 대기 시간 바로 입장, 데이트, 연인・배우자",음식이 맛있어요,128,1
31316156,기쁨270,,2024-10-26,저녁에 방문,음식이 맛있어요,915,2
31316156,iiliiiliiliiil,맛은 예전보다 못해요 ㅠㅠ가격은 자꾸오르고..약간 아쉬움,2024-10-09,저녁에 방문,음식이 맛있어요,1261,1
31316156,건크레인,굳,2024-09-22,저녁에 방문,음식이 맛있어요,1141,4
31316156,새콤레몬60,짬뽕 국물 굿~,2024-09-14,점심에 방문,음식이 맛있어요,925,7
31316156,예수 향기,!!!<@>,2024-09-07,점심에 방문,음식이 맛있어요,1501,9
31316156,희망611호,세상에.양은많은데.맛이없어서 깜짝놀랬어요.아까워서먹는다고.먹었는데도.엄청남김.ㅠㅠ.세상돈아까워요.오래하실려면.발전하셔야겠어요.,2024-09-06,"점심에 방문, 예약 없이 이용, 대기 시간 바로 입장, 여행, 아이, 부모님",양이 많아요,76,1
31316156,예수 향기,👍,2024-08-31,저녁에 방문,음식이 맛있어요,1501,8
31316156,밀키스제로,"동네스시집! 오랜만에 방문했는데 특선모듬초밥 굿굿🍣+냉모밀도 맛있습니다!👍🏻((처음 같이 나오는 야채(양배추)가 없어진거 같아 아쉽,, 너무 오래되었나요ㅎㅎ))",2024-08-17,"저녁에 방문, 예약 없이 이용, 대기 시간 바로 입장, 일상, 친구",음식이 맛있어요,504,1
31316156,sak****,,2024-08-06,"밤에 방문, 예약 없이 이용, 대기 시간 바로 입장, 일상, 연인・배우자",음식이 맛있어요,1300,6
31316156,MINOSLOVE,,2024-08-02,"저녁에 방문, 예약 없이 이용, 대기 시간 바로 입장, 일상, 지인・동료",가성비가 좋아요,1412,2
31316156,1004u,.,2024-07-30,점심에 방문,,389,1
31316156,ado00179,맛있어요,2024-07-23,"점심에 방문, 예약 없이 이용, 대기 시간 바로 입장, 친목, 친구, 지인・동료",음식이 맛있어요,930,1
31316156,문문79,존맛,2024-07-19,"저녁에 방문, 포장·배달 이용, 대기 시간 바로 입장, 일상, 혼자, 반려동물",음식이 맛있어요,301,3
31316156,예수 향기,👍 👍 👍,2024-07-14,저녁에 방문,음식이 맛있어요,1501,7
31316156,새콤레몬60,굿,2024-07-13,점심에 방문,음식이 맛있어요,925,6
31316156,kimhappy12,가족과 생파로~~ 저녁 식사 했어요.계속 시켜먹게 되는 곳~~ 스시도 맛나고 돈가스 가득~ 좋았습니다.,2024-07-06,"저녁에 방문, 예약 없이 이용, 대기 시간 10분 이내, 가족모임, 연인・배우자",음식이 맛있어요,36,1
31316156,감성나비,"초밥은 사이코우스시👍물가가 올라서 여기도 조금 가격은 올랐어요.그래도 맛집 인정! 항상 신선하게 초밥을 먹을 수 있고, 실패가 없는 맛집이에요😍",2024-06-27,저녁에 방문,음식이 맛있어요,1083,13
31316156,고고콤마,불맛나는 초밥이 2개 주는 센스! 너무 좋았어요우동도 같이 나와서 맛있게 배부르게 먹었어요,2024-06-23,"저녁에 방문, 예약 없이 이용, 대기 시간 바로 입장, 친구",음식이 맛있어요,2896,1
31316156,행복바이러스1202,좋아요,2024-06-23,점심에 방문,음식이 맛있어요,2102,1
31316156,stilra,굳,2024-06-22,"점심에 방문, 예약 없이 이용, 대기 시간 바로 입장, 데이트, 지인・동료",음식이 맛있어요,374,1
31316156,Yoll11,좋아요,2024-06-18,저녁에 방문,음식이 맛있어요,1185,6
31316156,7 도치,동네에서  드문 일식집이니 종종 방문합니다.가족이나 회사 동료들 일상 식사하기 좋은 쏘쏘한 식당!,2024-05-25,"저녁에 방문, 예약 후 이용, 대기 시간 바로 입장, 일상, 혼자",음식이 맛있어요,1121,10
31316156,남연정19,"연어초밥 2세트, 나가사끼 짬뽕 포장 주문했어요",2024-05-23,"저녁에 방문, 포장·배달 이용, 대기 시간 바로 입장, 일상, 혼자",음식이 맛있어요,994,3
31316156,안태원,좋아요,2024-05-23,저녁에 방문,음식이 맛있어요,1175,4
31316156,정윤숙30,좋아요,2024-05-23,저녁에 방문,음식이 맛있어요,1278,4
31316156,ha1****,맛있어요,2024-05-18,"점심에 방문, 예약 없이 이용, 대기 시간 바로 입장, 친목, 친구",음식이 맛있어요,190,1
31316156,olhj121307,맛있어요,2024-05-18,"점심에 방문, 예약 없이 이용, 대기 시간 바로 입장, 친목, 일상, 지인・동료",음식이 맛있어요,379,1
31316156,딸둘mom,동생이 점심대접해준다고 데리고 왔는데살살 녹네요~~맛있어요~~잘먹고갑니다^^전라도 광주에서 서울여행와서 들립니다❤,2024-05-14,"점심에 방문, 예약 없이 이용, 대기 시간 바로 입장, 여행, 연인・배우자, 아이, 친척・형제",음식이 맛있어요,1111,1
31316156,감성나비,최애 스시집👍 늘 맛있게 잘 먹고 있습니다.😁,2024-05-12,"점심에 방문, 예약 없이 이용, 대기 시간 바로 입장, 가족모임, 연인・배우자, 아이",음식이 맛있어요,1083,12
31316156,goa****,맛있어요! 자주올게요~,2024-05-11,"점심에 방문, 예약 없이 이용, 대기 시간 바로 입장, 친목, 친구",인테리어가 멋져요,132,1
31316156,OneZeroNine,동네에서 가기 좋은 스시집스시랑 나가사키 짬뽕 맛있음!정식 세트 굿,2024-05-08,"저녁에 방문, 예약 없이 이용, 대기 시간 바로 입장, 가족모임",음식이 맛있어요,550,3
31316156,카르페디엠6097,언제 먹어도 맛있는 스시네요. 돈까스도 양 많고 맛있고 우동도 맛있어요.,2024-05-08,저녁에 방문,매장이 청결해요,354,1
31316156,ae0429,굿,2024-05-08,"점심에 방문, 예약 없이 이용, 대기 시간 10분 이내",음식이 맛있어요,1008,7
31316156,folli1975,냉모밀을 먹고 싶어서 오랜만에 찾은 사이코우스시~냉모밀과 스시롤 세트를 추천합니다~~오늘은 나가사키짬뽕 세트로 초이스!!!,2024-05-06,"점심에 방문, 예약 없이 이용, 대기 시간 바로 입장, 가족모임, 친척・형제",음식이 맛있어요,1095,2
