place_id,nickname,content,date,situations,keywords,review_count,visit_count
1846605156,wns****,완전 맛나요! 다음에 또먹으러 올게요~ㅎㅎ,2025-04-07,"저녁에 방문, 예약 없이 이용, 대기 시간 30분 이내, 데이트, 연인・배우자",음식이 맛있어요,6,1
1846605156,0058180,진짜 현지의 맛이 나요!! 잘 먹었습다><,2025-04-07,"저녁에 방문, 예약 없이 이용, 대기 시간 30분 이내, 데이트, 연인・배우자",음식이 맛있어요,39,1
1846605156,다이어터4860,정망 맛읶어요!! 쌀국수 국물도 특이하고 맛있고 분짜 반쎄오도 맛있어요,2025-04-07,"저녁에 방문, 예약 없이 이용, 대기 시간 바로 입장, 친목, 데이트, 나들이, 일상, 친구",음식이 맛있어요,10,1
1846605156,dhjdlwns,맛있고 혼밥하기도 좋아요~,2025-04-07,"저녁에 방문, 예약 없이 이용, 대기 시간 10분 이내, 일상, 혼자",혼밥하기 좋아요,38,4
1846605156,nomad77,엄마랑 데이트 와서 맛있게 잘 먹고 가요!!감사합니다,2025-04-07,"점심에 방문, 예약 없이 이용, 대기 시간 10분 이내, 데이트, 나들이, 연인・배우자",음식이 맛있어요,24,1
1846605156,zza****,베트남의 쌀국수풍미를 핫껏 느낄수있네요분짜도 상큼하고 맛나네요^^,2025-04-07,"점심에 방문, 예약 없이 이용, 대기 시간 10분 이내, 나들이, 친구",음식이 맛있어요,16,1
1846605156,pia****,맛있어요,2025-04-07,"점심에 방문, 예약 없이 이용, 대기 시간 10분 이내, 데이트, 연인・배우자",음식이 맛있어요,24,1
1846605156,짱구는 잘먹어,쌀국수 불맛나고 넘 맛있어요! 분짜 양도 많구용>< 인테리어도 힙하고 느좋입니다. 외국인들도 많은 찐 맛집인 거 같아용,2025-04-07,"점심에 방문, 예약 없이 이용, 대기 시간 10분 이내, 친목, 친구",음식이 맛있어요,160,1
1846605156,124523,맛있어요오~~~~~,2025-04-07,"점심에 방문, 예약 없이 이용, 대기 시간 10분 이내, 데이트, 부모님",양이 많아요,187,1
1846605156,하하1968,맛있어요!!! 셋이서 시그니처 세트에 꿔이2 시켜서 딱 맞게 먹었어요. 직원 분들 친절하시고 정말 좋습니다.,2025-04-07,"점심에 방문, 예약 없이 이용, 대기 시간 바로 입장, 친목, 친구",친절해요,34,1
1846605156,아잉3748,맛있어요!,2025-04-07,"점심에 방문, 예약 없이 이용, 대기 시간 바로 입장, 데이트, 연인・배우자",음식이 맛있어요,51,1
1846605156,소연92,가장 좋아하는 집이에요. 매번 와서 먹어요~,2025-04-07,"점심에 방문, 예약 없이 이용, 대기 시간 바로 입장, 친목, 친구",음식이 맛있어요,34,1
1846605156,dav****,양이 많고 국물이 진해서 계속 먹고 싶어요!!,2025-04-06,"저녁에 방문, 예약 없이 이용, 대기 시간 바로 입장, 친목, 연인・배우자, 친구",음식이 맛있어요,31,1
1846605156,yoo****,성수동에 있는 쌀국수집 중에 제일 맛있어요 !!,2025-04-06,"저녁에 방문, 예약 후 이용, 대기 시간 30분 이상, 데이트, 연인・배우자",재료가 신선해요,18,1
1846605156,qkr****,너무 맛있어요!,2025-04-06,"점심에 방문, 예약 후 이용, 대기 시간 30분 이내, 데이트, 연인・배우자",음식이 맛있어요,19,1
1846605156,오독오도독,맛있게 잘 먹었습니다. 국물 진해서 좋아요.,2025-04-06,"점심에 방문, 예약 후 이용, 대기 시간 30분 이상, 데이트, 연인・배우자",음식이 맛있어요,15,1
1846605156,늠름하부웡,주말에도 사람이 많네요! 미리 테이블링 하고 갔는데 한 10분정도 기다려서 먹었어요! 맛있습니다~육수랑 면도 리필이 되고 분짜도 맛있어요!,2025-04-06,"점심에 방문, 예약 후 이용, 대기 시간 10분 이내, 친목, 나들이, 일상, 가족모임, 친척・형제",음식이 맛있어요,38,1
1846605156,오리2157,맛있어요오오,2025-04-06,"점심에 방문, 예약 후 이용, 대기 시간 1시간 이상, 데이트, 연인・배우자",음식이 맛있어요,47,1
1846605156,나용이야1,ㅎㅎ 역시 맛집이라대기 많고 성수 본점답네요맛있어요~~~,2025-04-06,"점심에 방문, 예약 후 이용, 대기 시간 1시간 이상, 데이트, 연인・배우자",음식이 맛있어요,49,2
1846605156,하하하하4843,한시간가량 기다려온 꾸아... 비주얼 압도적이고 맛도 너무 맛이어요ㅜ근데 먹다가 분짜에서 비닐 나왔어요...,2025-04-06,"점심에 방문, 예약 후 이용, 대기 시간 30분 이상, 데이트, 친목, 연인・배우자, 친구",음식이 맛있어요,31,1
1846605156,호오잇74,맛있어요!! 기다린 보람이 있네요 ㅎㅎ♥️♥️,2025-04-06,"점심에 방문, 예약 후 이용, 대기 시간 30분 이상, 데이트, 연인・배우자",음식이 맛있어요,32,1
1846605156,스완52,쌀국수 원래 좋아하는데 양도많고 넘 맛있어요!̆̈,2025-04-06,"점심에 방문, 예약 없이 이용, 대기 시간 30분 이내, 친목, 나들이, 친척・형제",음식이 맛있어요,16,1
1846605156,koh****,고기가 엄청 많아요! 불향도 나고 넘 맛있게 먹었습니다🤤,2025-04-06,"점심에 방문, 예약 없이 이용, 대기 시간 30분 이내, 데이트, 연인・배우자, 친구",음식이 맛있어요,11,2
1846605156,라이언29,아이와 성수동 데이트로 먹었는데 맛나요,2025-04-06,"점심에 방문, 예약 없이 이용, 대기 시간 30분 이내, 데이트, 아이",음식이 맛있어요,9,1
1846605156,hyu****,맛있어요!,2025-04-06,"점심에 방문, 예약 없이 이용, 대기 시간 10분 이내, 데이트",음식이 맛있어요,17,1
1846605156,5553ㅎㅇ,두번째 방문이에요! 사람은 많은편이지만 맛있어서 자주 오고싶어요 11:30에 오니 대기없었어요,2025-04-06,"점심에 방문, 예약 없이 이용, 대기 시간 바로 입장, 일상, 혼자",양이 많아요,96,2
1846605156,tks****,성수오면 여기만 와요! 인생 쌀국수 맛집!!,2025-04-06,"점심에 방문, 예약 없이 이용, 대기 시간 바로 입장, 데이트, 부모님",음식이 맛있어요,33,1
1846605156,dms****,유명해서 왔는데 맛있어요!!! 다음에도 또 올게요!!,2025-04-06,"점심에 방문, 예약 없이 이용, 대기 시간 바로 입장, 데이트, 연인・배우자",재료가 신선해요,54,1
1846605156,박혜진9021,처음 방문했는데 시그니처 세트 너무 좋아오!! 맛있어요!!🙂,2025-04-06,"점심에 방문, 예약 없이 이용, 대기 시간 바로 입장, 친목, 친구",인테리어가 멋져요,14,1
1846605156,eu90,그동안 먹어본 쌀국수 국물맛과 달라서 이색적이네요,2025-04-06,"점심에 방문, 예약 없이 이용, 대기 시간 바로 입장, 데이트, 연인・배우자",음식이 맛있어요,3,1
1846605156,조선왕조실룩샐룩 트월킹,국물이 죽여요 너무 맛있네요 재방문의사잇씁니다,2025-04-05,"저녁에 방문, 예약 없이 이용, 대기 시간 바로 입장, 친목, 혼자",음식이 맛있어요,107,1
1846605156,Rinssa,반쎄오랑 쌀국수랑 새우볶음밥 시켰어요!!! 너무 맛있어요반쎄오 제일 맛있어요 ㅎㅎ 스리라차 마요소스도 맛있으 잘먹었습니다,2025-04-05,"저녁에 방문, 예약 없이 이용, 대기 시간 바로 입장, 데이트, 연인・배우자",음식이 맛있어요,20,1
1846605156,rhkshap,성수 맛집… 또또또간집입니다!분짜 맛집이라 항상 분짜 시켜요다들 분짜 드셔보시길..,2025-04-05,"저녁에 방문, 예약 없이 이용, 대기 시간 바로 입장, 데이트, 연인・배우자",음식이 맛있어요,8,1
1846605156,lov****,베트남 현지에서 먹는 맛입니다 아주 맛있어요~~강추강추,2025-04-05,"점심에 방문, 예약 없이 이용, 대기 시간 바로 입장, 데이트, 연인・배우자",음식이 맛있어요,16,1
1846605156,202324abc,"꾸아 성수점 거리도 있는데 세번째 방문이에요.반쎄오, 매운 쌀국수, 수림프 라이스롤까지 먹어봤는데 지금까지 다 맛있었어요!!",2025-04-05,"점심에 방문, 예약 없이 이용, 대기 시간 바로 입장, 나들이, 친척・형제",음식이 맛있어요,46,1
1846605156,쯔아아아누,맛있어요 굿,2025-04-05,"점심에 방문, 예약 없이 이용, 대기 시간 바로 입장, 친목, 친구",음식이 맛있어요,16,1
1846605156,noxseojo,쌀국수 중에 원탑..! 오늘도 잘먹고 갑니다~~~서울숲점이 젤 맛있움 ㅎㅎ,2025-04-05,"점심에 방문, 예약 후 이용, 대기 시간 30분 이내, 데이트, 가족모임, 부모님",음식이 맛있어요,633,4
1846605156,미나3,분위기도 좋고 너무 맛있어요! 또오고싶어여,2025-04-05,"점심에 방문, 예약 없이 이용, 대기 시간 10분 이내, 친목, 친구",음식이 맛있어요,29,1
1846605156,ahj****,국물도 진하고 양도 푸짐하고 너무 맛있어요,2025-04-05,점심에 방문,음식이 맛있어요,1019,1
1846605156,소소짱,친구들과 넘 맛있게 먹었어요~  양도 많고 친절합니다.,2025-04-05,"점심에 방문, 예약 후 이용, 대기 시간 10분 이내, 친목, 친구",음식이 맛있어요,20,1
1846605156,황유경9845,매장 깔끔하고 음식도 맛있어요! 분짜소스 깔끔해서 좋아요 ㅎㅎ,2025-04-05,"점심에 방문, 예약 없이 이용, 대기 시간 바로 입장, 데이트, 연인・배우자",음식이 맛있어요,8,1
1846605156,sea****,처음왓어용시그니처 먹엇는데 너무맛있어용시그니처굿!!♡,2025-04-04,"저녁에 방문, 예약 없이 이용, 대기 시간 10분 이내, 데이트, 연인・배우자",음식이 맛있어요,19,1
1846605156,김유림21,친구가 맛있다고 해서 왔는데 진짜 맛집이에여…쌀국수 양도 많고 넘넘 최고입니다대화하기도 좋구 역 근처라 오기도 너무 편해요!다음에 또 방문할게요~~~,2025-04-04,"저녁에 방문, 예약 후 이용, 대기 시간 30분 이내, 친목, 친구",혼밥하기 좋아요,18,1
1846605156,Claire667,앙돼에에에엥 왕갈비 품절 실화 ㅠㅠ 꾸이 장소이전하고는 첨와보는데 매장 넓어져서 웨이팅 예전보단 덜해서 좋네여><!!!,2025-04-04,"저녁에 방문, 예약 없이 이용, 대기 시간 30분 이내, 친목, 친구",음식이 맛있어요,95,1
1846605156,se eun52,쌀국수 국물 넘 맛있고 불맛나서 좋아요 분짜도 넘 추천입니다!,2025-04-04,"저녁에 방문, 예약 후 이용, 대기 시간 30분 이내, 데이트, 연인・배우자",음식이 맛있어요,439,1
1846605156,뿅뿅6975,꾸아는 항상 맛이써요~~오늘은 성수점이네요~~,2025-04-04,"저녁에 방문, 예약 없이 이용, 대기 시간 10분 이내, 나들이, 아이",음식이 맛있어요,27,1
1846605156,기니팡팡,저번에 먹은 꾸아 반쎄오가 또 생각나서 왔어요! 👍🏻,2025-04-04,"저녁에 방문, 예약 없이 이용, 대기 시간 30분 이내, 친목, 나들이, 친구",음식이 맛있어요,4,1
1846605156,후르츠텔라31,너무 맛있어요!! 얼마전에 나트랑에서 먹었던 그맛 입니다~~~ 고기육수 맛이 정말 좋네요!!,2025-04-04,"저녁에 방문, 예약 없이 이용, 나들이, 부모님",음식이 맛있어요,22,1
1846605156,Teo283,역시 명불허전입니다 :-),2025-04-04,"점심에 방문, 예약 없이 이용, 대기 시간 30분 이내, 데이트, 연인・배우자",음식이 맛있어요,13,1
1846605156,sky****,맛있어요!,2025-04-04,"점심에 방문, 예약 후 이용, 대기 시간 30분 이내, 데이트, 연인・배우자",음식이 맛있어요,20,1
1846605156,honghong71,둘이서 시그니처세트 시켰어요!! 반쎄오 처음 먹어보는데 너무 맛있음 ㅜㅜ 친구피셜 베트남에서 먹은거보다 맛있대요!,2025-04-04,"점심에 방문, 예약 후 이용, 대기 시간 30분 이내, 친목, 친구",음식이 맛있어요,3,1
1846605156,oo****,처음 왔는데 넘 맛있고 음식도 빠르게 나오고 혼밥하기 좋은 거 같아요!!,2025-04-03,"저녁에 방문, 예약 없이 이용, 대기 시간 바로 입장, 친목, 혼자",음식이 맛있어요,30,1
1846605156,김재훈92,정말 맛있어요!,2025-04-03,"저녁에 방문, 예약 없이 이용, 대기 시간 바로 입장, 친목, 친구",음식이 맛있어요,8,1
1846605156,재재88님,직원분들 너무 친절하시고 음식도 맛있어요!!타이거생맥 존맛👍,2025-04-03,"저녁에 방문, 예약 없이 이용, 대기 시간 10분 이내, 데이트, 연인・배우자",음식이 맛있어요,8,1
1846605156,ym12,음식 양이 많고 신선하고 맛있어요! 직원분들도 친절하셔서 좋았어요. 다음에 또 방문 예정입니다~!,2025-04-03,"저녁에 방문, 예약 없이 이용, 대기 시간 바로 입장, 데이트, 친구",음식이 맛있어요,15,1
1846605156,sho****,음식 맛있어요 :),2025-04-02,"저녁에 방문, 예약 없이 이용, 대기 시간 바로 입장, 친목, 친구",현지 맛에 가까워요,2,1
1846605156,우디디딛,맛있어요!!!!!,2025-04-02,"저녁에 방문, 예약 없이 이용, 대기 시간 바로 입장, 데이트, 연인・배우자",음식이 맛있어요,18,1
1846605156,셍5370,진짜 맛있고 분위기도 힙해서 좋아여 ㅎㄹ,2025-04-02,"점심에 방문, 예약 없이 이용, 대기 시간 바로 입장, 일상, 혼자",인테리어가 멋져요,21,1
1846605156,둥근곰61,맛있게 잘먹고 갑니다- 갈비 아주 그럴싸해요,2025-04-02,"점심에 방문, 예약 없이 이용, 대기 시간 바로 입장, 친목, 친구",음식이 맛있어요,16,1
1846605156,딱지마차,예약없이 방문 했는데 운좋게 들어왔어요. 맛있게 잘 먹었습니다~^^,2025-04-02,"점심에 방문, 예약 없이 이용, 대기 시간 바로 입장, 데이트, 연인・배우자",음식이 맛있어요,902,1
1846605156,lovablehw,"베트남 쌀국수 & 분짜 & 반쎄오 맛집 리뷰최근에 다녀온 베트남 음식점에서 쌀국수, 분짜, 반쎄오를 먹어봤는데, 완전 만족!✅ 쌀국수 – 국물이 깊고 진한데도 깔끔해서 한 입 먹자마자 감탄. 고수 풍미가 은은하게 퍼지면서 면도 쫄깃해서 너무 좋았음.✅ 분짜 – 숯불 향이 제대로 밴 고기랑 새콤달콤한 소스 조합이 최고. 쌀국수랑 같이 먹으면 환상적인 조합!✅ 반쎄오 – 바삭한 크레페 속에 새우랑 돼지고기가 듬뿍! 신선한 허브랑 같이 싸 먹으니까 완전 베트남 현지 느낌.전반적으로 음식 퀄리티도 높고, 양도 넉넉해서 만족도가 높았음. 베트남 음식 좋아하는 사람이라면 강추!",2025-04-01,"저녁에 방문, 예약 후 이용, 대기 시간 10분 이내, 가족모임, 부모님",음식이 맛있어요,8,1
1846605156,Rhee68,평일 점심 대기없이 이용했으나 다른매장들보다 사람들이 많은거같아용 인기맛집! 서울숲에서 쌀국수는 이곳입니다~!,2025-04-01,"점심에 방문, 예약 없이 이용, 대기 시간 바로 입장, 일상, 혼자",음식이 맛있어요,20,1
1846605156,shl****,맛있어요~!!,2025-04-01,"점심에 방문, 예약 없이 이용, 대기 시간 30분 이내, 나들이, 친구",음식이 맛있어요,6,1
1846605156,ㅋㅋㅋ25,저번에 지인이랑 왔다가맛있어서 친구랑 또 왔어요완전 존맛,2025-04-01,"점심에 방문, 예약 후 이용, 대기 시간 10분 이내, 친목, 친구",음식이 맛있어요,13,2
1846605156,hjp****,재료가 신선하고 맛있어요!강추!!,2025-04-01,"점심에 방문, 예약 없이 이용, 대기 시간 바로 입장, 친목, 친구",음식이 맛있어요,8,1
1846605156,785264,맛있어요,2025-03-31,"저녁에 방문, 예약 없이 이용, 대기 시간 10분 이내, 일상, 친구",음식이 맛있어요,54,1
1846605156,미뇽뇽그리,따뜻하구 맛잇어용!! 담이 서울숲올때 또 먹고싶어요,2025-03-31,"저녁에 방문, 예약 없이 이용, 대기 시간 30분 이내, 친목, 데이트, 나들이, 친구",음식이 맛있어요,31,1
1846605156,뿌잉뿌잉오로라,시그니처메뉴 가성비 너무 좋아요! 면추가도 한번씩 되서 배부르고 맛있게 잘먹었어요! 다음에 족발덮밥 먹으러 오려구요~,2025-03-31,"저녁에 방문, 대기 시간 10분 이내, 데이트, 연인・배우자",음식이 맛있어요,22,1
1846605156,탱ㅌ태,매장이 깔끔하고 맛있어요뷰도 좋고 데이트하기 좋아요,2025-03-31,"저녁에 방문, 예약 없이 이용, 대기 시간 10분 이내, 데이트, 연인・배우자",인테리어가 멋져요,17,1
1846605156,뽀꿀롬,자주오는 곳이에요! 너무 맛있어요!,2025-03-31,"저녁에 방문, 예약 없이 이용, 대기 시간 바로 입장, 데이트, 연인・배우자",음식이 맛있어요,26,3
1244479891,듕듕양,찾아오는데조금헷갈렸지만~너무너무 만족~음식도맛있고분위기도좋구~친절해서너무 좋았어요~~,2025-04-08,"저녁에 방문, 예약 후 이용, 대기 시간 바로 입장, 친목, 나들이, 친구, 지인・동료",음식이 맛있어요,1048,1
1244479891,ehd****,분위기가 너무 좋네요한남동 매장은 웨이팅이 있었는데 성수점은 기다림 없이 이용해서 좋았어요음식도 너무 맛있게 먹었습니다,2025-04-08,"점심에 방문, 예약 후 이용, 대기 시간 바로 입장, 친목, 지인・동료",친절해요,628,1
1244479891,바다랑10,아기의자가 없었지만 맛있게 잘 먹었어요~ 피자 스테이크 다 맛있었고분위기좋아요!,2025-04-07,"저녁에 방문, 예약 없이 이용, 대기 시간 10분 이내, 나들이, 연인・배우자",음식이 맛있어요,24,1
1244479891,그루트유,리뷰는 처음 적는데 유투버 재유님 보고 처음 알게되어서 간곳인데 벌써 3년정도 된거 같네요.. 여긴 옥수수피자가 메인이라 꼭 드셔야합니다...! 이번엔 화이트라구파스타도 같이 시켰더니 단짠단짠 조합의 정석이라 강추 드리고 싶어요!! 옥수수피자는 살짝 매콤+달달한정도입니다 ㅎㅎ다음에도 먹으러 올게요~😚,2025-04-07,"저녁에 방문, 예약 없이 이용, 대기 시간 바로 입장, 일상, 친구",음식이 맛있어요,68,1
1244479891,드리즐63,"맛집의 증표 빈그릇 사진도 첨부합니다친구랑 오기도, 커플끼리 오기도 너무 좋아요음식도 맛있고 분위기 좋아서 데이트로 추천쓰~",2025-04-07,"점심에 방문, 예약 없이 이용, 대기 시간 바로 입장, 데이트, 연인・배우자",음식이 맛있어요,745,1
1244479891,S1120,모든 음식이 다 맛있어요!!!,2025-04-07,"점심에 방문, 예약 없이 이용, 대기 시간 바로 입장, 일상, 지인・동료",음식이 맛있어요,6,1
1244479891,마늘짱아찌,성수에 오니 맛집이 많아서 좋아요,2025-04-07,"점심에 방문, 예약 없이 이용, 대기 시간 바로 입장, 친목, 지인・동료",음식이 맛있어요,147,1
1244479891,m8****,디뮤지엄 갔다가 점심먹기 딱임,2025-04-07,"점심에 방문, 예약 없이 이용, 대기 시간 바로 입장, 나들이, 지인・동료",인테리어가 멋져요,6,1
1244479891,화덕후,한남동에서 너무 맛있게 먹었어서 서울숲점도 갔어요!  파스타는 이번에 처음 먹어봤는데 상상 이상으로 맛있네요 최고💗💗,2025-04-06,"저녁에 방문, 예약 후 이용, 대기 시간 바로 입장, 데이트, 연인・배우자",음식이 맛있어요,39,1
1244479891,정이e2,주말에 캐치테이블 걸어놓으면 1시간 이상 기다릴거 생각 하셔야하고 주문 했는데 옆자리 테이블이 훨씬 늦게 들어왔는데 우리보다 음식이 먼저 나왔어요. 직원분한테 물어보니 이제서야 음식이 지금 들어가서 5분만 기다려달라고 하셔서 15분 후에 나와서 주문하고 30분 이상을 기다렸네요. 왜 늦게 나왔냐고 여쭤보니 그제서야 주문 누락이 되었다 죄송하다해서 너무 화났네요^^ 전에 너무 맛있게 먹어서 재방문 한거였는데 직원분 대처 때문에 다시는 안가려구요~,2025-04-06,"점심에 방문, 예약 후 이용, 대기 시간 1시간 이상, 나들이, 친구",특별한 메뉴가 있어요,18,1
1244479891,aldwnfksp,피자가 짤줄 알았는데 전혀 안짜고 살짝 달달하고 맛있었어용직원분들 친절하셔서 좋아요,2025-04-06,"점심에 방문, 예약 후 이용, 대기 시간 바로 입장, 데이트",컨셉이 독특해요,8,1
1244479891,이쁜이맘64,친구들 모임으로 갔었는데 음식 하나하나 맛있고 분위기도 좋아요. 브런치 모임 하기 딱이네요,2025-04-06,"점심에 방문, 예약 후 이용, 대기 시간 바로 입장, 친목, 친구",음식이 맛있어요,25,1
1244479891,온리갓심,,2025-04-05,"저녁에 방문, 예약 없이 이용",화장실이 깨끗해요,2651,1
1244479891,aln****,이번엔 반반 피자에 도전했는데 두 가지 맛 다 만족스러워서 고르기 힘들었어요 😄,2025-04-04,"점심에 방문, 예약 없이 이용, 대기 시간 바로 입장",음식이 맛있어요,36,1
1244479891,햄스터57,특별한 날 분위기 내고 싶을 때 딱이에요. 조명도 따뜻하고 음악도 잔잔해서 좋았어요.,2025-04-04,"점심에 방문, 예약 없이 이용, 대기 시간 바로 입장, 친목, 친구",양이 많아요,64,1
1244479891,lcp****,서울숲에서 산책하고 여기 들르면 하루가 완성되는 기분이에요 🌿,2025-04-04,"점심에 방문, 예약 없이 이용, 대기 시간 바로 입장, 친목",음식이 맛있어요,86,1
1244479891,oph****,먹자마자 ‘또 오자’ 했던 곳! 피자 도우도 쫄깃하고 소스도 제대로예요.,2025-04-04,"점심에 방문, 예약 없이 이용, 대기 시간 바로 입장, 여행",음식이 맛있어요,68,1
1244479891,hakoo93,옥수수피자 강추.라자냐도 맛있어요.친구들과 모임하기 좋아요.서읠숲역 4번 출구에서 가는 게 제일 편해요.식사 후 서울숲 산책하기 좋아요.,2025-04-04,"점심에 방문, 예약 후 이용, 대기 시간 바로 입장, 친목, 지인・동료",음식이 맛있어요,112,1
1244479891,cod****,5~6년전 한남점 오픈 초기에 다녀왔는데 서울숲 옆에 있어서 생각나서 와봤어요. 그때도 옥수수피자 맛있게 먹었는데 여전히 맛있고 역시 원조네요.인테리어는 더 힙해져서 연인끼리 데이트로 오기에 딱입니다.,2025-04-03,"저녁에 방문, 예약 후 이용, 대기 시간 바로 입장, 데이트, 나들이, 연인・배우자",대화하기 좋아요,1108,1
1244479891,fea****,성수동에서 지인들이랑 같이 밥먹기 좋은 곳이에요. 분위기가 조용해서 앞 사람이랑 이야기도 불편함없이 잘 되구요🍽️,2025-04-03,"점심에 방문, 예약 없이 이용, 대기 시간 바로 입장, 데이트",재료가 신선해요,54,1
1244479891,ioy****,파스타맛집 찾고 있다면 여기 추천드려요. 양도 푸짐하고 퀄리티도 높아요.,2025-04-03,"점심에 방문, 예약 없이 이용, 대기 시간 바로 입장, 여행",음식이 맛있어요,63,1
1244479891,moo****,주차도 가능하고 매장도 넓어서 가족끼리 오기에도 좋았어요. 부모님도 만족하셨어요!,2025-04-03,"점심에 방문, 예약 없이 이용",양이 많아요,205,1
1244479891,fwi****,사진보다 실물이 더 예쁜 플레이팅! 음식 하나하나 정성이 느껴졌어요.,2025-04-03,"점심에 방문, 예약 없이 이용, 대기 시간 바로 입장, 여행",재료가 신선해요,94,1
1244479891,HUNZ,"서울숲 파스타, 피자 맛집이에요! 옥수수 피자는 달달한 옥수수가 한가득 올라간 피자가 독특하면서도 중독적인 맛이었고, 화이트 라구 파스타는 크리미한 라구 소스가 일품이었어요! 커피와 음료 메뉴도 다양해서 주문해봤는데 라떼도 고소하고 맛있었어요 :)",2025-04-02,"저녁에 방문, 예약 후 이용, 대기 시간 바로 입장, 일상, 친구",친절해요,179,1
1244479891,011****,"친구랑 급하게 찾은 성수 맛집인데, 피자랑 파스타 둘 다 훌륭해서 기분 좋은 하루였어요.",2025-04-02,"점심에 방문, 예약 후 이용, 대기 시간 바로 입장",음식이 맛있어요,109,1
1244479891,334****,화려하진 않아도 따뜻하고 조용한 분위기에서 편하게 식사할 수 있어서 좋아요.,2025-04-02,"점심에 방문, 예약 후 이용, 대기 시간 바로 입장",재료가 신선해요,85,1
1244479891,whe****,"봉골레 파스타는 해산물 향이 깊게 우러나 있어서 너무 맛있었고, 피자도 바삭하니 굿!",2025-04-02,"점심에 방문, 예약 후 이용, 대기 시간 바로 입장",재료가 신선해요,217,1
1244479891,195****,여긴 언제 와도 후회 없어요! 화이트 라구 파스타는 매번 먹어도 질리지 않네요 🥰,2025-04-02,"점심에 방문, 예약 후 이용",음식이 맛있어요,36,1
1244479891,nin****,브런치 메뉴인 메밀 유부초밥 먹어봤는데 의외로 너무 맛있어서 놀랐어요. 강추합니다,2025-04-01,"점심에 방문, 예약 후 이용",음식이 맛있어요,26,1
1244479891,hai****,화이트 라구 파스타는 꾸덕한 소스와 고기 풍미가 어우러져 진짜 중독적인 맛이었어요. 다음엔 꼭 또 먹을 거예요 😋,2025-04-01,"점심에 방문, 예약 후 이용",재료가 신선해요,46,1
