place_id,nickname,content,date,situations,keywords,review_count,visit_count
1928098974,심97,,2025-04-01,"저녁에 방문, 대기 시간 바로 입장",음식이 맛있어요,36,1
1928098974,blu****,아이들이 좋아해요,2025-03-31,"점심에 방문, 예약 없이 이용, 대기 시간 바로 입장, 가족모임, 아이",음식이 맛있어요,12,1
1928098974,thsgmlwls6,첫방문인데 친절하시고 맛있습니다ㅎㅎ고기질도 좋고 구워주셔서 좋습니다^^또 방문 예정입니다~!,2025-03-29,"저녁에 방문, 예약 없이 이용, 대기 시간 30분 이내, 친목, 친구",매장이 넓어요,57,1
1928098974,Hyun ah x p,"지나다니면서 외관도 깔끔해서 언제 한번 해야지 했는데, 오늘 드뎌 왔네요. 숙성고기라는데, 삼겹살, 목살, 가브리 주문했는데… 직원분이 구워주셔서 그런가요? 아니 여기 넘 맛있네요!!!고기는 말모지만, 숙성 된 고기라서 더 맛있었어요~여기 꼭 오세요!!!영수증 리뷰 이벤트도 하시고요. 자주 올 것 같아요~😋",2025-03-29,"저녁에 방문, 대기 시간 바로 입장, 일상, 연인・배우자, 아이",음식이 맛있어요,48,1
1928098974,bi****,맛나게 잘 먹었어용,2025-03-29,"밤에 방문, 예약 없이 이용, 대기 시간 바로 입장, 친목, 친구",인테리어가 멋져요,85,2
1928098974,daddy60,가게 분위기 좋고고기질이 좋네요^^,2025-03-28,"저녁에 방문, 예약 없이 이용, 대기 시간 바로 입장, 친목, 연인・배우자",음식이 맛있어요,8,1
1928098974,뉴세기건설인력,진짜 맛있네요^^,2025-03-28,"저녁에 방문, 예약 없이 이용, 대기 시간 바로 입장, 친목, 지인・동료",음식이 맛있어요,12,2
1928098974,뭉뭉8373,첫입부터 육즙 장난 아니네요..  왜 가게 이름이 육즙인지 알 수 있는 한입!! 분위기 좋고 연기도 안나서 좋아요!! 백김치 구워서 쌈 싸먹으면 크으~~,2025-03-26,"저녁에 방문, 예약 없이 이용, 대기 시간 바로 입장, 데이트, 일상, 가족모임, 연인・배우자, 친구",음식이 맛있어요,3,1
1928098974,정호05,맛도 있고 항상 느끼지만 구워주는게 정말 편하고 자주 왔는데 다름에 또 올 것 같네요!!,2025-03-26,"저녁에 방문, 예약 없이 이용, 대기 시간 바로 입장, 가족모임, 부모님",매장이 청결해요,20,1
1928098974,gkr****,너무 맛있게 먹었습니다 사장님도 친절 하시고 맛도 있어요 !!! 중랑구 사시는 분들이면 이곳 추천 합니다 !!,2025-03-23,"저녁에 방문, 예약 없이 이용, 대기 시간 바로 입장, 일상, 친구",인테리어가 멋져요,1,1
1928098974,샤랄라678,두번째 방문이에요 면목동 돼지고기 맛집~~!!,2025-03-22,"저녁에 방문, 예약 없이 이용, 대기 시간 10분 이내, 친목, 친구, 지인・동료",음식이 맛있어요,25,2
1928098974,mjh0liC,토요일 저녁이라 웨이팅 있을 거 같지만 지인들이 너무 맛있다고 해서 와봤는데 역시 웨이팅은 있었지만 금장 빠졌고 너무 맛있어요ㅠㅠ! 특히 목살 ♥️ 살면서 이렇게 부드러운 목살은 처음이에야 ㅋㅋ 전 삼겹살 파인데..여긴 무조건 목살!!!!! 강츄 다 맛잇네야~^^,2025-03-22,"저녁에 방문, 예약 없이 이용, 대기 시간 30분 이내, 데이트, 연인・배우자",음식이 맛있어요,43,1
1928098974,lin****,처음 와봤는데 사장님도 너무 친절 하시고 무엇보다 삼겹살이 너무 맛있어요!! 말그대로 육즙 최고예요!!,2025-03-18,"저녁에 방문, 예약 없이 이용, 대기 시간 바로 입장, 친목, 부모님",친절해요,752,1
1928098974,송송14,오랜만에 와도 맛있어여 ㅠ ㅠ ㅠ ㅠ 저희는 가브리살이 젤 맛있네용~~잘먹고갑니다~~~~😍😍,2025-03-17,"아침에 방문, 예약 없이 이용, 대기 시간 바로 입장, 데이트, 연인・배우자, 친구",음식이 맛있어요,26,3
1928098974,blueuwhite,고기를 구워줘서 좋네요~ 인테리어도 깔끔해서 좋네요가족들과 함께 오기도 괜찮을거 같아요^^ 직원 분들도 센스있고 친절하시네요,2025-03-17,"아침에 방문, 예약 없이 이용, 대기 시간 바로 입장, 일상, 연인・배우자",직접 잘 구워줘요,63,1
1928098974,꿀단지5964,가게에서 고기냄새 안 나서 좋고고기가 마시써혀어엉 조개탕도나어ㅓ염,2025-03-16,"저녁에 방문, 예약 없이 이용, 대기 시간 바로 입장, 데이트, 연인・배우자",음식이 맛있어요,23,4
1928098974,viv****,너무 맛있어요!! 자주 올 것 같아요!!,2025-03-15,"저녁에 방문, 예약 없이 이용, 대기 시간 바로 입장, 가족모임, 부모님",음식이 맛있어요,8,1
1928098974,은초비,진짜 목살 육즙 대박 첫점은 소고기맛 납니다! 꼭 드셔보세요!!!!,2025-03-15,"저녁에 방문, 예약 없이 이용, 대기 시간 10분 이내, 데이트, 연인・배우자",음식이 맛있어요,5,1
1928098974,sunlove501,고기가 두껍고 질이 너무 좋아요. 직접 맛있게 구워주셔서 더 편하고 맛있게 먹을 수 있어요🫶,2025-03-14,"저녁에 방문, 예약 없이 이용, 대기 시간 바로 입장, 가족모임, 아이, 부모님, 친척・형제",음식이 맛있어요,15,1
1928098974,협장군,직접구워주셔서 편하고 고기가 아주 맛나요!!! 홍합탕도 나와서 소주안주로 좋아요 감사합니다!!,2025-03-13,"저녁에 방문, 예약 없이 이용, 대기 시간 바로 입장, 데이트, 지인・동료",음식이 맛있어요,23,1
1928098974,리세스초콜렛,너무너무 맛있어요ㅠㅠ친절하시고 서비스 짱짱 !!,2025-03-11,"저녁에 방문, 예약 없이 이용, 대기 시간 바로 입장, 데이트, 연인・배우자",음식이 맛있어요,11,1
1928098974,두쨩9,구워주는 고깃집 찾다가 왔는데 고기도 너무 맛있어요!!직원분들도 너무 친절하시고 가게 이름대로 고기에 육즙 가득해요><리뷰대로 외국분이신 삼촌? 직원분 진짜 왕 친절해요!반찬들도 넘나 다 맛잇고 다음에 꼭 또올거에요!!,2025-03-11,"저녁에 방문, 예약 없이 이용, 대기 시간 10분 이내, 친목, 가족모임, 아이, 부모님",매장이 넓어요,21,1
1928098974,sugarㅇㅅㅇ,"고기가 맛있고, 냄새도 안나서 옷에 고기냄새 걱정 없어요!직접 딱 알맞게 구워주셔서 너무 좋아요!항상 고기 외식은 여기로 옵니다❤️",2025-03-11,"저녁에 방문, 예약 없이 이용, 대기 시간 바로 입장, 일상, 아이",음식이 맛있어요,50,7
1928098974,씐디64,삼겹살 먹고 싶을땐 무조건 여기 와요^^ 고기는 무조건이고 사이드메뉴도 다 맛있어요!! 직원분들도 다 친절하시고 늘 기분좋게 먹고 갑니다^^,2025-03-10,"저녁에 방문, 예약 없이 이용, 대기 시간 바로 입장, 데이트, 연인・배우자",음식이 맛있어요,11,3
1928098974,연화2396,넘 맛있어요 ! 재방문 의사 있습니다 !,2025-03-09,"저녁에 방문, 예약 없이 이용, 대기 시간 바로 입장, 데이트, 친구",음식이 맛있어요,241,1
1928098974,크리미82,두번째 방문입니다. 이 쪽 지나갈때마다 생각나서 방문하게 됩니다!  고기도 맛있는데 눈꽃치즈볶음밥도 맛나요,2025-03-07,"저녁에 방문, 예약 없이 이용, 대기 시간 바로 입장, 데이트, 일상, 연인・배우자",음식이 맛있어요,19,2
1928098974,히히442,집근처러 와보고 싶어서 왔어요 도톰하고 육즙 장난아니고 진짜 맛있어요애 둘 데리고 간거라 정신없었는데 직접 고기 구워주셔서 너무 편하고 맛있게 잘먹고갑니다,2025-03-07,"저녁에 방문, 예약 없이 이용, 대기 시간 바로 입장, 데이트, 연인・배우자",음식이 맛있어요,18,1
1928098974,es****,고기맛도 최고지만!!!!!!! 직원분들이 최고친절하십니다 특히 그서빙 외국분이신?삼촌~~감사합니다 왕친절~~!너무기분좋게 먹구갑니다^^~~~감사합니다 또올게요~~~사진엔없지만 계란찜도짱맛,2025-03-07,"저녁에 방문, 예약 후 이용, 대기 시간 10분 이내, 가족모임, 연인・배우자",음식이 맛있어요,23,2
1928098974,eka****,면목역 육즙면목역 삼겹살 맛집 찾을 때면목 육즙 추천드려요고기도 질 너무 좋고 두툼하구직원분이 다 구워주셔서 너무 편함.ᐟ❤️❤️👍🏻면목역 맛집 인정,2025-03-07,"밤에 방문, 예약 없이 이용, 대기 시간 바로 입장, 데이트, 일상, 연인・배우자",친절해요,73,1
1928098974,기네스45,고기질 너무좋고 친절해요~~,2025-03-06,"저녁에 방문, 예약 없이 이용, 대기 시간 바로 입장, 가족모임, 연인・배우자",음식이 맛있어요,2,1
1928098974,아령기,삼겹살 너무 맛있어서 2인분 먹다가 항정살로 넘어왔어요ㅎㅎ하남 돼지집도 직접 구어줘서 맛있는데 여기도 구어주는데 고기맛이 달라요ㅎㅎ고기먹을거면 이집 괜찮은거 같아요ㅎ,2025-03-05,"저녁에 방문, 예약 없이 이용, 대기 시간 바로 입장, 친목, 친구",음식이 맛있어요,1,1
1928098974,cha****,구워주시니 넘 편해용^^맛도 굿굿❤️면목동 맛집이에요~또 오고 싶어요!,2025-03-05,"아침에 방문, 예약 없이 이용, 대기 시간 바로 입장, 데이트, 연인・배우자",인테리어가 멋져요,14,1
1928098974,도로시5498,지나가다 몇번본 깔끔한 고깃집 기념일 맞쳐갔습니다. 너무 맛있네요. 직접 구워주시니 편하고 냄새 안풍기니 더 좋아요. 단골찜입니다,2025-03-04,"저녁에 방문, 예약 없이 이용, 대기 시간 바로 입장, 기념일, 가족모임, 아이, 부모님",고기 질이 좋아요,21,1
1928098974,s5예비입주자,,2025-03-03,"저녁에 방문, 예약 없이 이용, 대기 시간 바로 입장, 친목, 지인・동료",음식이 맛있어요,6,1
1928098974,hot****,여러번 왔는데 직원분들 다친절하시고고기 너무너무너무너무 맛있어요동네맛집♡♡,2025-03-03,"저녁에 방문, 예약 없이 이용, 대기 시간 바로 입장, 가족모임, 아이, 부모님",음식이 맛있어요,6,1
1928098974,ej0109,고기 도톰하니 육즙쫘악~~ 구워주셔서 더 조은~ 맛집 인정입니다~~^^,2025-03-03,저녁에 방문,음식이 맛있어요,1476,1
1928098974,eunlove74,고기가 냄새도 안나고 맛있어요다만 삼겹살이 좀 질겨요근데 맛있어요,2025-03-03,"아침에 방문, 예약 없이 이용, 대기 시간 바로 입장, 나들이, 부모님, 친척・형제",음식이 맛있어요,691,1
1928098974,이네일,고기가 신선해보이고 직접궈줘서 너무편하고 주차도 가게앞가능해서 좋습니다~~~ 맛도좋아요 홍합.조개탕도 서비스로나오니 소주마시기좋네요,2025-03-02,"저녁에 방문, 예약 없이 이용, 대기 시간 바로 입장, 가족모임, 연인・배우자",고기 질이 좋아요,61,1
1928098974,민쌤11,고기도 맛있고 친절하고 잘 구워주셔서 편하게 잘 먹었습니다. 아이도 맛있다며 잘 먹었어요^^ 재방문 예정입니다^^,2025-03-01,"점심에 방문, 예약 없이 이용, 대기 시간 바로 입장, 가족모임, 아이",음식이 맛있어요,4,1
1928098974,sjrnf8467,고기는 역시 육즙! 육즙이 살아있는 삼겹살 쵝오~  완전 사랑합니다♡데이트할때 좋아요ㅎ 고기 다 구워주시니 누가 서운하니 할 필요도 없고! 항상 맛있고 청결한 맛집 !직원분들도 친절해서 좋아요 맛있게 잘 먹었습니다,2025-02-28,"아침에 방문, 예약 없이 이용, 대기 시간 바로 입장, 데이트, 연인・배우자",음식이 맛있어요,16,3
1928098974,도도욤,사장님이 직접해주시던때가 좋았어요.직원분들중 중년 여성분 빼고는전부 그만큼 못구워서 고기질이 좋아도구워지면서 예전만 못합니다.어지간한 곳보다 맛있어서 자주 갔는데최근 직원분들은 친절하지도 않고고기도 못구우니 갈 이유가 사라졌어요 사장님 실력이면 더 유명해져야되는 곳인데단골로써 너무너무 아쉽습니다..,2025-02-26,"저녁에 방문, 예약 없이 이용, 대기 시간 바로 입장, 데이트, 연인・배우자",음식이 맛있어요,56,1
1928098974,gjmptw,,2025-02-23,"저녁에 방문, 예약 없이 이용, 대기 시간 바로 입장, 데이트, 연인・배우자",매장이 넓어요,24,1
1928098974,꿀단지5964,또와써염 고기냄새안나는가게라조아효,2025-02-21,"저녁에 방문, 예약 없이 이용, 대기 시간 바로 입장, 데이트, 연인・배우자",음식이 맛있어요,23,3
1928098974,zxzxx92,너무너무 맛있고 직원분들도 다 친절하세요 강추!!!!!,2025-02-21,"저녁에 방문, 예약 없이 이용, 대기 시간 바로 입장, 데이트, 연인・배우자",음식이 맛있어요,14,1
1928098974,auddh97,육즙은 언제와도 존맛입니다 🍀항정살 삼겹살 다 맛있어욤 매장두 깔끔하고 자주 오는 동네 맛집입니다 👍,2025-02-21,"저녁에 방문, 예약 없이 이용, 대기 시간 바로 입장, 데이트, 연인・배우자",음식이 맛있어요,7,2
1928098974,꿀단지5964,고기 질이 넘나 조쿠 마싯어요!!!,2025-02-19,"저녁에 방문, 예약 없이 이용, 대기 시간 바로 입장, 데이트, 연인・배우자",음식이 맛있어요,23,2
1928098974,보니또의 하루기록,숙성고기라 부드럽고 매장도 깔끔!! 고기 다 구워주시니 맛있게 먹기만 하면 되요~넘 친절하게 설명해주시고 단골 예약이요ㅋㅋㅋ 곁들이 반찬도 다 맛있고 고기와 어울리는 조합이라 좋아요~,2025-02-18,"저녁에 방문, 예약 없이 이용, 대기 시간 10분 이내, 데이트, 연인・배우자",친절해요,585,1
1928098974,박광현6,,2025-02-18,"저녁에 방문, 예약 없이 이용, 대기 시간 바로 입장, 기념일, 연인・배우자, 아이",음식이 맛있어요,1,1
1928098974,신화85,고기집 치고 봉지에 옷 안넣어도 될만큼 매장에 냄새도 안나고 고기도 맛있어요. 직원분들도 친절하세요. 특히 갈치속젓이랑 묵은지 싸먹으면 너무 맛있어요.,2025-02-15,"저녁에 방문, 예약 후 이용, 대기 시간 바로 입장, 가족모임, 연인・배우자, 아이, 친척・형제",음식이 맛있어요,10,1
1928098974,갱이8999,고기도구워주시고  친절하고  고기 질도 좋네요~,2025-02-14,"저녁에 방문, 예약 없이 이용, 대기 시간 바로 입장, 친목",고기 질이 좋아요,7,1
1928098974,baw****,고기는 항상 올때마다 야들야들해요뻑살싫어하는 저희에게 목살도 야들합니다삼걉살은 말모말모요기에 가장큰메리트는 조개탕존맛그냥 여기는 다맛있어요,2025-02-13,"저녁에 방문, 예약 없이 이용, 대기 시간 바로 입장, 데이트, 연인・배우자",음식이 맛있어요,6,1
1928098974,이수41,"집 근처라 한번씩 오는데 넘 맛있어요직원분들도 넘 친절하시고 매장이 청결해요가족모임, 지인모임 하기에도 너무 좋아요",2025-02-13,"저녁에 방문, 예약 없이 이용, 대기 시간 바로 입장, 가족모임, 연인・배우자",음식이 맛있어요,5,2
1928098974,꿀단지5964,고깃집인데 냄새가 하나도 안 나서 넘나 좋아요!당연 고기도 맛있고  가게도 깨끗해여!!,2025-02-13,"저녁에 방문, 예약 없이 이용, 대기 시간 바로 입장, 데이트, 연인・배우자",고기 질이 좋아요,23,1
1928098974,군자동 대길이,친절하시고 고기도 직접 구워주셔서 편해요.굽기도 딱 알맞고 정말 맛있습니다.리뷰 안 쓰는 편인데 너무 맛있어서 남겨요.집 근처라 자주 와야겠네요.,2025-02-11,"저녁에 방문, 예약 없이 이용, 대기 시간 바로 입장, 데이트, 연인・배우자",음식이 맛있어요,7,1
1928098974,godsydtjm52,삼겹살은 육즙👍👍 직접 구워주시고 고기도 너무 맛있어서 아이와 삼겹살이 먹고 싶을때 강추입니다❤️❤️,2025-02-10,"저녁에 방문, 예약 없이 이용, 대기 시간 바로 입장, 일상, 가족모임, 연인・배우자, 아이",음식이 맛있어요,14,2
1928098974,에티켓13,맛있어요 ^^,2025-02-10,"저녁에 방문, 예약 없이 이용, 대기 시간 바로 입장, 친목, 지인・동료",음식이 맛있어요,4,1
1928098974,솜솜2222,사진보고 기대하고 왔는데 기대한만큼 정말 맛있었습니다🥹😭사우나 갔다가 코스트코 장보고 배고파서 고기 먹으려는데 집근처에는 늦게까지하는곳이 없어서 찾아보다가 젤 맛있어 보이는대로 왔습니다!! 다른데는 잘 못구워주시는데 많은데 여기는 정말 고기 맛있게 구워 주십니다 남자 외국인분이라 반신반의 했는데 고기 굽는법을 따로 배우신듯 합니다 그렇게 많은 고깃집 다녀봤지만 여기 남자 외국인 직원분이라면 정말 맛있게 드실수 있을것 같아요 오랜만에 맛있는 저녁 먹어서 행복했습니다 감사합니다~🥰,2025-02-10,"아침에 방문, 예약 없이 이용, 대기 시간 바로 입장, 데이트, 연인・배우자",음식이 맛있어요,62,1
1928098974,auddh97,이근처 고깃집 중에 제일 깔끔하구 고기도 맛있는 곳이에요 ! 자주 옵니다 넘 맛있어요 🙂,2025-02-08,"저녁에 방문, 예약 없이 이용, 대기 시간 바로 입장, 데이트, 연인・배우자",음식이 맛있어요,7,1
1928098974,hahahagood,친절하게 잘 응대해주시구 고기도 온도계 사용하면서 정성스래 잘라주십니다고기가 참 맛있숩니다역에서도 가깝고 다시 또 방문하겠숨니다~,2025-02-08,"점심에 방문, 예약 없이 이용, 대기 시간 바로 입장, 데이트, 연인・배우자",음식이 맛있어요,13,1
1928098974,khy439547,,2025-02-08,"아침에 방문, 예약 없이 이용, 대기 시간 바로 입장, 일상, 아이",음식이 맛있어요,24,1
1928098974,스펀지송94,감사합니다 너무 맛있게 먹었어요 자주 방문할게요,2025-02-07,"저녁에 방문, 예약 없이 이용, 대기 시간 바로 입장, 데이트, 연인・배우자",음식이 맛있어요,5,1
1928098974,khy90,구워주셔서 편해요!!  모두 친절하고 말그대로 육즙 팡팡이에요!,2025-02-06,"저녁에 방문, 예약 없이 이용, 대기 시간 30분 이내, 가족모임, 부모님",음식이 맛있어요,19,1
1928098974,thaothao,진짜 맛있어요. 매장 깔끔하고 직원도 친절하세요 🥰🥰대박나세요~~~,2025-02-04,"저녁에 방문, 예약 없이 이용, 대기 시간 바로 입장, 데이트, 친구",음식이 맛있어요,3,1
1928098974,어니나잘해,매장이 넓고 청결해요! 삼겹살도 너무 맛있고 면목역에 자주 올만한 고기집이 생겨서 좋습니다. 사이드도 다 맛있어요!!,2025-02-04,"점심에 방문, 예약 없이 이용, 대기 시간 바로 입장, 데이트, 연인・배우자",음식이 맛있어요,238,1
1928098974,phja96,첫 방문인데 너무 맛있어서 또올꺼에요부모님도 만족하시고 직원분도 너무 친절하셔서 기분 좋게 먹고 갑니다👍🏻,2025-02-02,"점심에 방문, 예약 없이 이용, 대기 시간 바로 입장, 가족모임, 부모님",음식이 맛있어요,5,1
1928098974,호2,너무 맛있어서 또 방문 했어요! 삼겹살 맛집입니다 진짜 짱 맛있고 깔끔하게 직접 구워주셔요 ㅎㅎ 가브리살도 맛있어요~ 끼룩,2025-01-31,"저녁에 방문, 예약 없이 이용, 대기 시간 바로 입장, 데이트, 연인・배우자",친절해요,6,2
1928098974,our6a,"아이랑 같이 왔는데 오늘도 역시 맛있게 먹는중 ! 저번에 첨 오고, 생각나서 또 왔는데 역스 맛있움 ! 자주 자주 올게요.",2025-01-30,"저녁에 방문, 예약 없이 이용, 대기 시간 바로 입장, 가족모임, 아이",음식이 맛있어요,81,2
1928098974,잉잉쮸,면목오면 생각하는 고기 맛집!고기질도 좋고 맛있게 구워주셔서 너무 좋아요❣️,2025-01-30,"저녁에 방문, 예약 없이 이용, 대기 시간 바로 입장, 데이트, 연인・배우자",음식이 맛있어요,12,3
1928098974,크으게될아이,면목 고기하면 육즙!!설 연휴 맞아 생각나서 찾아왔어요매번 맛있게 구워주셔서 배부르게 먹고 가요,2025-01-30,"저녁에 방문, 예약 없이 이용, 대기 시간 바로 입장, 데이트, 연인・배우자",친절해요,23,2
1928098974,Dididksgayauakam,가게 분위기가 너무 좋고 고기도 구워주셔서 데이트로 왔는데 완전 만족입니다👍👍다음에 또 방문하겟습니다!,2025-01-27,"저녁에 방문, 예약 없이 이용, 대기 시간 바로 입장, 데이트, 연인・배우자",음식이 맛있어요,39,1
1928098974,회색별사탕,고기가 종류도 많고 맛있어요👍,2025-01-27,"저녁에 방문, 예약 없이 이용, 대기 시간 바로 입장, 데이트, 연인・배우자",음식이 맛있어요,67,1
1928098974,윤선904,고기 맛있어요!!,2025-01-27,"점심에 방문, 예약 없이 이용, 대기 시간 바로 입장, 가족모임",음식이 맛있어요,71,1
1928098974,blossom30,맛있는 고기에 친절한 직원분들!행복한 저녁이었습니다 번창하세요!!,2025-01-25,"저녁에 방문, 예약 없이 이용, 대기 시간 10분 이내, 데이트, 연인・배우자",음식이 맛있어요,9,1
1928098974,sy1****,맛있어요!! 사장님도 친절하세요😁,2025-01-23,"저녁에 방문, 예약 없이 이용, 대기 시간 바로 입장, 가족모임, 부모님",음식이 맛있어요,2,1
1928098974,이서히,면목역 근처에 새로 생긴 고기집이 있어 방문 했습니다! 가게 이름이 육즙인데 고기 진짜 육즙 가득이네요!! 라면은 역시 남이 끓인 라면 한입만이 최고라는 말이 있듯이 고기는 역시 남이 구워주는 고기가 최고 인가봐요. 직원분이 고기 직접 다 구워주시는데 편하고 너무 좋습니다!!! 매장 분위기도 좋고 음식도 맛있네요! 친구들과 맛있고 즐겁게 잘 먹었어요!!,2025-01-22,"저녁에 방문, 예약 없이 이용, 대기 시간 바로 입장, 친목, 친구",친절해요,38,1
1928098974,TLTK,"고기 두껍고 상태 좋아요. 그리고 고기 구워주시는데 맛있게 잘 구워주십니다. 다만, 어딜가나 구워주시는 곳들은 먹는 속도가 안맞을 수 있으니 참고하시면 되겠습니다. 저희는 추가 주문 후 직접 굽겠다 말씀드리고 직접 구워먹었습니다. 맛있게 잘 먹었습니다.",2025-01-21,"저녁에 방문, 예약 없이 이용, 대기 시간 바로 입장, 친목, 친구",음식이 맛있어요,940,1
1928098974,81chanel,좋아요,2025-01-20,"밤에 방문, 예약 없이 이용, 대기 시간 바로 입장, 연인・배우자",음식이 맛있어요,571,3
1928098974,jeunjeun4,삼겹살이 땡겨서 방문했어요고기가 신선하고 맛있게 구워주셔서 편하게 먹었어요추천합니다!!,2025-01-18,"저녁에 방문, 예약 없이 이용, 대기 시간 바로 입장, 일상, 연인・배우자",친절해요,13,1
1928098974,kyoung8009,처음 왔는데 직원분들이 친절하시고 잘 구워주셔서 맛있게 잘 먹었습니다.,2025-01-17,"저녁에 방문, 예약 없이 이용, 대기 시간 바로 입장, 가족모임, 부모님",음식이 맛있어요,1,1
1928098974,양양6231,저번에 친구랑 왔을 때 너무 맛있어서 혼자왔어요! 고기 구워주시는데 너무 맛있게 구워주셔서 행복합니다 감사해요…❤️,2025-01-17,"저녁에 방문, 예약 없이 이용, 대기 시간 바로 입장, 일상, 혼자",음식이 맛있어요,13,1
1928098974,아기별72,"진짜 너무 맛있어요 ~~ 연기 안나는 고기집 처음입니다 ^^ 볶음밥 꼭 드시고 기본으로 나오는 수데 멜젓양념, 조개탕도 입맛 돋구게 짱이에요 ~~ 삼겹, 가브리살, 목살 다 찐으로 맛나요 ~~ 너무 맛있게 잘 먹구 갑니당 ^^ 쾌적하구 정말 꼬신 고기 원하신다면 한번 꼭 와보세용 ~~  ^^ 밑반찬인 백김치 파김치도 다 맛나욤",2025-01-17,"아침에 방문, 예약 없이 이용, 대기 시간 바로 입장, 친목, 친구, 지인・동료",음식이 맛있어요,28,1
1928098974,joo****,올때마다 항상 친절하게 응대해주시고 고기 질도 좋아서 고기생각날땐 항상 육즙 찾아서 오는거같아요!!,2025-01-15,"저녁에 방문, 예약 없이 이용, 대기 시간 바로 입장, 데이트, 연인・배우자",음식이 맛있어요,6,1
1928098974,202호새댁,매장이 너무 깔끔하고 고기가  맛있어요 이동네  먹을곳 많지 않은데너무 괜찮네요 서비스 조개탕도  너무 시원하구요 ~지주 오게 될거 같아요 ~,2025-01-15,"저녁에 방문, 예약 없이 이용, 대기 시간 바로 입장, 친목, 친구",음식이 맛있어요,16,1
1928098974,Yogurt9,,2025-01-14,"저녁에 방문, 예약 없이 이용, 대기 시간 바로 입장, 일상, 연인・배우자",음식이 맛있어요,17,1
1928098974,민경2966,가족들이랑 저번에 왔는데 맛있어서 또 왔어요!!대파김치가 맛있습니당😋,2025-01-12,"저녁에 방문, 예약 없이 이용, 대기 시간 바로 입장, 가족모임, 부모님",음식이 맛있어요,18,1
