place_id,nickname,content,date,situations,keywords,review_count,visit_count
1004869182,지민1792,고기가 너무 맛있어요!! 쭈꾸미도 시켰는데 만족스럽게 먹고 갑니다!!,2025-03-29,"점심에 방문, 예약 없이 이용, 대기 시간 바로 입장, 나들이, 부모님",음식이 맛있어요,5,1
1004869182,YOON39,시립대 고기집은 여기 자주 옵니당ㅎㅎ 구워주셔서 편하고 고기도 큼직하고 맛있어요 ㅋㅋㅋ사이드 된찌랑 계란찜이 필수입니다ㅎㅎㅎ고기집 데이트 하기도 좋아요!!,2025-03-26,"저녁에 방문, 예약 없이 이용, 대기 시간 바로 입장, 데이트, 연인・배우자",음식이 맛있어요,26,1
1004869182,꼬마6029,"직접 구워주시고 묵사발, 된장찌개 서비스까지 너무 만족합니다 다음에 또 방문하고 싶네요!",2025-03-23,"저녁에 방문, 예약 없이 이용, 대기 시간 바로 입장, 데이트, 연인・배우자",친절해요,7,1
1004869182,문숩58,가족 외식으로 왔눈데 맛있게 직접 구워주셔서 잘 먹고 갑니다!다음에 또 올게요,2025-03-23,"저녁에 방문, 예약 없이 이용, 대기 시간 바로 입장, 친목, 부모님",매장이 넓어요,28,1
1004869182,yeonrose,청량리 주변 삼겹살 맛집 찾다가 시립대 앞에 맛있다는 집이 있어서 왔어요 ㅎㅎ 맛있게 잘 구워주셔서 데이트하기 좋은 것 같아요!!,2025-03-22,"저녁에 방문, 예약 없이 이용, 대기 시간 바로 입장, 데이트, 연인・배우자",음식이 맛있어요,4,1
1004869182,박성찬50,시립대 봄 산책 나들이왔어용.  청량리 삼겹살 맛집 찾아보다가 방문했는데 여전히 맛있네요. 평소엔 돼지한팡 먹다가 가족끼리 온터라 삼겹살 시켰는데 육즙이 끝내줍니다. 강추해요.,2025-03-22,"점심에 방문, 예약 없이 이용, 대기 시간 바로 입장, 나들이, 연인・배우자, 아이",음식이 맛있어요,9,1
1004869182,mjk****,시립대 맛집 고기집입니다!!회식하기에도 딱이고 데이트 하기에도 좋아요,2025-03-20,"저녁에 방문, 예약 없이 이용, 대기 시간 바로 입장, 데이트, 연인・배우자",음식이 맛있어요,4,1
1004869182,라이언72,고기가 맛있어요,2025-03-19,"저녁에 방문, 예약 없이 이용, 대기 시간 바로 입장, 친목, 지인・동료",음식이 맛있어요,9,1
1004869182,wjddbs626,고기도 직접 다 구워주시고 양도 많아서 맛있게 먹었습니다!!ㅎㅎ 사장님이 너무 친절하셔서 기분이 좋았어용 추천입니다!!👍🏻👍🏻👍🏻,2025-03-16,"저녁에 방문, 예약 없이 이용, 대기 시간 바로 입장, 데이트, 연인・배우자",친절해요,207,1
1004869182,hj****,시부모님과 편히 먹기 좋은 고깃집이에요!!맛있어서 재방문 의사 있어요!!!,2025-03-16,"점심에 방문, 예약 없이 이용, 대기 시간 바로 입장, 가족모임, 부모님",음식이 맛있어요,11,1
1004869182,Hyun0,"시립대, 전농동 삼겹살 맛집에서 저녁 먹었습니다다 구워주셔서 편하기 먹을수 있어요~ 아이와 오기도 넘 좋아요",2025-03-14,"저녁에 방문, 예약 없이 이용, 대기 시간 바로 입장, 일상, 연인・배우자, 아이",음식이 맛있어요,35,1
1004869182,포엘80,맛있어요 고기질도 좋아요 짱짱,2025-03-14,"저녁에 방문, 예약 없이 이용, 대기 시간 바로 입장, 데이트, 연인・배우자",음식이 맛있어요,4,3
1004869182,아콘치즈,시립대 정문에 있는데 고기도 직접 구워주시고 삼겹살 맛집입니다!,2025-03-11,"점심에 방문, 예약 없이 이용, 대기 시간 바로 입장, 데이트, 연인・배우자",음식이 맛있어요,6,1
1004869182,달곰30,"답십리 집근처 삼겹살 맛집이예요 내부도 깔끔하고 고기도 두껍고 구워주고 맛있어요!  가족이랑,연인이랑 외식이나 데이트하기 좋아요맛집이니 추천합니다!!",2025-03-08,"저녁에 방문, 예약 없이 이용, 대기 시간 바로 입장, 데이트, 연인・배우자",음식이 맛있어요,69,1
1004869182,zuo****,고기가 진짜 뷰드러워요. . 아이가 질긴고기는 안먹는데...어이가 너무 잘 먹어요♡,2025-03-07,"저녁에 방문, 예약 없이 이용, 대기 시간 바로 입장, 일상, 연인・배우자, 아이",음식이 맛있어요,2,1
1004869182,mgw789714,삼겹살 땡겨서 찾다가 후기기 많길래 와봤는데 넘 맛있어요!! 구워주시는데 고기를 가위가 아니고 칼로 잘라주셔요...칼로 잘라주는 곳 첨이라 넘 신기ㅋㅋㅋ고기도 두껍고 육즙 안빠지게 진짜 잘구워주시네용👍👍,2025-03-07,"저녁에 방문, 예약 없이 이용, 대기 시간 바로 입장, 데이트, 연인・배우자",음식이 맛있어요,23,1
1004869182,경기주민87,시립대 삼겹살 맛집청량리 데이트 고기도 맛나고 구워주셔서 편합니다👍👍,2025-03-03,"저녁에 방문, 예약 없이 이용, 대기 시간 바로 입장, 데이트, 연인・배우자",음식이 맛있어요,12,2
1004869182,ojs****,시립대 답십리 전농동 맛집 추천쓰,2025-03-03,"저녁에 방문, 예약 없이 이용, 대기 시간 바로 입장, 데이트, 연인・배우자",음식이 맛있어요,3,1
1004869182,HS1,매번 고기 먹고싶을때마다 방문하는데 친절히 구워주시고 맛잇어요🥺#시립대삼겹살맛집 #청량리맛집 #청량리삼겹살,2025-03-03,"점심에 방문, 예약 없이 이용, 대기 시간 바로 입장, 데이트, 연인・배우자",인테리어가 멋져요,21,1
1004869182,해피부인,고기가 육즙이 가득하고 계란찜 너무 맛있어요.직접 구워 주시니 편하게 먹을수 있네요,2025-03-03,"점심에 방문, 예약 없이 이용, 대기 시간 바로 입장, 일상, 부모님",음식이 맛있어요,1458,1
1004869182,cks****,직원분들 친절하시고  고기도 두툼하니 맛있어요.ㅎ직접 맛있게 구워주셔서 그냥 맛있게 먹기만해서 더 좋아요.ㅎㅎ귀한 쌈야채인 당귀까지 푸짐하게 주셔서 좋아요^^다음엔 가족모두랑 같이 와야겠어요.ㅎ,2025-03-02,"저녁에 방문, 예약 없이 이용, 대기 시간 바로 입장, 일상, 연인・배우자",음식이 맛있어요,6,1
1004869182,대창덮밥37,시립대 근처 삼겹살 맛집!삼겹살 맛있어요,2025-03-02,"저녁에 방문, 예약 없이 이용, 대기 시간 바로 입장, 데이트, 친목, 친구",음식이 맛있어요,12,1
1004869182,온마이웨이,시립대 근처에 고깃집 찾다가 리뷰가 좋아서 와봤어요! 삼겹살이랑 주먹고기 하나씩 시켰는데 넷이 배불리먹었어요 배불러서 냉면 패스할까 하다가 시켜봤는데 냉면도 짱맛있어요! 가족모임하기도 좋고 학생분들 데이트하시기에도 좋을거같아요 :) 추천합니다,2025-03-01,"저녁에 방문, 예약 없이 이용, 대기 시간 바로 입장, 일상, 가족모임, 부모님",음식이 맛있어요,19,1
1004869182,Smile u,청량리 전농동 서울 시립대 근처고기 맛집입니다..!   고기도 직접 구워주시네여🤙,2025-02-22,"저녁에 방문, 예약 없이 이용, 대기 시간 바로 입장, 나들이, 연인・배우자",음식이 맛있어요,6,1
1004869182,tjd****,"제가 자주가는 삼겹살 맛집입니다삼겹도 맛있고 돼지고기 모두 맛있어요시립대, 전농동 맛집이니다ㅎㅎ아내와 맛난 삼겹 먹으며 데이트 했어요~!!",2025-02-22,"저녁에 방문, 예약 없이 이용, 대기 시간 바로 입장, 데이트, 연인・배우자",음식이 맛있어요,29,1
1004869182,그냥237,,2025-02-21,"저녁에 방문, 예약 없이 이용, 대기 시간 바로 입장, 데이트, 연인・배우자",음식이 맛있어요,3,2
1004869182,밥8747,고기양도 듬뿍 맛있고 고기도 직접 구워주시니 추천하는 식당입니다ㅠㅠㅠ 여기 냉면도 별미 심지어 볶음밥도 너무 맛있는 식당이에요..ㅠㅠㅠ 왕추천!!시립대 맛집,2025-02-20,"저녁에 방문, 예약 없이 이용, 대기 시간 바로 입장, 친목, 친구",음식이 맛있어요,7,1
1004869182,포엘80,맛있어요 고기짱짱 신선해요,2025-02-16,"저녁에 방문, 예약 없이 이용, 대기 시간 바로 입장, 친목, 지인・동료",음식이 맛있어요,4,2
1004869182,sybae01,고기 직접 맛있게 구워주시고 친절하세요!,2025-02-16,"저녁에 방문, 예약 없이 이용, 대기 시간 바로 입장, 데이트, 연인・배우자",매장이 넓어요,28,1
1004869182,es****,"시립대 앞 삼겹살 맛집으로 유명한 곳 다녀왔는데 사장님도 너무 친절하시고 무엇보다 고기가 육즙이 살아있고 냄새도 안나고 넘 맛있어유,, 최고!!",2025-02-16,"점심에 방문, 예약 없이 이용, 대기 시간 바로 입장, 데이트, 친목, 연인・배우자",고기 질이 좋아요,4,1
1004869182,kjy66,직원분들 친절하시고 직접 구워주시니 편하게 먹을수있어요시립대or답십리 or전농동 or청량리,2025-02-14,"저녁에 방문, 예약 없이 이용, 대기 시간 바로 입장, 데이트, 연인・배우자",음식이 맛있어요,9,1
1004869182,Jeff818,청량리 시립대 앞 고기 맛집!!데이트나 회식 때도 갈거같아요! 맛있어요!!,2025-02-14,"저녁에 방문, 예약 없이 이용, 대기 시간 바로 입장, 데이트, 연인・배우자",음식이 맛있어요,5,1
1004869182,빠라삐리뽀뽀,항상 맛있어요!,2025-02-12,"저녁에 방문, 예약 없이 이용, 대기 시간 바로 입장, 데이트, 연인・배우자",음식이 맛있어요,55,1
1004869182,jij****,,2025-02-10,"저녁에 방문, 예약 없이 이용, 대기 시간 바로 입장, 데이트, 연인・배우자",음식이 맛있어요,11,1
1004869182,mon****,시립대 근처에서 제일 좋아하는 고깃집이에요 고기 맛있게 다 구워주셔서 편하게 먹을 수 있어요🙂 메뉴 구성도 알차고 가족들이랑 이야기 나누면서 먹기 좋은 식당입니다~~!,2025-02-09,"저녁에 방문, 예약 없이 이용, 대기 시간 바로 입장, 친목, 친척・형제",매장이 넓어요,15,2
1004869182,sub****,고기가 두꺼워서 맛있어요!! 다음에 또 가족들이랑 먹으러 올게요~!~!,2025-02-09,"저녁에 방문, 예약 없이 이용, 대기 시간 바로 입장, 가족모임, 부모님",매장이 넓어요,9,1
1004869182,박상문88,너무 맛있어서 재방문했습니다 친절히 고기를구워주셔서 덕분에 맛있고 편하게 먹었습니다 반찬이랑 된장찌개도 넘 맛나요,2025-02-09,"저녁에 방문, 예약 없이 이용, 대기 시간 바로 입장, 일상, 연인・배우자",음식이 맛있어요,2,2
1004869182,포엘80,맛있어요 고기가 신선해요~~,2025-02-07,"저녁에 방문, 예약 없이 이용, 대기 시간 바로 입장, 데이트, 연인・배우자",음식이 맛있어요,4,1
1004869182,euiness,학교 끝나고 고기 먹고 싶어서 왔는데 고기 질이 너무 좋고 진짜 맛도리입니다!! 직접 구워주셔서 너무 편해요~~🥩🥩😋😋,2025-02-06,"저녁에 방문, 예약 없이 이용, 대기 시간 바로 입장, 데이트, 연인・배우자",음식이 맛있어요,14,1
1004869182,김성아73,맛있게 잘 구워주셔서 잘 먹었어요! 친절하시고 고기 질도 좋아요!,2025-02-06,"점심에 방문, 예약 없이 이용, 대기 시간 바로 입장, 데이트, 연인・배우자",음식이 맛있어요,5,1
1004869182,dlw****,올 때마다 맛있고 항상 친절하세요🫶,2025-02-04,"저녁에 방문, 예약 없이 이용, 대기 시간 바로 입장, 데이트, 연인・배우자",고기 질이 좋아요,4,1
1004869182,bjm****,최원석의돼지한판 서해쭈꾸미 시립대점 우선 입구부터 찐 맛집 느낌! 키오스크로 자리에서 편하게 주문하고 숙성 돼지고기가 정말 맛있어요! 직원분이 직접 구워주셔서 편하고 맛있고 된장찌개와 묵사발이 서비스로 나와 너무 좋습니다!,2025-02-04,"저녁에 방문, 예약 없이 이용, 대기 시간 바로 입장, 데이트, 연인・배우자",음식이 맛있어요,13,1
1004869182,hay****,고기랑 볶음밥 찌개 냉면 다 맛있습니다 추운 날씨에 따뜻하고 맛있는 음식 먹으니 좋네요,2025-02-03,"저녁에 방문, 예약 없이 이용, 대기 시간 바로 입장, 가족모임, 아이",음식이 맛있어요,77,1
1004869182,drj****,고기 전부 구워주시고 버섯이랑 마늘 진짜 맛도리 기본 된찌에 바지락까지 들어가요 마싯어오 추천 ㅎ ㅎ,2025-01-31,"저녁에 방문, 예약 없이 이용, 대기 시간 바로 입장, 친목, 친구",음식이 맛있어요,3,1
1004869182,뽀로로5716,,2025-01-29,저녁에 방문,혼밥하기 좋아요,30,1
1004869182,찡구링,여기 고기 진짜 마시떠요ㅠ밑반찬도 훌륭하규 완전 친절하시구직접 구워다주세요! 체고,2025-01-26,"저녁에 방문, 예약 없이 이용, 대기 시간 바로 입장, 데이트, 친척・형제",음식이 맛있어요,39,1
1004869182,5793100,굿,2025-01-26,"점심에 방문, 예약 없이 이용, 대기 시간 바로 입장, 일상, 지인・동료",음식이 맛있어요,302,1
1004869182,gbd****,고기 너무 맛있어요!! 잘 구워주셔서 먹기도 편하고 좋네요 ㅎㅎ 된장찌개랑 밑반찬도 맛있습니다~~,2025-01-19,"저녁에 방문, 예약 없이 이용, 대기 시간 바로 입장, 데이트, 연인・배우자",친절해요,3,1
1004869182,살어리랏다57,고기너무맛있고 매장이깔끔하고넓어서 항상여기로 고기먹으러와요!,2025-01-19,"점심에 방문, 예약 없이 이용, 대기 시간 바로 입장, 가족모임, 연인・배우자, 아이",음식이 맛있어요,2,1
1004869182,흠7487,"고기가 너무 숙성이 잘됐고 고소해요. 직원분이 구워줘서 편해요. 밑반찬,찌개, 다  맛있고 친절한식당입니다^^",2025-01-15,"저녁에 방문, 예약 없이 이용, 대기 시간 바로 입장, 친목, 친구",음식이 맛있어요,644,6
1004869182,sgc8421,,2025-01-14,"저녁에 방문, 예약 없이 이용, 대기 시간 바로 입장, 데이트, 연인・배우자",음식이 맛있어요,3,1
1004869182,맛간짱10,,2025-01-13,"저녁에 방문, 예약 없이 이용, 대기 시간 바로 입장, 일상, 친구",음식이 맛있어요,1548,1
1004869182,박수진6068,두번째 방문인데 역시 친절하시고  음식맛은 말할것도 없이 좋네요  근처 고기집중에서는 탑티어입니다 쌈채소에 당귀도 나와서 더 조아요 번창하세요~~💗💗🙇‍♀️,2025-01-10,"저녁에 방문, 예약 없이 이용, 대기 시간 바로 입장, 데이트, 연인・배우자",음식이 맛있어요,37,1
1004869182,Su  A,직원분이 친절하고 고기도 맛있네요!,2025-01-10,"저녁에 방문, 예약 없이 이용, 대기 시간 바로 입장, 친목, 친구",음식이 맛있어요,6,1
1004869182,spoz0089,반찬도 정갈하게 나오고 고기도 맛있어요 고기 구워주시는 이모님도 친절하시고 삼겹살 땡기면 다시 재방문 할것같아요~!!,2025-01-09,"밤에 방문, 예약 없이 이용, 대기 시간 바로 입장, 일상, 지인・동료",음식이 맛있어요,11,1
1004869182,minjae84,오랜만에 와도 맛잇는 고깃집 변함없는 맛에 찾아오게되어요❤️사장님 항상 잘먹고갑니다!,2025-01-09,"저녁에 방문, 예약 없이 이용, 대기 시간 바로 입장, 데이트, 연인・배우자",음식이 맛있어요,339,4
1004869182,koo****,일요일이라 와이프랑 아이랑 가까운 곳으로 고기먹으러 왔는데 너무 쫄깃하고 맛있습니다. 쭈꾸미도 너무 맛있어요. 가족끼리 방문하기 너무 좋습니다.,2025-01-05,"저녁에 방문, 예약 없이 이용, 대기 시간 바로 입장, 가족모임, 연인・배우자, 아이",음식이 맛있어요,7,1
1004869182,nab****,고기 먹으러 멀리서왔어요 여기 고기 진짜 맛있어요 기술자의 솜씨로 맛있게구워주셔서 최상의 맛을 느낄 수 있어요!!그리고 고기만 맛집인줄 알지만 쭈꾸미도 미쳤다는거 쭈꾸미 여기서 먹고 집에서부터 1시간 걸리는데도 여기로 먹으러와요👍👍,2025-01-04,"저녁에 방문, 예약 없이 이용, 대기 시간 바로 입장, 가족모임, 친척・형제",음식이 맛있어요,8,1
1004869182,kl****,고기가 너무 좋네요 !서울 놀러와서 친구랑 먹으러 왔는데때갈도 좋고 맛도 좋습니다!아이들과 함께왔어요 ^^,2025-01-03,"저녁에 방문, 예약 없이 이용, 대기 시간 바로 입장, 데이트, 친목, 친구, 지인・동료",음식이 맛있어요,60,1
1004869182,블버터,"고기도 두툼하고, 직접 구워주셔서 먹기 편했습니다! 가게 분위기도 깔끔해서 데이트하기에도, 회식하기에도 너무 좋습니다.",2025-01-01,"저녁에 방문, 예약 없이 이용, 대기 시간 바로 입장, 데이트, 연인・배우자",음식이 맛있어요,8,1
1004869182,hjs99,시립대 맛집이라 해서 방문했습니다! 직접 구워주셔서 편하고 맛있어요!!,2024-12-31,"저녁에 방문, 예약 없이 이용, 대기 시간 바로 입장, 가족모임, 부모님, 친척・형제",음식이 맛있어요,13,1
1004869182,whaga1015,"고기가 신선하고 맛있어요!!직접 구워주셔서 편하게 먹을 수 있어요👍🏻반찬도 잘 나오고, 된장찌개도 서비스로 나와요!!!다음에도 돼지고기 먹고싶을 때 들릴게요😆",2024-12-31,"저녁에 방문, 예약 없이 이용, 대기 시간 바로 입장, 데이트, 연인・배우자",직접 잘 구워줘요,116,1
1004869182,소소이,직접구워주시고 맛이좋아요. 자주방문할게요 주차도 편해요,2024-12-28,"점심에 방문, 예약 없이 이용, 대기 시간 바로 입장, 기념일, 연인・배우자, 아이, 부모님",뷰가 좋아요,561,1
1004869182,kjhkjh1321,시립대 근처 괜찮은 고기빕입니다! 모임하기 좋아요! 추천합니다~~,2024-12-26,"저녁에 방문, 예약 없이 이용, 대기 시간 바로 입장, 가족모임, 친척・형제",음식이 맛있어요,3,1
1004869182,gml****,고기가 너무 맛있어요^^정말 크리스마스 좋은날 좋은곳에서..^고기 잘 구어주셔서 맛잇게먹었어요~,2024-12-25,"밤에 방문, 예약 없이 이용, 대기 시간 바로 입장, 연인・배우자",음식이 맛있어요,13,1
1004869182,박상문88,고기를 구워주셔서 가족들끼리 편하게 먹을 수 있어서 좋아요. 다음에 또 방문하고 싶어요 :) 직원분들도 친절하셨어요. 감사합니다.,2024-12-25,"저녁에 방문, 예약 없이 이용, 대기 시간 바로 입장, 가족모임, 지인・동료",음식이 맛있어요,2,1
1004869182,건우지롱,사장님이 정말 친절하고 고기를 잘 구워주셔서 행복하게 고기를 먹을 수 있었습니다,2024-12-21,"저녁에 방문, 예약 없이 이용, 대기 시간 바로 입장, 친목, 친구",음식이 맛있어요,5,1
1004869182,에너지소비효율,매장고 넓고 깨끗하고고기도 맛있어요!다 구워주셔서 편합니다!,2024-12-12,"저녁에 방문, 예약 없이 이용, 대기 시간 바로 입장, 친목, 지인・동료",음식이 맛있어요,8,1
1004869182,동글994,여기 진짜 처음부터 끝까지 불친절히네요 기분이 너무 나쁩니다,2024-12-10,"저녁에 방문, 예약 후 이용, 대기 시간 바로 입장, 친목, 지인・동료",,22,1
1004869182,Min Cho,늦게 까지 이렇게 맛있는 고기 먹을수 있어 너무 좋아요!,2024-12-10,"저녁에 방문, 예약 없이 이용, 대기 시간 바로 입장, 데이트, 연인・배우자",음식이 맛있어요,14,1
1004869182,kej****,아이들한테 외식 어디로 가고 싶냐고 물어보면 꼭 여기 온다고 해요~ 저번에 회원가입했더니 쿠폰 날라온게 있어서 오늘 썼어요!,2024-12-08,"저녁에 방문, 예약 없이 이용, 대기 시간 바로 입장, 가족모임, 아이",음식이 맛있어요,16,3
1004869182,밍디이이,동네에서 삼겹살 먹고싶을 때마다 오는 곳이에요!!된장찌개 서비스로 나오고 고기 질도 올때마다 굿🩷직원분들이 고기 굽기 장인이셔서 믿고 먹으러 옵니다🫶🏻,2024-12-06,"저녁에 방문, 예약 없이 이용, 대기 시간 바로 입장, 데이트, 연인・배우자",음식이 맛있어요,23,1
1004869182,Day32582,,2024-12-06,"점심에 방문, 예약 없이 이용, 대기 시간 바로 입장, 친목, 친구",고기 질이 좋아요,6,1
1004869182,주노플로,어제도 오고 오늘도 왔습니다~~ 너무 맛있어요!,2024-12-05,"저녁에 방문, 예약 없이 이용, 대기 시간 바로 입장, 회식, 친구",음식이 맛있어요,23,2
1004869182,그냥237,자주오는 집인데요 숙성된  고기맛과 구워주는 서비스가 좋아요,2024-12-01,"저녁에 방문, 예약 없이 이용, 대기 시간 바로 입장, 일상, 연인・배우자",음식이 맛있어요,3,1
1004869182,이이이89,너무 맛있어요~~~ 직접 구워주셔서 간편하고 먹기만 했어요~~~😃,2024-11-25,"저녁에 방문, 예약 없이 이용, 대기 시간 바로 입장, 데이트, 연인・배우자",고기 질이 좋아요,13,2
1004869182,bab****,숙성삼겹살 주문했는데 맛있게 잘 먹었습니다.직원분이 처음부터 끝까지 구워주시는데 너무 편하게 먹을 수 있고 아주 친절하세요~,2024-11-22,"저녁에 방문, 예약 없이 이용, 대기 시간 바로 입장, 일상, 혼자",음식이 맛있어요,17,1
1004869182,mon****,시립대에서 자주오는 고깃집이에요 삼겹살 두툼하고 무엇보다 구워주셔서 너무 편하게 먹을 수 있어서 좋아요~~! 곁들임 반찬도 자극적이지 않고 맛있습니다!!,2024-11-17,"저녁에 방문, 예약 없이 이용, 대기 시간 바로 입장, 일상, 친척・형제",매장이 넓어요,15,1
1004869182,김다혜6992,,2024-11-17,"저녁에 방문, 예약 없이 이용, 대기 시간 바로 입장, 일상",음식이 맛있어요,6,1
1004869182,소울저,고기도 직접 구워주셔서 너무 편했고 숙성이라 그런지 깊은 맛이 나고 고기질도 엄청 좋았어요!! 기본으로 나오는 묵밥도 맛있어서 국물까지 마셨네요..ㅎ사이드 메뉴도 맛있고 최고입니다!!,2024-11-17,"저녁에 방문, 예약 없이 이용, 대기 시간 바로 입장, 일상, 아이",음식이 맛있어요,10,1
1004869182,박은비1136,고기가 맛있고 분위기가 좋아요!,2024-11-13,"저녁에 방문, 예약 없이 이용, 대기 시간 바로 입장, 친목, 지인・동료",인테리어가 멋져요,13,1
1004869182,령둥,밑반찬도 맛있고 고기 너무 잘 구워주세요!! 맛있어용 ㅎㅎㅎ 이벤트도 많아서 넘 즐겁게 먹었네용!!,2024-11-13,"점심에 방문, 예약 없이 이용, 대기 시간 바로 입장, 친목, 일상, 친구",인테리어가 멋져요,28,1
1004869182,njw1994,미쳒어요 맛있어요,2024-11-12,"저녁에 방문, 예약 없이 이용, 대기 시간 바로 입장, 데이트, 연인・배우자",음식이 맛있어요,35,1
1004869182,가을242,고기가 최고입니다~자주애용할듯요,2024-11-11,"저녁에 방문, 예약 후 이용, 대기 시간 바로 입장, 가족모임, 연인・배우자, 아이",음식이 맛있어요,18,1
1004869182,swi****,일단 고기 질이 너무 좋고 고기도 직접 구워주셔서 되게 편하게 먹은것 같아요! 된장찌개도 맛있고 되게 친절하셔서 맛있는 한끼 하고 온것 같습니다!,2024-11-07,"저녁에 방문, 예약 없이 이용, 대기 시간 바로 입장, 친목, 친구",인테리어가 멋져요,11,1
1004869182,배수연453,"리뷰를 늦게 적었네요..ㅜㅜㅜ 학교에서 교수님들과 다같이 회식을 하러 왔었습니다. 예약해두고 갔는데 바로 입장하고 주문하자마자 고기가 바로 나와서 좋았어요. 고기도 직접 구워주시고 하셔서 덕분에 편하게 맛있게 먹었습니다. 계란찜도 맛있었고, 감사했습니다 :)",2024-11-06,"저녁에 방문, 예약 후 이용, 대기 시간 바로 입장, 회식, 지인・동료",음식이 맛있어요,28,1
1004869182,유월꽃,반찬이 정갈하게 잘 나오고 묵사발이 맛있습니다. 고기도 직접 구워주셔서 편하게 먹고 왔네요. 감사히 잘 먹었습니다!,2024-11-04,"저녁에 방문, 예약 없이 이용, 대기 시간 바로 입장, 친목, 친구",아늑해요,3,1
1004869182,논스톱79,"웬만하면 리뷰 안씁니다진심으로 맛있습니다항정살을 선호하지않는데, 이 곳은 진짜 미친맛입니다! 어머님께서 고기도 구워주시는데 굽기정도도 최고입니다! 꼭 와보십쇼 별점 500점!!!!!(예쁜 여자친구랑 먹어서 훨----씬 맛있기도 합니다 🥰🥰🥰)",2024-11-03,"저녁에 방문, 예약 없이 이용, 대기 시간 바로 입장, 데이트, 연인・배우자",음식이 맛있어요,9,1
36802619,킹핀73,맛있네요,2025-04-01,저녁에 방문,음식이 맛있어요,1572,4
36802619,쮸맛집,깔끔해요!,2025-03-03,저녁에 방문,음식이 맛있어요,1792,3
36802619,parkkyungjun63,,2025-02-21,저녁에 방문,음식이 맛있어요,888,3
36802619,parkkyungjun63,,2025-01-15,밤에 방문,음식이 맛있어요,888,2
