place_id,nickname,content,date,situations,keywords,review_count,visit_count
1350874889,florence0504,비오는날 아기데리고 점심을 산뜻하게 한끼 즐기고왔어요💚 리코타치즈와 무화과잼 조화에 절로 웃음이 나더라구요👍🏼 빵은 진짜 겉바속촉 제대로에요...! 버섯샌드위치는 생각지도못하게 유자 드레싱이 더해져있어서 충격적으로 맛났어요...! 주중은 엄청 붐빈다고 하시니 매주 토요일마다 가서 런던풍의 아늑한 분위기 맘껏 즐기다오려구요🥰  매장 인테리어 못찍은게 한입니다ㅠㅠ  여기 진짜 맛도 분위기도 런던 속 베이커리 카페 그 자체입니다👍🏼,2024-06-22,"점심에 방문, 예약 없이 이용, 대기 시간 바로 입장, 나들이, 연인・배우자, 아이",인테리어가 멋져요,37,5
1350874889,dja****,샌드위치 맛집,2024-04-06,"점심에 방문, 예약 없이 이용, 대기 시간 바로 입장, 나들이, 친구",커피가 맛있어요,121,6
1350874889,dja****,샌드위치 커피 다 너무 맛있어요,2024-03-30,"점심에 방문, 예약 없이 이용, 대기 시간 바로 입장, 일상, 혼자",커피가 맛있어요,121,5
1350874889,HelenaVan,너무 이쁜 곳이예요,2024-03-23,"아침에 방문, 예약 없이 이용, 대기 시간 바로 입장, 데이트, 연인・배우자",커피가 맛있어요,382,1
1350874889,바로베로,"미사 브런치 맛집😊곡물빵이 넘 맛있고, 재료도 신선해요!!수제 샌드위치가 맛이 강하지 않고, 담백하고 깔끔해서 너무 맘에들어요👍 커피와 세트 주문 가능해서! 가성비 쵝오😆인테리어도 넘 아늑하고, 친절하셔서 자주 찾게 됩니당💙",2024-01-06,"점심에 방문, 예약 없이 이용, 대기 시간 바로 입장, 일상",커피가 맛있어요,559,2
1350874889,zziv,커피 너무 맛있어요!! 조용히 쉬면서 커피 한 잔 하기 좋네요~~ ☕️,2024-01-05,"점심에 방문, 예약 없이 이용, 대기 시간 바로 입장, 친목, 친구",인테리어가 멋져요,494,1
1350874889,몰라도입니다,딸기라떼도 적당히 달달해서 맛잇어용,2024-01-01,"점심에 방문, 예약 없이 이용, 대기 시간 바로 입장, 데이트, 연인・배우자",매장이 청결해요,824,1
1350874889,rivoo,너무 좋아요….. 커피도 맛있고 샌드위치도 맛있고 스프도 맛있어요테이블 구성 공간까지 완벽해요100점 만점이에요(+샌드위치와 커피 모두 가격까지 합리적인데 스프가 그릇 크기 대비 비싸게 느껴져요. 샌드위치 세트에 추가 시 할인을 해주시면 더 많은 사람들이 함께 주문하지 않을까 생각해요. 고려해 주시면 감사하겠습니다 사장님^^),2023-12-28,"저녁에 방문, 예약 없이 이용, 대기 시간 바로 입장, 데이트, 친목, 나들이, 일상, 연인・배우자, 친구, 지인・동료, 혼자, 부모님, 반려동물",커피가 맛있어요,27,2
1350874889,바로베로,"하남미사 분위기 좋은카페🧡⭐️아늑한 분위기에, 커피도 맛있고티그레도 넘 부드럽고 맛있어요👍브런치즐기러 또 와야겠어용😊",2023-12-25,"점심에 방문, 예약 없이 이용, 대기 시간 바로 입장, 일상, 지인・동료",인테리어가 멋져요,559,1
1350874889,먹짱k선생,사장님이 너무 친절하시고 카페가 너무 예뻐요. 양송이 스프가 완전 맛있어요~~ 샌드위치 맛도 깔끔해서 재방문 의사 있어요. 다만 겨울엔 좀 추워요 그래서 그런지 자리마다 담요가 있어서 세심함이 느껴지는 곳이예요. 주차는 쉽지 않아요. 평일 낮에 가서 가게 뒤에 5대 정도 댈 수 있는곳에 딱 한자리가 남아 주차했는데 주말엔 주차할곳이 없어서 자리찾아 헤맬것 같아요.,2023-12-19,"점심에 방문, 예약 없이 이용, 대기 시간 바로 입장, 일상",커피가 맛있어요,150,1
1350874889,탄이누나나야나,우연히 들어왔는데 분위기도 좋고 티그래 넘 맛있어요😊,2023-12-16,"점심에 방문, 예약 없이 이용, 대기 시간 10분 이내, 친목, 친구",커피가 맛있어요,1098,1
1350874889,홍홍홍3547,버섯 샌드위치랑 아메리카노 세트로 먹었습니다.서빙도 테이블로 갖다주시고 친절하셨어요~또 가고 싶은 탁트인 전망에 깔끔한 매장안이 마음이 들어요!,2023-12-08,"점심에 방문, 예약 없이 이용, 대기 시간 바로 입장, 혼자",특별한 메뉴가 있어요,1867,1
1350874889,라라랜드4397,커피도 샌드위치도 좋아요🫶,2023-11-23,점심에 방문,커피가 맛있어요,476,1
1350874889,Iliilll,남편 생일이라 백화점 왔다가 방문했어요~ 샌드위치랑 커피랑 세트메뉴가 있어서 넘 좋고 재료도 신선했습니다. 다만 스프가 너무너무 뜨거워서 입 천장이랑 목구멍쪽까지 다 데어서 이틀째 고생중이에요 ㅠㅠ.. 그래도 입 다 나으면 다시 가고싶은만큼 분위기도 좋고 모든 메뉴가 맛있었습니다 :),2023-11-19,"점심에 방문, 예약 없이 이용, 대기 시간 바로 입장, 데이트, 연인・배우자",커피가 맛있어요,113,1
1350874889,sangah0,최고좋아오오오!!친절하고 맛있고 조용하고최고입니다아ㅏㅏㅏ요즘 최애🩷🩷,2023-11-16,"점심에 방문, 예약 없이 이용, 대기 시간 바로 입장, 데이트, 연인・배우자, 아이",커피가 맛있어요,473,2
1350874889,얌얌6990,가보고싶던 까페   사장님도 친절하시고 커피도 맛있고 스프도  담번에 다른 메뉴 또 먹으러 갈거같아여 직접구우시는 빵까지  냄새 솔솔~~^^,2023-10-25,점심에 방문,커피가 맛있어요,57,1
1350874889,sangah0,사장님도 직원분도 정말 친절하시고인테리어도 예쁘고 음식도 넘 맛있고이곳에 오면 아주 행복합니다ㅠㅠㅠ🫶,2023-10-09,점심에 방문,커피가 맛있어요,473,1
1350874889,stopAg16,잠봉뵈르 맛있어요,2023-09-17,점심에 방문,특별한 메뉴가 있어요,557,1
1350874889,Antdy,사장님 친절하시고 뷰조 푸릇푸릇하고 여유로운 붘위기에 층고도 높아서 전체적으로 참 맘에들어요 또올게요,2023-08-26,저녁에 방문,커피가 맛있어요,115,1
1350874889,녹초쵹,샌드위치 궁금해서 방문했습니다ㅎㅎ부부이신 것 같은 사장님 두분이 너무 친절하게 맞이해주셔서 좋았습니다 메뉴판에 샌드위치 사진이랑 안에 내용물이 뭐 들어가는 지 상세하게 써있는 점이 좋았던 것 같습니다!!프로슈토 프로마쥬 시켰는데 루꼴라 신선하고 꿀이랑 치즈 햄이 너무 잘 어울렸습니다ㅠㅠ너무 맛있어용 바게트 빵도 안 질기고 살짝 토스트되서 바삭하니 굳이었습니다😆천장도 넓고 창도 통창이여서 가게공간도 너무 개방감 있고 좋았습니다 담에 또 올 예정입니다ㅎㅎ!!,2023-08-25,점심에 방문,특별한 메뉴가 있어요,88,1
1350874889,8670young,굿,2023-08-24,점심에 방문,커피가 맛있어요,959,1
1350874889,럭키2078,"처음 가봤는데,음식도 맛있고,사장님도 친절하셨어요. 주차장이 협소했지만,길가에 이중주차하고오랜만에 만난 언니랑 실컷 수다 떠는 시간을 가졌어요.다음엔 다른 메뉴도 먹어보고 싶어요.정성 가득한 맛이 느껴지고, 다 맛있었어요.",2023-07-18,점심에 방문,커피가 맛있어요,69,1
1350874889,keh****,제가 너무나 애정하는 곳..🩵샌드위치며 커피며 완벽 그 잡채,2023-07-12,점심에 방문,집중하기 좋아요,200,1
1350874889,jun****,전부터 궁금했는데 커피가 깔끔하고 잔도 예쁘고 만족합니당❣️,2023-07-07,점심에 방문,친절해요,184,1
1350874889,류자키35,프라이데이엔 올프ㅋ,2023-07-07,점심에 방문,커피가 맛있어요,609,1
1350874889,솔방울687,인테리어 너무 예쁘고 커피랑 디저트 정말 맛있어요!!👍🏻,2023-07-06,점심에 방문,커피가 맛있어요,543,1
1350874889,Bittersweet0,,2023-07-01,점심에 방문,친절해요,585,1
1350874889,맛없으면리뷰남김,"심플담백한 샌드위치, 빵은 바삭하게 구워주시고 속에 들어간 버섯과 루꼴라 유자가 조화롭게 느껴졌습니다~!친절하신 사장님이 가격도 세트메뉴 가격으로 변경해주셨어요😋",2023-06-30,점심에 방문,음식이 맛있어요,22,1
1350874889,whitedreammocha,샌드위치도 맛있는데 단호박 스프 좋아하시는 분들은 단호박 스프 꼭 드셔보세요 넘 맛있어요,2023-06-29,점심에 방문,인테리어가 멋져요,277,1
1350874889,Chloe Lee47,모든 음료와 음식에 건강함과 프레쉬함이 느껴져서 너무 좋아요. 쾌적하고 사진도 잘나오고 주차도 편해서 자주옵니당. 이건 착즙주스인데 진쯔ㅏ 진~해서 좋아용 설탕 넣은 인위적인 맛이 아니라서 너무 좋아요,2023-06-16,밤에 방문,인테리어가 멋져요,29,4
1350874889,벨루밍,사장님 애정이 느껴지네요~ 조용하니 브런치 먹기 좋았어요,2023-06-13,점심에 방문,디저트가 맛있어요,215,1
1350874889,ha****,샌드위치 맛있어요,2023-06-13,점심에 방문,음료가 맛있어요,597,1
1350874889,dja****,"샌드위치, 커피 맛집❤️",2023-06-03,점심에 방문,뷰가 좋아요,121,4
1350874889,lazyduck90,,2023-05-26,점심에 방문,인테리어가 멋져요,700,3
1350874889,minkwak,좋은 곳을 알게되서 기분 좋네요. 맛있게 잘 먹었습니다.,2023-05-20,점심에 방문,인테리어가 멋져요,577,1
1350874889,맛고먹고,커피 잔이 큰거로 바뀌었더라구요?갈 때마다 이쁘고 메뉴도 많이 추가되었고맘에 드는 곳 😊💚제 아이패드랑 최애 노래랑힐링하고 업무보고 찰칵찰칵ㅎㅎ,2023-05-16,점심에 방문,매장이 청결해요,413,3
1350874889,dja****,커피랑 샌드위치 다 맛있어요,2023-05-14,저녁에 방문,친절해요,121,3
1350874889,밝은 햇살,카페에서 신발 벗고 양반다리로 앉아있는 분들...  참 그러네요 기본 에티켓 좀 지켜주세요 ...  카페는 집이 아닙니다.,2023-05-06,점심에 방문,특별한 메뉴가 있어요,292,1
1350874889,모델언니,자전거 타다 혼밥했는데 샌드위치도 맛있도단호박 스프 넘 잘먹음요~~케잌이 좀만 쌌으면 꼭 먹어보고 싶었다는!!!혼자 3개 먹기엔 넘 돼지같아서 ㅎㅎ,2023-04-28,점심에 방문,커피가 맛있어요,32,1
1350874889,coffe468576,,2023-04-26,점심에 방문,매장이 청결해요,84,1
1350874889,dja****,하남에서 제일 조아하는 카페입니다. 지금까지 먹었던 샌드위치중에 여기 샌드위치가 제일 맛있어요. 예전엔 드립커피만 하셨는데 지금은 카페라떼도 있네요! 커피 안쓰고 넘 맛있어요. 주차도 편하고 사장님들도 친절하세요.,2023-04-22,점심에 방문,커피가 맛있어요,121,2
1350874889,개껌57,반려동물 동반이되어서 왔는데 브런치메뉴도 너무 맛나네요😻👍,2023-04-15,점심에 방문,특별한 메뉴가 있어요,145,1
1350874889,둥둥2334,넓고 깨끗해요! 좋습니다~~,2023-04-08,점심에 방문,인테리어가 멋져요,568,1
1350874889,굿끼니는제때먹어야지,굿,2023-04-08,점심에 방문,디저트가 맛있어요,557,1
1350874889,rub****,굿,2023-03-29,점심에 방문,특별한 메뉴가 있어요,1940,1
1350874889,161****,"엄청 맛있구,, 햇살 맛집 ,, ♥ 주말에 11시반쯤 점심 시간 전에 갔더니 운 좋게 사람이 많지 않아서 편안히 쉬고 맛있게 먹었습니다 ♥ 생각보다 저렴하구 엄청 엄청 맛있었답니당",2023-03-25,점심에 방문,대화하기 좋아요,105,1
1350874889,lazyduck90,커피 맛있고 분위기가 너무 좋아요.,2023-03-19,점심에 방문,친절해요,700,2
1350874889,당 중독자,분위기가 좋고 커피도 디저트도 다 맛있어요 ..🥹저만 알고 싶은데 저만 알면 안 될 거 같은 곳,2023-03-16,점심에 방문,인테리어가 멋져요,12,1
1350874889,아쿠아블루83,"집에서 조금 멀지만 비가 오니 따뜻한 커피와 스프가 땡겨서 다녀왔습니다. 양송이스프 느끼하지 않고, 양송이가 듬뿍 들어가서 진하고 맛있었어요~  (살짝만 더 걸쭉했으면 하는 아쉬움이...^^;) 커피도 괜찮았습니다. 다음에는 잠봉뵈르나 샌드위치도 먹어보고 싶어요.  사장님들도 다 친절하십니다~~^^",2023-03-12,점심에 방문,특별한 메뉴가 있어요,1204,1
1350874889,호잇o0o,좋아요,2023-03-11,점심에 방문,디저트가 맛있어요,210,1
1350874889,angelamk,SRT 맛있어요~~신메뉴도 생겼는데 뭐하나 빠지는거없이 맛나요~아이들이 막기좋은 양송이스프랑 단호박스프랑 딸기오픈샌드위치까지 가족단위로 와도 좋아요^^,2023-03-05,점심에 방문,디저트가 맛있어요,41,2
1350874889,쥬디0,,2023-03-04,점심에 방문,친절해요,451,1
1350874889,lazyduck90,커피랑 샌드위치 둘 다 너무 맛있고 분위기도 좋아요,2023-03-01,점심에 방문,매장이 청결해요,700,1
1350874889,미냉미냉96,새로생긴 카페라 궁금해서 방문.매장 깨끗하고 따뜻하고 친절~~커피도 피스타치오케잌도 맛나네요^^샌디치랑 홈메이드스프도 있어담에 브런치먹으러 꼭!가고 싶네요~~,2023-02-22,저녁에 방문,커피가 맛있어요,1481,1
1350874889,Chloe Lee47,이 동네 샌드위치 맛집..찐맛집!!! 맛도 세련 인테리어도 세련이라 친구들오면 저는 무조건 여기 데리고 와요,2023-02-17,점심에 방문,인테리어가 멋져요,29,3
1350874889,맛고먹고,오랫만에 방문했더니 샌드위치 외에 메뉴들도 많이 생겼더라구요 ?티 라인업도 향도 너무 좋고이쁜 라떼아트도 해주셔서좋은 시간보내고 갑니동 😀,2023-02-11,점심에 방문,커피가 맛있어요,413,2
1350874889,Thktta,주말 브런치 하면 생각나는 곳. 매장이 환하고 예쁩니다 정말 청결하고 주인분들도 친절하세요!,2023-02-11,점심에 방문,사진이 잘 나와요,167,3
1350874889,Chloe Lee47,간단한 한끼 식사도 할 수 있는 카페에요.샌드위치도 맛잇지만 스프도 정말 찐 맛집!쾌적하고 주차도 가능해서 자주 와요!,2023-01-20,점심에 방문,커피가 맛있어요,29,2
1350874889,Thktta,단호박스프 맛있어요. 샌드위치도 맛도리~,2023-01-15,점심에 방문,디저트가 맛있어요,167,2
1350874889,아따맘마ㅈ2ㄷ,한국에서 맛보기 힘든 프로마슈를 먹어볼 수 있습니다.매장도 넓고 한적하고 분위기도 좋네요.주차공간도 잘돼있습니다.,2023-01-03,저녁에 방문,사진이 잘 나와요,37,1
1350874889,젼블리16,샌드위치 메뉴가 특별하고 너무 맜있어요 보통 샌드위치랑 다르게 프로슈토 포로마쥬 이국적인 샌드위치 먹어 보실수 있어요  뷰가 너무 좋고 깨끗하고 분위기가 좋아요 :),2023-01-03,저녁에 방문,친절해요,58,1
1350874889,보라색하늘맛,초코무스 먹고 싶어서 방문했는데 진짜 두접시 먹구 싶더라구요:-) 커피도 맛있구 레몬에이드도 정성스럽게 만드신 것같았어요~~ 테이블 간격도 넓직하고 다음엔 샌드위치 먹으러 와보고 싶네요!,2022-12-31,점심에 방문,디저트가 맛있어요,1089,1
1350874889,Thktta,"샌드위치 재료는 신선하고, 디저트 커피 모두 너무 맛있어요! 😊 초코 클라우드랑 단호박 스프 가 있어서 먹어봤는데 맛있었어요. 동네에 좋은 곳이 있어서 행복합니다",2022-12-31,점심에 방문,디저트가 맛있어요,167,1
1350874889,Emma,샌드위치 디저트류가 정말 맛있어요특색있어요!! 커피는 쏘쏘지만 저렴해요~가면 행복해지는곳🫶🏻,2022-12-28,점심에 방문,특별한 메뉴가 있어요,18,1
1350874889,주이디샤네에르,"초코클라우드 맛있어요! 배불러서 디저트만 먹었는데, 다음엔 브런치 먹고 싶어요🎅🏻",2022-12-24,점심에 방문,디저트가 맛있어요,1323,1
1350874889,카페투어리스트22,"올모스트프라이데이(almost Friday)기둥 제외하고 카페 두면이 모두 통창이어서 빛이 아주 좋다. 화이트톤 북유럽 스타일 인테리어가 깔끔하고 세련된다.샌드위치가 메인이고 커피는 거드는 곳이다. 아메리카노 3800원은 정말 괜찮은 가격인데, 강배전 원두이다. 강배전이어서인지 커피기름도 많이 뜨고 고소한 느낌을 넘어서 약간 떫은 맛이 느껴진다. 개인적으로 선호하지 않는 커피맛이다.배불러서 샌드위치를 시키지 않았는데, 이 카페의 진면목을 구경하고 가지 못하는 것 같아 아쉽다. 엄연히 샌드위치가 주 메뉴이니까…수제 요거트를 주문했는데, 맛있었다. 같이 딸려나온 달달한 컴포트?가 적당히 쌉쌀한 요거트랑 아주 잘 어울렸다.주차는 매장 앞에 가능하지만 거의 차있으니 주변 골목을 이용하자.",2022-12-24,점심에 방문,디저트가 맛있어요,14,1
1350874889,영수증사냥꾼,"수우 옆건물 비교적 최근에 생긴 미사 신상 카페 통유리를 통한 햇빛이 잘 들어 따듯한 느낌을 주고, 천고가 높아 개방감도 좋다. 샌드위치를 메인으로 하는 카페지만 식사 후에 방문한지라 시키진 못했고, 대안으로 선택한 요거트볼은 그래놀라와 컴포트와 곁들여 먹으니 맛이 좋았다. 커피는 개인적으로 약간 아쉬움이 있지만 샌드위치와 곁들이면 또 다른 맛을 느낄 수 있을지도 모르겠다. 조용한 분위기의 공간이 편안함을 줘서 잠시 머물다 가기 좋은 카페라고 생각한다. 주말의 여유로움을 느끼기에 좋은 곳. 카페 앞 주차 가능. 하머니 가능.",2022-12-24,점심에 방문,뷰가 좋아요,596,1
1350874889,Chloe Lee47,커피와 티가 너무 맛잇어서 애용하다가 디쉬류도 주문해봤는데 너무 맛잇어요.. 인위적인맛 하나 없고 굿굿 추운날 스프 딱이에요! 주차 가능하고 매장도 넓음,2022-12-20,점심에 방문,특별한 메뉴가 있어요,29,1
1350874889,Ghfdddddd,기본 커피도 맛있고 라떼도 맛있어요샌드위치는 건강한 맛이에요 군더더기 없이 깔끔하고 홈메이드 맛이라 넘 좋아요!(소스치덕치덕한 스타일이 아니라 개인적으로 넘맛있어요☺️)분위기도 좋구 항상 친절한 주인분✨ 두번 세번 네번 가는 이유가 있어요!,2022-12-18,점심에 방문,주차하기 편해요,719,1
1350874889,골송,샌드위치와 스프가 맛있습니다.,2022-12-15,점심에 방문,대화하기 좋아요,471,1
1350874889,고구마982,여유로운 주말 힐링에 딱이었어요..❤️ 샌드위치 취향저격 제대로네요,2022-12-03,점심에 방문,대화하기 좋아요,71,1
1350874889,고고띠히히,산책하다 들렀는데 좋아요ㅎ나중엔 메인메뉴도 같이 먹어봐야겠어요,2022-11-30,점심에 방문,커피가 맛있어요,817,1
1350874889,juju4482,케이크맛있어요근데 소리가 좀많이 울려요,2022-11-24,점심에 방문,사진이 잘 나와요,322,2
1350874889,쓰리슷하43,"오랜만에 왔는데 필터 커피가 없어서 아쉬웠습니다..하지만, 바디감 있는 원두를 사용하셔서 그런지 라떼가 묵직하고 맛있었고 직접 만드시는 마들렌도 물리지 않는 맛이라 좋습니다.",2022-11-22,점심에 방문,디저트가 맛있어요,7,2
1350874889,P_each,"맛있는 샌드위치+깔끔한 인테리어+반려견 동반까지 이 모든걸 충족하는 곳은 올모스트프라이데이뿐인거 같아요! 주문 받으시는 분도 친절하시고, 매장 인테리어가 깔끔하니 청결도도 높아보고, 샌드위치 메뉴중 3개 먹어봤는데 다 맛있어요!! 이번 겨울 시즌으로 나온 단호박 스프도 맛있습니다:) 혼자 간단하게 브런치 즐기기 좋아요!",2022-11-16,점심에 방문,매장이 청결해요,189,1
1350874889,쪼꼬맹이알61,커피가 맛있어요 디저트도 맛있습니다~:)조용하게 앉아있을수 있어 가끔 옵니다,2022-11-15,점심에 방문,집중하기 좋아요,122,1
1350874889,lksanchez,날씨가 추워지는데 깊고 진한 단호박 스프랑 샌드위치 커피의 조합이 너무좋아요 👍👍👍,2022-11-13,점심에 방문,특별한 메뉴가 있어요,1,1
1350874889,슐96,"평일 낮에 갔는데 조용해서 작업하기 좋았습니다!샌드위치 재료도 신선해서 좋고, 라떼도 맛있었어요. 다만 역이나 버스정류장이랑 멀어서ㅠㅠ 접근성이 떨어진다는 점이 조금 아쉽습니다..집 근방이라면 자주 갈 거 같아요!",2022-11-03,점심에 방문,친절해요,19,1
1350874889,juju4482,친절해요커피는 쏘쏘 케이크가 맛있어요소리가 좀 울려요,2022-10-23,점심에 방문,친절해요,322,1
1350874889,ceb****,케이크 궁금해서 시켜봤는데 고소하고 맛있어요,2022-10-20,점심에 방문,커피가 맛있어요,9,2
1350874889,맛고먹고,주차하기 편함.바로 앞에 없으면 주변에 해도 괜찮음.음료+샌드위치 구성이 좋았고인테리어 내부고 깔끔하고 이뻤음.천고도 높아 빵 뚫린 기분저녁에 와도 운치있을듯 😀,2022-10-20,점심에 방문,주차하기 편해요,413,1
1350874889,ceb****,초코클라우드 하나만 보고 찾아왔는데 인테리어도 이쁘고 커피도 정말 맛있어요 ^^ 초코무스좋아하면 꼭 먹어보세요,2022-10-02,점심에 방문,디저트가 맛있어요,9,1
1350874889,florence0504,나른한 금요일 오후는 이렇게 스윗한 디저트로 훌훌 보내버렸네요🍰🧁 바스크 치즈케이크는 먹어봤던 디저트가게들중 가장 맛있어요...! 피스타치오 치케랑은 완전 다른 매력이네요💛 한개만 시켰으면 후회했겠어요ㅎ,2022-09-30,점심에 방문,대화하기 좋아요,37,4
1350874889,kbear,친절하시구 샌드위치맛잇어요!!!!,2022-09-21,점심에 방문,좌석이 편해요,82,1
1350874889,florence0504,"느끼한걸 잔뜩 먹고온 오늘은 상큼한 티랑 디저트가 생각나서 집에 오는길에 피스타치오 라즈베리크림치즈케이크랑 신메뉴 티를 마셨어요~💕 여전히 필터커피 향이 진하고, 티는 꽃밭을 걷는듯 향기롭네요ㅎ 무엇보다도 어디서도 먹어본적없는 케이크였데 적당히 달달하고~ 부드럽고 색감도 예뻐요🍰 좀더 찬바람 불면 바스크 치케 먹으러 와야겠어요 🍮",2022-09-18,점심에 방문,디저트가 맛있어요,37,3
1350874889,okc****,친절해요,2022-09-15,점심에 방문,,325,1
1350874889,dja****,주차하기 편해요. 다만 늦게가면 자리 없을듯카페 의자 간 자리가 넉넉하게 되어있어서 거리두기도 괜찮아요. 내부 인테리어 심플하구 예뻐요. 커피도 맛있고….샌드위치가 너무 맛있어요…샌드위치때매 다시 방문하고싶은 카페!너무 맛있어요!,2022-09-11,점심에 방문,커피가 맛있어요,121,1
1307343334,밍밍밍밍밍14,근처 아파트 주민인데 산책하다 맛있어 보여서 식구데리고 갔다가 너무 놀랬어요 고기는 진짜 맛있는데 직장인들 소음이 어마어마...가족끼리 갈곳은 아니네요,2025-04-02,"저녁에 방문, 대기 시간 바로 입장, 가족모임",음식이 맛있어요,21,1
1307343334,레시피디자인,좋아요,2025-03-21,"저녁에 방문, 예약 없이 이용, 대기 시간 바로 입장, 일상, 지인・동료",음식이 맛있어요,340,2
1307343334,지닝2384,,2025-03-17,저녁에 방문,음식이 맛있어요,800,1
1307343334,빵빠라빵써이,후식까지 너무 맛있게 잘먹었어요후식 꼭 꼭 드새요 진짜 맛있습니다ㅠㅠ,2025-03-07,"저녁에 방문, 예약 후 이용, 대기 시간 바로 입장, 일상, 부모님, 친척・형제",음식이 맛있어요,71,1
1307343334,에리카설,쏘쏘 ~,2025-02-20,점심에 방문,매장이 넓어요,529,1
1307343334,lux****,고기도 질이 너무 좋고 위에 술도 너무 멋있네요 고기는 사진찍을생각못하고 먼저먹어서 사진을 못찍었네요 비즈밸리 최고 맛집입니다,2025-02-18,"저녁에 방문, 예약 없이 이용, 대기 시간 바로 입장, 친목, 나들이, 여행, 연인・배우자, 친구, 지인・동료",음식이 맛있어요,28,6
1307343334,eog****,점심식사하러 왔는데 여기 왠만한 김치찌개 전문점보다 훨씬 퀄리티도 좋고 맛있네요,2025-02-18,"점심에 방문, 예약 없이 이용, 대기 시간 바로 입장, 데이트, 친목, 연인・배우자, 친구",음식이 맛있어요,15,6
1307343334,lif****,고기질이 너무 좋습니다. 두툼하고 육즙도 가득하니 너무 좋네요. 도드람이라는 브랜드는 처음 접해봤는데 너무 좋네요. 파김치와 김치등 반찬도 정갈하니 맛있고요. 인테리어도 깔끔하니 좋네요. 근처에 사는데 자주 올거 같아요. 동네 맛집 추천합니다~~^^,2025-01-26,"저녁에 방문, 예약 없이 이용, 대기 시간 바로 입장, 데이트, 연인・배우자",음식이 맛있어요,19,1
1307343334,Coco Chanel,#구속기념#김치찌개#라면사리 추가해서#먹고 왔지요,2025-01-15,"점심에 방문, 예약 없이 이용, 대기 시간 바로 입장, 일상, 지인・동료",음식이 맛있어요,1135,2
