place_id,nickname,content,date,situations,keywords,review_count,visit_count
1214110766,내돈내산소비자,"닭목살구이 기본이랑 양념, 날치알주먹밥, 콘치즈 먹었어요. 목살구이 양념맛이 매콤하니 아주 맛있었어서 둘 중 하나 시키실거면 양념된거 시키세요. 날치알밥은 3500원 밖에 안하는데 양도 많고 고소하니 맛있어요. 콘치즈는 꼭 시키세요. 고구마가 가운데 크게 나오는데 이게 달달하니 정말 맛있어요",2024-08-07,"저녁에 방문, 예약 없이 이용, 대기 시간 바로 입장, 데이트, 연인・배우자",친절해요,174,1
1214110766,aud****,검색해서 찾아간 집인데 너무 맛있게 잘 먹어서 일부러 리뷰 씁니다~  음식이 모두 깔끔하고 재료 신선하고 맛있습니다. 저는 다음에 또 가야겠다 마음 먹었습니다!,2024-08-02,"저녁에 방문, 예약 후 이용, 대기 시간 바로 입장, 데이트, 연인・배우자",음식이 맛있어요,6,1
1214110766,정블리2785,맛있어요 친절하십니다,2024-08-01,"점심에 방문, 대기 시간 바로 입장, 일상, 지인・동료",음식이 맛있어요,1393,7
1214110766,프롬박,2차로 갔었는데 맛있었어요 ㅎㅎ다음엔 초반부터 달려봐야겠습니다 ㅋㅋ,2024-07-30,"저녁에 방문, 예약 없이 이용, 대기 시간 바로 입장, 데이트, 연인・배우자",음식이 맛있어요,644,1
1214110766,갱팔,사장님의 추천으로 선양이란 술을 첨 마셔봤는데 깔끔하고 좋았어요~~~역시 안주도 최고~~~~👍,2024-07-28,"저녁에 방문, 예약 없이 이용, 대기 시간 바로 입장, 친목, 친구",음식이 맛있어요,486,6
1214110766,갱팔,"닭발, 너무 맛있어요~~~~~♡",2024-07-21,밤에 방문,음식이 맛있어요,486,5
1214110766,빠라바라밤빰,"점심특선 간장불고기예요! 고기잡내도 없고 밥도 고슬고슬 맛있어요! 반찬4종이 갈 때마다 달라서 재밌어요! 무생채 존맛이에용 복날이라고 닭곰탕 나오는 센스,,, 원래 여름엔 묵사발, 겨울엔 콩나물국인것 같아요!",2024-07-15,"점심에 방문, 예약 없이 이용, 대기 시간 바로 입장, 일상, 혼자",음식이 맛있어요,121,10
1214110766,to****,진짜 맛있어요 구성도 좋고 반찬까지 맛있고가격도 착하고 배 터지게 먹었어요게다가 사장님도 친절하셔서 저 또 갈거에요!!!!,2024-07-14,"저녁에 방문, 예약 없이 이용, 대기 시간 바로 입장, 친목, 친구",음식이 맛있어요,32,1
1214110766,모두띠,용답시장 내 위치한 매운숯불안주 맛집 !.!여긴 양념이 진짜 맛있게 매워서 스트레스 풀기 좋았어요~음식은 주방에서 완조리되어 나오고 테이블마다 하트모양 숯을 채워 따뜻하게 음식을 먹을수 있어서 좋아요서비스로 쥬시쿨 챙겨주신 사장님 감사합니다 bbb,2024-07-12,"저녁에 방문, 예약 후 이용, 대기 시간 바로 입장, 데이트, 연인・배우자",음식이 맛있어요,132,1
1214110766,rin2994,매콤한 닭발이랑 닭목살 시켰습니다!! 닭발은 숯불향이 확나서 너무 맛나요ㅠㅠ 딱 술안주!! 닭목살은 첨 먹어보는데 꼬독꼬독 식감이 최고입니다!! 안주들 합이 좋네요 ㅎㅎㅎㅎ 😃😃,2024-07-06,"점심에 방문, 예약 없이 이용, 대기 시간 바로 입장, 친목, 친구",음식이 맛있어요,34,1
1214110766,mjr****,답십리 숯불닭발로 유명한 불티상회 ! 닭발러버로서 궁금해서 방문해봤어요 닭발이 그어디서먹은것보다 쫀득하고 맵찔이도 맛있게 먹을정도의 매움이라 너무 맛잏더라구요 🥹 닭목살 소금구이도 청양간장소스에 찍어먹으면 뻑뻑함 하나도 없이 야들야들 넘 맛있어요 ㅠㅠ동네주민이라면 매일갈듯요 ㅠㅠㅠ 닭발좋아하시면 꼭 드셔보세요 💛,2024-06-17,"저녁에 방문, 예약 후 이용, 대기 시간 바로 입장, 데이트, 연인・배우자",음식이 맛있어요,39,1
1214110766,갱팔,여기는 진짜 다 맛있어요~~~~~👍👍👍,2024-06-14,"밤에 방문, 예약 없이 이용, 대기 시간 바로 입장, 친목, 친구",음식이 맛있어요,486,4
1214110766,숑셩42,2인분만 시켰는데도 푸짐하게 나와서 맛있게 먹고 갑니다! 숯불에 구워주셔서 그런지 더 맛이 잇었고 밑반찬이랑 같이 먹으면 더더 맛이있었어요. 다음에는 혼자 점심에 와서 특선 먹구 갈려고요 ㅎㅎ,2024-06-13,"저녁에 방문, 예약 없이 이용, 대기 시간 바로 입장, 데이트, 연인・배우자",음식이 맛있어요,73,1
1214110766,해피꼼스,숯불에 구운 쭈꾸미가 정말 맛있었어요ㅎ다른 직화구이들도 먹고싶네요 ㅎ,2024-06-10,"저녁에 방문, 예약 없이 이용, 대기 시간 바로 입장, 데이트, 연인・배우자",음식이 맛있어요,737,1
1214110766,응9,"답십리역 주변에 닭발, 숯불고기 맛있는곳으로 불티상회 방문했는데 직접 구워주셔서 편하게 먹고왔어요!시킨 메뉴도 다 맛있고, 양도 많아서 가성비 최고👍🏻매운맛도 조절되서 매운맛하나 안매운거 하나 시켜서 먹었는데 매운거 잘먹는 저한테는 맵기를 더 올려서 먹어도 될 정도였어요!같이 간 사람은 매운거 못먹는데도 맛있게 매콤하다도해서 잘먹을정도였어요😁사장님께서 친절하시고, 먹는 중간중간 맵기는 괜찮으신지, 부족한 반찬은 없는지 확인도 해주시더라구요~~포차 분위기에서 안주, 술 기분 좋은 외식하고 온 느낌!!! 다음에 또 방문할게요 오래오래 장사하세요 사장님 :)",2024-06-08,"저녁에 방문, 예약 후 이용, 대기 시간 바로 입장, 데이트, 연인・배우자",친절해요,121,1
1214110766,써니64,분위기 좋고 맛도 좋고!사장님 짱 친절 ~~~,2024-06-01,저녁에 방문,음식이 맛있어요,360,3
1214110766,euniiyy,"답십리역 바로 앞에 있어서 찾아가기 쉬웠던 불티상회!닭발도 쫄깃하고 주먹밥이랑 궁합도 역시나 최고였구요, 닭목살도 불향이 진하게 나면서 정말정말 맛있었습니다 ㅎㅎㅎ 개인적으로 양념이 발린 닭목살도 궁금하더라구요!저희는 다음날 출근이라 술을 못마셨지만, 소주 한잔하기에 딱 좋은 안주였어요~~~닭발밑에 깔려져있는 야채무침도 달짝지근하고 맛있어서 싹싹 긁어 먹었답니다 ^.^답십리 근처 사시는 분들, 소주 한잔 하고 싶으실때 강추입니다!!",2024-05-26,"저녁에 방문, 예약 후 이용, 대기 시간 바로 입장, 친목, 친구",친절해요,63,1
1214110766,현지2112,답십리역 가성비 닭발 맛집!!!으로 알고 갔는데 오징어 숯불 오징어로 꼭꼭 드세요 여러분! 1인분씩 시켰는데 양 많아서 후아 배 터지는줄 알았어용 🐷🐷 안주도 다양해서 다음엔 숯불 불고기 먹으러 올게용!!,2024-05-25,"저녁에 방문, 예약 후 이용, 대기 시간 바로 입장, 친목, 친구",음식이 맛있어요,88,1
1214110766,tlswlgy713,2차로 친구랑 방문했는데닭발과 오징어이 숯불향이 잘 베어있고둘다 연해서 맛있게 먹었습니다!배부른지 모르고 술술 들어갔어요 ㅎㅎ사장님도 유쾌 친절하셔서 좋은 시간 보냈습니다!,2024-05-25,"저녁에 방문, 예약 후 이용, 대기 시간 바로 입장, 친목, 친구",아늑해요,22,1
1214110766,히블리블리,"사장님 인상 너무 좋으세요! 조리 다 돼서 나와 먹기만 하면 됩니당! 매콤하고 맵기 조절 가눙!! 사이드도 좋아하는 계란찜, 누룽지 다 있어서 더더더 만족! 화장실도 실내에 있어용! 가게도 시원하고 술이 물도 헛개수 그냥 술이 술술~~~~ ㅎㅎ 집 근처에 있으면 배달 시키고 싶어요 ㅠ_ㅠ",2024-05-25,"저녁에 방문, 예약 후 이용, 대기 시간 바로 입장, 데이트, 연인・배우자",음식이 맛있어요,1035,1
1214110766,miy****,분위기도 좋고 음식도 맛있고 너무너무 친절하고👏🏻좋아욥😊 또 갈꺼예욥😍,2024-05-24,"저녁에 방문, 예약 후 이용, 대기 시간 바로 입장, 친목, 친구",친절해요,17,1
1214110766,샤랄랄라써니,"불티상회 오랜만에 방문했는데 여전히 너무 맛있고 양도 많고 무엇보다 사장님,직원 모두 친절하셔서 더 맛있게 느껴지는 기분❤️ 남편이랑 저랑 불티상회 불닭러버인데 오늘은 닭발도 땡겨서 추가해서 먹었는뎅 ㅠㅠ역시 맛있어요ㅠㅠ용답동 주민으로서 이동네 맛집으로 유명한 곳보다....여기 진짜 찐추천이여....ㅠㅠ닭발도 오동통해서 씹을 맛 납니당ㅋㅋ아 불닭은 그냥 먹어도 맛있는데 남편은 치즈랑 먹는걸 좋아해서 추가했는뎅 치즈폭포😱  오늘 가볍게 먹으려고 했는데 푸짐하게 주셔서 감사합니당👍👍 또 올게요!!!",2024-05-24,"저녁에 방문, 예약 후 이용, 대기 시간 바로 입장, 일상, 연인・배우자",음식이 맛있어요,49,1
1214110766,꾸꾸뿌뿌,두번째 방문이에요~ 첫날 그맛이 계속 생각나서 지인들과 또 방문~ 종류별로 이것저것 시켰는데 정말 다 맛있어요~ 특히 치즈계란말이 ! 엄청커서 보면 깜놀하실거에요~ 요기는 음식도 음식이지만 사장님 너무 친절하구 좋으세요~ 옆집언니같은 느낌ㅎ 갈때마다 기분좋은 ^^ 자주가서 왕왕 먹어야겠어요 👍,2024-05-24,"저녁에 방문, 예약 후 이용, 대기 시간 바로 입장, 친목, 지인・동료",음식이 맛있어요,4,1
1214110766,두그릇뚝딱,답십리 닭발맛집은 여기에요!!한번 왔다가 맛있어서 계속 여기만 오게되더라구요음식도 맛있게 구워서 빨리 나오고 숯불구이라 불맛가득 너무 맛있어요~~,2024-05-21,"저녁에 방문, 예약 없이 이용, 대기 시간 바로 입장, 데이트, 연인・배우자",음식이 맛있어요,78,1
1214110766,초로옥이,너무너무 맛있게 잘 먹었습니다가성비 맛집 불티상회매운불맛을 찾으신다면 여기로 오세요!!이벤트도 진행중~~~!,2024-05-17,"저녁에 방문, 예약 후 이용, 대기 시간 바로 입장, 데이트, 연인・배우자",매장이 청결해요,122,1
1214110766,아자파팅팅,닭목살구이랑 닭발 먹었는데 넘나 맛있네요!!꼬들하니 식감이 좋고 같이 사이드로 나오는 묵사발이랑 샐러드도 맛있고 주먹밥도 맛있었어요술안주로도 최고이고 술 안드시는분도 묵사발에 같이 먹으니 맛있네요 혼밥하시는분도 있고 지인과 함께 와도 좋고강추입니다^^,2024-05-17,"저녁에 방문, 예약 후 이용, 대기 시간 바로 입장, 친목, 친구",음식이 맛있어요,29,1
1214110766,bae****,닭목살 처음 먹어보고 완죤 반해버렸어요 꼬들하고 매콤해서 완전 맛있습니다 ♡ 닭발도 무뼈통뼈 고를수 있어 좋아요 😀,2024-05-14,"저녁에 방문, 예약 후 이용, 대기 시간 바로 입장, 일상, 친구",음식이 맛있어요,2772,1
1214110766,라라리리로,닭목살소금구이랑 무뼈닭발 시켰습니다~~~~ 무뼈닭발은 신라면정도 맵기였는데 모든사람들이 좋아할만한 매운맛!!! 목살은 소금구이라 매운거 못드시는 분들이 이렇게 시켜서 같이 먹으면 딱이겠아요ㅎㅎ닭발이 숯불로 구워서 그런지 숯불향도 은은하게 너고 정말 맛있었습니다! 밑에 파채랑 쌈무랑 같이 싸먹으면 최고~~~~~답십리 닭발맛집은 여기입니다!!!!!,2024-05-12,"저녁에 방문, 예약 후 이용, 대기 시간 바로 입장, 친목, 부모님",음식이 맛있어요,253,1
1214110766,빠라바라밤빰,고추장 불고기는 쌈 싸먹으면 맛있어요! 계란찜 짱큰 뚝배기에 나와요,2024-05-12,"점심에 방문, 예약 없이 이용, 대기 시간 바로 입장, 데이트, 연인・배우자",음식이 맛있어요,121,9
1214110766,Daily뿌기,숯불고기 맛있어요,2024-05-11,"저녁에 방문, 예약 없이 이용, 대기 시간 바로 입장, 데이트, 연인・배우자",음식이 맛있어요,170,1
1214110766,빠라바라밤빰,점심특선 시간 널널해서 좋아용 간장불고기랑 파채조합 맛나요,2024-05-11,"점심에 방문, 예약 없이 이용, 대기 시간 바로 입장, 일상, 혼자",음식이 맛있어요,121,8
1214110766,su****,"답십리 맛집 불티상회!! 한잔하기 좋은 술집 불티상회입니당😃 숯불 닭목살 구이 먹었는데 정말 너무너무 맛있구요!!!!  직접 다 구워주셔서 먹기도 편하고 넘 좋아요!!! 기본찬으로 주시는 샐러드와 묵사발도 맛있고 추가로 주문한 계란찜과 콘치즈도 양도 많고 넘 맛있었어요!! 사장님도 넘 친절하시구 기분좋게 넘 맛있게 잘 먹고 왔습니당:)다른 테이블보니 숯불불고기랑 오징어도 넘 맛있어 보이더라구요. 쭈꾸미도..!!ㅎㅎ담엔 다른 메뉴로 먹어보려구요!!진짜 숯불에 넘 정성스럽게 잘 구워주시는듯!!숯불구이류가 최고인 불티상회에서 잘 먹고 갑니다!가족외식, 직장회식, 친구술모임하기 다 넘 좋은 장소에요!! 맛있는 음식 감사합니다:)",2024-05-10,"저녁에 방문, 예약 후 이용, 대기 시간 바로 입장, 데이트, 일상, 연인・배우자",친절해요,170,1
1214110766,김무스2311,여긴 좀 자주가는 편.갈때마다 만족하는 편.요즘 외식값 너무 하드한데이집은 아직 하드하진 않음.목요일날 먹었는데 또 먹고 싶다,2024-05-09,"저녁에 방문, 예약 후 이용, 대기 시간 바로 입장, 회식, 지인・동료",음식이 맛있어요,20,10
1214110766,유정0111,"닭목살 소금구이 , 양념구이 1 인분씩 시켰는데 구워서 나와서 너무 좋앗어용 ~~ 양념구이 매콤하게 맛잇어용 !! 사장님도 너무 친절하셔서 다음에 또 오고시퍼요 ~~~!",2024-05-08,"저녁에 방문, 예약 후 이용, 대기 시간 바로 입장, 데이트, 친구",음식이 맛있어요,60,1
1214110766,atec3,좋아요,2024-04-25,"점심에 방문, 예약 없이 이용, 대기 시간 바로 입장, 일상, 친구",음식이 맛있어요,1387,1
1214110766,깨비리,"회사동료가 맛집이라고 추천해줘서 드디어 방문했습니다1시 넘은 시간에도 딱 한 테이블만 남았더라고요다들 주문 안하신 상태였고 저희가 꼴지 ㅎㄷㄷ~~원래는 음식이 빨리 나오는 것 같은데 꼴지로 주문하다보니 대기 시간이 좀 있었지만 콩나물국 횐상이었고 쌈야채 싱싱하고 불맛 가득한 고추장 불고기, 쭈꾸미 비벼 먹으라고 대접에 야채와 김가루 날치알이 들어간 특별한 밥을 주시는 통에 밥 한그릇 순삭했습니다다 맛있어서 저 원래 밥 많이 안 먹는 편인데 밥도둑이었어요집에 가자마자 다시 먹고 싶어 생각나는 곳점심시간 가성비 좋은 메뉴로 손님 바글바글한 이유가 있어요넘 맛있게 먹었어요늦게 나왔다고 모두에게 서비스로 주신 쥬시쿨 감사합니다",2024-04-25,"점심에 방문, 예약 없이 이용, 대기 시간 바로 입장, 일상, 연인・배우자",음식이 맛있어요,2189,1
1214110766,이정민3183,"용답동에 이런 맛집이 있다니 .. 사진 안찍은거 너무 아쉬워요 ㅜㅜ 둘이서 쭈꾸미보쌈세트 먹었는데 셋이서 먹어도 충분할 것 같습니다 !!!! 보쌈도 완전 부드럽고 쭈꾸미 불향 미쳤어요 요 근래에 먹은 콘치즈중에 제일 맛있습니다 ..,,, 번창하세요 사장님 ...... ❗️❗️❗️❗️",2024-04-17,"밤에 방문, 예약 없이 이용, 대기 시간 바로 입장, 일상, 연인・배우자",친절해요,11,1
1214110766,heeya5875,야채도 많이 주시고 밑반찬도 많이주시네요👍포장도 엄청 신경써주시는게 느껴졌답니다!!^^,2024-04-10,"저녁에 방문, 포장·배달 이용",음식이 맛있어요,478,2
1214110766,heeya5875,처음갔을때 맛있게 먹고 아이들과 네이버 예약후 재방문했어요~~~ 이벤트쿠폰 사용해서 평일에 소주 2000원👍👍👍간장불고기 잡내 없어서 아이들도 잘먹더라고요^^주먹밥에는 야채도 김도 듬뿍있어서 다른데 주먹밥이랑은 다른느낌이었어요~ 닭발도 맛있고 닭목살소금구이도 괜찮네요~!친절하신 사장님과 직원분들이 계셔서 편히 식사한것같아요👍,2024-04-09,"저녁에 방문, 예약 후 이용, 대기 시간 바로 입장, 가족모임",음식이 맛있어요,478,1
1214110766,갱팔,사장님 너무 친절하시고~~메뉴들이 다 맛있어요~~~~♡,2024-03-30,"밤에 방문, 예약 없이 이용, 대기 시간 바로 입장, 친목, 친구",음식이 맛있어요,486,3
1214110766,xk****,맛있어요,2024-03-26,"저녁에 방문, 예약 없이 이용, 대기 시간 바로 입장, 친목, 지인・동료",음식이 맛있어요,763,1
1214110766,red****,서비스 국물이 맛나요 안주나오기 전에 소주1병 ㅎㅎ,2024-03-07,"저녁에 방문, 예약 없이 이용, 대기 시간 바로 입장, 일상, 지인・동료",음식이 맛있어요,632,1
1214110766,aja****,음식도 저렴하고 맛있어요!!!다음에도 먹을거 같아요,2024-03-06,"저녁에 방문, 포장·배달 이용, 대기 시간 바로 입장",음식이 맛있어요,27,1
1214110766,갱팔,가성비너무좋고 맛있고 친절하세요~~~,2024-02-28,저녁에 방문,음식이 맛있어요,486,2
1214110766,밀뚜,불금 메뉴로 뭐 먹을까 하다가들어간 곳인데 너무 만족👍🏻👍🏻👍🏻메뉴구성도 너무 좋고 맛있어서 술이 술술술 들어감앞으로 자주 갈 것 같아여!!!!,2024-02-23,"저녁에 방문, 예약 없이 이용, 대기 시간 10분 이내, 일상, 연인・배우자",친절해요,41,1
1214110766,빠라바라밤빰,"기본반찬 부침개에 오징어 넣어주는 폼 미쳐따,,, 쌈채소 오늘은 청상추도 있던데 엄청 싱싱해요! 깻잎에 간장불고기에 파채올리면 엄청 맛있어용 혼밥하기 죠아요",2024-02-21,"점심에 방문, 예약 없이 이용, 대기 시간 바로 입장, 일상, 혼자",음식이 맛있어요,121,7
1214110766,dhtpghk3,닭목살 진짜찐~입니다,2024-02-15,"저녁에 방문, 예약 후 이용, 대기 시간 바로 입장, 친목, 지인・동료",음식이 맛있어요,25,1
1214110766,빠라바라밤빰,졸업식 뒤풀이로 갔는데 고기도 많고 밑반찬도 맛있었어요! 쥬시쿨로 짠도 했어요!,2024-02-15,"점심에 방문, 예약 없이 이용, 대기 시간 바로 입장, 친목, 친구",음식이 맛있어요,121,6
1214110766,빠라바라밤빰,올 때마다 반찬이 바뀌어서 재밌어요! 고기가 진짜 부드럽고 잡내가 없어서 좋습니당 근데 가끔 TV에 액션영화를 큰 소리로 틀어놓으시더라구요... 뉴스나 예능같은거를 쪼그맣게 틀어두셨으면 좋겠는 바람이 있어요...,2024-02-08,"점심에 방문, 예약 없이 이용, 대기 시간 바로 입장, 일상, 혼자",음식이 맛있어요,121,5
1214110766,dlrhkdals11,대박 너무 맛남 대박!,2024-02-06,저녁에 방문,특별한 메뉴가 있어요,521,1
1214110766,소다8044,오늘 이것저것 많이 챙겨주시고 친구들이랑 정말 맛있게 잘 먹었습니다 ! 👐 양도 정말 많고 반찬도 넘넘 맛있었어요 :),2024-02-03,"저녁에 방문, 예약 후 이용, 대기 시간 바로 입장, 친목, 친구",음식이 맛있어요,38,2
1214110766,동그라미4341,"답십리역 주변으로 친구들이랑 술 한 잔 하기 좋은 곳, 숨은 맛집 불티상회에 다녀왔습니다. 가게 앞에 큰 닭발 풍선에 '불티상회'라고 적혀서 찾기 쉬웠어요^^요즘 고물가시대에 착한가격들이라서 가성비 좋게 먹고 올 수 있었습니다사장님과 종업원 분들 또한 친절하고, 음식맛도, 술맛도 좋아서 즐겁게 먹다 왔네요",2024-02-02,"저녁에 방문, 예약 없이 이용, 대기 시간 바로 입장, 친목, 친구",단체모임 하기 좋아요,29,1
1214110766,가나다라마바사8885,진짜어케ㅜㅜㅜㅜ 답십리맛집은 무조건 불티상회 ㅠㅠ 가격도 저렴한데 양까지 많아서 배터지기 먹고 나올 수 있습니다 ❤️❤️ 네이버예약 쿠폰 쓰세요~~ 개이득~~~ 👍🏻🐙 저는 직화쭈꾸미보쌈세트 주문했고 보쌈이랑 쭈꾸미 감싸서 한입에 와압하면 소주 한병 뚝딱이네요쭈꾸미 크기도 크고 잡내도 안나고 재방문의사 100퍼 있는 곳이에요 추천!!,2024-02-02,"저녁에 방문, 예약 없이 이용, 대기 시간 바로 입장, 친목, 부모님",음식이 맛있어요,327,1
1214110766,네이버사람,"✔숯불 살로만 불닭불맛이 느껴지는 불닭이에요 순살이라 먹기 편하고 부드러워요.17,000원에 양도 많아서 가성비가 좋아요무턱대고 매운 맛이 아니라 맛있게 맵고 저한테는 신라면 정도 맵기로 느껴져서 많이 맵지 않았어요!공기밥 시켜서 같이 먹으면 더 맛있어요✔왕계란말이말그대로 왕이에요 양이 엄청 많고 맛있어요 결국 다 못먹고 포장했는데 집에 와서 식은채로 먹어도 맛있더라구요✔네이버 예약시 쿠폰 5종 사용 가능!✔점심식사도 가능저녁때 여는 포차가 많은데 여긴 점심식사도 가능해요✔소독기에 수저가소독기 쓰는 곳 처음 봤는데 소독기 안에 수저가 들어 있어 위생적이었어요✔기본 안주 조개탕콩나물이 들어간 조개탕이 기본 안주로 나오는데 진짜 맛있어요 👍",2024-01-31,"저녁에 방문, 예약 없이 이용, 대기 시간 바로 입장, 나들이, 혼자",음식이 맛있어요,680,1
1214110766,피오57,올때마다  느끼지만 너무 친절하시고  음식이  맛있어여~~닭발사랑 짱~~~♡,2024-01-31,저녁에 방문,음식이 맛있어요,346,19
1214110766,dageumine,양이 진짜진짜 많고! 가볍게 술 한 잔하면서 먹기 넘 좋았어요-! 직원 분도 넘 친절하시고(다 먹고 나갈 때 쥬시쿨도 주시고❤️) 싹싹 다~~~ 먹어치웠습니다! 주먹밥도 시켜서 먹었는데 고기랑 넘나 잘 어울리는 거...✨ 맛있게 잘 먹었습니다!👍🏻,2024-01-23,"저녁에 방문, 예약 후 이용, 대기 시간 바로 입장, 회식, 친구, 지인・동료",음식이 맛있어요,112,1
1214110766,피오57,진짜  너무 맛있어여~~~~ ♡♡♡,2024-01-21,저녁에 방문,음식이 맛있어요,346,18
1214110766,소다8044,양 정말정말 많고 밑반찬도 진짜 맛있어요! 해물탕 같은 국물도 주시는데 진짜 시원해요 ! 배터지게 잘 먹었습니다 다음에 또올게여!!!,2024-01-21,"저녁에 방문, 예약 없이 이용, 대기 시간 바로 입장, 친목",음식이 맛있어요,38,1
1214110766,모험가찌니,집근처에서 한잔 하려고 간 닭발집인데 맛집이었음👍🏻저 왜 이제 와본거죠…닭발 양념 미쳤어요🧡 주먹밥 양도 왕 많고 유쾌한 사장님까지 자주 들릴게여😜 숯불 향이 좋아서 계속 생각나요..🔥,2024-01-20,"저녁에 방문, 예약 후 이용, 대기 시간 바로 입장, 데이트, 연인・배우자",음식이 맛있어요,73,1
1214110766,ming282,낮술이 땡겨서 오후 다섯시에 방문했는데 더 늦게 방문했으면 자리없어서 못 먹을뻔 했오요 ㅠㅜ ♥ 무뼈닭발 불맛장난아니구 살로만 불닭도 너무너무 맛있어요♥ 기본 반찬으로 조개탕이 나오는게 웬말!! 배불러서 날치알주먹밥 못먹은게 넘 슬퍼요 ㅠ 담엔 꼭 먹어야징🥺😍,2024-01-20,"저녁에 방문, 예약 후 이용, 대기 시간 바로 입장, 데이트, 연인・배우자",친절해요,2,1
1214110766,맛술러,처음 갔는데 답심리 맛집으로 바로 저장했어요!! 닭발이랑 닭구이소금 시켰는데 저녁겸 술안주로 진짜 최고입니당 ㅠㅠㅜㅜ 다 구워져서 나와서 먹기도 편했어요~~~ 담에 또 갈게요 사장님^^,2024-01-17,"저녁에 방문, 예약 후 이용, 대기 시간 바로 입장, 친목, 일상, 친척・형제",매장이 청결해요,45,1
1214110766,도심 속의 라쿤,근처 나으리 닭발이랑은 또 다른맛 ㅎㅎ 통닭발 살도 오동통하구 여기 닭목살구이도 별미에 맛나요!  가격두 착하구.. 집근처였다면 참 좋았을텐디,2024-01-15,"저녁에 방문, 예약 없이 이용, 대기 시간 바로 입장, 친목, 지인・동료",음식이 맛있어요,559,1
1214110766,che****,숯불 닭발 구이하면 여기가 찐 맛집입니도.. 🥹주먹밥 꼭 같이 시켜서 먹으세용 ㅠ 매콤하니 완전 술 안주로 딱이였어요 그리고 예약하고 가면 쿠폰 쓰실 수 있으니꼭 ! 받아 가세용 사장님 인심이 넘 후하셔 ..,2024-01-12,"저녁에 방문, 예약 후 이용, 대기 시간 바로 입장, 일상, 연인・배우자",음식이 맛있어요,63,1
1214110766,피오57,👍,2024-01-06,밤에 방문,음식이 맛있어요,346,17
1214110766,마이멜로디162,여기 양이 진짜 많아요 !! 🩷 고기 불향 싹 나는 게 너무 맛있고 쌈이랑도 잘 어울려요 고기랑 파채랑 먹어도 찰떡 ㅎㅎ,2023-12-30,"저녁에 방문, 예약 없이 이용, 대기 시간 바로 입장, 일상, 부모님",음식이 맛있어요,86,1
