place_id,nickname,content,date,situations,keywords,review_count,visit_count
1110196289,준4409,"여러번 먹어본 제제 짜장면과 게살볶음밥, 샤롱바오 외에 창펀과 탄탄면도 맛있게 먹었다. 제제를 온 가족이 좋아하게 됐다.",2025-03-15,"저녁에 방문, 예약 후 이용, 대기 시간 바로 입장, 기념일, 아이",음식이 맛있어요,118,1
1110196289,우아한 장금씨,"성수 줄서는 식당 딤섬 중식 맛집 제제예요❤️친구가 5시 15분쯤 도착, 대기 1번, 6시 예약자리 있어 먹고 6시까지 나올 수 있었는데 기다렸다가 36분에 입장 알림요.둘이서 새우창펀(13.0), 트러플 메추리알 샤오마이(10.0), 하가우(9.0) 주문요.• 새우창펀 - 바삭 고소하고 새우 두툼해 맛있었어요~! 👍둘이서 나눠먹으니 오이무침 먹고싶을 정도로 느끼하진 않았어요 ㅎㅎ꼭 드세요^^• 하가우 - 첫 딤섬의 강렬함으로 애정하는 하가우라 골랐는데 딤섬피가 꽤 부드러운 편이라 살짝 아쉬웠지만 맛있었어요^^• 트메샤 - 트러플 별로인 1인인데, 메추리알의 탱글고소한 맛과 은은하게 잘 어울려 👍바 자리가 없어 1인식사 안돼 아쉽지만, 메뉴 빨리 나와 좋았고, 메뉴가 다양해 만족요^^",2025-03-08,"저녁에 방문, 대기 시간 30분 이내",음식이 맛있어요,1028,1
1110196289,영시미39,건물뒷편에 주차장 있구요! 창펀 먹어버고싶었는데 새우창펀 정말 맛있네요!! 탄탄면은 처음먹어봐서 향신료 못먹는 저는 뭔가 향신료같은 강한 느낌은 없어서 먹을수있었구요! 탄탄면이 처음이라 비교를 못하겠네요^^;;  전체적우로 다 맛있고 친절하고 또 방문하려합니다!,2025-03-06,"저녁에 방문, 예약 없이 이용, 대기 시간 바로 입장",친절해요,315,1
1110196289,때깔좋은때지,"베이징덕 먹고싶어서 예약후 이용. 예약때 (수술후 회복중인 환자가 있어서)춥지않고 조용한자리 요청했었는데 문쪽자리 안내받음. 예약손님,웨이팅손님,포장손님이 계속 들락거려서 겉옷입고 먹음.베이징덕 양을 물어봤을때 3~4인 먹는다하고, 보통 에피타이저로 딤섬먹고 베이징덕먹거나 부족하면 식사주문한다기에 평소2인분으로 셋이 먹어도 남는 소식 가족이라 다른거없이 바로 베이징덕 먹고 부족하면 추가하겠다했더니 그제서야 베이징덕 준비하는지 한참 기다린뒤에야 먹을수있었음. 같이나온 전병이 차가웠고 두번째준 전병은 따뜻. 결론적으로 베이징덕은 양이 생각보다 적어서 새우크리스피창펀 추가로 시키고도 배부르지않았음. 평소 순살 후라이드치킨 한마리시키면 겨우 다먹거나 남기는 가족인데 이런 상황...가격대비 추천하고 싶지않음",2025-02-25,"저녁에 방문, 예약 후 이용, 대기 시간 바로 입장, 가족모임, 연인・배우자, 아이",,209,1
1110196289,유개죽,해산물볶음면 👍🏻,2025-02-15,"저녁에 방문, 예약 없이 이용, 대기 시간 30분 이내, 나들이, 친구",음식이 맛있어요,1705,1
1110196289,BELLA99,네번쯤 방문했는데두번은 식사시간에 맞춰가서 매뉴여러개 시켜서잘 몰랐는데지난번도 그렇구 오늘처럼 다른곳에서 늦은점심먹구 카페들렀다 요기새우창펀 먹고싶어서 친구와 방문했는데딤섬이나  사이드메뉴는 꼭 메인디쉬를 1인당 시켜야 된다고 하네요 1차로 배부르게 먹고외서 딤섬만 먹고 가고 싶다하니 안된다해서:걍 암꺼니 메인디쉬를 고르는데제가 선택을 못하니메니저이신듯한 직원분이 다소퉅툴대시면서 그냥 처음 주문하려 했던거만 시키시라며 메뉴판 걷어가시네요 그러고는 돌아서시며 추가주문은 안된다고 말하시는데:: 어차피 그렇게 주문하라  헸으면 좀더 친절하게 말씀하심 얼마나 서로 기분좋을까요 같이 간 친구가 눈치보면서 잠실에도 이정도 맛집은 있다며 여긴 배고플때 말고는 눈치보여 못오겠다네요 맛이구 뭐구언능 먹구 나왔습니다ㅜ,2025-02-15,"저녁에 방문, 예약 없이 이용, 대기 시간 10분 이내, 일상, 친구",특별한 메뉴가 있어요,10,2
1110196289,째깍째깍,"샤오롱바오 9천, 새우창펀 1만3천, 사천식탄탄면 1만4천. 맛있게 잘 먹고왔다!!",2025-02-09,저녁에 방문,음식이 맛있어요,761,1
1110196289,쏭구마,맛있었어요! 중식이 끌려서 갔어요. 주변 음식점에 비해 가격도 양도 합리적이었어요! 볶음밥 간이 완벽해서 놀랐어요. 맛있었습니당,2025-01-23,"저녁에 방문, 예약 없이 이용, 대기 시간 바로 입장, 친목, 친구",음식이 맛있어요,381,1
1110196289,빵디야,이른저녁 시간대에 방문했는데 식사중이신 테이블이 많아서 놀랐어요~~크리스피새우창펀으로 시작해서 메뉴들이 빠르게 제공됩니다 양은 많은편이 아니라 성인2명이 다양하게 먹을수 있어요 시그니처 메뉴들로 주문했고 맛있게 잘먹었습니다💗,2025-01-11,"저녁에 방문, 예약 없이 이용, 대기 시간 바로 입장, 데이트, 연인・배우자",음식이 맛있어요,464,1
1110196289,ask****,음식이 맛있어요 😀,2025-01-08,"저녁에 방문, 예약 없이 이용, 대기 시간 바로 입장, 일상, 지인・동료",음식이 맛있어요,1080,1
1110196289,sunny5193,"크리스피 새우 창펀이 너무 맛있고 마라두부, 샤오롱바오도 일반적으로 먹는 맛이 아닙니다. 홍콩 현지에서 먹는 것 같았어요. 맛있게 잘 먹었습니다.",2025-01-04,"점심에 방문, 예약 후 이용, 대기 시간 바로 입장, 친목, 친구",음식이 맛있어요,347,1
1110196289,gwageunjoo38,맛있어요,2024-12-26,"점심에 방문, 예약 없이 이용, 대기 시간 바로 입장, 친목, 지인・동료",음식이 맛있어요,854,1
1110196289,섬섬옥수수수염차,제제 짜장면 매콤하면서 맛있어요.일반 짜장과는 다른 특제 소스 맛이 매력적~흑식초 탕슉도 새콤하니맛있어요! 고기가 좀 두껍고 통통한 편이라 그건 개취가 아니라 별로..하지만 또 가고 싶은 곳!!,2024-12-06,"점심에 방문, 예약 없이 이용, 대기 시간 바로 입장, 친목, 친구",음식이 맛있어요,192,1
1110196289,jun****,해산물 볶음면을 먹었습니다. 갓볶아서 내주셔서 넘나 따끈하게 잘먹었어요. 저녁에 요리류랑 같이 먹어보고싶네여,2024-11-27,"점심에 방문, 예약 없이 이용, 대기 시간 바로 입장, 친목, 지인・동료",음식이 맛있어요,144,1
1110196289,Globian66,좋아염~^*.,2024-11-19,"점심에 방문, 예약 없이 이용, 대기 시간 바로 입장, 데이트, 연인・배우자",음식이 맛있어요,904,1
1110196289,바람5711,전반적으로 다 나쁘지 않은 맛이었습니다 크리스피창펀 제일 맛있고 오이반찬 주문 필수이고 탄탄면은 쏘쏘 라즈지는 딱 맥주안주였어요!,2024-11-06,"점심에 방문, 예약 없이 이용, 대기 시간 바로 입장, 일상, 친구",음식이 맛있어요,350,1
1110196289,순이1678,"하가우, 새우창펀, 오이냉채 넘넘 맛있어요재방문 의사 있습니당",2024-11-05,저녁에 방문,인테리어가 멋져요,588,1
1110196289,나의 외장하드,리뷰가 좋은 새우창펀은 오히려 쏘쏘간도 좀 짜네요양주식볶음밥 추천,2024-11-02,점심에 방문,음식이 맛있어요,841,1
1110196289,kim****,맛있어용,2024-10-27,"저녁에 방문, 예약 없이 이용, 대기 시간 30분 이내, 친목, 친구",음식이 맛있어요,32,1
1110196289,토토뉴냐,맛있어요,2024-10-20,"점심에 방문, 예약 후 이용, 대기 시간 바로 입장, 친목, 친구",음식이 맛있어요,174,1
1110196289,rud****,정신없이 먹느라 사진을 못 찍었네요 일단 예약 안하고 평일 저녁 웨이팅 했는데 20분 안에 들어갔어요부추교자 하가우 샤오룽바오 먹었는데 모든 딤섬 다 맛있고 특히 하가우 탱글탱글!완탕면에 있는 새우완자도 탱글탱글! 자가제면한 면도 특이하고 고소 구수하고 맛있었어요딤섬과 식사 및 요리 메뉴 먹다보면 가격이 후루룩 올라가지만 그래도 맛있어서 기분 좋아요 ㅎㅎ담에 또 올 거예요,2024-10-15,"저녁에 방문, 예약 없이 이용, 대기 시간 30분 이내, 친목, 지인・동료",인테리어가 멋져요,863,1
1110196289,BEAULIGHT,소룡포 완탕면 겁나맛있음,2024-10-13,저녁에 방문,음식이 맛있어요,1528,1
1110196289,do2****,맛나요,2024-10-12,"점심에 방문, 예약 없이 이용, 대기 시간 바로 입장, 친목, 친구",음식이 맛있어요,1585,1
1110196289,쿠키갱,굿👍🏻,2024-10-11,"저녁에 방문, 예약 없이 이용, 대기 시간 바로 입장, 친목, 친구",친절해요,567,1
1110196289,선인장튀김,새우 창펀이 딤섬류 중 가장 맛있었어요.트러플메추리알샤오마이 메추리알이 반숙이라 특이함.샤오롱바오 하가우 부추교자 맛있음오이냉채 시켜야 느끼함 잡아줌칠리새우 꼭 시켜야 됨날치알게살볶음밥 굿,2024-10-08,아침에 방문,음식이 맛있어요,1219,1
1110196289,Iop,가격대비 양 적고 여직원 엄청 불친절해요,2024-10-03,저녁에 방문,컨셉이 독특해요,49,1
1110196289,둠스닥스,"서울숲 중식 최고 식당. 분위기도 좋고 예약도 되고 회사 근처라 종종 가는 맛집트러플 메추리, XO볶음밥, 마파두부, 유린기는 필수임. 왜냐 존맛이기 때문. 근데 서비스는 이 날따라 불만족...테이블 공간도 많은데 먹던 접시를 자꾸 빼감. 음식 남은거 가져가달라고 말씀하신게 4번은 될듯...아직 먹고있는데..한두시간 있던 것도 아니고ㅠ결제시간 보니 45분 있었음...개선 시급.",2024-10-02,"점심에 방문, 예약 후 이용, 대기 시간 바로 입장",음식이 맛있어요,607,4
1110196289,수슐랭,"새우창펀 맛있었고, 다른 음식들도 맛있어요! 그리고 아기랑 가도 친절하게 응대해주셔서 좋아요^^",2024-09-29,"저녁에 방문, 예약 없이 이용, 대기 시간 바로 입장, 나들이, 연인・배우자, 아이",음식이 맛있어요,857,5
1110196289,lim****,굿굿,2024-09-29,"점심에 방문, 예약 없이 이용, 대기 시간 10분 이내, 나들이, 연인・배우자",음식이 맛있어요,942,1
1110196289,Lavenda,맛있는 제제,2024-09-28,"저녁에 방문, 예약 없이 이용, 대기 시간 30분 이내, 데이트, 나들이, 연인・배우자",음식이 맛있어요,1943,1
1110196289,섹시소쥬,맛나요,2024-09-08,저녁에 방문,매장이 청결해요,640,1
1110196289,먹생먹사람,"베스트는 새우크리스피창펀! 일단 잡숴봐유. 트러플메추리알샤오마이는 반숙메츄리알이라 눅진한 노른자가 입안에서 퍼져서 넘 좋았음!흑식초는 뭔가 오래 숙성함 발사믹 특유의 찐득함이 느껴지는데 톡 쏘는 중국식 탕수육이 거부감 없으면 맛있게 먹을 수 있고 다른 곳에 잘 없음!!우육탕면은 맛은 있는데 간이 너무 세다…진한게 아니라 짠데 식을수로 짠맛만 정말 강해져서 살짝 아쉬웠디. 면이나 토핑은 좋았는데요. ㅠ ㅠ 볶음밥은 볶음밥이고 그리고 하나 불만이 있다면… 쟈스민챠 3,500원은 너무 비싼것 같습니다…",2024-09-01,"저녁에 방문, 예약 없이 이용, 대기 시간 바로 입장, 친목, 친구",음식이 맛있어요,474,1
1110196289,스마일디제이,맛있어요~~ 👍🏻,2024-08-27,"저녁에 방문, 예약 없이 이용, 대기 시간 바로 입장, 친목, 친구",대화하기 좋아요,3207,1
1110196289,날랭랭,샤오롱바오가 유명한 이유가 있는 곳이에요~ 탄탄면은 처음 먹어보는데 조금 더 매콤하면 좋았을 것 같았고 볶음밥은 무난했는데 샤오롱바오는 진짜 맛있었어요! 혼자서 두판도 가능할 것 같은 맛이었습니다😋,2024-08-23,"점심에 방문, 예약 없이 이용, 대기 시간 10분 이내, 친목, 친구",음식이 맛있어요,287,1
1110196289,YJo8,여기서 먹은 메뉴 중 샤오롱바오가 제일 맛있었어요탄탄면은 뭔가...제 입맛에는 안 맞았고 볶음밥은 고슬고슬 괜찮았어요!,2024-08-23,점심에 방문,특별한 메뉴가 있어요,1026,1
1110196289,모호록,음식 깔끔하고 괜찮아요! 다만 양은 많진 않아서 살짝 비싼 느낌도 있네요,2024-08-08,"점심에 방문, 예약 후 이용, 대기 시간 10분 이내, 친목, 지인・동료",차분한 분위기에요,225,1
1110196289,totorosi,"오랫만에 들른 제제,, 정말 특별하고 맛있는 중식당,트러픙메추리알샤오마이, 샤오롱바오, 소흥주칠리새우, 사천마파두부에 볶음밥, 코코넛밥을 쓱쓱 비벼 먹으면,,, 한참을 과식해버릴 수 밖에 없음,, 이 집 역시 웨이팅을 기본으로 하는 집이지만 오늘은 운이 좋게 바로 먹을 수 있었다, 성수에서 애정하는 맛집^^",2024-07-23,"점심에 방문, 예약 없이 이용, 대기 시간 바로 입장, 친목, 연인・배우자",음식이 맛있어요,85,1
1110196289,들렀다가요,흑식초탕수육 독톡하고 맛도 괜찮아요 방문할 때마다 꼭 주문해서 먹어요,2024-07-06,"저녁에 방문, 예약 없이 이용, 대기 시간 30분 이내",음식이 맛있어요,870,2
1110196289,리뷰미순소머리국바비,긋,2024-07-03,"점심에 방문, 예약 없이 이용, 대기 시간 바로 입장, 데이트, 연인・배우자",음식이 맛있어요,729,1
1110196289,디기딕디디,"주말 점심 예약없이 방문, 웨이팅 없이 바로 입장새우딤섬 너어무 맛있고, 음식이 다서 기름질 수 있기 때문에 사이드메뉴 오이 꼭!!!! 주문하세요 추천!",2024-06-16,"점심에 방문, 예약 없이 이용, 대기 시간 바로 입장, 친목, 친구",음식이 맛있어요,85,1
1110196289,haeat,하... 너무 다 맛있었어요 딤섬이랑 사이드 제외하고 1인 1메뉴 시켜야되서 딤섬을 더 못시켜서 (더 시키면 메인 음식을 남겼을꺼라) 아쉬웠어요,2024-06-15,"점심에 방문, 예약 후 이용, 대기 시간 바로 입장, 친목, 친구",음식이 맛있어요,202,1
1110196289,먹고 먹고 먹고,새우 짱맛있고흑초탕수도 맛있어요,2024-06-09,"저녁에 방문, 예약 없이 이용, 대기 시간 바로 입장",음식이 맛있어요,530,1
1110196289,에오니80,주방이 다보이는 구조인데 마스크 아무도 안쓰고  토마토 맨손으로 집어서 주고 외부 쓰레기 치우다가 바로 주방들어가서 맨손으로 고기만짐 메인디쉬 랑 탄탄면 시켰는데 메인디쉬 다먹고니서 한참 기다렸다가 탄탄면나옴 메인 다 먹고 주는거라는데 그러면 처음부터 메인다음에 탄탄면 나올꺼라고 손님한테 설명해줘야하는거 아닌가 탄탄면 누락해놓고 핑계대는것으로 밖에 안보임,2024-06-07,"점심에 방문, 예약 없이 이용, 대기 시간 바로 입장, 데이트, 연인・배우자",,48,1
1110196289,예아지20,두번째 방문입니다. 역시나 불친절하시네요 ..?처음 방문했을 때도 서비스가 별로였는데 오픈부터 사람이 꽤 있었어서 바쁘셔서 그랬나보다 했지만 그날도 기분좋게 들어가지는 않았어요. 그런데 두번째 방문은 오픈 30분 전 도착해서 기다리려고 하는데 홀직원분 역시나 너무 불친절하게 안내해주시고 본인 일만 보시더라구요. 음식은 맛있었지만 계속해서 이런 서비스라면 아무리 맛집이어도 찾아가지 않을 것 같아요. 다른 곳을 방문하려다가 못가게 되서 갈 곳을 찾다 지난번에 맛있게 먹었던 제제가 생각나서 재방문 한거였는데 아직까지 서비스는 영 별로였네요. 식사 전부터 기분이 상했습니다. 서비스는 정말 별로지만 맛있는 중식을 찾는 분들께 추천드려요. 왠만해서 이런 리뷰 잘 안쓰는 사람인데  이렇게 됐네요.,2024-06-06,"점심에 방문, 예약 없이 이용, 대기 시간 30분 이내, 일상, 부모님",,15,1
1110196289,ejm****,2번째 방문했어요.오늘은 바로 입장해서 바로 식사를 했어요 맛있게 먹었습니다.,2024-06-04,"점심에 방문, 예약 없이 이용, 대기 시간 바로 입장, 친목, 친척・형제",음식이 맛있어요,1441,1
1110196289,곰2198,"정말 맛있고 분위기도 좋았는데, 밥먹는데 계속 다 먹은 음식이나 접시를 중간중간 너무 자주 오셔서 치워서,, 먹기 집중하기힘들었어요 빨리 나가라능거같아서",2024-06-01,"저녁에 방문, 예약 없이 이용, 대기 시간 30분 이내, 데이트, 연인・배우자",음식이 맛있어요,594,1
1110196289,심술쟁이마녀,별로..,2024-05-26,"점심에 방문, 예약 없이 이용, 대기 시간 바로 입장, 친목, 친구",,574,1
1110196289,sse****,새우창펀이 맛있어요. 주류도 시키는데 식사를 인원수대로 주문 해야 하는게 좀 그렇네요.,2024-05-21,"저녁에 방문, 예약 후 이용, 대기 시간 바로 입장, 친목, 친구",음식이 맛있어요,254,1
1110196289,내마링,탕수육 새콤해서 물리지 않고 너무 맛있어요. 짜장면서 자가제면이라 맛있더라구요. 전반적인 메뉴가 깔끔해서 좋았습니다.,2024-05-21,"점심에 방문, 예약 없이 이용, 대기 시간 바로 입장, 친목, 친구",인테리어가 멋져요,112,1
1110196289,맛에 진심 쵸키,"맛있어요탄탄멘은 다른곳서 먹어보지 못한 맛인데 맛있구흑식초탕수육은 중국식초 버무린맛이라 맛있는데,,먹다보면 조금 물릴수있어서 밥이나 매콤한걸 같이 주문하면 좋을듯합니다!재방문의사있어요!!",2024-05-18,"저녁에 방문, 예약 없이 이용, 대기 시간 30분 이내",음식이 맛있어요,122,1
1110196289,수슐랭,새우창펀 굿!,2024-05-12,"저녁에 방문, 예약 없이 이용, 대기 시간 10분 이내, 일상, 연인・배우자, 아이, 친척・형제",음식이 맛있어요,857,4
1110196289,우중의꽃,음식이 맛있어요,2024-05-11,저녁에 방문,음식이 맛있어요,282,1
1110196289,빈이39,먹어본 딤섬들 중에 가장 맛잇엇음 탄탄면은 별로근데 메인메뉴 무조건 인원수당 시켜야한다고 해서딤섬 추가할거라 하나만 시켜도 되냐고 했는데된다고 함 이게마음에 안들었는지웨이팅 손님도 생기고하니까 먹고있는데 막 빈접시라고 치운다는 말도 없이 계속 가져감 그래서 앉아있는데 테이블에 앞접시만 남게됨 ㅋㅋ옆테이블은 고량주에 비싼요리 시키고 나가서 한참을 담배핀다고 안들어왔는데 옆테이블 빈접시는 그냥두고 .. 음식은 맛있었지만 그닥 기분이 좋진 않았네요다시갈지는 잘 .. 손님을 대하는 직원들 태도부터 고쳐야지 싶네요 아무리 음식이 맛있어도 ..ㅎ,2024-05-09,"저녁에 방문, 예약 없이 이용, 대기 시간 바로 입장, 친목, 친구",음식이 맛있어요,5,1
1110196289,욕망의항아리18호,"메추리알 들어간 딤섬은 메추리알이 반숙이라 좋아써용새우창펀도 존맛이에요근데 우육탕면은 너무 짜요,,,8일 오후 5시 40분에 계시던 뉴발 신발에 머리 묶고 마스크 쓰신 알바생분 굉장히 불친절해요🥺👎저희가 주문하려고 불렀을 때 전화 받으신채로 아무말 없이 메뉴판 걷어가셔서 당황했어요",2024-05-08,"저녁에 방문, 예약 없이 이용, 대기 시간 바로 입장, 데이트, 연인・배우자",특별한 메뉴가 있어요,17,1
1110196289,SHORRY,리뷰들이 극과 극이지만 중식이 먹고 싶어 방문했어요. 접대는 친절했고 음식은 코스요리처럼  천천히 나왔어요. 먹을때는 맛있다고 먹었지만 음식과 같이  콜라를 마셨는데 콜라맛이 느껴지지 않았어요. 그만큼 간이 쌥니다.. 식후 2시간이 되었는데 같이 먹었던 사람도 저도 속이 쓰려요. 달고 짜요. 보통 중식의 두배정도 되는것 같아요... ㅠㅜ 당도와 염도를 좀 낮춰서 조리하시면 좋을 것 같아요.,2024-05-03,저녁에 방문,,124,1
1110196289,나루밋,금요일 저녁 6시쯤 방문했을 때 웨이팅 없었어요. 테이블이 많지 않지만 모두 푹신석입니다. 테이블링 어플을 사용해요. 딤섬류는 다 쫀득하고 폭신해서 맛있어요. 샤오롱바오는 전용 받침대를 주셔서 국물이랑 먹기 좋았어요. 탄탄면은 면이 많아서 굉장히 배부릅니다. 딤섬 제외 1인 1메뉴입니다. 맥주랑 같이 마시면 좋은데 6천원대에요. 깔끔하게 딤섬 먹을 때 추천합니다!,2024-04-19,"저녁에 방문, 예약 없이 이용, 대기 시간 바로 입장, 데이트, 연인・배우자",친절해요,540,1
1110196289,Mon2K,음식 맛있어요!!,2024-04-18,"저녁에 방문, 예약 없이 이용, 대기 시간 바로 입장, 친목, 친구",음식이 맛있어요,311,1
1110196289,who am I,"맛집이라하여 방문하였으나, 탄탄면은 소금면이구요 사천식라즈지는 손톱만한닭고기 낚시해서먹었습니다. 마른고추볶음으로 이름을 바꿔야할것같아요.샤오롱바오 껍질에서 밀가루 맛 나요.  돈아깝습니다.",2024-04-10,"점심에 방문, 예약 없이 이용, 대기 시간 30분 이상, 일상, 친척・형제",,1231,1
1110196289,wvivi,맛있어요,2024-04-07,"점심에 방문, 예약 없이 이용, 대기 시간 10분 이내, 친목, 친구",음식이 맛있어요,1211,1
1110196289,ali****,여기 창펀개 맛도리!! 탕탕면은 기본이라는 말이 많아서 완탕면 시켰는데 맑은 국물 먹고 싶으면 완전 추천우육면은 대만에서 먹었던 컵라면 우육면 처럼 찐하고 맛있었음,2024-04-05,"점심에 방문, 예약 없이 이용, 대기 시간 30분 이상, 데이트, 친구",음식이 맛있어요,853,1
1110196289,호엉이8274,"캐치테이블 예약이 안돼서 현장 예약했어요!앞에 3팀 대기하고 있다고 떠 있었는데요4팀이 넘게 들어갔는데두 저흴 안 부르더라구요~직원에게 얘기했더니 현장예악보다 시간예약한 사람 먼저 부르는 시스템이라네요ㅠ30분 넘게 기다렸다 입성했습니다.하가우, 오이냉채, 우육탕면 시켰어요.창펀도 시켰는데 저희보다 늦게 온 테이블은 나오는데저희껀 안 나오더라구요.손님이 많아서 잊어버리셨대요ㅠ오이냉채 맛있다는 글이 있어서 시켜봤는데간장에 마늘넣은 그냥오이.하가우는 새우살이 한가득 통통하게 들어있어서 맛있었어요.우육탕면은.....뭐지.....면이 덜 익었는지 한가닥을 들어 올리면 면전체가 들어올려지는 기적이 벌어지고요.딱딱했어요~원래 이런면인건가?제제야~~이젠 안녕~~~",2024-04-05,"점심에 방문, 예약 없이 이용, 대기 시간 30분 이내, 데이트, 연인・배우자",친절해요,1394,1
1110196289,blues00,우연히 들어간 곳이 맛있고 분위기 있을때 기분 최고인데 여기가 그랬음. 맛있고 친절하고 분위기 있어서 강추!! 2인 자리가 좁은게 다소 불편하긴 한데 직원분들이 친절해서 상쇄시킴,2024-03-31,"점심에 방문, 예약 없이 이용, 대기 시간 바로 입장, 데이트, 나들이, 연인・배우자",음식이 맛있어요,16,1
1110196289,Lemonade77,"소흥주 칠리새우 진짜 맛있네요 👍이 날 주문한게 다 좋았는데특히 소흥주 칠리새우, 흑식초 해파리냉채, 새우창펀은 꼭 드셔요😊",2024-03-27,"점심에 방문, 예약 없이 이용, 대기 시간 바로 입장, 일상, 친구",친절해요,258,1
1110196289,oh****,새우가 정말 바삭하고 소스도 맛있어서 볶음밥에도 비벼 먹었는데 아주 최고였습니다 👍,2024-03-23,"점심에 방문, 예약 없이 이용, 대기 시간 10분 이내, 데이트, 연인・배우자",음식이 맛있어요,509,1
1110196289,루미쿄부우,음식은 맛있었습니다.이해가 안가는게 저희가 제일 먼저 들어가서 먼저 주문했는데 뒤 순서 부터 메뉴가 나와서 좀 당황스러웠습니다. 왜 그런거냐고 물어보니 죄송하다고만 하시고 웍 순서가 있어서 그렇다는데 저희보다 나중에 오신 테이블들이랑 같은 메뉴도 늦게 주문한 순서부터 음식이 나와서 불편했습니다.,2024-03-23,"점심에 방문, 예약 없이 이용, 대기 시간 바로 입장, 나들이, 연인・배우자, 아이",차분한 분위기에요,11,1
1110196289,day999,"계산하시는 분..결제하려고 카드 꺼내자마자 한손으로 거칠게 휙 채가시네요.. 기분 나쁘다고 말씀드리니 “제가요? 아닌데요?, 바빠서 그런건데요” 껄렁껄렁 얘기하시네요…외식하면서 이런 무례한 대우는 생전 처음이네요. 기분좋게 밥먹으러 왔다가 하루 기분 다 망쳤습니다 재방문 의사 없습니다.",2024-03-17,"저녁에 방문, 예약 없이 이용, 대기 시간 바로 입장, 데이트, 연인・배우자",인테리어가 멋져요,12,1
1110196289,green light27,🙄,2024-03-12,"점심에 방문, 예약 없이 이용, 대기 시간 바로 입장, 일상, 혼자",,696,1
