place_id,nickname,content,date,situations,keywords,review_count,visit_count
1907695191,이보라사랑,너무 맛있게 먹었어요!!! 가게 분위기도 좋아서 모임할때도 강추합니다!!!,2025-03-26,"저녁에 방문, 예약 없이 이용, 대기 시간 바로 입장, 일상, 친척・형제",좌석이 편해요,8,1
1907695191,jim****,양 많고 맛있어요!!!!,2025-03-26,"저녁에 방문, 예약 없이 이용, 대기 시간 바로 입장, 친목, 친구",음식이 맛있어요,36,2
1907695191,96****,양도 많고 가격도 착하고 맛있어요!!또 오겠습니당,2025-03-25,"저녁에 방문, 예약 없이 이용, 대기 시간 바로 입장, 데이트, 연인・배우자",인테리어가 멋져요,21,1
1907695191,녹히야,친절하고 맛있어요,2025-03-25,"저녁에 방문, 예약 없이 이용, 대기 시간 바로 입장, 데이트, 연인・배우자",음식이 맛있어요,18,1
1907695191,Haanottz,짱 맛있어요! 가게두 깨끗하고 예버용,2025-03-24,"점심에 방문, 예약 없이 이용, 대기 시간 바로 입장, 데이트, 연인・배우자",음식이 맛있어요,18,1
1907695191,행복감사겸손평안,너무 맛있고 친절하시고 인테리어도 너무 이쁩니다 ! 감사합니다 !!,2025-03-23,"저녁에 방문, 예약 없이 이용, 대기 시간 바로 입장, 데이트, 연인・배우자",음식이 맛있어요,34,1
1907695191,syenii,파히타세트 먹었는데 역시 맛있어요매장도 청결하고 주차도 편해요,2025-03-23,"점심에 방문, 예약 없이 이용, 대기 시간 바로 입장, 데이트, 연인・배우자",음식이 맛있어요,594,1
1907695191,kim****,갓잇 항상 맛있게 먹구있어요~~타코하면 역시 갓잇이 최고👍오늘도 어김없이 맛있네요 ^^잘먹겠습니당💕,2025-03-23,"점심에 방문, 예약 없이 이용, 대기 시간 바로 입장, 데이트, 연인・배우자",음식이 맛있어요,22,1
1907695191,사진올리기51,갓잇은 언제 먹어도 맛있어요! 상봉엔터식스점은 인테리어도 깔끔하고 직원분들도 친절하시네요 👍🏻👍🏻,2025-03-23,"점심에 방문, 예약 없이 이용, 대기 시간 바로 입장, 데이트, 연인・배우자",음식이 맛있어요,148,1
1907695191,이홍준77,메뉴 구성이 알차고 맛있어요~~~ 분위기도 좋고 꼭 방문하세요~!!,2025-03-22,"저녁에 방문, 예약 없이 이용, 대기 시간 바로 입장, 데이트, 연인・배우자",음식이 맛있어요,11,1
1907695191,ahr****,"너무 맛있어용^^* 항상 친절하시고, 맛도 좋고!! 아이도 너무 좋아해요♡.♡",2025-03-22,"점심에 방문, 예약 없이 이용, 대기 시간 바로 입장, 가족모임, 아이",음식이 맛있어요,240,2
1907695191,살사라져라,갓잇이 우리지역에도~~메뉴판에서  갓 튀어 나온듯한 실물 비주얼이 입맛을 돋우네요~평소 먹고 싶었던신선한 소스며 엔칠라다 먹어보기가 쉽지않은데 맛있었어요~또 오고 싶어요~,2025-03-22,"점심에 방문, 예약 없이 이용, 대기 시간 30분 이내, 일상, 아이",음식이 맛있어요,57,1
1907695191,JH3448,맛있고 분위기가 좋네요~,2025-03-21,"점심에 방문, 예약 없이 이용, 대기 시간 바로 입장, 일상, 혼자",음식이 맛있어요,4,1
1907695191,tmx****,벌써 3번째 방문이네요 맛있어요,2025-03-20,"저녁에 방문, 예약 후 이용, 대기 시간 바로 입장, 데이트, 일상, 부모님",음식이 맛있어요,34,3
1907695191,우기1125,처음방문했는데 깨끗하고 친절하세요~세트시켰는데 양도 많고 맛도 있고~  다음에 아이들 데리고 와야겠어요~,2025-03-20,"점심에 방문, 예약 없이 이용, 대기 시간 바로 입장, 일상, 부모님, 친척・형제",음식이 맛있어요,1328,1
1907695191,ey317,자주 방문했디만 리뷰는 처음입니다-!! 타코를 좋아하는데 집근처엔 없어서 아쉬웠는데 생겨서 너무 좋아요-!!! 맛은 말해 뭐하구요~ 친절한 직원분들 덕분에 만족도가 매우 높습니다~,2025-03-19,"점심에 방문, 예약 없이 이용, 대기 시간 바로 입장, 친목, 친구",음식이 맛있어요,12,1
1907695191,스타더스트80,다른 갓잇 지점보다 친절하고 음식이 맛있습니다.,2025-03-18,"저녁에 방문, 예약 없이 이용, 대기 시간 바로 입장, 데이트, 연인・배우자",음식이 맛있어요,16,1
1907695191,또밍잉,남자친구랑 적당히 헤비한 음식이 뭐가 있을까 검색하다가 마침 평소에 가보고 싶었던 갓잇 매장이 있길래 바로 방문하였습니다! 라스트 오더가 얼마 남지 않았음에도 친절히 맞아주셔서 감사했어요ㅠㅜ 음식의 맛은 말할 것도 없이 최고였습니다🤍,2025-03-17,"저녁에 방문, 예약 없이 이용, 대기 시간 바로 입장, 데이트, 연인・배우자",인테리어가 멋져요,72,1
1907695191,힛응,첫 방문인데 너무 친절하시고 무엇보다 진짜 맛있어요!!!!❤️❤️,2025-03-17,"점심에 방문, 예약 없이 이용, 대기 시간 바로 입장, 데이트, 연인・배우자",음식이 맛있어요,142,1
1907695191,zerozii,믿고먹는 갓잇! 동네에 생겨서 좋아요,2025-03-16,"저녁에 방문, 예약 없이 이용, 대기 시간 바로 입장, 데이트, 연인・배우자",음식이 맛있어요,10,1
1907695191,나멋져15,너무 맛있어요~ 가까운데 생겨서 좋아요,2025-03-16,"저녁에 방문, 예약 없이 이용, 대기 시간 바로 입장, 친목, 연인・배우자",음식이 맛있어요,33,1
1907695191,ran****,플레이팅이 예쁘고 맛있어요,2025-03-16,"저녁에 방문, 예약 없이 이용, 대기 시간 바로 입장, 데이트, 연인・배우자",음식이 맛있어요,11,1
1907695191,sev****,너무 맛있습니다!! 매장도 깨끗합니다!,2025-03-16,"점심에 방문, 예약 없이 이용, 대기 시간 바로 입장, 데이트, 친목, 연인・배우자, 친구",음식이 맛있어요,9,1
1907695191,Yun778,멕시코 음식이 먹고싶다면 이 장소를 추천합니다,2025-03-15,"저녁에 방문, 예약 없이 이용, 대기 시간 10분 이내, 친목, 친구",음식이 맛있어요,6,1
1907695191,lee****,파히타 너무 맛있구 재료가 풍족해요오 맛있게 먹었습니다!!,2025-03-15,"저녁에 방문, 예약 없이 이용, 대기 시간 바로 입장, 데이트, 연인・배우자",음식이 맛있어요,16,1
1907695191,seong0506,다양하게 나와서 이것저것 맛보기 좋고매장 분위기도 좋고 맛도 좋아서 데이트하기 좋아요!,2025-03-15,"저녁에 방문, 예약 없이 이용, 대기 시간 바로 입장, 데이트, 연인・배우자",음식이 맛있어요,70,1
1907695191,mer****,친절하게 안내해주시고 아이가 있었지만 3인이라 의자만 붙여주실줄 알았는데 테이블 옮겨주시고 손 닦는 세면대가 매장 안에 있는것도 좋아요 !,2025-03-15,"점심에 방문, 예약 없이 이용, 대기 시간 바로 입장, 데이트, 연인・배우자",인테리어가 멋져요,27,1
1907695191,이바보71,새로 생겨서 그런지 매장이 깨끗하고 음식도 맛있어요!!,2025-03-15,"점심에 방문, 예약 없이 이용, 대기 시간 바로 입장, 가족모임, 부모님",음식이 맛있어요,8,1
1907695191,임씅o,재방문인데 여전히 맛있습니당 짱짱,2025-03-15,"점심에 방문, 예약 없이 이용, 대기 시간 바로 입장, 일상, 친구",인테리어가 멋져요,18,1
1907695191,dhekfl8264,제가 좋아하는 갓잇입니다❤️❤️❤️ 잘먹겠습니다맛있어요~~~❤️❤️❤️❤️❤️❤️,2025-03-15,"점심에 방문, 예약 없이 이용, 대기 시간 바로 입장, 친목, 일상, 친구",음식이 맛있어요,128,2
1907695191,블루밍 제인,아이가 좋아하는 곳!! 타코 맛있고 분위기도 좋아요!!,2025-03-15,"점심에 방문, 예약 없이 이용, 대기 시간 바로 입장, 데이트, 아이",음식이 맛있어요,10,2
1907695191,chl****,맛있어요~,2025-03-15,"점심에 방문, 예약 없이 이용, 대기 시간 바로 입장, 데이트, 연인・배우자",주차하기 편해요,7,1
1907695191,JJ0070,항상 사람 많습니다. 양도 푸짐하고 맛있습니다.,2025-03-14,저녁에 방문,음식이 맛있어요,2140,2
1907695191,hh7hh2,믿고 먹는 갓잇 맛있었어요~!!,2025-03-14,"저녁에 방문, 예약 없이 이용, 대기 시간 바로 입장, 데이트, 연인・배우자",음식이 맛있어요,22,1
1907695191,포뇨29,타코 먹고 싶어 주문 마감 시간 전에 부랴부랴 왔습니다. 타코 맛있어요.,2025-03-14,"저녁에 방문, 예약 없이 이용, 대기 시간 10분 이내, 데이트, 연인・배우자",인테리어가 멋져요,26,1
1907695191,커버스,분위기 내면서도 먹고편하게 먹을수도있네요앞으로도 종종올듯,2025-03-14,"저녁에 방문, 예약 없이 이용, 대기 시간 바로 입장, 데이트, 연인・배우자",음식이 맛있어요,70,1
1907695191,Jiyeonahn,너무맛있어요,2025-03-13,"저녁에 방문, 예약 없이 이용, 대기 시간 바로 입장, 친목, 친구",음식이 맛있어요,24,1
1907695191,영지버섯31,엔식 최고맛집!너무너무 너무너무 너무너무맛잇어용 ㅠㅠㅠㅠ또오고 또오고 또올게용 ㅎㅎㅎㅎㅎ,2025-03-13,"점심에 방문, 예약 없이 이용, 대기 시간 10분 이내, 친목, 친구",단체모임 하기 좋아요,9,2
1907695191,꿩3,,2025-03-13,"점심에 방문, 예약 없이 이용, 대기 시간 바로 입장, 친목, 지인・동료",음식이 맛있어요,10,1
1907695191,IiiiiiIlililllliii,특별한 메뉴가 있어요맛있어요,2025-03-13,"점심에 방문, 예약 없이 이용, 대기 시간 바로 입장, 친목, 친구",음식이 맛있어요,770,1
1907695191,최수지니,와보고싶었던 갓잇! 기대한만큼 맛있고 재료 신선하고 깔끔해서 또 먹고싶어요~~!!!👍🏻👍🏻👍🏻✨,2025-03-12,"저녁에 방문, 예약 없이 이용, 대기 시간 바로 입장, 데이트, 연인・배우자",음식이 맛있어요,11,1
1907695191,Joyjo,"분위기도 좋고, 맛있어요. 근데 양이 좀 적어서 넉넉하게 시키시는 걸 추천해요!",2025-03-12,"점심에 방문, 예약 없이 이용, 대기 시간 바로 입장, 친목, 친구",음식이 맛있어요,8,1
1907695191,csm67,너무 맛있어요 재방문 의사 있습니다,2025-03-11,"저녁에 방문, 예약 없이 이용, 대기 시간 바로 입장, 친목, 친구",음식이 맛있어요,7,1
1907695191,Hye jin young,너무 푸짐하고 맛있어요! 자주 올거 같아요 ~~,2025-03-10,"저녁에 방문, 예약 없이 이용, 대기 시간 바로 입장, 나들이, 친구",음식이 맛있어요,217,1
1907695191,으니으닝51,너무 맛있어요 :) 타코를 정말 좋아하는데 구성도 맛있고 매장도 정말 청결하네요!,2025-03-09,"점심에 방문, 예약 없이 이용, 대기 시간 바로 입장, 데이트, 연인・배우자",음식이 맛있어요,22,1
1907695191,별명90,멕시코 음식은 처음인데 고기 종류도 다양하게 나오고 밥도 같이 나와서 배가 든든하네요.  브리또 말고 다른 사이드로 시켜서 먹었어도 다양하고 풍부하게 먹을 수 있을 것 같아요. 파인에플이랑 야채도 같이 많이 나와서 만족스럽습니다: ),2025-03-09,"점심에 방문, 예약 없이 이용, 대기 시간 바로 입장, 가족모임, 친척・형제",음식이 맛있어요,3,1
1907695191,롬롬4341,맛있고 좋아요!,2025-03-08,"저녁에 방문, 예약 없이 이용, 대기 시간 바로 입장, 데이트",양이 많아요,55,1
1907695191,정인혁62,세트로 시켜드세요! 분위기굳 세팅 굳 맛있었어요~,2025-03-08,"저녁에 방문, 예약 없이 이용, 대기 시간 바로 입장, 가족모임, 부모님",인테리어가 멋져요,9,1
1907695191,fig****,음식고 맛있고 매장은 깨끗하고 직원분들은 친절합니다.,2025-03-08,"저녁에 방문, 예약 없이 이용, 대기 시간 바로 입장, 일상, 아이",음식이 맛있어요,5,2
1907695191,xxelln,주말에 바로입장 할 수 있어서 좋았어요! 너무 맛나요!!,2025-03-08,"점심에 방문, 예약 없이 이용, 대기 시간 바로 입장, 친목, 친구",인테리어가 멋져요,184,1
1907695191,Baam24,상봉갓잇으로 갓잇을 처음알게되었어요!너무 맛있어서 재방문 하였습니다 ❤️인테리어 진짜 예쁘고 맛도 있어요!,2025-03-08,"점심에 방문, 예약 없이 이용, 대기 시간 10분 이내, 친목, 부모님",음식이 맛있어요,1,1
1907695191,김혜령B,갓잇 상봉점 직원분들도 친절하시고 음식도 깔끔하게 나와서 자주 오게되네요~!,2025-03-08,"점심에 방문, 예약 없이 이용, 대기 시간 바로 입장, 일상, 친척・형제",재료가 신선해요,13,1
1907695191,쿠잉쿠잉30,,2025-03-08,"점심에 방문, 예약 없이 이용, 대기 시간 바로 입장, 데이트, 친구",음식이 맛있어요,163,1
1907695191,youngguns78,오랜만의 가족 외식..멀리만 있던곳이 집앞에 생겨서 넘 좋아요,2025-03-08,"점심에 방문, 예약 없이 이용, 대기 시간 바로 입장, 데이트, 연인・배우자",음식이 맛있어요,12,1
1907695191,skyeonkim,너무 재료가 신선하고 맛있어요! 동네 근처에 이런 곳이있어서 좋아요!!👍👍,2025-03-08,"점심에 방문, 예약 없이 이용, 대기 시간 바로 입장, 데이트, 연인・배우자",음식이 맛있어요,20,1
1907695191,snmml,맛있어요! 매장도 쾌적하고 좋습니당,2025-03-08,"점심에 방문, 예약 없이 이용, 대기 시간 바로 입장, 친목, 가족모임, 친척・형제",인테리어가 멋져요,161,1
1907695191,하영956,재료도 신선하고 맛있어요! 직원분들도 친절해서 가족들과 맛있게 식사했습니다~,2025-03-07,"점심에 방문, 예약 없이 이용, 대기 시간 바로 입장, 가족모임, 부모님",단체모임 하기 좋아요,21,1
1907695191,kim****,파히타 세트 2인이서 배부르게 맛있게 먹었어요! 특히 새우타코가 정말 맛있어요🌮🌮,2025-03-06,"저녁에 방문, 예약 없이 이용, 대기 시간 바로 입장, 친목, 친구",음식이 맛있어요,10,1
1907695191,ggj****,,2025-03-06,"점심에 방문, 예약 없이 이용, 대기 시간 바로 입장, 친목",음식이 맛있어요,328,1
1907695191,duswnall,멕시칸 음식 좋아하는데 엔터식스에 생겨서 좋네요~~양도 많고 맛도 좋고 가게 분위기도 좋아요~~,2025-03-05,"점심에 방문, 예약 없이 이용, 대기 시간 바로 입장, 데이트, 친목, 연인・배우자",음식이 맛있어요,47,1
1907695191,jin****,새로 생긴 이후로 와보고 시펏는데 집 앞에 생겨수 너무조아요! 타코는 역시 갓잇이죠>__<♡,2025-03-04,"저녁에 방문, 예약 없이 이용, 대기 시간 바로 입장, 데이트, 연인・배우자",음식이 맛있어요,70,1
1907695191,Hojji 02,"저녁 식사 먹으러 들렀어요! 손 씻는 곳이 있어서 청결한 식사가 가능하고, 음식도 맛있어요! 불닭세트 추천!👍😄",2025-03-03,"저녁에 방문, 예약 없이 이용, 대기 시간 바로 입장, 데이트, 연인・배우자",인테리어가 멋져요,6,1
1907695191,쥬쥬쥬47,역시 믿고 먹는 갓잇 넘 맛있어용~,2025-03-03,"저녁에 방문, 예약 없이 이용, 대기 시간 바로 입장, 가족모임, 부모님",음식이 맛있어요,22,1
1907695191,kim****,부모님 모시고 왔는데 맛있게 잘 먹었습니다.^^3인이서 타코 2인 세트에 보울 시켜서 배부르게 먹었습니다.다음에 또 방문 할게요~,2025-03-03,"저녁에 방문, 예약 없이 이용, 대기 시간 바로 입장, 가족모임, 부모님",음식이 맛있어요,18,1
1907695191,bluetoyjin,깔끔하고 맛있는 곳,2025-03-03,"점심에 방문, 예약 없이 이용, 대기 시간 바로 입장, 친목, 지인・동료",매장이 청결해요,1262,1
1907695191,아메리카노6365,부모님과 함께 방문했습니다! 부모님도 처음 드셔보시는데 맛있다고 좋아하시네요! 직원분도 친절하시구~ 매장도 깔끔해서 좋네요~👍,2025-03-03,"점심에 방문, 예약 없이 이용, 대기 시간 바로 입장, 친목, 부모님",친절해요,22,1
1907695191,맛있는게조하용,분위기도 좋고 직원분이 너므 친절해요~음식도 맛있고 양도 많아용!어머님이랑 같이 방문했는데 좋아허시네요😋,2025-03-03,"점심에 방문, 예약 없이 이용, 대기 시간 바로 입장, 가족모임, 부모님",음식이 맛있어요,474,1
1907695191,우와와우일,너무 맛있어요~,2025-03-03,"아침에 방문, 예약 없이 이용, 대기 시간 30분 이내, 가족모임, 부모님",음식이 맛있어요,143,1
1907695191,Hihello1111,타코 먹고 싶을때마다 오는곳💚분위기 좋고 존맛이여유,2025-03-02,"저녁에 방문, 예약 없이 이용, 대기 시간 바로 입장, 데이트, 연인・배우자",인테리어가 멋져요,30,2
1907695191,ch****,분위기 좋아요. 가족과 방문하기 좋네요.,2025-03-02,"저녁에 방문, 예약 없이 이용, 대기 시간 30분 이내, 가족모임, 부모님",음식이 맛있어요,18,1
1907695191,맛도리탐정코난,타코랑 화이타 정말 맛잇고 세트메뉴 푸짐해서 좋아요. 핫윙도 진찌 맛있어요~!,2025-03-02,"점심에 방문, 예약 없이 이용, 대기 시간 바로 입장, 일상, 연인・배우자, 아이",음식이 맛있어요,99,1
1061053280,아디앙,넘 맛있어요 자주오는곳 입니다^^ 다들 많이오세요~,2025-04-10,"점심에 방문, 예약 없이 이용, 대기 시간 바로 입장, 일상, 친구",음식이 맛있어요,26,7
1061053280,loveday6984,우연히 지나가다 들어와봐는데 아늑하고 혼밥하기 좋네요~음식도 맛있고 친절하시고 또올께요,2025-04-10,"점심에 방문, 예약 없이 이용, 대기 시간 10분 이내, 일상, 부모님",음식이 맛있어요,3,1
1061053280,오두방정이융,리뷰 이벤트 하면 죽도 줘요 짱짱👍🏻 맛있게 잘 먹겠습니당!,2025-04-09,"점심에 방문, 예약 없이 이용, 대기 시간 바로 입장, 친목, 지인・동료",재료가 신선해요,8,1
1061053280,깡구6068,맛있어요 맨날 옴,2025-04-09,"점심에 방문, 예약 없이 이용, 대기 시간 바로 입장, 일상, 지인・동료",음식이 맛있어요,6,4
1061053280,시엘디자인,너무맛잇고 빠르게나와서 빨리즐길수있어서 좋아요,2025-04-09,"점심에 방문, 예약 없이 이용, 대기 시간 바로 입장, 데이트, 연인・배우자",음식이 맛있어요,1,1
1061053280,아디앙,자주오는곳 입니다^^ 맛있어요 너무 좋아요~~,2025-04-08,"저녁에 방문, 예약 없이 이용, 대기 시간 바로 입장, 데이트, 친구",인테리어가 멋져요,26,6
1061053280,bor****,깔끔해서 혼자 밥 먿기 너무 좋어요!!!!! 샤브샤브로 속도 편하게 맛있는 식사했습니다!! 평소 자주 이용하던 온당인데 역시나 맛있고 중랑에 생겨서 너무 좋아요,2025-04-07,"저녁에 방문, 예약 없이 이용, 대기 시간 바로 입장, 일상, 혼자",음식이 맛있어요,39,1
1061053280,gas****,혼자 오기 좋고 너무 맛있습니당자주 오는 곳이에요ㅎ!,2025-04-07,"저녁에 방문, 예약 없이 이용, 대기 시간 바로 입장, 친목, 혼자",음식이 맛있어요,4,3
1061053280,용용먹투어,혼밥하러 오기 좋아용!온누리상품권 사용도 가능해서 더 저렴하게 먹을수 있어요굿,2025-04-07,점심에 방문,혼밥하기 좋아요,174,1
1061053280,ana****,너무맛있어서한번더왔어용,2025-04-07,"점심에 방문, 예약 없이 이용, 대기 시간 바로 입장, 데이트, 친구",음식이 맛있어요,12,2
1061053280,박예나7663,친구들이랑 놀때랑 데이트 할때 저렴하고 양도 생각보다 많아서 자주와요!,2025-04-07,"점심에 방문, 예약 없이 이용, 대기 시간 바로 입장, 데이트, 친목, 나들이, 일상, 기념일, 회식, 가족모임, 비즈니스, 연인・배우자, 친구, 지인・동료, 아이, 부모님, 반려동물, 친척・형제",재료가 신선해요,10,2
1061053280,사람5456,진짜 가까우면 단골 되고싶은 마음이에오 사실 좀 거리있는데도 벌써 여기 온지 4번째 된 거 같네용! 너무 맛있습니다,2025-04-07,"점심에 방문, 예약 없이 이용, 대기 시간 바로 입장, 친목, 친구",음식이 맛있어요,12,1
1061053280,iii23,미나리 샤브를 동네에서 먹을 수 있어서 좋아요혼밥하기도 최고깔끔하고 좋아요,2025-04-06,"저녁에 방문, 예약 없이 이용, 대기 시간 바로 입장, 일상, 아이",음식이 맛있어요,5,1
1061053280,쏠38,혼밥하기에도 딱 좋아요깔끔하고 신선해요:),2025-04-06,"저녁에 방문, 예약 없이 이용, 대기 시간 바로 입장, 가족모임, 부모님",혼밥하기 좋아요,1252,1
1061053280,사또밥32,집 앞에 샤브샤브집이 있어서 가끔 와서 먹는데 올때마다 너무 맛있게 먹고 갑니다다른분들한테도 추천 많이 하는 곳이에요,2025-04-06,"저녁에 방문, 예약 없이 이용, 대기 시간 바로 입장, 데이트, 연인・배우자",음식이 맛있어요,50,1
1061053280,asdf842,깔끔하고 친절하셔서 만족합니다 .혼밥하기도 굉장히 잘되어있어서 혼잡 하러 자주올듯 해요!!,2025-04-06,"점심에 방문, 예약 없이 이용, 대기 시간 바로 입장, 데이트, 연인・배우자",혼밥하기 좋아요,41,1
1061053280,펭귄좋아해요,동생이랑 같이 와서 먹었어요!꽤 양 많은 여자 두 명이었는데 각자 하나만 시켜도 너무 배불러서 추가 없이 맛있게 먹었습니다 :d,2025-04-06,"점심에 방문, 예약 없이 이용, 대기 시간 바로 입장, 데이트, 아이",혼밥하기 좋아요,4,1
1061053280,seo****,야채도 잘 나오고 소스 종류도 많아서 좋았어요!재방문 하고 싶어요,2025-04-06,"점심에 방문, 예약 없이 이용, 대기 시간 바로 입장",음식이 맛있어요,14,1
1061053280,스마티23,매장이 분위기 좋고 육수가 정말 맛있고 좋았어요,2025-04-05,"저녁에 방문, 예약 없이 이용, 대기 시간 바로 입장, 기타",음식이 맛있어요,8,1
1061053280,sua****,먹기 바빠서 다 먹은 사진밖에 없지만... 일단 가격이 좋아요! 샤브샤브 한 그릇에 8900원 너무 좋습니다!! 그리고 매장도 전반적으로 깔끔하고 혼밥이나 친구랑 같이 밥먹기도 좋아요!!,2025-04-05,"점심에 방문, 예약 없이 이용, 대기 시간 바로 입장, 일상, 혼자",음식이 맛있어요,18,1
1061053280,kkt****,일인 팟으로 먹을 수 있어서 다양한 맛 먹기에도 좋고 재료도 신선하네요 잘 먹고 갑니당 총총총...,2025-04-04,"저녁에 방문, 예약 없이 이용, 대기 시간 10분 이내, 가족모임, 아이",음식이 맛있어요,8,1
1061053280,사랑가득15,오랜만에 딸이랑 맛있게 냠냠  좋아요,2025-04-04,"점심에 방문, 예약 없이 이용, 대기 시간 바로 입장, 일상, 가족모임, 아이",음식이 맛있어요,98,1
1061053280,suu****,몇번 째 오는 건지 모르겠는 샤브온당항상 올 때마다 친절하시고 너무 맛있엉… 중독수준…,2025-04-04,"점심에 방문, 예약 없이 이용, 대기 시간 바로 입장, 일상, 혼자",음식이 맛있어요,15,3
1061053280,슈슈팡팡,,2025-04-02,"저녁에 방문, 예약 없이 이용, 대기 시간 바로 입장, 일상, 혼자",음식이 맛있어요,1134,5
1061053280,Karl2979,조용히 혼밥하기 좋고 구성이 알차요!,2025-04-01,"점심에 방문, 예약 없이 이용, 대기 시간 바로 입장, 일상, 혼자",음식이 맛있어요,560,1
1061053280,옥한솔,매주마다 와서 맛있게 먹고 있습니다 양도 혼자 먹기에 충분하고 맛도 훌륭합니다!!,2025-03-31,"저녁에 방문, 예약 없이 이용, 대기 시간 바로 입장, 데이트, 연인・배우자",음식이 맛있어요,8,1
1061053280,치약치약,저렴하고 든든하게 잘먹었습니다!! 혼밥샤브 최고 ^_^,2025-03-31,"점심에 방문, 예약 없이 이용, 대기 시간 바로 입장, 혼자",음식이 맛있어요,23,1
1061053280,suu****,리뷰는 두번 째이지만 벌써 3번 째 방문한 샤브온당 !다이어터에게 이만큼 좋은 곳은 없음 ㅠㅠ 죄책감 안 느낄 수 있는 힐링식당…🍀❤️,2025-03-31,"점심에 방문, 예약 없이 이용, 대기 시간 바로 입장, 일상, 혼자",음식이 맛있어요,15,2
1061053280,tty****,벌써 n회차 방문중인 샤브온당!매일 혼밥 하다가 이번엔 가족과 함께 방문했어요 ㅎㅎ 금액은 저렴해도 배부르게 먹을 수 있어서 자주 방문합니다!!,2025-03-31,"점심에 방문, 예약 없이 이용, 대기 시간 바로 입장, 가족모임, 부모님",음식이 맛있어요,17,4
1061053280,앵1233,혼자 샤브샤브 먹으로 오기 좋아요 깔끔하고 맛있게 잘 먹었습니다,2025-03-31,"점심에 방문, 예약 없이 이용, 대기 시간 바로 입장, 일상, 친구",음식이 맛있어요,14,1
1061053280,쟈히14,,2025-03-31,"점심에 방문, 예약 없이 이용, 대기 시간 바로 입장, 친목, 지인・동료",음식이 맛있어요,4,1
1061053280,wjs****,혼밥하기 넘 좋아요. 재료도 신선하고.가끔 샤브먹고싶을때마다 와요!,2025-03-30,"저녁에 방문, 예약 없이 이용, 대기 시간 바로 입장, 혼자",음식이 맛있어요,26,1
