place_id,nickname,content,date,situations,keywords,review_count,visit_count
1318516979,아나이아,해방촌 맛집이네요🙌콘 옥수수 파스타와 뿔명이 파스타 맛있습니다콘 옥수수 파스타는 달지만 위에 있는 근대랑 먹으면 맛이 딱 맞아요뿔명이 파스타는 까르보나라 느낌인데 전혀 느끼하지 않습니다돼지갈비도 너무 맛있어요수육 느낌으로 로제같은 색을 가지고 있는 대파샐러드 같이 먹으면 김치 필요없어요에피타이저 마저 맛있었습니다👍너무 행복했던 시간이었어요🥰,2024-04-16,"저녁에 방문, 예약 후 이용, 대기 시간 바로 입장, 친목, 친구",인테리어가 멋져요,203,1
1318516979,tfgd0708,웰춈디쉬부터 우선 입맛을 사로잡알달까요 ㅠㅠㅠ 그다음 줄줄이 나오는 옥수수파스타 돼지갈비 진짜 특별한 맛이였지만 정말 맛있게 먹었어요 또 가고 싶어요,2024-04-14,"저녁에 방문, 예약 후 이용, 대기 시간 바로 입장, 친목, 친구",친절해요,20,1
1318516979,봉봉이이이이,"해방촌, 맛집핫플 해방촌에 예약이 가능한 식당이라니 편하고 좋잖아요? 공간도 너무 예쁘고, 음식도 타 식당들과는 차별화 된 특색 있는 음식들이라 더 좋았어요 :-)방문 당시 임신 중이라 와인/맥주 한 모금이라도 같이 곁들이지 못한게 아쉽네요-!",2024-04-13,"저녁에 방문, 예약 후 이용, 대기 시간 바로 입장, 데이트, 연인・배우자",음식이 맛있어요,676,1
1318516979,sommm,"간만에 녹사평 근처에 놀러가서 만나게 된 춈, 인테리어부터 음식까지 보기에 좋은 음식과 함께했어요!1인 1음료 필수인 건 아쉽지만 메뉴가 특별하고 분위가가 좋습니다! 직원분들도 친절하셔서 좋아요",2024-04-07,"점심에 방문, 예약 후 이용, 대기 시간 바로 입장, 나들이, 친구",음식이 맛있어요,80,1
1318516979,권별,너무맛있어요!,2024-04-06,"저녁에 방문, 예약 없이 이용, 대기 시간 바로 입장, 일상, 친구",음식이 맛있어요,1259,1
1268532109,bumkham,디저트 완전 맛있었음감바스 멫 튀김도,2025-03-15,"저녁에 방문, 예약 후 이용, 대기 시간 바로 입장",대화하기 좋아요,1208,1
1268532109,욤욤 욤,실내가 너무 추워서 식사하는데 춥고 불편했어요,2025-02-22,"점심에 방문, 예약 후 이용, 대기 시간 바로 입장, 데이트, 연인・배우자",친절해요,4,1
1268532109,sully,리뉴얼하기 전에 방문하고 재방문인데요여전히 좋았어요여전히 재방문 하고 싶어요,2024-12-14,"저녁에 방문, 예약 후 이용, 대기 시간 바로 입장, 친목, 친구",음식이 맛있어요,86,1
1268532109,vincando,정말 맛있는 곳이에요. 예약도 되고 모든 메뉴가 훌륭합니다. 저만 알고 싶은 레스토랑이에요. 정말 맛있어요.,2024-12-06,"저녁에 방문, 예약 후 이용, 대기 시간 바로 입장, 가족모임, 부모님",인테리어가 멋져요,22,1
1268532109,두교,기대보단 훨씬 아쉬웠다. 음식에 대해 잘 아는 사람이 아니라 맛을 제대로 못 본 걸지도. 사장님과 요리사분께서 웃으시며 식사는 잘 하셨냐 여쭤보시는데 나도 모르게 너무 맛있게 잘 먹었다고 거짓말 했다. 음식보다도 친절하고 기분 좋은 웃음이 기억에 더 남는다.,2024-10-19,"저녁에 방문, 예약 후 이용, 대기 시간 10분 이내, 데이트, 연인・배우자",음식이 맛있어요,20,1
1268532109,야하요호,저녁먹으러 여기저기 해매다 찾은곳!분위기가 좋고 직원들도 친절했듬무조건 와인 글라스로 1잔 시켜야 식사가능저녁이라 와인바로 돌려서 그런거같기도..?무조건 한잔은 시켜야 한다해서 오늘의 와인?으로 레드와인 화이트와인각각 한잔씩 마셔봄!!개인적으로 오늘은 화이트와인이 👍다만 너무 음식이 늦게나왔서 아쉬움..맛있는데 흐름이 끊기는게 정말 아쉬웠달까..돈이 안아까울정도로 맛있었지만단점을 굳이 꼽아보자면 오래 기다려야 한다는거…!,2024-10-13,"저녁에 방문, 예약 없이 이용, 대기 시간 바로 입장, 일상, 친척・형제",음식이 맛있어요,67,1
1268532109,ij66,외국에 온 것 같은 인테리어에 음식도 맛있어서 항상 갈 때마다 기분이 좋아요!,2024-09-21,"저녁에 방문, 예약 후 이용, 대기 시간 바로 입장, 일상, 친척・형제",인테리어가 멋져요,66,2
1268532109,tnwk1101,음식 먹고있는데 마감청소 하는데 처음봤습니다. 특히 와인바는 서비스가 정말 중요하다고 생각하는데 장사 잘 돼서 그런거 신경 안쓰나봅니다. 마감 안내도 하지 않아놓고 옆에서 청소하는데 너무 황당한 경험이었고 본인들이 실수로 안내 안해놓고 제대로 사과도 못받았습니다. 직원 여러명 있었는데 정말 하나같이 다들 일하기 싫어 죽겠는 사람들처럼 보였고 사장님 또한 이 사실을 알고 계시는듯 하였으나 모르는척 하는게 신기했습니다. 20만원 내고 괜히 기분나쁜 경험 하고 왔네요; 여러개 시켰는데 다른건 너무 평범하여 딱히 할말이 없고 우니파스타인지 김파스타인지 구분이 안되는 우니맛이 1도 안느껴지는 정체불명의 이 파스타...이 가격으로 한남동만 가도 생면으로 즐길 수 있습니다,2024-09-21,"저녁에 방문, 예약 후 이용, 대기 시간 바로 입장, 친목, 친구",,9,1
1268532109,AN6072,생일때 방문했는제 친절하시고 진짜 맛있었어용ㅎㅎㅎㅎ,2024-08-02,"저녁에 방문, 예약 후 이용, 대기 시간 바로 입장, 기념일, 친구",친절해요,10,1
1268532109,yyoonni,비가 엄청 온 날이었지만 예쁜 식당 안에서 맛있는 음식들을 먹으니 기분이 아주 좋았습니다!남자친구랑 갔던건데 다음번에는 친구들도 데려와야겠어요ㅎㅎ김에 싸먹는 우니크림파스타랑 트러플부르스케타 왕추천이욤~!,2024-07-27,"저녁에 방문, 예약 후 이용, 대기 시간 바로 입장, 데이트, 연인・배우자",인테리어가 멋져요,41,1
1268532109,키카소,너무 맛있었습니다 분위기도 좋구요,2024-07-27,"저녁에 방문, 예약 후 이용, 대기 시간 바로 입장, 친목, 친구",음식이 맛있어요,20,1
1268532109,tgc01031,제 입맛엔 너무 별로라 후기 남깁니다ㅠ 감바스는 향이 너무 세고 맛이 없어서 거의 다 남겼구요…그나마 스튜는 좀 괜찮았는데 자극적이기만 하고 무슨 맛인지 몰라서 남겼습니다ㅠ 두번은 절대 방문 안할 것 같아요…전체적으로 맛으로 가는건 아닌 것 같고 비 안오는 날 야외에서 먹는 분위기로는 갈 순 있겠네요ㅠ,2024-07-27,"저녁에 방문, 예약 후 이용, 대기 시간 바로 입장, 친목, 친구",,33,1
1268532109,만만이2091,별관 안내해주셨는데 비가 많이 오는 날인데도 문을 활짝 열어두셔서 냉방이 잘 안될 뿐 더러 에어컨에서 저희 식탁으로 물이 뚝뚝 떨어지더라구요.. 그리고 직원분이 별관에 계속 계신게 아니라서 응대도 즉각적으로 안됐습니다.,2024-07-27,"저녁에 방문, 예약 후 이용, 대기 시간 바로 입장, 여행, 친구",음식이 맛있어요,16,1
1268532109,mauvey,예약했는데 바로 입장 못했다. 전 테이블이 딱 정시에 나가더리고요. 원래 식당은 50분까지 하고 10분동안 테이블 정리하는데…. 그 점빼고 미역우니 파스타 그것만 바라보고 다시 방문했어요. 빵도 맛있고 분위기가 좋아서 와인 한잔 마시고 조용히 수다 떨기 좋다.,2024-07-26,"저녁에 방문, 예약 후 이용, 대기 시간 10분 이내, 친목, 친구",음식이 맛있어요,8,1
1268532109,솔1851,모든 음식이 너무 맛있었어요!! 또 방문하고 싶어요~~!!,2024-07-14,"점심에 방문, 예약 후 이용, 대기 시간 바로 입장, 친목, 친구",친절해요,23,1
1268532109,청주에서서울로올라온양반,음식은 대체로 맛있었어요 우니파스타는 정말 비린맛이 하나도 안나고 감칠맛으로 정말맛있었습니다. 김에 싸먹는거 까지 아주 좋았어요 근데 갑오징어는 생각보다 별다른맛이 없었습니다. 특색은 없고 불향나는 정도 ㅎㅎ 그리고 메뉴가 많이 빠져서 그런지  레드와인에 먹을만한 메뉴가 없었던거 같아 아쉬웠습니다. 그래도 분위기 좋고 대화하기 좋고 화장실도 청결하고 잘 놀다 갑니다. 감사합니다,2024-06-29,"저녁에 방문, 예약 후 이용, 대기 시간 바로 입장, 데이트, 연인・배우자",음식이 맛있어요,1215,1
1268532109,핑퐁667,다 좋았으나....매생이가 들어간 파스타가 생각보다 어려운음식이였습니다. 제가 평소 먹어왔던 음식보다 매생이가 더 아낌없이 들어가있었습니다.. 개인적으론  매생이 맛이 너무 강해서 먹기 힘들었네요.  메뉴옆에  설명이 좀더 추가되면 좋을거같아요! ..,2024-06-23,"저녁에 방문, 예약 후 이용, 대기 시간 바로 입장",매장이 청결해요,38,1
1268532109,haerang,갈때마다 만족하고 오는곳이에요! 와인이 맛잇는게 많고 추천도 세심하게 잘해주셔서 술 즐기는 사람들에게는 최고인 것 같아여! 이번에 추천해주신 와인도 너무 맛잇게 먹었어여 ㅎㅎ,2024-06-15,"저녁에 방문, 예약 후 이용, 대기 시간 바로 입장, 데이트, 연인・배우자",친절해요,32,5
1268532109,Uou7,맛있어요:) 남자친구랑 오고싶네여..,2024-06-15,"저녁에 방문, 예약 후 이용, 대기 시간 바로 입장, 친목, 친구",음식이 맛있어요,53,1
1268532109,건방진오리,짭짤함.  바삭함.  버터의고소함 풍미 좋고 과하지 않고 잘 어울려 맛있어요,2024-06-08,"저녁에 방문, 예약 없이 이용, 대기 시간 바로 입장",음식이 맛있어요,2253,1
1268532109,옹람이,이런곳 좋아요 다섯개선택으론 부족해요!너무맛있고 친절하고 기념일이라 콜키지했는데 메뉴추천도 잘해주셨어요인테리어도 너무예쁘고 노래도좋고 위치도좋고암튼 너무너무만족스러웠어요!!다음엔 와인추천도같이받아볼게요!덕분에 행복한저녁이였습니댜,2024-05-25,"저녁에 방문, 예약 후 이용, 대기 시간 바로 입장, 기념일, 연인・배우자",음식이 맛있어요,47,1
1268532109,오리털이불좋아,"해방촌 언덕에 위치한 식당.접근성이 좀 아쉽지만 녹사평 역에서 내려 언덕을 따라 걸어올라가며 이국적인 거리를 걷는 느낌을 받아 멀게 느껴지진 않았다. 합리적인 가격의 음식과 다양한 와인, 훌륭한 인테리어와 친절한 직원분들 덕분에 기분 좋게 식사할 수 있었다.",2024-05-24,"저녁에 방문, 예약 후 이용, 대기 시간 바로 입장, 데이트, 연인・배우자",친절해요,113,1
1268532109,유나츄,메뉴는 전체적으로 맛있었습니다!그런데 테라스가 인스타에 나오는 사진이랑 같진않았어요ㅠㅠ창문 색도 바뀌고 차가 너무 가깝게 지나다녀서 불편했습니다.실내 창가자리가 더 좋은것같아요~,2024-04-21,"점심에 방문, 예약 후 이용, 대기 시간 바로 입장, 기념일, 친구",,26,1
1268532109,향찌투어,"오리 3번째 방문이에요! 음식들도 하나같이 다 맛있고, 직원분들이 너무 친절하셔서 항상 기분 좋게 이용하고있습니다.😋😋🤍",2024-04-06,"저녁에 방문, 예약 후 이용, 대기 시간 바로 입장, 친목, 친구",음식이 맛있어요,55,1
1268532109,onnand,"우니파스타 진심 개 맛도리구요.. 트러플 감자튀김도 존맛... 같이주시는 김도 맛잇고,, 굳굳",2024-03-23,"저녁에 방문, 예약 후 이용, 대기 시간 바로 입장, 친목, 친구",음식이 맛있어요,307,1
1268532109,돔더미,인스타 리뷰보고 방문했는데 친절하시고 와인 페어링도 너무 잘해주셔서 맛있게 먹고 좋은 시간 보내다가 갑니다 여름에 테라스 즐겨보고 싶네용,2024-03-17,"저녁에 방문, 예약 후 이용, 대기 시간 바로 입장, 나들이, 친구",음식이 맛있어요,2,1
1268532109,강서구맛집순이,왕 친절 하시고 구석쪽에 앉았는데 김 떨어졌는지 뭐 필요한거 없는지 자주 체크하러 와주셔서 너무 고맙고 즐거운 저녁 시간 보낸 것 같습니당!!나중에 날씨 좋아지면 데이뚜 하러 오려고요!🫶🏻,2024-02-18,"저녁에 방문, 예약 후 이용, 대기 시간 바로 입장, 친목, 친구",기본 안주가 좋아요,205,1
1268532109,Memymemy,Ori 재방문 하고 싶은 맛집이였어요. 따봉 두개 👍🏻👍🏻,2024-02-17,"저녁에 방문, 예약 후 이용, 대기 시간 바로 입장, 친목",음식이 맛있어요,67,1
1268532109,옹혜,분위기도 좋고 음악도 좋고 와인도 음식도 맛있었던 오리! 예약 후 방문하는 걸 추천 드려요! ✿(′ᵕ′*) 직원 분들도 친절하셨고 분위기도 좋아서 머무르는데 정말 만족스러웠어요! 우니파스타랑 토마토 스튜 (에그인헬) 주문했는데 둘 다 맛있었지만 토마토 스튜가 뜻밖의 존맛탱 ಇ 완전 추천드려요! 데이트하기에도 친구들끼리 소모임 하러 오기에도 좋아요! 완전 추천 ಇ 다음에 또 방문할게요!,2024-02-03,"점심에 방문, 예약 후 이용, 대기 시간 바로 입장, 친목, 친구, 친척・형제",음식이 맛있어요,676,1
1268532109,jyeon0615,"안뇽하세요~! 2/2일에 방문했어요 :) 지나가다 봐서 한번쯤 방문하고 싶었는데 음식 맛, 분위기, 친절함에 너무 흡족한 신년모임이 되었습니다~! 앞으로 여러번 방문하고 싶어요!!우니크림파스타는 처음먹어보는데 너무 맛있어서 또먹고싶고 김에 싸먹는게 독특햇는데 잘어울려서 왜 같이 추천하셧는지 알겠더라구요!! 목살스테이크도 촉촉하고 소스랑 잘 어울려서 좋았구 뇨끼는 같이 방문한 언니가 먹어본 뇨끼중 식감이 최고라고 극찬했습니닷🫶💕그리고 계속 부족한거없는지 신경써주셔서 편하게 식사하구왓어요 또 방문하겠습니당❤️",2024-02-02,"저녁에 방문, 예약 후 이용, 대기 시간 바로 입장, 친목, 회식, 지인・동료",음식이 맛있어요,23,1
1268532109,현진0202,유럽 어딘가로 여행 온 것 같았던 곳이에요! ㅎㅎㅎ 맛없는 메뉴가 하나도 없었고 특히 트러플이랑 치즈 들어간 부르스케타를 왕 추천 드립니다 ㅎㅎㅎ 🫶 와인 바틀로 주문해도 합리적인 가격대인데 맛도 좋았어요. 그렇지만 한 달 가까이 지나도 기억나는 것은 코지한 분위기랑 친절함의 끝이었던 직원분의 센스..✨ 접근성이 훌륭하진 않지만 그만한 가치가 있으니 추천드립니다~!,2024-02-01,"저녁에 방문, 예약 후 이용, 대기 시간 바로 입장, 데이트, 기념일, 회식, 친구",음식이 맛있어요,42,1
1268532109,뿡뿡염뿡,우니크림파스타랑 순대 먹었는데 맛있었어요. 파스타는 또 먹으러 가고 싶네요! 페어링 한 와인과 아주 잘 어울렸습니다. 연말에 가면 더 좋을 거 같아요 ㅎㅎ 친절하셔서 너무 좋았고 깔끔합니다!! 또 갈거예요 ㅎㅎ,2024-01-17,"저녁에 방문, 예약 후 이용, 대기 시간 바로 입장, 친목, 친구",차분한 분위기에요,22,1
1268532109,자유썬,"새로 나온 메뉴도 맛있고, 특히 트러플치즈크림부르스케타 크림이 너무 맛있습니다! 5명이라 별관opato로 예약했는데 분위기 좋고 음식들도 맛있다고 처음 같이 간 친구들도 다 만족했어요, 서비스로 챙겨주신 소금빵도 맛있었구요, 갈때마다 친절하게 대해주셔서 감사합니다, 새해 복 많이 받으세요!",2024-01-07,"저녁에 방문, 예약 후 이용, 대기 시간 바로 입장, 친목, 일상, 친구",음식이 맛있어요,63,8
1268532109,GreatGerms,,2024-01-06,"저녁에 방문, 예약 후 이용, 대기 시간 바로 입장, 데이트, 연인・배우자",음식이 맛있어요,8,1
1268532109,2U71,작년에 먹고 너무 맛있어서 놀랐던 우니 파스타를 올해 다시 먹으러 갔는데 여전히 너무 맛있었어요! 추천해주신 화이트와인도 싱그러운 향이 음식과 넘 잘 어울렸네요. ㅎㅎ,2024-01-04,"저녁에 방문, 예약 후 이용, 대기 시간 바로 입장, 데이트, 연인・배우자",음식이 맛있어요,15,2
1268532109,hye****,숯불에 구운 목살이랑 오징어 튀김 주문했어요. 와인바라서 1인 1 주류 필수이니 참고하세용. 음식 너무 맛있고 별관이라 사람이 많이 않아서 좋았어요! 연말이라 그런지 음식 이 좀 늦게 나왔지만🥲 다음에는 또 방문하고 싶은 곳 입니다.,2023-12-31,"저녁에 방문, 예약 후 이용, 대기 시간 바로 입장, 일상, 친구",음식이 맛있어요,19,1
1268532109,보구미99,지난 번에 너무 맛있게 먹었던 기억이 있어서 재방문했습니다~ 오징어순대랑 우니파스타 강추합니다 와인 안주로 딱이에요! 그리고 솔직히 부르스케타는 가성비가 안 좋은 것 같습니다ㅠ 가격에 비해 양이 너무 적어요ㅜ,2023-12-31,"점심에 방문, 예약 후 이용, 대기 시간 바로 입장, 친목, 친구",음식이 맛있어요,31,1
1268532109,루피0424,오픈과 동시에 방문했는데음식 하나 나오는데 40분 걸림...ㅎ양은 적고 음식은 맛있어요인당 1인 1주류 무조건 해야함,2023-12-30,"점심에 방문, 예약 후 이용, 대기 시간 바로 입장, 일상, 지인・동료",음식이 맛있어요,118,1
1268532109,padobabo,양이 정말 너무너무너무 적어서 놀랐어요 여자 셋이 적당히 먹었는데 12 나옴,2023-12-29,"저녁에 방문, 예약 후 이용, 대기 시간 바로 입장, 친목, 친구",음식이 맛있어요,850,1
1268532109,Sungachu,"크리스마스 때 방문하고 싶어서 와인페어링 추가해서 이용했어요. 오두막집 분위기 최고에요..🫶🏻 코스요리인데두 한 접시마다 양이 많아서 남자친구랑 배터지게 먹었구요, 와인 페어링하길 너무 잘했다 싶었어요! 아 글구 외부음식 반입도 돼서 케이크도 먹었어요 접시까지 챙겨주시고..🤍 날 따뜻해지면 꼭 테라스로 다시 오고 싶어요!",2023-12-24,"저녁에 방문, 예약 후 이용, 대기 시간 바로 입장, 데이트, 연인・배우자",음식이 맛있어요,79,2
1268532109,sujin kate,음식이 매우 맛있어요 ! 뇨끼가 기억에 남습니다. 마지막에 브레드푸딩 디저트도 주문하시길 추천드립니당 ~,2023-12-14,"저녁에 방문, 예약 후 이용, 대기 시간 바로 입장, 친구",인테리어가 멋져요,16,1
1268532109,자유썬,"야채가게였을때부터 우니파스타가 맛있고 분위기가 좋아서 꾸준히 가는곳이에요, 타르타르도 신메뉴로 나왔길래 시켜봤는데 맛있었어요ㅎ 항상 친절하게 응대해주시고 우니파스타는 다른곳에서 맛보기 힘든맛이여서 스테디셀러메뉴로 남아있기를 바랍니다.",2023-12-08,"저녁에 방문, 예약 후 이용, 대기 시간 바로 입장, 친목, 친구",음식이 맛있어요,63,6
1268532109,로토맘70,"안주도 맛있지만, 추천해주시는 와인도 다 좋았어요. 그중에서도 제일은 서빙해 주시는 매니저님의 친절이죠.~",2023-11-30,"저녁에 방문, 예약 후 이용, 대기 시간 바로 입장, 가족모임, 연인・배우자",음식이 맛있어요,10,2
1268532109,숨어있는아이,앤틱한 느낌의 인테리어와 맛있는 음식 그리고 친절한 직원들이 있는 멋진 가게입니다.,2023-11-26,"저녁에 방문, 예약 후 이용, 대기 시간 바로 입장, 데이트, 연인・배우자",음식이 맛있어요,54,1
1268532109,bla****,오파토는 자주 방문했지만 오리는 처음인데 모든 메뉴 다 먹어보고 싶을 정도로 시키는 것마다 맛있고 어울리는 와인도 친절하게 추천해주셔서 주문한 것 모두 만족스러웠어요! 디저트까지 흠 잡을 데 없이 맛있어서 친구들과 너무 좋은 시간 보내고 왔습니다💗,2023-11-23,저녁에 방문,인테리어가 멋져요,28,1
1268532109,스므77,인테리어도 맛도 직원분들 친절함도 정말 모두 만족하는 곳입니다. 생일 식사로 방문했는데 친절한 직원분들의 응대와 맛있는 음식 덕에 좋은 기억이 가득한 생일이 되었어요. 와인 설명이나 음식 설명도 너무 친절하게 잘 해주셔서 기분 좋게 식사를 할 수 있었습니다. 다음 번에 또 방문하고싶은 곳이에요. 해방촌 데이트 고민이신 분들은 꼭 !! 방문해보셨으면 좋겠습니다♥,2023-10-27,저녁에 방문,인테리어가 멋져요,129,1
1268532109,캐리3755,음식분위기 서비스 모두 최고💜💜💜,2023-10-27,저녁에 방문,친절해요,35,1
1268532109,jen****,분위기도 좋구 음식도 맛있어서 또 오고싶은 곳이에여❤️,2023-10-21,점심에 방문,음식이 맛있어요,34,1
1268532109,욱히히히히,좋앙요 맛싯ㅅ어요 ㅎㅎ,2023-10-14,"저녁에 방문, 예약 후 이용, 대기 시간 바로 입장, 친목, 지인・동료",인테리어가 멋져요,131,1
1268532109,Shine8222,너무 좋았어요!!!!!! 가을에 가기 참 좋은 곳이고 와인 추천도 좋았고 음식도 유명한 우니크림파스타+ 당일 추천해주신 목살 요리 먹었는데 싹 맛있었어요 또 갈 것 같아요 🩷,2023-10-11,저녁에 방문,친절해요,16,1
1268532109,koo0xxna,맛있는 음식들과 매장분위기 덕분에 남자친구 생일을 행복하게 잘 보냈습니다! 직원분들도 굉장히 친절하시고 잘 챙겨주셔서 더욱 행복했던것같아요~☺️  와인을 잘 몰라도 주문한 음식과 잘 매칭되는 와인을 추천해주셔서 편하고 즐거웠습니다! 다른 기념일에도 또 가고싶을정도로 재방문의사와 믿고 추천해도 되는 매장이었어요~~ 사장님 추석 연휴 잘 보내시고 오래도록 운영해주세요~!!ㅎㅎㅎ감사합니다,2023-09-21,저녁에 방문,인테리어가 멋져요,19,1
1268532109,구름같은양,굿,2023-09-10,밤에 방문,음식이 맛있어요,274,1
1268532109,오 선물,ㆍ,2023-09-10,저녁에 방문,인테리어가 멋져요,891,1
1268532109,현준5045,"원래 안좋은 리뷰는 안쓰기도하고, 웬만큼 별로여도 신경 잘 안쓰는 편인데 여기선 밥먹는내내 기분 너무 안좋았습니다 테라스자리 예약했는데 예약시간 맞춰 가니 실수로 다른 분들을 테라스에 앉혔다고 실내로 안내해주시고 이부분은 테라스 비었을때 옮겨주셔서 괜찮았지만 이미 식사가 끝난 이후였고, 식사하는 내내 사소한 요구사항을 절대 한번에 요청을 들어주시는 법이 없더라구요 크게 바쁘거나 정신없어 보이지도 않는데 무슨 유럽 식당에서 인종차별 당하는 기분이었습니다 물달라고 자리에서 세번 말씀드려도 안갖다주시고 결국 네번째에 직접 카운터까지 가서 말씀드리고, 테이블에서 아무리 불러도 눈마주치고서도 응대 안해주시고 그냥 모든 요구사항을 세네번정도는 말씀드려야 겨우겨우 들어주시니 참 당황했습니다 다시는 안갈 것 같아요",2023-09-08,밤에 방문,화장실이 깨끗해요,23,1
1268532109,꽁꽁삼,분위기도 너무좋고 뇨끼 파스타 스테이크 또르띠야 트러플감튀!!!ㅎㅎㅎ 다 맛있어요🖤 저희 스테이크가 조금 늦게 나왔는데 서비스도 챙겨주셨답니다 ㅎㅎ 또 가고싶은 곳😎,2023-08-25,저녁에 방문,음식이 맛있어요,10,1
1268532109,pingoooo71,"언제 가도 좋은 곳,, 항상 여기서 생일도 보내고 특별한 날 무조건 찾는 곳, 음식맛 최고 서비스 최고 정말 좋아요!",2023-08-25,저녁에 방문,단체모임 하기 좋아요,20,3
1268532109,Hyeng23,내추럴 와인맛집!! 취향에 맞게 추천해주시는 와인마다 정말 맛있었어요 와인이랑 어울리는 음식들도 다 맛있구 분위기도 좋아요,2023-08-12,점심에 방문,뷰가 좋아요,18,2
1268532109,rqfds,"Ori 때문에 서울 여행 일정 요일을 변경할 정도로 큰 기대를 하고 왔던 곳인데, 가기 전에 메뉴를 본다고 평점을 보니 생각보다 좋지않은 평들이 많았지만 개의치 않고 방문하였습니다. 하지만 실제로 방문이 종료된 후 그곳에서의 평가들이 왜그렇게 될 수 밖에 없었는지 120% 납득이 갔고, 생각보다 큰 실망을 한 저는 다른분 후기처럼 다시 방문할 의사가 있냐는 스스로의 질문에는 글쎄요…토마토 베이스의 빵처럼 느껴지는 뇨끼의 식감, 김을 싸먹지 않으면 너무 달고 짜게만 느껴지는 우니 파스타, 무슨 맛을 표현하고자 했는지 잘 모르겠는 오징어 순대까지 ㅠ.. 개인적으로 정말 아쉬웠습니다. 장점이 있다면 다른 곳에서는 맛 볼수 없는 오리만의 시그니처 안주들이 많지만, 그 안주들을 맛보러갈만큼의 특별한 가치가 없네요.",2023-08-09,저녁에 방문,인테리어가 멋져요,8,1
