place_id,nickname,content,date,situations,keywords,review_count,visit_count
1110133208,밀크티걸,"주문 메뉴: 에그 베네딕트 연어, 오믈렛접근성은 떨어지지만 브런치 하기 완벽한 오아시스 한남점☺️사람에 따라 양은 약간 적을 수도 있겠지만 메뉴 모두 무난히 맛있었습니다!",2024-07-30,"점심에 방문, 예약 없이 이용, 대기 시간 바로 입장, 나들이, 친구",음식이 맛있어요,202,1
1110133208,kwj****,음식은 뭐 이가격에 이정도면 그냥 soso 인거같고요 직원들이 쫌 불친절해서 밥맛이 떨어지네요. 특히 키큰분 별로 안친절하네요. 청담 오아시스는 친절했던거같은데. 일하기 싫으신듯. 암튼 음식은 뭐 그냥 저냥 먹을만합니다. 분위기는 뭐 한남동 카페 느낌.,2024-07-29,"점심에 방문, 예약 없이 이용, 대기 시간 바로 입장, 데이트, 연인・배우자",아늑해요,2,1
1110133208,스누피6637,좋아요,2024-07-28,아침에 방문,음식이 맛있어요,753,1
1110133208,꼼꼼히96,좋아요,2024-07-26,점심에 방문,인테리어가 멋져요,418,1
1110133208,객관적인 평가,한남동이라는거 감안하지만 .. 너무 비싸고 양이 적어요 .. 파스타랑 아보카도치킨샌드위치 맛있었어요 여럿이서 오면 에그베네틱트보다 샌드위치 여러개 시키는게 나을것같아요셋이서 음료까지시키면 77000원 선넘지...,2024-07-23,"점심에 방문, 예약 없이 이용, 대기 시간 10분 이내, 일상, 부모님",매장이 넓어요,1482,2
1110133208,하낫츠,"역에서 미리 캐치테이블로 웨이팅 걸어놓고 갔더니 딱 맞게 입장했어요! 일단 리뷰에 다들 타이 누들 샐러드(치킨)을 시키라고 해서 누들 샐러드랑 바나나호두 팬케잌, 고르곤졸라치즈 무화과 샌드위치 시켰어요. 메뉴들이 다 너무너무 맛있어요!!❤️타이누들샐러드❤️는 왜 다들 시키라고 했는지 한입 드시면 알거예요. 여름에 먹기 딱 좋은 새콤한 샐러드! 그리고 ❤️치즈무화과 샌드위치❤️가 저는 너무 맛있었어요. 아직도 생각나는 맛이예요!! 이태원에서 브런치가게 고민중이라면 강추합니다!",2024-07-23,"점심에 방문, 예약 없이 이용, 대기 시간 10분 이내, 일상, 친구",매장이 넓어요,205,1
1110133208,인앵,가게가 울리는 구조로 되어있어서(?) 조금만 크게 얘기해도 쫓겨납니다목소리 작고 정말 “브런치”처럼 빠른 식사 가능하신분들만 방문하시길 추천드립니다👍👍,2024-07-23,"점심에 방문, 예약 없이 이용, 대기 시간 바로 입장, 친목, 친구",,45,1
1110133208,아가또치,"토요일 낮 2시쯤 도착예정이었어서 시간 맞춰 미리 캐치테이블로 웨이팅 걸어두고 방문했어요 ! 안내받기까지 대략 40분정도 걸렸는데 도착한 후로는 10분정도 대기했던 것 같습니다 ㅎ-ㅎ전에 한 번 먹으러 왔을 때 맛있었던 기억이 있어서 동생이랑 재방문했고, 동생도 맛있게 먹어줘서 뿌듯했어요 🤭에그스크럼블 진챠 맛있구 토스트나 팬케이크 다 어쩜 그렇게 부드럽던지 다들 입에서 살살 녹더라구요 !! 한남동 브런치는 오아시스 추천합니다 ~ 🩵",2024-07-14,"점심에 방문, 예약 후 이용, 대기 시간 10분 이내, 일상, 친척・형제",인테리어가 멋져요,54,1
1110133208,포포z,구미에서 서울 한남동 처음 놀러왔어요!!브런치 먹고 싶어서 검색해서 들린곳인데 같이 방문한 동생도 만족스러워했던 곳입니다맛도 분위기도 좋고 외관이 특히 이뻤답니당,2024-07-13,"점심에 방문, 예약 후 이용, 대기 시간 30분 이상, 여행, 일상, 친구",음식이 맛있어요,67,1
1110133208,루모스맥시마,점심시간 조금 지나서 갔는데도 웨이팅했네요ㅎㅎ 가격은 많이 비싼편이지만😂 그래도 맛있게 먹었습니다! 양도 다른 브런치집들에 비하면 괜찮은편인 것 같아요 맛있어서 재방문의사 있어요!!,2024-07-12,"점심에 방문, 예약 없이 이용, 대기 시간 30분 이내, 일상, 지인・동료",인테리어가 멋져요,613,1
1110133208,yoo****,대기 미쳤어요ㅠㅠㅠㅠㅠ맛있어요,2024-06-23,"점심에 방문, 예약 없이 이용, 대기 시간 1시간 이상, 데이트, 연인・배우자",특별한 메뉴가 있어요,346,1
1110133208,정님8471,,2024-06-22,점심에 방문,재료가 신선해요,698,1
1110133208,으뎡,,2024-06-21,"점심에 방문, 예약 없이 이용, 대기 시간 10분 이내, 일상, 지인・동료",음식이 맛있어요,764,1
1110133208,sseorriii0305,예전에 갔을 때 너무 좋았어서 갔는데 예전 느낌도 안나고 직원분들도 친절한듯 안 친절한..? 맛 가격 모두 그녕 그래요,2024-06-16,"점심에 방문, 대기 시간 30분 이내, 데이트, 연인・배우자",인테리어가 멋져요,203,1
1110133208,Dingdingi,,2024-06-16,아침에 방문,음식이 맛있어요,120,1
1110133208,밤1988,무화과 프렌치 토스트 추천,2024-06-15,"점심에 방문, 예약 없이 이용, 대기 시간 30분 이내, 친목, 친구",인테리어가 멋져요,562,1
1110133208,noknamu,비싸고 맛있어요사과케일주스 맛나요한남동 브런치카페하면생각나는 곳입니다,2024-06-12,"점심에 방문, 예약 없이 이용, 대기 시간 바로 입장",인테리어가 멋져요,154,1
1110133208,듀이32,한남동쪽 약속있으면 꼭 방문합니다.맛있어요.,2024-06-09,"점심에 방문, 예약 없이 이용, 대기 시간 30분 이내, 일상, 친구",음식이 맛있어요,17,1
1110133208,잔망다람,특별한듯 특별하지않은듯 하지만 건강한 기분내며 맛잇게 먹었습니다:) 😊😊,2024-06-08,"점심에 방문, 예약 없이 이용, 대기 시간 10분 이내, 일상, 혼자",음식이 맛있어요,278,1
1110133208,jiamei485,맛있게 먹은 한 끼,2024-06-06,"아침에 방문, 예약 없이 이용, 대기 시간 바로 입장, 데이트, 연인・배우자",음식이 맛있어요,347,1
1110133208,곰2198,아기랑 가기 좋아요,2024-06-02,"점심에 방문, 예약 없이 이용, 대기 시간 바로 입장, 데이트, 아이, 부모님",음식이 맛있어요,596,1
1110133208,Irene007,음식은 만족스러워요~ 평소대비 웨이팅이 없어서 편시 식사 가능했구요. 검정뿔테 남자분 불친절하세요.. 다른 남자 직원이 친절해 응해주셨습니다~,2024-06-01,"점심에 방문, 예약 없이 이용, 대기 시간 바로 입장, 친목, 친구",음식이 맛있어요,305,1
1110133208,용산맛집뿌셔,대체적으로 다 맛있었지만 특히 타이누들 해물 넘 좋았어요. 어쩜 오징어를 그렇게 맛있게 조리할수 있는건지! 치킨 아보카도 샌드위치도 고급스러운 맛에 따뜻한게 브런치 메뉴로 딱이었구요. 파스타는 아주 특별한 맛이라고 할 수는 없으나 깔끔하게 개운한 맛이 맘에 들었습니다. 매장은 사람도 많고 약간 대화 소리가 울리는 느낌이라 대화하며 식사 즐기기에 아주 편안했다라고는 못느꼈던것 같아요.,2024-05-29,"점심에 방문, 예약 없이 이용, 대기 시간 10분 이내, 친목, 친구",음식이 맛있어요,102,1
1110133208,Eodrmf,잘 먹었습니다 :),2024-05-29,점심에 방문,음식이 맛있어요,1296,1
1110133208,charmantemj,"음식도 맛있고, 재료도 신선해요~! 타이누들 씨푸드 추천합니당✨ 그리고 음식 먹다가 실수로 음료 쏟았는데,,,새로 갖다주셔서 너무 감동했습니다❣️더더 번창하세요!!",2024-05-26,"점심에 방문, 예약 없이 이용, 대기 시간 30분 이내, 일상, 가족모임, 부모님, 친척・형제",음식이 맛있어요,13,1
1110133208,ahn****,공간이 멋있어요~ 예쁜곳에서 맛있게 먹고 갑니다!데이트하기에 좋은 음식들이 많아요~^^,2024-05-18,"점심에 방문, 예약 없이 이용, 대기 시간 바로 입장, 데이트, 연인・배우자",인테리어가 멋져요,1106,1
1110133208,jamwondong1234,음식은 맛있으나 인간적으로 너어어어어어무 시끄러워서 먹다 체할까봐 포장해서 나옴 ㅜㅠ 모임들을 많이하는 장소인지.......데이트 분위기는 확실히 아님 테이블 배치를 다시 해야할 것 같음,2024-05-15,"아침에 방문, 예약 없이 이용, 대기 시간 10분 이내, 데이트, 친구",화장실이 깨끗해요,27,1
1110133208,Coconell,"청담점 이후 오랫만에,당연하지만 가격이 많이 올랐고맛은 여전히 좋음에그베네딕트 추천아메리카노는 비추 쥬스 마실 걸..카운터 여자분 살짝 불편했는데다른 날 다녀온 사람도 같은 말을 함",2024-05-13,"점심에 방문, 예약 후 이용, 대기 시간 30분 이내, 친목, 지인・동료",음식이 맛있어요,170,1
1110133208,슈우44,굿,2024-05-13,"점심에 방문, 예약 없이 이용, 대기 시간 바로 입장, 데이트, 연인・배우자",음식이 맛있어요,421,1
1110133208,태양을 찾아,맛있어요^^,2024-05-13,점심에 방문,음식이 맛있어요,702,1
1110133208,dev****,가족들 브런치로 방문했어요조카들이 특히 파스타를 좋아하네요음식이 신선하고 맛있어요,2024-04-28,"점심에 방문, 예약 후 이용, 대기 시간 30분 이내, 가족모임, 아이, 부모님",음식이 맛있어요,310,1
1110133208,섹시한 부산갈매기,엄마랑 평일 한남동 데이트하면서 엄마가 꼭 드시고 싶다한 브런치집이어서 대기 걸고 기다려서 갔다왔어요!가격이 좀 비싸긴 했지만 맛과 양은 적당했어요,2024-04-19,"점심에 방문, 예약 없이 이용, 대기 시간 30분 이내, 가족모임, 부모님",매장이 넓어요,481,1
1110133208,piccadilly,음식이 맛있어요,2024-04-17,"아침에 방문, 예약 없이 이용, 대기 시간 바로 입장, 일상, 지인・동료",음식이 맛있어요,52,1
1110133208,닉네임설정중임,굿,2024-04-14,점심에 방문,특별한 메뉴가 있어요,516,1
1110133208,오늘은레서판다,에그베네딕트(연어)랑 🍒체리베리팬케익🥞 맛있게 먹었어요ㅎㅎ,2024-04-10,"점심에 방문, 예약 없이 이용, 대기 시간 30분 이내, 데이트, 연인・배우자",음식이 맛있어요,112,1
1110133208,돼그리,"오아시스 한남점, 감성 뿜뿜한 브런치 카페답게 분위기 제대로다. 통창 덕분에 자연광 잘 들어와서 사진 찍기도 좋고, 테이블 간격 넉넉해서 여유롭게 먹기 좋았다. 직원들도 친절하고 주문도 빨리 나오는 편.에그 베네딕트 연어는 소스가 부드럽게 감싸면서 짭짤~고소한 맛이 찰떡. 프라운 로제 파스타는 새우 큼직하고 로제 소스 꾸덕해서 만족도 최상. 크림 라떼는 부드럽고 고소해서 디저트랑 찰떡이고, 홍차 아이스티는 달지 않고 깔끔해서 브런치랑 조합 굿.전체적으로 음식 퀄 좋고 분위기 좋아서 ""여기 또 와야겠다"" 생각 들었음.",2024-03-19,"점심에 방문, 예약 없이 이용, 대기 시간 30분 이내, 친목, 친구",친절해요,44,1
1110133208,he****,,2024-03-15,"점심에 방문, 예약 없이 이용, 대기 시간 10분 이내, 친목, 친구",음식이 맛있어요,1653,1
1110133208,애밀리,연어베네딕트 무화과 콩포트 팬케이크오눌의 파스타 로제파스타 이렇게 먹었어요커피도 맛있고 브런치도 괜찮네요가격대가 조금있지만 발렛도되고편히 먹고왔어요,2024-03-11,"점심에 방문, 예약 없이 이용, 대기 시간 바로 입장, 데이트, 연인・배우자, 부모님",음식이 맛있어요,331,1
1110133208,monika224,규모가 작다는건 조금 아쉽지만  메뉴도 좋고 브런치 맛있어요 데코도 이쁘고~,2024-03-10,"점심에 방문, 예약 없이 이용, 대기 시간 바로 입장, 친목, 친구",음식이 맛있어요,118,1
1110133208,소심포악,오월의 종에 빵사러 들렸다가 자연스럽게? 들어갔어요 ㅎㅎ브런치메뉴 맛있어요. 소스들이 무겁지 않고 밸런스 잘 맞는 느낌이었어요.,2024-03-09,"점심에 방문, 예약 없이 이용, 대기 시간 바로 입장, 데이트, 친목, 일상, 연인・배우자, 친구, 지인・동료",음식이 맛있어요,292,1
1110133208,맑음2760,이른 시간부터 오픈해서 갔더니 이미 만석이더라고요~ 바로 나오시는 분들이 계셔서 웨이팅은 없이 들어갔습니다. 에그베네딕트 맛있어요🙂,2024-03-06,"점심에 방문, 예약 없이 이용, 대기 시간 바로 입장, 데이트, 연인・배우자",대화하기 좋아요,482,1
1110133208,Anotherday20,케일사과레몬쥬스 맛있어요!,2024-03-04,"점심에 방문, 예약 없이 이용, 대기 시간 바로 입장, 나들이, 친구",음식이 맛있어요,1691,1
1110133208,jiw****,샌드위치맛있어요,2024-03-04,"점심에 방문, 예약 없이 이용, 대기 시간 바로 입장, 친목, 친구",음식이 맛있어요,1818,1
1110133208,추웡3,"타이누들 샐러그, 훈제연이 에그베네딕트, 무화과 프렌치토스트 먹었는데 넘 맛있었어요!무엇보다 직원분들이 넘 친절하시고 많은 부분 배려해주신것도 기억에 남습니다. 재방문의사 무조건 있어요ㅎㅎㅎㅎ",2024-03-04,"점심에 방문, 예약 없이 이용, 대기 시간 바로 입장, 친목, 친구",음식이 맛있어요,28,1
1110133208,Denver93,굿,2024-03-03,"점심에 방문, 예약 없이 이용, 대기 시간 30분 이상, 데이트, 연인・배우자",음식이 맛있어요,846,1
1110133208,유진9869,굿이에용,2024-02-23,"점심에 방문, 예약 없이 이용, 대기 시간 10분 이내, 일상, 친구",음식이 맛있어요,212,1
1110133208,아이스크림컵케익,맛나요!,2024-02-18,"점심에 방문, 예약 없이 이용, 대기 시간 10분 이내, 나들이, 연인・배우자, 아이",인테리어가 멋져요,616,2
733920762,구암5144,좋아요,2025-04-01,"점심에 방문, 예약 없이 이용, 대기 시간 바로 입장, 일상, 아이",음식이 맛있어요,2611,2
733920762,hee****,,2025-03-25,점심에 방문,친절해요,807,1
733920762,성실한 리뷰어,"일요일 오후 3시 30분쯤 방문했고 한 팀만 식사중이었어요. 2인 들어가니 직원분이 2인석 자리 중 아무 데나 앉으라 해서 4인석은 안되냐 했더니 안된대서 2인석에 앉았는데 시간대가 애매해서 자리도 텅텅 비었던데 좀 융통성을 발휘해 주셨다면 더 좋았을 거 같아요.대표 메뉴인 크로와상 프렌치 토스트와 연어 와플 에그 베네딕트 주문했습니다. 각각 19,000원이에요. 메뉴가 빠르게 나왔고 다 먹고 나니 3시 45분이어서  놀랐어요. 배가 고프기도 했고 맛도 있고 약간 스트레스 해소되는 음식이었어요. 크로와상에 프렌치 토스트니 말 다했죠! 거기에다가 에그 베네딕트도 와플이잖아요. 부드럽고 폭신한 와플이요! 1인 1메뉴였고 크로와상 반 자른 거 4개, 에그 베내딕트도 수란 2개라 둘이서 나눠 먹기 좋았어요.",2025-03-16,"점심에 방문, 예약 없이 이용, 대기 시간 바로 입장",음식이 빨리 나와요,639,1
733920762,수연332,예쁘게 나와요 배는 부르진않음,2025-03-09,"점심에 방문, 예약 없이 이용, 대기 시간 30분 이내, 데이트, 연인・배우자",음식이 맛있어요,689,1
733920762,gis****,오랜만에 방문한 곳인데 여전히 좋은 곳이네요. 아무래도 브런치에 커피까지 하면 한사람당 가격이 가볍지는 않은정도지만 한번씩 평일 오전에 방문할 기회가 있다면 좋은 곳 입니다.,2025-03-06,"아침에 방문, 예약 없이 이용, 대기 시간 바로 입장, 데이트, 연인・배우자",음식이 맛있어요,19,1
733920762,Stanleyyy,,2025-03-03,"점심에 방문, 예약 없이 이용, 대기 시간 바로 입장, 데이트, 연인・배우자",음식이 맛있어요,377,1
733920762,bye6757,,2025-03-03,"점심에 방문, 예약 없이 이용, 대기 시간 30분 이내, 데이트, 연인・배우자",음식이 맛있어요,1386,1
733920762,wur****,맛도 좋고 분위기도 좋아요~~,2025-03-01,"아침에 방문, 예약 없이 이용, 대기 시간 바로 입장, 데이트, 연인・배우자",음식이 맛있어요,1301,1
733920762,hyu****,지난 2월 평일 오전 10시쯤 아이와 함께 방문했는데 손님이 저희밖에 없더군요. 3명이다보니 나름의 배려인지 큰자리를 주시긴했는데 아무래도 매장이 비어있다보니 문이열릴때마다 바람이 불어 쌀쌀하더라구요. 아이때문에 추운것같아 자리가 좁아도 괜찮으니 안쪽자리로 옮겨달라했는데 직원분들이 사장님이 절대 2인좌석은 붙이지말라 했다며 딱잘라 안된다 하더라구요!! ㅋㅋ 매장에 저희 3가족 뿐이었는데 말이에요..... 융통성 없는 대처에 일단 매우 실망 + 냉골에서 밥먹는 심정으로 잠바껴입고 식사를 할수밖에 없었네요ㅠ써머레인은 초창기때부터 저희 가족의 최애 브런치플레이스였는데 초심을 잃은건지 커피도 식어나오고...음식은 뭐 쏘쏘.... 당분간 다시 방문할일은 없겠다 생각했습니다 .... 그동안 좋아했었었지만 이젠 안녕,2025-02-25,"아침에 방문, 예약 없이 이용, 대기 시간 바로 입장, 일상, 연인・배우자, 아이",,16,1
733920762,Charle,맛있게잘먹었어요~,2025-02-23,"점심에 방문, 예약 없이 이용, 대기 시간 바로 입장, 데이트, 연인・배우자",음식이 맛있어요,893,1
733920762,붐붐파파,미트파이 엄청나게 맛있다,2025-02-23,"점심에 방문, 예약 없이 이용, 대기 시간 바로 입장, 데이트, 연인・배우자",음식이 맛있어요,908,1
733920762,싱싱생숑,모든 메뉴 다 맛있게 먹었습니다 :),2025-02-23,"점심에 방문, 예약 없이 이용, 대기 시간 30분 이내, 친목, 나들이, 여행, 일상, 친구",음식이 맛있어요,861,1
733920762,줄리아킴민노엘,"버섯 와플 에그 베네딕트, 크로아상프렌치토스트 그리고 워터멜론 로즈 스무디 시켜먹었어요🧇🍞🍉 써머레인에서 워터멜론 로즈 스무디는 처음 시켜 먹어보는데 너무 맛있더라구요! 프렌치토스트는 예상 가능한 맛있는 맛이었어요. 버섯 와플 에그 베네딕트는 그냥 그랬어서 다른 에그 베네딕트 추천합니다. 일요일 오후 1시에 가서 웨이팅 한 15분 정도 하고 들어갔어요. 두명이서 메뉴 2개에 음료하는게 양이 딱 적당한 것 같아요.",2025-01-26,"점심에 방문, 예약 없이 이용, 대기 시간 10분 이내, 친목, 일상, 친구",매장이 청결해요,180,1
733920762,Ms piggy,이태원 브런치 하면 생각나는 곳. 3-4번째 방문인데 꾸준히 맛있음. 베스트메뉴 연어 에그베네딕트는 빵 대신 와플이 베이스고 아보카도와 수란 연어가 올라감. 풀드포크 오픈샌디치는 풀드포크와 비비큐소스가 잘 어울리고 감튀는 보나스- 꾸준히 안정적으로 맛난 집이라 재방의사 있고 데이트/친구모임 추천!,2025-01-22,"점심에 방문, 예약 없이 이용, 대기 시간 바로 입장, 친목, 친구",음식이 맛있어요,586,1
733920762,ejr****,가격에 비해 양이 적습니다.직원분들이 친절하지 않고 성의 없는 태도가 불쾌했습니다. 맛도 그렇게 있지 않는데..,2025-01-18,"점심에 방문, 예약 없이 이용, 대기 시간 바로 입장, 데이트, 친구",,2,1
733920762,카피바라를믿기,흠냐 흠냐 워터멜론 로즈는..,2025-01-12,"점심에 방문, 예약 없이 이용, 대기 시간 바로 입장, 일상, 친구",특별한 메뉴가 있어요,1049,1
733920762,여바람,"옷에 사람을 맞춰야하나?사람이 옷에 맞춰야하나?오후에 결혼식장 참석하러 가야한다.그래서 정장에 코트를 입고 나왔더니 해장국 먹으러 가긴 애매하다.아들이 차로 모시고 다니니 편히 브런치맛집을 찾았다.수란형태의 에그, 스크램블의 부드러운 식감, 연어는 훈연기가 있는 싱싱한 돋보인다.3가지 메뉴 다 맛나다.",2025-01-11,"점심에 방문, 예약 없이 이용, 대기 시간 10분 이내, 데이트, 연인・배우자",음식이 맛있어요,258,1
733920762,엘모맘,연말 느낌 너는 감성적 호주삭 브런치건강하게 맛있게 먹었어요.에너지 넘치는 브런치 맛집이예요,2024-12-31,"점심에 방문, 예약 없이 이용, 대기 시간 바로 입장, 일상, 친척・형제",음식이 맛있어요,372,1
733920762,이이름이없어요,비주얼이 예뻐서 기분이 좋아요!! 맛도 괜찮아요.,2024-12-30,"점심에 방문, 예약 없이 이용, 대기 시간 바로 입장",재료가 신선해요,813,1
733920762,S2kkimi,크리스마스이브🎄🎅🏻🧑🏻‍🎄 연어와플😋😋,2024-12-24,점심에 방문,인테리어가 멋져요,1085,1
733920762,MmeParis,맛있는 샐러드 먹고 싶을때 들러요.발렛 파킹 편하게 할 수 있고 매장도 넓은편.,2024-12-22,"점심에 방문, 예약 후 이용, 대기 시간 10분 이내, 친목, 친척・형제",재료가 신선해요,168,1
733920762,Hakmyung,"음식이 전체적으로 예쁘게 플레이팅되어 나오고, 그에 걸맞게 맛도 나쁘지 않아요. 사람이 많아 음식이 나오는 데 시간이 조금 걸렸어요. 연어 와플 에그베네딕트와 파블로바 디저트를 추천합니다!",2024-12-21,"점심에 방문, 예약 없이 이용, 대기 시간 10분 이내",음식이 맛있어요,949,1
733920762,냠냠냠냠욤욤욤,맛있어오 !!! 브런치,2024-12-06,점심에 방문,음식이 맛있어요,916,1
733920762,맛집탐험가여니맘,맛있네요! 양이 생각보다 많아요! 연어가 들어간걸 2가지 중복으로 시키는 바람에 연어를 많이 남겼네요ㅠㅠ 생연어 좋아하는데 훈제연어긴 합니다ㅠㅠ 연어자체는 신선해요!! 샐러드를 다른걸 고르거나 에그베네딕트를 베이컨으로 골랐어도 좋았을거 같아요! 2명이 먹기엔 3가지가 많았네요 ㅋㅋㅋ (남기고 온거 생각나서 아깝내요ㅠㅠ) 발렛이 되긴하는데 만차의 경우엔 할수가 없어요! 일행이 주차하러 한강진공영까지 갔다왔네요ㅠㅠ 주문은 하자마자 음식이 정말 바로 나왔어요 ㅎㅎ특히 샐러드랑 연어와플에그베네딕트! 저는 스매쉬드아보카도가 젤 맛있었어요!!!(버섯과 스크램블고름),2024-11-29,"점심에 방문, 예약 없이 이용, 대기 시간 바로 입장, 데이트, 연인・배우자",음식이 맛있어요,498,1
733920762,the****,호주식 브런치가 인상적이네요. 직원 분들도 정말 친절해서 좋았습니다.,2024-11-17,점심에 방문,매장이 넓어요,1168,1
733920762,attractsy55,금요일 오전 브런치 하러 방문오전 일찍 오픈하는 것도 좋고메뉴 구성도 알차서 브런치 맛집이에요점심시간 가까워지면 만석이에요와플에그베네딕트 조화롭게 맛있음프렌치토스트는 단맛을좋아하신다면 추천!,2024-11-15,"점심에 방문, 예약 없이 이용, 대기 시간 바로 입장, 데이트, 연인・배우자",친절해요,233,1
733920762,nol910da01hee,한남동에서 호주식 브런치를 맛볼 수 있는 써머레인이에요 주말이었지만 운 좋게 금방 들어갈 수 있었는데요 먹고 싶은 메뉴를 골라 카운터에 가서 주문하는 방식이에요 다 먹고 싶어서 한참 고민한 건 안 비밀 ㅠ 신중한 주문 끝에 연어에그베네딕트와 크로아상프렌치토스트 조합으로 먹어 보았는데 so goooood ~ 멍멍이들도 함께할 수 있는 브런치카페라 귀여운 구경도 잘 했답니다,2024-11-10,점심에 방문,음식이 맛있어요,406,1
733920762,Annie6168,음식은 맛잇엇습니다 가격은 조큼 비싸지만 나쁘지 않앗고 음식자체는 만족이엇으나 서비스가 넘 별로엿습니다 뭘 물어보면 대답을 제대로 안하고 손짓으로..기분나빠서 다시 가진 않으려구요,2024-11-09,"점심에 방문, 예약 없이 이용, 대기 시간 바로 입장, 데이트, 연인・배우자",음식이 맛있어요,7,1
733920762,개코월드61,맛있고 힙하고. 한남에서 다시 꼭 와야할 브런치를 꼽으라면 바로 여기입니다.,2024-10-25,"점심에 방문, 예약 없이 이용, 대기 시간 10분 이내, 친목, 친구",음식이 맛있어요,6,1
733920762,creator74,저의 최애메뉴입니다❤️오픈했을때부터 자주오는데 양이 좀 적어진것 같아서그부분은 아쉽지만 아주 맛집입니다브런치 먹기 딱입니다,2024-10-24,"점심에 방문, 예약 없이 이용, 대기 시간 바로 입장, 친목, 친구",인테리어가 멋져요,50,2
733920762,이태원클라쓰,연어가 이븐하게 잘 익었네요.흐르는 강물을 거슬러 오르는 저 힘찬 연어가생각나는 맛이였습니다. 잘 먹었습니다.,2024-10-14,"아침에 방문, 예약 없이 이용, 대기 시간 바로 입장, 데이트, 연인・배우자",음식이 맛있어요,225,1
