place_id,nickname,content,date,situations,keywords,review_count,visit_count
1920065620,즐겁게 열심히,"항상 줄서는 집이라 이번에 가봤는데 맛있네요. 일본 도쿄에서 라멘 우승했다네요. 돈코츠라멘, 마제소바set 먹었는데 양념마늘장, 다시마식초, 고추기름 추가해서 넣었더니 맛도 확 변하더라고요. 맛있고 색다른 맛에 좋았네요",2025-01-30,"점심에 방문, 예약 없이 이용, 대기 시간 10분 이내, 일상, 친구",음식이 맛있어요,1509,1
1920065620,Woongstar,입맛 까다로운 엄마가 인정한 찐맛집으로 유명한건 누구나 너무나도 잘 알고있는사실입니다.부모님 한번 꼭 모셔가보세요!!너무 좋아하시네요.칸다소바 만세~!,2025-01-28,"저녁에 방문, 예약 없이 이용, 대기 시간 10분 이내, 나들이, 부모님",음식이 맛있어요,830,2
1920065620,wldbs3690,마제소바 맛있고 직원분들도 친절하세용 밥꼭비벼먹기,2025-01-27,"저녁에 방문, 예약 없이 이용, 대기 시간 바로 입장",음식이 맛있어요,416,1
1920065620,shyunni,개인 취향인 것 같긴한데.. 리뷰가 다들 좋길래 가보았지만 저는 별로였습니다. 껍데기 비린내가 너무 심해서 1/3 만 먹고 나왔어요.. 커피가 먹고 싶어지는 맛이네요 브레이크 타임이 곧 시작이라 그런지 음식 아직 먹고 있는데 냅킨 정리하시고 분주해보이는 것도 개인적으로 서비스 별로였습니다.,2025-01-27,점심에 방문,,91,1
1920065620,hoa****,맛집이에요 ^^,2025-01-27,"점심에 방문, 예약 없이 이용, 대기 시간 바로 입장, 나들이, 친구",음식이 맛있어요,403,2
1920065620,딤플82,좋아요,2025-01-26,저녁에 방문,음식이 맛있어요,442,1
1920065620,역설적표현,왜 돼지껍데기를 먹어야 한다고 하는지 알겠습니다.,2025-01-23,"저녁에 방문, 예약 없이 이용, 대기 시간 바로 입장, 일상, 혼자",혼밥하기 좋아요,583,1
1920065620,재연1,국물이 진하고 맛있어요,2025-01-21,"점심에 방문, 대기 시간 10분 이내",음식이 맛있어요,883,1
1920065620,erwg777,10분전에 도착했더니 대기 줄이 있었습니다만꽉 차기 전에 입구 앞쪽에 앉을 수 있었어용5시 13분쯤 주문했고 음식은 5시 30분쯤 나와 한그릇 싹비움,2025-01-19,"저녁에 방문, 예약 없이 이용, 대기 시간 30분 이내, 데이트, 연인・배우자",음식이 맛있어요,83,3
1920065620,hsh****,생각한 만큼 맛이 있지는 않았어요아쉬워요 아부라소바 안에있는 고기는 돼지부속같음… 살짝그래도 직원분들은 친절하십니다,2025-01-18,"저녁에 방문, 예약 없이 이용, 대기 시간 바로 입장, 데이트, 연인・배우자",,78,1
1920065620,사과농장,존맛…,2025-01-18,"점심에 방문, 예약 없이 이용, 대기 시간 바로 입장, 데이트, 연인・배우자",음식이 맛있어요,806,2
1920065620,학종이95,그릇에 기름이 많으니 조심.,2025-01-18,"점심에 방문, 예약 없이 이용, 대기 시간 30분 이상, 친목, 친구",음식이 맛있어요,6,1
1920065620,없음9229,굿굿굿,2025-01-16,"점심에 방문, 예약 없이 이용, 대기 시간 바로 입장, 나들이, 친척・형제",음식이 맛있어요,1227,1
1920065620,s34****,"마제소바에 삶은계란, 돼지껍데기 추가해서 먹었는데 무난하게 맛있어요. 셀프 결제 먼저 하고 기다리다 주문번호 부르면 자리 안내해줍니다. 밥 달라고하면 주세요. 마제소바 면 다 먹고 밥 비벼먹으면 맛있어요",2025-01-15,"점심에 방문, 예약 없이 이용, 대기 시간 10분 이내, 일상, 혼자",혼밥하기 좋아요,16,1
1920065620,팔도3,맛있어요~~~~~~~~~~~~,2025-01-12,"점심에 방문, 예약 없이 이용, 대기 시간 10분 이내, 데이트, 연인・배우자",매장이 청결해요,21,1
1920065620,tjwlsdl0715,"대기는 생각보다 빨리 빠져서 약 15분 대기했고, 음식은 역시나 맛있었습니다",2025-01-11,"점심에 방문, 예약 없이 이용, 대기 시간 30분 이내",혼밥하기 좋아요,42,1
1920065620,익명잉명,,2025-01-09,"점심에 방문, 예약 없이 이용, 대기 시간 바로 입장, 친목, 친구",음식이 맛있어요,1064,1
1920065620,branchee,모듬추가한 이에케라멘 기대 이하 였습니다. 예상했던 것 보다 돼지 누린내?가 약간 나고 많이 짠 편입니다. 하지만 짜기는 덜 짜게로 선택할 수 있습니다. 껍데기 아부라소바는 껍데기가 통통하고 간이 잘 되어있어서 맛있습니다.,2025-01-07,"저녁에 방문, 예약 없이 이용, 대기 시간 10분 이내, 일상, 친구",매장이 청결해요,139,1
1920065620,Lhj8631,맛있어요,2025-01-06,"저녁에 방문, 예약 없이 이용, 대기 시간 30분 이내, 친목, 연인・배우자",음식이 맛있어요,714,1
1920065620,케이디611,"경복궁 근처 들른 김에 따뜻한 소바가 땡겨서 찾아보다가 가까운것에 칸다소바가 있어서 들어갔어여! 웨이팅은 없었지만 일요일 저녁7시쯤 갔을때도 손님들이 꽤나있었습니다. 소바+교자세트로 나름 가성비있는 가격에 맛나게 잘먹었습니다. 저희는 이에케라멘 교자세트, 아부라소바 교자세트를 주문했고, 이에케라멘은 국물이 진해서 맛있게 먹을 수 있었습니다. 아부라소바는 개인적으로 마제소바보다 더 맛있게 먹었던 것 같습니다. 파로만 토핑이 가득차서 첨엔 뭔가하다가 면이랑 토핑이랑 섞으니 안에 있던 소스랑 맛있게 먹을 수 있었습니다. 소스도 굉장히 진하고 라면 다먹고 서비스밥이랑 같이 비벼먹으면 정말 맛있습니다. 서비스밥의 경우, 직원분이 지나가다가 물어보시기도 하셨는데 생각보다 배불러서 하나만 주문하길 권장합니다:)",2025-01-05,"저녁에 방문, 예약 없이 이용, 대기 시간 바로 입장, 데이트, 연인・배우자",음식이 맛있어요,170,1
1920065620,리뷰꾸르잼,껍데기 아부리소바가 궁금했는데 양념된 껍데기랑도 잘 어울리더라구요💚🤎 조금 느끼할땐 고추기름이랑 다시마 식초넣어서 먹으니까 깨끗이 다 먹었어요😋😋 운좋게 주말인데 웨이팅이 없어서 더 기분좋게 잘 먹고왔습니다!,2025-01-05,"점심에 방문, 예약 없이 이용, 대기 시간 바로 입장, 친목, 친구",음식이 맛있어요,670,1
1920065620,플럼019,유명해서 가봤어요,2025-01-04,"점심에 방문, 예약 없이 이용, 대기 시간 10분 이내, 데이트, 연인・배우자",음식이 맛있어요,537,1
1920065620,뀨뀨8121,라멘이랑 고민하다가 칸다소바 걸랐는데 후회없었어용 다음에는 라멘먹어보는걸로!,2025-01-04,"점심에 방문, 예약 없이 이용, 대기 시간 30분 이내, 친목, 친구",음식이 맛있어요,418,1
1920065620,콜3,동생 : 별로다. 위생이 안좋다.나 : 그럭저럭 만족. 다만...다음번에 간다면 타 지점 가련다 ㅎ,2024-12-31,"점심에 방문, 예약 없이 이용, 대기 시간 30분 이내, 데이트, 친목, 일상, 친척・형제",음식이 맛있어요,2069,1
1920065620,처음처럼5298,국물이 진하고 면이 부드러웠어요 차슈는 다른 리뷰처럼 냄새가 나서 고추기름 식초 찍어 먹었어요,2024-12-29,"저녁에 방문, 예약 없이 이용, 대기 시간 바로 입장",음식이 맛있어요,209,2
1920065620,에헷1004,언제 먹어도 맛있는 칸다소바지금 또 먹고싶음 ㅜㅜ,2024-12-28,"저녁에 방문, 예약 없이 이용, 대기 시간 바로 입장, 일상, 연인・배우자",음식이 맛있어요,1260,2
1920065620,12will,30분 정도 대기했는데 추워서 약간 후회하다가음식 먹어보고 기다리길 잘했다 싶어요. 맛있습니다.,2024-12-28,"점심에 방문, 예약 없이 이용, 대기 시간 30분 이내, 나들이, 부모님",음식이 맛있어요,9,1
1920065620,처음처럼5298,돼지껍데기가 바삭하지않고 전체적으로 좀 느끼했어요 매장 회전율이 좋았어요 주방에 다섯분이 계신데 굉장히 분주하게 움직이셨어요,2024-12-27,"저녁에 방문, 예약 없이 이용, 대기 시간 바로 입장",혼밥하기 좋아요,209,1
1920065620,넘죠아서어죠지,길 걷다 너무 추워서 우연히 들아간 칸다소바. 이에케라멘 너무 맛있어요! 다음엔 소바도 도전하고싶어요🤤 교자와 산토리 생맥도 잘 어울려요😋,2024-12-27,"저녁에 방문, 예약 없이 이용, 대기 시간 바로 입장, 일상, 연인・배우자",매장이 넓어요,240,1
1920065620,so****,소바가 맛있어요 ^^,2024-12-26,"저녁에 방문, 예약 없이 이용, 대기 시간 바로 입장, 데이트, 연인・배우자",음식이 맛있어요,1166,1
1920065620,BDBD BabyDuck,서울라이트 광화문 보러갔다가 들렀어요^^따뜻한 국물이 먹고싶었는데 크리스마스라그랬는지 소진되었네요.그래도 소바도 맛나니까 꿀꺽!! 돼지껍데기 처음 먹어보는데 원래 이렇게  쫄깃하면서 부드럽고 맛난건가요?? 어쩔 수 없이 또 방문해야겠네요~~잘먹었습니당^^,2024-12-25,"저녁에 방문, 예약 없이 이용, 대기 시간 10분 이내, 데이트, 일상, 연인・배우자",음식이 맛있어요,37,1
1920065620,Shu1001,살면서 먹어본 라멘중 최고….너무 맛있어요~!,2024-12-24,"점심에 방문, 예약 없이 이용, 대기 시간 30분 이내, 데이트, 연인・배우자",인테리어가 멋져요,11,1
1920065620,MTVIEW,경복궁역 맛집으로 늘 줄이 긴데요. 평일 저녁에 마침 웨이팅이 없어서 들렀어요. 돈고츠 라멘을 주문했는데 맛은 있었지만 염도 80%로 먹었음에도 저에게는 좀 짜게 느껴졌습니다.,2024-12-23,"저녁에 방문, 예약 없이 이용, 대기 시간 10분 이내, 일상, 친구",특별한 메뉴가 있어요,84,1
1920065620,wecango,국물이 진하고 맛있어요!! 🍜은근 양이 많다,2024-12-23,"저녁에 방문, 대기 시간 10분 이내, 친구",음식이 맛있어요,160,1
1920065620,꿀짱다롱,오랜만에 방문한 칸다소바!여전히 인기가 많아서 웨이팅했습니다!너무 맛있고 만두처음 먹어봤는데 맛있어요!배터지게 잘 먹었습니다 :),2024-12-21,"점심에 방문, 예약 없이 이용, 대기 시간 30분 이내, 데이트, 일상, 연인・배우자",음식이 맛있어요,538,2
1920065620,맛집챙,돼지껍데기 아부라소바 진짜 최고에요ㅠ지점 더 늘었으면 좋겠네요,2024-12-20,"점심에 방문, 예약 없이 이용, 대기 시간 10분 이내, 일상, 혼자",음식이 맛있어요,1181,1
1920065620,햅삐한 틈새소풍러,"주말이면 줄이 너무 길어서 쉬 먹기도 힘든 식당인데평일 저녁에 가면 혼밥러들이 그득이다.겨울바람이 코 끝을 얼얼할 정도로 차지면서매번 ‘아부라소바’를 먹던 오늘만큼은 뜨끈한 국물이 땅긴다.군침 도는 계란, 발그레한 고기, 주먹으로 꽉 쥐었던 시금치넓적한 김에 사골육수가 면빨에 담긴 것처럼 깊은 면빨고추가루에 묻혀진 마늘을 잔뜩 얹은 국물이 더욱 깔끔해진다.후루룩 후루룩 다 마셔버리고 싶게 맛있다.칸다소바 메뉴는 3가지에 만두가 있다.어느 것 하나 빠지는 것 없이 모두가 주인공으로 손색이 없다.기분, 날씨에 따라 무엇을 선택하든 다 최고의 선택일거다.",2024-12-17,"저녁에 방문, 예약 없이 이용, 대기 시간 바로 입장, 일상, 혼자",혼밥하기 좋아요,263,4
1920065620,ha3i,,2024-12-16,"저녁에 방문, 예약 없이 이용, 대기 시간 바로 입장, 일상, 혼자",혼밥하기 좋아요,5,1
1920065620,salvia22,저는 마제소바가 더 좋았어요,2024-12-16,"점심에 방문, 예약 없이 이용, 대기 시간 30분 이내, 데이트, 연인・배우자",음식이 맛있어요,742,1
1920065620,doiha,,2024-12-14,"저녁에 방문, 예약 없이 이용, 대기 시간 바로 입장, 일상, 혼자",음식이 맛있어요,1606,5
1920065620,하늘날자47,여전히 맛있다별차이 없이 맛있지만 롯데월드몰보다 맛닜다근데!!!!여전히 대기번호 끊고 밖에서 기다려야 한다핸드폰 연락시스템좀 도입하지..고객 불친화 음식점이다그리고!!!!면의 양이 살짝 줄은 느낌추가밥은 확실히 줄었다!!예전엔 꾸꾹 눌러 담아줬는데 ㅠㅜ,2024-12-14,"저녁에 방문, 예약 없이 이용, 대기 시간 30분 이내, 나들이, 혼자",음식이 맛있어요,49,1
1920065620,Fourever,진짜 진짜 오랜만에 칸다소바 경복궁점에 방문했더니 직원분들이 전부 바뀌시고 군만두?세트메뉴도 추가 됐더라구요! 여전히 마제소바는 맛있었구 직원분들도 친절하셔요! 브레이크타임 끝나는 시간에 맞춰가면 웨이팅없이 바로 착석 가능한거 같아요:),2024-12-13,"저녁에 방문, 예약 없이 이용, 대기 시간 바로 입장",친절해요,41,1
1920065620,버섯601,마제소바 맛집인줄 알았는데 돈코츠 라멘도 넘 맛있어요!! 추천 😍,2024-12-13,"점심에 방문, 예약 없이 이용, 대기 시간 10분 이내, 나들이, 친구",음식이 맛있어요,380,1
1920065620,햅삐한 틈새소풍러,"서촌에 올 일이 있으면 ‘칸다소바’에 들를 수 있겠구나 싶어서발걸음이 가볍다.가벼운 정도가 아니고 신이 나서 들썩일 정도다.자꾸만 생각이 날 정도니 이건 중독된 것이 틀림없다.키오스크 앞에서 순간이지만 또 수퍼컴퓨터의 연산마냥뭘 먹을까 많은 고민들이 내 머릿속을 오간다.라면대회 1등? 내가 좋아하는 아부라소바?내 검지손가락은 또 아부라소바를 눌러버렸다.만두도 먹고 싶었지만 그럼 배가 찢어질 것 같아 포기했다.‘아부라소바’는 음식이 아니고 그림같다.그리고 돼지껍데기는 음식이 아니고 예술이다.가위질하는 느낌부터 턱이 빠지도록 씹어대며 느껴지는쫀득한 껍데기와의 실갱이, 이 모든 것이 즐거움이다.난 아마 다음에 가도 또 ‘아부라소바’를 시킬 것 같다.가능하면 만두까지",2024-12-10,"저녁에 방문, 예약 없이 이용, 대기 시간 바로 입장, 일상, 혼자",혼술하기 좋아요,263,3
1920065620,teaj,마제소바에 차슈추가했는데 차슈가 여태까지 먹어본 차슈 중에 최악의 퀄리티임. 돼지 냄새나서 안먹음. 옆 사람도 차슈 안먹었더라.,2024-12-07,"저녁에 방문, 예약 없이 이용, 대기 시간 바로 입장, 일상, 혼자",,24,1
1539185460,앙팡뇩,,2025-04-10,점심에 방문,음식이 맛있어요,941,6
1539185460,헤일리슈아맘,먹느라 사진이 없지만 서울역 근처 탐방하다가 리뷰보고 가서 먹게된 곳이에요~ 일본식 라면이고 국물과 면이 독특하고 맛있네요! 다음엔 다른메뉴 먹어보고 싶어요 식사량이 많으신 분들은 기본만 하시면 양이 좀 적을 것 같긴했어요! 다음에도 또 방문하고 싶은 곳입니다,2025-04-06,"점심에 방문, 예약 후 이용, 대기 시간 30분 이내, 친목, 친구",음식이 맛있어요,41,1
1539185460,영이43,처음 먹어보는 유자향 가득 시오라멘 상큼하니 계속 땡기는맛입니다.매운유즈소유 라면은 좀 매운맛이 부족한맛이라 아쉽긴했으나 맛있었습니다.고기만두도 바삭하니 맛있으니 꼭 드셔보시길!면추가 반만해도 양이 꽤 됩니다. 육수도 같이 시키면 한번더 따뜻하게 먹을 수 있으니 드셔보새요.,2025-04-06,"점심에 방문, 대기 시간 10분 이내, 데이트, 연인・배우자",음식이 맛있어요,527,1
1539185460,맛객나그네,날 실망시키지않는 유즈라멘!,2025-04-05,"점심에 방문, 예약 없이 이용, 대기 시간 10분 이내, 일상, 혼자",음식이 맛있어요,2039,5
1539185460,유누1017,유자향이 들어가서 더더욱 맛있는것같아요! 양도 충분하고 맛도 너무 좋네용ㅠㅠ 대기줄이 조금 있는것 빼면 완벽해서 시간날때마다 한번씩 와서 먹고있습니당ㅎㅎ,2025-04-03,"점심에 방문, 예약 없이 이용, 대기 시간 10분 이내, 비즈니스, 지인・동료",음식이 맛있어요,23,1
1539185460,도도리16,앱으로 기다려서 메뉴를 주문하고 나가서 기다리다가 자리에 앉고 기다리면 라멘이 나오는 웨이팅의 늪... 제일 기본인 유즈시오라멘을 시켰어요. 심심할 뻔한 맑은 국물에 새콤한 유자가 들어가서 재미있고 밸런스 좋았어요. 두툼한 차슈도 행복하고 맛있어서 근처 갈 일이 있고 웨이팅 짧다 싶으면 가볼 만도 함.,2025-03-30,"점심에 방문, 예약 후 이용, 대기 시간 30분 이상, 나들이, 일상, 친구",음식이 맛있어요,44,1
1539185460,애초에,간장 라멘 먹었는데 무난했던 것 같아요친구는 시오라멘 먹었는데 아무 맛 안난다고 하더라구여…,2025-03-29,"저녁에 방문, 예약 없이 이용, 대기 시간 30분 이내, 일상, 연인・배우자, 친구",매장이 넓어요,93,1
1539185460,강남역리뷰공주,서울역 갈때마다 먹는 유자라멘 맛집!유자소스 뿌리면 은은하게퍼지는 향이 느끼함도 잡아줘서 질리지않고 먹을수 있습니다!또한 자가제면이라 면이 진짜 맛있는데 무한리필!!!^^,2025-03-28,"점심에 방문, 예약 없이 이용, 나들이",음식이 맛있어요,450,2
1539185460,psickmsick,"서울역 대표 맛집 유즈라멘 첫방문입니다.케치테이블로 평일 점심 12시쯤 예약하여 1시에 입장했습니다.(더 일찍 예약하시길 추천)대표 메뉴인 '매운유즈쇼유'와 유즈쇼유 & 군만두 주문.메뉴는 입구에서 키오스크로 미리 주문하고 들어가기에 금방 제공됩니다. 본관은 다찌 테이블로 생각보다 작은데, 별관이 단체석도 받을수 있도록 아주 넓었습니다.매운유즈쇼유는 생각보다 그렇게 맵진 않았습니다.(신라면 정도)면발은 쫄깃하고 탱글한 느낌!국물은 그냥 먹었을땐 약간 기름지며 해비한 느낌을 받맜는데 향채소인 루꼴라와 함께 먹으면 담백하고 건강한 맛으로 변합니다. 꿀조합!고기도 두툼한데 엄청 부드럽고 불향이 잘베어서 너무 맛있었습니다.다음번 방문에는 담백한 유즈시오라멘 한번 먹어보려구요.잘 먹고 갑니다.",2025-03-28,"점심에 방문, 예약 후 이용, 대기 시간 30분 이상, 친목, 나들이, 일상, 지인・동료",음식이 맛있어요,360,1
1539185460,개앵쓰,"🍜  담백하면서 깊은 맛의 라멘 맛집, 유즈라멘 🍜서울역 근처에 볼 일이 있어 간 김에 예전부터 저장해 놓았던 맛집, 유즈라멘에 다녀왔다!🍋‍🟩 주문메뉴1️⃣ 유즈시오라멘 몇 년전 라멘 맛집이라는 곳에 방문했을 때 기대에 못 미쳤던 경험이 있기에 기대 없이 방문하였는데 너무 맛있게 먹었다💗약간 기름지지만 라멘이라는 점을 생각하면 기름 없는 축에 속하고, 담백한 국물과 은은하게 올라오는 상큼한 유자 맛이 일품이다.토핑으로 루꼴라와 큼지막한 차슈 그리고 부드러운 반숙란 또한 라멘과 잘 어울렸음(어떻게 루꼴라를 넣을 생각을 하셨나요,,🫶)바쁜 와중에도 직원분들 너무너무 친절하셨고, 세심하게 테이블 살피는 모습 대단하세요👍",2025-03-28,"밤에 방문, 예약 없이 이용, 대기 시간 30분 이내, 일상, 친구",음식이 맛있어요,82,1
1539185460,JeongeunH,처음 방문해본 거라 젤 베스트인 유즈시오 라멘 먹었는데 진짜 맛있었어요!! 일단 국물 먼저 호로록하는데 진짜 먹어본 라멘 중에 젤 깔끔한 맛!!! 평소 라멘 먹으면 처음에는 맛있다가 나중에는 좀 느글하고 그런 느낌 매번 받았는데 여긴 진짜 깔끔하더라고요👍🏻그리고 차슈 느끼하지 않게 부드러웠고 라멘에 루꼴라 뭔가 조합이 오묘했는데 잘 어울리는 조합이었답니다~처음에는 묘하게 나는 유자향이 매력적이었고 유자청?을 더 넣어서 먹었더니 진짜 미친 맛이었습니다~반찬으로 파김치가 있는데 라멘이랑 조합👍🏻👍🏻다음에 다른 메뉴 먹으러 또 와야될 거 같아요~,2025-03-27,"점심에 방문, 예약 없이 이용, 대기 시간 10분 이내, 나들이, 친척・형제",인테리어가 멋져요,20,1
1539185460,냥냥박사냥,"가라아게 촉촉 , 튀김만두 만두소가 가득 , 유즈소금과 매운유즈간장 독특한 맛으로 한번쯤 먹어볼만 해요 맛있게 잘 먹고갑니다 차슈가 너무 익어서 푸석했어요 좀 더 부드러웠으면 좋겠어요 🙏🏼",2025-03-23,점심에 방문,혼밥하기 좋아요,350,1
1539185460,송니백,,2025-03-23,점심에 방문,음식이 맛있어요,570,1
1539185460,진429,서울에서 제일 맛있는 라멘 집이에요. 면과 육수 추가가 무료로 무제한이라 아주 좋습니다,2025-03-22,점심에 방문,음식이 맛있어요,1191,1
1539185460,FromA,"🍜유즈시오(소금)라멘 12,000원🥣유즈소유(간장)라멘 12,000원⏱️토요일 오후 3:33 웨이팅, 3:44 결제, 3:56 식사유자라멘이 궁금했는데 한번쯤 먹어볼만한 깔끔한 맛,두툼한 차슈와 면과 육수가 무한리필인게 킬포인듯🤔별관도 있어서 웨이팅 회전율이 빠르다.웨이팅 인기는 신기함ㅋ",2025-03-22,"점심에 방문, 대기 시간 30분 이내, 데이트, 연인・배우자",현지 맛에 가까워요,719,1
1539185460,연기,차슈가 넘좋아요쇼유라멵국물 짱,2025-03-22,"점심에 방문, 예약 없이 이용, 대기 시간 바로 입장",음식이 맛있어요,1259,2
1539185460,시종여일77,,2025-03-22,"점심에 방문, 예약 후 이용, 대기 시간 30분 이상, 데이트, 연인・배우자",음식이 맛있어요,1500,11
1539185460,충만한포스,"길지 앓은 시간 웨이팅 후 들어갔어요본관과 별관이 키친을 중심으로 나뉘어져 있어서 안내를 따라 별관에서 식사했어요시오라멘과 치킨 가라아게를 주문했는데 치킨 가라아게가 먼저 나와 에피타이저로 먹고 있으니 시오라멘이 등장했습니다🍜치킨 가라아게도 일본에서 먹던 현지맛과 비슷했어요육질이 부드럽고 육즙이 팡팡 터졌어요🍗시오라멘은 유즈라멘만의 유자착즙을 육수에 넣어 먹으면 별미인데 상큼한 향이 구수하고 진한 육수와 독특하게 잘 어울립니다👍유즈라멘은 면이 부족하면 언제든 한그릇과 반그릇씩 리필이 되니 양은 걱정없이 드셔도 됩니다저는 한그릇, 아내는 반그릇을 리필하여 순삭했어요육수도 리필이 가능하니 양껏 드실 수 있습니다직원분들도 정말 친절하고 깊은 육수와 상큼한 과즙이 어울리는 유즈라멘 추천합니다👍",2025-03-21,"저녁에 방문, 예약 없이 이용, 대기 시간 10분 이내, 일상, 연인・배우자",음식이 맛있어요,17,1
1539185460,KIMWON33,기차 타기 전에 시간이 있어서 걸어갔다왔어요 친절하고 맛있습니다. 바로 먹고 나와서 사진이 없네요,2025-03-18,"점심에 방문, 예약 없이 이용, 대기 시간 바로 입장, 여행, 아이",음식이 맛있어요,213,1
1539185460,fhkcls,나이샤,2025-03-16,"저녁에 방문, 예약 없이 이용, 대기 시간 바로 입장, 데이트, 연인・배우자",음식이 맛있어요,1412,2
1539185460,dlw****,평소 라멘 잘 안먹는데 느끼하지도 않고 좋았어요!!,2025-03-16,"점심에 방문, 예약 후 이용, 대기 시간 10분 이내, 데이트, 연인・배우자",친절해요,29,1
1539185460,우리의우주,"서울역에 들른 김에 유즈라멘 만리동점에 방문했다. 토요일 저녁이라 웨이팅을 걱정했지만 운 좋게도 바로 입장할 수 있었다. 혼자 방문했지만 전혀 어색하지 않았고, 자리도 아늑해서 편하게 식사할 수 있었다. 시오라멘을 주문했는데, 첫 맛은 깔끔하고 유자 향이 은은하게 퍼져서 굉장히 상쾌했다. 국물은 깊고 진했지만 느끼하지 않고, 두꺼운 차슈 고기와, 반숙 계란이 조화를 잘 이뤘다. 먹다 보니 자연스럽게 면과 육수를 추가로 요청했다. 추가해도 국물 맛이 유지되어 만족스러웠다. 혼밥하기 좋은 라멘집으로 추천하고 싶다.항상 여기서 매운 유주쇼유라멘, 매운 유즈시오라면 등을 먹다가 기본 메뉴를 먹었는데 자극적이지 않고 매우 만족스러웠습니다😀확실히 여기만의 매력있는 라멘집인 거 같아요😀",2025-03-15,"저녁에 방문, 예약 없이 이용, 대기 시간 바로 입장, 일상, 혼자",음식이 맛있어요,2080,3
1539185460,sh025,면 추가 무료~ :) 금요일 저녁에 방문했는데 웨이팅 없고 혼자여서 금방 앉을 수 있었어요,2025-03-14,"저녁에 방문, 예약 없이 이용, 대기 시간 10분 이내",혼밥하기 좋아요,378,2
1539185460,뵤뵤님,국물은 일본 라멘 느낌 + 면은 홍콩 완탕멘 느낌 😛🍜,2025-03-14,저녁에 방문,음식이 맛있어요,105,1
