place_id,nickname,content,date,situations,keywords,review_count,visit_count
1370292097,소백36,저녁으로 먹으려고 샀는데 너무 맛있었어요. 채소도 많이 들어있고 건강한 맛이에요.,2025-03-27,"저녁에 방문, 예약 없이 이용, 대기 시간 바로 입장, 일상, 혼자",음식이 맛있어요,99,7
1370292097,dkd****,우리동네 최고 김밥집!! 키토 있어서 짱 좋아요♡♡무엇보다 종류도 많고 깔끔해서 좋습니당♥︎,2025-03-27,"점심에 방문, 포장·배달 이용, 대기 시간 바로 입장, 일상, 부모님",음식이 맛있어요,31,5
1370292097,ell****,매장도 청결하고 무엇보다 음식이 맛있어요!! 옛날 추억의 떡볶이 맛이에요 떡볶이 강추-!,2025-03-27,"아침에 방문, 포장·배달 이용, 대기 시간 바로 입장",음식이 맛있어요,1,1
1370292097,꼬해67,한줄씩만 먹어도 충분히 배부를만큼 속도 실하고 맛있어요!,2025-03-25,"저녁에 방문, 포장·배달 이용, 대기 시간 바로 입장, 연인・배우자",음식이 맛있어요,7,3
1370292097,김현지요,저번에 먹고 맛있어서 또 포장했어요~!근처 김밥집중에 젤 맘에 들어요,2025-03-25,"점심에 방문, 포장·배달 이용, 대기 시간 바로 입장, 일상, 혼자",음식이 맛있어요,8,2
1370292097,amy0302,김밥도 떡볶이도 맛있게 잘 먹었습니다 !!,2025-03-25,"점심에 방문, 포장·배달 이용, 대기 시간 바로 입장, 일상, 혼자",음식이 맛있어요,28,12
1370292097,뿅뿅2253,집근처에 이런곳이 있어서 넘 좋아요 매번 친절하게대해 주셔서 감사합니다,2025-03-24,"점심에 방문, 포장·배달 이용, 대기 시간 바로 입장, 일상, 아이",음식이 맛있어요,23,7
1370292097,judy012540,와사비마요소스랑 너무 잘 어울려요참치김밥은 오공김밥이 제일 맛있어요,2025-03-24,"점심에 방문, 포장·배달 이용, 대기 시간 10분 이내, 일상, 혼자",음식이 맛있어요,8,1
1370292097,aub****,재료가 신선하고 먹으면서 건강해진다는 생각이 들어요키토 김밥이 있어 행복해요~,2025-03-24,"점심에 방문, 예약 후 이용, 대기 시간 10분 이내, 일상, 아이",음식이 맛있어요,9,19
1370292097,DrSY,오공김밥 애오개점 사장님 부자되세요~우리 동네 김밥 맛집!,2025-03-23,"저녁에 방문, 포장·배달 이용, 대기 시간 바로 입장, 일상, 혼자",음식이 맛있어요,49,6
1370292097,x코코x,자주 먹는 김밥맛집역시 맛있고 푸짐해용,2025-03-23,"저녁에 방문, 포장·배달 이용, 대기 시간 10분 이내, 일상, 연인・배우자, 아이",음식이 맛있어요,198,4
1370292097,염양이,김밥 맛있고 메뉴도 다양해서 좋아요!,2025-03-23,"점심에 방문, 예약 없이 이용, 대기 시간 10분 이내, 나들이",음식이 맛있어요,15,3
1370292097,jun****,맛있어서 자주 이용해요! 강력 추천!!!,2025-03-23,"아침에 방문, 예약 후 이용, 대기 시간 10분 이내, 나들이, 연인・배우자",음식이 맛있어요,9,9
1370292097,마마님123,언제나 꽉찬 김밥! 재료가 가득차서 좋아요 :) 단골입니다 ㅎ 외출할 때 항상 3~4줄 사가요ㅎㅎ,2025-03-22,"점심에 방문, 포장·배달 이용, 대기 시간 바로 입장, 나들이, 연인・배우자",음식이 맛있어요,23,10
1370292097,chl****,김밥이 아주실하고 다양한 종류가있어요:) 아이 먹게 작게 싸주셔서 감사합니다,2025-03-22,"점심에 방문, 포장·배달 이용, 대기 시간 바로 입장, 나들이, 아이",음식이 맛있어요,13,1
1370292097,소백36,소고기 김밥 재료도 실하게 들어있어서 맛있었습니다. 리뷰로 주신 커피도 잘 먹었습니다.,2025-03-22,"점심에 방문, 포장·배달 이용, 대기 시간 바로 입장, 일상, 혼자",음식이 맛있어요,99,6
1370292097,Junnee,마래푸 근처 있는 김밥집 처음 가봤는데맛있었어요 시그니처 메뉴가 베스트 :),2025-03-22,"점심에 방문, 포장·배달 이용, 대기 시간 바로 입장, 일상, 혼자",음식이 맛있어요,4,1
1370292097,godlike2744,김밥이 너무 맛있어요! 사진 선택이 왜 안되는지 모르겠지만! 초딩 아이들 선택은 돈까스와 스팸김치였구요…물론 다른 김밥도 다 맛있어요! 매운 거 좋아하시는 분은 불오뎅김밥 강추요!,2025-03-22,"점심에 방문, 포장·배달 이용, 일상, 아이",음식이 맛있어요,15,1
1370292097,쇼징,재재재주문💕 제일 좋아하는 참치김밥과 처음 시도해보는 돈가스 김밥 포장함 역시나 맛있습니다,2025-03-22,"아침에 방문, 포장·배달 이용, 대기 시간 바로 입장, 일상, 연인・배우자",음식이 맛있어요,10,2
1370292097,캐니캥,오공아 삼장법사님 진미채 김밥 한줄만 사다주겠니?,2025-03-22,"아침에 방문, 포장·배달 이용, 대기 시간 10분 이내, 일상",음식이 맛있어요,705,1
1370292097,누빔스,맛잘알 언니가 추천해준 가게!! 크기부터 압도적이고 재료 알차고 간 적당하고 진짜 맛있었어요~!! 매일매일 먹어도 질리지 않을 맛입니다. 김밥에 진심이라 김밥 입맛 까다로운 편인데 여기 진짜 맛집이에요,2025-03-21,"점심에 방문, 포장·배달 이용, 대기 시간 바로 입장, 일상, 친구",음식이 맛있어요,7,1
1370292097,essencema43,돈까스 양념소스맛이 진하지만색다르게 맛있네요,2025-03-21,"점심에 방문, 포장·배달 이용, 일상, 혼자",음식이 맛있어요,10,2
1370292097,vin****,커피까지 맛집이네요. 최근 먹어본 김밥 중 최고네요.,2025-03-21,"점심에 방문, 포장·배달 이용, 대기 시간 바로 입장, 일상, 혼자",음식이 맛있어요,5,1
1370292097,서박이,사진처럼 진짜 꽉찬 김밥이라 자주 먹어요!점심에 이용하시는 분들은 미리 주문하고 방문하세요!,2025-03-21,"점심에 방문, 예약 후 이용, 대기 시간 바로 입장, 일상, 혼자",음식이 맛있어요,17,19
1370292097,서박이,"항상 맛있게 먹고 있어요!! 소고기김밥 다른 곳에서 시키면 간혹 힘줄 씹히고 퍽퍽하기만 해서 싫었는데, 오공김밥꺼는 맛있어용",2025-03-20,"점심에 방문, 포장·배달 이용, 대기 시간 바로 입장, 여행, 일상, 혼자",음식이 맛있어요,17,18
1370292097,mangsangs,맛있게 잘 먹었습니다,2025-03-20,"점심에 방문, 포장·배달 이용, 대기 시간 바로 입장, 일상, 혼자",음식이 맛있어요,51,17
1370292097,Rydye,명란마요&돈까스 김밥 조합으로 n번째 먹습니다~~ 너무 맛있어요!!,2025-03-20,"점심에 방문, 포장·배달 이용, 대기 시간 바로 입장, 일상, 연인・배우자",양이 많아요,33,9
1370292097,sundo325,늘 맛있게 먹고 있습니다 :) 재료도 신선하고 알차요!,2025-03-18,"저녁에 방문, 포장·배달 이용, 대기 시간 10분 이내, 일상, 아이",음식이 맛있어요,8,6
1370292097,싱글몰트1,김밥이 생각나면 여기서 먹습니다.,2025-03-18,"점심에 방문, 포장·배달 이용, 대기 시간 10분 이내",음식이 맛있어요,10,4
1370292097,짱콩잉,야채듬뿍~ 김밥이 늘 맛있어서 김밥만 자주 사먹다가 떡볶이를 처음 먹어봤는데 생각보다 제 입맛엔 간이 조금 센 편이네요 그래도 맛있게 잘 먹었습니다! 항상 빠르고 친절하세요~,2025-03-17,"점심에 방문, 포장·배달 이용, 대기 시간 바로 입장, 일상, 혼자",음식이 맛있어요,3,2
1370292097,대저택도련님,오공김밥 오늘도 맛있어요,2025-03-17,"점심에 방문, 포장·배달 이용, 대기 시간 바로 입장",음식이 맛있어요,7,3
1370292097,김현지요,이른시간에 이용할 수 있어서 좋았어요~~오공김밥 주문했는데 맛있고 매장도 청결했어요담에 재방문 할게요~!,2025-03-17,"아침에 방문, 포장·배달 이용, 대기 시간 바로 입장, 일상, 혼자",음식이 맛있어요,8,1
1370292097,뿅뿅2253,속이 아주 꽉찬 김밥  오늘도 맛있게 잘 먹었습니다,2025-03-16,"저녁에 방문, 예약 없이 이용, 대기 시간 바로 입장, 일상, 아이",음식이 맛있어요,23,6
1370292097,als****,맛있어요 추천합니다,2025-03-16,"저녁에 방문, 포장·배달 이용, 대기 시간 바로 입장, 친구",음식이 맛있어요,3,2
1370292097,로사53,아이김밥 주문 했는데  가격대비내용물 실하고 얇게 커팅 요청사항도 잘 들어주셔서 자주 주문해요!맛있어요!!,2025-03-16,"점심에 방문, 포장·배달 이용, 대기 시간 10분 이내, 나들이, 아이",재료가 신선해요,14,2
1370292097,뉴요정,날씨좋은 주말 점심시간이라 그런지 대기가 조금 있었습니다. 사장님께서 죄송해하시며 오시는 고객분들께 대기시간 계속 안내해주시더라구요. 음~ 저는 맛있으니 대기 인정👍 입니다!,2025-03-15,"점심에 방문, 포장·배달 이용, 대기 시간 30분 이내, 나들이, 연인・배우자",음식이 맛있어요,13,2
1370292097,lov****,김치참치 너무 맛있어요~~주말마다 먹고 있어요!커피도 서비스로 주시고 최고👍,2025-03-15,"점심에 방문, 포장·배달 이용, 대기 시간 바로 입장, 나들이, 연인・배우자, 아이",음식이 맛있어요,12,4
1370292097,로사53,아이 김밥이 사이즈도 작고 내용물 좋아요!작은아이꺼는.더 작게 잘라달라고 요청했는데 잘 해주셨어요!주방안이 다 보이고 깔끔합니다!,2025-03-15,"점심에 방문, 포장·배달 이용, 대기 시간 10분 이내, 일상, 아이",음식이 맛있어요,14,1
1370292097,Citrus55,알차고 신선한 재료들이 가득 들어있어요!! 담백한 참치김밥 맛있게 잘 먹었어요~,2025-03-15,"점심에 방문, 포장·배달 이용, 대기 시간 바로 입장, 일상, 혼자",음식이 맛있어요,15,10
1370292097,tmd****,재료가 신선하고 김밥이 맛있어요! 포장해가기 좋슴니당ㅎㅡㅎ,2025-03-15,"아침에 방문, 예약 없이 이용, 대기 시간 바로 입장, 데이트, 연인・배우자",음식이 맛있어요,7,1
1370292097,jun****,김밥 종류도 많고 맛있어서 자주 이용해요~,2025-03-15,"아침에 방문, 포장·배달 이용, 대기 시간 10분 이내, 나들이, 연인・배우자",음식이 맛있어요,9,8
1370292097,ysy****,커피까지 ㅠ 받으면서 감사한 마음!김밥만 먹어도 너무 맛있어요 당근김밥같은 느낌으로 맛있어요 간은 좀 있습니다,2025-03-15,"아침에 방문, 포장·배달 이용, 대기 시간 10분 이내, 일상, 혼자",음식이 맛있어요,22,3
1370292097,서박이,진짜 커서 좋아요 김밥 하나만 먹으면 배고픈데 여기 김밥은 맛있게 배불리 먹을 수 있어서 좋어용,2025-03-14,"점심에 방문, 포장·배달 이용, 대기 시간 바로 입장, 일상, 혼자",음식이 맛있어요,17,17
1370292097,혜23,2~3명 먹고갈 곳이 있어 좋아요.,2025-03-14,"아침에 방문, 포장·배달 이용, 대기 시간 30분 이내, 일상, 혼자",음식이 맛있어요,33,10
1370292097,꾸이93,집 앞에 오공김밥이 있어서 너무 좋아요.키토김밥 좋아하는데 최애 메뉴들이 많아요!떡볶이도 맛있어요~~ 매장은 오픈 주방이라 더 믿음이 갑니다!,2025-03-14,"아침에 방문, 예약 없이 이용, 대기 시간 바로 입장, 일상, 혼자",친절해요,26,1
1370292097,대저택도련님,일주일에 두세번 이상 찾는 오공김밥!! 맛있어요!! 커피 서비스 👍 👍 👍,2025-03-13,"점심에 방문, 포장·배달 이용, 대기 시간 바로 입장",음식이 맛있어요,7,2
1370292097,man****,음식 너무 맛있고 친절하셔요!,2025-03-13,"점심에 방문, 포장·배달 이용, 대기 시간 바로 입장, 일상, 혼자",음식이 맛있어요,4,1
1370292097,파우찌,터질 것 같이 튼실한 키토김밥을 먹을 수 있어 너무 좋아요! 매장 원칙도 명확하고 가게 내부도 청결해요!!,2025-03-13,"점심에 방문, 예약 없이 이용, 대기 시간 바로 입장, 일상, 혼자",음식이 맛있어요,170,1
1370292097,가나다개내대,진미채 김밥 맛있어요 ^^아이는 크림치즈소불고기 완전 좋아해요재로도 싱싱해요,2025-03-11,"점심에 방문, 포장·배달 이용, 대기 시간 10분 이내, 일상, 혼자",음식이 맛있어요,39,13
1370292097,cecilro,요즘 가장 맛있게 먹는 최애김밥~^^오늘도 잘 먹었습니다.,2025-03-11,"점심에 방문, 포장·배달 이용",음식이 맛있어요,683,4
1370292097,서박이,진짜 이 근처 김밥집은 여기밖에 안 가요 돈까스 김밥 크고 맛있어용,2025-03-11,"점심에 방문, 포장·배달 이용, 대기 시간 바로 입장, 일상, 혼자",음식이 맛있어요,17,15
1023755433,mee****,튀김 진짜 맛있네요,2025-03-01,"저녁에 방문, 포장·배달 이용, 대기 시간 10분 이내, 일상, 연인・배우자",음식이 맛있어요,49,1
1023755433,파니55,다 맛있는데 특히 저 바로해주시는 바삭바삭한 튀김이 넘 맛있어요!,2025-02-07,점심에 방문,친절해요,1037,3
1023755433,Q and A,튀김만 굿굿,2025-02-07,"점심에 방문, 예약 없이 이용, 대기 시간 10분 이내, 나들이, 친구",음식이 맛있어요,1078,1
1023755433,파니55,다 맛있는데 특히 튀김이 맛나요!,2025-01-27,점심에 방문,음식이 맛있어요,1037,2
1023755433,Daily기록,,2025-01-24,"점심에 방문, 예약 없이 이용, 대기 시간 바로 입장, 일상, 혼자",음식이 맛있어요,165,1
1023755433,1218alswl,엄마가 애기 보러 오셨다가 떡볶이 먹고 싶어 하셔서 사 왔어요. 떡볶이 맛있다고 극찬하시네요. 튀김도 맛나는데 김말이가 찐이에요. 남편은 순대도 졸맛이래요ㅎㅎ,2025-01-23,"점심에 방문, 포장·배달 이용, 대기 시간 10분 이내, 일상, 혼자",음식이 맛있어요,544,3
1023755433,FromA,"🥘비트떡볶이 4천원🦑오징어튀김 3개 2,500원🍤모듬튀김 4천원떡볶이도 주문 후 바로 조리해주시고튀김도 주문 후 바로 튀겨주시는데깨끗하고 신선하고 바삭하고 너무  맛있었어요👍👍👍좋은 재료에 착한 가격이 감동적인 떡볶이 달인 맛집😍감사합니다🙏",2025-01-15,"저녁에 방문, 일상, 연인・배우자",음식이 맛있어요,719,1
1023755433,토마토맘16,맛나요,2025-01-11,저녁에 방문,음식이 맛있어요,2412,3
1023755433,Salut86,"너무 맛있게 잘먹었습니다.떡볶이가 유명하던데,떡볶이소스가 맛있고튀김이 생각보다 되게 맛있었어요.",2025-01-08,"저녁에 방문, 포장·배달 이용",음식이 맛있어요,24,1
1023755433,보나피데,진짜 맛있어요ㅠ 튀김 4000원에 엄청 푸짐해요! 마늘버터멘보샤랑 깻잎김말이가 킥이네요!,2025-01-04,"저녁에 방문, 예약 없이 이용, 대기 시간 바로 입장, 데이트, 연인・배우자",음식이 맛있어요,50,1
1023755433,백수인,튀김만 만원 가까이 먹었더니 느끼합니다. ^^이집은 우리나라 분식집들 중에서 튀김을 제일 잘 할 확률이 높습니다.(튀김 종류가 4개 있는데 오징어랑 김말이 추천합니다)순대도 맛있습니다.이것도 꼭  추천!!마지막 사진도 한 번 봐주세요소량으로 떡볶이 만드는 가스 화구 주변을 보세요사진은 잘 표현 안 됐지만 엄청 깔끔해요.이런 분식집 만나기 정말 어러울 듯,2025-01-02,저녁에 방문,음식이 맛있어요,1020,2
1023755433,iity,"떡볶이가 가격에 비해 양이 적은데,  특색있고 맛있었어요.  비트로 색을 내서 빨갛지만 보기와 다르게 전혀 맵지 않고 많이 달달한 스타일이에요. 호불호는 조금 갈릴 것 같은데, 저는 좋았어요. 특히 튀김이 맛있고 종류도 다양했어요~오징어 튀김도 실하고. 김말이, 멘보샤 튀김 추천합니다!",2024-12-29,"점심에 방문, 대기 시간 30분 이내",음식이 맛있어요,273,1
1023755433,곱창초밥빵,,2024-12-21,점심에 방문,,1158,8
1023755433,먹는게남는다,올만에 먹었는데 역시 튀김 맛집입니다 ㅋ,2024-12-07,"저녁에 방문, 포장·배달 이용, 대기 시간 바로 입장, 회식, 혼자",음식이 맛있어요,306,8
1023755433,세콰노,"작년 생달에 나왔을 당시 먹어보고, 근처에 일하러 온 김에 들러본 아현시장 마포분식입니다. 비트로 만든 떡볶이가 가장 독특하고, 개인적으로는 깨끗한 기름에 튀겨낸 다양한 튀김이 이 집의 매력이 아닐까 생각합니다.",2024-12-04,"점심에 방문, 예약 없이 이용, 대기 시간 바로 입장, 일상, 혼자",음식이 맛있어요,53,2
1023755433,연1185,1인분만 주문이 안되서 아쉬워요,2024-11-09,"점심에 방문, 예약 없이 이용",음식이 맛있어요,1422,3
1023755433,won****,ㄱ,2024-11-09,"점심에 방문, 포장·배달 이용, 대기 시간 10분 이내, 일상, 혼자",음식이 맛있어요,351,3
1023755433,씩씩하게95,떡볶이를 좋아해서 근처에 갔다일부러 찾아 갔다. 소문과 리뷰와 같이떡볶이 맛이 색다르고 맛있었다.허나.. 할머니 사장님 넘 불친절하셔서다시는 찾지 않을거 같다..,2024-11-08,"점심에 방문, 예약 없이 이용, 대기 시간 바로 입장, 일상, 기타",음식이 맛있어요,21,1
1023755433,백수인,떡볶이를 비트 발효 이용하신다는데확실히 다른 곳과는 차별화된 맛입니다.생각소다 많이 달아서 제 예상을 벗어났는데패스하려다 아쉬워서 시킨 오징어 튀김에서 빵 터졌어요이게 분식집에서 말이 되는 퀄리티인가요?횟집가면 가끔 보는 그런 정성과 맛이 일품인튀김이었습니다.꼭 드셔보세요주문들어오면 소량으로 바로 튀겨주시는데아내가 다음엔 1만원어치 오징어 튀김 먹겠다고 했습니다.,2024-11-04,점심에 방문,재료가 신선해요,1020,1
1023755433,하겐다즈매니아,"쯔양도 다녀간 마포분식오늘 떡볶이2인, 오뎅, 멘보샤2 먹었어요마포분식 튀김이 최고존엄 ㅠㅠㅠㅠ주문한 후에 튀겨주시고 떡볶이 만들어주셔서 신선그 자체! 분식에 신선하다는게 어울리는게 마포분식온누리 쓸 수 있어 좋고 무엇보다 맛있고 친절하세요오늘은 거의 마감 직전에 가서 그런지 평소보다 떡볶이가 많이 매웠어요ㅠ",2024-11-02,저녁에 방문,음식이 맛있어요,560,2
1023755433,Mrju,"주문 즉시 만들어주는 떡볶이, 튀김입니다.비트로 만든 떡볶이 입니다.적당한 맵기이고 튀김은 일식집 튀김 보다 맛있습니다.👍",2024-10-26,"점심에 방문, 예약 없이 이용, 대기 시간 바로 입장, 친목, 지인・동료",음식이 맛있어요,591,2
1023755433,퐁그리,오징어튀김이랑 가지튀김! 바삭바삭 맛있어요.,2024-10-10,"점심에 방문, 예약 없이 이용, 대기 시간 바로 입장, 일상",음식이 맛있어요,1040,4
1023755433,하겐다즈매니아,"마포분식 알게되어서 너무 좋아요..!!떡볶이랑 튀김 주문하면 즉시 그자리에서 만들어주세요떡볶이 튀김 다 미리해놓는게 기본값이라 생각했는데 여기 마포분식은 그때 해주셔서 따끈따끈 튀김도 갓 튀겨져서 진짜 맛있어요비트가 들어가서 걸쭉한 건더기가 있고 떡은 조리한지 오래되지 않아 말랑말랑해요멘보샤 강추ㅜㅜㅜ무조건입니다… 모둠 시키면 멘보샤1이어서 싸울 각ㅋㅋㅋ남자친구랑 떡볶이2,멘보샤, 김말이 사갔다가 먹고 너무 맛있어서 내려와서 식당에서 또 사먹었어요,,,, 생활의달인 나올만한 가게로 인정!!할머님이랑 사장님 너무 친절하셔서 기분좋게 먹고 갑니다! 오래오래 장사해주세요❤️미리주문 네이버페이가능하고 다 만들어지면 전화도 주셔서 좋았어요(기계음) 온누리도 됩니당 ㅎㅎㅎ",2024-10-07,저녁에 방문,친절해요,560,1
1023755433,meredith2,주문하면 바로 만들어주세요. 튀김 너무 맛있어요. 떡볶이는 매우 빨갛지만 달달해요. 감사합니다.,2024-09-28,점심에 방문,음식이 맛있어요,376,1
1023755433,Mrju,"떡볶이는 비트떡볶이이구 밀떡입니다.여기는떡볶이 튀김을 주문하면 그 때 바로 만들어 줍니다.그래서 튀김도 아주 바삭바삭하고,떡볶이는 비트의 단맛이 나서 맛이 좋습니다.생활의달인에 나온 떡볶이집 입니다.금액은 각각 4천원입니다.맛있습니다.👍",2024-09-28,"점심에 방문, 예약 없이 이용, 대기 시간 바로 입장, 친목, 지인・동료",음식이 맛있어요,591,1
1023755433,레모나우,튀김생각날때마다 가장 먼저 생각나는 곳이예요! 김말이 완전 강추강추 다른 튀김도 맛있어요~,2024-09-26,"저녁에 방문, 포장·배달 이용, 대기 시간 10분 이내, 일상",음식이 맛있어요,31,4
1023755433,kdoong258,? 전에 맛있게 먹어서 운동하고 기분 좋게 점심 먹으러 갔는데 할머니 날카롭게 반응하며 장사하기 싫은가 기분만 잡치고 왔습니다 점심시간에 사람없는 이유를 알겠네요 다신 안가요,2024-09-23,"점심에 방문, 예약 없이 이용, 대기 시간 바로 입장, 일상, 혼자",가성비가 좋아요,75,1
1023755433,won****,ㄱ,2024-09-16,"저녁에 방문, 포장·배달 이용, 대기 시간 10분 이내, 일상, 혼자",음식이 맛있어요,351,2
1023755433,그렇다면야,떡볶이랑 튀김이 예술입니다. 떡볶이는 비트라 거의 안 매워요. 튀김은 바로 튀겨주셔서 엄청 바삭해요.,2024-09-16,"점심에 방문, 예약 없이 이용, 대기 시간 바로 입장, 여행, 혼자",음식이 맛있어요,266,1
1023755433,루시아15,"와~ 떡볶이맛의 신세계! 제주 발효 비트 소스로 만든 #아현시장 #마포분식 #떡볶이생활의달인 에 나왔었나보다.떡볶이 1인분 양은 적지만, 자극적이지 않은 맛깔난 양념과 쫄깃한 떡볶이 모두 합격!주문 후 바로 조리해서 3-5분 걸린다.모듬튀김도 주문해보고 싶어 주문~와~ 여기 무슨 일식당 튀김처럼 깨끗하고 깔끔하게 튀겨준다.오징어튀김, 밤고구마튀김, 김말이튀김 모두 다 맛있음.온누리상품권도 쓰고 아주 대만족!앞으로 단골하겠음 😊#아현시장맛집 #아현역떡볶이 #떡볶이맛집 #마포떡볶이 #비트떡볶이 #아현동떡볶이",2024-09-15,"저녁에 방문, 예약 없이 이용, 대기 시간 바로 입장, 일상, 혼자",음식이 맛있어요,1562,1
1023755433,김애니밟밟,할머니 사장님 오래 건강하세요.,2024-09-13,저녁에 방문,음식이 맛있어요,528,1
1023755433,gloomy9876,이동네 사시는 분들이라면 다들 아실꺼예요 왜 줄서면서 까지 튀김을 사서 먹는지 진짜 김말이튀김은 서울바닦에서 여기가 원탑👍,2024-09-07,"점심에 방문, 포장·배달 이용, 대기 시간 30분 이내, 혼자",음식이 맛있어요,14,15
1023755433,won****,굿,2024-08-29,"저녁에 방문, 포장·배달 이용, 대기 시간 10분 이내, 일상, 혼자",음식이 맛있어요,351,1
1023755433,das****,다 맛있지만 튀김이 진짜 맛있어요,2024-08-29,"저녁에 방문, 예약 없이 이용, 대기 시간 바로 입장, 일상, 연인・배우자",음식이 맛있어요,1775,1
1023755433,은블리v,😶,2024-08-29,"점심에 방문, 예약 없이 이용, 대기 시간 바로 입장, 일상, 친척・형제",,672,1
1023755433,chiichiihere,"이 근방 세 번의 떡볶이집 실패 후 찾은 성공이라 굉장히 기쁩니다! 너무 맛있어요! 동네분들 여기 추천입니다✨ 국물이 매력적인 떡볶이, 쫀득한 순대, 바삭하고 신선한 튀김 다 훌륭합니다!",2024-08-24,"저녁에 방문, 포장·배달 이용, 대기 시간 10분 이내, 일상, 혼자",음식이 맛있어요,10,1
1023755433,Mement,사장님 정말 너무 맛있어요 🥹맛있는 음식 만들어 주셔서 감사합니다오래오래 건강하게 떡볶이와 튀김 만들어주세요 감사합니다❤️,2024-07-26,"저녁에 방문, 포장·배달 이용",음식이 맛있어요,40,9
1023755433,88mr,떡볶이 맛있어요,2024-07-20,"저녁에 방문, 포장·배달 이용",음식이 맛있어요,1761,1
1023755433,muranghae,처음 가봤는데 와우 맛있었어요색깔과는 다르게 맵지 않았고 비트떡볶이라는 컨셉도 좋았고 적당하게 달고 제가 좋아하는 쌀떡에껫잎김말이 튀김과 함께 먹었는데 재방문하고 싶은 곳,2024-07-11,"저녁에 방문, 예약 없이 이용, 대기 시간 바로 입장, 일상, 혼자",음식이 맛있어요,852,1
1023755433,zxc12378,이 동네 오래 살면서 여기를 이제야 갔어요ㅠ 떡볶이가 매콤달콤한게 너무 맛있어요!! 근데 여기는 튀김도 엄청 맛있네요 엄청 바삭합니다.. 최고예요,2024-06-17,"점심에 방문, 포장·배달 이용, 대기 시간 바로 입장",음식이 맛있어요,56,1
1023755433,먹는게남는다,역시 변함없는 맛~ 튀김이 바삭하고 맛나요!,2024-06-05,"저녁에 방문, 포장·배달 이용, 대기 시간 바로 입장",친절해요,306,7
