place_id,nickname,content,date,situations,keywords,review_count,visit_count
1244479891,cod****,5~6년전 한남점 오픈 초기에 다녀왔는데 서울숲 옆에 있어서 생각나서 와봤어요. 그때도 옥수수피자 맛있게 먹었는데 여전히 맛있고 역시 원조네요.인테리어는 더 힙해져서 연인끼리 데이트로 오기에 딱입니다.,2025-04-03,"저녁에 방문, 예약 후 이용, 대기 시간 바로 입장, 데이트, 나들이, 연인・배우자",대화하기 좋아요,1108,1
1244479891,fea****,성수동에서 지인들이랑 같이 밥먹기 좋은 곳이에요. 분위기가 조용해서 앞 사람이랑 이야기도 불편함없이 잘 되구요🍽️,2025-04-03,"점심에 방문, 예약 없이 이용, 대기 시간 바로 입장, 데이트",재료가 신선해요,54,1
1244479891,ioy****,파스타맛집 찾고 있다면 여기 추천드려요. 양도 푸짐하고 퀄리티도 높아요.,2025-04-03,"점심에 방문, 예약 없이 이용, 대기 시간 바로 입장, 여행",음식이 맛있어요,63,1
1244479891,moo****,주차도 가능하고 매장도 넓어서 가족끼리 오기에도 좋았어요. 부모님도 만족하셨어요!,2025-04-03,"점심에 방문, 예약 없이 이용",양이 많아요,205,1
1244479891,fwi****,사진보다 실물이 더 예쁜 플레이팅! 음식 하나하나 정성이 느껴졌어요.,2025-04-03,"점심에 방문, 예약 없이 이용, 대기 시간 바로 입장, 여행",재료가 신선해요,94,1
1244479891,HUNZ,"서울숲 파스타, 피자 맛집이에요! 옥수수 피자는 달달한 옥수수가 한가득 올라간 피자가 독특하면서도 중독적인 맛이었고, 화이트 라구 파스타는 크리미한 라구 소스가 일품이었어요! 커피와 음료 메뉴도 다양해서 주문해봤는데 라떼도 고소하고 맛있었어요 :)",2025-04-02,"저녁에 방문, 예약 후 이용, 대기 시간 바로 입장, 일상, 친구",친절해요,179,1
1244479891,011****,"친구랑 급하게 찾은 성수 맛집인데, 피자랑 파스타 둘 다 훌륭해서 기분 좋은 하루였어요.",2025-04-02,"점심에 방문, 예약 후 이용, 대기 시간 바로 입장",음식이 맛있어요,109,1
1244479891,334****,화려하진 않아도 따뜻하고 조용한 분위기에서 편하게 식사할 수 있어서 좋아요.,2025-04-02,"점심에 방문, 예약 후 이용, 대기 시간 바로 입장",재료가 신선해요,87,1
1244479891,whe****,"봉골레 파스타는 해산물 향이 깊게 우러나 있어서 너무 맛있었고, 피자도 바삭하니 굿!",2025-04-02,"점심에 방문, 예약 후 이용, 대기 시간 바로 입장",재료가 신선해요,217,1
1244479891,195****,여긴 언제 와도 후회 없어요! 화이트 라구 파스타는 매번 먹어도 질리지 않네요 🥰,2025-04-02,"점심에 방문, 예약 후 이용",음식이 맛있어요,36,1
1244479891,nin****,브런치 메뉴인 메밀 유부초밥 먹어봤는데 의외로 너무 맛있어서 놀랐어요. 강추합니다,2025-04-01,"점심에 방문, 예약 후 이용",음식이 맛있어요,26,1
1244479891,hai****,화이트 라구 파스타는 꾸덕한 소스와 고기 풍미가 어우러져 진짜 중독적인 맛이었어요. 다음엔 꼭 또 먹을 거예요 😋,2025-04-01,"점심에 방문, 예약 후 이용",재료가 신선해요,46,1
1244479891,xor****,"가게 분위기도 좋고, 음식도 전부 정갈하게 나와서 데이트 장소로 딱이에요 💕",2025-04-01,"점심에 방문, 예약 후 이용",양이 많아요,83,1
1244479891,lin****,서울숲 나들이 마무리는 여기서! 옥수수 피자랑 파스타 조합은 언제 먹어도 실패 없어요.,2025-04-01,"점심에 방문, 예약 후 이용",재료가 신선해요,133,1
1244479891,경국지색26,매콤할줄 알았는데 별로 맵지는 않았어요.옥수수랑 치즈 반반 피자와 메밀 국수 먹었는데 배부르네요.,2025-04-01,"점심에 방문, 예약 후 이용, 대기 시간 바로 입장, 나들이, 친구",음식이 맛있어요,21,1
1244479891,tam****,넘 맛있었습니당😋❤️,2025-03-31,"점심에 방문, 예약 후 이용, 대기 시간 바로 입장, 여행, 부모님",음식이 맛있어요,3,1
1244479891,마멜9,옥수수피자랑 파스타 맛있어요!!,2025-03-30,"저녁에 방문, 예약 후 이용, 대기 시간 바로 입장, 친목, 나들이, 친구",메뉴 구성이 알차요,23,1
1244479891,코나15,흔하디 흔한 성수동 식당 중 하나. 일단 직원 태도는 알바하는 고딩같고... 피클 있냐고 물어보니 그런거없고 당근라페가 사이드로 있으니 시키라고함. 분위기도 깔끔하고 메뉴도 그럴싸한데 옥수수 피자 위에 올라간 새우가...상태가..ㅋㅋㅋ 먹다 바로 뱉음ㅎ  전복 파스타에도 전복이 크게 올라가는데 전복 상태가.....ㅎㅎ 기본적인건 하나도 갖추지 못했으면서 보여지는거에만 급급함. 여기만 이런거 아니고 성수동에 있는 식당들 중에 이런 곳 진짜 많음ㅋㅋㅋ 또 공통점이 음식들은 평타는 침 피자는 맛있었음ㅎㅎ,2025-03-29,"저녁에 방문, 예약 없이 이용, 대기 시간 바로 입장, 친목, 친구",,15,1
1244479891,cbk****,이번에도 감성 가득한 분위기와 맛있는 음식 덕분에 행복한 식사 시간이었어요! 😊💖 다음엔 또 어떤 메뉴를 먹어볼지 벌써 기대돼요~,2025-03-28,점심에 방문,양이 많아요,103,1
1244479891,rl0****,"SNS에서 많이 봤던 곳이라 궁금했는데, 실제로 와보니 더 만족스러웠어요! 📸 플레이팅도 예쁘고 음식도 정갈하게 나와서 사진 찍고 싶어지는 곳!",2025-03-28,점심에 방문,재료가 신선해요,42,1
1244479891,ubc****,혼밥하기도 부담 없는 분위기라 좋았어요! 🕯️ 테이블 간격도 넓고 조용해서 혼자 와도 편안하게 식사할 수 있었어요. 물론 음식은 말할 것도 없이 맛있었어요.,2025-03-28,점심에 방문,음식이 맛있어요,220,1
1244479891,ann****,"친구가 추천해줘서 방문했는데, 왜 이제야 왔나 싶어요. 🤭 피자도 파스타도 전부 맛있어서 뭘 먹어도 만족스러울 곳! 다음에는 단체 모임으로 와도 좋을 것 같아요.",2025-03-28,점심에 방문,인테리어가 멋져요,70,1
1244479891,강봉규29,"일단 분위기가 너무 좋아서 첫인상부터 합격! ✅ 음식이 하나하나 정성이 들어간 느낌이었고, 특히 피자 도우가 쫄깃하고 바삭해서 제 스타일이었어요.",2025-03-27,점심에 방문,인테리어가 멋져요,85,1
1244479891,xx-****,"성수에서 친구랑 만날 때 자주 가게 될 것 같아요! 👫 넓고 쾌적한 공간에서 여유롭게 식사할 수 있어서 좋았고, 무엇보다 음식이 다 맛있어서 실패 없는 선택!",2025-03-27,점심에 방문,음식이 맛있어요,34,1
1244479891,pro****,"손님이 많았지만 오래 기다리지 않았어요. ⏳ 피자도 맛있었지만, 저는 봉골레 파스타가 가장 인상 깊었어요! 해산물 향이 깊고, 마늘 풍미가 살아 있어서 너무 맛있었어요.",2025-03-27,점심에 방문,음식이 맛있어요,121,1
1244479891,snb****,"메뉴가 다양해서 뭘 먹을지 고민됐는데, 직원분이 추천해주신 화이트 라구 파스타 대만족! 🍽️ 크리미하면서도 짜지 않고 적당한 간이라 계속 먹게 되는 맛이었어요.",2025-03-27,점심에 방문,가성비가 좋아요,60,1
1244479891,han****,"서울숲에서 산책하고 와서 먹으니 더 맛있게 느껴졌어요! 🌳🍴 크리미한 라구 파스타가 입안 가득 퍼지는 게 너무 좋았고, 와인 한잔과 함께 먹으니 더 좋았어요.",2025-03-26,점심에 방문,인테리어가 멋져요,119,1
1244479891,les****,"처음 가봤는데 벌써 다음 방문 계획 중이에요. 📝 반반 피자로 여러 맛을 동시에 즐길 수 있어서 고민할 필요 없었고, 식사 후 카페까지 한 번에 해결되는 코스라 더 좋았어요!",2025-03-26,점심에 방문,재료가 신선해요,55,1
1244479891,vfz****,데이트 코스로 완전 추천! 💕 창가 자리에서 따뜻한 조명 아래 피자랑 파스타를 나눠 먹으니 분위기 최고였어요. 디저트도 함께 있어서 마무리까지 완벽했어요.,2025-03-26,점심에 방문,양이 많아요,74,1
1244479891,ser****,다양한 메뉴 중에서도 화이트 라구 파스타가 진짜 최고였어요. ✨ 꾸덕꾸덕한 소스에 고기 풍미가 가득해서 중독적인 맛! 옥수수 피자는 바삭한 감자칩이 신의 한 수였어요.,2025-03-26,점심에 방문,음식이 맛있어요,114,1
1244479891,tha****,평일 오후에 조용히 방문해서 여유롭게 식사했어요. 🍷 크림 파스타 좋아하는 사람이라면 화이트 라구 파스타 무조건 드세요! 깊고 고소한 맛이 일품이에요.,2025-03-25,점심에 방문,매장이 넓어요,36,1
1244479891,cus****,"성수 핫플 중 하나! 🎶 점심 시간에 방문했는데 음식이 빨리 나와서 좋았고, 직원분들도 친절하셔서 기분 좋게 식사하고 왔어요. 봉골레 파스타도 강추!",2025-03-25,점심에 방문,음식이 맛있어요,98,1
1244479891,cyi****,"이제야 이곳을 알게 된 게 너무 아쉬울 정도예요. 😭 옥수수 피자, 화이트 라구 파스타 조합이 이렇게 완벽할 수 있다니! 매장 분위기도 깔끔하고 세련됐어요.",2025-03-25,점심에 방문,재료가 신선해요,31,1
1244479891,011****,"가족 모임으로 방문했는데, 연령대 상관없이 다 만족했어요! 👨‍👩‍👧‍👦 피자는 바삭하면서도 쫄깃하고, 파스타는 소스가 진해서 제대로 된 한 끼 느낌이었어요.",2025-03-25,점심에 방문,재료가 신선해요,88,1
1244479891,062****,넓은 매장에 음식 좋고 직원분들도 친절하게 응대해주셔서 편안하게 식사했습니다 ㅎㅎ,2025-03-24,저녁에 방문,음식이 맛있어요,67,1
1244479891,fla****,분위기 좋고 맛있는 곳이었습니다. 직원분들도 친절하셔서 편하게 식사했습니다. 음식도 맛있어서 기분 좋게 먹었습니다 ㅎㅎ,2025-03-24,저녁에 방문,음식이 맛있어요,85,1
1244479891,48y634,맛도 좋고 소스도 넉넉하게 나와요 다른 메뉴들도 맛있었는데 친구도 함께 왔는데 다들 만족했어요,2025-03-24,점심에 방문,음식이 맛있어요,70,1
1244479891,acr****,이런 분위기에서 식사하는 건 처음이었는데 정말 낯설지만 신선했습니다. 음식도 맛있고 여유롭게 즐길 수 있어서 좋았습니다 ㅎㅎ,2025-03-24,점심에 방문,음식이 맛있어요,167,1
1244479891,arc****,요즘 회사 근처 밥집으로 많이 찾아가는 곳이에요 피자가 정말 맛있어서 출출할 때 종종 가게 되는 것 같아요 간단히 먹고 싶을때 좋아요 ㅎㅎ,2025-03-22,저녁에 방문,재료가 신선해요,102,1
1244479891,krz****,아 파스타 먹고 싶어서 갔는데 생각보다 좋았어요 면이 쫄깃하고 소스 진하니 괜찮았습니다 ㅎㅎ,2025-03-22,저녁에 방문,인테리어가 멋져요,40,1
1244479891,oao****,서울숲점 음식이 정말 맛있네요. 매장도 깔끔하고 직원분들 친절해요. 다음에 또 방문할 것 같습니다.,2025-03-22,저녁에 방문,인테리어가 멋져요,95,1
1244479891,021****,너무 맛있습니다. 직원분이 친절하게 대해주셔서 기분 좋았고 매장도 깨끗해서 좋았습니다 ㅎㅎ,2025-03-22,점심에 방문,음식이 맛있어요,14,1
1244479891,캠핑몬S2,이런리뷰 잘 안남기는데 맛집이라고 해서 왔더니 진짜 너무 소태.아무리 객관적으로 적으려고 해도 너무 짜워요.심각한 수준.  태어나서 먹은 음식중에 제일 짜움이태리가서 파스타먹어도 맛있다는 수준인데 여기는 소금을 잘못넣었는지 게우 소스 맛은 1도 안느껴짐피자는 맛있어요. 피자는 ...,2025-03-22,"점심에 방문, 예약 후 이용, 대기 시간 바로 입장, 데이트, 연인・배우자",,34,1
1244479891,iri****,음식도 맛있고 직원분들 서비스도 좋았습니다. 정돈된 인테리어가 인상적이었습니다.,2025-03-21,저녁에 방문,양이 많아요,59,1
1244479891,cul****,직원분들 응대도 좋았고 맛있게 식사했습니다 매장 안 분위기가 참 편안하고 아늑했습니다,2025-03-21,저녁에 방문,음식이 맛있어요,86,1
1244479891,홍천사랑,봉골레파스타  콰트로 피자 시켰어요지하이지만 쾌적하고 분위기 좋아보여 들어갔어요그런데 쉐프님 염도계로 한번 재보셨나요?하루 염분 그이상일거같아요남편은 입천정이 다음날 헐었어요파스타도 먹물인지 까맣고 생면에 식감도 좋고 피자 치즈도 풍미있고 양도 적지않아 가성비있던데..건강한 맛집으로 유명해지길 바래요~~,2025-03-21,"저녁에 방문, 예약 없이 이용, 대기 시간 바로 입장, 데이트, 연인・배우자",화장실이 깨끗해요,60,1
1244479891,gro****,오늘 서울숲점에서 식사했어요 직원분도 친절하고 음식도 맛있었어요 분위기도 좋고 다음에 또 오고 싶습니다,2025-03-21,저녁에 방문,재료가 신선해요,48,1
1244479891,pho****,좋은 곳이네요! 음식 맛도 좋고 직원분들도 친절했습니다. 편안한 분위기에서 식사할 수 있어서 기분 좋았습니다 ㅎㅎ,2025-03-21,점심에 방문,음식이 맛있어요,119,1
1244479891,nam****,단연 좋은 곳입니다! 음식이 정말 맛있고 직원분이 친절하게 응대해주셔서 더욱 만족스러웠습니다. 매장 내부도 쾌적해서 편안하게 식사할 수 있었습니다. 다음에 또 방문하고 싶은 레스토랑입니다~!,2025-03-20,저녁에 방문,음식이 맛있어요,25,1
1244479891,wmx****,생각보다 더 훌륭한 맛이었어요! 아메리칸 스타일 음식을 먹을 수 있어서 좋았어요~ 직원분들 응대도 편안하고 서비스도 좋았습니다,2025-03-20,점심에 방문,음식이 맛있어요,123,1
1244479891,jef****,필요한 것을 모두 얻을 수 있어요. 다양한 음식도 좋고 직원분이 친절하게 응대해주셔서 편안했습니다. 전반적으로 만족스러운 식사 시간이었습니다,2025-03-20,점심에 방문,가성비가 좋아요,63,1
1244479891,nam****,편안하게 이용했어요 맛있는 식사에 분위기까지 좋았습니다 직원분도 친절하고 음식이 맛있어서 만족스러웠습니다 비용도 적당했고 여유롭게 식사하기 좋았습니다,2025-03-20,점심에 방문,재료가 신선해요,19,1
1244479891,061****,음식 맛있고 매장 분위기 정말 신경쓴 느낌 들더라용 직원분도 친절하고 음식도 너무 맛있게 먹었어요,2025-03-19,저녁에 방문,가성비가 좋아요,53,1
1244479891,res****,직원분들 친절해서 기분 좋게 식사했어요. 가게 분위기도 아늑하고 음식도 넉넉하게 나와서 만족스러웠습니다. 다음에 또 방문할게요 ㅎㅎ,2025-03-19,저녁에 방문,인테리어가 멋져요,86,1
1244479891,k3a****,오랜만에 가본 레스토랑인데 직원분이 친절하게 응대해주셔서 좋았습니다. 음식도 맛있고 가격도 괜찮아서 만족스러웠습니다. 다음에 또 방문하고 싶네요.,2025-03-19,저녁에 방문,음식이 맛있어요,45,1
1244479891,yau****,맛있게 즐기고 왔어요. 직원분이 친절하게 응대해주시고 음식도 빠르게 나와서 좋았어요. 사진이랑 실물이 정말 비슷하더라구요 ㅎㅎ 고기가 너무 맛있어서 다음에 또 먹으러 갈거에요!,2025-03-19,점심에 방문,재료가 신선해요,92,1
1244479891,oto****,"건축 소재를 활용한 모던한 인테리어가 독특했어요. 파스타가 특히 인상적이었고, 주차가 2시간 무료라서 여유롭게 식사할 수 있었어요.",2025-03-18,저녁에 방문,양이 많아요,93,1
1244479891,썬드라이올리브오일,"음식뿐만 아니라 분위기도 너무 좋았어요. 친구들이랑 여러 가지 메뉴를 시켜서 나눠 먹었는데, 정말 좋은 선택이었어요. 🎀",2025-03-18,저녁에 방문,음식이 맛있어요,156,1
1244479891,chr****,"남자친구랑 화이트 라구 파스타랑 옥수수 피자를 먹었는데, 뭐가 제일 맛있는지 고르기 힘들 정도로 전부 다 맛있었어요! 가격도 충분히 낼 가치가 있는 곳이에요. 다음엔 봉골레 파스타 도전해볼 거예요.",2025-03-18,저녁에 방문,인테리어가 멋져요,73,1
1244479891,박형언9,"주차랑 예약이 가능해서 정말 편했어요. 크리미한 화이트 라구 파스타는 너무 고소하고 맛있었고, 반반 피자도 무난하게 먹기 좋은 조합이었어요. 🚗",2025-03-18,저녁에 방문,음식이 맛있어요,47,1
1244479891,dud****,"남자친구랑 근처 구경하다가 들렀는데, 화이트 라구 파스타가 정말 맛있었어요. 소스가 최고였고, 음식도 빨리 나오고 직원분들도 엄청 친절하셨어요.",2025-03-17,저녁에 방문,음식이 맛있어요,55,1
1244479891,edp****,"첫 방문이라 시그니처 메뉴 3가지 전부 주문해봤어요! 화이트 라구 파스타랑 봉골레 파스타가 정말 맛있고, 옥수수 피자도 너무 맛있었어요. 벌써 다음 방문 계획 중이에요.",2025-03-17,저녁에 방문,재료가 신선해요,46,1
1244479891,hwl****,딸이랑 공원에서 놀다가 데이트 겸 방문했어요. 아이가 피자랑 파스타를 정말 좋아해서 자주 오게 될 것 같아요. 💖,2025-03-17,저녁에 방문,재료가 신선해요,80,1
1244479891,arc****,"여기 파스타 정말 맛있어요! 특히 화이트 라구 파스타 소스는 정말 진하고 크리미해요. 면도 완벽하게 익었고, 먹다 보니 금방 사라졌어요. 다음에 또 올게요! 😊",2025-03-17,저녁에 방문,재료가 신선해요,136,1
1244479891,198****,파이프그라운드에서 저녁식사 했습니다 음식도 맛있고 직원분들 친절해서 기분 좋게 식사 마쳤습니다 다음에 또 방문하고 싶은 곳입니다,2025-03-17,점심에 방문,음식이 맛있어요,100,1
1244479891,mac****,분위기 좋은 곳에서 맛있는 식사했습니다 직원분들이 친절하게 응대해주셔서 기분 좋았습니다 음식도 정말 맛있고 양도 넉넉해서 만족스러웠습니다,2025-03-17,점심에 방문,음식이 맛있어요,128,1
1244479891,pap****,요리 하나하나가 정말 푸짐하고 맛있습니다 직원분들이 친절해서 즐겁게 식사했습니다 다음에 또 방문하고 싶은 식당입니다,2025-03-17,점심에 방문,특별한 메뉴가 있어요,46,1
1244479891,고양이똥꾸멍,가지 라자냐가 정말 맛있어요,2025-03-16,"점심에 방문, 예약 없이 이용, 대기 시간 바로 입장, 데이트, 연인・배우자",인테리어가 멋져요,181,1
1244479891,geo****,서울숲 산책 후 가기 좋은 맛집이에요! 추천드립니다.,2025-03-16,점심에 방문,특별한 메뉴가 있어요,84,1
1244479891,dh6kcjp,가족들과 함께 방문했는데 전 연령층이 모두 만족할 수 있는 곳이에요.,2025-03-16,점심에 방문,재료가 신선해요,156,1
1244479891,bit****,"음식 맛, 분위기, 서비스까지 모두 아주 만족스러워요.",2025-03-16,점심에 방문,음식이 맛있어요,58,1
1244479891,siz****,브런치 메뉴가 예쁘고 맛도 훌륭했어요. 사진도 잘 나오네요!,2025-03-16,점심에 방문,음식이 맛있어요,103,1
1244479891,하햐허혀호,옥수수피자 왜 유명한지 알겠어요ㅎㅎㅎ진짜 꿀맛‼️ 봉골레파스타랑 화이트 라구파스타까지 주문해서 3명이서 먹었는데 다 만족했어요🍀 또갈집이예요🎶,2025-03-15,"저녁에 방문, 예약 후 이용, 대기 시간 바로 입장, 친목, 친구",음식이 맛있어요,57,1
1244479891,198****,주말에도 웨이팅이 길지 않아서 좋았어요.,2025-03-15,아침에 방문,음식이 맛있어요,90,1
1244479891,anx****,비오는 날 방문했는데 감성적인 분위기가 너무 좋았어요.,2025-03-15,아침에 방문,음식이 맛있어요,112,1
1244479891,fab****,메뉴 구성이 다양해서 무엇을 먹을지 고민되는 곳이에요!,2025-03-15,아침에 방문,양이 많아요,125,1
1244479891,kud****,이 근처에서 가장 분위기 좋은 곳이 아닐까 싶어요!,2025-03-15,아침에 방문,음식이 맛있어요,126,1
1244479891,6jj****,직원분들도 친절하고 음식도 환상적이에요. 추천합니다!,2025-03-14,점심에 방문,재료가 신선해요,83,1
1244479891,011****,남자친구랑 데이트하면서 방문했는데 분위기가 너무 좋았어요.,2025-03-14,점심에 방문,,84,1
1244479891,041****,커피도 맛있고 음식도 너무 만족스러웠어요! 또 올게요.,2025-03-14,점심에 방문,음식이 맛있어요,105,1
1244479891,rec****,조용한 분위기에서 브런치를 즐길 수 있어서 만족스러웠어요.,2025-03-14,점심에 방문,음식이 맛있어요,72,1
1368783268,평균별점사쩜오,솥밥 맛있어요~ 쵸린기도요~,2025-04-03,"저녁에 방문, 예약 없이 이용, 대기 시간 바로 입장, 친목, 친구",음식이 맛있어요,1851,1
1368783268,귀여운탄,"솥밥은 밑에 누룽지만 살짝 있을뿐 솥도 뜨겁지않고 솥안에 밥과 내용물은 미적지근 하여 솥밥이 원래 이렇게 따뜻하지 않은것인지 의문이 들었다.홀안에 계속 빈자리가 3자리정도 나면서 적당히 돌아가고 있었는데  직원들 끼리는 농담하며 분위기좋던데 리필 부탁하면 계속 잠시만요 하며 어찌나 무뚝뚝한지,반찬양은 왜그리 조금씩 주는지...세명이 식사하는데 반찬세팅은 2곳에 해줬고 김은 한곳에 놔줬는데 너무 부족하여 김 리필을 부탁하자 3장을 더주었다. 정말 기분이 상하고 다시 리필을 부탁했을때 싸늘한 표정에  '잠시만요' 라며 말투가 어찌나 무뚝뚝한지 같이간 지인이 너무 불편해했다. 기왕이면 '네~' 라고 친절하게 대답해주면 얼마나 좋을까.저렴하지 않은 가격에 이런 대접받으며 다시는 방문 하고 싶지않은 곳이다.",2025-04-03,"점심에 방문, 예약 없이 이용, 대기 시간 10분 이내, 친목, 지인・동료",차분한 분위기에요,1,1
1368783268,Ddokkkyyyyyunnnnn,"저녁에 첫방문 했는데 맛있었어요. 처음엔 조금 비싸지 않나 생각했는데 연어 퀄리티가 엄청 좋고 부드러워서 만족했어요. 밥을 접시에 덜어내면 솥에 뜨거운 물 부워주시는데 ,그렇게 만들어진 누룽지도 맛있었습니다. 월요일 저녁이라 꽤 자리 여유가 있었고 만족한 한끼 식사였어요.",2025-03-31,"저녁에 방문, 예약 없이 이용, 대기 시간 바로 입장, 나들이, 혼자",인테리어가 멋져요,20,1
1368783268,wlg****,솥밥 퍼내는데 깊숙이에서 갈색의 긴 머리카락이 찐득찐득하게 파묻혀있었습니다주방 계신분들이 머리도 덮수룩한데 정리하지않고 그냥 음식하시더라구요  총 20분 걸려 음식 다시 받아 먹었고 음식맛은 비려요~ + 오픈 10분전에 도착해서 웨이팅 누르려고 들어갔는데 문밖으로 나가라더라구요 민망해서 “아 밖이 너무 추워서요... ^^” 하면서 나가는데 (안나가는것도 아니고) 보란듯 문을 철컹 잠궈 버리더라구요,2025-03-30,"점심에 방문, 예약 없이 이용, 대기 시간 바로 입장, 일상, 혼자",,60,1
1368783268,sse380,"브레이크 타임이 걸리기 전에 혼자 식사하러 다녀왔습니다.정말 오랜만에가서 맛이 변했으면 어쩌나 걱정이 되었는데, 여전히 맛있었습니다.",2025-03-27,"점심에 방문, 예약 없이 이용, 대기 시간 바로 입장, 일상, 혼자",음식이 맛있어요,149,1
1368783268,라온Amy,"첫 방문에 웨이팅을 해서 오늘은 오픈런을 했죠~ㅋ매장은 한산해서 좋았는데 음식 맛은 첫 방문했을 때 먹었던 것보다는 조금 아쉬웠어요ㅠ표고 멘보샤도 덜 바삭하고 튀겼다기보단 데워졌다는 느낌!!!솥밥은 맛있긴 했는데 먹고 나니 조금 느끼해서 초생강을 계속 먹었네요~^^""",2025-03-23,"점심에 방문, 예약 없이 이용, 대기 시간 바로 입장, 친목, 친구, 지인・동료",음식이 맛있어요,56,2
1368783268,낭녀,"✅ 고등어 솥밥, ✅ 전복장 솥밥두 가지 시켜 먹었습니다! 정말 맛있게 잘 먹었습니다 고등어는 가시가 많아서 가시를 같이 먹지 않는 분들에게는 조금 불편할 수 있어요🥲 그래도 맛있습니다!전복장은 제 입맛에는 싱거웠지만 다른 분들에게는 딱 맞지 않을까 싶네요!! 전복이 부드럽고 맛있었어요",2025-02-15,"저녁에 방문, 예약 없이 이용, 대기 시간 바로 입장, 데이트, 연인・배우자",혼밥하기 좋아요,7,1
1368783268,째깍째깍,"연어솥밥 2만, 스테이크 솥밥 2만5천. 기분 좋고 만족스럽게 식사 잘했다!!",2025-02-09,점심에 방문,음식이 맛있어요,761,1
1368783268,나는얌얌이,지난번엔 전복장솥밥으로 먹고 이번엔 연어로 먹어봤는데 역시 맛있네요>.<,2025-01-14,"점심에 방문, 예약 없이 이용, 대기 시간 바로 입장, 친목, 지인・동료",음식이 맛있어요,951,1
