place_id,nickname,content,date,situations,keywords,review_count,visit_count
34799908,한마음4922,음식이 맛있어서 다음에 다른 음식도 먹고싶네요,2025-04-09,"저녁에 방문, 예약 없이 이용, 대기 시간 바로 입장, 친목, 친구",음식이 맛있어요,563,1
34799908,물망초178,맛나요,2025-04-09,"저녁에 방문, 예약 없이 이용, 대기 시간 바로 입장, 친목, 친구",음식이 맛있어요,1869,1
34799908,너티야,음 ~~~ 야미 🖤,2025-03-27,저녁에 방문,음식이 맛있어요,78,2
34799908,너티야,맛있어요 또또또간집 중에 하나 👍🏻,2025-02-27,"저녁에 방문, 예약 없이 이용, 대기 시간 바로 입장",친절해요,78,1
34799908,아미4242,지인과 가끔씩 가는곳입니다예약후  방문했고 음식은 맛있게 먹었습니다근데 매장이 너무 추워서 패딩입고 먹는데도다리가 너무  시리고 제가 동태가 될 뻔했네요매장관리에 조금더 신경써주셨음 합니다,2025-01-06,"저녁에 방문, 예약 후 이용, 대기 시간 바로 입장, 친목, 지인・동료",음식이 맛있어요,2,1
34799908,수닝수닝12,건강한 맛이에요!,2024-12-07,"저녁에 방문, 예약 없이 이용, 대기 시간 바로 입장, 데이트, 연인・배우자",음식이 맛있어요,1019,1
34799908,peonyyy,바삭바삭 맛있어요,2024-11-26,저녁에 방문,음식이 맛있어요,1049,3
34799908,흔적6622,"방송에서 보고 멀리서 찾아 방문했습니다. 음식 분위기 흠잡을데 없이 만족스러웠습니다. 다만, 실장이라는 분이 같이 일하는 알바생을 혼내시는 소리가 홀에서 다 들렸습니다. 식사중 상당히 불쾌했던부분이라 재방문의사는 없습니다.",2024-11-23,"저녁에 방문, 예약 후 이용, 대기 시간 바로 입장, 데이트, 연인・배우자",음식이 맛있어요,21,1
34799908,시카고 불스,가격대는 약간 있다하지만진짜 맛집 강추,2024-10-28,저녁에 방문,음식이 맛있어요,538,1
34799908,D블리,"두번째 방문!재료 신선~ 맛있음.음식주문은 인원수 대로 주문해야하며,제주유산균생막걸리는 예약할때 미리 주문해야지 마실 수 있는 시스템이니 미리 참고하세요! 갑오징어 해물전 맛있어요~메뉴는 하나씩 다 먹어본거 같은데,왠만해선 다 맛있어요~",2024-10-14,"저녁에 방문, 예약 후 이용, 대기 시간 바로 입장",음식이 맛있어요,1886,1
34799908,알렉서,음식이 정말 맛있어요 : ),2024-10-03,"저녁에 방문, 예약 없이 이용, 대기 시간 바로 입장, 데이트, 연인・배우자",음식이 맛있어요,20,1
34799908,hyl****,가족들이랑 맛있는 한식이 먹고 싶어서 방문했습니다 흑돼지 수육 파전 오삼불 먹었어요 반찬도 하나하나 맛있습니다 잘 먹었어요,2024-09-29,점심에 방문,음식이 맛있어요,101,1
34799908,Staybystay,집밥을 먹는듯하게 간이 쎄지않고 건강한 느낌 좋았어요다만 운영면에서는 불편한 부분들이 느껴진게 일단 홀서빙1명으로 그게 다 커버가 안되서 주문부터 추가요청까지 너무 많이 기다리거나 누락되는 일이 많았구요. (옆테이블 소히가 들려서 답답해하는 게 느껴지더라고요) 게다가 밥도 설익어서? 밥 추가도 결국 취소. 주말에는 알바가 더 필요할거같고요. 오는 손님 정리가 안되면 웨이팅 시스템화를 해놔야할거같아요. 내부가 널찍하지않은 편인데 짐 놔둘곳도 없으니 의자를 수납의자로 바꾸시면 옷이나 가방 두기 좋을거같구요. 작은 공간 안에서 주문 계산 입장문의까지 다 하려니 번잡스러웠어요. 그래서 작은 질문들에도 조금 예민해보이시더라구요. 계산하면서 동시에 예약전화까지 많이 오니까 지금 그 인원으로는 서비스가 전혀 안되요,2024-09-28,"저녁에 방문, 예약 없이 이용, 대기 시간 바로 입장, 친목, 친구",음식이 맛있어요,630,1
34799908,한결같이기록하는한량,갑오징어 3종 세트갑오징어삼겹살볶음 2인 43000웤갑오징어파전 24000원갑오징어숙회 28000원날치알볶음밥 4000원,2024-09-27,"저녁에 방문, 예약 후 이용, 대기 시간 10분 이내, 친목, 친구, 지인・동료",아늑해요,1617,5
34799908,카치아21,,2024-08-19,점심에 방문,재료가 신선해요,765,1
34799908,한결같이기록하는한량,갑오징어숙회갑오징어파전갑오징어볶음갑오징어시리즈로 맛있는 점심,2024-08-17,"점심에 방문, 예약 후 이용, 대기 시간 바로 입장, 일상, 연인・배우자, 친구",단체모임 하기 좋아요,1617,4
34799908,Meta버스,가격은 좀 쌘편이지만 음식 깔끔하고 좋아요.,2024-08-12,"저녁에 방문, 예약 없이 이용, 대기 시간 30분 이내, 친목, 지인・동료",음식이 맛있어요,1258,1
34799908,jin****,방송보고…갑오징어 숙회는 굿,2024-08-12,"저녁에 방문, 예약 후 이용, 대기 시간 바로 입장, 친구",음식이 맛있어요,1593,1
34799908,닐니리15,여름인데 안이 너무 덥고 가격대비 서비스와 음식맛이 아쉬워요.,2024-08-11,"점심에 방문, 예약 없이 이용, 대기 시간 바로 입장, 데이트, 연인・배우자",양이 많아요,12,1
34799908,sm****,맛있어요,2024-08-03,"점심에 방문, 예약 후 이용, 대기 시간 바로 입장, 친목, 지인・동료",음식이 맛있어요,562,1
34799908,나무서기,가격도좋고 맛이 좋아요~^^갑오징어 파전도 맛있어요^^,2024-08-03,"점심에 방문, 예약 후 이용, 대기 시간 바로 입장, 친목, 친구",음식이 맛있어요,144,1
34799908,kyc****,굿굿,2024-08-03,"점심에 방문, 예약 후 이용, 대기 시간 바로 입장, 친목",음식이 맛있어요,2479,1
34799908,짱구맘3843,가격대비 좀 아쉬웠음밑반찬 두부부침과 김치양념은 너무 달았고 미역국은 다소 짰으며 메인인 갑오징어양념삼겹은 떡살빼면 좀 아쉬웠네요양념이 자극적이진 않았어요그리고 실내 환기가 너무 안된게. . 비오는날 소주 한잔하기에는 좋네요,2024-07-25,"저녁에 방문, 예약 없이 이용, 대기 시간 바로 입장, 데이트, 연인・배우자",음식이 빨리 나와요,33,1
34799908,kkuunnsstt49,굿,2024-07-24,저녁에 방문,음식이 맛있어요,2095,1
34799908,rkawk0801,오삼불고기 너무 맛있어요~!!,2024-07-08,점심에 방문,음식이 맛있어요,310,1
34799908,ice****,가게가 좀 좁아서 시끄럽지만 음식이 맛있고 분위기 있어요 모임때 또 가고 싶어요,2024-06-29,"저녁에 방문, 예약 후 이용, 대기 시간 바로 입장, 가족모임, 부모님, 친척・형제",음식이 맛있어요,2503,1
34799908,오늘저장꾼,"부부 셰프의 맛집이라고 소개받아 가본 곳인데, 역시 소문값을 하는 곳이네요.반찬부터 메뉴까지 모두 정갈하고 깔끔하고 감칠맛나는 곳이에요.가성비는 글쎄지만 맛과 세트 구성은 완전 와우에요.반드시 예약 필수구요.",2024-05-28,"저녁에 방문, 예약 후 이용, 대기 시간 바로 입장, 친목, 비즈니스, 지인・동료",음식이 맛있어요,778,1
34799908,AZOMNI,이사를 가서 3년만에 와봤네요.역쉬 맛은 변함이 없네요.사이드 반찬들도 맛있구요. 근데  갑오징어 숙회는 양파랑 버섯이 너무많았어요..ㅜㅜ담엔 오징어를 더많이 주세요..즐거운 식사였네요.,2024-05-27,"저녁에 방문, 예약 없이 이용, 대기 시간 바로 입장, 친목, 친구",음식이 맛있어요,698,2
34799908,tuaimes,오랜만에 갔어요여전히 음식 맛있고 직원분들 너무 친절하시고다만 2인은 예약이 안된다고 해서 1시간 웨이팅2인도 예약 받아 주세요~저희 4인 먹는 것 처럼 먹을 수 있어요 ㅎㅎ 🙂‍↔️,2024-05-23,"저녁에 방문, 예약 없이 이용, 대기 시간 1시간 이상, 친목, 친구",음식이 맛있어요,133,1
34799908,요니PICK,운좋게 주말 자리예약이 가능해서~ 대기없이 바로 입장하여 먹었어요! 손님이 많아서 음식 나오는데 오래걸리긴 했는데! 미리나온 밑반찬이 진짜 너무 마싯어서 괜찮았습니다! 음식이 다 너무 마싯너서ㅜ 다음에 집들이 손님오면 또 방문하려고해요! 진짜 ㅎㅎ 맛있았아요!! 강추강추!!!볶음밥 진짜 최고…!!,2024-05-19,"저녁에 방문, 예약 후 이용, 대기 시간 바로 입장, 데이트, 친목, 연인・배우자, 친구",음식이 맛있어요,807,1
34799908,lsa7834,,2024-04-21,"저녁에 방문, 예약 후 이용, 대기 시간 바로 입장, 가족모임, 부모님, 친척・형제",음식이 맛있어요,1381,1
34799908,lim93040817,"음식이 정말 너무 늦게 나옵니다. 서빙이 제대로 이루어지지 않습니다.미리 예약하고 단체 모임으로 다녀왔는데 주문하고 첫 음식이 1시간 되어서야 나오고, 메뉴가 삼합인데 3개가 각각 따로 나올 정도로 주방의 처리 능력이 주문을 전혀 따라가지 못합니다.음식은 그렇다 치더라도 병맥주, 제로콜라, 집게 달라는 것도 3번, 4번 다시 말해야 되고, 30분씩 걸려서 나오는 이유가 무엇인가요. 맥주를 만들어서 가져오나는 소리가 절로 나옵니다.그리고 서빙이 지나치게 지연돼서 답답한 마음에 찾아가서 물었더니 화내는 건 무슨 경우인가요. 주문이 들어간 음식이 무엇인지도 제대로 파악 못해서 가게에서 나오는 순간 마저 포스기 앞에서 다퉜네요.손님이 1/3 정도로 줄어야 음식을 정상적으로 제공 받을 수 있겠습니다.",2024-04-19,"저녁에 방문, 예약 후 이용, 대기 시간 바로 입장, 회식, 친구",,2,1
34799908,youngwon6755,옥수역에서 가장 유명한집 같아요~오삼불고기 아주 맛있고 반찬도 가짓수 많아서 골고루 먹을수있어 좋았어요~평일이라 대기없이 들어가서 좋았어요~,2024-04-17,"점심에 방문, 예약 없이 이용, 대기 시간 바로 입장, 데이트, 친목, 연인・배우자, 친구",음식이 맛있어요,585,1
34799908,big****,3일전 예약후 오픈런 방문ᆢ고급지게 셋팅되서 음식이 나오니 대접 받는 기분이였고 음식도 깔끔하고 맛있었어요~~,2024-04-17,"점심에 방문, 예약 후 이용, 대기 시간 바로 입장, 일상, 친구",재료가 신선해요,525,1
34799908,아메리카노5516,문어숙회 맛나요,2024-04-03,"저녁에 방문, 예약 없이 이용, 대기 시간 30분 이내, 친목, 지인・동료",음식이 맛있어요,1391,1
34799908,바닐라아이스크림냠,무난무난 맛있는 집입니다.미역국 주셔서 진짜 좋았구요.음식들이 정갈하게 나와서 먹기 좋아요.입구쪽에 하수구 냄새가 조금 나서 아쉽긴 하지만재방문 의사 있습니다. 잘 먹고 갑니다. 😊,2024-03-24,"점심에 방문, 예약 없이 이용, 대기 시간 바로 입장, 데이트, 연인・배우자",음식이 맛있어요,319,1
34799908,코코이웅,부부요리단서울여행2일차...무계획에 나왔던곳이라 숙소들어가는길이라에 저녁식사겸...사람이 너무 많아서 많이 시끄러운것 빼고는 다 좋았다,2024-03-18,"저녁에 방문, 예약 없이 이용, 대기 시간 10분 이내, 여행, 지인・동료",음식이 맛있어요,657,1
34799908,koohyojung,푸짐하고 맛있어요!!,2024-03-17,"점심에 방문, 예약 없이 이용, 대기 시간 바로 입장, 데이트, 연인・배우자",음식이 맛있어요,292,1
34799908,neo301,"⭐️방문 전 알아두면 좋은 내용최근 넷플릭스 전현무계획에 나와서 핫해졌고요. 주문 후 30분은 지나야 메뉴 나와요.1. 예약예약 가능하고요. 당일 대기손님은 최대2시간 이용가능오후 5시부터 저녁 시작인데, 토요일 기준 4:20정도 가니 대기1번 받아서 5시 입장했습니다. 5시 되니 예약손님과 대기 1,2번 들어가니 꽉참.이후에 온 분들은 1시간 이상 대기하신듯.*가능하면 예약방문하시고 예약 꽉 찼는데 꼭 가고 싶다? 오픈 40분 전에는 대기하시길. 아직 스마트 예약이나 대기시스템이 없음.2. 맛전복갑오징오흑돼지불고기 맛있어요! 그리고 볶음밥 꼭 드세요. 삼겹찜은 기대보단 쏘쏘. 문어숙회는 아직 못 먹어봄요.3. 주차 사진에 보이는 매장 바로 앞에 1-2대 가능or 옥수영공영주차장",2024-03-16,"저녁에 방문, 예약 없이 이용, 대기 시간 30분 이내, 친목, 일상, 친구",음식이 맛있어요,390,1
34799908,단무지101,저는 예약 없이 저녁 타임 오픈런 해서 갔지만 꼭 예약하고 가시길.... 자리가 진짜 너무너무 별로였어서 ㅠㅠ근데 음식은 참 맛있었습니당😊 특히 오삼불고기 양념이 완전 밥도둑!! 파전도 바삭바삭 오징어도 실하고_ 볶음밥까지 아주 싹싹 긁어먹고 나왔어요🤣💛😋,2024-03-07,"저녁에 방문, 예약 없이 이용, 대기 시간 바로 입장, 일상, 연인・배우자",음식이 맛있어요,788,1
34799908,gardenMAN,맛은 있으나 방송탓인지 손님이 몰려 복잡하기는 저번이랑 마찬가지 이다.  좀 잠잠해지면 가야겠다.   룸은 휀소리 와 전철 지나가는 소리가 나고 옆 테이블과 합석한 분위기라 예민한 분들은 홀에서 식사 추천.  제주산 고등어는 신선하고 잘구워졌다.   파전은이번에도 늦게 나와서 아쉬웠다.  당분간 오래걸리는 메뉴는 빼는게 좋을듯 싶다.    알아서 잘하시겠지만.,2024-03-02,"저녁에 방문, 예약 후 이용, 대기 시간 바로 입장, 가족모임, 연인・배우자",음식이 맛있어요,643,2
34799908,나나루나,깔끔하고  맛있었어요~ 반찬하나하나 신경쓴게보여요~아쉬운건 직원분이 우왕좌왕 하지않으면 좋겠어요~ 테이블이 그렇게 많치않았는데 너무 정신없더라구요~~,2024-03-02,"점심에 방문, 예약 후 이용, 대기 시간 바로 입장, 친목, 친구",음식이 맛있어요,822,1
34799908,gardenMAN,어제 방송 타서 그런지 갑자기 손님들이 모이면서 초반에는 쫌 우왕좌왕 했고 주문도 몇번 미쓰 했지만 어쩌겠나.   가성비는 좋으편이고 양도 많은듯.  다음에는 좀 덜 복잡할때 가봐야 겠다.   주차장 이나 발렛이 없어 많이 아쉽지만 어쩌겠나.,2024-02-17,"저녁에 방문, 예약 후 이용, 대기 시간 30분 이상, 일상, 가족모임, 지인・동료, 부모님, 친척・형제",음식이 맛있어요,643,1
34799908,2나63,부부 세프님들이 다 호텔 출신이시라 그런지 음식도 맛있고 플레이팅도 좋았음,2024-02-17,"점심에 방문, 예약 후 이용, 대기 시간 바로 입장, 친목, 지인・동료",음식이 맛있어요,1362,1
34799908,제로제로1,진짜 맛있고 좋아요!!! 자주 가고싶네용:),2024-01-24,"저녁에 방문, 예약 없이 이용, 대기 시간 바로 입장, 일상, 연인・배우자, 부모님",단체모임 하기 좋아요,1987,1
34799908,맛있는건못참치롱,갑오징어도 실하고 진짜 맛있게 잘 먹었어요,2024-01-19,"저녁에 방문, 예약 후 이용, 대기 시간 바로 입장, 친목, 친구",음식이 맛있어요,206,1
34799908,한선희19,음식이 맛나요~,2024-01-18,"점심에 방문, 예약 없이 이용, 대기 시간 바로 입장, 회식, 연인・배우자",음식이 맛있어요,629,1
34799908,사랑맘포에버,굿,2024-01-16,저녁에 방문,음식이 맛있어요,947,1
34799908,연주몬,"음식은 맛있어요. 인공적인 조미료를 쓴 맛이 아니라 정말 담백 하고 맛있어요. 다만 여성 알바분, 딸이신지 뭐 모르겠는데 음식 주실때마다 테이블에 툭툭 올리고 더 달라 그랬더니 테이블 모서리에 툭 올려놓고.가족이라 잘릴 걱정 없어서 그러신건지 모르겠는데 왜 그렇게 서비스 하시는건지 전 이해가 안가네요.돈내고 밥 먹으러 간건데 서비스가 이런건 다시 오지 말란건지 뭔지",2023-12-27,"저녁에 방문, 예약 없이 이용, 대기 시간 바로 입장, 데이트, 연인・배우자",음식이 맛있어요,619,1
34799908,linda김22,"작년 모임을 이 곳에서 했는데 올해도 다시 왔네요.문어삼겹찜세트(79,000원)와 갑오징어파전(23,000원)을 시켰어요.먹기 전에는 비주얼에 감탄했고 먹고 나서는 오득오득 씹히는 식감에 감동 😭 완도산 문어와 제주흑돼지 삼겹도 좋았지만 함께 곁들여 나온 장아찌가 훌륭했어요.또 밑반찬은 뭐니? 버릴 것이 없는 밑반찬 맛집💕메인요리부터 밑반찬까지 싹쓸이 했다는~~^^갑오징어파전은 겉바속촉하고 오이고추가 아삭하고 좋았어요.막걸리까지 마시니 굿굿👍추위에 떨었던 몸이 막걸리 한잔에 싹~ 풀리네요.20대의 찬란했던 시절의 친구들을1년만에 같은 곳에서 만나니 참 좋았습니다.음식까지 맛있고 더 할 나위없이 행복했네요.",2023-12-16,"점심에 방문, 예약 후 이용, 대기 시간 바로 입장, 친목, 나들이, 지인・동료",음식이 맛있어요,467,1
34799908,있는그대로솔직히,컨셉도 좋고 분위기도 괜찮은데 오삼불의 오징어는 맛있었으나….제주흑돼지가 너무 얇고 정말 별로였다,2023-11-24,저녁에 방문,친절해요,41,1
34799908,kmc****,ㆍ,2023-11-17,"저녁에 방문, 예약 후 이용, 대기 시간 바로 입장, 친목",음식이 맛있어요,1922,1
34799908,0soos3,10년 내공이 보이네요..음식 먹고 감동하긴 처음입니다 부부요리단 최고 ❤️!!,2023-10-30,저녁에 방문,음식이 맛있어요,9,2
34799908,dayeon75,"옥수역 숨은 맛집이에요. 밑밭찬도 골고루 잘 나와서 좋아요. 메인 메뉴인 오삼불은 오징어도 많이 들어가 있고 버섯이랑 고기, 떡도 많이 들어가 있어서 너무 맛있어요. 양도 넉넉하게 주시고 오삼불 다 먹고 마무리로 볶음밥까지 먹어주면 👍사이드 메뉴인 파전과 문어숙회도 맛있어요. 파전에 들어가는 파랑 오징어가 많이 들어가 있어요. 문어숙회는 문어가 튼실하니 맛있습니다. 술도 다양하니 즐기기 좋습니다. 우리나라 술도 있어서 좋아요. 여사장님 유쾌하시고 친절하십니다. 직원들도 친절합니다.😄",2023-10-26,저녁에 방문,음식이 맛있어요,1,1
34799908,yoons1000,"단품메뉴도 아닌데  처음부터 인원수 대로 음식을 주문해야 한다고 하니 기분이 좀 않좋았습니다. 문어 삼겹(79,000원)을 2인분으로 계산하시니까 필요이상으로 많이 시켜 음식만 남기게 됩니다.메뉴판에  문어 삼겹은 몇인분인지  표기가 없는데 오삼처럼  2인분 79,000원이라고  표기해 주시기 바랍니다.",2023-10-23,저녁에 방문,음식이 맛있어요,1,1
34799908,Foooooooooooood,소문듣고 왔는데.. ㅠ다른말은 안하겠습니다..사진에 주방후드;;;;검은기름 뚝뚝 음식에 다 떨어지다 못해 머리에도 떨어질텐데…………쉐프 아니라고 해주세요….제발…,2023-10-20,저녁에 방문,,77,1
34799908,umj****,좋아요 음식이 맛있어요,2023-10-14,저녁에 방문,음식이 맛있어요,486,1
34799908,고기뷔페깻잎도둑,"옥수역 7번 출구 앞 현대아파트 가는 길 방면 골목에 위치한 한식 요리 주점입니다. 가게 상호명과 메뉴에서 알 수 있듯 제주산 흑돼지와 해산물을 다양하게 요리해내옵니다. 일단 이집은 밑반찬으로 나오는 반찬들 마저 허투로 놓치기 어려운 세심함을 뽐냅니다. 따뜻하게 나오는 반찬에 한잔 기울이고 있으면 메인들이 나오는데 문어에 놓인 깻잎엔 기름과 날치알이 버무려져 곁들이는데 특색을 주며, 보쌈은 부드럽고 찰진데 갓김치, 목이버섯장아찌와 먹으면 또 새로운 맛을 즐기게 해줍니다. 백미는 역시 불고기인데 갑오징어와 흑돼지가 조화롭게 만들어주는 양념에  볶아져 일품입니다. 갑오징어가 어찌나 통통하고 부드러운지 리뷰를 쓰면서도 자꾸 생각나네요. 조만간 또 방문할 예정입니다.",2023-10-13,저녁에 방문,양이 많아요,353,1
34799908,혼밥대식가,옥수역 맛집입니다,2023-10-10,"저녁에 방문, 예약 없이 이용, 대기 시간 바로 입장, 친목, 지인・동료",음식이 맛있어요,829,1
34799908,jam****,음식이 참 고급져요~ 특별한 날 한끼식사 추천입니다~,2023-09-30,점심에 방문,주차하기 편해요,353,1
34799908,Interviewer 면접관,,2023-09-27,저녁에 방문,음식이 맛있어요,208,1
34799908,오드리2151,좋아여,2023-09-22,저녁에 방문,음식이 맛있어요,661,1
34799908,냠냠뇸뇸뇸냠냠,가격대가 있는 편이지만 재료가 신선하고 반찬이 잘나와요! 양념맛이 달지않고 재료에 집중된곳!,2023-09-17,점심에 방문,음식이 맛있어요,45,1
34799908,썬보라,"친구가 추천해서 간곳인데 정갈한 밑반찬과 메인,볶음밥까지 다 맛있어요. 공간이 분리되어 있고 컨셉있어서 분위기 좋네요. 주말 저녁엔 손님이 많아요.",2023-09-16,저녁에 방문,특별한 날 가기 좋아요,601,1
34799908,럽신,예약하기 힘든곳인데 운 좋게 한자리가나서 다녀왔습니다. 진황제 먹었는데 다음에기회되면 오삼불이 한번 먹어보고 싶네요^^마침 간 날 연예인도 있는걸 보니 유명한 집은 맞는 것 같네요.,2023-09-08,저녁에 방문,음식이 맛있어요,1854,1
34799908,jhp****,굿,2023-08-20,저녁에 방문,,1235,1
34799908,리버2454,굿,2023-08-20,저녁에 방문,,1086,1
34799908,JJ4234,,2023-08-17,저녁에 방문,음식이 맛있어요,1476,1
34799908,먹고죽은귀신때깔도좋대,"지인 추천으로 방문하게된 부부요리단. 푸짐한 오징어제육, 파전, 볶음밥 먹고 92,000원 나왔습니다.밥집이라기 보다는 반주하면서 밥먹기 좋은 집이에요. 저렴한 가격은 아니지만, 그래서인지 해물이 신선하다는 느낌이었고, 정갈한 세팅이 마음에 들었습니다.주차는 가게앞 노상공영주차장, 또는 골목에다가 눈치껏 주차하셔야 해요.",2023-08-15,"저녁에 방문, 예약 없이 이용, 대기 시간 바로 입장, 친목, 나들이, 친구",음식이 맛있어요,213,1
34799908,수지구공일칠,메인인 오삼불고기 뿐 아니라 각종 반찬과 볶음밥까지! 흑돼지라고 해도 가격대가 좀 높다고 생각했는데 구성과 맛을 보면 인정할 수 밖에 없습니다. 구비해놓으신 주류도 다양해서 저녁에 반주 걸치기 좋은 집입니다.,2023-08-11,저녁에 방문,음식이 맛있어요,494,1
34799908,만두먹는하마63,정말 너무 맛있고 재료도 신선한거 같습니다 지인들이 왜 자꾸 이곳을 들리라고 하는건지 알거같네요 ㅎㅎ 뷰도 너무좋고 참 좋은거같아용 ㅎㅎ,2023-08-09,저녁에 방문,뷰가 좋아요,207,1
34799908,만두60668,최고의 가게입니다 단골될거같아요 ㅎㅎ 음식퀄리티가 정말 뛰어나구여 밑반찬들도 맛있습니다 ㅎㅎ 사장님께서 참 친절하게 응대 잘해주시네요~~ 다음에 또올겁니다!!,2023-08-09,저녁에 방문,특별한 날 가기 좋아요,178,1
34799908,mih****,반찬도 맛있고 음식이 맛있어요,2023-08-05,점심에 방문,음식이 맛있어요,1064,1
34799908,sj3945044,음식이 너무 맛있었어요! 사장님도 정말 친절하시고 재방문 의사 100퍼센트,2023-08-04,점심에 방문,친절해요,14,1
34799908,강한란 아띠라니,젊은 사장님의  미소가  가게의 분위기를 업시켜네요음식도 맛있어요이차로 간단히게  술  한잔 해도 배부르지않게 먹을수 있어요,2023-08-03,저녁에 방문,음식이 맛있어요,326,1
34799908,조은무나,부부요리단 최고입니다..자주올께요,2023-08-03,저녁에 방문,가성비가 좋아요,492,1
34799908,ㅌㄹㅇㅌㄹㅇ,음식이 정갈해서 너무 좋았어요!저녁이라 웨이팅도 있지만 역시 믿먹!!!,2023-08-02,저녁에 방문,친절해요,101,1
34799908,최병문대표 한국재무,옥수동의 아담한 맛집. 가성비도 좋고 가정식 백반처럼 정갈하게 나옵니다,2023-07-30,저녁에 방문,가성비가 좋아요,1020,1
34799908,규통,반찬도 완전 정갈하고 깔끔해서 너무 좋아요!! 같이 나오는 미역국도 맛있음!!  갑오징어흑돼지볶음 먹었는데 갑오징어 엄청 부드럽고 통통해요 ! 깻잎이랑 콩나물 같이 싸먹으면 존맛탱! 꼭 날치알 볶음밥 추가하세유 👍🏻👍🏻,2023-07-29,점심에 방문,친절해요,654,1
34799908,syn****,비쥬얼 보세요 크으ㅠㅠ 반찬도 깔끔 + 먹을만큼만 주셔서 남길 부담도 노노  + 매우신분들을 위한 센스 !! 갑오징어는 얼마나 부드럽게요. 흙돼지는 드시면 눈물 납니다ㅠㅠ 단골집 쾅쾅,2023-07-29,점심에 방문,가성비가 좋아요,106,1
