place_id,nickname,content,date,situations,keywords,review_count,visit_count
1584576344,mingggz,커틀렛이 먹어보고 싶었는데 재료소진으로 못 먹어서 아쉬웠어요~ 담엔 조금 더 일찍 가서 먹어보려구요~ 기대하지 않았던 리조또가 너무너무 맛있었어요😁 스파이시 파스타는 약간 매운데 계속 먹게 되는 맛이었어요👍 담에 또 방문할게요😆,2024-10-04,"저녁에 방문, 예약 없이 이용, 대기 시간 바로 입장, 데이트, 연인・배우자",인테리어가 멋져요,1286,1
1282258672,GGgGyu,"불친절. 다시는 절대 안 감.1. 자리 안내하는데 앞치마 안에 손을 넣고 배를 긁으며 귀찮다는 듯이 응대하시고, 같이 간 사람은 뭐라고 하는지 듣지도 못함.2. 서빙할 때 음식을 테이블에 던지듯이 툭 두고 감.3. 밥 먹는 바로 옆 벽면에 머리카락이 붙어 있음.이번이 두 번째 방문인데, 첫 방문 때도 비슷하게 응대했던 걸 보면 사장님은 평일 오후 알바생분 재교육하셔야 할 듯. 음식 맛과는 상관없이 직원의 불친절한 태도 때문에 다시는 안 감.",2025-03-26,"저녁에 방문, 예약 없이 이용, 대기 시간 바로 입장, 데이트, 연인・배우자",,5,1
1282258672,못말려,"피자, 파스타 다 맛있었어요~ㅎㅎㅎ",2025-03-23,"점심에 방문, 예약 없이 이용, 대기 시간 30분 이내, 데이트, 연인・배우자",음식이 맛있어요,220,2
1282258672,맛잘알쩝쩝박사먹돌먹순,"1,2번 사진이 전에 방문해서 제가 찍은 사진3,4,5번 사진이 어제 사진입니다...메뉴도 변하고 맛도 피자 토핑양이 눈에 띄게 변해서 넘 실망이에요.. 예전에는 피자가 크진않아도 위에 흘러내릴듯 촉촉하게 바질이 올라가있었는데 어제는 희끗희끗 마른 도우가 눈에 띄네요🤔😢예전부터 맛있어서 지인들 데리고 여러번 재방문 했던 곳이였는데 사장님이 바뀐건지,, 아쉬움이 남네요",2025-03-10,"저녁에 방문, 예약 후 이용, 대기 시간 바로 입장, 친목, 지인・동료",,301,2
1282258672,민트폴로,맛있어요,2025-03-01,"저녁에 방문, 예약 없이 이용, 대기 시간 30분 이내",음식이 맛있어요,995,1
1282258672,어부열,바르셀로나는 엄청짜고 트러플크림은 느끼해서 둘이 잘어울려요 잘 먹었오요,2025-03-01,"점심에 방문, 예약 없이 이용, 대기 시간 바로 입장, 데이트, 연인・배우자",음식이 맛있어요,1066,1
1282258672,옥이이모,도우가 진짜 쫄깃하고 식감 미쳤음요.본 식사 전에 간단하게 피자 한판에 콜라 마실거라 우연히 들린 곳이었는데 대박 화덕피자 맛집이었음!!,2025-01-25,"점심에 방문, 예약 없이 이용, 대기 시간 바로 입장, 나들이, 일상, 친척・형제",룸이 잘 되어있어요,833,1
1282258672,yb8741,"1번사진이 바뀌기 전(2024.07), 2번3번이 바뀐 후(2025.1.19)사진만 봐도 아예 다른 피자입니다. 최고의 맛에서 최악의 맛이 됐습니다.바질페스토는 풋내가 심하고 간이 하나도 맞지 않으며 치즈는 따로 노는 맛이고 어울리지가 않습니다. 빵도 밀가루 냄새가 많이 났습니다.그나마 얘보다 나았던 버섯 리조또의 수란에서는 계란 껍질이 나왔습니다....이전맛을 기대하고 가신 분들은 매우 실망하실 것이라고 생각합니다.",2025-01-19,"저녁에 방문, 예약 없이 이용, 대기 시간 바로 입장, 데이트, 연인・배우자",,23,1
1282258672,얌8620,리조또 뭔가 맛이 미묘한데 ㄱㅊ했음대체적으로 느끼한 음식들만 시킨거같다 근데 맛있어요,2025-01-18,"점심에 방문, 예약 없이 이용, 대기 시간 30분 이내, 나들이, 친구",음식이 맛있어요,409,1
1282258672,shining7,작년에 와보고 올해 첨이에요역시 맛나네요 피자도 맛나고 파스타도 굿굿^^담에 또 올께요 😀,2025-01-18,"점심에 방문, 예약 없이 이용, 대기 시간 바로 입장",음식이 맛있어요,56,1
1282258672,송준영5456,응대도 친절하고 피자는 진짜 맛있었는데파스타가.. 특히 비스크 파스타는 색부터 야끼소바 색이고 맛은 내장 특유의 비린내랑 쓴맛이 너무나서 이걸 돈받고 파는게 맞나? 라는 생각이 들정도로 심각했습니다. 담부터 파스타는 절대 안시킬것 같아요.,2025-01-14,"저녁에 방문, 예약 없이 이용, 대기 시간 바로 입장, 데이트, 연인・배우자",인테리어가 멋져요,6,1
1282258672,len****,피자맛집!! 따듯한 가정집인테리어가 너무 예뻐서 기분도 너무 좋았습니다 게다가 콜키지프리라니!!!! 다음에 이용할땐 와인한병 가져가려구요,2025-01-12,"저녁에 방문, 예약 없이 이용, 대기 시간 10분 이내, 데이트, 연인・배우자",음식이 맛있어요,5,1
1282258672,eunnnnd,"뚝섬에서 가까운 맛집이라고해서 찾아갔는데, 가정집을 개조해서 그런지 매장이 예쁘더라구요. 데이트할때도 분위기 있어서 좋을 것같아요. 마스카포네랑 아마트리치아나(약간 매운 토마토파스타) 이 두가지를 가장 많이 주문 하는 것같아서 시켰는데,,, 진짜 존맛탱ㅜㅜ 도우도 쫀득하고 마스카포네 치즈 달달하니 맛나용 ㅎㅎ 살짝 느끼하다 싶어서 아마트리치아나 먹으면 조합이 좋더라구요!!! 친구는 와인안마셔서 저만 주문해서 마셨는데, 하프보틀 사이즈 있어서 딱이었어용🫶🏽 운좋게 대기없이 바로 들어갔는데, 들어오니까 자리 거의 다 찼어용 ㅎㅎ 성수 다른 가게는 좀 비싼편인데,, 누메로도스는 이만큼 합리적인 가격으로 밥먹을 수 있다니…!!! 자주 올 것같아요~~~",2025-01-12,"점심에 방문, 예약 없이 이용, 대기 시간 바로 입장, 친목, 나들이, 친구",친절해요,13,1
1282258672,꿈하늘바람,아주 맛 있었어요.분위기도 독특했어요,2025-01-12,"점심에 방문, 예약 없이 이용, 대기 시간 바로 입장, 친목, 친구",음식이 맛있어요,742,1
1282258672,Slower38,방으로 되어있어서 분위기 엄청 아늑해요 소모임하기에 딱이에요!! 음식도 한꺼번에 센스있게 나와서 사진찍기도 좋아요ㅎㅎ 재료 다 너무 신선하고 왜 유명한지 알겠어요 맛있어서 또 방문 예정입니다! 아 마스카포네피자는 꼭 먹어봐야함ㅎㅎ,2025-01-11,"저녁에 방문, 예약 없이 이용, 대기 시간 30분 이내, 친목, 친구, 지인・동료",재료가 신선해요,22,1
1282258672,sod****,마스카포네 피자가 너무 맛있어요 크립치즈가 바질페스토랑 너무 궁합이 잘맞아요 존맛탱입니다 봉골레 파스타 간도 딱좋고 조개도 맛있어요 재방문 의사 또 있어요 사장님 다음에는 다른 피자랑 리조또 해치우러 갈께요!!,2025-01-11,"점심에 방문, 예약 없이 이용, 대기 시간 30분 이내, 친목, 나들이, 친구",음식이 맛있어요,4,1
1282258672,zz****,와  먹느라사진한장도못찍었네요 옛날에와봤지만   더욱더 맛있어진거같아요 역시마수카포네의 근본 누메로도스 그의짝궁 아마트리치아나..이건 둘다 식혀서먹어야 더맛있는거같아요 (갠취)두명이가서 두개만시켜도 배터질거같은한 양 요즘시대에 이정도가성비라면 맨날먹고싶네요 ㅠ번창하십쇼 그럼이만 ㅂㅇ,2025-01-10,"저녁에 방문, 예약 없이 이용, 대기 시간 바로 입장, 데이트, 연인・배우자",인테리어가 멋져요,5,1
1282258672,1234569425,서울 여행 와서 먹은집인데 최악이었습니다ㅠ서울에서는 피자의 의미가 좀 다른가요..정말 얇은 또띠아 위에 토마토 소스 뿌려놓은 느낌인데 피자를 들면 위에 소스가 줄줄 흘러서 숟가락으로 소스 떠서 먹어야해요 제가 생각한 피자가 아니라 정말 당황했고 겉 부분도 너무 탄채로 주셔서 좀 그랬습니다;파스타는 먹을만 했지만 조개들 간이 하나도 안되어있었고 따로 노는 느낌이었습니다. 웨이팅 안하고 먹어서 그냥 그러려니 했지만 웨이팅 까지 하고 먹었으면 많이 화났을거 같습니다.,2025-01-08,"점심에 방문, 예약 없이 이용, 대기 시간 바로 입장, 여행, 친구",,17,1
1282258672,uzzena,피자 리조토 다 맛있게 먹었어요~! 대파크림리조토 독특하고 양도 많았습니다!,2025-01-04,"점심에 방문, 예약 없이 이용, 대기 시간 바로 입장, 친목, 친구",음식이 맛있어요,850,1
1282258672,딸기맘3037,ㅎ,2024-12-25,점심에 방문,음식이 맛있어요,1867,1
1282258672,eeeeee s,양이 많지는 않아요 ~~ 맛있어요.,2024-12-24,점심에 방문,음식이 맛있어요,480,2
1282258672,wecango,피자 진짜 맛있어요!! 직원분들도 친절하십니다👍🏻,2024-12-20,"저녁에 방문, 예약 없이 이용, 친구",친절해요,160,1
1282258672,롤리26,좋아요,2024-12-17,"저녁에 방문, 예약 없이 이용, 대기 시간 바로 입장",음식이 맛있어요,539,1
1282258672,승응53,"피자는 소스 맛이 너무 세고, 파스타는 면이 고등어와 어우러지지 않고, 리조또는 첫입이 제일 맛있었지만 취향 차이라고 생각했는데 다른 테이블에서 케찹 없냐고 물어봤을 때 ‘그런 거‘ 없다고 하는 응대나 영수증 달라고 하니 주머니에 구겨놨던 거 그대로 주는 응대가 많이 많이 많이 아쉬웠습니다 ~~~🍀",2024-12-08,"점심에 방문, 예약 없이 이용, 대기 시간 바로 입장, 친목, 친구",음료가 맛있어요,15,1
1282258672,흔지흔지,성수 / 뚝섬 근처 오면 꼭 가는 곳!사장님이 간을 기가막히게 맞추셔서 항상 만족하면서 먹고 갑니다! 이탈리아 음식 먹고 싶을 때 항상 생각나는 곳이에요! 조만간 또 가겠습니다~,2024-12-07,"저녁에 방문, 예약 없이 이용, 대기 시간 바로 입장, 데이트, 연인・배우자",음식이 맛있어요,263,1
1282258672,다연86,진짜 파스타 3개의 종류 먹어보고 대파크림 머시기 리조또도 먹었는데 진짜 너무 맛이 심하게 맛없음파스타 다른 맛집들 시장조사도 안해보신 느낌?면수의 맛이 그대로 나고 면도 익지 않고 간 하나도 안되어있소 죄다 비리고 맛이 너무 너무너무너무 없음사장님 불러서 간보셨냐고 여쭈었는데도 확신없는 대답이 돌아오는 이유가 있음진짜 리뷰를 이렇게 까지 안남기려 했는데 심해도 너무 맛없음의 극치임 ..피자는 진짜 개맛있는디 파스타랑 리조또는 왜 이모양이지..?엔초비 파스타 봉골레 파스타 무슨 뻘건 파스타도 셋다 먹었디만 셋다 한젓가락 먹고 버림 내 입맛이 이상한게 아니라 세명의 직장동료들이랑 두번을 방문했는데 다 한젓가락 먹고 휴지에 뱉음 레전드로 맛없는 파스타 드디어 찾음 ..피자만 먹으러 가야게쑴 ..,2024-12-06,"점심에 방문, 예약 없이 이용, 대기 시간 바로 입장, 비즈니스, 지인・동료",인테리어가 멋져요,40,1
1282258672,azure J,"성수에서 화덕피자로 유명한 누메로도스(&누메로뜨레쓰)시그니처라 할 수 있는 바질마스카포네치즈 피자와 샐러드, 파스타 모두 빠른 조리와 서빙 덕분에 브레이크 타임 전, 여유롭게 식사 가능했습니다.(여기 전체적으로 메뉴 선정 실패 없었고, 아무래도 화덕에서 구워내는 피자류가 top!!!!)그동안은 주로 누메로뜨레쓰에서 식사를 했는데, 그때 방문했던 기억들이 좋아 누메로도스도 방문을 하게 되었습니다! 분위기는 누메로도스가 조금 더 감성적인… 😊😊라스트 오더 시점에는 캐치테이블 예약 막아두셔도 괜찮을 듯 합니다!",2024-12-03,"점심에 방문, 예약 후 이용, 대기 시간 바로 입장, 데이트",음식이 맛있어요,46,1
1282258672,밥보04,맛있어요,2024-11-30,"저녁에 방문, 예약 없이 이용, 대기 시간 바로 입장, 여행, 혼자",음식이 맛있어요,527,1
1282258672,승단단,오랫만에 방문했어요 여전히 맛집-연말약속장소로는 항상 누메로도스가 떠오르네요아늑하고 따듯한분위기에 맛도 가격도 좋아요,2024-11-30,"점심에 방문, 예약 없이 이용, 대기 시간 바로 입장, 일상, 친구",음식이 맛있어요,51,1
1282258672,청개구리4928,불편함과 기다림을 이기는 음식복잡한 내부 구조 때문에 주문 받길 5분 넘게 기다리가 카운터로 가서 주문하려니 여기서 주문하지 마시고 가서 앉아계시면 주문 받을게요. 하시고직원분은 오지 않으셨다......또 자리에서 무한정 기다리다가 결국 해당 직원분은 오지 않으실거 같아서 다른 테이블 서빙하러 오신 직원분께 주문하고 받은 음식은 진짜 너무 맛있는데...내부 소리가 조금 울리고 오른쪽 창가 구역은 테이블 간격이 좁은 터라 조금 붐비는 느낌은 아쉬웠다,2024-11-18,"저녁에 방문, 예약 없이 이용, 대기 시간 바로 입장, 친목, 친구",음식이 맛있어요,42,1
1282258672,딩구90,버섯 구워진 게 예술이네~,2024-11-17,점심에 방문,음식이 맛있어요,2402,1
1282258672,애기콩미니,화덕피자 진짜 맛있어요~~ 진짜 꼭 드세요~~,2024-11-16,"저녁에 방문, 예약 없이 이용, 대기 시간 바로 입장, 친목, 친구",인테리어가 멋져요,692,1
1282258672,해피데이1678,"모처럼 맘먹고 피자, 파스타 먹으러 나왔다가 큰실망만 했네요. 마르게리따피자는 소금맛이.두드러져.짜고 토마토소스 신맛이 위로 치고올라와 중간에 못미치는 맛이었고 봉골레파스타도 실망스럽기가 간도 제대로 못마추고 이런가게를 한다는게 이해가 안갑니다. 다른 리뷰에 맛있단는글도 이해안가구요",2024-11-16,"점심에 방문, 예약 없이 이용, 대기 시간 바로 입장, 데이트, 연인・배우자",,31,1
1282258672,유스티나78,금요일 한시정도 갔는데 대기 없이 바로 입장 했어요대표 메뉴 마스카포네랑 고등어 파스타 먹었어요피자 도우 너무 쫄깃 하고 맛있어요고등어 파스타는 색다르게 맛있었어요느끼 할 수 있는데 샹그리아로 입가심 좋았어요,2024-11-15,점심에 방문,음식이 맛있어요,131,1
1282258672,메리벨20,,2024-11-10,저녁에 방문,음식이 맛있어요,2051,1
1282258672,뽀미8777,맛있네요,2024-11-10,점심에 방문,음식이 맛있어요,491,1
1282258672,bri****,5인에서 빙문했는데 대기시 2인 테이블 니오면 뒤늦게온 손님 먼저 입장시켜주십니다 피크타임에 제한시간도 없는듯 하여 2인이상 빙문시에는 대기가 한없이 길어지네요. 음식은 먹을만한 정도 였지만 봉골레 파스타는 너무너무 맛이없었어요. 직원분들도 친절하진 읺구요. 벨이 없어서 직원 부르기도 힘들었습니당,2024-11-09,"저녁에 방문, 예약 없이 이용, 대기 시간 1시간 이상, 친목, 친구",인테리어가 멋져요,3,1
1282258672,eatandplay,"일요일 5시쯤 방문해서 웨이팅 없이 입장했어요~깔조네, 포르치니 리조또, 봉골레 파스타 주문했어요깔조네는 처음 먹어보는데 마스카포네 치즈가 부드럽고빵이 정말 맛있어요!! 피자 도우맛집-!포르치니 리쪼도는 짭쪼름했고 수란이 올라가서 독특했어요봉골레에 가리비가 부드럽고 면의 익힘도 적당했어요~와인 한 병은 콜키지 프리라서 옆에 와인샾에서 사서 방문해도 좋을 것 같아요🙂",2024-11-03,저녁에 방문,음식이 맛있어요,450,1
1282258672,원북이2,음식이 특히 피자가 너무 짭잘하고 맛있어요!,2024-11-03,"점심에 방문, 예약 없이 이용, 대기 시간 바로 입장, 데이트, 혼자",음식이 맛있어요,412,1
1282258672,도치필름,성수동에 올 일이 있어서 식사를 하게 되었다 고등어가 들어간 특이한 파스타가 있어서 먹어봤는데 개인적으로 좀 많이 비려서 먹기 어려웠다. 깔끔한 인테리어에 일반적인 양식집 정도의 분위기를 지니고 있다.,2024-11-02,"저녁에 방문, 예약 없이 이용, 대기 시간 바로 입장, 데이트, 일상, 친구",특별한 메뉴가 있어요,214,1
1282258672,욕심공장,"네이버에는 1번째 방문으로 뜨지만, 몇년전부터 성수동 올때마다 방문했던 N번째 또간집 단골입니다! 최근에 연달아 방문하면서 5가지 메뉴 맛봤어요! 2분이서 데이트를 온다면 꼭 피자를 하나 드셔보세요! 뻔한 모짜렐라 말고 크림같은 치즈의 식감을 꼭 느껴보셔야 합니다. (특히 깔조네 추천!) 도우가 씹을수록 고소하고, 이탈리아에서 먹었던 화덕피자의 느낌이랑 제일 비슷했어요. 파스타도 맛있지만, 리조또도 예술이예요. 잡곡이 살짝 섞여서 식감이 재밌습니다. 대파 크림보다는 포르치니 식감이 더 좋았네요. 둘다 치즈가 들어가서 다른 하나는 느끼하지않은 걸로 시키면 좋아요. 여기는 가지그라탕도 맛있고, 파스타는 말해뭐해?! 다 맛있으니까 다 드셔보시는거 추천합니다. 소개팅하시는 분들도 많을만큼 분위기도 조용해요.",2024-10-30,"저녁에 방문, 예약 없이 이용, 대기 시간 바로 입장, 데이트, 연인・배우자",음식이 맛있어요,382,1
1282258672,shin0305,어머니랑 같이 방문했는데 맛있다고 좋아하셔서 행복했어요 ㆅ🩷,2024-10-28,"저녁에 방문, 예약 후 이용, 대기 시간 바로 입장, 일상, 부모님",친절해요,48,1
1282258672,jijiji118,좁아요,2024-10-20,점심에 방문,,1412,1
1282258672,마을의 천연비타민,봉골레파스타와 마스카포네피자를 주문.. 누메르도스의 시그니처 메뉴인 마스카포네는 바질향과크림의 조화가 식욕을 더 돋구어주며 겉은 파삭하고 속은 부드럽고 씬피자가 주는 깔끔함에 자주 올것같은 예감.,2024-10-10,"점심에 방문, 예약 후 이용, 대기 시간 10분 이내, 일상, 아이",음식이 맛있어요,1186,1
1282258672,끄르르륵61,피자가 정말 맛있어요! 봉골레도 맛있어요ㅎㅎ 피자때문에 또 오고싶은곳입니다 피자도우 바삭함이 킥이네요❤️,2024-10-10,"점심에 방문, 예약 없이 이용, 대기 시간 바로 입장, 나들이, 부모님",음식이 맛있어요,43,1
1282258672,금융어린이,이번 주만 2번째 왔습니다!피자도 존맛입니다 :) 개인적으로는 첫번째 사진에 있는 피자 정말 맛있게 먹었습니다!,2024-10-10,"점심에 방문, 예약 후 이용, 대기 시간 바로 입장, 일상, 지인・동료",음식이 맛있어요,446,2
1282258672,sea46,직원분들이친절하고 음식진짜맛있어요~,2024-10-05,"점심에 방문, 예약 없이 이용, 대기 시간 바로 입장, 친목, 친구",음식이 맛있어요,290,1
1282258672,금융어린이,"정말 오랜만에 왔는데 여전히 맛있네요!성수동 파스타, 피자 등 데이트 장소 찾으신다면 추천드립니다!",2024-10-04,"점심에 방문, 예약 없이 이용, 대기 시간 바로 입장, 일상, 지인・동료",음식이 맛있어요,446,1
1282258672,운이매우좋다,음식도 맛있고 분위기도 좋아요~~,2024-09-16,"저녁에 방문, 예약 없이 이용, 대기 시간 바로 입장, 일상, 친구",음식이 맛있어요,489,1
1282258672,917kk,파스타는 평범한데 피자 쫀득하고 맛있었어요! 양이 많은 편은 아니여서 아쉽네요ㅜㅜ,2024-09-09,"저녁에 방문, 예약 없이 이용, 대기 시간 바로 입장",인테리어가 멋져요,163,1
1282258672,칸타빌레나빌레라,굿,2024-09-08,"점심에 방문, 예약 없이 이용, 대기 시간 바로 입장, 친목, 지인・동료",음식이 맛있어요,938,1
1282258672,IST,맛나용,2024-09-07,저녁에 방문,음식이 맛있어요,781,1
1282258672,ghkdlxldgodiwl,항상 맛있게 먹어용!!! 🫶🏻🫧,2024-09-06,"저녁에 방문, 예약 없이 이용, 대기 시간 바로 입장, 데이트, 연인・배우자",음식이 맛있어요,420,2
1282258672,limwoo99,파마넬라 샐러드 독특하고 맛있어요^^,2024-08-30,"점심에 방문, 예약 없이 이용, 대기 시간 바로 입장, 친목, 친구",음식이 맛있어요,2491,1
1282258672,박박박3,대표피자가 제일 맛있었고 나머지 종류는 그냥 무난한 맛이였던 것 같아요,2024-08-27,"저녁에 방문, 예약 후 이용, 대기 시간 바로 입장",음식이 맛있어요,935,1
1282258672,Jessica3677,너무너무 맛있어요ㅜㅠ분위기도 좋고 데이트 하기 좋은데공간때문인지 너무 시끄러운 테이블 한군데가 있어서상당히 신경쓰이고 거슬렸네요칼쪼네도 맛있었는데특히!!쉬림트 까넬로니가 정말 맛있었어요이거 때문에 무조건 다시 갈 예정입니다👍👍,2024-08-20,저녁에 방문,음식이 맛있어요,1023,1
1282258672,피자먹짱,진짜 대박 맛있어요 피자 먹으러 한 세번째 방문인거 같아요 또갈거에요.... 파스타도 맛있고 너무 좋음,2024-08-12,"저녁에 방문, 예약 없이 이용, 대기 시간 30분 이내, 친구",음식이 맛있어요,682,1
1282258672,인성터진보노보노51,바질피자 너무너무 맛있음,2024-08-12,"저녁에 방문, 예약 없이 이용, 대기 시간 바로 입장, 데이트, 친구",음식이 맛있어요,38,1
1282258672,shoonkim,"지나갈 때마다 가본다 가본다 하고 지나쳤던 곳을 드디어 가 보았습니다. 이름 그대로 이탈리안 음식점이고, 음식이 맛있습니다. 근처의 Bacci 대비 캐쥬얼하고 가정식 같은 곳입니다. 와인 리스트가 조금 빈약한 느낌인데, 대부분 고객이 술마시지는 않는 고객분들로 보여 괜찮을지도 모르겠네요.",2024-08-03,"점심에 방문, 예약 없이 이용, 대기 시간 바로 입장, 데이트, 연인・배우자",음식이 맛있어요,20,1
1282258672,드커니,누메로도스 2번째 방문최애 메뉴 낙찰! 대파크림리조또🥰,2024-07-29,"점심에 방문, 예약 없이 이용, 대기 시간 바로 입장, 일상, 지인・동료",음식이 맛있어요,259,1
1282258672,3000일굶은루피,맛있어요!!! 재고 없어서 서비스로 샐러드도 받았는데 맛있게 잘 먹었습니당 ㅎㅎㅎ,2024-07-23,저녁에 방문,,478,1
1282258672,작은먼지처럼,웨이팅없이 운좋게 들어갔어요 맛있어요!,2024-07-14,"점심에 방문, 예약 없이 이용, 대기 시간 바로 입장, 친목, 친구",음식이 맛있어요,284,1
1282258672,gydms20,누메로뜨레쓰에서 처음 먹어보고 누메로도스왔는데 역시나 피자 맛집 ㅠㅠ 남자친구가 바질을 잘 못먹어서 프로슈토 주문해서 먹어봤는데 이것도 맛있네요ㅠㅠ 파스타도 도전해봤는데 봉골레 애호박이 들어가서 오잉? 했는데 생각보다 궁합이 좋더라구요? 피자는 간이 좀 짰는데 봉골레가 생각보다 간이 약해서 같이 먹기 괜찮았어요☺️,2024-07-14,"점심에 방문, 예약 없이 이용, 대기 시간 바로 입장, 데이트, 연인・배우자",인테리어가 멋져요,41,1
1282258672,새냐,배부르고 맛잇어요,2024-07-14,"점심에 방문, 예약 없이 이용, 대기 시간 바로 입장, 친목, 친구",음식이 맛있어요,165,1
1282258672,미니잭슨,피자 도우가 생각보다 더 얇았는데 맛있었어요👍,2024-07-03,"점심에 방문, 예약 후 이용, 대기 시간 바로 입장, 친목, 친구",인테리어가 멋져요,118,1
1282258672,woozza,조아용 조아용 조아용 ㅎㅎ 조아용 조아용 조아용 ㅎㅎ 조아용 조아용 조아용 ㅎㅎ,2024-07-01,"저녁에 방문, 예약 없이 이용, 대기 시간 바로 입장, 나들이, 지인・동료",매장이 넓어요,870,1
1282258672,jjwapjjwap,"마리나라/까르보나라/가지그라탕 시켰습니다. 콜키지가 무료가 되어서 그점은 좋았습니다. 피자 커팅이 너무 균일하지 않았고 마리나라 소스는 단맛이 너무 강했습니다. 까르보나라는 정말 평범. 가지 그라탕도 무난한 맛. 퀄리티 대비 가격대가 살짝 비싼감이 없지않아 있으나 성수동임을 감안하면 합리적인 듯 싶기도. 테이블도 좁고 바닥도 울퉁불퉁하여 분위기가 고급스럽고 편안하지는 않습니다. 약간 허름해요. 인스타 감성, 소개팅맛집이라는 키워드를 거르고 보면 굳이 가 볼 정도의 집은 아닌거 같네요.",2024-06-29,"저녁에 방문, 예약 없이 이용, 대기 시간 바로 입장, 데이트, 연인・배우자",,1191,1
1282258672,함께울림,굿,2024-06-23,점심에 방문,음식이 맛있어요,2559,1
1282258672,귀여니74,굿,2024-06-23,점심에 방문,음식이 맛있어요,2035,1
1282258672,쩡이4127,주말 애매한 시간에갔더니 대기없이 바로 입장했어요!  시그니처 피자 등 4가지 메뉴 시켰는데 전반적으로 다 맛있었으나 먹다보면 입이 굉장히 짜요ㅎㅎㅎ친구들이랑 물을 몇컵 먹었나몰라요..매장이 시원하고 테이블간 간격도 좁지않아 대화하기좋았습니다,2024-06-23,"점심에 방문, 예약 없이 이용, 대기 시간 바로 입장, 친목, 친구",음식이 맛있어요,1877,1
