place_id,nickname,content,date,situations,keywords,review_count,visit_count
1876244710,Ooosoap,"요즘 맛, 서비스 모두 좋은 곳 보기 힘든데 여기는 모두 최 고 입니다. 여름이라 해산물 먹기도 무서운데 여기는 오징어가 너무 싱싱하고 맛있어요!! 가족들도 너무 좋아해서 일주일에 한 번씩은 방문하고 있습니다:)",2024-07-04,"점심에 방문, 예약 없이 이용, 대기 시간 바로 입장, 일상, 혼자",음식이 맛있어요,13,2
1876244710,com****,항상 친절하시고 맛있습니다.,2024-06-30,"점심에 방문, 예약 없이 이용, 대기 시간 바로 입장, 일상, 친구",음식이 맛있어요,223,1
1876244710,레일라일라,음식 맛있어요. 첫 오픈할때보다 서빙에 체계가 잡힌것 같아요.,2024-06-29,"점심에 방문, 예약 없이 이용, 대기 시간 10분 이내, 일상, 친구",음식이 맛있어요,86,1
1876244710,다롱찌이,은평 불광 근처에 맛있는 짬뽕집이 없어서 찾던 중 방문했는데 너무 맛있어서 후기남깁니다 ..!!!!! 일단 재료도 다 국내산 사용하시고 음식도 미리 만들어두는게 아니라 주문 즉시 만드는거라 너무 맛있었어요 ㅠㅠ 게다가 탕수육 야채까지 살아있고 탕짜짬 다 최고라 재방문 100%인곳 친절하시고 가게 내부도 깨끗해요💗,2024-06-28,"저녁에 방문, 예약 없이 이용, 대기 시간 바로 입장, 데이트, 연인・배우자",음식이 맛있어요,346,1
1876244710,곱하기100,독바위의 자랑! 진짬뽕♡ 짬뽕 맛집 찾아다니느라 영등포 구파발 강남 여기저기 다녀봤지만 진짬뽕이 최고입니다~ 여기 생긴 이후로 차끌고 멀리 안나가서 더 좋구요 요리들도 전부 훌룡해요 특히 탕수육 양장피가 찐이예요~,2024-06-16,"점심에 방문, 예약 없이 이용, 대기 시간 바로 입장, 가족모임, 아이",음식이 맛있어요,22,8
1876244710,제이와이피103,맛있어요,2024-06-13,"저녁에 방문, 예약 없이 이용, 대기 시간 바로 입장, 일상, 연인・배우자, 아이",음식이 맛있어요,875,18
1876244710,일상냉이,여기만큼 맛있는 중국집 못본듯하네요 홀이 너무 바빠서 배달을 못하실 정도면 말 다한듯..매운거 좋아하시는 분들 고추짬뽕밥 강추 지립니다,2024-06-13,"저녁에 방문, 예약 없이 이용, 대기 시간 바로 입장, 일상, 지인・동료",혼밥하기 좋아요,677,1
1876244710,핌포코,언니에게 진짬뽕 맛있다는 얘기 듣고가족들이랑 방문했어요~일단 매장이 너무 깔끔했어요!여긴 면발이 넘 맛있더라구요간짜장 jmt!👍남편은 고추짬뽕밥 먹었는데 땀뻘뻘 흘리면서도맛있어서 숟가락을 놓을 수 없었대여아이들도 잘먹어서 흐뭇했어요또 먹으러 올게요~,2024-06-06,"점심에 방문, 예약 없이 이용, 대기 시간 바로 입장, 일상, 연인・배우자, 아이",음식이 맛있어요,116,1
1876244710,배려4512,ㅎㅎ,2024-06-01,"점심에 방문, 예약 없이 이용, 대기 시간 바로 입장, 친목, 친구",음식이 맛있어요,1528,2
1876244710,Ooosoap,제가 먹었던 짬뽕국물 중에 단연 최고라고 말할 수 있습니다( ◜𖥦◝ ) 맛은 물론이고 재료도 신선하고 양도 푸짐해서 자주 가게 되더라구요! 아직 안 가보셨다면 방문하셔서 짬뽕밥 한번 드셔보세요..강 추 드립니다!!!!!🧚,2024-05-31,"점심에 방문, 예약 없이 이용, 대기 시간 바로 입장, 일상, 혼자",혼밥하기 좋아요,13,1
1876244710,제이와이피103,맛있어요,2024-05-30,"저녁에 방문, 예약 없이 이용, 대기 시간 10분 이내, 일상, 연인・배우자, 아이",음식이 맛있어요,875,17
1876244710,욱신,진짜 너무너무 맛있음!! 이거먹으러 차타고옴.. 말다함,2024-05-30,"점심에 방문, 예약 없이 이용, 대기 시간 바로 입장, 데이트, 부모님",음식이 맛있어요,50,1
1876244710,불광 디와이,단골입니다 세상 맛있어요,2024-05-26,"저녁에 방문, 예약 없이 이용, 대기 시간 바로 입장, 가족모임, 부모님",친절해요,30,1
1876244710,Booths,"20명 같이 회식할 곳 찾다가 알게된 진짬뽕집! 예약한대로 준비해주셔서 편하게 잘 먹고 갑니다.ㅎㅎ 짜장, 짬뽕, 대구식 덮밥, 볶음밥, 탕수육 모두 모두 맛있네요.ㅎㅎ 오픈형 주방이라 요리하는 것도 보이고 청결해서 좋아용!👍🏻👍🏻👍🏻",2024-05-25,"점심에 방문, 예약 후 이용, 대기 시간 바로 입장, 회식, 친구",음식이 맛있어요,24,1
1876244710,bsr****,맛있어서 매주 오는 곳입니다!!짬뽕도 맛있고 탕수육도 맛있는 곳이에요!혼자와서 먹기도 좋습니다!,2024-05-21,"점심에 방문, 예약 없이 이용, 대기 시간 바로 입장, 일상, 혼자",음식이 맛있어요,8,1
1963190083,CidjxncnsU,헉 왜 여기를 이제서야 알았을까요?정말 너무 너무 맛집이에여❤️꼭 바질크림리조또는 무조건 시키시길 바라요!!,2025-02-27,"저녁에 방문, 예약 후 이용, 대기 시간 바로 입장, 친목, 친구",음식이 맛있어요,46,1
1963190083,나는잘될겨0,불광역 맛집 파스타 후기가격도 부담스럽지 않고 맛도 좋고 분위기도 있어요. 그래서 그런가 피크타임 지난 저녁시간대에도 손님들이 많았아요!,2025-02-26,저녁에 방문,음식이 맛있어요,1907,1
1963190083,미식가인척하는잡식가,은평구 데이트 하기 좋은 곳 ❤️파스타가 너무 맛있어요김치볶음밥도 강추강추,2025-02-19,"저녁에 방문, 예약 후 이용, 대기 시간 바로 입장, 데이트, 연인・배우자",음식이 맛있어요,603,1
1963190083,기리덤보,잘 먹었어요😃,2025-02-07,"저녁에 방문, 예약 없이 이용, 대기 시간 바로 입장, 일상, 연인・배우자",음식이 맛있어요,652,1
1963190083,Jeconomy,👍🏻,2025-02-03,"점심에 방문, 예약 없이 이용, 대기 시간 10분 이내, 일상, 지인・동료",음식이 맛있어요,1196,1
1963190083,hyebapcha,✨재방문하고싶은 양식집이에요✨ 파스타를 자주 먹지는 않아서 오랜만에 먹었는데 인생 맛집 찾아서 리뷰썼습니다아..베스트 메뉴들로 엄선해서 드시면 절대 후회없구 간도 세지않아서 정말 맛나게 싹싹 긁어먹었어요❤️ 재방문의사100프로!,2025-01-20,"저녁에 방문, 예약 없이 이용, 대기 시간 바로 입장, 친목, 연인・배우자",인테리어가 멋져요,22,1
1963190083,당찬다람쥐685,일모  파스타 샐러드 너무 맛있어요 무조건 다시 올 곳!!!!!! 가게 분위기도 편안해서 데이트하기 딱이에요🥰,2025-01-17,"저녁에 방문, 예약 없이 이용, 대기 시간 바로 입장, 데이트, 연인・배우자",음식이 맛있어요,31,1
1963190083,맛있는게좋앙486,집근처라서 자주 가는곳이에요 매번 갈때마다 과식을 하게 되는 곳입니다~^^ 너무 맛있어요~,2025-01-08,"저녁에 방문, 예약 없이 이용, 대기 시간 바로 입장, 데이트, 연인・배우자",음식이 맛있어요,29,2
1963190083,hon****,친절하시고 음식 맛있고😊예약 후에 10명의 인원 식사하였고 정말 정말 빠르게 음식 준비해주셨어요~!예약시간보다 30분 일찍 도착하였으나 그 전에 입장할 수 있도록 도와주셨어요~! 감사합니다. 🥹메뉴판에 나와있듯 선술집이나 점심시간엔 다들 식사하러 방문하시는 듯!!점심시간 방문 추천!! ㅎㅎ,2024-11-01,"점심에 방문, 예약 후 이용, 대기 시간 바로 입장, 비즈니스, 지인・동료",아늑해요,335,1
1963190083,투또리,오랫만에 신입직원들에게 맛집을 알려주려 예약하고 들렸어요~~역시나 너무 맛있었어요 직원들도 좋아하고^^   바질크림리조또  는 처음 먹었는데 화려한자태에 눈도 즐거웠네요 ㅋ 바질의 풍미도 좋았답니다~~~오늘도 👍,2024-10-22,"점심에 방문, 예약 후 이용, 대기 시간 바로 입장, 비즈니스, 지인・동료",음식이 맛있어요,433,3
1963190083,페르소나4960,4번의 방문과 한번의 배달을 통한 결론이다. 이곳은 가성비가 좋다고 평가하면 매우 실례되는 곳이다. 이렇게 훌륭한 퀄리티의 음식을 이렇게 저렴하게 제공한다고? 가성비가 좋다가 아니라 사장님이 미쳤어요 수준이다. 더 자주 올 수 없어서 너무 아쉽다. 이곳의 모든 음식을 경험해 보고 싶다.,2024-10-10,"점심에 방문, 예약 없이 이용, 대기 시간 바로 입장, 일상, 혼자",음식이 맛있어요,14,1
1963190083,김영석618,"점심에 들기름 냉파스타 맛있게 먹었습니다! 플레이팅도 정갈하고 음식이 산뜻하니 맛나더군요😊다른 메뉴들도 많던데 곧 재방문할 예정입니다. 은평구 양식, 파스타 맛집 추천드려요🍝",2024-09-24,"점심에 방문, 예약 없이 이용, 대기 시간 바로 입장, 여행, 일상, 혼자",음식이 맛있어요,265,1
1963190083,han****,^^,2024-08-05,점심에 방문,음식이 맛있어요,1519,2
1963190083,투또리,지난번 직원들과 먹었을때  너무 맛있어서 친한동생과 다시 방문~~역시  맛이 일품입니다. 나의 파스타 맛집~~분명  한번 맛보면  다시 올거예요!!^^,2024-08-01,"점심에 방문, 예약 후 이용, 대기 시간 바로 입장, 비즈니스, 지인・동료",음식이 맛있어요,433,2
1963190083,han****,^^,2024-07-20,점심에 방문,음식이 맛있어요,1519,1
1963190083,투또리,직원 송별회 점심 장소로 픽~!  인생 파스타에 들정도로 👍 넘 맛있게 먹었어요~같이 간 동료들도 너무 맛있다고 좋아하네요^^  제가 선택한 트러플알리오올리오는 Best of best!!!분의기도 좋고 음악도 좋고!!  단골각 예상합니다~~♡♡♡,2024-07-12,"점심에 방문, 예약 후 이용, 대기 시간 바로 입장, 회식, 지인・동료",음식이 맛있어요,433,1
1963190083,xod****,음식 맛은최고예요!! 우선 청결하고 깨끗하고 친절해요!자주올게요,2024-07-06,"점심에 방문, 예약 없이 이용, 대기 시간 바로 입장, 데이트, 연인・배우자",음식이 맛있어요,6,1
1963190083,약과쨩,"☀️바쁜 현대인을 위한 요약 리뷰☀️1.가게 자체가 행복해지는 분위기임-돈 땡겨볼까? 이런 분위기가 아니라고수가 취미생활하는 느낌입니다.사람들 행복하게 해줘야지~ 이런 분위기2.매콤 명란 크림 파스타는 찐-매콤한 크림 좋아하는 사람은 무조건 드세요.3.토마토 페스카토레에 해산물 왕창 넣어줌4.불광역에서 엄청 가까움-역 근처라 너무 좋음5.엄청 친절하게 응대해 주심맛있는 파스타 먹고 소소한 행복 느끼고 싶은 분은꼭 방문해 보세요. 퇴근 후에 가서 파스타 먹자마자피로가 확 풀리는 기분이었고, 오늘 하루 열심히 살았다는 편안함과 행복을 느낄 수 있었어요.특히 퇴근 후에 만나서 같이 식사하는 커플에게 강추합니다.",2024-07-04,"저녁에 방문, 예약 없이 이용, 대기 시간 바로 입장, 데이트, 연인・배우자",음식이 맛있어요,45,1
1963190083,Hi8120,불광 주민이라면 다들 가보셔야 합니다!!! 진정한 은평구 짱짱짱 맛집이예요😘❤️ 제가 강경 한식파(+술러버)인데 최근 먹은 양식 중에 최고로 맛있습니다~ 사장님 인상도 좋고 직원분도 매우 친절하셔서 진짜 너어어어어어무 기분 좋게 먹고 왔습니당!!!!,2024-06-25,"저녁에 방문, 예약 없이 이용, 대기 시간 바로 입장, 데이트, 연인・배우자",음식이 맛있어요,84,1
1963190083,한츈식,정말 맛있는 파스타 였어요,2024-06-21,"점심에 방문, 예약 없이 이용, 대기 시간 30분 이내, 가족모임, 연인・배우자, 부모님",음식이 맛있어요,482,1
1963190083,YULLA13,불광동 추천 맛집!! 메뉴 전부 너무 맛있어요보리로 만든 리조또라 식감도 좋아요!!,2024-06-20,"저녁에 방문, 예약 없이 이용, 대기 시간 바로 입장",음식이 맛있어요,721,1
1963190083,슈크림먹자,메뉴종류도 많고 마싯어요 ~!!분위기도 아늑하고 좋고 와인이나 소주 맥주 술종류도 다양해서 좋아요!인테리어도 예뻐서 여자들끼리 가기에도 좋아요,2024-05-27,"저녁에 방문, 예약 후 이용, 대기 시간 바로 입장, 데이트, 지인・동료",음식이 맛있어요,1077,1
1963190083,닉넴뭘로해22,올때마다 너무 좋은걸…❤️음식도 맛있고 가볍게 술먹기 너무좋아요!!직원분들도 쏘 친절!,2024-05-24,"저녁에 방문, 예약 없이 이용, 대기 시간 바로 입장, 데이트, 연인・배우자",음식이 맛있어요,24,2
1963190083,ini****,너무 맛있어서 사진찍을 생각도 못하고 먹었네요 동네에 이런곳이있을줄은 몰랐습니다 정말 맛있네요!!,2024-05-21,"밤에 방문, 예약 없이 이용, 대기 시간 바로 입장, 일상, 기타",음식이 맛있어요,7,1
1963190083,lewboo,"이 동네에 양식 먹을 곳이 없었는데, 양식주점이 오픈해서 항상 궁금해하다가 늦은 저녁 먹을 겸 들러봤어요.트러플이 올라간 알리오올리오와 산토리 하이볼 먹었는데 재료를 아끼지 않은 맛이라 너무 맛있게 먹었습니다.면 익기도 딱 좋았구 트러플이랑 오일 향이 듬뿍 느껴졌어요. 트러플 들어간 음식들 보면 향만 느껴질 정도로 넣는데, 직접 올려주신 부분이 인상깊었어요. ㅎㅎ 하이볼도 위스키 많이 들어간 맛이 났습니다.비록 전 혼자 왔지만 ^.ㅠ 인테리어랑 분위기도 좋아서 연인끼리 와도 좋을 것 같아요..!늦은시간에 혼자 방문했는데 친절히 응대해 주신 것도 좋았습니다. 오래오래 장사하시면 좋겠어요!",2024-05-16,"저녁에 방문, 예약 없이 이용, 대기 시간 바로 입장, 일상, 혼자",음식이 맛있어요,7,1
1963190083,건강건빵,늑간살 스테이크와 라구 파스타 먹었습니다. 가격도 괜찮고 정말 맛있어서 싹싹 긁어먹었네요🤤🤤 재방문하고 싶네요!,2024-05-11,점심에 방문,음식이 맛있어요,1306,1
1963190083,스텔라2696,"동네에 귀한 아늑한 분위기 맛집입니다!! 남편, 아이랑 갈 때마다 늘 편하게 시간 보낼 수 있게 해주시는 친절한 사장님들도 최고입니당👍🏻",2024-05-08,"저녁에 방문, 예약 없이 이용, 대기 시간 바로 입장, 데이트, 기념일, 가족모임, 아이",친절해요,20,1
1963190083,수와수리,"불광동 연신내 근처에 갈 일이 생길때마다 고깃집 말고 괜찮은 식당 없을까? 늘 궁리했는데 드디어 오늘 일모를 만났네요.불광1동 행정복지센터 바로 옆에 있어요.일방통행 도로라서 많이 붐비지도 않고, 건물 주차장도 사용할수 있어서 운치있고 편리하네요.매장이 크진 않지만 아기자기해요.피규어들도 꽤 있고요.2인 B세트로 먹다가 살짝 양이 적을까봐 빵 추가해서 먹었더니 아주 적당하네요.트러플 알리오올리오 파스타는 트러플 향이 제대로였구요~ 스테이크도 굽기정도나 밑간이 딱이네요.일모가 무슨 뜻일까 궁금했는데...  ㅎㅎ사장님 성함인가봐요^^맛있게 먹었습니다. 또 올게요~",2024-05-08,"저녁에 방문, 예약 없이 이용, 대기 시간 바로 입장, 가족모임, 친척・형제",음식이 맛있어요,1078,1
1963190083,로키323,,2024-04-23,"점심에 방문, 예약 없이 이용, 대기 시간 바로 입장",친절해요,564,1
1963190083,ssa****,일모 너무맛잇어요~,2024-04-16,"저녁에 방문, 예약 없이 이용, 대기 시간 바로 입장, 데이트, 친목, 일상, 기념일, 연인・배우자, 친구, 혼자",음식이 맛있어요,35,1
1963190083,뉴늉56,첫번째 방문 했을 때보다 더 안정적이어진 느낌이었어요그런데 맨손으로 요리하시면서 포스기도 누르고 볼펜 잡은 손으로 바로 식재료를 만지시더라구요. 바테이블에 앉아서 바로 보이는데 좀 당황스러웠어요,2024-04-10,"저녁에 방문, 예약 없이 이용, 대기 시간 바로 입장, 일상, 지인・동료",잡내가 적어요,25,1
1963190083,귀여운 뭉밥이,일모에서 맛있게 먹방한게 생각나서 동생과 함께 다시 들렸어요^^이번에도 배고픔에 먹기일보직전에 일단 찰칵ㅋㅋ스테이크셀러드와 트러플알리오올리오 를 시켰어요^^둘이서 대화나누며 너무 부담되지않는 양으로 아주 맛있게 클리어^^구운바게뜨빵은 사장님께서 다시 들려주셔서 감사하시다며 서비스ㅋㅋ너무 행복한 시간보내고 맛있게 먹고갑니다.여러분들도 방문하시면 절대 후회하지 않으실꺼예요!,2024-03-15,"점심에 방문, 예약 없이 이용, 대기 시간 바로 입장, 나들이, 친척・형제",음식이 맛있어요,3,2
1963190083,supersuri,다음에 또 방문하면 다른 메뉴도 먹어보고싶어요,2024-03-06,저녁에 방문,아늑해요,86,1
1963190083,롱롱삐,"여자 둘이서 4메뉴3와인 가능한곳🤣🤨저희는 바지락바질페스토술찜, 트러플알리오올리오, 치즈칠리프라이, 계란토스트 이렇게 4가지 메뉴를 맛보았습니다. 예쁜플레이팅에 간이 적당해서 안주겸 식사로 좋았고추천해주시는 와인도 딱 음식에 맞아 화이트 레드 골고루 즐길수 있었습니다.디쉬메뉴도 리스트도 풍성하고 와인 외에도 전통주,막걸리 등 다양한 주류리스트를 가지고 계시더라구요. 아늑하면서도 속이 꽉찬 공간인 듯합니다. 감사합니다 사장님👍🤗",2024-03-05,"저녁에 방문, 예약 후 이용, 대기 시간 바로 입장, 친목, 친구",친절해요,552,1
1963190083,먹 방,분위기 맛 가격 양 전부 대만족했어요!! 대식간데도 배 부르게 먹고 나왔어욬ㅋㅋㅋㅋ 파스타 소스까지 다 클리어했구요. 양식집인데 카레까지 잘해버림ㅜㅜ 오사카에서 먹었던 카레보다 맛남,2024-02-26,"저녁에 방문, 예약 없이 이용, 대기 시간 바로 입장, 데이트, 연인・배우자, 친구",음식이 맛있어요,119,1
1963190083,해삐64,불광역 숨은 양식맛집이에용😍 매장 분위기며 음식 퀄리티며 완전 고급스러워요🤩 그런데도 가성비 맛집 인정!! 데이트 코스로도 완전 제격인 거 같아용! 자주 방문하고 싶어용!!,2024-02-23,"저녁에 방문, 예약 없이 이용, 대기 시간 바로 입장, 일상, 친구",음식이 맛있어요,630,1
1963190083,가만가만히,불광동 먹자골목에서 만날 수 있는 가장 힙한 장소 같아요.  멀리서도 노란 간판이 따뜻하게 보여요.   오픈 주방이라 깔끔해 보여요.  저희 가족들에게는 약간 양이 부족한 듯해요.  애견동반 가능.  재방문 의사 있음.,2024-02-22,저녁에 방문,음식이 맛있어요,1109,1
1963190083,영수증리뷰중독자,"🎈분위기 예쁘고 사장님 이름 걸고 하는 퓨전양식집🎈바자리가 예쁘고 좋았지만 짐 둘만한 곳이 있지않아서 불편했음🎈와인은 가장 저렴한 레드와인 주문한건데 많이 안달고 떫지않아서 넘기기가 정말 좋았음🎈매콤명란크림파스타는 매콤, 명란, 크림 느낌이 하나도 도드라지지않아서 나는 심심했는데  남자친구는 뭔소리냐고 너무 맛있다함🎈비프브루기뇽은 고기사이즈가 정말 크고 좀 퍽퍽한 고기느낌이라 아쉬웠는데 찾아보니 원래 그런 고기로 하는게 맞는 요리라고 함. 난 당근 맛있었음🎈비프브루기뇽도 나는 매웠는데 남자친구는 하나도 안맵다고 왜그러냐함(본인이 매운거 원래 더 잘 먹음)🎈바게뜨 바삭바삭하게 잘 구워주시고, 배달주문 짱많음🎈여차저차해서 마음에 들었던 곳. 가성비좋고 예쁘고 좋음",2024-02-17,"저녁에 방문, 예약 없이 이용, 대기 시간 바로 입장, 데이트, 기념일, 연인・배우자",음식이 맛있어요,662,1
1963190083,beloved2456,맛있어요,2024-02-14,"저녁에 방문, 예약 없이 이용, 대기 시간 바로 입장, 친목, 친구",음식이 맛있어요,1381,2
1963190083,눈누난나3392,불광역 골목 속에 있는 양식과 한식을 둘 다 먹을 수 있는 퓨전양식집이에요!  처음 와봤는데 트러플 향 가득 나는 알리오올리오는 느끼하지도 않고 너무 맛있고 오믈렛 김치볶음밥도 두꺼운 계란이불 덮은 것처럼 너무 부드럽고 맛있어요 분위기도 좋아서 커플 분들 데이트 하기도 좋고 가족단위도 많이 오더라구요! 너무 포근하고 따뜻한 곳이에요 자주 오려구요,2024-02-08,"저녁에 방문, 예약 후 이용, 대기 시간 바로 입장, 일상, 친구",인테리어가 멋져요,450,1
1963190083,블로거 연이에용,"신선한 재료들로 만든 맛있는 음식들, 아늑한 분위기, 친절한 사장님과 직원분까지!​ 모든 게 좋았던 일모를 불광역 파스타 맛집으로 인정합니당당>0<",2024-02-08,"저녁에 방문, 예약 후 이용, 대기 시간 바로 입장, 일상, 부모님",인테리어가 멋져요,67,1
1963190083,경찡61,갓성비 파스타 맛집 일모💖💖💖동네에 맛집 발견해서 너무 기쁩니다!!명란크림파스타 저렴한데 내용물도 알차고 너무 맛있고요~바질리조또 플레이팅 넘 예쁜데 맛까지 있어요~매장 분위기도 좋아서 데이트겸 방문하는것도 넘 추천하는 곳!재방문의사 천퍼만퍼입니다😆😆😆 또 가려구요!,2024-02-05,"저녁에 방문, 예약 후 이용, 대기 시간 바로 입장, 데이트, 친목, 일상, 친구",음식이 맛있어요,33,1
1963190083,로지18,외관도 아기자기하고 음식도 괜찮았어요 분위기가 좋아 데이트하기 좋은 곳이에요,2024-02-03,"저녁에 방문, 예약 없이 이용, 대기 시간 바로 입장, 데이트, 연인・배우자",인테리어가 멋져요,39,1
1963190083,bhl****,친구랑 오랜만에 불광동 왔다가 핫한 파스타집 있다고해서 찾아온 일모!!12시 예약인데 홀은 이미 꽉 차있어서 맛집임을 증명하고 있었다. ㅎㅎ분위기가 좋은 카페같은 느낌의 파스타집ㅋ어제 한잔한 우리는 토마토로 해장을 하겠다며 토마토라구파스타와 토마토페스카토레를 주문했다.토마토라구파스타는 고기가 듬뿍들어있어서 파스타를 덜때마다 면에 고기가 붙어있었다.(더 고급진 표현은 없는거니???ㅋㅋ)토마토페스카토레는 토마토해산물 파스타인데 해산물도 실하고 토마토소스랑 잘 어울렸다. 다른 테이블이 시킨거보니 하나같이 다 맛있어 보였다. 특히 스테이크 메뉴(고기욕심!!)주방에서 강한불로 바로 재료들을 익혀내니 재료의 맛들이 살아 있어서 좋았다.오랜만에 분위기 좋은곳에서 맛있는 음식을 먹으니 너무 행복했다~,2024-02-02,"점심에 방문, 예약 후 이용, 대기 시간 바로 입장, 친목, 친구",음식이 맛있어요,91,1
1963190083,잡덕수집가,파스타 맛있어요. 복분자랑도 잘 어울립니다.,2024-01-06,"점심에 방문, 예약 없이 이용, 대기 시간 바로 입장, 가족모임, 부모님",음식이 맛있어요,500,1
1963190083,bbbddd74,좋아요ㅎㅎ,2023-12-28,"저녁에 방문, 예약 없이 이용, 대기 시간 바로 입장, 일상, 친구",,315,1
1963190083,맛있는게좋앙486,"오픈때부터 몇번 갔는데 리뷰를 못남겼었네요~^^아이들과 가서 먹기도 좋고~ 부모님 , 친구 등 연령무관하게 함께 즐거운 식사를 하기 좋은 곳이에요~^^사장님 직원분 다 너무 친절하세요~^^아직 먹어보지 못한 메뉴는 빠른시일내에 방문해서 먹어보도록 하겠습니다~^^ 오늘도 맛있게 잘 먹었습니다~^^",2023-12-18,저녁에 방문,인테리어가 멋져요,29,1
1963190083,유승희89,굿,2023-12-16,저녁에 방문,음식이 맛있어요,2492,1
1963190083,만쥬YAM,양식에서 익숙한 한식맛을 느껴볼 수 있는 곳!그래서 더욱 새롭고 맛있었어요👀저렴한 가격에 이런 퀄리티를 맛 볼 수 있다니?!저녁엔 술과 함께 곁들여 먹을 수 있어 색다른 매력이 가득🤍🍽️ 매콤 명란 크림 파스타 (14.0)명란과 매콤한 맛이 느끼함을 제대로 잡아줘 첫입부터 마지막까지 맛있었어요!🍽️ 한돈 등심 돈까스 (10.0)바삭바삭한 식감이 최고!기대하지 않은 돈까스도 이렇게 맛있으면 어쩌죠..?🥹,2023-12-16,"점심에 방문, 예약 없이 이용, 대기 시간 바로 입장, 친목, 친구",음식이 맛있어요,123,1
1963190083,onlyy won,첫째로 음식이 정말 맛있어요!깔끔하고 풍부한 맛의 퓨전 양식집이었습니다.꼬제에 들어간 누룽지 너무 맛있어서마구 퍼먹었네요 ㅋㅋ분위기가 데이트하기 안성맞춤이에요매장도 굉장히 청결하구요! 맛있어 보이는 메뉴가 넘 많았어서꼭 재방문 예정입니다😊,2023-12-12,"저녁에 방문, 예약 후 이용, 대기 시간 바로 입장, 데이트, 연인・배우자",음식이 맛있어요,12,1
1963190083,기며누78,사장님 맛있고 음식이 친절해요~,2023-12-09,저녁에 방문,친절해요,15,3
