place_id,nickname,content,date,situations,keywords,review_count,visit_count
38405139,죽지않아497,신당동떡볶이 검색해서 메인에 후기가 제일 많아 다녀왔어요 주말 점심 대기 30분정도? 였고 떡볶이는 자극적이지 않고 넘넘 맛있어요 🍴,2025-02-22,"점심에 방문, 예약 없이 이용, 대기 시간 30분 이내, 데이트, 연인・배우자",음식이 맛있어요,88,1
38405139,pink쌤,발렛해주시는분들 계셔서 편했어요. 떡볶이 푸짐하고 양념이 넘 맛있어요~~ 괜히 유명한게 아니다 싶었어요ㅎㅎ,2025-02-22,"점심에 방문, 예약 없이 이용, 대기 시간 30분 이내, 데이트, 연인・배우자",음식이 맛있어요,318,1
38405139,조아라5678,학생 때 가긴 했었지만 ㅎ성인 되서는 오랜만에 갔는데 맛은 그대로 였고 양도 많네요 ㅎ,2025-02-21,"점심에 방문, 예약 없이 이용, 대기 시간 10분 이내, 일상, 친구",양이 많아요,1198,1
38405139,쏭쏭47,오랜만에 방문했어요 ㅎ 평일 저녁에도 사람이 많네요!! 자리가 좀 좁아서 불편하긴했지만... 잘 먹고 볶음밥까지 볶아먹고 왔어요,2025-02-19,"저녁에 방문, 예약 없이 이용, 대기 시간 바로 입장, 데이트, 연인・배우자",음식이 맛있어요,781,1
38405139,스머프베리베리,음식 빨리 나오고 맛있어요,2025-02-19,"점심에 방문, 예약 없이 이용, 대기 시간 바로 입장, 일상, 아이",음식이 맛있어요,241,1
38405139,수다스런미식가,1. 매장이 크고 자리가 많아서 웨이팅 걱정은 없습니다.2. 떡볶이는 달콤하면서 살짝 매운 편이라 매운 걸 못 먹는 사람도 충분히 먹을 수 있었습니다. 2인 세트는 2명이서 먹기에 살짝 부족한 편입니다. + 볶음밥은 직접 해 먹어야 됩니다.3. 직원분들이 많지만 항상 바쁜 편이라 부르는데 힘들 수 있지만 친절하게 응대해 주십니다.,2025-02-17,"저녁에 방문, 예약 없이 이용, 대기 시간 바로 입장, 데이트, 연인・배우자",음식이 맛있어요,384,1
38405139,naraepopo,가성비 좋고 아주 좋았습니다볶음밥은 필수로 먹어야해요!!,2025-02-15,"저녁에 방문, 예약 없이 이용, 대기 시간 30분 이상, 데이트, 연인・배우자",음식이 맛있어요,1180,1
38405139,COCO0513,떡볶이로 유명한 신당동 드디어 처음 가봤는데 신기했어요홀이 가득찼는데 빠르게 나오고 원활한 진행이 좋았어요,2025-02-15,"점심에 방문, 예약 없이 이용, 대기 시간 10분 이내, 일상, 친구",가성비가 좋아요,131,1
38405139,aut****,빠른 주차안내와 포장 좋네요,2025-02-15,"점심에 방문, 포장·배달 이용, 대기 시간 10분 이내, 나들이, 연인・배우자",음식이 맛있어요,1039,1
38405139,황쏘,즉떡하면 생각나는 마복림할머니네 ㅎㅎㅎ 특별한 맛은 아니지만 옛날 생각나서 좋아요.,2025-02-15,점심에 방문,음식이 맛있어요,669,1
38405139,드라이버8937,,2025-02-14,점심에 방문,음식이 맛있어요,540,5
38405139,단풍나무13,추억의 그 맛 기대가 넘 컸네요아고 어쩌다 맛이 ....,2025-02-14,"점심에 방문, 예약 없이 이용, 대기 시간 10분 이내, 친목, 친구",매장이 넓어요,855,1
38405139,최고의휴식,오랜만에 방문했어요. 맛도 변함없이 맛있고 좋았는데직원분 친절함이 좀 없어 아쉬윘어요.,2025-02-13,"저녁에 방문, 예약 없이 이용, 대기 시간 바로 입장, 데이트, 연인・배우자",음식이 맛있어요,311,1
38405139,꾸기7884,음식은 맛있지만 서비스가 좀 부족한게 아쉬워요예를들어 마무리로 볶음밥 주문했는데 안해주시더라구요,2025-02-13,"저녁에 방문, 예약 없이 이용, 대기 시간 바로 입장, 데이트, 연인・배우자",음식이 맛있어요,520,1
38405139,jiyeon v,맛있었어요,2025-02-13,점심에 방문,매장이 넓어요,887,6
38405139,Keep going84,마복림 할머니 궁금해서 방문했어요.안에 손님은 많았어요.그런데 종업원 분이 응대 할 때 핀잔식으로 응대하고 떡볶이 야채 추가 했는데 자잘해서 지저분해요.궁금해서 한 번 방문해 보고 싶었는데 한 번 방문한걸로 만족이요.,2025-02-13,"점심에 방문, 예약 없이 이용, 대기 시간 바로 입장, 일상, 부모님",음식이 맛있어요,567,1
38405139,sk****,,2025-02-11,"저녁에 방문, 예약 없이 이용, 대기 시간 바로 입장, 친목, 친구",음식이 맛있어요,317,1
38405139,인생은아이스크림,너무 기대를 많이해서 그랬나맛은 그냥그냥~ㅎ떡이 너무 조금 라면이랑 당면사리가 메인같았어요잘드시는분들은 추가사리 필요할꺼같구요쿨피스아니고 쥬시쿨이용 ㅎㅎ,2025-02-08,"점심에 방문, 예약 없이 이용, 대기 시간 30분 이내, 데이트, 연인・배우자",매장이 넓어요,59,1
38405139,곰플레이어,신당동 떡볶이집 전통의 마복림 떡볶이집즐거운 마음으로 맛있게 먹고 왔어요,2025-02-08,"점심에 방문, 예약 없이 이용, 대기 시간 30분 이내, 여행, 연인・배우자",아늑해요,43,1
38405139,원026,맛있어요!,2025-02-08,"점심에 방문, 예약 없이 이용, 대기 시간 바로 입장, 데이트, 연인・배우자",음식이 맛있어요,1569,1
38405139,재목한무,"주차 발렛해주시는데 무료에요매장도 넓고, 즉석떡볶이 간만에먹는데 맛있네요찾아가서 먹을만해요",2025-02-05,"저녁에 방문, 예약 없이 이용, 대기 시간 바로 입장, 데이트, 연인・배우자",음식이 맛있어요,160,1
38405139,tax****,입덧 이슈로 방문한 마복림할머니집.중학교 때 처음 방문했던거 같은데.여전히 사람 많고 여전히 맛있어요.예전이랑 시스템은 좀 변했지만 여전히 애정스런 떡뽁이집.,2025-02-04,"저녁에 방문, 예약 없이 이용, 대기 시간 바로 입장, 데이트, 연인・배우자",음식이 맛있어요,1497,1
38405139,드라이버8937,,2025-02-04,저녁에 방문,음식이 맛있어요,540,4
38405139,honey8611,원조 답게 먹을수록 땡기는 맛이 있네요. 요즘 트랜드 맛은 아니고 예전 정통 맛을 원하시면 추천 드려요.,2025-02-04,"점심에 방문, 예약 없이 이용, 대기 시간 바로 입장, 데이트, 연인・배우자",인테리어가 멋져요,331,1
38405139,vividyj2,"맛이 바뀐것 같아요. 오랜만에 갔는데, 맵고 텁텁해졌어요",2025-02-02,"저녁에 방문, 예약 없이 이용, 대기 시간 30분 이내, 친목, 친구",가성비가 좋아요,387,2
38405139,이상혁456,아이들과 맛있게 먹었어요.,2025-02-02,"저녁에 방문, 예약 없이 이용, 대기 시간 30분 이내, 데이트, 연인・배우자, 아이",음식이 맛있어요,11165,1
38405139,jucksweat,,2025-02-02,"점심에 방문, 예약 없이 이용, 대기 시간 30분 이내, 일상, 연인・배우자, 아이, 부모님",음식이 맛있어요,938,1
38405139,나의 생,가끔 생각나는맛,2025-02-02,"점심에 방문, 예약 없이 이용, 대기 시간 10분 이내, 일상, 아이",양이 많아요,6098,1
38405139,김뉴44,https://m.blog.naver.com/kimnew8376/223745345215가족과 함께   발렛 주차도해주니  며느리도 모르는 그맛즉석떡뽁이 굿입니다요,2025-02-02,"점심에 방문, 예약 없이 이용, 대기 시간 30분 이내, 친목, 나들이, 연인・배우자, 아이",음식이 맛있어요,26,1
38405139,슬기콩05,맛있게 잘먹었습니다 !,2025-02-02,"점심에 방문, 예약 없이 이용, 대기 시간 바로 입장, 데이트, 연인・배우자",매장이 넓어요,1300,1
38405139,녹턴22,굿,2025-02-01,"점심에 방문, 예약 없이 이용, 대기 시간 바로 입장, 나들이, 친구",음식이 맛있어요,2830,6
38405139,Yuna27,떡볶이는 항상 맛있어요. 먼거리 큰맘 먹고 가서 맛있게 먹었어요.,2025-01-31,"저녁에 방문, 예약 없이 이용, 대기 시간 바로 입장, 일상, 친구",음식이 맛있어요,1058,1
38405139,로구인,기본 2인분 꽤 양이 많습니다~ 면사리도 충분한 것 같아요! 밥 볶아먹으려고 했는데 배불러서 남겼어요. 소스는 적당히 매콤하고 달면서 자극적입니다. 다만 앉아있는 공간이 매우 협소하고 다른 테이블간 간격이 너무 좁아서 좀 불편했어요. 가스 버너 냄새도 심합니다..,2025-01-31,"저녁에 방문, 예약 없이 이용, 대기 시간 바로 입장, 친목, 일상, 친구",,472,1
38405139,qja****,늘 근처 오면 포장해 갑니다,2025-01-30,"점심에 방문, 예약 없이 이용, 대기 시간 바로 입장, 일상, 연인・배우자",음식이 맛있어요,291,3
38405139,매일미소,🍲 😋 중독..,2025-01-30,"점심에 방문, 예약 없이 이용, 대기 시간 30분 이내, 일상",음식이 맛있어요,1491,3
38405139,미래야맑음,,2025-01-27,"저녁에 방문, 예약 없이 이용, 대기 시간 바로 입장, 여행, 연인・배우자",음식이 맛있어요,447,1
38405139,sonxab6ix,신당동 떡볶이타운 꼭 가보고 싶었는데!!!! 가장 유명하다는 마복림 갔어요 근데 솔직히 특별한 맛 1도 읍꼬 그냥저냥 뭐 분위기로 이름값으로 한 번 가 볼만 해요,2025-01-27,"저녁에 방문, 예약 없이 이용, 대기 시간 바로 입장, 데이트, 연인・배우자",,443,1
38405139,제일큰행,"달큰하지도않고 맵지도않고 니맛도내맛도아닌 그런 즉석떡볶이. 유딩, 초딩도 먹을수있음. 기대를 너무 한 탓인가 실망스러움. 양은 많아서 2명이서 배터져 죽을뻔. 볶음밥 절대못먹을것같음. 줄은 생각보다 빨리 줄어듦",2025-01-27,"점심에 방문, 예약 없이 이용, 대기 시간 30분 이내, 데이트, 여행, 연인・배우자",음식이 빨리 나와요,713,1
38405139,rod****,맛있어요,2025-01-27,"점심에 방문, 예약 없이 이용, 대기 시간 바로 입장, 나들이, 일상, 연인・배우자, 아이",음식이 맛있어요,1004,1
38405139,jys****,,2025-01-25,저녁에 방문,음식이 맛있어요,480,1
31906212,lavieenroseee,"한식 먹고 싶어서 방문했는데 간도 심심하고 건강한 맛이어서 넘 좋았어요🍚𝟕가지 나물, 오징어볶음, 치즈 달걀말이 모두 넘 맛있었어요💕반찬도 정갈하고 깔끔하게 나와요건강한 집밥 느낌 최고♥️",2025-03-30,"저녁에 방문, 예약 없이 이용, 대기 시간 30분 이내, 데이트, 연인・배우자",친절해요,628,1
31906212,까만언니,,2025-03-28,"저녁에 방문, 예약 없이 이용, 대기 시간 30분 이내, 일상, 친구",음식이 맛있어요,1047,1
31906212,yjh****,맛 좋아요. 어머님의 레시피를 담은 맛!,2025-03-25,"저녁에 방문, 예약 후 이용, 대기 시간 바로 입장, 일상, 아이",음식이 맛있어요,884,1
31906212,xanxou,"김치볶음밥이랑 돼지맥적구이 먹었습니다. (오이냉국 추가)밥, 반찬, 메인메뉴 빠짐없이 너무 맛있었어요 제 입맛에 잘 맞았던 거 같아요고객이 많아서인지 주문한 뒤 음식을 받는 데까지 시간이 조금 걸렸습니다",2025-03-23,"점심에 방문, 예약 없이 이용, 대기 시간 바로 입장, 데이트, 연인・배우자",음식이 맛있어요,27,1
31906212,rui****,,2025-03-22,"저녁에 방문, 예약 없이 이용, 대기 시간 1시간 이상, 친구",음식이 맛있어요,269,1
31906212,wea****,좋아요,2025-03-15,"저녁에 방문, 예약 없이 이용, 대기 시간 바로 입장, 데이트, 연인・배우자",음식이 맛있어요,1276,1
31906212,ㄴㄴ8172,한식의 스탠다드라고 불러도 될 만큼 깔끔하고 맛있는 집입니다! 외국인들에게 소개시켜줘도 손색없을 것 같아요,2025-03-15,"점심에 방문, 예약 없이 이용, 대기 시간 30분 이내, 나들이, 부모님",음식이 맛있어요,320,1
31906212,lenabr11205,배달로 처음 접한 곳인데 매장에서 먹으니 더 맛있어요. 분위기도 좋구요. 기본찬에 국도 나와서 한끼 든든하게 먹었어요. 현미랑 쌀밥도 취향껏 선택할 수 있어 좋았습니다.,2025-03-14,"점심에 방문, 예약 후 이용, 대기 시간 바로 입장, 친목, 지인・동료",친절해요,250,1
31906212,슈슈깡39,음식이 정갈하고 맛있어요. 분위기도 좋고요. 자주 빙문하고 싶은 곳이에요.,2025-03-14,"점심에 방문, 예약 후 이용, 대기 시간 바로 입장, 기념일, 지인・동료",음식이 맛있어요,322,1
31906212,강남요술봉,늘 자리가 없어요맛있어요😆,2025-03-04,"점심에 방문, 예약 없이 이용, 대기 시간 10분 이내, 지인・동료",음식이 맛있어요,368,2
31906212,임채은0620,💗 치즈감자전은 무조건 주문하세요 ~~!!!! 💗진짜 너무 맛있었구 사장님도 친절하셨어요 ㅎㅎ 토요일 저녁 기준 40분 정도 웨이팅했고 주변 매장 구경하다보니 금방 시간 지났어요~! 음식 모두 다 너무 맛있었구 친구랑 오기에도 연인과 데이트하기에도 부모님 모시고 오기에도 다 좋았습니다! 재방문 의사있어욤 !!!,2025-03-01,"저녁에 방문, 예약 없이 이용, 대기 시간 30분 이상, 일상, 친구",음식이 맛있어요,16,1
31906212,오랑23,간이 심심하지만건강하고 맛있어요.제육은 오히려 특징이 안 사는 것 같고묵은지비빔밥이나 더덕구이는 맛있었어요.친절하고 편한 분위기라 맘에 듭니다.,2025-02-28,"점심에 방문, 예약 후 이용, 대기 시간 10분 이내, 일상, 친구, 아이",음식이 맛있어요,349,1
31906212,흰구름4046,"조미료가 느껴지지 않는 건강한 맛메인, 밑반찬, 일품요리 모두 맛있어요세트메뉴에 옥돔구이가 나오는건 첨 봤어요들큰하지 않은 오징어 볶음이 특히 맘에 들었어요모든 술을 잔으로 팔아 각자 취향대로 마실수 있어 좋아요",2025-02-12,"저녁에 방문, 예약 후 이용, 대기 시간 10분 이내, 친목, 친구, 지인・동료",음식이 맛있어요,273,1
31906212,mfspilot,지인 소개로 간 숨은 맛집!다음엔 외국 손님도 모시고 갈 듯~ 👍,2025-02-12,점심에 방문,음식이 맛있어요,1112,1
31906212,복복지니,비건 메뉴 추천합니다. 음식과는 화이트와인이 잘 어울리네요. 한식과 와인의 궁합이 참 좋습니다.,2025-02-02,"점심에 방문, 예약 없이 이용, 대기 시간 바로 입장, 친목, 친구",재료가 신선해요,380,1
31906212,소댕974,"8만원가까이되는 돈을 쓰고 먹는내내 갸우뚱해지는 맛이었어요. 보쌈은 얇고, 갓김치는 특유의 맛을 잃어 시중에 판매되는 보쌈 정식 이하였습니다. 옥돔은 반건조 상태라 해도 지나치게 말라 살이 거의 없고 너무 짰습니다.  매생이굴국에 들어간 굴은 전부 썼어요. 굴이 하나같이 다 썼는데 그대로 나왔다는건 요리하시는분이 맛을 안봤을 가능성이 높을것 같네요. 매생이는 양이 적어 한 줌(거의 반 줌?) 정도밖에 되지 않았던 것 같습니다. 치즈 바삭 감자전은 이름부터 다시 고민해볼 필요가 있어 보입니다. 씹는 순간 신문지 같은 식감이 느껴졌고, 미리 조리해 두었다가 다시 구웠거나 튀긴 걸로 보여요. 전반적으로 미디어에서 과대평가된 식당에 온 느낌이었습니다.",2025-02-01,"저녁에 방문, 예약 없이 이용, 대기 시간 10분 이내, 친목, 일상, 친구",친절해요,14,1
31906212,오 선물,좋아요,2025-01-27,저녁에 방문,음식이 맛있어요,891,1
31906212,할미꽃9112,리움 가기전에 점심 먹고 가려고 들렀던 집. 한정식 가게이긴 한데 생각과는 좀 달랐던 약간 퓨전 한정식. 젊은 사람들이 많이 오고 분위기는 좋았음. 예쁜 창문으로 보이는 겨울풍경이 이쁘고 음식도 담백하고 좋았네요. 옥돔구이를 약간 바삭하게 튀기듯 구워 비린맛 없이 맛있었습니다. 가게 이름이 빠르크인데 간판에 상호가 잘 안 나타나 찾기 어려웠어요. 창문에 조그맣게 parc라고 적힌 거 보고 알았네요.,2025-01-26,"점심에 방문, 예약 없이 이용, 대기 시간 30분 이내, 일상, 연인・배우자",매장이 청결해요,128,1
31906212,esp****,2년만에 방문한 오래된 단골집인데 평일 늦은 점심 시간인데도 대기가 있고 그새 핫플이 되었네요~~,2025-01-21,"점심에 방문, 예약 없이 이용, 대기 시간 30분 이내, 나들이, 친구",음식이 맛있어요,649,1
31906212,메 론 팡,건강하고 몸이 청결해지는 맛이에요🍃간장소스 오징어볶음은 처음이었는데 맛있었어요!매운맛은 매울까봐 걱정했는데 그냥 한국인한테는 익숙한 오징어볶음맛!비건음식도 많아서 외국인분들도 많이 방문하는 것 같아요,2025-01-08,"저녁에 방문, 예약 없이 이용, 대기 시간 바로 입장, 친목, 친구, 지인・동료",친절해요,192,1
31906212,인사88,"가게 분위기도 넘 좋고, 일하시는 분들이 진짜 친절하셔서 넘 좋게 잘먹고 갑니다. 맛도 있고 덕분에 즐거운 한끼 했습니다~~",2025-01-04,"저녁에 방문, 예약 후 이용, 대기 시간 10분 이내, 친목, 친구",음식이 맛있어요,25,1
31906212,123****,아니 너무 친절한 응대로 안내해주셔서 너무 좋았어요ㅜㅜ저희가 8명이라 정신없으셨을텐데 다 신경써주셨어요그리고 메뉴들이 어른들이랑도 부담없이 먹기가 좋아요!!깔끔하고 맛나요 완존 추천!!!*❤️‍🔥🍀,2025-01-04,"저녁에 방문, 예약 후 이용, 대기 시간 바로 입장, 데이트, 친목, 나들이, 여행, 연인・배우자, 친구, 지인・동료",음식이 맛있어요,50,1
31906212,차밍쑤77,맛있지만 양과 가격이 살짝 아쉬운거같아요주말 점심에도 되는메뉴가 적어서 좀 아쉬웠어요그래도 맛있어요특히 반찬이 깔끔하니 맛있습니다!,2024-12-29,"점심에 방문, 예약 없이 이용, 대기 시간 바로 입장, 친목, 친구",음식이 맛있어요,65,1
31906212,토끼4114,김치볶음밥 매샹이굴국 튀감 생선구이등 음식이 맛있어요,2024-12-21,"점심에 방문, 예약 없이 이용, 대기 시간 바로 입장, 친목, 친구",음식이 맛있어요,917,1
31906212,갓 킴 옙,정말 하나도 맵지 않은 조림 ㅎ반찬도 그냥 무난하고요정갈해요참이슬 없고 진로만 있네요약간 대기하고 입장했습니다외국인이 먹기 좋은 한식집 같아요,2024-12-06,"저녁에 방문, 예약 후 이용, 대기 시간 30분 이내, 데이트, 연인・배우자",인테리어가 멋져요,68,1
31906212,St루이스,,2024-12-06,저녁에 방문,음식이 맛있어요,1647,1
31906212,sujisummer,문득문득 생각나는 감자치즈전 너무 맛있어요..💕,2024-12-03,"저녁에 방문, 예약 없이 이용, 대기 시간 10분 이내, 친목, 친구",음식이 맛있어요,52,1
31906212,예커벨,,2024-11-16,"점심에 방문, 예약 없이 이용, 대기 시간 바로 입장, 데이트, 친목",음식이 맛있어요,3357,1
31906212,도로시6366,음식 맛있어요.잡채가 특히 맛있었어요,2024-11-15,"점심에 방문, 예약 없이 이용, 대기 시간 바로 입장, 친목, 친구",재료가 신선해요,69,1
31906212,플로라황,맛있어요 모임하기도 좋구요 또 가고싶어요,2024-11-14,"점심에 방문, 예약 후 이용, 대기 시간 바로 입장, 친목, 친구",음식이 맛있어요,472,1
31906212,헬리찡,한남동에서 정갈한 한식🤎la갈비와 오징어볶음 냠냠,2024-11-08,저녁에 방문,음식이 맛있어요,492,1
31906212,avedagirl,다시 방문할 예정이에요 간도 잘 맞추시고 음식이 맛있어요!,2024-11-08,"점심에 방문, 예약 없이 이용, 대기 시간 30분 이상, 친목, 친구",음식이 맛있어요,868,1
31906212,굿굿바이브,10년이 넘어도 한결같기에 늘 대기가 있는게 아닐까요음식으로 위로와 힘을 받는다는게 뭔지알게해준 고마운 식당이랍니다!늘 응원 합니다 :),2024-10-28,"점심에 방문, 예약 없이 이용, 대기 시간 30분 이내, 일상, 기타",음식이 맛있어요,573,2
31906212,apr****,"김치볶음밥을 먹었는데, 미리 만들어놨던것을 담아서 갖다준느낌.베이컨은 뻣뻣해서  식었고 밥도 건조한 식감 .위에 올려진  수란은  즉석에서 해서 올려준것 같음.맛있다고 해서 갔는데   실망!   다시  가고싶진  않다.",2024-10-27,"점심에 방문, 예약 없이 이용, 대기 시간 바로 입장, 친목, 친구",특별한 메뉴가 있어요,426,1
31906212,우담바라45,예약후 편하게 이용했구요~음식은 조미를 최소한으로 해서 슴슴하고 좋았어요,2024-10-18,"저녁에 방문, 예약 후 이용, 대기 시간 바로 입장, 친목, 지인・동료",음식이 맛있어요,1554,1
31906212,노브달,점심 때 단품 먹었는데 하나같이 맛있었어요. 밥이 보약ㅎㅎ,2024-10-12,"점심에 방문, 예약 없이 이용, 대기 시간 30분 이내, 친목, 친구",음식이 맛있어요,363,1
31906212,쨔쟌쟌,"가격대가 꽤 있는 편이지만 맛도 괜찮습니다. 먹어본 메뉴중에는 갈비가 제일 맛있었고, 더덕구이는 조금 더 매콤했음 했어요! 그래도 전체적으로 발란스가 괜찮고 건강한 식사 느낌이라 좋았습니다!",2024-10-02,"점심에 방문, 예약 없이 이용, 대기 시간 10분 이내, 친목, 친구",음식이 맛있어요,866,1
31906212,찰랑소녀25,간이 딱 좋아요! 한끼 맛있게 잘먹고 갑니다.,2024-10-01,점심에 방문,음식이 맛있어요,1259,1
31906212,holystory,"한남동에서 건강한 한식을 찾기 어려운데, 한식으로 건강한 음식을 지인,친구와 먹기 좋을 것 같아요. 사람이 많았지만 기다린 만큼 맛이 담백했습니다. 하지만 양이 좀 적어 생각했던 것보다 많이 시켜야 하는 단점도 있는 것 같네요. 내부 인테리어와 분위기는 좋습니다!",2024-09-21,"저녁에 방문, 예약 후 이용, 대기 시간 30분 이내, 친목, 친구",음식이 맛있어요,45,1
31906212,파랑새93,퓨전 한식 같기도 한데 깔끔하고 건강한 밥상  느낌이랄까 ᆢ집밥처럼 맛있어요,2024-09-19,"점심에 방문, 예약 없이 이용, 대기 시간 바로 입장, 일상, 친구",건강한 맛이에요,438,1
31906212,강남요술봉,늘 줄이 길어서 못 먹었었는데 오늘은 다행히 점심시간에 딱 먹을수 있었습니다직장인이 점심으로 먹기에 비싸지만 맛은 있네요외국인도 많이 오네요👍,2024-09-11,"점심에 방문, 예약 없이 이용, 대기 시간 바로 입장, 일상, 지인・동료",음식이 맛있어요,368,1
31906212,리시안셔스777,학교 다닐때부터 들렀는데 10년이 넘도록 장사하고 계신줄 몰랐어요 한남동 가면 제일먼저 생각나는 맛집 이에요!,2024-09-08,"저녁에 방문, 예약 없이 이용, 대기 시간 바로 입장, 데이트, 연인・배우자",음식이 맛있어요,276,1
31906212,굿굿바이브,제육에 샤르도네 한잔이면 세상을다 가진 기분을 가질수 있군요 👍,2024-09-03,"점심에 방문, 예약 없이 이용, 대기 시간 바로 입장, 일상, 기타",음식이 맛있어요,573,1
31906212,merrysom,너무 열심히 먹어서 사진도 없네요! 밥다운 밥이 먹고 싶을 때! 따뜻한 밥한끼 대접하고 싶을 때 가는 밥맛집이에요! LA갈비 처음 먹어봤는데 너무너무 맛있고 더덕구이 갈때마다 먹는 메뉴에요!!,2024-08-17,"저녁에 방문, 예약 후 이용, 대기 시간 30분 이내, 친목, 친구",아늑해요,85,1
31906212,na217,"시작하기 10분 전 도착해서 줄을 섰습니다. 3번째 팀이었고 11시30분 정각에 들어가서 바로 주문하고 먹을 수 있었어요. 가정집 같은 아늑한 분위기에서 집밥같은 한식요리 잘 먹었습니다. 식당의 이름도, 식당에서 계속 울리는 배경 음악도, 주문을 받은 젊은 직원들도 전통적인 한식당의 느낌이 아니어서 오히려 경쾌하고 발랄한 느낌을 주었어요. 새로운 맛은 아니지만 집에서 해먹기는 너무 일이 많은 …. 그런 한국 음식들 맛깔나게 잘 먹었습니다. 특히 튀김을 정말 바삭하게 튀겨 주어 맛있었어요.",2024-08-15,"점심에 방문, 예약 없이 이용, 대기 시간 10분 이내, 나들이, 연인・배우자",건강한 맛이에요,28,1
31906212,아이러브토리,분위기 좋은 곳에서 맛있는 요리와 밥상을 먹고 갑니다!,2024-08-02,"저녁에 방문, 예약 없이 이용, 대기 시간 바로 입장, 친목, 지인・동료",음식이 맛있어요,212,1
31906212,악동왕군,뮤지컬 프라얜슈타인 보기전 저녁식사로 들렷습니다 한남스타일의 한식집 딱 맞는 것 같습니다 사이드로 시칸 잡채 맛있습니다,2024-07-30,"저녁에 방문, 예약 없이 이용, 대기 시간 바로 입장, 데이트, 일상, 연인・배우자",특별한 메뉴가 있어요,477,1
