place_id,nickname,content,date,situations,keywords,review_count,visit_count
1105842975,ysj****,음식은 괜찮아요. 너무맛있다는 아니고 가격비해 괜찮아요. 리뷰에 빨리나온다했는데 손님 한테이블밖에없었는데 주문하고 오래기다렸어요. 최소 20분넘게.,2024-07-06,"점심에 방문, 예약 후 이용, 대기 시간 바로 입장, 연인・배우자, 아이",음식이 맛있어요,9,1
1105842975,최고아부지,맛있당^^,2024-07-03,"저녁에 방문, 예약 없이 이용, 대기 시간 바로 입장, 일상, 연인・배우자, 아이",음식이 맛있어요,1147,3
1105842975,qufqufquf,"성북구 숨겨진 분위기 맛집 파스타 발견했어여... 💖✨ 투움바 진짜 맛있어여... 매콤하니 별로 안 느끼해서 아웃백보다 더 맛있는듯... ㅠㅠ 새우까지 합격,,!! 〰️💛 찹스테이크도 양 많구.. 버섯이랑 양파랑 마늘이랑 찹스테이크 두개 얹어서 먹으면 짱맛,,!! 🫶🏻",2024-06-30,"저녁에 방문, 예약 후 이용, 대기 시간 바로 입장, 데이트, 연인・배우자",음식이 맛있어요,45,1
1105842975,웡50,음식이 맛있고 아늑한 분위기에서 식사 하기 좋아요!,2024-06-25,"점심에 방문, 예약 후 이용, 대기 시간 바로 입장, 친목, 친구",음식이 맛있어요,24,1
1105842975,10****,매장이 너무 이쁘고 음식이 맛있어요😇💗,2024-06-25,"점심에 방문, 예약 후 이용, 대기 시간 바로 입장, 친목, 친구",음식이 맛있어요,42,1
1105842975,isa****,주말에 양식이 너무 먹고싶어서 집 주변 양식집을 찾아보던 중 메뉴도 다양하고 맛있다는 후기들이 많아서 이태리맨션에 방문했어용!!!모든 양식집의 메뉴를 합해놓았을만큼 메뉴가 많고 인테리어 예쁘고 음식도 빨리나와요ㅎㅎ양식집의 정석이에요 맛이 정말 고급지고 맛있다눙 근데 가겨이 저렴해서 짱짱 좋아요!!다들 믿고 방문하세요 ❤️,2024-06-22,"점심에 방문, 예약 없이 이용, 대기 시간 10분 이내, 데이트, 연인・배우자",음식이 맛있어요,49,1
1105842975,풍경소리1864,맛있어요,2024-06-19,"점심에 방문, 예약 후 이용, 대기 시간 바로 입장, 친목, 친구, 지인・동료",음식이 맛있어요,59,1
1105842975,비버3,음식은 가격도 그렇고 맛도 다 만족입니다 :)재방문의사 있어요🌸,2024-06-13,"저녁에 방문, 예약 후 이용, 대기 시간 바로 입장, 친목, 지인・동료",음식이 맛있어요,991,1
1105842975,hod****,"성신여대 파스타 맛집, 분위기 맛집 이태리 맨션에 다녀왔어요. 베스트메뉴인 투움바 파스타와 베스트 메뉴 못지 않은! 추천하고 싶은 봉골레 파스타, 부라타치즈 샐러드, 마르게리따 피자까지 다 맛있게 먹고 왔어요. 음식들도 전부 맛있지만 분위기가 아늑하고 따뜻한 느낌이어서 소개팅장소, 데이트 장소로 추천하고 싶은 곳이에요. 평일 점심엔 10프로 할인도 되니 꼭 가보세요👍🏻😆👍🏻",2024-06-13,"저녁에 방문, 예약 후 이용, 대기 시간 바로 입장, 친목, 지인・동료",인테리어가 멋져요,126,1
1105842975,공주26,맛있어요,2024-06-13,"저녁에 방문, 예약 후 이용, 대기 시간 바로 입장, 친목, 지인・동료",음식이 맛있어요,31,1
1105842975,채채c,성신여대 파스타 맛집이에요🩷🩷🩷소스도 찐하고 가격에 비해 양도 많고 정말 맛있어요!!!맛+분위기+가격+친절함까지 데이트하기 정말 좋은곳이에요☺️👍🏻조만간 또 방문하겠습니당😊,2024-06-09,"점심에 방문, 예약 없이 이용, 대기 시간 바로 입장, 데이트, 연인・배우자",음식이 맛있어요,27,1
1105842975,inn****,샐러드랑 파스타가 비주얼도 좋고 넘 맛있어요! 직원 분들도 모두 친절하세요 성신여대 파스타 맛집인것 같아요 재방문 할게요!!,2024-06-09,"점심에 방문, 예약 후 이용, 대기 시간 바로 입장, 데이트, 연인・배우자",음식이 맛있어요,81,1
1105842975,dylee1,베스트메뉴인 투움바 파스타랑 찹스테이크 시켰는데 둘다 진짜 맛있었어요! 가격은 저렴한데 양도 엄청 많고 맛있어서 정말 만족스러웠습니당 ㅎㅎ 매장 분위기도 좋아서 성신여대 데이트 맛집으로 강추합니다!,2024-06-06,"점심에 방문, 예약 후 이용, 대기 시간 바로 입장, 데이트, 연인・배우자",음식이 맛있어요,95,1
1105842975,승언98,가게 분위기 맛 모두모두 훌륭합니다. 데이트 장소로 추천드립니다,2024-06-05,"점심에 방문, 예약 없이 이용, 대기 시간 바로 입장, 데이트, 연인・배우자",음식이 맛있어요,195,1
1105842975,MK45,"성신여대 메인에서 조금 벗어난 골목길에 있는 파스타 맛집이에요. 매장 분위기 너무 좋고, 학교 앞이라 퀄리 대비 가성비 대박 파스타를 먹을 수 있는 곳입니다👍👍 투움바 파스타랑 스테이크 크림리조또 먹었는데 호불호없이 맛있는 맛 🫶 뭘 시켜도 실패가 없을 거 같아요💕",2024-05-30,점심에 방문,음식이 맛있어요,383,1
1105842975,꼬미꾸미56,"일단 분위기 너무 좋아요편안한 분위기에 구석구석 인테리어가 너무 멋져요크림리조토 진짜 완전 강추 👍 밥알 살아있으면서도 크림이 잘 스며들어있고 함께 나오는 스테이크 진심 살살 녹습니다파스타, 리조토 먹고 싶을때 또 방문하려구요",2024-05-28,"저녁에 방문, 예약 없이 이용, 대기 시간 바로 입장, 데이트, 연인・배우자",음식이 맛있어요,116,1
1105842975,닉네임을입력해주세요 네,,2024-05-17,"저녁에 방문, 예약 없이 이용, 대기 시간 10분 이내",음식이 맛있어요,306,2
1105842975,요미00,파스타•스테이크샐러드 두개 시켜서여자 둘이서  맛있게 잘먹었네요 ㅎㅎ 친구가 파스타를 별로 안좋아하는데 여기껀 맛있다고 칭찬하더라구요~ 소스가 찐해서 좋았어요!! 새우도 탱글하고! 사장님도 친절하시고 음식도 빨리 나와서 굿 bb예약하고 가니까 대기 필요없어서 넘 좋아여대박나세요 :),2024-05-17,"저녁에 방문, 예약 후 이용, 대기 시간 바로 입장, 친목, 친구",음식이 맛있어요,32,1
1105842975,Jude28,"한식파지만 친구가 찜해둔 이탈리안식당 방문. 우선 너무나 시끄럽고 번잡한 곳을 벗어나있는 뒷골목의 차분한 동네분위기가 무척 맘에 들었고 식당 내외부 모두 좋았습니다. 역시 한식파다보니 중간에 느끼해지는 건 어쩔 수 없었지만, 가장 인기있는 음식이라는 투움바파스타와 명란오일파스타 모두 맛있게 먹었습니다~ 맵기 표시가 돼있지만 덜 맵게 조절해주시네요.",2024-05-17,"저녁에 방문, 예약 없이 이용, 대기 시간 바로 입장, 친목, 친구",음식이 맛있어요,2262,1
1105842975,얍957,"도른놈~~~~~🤍🐽🤍투움바가 베스트 메뉴인데 봉골레도 진짜 마싯엇어요.,, 긋긋베리굿~~~~~}",2024-05-16,"점심에 방문, 예약 없이 이용, 대기 시간 바로 입장, 데이트, 연인・배우자",친절해요,42,1
1105842975,sea****,매년 종종 방문하는 곳이에요. 번화가 쪽도아니라 시끄럽지 않고 분위기도 너무너무 좋아요!음식도 너무 담백하고 맛있어용,2024-05-15,"저녁에 방문, 예약 후 이용, 대기 시간 바로 입장, 데이트, 연인・배우자",음식이 맛있어요,91,3
1105842975,GorgeousGG,분위기도 아늑하고 따뜻해서 마음이 편안해지는 공간이예요^^^재료도 신선하고 아낌없이 들어가있어요~~가성비가 매우 좋은 성신여대 맛집 인정💚,2024-05-15,"점심에 방문, 예약 후 이용, 대기 시간 바로 입장, 친목, 일상, 친구, 지인・동료, 아이",음식이 맛있어요,77,1
1105842975,mjy****,맛있어요. 고등학생이라고 물어보고 약과도 주셨어요. 서비스 대박👍 저희 다 그릇 설거지 했어요.,2024-05-10,"점심에 방문, 예약 후 이용, 대기 시간 바로 입장, 나들이, 친구",친절해요,24,1
1105842975,선택받은아이들,작년에 한번 와보고 너무 맛있던 기억이 남아서 다시 왔어요! 역시 맛있게 잘 먹고 갔습니다🙂그리고 친절하시고 분위기 아늑해서 좋아요,2024-05-08,"저녁에 방문, 예약 없이 이용, 대기 시간 바로 입장, 일상, 연인・배우자",음식이 맛있어요,1912,2
1105842975,로그유지니,기대 이상이예요!이 가격에 재료도 많이 들어가고 맛도 최고네요.파스타 두 가지 모두 간도 딱 맞고 첫 입부터 마지막까지 즐겁게 먹었어요.샐러드도 신선하고 가벼운 드레싱이라 너무 좋았습니다.조만간 또 방문할 것 같아요!,2024-04-28,"점심에 방문, 예약 후 이용, 대기 시간 바로 입장, 일상, 친구",음식이 맛있어요,687,1
1105842975,미니언니20,가격대비 맛있습니다.리조또가 제 입맛에 가장 맛있었습니다.정성스럽게 음식이 나왔고 친구들과 오랜만에좋은 시간을 보냈습니다.레몬에이드도 마셨는데 적당히 달면서 괜찮았습니다.주말에도 넘 분비지 않고 밥먹으며 기분 전환하기에 좋았습니다.,2024-04-27,"점심에 방문, 예약 후 이용, 대기 시간 바로 입장, 친목, 친구",음식이 맛있어요,121,1
1105842975,미브 meve,성신여대에 이런 데이트하기 딱좋은 파스타 맛집이 있었다니 ..❤️조용한 분위기에 도란도란 얘기하기 넘 좋았어요!투움바 파스타랑 명란크림 파스타 둘다 꾸덕한 맛이 너무 매력있었고찹스테이크도 한입 크기로 쏙쏙 넣어먹을 수 있어서 곁들임으로 딱이었어요 !!성신여대파스타 맛집은 이태리맨션입니다 ..💛,2024-04-24,"저녁에 방문, 예약 후 이용, 대기 시간 바로 입장, 데이트, 연인・배우자",음식이 맛있어요,29,1
1105842975,정파리아,제가 짱짱짱 좋아하는 파스타집중 하나에요!! 같이갓던 사람들 다 맛있다하는곳ㅎㅎ 분위기도 좋아서 기념일날 가도 좋을거같아유,2024-04-23,"저녁에 방문, 예약 없이 이용, 대기 시간 바로 입장, 데이트, 친척・형제",음식이 맛있어요,111,1
1105842975,반두라2,파스타맛집 맞네요ㅎㅎ #성신여대파스타맛집 #한성대맛집,2024-04-20,"점심에 방문, 예약 후 이용, 대기 시간 바로 입장, 데이트, 연인・배우자",음식이 맛있어요,475,1
1105842975,네네00,자주가고 좋아하는 동네 맛집입니다 : ),2024-04-17,"점심에 방문, 예약 후 이용, 대기 시간 바로 입장, 친목, 지인・동료",친절해요,24,32
1105842975,예지39,"집주변에 있는 맛집이여서 지나갈때마다 보고 이제야 방문해봤는데왜이제야 방문했는지..ㅠㅠㅠ분위기부터 가성비, 맛까지 다 최고였어요요근래 먹은 양식집중 베스트1위 맛집이었습니다남친이랑 방문했는데 둘다 단골되서 조만간 또 방문하려구요💗💗",2024-04-14,"저녁에 방문, 예약 없이 이용, 대기 시간 바로 입장, 데이트, 일상, 연인・배우자",음식이 맛있어요,433,1
1105842975,vanilla dream,"평소에는 그리 즐기지 않던 투움바파스타에 끌려, 바로 검색하고 찾아오게되었던 성신여대파스타맛집, 특히나 크리미하게 매콤한 투움바파스타 맛집 이태리맨션! 개인적으로 아주 가볍게 먹어야지, 혼밥 여유롭게 즐겨야지 싶어 방문했는데, 왠걸 입짧은 내가 거의 그릇을 설겆이하다싶이 맛스럽게 배부르게 즐긴 한 끼네요.단, 나 빼고 전부 커플데이트, 소개팅자리로 인기 좋았던 곳이니만큼, 다음 방문은 여유롭게 성신여대 데이트코스로 넣어 남자친구와 재방문해야겠다 싶던 곳! 혹시나 성신여대 소개팅 성공 확률 높이고 싶은 분들이거나, 혹은 데이트 장소 센스있게 고르고 싶은 분들께는 1순위로 추천이요!",2024-04-14,"점심에 방문, 예약 없이 이용, 대기 시간 바로 입장, 일상, 혼자",음식이 맛있어요,1077,1
1282435530,100****,리뷰보고왔는데 청결하고 맛있어요 야채종류많이있어서 아주좋아요 추천합니당,2025-04-10,"저녁에 방문, 예약 없이 이용, 대기 시간 바로 입장, 친목, 친구",음식이 맛있어요,92,1
1282435530,hyo****,"고기 질이 일단 너무 좋고, 성신여대 주변 고기집 중에서 가장 인테리어가 고급집니다 👍",2025-04-10,"저녁에 방문, 예약 없이 이용, 대기 시간 바로 입장, 데이트, 연인・배우자",음식이 맛있어요,12,1
1282435530,포도53,깔끔하고 고기맛있고!서비스도 최고!,2025-04-10,"저녁에 방문, 예약 후 이용, 대기 시간 바로 입장, 가족모임, 부모님",음식이 맛있어요,9,1
1282435530,yeo****,매장 분위기 깔끔하고 김치랑 미나리 조합이 미쳤어요. 역시 삼겹살은 근본,2025-04-10,"저녁에 방문, 예약 없이 이용, 대기 시간 바로 입장, 친목, 친구",인테리어가 멋져요,252,1
1282435530,체리블라쏨,고기가 맛있고 야채도 신선해요! 김치가 정말 맛있는데 국내산김치를 부족하면 넉넉하게 리필해주셔서 너무 좋았습니다👍🏻그리고 사장님이 잘생겼어용,2025-04-10,"저녁에 방문, 예약 없이 이용, 대기 시간 바로 입장, 일상, 부모님",매장이 청결해요,10,1
1282435530,히야5344,,2025-04-08,"저녁에 방문, 예약 없이 이용, 대기 시간 바로 입장, 데이트, 연인・배우자",고기 질이 좋아요,7,1
1282435530,mrsong84,셀프바에 야채도 많고 고기도 맛있어요^^,2025-04-08,"저녁에 방문, 예약 없이 이용, 대기 시간 바로 입장, 데이트, 연인・배우자",음식이 맛있어요,9,3
1282435530,bla****,맛있어요 저번주에도 왔는데 친구들과 또 먹으러왔어요 ㅎㅎ 가성비 짱 맛도 좋아요,2025-04-07,"저녁에 방문, 예약 없이 이용, 대기 시간 바로 입장, 데이트, 친목, 친구",음식이 맛있어요,10,2
1282435530,칸타빌레2436,너무 맛있게 잘 먹었습니다 재방문하고 싶은 곳입니다,2025-04-07,"저녁에 방문, 예약 없이 이용, 대기 시간 바로 입장, 데이트, 연인・배우자",인테리어가 멋져요,25,1
1282435530,수빈1342,"성신여대 고기집은 금뚜껑이 최곱니다 :)고기도 너무 맛있고, 계란찜, 쫄면도 너무 맛있어요후식 아이스크림까지 짱!!#성신여대맛집#성신여대 고기집#성신여대삼겹살#금뚜껑",2025-04-07,"저녁에 방문, 예약 없이 이용, 대기 시간 바로 입장, 데이트, 부모님",음식이 맛있어요,34,3
1282435530,벋이언니,시설도 깔끔하고 맛도 너무 좋았어요 깔끔한 분위기에서 좋은 식사하고 갑니다 ㅎㅎ#성신여대고깃집#성신여대삼겹살,2025-04-07,"저녁에 방문, 예약 없이 이용, 대기 시간 바로 입장, 데이트, 연인・배우자",인테리어가 멋져요,23,1
1282435530,soobiiin,마싯어용~!~!~!~~#성신여대고깃집 #성신여대 맛집,2025-04-07,"저녁에 방문, 예약 없이 이용, 대기 시간 바로 입장, 일상, 지인・동료",음식이 맛있어요,42,2
1282435530,나다ㅇ,맛있어요~,2025-04-07,"저녁에 방문, 예약 없이 이용, 대기 시간 바로 입장, 가족모임",음식이 맛있어요,51,2
1282435530,이우영79,"역시 성신여대맛집, 너무 맛있게 잘먹었습니다 직원분들더 친절하시고 되게 깔끔해요 재방문 확정이요~!",2025-04-07,"저녁에 방문, 예약 없이 이용, 대기 시간 바로 입장, 데이트, 연인・배우자",음식이 맛있어요,27,1
1282435530,뾰로롱콩,아기랑 이곳을 자주오는데 아기의자도 있고 아이스크림 있어서 좋아요!고기맛도좋고! 맛있어서 자주오게되네요!,2025-04-07,"저녁에 방문, 예약 없이 이용, 대기 시간 바로 입장, 데이트, 연인・배우자",음식이 맛있어요,33,3
1282435530,bea****,,2025-04-06,"저녁에 방문, 예약 없이 이용, 대기 시간 바로 입장, 데이트, 연인・배우자",음식이 맛있어요,3,1
1282435530,ekk****,성신여대 맛집 찾으시면 금뚜껑 추천 해요!홀도 크고 가족모임으로 제격이에요!성신여대 고깃집 추천 합니덩,2025-04-06,"저녁에 방문, 예약 없이 이용, 대기 시간 바로 입장, 데이트, 연인・배우자",인테리어가 멋져요,2,1
1282435530,냠냠이599,맛있고 깔끔하고 친절하십니다!!,2025-04-06,"저녁에 방문, 예약 없이 이용, 대기 시간 바로 입장, 데이트, 연인・배우자",음식이 맛있어요,2,1
1282435530,asdf1216,직원분들도 친절하시고 반려동물 동반도 흔쾌히 허락해주셔서 감사했어요! 고기도 너무 맛있어서 추가해서 먹었어요 ㅎㅎ,2025-04-06,"저녁에 방문, 예약 없이 이용, 대기 시간 바로 입장, 데이트, 연인・배우자",음식이 맛있어요,24,1
1282435530,REG16O,미쳐버린 맛입니다! 고기 질도 좋고 양도 넉넉하고 계란찜은 말해뭐해!! 성신여대 맛집으로 강추입니다ㅎㅎ,2025-04-06,"저녁에 방문, 예약 없이 이용, 대기 시간 바로 입장, 친목, 친구",음식이 맛있어요,19,1
1282435530,heroine rin,서비스가 좋고 양도 많아요!이른 저녁까진 괜찮은데 밤에 오면 너무 사람이 많을 것 같아요ㅜㅜ음식도 맛있습니다 ㅎㅂㅎ,2025-04-06,"저녁에 방문, 예약 없이 이용, 대기 시간 바로 입장, 데이트, 연인・배우자",음식이 맛있어요,375,1
1282435530,q__****,두번째 방문!!아이들이 너무 좋아해서 재방문 했어욕!!오늘도 맛있게 먹었네요~~재재방문 할것 같아요~~^^,2025-04-05,"저녁에 방문, 예약 없이 이용, 대기 시간 바로 입장, 일상, 가족모임, 연인・배우자, 아이",음식이 맛있어요,27,1
1282435530,duk****,#성신여대맛집#성신여대고깃집,2025-04-05,"저녁에 방문, 예약 없이 이용, 대기 시간 바로 입장, 일상, 친구",음식이 맛있어요,4,1
1282435530,gan****,#성신여대맛집 #성신여대고깃집 맛있어용 ㅎㅎ,2025-04-05,"저녁에 방문, 예약 없이 이용, 대기 시간 바로 입장, 친목, 친구",음식이 맛있어요,5,1
1282435530,bb1****,부부동반 예약해서 왔는데 삼겹ㆍ목살ㆍ항정 모두 맛있네요~ 야채도 싱싱하고 신나게 먹었어요  계란찜 짱 맛나요~ 와서 드셔 보셩^^,2025-04-05,"저녁에 방문, 예약 후 이용, 대기 시간 바로 입장, 친목, 친구",음식이 맛있어요,629,1
1282435530,helloskyblue,가족식사로 온 식당인데1차로 인테리어에 반하고2차로 싱싱한 고기에 반했어요 고기도 너무 맛있고 아이들과 오니 룸으로 자리 잡아주셔서 편안하게 먹고 왔네요,2025-04-05,"점심에 방문, 예약 없이 이용, 대기 시간 바로 입장, 가족모임, 아이, 부모님",고기 질이 좋아요,27,1
1282435530,식혜8,고기가 신선해서 맛있네요!! 밑반찬도 깔끔하고 계란찜도 엄청 푸짐하고 맛있네요  셀프코너 채소들도 신선하고 맛있습니다👍,2025-04-05,"점심에 방문, 예약 후 이용, 대기 시간 바로 입장, 여행, 친구",음식이 맛있어요,7,1
1282435530,ant****,요즘 감성에 맞춘 삼겹살집이에요. 하이볼이나 제로음료도 잘 갖춰져 있어서 다양한 취향의 사람들이 한 데 모여 식사하기 좋아요.친절하고 맛있습니다. 성신여대 대표 고깃집으로 손색이 없어요. 성신여대 삼겹살 찾는다면 금뚜껑이요^^,2025-04-05,"점심에 방문, 예약 없이 이용, 대기 시간 바로 입장, 일상, 연인・배우자",음식이 맛있어요,11,1
1282435530,염자오밍,맛있어서 자주와요 메뉴도 다양하고 아이랑 오기좋아요,2025-04-04,"점심에 방문, 예약 없이 이용, 대기 시간 바로 입장, 가족모임, 아이",음식이 맛있어요,298,2
1282435530,세히218,와우..!! 친구가 추천해줘서 왔는데 너무 양도 많구 세심하게 신경쓴 부분들이 너무 잘보여서 감동이었어요~!!ㅎㅎ쌈두 무제한이구 고기도 많고 특히 세트 조합이 알차서 진짜 배부르게 먹을 수 있었어요~! 비빔면도 고기랑 먹으니까 짱맛~!! 또 올게요!!,2025-04-04,"점심에 방문, 예약 없이 이용, 대기 시간 바로 입장, 친목, 친구",음식이 맛있어요,21,1
1282435530,zyy****,너무 맛있게 먹었습니다~,2025-04-03,저녁에 방문,음식이 맛있어요,9,1
1282435530,미니ming,고기가 무항생제라 맛있어요 서비스계란찜에 비빔면 짱짱맛야채도 종류가 많아서 너무 좋아요일하시는 분들도 친절하시고 더군다나 3초를 잡아라! 이벤트 너무 재밌습니다! 금뚜껑 방문만 n번째!!!다음에 또 올께용♥,2025-04-03,"저녁에 방문, 예약 없이 이용, 대기 시간 바로 입장, 데이트, 연인・배우자",음식이 맛있어요,40,3
1282435530,메인서클,여자친구랑 왔는데 너무 좋습니다ㅎㅎ,2025-04-03,"저녁에 방문, 예약 없이 이용, 대기 시간 바로 입장, 데이트, 연인・배우자",음식이 맛있어요,12,1
1282435530,희수맘65,매장도 깔끔하고 고기도 맛있고 쌈야채종류도 많고신선하고 원하는종류를 가져올수 있어 좋아요~~친절해서 기분좋은 모임 갖었어요~^^,2025-04-02,"저녁에 방문, 예약 없이 이용, 대기 시간 바로 입장, 친목, 친구",음식이 맛있어요,5,1
1282435530,bla****,인테리어도 고급인데 맛도 엄청 좋고 서비스도 팍팍 챙겨주십니다 돈 많이나올줄 알았는데 서비스 먹다보니 가성비 식당이 되버렷..이정도면 맨날 와야될듯,2025-04-02,"저녁에 방문, 예약 없이 이용, 대기 시간 바로 입장, 데이트, 친목, 친구",음식이 맛있어요,10,1
1282435530,KK100,첫방문인데 음식 하나하나가 다 맛있어서 또 먹으러 올 것 같아요😊 직원분들고 친절하시고 맛있어요 !!,2025-04-01,"저녁에 방문, 예약 없이 이용, 대기 시간 바로 입장, 데이트, 연인・배우자",인테리어가 멋져요,56,1
1282435530,caterina,#성신여대맛집#성신여대삼겹살 금뚜껑삼겹살 맛있어요 계란찜도 맛있네요,2025-04-01,"저녁에 방문, 예약 없이 이용, 대기 시간 바로 입장, 데이트, 친목, 아이",고기 질이 좋아요,531,1
1282435530,오유나8,맛있어서 허겁지겁 먹었어요 서비스도 좋고  하이볼도 괜찮아요,2025-04-01,"저녁에 방문, 예약 없이 이용, 대기 시간 바로 입장, 회식, 지인・동료",고기 질이 좋아요,877,1
1282435530,Amy112,금뚜껑은 늘.. 맛있습니다!!!!!!!!!!단체로 오기에도 최고고 성신여대생 최고 복지라고 해도 될 정도로 서비스도 좋아요 ❤️❤️ 이미 자주 오지만 더 자주 올게요 🌸⭐️,2025-04-01,"저녁에 방문, 예약 없이 이용, 대기 시간 바로 입장, 데이트, 연인・배우자",단체모임 하기 좋아요,17,3
1282435530,ㅇㅈㅅ5824,직원분들이 너무너무 친절하시고 고기가 맛있어요~~~^^!!,2025-04-01,"저녁에 방문, 예약 후 이용, 대기 시간 바로 입장, 회식, 지인・동료",음식이 맛있어요,7,1
1282435530,yunso0405,삼겹살은 물론 서비스 계란찜도 완전 맛있어요! 친절하시고 뒤에 룸도 있어서 단체로 오기 좋을 것 같아요 성신여대 삼겹살 맛집 입니당 깔끔해서 좋아요 추천!,2025-03-31,"저녁에 방문, 예약 없이 이용, 대기 시간 바로 입장, 데이트, 연인・배우자",음식이 맛있어요,17,1
1282435530,vintage1116,,2025-03-30,"저녁에 방문, 예약 없이 이용, 대기 시간 바로 입장, 친목, 연인・배우자",음식이 맛있어요,18,1
1282435530,ssophy,너무 맛있어요 :)비빔면도 최고,2025-03-30,"저녁에 방문, 예약 없이 이용, 대기 시간 바로 입장, 일상, 연인・배우자",음식이 맛있어요,6,1
1282435530,mimi6779,너무 너무 맛있게 먹어서 고맙습니다. 비빔면이랑 계란찜이나 고기랑 너무 너무 맛이 좋아요. 다음에 또 올 예정이에요. 서비스 너무 만족합니다. 감사합니다.,2025-03-30,"저녁에 방문, 예약 없이 이용, 대기 시간 바로 입장, 데이트, 연인・배우자",음식이 맛있어요,18,1
1282435530,제이유17,신선한 고기와 야채가 좋아요특히! 계란찜과 비빔국수가 진짜 맛있어요!!미나리가 더 많으면 좋을것 같기도해요;)너무 맛있고 깔끔해서 추천해요!,2025-03-30,"저녁에 방문, 예약 없이 이용, 대기 시간 바로 입장, 친목, 지인・동료",인테리어가 멋져요,456,1
1282435530,이지훈3178,데이트할때 저녁먹을 곳 고민하다가 그냥 딱 보이는 곳으로 들어왔는데 후회없는 선택 한 것 같습니다 매장 깔끔하고 음식 고기 다 맛있게 잘 먹었습니다😋👅,2025-03-30,"저녁에 방문, 예약 없이 이용, 대기 시간 바로 입장, 연인・배우자",음식이 맛있어요,8,1
