place_id,nickname,content,date,situations,keywords,review_count,visit_count
1404644688,와우7535,굿,2025-04-07,저녁에 방문,특별한 메뉴가 있어요,3818,9
1404644688,네프탈리,가성비좋고 음식도 맛있어요!!추천드려요,2025-04-05,"점심에 방문, 예약 없이 이용, 대기 시간 바로 입장, 데이트, 연인・배우자",음식이 맛있어요,454,1
1404644688,lee****,"오르다피자 길음점에서 반반피자(더블불고기+킹쉬림프)와 크림치즈볼 주문해봤어요.토핑이 아낌없이 올라가 있어서 한 입 베어무는 순간 풍성한 맛이 퍼져요.킹쉬림프는 매콤하고 통통한 새우 식감이 매력적이었고, 불고기는 달짝지근한 맛이 좋아요.치즈 크러스트 도우 덕분에 끝까지 맛있게 먹을 수 있었어요.크림치즈볼은 겉은 바삭, 속은 부드러운 치즈가 꽉 차 있어서 별미였어요.가격 대비 만족도 높았고, 다음엔 다른 메뉴도 도전해보고 싶네요!",2025-04-03,"저녁에 방문, 포장·배달 이용, 대기 시간 바로 입장, 일상, 혼자",친절해요,28,1
1404644688,lee****,매장에서 먹고 너무 맛있어서 친척집 가는길이라 부자피자로 두판 급 포장추가 했어요. 도우끝도 맛있고 먹고 난 다음 속도 편해서 너무 좋네요. 연세있으신 어르신께 사드렸는데 맛있게 드셨어요. 훈제치킨도 튀김옷이 없어 깔끔하고 시원한 맥주랑 딱이네요. 포장은 피자한판에  6천원 할인까지 있어 너무 좋아요.,2025-04-02,"점심에 방문, 예약 없이 이용, 대기 시간 바로 입장, 일상, 연인・배우자",음식이 맛있어요,1,1
1404644688,ju****,방문포장주문시 할인해서 좋아요 맛도 좋아요,2025-04-02,"점심에 방문, 예약 없이 이용, 대기 시간 바로 입장, 일상, 혼자",음식이 맛있어요,582,2
1404644688,제이짱71,아이가 좋아해서 자주 먹어요네이버로 주문은 처음인데편하고 좋네요^^,2025-03-31,"저녁에 방문, 포장·배달 이용, 대기 시간 바로 입장, 일상, 혼자",아늑해요,37,1
1404644688,라이크하옹,길음역 맛집 오르다피자에서 고구마피자 먹고 왔어요홀에서 먹으니까 스파게티가 서비스~!~!세트 시켜서 텐더치킨꺼지 야무지게 먹었더니왕배불 그 자체✨나중에는 근본인 페퍼로니 시켜야지✌️,2025-03-30,"점심에 방문, 예약 후 이용, 대기 시간 바로 입장, 일상, 친척・형제",친절해요,101,1
1404644688,먹샷,성북구 길음동 피자맛집 오르다피자에 다녀왔어요. 갓구운 수제숙성도우로 피자를 만들어 정말 맛있더라고요. 포장주문 하면 만원에 피자 한판을 먹을 수 있다니.. 집 근처에 있으면 매일 가고 싶을 정도예요. 스파게티도 일반 피자집의 그 맛이 아니에요.치즈가 진짜 맛있었어요 진짜 강추!!,2025-03-29,"점심에 방문, 예약 후 이용, 대기 시간 바로 입장, 데이트, 연인・배우자",음식이 맛있어요,365,1
1404644688,백색와이프,집에갈때마다 항상 궁금했던 오르다피자🍕이번에는 냄새에 이끌려 자연스럽게 들어가서 주문했는데 정말 맛도리 인정이요 반반피자로 콤비네이션과 페퍼로니피자 진심 집에올때까지 참기 버거웠네요 사이드로 주문한 핫윙 최고예요 역시 전문가가 만든게 최고예요,2025-03-26,"저녁에 방문, 예약 후 이용, 대기 시간 바로 입장, 데이트, 연인・배우자",음식이 맛있어요,19,1
1404644688,jye99,"오르다반반피자로 스테이크퐁듀피자와 킹쉬림프 피자 먹었습니다. 가격이 저렴한 편이라 조금 식으면 도우도 딱딱해지고 토핑도 별로 없겠거니 했는데, 완전한 착각이었어요! ⭐️도우 정말 쫄깃하고 바삭해서 맛있고 토핑도 엄청 신선하고 적지 않습니다!!!⭐️심지어 매장에서 먹으면 치즈 가득한 스파게티가 무료고, 테이크아웃하면 피자가 엄청 할인되서, 배달기사분들보다 손님들이 훨씬 많았어요. 피자집에 배달기사보다 손님들이 더 많은 거 처음 봅니다. 처음 방문이었는데 직원분들도 굉장히 친절하시고, 집 근처라 종종 들러 피자 먹어야겠어요!!! 진짜 진짜 추천합니다!!!!!",2025-03-25,"저녁에 방문, 예약 후 이용, 대기 시간 바로 입장, 데이트, 연인・배우자",인테리어가 멋져요,40,1
1404644688,곰돌이84,맛있어요 토핑이 많아요,2025-03-25,"점심에 방문, 포장·배달 이용, 대기 시간 30분 이내, 일상, 혼자",음식이 맛있어요,1937,5
1404644688,냐옹이파이터,"요즘 피자 너무 비싸서 사먹을 엄두가 안 났는데 오르다피자 포장 할인이 많이 되길래 사먹어봤어요가족끼리 먹으려고 세트 1번(불새피자, 치즈크러스트 추가 치즈오븐스파게티, 콜라)에 피클세트 추가해서 포장할인 받으니 25000원이었습니다 ^.^요즘 물가 생각하면 너무 저렴한 편이라, 저가형 피잣집 맛일거라 생각했는데 재료도 듬뿍 들어가있고 따끈따끈 너무 맛있었어요.. 매장에서 먹어도 이런저런 이벤트가 많은 것 같더라고요. 사장님도 너무 친절하셔서 이제 피자 포장은 오르다에 정착하려고요!! 번창하세요🫶",2025-03-24,"저녁에 방문, 예약 후 이용, 대기 시간 바로 입장, 일상, 친구",음식이 빨리 나와요,954,1
1404644688,경히0505,*내돈내산* 치즈피자 미쳤어요ㅠㅠㅠㅠ 다른 피자집 갈 필요없음 가성비 맛집 오르다로 ㄱㄱ Mz입맛 겨냥 할머니 사다드렸는데 할머니도 진짜 마싯대요 도미노만 좋아하셨는데 이젠 여기만 드신다는데요 큰일 났어요ㅠ 단골예약입니다 집 밑에 이런 맛집 생겨서 너무 좋아요ㅜㅜㅜㅜㅜ다음엔 다른 피자도 먹어봐야겠어요 방문 포장하면 6천원 할인 된다해서 무조건 방문포장 합니다 마니와주세용용사장님 너무 친절하셔서 괜스레 기분 좋아지네요 ㅎㅎㅎ번창하세요 엄청 맛있어요,2025-03-23,"저녁에 방문, 예약 없이 이용, 대기 시간 바로 입장, 데이트, 연인・배우자",매장이 넓어요,169,1
1404644688,s_y****,다 맛있어보여서 뭘 먹어야할지 선택하기 어려웠는데 사장님의 친절한 안내로 고구마 피자를 먹어봤어요🙂달콤한 고구마와 고소한 치즈는 최고의 조합이였습니당!!! 고구마 좋아하는 사람… 오르다 피자에 고구마피자 강추드립니다👍🏽👍🏽👍🏽 내돈내산 리뷰입니당다음에는 무슨 피자를 먹어볼지 행복한 고민중입니다재방문 의사 200% …,2025-03-23,"저녁에 방문, 예약 없이 이용, 대기 시간 바로 입장, 데이트, 연인・배우자",인테리어가 멋져요,16,1
1404644688,kensin818,,2025-03-22,"점심에 방문, 포장·배달 이용, 대기 시간 30분 이내, 일상, 혼자",음식이 맛있어요,664,3
1404644688,우리유나,,2025-03-15,"저녁에 방문, 예약 후 이용, 대기 시간 바로 입장, 일상, 가족모임, 아이",음식이 맛있어요,13,3
1404644688,ifonly18,매번맛있는집열기전에 리뷰부터쓰는집 ㅎㅎ여기는 매번 엄마네꺼랑 저희집꺼 시켜서 픽업가요~덕분에 자꾸자꾸 피자먹게됩니다!계속 리뷰남겨서 오~~래장사하게 할꺼에요!!추천해요!!!,2025-03-13,"저녁에 방문, 포장·배달 이용, 대기 시간 바로 입장, 일상",음식이 맛있어요,27,2
1404644688,와우7535,굿,2025-03-11,저녁에 방문,특별한 메뉴가 있어요,3818,8
1404644688,쏘피5637,고구마피자 포장 주문하고 집와서 먹자마자 너무 맛있어서 리뷰이벤트도 아닌데 리뷰쓰러 왔어요!! 강추합니다👍🏼,2025-03-11,"저녁에 방문, 예약 없이 이용, 대기 시간 바로 입장",매장이 청결해요,86,1
1404644688,김지혜7774,맛있어요!! 오늘도 잘 먹었습니다,2025-03-10,"저녁에 방문, 포장·배달 이용, 대기 시간 바로 입장, 일상, 연인・배우자",친절해요,18,1
1404644688,차돌이50,.,2025-03-10,"점심에 방문, 포장·배달 이용, 대기 시간 10분 이내, 일상, 아이",음식이 맛있어요,1774,4
1404644688,yy1****,,2025-03-07,"저녁에 방문, 포장·배달 이용, 대기 시간 10분 이내, 혼자",가성비가 좋아요,1746,3
1404644688,티노,항상 포장/픽업으로 잘 먹고있어요. 가성비가 너무 좋고 피자+파스타 맛도 왠만한 다른 프랜차이즈 피자집보다 좋습니다,2025-03-05,"저녁에 방문, 포장·배달 이용, 대기 시간 10분 이내, 일상, 연인・배우자",음식이 맛있어요,389,1
1404644688,와우7535,굿,2025-03-04,저녁에 방문,특별한 메뉴가 있어요,3818,7
1404644688,zm****,깔끔하고 신선해요 너무 맛있게 잘먹었습니다 치즈도 완전 맛있고 !!가성비도 너무 좋아요 매장에서 먹나 테이크아웃해서 먹나 헤택이 좋아서 자주올듯합니다 사장님도 너무 친절하셔서 기분좋은 한끼였습니다!!!👍👍👍👍👍,2025-03-03,"저녁에 방문, 예약 후 이용, 대기 시간 바로 입장, 친목, 연인・배우자, 친구",음식이 맛있어요,47,1
1404644688,프레지,또 먹을거에요!,2025-03-03,"점심에 방문, 포장·배달 이용, 대기 시간 10분 이내",음식이 맛있어요,179,1
1404644688,오드리하루,"동네에 피자맛집이 생겼다고 해서 아이랑 같이 왔는데치킨이랑 피자반반 세트가 있어서 너무 좋았어여남편, 아이 입맛 다 고려해서 반반피자 주문하고 치킨이랑같이 먹었는데 너무 맛있어요. 여기 단골될 것 같아요금액도 저렴하고 여기 가성비 최고에요!!! 아 홀에서 식사할 경우 스파게티랑 샐러드 둘 중 하나 서비스 주시는데 저는 스파게티 먹었는데 이게 또 완전 최고에요. 밥하기 싫은 주말에 가족외식 잘하고 갑니다!!!",2025-03-02,"저녁에 방문, 예약 없이 이용, 대기 시간 바로 입장, 일상, 연인・배우자, 아이",음식이 맛있어요,79,1
1404644688,rm****,싸고 맛이 좋아요 친절해요,2025-03-01,"점심에 방문, 예약 없이 이용, 대기 시간 바로 입장, 데이트, 연인・배우자",음식이 맛있어요,29,1
1404644688,fly****,방문 포장 할인 가성비도 너무 좋고 피자가 진짜 맛있어요 ^^ 다음엔 매장에서 먹어보고 싶어요 피자도 정말 맛있고 사장님도 친절하셔서 재방문 의사 매우 있습니다 ^^,2025-02-28,"저녁에 방문, 예약 후 이용, 대기 시간 바로 입장, 일상, 혼자",친절해요,941,1
1404644688,디혜1,방문포장을했는데 6000원이나 할인이 됬어요!!만원피자들도 있던데 요즘같은 시대에 피자한판이 만원이라니..진짜 대박이죠!!도우도 자가제면이라 그런지 엄청 쫀득하고 저는 반반피자로 콤비랑 불새로 주문했는데 토핑도 장난아니고 특히 불새완전추천이에요사이드로 윙이랑 스파게티도 먹었는데 윙이 얼마나 맛있는지 까탈스런 신랑이 윙 4개나 먹어서 맛있는 윙은 1개밖에 못먹었어요ㅠㅠ,2025-02-27,저녁에 방문,음식이 맛있어요,481,1
1404644688,shwl2345,피자가 만원대인 것 부터 너무 만족스러웠는데너무 맛있고 재료도 가득해서 다음에 또 주문하려고 합니다! ☺️특히 고구마피자 추천합니다 👍🏻,2025-02-23,"저녁에 방문, 포장·배달 이용, 대기 시간 바로 입장",음식이 맛있어요,1200,1
1404644688,와우7535,굿,2025-02-23,점심에 방문,특별한 메뉴가 있어요,3818,6
1404644688,Oll9803,"집 근처에 새로 생겼다고 해서 궁금해 방문했습니다. 테이크아웃 이벤트 중이라 좋은 가격으로 피자 두 판 구매해서 먹었습니다. 정말 맛있게 먹었고, 다른 크러스트 추가 없이 일반 도우로 먹었는데 두껍지 않고 적당히 얇은 편이라 오히려 만족했습니다. 수제 요거트 소스가 피자랑 정말 잘 어울렸습니다. 아 픽업하고 나갈 때 요거트 소스 더 구매하려고 했더니 서비스로 주셨습니다 ㅎㅎㅎ 감사했어요 사장님들 친절하셨고, 매장도 깨끗했습니다. 다음에 피자 먹고 싶으면 여기서 다른 피자도 사서 먹어보려구요. 암튼 맛있게 잘 먹었습니다~",2025-02-22,"저녁에 방문, 포장·배달 이용, 대기 시간 10분 이내, 일상, 부모님",음식이 맛있어요,4,1
1404644688,djk****,방문포장시 만원피자라니!! 방문포장혜택이너무좋아요~요새어디가서도 없을 가성비가격! 직접반죽해 48시간숙성한 쫀득한 수제도우와푸짐한토핑까지~치즈오븐스파게티도치즈가듬뿍들어가있어서 너무맛있어요~사장님~어디가지마시고 오래오래 이자리를지켜주세요^^ 피자가땡긴다면 갓성비인 오르다피자!!,2025-02-22,"점심에 방문, 포장·배달 이용, 대기 시간 10분 이내, 데이트, 연인・배우자",음식이 맛있어요,60,1
1404644688,차차럭스네,싸게 포장해와서 집에서 가족들과맛있게먹었오요 ^^,2025-02-22,"점심에 방문, 예약 후 이용, 대기 시간 바로 입장, 일상, 혼자",음식이 맛있어요,143,1
1404644688,롯데월드 송곳니,"피자랑 사이드메뉴 스파게티가 정말 맛있어요! 가격이 싸고 양도 많아서 가성비 최고입니다. 매장이 청결하고 사장님, 직원 모두 친절하셔서 기분 좋게 포장받고 나왔습니다. 특히 직원분이 잘생겼어요! 다음에도 방문포장할 의향 있습니다. 번창하세요!",2025-02-21,"저녁에 방문, 포장·배달 이용, 대기 시간 바로 입장, 일상, 회식, 부모님",음식이 맛있어요,1,1
1404644688,goo****,맛나요,2025-02-21,"저녁에 방문, 예약 없이 이용, 대기 시간 10분 이내",가성비가 좋아요,159,3
1404644688,Koooook,수제도우의 갓성비 넘치는 길음동 피자 맛집입니다.가격은 저렴한데 퀄리티는 매우 좋았어요!!방문포장하면 기본할인 6천원에 5일25일은 오르다데이로 7천원씩 할인해주더라고요!,2025-02-21,"저녁에 방문, 예약 후 이용, 대기 시간 바로 입장, 데이트, 연인・배우자",음식이 맛있어요,57,1
1404644688,지나4,치즈피자 1만원에 포장 주문했어요. 토핑이 듬뿍 올라가서 맛있고 도우도 바삭하고 도톰해서 맛있었어요~가게가 깔끔하고 직원븐들이 친절해요. 가격이 저렴해서 마음에 들고 또 방문하게 될 것 같아요,2025-02-17,"점심에 방문, 포장·배달 이용, 대기 시간 30분 이내, 일상, 혼자",음식이 맛있어요,548,1
1404644688,맛집똑똑똑,오르다 피자를  처음 맛봣는데토핑도 많고 맛의풍미도 좋네요다음에도 방문하고 싶어요,2025-02-17,"점심에 방문, 예약 없이 이용, 대기 시간 바로 입장, 일상, 혼자",재료가 신선해요,291,1
1404644688,ifonly18,"와~ 배달만시켜먹었는데,남편이랑 도서관가던길에 포장할인이보여서 들렸어요배달시켰을때도 맛있었는데포장해서 가성비로 즐기니 더더맛있었어요!!!♡♡♡앞으로 자주 갈 피자집이 동네에생겨서 너무좋아요~아!!특히 이집은 새콤한맛의 소스가 특색있고맛있어요!!디핑소스 꼭 드셔보세요!!",2025-02-16,"점심에 방문, 예약 없이 이용, 대기 시간 10분 이내, 연인・배우자",음식이 맛있어요,27,1
1404644688,쩝쩝박사6,피자 너무맛있어요 이 가격에 진짜 최고ㅠㅠ,2025-02-15,"저녁에 방문, 포장·배달 이용, 대기 시간 30분 이내, 일상, 부모님",음식이 맛있어요,226,1
1404644688,kensin818,,2025-02-15,"점심에 방문, 예약 없이 이용, 대기 시간 바로 입장, 일상, 혼자",가성비가 좋아요,664,2
1404644688,트라이플12,"진짜 너무너무 맛있네요! 소스랑 치즈가 진짜 맛있어요. 왜 매일 손님이 많은지 알겠어요. 정말정말 맛있습니다. 가격대비 음식양도 충분히 푸짐한데, 맛이 정말 좋습니다.",2025-02-14,"저녁에 방문, 포장·배달 이용, 대기 시간 바로 입장, 일상, 가족모임, 지인・동료",음식이 맛있어요,17,1
1404644688,곰돌이84,햄이 엄청 많이 들어있어요. 애들이 좋아해요 도우도 바삭바삭해서  좋아요,2025-02-13,"저녁에 방문, 포장·배달 이용, 대기 시간 30분 이내, 일상, 혼자",음식이 맛있어요,1937,4
1404644688,네이맨,안녕하세요~오늘도 참새 방앗간 들리듯이 건강하고 맛있는 가성비 맛집 오르다파자 길음점에 왔습니다. 오늘은 큰둥이가 텐더를 먹어보고 싶다고해서 추가해보았는데 사진을 찍지 못했네요...다음에는 꼭 찍어서 올려드릴께요~오늘도 맛있는 피자 맛있게 먹었습니다~👍,2025-02-11,"저녁에 방문, 예약 없이 이용, 대기 시간 바로 입장, 일상, 연인・배우자",음식이 맛있어요,11,6
1404644688,귤은맛있다,ㅈㅇ 두 번 째 먹고 있는데 치즈오븐스파게티 진짜 맛있어요~~,2025-02-11,저녁에 방문,음식이 맛있어요,2791,2
1404644688,LYW1223,더블포테이토 & 콤비네이션,2025-02-09,"점심에 방문, 포장·배달 이용, 대기 시간 10분 이내, 친척・형제",음식이 맛있어요,35,2
1404644688,Beautykang,만원이라 기대 안했는데 너무너무 맛있어요 이가격에 이런 퀄리티 라니 맛도리 추천합니다,2025-02-04,"점심에 방문, 예약 없이 이용, 대기 시간 30분 이내, 일상, 연인・배우자, 부모님",음식이 맛있어요,325,1
1404644688,와우7535,굿,2025-02-01,점심에 방문,특별한 메뉴가 있어요,3818,5
1404644688,ban****,동네에 새로오픈해서 포장해 왔는데 별기대안했는데 도우도 맛있고 토핑도 맛있고 가격도 포장해서 할인받았어요너무 맛있게 잘먹었어요,2025-02-01,"점심에 방문, 예약 없이 이용, 대기 시간 바로 입장, 나들이, 연인・배우자",음식이 맛있어요,28,1
1404644688,ju****,가성비가 좋아요 테이크아웃시 만원부터,2025-02-01,"점심에 방문, 예약 없이 이용, 대기 시간 바로 입장, 일상, 친척・형제",음식이 맛있어요,582,1
1404644688,냐옹팡이,요즘 피자스쿨도 만원넘습니다근데 포장으로하면 이정도 고퀄리티피자를만원에 즐길수있습니다집근처에 생겨서 너무좋아요!,2025-02-01,"점심에 방문, 포장·배달 이용, 대기 시간 바로 입장, 일상, 연인・배우자",음식이 맛있어요,228,2
1404644688,냐옹팡이,요즘 시대에 테이크아웃이면 만원에 가능하다니대박 아닙니까?그래서 그릉가 홀포장 손님이 많으시더라구요맛은 또 굉장히 엄청나요ㅋㅋ집가까이 이런곳이 생겨서 대박만족!,2025-01-30,"점심에 방문, 예약 후 이용, 대기 시간 바로 입장, 일상, 연인・배우자",음식이 맛있어요,228,1
1404644688,dtg****,미리 예약하고 방문포장으로 픽업했습니다. 픽업 요청드린 시간에 맞춰 픽업할 수 있었어요. 저렴한데다 맛도 좋았어요!!,2025-01-29,"저녁에 방문, 포장·배달 이용, 대기 시간 바로 입장, 일상",음식이 맛있어요,14,1
1404644688,LYW1223,,2025-01-29,"점심에 방문, 포장·배달 이용, 대기 시간 바로 입장, 일상, 연인・배우자",음식이 맛있어요,35,1
1404644688,jun****,더블 포테이토와 페파로니랑 고구마 피자 시켰는데가족들이랑 진짜 맛있게 먹었어요ㅜ 더군다나 도우가엄청 부드럽고 폭신해서 더 맛있었어요~사장님과 알바생분들이 너무 착하고 친절했어요그리고 피자에 치즈랑 토핑도 엄청 많아서 배부르게먹었습니다~ 다음에도 꼭 재방문 하겠습니다!!,2025-01-28,"점심에 방문, 포장·배달 이용, 대기 시간 10분 이내, 가족모임, 혼자",음식이 맛있어요,2,1
1404644688,네이맨,"안녕하세요~ SK아빠입니다. 설명절전 아무래도 아이들이 피자를 못먹을까봐 오늘도 고구마피자와 슈퍼콤비네이션 피자 이렇게 두 판 맛있게 주문하여 찾아갑니다. 언제나 변함없는 신선한 맛, 청결한 매장, 친절한 직원분들과 사장님 덕에 오늘도 맛있는 저녁 기대 됩니다. 참! 설명절에도 쉬시지 않고 영업을 하신다고 하니 이용하시는분들은 참고하셔도 좋을것 같아요~👍",2025-01-27,"저녁에 방문, 예약 없이 이용, 대기 시간 바로 입장, 일상, 연인・배우자",음식이 맛있어요,11,4
1404644688,푸리푸리밥,가족들이랑 엄청 맛있개 먹었어요 진짜 고구마피자 테이크아웃 할인 받아가지고 1만원에 이거 먹움 ㅋㅋ 진짜 가성비 너무 좋아요,2025-01-27,"저녁에 방문, 예약 없이 이용, 대기 시간 바로 입장, 일상, 부모님",음식이 맛있어요,127,1
1404644688,개굴이66,맛있어서 자주 방문하고 있습니다. 번창하세요~,2025-01-27,"점심에 방문, 포장·배달 이용, 대기 시간 10분 이내, 일상, 연인・배우자",음식이 맛있어요,36,1
1404644688,와우7535,굿,2025-01-26,점심에 방문,특별한 메뉴가 있어요,3818,4
1404644688,차돌이50,.,2025-01-25,"저녁에 방문, 포장·배달 이용, 대기 시간 10분 이내, 일상, 아이",음식이 맛있어요,1774,3
1404644688,셀리Sally,"고구마피자는 부드러운 고구마 무스가듬뿍 올라가 있어서 달달하고 고소한 맛이 최고였고,빵도 그냥 평범한 도우가 아니라 48시간 숙성된 수제도우라서 진짜 쫀득쫀득하더라고요.갓 구워 나온 도우에서 느껴지는 정성!!!치즈오븐 스파게티는 치즈가 엄청 듬뿍 올라가 있어서 뜨끈뜨끈하고 정말 고소했어요~길음뉴타운 신상맛집👍🏻 자주 오겠습니다 ㅎㅎ🤤🫶🏻",2025-01-25,"점심에 방문, 포장·배달 이용, 대기 시간 바로 입장, 일상, 연인・배우자",음식이 맛있어요,116,1
1404644688,하얀꽃잎,👍,2025-01-24,"저녁에 방문, 예약 없이 이용, 대기 시간 30분 이내, 일상, 혼자",음식이 맛있어요,1081,2
1404644688,Sunshine1019,오픈행사로 맛있는 피자 아이와 잘먹었습니다!!!아이가 맛있다고 절반을 반판을 먹었답니다~이벤트행사 오래 했으면 좋겠네요^^서비스로 주신 소스도 맛나네요!!!대박나세요~~~,2025-01-23,"점심에 방문, 포장·배달 이용, 대기 시간 바로 입장, 친목, 일상, 아이",음식이 맛있어요,260,1
1404644688,차돌이50,.,2025-01-23,"점심에 방문, 포장·배달 이용, 대기 시간 10분 이내, 일상, 아이",음식이 맛있어요,1774,2
1404644688,네이맨,안녕하세요~ SK아빠입니다. 오늘도 맛있고 건강한 맛에 가성비 최고인 오르다 피자 길음점에 피자사러 왔어요~😄이젠 저보다 아이들이 더 단골이 되었네요~항상 친절하게 맞아주시는 직원분들과 사장님! 오늘도 화이팅하세욧!~👍,2025-01-22,"저녁에 방문, 예약 없이 이용, 대기 시간 바로 입장, 일상, 연인・배우자",음식이 맛있어요,11,3
1404644688,예예39,"사장님.. 진심으로 너무 너무 맛있게 먹었어요ㅠㅠ포장 할인 받으니 가격대가 놀라울 정도로 저렴해져 사장님께서 남는게 있으실까 하는 걱정을 혼자 해보았답니당,, 비싼 피자 프랜차이즈에 견주어도 손색이 없을만큼 토핑도 많고 맛도 있어 피자는 앞으로 길음동 오르다피자에 정착해야겠어요! 피자 한 조각 가격으로 계산해 보았을 때 피자빵보다도 저렴한 가격으로 고퀄리티 피자를 먹을 수 있다니 감동입니당 💛 넘 맛있게 먹어 주절주절 말이 길었네요 ㅎㅎㅎ 저같은 서민분들을 위해 오래 오래 영업해 주세요^.^✨",2025-01-20,"저녁에 방문, 예약 없이 이용, 대기 시간 바로 입장, 연인・배우자",음식이 맛있어요,53,1
1404644688,동구리동동78,아이들이 맛있게 잘먹는 피자와 순살치킨을 합리적인 가격으로 생일파티를 할 수 있었어요!샐러드도 시킬 수 있어 건강하고 맛있는 피자를 즐길 수 있었어요^^,2025-01-20,"점심에 방문, 포장·배달 이용, 대기 시간 10분 이내, 기념일, 아이",음식이 맛있어요,1,1
1404644688,대대스브런치93,3번째 인데 매번 다른거 먹어봐도 다 맛있네요,2025-01-20,"점심에 방문, 포장·배달 이용, 대기 시간 30분 이내, 일상, 연인・배우자",음식이 맛있어요,815,2
1404644688,귤은맛있다,ㅈㅇ 맛있고 서비스 좋고 가격 좋고~,2025-01-19,저녁에 방문,음식이 맛있어요,2791,1
1404644688,HEART43,더블 포테이토 반 반에 치즈 추가했는데 토핑 엄청 가득 올라가 있고 치즈도 엄청 많이 주셨어요 도우 끝에는 추가 안했는데 기본 도우도 바삭바삭하니 끝부분까지 맛났어요 스파게티도 치즈 가득 올려 주시는데 너무 맛나요 다음에 다른 맛 먹어봐야겠어요 👍🏻,2025-01-19,"저녁에 방문, 예약 후 이용, 대기 시간 바로 입장, 일상, 혼자",음식이 맛있어요,1433,1
