place_id,nickname,content,date,situations,keywords,review_count,visit_count
1930968318,리코빌,감사합니당  사장님 수고하셔요,2024-10-27,"저녁에 방문, 예약 없이 이용, 대기 시간 바로 입장, 회식, 부모님",음식이 맛있어요,1130,11
1930968318,장점,감사합니다 잘먹었습니다,2024-10-27,"저녁에 방문, 예약 없이 이용, 대기 시간 바로 입장, 회식, 부모님",음식이 맛있어요,650,17
1930968318,shnnyy,굿,2024-10-25,저녁에 방문,음식이 맛있어요,2128,3
1930968318,차돌이50,.,2024-10-20,"저녁에 방문, 예약 없이 이용, 대기 시간 바로 입장, 일상, 연인・배우자, 아이",음식이 맛있어요,1774,1
1930968318,ksg****,"동물복지 닭을 사용해서 그런지 정말 신선하네요! 기름도 깨끗하고 맵슐랭 반반치킨으로 잘 먹고 왔어요. 최근에 확장 리모델링을 해서 식기류도 다 새거라서 좋았어요. 치킨 먹다가 매워서 어포튀김을 시켰는데, 앞으로 이 메뉴는 여기 올 때마다 시킬거에요. 다들 휴게소에서 어포 시키지 마시고 여기서 드셔보세요^^ (양도 많음^^)",2024-10-15,"저녁에 방문, 예약 없이 이용, 대기 시간 바로 입장, 가족모임, 아이",음식이 맛있어요,6,1
1930968318,리코빌,잘먹겠음니다 감사합니당,2024-10-05,"저녁에 방문, 예약 없이 이용, 대기 시간 바로 입장, 일상, 부모님",음식이 맛있어요,1130,10
1930968318,장점,감사합니다,2024-10-05,"저녁에 방문, 예약 없이 이용, 대기 시간 바로 입장, 일상, 부모님",음식이 맛있어요,650,16
1930968318,럽홍,자담치킨 맛있어요 양념빼고 ㅋㅋ,2024-09-28,"점심에 방문, 예약 없이 이용, 대기 시간 바로 입장, 데이트, 친구",음식이 맛있어요,537,1
1930968318,bluekihun,어젯밤에 아내가 치밥 먹고 싶다고 해서 오늘 살짝 늦잠자고 일어나 주문함.원래 배달 치킨은 다른 브랜드 이용했었는데 최근 닭 육질 저하가 있는 듯 해서 이전에 다른 지점이긴하지만 자담의 치킨이 꽤나 괜찮았던 경험이 있어 자담으로 결정했다.새로운 맛보다는 기본 반반에 밥과 먹기 좋은 부위인 콤보로 시켰다. 배달도 예정보다 빨랐고 잘 튀겨낸 후라이드와 깔끔한 양념치킨이 밥 먹기 좋았다. 그리고 치킨무도 다른 곳보다 좀 더 깔끔하다.,2024-09-15,"점심에 방문, 포장·배달 이용, 대기 시간 30분 이내, 일상, 연인・배우자",음식이 맛있어요,1207,1
1930968318,kin****,괜찮아요,2024-07-07,"점심에 방문, 예약 없이 이용, 대기 시간 바로 입장, 친목, 지인・동료",친절해요,1076,7
1930968318,리코빌,괜찮아요,2024-07-07,"점심에 방문, 예약 없이 이용, 대기 시간 바로 입장, 친목, 지인・동료",친절해요,1130,9
1930968318,사랑하는 가을이,조아요,2024-07-07,"점심에 방문, 예약 후 이용, 대기 시간 30분 이내, 일상, 부모님, 친척・형제",음식이 맛있어요,2549,2
1930968318,장점,괜찮아요,2024-07-07,"점심에 방문, 예약 없이 이용, 대기 시간 바로 입장, 친목, 지인・동료",친절해요,650,15
1930968318,stk****,맛있어요,2024-06-11,저녁에 방문,음식이 맛있어요,2217,6
1930968318,사랑하는 가을이,조아요,2024-06-08,"저녁에 방문, 예약 후 이용, 대기 시간 30분 이내, 일상, 부모님",음식이 맛있어요,2549,1
1930968318,kin****,괜찮아요,2024-06-08,"저녁에 방문, 예약 없이 이용, 대기 시간 바로 입장, 친목, 지인・동료",음식이 맛있어요,1076,6
1930968318,달코미별,잘 포장해 치킨 양도 많고 가성비 최고별🌟 촉촉 맛있는 치킨 소스도 달큼하니 3가지 섞여서 떡도 있고 좋았별🌟,2024-05-24,"점심에 방문, 포장·배달 이용, 대기 시간 바로 입장, 나들이, 혼자",음식이 맛있어요,1690,1
1930968318,다크팽,친절해요!,2024-05-08,"저녁에 방문, 포장·배달 이용, 대기 시간 바로 입장",친절해요,762,1
1930968318,장점,조아요,2024-05-08,"점심에 방문, 예약 없이 이용, 대기 시간 바로 입장, 일상, 혼자",음식이 맛있어요,650,13
1930968318,리코빌,감사합니당 잘먹겠음니다,2024-05-08,"점심에 방문, 예약 없이 이용, 대기 시간 바로 입장, 일상, 부모님",음식이 맛있어요,1130,8
1930968318,리코빌,바로바로 맛있게 잘먹겠음니다,2024-04-07,"저녁에 방문, 포장·배달 이용, 대기 시간 바로 입장, 데이트, 부모님",음식이 맛있어요,1130,7
1930968318,장점,맛있게잘먹겠음니다 감사합니다,2024-04-07,"저녁에 방문, 예약 없이 이용, 대기 시간 바로 입장, 회식, 아이",음식이 맛있어요,650,12
1930968318,kin****,괜찮아요,2024-04-06,"저녁에 방문, 예약 없이 이용, 대기 시간 바로 입장, 친목, 친척・형제",친절해요,1076,5
1930968318,장점,괜찮아요,2024-04-06,"저녁에 방문, 예약 없이 이용, 대기 시간 바로 입장, 친목, 기타",친절해요,650,11
1930968318,장점,감사합니다,2024-03-26,"점심에 방문, 예약 없이 이용, 대기 시간 바로 입장, 일상, 혼자",음식이 맛있어요,650,10
1930968318,리코빌,사장님잘먹었음니다 고맘슴니다수고하셔요,2024-03-17,"점심에 방문, 예약 없이 이용, 대기 시간 바로 입장, 가족모임, 부모님, 친척・형제",음식이 맛있어요,1130,6
1930968318,장점,,2024-03-02,"저녁에 방문, 예약 없이 이용, 대기 시간 바로 입장, 친목, 친척・형제",음식이 맛있어요,650,9
1930968318,kin****,괜찮아요,2024-03-02,"저녁에 방문, 예약 없이 이용, 대기 시간 바로 입장, 친목, 친척・형제",음식이 맛있어요,1076,4
1930968318,Takeru,아들이랑 운동 하고 집에 가는 길에 들려서 포장 주문 했어요 ~ 사장님이 주신 새우칩이 별미구요 친절 하셔서 집앞에 자담이 더 가까운데 일부러 길음점 이용 합니다 집 앞 보다 친절 하시고 정이 있어서 좋아요 치킨 맛도 그래서 더 좋은거 같고요 ~^^ 기왕 같은 돈 내고 먹는거면 친절 하고 새우칩이라도 더 주시고 말씀이라도 이쁘게 해 주시는데서 돈 내고 먹고 싶은게 제 맘~!! 번창하세요 ~^.^,2024-02-26,"저녁에 방문, 포장·배달 이용, 대기 시간 30분 이내",음식이 맛있어요,327,1
1930968318,물방울289,맛  있는  자담치킨맵슐랭  좋아요,2024-02-24,점심에 방문,음식이 맛있어요,1328,2
1930968318,장점,감사합니다 ^^,2024-02-20,"점심에 방문, 예약 없이 이용, 대기 시간 바로 입장, 가족모임, 친척・형제",음식이 맛있어요,650,8
1930968318,kin****,괜찮아요,2024-02-17,"저녁에 방문, 예약 없이 이용, 대기 시간 바로 입장, 친목, 지인・동료",친절해요,1076,3
1930968318,장점,괜찮아요,2024-02-17,"저녁에 방문, 예약 없이 이용, 대기 시간 바로 입장, 친목, 지인・동료",친절해요,650,7
1930968318,ros****,맛있써요,2024-02-13,"저녁에 방문, 포장·배달 이용, 대기 시간 30분 이상, 기타",음식이 맛있어요,1643,1
1930968318,리코빌,감사합니다 잘먹겠음니다,2024-02-08,"저녁에 방문, 예약 없이 이용, 대기 시간 바로 입장, 가족모임, 부모님",음식이 맛있어요,1130,5
1930968318,장점,감사합니다,2024-02-08,"저녁에 방문, 예약 없이 이용, 대기 시간 바로 입장, 가족모임, 부모님",음식이 맛있어요,650,6
1930968318,beingforgotten,집이랑 가까워서 포장했는데 바삭하고 맛있게 잘 먹었어요~! 파닭은 파 양이 적어서 아쉬웠다는…🥺,2024-01-31,"저녁에 방문, 포장·배달 이용, 대기 시간 30분 이내, 가족모임, 부모님",음식이 맛있어요,2359,5
1930968318,장점,괜찮아요,2024-01-21,"점심에 방문, 예약 없이 이용, 대기 시간 30분 이내, 친목, 지인・동료",음식이 맛있어요,650,5
1930968318,kin****,굿,2024-01-21,"점심에 방문, 예약 후 이용, 대기 시간 30분 이내, 친목, 지인・동료",음식이 맛있어요,1076,2
1930968318,7415963han,자담치킨 맛있네요,2024-01-17,"저녁에 방문, 포장·배달 이용, 대기 시간 바로 입장, 일상, 연인・배우자",음식이 맛있어요,14,1
1930968318,오오라마,굿,2024-01-10,"저녁에 방문, 포장·배달 이용, 대기 시간 바로 입장, 일상, 연인・배우자",음식이 맛있어요,736,1
1930968318,행콩268,음식이 맛있고 친절하시네요,2024-01-05,"저녁에 방문, 포장·배달 이용, 대기 시간 바로 입장, 가족모임, 부모님",음식이 맛있어요,3,1
1930968318,sam****,"방문포장 자주 이용하는데, 무지 친절하고 서비스도 좋아요",2023-12-29,"점심에 방문, 포장·배달 이용, 일상, 아이",음식이 맛있어요,241,1
1930968318,JUNGBUM LEE,"여사장님 바쁘신 와중에 손님들께 이렇게 손편지도 직접 써서 간식과 함께 넣어주시고, 손님을 대하는 마음이 진심으로 느껴졌습니다. 올해 자담치킨을 인수하셔서 매장은 그대로고 사장님은 바뀌신걸로 알고있습니다. 결론은 사장님 바뀌고 치킨맛과 양이 모두 훨씬 좋아졌습니다. 앞으로도 치킨은 쭉 길음 자담에서 사먹을 생각입니다!",2023-12-28,밤에 방문,음식이 맛있어요,23,1
1930968318,장점,감사합니다 잘먹었습니다,2023-12-03,"점심에 방문, 예약 후 이용, 대기 시간 10분 이내, 가족모임, 혼자",음식이 맛있어요,650,4
1930968318,리코빌,잘먹겠음니다,2023-12-03,"점심에 방문, 예약 후 이용, 대기 시간 바로 입장, 일상, 부모님",음식이 맛있어요,1130,4
1930968318,nakata5252,길음동에 사는데 학부모께서 선물로 주셔서방문했는데 여자 사장님 너무 친절하시고기분좋게 맞이해 주셔서 먹기전부터 기분 좋아졌습니다.  초심 잃지 마시고 항상 지금처럼 장사하시면 분명 대박 나실거같아요. 화이팅 하세요 잘먹었습니다.,2023-11-12,밤에 방문,음식이 맛있어요,1,1
1930968318,뚜레쥬르87,어웅 사장님!!!!너무친절하세용2일전에 맵슐랭먹구 넘 맛있어서오늘 또 시켰음당 ㅋㅋ오늘은 애들주려고 후라이드와 맵슐랭ㅋㅋ  넘 맛있게먹었고 단골될거같아요,2023-10-26,저녁에 방문,양이 많아요,13,1
1930968318,장점,친절하고 맛있어요 감사합니다,2023-10-17,저녁에 방문,음식이 맛있어요,650,3
1930968318,리코빌,감사합니다 수고하셔요,2023-10-17,저녁에 방문,음식이 맛있어요,1130,3
1930968318,퍼스트원,맛나요,2023-10-12,저녁에 방문,음식이 맛있어요,1363,1
1930968318,리코빌,잘먹었음니다 사장님,2023-09-21,점심에 방문,음식이 맛있어요,1130,2
1930968318,장점,감사합니다,2023-09-21,점심에 방문,음식이 맛있어요,650,2
1930968318,시에나김,맛있어요 맵슐랭치킨 맵네요 ㅋㅋ,2023-09-04,밤에 방문,친절해요,62,2
1930968318,리코빌,맛있게잘먹었음니다,2023-08-22,점심에 방문,음식이 맛있어요,1130,1
1930968318,장점,감사합니다,2023-08-22,점심에 방문,음식이 맛있어요,650,1
1930968318,beingforgotten,집이랑 가까워서 포장주문하기 좋아요! 예전보다 초큼 촉촉함이 덜했지만 바삭합니다..! 맵슐랭+핫후라이드 조합 추천해요,2023-08-20,저녁에 방문,음식이 맛있어요,2359,4
1930968318,시에나김,자담치킨 맵슐랭~ 매운맛간장치킨~ 몇일전에도 시켰는데 맛있어서 또시키네요 맛나요🥰배달직원분은 사장님이신지 라이더분이신지 잘 모르겠지만 너무 친절하셔서 🫶🏻👍🏻일주일에 닭 1번~3번은 꼭 시켜먹는데 요집도 이제 우리집 치킨뫼비우스의 띠안에 들어옴이동네 케이에프씨 비에이치씨 육십계 비비큐 프라닭 교촌 가끔 지코바 가끔 페리카나 가끔 맥시칸 가끔 굽네 그리고 앞으로는 자담도 자주 먹을듯 ㅋ,2023-08-17,저녁에 방문,친절해요,62,1
1930968318,해피맘1025,좋아요 좋아요 좋아요,2023-08-15,저녁에 방문,음식이 맛있어요,1459,1
1930968318,무무9560,아들이 자담 좋아해요,2023-08-14,저녁에 방문,음식이 맛있어요,199,4
1930968318,야무진54,오랜만에 먹었는데  맛있네요^^,2023-08-13,저녁에 방문,음식이 맛있어요,2197,17
1930968318,소나기비67,순살반반이 맛있습니다. 사장님도 친절해요.,2023-08-04,저녁에 방문,음식이 맛있어요,508,2
1930968318,cae****,사장님이 엄청친절하십니다.당연히 맛도 좋고요앞으로 자주 이용하겠습니다~,2023-08-02,저녁에 방문,재료가 신선해요,30,1
1930968318,shnnyy,굿,2023-07-09,저녁에 방문,음식이 맛있어요,2128,1
1930968318,karl2005,조아요,2023-06-28,저녁에 방문,음식이 맛있어요,1648,2
1930968318,h03****,치킨 신메뉴 소스가 맛있어요,2023-06-15,저녁에 방문,음식이 맛있어요,662,1
1930968318,소나기비67,치킨 중에 맛은 자담이 제일 맛있어요 👍🏻먹다가 찍은 사진이라 사진이 지저분해요 😭,2023-06-05,저녁에 방문,재료가 신선해요,508,1
1930968318,화이팅 쭈,워낙 자주사먹는 곳인데 최근 사장님이 바뀌셨네요 바뀌고 처음엔 닭크기나 튀김정도가 많이 달랐는데 점점 닭도 잘튀겨주시고 맛도 더 좋아지네여 ~ 순살후라이드에 떡튀김도 생겼지만 기존 닭에 충실함이 더 좋은거 같아요 바뀌고 두번째 인데 오늘은 기름이 너무 깨끗해서 좋았어요,2023-06-01,저녁에 방문,친절해요,352,3
1930968318,rla****,맛있어요,2023-05-12,점심에 방문,음식이 맛있어요,865,1
1930968318,beingforgotten,집이랑 가까워서 포장주문 해먹어요🩵 바삭하고 육즙 팡팡… 맛있어요,2023-05-03,점심에 방문,음식이 맛있어요,2359,3
1930968318,karl2005,조아요,2023-04-28,저녁에 방문,음식이 맛있어요,1648,1
1930968318,야무진54,포장할인 이천원,2023-04-12,저녁에 방문,음식이 맛있어요,2197,16
1930968318,화이팅 쭈,순살이 퍽퍽하지않고 촉촉하고 바싹하고 좋아요기본염지가 맵지않아 아이들이 아주 잘먹습니드,2023-04-11,저녁에 방문,음식이 맛있어요,352,2
1930968318,kangjs650,친절해요,2023-04-06,저녁에 방문,친절해요,1131,3
1930968318,깨스의깨스라이팅,치킨은 뭐니뭐니해도 자담치킨이지요~❤️,2023-04-05,밤에 방문,매장이 넓어요,455,1
1930968318,한심맘,ㅈㅇㅇ,2023-03-19,저녁에 방문,음식이 맛있어요,806,1
1930968318,kangjs650,음식이 맛있어요,2023-03-14,저녁에 방문,음식이 맛있어요,1131,2
1930968318,야무진54,다먹고 찍어서 메인이 없네요,2023-01-06,저녁에 방문,재료가 신선해요,2197,15
1930968318,미류나무82,맛있게 잘 먹었어요^^,2022-12-24,저녁에 방문,음식이 맛있어요,177,1
1764557280,dal****,근처 마라집중 최고에요~~ 매장 넘 깔끔하고 맛있어요! 2단계로 먹었는데 저한테는 맛있게 맵네요! 추천합니다!,2025-04-11,"점심에 방문, 예약 없이 이용, 대기 시간 바로 입장, 친목, 친구",음식이 맛있어요,25,1
1764557280,로그인7653,진짜 맛있어요!!!,2025-04-11,"점심에 방문, 예약 없이 이용, 대기 시간 바로 입장, 친목, 친구",음식이 맛있어요,28,2
1764557280,app****,매장이 깔끔하고 메뉴재료가 신선하게 잘 괸리되고있어요. 또오고싶어요,2025-04-11,"점심에 방문, 예약 없이 이용, 대기 시간 바로 입장, 일상, 혼자",음식이 맛있어요,7,1
1764557280,람쥐양,아이들이랑같이와서 0단계도잘먹어요~,2025-04-09,"저녁에 방문, 예약 없이 이용, 대기 시간 바로 입장, 친목, 아이",음식이 맛있어요,12,4
1764557280,j_w****,맛잇엉용,2025-04-09,"점심에 방문, 예약 없이 이용, 대기 시간 바로 입장, 친목, 친구",음식이 맛있어요,4,1
1764557280,뿌르르르21,일주일에 한번씩은 꼭 오는 단골집이예요~~재료도 신선하고 마라탕 너무 맛있어요!!!!!!,2025-04-08,"저녁에 방문, 예약 없이 이용, 대기 시간 10분 이내, 친목, 연인・배우자, 아이",음식이 맛있어요,65,24
1764557280,민희23,집근처라 자주 옵니다!!! 인테리어도 멋지고 맛도 있어요!!! 더 자주 올께요:),2025-04-07,"저녁에 방문, 예약 없이 이용, 대기 시간 바로 입장, 데이트, 아이",인테리어가 멋져요,38,27
1764557280,cattyxx,샹궈먹었는데 넘 맛잇었어요:),2025-04-07,"저녁에 방문, 예약 없이 이용, 대기 시간 바로 입장, 친목, 친구",친절해요,11,5
1764557280,페이지5889,재료들 깨끗하고 맛있어서 정기적으로 마라탕 먹으러 오는 곳이에요~,2025-04-07,"점심에 방문, 예약 없이 이용, 대기 시간 바로 입장, 데이트, 아이",혼밥하기 좋아요,24,2
1764557280,kim185769,혼자 왔는데 바로 들어와서 먹을 수 있어 좋아요^^ 깨끗하고 맛있어요,2025-04-07,"점심에 방문, 예약 없이 이용, 대기 시간 바로 입장, 일상, 혼자",음식이 맛있어요,21,1
1764557280,남한의 용,"두번째 방문,,,맛나요 항상",2025-04-06,"저녁에 방문, 예약 없이 이용, 대기 시간 바로 입장, 데이트, 일상, 연인・배우자",음식이 맛있어요,30,2
1764557280,tom****,맛있어서 매번 오는곳이예요~~!!!,2025-04-06,"점심에 방문, 예약 없이 이용, 대기 시간 바로 입장, 친목, 친구",음식이 맛있어요,305,4
1764557280,황소69,매장도 깔끔하고 맛도 좋습니다~^^마라탕은 항상 여기서 먹어요~,2025-04-06,"점심에 방문, 예약 없이 이용, 대기 시간 바로 입장, 나들이, 지인・동료, 아이",음식이 맛있어요,12,3
1764557280,soc****,너무 맛있어요^^!!,2025-04-06,"점심에 방문, 예약 없이 이용, 대기 시간 바로 입장, 데이트, 연인・배우자",음식이 맛있어요,8,1
1764557280,황인서58,마라탕 땡길때마다 여기로 와요!! 재료도 신선하고 매장 내부도 넓고 깔끔해서 좋아요👍,2025-04-05,"저녁에 방문, 예약 없이 이용, 대기 시간 바로 입장, 일상, 부모님",매장이 넓어요,34,4
1764557280,afr****,맛있어요!!!!매월옵니다!!!,2025-04-05,"저녁에 방문, 예약 없이 이용, 대기 시간 바로 입장, 친목, 친구",음식이 맛있어요,55,24
1764557280,KC4,맛잇어요,2025-04-05,"저녁에 방문, 예약 없이 이용, 대기 시간 바로 입장",음식이 맛있어요,256,6
1764557280,ult****,자주오는 마라공방마라탕 맛있어요.2단계 도전!,2025-04-05,"점심에 방문, 예약 없이 이용, 대기 시간 10분 이내, 친목, 친구",음식이 맛있어요,10,3
1764557280,110****,순한맛으로 시켜서 6살 아이랑 함께 먹기 좋아요 항상 맛있고 꿔바로우도 별미입니당 주차도 편하구요,2025-04-05,"점심에 방문, 예약 없이 이용, 대기 시간 바로 입장, 친목, 연인・배우자",음식이 맛있어요,6,1
1764557280,힐링수,볶음밥이 깔끔하고 너무 맛있어요^^,2025-04-05,"점심에 방문, 예약 없이 이용, 대기 시간 바로 입장, 가족모임",음식이 맛있어요,27,7
1764557280,sk8boarding,맛있어요 주차도 편해서 비올때 오기도 좋아요,2025-04-05,"점심에 방문, 예약 없이 이용, 대기 시간 바로 입장, 데이트, 일상, 연인・배우자, 아이",음식이 맛있어요,34,19
1764557280,긔술,너무 맛있어서 사진도 못찍고 개눈감추듯 먹었네요,2025-04-04,"저녁에 방문, 예약 없이 이용, 대기 시간 바로 입장, 친목",음식이 맛있어요,50,1
1764557280,한아름2071,사랑해요~마라공방,2025-04-04,"저녁에 방문, 예약 없이 이용, 대기 시간 바로 입장, 친목, 친구",음식이 맛있어요,12,8
1764557280,skrrskrrr,맛잇어여,2025-04-04,점심에 방문,음식이 맛있어요,10,6
1764557280,anv,맛있습니다!!,2025-04-04,"점심에 방문, 예약 없이 이용, 대기 시간 바로 입장, 일상, 혼자",음식이 맛있어요,25,7
1764557280,윤율96,또왔어요~~가볍게 먹기 좋아요~^^,2025-04-04,"점심에 방문, 예약 없이 이용, 대기 시간 바로 입장, 일상",음식이 맛있어요,83,38
1764557280,s young,매번 오는데 깨끗하고 맛있어요~~,2025-04-04,"점심에 방문, 예약 없이 이용, 대기 시간 바로 입장, 일상, 지인・동료",음식이 맛있어요,16,12
1764557280,imj****,주 1회는 방문해서 먹는거 같아요맛있습니다~!!,2025-04-02,"저녁에 방문, 예약 없이 이용, 대기 시간 바로 입장, 데이트, 연인・배우자",음식이 맛있어요,40,5
1764557280,atemplar,집근처라 자주오는데 항상 맛있어요^^,2025-04-02,"점심에 방문, 예약 없이 이용, 대기 시간 바로 입장, 일상, 혼자",친절해요,3,2
1764557280,123776,오늘도 맛있습니다,2025-04-01,"저녁에 방문, 예약 없이 이용, 대기 시간 바로 입장, 친목, 친구",친절해요,18,8
1764557280,can****,마라공반사란해,2025-04-01,저녁에 방문,음식이 맛있어요,10,6
1764557280,fee****,맛있어요,2025-04-01,"점심에 방문, 예약 없이 이용, 대기 시간 바로 입장, 일상, 혼자",음식이 맛있어요,24,23
1764557280,구슬42,너무 맛있는 동네 맛집입니다,2025-03-31,"저녁에 방문, 예약 없이 이용, 대기 시간 바로 입장, 가족모임, 아이",음식이 맛있어요,8,5
1764557280,jhn15,자주 와요!,2025-03-31,"점심에 방문, 예약 없이 이용, 대기 시간 바로 입장, 일상, 혼자",음식이 맛있어요,2,2
1764557280,whomin26,계속 방문하게 되는 곳!,2025-03-30,"저녁에 방문, 예약 없이 이용, 대기 시간 바로 입장, 일상, 아이",가성비가 좋아요,3,2
1764557280,jak****,길음뉴타운 마라탕 맛집!!깔끔하고 맛있어요:),2025-03-30,"저녁에 방문, 예약 없이 이용, 대기 시간 바로 입장, 가족모임, 부모님, 친척・형제",음식이 맛있어요,3,1
1764557280,플래타너스,여긴 동네 찐맛집이예요~아이들이 너무 좋아해서 자주 오게되네요^^,2025-03-30,"저녁에 방문, 예약 없이 이용, 대기 시간 바로 입장, 가족모임, 아이",음식이 맛있어요,909,5
1764557280,박유민42,항상 오는 맛집입니다 꿔바로우 소스 따로달라고 하는데 다른집은 그냥 부어서 주는 집도 봤는데 여기는 여창사항도 잘 들어주시고 직원분도 너무 친절해서 좋았어요!!,2025-03-30,점심에 방문,혼밥하기 좋아요,5,1
1764557280,윤진4123,평소에도 되게 많이 오던 마라탕 집이에요!가격도 싸고 맛도 있는데 직원분들까지 친절하셔서 더 좋은거같아요! 다음에도 또 올게요💕,2025-03-30,"점심에 방문, 예약 없이 이용, 대기 시간 바로 입장, 일상",친절해요,4,2
1764557280,hw****,맛있어욧 ㅎㅎ,2025-03-29,"저녁에 방문, 예약 없이 이용, 대기 시간 바로 입장, 친구",음식이 맛있어요,8,2
1764557280,구슬44,아이와 오기 좋은 마라공방입니다 하얀마라탕이랑 꿔바로우 시키면 6세아이도 잘먹어요~항상 맛있어요,2025-03-29,"점심에 방문, 예약 없이 이용, 대기 시간 바로 입장, 가족모임, 아이",음식이 맛있어요,3,2
1764557280,kcw****,깔끔하고 0.5단계도 있어서 좋아요. 샹궈맛있습니다.,2025-03-29,"점심에 방문, 예약 없이 이용, 대기 시간 바로 입장, 일상, 아이",음식이 맛있어요,19,7
1764557280,으니64,마라탕 너무 맛있어요! ㅎㅎ,2025-03-28,"저녁에 방문, 예약 없이 이용, 대기 시간 10분 이내, 일상, 연인・배우자, 아이",음식이 맛있어요,8,1
1764557280,gpt****,애들이 마라탕 좋아해서 자주와요~올때마다 만족입니다우리동네서 마라탕은 마라공방이 제일 맛있어요~~,2025-03-28,"저녁에 방문, 예약 없이 이용, 대기 시간 10분 이내, 일상, 아이",음식이 맛있어요,11,6
1764557280,어벙부부,양도 넉넉하고 맛도 있어요.집근처니 자주올거같습니다.,2025-03-28,"점심에 방문, 예약 없이 이용, 대기 시간 바로 입장, 친목, 지인・동료",음식이 맛있어요,28,1
1764557280,호산나54,,2025-03-28,"점심에 방문, 예약 없이 이용, 대기 시간 바로 입장, 친목, 친구",음식이 맛있어요,12,4
1764557280,jun****,너무 맛있어요 아이들이너무 좋아합니다 청결해요,2025-03-27,"저녁에 방문, 예약 없이 이용, 대기 시간 바로 입장, 친목, 아이",음식이 맛있어요,12,2
1764557280,justdoit72,맛있어용 ㅎㅎ,2025-03-27,"저녁에 방문, 예약 없이 이용, 대기 시간 바로 입장, 일상, 친구",음식이 맛있어요,7,3
1764557280,mor****,존맛턍💕,2025-03-27,"저녁에 방문, 예약 없이 이용, 대기 시간 바로 입장, 친목",음식이 맛있어요,38,24
1764557280,sin****,맛있어용 ㅎㅎ!!!,2025-03-27,"저녁에 방문, 예약 없이 이용, 대기 시간 10분 이내, 친목, 친구",음식이 맛있어요,56,45
1764557280,롱이롱롱이,마라공방 맛있어요 !!,2025-03-27,"저녁에 방문, 예약 없이 이용, 대기 시간 바로 입장, 친목",음식이 맛있어요,68,28
1764557280,jli****,,2025-03-27,"점심에 방문, 예약 없이 이용, 대기 시간 바로 입장, 데이트, 연인・배우자",매장이 청결해요,14,5
