place_id,nickname,content,date,situations,keywords,review_count,visit_count
1104854574,qlsdlqlsdlek,닭갈비가 먹고 싶어 왔는데 넘넘 맛있게 잘 먹고 갑니다👍🏻,2025-04-10,"저녁에 방문, 예약 없이 이용, 대기 시간 바로 입장, 데이트, 연인・배우자",음식이 맛있어요,22,1
1104854574,조리퐁3680,학교 끝나고 친구랑 먹으러 왔어요ㅎㅎ 고기가 넘넘 부드럽고 맛있습니다! 시장님께서도 먹는 법 친절하게 알려주셔서 더 맛있게 먹었어요! 그리고 사장님이 안정환 닮으셨어요🤩,2025-04-10,"저녁에 방문, 예약 없이 이용, 대기 시간 바로 입장, 친목, 친구",음식이 맛있어요,14,1
1104854574,늘912,성신여대 입구역 최고 맛집 되십니다...✨고기 직접 구워주시고 어떻게 먹는 게 맛있는지 다 알려주시는 맛잘알 유머왕 매니저님과 친절한 사장님까지 이 집 음식이 맛있고 친절해오 .... 🥹주변에 꼭 가보라고 권하고 싶은 맛집입니다👍🏻가게가 깔끔하고 청결해서 더 믿음이 갔습니닷,2025-04-08,"저녁에 방문, 예약 후 이용, 대기 시간 바로 입장, 친목, 나들이, 친구",음식이 맛있어요,23,1
1104854574,anguuuu,예전에도 방문했는데 오늘 처음으로 총괄매니저님이 설명해주면서 구워주셔서 너무 좋았어요ㅋㅋㅋㅋ유쾌하시고 맛있게 먹는 방법도 잘 알려주셔서 좋은 식사 시간이 됐어요ㅎㅎㅎ 다음에도 매니저님이 구워주시면 좋겠어요>.< 감사합니다^^ (두꺼비 거울 girls),2025-04-06,"저녁에 방문, 예약 없이 이용, 대기 시간 바로 입장, 친목, 친구",음식이 맛있어요,49,1
1104854574,Cnuisw,점심시간 지나 방문해 매장이 여유로워 총괄매니저님이 직접 식사 도와주셨구 정말 친절하셨어요 좋은 조합도 알려주시고 고기도 맛있게 구워주셨어용🥹 너무 맛있었어요 감사합니당~~,2025-04-06,"점심에 방문, 예약 없이 이용, 대기 시간 바로 입장, 친목, 친구",음식이 맛있어요,6,1
1104854574,uji****,"25년 4월 비오늘날 오후 방문 계모임!닭에 관한모든메뉴가 있는곳!소금모듬구이로 모든부위를  맛보았다소금에만 찍어서 먹어도 전혀냄새가 나지않았다!소금과고추냉이로 먹었을땐.풍미가 올라오고그곳의 대표 유자소스 찍었을때 입안이 즐거움이 가득했다.참고로 본인은 매콤함이.좋아서 따로나온 청양고추를 많이 넣어서 저혀 느끼하지 않았다양념으로 시킨 다릿살과 목살은 그것만의 풍미가 가득하다매콤한칼국수로 입가심을 했고, 호기심에 시켰던 치즈볶음밥은 여대앞을 겨냥한듯한 메뉴같지만모든이들의 입을 아우를수있는 즐겁고 재미있는 메뉴인듯하다 눈이 즐겁고 입도 행복한 비오는 날의 오후였던거 같다재방문이 충분한 이유가있는 메뉴들이다.내돈 내산 리뷰마침!!",2025-04-05,"저녁에 방문, 예약 없이 이용, 대기 시간 10분 이내, 친목, 지인・동료",음식이 맛있어요,9,1
1104854574,Sojjsh,계모임 존맛탱입니다!! 총괄매니저님이 일단 굉장히 친절하시고 메뉴설명도 친절하게해주세요 ! 성신오면 꼭먹어보세요 추추추추추추천⭐️⭐️⭐️⭐️⭐️,2025-04-05,"저녁에 방문, 예약 없이 이용, 대기 시간 바로 입장, 데이트, 연인・배우자",음식이 맛있어요,15,1
1104854574,케이크얌얌미미,"⭐️⭐️⭐️⭐️⭐️ 맛, 청결, 서비스 👍🏻소금다리살 , 양념목살 먹고왔어요미친 맛 처음이야 😆소금다리살은 고고하고 부드럽게 넘어가는 맛 그냥 먹어도 맛있고 직접만든 소스가 최고 👍🏻양념목살은 물리지 않는 양념 맛과 또다른 부드러운 식감으로 매력적이였어요 😆🔺직접 다 구워주시고 , 분위기도 즐겁게 해주시면서 테이블들을 다 신경써서 챙겨주시더라구요 🙌🏻🔺먹는 방법과 부위별 소스추천도 잘해주셔서 든든하게 먹었다는 !!🔺 부족한건 미리 채워주셨고 특별한 모임이였는데 서비스까지 챙겨주셔서 감사했습니다 🙈이런 닭고기는 처음이였어 !!! 맛있었습니다 ⭐️계모임 총괄 매니저님 감사합니다 🔥또 갈게요 ⭐️",2025-04-05,"저녁에 방문, 예약 후 이용, 대기 시간 바로 입장, 친목, 친구",음식이 맛있어요,3,1
1104854574,밍그37,양념 모듬 시키면 처음에 구워주세요! 친구랑 대화도 안하고 순식간에 먹었네요!! 너무 맛있고 직원분들이 다 유쾌하고 친절하십니당 ㅎㅎ 지나갈때마다 줄서있는 이유가 있네요👍👍,2025-04-03,"저녁에 방문, 예약 없이 이용, 대기 시간 바로 입장, 친목",인테리어가 멋져요,10,1
1104854574,먀암묘옴,총괄매니저님. 덕분에 잊을 수 없었던 식사…🤭 센스 너무 좋으시도 덕분에 많이 웃으면서 식사하도 갑니다~~~ 서비스까지 완전 대박🔥 음식도 너무 맛있답니다🤤 안정환 닮으신 총괄매니저님 체고⭐️,2025-04-03,"저녁에 방문, 예약 없이 이용, 대기 시간 바로 입장, 데이트, 연인・배우자",음식이 맛있어요,13,1
1104854574,you****,사실 인스타 광고보고 별 기대 없이 그냥 집 근처에서 먹자해서 왔어요.첫 손님이라 그런지 매니저님이 직접 구워주셨고 부위 및 먹는법에 대해서 자세히 설명해주셨어요.개인적으로 소금 찍어먹는게 젤 맛있었네요!!(양념 닭목살은 아무도 못이김)직원분들 다 친절하시고 매장은 물론 화장실도 너무 깨끗해서 단골 될 것 같아요.덕분에 기분 좋은 기념일 보내고갑니다.또 올게요 계모임❤️❤️,2025-03-29,"저녁에 방문, 예약 없이 이용, 대기 시간 바로 입장, 데이트, 연인・배우자",음식이 맛있어요,13,1
1104854574,Boo49,너무 맛있게 잘 먹었습니다..매니저님이 너무 친절하게 먹는법도 알려주시고 정말 맛있게잘 먹았어요… 반찬도 손수 다 만드신다는데하나같이 다 너무 맛있었습니다.정말 자주 방문할 것 같아요 ♡,2025-03-28,"저녁에 방문, 예약 없이 이용, 대기 시간 바로 입장, 데이트, 연인・배우자",음식이 맛있어요,4,1
1104854574,자장암,"흔한 닭요리라 별기대 없이 갔는데, 재료도 신선하고 정말 맛있었어요.  개인적으론 원래 양념을 좋아하는데 여기 소금구이는 고소하고 단백하고 고급스럽게 맛있네요.  해장 닭칼국수는 장칼국수 처럼 얼큰해서 좋았고, 간장 비빔국수는 한국식 고급 스파게티 같았습니다.   즐거운 시간이었어요.",2025-03-27,"저녁에 방문, 예약 후 이용, 대기 시간 바로 입장, 친목, 지인・동료",음식이 맛있어요,4,1
1104854574,eun****,생일 기념으로 가족이랑 방문했어요~ 입맛 까탈스러운 어머니 입맛도 사로잡은 곳!!!메인과 사이드 둘 다 맛있는 곳 흔치 않은데 여기는 진짜 맛없는 거 찾기가 힘든 곳이에요ㅠㅠㅠ 정말 오랜만에 재방문인데 고기도 다 구워주시고 무엇보다 부위마다 가장 맛있게 먹는 법 알려주시는게 좋았어요~ 생일이라고 서비스로 하이볼도 챙겨주셨어요ㅎㅎㅎ매니저님께서 잘 챙겨주신 덕분에 너무 행복한 생일 보냈네요ㅠㅠ 저희뿐만 아니라 다른 테이블도 다 신경쓰시던데 정말 리스펙합니다👍🏻 빠른 시일 내에 다시 또 가보랴구요~~~,2025-03-26,"저녁에 방문, 예약 후 이용, 대기 시간 바로 입장, 기념일, 가족모임, 부모님",음식이 맛있어요,1,1
1104854574,2666666,먹어본 메뉴 진짜 다 맛있어요 레전드👍,2025-03-25,"저녁에 방문, 예약 없이 이용, 대기 시간 바로 입장, 친목, 친구",음식이 맛있어요,2,1
1104854574,har****,"🤍 완전 깔끔쫄깃 질 좋은 닭고기집 🤍맛집 검색하다 우연히 가게 됐는데 일단 매장도 넓고 깔끔해서 좋았습니다!처음 와봤다고 하니 매니저님이 다 엄청 맛있게 구워주시고 맛있게 먹는 조합도 친절하게 다 알려주셨어요닭고기는 다 비슷하다 생각했는데 요기 고기는 차원이 다르게 쫄깃 야들했습니다 ,, 🫶 매니저님 감사했고 근처 놀러오면 꼭 다시 들를게요!",2025-03-25,"저녁에 방문, 예약 없이 이용, 대기 시간 바로 입장, 데이트, 나들이, 일상, 연인・배우자",음식이 맛있어요,7,1
1104854574,먹짱김선생,근처에 갔다가 맛집 검색해서 갔어요!사장님이 직접 오셔서 부위 설명해주시고 구워주셔서 넘 맛있게 잘 먹었어요!!어떻게 먹어야 맛있는지도 자세히 알려주셔서 재밌게 먹었답니당그리고!! 밑반찬이랑 소스가 진짜 잘 나오고 다 맛있어요 ㅠㅠ저 노란 소스는 직접 개발하신 거라는데 푹 찍어먹으면 짱 맛있습니다!!사진 찍는 기계도 있고 센스 넘쳤던 곳이에요 🩷담에 또 갈게용!,2025-03-22,"저녁에 방문, 예약 없이 이용, 대기 시간 바로 입장, 친목, 친구",음식이 맛있어요,841,1
1104854574,see****,네이버 맛집에 떠서 처음 와본 계모임닭 부속과 숯불이 이렇게 맛있을줄 몰랐네요!매장 인태리어는 인스타감성 펍 분위기였고 전 특히 소금하고 순두부찌개가 맜있었네요직원분들 서비스도 친절하고 매장도 깔끔해 다음에도 방문할만한 매장인거같아요!,2025-03-22,"점심에 방문, 예약 없이 이용, 대기 시간 바로 입장, 친목, 친구",고기 질이 좋아요,3,1
1104854574,qwe****,첫방문인데 사장님도 친절하시고 직원분들도 넘 친절하셔서 고기도 구워주셔서 편하고 맛있게 잘 먹고 갑니당 다음에 또 올게용😁,2025-03-22,"점심에 방문, 예약 없이 이용, 대기 시간 바로 입장, 데이트, 연인・배우자",친절해요,26,1
1104854574,통통도토리리,오랜만에 지인들과 만나서 갔는데 직원분들도 친절하시구 양도많고 너무 맛있어요!! 특히 소금구이가 맛나요 :),2025-03-21,"밤에 방문, 예약 없이 이용, 대기 시간 바로 입장, 친목, 친구",음식이 맛있어요,8,1
1104854574,shsdal,에기 닭구이 짱이네요~ 정신없이 먹다보니 사진찍는것도 까머고 그나마 건진 사진 ㅎㅎ 촉촉하고 부드럽고 바싹하고 고소하고~ 계속 추가해서 먹게되는 맛이네요~ 너무배불러서 못먹어본 달짝구이 먹으러 또 가야겠어요~ 사이드 순두부는 예술이네요 잘먹었습니다. 추천!!!!!,2025-03-21,"저녁에 방문, 예약 없이 이용, 대기 시간 10분 이내, 나들이, 지인・동료",음식이 맛있어요,4,2
1104854574,naraa90,닭구이맛집 1티어예요!!!처음 소금구이 먼저 먹었는데 닭다리살 껍질 식감 바삭하게 초벌해서 나와 정말 맛있어요~추가로 마라맛 주문했는데 소금구이랑은 또 다른 맛있음이 있어요~!!! 마라 좋아해서 다음에가면 마라맛으로 더 많이 먹고 오려구요~반찬도 맛있고 마요소스?? 이게 킥이예요~ 여기에 다진 청량고추 섞어서 찍먹하면 마라 안좋아하는 사람도 완전 잘 즐길수있을거 같아요~,2025-03-21,"저녁에 방문, 예약 후 이용, 대기 시간 바로 입장, 친목, 연인・배우자, 친구",직접 잘 구워줘요,377,1
1104854574,초록이313,처음 방문이라 기대하고 갔는데 서비스도 맛도 별로예요주문하고 여러번 확인해야하는 번거로움과 밑반찬도 양을 너무 적게줘서 여러번 리필해야되네요고기먹고 칼국수 주문했는데 누락되서 식사하다말고 나왔어요 비추천입니다!!,2025-03-21,"저녁에 방문, 예약 없이 이용, 대기 시간 바로 입장, 친목, 친구",,61,1
1104854574,HappyLife,"숯불에 구워먹는 고기는 다 맛있겠지만 철판보다 숯불에 구워먹는 닭고기를 좋아하는 편이라 간 곳! 잡내하나 없고 닭특수부위구이 전문이라 모듬엔  닭다리살, 목살, 무릎연골, 어깨살이 나오는데 1차 초벌되어 나오고도 테이블에서 직접구워주시기까지 하니 너무 편하게 또 맛있게 먹고 왔어요. 부위 다 맛있음!  밑반찬 모두 만드신다는데 계란장소스 그리고 청양마요 소스랑 너무 잘 어울리더라구요. 그리고 마늘쫑무침도 진짜...몇 번을 리필했는지요^^;;; 밥도둑 그리고 간장과 소금구이 아이가 먹기 딱 좋아요 :)입가심으로 묵사발 시켰는데 이렇게 이쁘게 나오는 묵사발은 처음이네요...ㅎㅎㅎ 초벌도 하시고 음식도 하시느라 식사는 조금 늦게 나온다는 점~ 제 원픽은 양념모둠~ 그리고 시원한 묵사발이요!",2025-02-28,"저녁에 방문, 예약 없이 이용, 대기 시간 바로 입장, 일상, 연인・배우자, 아이",음식이 맛있어요,464,1
1104854574,민트우유,"고기는 맛있습니다!그런데, 묵사발은 꽝꽝 얼어있어서 버리고 왔네요.재료 준비가 되어 있지 않으면… 상태를 보고 판매를 해주셨으면 하네요.",2025-02-27,"저녁에 방문, 예약 없이 이용, 대기 시간 바로 입장, 가족모임, 부모님",음식이 맛있어요,1030,1
1104854574,Ryuly seoul,"지나가면서 자주 봤는데 처음 들어가봤어요.구이모듬이랑 철판볶음밥, 생맥주 주문했는데 최상의 조합이었어요.ㅎㅎ고기와 밥, 소스, 반찬 모두 맛있었고특히 직원분들이 너무 친절하셔서 기분이 좋았고 정말 잘 왔다고 생각했어요!",2025-02-09,"저녁에 방문, 예약 없이 이용, 대기 시간 바로 입장, 데이트, 연인・배우자",음식이 맛있어요,91,1
1104854574,esk****,"해당 글은 계모임에 대한 사랑과 애정으로 적는 글이고 사장님께 돈 안받은 후기입니다. (제 주책)계모임 오목교점 열심히 다니다가 문 닫아서 성신여대점까지 먹으러 간 원정대입니다!!!제가 추천하는 이유 3가지 딱 말씀드릴게요1. 팔*도?와는 비교할 수 없는 질 좋고 맛있는 닭 특수부위 (이렇게 맛있는 닭구이는 22인생 처음)2. 닭요리와 잘 어울리는 맛있는 하이볼 (하이볼 종류도 많고 하이볼을 칵테일바 수준으로 말아주세요..)3. 닭과 같이 먹는 유자 갈릭소스, 노른자 간장 소스에 두번 치임 (소스 먹어본 사람치고 다시 안가는 사람 없소이다.. 유자 갈릭에 닭다리살 한번 딱 찍어먹으면 이제 다른 닭구이 못먹어요)사랑합니다 계모임.. 제발 우리 동네에도 내주세요..",2025-02-01,"저녁에 방문, 예약 후 이용, 대기 시간 바로 입장, 데이트, 연인・배우자",양이 많아요,33,1
1104854574,플라5887,오늘은 남편과 친구 모임으로 다녀왔어요.닭을 좋아하는 우리 가족♡ 자주 찾는 곳!!양념모둠구이 완전 추천!!  다양한 소스에찍어먹으면 깊은 맛까지~오늘도 맛있게 잘 먹고갑니다^^,2025-01-31,"저녁에 방문, 예약 없이 이용, 대기 시간 바로 입장, 친목, 친구",음식이 맛있어요,9,1
1104854574,petitlapin,근처 닭갈비집 중 젤 맛있어요.,2025-01-23,"저녁에 방문, 예약 없이 이용, 대기 시간 바로 입장, 일상, 연인・배우자",음식이 맛있어요,1466,17
1104854574,썸뷔,닭 특수부위는 팔O도에서 처음 먹어봤었는데 이제 계모임 갈듯요 ㅎㅎ 여기 맛있네요. 소스도 달달 매콤 고기 냄새 일도 없고 목살 쫄깃 굳굳. 여자 넷이 갔는데 넘 마니 먹음 ㅋㅋ 배 터지겠는데 국수 메뉴 발견하고 마지막으로 초계국수까지 ㅡㅡㅋ 아 근데 국수 면발 뭐지? 맛있어 ㅡㅡ;; ㅋㅋㅋ 마지막으로 계산 하고 나올때 발견한 스티커사진!!!! 다들 취했지만 예쁘게 찍고 ㅋㅋ 가게에 붙야놓고 왔어요 ㅋㅋ 담에 가서 찾으면 잼잇을듯 ㅋ 재방문 의사 완전 있~~~ (화장실 인터리어 힙해요 ㅋㅋ,2025-01-17,"저녁에 방문, 예약 후 이용, 대기 시간 바로 입장, 친목, 지인・동료",음식이 맛있어요,32,1
1104854574,서울 k 동글이,성신여대 계모임 방문햇내요 양념모듬구이 양념이 타지않게 세심하게 구워주시내요 물론 맛도 엄지척  치즈 철판볶음밥은 불향 가득하고 치즈에 비벼먹으니까 매운맛은 중화되면서 치즈의  고소한 맛이 업그레이드 되내요 다음에 재방문 의사 만퍼센트 잘먹었습니다,2024-12-06,"저녁에 방문, 예약 없이 이용, 대기 시간 바로 입장, 데이트, 연인・배우자",음식이 맛있어요,1,1
1104854574,a06****,친구가 맛집이라고 소개해줘서 같이 먹으러 왔는데 이렇게 많은 부위의 닭을 먹은 건 처음이었어요! 너무 맛있고 새로운 경험이었어요 그리고 직원분께서 직접 구워주시면서 친절하게 하나하나 다 설명해주셔서 어떤 부위인지 알고 먹을 수 있었어요!! 사이드메뉴도 다 맛있어보여서 다음 번엔 다른 사이드 메뉴 도전해보려구요 ㅎㅎㅎ 단골 예약입니당♡♡,2024-12-06,"저녁에 방문, 예약 없이 이용, 대기 시간 바로 입장, 친목, 친구",인테리어가 멋져요,11,1
1104854574,체링열매,"너무너무 진짜 맛있어요! 마지막에 사진 기계도 있고, 사장님 성격이 너무너무 좋으시잖아요!! 무조건 또 가는집!!❤️",2024-11-09,"저녁에 방문, 예약 없이 이용, 대기 시간 바로 입장, 데이트, 연인・배우자",매장이 넓어요,65,1
1104854574,야오8,닭구이 중 최고입니다!다 구워주시고 닭이 엄~~~청 부드러워요!짱맛있습니다 모듬으로 꼭 먹어야해요!! 항상 잘먹고 갑니다~~,2024-10-31,"저녁에 방문, 예약 없이 이용, 대기 시간 바로 입장, 데이트, 기념일, 연인・배우자, 친구",음식이 맛있어요,10,2
1104854574,맛좋은유자,메인메뉴인 닭 다양한 부위 다 너무너무 맛있게 먹었구요!저는 특히 같이 나오는 소스와 반찬들이 너무너므 좋았어요! 같이 먹기에 조합이 최고라 계속 먹게 되더라구요!소금모둠 양념모둠 다 먹었는데 소금은 담백하게 계속 먹을 수 있고! 양념은 술을 부르는 맛이더라구요철판볶음밥은 꼭 드시길 .. 치즈를 들이 부은줄 알았답니다!! 최고!,2024-10-26,점심에 방문,음식이 맛있어요,960,1
1104854574,화이트늑대,맛잇게 잘먹엇습니다요 ~~,2024-10-12,"저녁에 방문, 예약 없이 이용, 대기 시간 바로 입장, 데이트, 지인・동료",고기 질이 좋아요,430,1
1104854574,찌루까미언니,소금구이 너무 마싰어요! 왜 유명한지 알겠네요~><,2024-10-06,"점심에 방문, 예약 후 이용, 대기 시간 바로 입장, 친목, 친구",음식이 맛있어요,36,1
1104854574,라이현99,고기도 직접 구워주시고 다양한 부위의 닭고기를 즐길 수 있어서 너무 즐거운 시간이었습니다.너무 맛있고 세상친절! 😆👍,2024-09-28,"저녁에 방문, 예약 후 이용, 대기 시간 바로 입장, 데이트, 연인・배우자",음식이 맛있어요,511,1
1104854574,챈719,사장님이 하나하나 맛있게 다 구워주셔서 편하게 먹었어요~😄 맛도 넘 좋고 국수도 맛있고 하이볼도 맛있었습니다! 사진 찍는 기계도 있어서 다 먹고 친구들이랑 추억도 남겼습니당! 담에 또 가려구요😉,2024-09-28,"점심에 방문, 예약 없이 이용, 대기 시간 바로 입장, 친목, 친구",인테리어가 멋져요,94,1
1104854574,너나라나의 솔직나무,매장도 넓고 소금구이  먹을만 했어요.근데 서비스는 구닥...양념소스 찍어 먹을려고 부탁했더만 안된다네요..ㅠ다른데는 주시던데...재방문 의사 ㄴㄴ,2024-09-27,"저녁에 방문, 예약 없이 이용, 대기 시간 바로 입장, 데이트, 지인・동료",음식이 맛있어요,309,1
1104854574,petitlapin,친절하고 육즙이 있으면서 맛있어요.,2024-09-12,"저녁에 방문, 예약 없이 이용, 대기 시간 바로 입장, 일상",음식이 맛있어요,1466,16
1104854574,amh****,특수부위가 맛있네요.,2024-09-12,저녁에 방문,음식이 맛있어요,2118,4
1104854574,은빛율,굿,2024-09-07,"저녁에 방문, 예약 없이 이용, 대기 시간 바로 입장, 데이트, 연인・배우자",음식이 맛있어요,767,1
1104854574,솜씻너,"예약하고 처음 방문했는데 너무 맛있게 잘 먹었어요!  매장 깔끔하고 다들 친절하셨어요☺️ 같이 나오는 소스, 반찬도 전부 깔끔하게 잘 어울렸어요. 다음에 또 방문하고 싶어요💗",2024-08-20,"저녁에 방문, 예약 후 이용, 대기 시간 바로 입장, 친목, 친구",인테리어가 멋져요,890,1
1104854574,qm****,진짜 맛있고 볶음밥 꼭드세요 ㅎ,2024-08-18,"저녁에 방문, 예약 없이 이용, 대기 시간 바로 입장, 데이트, 연인・배우자",음식이 맛있어요,4,1
1104854574,키라7969,벌써 두번째 방문입니다😋 항상 직원분들이 친절하고 맛있어요. 먹느라 사진찍는걸 항상 잊어버리네요. 조만간 달짝세트 먹으러 또 갈께요!,2024-08-15,"저녁에 방문, 예약 없이 이용, 대기 시간 바로 입장, 데이트, 연인・배우자",음식이 맛있어요,11,1
1104854574,bbs****,굿,2024-08-14,"저녁에 방문, 예약 후 이용, 대기 시간 바로 입장",음식이 맛있어요,985,1
1104854574,이어오46,Good,2024-08-14,"저녁에 방문, 예약 없이 이용, 대기 시간 바로 입장, 친목, 지인・동료",고기 질이 좋아요,463,1
1104854574,자두350,소금모둠구이 시켰는데 이것저것 맛볼 수 있고 양도 꽤 넉넉했어요 ! 볶음밥은 치즈가 많이 들어있었고 약간 매콤해서 사이드로 먹기에 좋았습니다. 닭구이에 얼그레이 하이볼 꼭 곁들여 드세요 😉,2024-08-07,"저녁에 방문, 예약 없이 이용, 대기 시간 바로 입장",매장이 넓어요,255,1
1104854574,sns****,"특수부위모둠을 시켰는데 근위, 염통은 닭 비린내가 납니다단품 메뉴를 시키는 것을 추천드려요닭다리, 안심은 맛있게 먹었습니다같이 준비해주는 노른자가 들어있는 소스도 비려요..먹으면서 치킨이 더 맛있고 가성비 있겠다는 생각이 들었어요 ㅜ.ㅜ 사장님은 친절하시고 매장은 깨끗합니다! ~",2024-08-04,"점심에 방문, 예약 없이 이용, 대기 시간 바로 입장, 친목, 친구",매장이 청결해요,3,1
1104854574,Hold Ju,굿,2024-07-31,"저녁에 방문, 예약 후 이용, 대기 시간 바로 입장",음식이 맛있어요,261,1
1104854574,최강 앨프녀,"오늘도 맛있는 계모임! 오픈 언제 했는지 정확히 기억은 안나지만 오픈초창기부터 다녔는데, 역시 오늘도 맛있네요! 소금구이랑 특수구이의 닭고기를 맛볼 수 있으며, 특제소스가 진짜 맛있어요 !",2024-07-26,저녁에 방문,음식이 맛있어요,635,1
1104854574,카라멜13,친구추천으로 중복날 방문했는데~ 정말 맛있어요~  특히 닭발이랑 목살 추천합니다!!!,2024-07-25,"저녁에 방문, 예약 없이 이용, 대기 시간 바로 입장, 친목, 친구",음식이 맛있어요,50,1
1104854574,김레인1004,항상 사람 많은 닭특수부위 전문점 계모임한번 가보고 싶었는데 힙한 느낌의 인테리어와신나는 음악 시원하고 쾌적한 내부맛있는 음식까지 훌륭했다!!,2024-07-24,"저녁에 방문, 예약 후 이용, 대기 시간 바로 입장, 나들이, 아이",인테리어가 멋져요,192,1
1104854574,Jjeong25,"성신여대 맛집 찾았어요 ㅎㅎㅎ 소금모듬구이도 담백, 그리고 최초 2인분 이상 주문 시에 부위별로 1인분씩 추가도 가능해서 넘 좋더라구요 ㅎㅎ 순두부찌개도 맛나고 특히 하이볼이 진짜 미쳐용..🤍",2024-07-18,"저녁에 방문, 예약 후 이용, 대기 시간 바로 입장, 데이트, 연인・배우자",매장이 넓어요,270,1
1104854574,망고chu,N번째 방분한 성신여대 닭구이맛집 계모임! 잡내도 적고 맛있어서 술을 부르는 맛이에요👍👍 순두부찌개는 진짜 꼭 드세요 ⭐️ 얼큰하니 닭구이랑 궁합도 좋고 술안주로도 딱이에요😍😍 시원한 생맥주먹고 맛있는 닭구이까지! 사장님도 친절하세요,2024-07-17,"저녁에 방문, 예약 없이 이용, 대기 시간 바로 입장, 데이트",친절해요,359,1
1104854574,dasomiS2,"닭구이 좋아하는데 모둠부위 맛볼수 있다는 성신여대맛집에 갔어요 ㅎㅎ 역시 인기맛집 답게 비오는 날인데도 바글바글( 여쭤보니 오늘은 적은편이였다는..) ㅎㅎㅎ 여튼 인기많은 이유 답게 고기가 부드럽고 구성이 좋았어요^^ 닭다리부터 안심, 연골, 염통 등 다양하니 물리지도 않고 다 먹고 왔네요! 무엇보다 고기가 부드러워서 맛있어용 ^^",2024-07-16,"저녁에 방문, 예약 없이 이용, 대기 시간 바로 입장, 데이트, 연인・배우자",음식이 맛있어요,443,1
1104854574,커피는내친구,굿,2024-07-16,저녁에 방문,고기 질이 좋아요,3560,1
