place_id,nickname,content,date,situations,keywords,review_count,visit_count
1541264106,아정이76,반반포장하면 두끼로 나눠 먹을 수 있어서 좋아요.,2025-01-24,"점심에 방문, 포장·배달 이용, 대기 시간 바로 입장, 일상, 연인・배우자",음식이 맛있어요,34,3
1541264106,yjy****,"죽은 이 근처에서 여기지점이 젤 맛있고, 또 친절하신거같아요",2025-01-04,"점심에 방문, 포장·배달 이용, 대기 시간 바로 입장, 혼자",재료가 신선해요,21,1
1541264106,지나4,죽 종류가 많고 다양해서 골라 먹기 좋아요.,2025-01-02,"점심에 방문, 포장·배달 이용, 대기 시간 30분 이내, 일상, 혼자",음식이 맛있어요,548,3
1541264106,jazzmate,,2024-12-21,"저녁에 방문, 포장·배달 이용, 대기 시간 바로 입장",음식이 맛있어요,3116,2
1541264106,ysd****,맛있어요,2024-12-20,점심에 방문,음식이 맛있어요,2244,1
1541264106,야야코유,근처 죽집중에 길음 본죽이 제일 맛있어요~~,2024-12-12,"점심에 방문, 예약 없이 이용, 대기 시간 바로 입장, 아이",음식이 맛있어요,109,1
1541264106,호롤롤로67,맛있고 소화가잘돼요,2024-12-07,"저녁에 방문, 예약 없이 이용, 대기 시간 10분 이내, 연인・배우자",음식이 맛있어요,584,1
1541264106,yy1****,,2024-12-04,"점심에 방문, 예약 없이 이용, 대기 시간 바로 입장, 혼자",친절해요,1746,3
1541264106,다뎀벼바,항상 몸이 안좋아 질때면 찾게 됩니다. 얼른 먹고 기운 내겠습니다!!!,2024-12-02,"저녁에 방문, 포장·배달 이용, 대기 시간 바로 입장, 일상, 혼자",매장이 넓어요,72,3
1541264106,sil****,맛있게 먹었어요 누룽지까지 박박 긁어서 ㅎㅎ,2024-11-29,점심에 방문,음식이 맛있어요,1195,1
1541264106,ess****,맛있게 잘 먹었습니다~,2024-11-25,"저녁에 방문, 포장·배달 이용",음식이 맛있어요,11,1
1541264106,Zzz7044,미음으로도 시킬수있어요,2024-11-21,점심에 방문,음식이 맛있어요,1038,2
1541264106,smile sjw,맛있겠다,2024-11-16,"저녁에 방문, 예약 없이 이용, 대기 시간 바로 입장, 친구",음식이 맛있어요,864,1
1541264106,choco0260,자주 이용하는 죽집입니다. 사장님 친절하세요. 죽도 맛있습니다.,2024-11-15,"저녁에 방문, 포장·배달 이용, 대기 시간 바로 입장, 일상, 회식, 아이",친절해요,18,4
1541264106,케투케투,맛있게 먹느라 사진을 못찍었네요 다음에 또 방문 하겠습니다,2024-11-04,"점심에 방문, 예약 없이 이용, 대기 시간 바로 입장, 일상, 혼자",혼밥하기 좋아요,5,1
1541264106,7297,네이버 예약 후 방문 직원분들 친절하시고 죽도 맛나요,2024-10-21,"점심에 방문, 예약 후 이용, 대기 시간 바로 입장, 일상, 혼자",음식이 맛있어요,240,2
1541264106,Zzz7044,맛있어요!!!!!!,2024-10-17,점심에 방문,음식이 맛있어요,1038,1
1541264106,jsb7604,두 가지 맛도 있네요,2024-10-15,"저녁에 방문, 포장·배달 이용, 대기 시간 10분 이내, 일상, 혼자",음식이 맛있어요,203,1
1541264106,dudhqoa,"2000원 더 주고 치즈 추가 했는데 치즈가 거의 없어서 슬펐어요,,  치즈매니절~~!! 😭",2024-09-18,"저녁에 방문, 포장·배달 이용",음식이 맛있어요,27,1
1541264106,민찬사랑,맛있어요,2024-09-12,점심에 방문,음식이 맛있어요,736,2
1541264106,성현석36,일하시는 분들 전부 친절하시고 죽도 너무 맛있습니다~,2024-08-13,"점심에 방문, 포장·배달 이용, 대기 시간 바로 입장, 일상, 혼자",음식이 맛있어요,2,1
1541264106,땡히,엄마가 아프신데 죽이 드시고싶다하셔서 급하게 사러갔는데 매우 빠르고 맛있어서 좋았습니다,2024-08-07,"저녁에 방문, 포장·배달 이용, 대기 시간 10분 이내, 혼자",메뉴 구성이 알차요,10,3
1541264106,사랑98,깔끔하고 맛있어요,2024-07-15,"아침에 방문, 포장·배달 이용, 대기 시간 바로 입장, 혼자",음식이 맛있어요,680,1
1541264106,쩝쩝박사6,죽이 맛있고 포장픽업 시간딱맞춰서 해주셔서 늘 따듯하게 바로 먹고있습니다👍,2024-07-01,"저녁에 방문, 포장·배달 이용, 대기 시간 바로 입장, 일상, 혼자",음식이 맛있어요,226,3
1541264106,천사아빠18,주문포장도 빠르고 친절하시고 좋아요,2024-06-07,"점심에 방문, 대기 시간 바로 입장, 일상, 혼자",음식이 맛있어요,234,7
1541264106,못난54,굿굿,2024-06-07,"점심에 방문, 예약 없이 이용, 대기 시간 바로 입장, 일상, 혼자",혼밥하기 좋아요,782,1
1541264106,김형배32,몸이아파 죽사러,2024-06-01,"점심에 방문, 예약 없이 이용, 대기 시간 바로 입장, 일상",음식이 맛있어요,682,2
1541264106,사유3316,처음 먹어본 새송이 소고기죽이 정말 맛있었어요,2024-05-25,"점심에 방문, 예약 후 이용, 일상, 연인・배우자",음식이 맛있어요,186,2
1541264106,selfbrand,맛있어요,2024-05-24,점심에 방문,음식이 맛있어요,1928,1
1541264106,kkb****,단호박죽 맛있어요,2024-05-10,"점심에 방문, 포장·배달 이용, 대기 시간 30분 이내",음식이 맛있어요,667,1
1541264106,찌니50,맛있게먹었습니당! 대기없이 바로 포장했어용,2024-04-25,"저녁에 방문, 포장·배달 이용, 대기 시간 바로 입장, 혼자",음식이 맛있어요,65,1
1541264106,쩝쩝박사6,친절하시고 죽도 요청사항대로 잘 소분해서 주십니다 늘 잘 먹고있어요 죽 맛집입니드,2024-04-20,"점심에 방문, 예약 후 이용, 대기 시간 10분 이내, 일상, 혼자",재료가 신선해요,226,2
1541264106,구찌119,죽맛있어요...아파서 짜증이났는데 직원분이친절하게 대응해주셔서 기분좋아졌어요^^다음엔 비빔밥 먹으러 가야겠어요~,2024-04-15,"저녁에 방문, 포장·배달 이용, 대기 시간 바로 입장, 일상, 혼자",음식이 맛있어요,2,1
1541264106,72b****,소분을 먼저 물어봐 주셔서 좋았어요,2024-04-13,점심에 방문,친절해요,1324,1
1541264106,60281,카운터 보시는분 ..   업무에 너무 미숙한데다 너무 블친절하십니다.,2024-04-11,"점심에 방문, 포장·배달 이용, 대기 시간 바로 입장, 일상, 혼자",음식이 맛있어요,13,1
1541264106,ilw****,좋아요,2024-04-10,"점심에 방문, 예약 없이 이용, 대기 시간 바로 입장, 일상, 지인・동료",음식이 맛있어요,2532,3
1541264106,크리스탈7481,굿!!,2024-04-08,"점심에 방문, 예약 후 이용, 대기 시간 30분 이내, 일상, 혼자",음식이 맛있어요,1651,7
1541264106,타니타니7,좋아요,2024-04-08,"점심에 방문, 예약 없이 이용, 대기 시간 바로 입장, 일상, 혼자",음식이 맛있어요,1079,3
1541264106,나르시스1728,좋아요,2024-04-03,점심에 방문,음식이 맛있어요,3765,3
1541264106,가쥬236,"여기는 카운터 알바하시는 아주머니 왜 안자르시는지 모르겠어요 정말 불친절하시고요, 틱틱거리십니다 갈때마다 되게 불쾌해요 약간 자기 기분대로 장사하세요 남의 가게를다른 손님들이랑도 말다툼하는거 한두번 본게 아니네요 동네장사를 ㅋㅋㅋ포장주문 동치미랑 다른 반찬 좀 넉넉하게 넣어주시라고 따로 말씀도 드렸고, 계산할때도 한 번 더 여쭤봤는데 너무 뻔뻔하고 당연하게 가득가득 채워넣었어요 하시더니 집 와서 보니까 원래 주는 양 보다도 적어요 장난 치십니까아 정말 불쾌합니다 사장님은 직원 좀 바꾸셨으면",2024-04-02,"저녁에 방문, 예약 후 이용, 대기 시간 바로 입장, 혼자",잡내가 적어요,57,1
1541264106,길음동푸른꿩,맛있고 건강한 맛이에요,2024-04-02,"저녁에 방문, 예약 없이 이용, 대기 시간 바로 입장, 일상, 혼자",음식이 맛있어요,654,1
1541264106,안냥맹,잘 먹었어요.,2024-03-30,"저녁에 방문, 예약 없이 이용, 대기 시간 바로 입장, 데이트, 일상, 연인・배우자",혼밥하기 좋아요,178,1
1541264106,오목55,친절해요,2024-03-18,점심에 방문,음식이 맛있어요,210,1
1541264106,쩝쩝박사6,미리 주문해놓고 포장픽업 갔는데 시간도 맞춰서 딱 준비해주셨어요 친절하시고 죽도 맛있네요,2024-02-26,"저녁에 방문, 예약 후 이용, 대기 시간 바로 입장, 일상, 혼자",혼밥하기 좋아요,226,1
1541264106,버리면쓰레기12393,김치아김치,2024-02-20,저녁에 방문,,2023,6
1541264106,yuho7617,내시경 하고 죽먹으러 왔어요~~,2024-01-31,"점심에 방문, 예약 없이 이용, 대기 시간 바로 입장, 데이트, 연인・배우자",음식이 맛있어요,411,1
1541264106,백멍뭉이네,좋아요,2024-01-30,"점심에 방문, 예약 없이 이용, 대기 시간 바로 입장, 일상, 혼자",음식이 맛있어요,833,5
1541264106,루피팡팡이,구내염 땜에 죽만 먹어야 됐었는데 단호박죽이 절 구했어요 너무 맛있네용 두개로 소분해서 먹으면 딱입니다,2024-01-29,"점심에 방문, 포장·배달 이용, 대기 시간 바로 입장",음식이 맛있어요,16,3
1541264106,루피팡팡이,굿,2024-01-26,"점심에 방문, 포장·배달 이용, 대기 시간 바로 입장",음식이 맛있어요,16,2
1541264106,돈나17,전화 통화 후 도착시간 말씀드렸는데 정확한 시간에 포장해주세요~ 친절하세요!,2024-01-22,"저녁에 방문, 예약 후 이용, 대기 시간 바로 입장, 가족모임, 부모님",음식이 맛있어요,193,1
1541264106,오마갓뜨,포장햣어요,2024-01-19,"점심에 방문, 예약 없이 이용, 대기 시간 바로 입장, 일상",특별한 메뉴가 있어요,2013,1
1541264106,son****,"아파서 죽 먹으러 갔다가 도저히 못 먹겠기에 반찬 , 죽 한입도 못 먹고 포장해달라고 했습니다.여자직원이 하는말이 포장은 반찬 못 나간다고 해서 그러면 죽만 포장해달라고 하니, 저렇게 줍니다 밖에 눈도 와서 쇼핑백에 담아달라고 하니 쇼핑백 500원 달라고 합니다 .ㅎㅎㅎㅎㅎㅎ 눈 오는데 그럼 저렇게 들고 가냐고 여자 직원한테 물으니 그제야 사장님이 나와서 반찬도 포장해 주고 쇼핑백도 담아준답니다 ㅡㅡ이게 무슨 장난하시나요 사람 봐가면서 장사하시나봐요 앞으로 절대 이용 할 일 없을것 같습니다.",2024-01-17,점심에 방문,,7,1
1541264106,크리스탈7481,굿!!,2024-01-13,"저녁에 방문, 예약 후 이용, 대기 시간 30분 이상, 일상, 혼자",음식이 맛있어요,1651,6
1541264106,크리스탈7481,굿!!,2024-01-06,"점심에 방문, 예약 후 이용, 대기 시간 10분 이내, 일상, 혼자",음식이 맛있어요,1651,5
1541264106,찐이6085,,2024-01-05,점심에 방문,음식이 맛있어요,1808,4
1541264106,찐이6085,,2024-01-02,점심에 방문,음식이 맛있어요,1808,3
1541264106,점핑스타 줌바 리나쌤,포장 가끔 ᆢ빨리 나와서 좋아요,2023-12-30,"저녁에 방문, 예약 없이 이용, 대기 시간 바로 입장, 일상, 혼자",음식이 맛있어요,1525,5
1541264106,위킴,전복죽 포장했는데 맛있게 잘 먹었어요 :),2023-12-29,"점심에 방문, 예약 후 이용, 대기 시간 바로 입장",음식이 맛있어요,385,1
1541264106,철스구루메,맛있쥬.,2023-12-21,"점심에 방문, 예약 없이 이용, 대기 시간 바로 입장, 일상, 혼자",음식이 맛있어요,987,1
1541264106,정미순75,굿,2023-12-14,"점심에 방문, 예약 없이 이용, 대기 시간 바로 입장, 일상, 혼자",음식이 맛있어요,973,5
1541264106,짱구이마16,아이가 아파서 호박죽 사왔어요,2023-12-14,아침에 방문,음식이 맛있어요,1648,1
1541264106,독한,친절하세요~ 맛도 굿,2023-12-08,"점심에 방문, 예약 후 이용, 대기 시간 10분 이내, 일상, 혼자",건강한 맛이에요,10,1
1541264106,아비뇽36,엄청 친절하고 좋습니다!,2023-11-30,"저녁에 방문, 예약 없이 이용, 대기 시간 바로 입장, 일상, 혼자",음식이 맛있어요,446,1
1541264106,GraceHyun,좋아요,2023-11-27,점심에 방문,친절해요,1035,2
1541264106,sh보라,깔끔하고 맛있어요,2023-11-25,"아침에 방문, 예약 없이 이용, 대기 시간 바로 입장, 데이트, 연인・배우자",음식이 맛있어요,565,2
1541264106,나는야 그로밋,전복죽 맛있고 사장님 친절히세요!,2023-11-23,"점심에 방문, 포장·배달 이용, 대기 시간 바로 입장, 일상, 부모님",친절해요,75,1
1541264106,Despacito38,혼밥하기 적당하네요,2023-11-20,"점심에 방문, 예약 없이 이용, 대기 시간 바로 입장, 일상, 혼자",혼밥하기 좋아요,198,1
1541264106,삼손20,굿,2023-11-20,"점심에 방문, 포장·배달 이용, 대기 시간 바로 입장, 일상, 혼자",음식이 맛있어요,2387,5
1541264106,강한전사63,좋아요,2023-11-15,"저녁에 방문, 예약 없이 이용, 대기 시간 30분 이내, 일상, 혼자",음식이 맛있어요,986,2
1541264106,Jennn2,죽이 3등분으로 소분 포장도 가능해서 너무 좋아요,2023-11-13,"저녁에 방문, 예약 후 이용",포장이 깔끔해요,14,1
1541264106,매일다욧만해,해물도 듬뿍 맛있어요,2023-11-07,"저녁에 방문, 포장·배달 이용, 대기 시간 바로 입장, 혼자",음식이 맛있어요,36,2
1541264106,정미순75,굿,2023-11-07,저녁에 방문,음식이 맛있어요,973,4
1541264106,아정이76,쇠고기야채죽이 젤 맛난거 같아요.입맛없을때 끼니 거르지 않고 먹을 수 있어 좋아요.,2023-11-06,"점심에 방문, 포장·배달 이용",건강한 맛이에요,34,2
1541264106,IM CLARA,조아요,2023-10-30,저녁에 방문,음식이 맛있어요,1706,15
1541264106,applepig,맛있어요,2023-10-30,저녁에 방문,음식이 맛있어요,1121,1
1541264106,IiiIiiiIIiiIIiii,가격 대비 그냥 그랬습니다. 이름값인 것 같아요.,2023-10-20,점심에 방문,건강한 맛이에요,2630,1
1541264106,원자4752,포장주문으로 먹었는데 단팥죽 너무 맛있어요.,2023-10-16,저녁에 방문,음식이 맛있어요,45,2
1541264106,studio07,쿠폰사묭이랑 비가와서 죽먹고싶어왔어요,2023-10-14,점심에 방문,매장이 청결해요,1941,1
1541264106,분홍 바늘꽃,요구사항이 많았는데 친절하게 해주셔서 감사했습니다,2023-10-11,점심에 방문,음식이 맛있어요,1294,1
1541264106,ysh****,좋아요~,2023-10-07,점심에 방문,음식이 맛있어요,2495,1
1541264106,bla****,가까운데 본죽이 있어서 감사하네요. ^^,2023-10-04,점심에 방문,음식이 맛있어요,719,1
1541264106,북극여우6783,"가끔 포장해 오는곳, 이번엔 남편  장염으로찾게 되었어요. 요청사항 잘 들어주세요.",2023-10-02,아침에 방문,음식이 맛있어요,43,2
1541264106,라벤더1762,아이가 아파서 픽업해먹었는데 맛있네요 ~,2023-09-19,점심에 방문,음식이 맛있어요,12,1
1541264106,hel****,좋아요~,2023-09-14,점심에 방문,음식이 맛있어요,1841,2
1541264106,양정미78,조아요~,2023-09-13,점심에 방문,음식이 맛있어요,59,1
1541264106,bijou0051,맛있어요~,2023-09-12,점심에 방문,음식이 맛있어요,807,1
1541264106,wls****,맛있어요,2023-09-08,저녁에 방문,음식이 맛있어요,926,1
1541264106,김형배32,가볍게 먹기 좋아요,2023-09-06,저녁에 방문,음식이 맛있어요,682,1
1541264106,lee****,좋아요,2023-08-28,점심에 방문,음식이 맛있어요,931,4
1541264106,psy****,본죽도 매장마다 맛도 조금씩 다른데 개인적으론 자주 이용하는 매장입니다! 맛있고 직원분께서도 친절하게 대해 주셔서 갈때마다 기분이 좋아요! 죽을 일반식처럼 자주 먹진 않지만 죽 먹을땐 꼭 길음역 매장을 이용한답니다.,2023-08-26,아침에 방문,음식이 맛있어요,10,1
31363747,ijm,좋아요,2025-03-29,"저녁에 방문, 예약 없이 이용",친절해요,650,2
31363747,행복지킴이33,가성비 맛집!!!,2025-03-22,"점심에 방문, 예약 없이 이용, 대기 시간 바로 입장, 일상, 친구",음식이 맛있어요,355,2
31363747,Banananina,좋아요~,2025-03-14,"점심에 방문, 예약 없이 이용",음식이 맛있어요,1383,2
31363747,등대8410,정말 좋아하는 홍두깨 손칼국수입니다. 1. 김치와 생무채가 맛있습니다. 2. 칼국수 칼제비 수제비 모두 맛있습니다. 3. 키위 등이 들어간 소스가 맛깔나는 비빔국수도 속을 풀어줍니다. 4. 콩국수도 깔끔합니다. 5. 국산 들깨국수도 국물이 고소하고 예술입니다! 6. 주기적으로 생각나서 먹어주고 있는 맛집입니다. :),2025-03-08,"점심에 방문, 예약 없이 이용, 대기 시간 바로 입장, 나들이, 아이",음식이 맛있어요,19,1
31363747,다정한말한마디,봄비가 이쁘게 오는 3월 첫날!비오면 수제비~♡,2025-03-01,점심에 방문,음식이 맛있어요,495,42
31363747,kmr****,날씨가 너무추워서 따뜻한 국물 생각나서 오랫만에 방문. 면이부들부들 넘 맛있어요.곁들인 김치.무생채도 굿~~~,2025-02-19,"점심에 방문, 예약 없이 이용, 대기 시간 바로 입장, 혼자",음식이 맛있어요,477,1
31363747,nax****,칼국수 가성비 있게 맛있는 곳,2025-02-18,"점심에 방문, 예약 없이 이용, 대기 시간 바로 입장, 나들이, 아이",음식이 맛있어요,374,4
31363747,미라클수아,매생이 칼제비,2025-02-11,"저녁에 방문, 예약 없이 이용, 대기 시간 바로 입장, 일상, 친구",음식이 맛있어요,2739,1
31363747,행복지킴이33,사장님도 친절하시고 칼국수.칼제비 다 굿~,2025-02-10,"저녁에 방문, 예약 없이 이용, 대기 시간 바로 입장, 일상, 혼자",음식이 맛있어요,355,1
31363747,맛차장,미아사거리 압도적 1등 칼국수집입니다.대부분 칼국수.수제비를 드시는데 전 삼색 비빔국수를 추천드립니다. 엄청난 야채에 자극적이지 않은 양념장 그리고 면도 직접 뽑아서 조리하는데 메뉴에 따라 면이 다 다릅니다. 입맛 없을때 드셔 보시면 딱이고 칼국수는 6천원으로 압도적 가성비를 자랑합니다.그리고 여름에는 콩국수 꼭 드셔보시길 추천드립니다오늘도 잘 먹었습니다^^,2025-02-01,"저녁에 방문, 예약 없이 이용, 대기 시간 바로 입장, 일상, 혼자",음식이 맛있어요,39,1
31363747,다정한말한마디,사진만 봐도 기분 좋아지는 맛집~~♡수제비가 더더 맛있어졌어용~~^^저는 홍두깨 국물 엄청 좋아해요깔끔하고 담백한 국물에 양념 후추 넣고흐흐 글 쓰면서 군침이~~엊그제 다녀오고 쓰는데오늘도 달려가야겠어욤^^!홍두깨 최고♡♡♡♡♡♡♡♡♡♡♡,2025-01-23,아침에 방문,음식이 맛있어요,495,41
31363747,맑음N,"칼국수 6,000칼제비 7,000꼬마김밥6줄 3,000가성비있는 칼국수집맛은 평범합니다.반찬은 김치, 무생체 원하는 만큼 셀프로 떠먹고다 먹은후에 그릇들은 셀프로 반납하는 곳.개인적으론 칼국수나 칼제비 국물이 심심한듯조금 셍거웠어요.",2025-01-18,점심에 방문,,1783,1
31363747,파이어스톰33,면발이  살아있는데 육수가좀싱겁네요  무채가 숙성 이안되어서 깊은맛은 없구요  김치  와밑반찬  쏘쏘  겉절이  싱겁습니다  하지만 가성비가좋고 양도마니주셰요  맛나게잘먹었구  곁들임  꼬마김밥  먹을만합니다  확맛집이고   그런거같지않네요   자주갈게요 주머니가 사정상 편한 문턱입니다모두셀프이고 선불입니다,2025-01-18,"점심에 방문, 예약 없이 이용, 대기 시간 바로 입장, 가족모임, 연인・배우자",양이 많아요,53,1
31363747,해피윰8,가격이 옛날에비해선 많이 오르긴했네요ㅜ그리고 갠적으로 김치는 안익고해서 별론데 무생채는 맛나네요~,2025-01-18,"점심에 방문, 예약 없이 이용, 대기 시간 바로 입장, 일상, 아이",,4154,1
31363747,kyjw13,굿~~~,2025-01-18,점심에 방문,음식이 맛있어요,2069,7
31363747,ejko1008,맛있어요!,2025-01-14,"점심에 방문, 예약 없이 이용, 대기 시간 바로 입장, 일상, 아이",음식이 맛있어요,1473,2
31363747,엄지손톱68,칼국수,2025-01-04,점심에 방문,음식이 맛있어요,2791,2
31363747,soo****,굿,2025-01-02,"점심에 방문, 대기 시간 바로 입장, 데이트, 친구",음식이 맛있어요,598,2
31363747,HappyLife,꼬마김밥 안에 든 건 단무지와 당근 부추 한 줄? 정도 인데 맛있어요. 발려진 참기름도 고소해서 아이가 6개 먹고 더 먹고 싶다고 2접시 시켰어요~그리고 수제비는 얇지 않아요~ 개인적으로 하늘거리게 얇은 수제비 좋아하는 편이라 전 칼국수 면이 더 좋네요 :),2024-12-30,"점심에 방문, 예약 없이 이용, 대기 시간 바로 입장, 일상, 아이",음식이 맛있어요,464,2
31363747,La Vita77,둘이 먹다 셋이 먹은듯한 배부름..늘 맛있음💯👍👏👏👏,2024-12-28,"점심에 방문, 예약 없이 이용, 대기 시간 바로 입장, 일상, 연인・배우자",음식이 맛있어요,238,4
31363747,nax****,맛있어요,2024-12-24,"점심에 방문, 예약 없이 이용, 대기 시간 바로 입장, 일상, 혼자, 아이",음식이 맛있어요,374,3
31363747,비기,쫄깃! 😋,2024-12-23,"점심에 방문, 예약 없이 이용, 대기 시간 바로 입장",음식이 맛있어요,1058,2
31363747,cod****,양념장이 있어 제 입맛에 맞춰 맛있게 먹었습니다,2024-12-21,"점심에 방문, 예약 없이 이용, 대기 시간 바로 입장, 일상, 친척・형제",음식이 맛있어요,24,1
31363747,cyclone9,나이스,2024-12-20,점심에 방문,음식이 맛있어요,1527,14
31363747,꿈꾸는나비34,회전율이 좋아서 대기해도 금새 자리 생겨요 배고파서 골목들어 갔다가 맛집을 찾았네요,2024-12-20,"점심에 방문, 예약 없이 이용, 대기 시간 10분 이내, 친목, 부모님",음식이 맛있어요,241,1
31363747,카롱이네 하루,맛있게 잘먹었습니다~~,2024-12-20,"점심에 방문, 예약 없이 이용, 대기 시간 바로 입장, 일상, 혼자",양이 많아요,409,2
31363747,cyclone9,나이스,2024-12-16,점심에 방문,음식이 맛있어요,1527,13
31363747,BBOK365,"양도 푸짐하고 추운 날 먹기 딱 좋은 칼국수, 수제비 집을 다녀왔어요.",2024-12-13,"점심에 방문, 예약 없이 이용, 대기 시간 바로 입장, 일상, 혼자",음식이 맛있어요,1871,1
31363747,ss****,직접 밀어서 만든 손칼국수.아주 맛있어요,2024-12-09,"점심에 방문, 예약 없이 이용, 대기 시간 바로 입장, 나들이, 연인・배우자",음식이 맛있어요,435,3
31363747,쫑나커요,좋아요,2024-12-06,"점심에 방문, 예약 없이 이용, 대기 시간 바로 입장, 데이트, 연인・배우자",음식이 맛있어요,1343,1
31363747,썬8178,굿,2024-12-06,"점심에 방문, 예약 없이 이용, 대기 시간 바로 입장, 데이트, 연인・배우자",음식이 맛있어요,1421,1
31363747,두빈장,비빔만두 야채 너무 맛있어서 두번 먹었어요,2024-11-30,"점심에 방문, 예약 없이 이용, 대기 시간 바로 입장, 일상, 지인・동료",음식이 맛있어요,20,1
31363747,자만39,가성비에 괜찮은 식당 입니다.좋아요.,2024-11-29,"점심에 방문, 대기 시간 바로 입장, 일상, 혼자",가성비가 좋아요,152,1
31363747,다정한말한마디,"11시 땡 오픈 전부터 줄 서는 최강맛집~!일찍 안 왔으면 어쩔뻔 ~ @,.@여섯분~ 여덟분~ 단체로 막 들어오십니다~늦게 왔으면 정말 오래 기다릴뻔~ ㅎㅎ11~2 사이 매우 손님 많아요~딱 오픈런~ 또는 3시 지나야 좀 먹기 편합니다~혼밥러는~ 피크 타임에 먹을수 없습니다~스스로 눈치가 보여서~ ㅎㅎ언제나 왕 친절하신~ 사장님들~ 새로오신 직원분들도 늘 친절하세요~맛 친절 청결~ 가격까지~ 완벽한 맛집!칼국수 칼제비 수제비 모두 아직은 6천원~!언제나 맛있게 편히 잘 먹고 옵니다~아직 안 가보신분~ 꼭 가세요~한번 가면 계속 가게 되요~저는 저 무생채 세상에서 제일 좋아합니다~변함없이 새콤새콤~ 맛나게 준비해주셔서고맙습니다~앙~ ^ㅡ^)//",2024-11-29,점심에 방문,음식이 맛있어요,495,40
31363747,관온인성,,2024-11-23,"점심에 방문, 예약 없이 이용, 대기 시간 바로 입장, 데이트, 연인・배우자",음식이 맛있어요,1457,2
31363747,다정한말한마디,늘 반갑게 인사주시고~항상 깔끔한 매장~국물이 끝내줘용~변함없는 새콤새콤 무생채~항상 맛있게 잘 먹습니다앙~^ㅡㅡㅡㅡㅡ^)//,2024-11-21,점심에 방문,음식이 맛있어요,495,39
31363747,pin****,맛있어요 맛있어요,2024-11-14,"점심에 방문, 예약 없이 이용, 대기 시간 바로 입장, 데이트, 일상, 지인・동료",음식이 맛있어요,628,2
31363747,hsk****,,2024-11-13,"점심에 방문, 예약 없이 이용, 대기 시간 바로 입장, 데이트, 연인・배우자",양이 많아요,756,1
31363747,cyclone9,나이스,2024-11-13,점심에 방문,음식이 맛있어요,1527,12
