place_id,nickname,content,date,situations,keywords,review_count,visit_count
1930874813,안희랑33,고기도 너무 부드럽고 맛있었어요! 양도 많아서 좋았습니다. 다음에 또 방문할게요!,2025-04-10,"점심에 방문, 예약 없이 이용, 대기 시간 바로 입장, 일상, 친구",음식이 맛있어요,13,1
1930874813,ni****,개강하고 계속 와보고 싶었는데 드디어 방문했습니다 ! 스테이크 덮밥의 고기가 수비드 되어있어서 부드럽고 맛있었어요 인테리어도 이뻐서 점심에 가면 좋을것 같습니다:),2025-04-10,"점심에 방문, 예약 후 이용, 대기 시간 바로 입장, 친목, 친구",음식이 맛있어요,7,1
1930874813,돌체티라떼,스테이크를 이만큼 주는데 가격이 합리적이에요그래서 점심식사 하러 종종 방문합니다!맛있고 신선한 느낌이라 좋아요파스타도 꽤 맛있는 편이라 어떤 메뉴 시켜도 맛있습니다^^,2025-04-10,"점심에 방문, 예약 없이 이용, 대기 시간 바로 입장, 친목, 지인・동료",음식이 맛있어요,101,1
1930874813,연연연연연연연,학교 근처라 가봤는데 맛있어요 가격에 비해 양도 많았습니다,2025-04-09,"점심에 방문, 예약 없이 이용, 대기 시간 바로 입장, 일상, 혼자",인테리어가 멋져요,26,1
1930874813,sssre,저번에 스테이크 덮밥 먹고 맛있어서 또 왔습니다! 토마토 파스타는 이번에 처음 먹어보는데 너무 맛있었어요~ 양도 많고 가격도 저렴해서 자주 올 것 같습니다!!,2025-04-07,"저녁에 방문, 예약 없이 이용, 대기 시간 바로 입장, 친목, 친구",음식이 맛있어요,23,1
1930874813,지수911,"직원분들도 너무너무 친절하시고 맛도 좋고 너무 만족한 식사였어요!! 스테이크 토시살로 변경해서 먹었더니 입에서 살살 녹아서 깜짝 놀랬네요.. 크림파스타도 너무 맛있었어요 통마늘이 킼입니다,,,ㅎ",2025-04-07,"저녁에 방문, 예약 없이 이용, 대기 시간 바로 입장, 일상, 친구",음식이 맛있어요,5,1
1930874813,닉닉닉닉이,너무 맛있어요 !! 사장님이랑 직원분들도 너무 친절하세요 다음에 또 올것같아요 !!,2025-04-06,"저녁에 방문, 예약 없이 이용, 대기 시간 바로 입장, 데이트, 연인・배우자",인테리어가 멋져요,22,1
1930874813,맛집탐방러허허,"주말에 산챡하다 들어가게 된 식당인데, 분위기 좋고 아늑한 매장이었어요! :) 음식도 다 한번에 나와서 사진 찍기 좋음",2025-04-06,"점심에 방문, 예약 없이 이용, 대기 시간 바로 입장, 데이트, 나들이, 연인・배우자",특별한 메뉴가 있어요,40,1
1930874813,100****,맛있어요! 분위기도 좋았어요,2025-04-05,"저녁에 방문, 예약 없이 이용, 대기 시간 바로 입장, 데이트, 연인・배우자, 아이, 반려동물",음식이 맛있어요,2,1
1930874813,mol****,음식맛있어요 조용하고 아늑해요친절도하세요,2025-04-05,점심에 방문,음식이 맛있어요,1354,1
1930874813,혁1111,스테이크 파스타 다맛있어요인테리어도 깔끔하고혼자와서도 드시기 편한분위기였어요,2025-04-05,"점심에 방문, 대기 시간 바로 입장, 데이트, 연인・배우자",음식이 맛있어요,18,1
1930874813,황소정74,너무 맛있었어용,2025-04-04,"저녁에 방문, 예약 없이 이용, 대기 시간 바로 입장, 친목, 친구",음식이 맛있어요,7,1
1930874813,arcane65,내부가 깔끔하고 서비스가 좋음. 무엇보다 고기가 맛있다.,2025-04-04,"점심에 방문, 예약 없이 이용, 대기 시간 바로 입장, 나들이, 일상, 혼자",음식이 맛있어요,11,1
1930874813,명477,너무 맛있었어요. 특히 스테이크가 너무 맛있었어요.,2025-04-04,"점심에 방문, 예약 없이 이용, 대기 시간 바로 입장, 친목, 친구",음식이 맛있어요,14,1
1930874813,홍서윤95,너무 맛있어요!!! 사장님도 너무 친절하셨어요. 또 방문하려구요!,2025-04-03,"저녁에 방문, 예약 없이 이용, 대기 시간 바로 입장, 혼자",친절해요,12,1
1930874813,여울765,스테이크가 너무 맛있어요. 진짜로 적당한 두께로 썰어져 나오는데 먹기에도 편하고 좋습니다. 파스타도 소스가 넉넉하게 면이랑 잘 어울려요. 성신여대 앞에 바로 있는데 안에 공간이 깔끔하고 넓어서 매우 좋습니다. 분위기도 따뜻하고 아늑해요. 이런 분위기 맛에 가격대도 너무나 착합니다!,2025-04-02,"저녁에 방문, 예약 없이 이용, 대기 시간 바로 입장, 친목, 친구",음식이 맛있어요,10,1
1930874813,나나279,식전빵이 진짜 맜있었어요. 물론 덮밥도 맜있었습니다! 차분한 분위기에 바 테이블 있어서 혼밥도 가능해서 좋았습니다!,2025-04-02,"점심에 방문, 예약 없이 이용, 대기 시간 바로 입장, 일상, 혼자",음식이 맛있어요,2,1
1930874813,김낄,런치메뉴 먹었는데 가격도 싸고 맛있어요~스테이크도 맛있고 마늘빵 주는거 너무 좋아요,2025-04-02,"점심에 방문, 예약 없이 이용, 대기 시간 바로 입장, 친목, 혼자",음식이 맛있어요,14,1
1930874813,땅콩0311,왕 맛나요🩵 고기도 부드럽고 파스타도 맛있어요 직원분도 친절하십니다,2025-03-31,"저녁에 방문, 예약 없이 이용, 대기 시간 바로 입장, 일상, 친구",음식이 맛있어요,6,1
1930874813,나띠나띠호나띵,음식이 다 맛있어요! 분위기도 좋아서 모임 장소로도 추천이에요👍👍,2025-03-30,저녁에 방문,음식이 맛있어요,530,1
1930874813,일상다반사50,"2번째 방문입니다..스테이크 부드럽고, 파스타 소스가 묘하게 땡기는 맛입니다.. 사이드로 나오는 구운마늘쫑이랑 양배추 콘슬로우도 진짜 맛있습니다.. 사이드까지 버릴게 하나없는 퍼펙트한 맛♡♡우리 아이들이 좋아하는 찐맛집이니다양배추 콘슬로우가 자칫 느끼할수있는",2025-03-29,"저녁에 방문, 예약 없이 이용, 대기 시간 바로 입장, 가족모임, 아이",음식이 맛있어요,20,1
1930874813,cho****,음식이 맛있고 가성비가 조아요인테리어도 예뻐서 데이트하기 좋을 것 같아요,2025-03-29,"점심에 방문, 예약 후 이용, 대기 시간 바로 입장, 가족모임, 부모님, 친척・형제",음식이 맛있어요,4,1
1930874813,vld****,고기가 너무 부드럽고 맛있었어요ㅠ!잘 먹었습니다~~!!,2025-03-28,"저녁에 방문, 예약 후 이용, 대기 시간 바로 입장, 친목, 친구",인테리어가 멋져요,18,1
1930874813,미쓰리커피,친구들  만나면 자연스럽게발길 당기는 단골집허그스~~~~~방문!!!넷이서 이것저것 시켜서 폭풍 흡입했답니다.식감좋고 부드럽고 맛있는 스테이크♡바다향기 가득품은 크림홍합탕♡5성급 호텔에서 만든것 같은 토마토 🍝♡맛 ~~쩜~^^근데? 가격은 분식집? 같구가성비 짱짱인 최애 단골집  ♡허그스♡잘 먹었습니당~~,2025-03-28,"저녁에 방문, 예약 없이 이용, 대기 시간 바로 입장, 친목, 친구",음식이 맛있어요,4,2
1930874813,cb****,너무너무 맛있었어요 ><이만원이라는 가격으로 맛있는 스테이크를 즐길 수 있다니!! 파스타도 넘 맛있었어용츄천~~~~👍👍💃🕺,2025-03-28,"저녁에 방문, 예약 후 이용, 대기 시간 바로 입장, 데이트, 친구",음식이 맛있어요,6,1
1930874813,2hj40,남자친구 생일을 맞아 방문하였는데 둘다 만족했어요💕 스테이크랑 파스타 둘다 너무 맛있었어요! 성신여대 주변에서 데이트하기 좋은 분위기 맛집 중 제일인 것 같아요🥰,2025-03-28,"점심에 방문, 예약 후 이용, 대기 시간 바로 입장, 데이트, 연인・배우자",음식이 맛있어요,7,1
1930874813,꽃2330,음식이 맛있어요~!차이니즈퀴천누들 생각보다 넘 맛있었어요~~ 고구마 프라이즈도 최고!!! 다 최고에요 ㅎㅎ사장님이 친절해오~~!,2025-03-27,"저녁에 방문, 예약 없이 이용, 대기 시간 바로 입장, 데이트, 연인・배우자",음식이 맛있어요,364,1
1930874813,테디23,가족식사자리로도 모던하고 참좋은거 같습니다 가격이 그렇게 비싼편이 아닌데도 음식의 퀄리티와맛이 상당히 좋았구요 응대도 굉장헤 친절하게 잘하시더라구요 인상 좋으신 사장님? 콜키지 프리라 잔도 준비해주시고 스테이크 파스타 스튜 맛도리 입니다 다음에 재방문의사 100%% 입니다 초초초 강추!!!!,2025-03-27,"저녁에 방문, 예약 후 이용, 대기 시간 바로 입장, 기념일, 가족모임, 연인・배우자, 아이",음식이 맛있어요,12,1
1930874813,으컁샤,스테이크도 합리적인 가격대고 메뉴가 다 맛있었습니다. 식전빵도 특히 맛있었습니다! 직원 분이 너무 친절하셔서 기분이 좋았습니다! 특별한 날에 또 오고 싶어요 ㅎㅎ,2025-03-26,"저녁에 방문, 예약 후 이용, 대기 시간 바로 입장, 친목, 친구",인테리어가 멋져요,16,1
1930874813,dbtmt,,2025-03-26,저녁에 방문,음식이 맛있어요,1204,1
1930874813,선아93,음식이 맛있고 넘 친절하세요!!,2025-03-26,"저녁에 방문, 예약 없이 이용, 대기 시간 바로 입장, 데이트, 연인・배우자",음식이 맛있어요,27,1
1930874813,SKAKBUS,스테이크 덮밥 먹었는데 양도 많고 맛있어요!!!! 재방문 의사 있습니다ㅎㅎ,2025-03-26,"점심에 방문, 예약 없이 이용, 대기 시간 바로 입장, 일상, 혼자",음식이 맛있어요,28,1
1930874813,컬처드림90,부채살스테이크는 육즙이 살아있어 씹을수록 맛있고 토마토스튜는 토마토의 상큼한 맛과 소고기의 고소한 맛이 잘 어울려요~^^서비스도 정말 친절하고 좋아요~^^,2025-03-24,"저녁에 방문, 예약 없이 이용, 대기 시간 바로 입장, 데이트, 연인・배우자",음식이 맛있어요,1365,1
1930874813,인졸미쫑,스테이크 담백하게 너무 맛있어요!파스타도 자극적이지 않고 맛있습니다!!,2025-03-23,"저녁에 방문, 예약 없이 이용, 대기 시간 바로 입장, 나들이, 부모님",음식이 맛있어요,13,1
1930874813,윤수현1214,친구들끼리 와서 잘 먹었습니다! 특히나 크림파스타가 정말 맛있었어용!!! 다음에도 또 올게요!!,2025-03-22,"저녁에 방문, 예약 없이 이용, 대기 시간 바로 입장, 친목, 친구",음식이 맛있어요,18,1
1930874813,소정742,"웅하 ,,,, 길거리 지나다니다가 인테리어가 예뻐서 밥먹을겸 들어왔는데 가성비도 너무 좋고 맛있어요!!!❤️❤️❤️ 친구들이랑 오가도 좋고 남자칭구랑 와도 좋을거가타요오오",2025-03-22,"저녁에 방문, 예약 없이 이용, 대기 시간 바로 입장, 친목, 친구",음식이 맛있어요,14,1
1930874813,기생물,"사진에 보이듯이 양이 정말 많습니다. 고기가 입에서 녹구 정말 부드러워요, 그리고 다양한 소스와 함께 다양한 맛을 느낄수 있어요. 핫웍파스타를 제일 맛있게 먹었는데 양념이 정말 꾸덕하고 버섯이나 야채가 많아서 식감이 훌륭해요. 고구마 프라이즈는 소스와 너무 잘어울리고 튀김정도가 완벽해요. 비프링은 고기육즙이 가득하고 사이드같지만 메인메뉴같은 느낌입니다. 모든 메뉴가 맛있지만 특히 고구마프라이즈와 핫웍파스타는 꼭 드시는거 추천입니다!",2025-03-22,"점심에 방문, 예약 없이 이용, 대기 시간 바로 입장, 데이트, 연인・배우자",인테리어가 멋져요,10,3
1930874813,Houuu,너무 맛있어요 허거덩슨 🥺,2025-03-21,"저녁에 방문, 예약 없이 이용, 대기 시간 바로 입장, 친목, 기타",음식이 맛있어요,15,1
1930874813,호잉잉잉,맛있고 친절해서 좋아요~,2025-03-17,"저녁에 방문, 예약 없이 이용, 대기 시간 바로 입장, 친목, 친구, 지인・동료",음식이 맛있어요,27,1
1930874813,오내온,스테이크 굽기가 정해져있는데 둘다 부드럽고 맛있어요! 파스타는 매콤한 크림파스타인데 계속 먹고싶은 맛이었습니다!!,2025-03-17,"저녁에 방문, 예약 후 이용, 대기 시간 바로 입장, 나들이, 일상, 친척・형제",음식이 빨리 나와요,19,1
1930874813,촉94,분위기도 좋고 매우 맛도 좋아요. 가족 친구 혼밥 모두 좋아요. 한번 오시길 강력추천합니다.,2025-03-16,"저녁에 방문, 예약 없이 이용, 대기 시간 바로 입장, 친목, 혼자",음식이 맛있어요,10,10
1930874813,김서원6382,성신여대쪽에서 친구랑 밥 뭐먹을까 고민하다가 여기로 왔어요! 파스타도 먹고싶고 스테이크도 먹어보고 싶어서 세개 시켰는데 양이 되게 많아서 힘들었어용ㅋㅋㅋㅋㅋ 음식도 맛있고 서비스로 주시는 마늘빵이 진짜 맛있어요😍,2025-03-16,"점심에 방문, 예약 없이 이용, 대기 시간 바로 입장, 친목, 친구",음식이 맛있어요,1,1
1930874813,son****,나쁘지 않게 잘 먹고 갑니다! 맛있었습니다!,2025-03-15,"점심에 방문, 예약 없이 이용, 대기 시간 바로 입장, 일상",인테리어가 멋져요,3,1
1930874813,이혜준28,맛있게 잘 먹었습니다 😁 고기도 부드럽고 특히 채소가 맛있습니다! 다음에 또 오겠습니다~~,2025-03-14,"점심에 방문, 예약 없이 이용, 대기 시간 바로 입장, 친목, 친구",음식이 맛있어요,8,1
1930874813,fjjri3318,"요즘 친구들 한 명씩 차이니즈퀴진누들 맛보게 하는 중입니다…. 다들 맛있다고 하고 진짜 실패없는 맛 !!! 고기도 늘 퀄리티 좋고 진짜 갓성비예요생각보다 양도 진짜 많아서 늘 쪼금씩 남기고 오는데 그게 너무 아쉬울뿐입니다 흡 성신여대 오는김에 오는게 아니라 여기 먹으려고 성신여대 오게되는 곳 ,,, 🫶🏻💗💗💗",2025-03-13,"저녁에 방문, 예약 후 이용, 대기 시간 바로 입장, 친목, 친구",음식이 맛있어요,20,3
1930874813,pia****,음식이 너무 맛있고 친절하셔서 재방문 하려합니다,2025-03-13,"저녁에 방문, 예약 후 이용, 대기 시간 바로 입장, 친목, 아이",음식이 맛있어요,6,1
1930874813,별명25,점심 특별 메뉴가 있고 혼밥하기 좋아요!물은 레몬물이고스테이크덮밥에 양파주셔서(구은양파아님)  좋아요.,2025-03-10,"점심에 방문, 예약 없이 이용, 대기 시간 바로 입장",특별한 메뉴가 있어요,11,1
1930874813,eg****,여기 파스타 진짜진짜 맛있어요 서울에서 가장 좋아하는 양식집!  양식 좋아해서 여기저기 많이다녀보는데 허그스가 최곱니다 치즈는 제가 안좋아해서 빼달라고 했어요,2025-03-09,"점심에 방문, 예약 없이 이용",음식이 맛있어요,2,2
1930874813,hyyyyye,사장님두 너무 친절하시고 파스타가 존맛이에요!!! 다음에 또 오겟습니다 🎀🎀🎀,2025-03-08,"저녁에 방문, 예약 후 이용, 대기 시간 바로 입장, 연인・배우자",음식이 맛있어요,18,1
1930874813,오렌지동동동,"성신여대의 보물이네요. 우연히 인스타그램에서 발견하고 바로 예약한 곳이에요. 사장님 정말 친절하셨고, 음식은 기대 이상으로 맛있었어요. 공간도 너무 예쁩니다. 데이트 장소로도 좋구요, 친구들끼리 모임도 추천합니다.",2025-03-08,"저녁에 방문, 예약 후 이용, 대기 시간 바로 입장, 친목, 일상, 친구",인테리어가 멋져요,7,1
1930874813,Wlsdnd12,인테리어가 아기자기하고 예뻐요.음식도 너무 맛있어요. 특히 차이니즈퀴진 누들이 맛도리입니다.,2025-03-08,"점심에 방문, 예약 없이 이용, 대기 시간 바로 입장, 데이트, 일상, 연인・배우자",인테리어가 멋져요,24,1
1930874813,cha****,음식이 너무 맛있어서 혼밥하러 자주 갑니다!!!진짜 집 근처에 이런 음식점이 있어서 너무 좋아요!!!!,2025-03-08,"점심에 방문, 예약 없이 이용, 대기 시간 바로 입장, 일상, 혼자",음식이 맛있어요,19,6
1930874813,테란39,깔끔하고 신선해요~~~~,2025-03-08,"점심에 방문, 예약 없이 이용, 대기 시간 바로 입장, 가족모임, 부모님",인테리어가 멋져요,15,1
1930874813,bre****,음식들도 너무 너무 맛있고 공간 자체도 너무 분위기가 좋습니다. 다음에도 꼭 방문할 예정입니다.,2025-03-08,"점심에 방문, 예약 없이 이용, 대기 시간 바로 입장, 데이트, 연인・배우자",음식이 맛있어요,52,1
1930874813,jh99442,맛있게 먹었습니다! 비프링카츠도 엄청 맛있어요!,2025-03-07,"점심에 방문, 예약 없이 이용, 대기 시간 바로 입장, 나들이, 혼자",음식이 맛있어요,8,5
1930874813,mrjh91,친구들과 예약후 이용했어요. 런치코스 가격도 부담없고 런치외 메뉴들도 다 맛있었습니다~,2025-03-07,"점심에 방문, 예약 후 이용, 대기 시간 바로 입장, 친목, 친구",음식이 맛있어요,12,1
1930874813,rnjsdndud23,인테리어도 깔끔하고 음식이 너무 맛있어서 덕분에 행복한 저녁식사를 할수있었어요 너무 감사합니다👍 사장님도 너무 친절하시고 식전빵으로 나온 마늘빵도 너무 맛있었어요👍,2025-03-06,"저녁에 방문, 예약 후 이용, 대기 시간 바로 입장, 데이트, 연인・배우자",음식이 맛있어요,15,1
1930874813,yuuuuuuj,스테이크 구성도 너무 좋고 음식 하나하나 다 전부 맛있어요 💗 데이트 코스로 완전 추천합니다 :),2025-03-03,"저녁에 방문, 예약 없이 이용, 대기 시간 바로 입장, 데이트, 연인・배우자",음식이 맛있어요,12,1
1930874813,lal****,"인당 1개 식전빵 제공되는데 달달하고 맛있습니다. 스테이크는 굽기 조절은 안 되고 미디움레어 정도로 나오는데 육즙이 촉촉하고 맛있어요. 와사비랑 홀그레인 머스터드, 소스랑 번갈아먹으면 꿀맛 ㅎㅎ 개강 전 마지막으로 맛난 거 먹고 싶어서 갔는데 혼밥 좌석 충분했고, 2인석이랑 4인석 위주였는데 아늑한 분위기였어요. 다음엔 파스타나 런치메뉴 먹어보고 싶네요 재방문 의사 완전 있어요~",2025-03-03,"저녁에 방문, 예약 없이 이용, 대기 시간 바로 입장",음식이 맛있어요,12,1
1930874813,kbj****,너무 맛있어요ㅠ,2025-03-03,"저녁에 방문, 예약 후 이용, 대기 시간 바로 입장, 데이트, 연인・배우자",인테리어가 멋져요,14,1
1930874813,bliss0x64,맛있어유 토시살 스테끼 꼭 드셔보시라요👍,2025-03-03,"점심에 방문, 예약 없이 이용, 대기 시간 바로 입장, 친목, 친구",음식이 맛있어요,27,1
1930874813,msy001009,분위기도 좋고 음식도 맛있고 직원분도 친절하셔서 재방문 의사 100%에요!! 성신여대 데이트 맛집으로 짱짱 추천입니다👍✨✨❤️,2025-03-02,"저녁에 방문, 예약 후 이용, 대기 시간 바로 입장, 데이트, 연인・배우자",친절해요,187,1
1930874813,dw****,런치 메뉴로 먹었는데 맛있네요ㅎㅎ 학교 앞이라 포인트도 모아보려구요! 가게 분위기도 너무 좋고 사장님도 친절하셔서 친구들이랑 자주 올 것 같아요👍🏻,2025-02-27,"점심에 방문, 예약 없이 이용, 대기 시간 바로 입장, 친목, 지인・동료",음식이 맛있어요,20,1
1930874813,fjjri3318,저의 성신여대 또간집..💗 세번째 방문인데 항상 너무 맛있어요!! 올때마다 차이니즈 누들은 꼭 먹는데 항상 실망시키지 않는 맛👍🏻 사장님(?)도 늘 친절하시고 좋아요 다들 한 번씩만 가주세효 진짜 갓성비 갓심비 다 챙기는 곳 !! 쓰고나니 광고같은데 아님니다 결백해요,2025-02-26,"저녁에 방문, 예약 후 이용, 대기 시간 바로 입장, 친목",음식이 맛있어요,20,2
1930874813,경현엄마,횟수로 4번째 방문이네요 맛있게 또 잘 먹었습니다,2025-02-26,"점심에 방문, 예약 후 이용, 대기 시간 바로 입장, 친목, 부모님",음식이 맛있어요,19,2
1930874813,흰흰이,저번에 방문하고 음식이 맛있어서 또 왔어요~~~이번에도 역시나 너무 맛있게 잘 먹었습니다 ! 먹고싶은 메뉴가 많아서 여러명이 왔다면 더 다양하게 시켜봤을텐데ㅠㅠ 엄마도 맛있다고 좋아하셨어요. 다음에 성신여대 오면 또 올게용,2025-02-23,"점심에 방문, 예약 없이 이용, 대기 시간 바로 입장, 나들이, 가족모임, 부모님",인테리어가 멋져요,27,2
1930874813,ithinking,"스테이크도 연하고 맛있고 버섯, 구운채소 등 음식구성이 알찹니다~ 토마토 스튜도 버섯, 고기, 토마토 등 재료가 알차고 매콤하니 너무 맛있었습니다~:)",2025-02-23,"점심에 방문, 예약 후 이용, 대기 시간 바로 입장, 친목, 기타",음식이 맛있어요,81,1
1930874813,hoo****,식전빵부터가 너무 맛있어요! 스테이크도 부드럽고 파스타도 로제 소스가 넘 맛있네요! 매장 분위기도 좋고 사장님도 넘 친절하세요!!,2025-02-22,저녁에 방문,친절해요,29,1
1930874813,프리미어리그007,,2025-02-21,"저녁에 방문, 예약 후 이용, 대기 시간 바로 입장, 가족모임, 연인・배우자",음식이 맛있어요,332,1
1930874813,xxx2051,스테이크 토시살 먹었는데 맛있음 !!!특이한건 아스파라거스가 아니아 마늘쫑이 구워져 나옴감자무스도 맛있다👍👍👍👍식전빵이 죤맛탱임 ㄹㅇ.. 어케했냐고 물어보고싶음토마토스튜도 시켜서 거기에도 빵 나왔는데무료리필 가능하다해서 또 먹음ㅋㅋ빵만 3개 먹고 옴ㅋㅋㅋㅋㅋㅋㅋㅋㅋㅋㅋㅋ나머지 메뉴도 다 맛있어요~~~,2025-02-21,"점심에 방문, 예약 후 이용, 대기 시간 바로 입장, 가족모임, 부모님",음식이 맛있어요,33,1
1930874813,dodamj,누구랑 와도 반응 좋았던 곳런치메뉴들 가성비 굿스프랑 파스타도 맛있었어요(스테이크는 반드시 드시길 야들야들하고 겉은 바삭해요)조만간 저녁 먹으러 또 갈 거예요 ㅋㅋ,2025-02-21,"점심에 방문, 예약 없이 이용, 대기 시간 바로 입장, 친목, 일상, 친구",대화하기 좋아요,6,1
1930874813,빈나빛,생일기념으로 친구랑 예약해서왔는데 스테이크도 가성비있고 파스타도 너무맛있었어요 다음에또오고싶네요 ㅎㅅㅎ,2025-02-20,"저녁에 방문, 예약 후 이용, 대기 시간 바로 입장, 친목, 친구",음식이 맛있어요,17,1
1930874813,촉94,맛있게 잘먹었습니다.강추합니다.,2025-02-16,"저녁에 방문, 예약 없이 이용, 대기 시간 바로 입장, 친목, 혼자",재료가 신선해요,10,9
1930874813,뽀얀개굴,"오랜만에 파스타랑 스테이크가 땡겨서 급 예약을 하고 갔어요 전부터 가격이 가성비&양이 훌룡하다길래 이제야 와봤습니당 일단 식전빵 너무 맛있어용:)파스타는 매콤크림파스타인데 제가 생각한 맛은 아니였지만 싹싹 긁어 먹었습니다ㅋㅋ스테이크는 다들 토시살 추천하길래 먹어봤더니 질기지 않고 냄새안나고 부드러운데 심지어 양도 많고 포테이토도 부드럽고~ 남자친구가 말하길 미국출장 갔을때 먹었던 맛이랑 비슷하다고 하네요 이 가격에 맛과양 인정입니다 심지어 둘 다 한마디도 안하고 계속 먹고 나왔더니 사장님이 왤케 빨리 드셨냐고ㅋㅋ,,,,저희 커플이 빨리 먹고 빨리 나온다?그럼 맛있어서 그래요,,^^ 제가 맛없으면 아에 안 먹어요 그럼 제 남자친구가 제꺼까지 먹을때까지 기다리느라 늦게 나온답니다ㅋㅋ여튼다음에 또먹으러갈게요",2025-02-16,"저녁에 방문, 예약 후 이용, 대기 시간 바로 입장, 데이트, 연인・배우자",음식이 맛있어요,29,1
1930874813,dan****,"가격대비 만족스러운 스테이크입니다 먹을수록 수비스여서 느껴지는 고기의 육향이 매우 좋았어요 특히 가니쉬로 같이 나온 버섯과 아스파라거스도 잘 구워져서 나와서 인지 고기,버섯,아스파라거스에 홀그레인 소스나 스테이크 소스를 살짝 묻혀먹으면 조합이 아주 좋더라고요 메쉬드 포테이토는 개인적으로 간이 조금 더 되어있었다면 더 만족스러웠을 것 같지만 이것도 고기랑 같이 소스에 찍어먹으면 궁합이 잘 맞더라고요 요즘 외식 하러 다니면서 크게 만족한 음식들이 없었는데 간만에 꽤 만족스러운 식사였습니다.",2025-02-16,"점심에 방문, 예약 후 이용, 대기 시간 바로 입장, 일상",음식이 맛있어요,1,1
1930874813,Elzeard,분위기도 좋고 너무 맛있어요~ 다음에 또 올게요^^,2025-02-15,"저녁에 방문, 예약 없이 이용, 대기 시간 바로 입장, 친목, 친구",음식이 맛있어요,4,1
