place_id,nickname,content,date,situations,keywords,review_count,visit_count
1910175007,회원,#길음맛집,2025-04-10,"저녁에 방문, 예약 후 이용, 대기 시간 바로 입장, 친목, 친구, 지인・동료",음식이 맛있어요,1,1
1910175007,꽃사슴205,길음맛집 맛찬들,2025-04-10,"저녁에 방문, 예약 없이 이용, 대기 시간 바로 입장, 아이",음식이 맛있어요,8,1
1910175007,ciswl0180,여전히 친절하고 깔끔해요. 오늘은 술 안먹고 밥만 먹었는데그래도  만족스럽습니다. 불판온도 ✔️ 좋아요 ㅎㅇㅎ,2025-04-10,"저녁에 방문, 예약 없이 이용, 대기 시간 바로 입장, 데이트, 연인・배우자",음식이 맛있어요,33,2
1910175007,일대종사1,고기가 진짜 연하고 맛있습니다.,2025-04-09,"저녁에 방문, 예약 없이 이용, 대기 시간 10분 이내, 친목, 친구",음식이 맛있어요,8,1
1910175007,여우8877,맛있어요~!!,2025-04-09,"저녁에 방문, 예약 없이 이용, 대기 시간 바로 입장, 데이트, 연인・배우자",음식이 맛있어요,12,2
1910175007,소중한 하루,길음맛집이네요~!!진짜 맛있어요~고기가 정말 살살 녹아요~ 맛있게 구워주셔서 너무 좋네요,2025-04-09,"저녁에 방문, 예약 후 이용, 대기 시간 바로 입장, 친목, 지인・동료",매장이 청결해요,22,1
1910175007,ㅉㄹ25,"트윈골드 내에 위치해있어서 주차하기 편하고, 아기의자 식기가 잘 갖춰져있어 아이와 오기 좋습니다.달마다 오는 것 같아요~ 고기 맛이 너무 좋아요!#길음삼겹살 #길음역맛집",2025-04-09,"저녁에 방문, 예약 없이 이용, 대기 시간 바로 입장, 기념일, 가족모임, 부모님, 아이",음식이 맛있어요,69,1
1910175007,Olivia서현서희맘,맛있음👍🏻👍🏻,2025-04-09,"저녁에 방문, 예약 없이 이용, 대기 시간 10분 이내, 가족모임, 아이",음식이 맛있어요,22,1
1910175007,이7043,맛있게 구워주셔서 편히 잘먹고 갑니다~,2025-04-09,"저녁에 방문, 예약 없이 이용, 대기 시간 바로 입장, 가족모임, 부모님",음식이 맛있어요,13,1
1910175007,란찡2,맛있는 삼겹살 먹고싶으면 오는 고기집입니다! 고기 좋은 거 보이시져?!? 다양한 조합으로 먹을 수 있어서 좋습니당,2025-04-08,"저녁에 방문, 예약 없이 이용, 대기 시간 바로 입장, 데이트, 연인・배우자",친절해요,22,2
1910175007,100****,맛찬들도 지점마다 차이가 있나봐요 반찬이 다양하고 고기랑 이거저거 곁들여먹을 수 있어서 좋아요 고기도 더 맛있는거같아요!,2025-04-08,"저녁에 방문, 예약 없이 이용, 대기 시간 바로 입장, 데이트, 연인・배우자",음식이 맛있어요,14,1
1910175007,지느님46,벌써 두번째 방문인데 고기도 너무 신선하고 반찬이 너무 맛있어요!!,2025-04-08,"저녁에 방문, 예약 없이 이용, 대기 시간 바로 입장, 데이트, 연인・배우자",음식이 맛있어요,14,1
1910175007,Qazx1234,너무 맛있어서 자주와요~서비스도 좋아요^^,2025-04-08,"저녁에 방문, 예약 없이 이용, 대기 시간 바로 입장, 가족모임, 연인・배우자",음식이 맛있어요,15,1
1910175007,kys****,두번째 방문인데 여전히 너무 맛있네요!직접 구워주시고 친절하세요!부모님 모시고 가기 너무 좋습니다!번창하세요!#길음맛집 #길음고기집,2025-04-08,"저녁에 방문, 예약 없이 이용, 대기 시간 바로 입장, 가족모임, 부모님",음식이 맛있어요,12,2
1910175007,kevin6248,고기가 너무 맛있어서 일주일만에 재방문입니다~지난번 대기해서 오늘은 네이버 예약하고 왔는데 된징찌게 서비스로 주셨습니다~ 오늘도 맛있네요~!! 우리동네에 이런 가게 생겨서 좋아요,2025-04-08,"저녁에 방문, 예약 후 이용, 대기 시간 바로 입장, 친목, 지인・동료",매장이 넓어요,39,2
1910175007,91s****,너무 기다려져서 미리 찍었어요!항상 맛있어요,2025-04-08,"저녁에 방문, 예약 없이 이용, 대기 시간 10분 이내, 일상, 아이",음식이 맛있어요,4,1
1910175007,백꼬오옴31,,2025-04-08,"저녁에 방문, 예약 없이 이용, 대기 시간 바로 입장, 기념일, 연인・배우자",음식이 맛있어요,3,1
1910175007,Joy티처,친절하게 다 구워주시고 고기 질이 일단 너무 좋습니다...👍🏻근처 살아서 자주 오는데 올때마다 고기질도 좋고 친절하셔요!!😆,2025-04-08,"저녁에 방문, 예약 없이 이용, 대기 시간 바로 입장, 데이트, 연인・배우자",음식이 맛있어요,24,1
1910175007,황은아7165,"동네에 깨끗한 삼겹살 집이 마땅히 없었는데, 새로 생겨서 너무 좋아요. 직원 분들도 너무 친절하시고 깔끔하고 직접 구워 주시니 편했어요.!!  길음동 삼겹살 맛집으로 추천합니다~!!!",2025-04-08,"저녁에 방문, 예약 없이 이용, 대기 시간 바로 입장, 가족모임, 연인・배우자, 아이",음식이 맛있어요,12,1
1910175007,왈패공주,예약 방문해서 대접받는 기분이라 더 좋았어요. 어제는 사진을 못찍어 지난번 방문 사진으로 올립니다. 고기도 맛있지만 정말 예술로 구워주심.,2025-04-08,"저녁에 방문, 예약 후 이용, 대기 시간 바로 입장, 가족모임, 아이",음식이 맛있어요,16,2
1910175007,데리멜론11,맛찬들은 늘 맛있어요 고기먹고싶을땐 맛찬들로~~ 강추드랴요!!,2025-04-07,"저녁에 방문, 예약 없이 이용, 대기 시간 바로 입장, 데이트, 연인・배우자",음식이 맛있어요,24,1
1910175007,zzangddolmam,고기도 맛있고 곁드림찬도 맛있어요항상 찾는곳 👍🏻,2025-04-07,"저녁에 방문, 예약 없이 이용, 대기 시간 바로 입장, 친목, 연인・배우자",음식이 맛있어요,45,2
1910175007,도연3921,길음에서 삼겹살을 먹어야한다면 여기로... 뮤족권...돌솥밥에 된장찌개+삼겹살? 이거는 못참음... 길음역맛집 인정합니다 땅땅,2025-04-07,"저녁에 방문, 예약 없이 이용, 대기 시간 바로 입장, 가족모임, 부모님",음식이 맛있어요,93,1
1910175007,kdh****,고기 질이 좋고 맛있어요~!!,2025-04-07,"저녁에 방문, 예약 없이 이용, 대기 시간 바로 입장, 데이트, 연인・배우자",음식이 맛있어요,14,1
1910175007,ps8150,처음 와 봣는데 너무 맛있습니다직원분들도 친절하고 매장도 쾌적해서 좋습니다,2025-04-07,"저녁에 방문, 예약 없이 이용, 대기 시간 바로 입장, 가족모임, 연인・배우자, 아이",음식이 맛있어요,21,1
1910175007,D I N60,매장이 청결하고 넓어서 가족모임하고 좋어요고기도 구워주시고 야채도 잘 챙겨주시네요 집근처라 자주 올것같아요 #길음삼겹살 #길음역맛집,2025-04-07,"저녁에 방문, 예약 없이 이용, 대기 시간 바로 입장, 가족모임, 연인・배우자, 아이",고기 질이 좋아요,20,1
1910175007,find brighter day,가족들끼리 삼겹살 먹으러 자주 방문하는 곳이에요. 아이들과 같이 오기 좋습니다.,2025-04-07,"저녁에 방문, 예약 없이 이용, 대기 시간 바로 입장, 일상, 아이",음식이 맛있어요,11,2
1910175007,나쁜남자289,맛잇을거같아요,2025-04-07,"점심에 방문, 예약 없이 이용, 대기 시간 바로 입장, 나들이, 지인・동료",음식이 맛있어요,4,1
1910175007,열정소녀9818,고기질이 매우 좋고 반찬가짓수 많아서 다양하게 즐길수 있습니다~ 직접 구워주시니 편하고 맛잇게 먹는법 친절하게 가르쳐 주시니 너무 감사하네요~ 후식으로 아이스크림 주셔서 아이도 매우 만족합니다!! 최고입니다~~!!#길음맛집#길음삼겹살#길음고깃집#성북맛집,2025-04-06,"저녁에 방문, 예약 없이 이용, 대기 시간 바로 입장, 나들이, 연인・배우자",음식이 맛있어요,5,1
1910175007,썸머25,고기먹고싶을때마다 오는곳이에요고기도 다 구워주시고 특히 밑반찬이 다양해서질리지않고 여러방법으로 먹을수있어서 좋아요길음역 맛집입니다!,2025-04-06,"저녁에 방문, 예약 없이 이용, 대기 시간 바로 입장, 친목, 연인・배우자",음식이 맛있어요,16,3
1910175007,새침떼기24,길음 맛집,2025-04-06,"저녁에 방문, 예약 없이 이용, 대기 시간 10분 이내, 기념일, 아이, 연인・배우자",메뉴 구성이 알차요,6,1
1910175007,그모습그대로55,집 아래라 한번씩 와서 먹는데올때마다 직원분들 친절하시고 고기도 맛있게 구워주셔서신경쓸거 하나없이 맛있게 먹기만하면돼요,2025-04-06,"저녁에 방문, 예약 없이 이용, 대기 시간 10분 이내, 가족모임, 연인・배우자, 아이, 부모님",음식이 맛있어요,8,1
1910175007,막살이56,길음맛집 맛찬들에서 삼겹살 잘 먹고 갑니다. 성북맛집 으로 이름 날리시기를.. 집근처에 삼겹살맛집이 생겨서 좋아요,2025-04-06,"저녁에 방문, 예약 없이 이용, 대기 시간 10분 이내, 가족모임, 아이",음식이 맛있어요,9,1
1910175007,강한발목92,맛있어요~~길음역 삼겹살집 좋아요,2025-04-06,"저녁에 방문, 예약 없이 이용, 대기 시간 10분 이내, 일상, 연인・배우자",음식이 맛있어요,3,1
1910175007,syj****,고기가 고소하고 맛있어요! 집근처에 고기집이 없어서 있었으면 좋겠다 생각했는데!맛도있고 매장도 깨끗하고 가족들과 오기도 편한 것 같아요오!! 맛있게 잘먹었습니다!,2025-04-06,"저녁에 방문, 예약 없이 이용, 대기 시간 바로 입장, 데이트, 일상, 기념일, 연인・배우자",음식이 맛있어요,8,1
1910175007,jae****,너무맛있어요,2025-04-06,"저녁에 방문, 예약 없이 이용, 대기 시간 바로 입장, 친목, 부모님",음식이 맛있어요,11,1
1910175007,개키,언제나 맛있고 친절한 곳입니다. 가족끼리 오기에 공간이 넒어서 좋아요. 손님들도 항상 많은 편이고요,2025-04-06,"저녁에 방문, 예약 없이 이용, 대기 시간 바로 입장, 친목, 일상, 연인・배우자, 아이",음식이 맛있어요,13,6
1910175007,바게미22,"길음 맛집 맛찬들 왕소금구이 길음점. 일단 구워주셔서 너무 좋고, 같이 나오는 반찬들도 맛있습니다. 특히 묵은지가 안매워서 아이들도 함께 먹을 수 있어서 좋아요. 고기 굽느랴 애 보느라 바쁜 가족들 이곳으로 오세용",2025-04-06,"저녁에 방문, 예약 없이 이용, 대기 시간 바로 입장, 일상, 연인・배우자, 아이",음식이 맛있어요,12,1
1910175007,뽕사장25,친절하네요,2025-04-06,"저녁에 방문, 예약 없이 이용, 대기 시간 바로 입장, 친목, 아이",컨셉이 독특해요,10,1
1910175007,김미영920,부모님 모시고 새로생긴 길음고기집에 왔어요반찬이 정갈하니 직접구워주시니 너무 좋네요맛있게먹고갑니다,2025-04-06,"저녁에 방문, 예약 없이 이용, 대기 시간 바로 입장, 친목, 부모님",고기 질이 좋아요,87,1
1910175007,Alpha Girl84,#길음역맛집 #길음고기집길음역 근처에 맛집이 또 생겼어요!! 직접 구워주셔서 편하고 맛도 있어 자주 올 것 같습니다😀,2025-04-06,"저녁에 방문, 예약 없이 이용, 대기 시간 바로 입장, 데이트, 나들이, 일상, 가족모임, 연인・배우자, 아이",음식이 맛있어요,4,1
1910175007,tbr****,너무너무 맛있어용!,2025-04-06,"점심에 방문, 예약 없이 이용, 대기 시간 바로 입장, 데이트, 연인・배우자",음식이 맛있어요,537,1
1910175007,늘별처럼 늘 그 자리에,고기를 늘 맛있게 구워줘요. 맛있게 먹을 수 있는 조합도 친절하게 잘 알려주십니다~찌개도 다 맛있어요!!,2025-04-06,"점심에 방문, 예약 없이 이용, 대기 시간 바로 입장, 가족모임, 아이",음식이 맛있어요,9,1
1910175007,리쯔린,역시 맛찬들은 실패 없죵! 맛있게 먹고 왔어요. 구워주셔서 넘 편합니다!,2025-04-05,"저녁에 방문, 예약 없이 이용, 대기 시간 바로 입장, 데이트, 연인・배우자",매장이 넓어요,632,1
1910175007,황금퍼터,항상 맛있어요!#길음맛집#길음삼겹살,2025-04-05,"저녁에 방문, 예약 없이 이용, 대기 시간 10분 이내, 가족모임, 아이",고기 질이 좋아요,8,1
1910175007,뷰티슈,"길음역맛집  고기집 찾음!! 고기  육즙이  끝내주고, 친절하세요~",2025-04-05,"저녁에 방문, 예약 없이 이용, 대기 시간 바로 입장, 가족모임, 부모님",고기 질이 좋아요,10,1
1910175007,병길,고기가 먹고 싶을 때 애용하는 식당입니다. 길음역맛집 인정입니다.,2025-04-05,"저녁에 방문, 예약 없이 이용, 대기 시간 10분 이내, 일상, 아이",고기 질이 좋아요,7,1
1910175007,거미여왕,아이랑 부모님이랑 함께하기 딱좋아요^^,2025-04-05,"저녁에 방문, 예약 없이 이용, 대기 시간 10분 이내, 가족모임, 아이, 부모님",음식이 맛있어요,10,1
1910175007,리쓰리맘,항상 맛찬들에서 먹어요.오늘 웨이팅 있었지만 빠르게 들어왔네요맛나게 잘먹었습니당,2025-04-05,"저녁에 방문, 예약 없이 이용, 대기 시간 10분 이내, 가족모임, 아이",음식이 맛있어요,46,3
1910175007,hjy****,길음역에서 비 안맞고 바로 갈 수 있다는 점이 좋았어요! 고기도 당연히 맛있었습니다ㅎㅎ 길음맛집 인정👍,2025-04-05,"저녁에 방문, 예약 없이 이용, 대기 시간 바로 입장, 가족모임, 부모님",매장이 넓어요,6,1
1910175007,오란씨52,고기가 질도 좋고 맛있어요^^,2025-04-05,"저녁에 방문, 예약 없이 이용, 대기 시간 바로 입장, 일상, 연인・배우자, 아이",음식이 맛있어요,6,2
1910175007,야령화,비오는  날 남편이랑 소주한잔하러 왔네요.  맛찬들 적극 추천합니다~    맛있어요 ~  꼭 이용해 보셔요~♡♡♡,2025-04-05,"저녁에 방문, 예약 없이 이용, 대기 시간 바로 입장, 데이트, 연인・배우자",음식이 맛있어요,25,2
1910175007,앗니용하세요,,2025-04-05,"저녁에 방문, 예약 없이 이용, 대기 시간 바로 입장, 가족모임, 부모님",음식이 맛있어요,11,1
1910175007,sss****,맛있고 깔끔해요!,2025-04-05,"점심에 방문, 예약 없이 이용, 대기 시간 바로 입장, 일상, 연인・배우자, 아이",음식이 맛있어요,16,1
1910175007,다라초코,고기 질도 너무 좋고 반찬도 다양하고 맛있어요~건너편에 수영가기 전이나 후에 항상 들르는 곳이에요~아이가 맛있다고 담에 또오재요 ㅋㅋ#길음맛집,2025-04-05,"점심에 방문, 예약 후 이용, 대기 시간 바로 입장, 일상, 아이, 부모님",직접 잘 구워줘요,20,1
1910175007,떠도리,길음 최고 맛집인것 같아요,2025-04-04,저녁에 방문,잡내가 적어요,2,1
1910175007,채송화1614,이곳은 단골집이에요. 넘 맛있어요,2025-04-04,"저녁에 방문, 예약 없이 이용, 대기 시간 30분 이내, 가족모임, 아이, 연인・배우자",음식이 맛있어요,4,2
1910175007,악마918,"부모님이랑 처음 방문했는데  고기도 직접 구워주시고 아주 편했어요~고기 잡내도 없고 맛있어요!! 친구들, 가족 모임 추천할때 딱이에요!! 🥰🥰",2025-04-04,"저녁에 방문, 예약 후 이용, 대기 시간 10분 이내, 회식, 가족모임, 부모님",음식이 맛있어요,7,1
1910175007,요가강사,저희 집 아파트 1층 이라서 한 번 와봤는데..넘 맛있어서 자주 오게 되었어요^^ 친절하고 맛나게 고기도 늘 다 궁워주시고..매장이 넓고 아늑해요^^ 줄서서 먹는 이유가 있는 최고의 맛집입니다.  한 번 오시면 단골이 되실겁니다.^^ 된장찌개도 맛나고 비냉.물냉도 맛나고..고기 찍어먹는 소스도 맛나여. 그리고..고기가 신선하고 맛나요.고기를 미나리. 또는 물냉.비냉에 싸서 먹어도 맛나요. 소.맥에 고기를 구워서 이번주 주말에 가족.지인.친인척.친구.연인과 함께 어떠세요?^^;;,2025-04-04,"저녁에 방문, 대기 시간 10분 이내, 일상, 연인・배우자",음식이 맛있어요,11,1
1910175007,sk8boarding,처음 와봤는데 매장도 넓직하고 고기도 신선하고 좋습니다,2025-04-04,"저녁에 방문, 예약 없이 이용, 대기 시간 30분 이내, 일상, 연인・배우자, 아이",고기 질이 좋아요,34,1
1910175007,나나8066,자주오는곳이에요 맛있어요!!!!#길음삼겹살,2025-04-04,"저녁에 방문, 예약 없이 이용, 대기 시간 10분 이내, 일상, 연인・배우자, 아이",음식이 맛있어요,4,1
1910175007,god****,길음역 맛집 맛찬들 드뎌 와봤어요~소문대로 맛있어여!!👍,2025-04-04,"저녁에 방문, 예약 없이 이용, 대기 시간 바로 입장, 나들이, 연인・배우자",음식이 맛있어요,75,1
1910175007,min****,"너무 맛있습니다! 고기 질이 나무 좋고 직원분들께서 직접 구워주시니 너무 편리했습니다!! 공간이 되게  아늑합니다♡♡ 넓고, 직원분들도 너무 친절하셔서ㅎㅎ 너무 편하게 먹을 수 있었어요ㅎㅎ  고기가 너무 부드러워요!! 4번째 방문이에요!! 추천은... 목살을 추천해드립니다!! 너무 맛있어요ㅎㅎ",2025-04-04,"점심에 방문, 예약 후 이용, 대기 시간 바로 입장, 친목, 가족모임, 비즈니스, 친구, 지인・동료, 아이, 부모님",음식이 맛있어요,3,2
1910175007,yee****,언제와도 항상 맛있어요:) 잘 먹고 갑니다~~!!,2025-04-04,"점심에 방문, 예약 없이 이용, 대기 시간 바로 입장, 일상, 부모님",음식이 맛있어요,8,2
1910175007,sleepingmon4,동네에서 맛있는 고기집! 가족이랑 자주 갑니다,2025-04-03,"저녁에 방문, 예약 없이 이용, 대기 시간 바로 입장, 일상, 아이",음식이 맛있어요,4,1
1910175007,보미미미,반찬도 여러 종류 잘 나오고 직접 구워주셔서 좋아요!! 고기도 맛도링,2025-04-03,"저녁에 방문, 예약 없이 이용, 대기 시간 바로 입장, 친목, 일상",반찬이 잘 나와요,32,1
1910175007,cvcll,"삼겹살 맛있네요, 솥밥에 취나물도 넘 맛있어요고기에 곁들이는 반찬들도 다양하고 짜지않아서 좋았음!",2025-04-03,"저녁에 방문, 예약 없이 이용, 대기 시간 10분 이내, 일상, 연인・배우자",직접 잘 구워줘요,17,1
1910175007,kevin6248,고기가 엄청 신선하고 목살에 마블링이 있네요반찬도 맛나고 직원분들 고기 엄청 잘 구워주심,2025-04-03,"저녁에 방문, 예약 없이 이용, 대기 시간 10분 이내, 친목, 지인・동료",음식이 맛있어요,39,1
1910175007,elonghy,평일 대기없이 입장했어요 친절해요 직접 구워주시니 너무 좋습니다,2025-04-03,"저녁에 방문, 예약 없이 이용, 대기 시간 바로 입장, 가족모임, 연인・배우자, 아이",고기 질이 좋아요,32,1
1910175007,rgd****,늘 와요 너무너무맛잇우용,2025-04-03,저녁에 방문,음식이 맛있어요,269,3
1910175007,도버대디,"삼겹,목살 모두 맛있네요~~미나리도 굿입니다#길음역맛집",2025-04-03,"저녁에 방문, 예약 후 이용, 대기 시간 바로 입장, 가족모임, 부모님",음식이 맛있어요,8,1
1910175007,3g****,,2025-04-03,"저녁에 방문, 예약 없이 이용, 대기 시간 바로 입장, 일상, 연인・배우자",아이와 가기 좋아요,8,1
1910175007,one****,,2025-04-02,"저녁에 방문, 예약 없이 이용, 대기 시간 바로 입장, 데이트, 연인・배우자",음식이 맛있어요,10,5
1910175007,킥오프52,삼겹살에 미나리 ~봄철  최강조합 ~신랑이랑 둘이  오붓하게 생파해요,2025-04-02,"저녁에 방문, 예약 없이 이용, 대기 시간 바로 입장, 데이트, 연인・배우자",음식이 맛있어요,5,1
1910175007,ambitious6840,매장도 넓고 직접 구워주시니 편하게 맛있게 먹을 수 있어요:) 길음 삼겹살 맛집입니당!!,2025-04-02,"점심에 방문, 예약 없이 이용, 대기 시간 바로 입장, 가족모임, 아이, 부모님",고기 질이 좋아요,24,1
1910175007,지원이맘97,길음 맛집 삼겹살 최고입니다 👍,2025-04-01,"저녁에 방문, 예약 없이 이용, 대기 시간 바로 입장, 친목, 지인・동료",음식이 맛있어요,27,1
1910175007,lip****,굿,2025-04-01,"저녁에 방문, 예약 없이 이용, 대기 시간 바로 입장, 비즈니스",음식이 맛있어요,7,2
1910175007,fly****,맛있게 잘 구워주세요~~!,2025-04-01,"저녁에 방문, 예약 없이 이용, 대기 시간 바로 입장, 친목, 연인・배우자",음식이 맛있어요,22,6
1910175007,또또11,길음삼겹살맛집 입니다 고기도 맛있고 매장도 쾌적하고 직원분들도 너무 친절해요 히히 길음맛집 담에 또 갈거에요 굳굳,2025-04-01,"저녁에 방문, 예약 없이 이용, 대기 시간 바로 입장, 가족모임, 부모님",음식이 맛있어요,1,1
1910175007,nick7,너무 넓고 쾌적하네요맛있게 먹었어요!!,2025-04-01,"저녁에 방문, 예약 없이 이용, 대기 시간 바로 입장, 데이트, 연인・배우자",음식이 맛있어요,23,1
1910175007,moa0917,맛있고 쾌적해요!,2025-04-01,"저녁에 방문, 예약 없이 이용, 대기 시간 바로 입장, 친목, 연인・배우자",매장이 넓어요,14,1
1910175007,밤비랑나랑,매번 아기랑 같이 오는게 고기도 좋고 반찬도 좋고 늘 만족스럽습니다. 좋은 음식 감사합니다!,2025-04-01,"저녁에 방문, 예약 없이 이용, 대기 시간 바로 입장, 일상, 회식, 가족모임, 연인・배우자, 아이",매장이 넓어요,382,4
1910175007,만다71,,2025-03-31,"저녁에 방문, 예약 없이 이용, 대기 시간 바로 입장, 친목, 친구",음식이 맛있어요,29,1
1910175007,kmmn924,고기가 진짜 맛있고 직원분이 친절하게 구워주셔서 좋았어요 길음맛집입니다,2025-03-31,"저녁에 방문, 예약 없이 이용, 대기 시간 바로 입장, 데이트, 연인・배우자",음식이 맛있어요,20,1
1910175007,태권소녀57,고기도 다구워주셔서  너무 맛있게 잘먹었어요!!길음에 고기 먹을 곳이 없었는데 새로 오픈해서 너무 좋아요 앞으로도 자주 먹을 것 같아요🫶#길음 맛집,2025-03-31,"저녁에 방문, 예약 없이 이용, 대기 시간 바로 입장, 일상, 부모님",음식이 맛있어요,14,1
1910175007,Jess26,맛있어요~~~ #길음맛집#길음삼겹살#길음역맛집#길음고기집#성북맛집,2025-03-31,"저녁에 방문, 예약 없이 이용, 대기 시간 바로 입장, 친목, 연인・배우자",음식이 맛있어요,29,3
1910175007,최성욱59,고기를 구워주시는 고깃집인데 고기를 타지 않고 맛있게 구워주셔서 너무 좋아요. 길음역맛집 인증합니다!,2025-03-31,"저녁에 방문, 예약 없이 이용, 대기 시간 바로 입장, 일상, 가족모임, 연인・배우자, 아이",음식이 맛있어요,1,1
1910175007,bla****,길음역 목살 삼겹살은 맛찬들이 최고에요,2025-03-31,"저녁에 방문, 예약 없이 이용, 대기 시간 바로 입장, 친목, 아이",음식이 맛있어요,37,2
1910175007,lp****,매번 너무 잘먹습니다감사합니다,2025-03-31,"저녁에 방문, 예약 없이 이용, 대기 시간 바로 입장, 친목, 연인・배우자",음식이 맛있어요,7,1
1910175007,xvnfmsqkekx2,맛있어요 친절해요,2025-03-30,"저녁에 방문, 예약 없이 이용, 대기 시간 바로 입장, 가족모임, 아이, 연인・배우자",고기 질이 좋아요,7,2
1910175007,EUN9168,고기 찐맛집이에요~ 삼겹살은 맛찬들!,2025-03-30,"저녁에 방문, 예약 없이 이용, 대기 시간 바로 입장, 일상, 연인・배우자, 아이",음식이 맛있어요,12,2
1910175007,soul2jy,너무너무 맛있어용 ㅎㅎㅎ,2025-03-30,"저녁에 방문, 예약 없이 이용, 대기 시간 바로 입장, 일상, 연인・배우자",음식이 맛있어요,779,1
1910175007,2na****,종종 방문하는데 기복 없이 항상 맛있어요~~ 고기는 무조건 여기서 먹어요,2025-03-30,"저녁에 방문, 예약 없이 이용, 대기 시간 바로 입장, 일상, 친척・형제",매장이 넓어요,4,1
1910175007,호빵귀신41,고기가 정말 맛있고 매장도 넓고 청결해요! 무엇보다 잘구워주세요 ㅎㅎ 아이와 함께 자주 가는 삼겹살 고깃집입니다~~#길음맛집 #길음삼겹살 #길음역맛집 #길음고기집 #성북맛집,2025-03-30,"저녁에 방문, 예약 없이 이용, 대기 시간 바로 입장, 일상, 가족모임, 연인・배우자, 아이",고기 질이 좋아요,21,3
1910175007,dsk0516,고기가 너무 맛있고 직원분 친절하세요길음맛집인정,2025-03-30,"저녁에 방문, 예약 없이 이용, 대기 시간 바로 입장, 친목, 연인・배우자",음식이 맛있어요,10,1
1910175007,veryspeedy,아이랑 자주와요 고기도 맛있고 솥밥이 정말 괜찮습니다!!,2025-03-30,"저녁에 방문, 예약 없이 이용, 대기 시간 바로 입장, 가족모임, 아이, 연인・배우자",음식이 맛있어요,31,1
