place_id,nickname,content,date,situations,keywords,review_count,visit_count
1284516279,아야어여오유정,먹느라 정신없어서 사진 찍은게 저거 밖에 없네용 ㅎ암튼 진짜 맛있었어요! 삼겹 2인분 먹고 마늘소갈비 2인분 딱 배불리 먹었고 같이 나오는 반찬들이 잘 어울리고 맛있어서 더 많이 잘 먹은거 같아요 고추장찌개는 녹진하고 고기도 많아서 진짜진짜 맛있었습니다 고기 드실 때 꼭 같이 드세요! 서비스로 주신 쫀득이도 다 먹고 직원분들 다 친절하셔서 기분 좋게 먹고 왔습니다 근처 가면 또 갈거 같아요😄,2025-03-16,"저녁에 방문, 예약 없이 이용, 대기 시간 바로 입장, 데이트, 연인・배우자",음식이 맛있어요,79,1
1284516279,케케7145,리뷰가좋아서오게되었는데 맛있어요 :-) 다음에 또 방문할게오,2025-03-15,"저녁에 방문, 예약 없이 이용, 대기 시간 바로 입장, 데이트, 연인・배우자",매장이 넓어요,10,1
1284516279,bba****,지인 추천으로 방문했는데 너무 맛있고 만족스러웠어요~~ 데이트 코스로 강추에요!! 고기도 맛있고 반찬 하나하나 다 맛있어요! 👍🏻,2025-03-15,"저녁에 방문, 예약 없이 이용, 대기 시간 바로 입장, 데이트, 연인・배우자",음식이 맛있어요,119,1
1284516279,예슐랭830,우대갈비 넘맛잇어요 양념갈비 맛과 잘 구어진 소고기식감을 둘다 느낄수 있어요 그리고 구어주시는데 너무 맛잇게 잘 구어주세요 물론 양은 ^^ 삼겹살추가햇어요 우대갈비 사진은 먹느라 바빠서 못찍음,2025-03-15,"저녁에 방문, 예약 없이 이용, 대기 시간 바로 입장, 데이트, 연인・배우자",음식이 맛있어요,216,1
1284516279,경2058,고기 진짜 맛있어요bbb우대갈비 짱양도 적당해서 2인분 시켜도 둘이서 배부르게 먹었어요.다음에 또 올게요번창하세요~!,2025-03-14,"저녁에 방문, 예약 없이 이용, 대기 시간 바로 입장, 데이트, 연인・배우자",친절해요,82,1
1284516279,나5271,"고기 세종류(마늘양념,생,삼겹살) 먹었는데 진짜 다맛있었구요된장찌개보세요 두부가 ㄹㅇ 너무 예술입니다!!여기는 물까지 맛있어요너무추천드려용",2025-03-14,"저녁에 방문, 예약 없이 이용, 대기 시간 바로 입장, 데이트, 연인・배우자",음식이 맛있어요,29,1
1284516279,알로하오이,리뷰 많고 좋아서 먹으러왔는데우대갈비 주문하면 다 구워줘서 존맛으로 냠2인분이긴 한데 우대갈비가 원래 양이 넉넉친 않아서 다른고기도 냠했슴당아니근데 볶음밥이 진짜 맛있어요 ㅋㅋㅋㅋ후식 쫀드기도 계속 생각날맛다음에 또 올만해요 🤭,2025-03-13,"저녁에 방문, 예약 없이 이용, 대기 시간 바로 입장, 데이트, 연인・배우자",음식이 맛있어요,21,1
1284516279,success7877,재방문했는데 넘넘 맛있어요!! 서비스도 좋고 깔끔하고 빨리빨리 나와서 너무 만족하면서 먹었습니다!!,2025-03-11,"저녁에 방문, 예약 후 이용, 대기 시간 바로 입장, 일상, 지인・동료, 아이, 부모님",음식이 맛있어요,9,1
1284516279,hee****,맛있게 잘 먹었습니다,2025-03-11,"저녁에 방문, 예약 없이 이용, 대기 시간 바로 입장, 데이트, 연인・배우자",고기 질이 좋아요,27,1
1284516279,hihue,"오랜만에 고기가 땡겨서 들른 고깃집인데, 기대 이상으로 대접받고 온 기분입니다.일단 서비스부터가 남다릅니다. 모든 면에서! 특히 사장님께서 직접 고기를 하나하나 정성스럽게 구워주시는 게 인상적이었습니다. 덕분에 태울 걱정 없이 최상의 상태로 즐길 수 있었어요.그리고… 가장 중요한 부분! 사장님이 너무 잘생기셨습니다. 그냥 멋진 정도가 아니라, 여자친구가 계속 흘깃흘깃 쳐다보더군요. 순간 긴장했지만, 다행히 고기 맛에 집중하면서 위기를 넘겼습니다.맛, 서비스, 분위기까지 완벽했던 곳! 다음에도 꼭 다시 오고 싶은 집이네요. 강력 추천합니다!",2025-03-10,"저녁에 방문, 예약 없이 이용, 대기 시간 바로 입장, 데이트, 연인・배우자",음식이 맛있어요,9,1
1284516279,배민경74,성신여대올때마다 무조건 가는 찐 맛집입니다! 한달에한번씩은 꼭오는거같아요! 갈비살 진짜 맛있습미다…두세번 사장님께서 볶음밥 주셨는에 이번에 새로 메뉴로 나왔더라구요!!!,2025-03-09,"저녁에 방문, 예약 없이 이용, 대기 시간 바로 입장, 데이트, 연인・배우자",음식이 맛있어요,58,3
1284516279,jun****,갑자기 고기 땡겨서 왔는데 완전 맛있어요🥹🥹 삼겹살 먹고 싶으면 여기 추천이에요!! 대파꼬치도 짱짱 맛있어요🩷,2025-03-09,"점심에 방문, 예약 없이 이용, 대기 시간 바로 입장, 데이트, 연인・배우자",고기 질이 좋아요,14,1
1284516279,산만00,갈비 너무 맛있었구 신메뉴로 나온 밀탄밥(김볶밥)도 먹어봤는데 딱 고깃집 볶음밥 맛인데 너무너무 맛있었어요! 항상 반찬도 고기질도 너무너무 맛있고 실망이 없는 밀탄입니다!,2025-03-08,"저녁에 방문, 예약 없이 이용, 대기 시간 바로 입장, 친목, 친구",음식이 맛있어요,16,4
1284516279,초이닷98,신메뉴 이베리코 너무너무 맛있고 된장술밥도 완전 밥도둑 이에요 최고!!!,2025-03-08,"저녁에 방문, 예약 후 이용, 대기 시간 바로 입장, 데이트, 연인・배우자",음식이 맛있어요,24,1
1284516279,ybp****,맛있어요👍,2025-03-08,"저녁에 방문, 예약 없이 이용, 대기 시간 바로 입장, 데이트, 연인・배우자",음식이 맛있어요,17,1
1284516279,킨무네,진짜 우리동네 밀탄있다 동네방네자랑하고다녀요!!,2025-03-08,"점심에 방문, 예약 없이 이용, 대기 시간 바로 입장, 친목, 친구",음식이 맛있어요,28,3
1284516279,산지크림,성신여대에 위치한 우대갈비 맛집 밀탄♡♡친한 지인에게 소개받아서 오게 되었다💞💞친한 동생과 같이 맛있는것을 먹기 위해 방문!!!매장도 청결하고 음식 비주얼도 너무 좋다사람이 많았고 다행히 바로 들어왔다♡대표메뉴 우대갈비 2인을 시켰는데.. 진짜 쫀득하고 눈이 번쩍이게 맛이 있는맛💕💕👍😋 맛이 너무 좋다!막걸리부터 술을 계속 먹기 시작하는 맛이였다!마늘꽃갈비살과 갈비살도 시키는데 마늘향과 고기의 쫀득함♡맛도리가 장난없다!!! 직원도 친절하고! 반찬도 리필 해주시는데 너무 친절하다💞💞 서비스가 너무 좋아용짜글이도 시켰는데 완전 베스트!직접 구워주셔서 더욱 좋았어요♡ 노래 선곡도 좋아요너무 맛있어서 다음에 또 올께요! 성신여대 맛집 인정입니다! 강추해용가격도 나쁘지않아서 더 좋아요!!!,2025-03-07,"저녁에 방문, 예약 없이 이용, 대기 시간 10분 이내, 친목, 지인・동료",음식이 맛있어요,129,1
1284516279,엄정현94,처음 왔는데 매장이 엄청 청결하고 고기질이 너무 좋아요! 반찬들도 신선합니다. 다음에 또 올게요!!,2025-03-06,"저녁에 방문, 예약 없이 이용, 대기 시간 바로 입장, 데이트, 친목, 일상, 가족모임, 비즈니스, 연인・배우자, 친구, 지인・동료",고기 질이 좋아요,19,1
1284516279,페코sz,"네이버에 성신여대 맛집 검색 후처음 방문 해봤는데후회없이 맛있게 잘 먹고 왔습니다!고기가 입에서 녹아요,, 존맛탱,,담에 또 올게용ㅎ",2025-03-05,"저녁에 방문, 예약 없이 이용, 대기 시간 바로 입장, 데이트, 연인・배우자",음식이 맛있어요,18,1
1284516279,웅이또잉,"😊 : 집근처에서 맛볼 수 있는 우대갈비. 우대갈비는 직원분이 구워주셔서 편하고 맛있게 먹을 수 있음. 2인분 양이 보기엔 은근 적어보이지만 먹으면 또 배부름! 그럼에도 우린 마늘 소갈비살을 추가 주문. 고기는 당연 우대갈비가 더 맛나고 소갈비살은 같이 주시는 소스가 졸여먹었을 때 맛남. 우대갈비는 와사비랑 먹으면 가장 조합이 좋음. 🤔 : 전반적으로 양념 고기들만 먹으니 다 먹으면 약간 짠기가 돌아 한동안 안 먹게 됨. 우대갈비는 직원 분이 잘라주실 때 약간 사이즈가 커서 이거의 2/3, 1/2 사이즈로 잘라주셔도 좋을 것 같음. 서비스로 주신 김치볶음밥 넘 감사했음💕 그치만 짠 맛은 부족하고 캡사이신 느낌의 매운 맛이 강해서 단독으로는 별론데 양념 고기랑 같이 먹으면 맛남.",2025-03-05,"저녁에 방문, 예약 없이 이용, 대기 시간 바로 입장, 일상, 기념일, 연인・배우자",음식이 맛있어요,470,1
1284516279,kim****,오늘도  친구와  밀탄에 고기 먹으러 왔어요~~갈비살을 먼저 먹었는데 저번에  방문할때 우대갈비를 맛있게 먹어서 이번에 우대갈비도 주문해 먹었어요~사장님께서 직접 구워 주셨는데 맛있게 구워주셔서 그런지 오늘 특히 더 맛있었네요 😆😁친구랑 먹으면서 우대갈비가  밀탄의 시그니처  메뉴인지 다시금 인정하게 되었어요~전 사실 밀탄에 오면 갈비살을 주로 먹는데 당분간은 우대갈비는 꼭 주문할것같아요~너무 부드럽고 양념이 진하지않아 더 좋았어요~밀탄에 고기먹으러 방문한지도 2년이 넘었네요~매번 오면서 느끼는거지만 맛.친절.서비스 변함이 없어서 더 좋아요~오늘도 친절함과 세심함에 또 한번 감사함을 느끼며 대접받고 갑니다~🙏( 술 잘 못드시는분~~새싹볼 추천이요!! 진짜 맛있어요🤗),2025-03-03,"저녁에 방문, 예약 없이 이용, 대기 시간 바로 입장, 친목, 친구",음식이 맛있어요,18,6
1284516279,Happyah,처음 와봤는데고기 넘넘 맛있어여역시 시그니쳐!!  마늘꽃갈비살주물럭 맛있습니당 ㅎㅎㅎ,2025-03-03,"저녁에 방문, 예약 없이 이용, 대기 시간 바로 입장, 친목, 친구",음식이 맛있어요,109,1
1284516279,술짠34,우대갈비드시면 직접 구워드려요다른고기는 셀프로구워드심됩니닼저희는 우대갈비랑 마늘꽃갈비살주물럭  말돈숙성삼겹살먹었는대요셋다넘맛있게먹었어요맨먼저 우대갈비 드시는거추천해요겁나식어서 구운지 한시간 되었는데도겉에살짝익혀주면따뜻한대 속은 촉촉하게 드실수있어요,2025-03-03,"저녁에 방문, 예약 없이 이용, 대기 시간 바로 입장, 데이트, 연인・배우자",음식이 맛있어요,14,1
1284516279,qqqq111,우대갈비 진짜 맛있네요.. 그리고 고추장짜글이 술밥으로 먹었는데 걍 역대급입니다 ㅠㅠ 또 올게요,2025-03-02,"저녁에 방문, 예약 없이 이용, 대기 시간 10분 이내, 데이트, 연인・배우자",친절해요,13,1
1284516279,reeesonwhy,우대 갈비랑 마늘 소갈비살 먹었는데 둘 다 너무 맛있고 다음에 또 오고 싶어요,2025-03-02,"저녁에 방문, 예약 없이 이용, 대기 시간 바로 입장, 친목, 친구",음식이 맛있어요,28,1
1284516279,jjumee96,너무 맛있었어요!,2025-03-01,"저녁에 방문, 예약 없이 이용, 대기 시간 바로 입장, 친목, 친구",매장이 넓어요,16,1
1284516279,ksks454574,재방문 의사 있는 몇 안되는 곳 또 방문할게요 !,2025-02-28,"저녁에 방문, 예약 없이 이용, 대기 시간 바로 입장, 친목, 연인・배우자, 지인・동료",매장이 넓어요,11,1
1284516279,일딴맘,처음와보는데 분위기도좋고진짜친절하시고 맛있어요^^,2025-02-26,"저녁에 방문, 예약 없이 이용, 대기 시간 바로 입장, 기념일, 연인・배우자, 아이",매장이 넓어요,11,1
1284516279,nomark2,고기도 맛있고 친절하고 좋습니다,2025-02-26,"저녁에 방문, 예약 없이 이용, 대기 시간 바로 입장, 친목, 연인・배우자",음식이 맛있어요,31,1
1284516279,elf****,소갈비살을 좋아해서 일부러찾아왔습니다갈빗살 부드럽고 너무 맛있습니다직원분도 친절하고 살비살 좋아힌시는 분들은 꼭 방문해보세요~강추입니다,2025-02-25,"밤에 방문, 예약 없이 이용, 대기 시간 바로 입장, 데이트, 연인・배우자",음식이 맛있어요,19,1
1284516279,xxo42,"완전 맛있어요 가격도 가성비 미쳤고,, 고기 질이 좋은게 너무 너무 좋아오 다시올게요 성신여대 고기맛집!!",2025-02-25,"저녁에 방문, 예약 없이 이용, 대기 시간 바로 입장, 데이트, 연인・배우자",음식이 맛있어요,30,1
1284516279,양승규47,너무 맛있어서 회식도 여기서 했어요 ㅎ 서비스로 나오는 무국도 맛있고 우리만 알고싶은 맛집입니다 !!💕,2025-02-25,"저녁에 방문, 예약 없이 이용, 대기 시간 바로 입장, 데이트, 연인・배우자",음식이 맛있어요,22,1
1284516279,좋아7339,고기도 잘 구워주시고 맛있어요!,2025-02-24,"밤에 방문, 예약 없이 이용, 대기 시간 바로 입장, 친목, 친척・형제",음식이 맛있어요,15,1
1284516279,이매럭입니다,갈비살 주물럭 진짜 너무 맛있어요 👍🏻성신여대 고깃집 중 최고라고 추천드립니다 😊사장님도 너무 친절하시고 다 구워주셔서 너무편하게 먹었어요♡ 재방문의사 10000%입니당 오래오래 장사해주세요!!!!,2025-02-24,"저녁에 방문, 예약 없이 이용, 대기 시간 바로 입장, 친목, 지인・동료",음식이 맛있어요,33,1
1284516279,200****,"전부터 와보고 싶었는데, 드디어 시원한 무국을 먹었다ㅎㅎ깔끔한 반찬에 맛있는 고기 달달한 마늘소스좋아요👍",2025-02-23,"저녁에 방문, 예약 없이 이용, 대기 시간 바로 입장, 친목, 친구",음식이 맛있어요,679,1
1284516279,랄날랄라,우대갈비 먹으러 왔는데 진짜 생각이상으로 맛있어서 감탄하면서 먹었어요 \ㅅ..ㅅ/너무 맛있고 깔끔하고 가격도 합리적이고 재방문의사 있습니다!,2025-02-22,"점심에 방문, 예약 없이 이용, 대기 시간 바로 입장, 친목, 친구",음식이 맛있어요,19,1
1284516279,kim****,같이 근무했던 직원들과 밀탄에 방문했구요 ~알고지낸지 8년이 넘은 사이인데 이번에 한 직원이 캐나다로 워홀을 가게 되어 맛있는 고기를 사주고싶다는 생각에 우대갈비.갈비살.삼겹살 다 주문했네요~제가 젤 좋아하는 갈비살은 이번에도 넘 만족했고 오래간만에 우대갈비 시켰는데 정말 맛있었어요~고기가 넘 부드러워 놀랐네요~🍖삼겹살은 사장님이 잘 구워주셔서 정말 배가 많이 불렀는데 맛있게 잘 먹었어요~그리고 사장님~ 된장찌개.밀탄면 잘 먹었어요~감사합니다!!좋은사람들과 좋은장소에서 맛있는 음식을 먹으니 시간 가는 줄 모르고 편하게 웃으며 맛있게 먹고 왔네요~오늘도 사장님.직원분들 세심한 배려에 또 대접받고가네요~ 항상 감사드려요~🫶,2025-02-21,"밤에 방문, 예약 없이 이용, 대기 시간 바로 입장, 친목, 지인・동료",음식이 맛있어요,18,5
1284516279,그린워러,너무 맛있어서 재방문했어요🫶🏻여전히 맛있고 고기두 반찬도 깔끔해서 좋아요!,2025-02-20,"저녁에 방문, 예약 없이 이용, 대기 시간 바로 입장, 친목, 친구",친절해요,36,2
1284516279,Hea0,"음식은 다 먹어서 사진은 없는데ㅠㅠ!!!!언제나 맛있구 언제나 서비스도 좋아요 히히오늘은 뭔가 우대갈비 양도 많았구ㅎㅎㅎㅎ배불로용~!~!~!뽑기는 갈 때 마다 하는데 항상 하이볼,,ㅎㅎ지금 시즌볼인 X-MAS 볼 진짜 개 꿀맛입니당><감사합니다~!!!!",2025-02-19,"밤에 방문, 예약 없이 이용, 대기 시간 바로 입장, 데이트, 연인・배우자",음식이 맛있어요,54,5
1284516279,dkd****,맛있어요👍,2025-02-19,"밤에 방문, 예약 없이 이용, 대기 시간 바로 입장, 데이트, 연인・배우자",음식이 맛있어요,11,1
1284516279,rud****,맛있습니다~~^^,2025-02-19,"저녁에 방문, 예약 없이 이용, 대기 시간 바로 입장, 데이트, 연인・배우자",음식이 맛있어요,5,1
1284516279,JACK CAPTAIN,너무맛있어요~! 세번째재방문중,2025-02-18,"저녁에 방문, 예약 없이 이용, 대기 시간 바로 입장, 데이트, 연인・배우자",음식이 맛있어요,62,1
1284516279,illustrator 윤,맛있어요!!!!,2025-02-17,"저녁에 방문, 예약 없이 이용, 대기 시간 바로 입장, 데이트, 연인・배우자",매장이 넓어요,13,1
1284516279,hawaii1053,고기 질도 좋고 같이 먹을수 있는 곁들임메뉴 구성이 좋아요기린생맥주도 있어서 최고에용,2025-02-15,"저녁에 방문, 예약 없이 이용, 대기 시간 바로 입장, 데이트, 연인・배우자",음식이 맛있어요,10,1
1284516279,djm0622056,고기 너무 맛나용 가격도 착하고 담에 또 올게여,2025-02-15,저녁에 방문,음식이 맛있어요,14,1
1284516279,als****,넘넘 애정하는 집근처 고깃집 ㅠㅠㅠ!!! 넘 마싯어요!!!,2025-02-15,"저녁에 방문, 예약 없이 이용, 대기 시간 바로 입장, 친목, 친구",음식이 맛있어요,14,2
1284516279,jon****,"우대갈비 직접 구워주시고 설명까지 넘 친절하세요얼음컵, 앞치마, 반찬리필등 센스가 좋았어요!! 맵찔이 분들은 비빔 밀면말구 물이 좋을거 같습나다. 고기 반찬다 맛있게 먹었습니다. 감사합니다 사장님",2025-02-15,"저녁에 방문, 예약 없이 이용, 대기 시간 바로 입장, 가족모임, 친척・형제",음식이 맛있어요,10,1
1284516279,아인aa,성신여대 최고 맛집 밀탄의 우대갈비 그릴링 신공~친절한 직원분의 능숙한 그릴링 실력에 감탄이 절로 나와요~ 너무너무 잘 먹었습니다.나만 알고 싶은 맛집이라면 이기적인 바램이겠죠ㅋㅋㅋ잡내 1도 없이 육즙 팡팡 진짜 맛있어요 👍👍👍👍👍힘든 하루 밀탄에서 위로 받고 갑니다🤗🤗🤗,2025-02-15,"저녁에 방문, 예약 후 이용, 대기 시간 10분 이내, 데이트, 연인・배우자",음식이 맛있어요,13,5
1284516279,sjhong1615,매번 오는 밀탄..올때마다 고기 맛에 감탄하고 갑니다오늘도 맛있는 고기 감사합니다!,2025-02-14,"저녁에 방문, 예약 없이 이용, 대기 시간 바로 입장, 데이트, 연인・배우자",아늑해요,30,2
1284516279,윙4,잘 구워주셔서 맛있고 편안하게 잘 먹었습니다! 고기도 반찬도 술도 친절함까지 넘나 만족스러운 저녁식사였어요 :),2025-02-14,"저녁에 방문, 예약 없이 이용, 대기 시간 바로 입장, 일상, 연인・배우자",음식이 맛있어요,1,1
1284516279,ㅅㅎㅇ16,우대갈비 구워주셔서 동네에서 우대갈비 먹고싶으먄 왓습니다!구워주셔서 편하고 고기맛은 말해뭐해 입니다참고로 고추장쩌글이 존맛이에용,2025-02-13,"저녁에 방문, 예약 없이 이용, 대기 시간 바로 입장, 데이트, 연인・배우자",음식이 맛있어요,54,2
1284516279,kim****,이번에 새로 입사한 직원이 첫 월급 들어와  본인이 쏜다고해서  저희 최애맛집 밀탄의 맛을 알려주러 방문했어요~저희가 좀 늦은시간에 방문해서인지 테이블이 좀 여유가있어 저희가 원하는자리에 편하게 식사할수있었어요😆즐겨먹는 갈비살에 새싹볼~~🍹진짜 맛있어요🫶사장님 ~테이블에 오셔서 반갑게 인사해주시니 저희 막내직원이 사장님과 인사하는 사이냐고~ㅋㅋ오늘 사장님께서 된장찌개.아이스크림.케이크도 서비스로 주셨는데~ 너무 맛있게 잘 먹었습니다.🥰된장찌개 넘 맛있어서 다음 방문할때는 꼭 주문해서 먹어야겠어요~오늘 사장님 덕분에 제 어깨가 으쓱했네요!!갈비살 먹는다는 생각에 직원들과 웃으며 방문했는데 사장님과 직원들의 세심한배려에 미소지으며 나왔네요~~조만간 방문할께요~감사합니다!!!,2025-02-11,"밤에 방문, 예약 없이 이용, 대기 시간 바로 입장, 친목, 지인・동료",음식이 맛있어요,18,4
1284516279,됴오옹,너무 맛있고 부드러워요!,2025-02-08,"저녁에 방문, 예약 없이 이용, 대기 시간 바로 입장, 데이트, 연인・배우자",음식이 맛있어요,26,2
1284516279,seo****,"매번 저녁에만 왔었는데 오늘은 점심먹으러 왔어요!자주오니까 사장님이 알아봐주시고 좋았습니다=33우대갈비 삼겹살 소금,마늘꽃갈비살 다 먹었는데 다 맛있어서 다 드시는 걸 추천합네다...특히 마늘갈빗살 마늘특제?소스? 같이 주시는데 찍어먹으면 마늘풍미가 배가되서 더 마싯더라구욥👍🏽삼겹살에는 무조건 멜젓뚝배기!! 시키셔서 꼭 같이 드세요!! 우대갈비에는 와사비에... 고기마다 찍어먹어야할 소스들이 다양해서 더 맛있고 재밌었어요😙 다 먹으면 서비스로 쫀디기 주시는데 진짜 마지막까지 너무 만족하고 갑니당🧡💛",2025-02-08,"저녁에 방문, 예약 없이 이용, 대기 시간 바로 입장",음식이 맛있어요,39,17
1284516279,지니지니자니자니,맛있어요!!! 질 좋은 고기 먹고 싶을땬 밀탄 ‼️‼️,2025-02-08,"저녁에 방문, 예약 없이 이용, 대기 시간 바로 입장, 일상, 친구",음식이 맛있어요,14,1
1284516279,남석49,고기 완전 맛있어요~~,2025-02-08,"저녁에 방문, 예약 없이 이용, 대기 시간 바로 입장, 데이트, 연인・배우자",음식이 맛있어요,16,1
1284516279,담탱,"몇번째 오는 지 모르겠는데 너무 맛있었어요 !! 직원분들도 너무 친절하세용다음에 또 오겠습니다 ! 사진은 찍는거 까먹어서 마지막 고기들만 남았네요 ,,,",2025-02-05,"저녁에 방문, 예약 없이 이용, 대기 시간 바로 입장, 데이트, 연인・배우자",음식이 맛있어요,11,1
1284516279,som39,우대갈비는 구워주시는데 너무 맛있었어요!음식 빨리 나오고바로 뒷골목에 주차장 있어서 편하고고기 냄새도 많이 안 배는 편이에요직원분들도 매우매우 친절하셔서배부르고 기분 좋게 식사하고 왔습니당 :^),2025-02-03,"저녁에 방문, 예약 후 이용, 대기 시간 바로 입장, 일상, 친구",친절해요,24,1
1284516279,kim****,오늘 급 고기가 먹고싶어 저의 최애 맛집 밀탄에 친구랑 왔네요🥰오늘도 소갈비살에 밀탄면 새싹볼 마셨어요🥩🍷밀탄에 오면 맛있는 음식에 분위기에 항상 기분좋게 식사하는것같아요🍴다정하신 사장님과 미소가 이쁜 여직원은 안계셨지만😭 다른 직원분들도 무척 친절하셨어요~오늘도 맛있게 기분좋게 대접받고 가네요~~항상 챙겨주시는 핫팩 덕분에 날씨 추웠는데 따뜻하게 집에갔구요~이런 배려 감사합니다🥰조만간 다시 방문할께요!!,2025-02-03,"저녁에 방문, 예약 없이 이용, 대기 시간 바로 입장, 친목, 친구",고기 질이 좋아요,18,3
1284516279,오로리76,항상 맛나게 먹아요사장님 원산지 국내산!잘먹고 가용~~~**,2025-02-02,"저녁에 방문, 예약 없이 이용, 대기 시간 바로 입장, 데이트, 친구",음식이 맛있어요,228,3
1284516279,뚜르르65,"친절하고 훈훈하신 직원분이 직접 고기 구워주시는곳이에요 👍 고기먹고싶어서 들어간 집이었는데 우대갈비, 갈비살이 주력인 곳인듯 하나 삼겹살도 넘 맛있었어요🥰 삼겹 1인분 12,000원인데 멜젓, 구운김치, 그외 반찬 구성이묜 가성비 진짜 미쳤☺️ 게다가 서비스로 쫀드기랑 음료까지 주셔서 이렇게 파시면 남는게 있나 ㅜㅜ 하며 감사한 마음으로 기분좋게 식사하고 나왔습니당😭 나갈때 데워놓은 핫팩이랑 페브리즈 분사 서비스(?)도 받았는데 마지막까지 정말 대박... 🩷 다음에 성신여대 갈 일 있으면 또 들를게요. 번창하시길🥺",2025-02-02,"점심에 방문, 예약 없이 이용, 대기 시간 바로 입장, 데이트, 연인・배우자",매장이 넓어요,43,1
1284516279,사과쥬스9483,너무맛있어요 다음에또올게요!!,2025-01-31,"저녁에 방문, 대기 시간 바로 입장, 데이트, 연인・배우자",음식이 맛있어요,4,1
1284516279,SBS86,,2025-01-31,"저녁에 방문, 예약 없이 이용, 대기 시간 바로 입장, 친목, 지인・동료",음식이 맛있어요,7,1
1284516279,zil****,처음 와봤는데 너무너무 친절하게 잘해주셔서 감동했어요.. 연예인급 미남이신 직원분이 설명도 잘해주시고😆 직원분들 다 너무 친절하세요~ 정말 맛있게 잘 먹었습니다! 단골될것 같아요^^,2025-01-31,"저녁에 방문, 예약 없이 이용, 대기 시간 바로 입장, 기념일, 친구",음식이 맛있어요,7,1
1284516279,집에 가고싶다,아니 진짜 개맛있어요..,2025-01-30,"저녁에 방문, 예약 없이 이용, 대기 시간 바로 입장, 친목, 친구",음식이 맛있어요,146,1
